Sheet: map
A1: 20 | B1: 20 | C1: 20 | D1: 20 | E1: 20 | F1: 20 | G1: 20 | H1: 20 | I1: 20 | J1: 20 | K1: 20 | L1: 20 | M1: 20 | N1: 20 | O1: 20 | P1: 20 | Q1: 20 | R1: 20 | S1: 20 | T1: 20 | U1: 20 | V1: 20 | W1: 20 | X1: 20 | Y1: 20 | Z1: 20 | AA1: 20 | AB1: 20 | AC1: 20 | AD1: 20 | AE1: 20 | AF1: 20 | AG1: 20 | AH1: 20 | AI1: 20 | AJ1: 20 | AK1: 20 | AL1: 20 | AM1: 20 | AN1: 20 | AO1: 20 | AP1: 20 | AQ1: 20 | AR1: 20 | AS1: 20 | AT1: 20 | AU1: 20 | AV1: 20 | AW1: 20 | AX1: 20 | AY1: 20 | AZ1: 20 | BA1: 20 | BB1: 20 | BC1: 20 | BD1: 20 | BE1: 20 | BF1: 20 | BG1: 20 | BH1: 20 | BI1: 20 | BJ1: 20 | BK1: 20 | BL1: 20 | BM1: 20 | BN1: 20 | BO1: 20 | BP1: 20 | BQ1: 20 | BR1: 20 | BS1: 20 | BT1: 20 | BU1: 20 | BV1: 20 | BW1: 20 | BX1: 20 | BY1: 20 | BZ1: 20 | CA1: 20 | CB1: 20 | CC1: 20 | CD1: 20 | CE1: 20 | CF1: 20 | CG1: 20 | CH1: 20 | CI1: 20 | CJ1: 20 | CK1: 20 | CL1: 20 | CM1: 20 | CN1: 20 | CO1: 20 | CP1: 20 | CQ1: 20 | CR1: 20 | CS1: 20 | CT1: 20 | CU1: 20 | CV1: 20 | CW1: =FIB(RC[-100]) -> 10946 | CX1: =FIB(RC[-100]) -> 10946 | CY1: =FIB(RC[-100]) -> 10946 | CZ1: =FIB(RC[-100]) -> 10946 | DA1: =FIB(RC[-100]) -> 10946 | DB1: =FIB(RC[-100]) -> 10946 | DC1: =FIB(RC[-100]) -> 10946 | DD1: =FIB(RC[-100]) -> 10946 | DE1: =FIB(RC[-100]) -> 10946 | DF1: =FIB(RC[-100]) -> 10946 | DG1: =FIB(RC[-100]) -> 10946 | DH1: =FIB(RC[-100]) -> 10946 | DI1: =FIB(RC[-100]) -> 10946 | DJ1: =FIB(RC[-100]) -> 10946 | DK1: =FIB(RC[-100]) -> 10946 | DL1: =FIB(RC[-100]) -> 10946 | DM1: =FIB(RC[-100]) -> 10946 | DN1: =FIB(RC[-100]) -> 10946 | DO1: =FIB(RC[-100]) -> 10946 | DP1: =FIB(RC[-100]) -> 10946 | DQ1: =FIB(RC[-100]) -> 10946 | DR1: =FIB(RC[-100]) -> 10946 | DS1: =FIB(RC[-100]) -> 10946 | DT1: =FIB(RC[-100]) -> 10946 | DU1: =FIB(RC[-100]) -> 10946 | DV1: =FIB(RC[-100]) -> 10946 | DW1: =FIB(RC[-100]) -> 10946 | DX1: =FIB(RC[-100]) -> 10946 | DY1: =FIB(RC[-100]) -> 10946 | DZ1: =FIB(RC[-100]) -> 10946 | EA1: =FIB(RC[-100]) -> 10946 | EB1: =FIB(RC[-100]) -> 10946 | EC1: =FIB(RC[-100]) -> 10946 | ED1: =FIB(RC[-100]) -> 10946 | EE1: =FIB(RC[-100]) -> 10946 | EF1: =FIB(RC[-100]) -> 10946 | EG1: =FIB(RC[-100]) -> 10946 | EH1: =FIB(RC[-100]) -> 10946 | EI1: =FIB(RC[-100]) -> 10946 | EJ1: =FIB(RC[-100]) -> 10946 | EK1: =FIB(RC[-100]) -> 10946 | EL1: =FIB(RC[-100]) -> 10946 | EM1: =FIB(RC[-100]) -> 10946 | EN1: =FIB(RC[-100]) -> 10946 | EO1: =FIB(RC[-100]) -> 10946 | EP1: =FIB(RC[-100]) -> 10946 | EQ1: =FIB(RC[-100]) -> 10946 | ER1: =FIB(RC[-100]) -> 10946 | ES1: =FIB(RC[-100]) -> 10946 | ET1: =FIB(RC[-100]) -> 10946 | EU1: =FIB(RC[-100]) -> 10946 | EV1: =FIB(RC[-100]) -> 10946 | EW1: =FIB(RC[-100]) -> 10946 | EX1: =FIB(RC[-100]) -> 10946 | EY1: =FIB(RC[-100]) -> 10946 | EZ1: =FIB(RC[-100]) -> 10946 | FA1: =FIB(RC[-100]) -> 10946 | FB1: =FIB(RC[-100]) -> 10946 | FC1: =FIB(RC[-100]) -> 10946 | FD1: =FIB(RC[-100]) -> 10946 | FE1: =FIB(RC[-100]) -> 10946 | FF1: =FIB(RC[-100]) -> 10946 | FG1: =FIB(RC[-100]) -> 10946 | FH1: =FIB(RC[-100]) -> 10946 | FI1: =FIB(RC[-100]) -> 10946 | FJ1: =FIB(RC[-100]) -> 10946 | FK1: =FIB(RC[-100]) -> 10946 | FL1: =FIB(RC[-100]) -> 10946 | FM1: =FIB(RC[-100]) -> 10946 | FN1: =FIB(RC[-100]) -> 10946 | FO1: =FIB(RC[-100]) -> 10946 | FP1: =FIB(RC[-100]) -> 10946 | FQ1: =FIB(RC[-100]) -> 10946 | FR1: =FIB(RC[-100]) -> 10946 | FS1: =FIB(RC[-100]) -> 10946 | FT1: =FIB(RC[-100]) -> 10946 | FU1: =FIB(RC[-100]) -> 10946 | FV1: =FIB(RC[-100]) -> 10946 | FW1: =FIB(RC[-100]) -> 10946 | FX1: =FIB(RC[-100]) -> 10946 | FY1: =FIB(RC[-100]) -> 10946 | FZ1: =FIB(RC[-100]) -> 10946 | GA1: =FIB(RC[-100]) -> 10946 | GB1: =FIB(RC[-100]) -> 10946 | GC1: =FIB(RC[-100]) -> 10946 | GD1: =FIB(RC[-100]) -> 10946 | GE1: =FIB(RC[-100]) -> 10946 | GF1: =FIB(RC[-100]) -> 10946 | GG1: =FIB(RC[-100]) -> 10946 | GH1: =FIB(RC[-100]) -> 10946 | GI1: =FIB(RC[-100]) -> 10946 | GJ1: =FIB(RC[-100]) -> 10946 | GK1: =FIB(RC[-100]) -> 10946 | GL1: =FIB(RC[-100]) -> 10946 | GM1: =FIB(RC[-100]) -> 10946 | GN1: =FIB(RC[-100]) -> 10946 | GO1: =FIB(RC[-100]) -> 10946 | GP1: =FIB(RC[-100]) -> 10946 | GQ1: =FIB(RC[-100]) -> 10946 | GR1: =FIB(RC[-100]) -> 10946
A2: 20 | B2: 20 | C2: 20 | D2: 20 | E2: 20 | F2: 20 | G2: 20 | H2: 20 | I2: 20 | J2: 20 | K2: 20 | L2: 20 | M2: 20 | N2: 20 | O2: 20 | P2: 20 | Q2: 20 | R2: 20 | S2: 20 | T2: 20 | U2: 20 | V2: 20 | W2: 20 | X2: 20 | Y2: 20 | Z2: 20 | AA2: 20 | AB2: 20 | AC2: 20 | AD2: 20 | AE2: 20 | AF2: 20 | AG2: 20 | AH2: 20 | AI2: 20 | AJ2: 20 | AK2: 20 | AL2: 20 | AM2: 20 | AN2: 20 | AO2: 20 | AP2: 20 | AQ2: 20 | AR2: 20 | AS2: 20 | AT2: 20 | AU2: 20 | AV2: 20 | AW2: 20 | AX2: 20 | AY2: 20 | AZ2: 20 | BA2: 20 | BB2: 20 | BC2: 20 | BD2: 20 | BE2: 20 | BF2: 20 | BG2: 20 | BH2: 20 | BI2: 20 | BJ2: 20 | BK2: 20 | BL2: 20 | BM2: 20 | BN2: 20 | BO2: 20 | BP2: 20 | BQ2: 20 | BR2: 20 | BS2: 20 | BT2: 20 | BU2: 20 | BV2: 20 | BW2: 20 | BX2: 20 | BY2: 20 | BZ2: 20 | CA2: 20 | CB2: 20 | CC2: 20 | CD2: 20 | CE2: 20 | CF2: 20 | CG2: 20 | CH2: 20 | CI2: 20 | CJ2: 20 | CK2: 20 | CL2: 20 | CM2: 20 | CN2: 20 | CO2: 20 | CP2: 20 | CQ2: 20 | CR2: 20 | CS2: 20 | CT2: 20 | CU2: 20 | CV2: 20 | CW2: =FIB(RC[-100]) -> 10946 | CX2: =FIB(RC[-100]) -> 10946 | CY2: =FIB(RC[-100]) -> 10946 | CZ2: =FIB(RC[-100]) -> 10946 | DA2: =FIB(RC[-100]) -> 10946 | DB2: =FIB(RC[-100]) -> 10946 | DC2: =FIB(RC[-100]) -> 10946 | DD2: =FIB(RC[-100]) -> 10946 | DE2: =FIB(RC[-100]) -> 10946 | DF2: =FIB(RC[-100]) -> 10946 | DG2: =FIB(RC[-100]) -> 10946 | DH2: =FIB(RC[-100]) -> 10946 | DI2: =FIB(RC[-100]) -> 10946 | DJ2: =FIB(RC[-100]) -> 10946 | DK2: =FIB(RC[-100]) -> 10946 | DL2: =FIB(RC[-100]) -> 10946 | DM2: =FIB(RC[-100]) -> 10946 | DN2: =FIB(RC[-100]) -> 10946 | DO2: =FIB(RC[-100]) -> 10946 | DP2: =FIB(RC[-100]) -> 10946 | DQ2: =FIB(RC[-100]) -> 10946 | DR2: =FIB(RC[-100]) -> 10946 | DS2: =FIB(RC[-100]) -> 10946 | DT2: =FIB(RC[-100]) -> 10946 | DU2: =FIB(RC[-100]) -> 10946 | DV2: =FIB(RC[-100]) -> 10946 | DW2: =FIB(RC[-100]) -> 10946 | DX2: =FIB(RC[-100]) -> 10946 | DY2: =FIB(RC[-100]) -> 10946 | DZ2: =FIB(RC[-100]) -> 10946 | EA2: =FIB(RC[-100]) -> 10946 | EB2: =FIB(RC[-100]) -> 10946 | EC2: =FIB(RC[-100]) -> 10946 | ED2: =FIB(RC[-100]) -> 10946 | EE2: =FIB(RC[-100]) -> 10946 | EF2: =FIB(RC[-100]) -> 10946 | EG2: =FIB(RC[-100]) -> 10946 | EH2: =FIB(RC[-100]) -> 10946 | EI2: =FIB(RC[-100]) -> 10946 | EJ2: =FIB(RC[-100]) -> 10946 | EK2: =FIB(RC[-100]) -> 10946 | EL2: =FIB(RC[-100]) -> 10946 | EM2: =FIB(RC[-100]) -> 10946 | EN2: =FIB(RC[-100]) -> 10946 | EO2: =FIB(RC[-100]) -> 10946 | EP2: =FIB(RC[-100]) -> 10946 | EQ2: =FIB(RC[-100]) -> 10946 | ER2: =FIB(RC[-100]) -> 10946 | ES2: =FIB(RC[-100]) -> 10946 | ET2: =FIB(RC[-100]) -> 10946 | EU2: =FIB(RC[-100]) -> 10946 | EV2: =FIB(RC[-100]) -> 10946 | EW2: =FIB(RC[-100]) -> 10946 | EX2: =FIB(RC[-100]) -> 10946 | EY2: =FIB(RC[-100]) -> 10946 | EZ2: =FIB(RC[-100]) -> 10946 | FA2: =FIB(RC[-100]) -> 10946 | FB2: =FIB(RC[-100]) -> 10946 | FC2: =FIB(RC[-100]) -> 10946 | FD2: =FIB(RC[-100]) -> 10946 | FE2: =FIB(RC[-100]) -> 10946 | FF2: =FIB(RC[-100]) -> 10946 | FG2: =FIB(RC[-100]) -> 10946 | FH2: =FIB(RC[-100]) -> 10946 | FI2: =FIB(RC[-100]) -> 10946 | FJ2: =FIB(RC[-100]) -> 10946 | FK2: =FIB(RC[-100]) -> 10946 | FL2: =FIB(RC[-100]) -> 10946 | FM2: =FIB(RC[-100]) -> 10946 | FN2: =FIB(RC[-100]) -> 10946 | FO2: =FIB(RC[-100]) -> 10946 | FP2: =FIB(RC[-100]) -> 10946 | FQ2: =FIB(RC[-100]) -> 10946 | FR2: =FIB(RC[-100]) -> 10946 | FS2: =FIB(RC[-100]) -> 10946 | FT2: =FIB(RC[-100]) -> 10946 | FU2: =FIB(RC[-100]) -> 10946 | FV2: =FIB(RC[-100]) -> 10946 | FW2: =FIB(RC[-100]) -> 10946 | FX2: =FIB(RC[-100]) -> 10946 | FY2: =FIB(RC[-100]) -> 10946 | FZ2: =FIB(RC[-100]) -> 10946 | GA2: =FIB(RC[-100]) -> 10946 | GB2: =FIB(RC[-100]) -> 10946 | GC2: =FIB(RC[-100]) -> 10946 | GD2: =FIB(RC[-100]) -> 10946 | GE2: =FIB(RC[-100]) -> 10946 | GF2: =FIB(RC[-100]) -> 10946 | GG2: =FIB(RC[-100]) -> 10946 | GH2: =FIB(RC[-100]) -> 10946 | GI2: =FIB(RC[-100]) -> 10946 | GJ2: =FIB(RC[-100]) -> 10946 | GK2: =FIB(RC[-100]) -> 10946 | GL2: =FIB(RC[-100]) -> 10946 | GM2: =FIB(RC[-100]) -> 10946 | GN2: =FIB(RC[-100]) -> 10946 | GO2: =FIB(RC[-100]) -> 10946 | GP2: =FIB(RC[-100]) -> 10946 | GQ2: =FIB(RC[-100]) -> 10946 | GR2: =FIB(RC[-100]) -> 10946
A3: 20 | B3: 20 | C3: 20 | D3: 20 | E3: 20 | F3: 20 | G3: 20 | H3: 20 | I3: 20 | J3: 20 | K3: 20 | L3: 20 | M3: 20 | N3: 20 | O3: 20 | P3: 20 | Q3: 20 | R3: 20 | S3: 20 | T3: 20 | U3: 20 | V3: 20 | W3: 20 | X3: 20 | Y3: 20 | Z3: 20 | AA3: 20 | AB3: 20 | AC3: 20 | AD3: 20 | AE3: 20 | AF3: 20 | AG3: 20 | AH3: 20 | AI3: 20 | AJ3: 20 | AK3: 20 | AL3: 20 | AM3: 20 | AN3: 20 | AO3: 20 | AP3: 20 | AQ3: 20 | AR3: 20 | AS3: 20 | AT3: 20 | AU3: 20 | AV3: 20 | AW3: 20 | AX3: 20 | AY3: 20 | AZ3: 20 | BA3: 20 | BB3: 20 | BC3: 20 | BD3: 20 | BE3: 20 | BF3: 20 | BG3: 20 | BH3: 20 | BI3: 20 | BJ3: 20 | BK3: 20 | BL3: 20 | BM3: 20 | BN3: 20 | BO3: 20 | BP3: 20 | BQ3: 20 | BR3: 20 | BS3: 20 | BT3: 20 | BU3: 20 | BV3: 20 | BW3: 20 | BX3: 20 | BY3: 20 | BZ3: 20 | CA3: 20 | CB3: 20 | CC3: 20 | CD3: 20 | CE3: 20 | CF3: 20 | CG3: 20 | CH3: 20 | CI3: 20 | CJ3: 20 | CK3: 20 | CL3: 20 | CM3: 20 | CN3: 20 | CO3: 20 | CP3: 20 | CQ3: 20 | CR3: 20 | CS3: 20 | CT3: 20 | CU3: 20 | CV3: 20 | CW3: =FIB(RC[-100]) -> 10946 | CX3: =FIB(RC[-100]) -> 10946 | CY3: =FIB(RC[-100]) -> 10946 | CZ3: =FIB(RC[-100]) -> 10946 | DA3: =FIB(RC[-100]) -> 10946 | DB3: =FIB(RC[-100]) -> 10946 | DC3: =FIB(RC[-100]) -> 10946 | DD3: =FIB(RC[-100]) -> 10946 | DE3: =FIB(RC[-100]) -> 10946 | DF3: =FIB(RC[-100]) -> 10946 | DG3: =FIB(RC[-100]) -> 10946 | DH3: =FIB(RC[-100]) -> 10946 | DI3: =FIB(RC[-100]) -> 10946 | DJ3: =FIB(RC[-100]) -> 10946 | DK3: =FIB(RC[-100]) -> 10946 | DL3: =FIB(RC[-100]) -> 10946 | DM3: =FIB(RC[-100]) -> 10946 | DN3: =FIB(RC[-100]) -> 10946 | DO3: =FIB(RC[-100]) -> 10946 | DP3: =FIB(RC[-100]) -> 10946 | DQ3: =FIB(RC[-100]) -> 10946 | DR3: =FIB(RC[-100]) -> 10946 | DS3: =FIB(RC[-100]) -> 10946 | DT3: =FIB(RC[-100]) -> 10946 | DU3: =FIB(RC[-100]) -> 10946 | DV3: =FIB(RC[-100]) -> 10946 | DW3: =FIB(RC[-100]) -> 10946 | DX3: =FIB(RC[-100]) -> 10946 | DY3: =FIB(RC[-100]) -> 10946 | DZ3: =FIB(RC[-100]) -> 10946 | EA3: =FIB(RC[-100]) -> 10946 | EB3: =FIB(RC[-100]) -> 10946 | EC3: =FIB(RC[-100]) -> 10946 | ED3: =FIB(RC[-100]) -> 10946 | EE3: =FIB(RC[-100]) -> 10946 | EF3: =FIB(RC[-100]) -> 10946 | EG3: =FIB(RC[-100]) -> 10946 | EH3: =FIB(RC[-100]) -> 10946 | EI3: =FIB(RC[-100]) -> 10946 | EJ3: =FIB(RC[-100]) -> 10946 | EK3: =FIB(RC[-100]) -> 10946 | EL3: =FIB(RC[-100]) -> 10946 | EM3: =FIB(RC[-100]) -> 10946 | EN3: =FIB(RC[-100]) -> 10946 | EO3: =FIB(RC[-100]) -> 10946 | EP3: =FIB(RC[-100]) -> 10946 | EQ3: =FIB(RC[-100]) -> 10946 | ER3: =FIB(RC[-100]) -> 10946 | ES3: =FIB(RC[-100]) -> 10946 | ET3: =FIB(RC[-100]) -> 10946 | EU3: =FIB(RC[-100]) -> 10946 | EV3: =FIB(RC[-100]) -> 10946 | EW3: =FIB(RC[-100]) -> 10946 | EX3: =FIB(RC[-100]) -> 10946 | EY3: =FIB(RC[-100]) -> 10946 | EZ3: =FIB(RC[-100]) -> 10946 | FA3: =FIB(RC[-100]) -> 10946 | FB3: =FIB(RC[-100]) -> 10946 | FC3: =FIB(RC[-100]) -> 10946 | FD3: =FIB(RC[-100]) -> 10946 | FE3: =FIB(RC[-100]) -> 10946 | FF3: =FIB(RC[-100]) -> 10946 | FG3: =FIB(RC[-100]) -> 10946 | FH3: =FIB(RC[-100]) -> 10946 | FI3: =FIB(RC[-100]) -> 10946 | FJ3: =FIB(RC[-100]) -> 10946 | FK3: =FIB(RC[-100]) -> 10946 | FL3: =FIB(RC[-100]) -> 10946 | FM3: =FIB(RC[-100]) -> 10946 | FN3: =FIB(RC[-100]) -> 10946 | FO3: =FIB(RC[-100]) -> 10946 | FP3: =FIB(RC[-100]) -> 10946 | FQ3: =FIB(RC[-100]) -> 10946 | FR3: =FIB(RC[-100]) -> 10946 | FS3: =FIB(RC[-100]) -> 10946 | FT3: =FIB(RC[-100]) -> 10946 | FU3: =FIB(RC[-100]) -> 10946 | FV3: =FIB(RC[-100]) -> 10946 | FW3: =FIB(RC[-100]) -> 10946 | FX3: =FIB(RC[-100]) -> 10946 | FY3: =FIB(RC[-100]) -> 10946 | FZ3: =FIB(RC[-100]) -> 10946 | GA3: =FIB(RC[-100]) -> 10946 | GB3: =FIB(RC[-100]) -> 10946 | GC3: =FIB(RC[-100]) -> 10946 | GD3: =FIB(RC[-100]) -> 10946 | GE3: =FIB(RC[-100]) -> 10946 | GF3: =FIB(RC[-100]) -> 10946 | GG3: =FIB(RC[-100]) -> 10946 | GH3: =FIB(RC[-100]) -> 10946 | GI3: =FIB(RC[-100]) -> 10946 | GJ3: =FIB(RC[-100]) -> 10946 | GK3: =FIB(RC[-100]) -> 10946 | GL3: =FIB(RC[-100]) -> 10946 | GM3: =FIB(RC[-100]) -> 10946 | GN3: =FIB(RC[-100]) -> 10946 | GO3: =FIB(RC[-100]) -> 10946 | GP3: =FIB(RC[-100]) -> 10946 | GQ3: =FIB(RC[-100]) -> 10946 | GR3: =FIB(RC[-100]) -> 10946
A4: 20 | B4: 20 | C4: 20 | D4: 20 | E4: 20 | F4: 20 | G4: 20 | H4: 20 | I4: 20 | J4: 20 | K4: 20 | L4: 20 | M4: 20 | N4: 20 | O4: 20 | P4: 20 | Q4: 20 | R4: 20 | S4: 20 | T4: 20 | U4: 20 | V4: 20 | W4: 20 | X4: 20 | Y4: 20 | Z4: 20 | AA4: 20 | AB4: 20 | AC4: 20 | AD4: 20 | AE4: 20 | AF4: 20 | AG4: 20 | AH4: 20 | AI4: 20 | AJ4: 20 | AK4: 20 | AL4: 20 | AM4: 20 | AN4: 20 | AO4: 20 | AP4: 20 | AQ4: 20 | AR4: 20 | AS4: 20 | AT4: 20 | AU4: 20 | AV4: 20 | AW4: 20 | AX4: 20 | AY4: 20 | AZ4: 20 | BA4: 20 | BB4: 20 | BC4: 20 | BD4: 20 | BE4: 20 | BF4: 20 | BG4: 20 | BH4: 20 | BI4: 20 | BJ4: 20 | BK4: 20 | BL4: 20 | BM4: 20 | BN4: 20 | BO4: 20 | BP4: 20 | BQ4: 20 | BR4: 20 | BS4: 20 | BT4: 20 | BU4: 20 | BV4: 20 | BW4: 20 | BX4: 20 | BY4: 20 | BZ4: 20 | CA4: 20 | CB4: 20 | CC4: 20 | CD4: 20 | CE4: 20 | CF4: 20 | CG4: 20 | CH4: 20 | CI4: 20 | CJ4: 20 | CK4: 20 | CL4: 20 | CM4: 20 | CN4: 20 | CO4: 20 | CP4: 20 | CQ4: 20 | CR4: 20 | CS4: 20 | CT4: 20 | CU4: 20 | CV4: 20 | CW4: =FIB(RC[-100]) -> 10946 | CX4: =FIB(RC[-100]) -> 10946 | CY4: =FIB(RC[-100]) -> 10946 | CZ4: =FIB(RC[-100]) -> 10946 | DA4: =FIB(RC[-100]) -> 10946 | DB4: =FIB(RC[-100]) -> 10946 | DC4: =FIB(RC[-100]) -> 10946 | DD4: =FIB(RC[-100]) -> 10946 | DE4: =FIB(RC[-100]) -> 10946 | DF4: =FIB(RC[-100]) -> 10946 | DG4: =FIB(RC[-100]) -> 10946 | DH4: =FIB(RC[-100]) -> 10946 | DI4: =FIB(RC[-100]) -> 10946 | DJ4: =FIB(RC[-100]) -> 10946 | DK4: =FIB(RC[-100]) -> 10946 | DL4: =FIB(RC[-100]) -> 10946 | DM4: =FIB(RC[-100]) -> 10946 | DN4: =FIB(RC[-100]) -> 10946 | DO4: =FIB(RC[-100]) -> 10946 | DP4: =FIB(RC[-100]) -> 10946 | DQ4: =FIB(RC[-100]) -> 10946 | DR4: =FIB(RC[-100]) -> 10946 | DS4: =FIB(RC[-100]) -> 10946 | DT4: =FIB(RC[-100]) -> 10946 | DU4: =FIB(RC[-100]) -> 10946 | DV4: =FIB(RC[-100]) -> 10946 | DW4: =FIB(RC[-100]) -> 10946 | DX4: =FIB(RC[-100]) -> 10946 | DY4: =FIB(RC[-100]) -> 10946 | DZ4: =FIB(RC[-100]) -> 10946 | EA4: =FIB(RC[-100]) -> 10946 | EB4: =FIB(RC[-100]) -> 10946 | EC4: =FIB(RC[-100]) -> 10946 | ED4: =FIB(RC[-100]) -> 10946 | EE4: =FIB(RC[-100]) -> 10946 | EF4: =FIB(RC[-100]) -> 10946 | EG4: =FIB(RC[-100]) -> 10946 | EH4: =FIB(RC[-100]) -> 10946 | EI4: =FIB(RC[-100]) -> 10946 | EJ4: =FIB(RC[-100]) -> 10946 | EK4: =FIB(RC[-100]) -> 10946 | EL4: =FIB(RC[-100]) -> 10946 | EM4: =FIB(RC[-100]) -> 10946 | EN4: =FIB(RC[-100]) -> 10946 | EO4: =FIB(RC[-100]) -> 10946 | EP4: =FIB(RC[-100]) -> 10946 | EQ4: =FIB(RC[-100]) -> 10946 | ER4: =FIB(RC[-100]) -> 10946 | ES4: =FIB(RC[-100]) -> 10946 | ET4: =FIB(RC[-100]) -> 10946 | EU4: =FIB(RC[-100]) -> 10946 | EV4: =FIB(RC[-100]) -> 10946 | EW4: =FIB(RC[-100]) -> 10946 | EX4: =FIB(RC[-100]) -> 10946 | EY4: =FIB(RC[-100]) -> 10946 | EZ4: =FIB(RC[-100]) -> 10946 | FA4: =FIB(RC[-100]) -> 10946 | FB4: =FIB(RC[-100]) -> 10946 | FC4: =FIB(RC[-100]) -> 10946 | FD4: =FIB(RC[-100]) -> 10946 | FE4: =FIB(RC[-100]) -> 10946 | FF4: =FIB(RC[-100]) -> 10946 | FG4: =FIB(RC[-100]) -> 10946 | FH4: =FIB(RC[-100]) -> 10946 | FI4: =FIB(RC[-100]) -> 10946 | FJ4: =FIB(RC[-100]) -> 10946 | FK4: =FIB(RC[-100]) -> 10946 | FL4: =FIB(RC[-100]) -> 10946 | FM4: =FIB(RC[-100]) -> 10946 | FN4: =FIB(RC[-100]) -> 10946 | FO4: =FIB(RC[-100]) -> 10946 | FP4: =FIB(RC[-100]) -> 10946 | FQ4: =FIB(RC[-100]) -> 10946 | FR4: =FIB(RC[-100]) -> 10946 | FS4: =FIB(RC[-100]) -> 10946 | FT4: =FIB(RC[-100]) -> 10946 | FU4: =FIB(RC[-100]) -> 10946 | FV4: =FIB(RC[-100]) -> 10946 | FW4: =FIB(RC[-100]) -> 10946 | FX4: =FIB(RC[-100]) -> 10946 | FY4: =FIB(RC[-100]) -> 10946 | FZ4: =FIB(RC[-100]) -> 10946 | GA4: =FIB(RC[-100]) -> 10946 | GB4: =FIB(RC[-100]) -> 10946 | GC4: =FIB(RC[-100]) -> 10946 | GD4: =FIB(RC[-100]) -> 10946 | GE4: =FIB(RC[-100]) -> 10946 | GF4: =FIB(RC[-100]) -> 10946 | GG4: =FIB(RC[-100]) -> 10946 | GH4: =FIB(RC[-100]) -> 10946 | GI4: =FIB(RC[-100]) -> 10946 | GJ4: =FIB(RC[-100]) -> 10946 | GK4: =FIB(RC[-100]) -> 10946 | GL4: =FIB(RC[-100]) -> 10946 | GM4: =FIB(RC[-100]) -> 10946 | GN4: =FIB(RC[-100]) -> 10946 | GO4: =FIB(RC[-100]) -> 10946 | GP4: =FIB(RC[-100]) -> 10946 | GQ4: =FIB(RC[-100]) -> 10946 | GR4: =FIB(RC[-100]) -> 10946
A5: 20 | B5: 20 | C5: 20 | D5: 20 | E5: 20 | F5: 20 | G5: 20 | H5: 20 | I5: 20 | J5: 20 | K5: 20 | L5: 20 | M5: 20 | N5: 20 | O5: 20 | P5: 20 | Q5: 20 | R5: 20 | S5: 20 | T5: 20 | U5: 20 | V5: 20 | W5: 20 | X5: 20 | Y5: 20 | Z5: 20 | AA5: 20 | AB5: 20 | AC5: 20 | AD5: 20 | AE5: 20 | AF5: 20 | AG5: 20 | AH5: 20 | AI5: 20 | AJ5: 20 | AK5: 20 | AL5: 20 | AM5: 20 | AN5: 20 | AO5: 20 | AP5: 20 | AQ5: 20 | AR5: 20 | AS5: 20 | AT5: 20 | AU5: 20 | AV5: 20 | AW5: 20 | AX5: 20 | AY5: 20 | AZ5: 20 | BA5: 20 | BB5: 20 | BC5: 20 | BD5: 20 | BE5: 20 | BF5: 20 | BG5: 20 | BH5: 20 | BI5: 20 | BJ5: 20 | BK5: 20 | BL5: 20 | BM5: 20 | BN5: 20 | BO5: 20 | BP5: 20 | BQ5: 20 | BR5: 20 | BS5: 20 | BT5: 20 | BU5: 20 | BV5: 20 | BW5: 20 | BX5: 20 | BY5: 20 | BZ5: 20 | CA5: 20 | CB5: 20 | CC5: 20 | CD5: 20 | CE5: 20 | CF5: 20 | CG5: 20 | CH5: 20 | CI5: 20 | CJ5: 20 | CK5: 20 | CL5: 20 | CM5: 20 | CN5: 20 | CO5: 20 | CP5: 20 | CQ5: 20 | CR5: 20 | CS5: 20 | CT5: 20 | CU5: 20 | CV5: 20 | CW5: =FIB(RC[-100]) -> 10946 | CX5: =FIB(RC[-100]) -> 10946 | CY5: =FIB(RC[-100]) -> 10946 | CZ5: =FIB(RC[-100]) -> 10946 | DA5: =FIB(RC[-100]) -> 10946 | DB5: =FIB(RC[-100]) -> 10946 | DC5: =FIB(RC[-100]) -> 10946 | DD5: =FIB(RC[-100]) -> 10946 | DE5: =FIB(RC[-100]) -> 10946 | DF5: =FIB(RC[-100]) -> 10946 | DG5: =FIB(RC[-100]) -> 10946 | DH5: =FIB(RC[-100]) -> 10946 | DI5: =FIB(RC[-100]) -> 10946 | DJ5: =FIB(RC[-100]) -> 10946 | DK5: =FIB(RC[-100]) -> 10946 | DL5: =FIB(RC[-100]) -> 10946 | DM5: =FIB(RC[-100]) -> 10946 | DN5: =FIB(RC[-100]) -> 10946 | DO5: =FIB(RC[-100]) -> 10946 | DP5: =FIB(RC[-100]) -> 10946 | DQ5: =FIB(RC[-100]) -> 10946 | DR5: =FIB(RC[-100]) -> 10946 | DS5: =FIB(RC[-100]) -> 10946 | DT5: =FIB(RC[-100]) -> 10946 | DU5: =FIB(RC[-100]) -> 10946 | DV5: =FIB(RC[-100]) -> 10946 | DW5: =FIB(RC[-100]) -> 10946 | DX5: =FIB(RC[-100]) -> 10946 | DY5: =FIB(RC[-100]) -> 10946 | DZ5: =FIB(RC[-100]) -> 10946 | EA5: =FIB(RC[-100]) -> 10946 | EB5: =FIB(RC[-100]) -> 10946 | EC5: =FIB(RC[-100]) -> 10946 | ED5: =FIB(RC[-100]) -> 10946 | EE5: =FIB(RC[-100]) -> 10946 | EF5: =FIB(RC[-100]) -> 10946 | EG5: =FIB(RC[-100]) -> 10946 | EH5: =FIB(RC[-100]) -> 10946 | EI5: =FIB(RC[-100]) -> 10946 | EJ5: =FIB(RC[-100]) -> 10946 | EK5: =FIB(RC[-100]) -> 10946 | EL5: =FIB(RC[-100]) -> 10946 | EM5: =FIB(RC[-100]) -> 10946 | EN5: =FIB(RC[-100]) -> 10946 | EO5: =FIB(RC[-100]) -> 10946 | EP5: =FIB(RC[-100]) -> 10946 | EQ5: =FIB(RC[-100]) -> 10946 | ER5: =FIB(RC[-100]) -> 10946 | ES5: =FIB(RC[-100]) -> 10946 | ET5: =FIB(RC[-100]) -> 10946 | EU5: =FIB(RC[-100]) -> 10946 | EV5: =FIB(RC[-100]) -> 10946 | EW5: =FIB(RC[-100]) -> 10946 | EX5: =FIB(RC[-100]) -> 10946 | EY5: =FIB(RC[-100]) -> 10946 | EZ5: =FIB(RC[-100]) -> 10946 | FA5: =FIB(RC[-100]) -> 10946 | FB5: =FIB(RC[-100]) -> 10946 | FC5: =FIB(RC[-100]) -> 10946 | FD5: =FIB(RC[-100]) -> 10946 | FE5: =FIB(RC[-100]) -> 10946 | FF5: =FIB(RC[-100]) -> 10946 | FG5: =FIB(RC[-100]) -> 10946 | FH5: =FIB(RC[-100]) -> 10946 | FI5: =FIB(RC[-100]) -> 10946 | FJ5: =FIB(RC[-100]) -> 10946 | FK5: =FIB(RC[-100]) -> 10946 | FL5: =FIB(RC[-100]) -> 10946 | FM5: =FIB(RC[-100]) -> 10946 | FN5: =FIB(RC[-100]) -> 10946 | FO5: =FIB(RC[-100]) -> 10946 | FP5: =FIB(RC[-100]) -> 10946 | FQ5: =FIB(RC[-100]) -> 10946 | FR5: =FIB(RC[-100]) -> 10946 | FS5: =FIB(RC[-100]) -> 10946 | FT5: =FIB(RC[-100]) -> 10946 | FU5: =FIB(RC[-100]) -> 10946 | FV5: =FIB(RC[-100]) -> 10946 | FW5: =FIB(RC[-100]) -> 10946 | FX5: =FIB(RC[-100]) -> 10946 | FY5: =FIB(RC[-100]) -> 10946 | FZ5: =FIB(RC[-100]) -> 10946 | GA5: =FIB(RC[-100]) -> 10946 | GB5: =FIB(RC[-100]) -> 10946 | GC5: =FIB(RC[-100]) -> 10946 | GD5: =FIB(RC[-100]) -> 10946 | GE5: =FIB(RC[-100]) -> 10946 | GF5: =FIB(RC[-100]) -> 10946 | GG5: =FIB(RC[-100]) -> 10946 | GH5: =FIB(RC[-100]) -> 10946 | GI5: =FIB(RC[-100]) -> 10946 | GJ5: =FIB(RC[-100]) -> 10946 | GK5: =FIB(RC[-100]) -> 10946 | GL5: =FIB(RC[-100]) -> 10946 | GM5: =FIB(RC[-100]) -> 10946 | GN5: =FIB(RC[-100]) -> 10946 | GO5: =FIB(RC[-100]) -> 10946 | GP5: =FIB(RC[-100]) -> 10946 | GQ5: =FIB(RC[-100]) -> 10946 | GR5: =FIB(RC[-100]) -> 10946
A6: 20 | B6: 20 | C6: 20 | D6: 20 | E6: 20 | F6: 20 | G6: 20 | H6: 20 | I6: 20 | J6: 20 | K6: 20 | L6: 20 | M6: 20 | N6: 20 | O6: 20 | P6: 20 | Q6: 20 | R6: 20 | S6: 20 | T6: 20 | U6: 20 | V6: 20 | W6: 20 | X6: 20 | Y6: 20 | Z6: 20 | AA6: 20 | AB6: 20 | AC6: 20 | AD6: 20 | AE6: 20 | AF6: 20 | AG6: 20 | AH6: 20 | AI6: 20 | AJ6: 20 | AK6: 20 | AL6: 20 | AM6: 20 | AN6: 20 | AO6: 20 | AP6: 20 | AQ6: 20 | AR6: 20 | AS6: 20 | AT6: 20 | AU6: 20 | AV6: 20 | AW6: 20 | AX6: 20 | AY6: 20 | AZ6: 20 | BA6: 20 | BB6: 20 | BC6: 20 | BD6: 20 | BE6: 20 | BF6: 20 | BG6: 20 | BH6: 20 | BI6: 20 | BJ6: 20 | BK6: 20 | BL6: 20 | BM6: 20 | BN6: 20 | BO6: 20 | BP6: 20 | BQ6: 20 | BR6: 20 | BS6: 20 | BT6: 20 | BU6: 20 | BV6: 20 | BW6: 20 | BX6: 20 | BY6: 20 | BZ6: 20 | CA6: 20 | CB6: 20 | CC6: 20 | CD6: 20 | CE6: 20 | CF6: 20 | CG6: 20 | CH6: 20 | CI6: 20 | CJ6: 20 | CK6: 20 | CL6: 20 | CM6: 20 | CN6: 20 | CO6: 20 | CP6: 20 | CQ6: 20 | CR6: 20 | CS6: 20 | CT6: 20 | CU6: 20 | CV6: 20 | CW6: =FIB(RC[-100]) -> 10946 | CX6: =FIB(RC[-100]) -> 10946 | CY6: =FIB(RC[-100]) -> 10946 | CZ6: =FIB(RC[-100]) -> 10946 | DA6: =FIB(RC[-100]) -> 10946 | DB6: =FIB(RC[-100]) -> 10946 | DC6: =FIB(RC[-100]) -> 10946 | DD6: =FIB(RC[-100]) -> 10946 | DE6: =FIB(RC[-100]) -> 10946 | DF6: =FIB(RC[-100]) -> 10946 | DG6: =FIB(RC[-100]) -> 10946 | DH6: =FIB(RC[-100]) -> 10946 | DI6: =FIB(RC[-100]) -> 10946 | DJ6: =FIB(RC[-100]) -> 10946 | DK6: =FIB(RC[-100]) -> 10946 | DL6: =FIB(RC[-100]) -> 10946 | DM6: =FIB(RC[-100]) -> 10946 | DN6: =FIB(RC[-100]) -> 10946 | DO6: =FIB(RC[-100]) -> 10946 | DP6: =FIB(RC[-100]) -> 10946 | DQ6: =FIB(RC[-100]) -> 10946 | DR6: =FIB(RC[-100]) -> 10946 | DS6: =FIB(RC[-100]) -> 10946 | DT6: =FIB(RC[-100]) -> 10946 | DU6: =FIB(RC[-100]) -> 10946 | DV6: =FIB(RC[-100]) -> 10946 | DW6: =FIB(RC[-100]) -> 10946 | DX6: =FIB(RC[-100]) -> 10946 | DY6: =FIB(RC[-100]) -> 10946 | DZ6: =FIB(RC[-100]) -> 10946 | EA6: =FIB(RC[-100]) -> 10946 | EB6: =FIB(RC[-100]) -> 10946 | EC6: =FIB(RC[-100]) -> 10946 | ED6: =FIB(RC[-100]) -> 10946 | EE6: =FIB(RC[-100]) -> 10946 | EF6: =FIB(RC[-100]) -> 10946 | EG6: =FIB(RC[-100]) -> 10946 | EH6: =FIB(RC[-100]) -> 10946 | EI6: =FIB(RC[-100]) -> 10946 | EJ6: =FIB(RC[-100]) -> 10946 | EK6: =FIB(RC[-100]) -> 10946 | EL6: =FIB(RC[-100]) -> 10946 | EM6: =FIB(RC[-100]) -> 10946 | EN6: =FIB(RC[-100]) -> 10946 | EO6: =FIB(RC[-100]) -> 10946 | EP6: =FIB(RC[-100]) -> 10946 | EQ6: =FIB(RC[-100]) -> 10946 | ER6: =FIB(RC[-100]) -> 10946 | ES6: =FIB(RC[-100]) -> 10946 | ET6: =FIB(RC[-100]) -> 10946 | EU6: =FIB(RC[-100]) -> 10946 | EV6: =FIB(RC[-100]) -> 10946 | EW6: =FIB(RC[-100]) -> 10946 | EX6: =FIB(RC[-100]) -> 10946 | EY6: =FIB(RC[-100]) -> 10946 | EZ6: =FIB(RC[-100]) -> 10946 | FA6: =FIB(RC[-100]) -> 10946 | FB6: =FIB(RC[-100]) -> 10946 | FC6: =FIB(RC[-100]) -> 10946 | FD6: =FIB(RC[-100]) -> 10946 | FE6: =FIB(RC[-100]) -> 10946 | FF6: =FIB(RC[-100]) -> 10946 | FG6: =FIB(RC[-100]) -> 10946 | FH6: =FIB(RC[-100]) -> 10946 | FI6: =FIB(RC[-100]) -> 10946 | FJ6: =FIB(RC[-100]) -> 10946 | FK6: =FIB(RC[-100]) -> 10946 | FL6: =FIB(RC[-100]) -> 10946 | FM6: =FIB(RC[-100]) -> 10946 | FN6: =FIB(RC[-100]) -> 10946 | FO6: =FIB(RC[-100]) -> 10946 | FP6: =FIB(RC[-100]) -> 10946 | FQ6: =FIB(RC[-100]) -> 10946 | FR6: =FIB(RC[-100]) -> 10946 | FS6: =FIB(RC[-100]) -> 10946 | FT6: =FIB(RC[-100]) -> 10946 | FU6: =FIB(RC[-100]) -> 10946 | FV6: =FIB(RC[-100]) -> 10946 | FW6: =FIB(RC[-100]) -> 10946 | FX6: =FIB(RC[-100]) -> 10946 | FY6: =FIB(RC[-100]) -> 10946 | FZ6: =FIB(RC[-100]) -> 10946 | GA6: =FIB(RC[-100]) -> 10946 | GB6: =FIB(RC[-100]) -> 10946 | GC6: =FIB(RC[-100]) -> 10946 | GD6: =FIB(RC[-100]) -> 10946 | GE6: =FIB(RC[-100]) -> 10946 | GF6: =FIB(RC[-100]) -> 10946 | GG6: =FIB(RC[-100]) -> 10946 | GH6: =FIB(RC[-100]) -> 10946 | GI6: =FIB(RC[-100]) -> 10946 | GJ6: =FIB(RC[-100]) -> 10946 | GK6: =FIB(RC[-100]) -> 10946 | GL6: =FIB(RC[-100]) -> 10946 | GM6: =FIB(RC[-100]) -> 10946 | GN6: =FIB(RC[-100]) -> 10946 | GO6: =FIB(RC[-100]) -> 10946 | GP6: =FIB(RC[-100]) -> 10946 | GQ6: =FIB(RC[-100]) -> 10946 | GR6: =FIB(RC[-100]) -> 10946
A7: 20 | B7: 20 | C7: 20 | D7: 20 | E7: 20 | F7: 20 | G7: 20 | H7: 20 | I7: 20 | J7: 20 | K7: 20 | L7: 20 | M7: 20 | N7: 20 | O7: 20 | P7: 20 | Q7: 20 | R7: 20 | S7: 20 | T7: 20 | U7: 20 | V7: 20 | W7: 20 | X7: 20 | Y7: 20 | Z7: 20 | AA7: 20 | AB7: 20 | AC7: 20 | AD7: 20 | AE7: 20 | AF7: 20 | AG7: 20 | AH7: 20 | AI7: 20 | AJ7: 20 | AK7: 20 | AL7: 20 | AM7: 20 | AN7: 20 | AO7: 20 | AP7: 20 | AQ7: 20 | AR7: 20 | AS7: 20 | AT7: 20 | AU7: 20 | AV7: 20 | AW7: 20 | AX7: 20 | AY7: 20 | AZ7: 20 | BA7: 20 | BB7: 20 | BC7: 20 | BD7: 20 | BE7: 20 | BF7: 20 | BG7: 20 | BH7: 20 | BI7: 20 | BJ7: 20 | BK7: 20 | BL7: 20 | BM7: 20 | BN7: 20 | BO7: 20 | BP7: 20 | BQ7: 20 | BR7: 20 | BS7: 20 | BT7: 20 | BU7: 20 | BV7: 20 | BW7: 20 | BX7: 20 | BY7: 20 | BZ7: 20 | CA7: 20 | CB7: 20 | CC7: 20 | CD7: 20 | CE7: 20 | CF7: 20 | CG7: 20 | CH7: 20 | CI7: 20 | CJ7: 20 | CK7: 20 | CL7: 20 | CM7: 20 | CN7: 20 | CO7: 20 | CP7: 20 | CQ7: 20 | CR7: 20 | CS7: 20 | CT7: 20 | CU7: 20 | CV7: 20 | CW7: =FIB(RC[-100]) -> 10946 | CX7: =FIB(RC[-100]) -> 10946 | CY7: =FIB(RC[-100]) -> 10946 | CZ7: =FIB(RC[-100]) -> 10946 | DA7: =FIB(RC[-100]) -> 10946 | DB7: =FIB(RC[-100]) -> 10946 | DC7: =FIB(RC[-100]) -> 10946 | DD7: =FIB(RC[-100]) -> 10946 | DE7: =FIB(RC[-100]) -> 10946 | DF7: =FIB(RC[-100]) -> 10946 | DG7: =FIB(RC[-100]) -> 10946 | DH7: =FIB(RC[-100]) -> 10946 | DI7: =FIB(RC[-100]) -> 10946 | DJ7: =FIB(RC[-100]) -> 10946 | DK7: =FIB(RC[-100]) -> 10946 | DL7: =FIB(RC[-100]) -> 10946 | DM7: =FIB(RC[-100]) -> 10946 | DN7: =FIB(RC[-100]) -> 10946 | DO7: =FIB(RC[-100]) -> 10946 | DP7: =FIB(RC[-100]) -> 10946 | DQ7: =FIB(RC[-100]) -> 10946 | DR7: =FIB(RC[-100]) -> 10946 | DS7: =FIB(RC[-100]) -> 10946 | DT7: =FIB(RC[-100]) -> 10946 | DU7: =FIB(RC[-100]) -> 10946 | DV7: =FIB(RC[-100]) -> 10946 | DW7: =FIB(RC[-100]) -> 10946 | DX7: =FIB(RC[-100]) -> 10946 | DY7: =FIB(RC[-100]) -> 10946 | DZ7: =FIB(RC[-100]) -> 10946 | EA7: =FIB(RC[-100]) -> 10946 | EB7: =FIB(RC[-100]) -> 10946 | EC7: =FIB(RC[-100]) -> 10946 | ED7: =FIB(RC[-100]) -> 10946 | EE7: =FIB(RC[-100]) -> 10946 | EF7: =FIB(RC[-100]) -> 10946 | EG7: =FIB(RC[-100]) -> 10946 | EH7: =FIB(RC[-100]) -> 10946 | EI7: =FIB(RC[-100]) -> 10946 | EJ7: =FIB(RC[-100]) -> 10946 | EK7: =FIB(RC[-100]) -> 10946 | EL7: =FIB(RC[-100]) -> 10946 | EM7: =FIB(RC[-100]) -> 10946 | EN7: =FIB(RC[-100]) -> 10946 | EO7: =FIB(RC[-100]) -> 10946 | EP7: =FIB(RC[-100]) -> 10946 | EQ7: =FIB(RC[-100]) -> 10946 | ER7: =FIB(RC[-100]) -> 10946 | ES7: =FIB(RC[-100]) -> 10946 | ET7: =FIB(RC[-100]) -> 10946 | EU7: =FIB(RC[-100]) -> 10946 | EV7: =FIB(RC[-100]) -> 10946 | EW7: =FIB(RC[-100]) -> 10946 | EX7: =FIB(RC[-100]) -> 10946 | EY7: =FIB(RC[-100]) -> 10946 | EZ7: =FIB(RC[-100]) -> 10946 | FA7: =FIB(RC[-100]) -> 10946 | FB7: =FIB(RC[-100]) -> 10946 | FC7: =FIB(RC[-100]) -> 10946 | FD7: =FIB(RC[-100]) -> 10946 | FE7: =FIB(RC[-100]) -> 10946 | FF7: =FIB(RC[-100]) -> 10946 | FG7: =FIB(RC[-100]) -> 10946 | FH7: =FIB(RC[-100]) -> 10946 | FI7: =FIB(RC[-100]) -> 10946 | FJ7: =FIB(RC[-100]) -> 10946 | FK7: =FIB(RC[-100]) -> 10946 | FL7: =FIB(RC[-100]) -> 10946 | FM7: =FIB(RC[-100]) -> 10946 | FN7: =FIB(RC[-100]) -> 10946 | FO7: =FIB(RC[-100]) -> 10946 | FP7: =FIB(RC[-100]) -> 10946 | FQ7: =FIB(RC[-100]) -> 10946 | FR7: =FIB(RC[-100]) -> 10946 | FS7: =FIB(RC[-100]) -> 10946 | FT7: =FIB(RC[-100]) -> 10946 | FU7: =FIB(RC[-100]) -> 10946 | FV7: =FIB(RC[-100]) -> 10946 | FW7: =FIB(RC[-100]) -> 10946 | FX7: =FIB(RC[-100]) -> 10946 | FY7: =FIB(RC[-100]) -> 10946 | FZ7: =FIB(RC[-100]) -> 10946 | GA7: =FIB(RC[-100]) -> 10946 | GB7: =FIB(RC[-100]) -> 10946 | GC7: =FIB(RC[-100]) -> 10946 | GD7: =FIB(RC[-100]) -> 10946 | GE7: =FIB(RC[-100]) -> 10946 | GF7: =FIB(RC[-100]) -> 10946 | GG7: =FIB(RC[-100]) -> 10946 | GH7: =FIB(RC[-100]) -> 10946 | GI7: =FIB(RC[-100]) -> 10946 | GJ7: =FIB(RC[-100]) -> 10946 | GK7: =FIB(RC[-100]) -> 10946 | GL7: =FIB(RC[-100]) -> 10946 | GM7: =FIB(RC[-100]) -> 10946 | GN7: =FIB(RC[-100]) -> 10946 | GO7: =FIB(RC[-100]) -> 10946 | GP7: =FIB(RC[-100]) -> 10946 | GQ7: =FIB(RC[-100]) -> 10946 | GR7: =FIB(RC[-100]) -> 10946
A8: 20 | B8: 20 | C8: 20 | D8: 20 | E8: 20 | F8: 20 | G8: 20 | H8: 20 | I8: 20 | J8: 20 | K8: 20 | L8: 20 | M8: 20 | N8: 20 | O8: 20 | P8: 20 | Q8: 20 | R8: 20 | S8: 20 | T8: 20 | U8: 20 | V8: 20 | W8: 20 | X8: 20 | Y8: 20 | Z8: 20 | AA8: 20 | AB8: 20 | AC8: 20 | AD8: 20 | AE8: 20 | AF8: 20 | AG8: 20 | AH8: 20 | AI8: 20 | AJ8: 20 | AK8: 20 | AL8: 20 | AM8: 20 | AN8: 20 | AO8: 20 | AP8: 20 | AQ8: 20 | AR8: 20 | AS8: 20 | AT8: 20 | AU8: 20 | AV8: 20 | AW8: 20 | AX8: 20 | AY8: 20 | AZ8: 20 | BA8: 20 | BB8: 20 | BC8: 20 | BD8: 20 | BE8: 20 | BF8: 20 | BG8: 20 | BH8: 20 | BI8: 20 | BJ8: 20 | BK8: 20 | BL8: 20 | BM8: 20 | BN8: 20 | BO8: 20 | BP8: 20 | BQ8: 20 | BR8: 20 | BS8: 20 | BT8: 20 | BU8: 20 | BV8: 20 | BW8: 20 | BX8: 20 | BY8: 20 | BZ8: 20 | CA8: 20 | CB8: 20 | CC8: 20 | CD8: 20 | CE8: 20 | CF8: 20 | CG8: 20 | CH8: 20 | CI8: 20 | CJ8: 20 | CK8: 20 | CL8: 20 | CM8: 20 | CN8: 20 | CO8: 20 | CP8: 20 | CQ8: 20 | CR8: 20 | CS8: 20 | CT8: 20 | CU8: 20 | CV8: 20 | CW8: =FIB(RC[-100]) -> 10946 | CX8: =FIB(RC[-100]) -> 10946 | CY8: =FIB(RC[-100]) -> 10946 | CZ8: =FIB(RC[-100]) -> 10946 | DA8: =FIB(RC[-100]) -> 10946 | DB8: =FIB(RC[-100]) -> 10946 | DC8: =FIB(RC[-100]) -> 10946 | DD8: =FIB(RC[-100]) -> 10946 | DE8: =FIB(RC[-100]) -> 10946 | DF8: =FIB(RC[-100]) -> 10946 | DG8: =FIB(RC[-100]) -> 10946 | DH8: =FIB(RC[-100]) -> 10946 | DI8: =FIB(RC[-100]) -> 10946 | DJ8: =FIB(RC[-100]) -> 10946 | DK8: =FIB(RC[-100]) -> 10946 | DL8: =FIB(RC[-100]) -> 10946 | DM8: =FIB(RC[-100]) -> 10946 | DN8: =FIB(RC[-100]) -> 10946 | DO8: =FIB(RC[-100]) -> 10946 | DP8: =FIB(RC[-100]) -> 10946 | DQ8: =FIB(RC[-100]) -> 10946 | DR8: =FIB(RC[-100]) -> 10946 | DS8: =FIB(RC[-100]) -> 10946 | DT8: =FIB(RC[-100]) -> 10946 | DU8: =FIB(RC[-100]) -> 10946 | DV8: =FIB(RC[-100]) -> 10946 | DW8: =FIB(RC[-100]) -> 10946 | DX8: =FIB(RC[-100]) -> 10946 | DY8: =FIB(RC[-100]) -> 10946 | DZ8: =FIB(RC[-100]) -> 10946 | EA8: =FIB(RC[-100]) -> 10946 | EB8: =FIB(RC[-100]) -> 10946 | EC8: =FIB(RC[-100]) -> 10946 | ED8: =FIB(RC[-100]) -> 10946 | EE8: =FIB(RC[-100]) -> 10946 | EF8: =FIB(RC[-100]) -> 10946 | EG8: =FIB(RC[-100]) -> 10946 | EH8: =FIB(RC[-100]) -> 10946 | EI8: =FIB(RC[-100]) -> 10946 | EJ8: =FIB(RC[-100]) -> 10946 | EK8: =FIB(RC[-100]) -> 10946 | EL8: =FIB(RC[-100]) -> 10946 | EM8: =FIB(RC[-100]) -> 10946 | EN8: =FIB(RC[-100]) -> 10946 | EO8: =FIB(RC[-100]) -> 10946 | EP8: =FIB(RC[-100]) -> 10946 | EQ8: =FIB(RC[-100]) -> 10946 | ER8: =FIB(RC[-100]) -> 10946 | ES8: =FIB(RC[-100]) -> 10946 | ET8: =FIB(RC[-100]) -> 10946 | EU8: =FIB(RC[-100]) -> 10946 | EV8: =FIB(RC[-100]) -> 10946 | EW8: =FIB(RC[-100]) -> 10946 | EX8: =FIB(RC[-100]) -> 10946 | EY8: =FIB(RC[-100]) -> 10946 | EZ8: =FIB(RC[-100]) -> 10946 | FA8: =FIB(RC[-100]) -> 10946 | FB8: =FIB(RC[-100]) -> 10946 | FC8: =FIB(RC[-100]) -> 10946 | FD8: =FIB(RC[-100]) -> 10946 | FE8: =FIB(RC[-100]) -> 10946 | FF8: =FIB(RC[-100]) -> 10946 | FG8: =FIB(RC[-100]) -> 10946 | FH8: =FIB(RC[-100]) -> 10946 | FI8: =FIB(RC[-100]) -> 10946 | FJ8: =FIB(RC[-100]) -> 10946 | FK8: =FIB(RC[-100]) -> 10946 | FL8: =FIB(RC[-100]) -> 10946 | FM8: =FIB(RC[-100]) -> 10946 | FN8: =FIB(RC[-100]) -> 10946 | FO8: =FIB(RC[-100]) -> 10946 | FP8: =FIB(RC[-100]) -> 10946 | FQ8: =FIB(RC[-100]) -> 10946 | FR8: =FIB(RC[-100]) -> 10946 | FS8: =FIB(RC[-100]) -> 10946 | FT8: =FIB(RC[-100]) -> 10946 | FU8: =FIB(RC[-100]) -> 10946 | FV8: =FIB(RC[-100]) -> 10946 | FW8: =FIB(RC[-100]) -> 10946 | FX8: =FIB(RC[-100]) -> 10946 | FY8: =FIB(RC[-100]) -> 10946 | FZ8: =FIB(RC[-100]) -> 10946 | GA8: =FIB(RC[-100]) -> 10946 | GB8: =FIB(RC[-100]) -> 10946 | GC8: =FIB(RC[-100]) -> 10946 | GD8: =FIB(RC[-100]) -> 10946 | GE8: =FIB(RC[-100]) -> 10946 | GF8: =FIB(RC[-100]) -> 10946 | GG8: =FIB(RC[-100]) -> 10946 | GH8: =FIB(RC[-100]) -> 10946 | GI8: =FIB(RC[-100]) -> 10946 | GJ8: =FIB(RC[-100]) -> 10946 | GK8: =FIB(RC[-100]) -> 10946 | GL8: =FIB(RC[-100]) -> 10946 | GM8: =FIB(RC[-100]) -> 10946 | GN8: =FIB(RC[-100]) -> 10946 | GO8: =FIB(RC[-100]) -> 10946 | GP8: =FIB(RC[-100]) -> 10946 | GQ8: =FIB(RC[-100]) -> 10946 | GR8: =FIB(RC[-100]) -> 10946
A9: 20 | B9: 20 | C9: 20 | D9: 20 | E9: 20 | F9: 20 | G9: 20 | H9: 20 | I9: 20 | J9: 20 | K9: 20 | L9: 20 | M9: 20 | N9: 20 | O9: 20 | P9: 20 | Q9: 20 | R9: 20 | S9: 20 | T9: 20 | U9: 20 | V9: 20 | W9: 20 | X9: 20 | Y9: 20 | Z9: 20 | AA9: 20 | AB9: 20 | AC9: 20 | AD9: 20 | AE9: 20 | AF9: 20 | AG9: 20 | AH9: 20 | AI9: 20 | AJ9: 20 | AK9: 20 | AL9: 20 | AM9: 20 | AN9: 20 | AO9: 20 | AP9: 20 | AQ9: 20 | AR9: 20 | AS9: 20 | AT9: 20 | AU9: 20 | AV9: 20 | AW9: 20 | AX9: 20 | AY9: 20 | AZ9: 20 | BA9: 20 | BB9: 20 | BC9: 20 | BD9: 20 | BE9: 20 | BF9: 20 | BG9: 20 | BH9: 20 | BI9: 20 | BJ9: 20 | BK9: 20 | BL9: 20 | BM9: 20 | BN9: 20 | BO9: 20 | BP9: 20 | BQ9: 20 | BR9: 20 | BS9: 20 | BT9: 20 | BU9: 20 | BV9: 20 | BW9: 20 | BX9: 20 | BY9: 20 | BZ9: 20 | CA9: 20 | CB9: 20 | CC9: 20 | CD9: 20 | CE9: 20 | CF9: 20 | CG9: 20 | CH9: 20 | CI9: 20 | CJ9: 20 | CK9: 20 | CL9: 20 | CM9: 20 | CN9: 20 | CO9: 20 | CP9: 20 | CQ9: 20 | CR9: 20 | CS9: 20 | CT9: 20 | CU9: 20 | CV9: 20 | CW9: =FIB(RC[-100]) -> 10946 | CX9: =FIB(RC[-100]) -> 10946 | CY9: =FIB(RC[-100]) -> 10946 | CZ9: =FIB(RC[-100]) -> 10946 | DA9: =FIB(RC[-100]) -> 10946 | DB9: =FIB(RC[-100]) -> 10946 | DC9: =FIB(RC[-100]) -> 10946 | DD9: =FIB(RC[-100]) -> 10946 | DE9: =FIB(RC[-100]) -> 10946 | DF9: =FIB(RC[-100]) -> 10946 | DG9: =FIB(RC[-100]) -> 10946 | DH9: =FIB(RC[-100]) -> 10946 | DI9: =FIB(RC[-100]) -> 10946 | DJ9: =FIB(RC[-100]) -> 10946 | DK9: =FIB(RC[-100]) -> 10946 | DL9: =FIB(RC[-100]) -> 10946 | DM9: =FIB(RC[-100]) -> 10946 | DN9: =FIB(RC[-100]) -> 10946 | DO9: =FIB(RC[-100]) -> 10946 | DP9: =FIB(RC[-100]) -> 10946 | DQ9: =FIB(RC[-100]) -> 10946 | DR9: =FIB(RC[-100]) -> 10946 | DS9: =FIB(RC[-100]) -> 10946 | DT9: =FIB(RC[-100]) -> 10946 | DU9: =FIB(RC[-100]) -> 10946 | DV9: =FIB(RC[-100]) -> 10946 | DW9: =FIB(RC[-100]) -> 10946 | DX9: =FIB(RC[-100]) -> 10946 | DY9: =FIB(RC[-100]) -> 10946 | DZ9: =FIB(RC[-100]) -> 10946 | EA9: =FIB(RC[-100]) -> 10946 | EB9: =FIB(RC[-100]) -> 10946 | EC9: =FIB(RC[-100]) -> 10946 | ED9: =FIB(RC[-100]) -> 10946 | EE9: =FIB(RC[-100]) -> 10946 | EF9: =FIB(RC[-100]) -> 10946 | EG9: =FIB(RC[-100]) -> 10946 | EH9: =FIB(RC[-100]) -> 10946 | EI9: =FIB(RC[-100]) -> 10946 | EJ9: =FIB(RC[-100]) -> 10946 | EK9: =FIB(RC[-100]) -> 10946 | EL9: =FIB(RC[-100]) -> 10946 | EM9: =FIB(RC[-100]) -> 10946 | EN9: =FIB(RC[-100]) -> 10946 | EO9: =FIB(RC[-100]) -> 10946 | EP9: =FIB(RC[-100]) -> 10946 | EQ9: =FIB(RC[-100]) -> 10946 | ER9: =FIB(RC[-100]) -> 10946 | ES9: =FIB(RC[-100]) -> 10946 | ET9: =FIB(RC[-100]) -> 10946 | EU9: =FIB(RC[-100]) -> 10946 | EV9: =FIB(RC[-100]) -> 10946 | EW9: =FIB(RC[-100]) -> 10946 | EX9: =FIB(RC[-100]) -> 10946 | EY9: =FIB(RC[-100]) -> 10946 | EZ9: =FIB(RC[-100]) -> 10946 | FA9: =FIB(RC[-100]) -> 10946 | FB9: =FIB(RC[-100]) -> 10946 | FC9: =FIB(RC[-100]) -> 10946 | FD9: =FIB(RC[-100]) -> 10946 | FE9: =FIB(RC[-100]) -> 10946 | FF9: =FIB(RC[-100]) -> 10946 | FG9: =FIB(RC[-100]) -> 10946 | FH9: =FIB(RC[-100]) -> 10946 | FI9: =FIB(RC[-100]) -> 10946 | FJ9: =FIB(RC[-100]) -> 10946 | FK9: =FIB(RC[-100]) -> 10946 | FL9: =FIB(RC[-100]) -> 10946 | FM9: =FIB(RC[-100]) -> 10946 | FN9: =FIB(RC[-100]) -> 10946 | FO9: =FIB(RC[-100]) -> 10946 | FP9: =FIB(RC[-100]) -> 10946 | FQ9: =FIB(RC[-100]) -> 10946 | FR9: =FIB(RC[-100]) -> 10946 | FS9: =FIB(RC[-100]) -> 10946 | FT9: =FIB(RC[-100]) -> 10946 | FU9: =FIB(RC[-100]) -> 10946 | FV9: =FIB(RC[-100]) -> 10946 | FW9: =FIB(RC[-100]) -> 10946 | FX9: =FIB(RC[-100]) -> 10946 | FY9: =FIB(RC[-100]) -> 10946 | FZ9: =FIB(RC[-100]) -> 10946 | GA9: =FIB(RC[-100]) -> 10946 | GB9: =FIB(RC[-100]) -> 10946 | GC9: =FIB(RC[-100]) -> 10946 | GD9: =FIB(RC[-100]) -> 10946 | GE9: =FIB(RC[-100]) -> 10946 | GF9: =FIB(RC[-100]) -> 10946 | GG9: =FIB(RC[-100]) -> 10946 | GH9: =FIB(RC[-100]) -> 10946 | GI9: =FIB(RC[-100]) -> 10946 | GJ9: =FIB(RC[-100]) -> 10946 | GK9: =FIB(RC[-100]) -> 10946 | GL9: =FIB(RC[-100]) -> 10946 | GM9: =FIB(RC[-100]) -> 10946 | GN9: =FIB(RC[-100]) -> 10946 | GO9: =FIB(RC[-100]) -> 10946 | GP9: =FIB(RC[-100]) -> 10946 | GQ9: =FIB(RC[-100]) -> 10946 | GR9: =FIB(RC[-100]) -> 10946
A10: 20 | B10: 20 | C10: 20 | D10: 20 | E10: 20 | F10: 20 | G10: 20 | H10: 20 | I10: 20 | J10: 20 | K10: 20 | L10: 20 | M10: 20 | N10: 20 | O10: 20 | P10: 20 | Q10: 20 | R10: 20 | S10: 20 | T10: 20 | U10: 20 | V10: 20 | W10: 20 | X10: 20 | Y10: 20 | Z10: 20 | AA10: 20 | AB10: 20 | AC10: 20 | AD10: 20 | AE10: 20 | AF10: 20 | AG10: 20 | AH10: 20 | AI10: 20 | AJ10: 20 | AK10: 20 | AL10: 20 | AM10: 20 | AN10: 20 | AO10: 20 | AP10: 20 | AQ10: 20 | AR10: 20 | AS10: 20 | AT10: 20 | AU10: 20 | AV10: 20 | AW10: 20 | AX10: 20 | AY10: 20 | AZ10: 20 | BA10: 20 | BB10: 20 | BC10: 20 | BD10: 20 | BE10: 20 | BF10: 20 | BG10: 20 | BH10: 20 | BI10: 20 | BJ10: 20 | BK10: 20 | BL10: 20 | BM10: 20 | BN10: 20 | BO10: 20 | BP10: 20 | BQ10: 20 | BR10: 20 | BS10: 20 | BT10: 20 | BU10: 20 | BV10: 20 | BW10: 20 | BX10: 20 | BY10: 20 | BZ10: 20 | CA10: 20 | CB10: 20 | CC10: 20 | CD10: 20 | CE10: 20 | CF10: 20 | CG10: 20 | CH10: 20 | CI10: 20 | CJ10: 20 | CK10: 20 | CL10: 20 | CM10: 20 | CN10: 20 | CO10: 20 | CP10: 20 | CQ10: 20 | CR10: 20 | CS10: 20 | CT10: 20 | CU10: 20 | CV10: 20 | CW10: =FIB(RC[-100]) -> 10946 | CX10: =FIB(RC[-100]) -> 10946 | CY10: =FIB(RC[-100]) -> 10946 | CZ10: =FIB(RC[-100]) -> 10946 | DA10: =FIB(RC[-100]) -> 10946 | DB10: =FIB(RC[-100]) -> 10946 | DC10: =FIB(RC[-100]) -> 10946 | DD10: =FIB(RC[-100]) -> 10946 | DE10: =FIB(RC[-100]) -> 10946 | DF10: =FIB(RC[-100]) -> 10946 | DG10: =FIB(RC[-100]) -> 10946 | DH10: =FIB(RC[-100]) -> 10946 | DI10: =FIB(RC[-100]) -> 10946 | DJ10: =FIB(RC[-100]) -> 10946 | DK10: =FIB(RC[-100]) -> 10946 | DL10: =FIB(RC[-100]) -> 10946 | DM10: =FIB(RC[-100]) -> 10946 | DN10: =FIB(RC[-100]) -> 10946 | DO10: =FIB(RC[-100]) -> 10946 | DP10: =FIB(RC[-100]) -> 10946 | DQ10: =FIB(RC[-100]) -> 10946 | DR10: =FIB(RC[-100]) -> 10946 | DS10: =FIB(RC[-100]) -> 10946 | DT10: =FIB(RC[-100]) -> 10946 | DU10: =FIB(RC[-100]) -> 10946 | DV10: =FIB(RC[-100]) -> 10946 | DW10: =FIB(RC[-100]) -> 10946 | DX10: =FIB(RC[-100]) -> 10946 | DY10: =FIB(RC[-100]) -> 10946 | DZ10: =FIB(RC[-100]) -> 10946 | EA10: =FIB(RC[-100]) -> 10946 | EB10: =FIB(RC[-100]) -> 10946 | EC10: =FIB(RC[-100]) -> 10946 | ED10: =FIB(RC[-100]) -> 10946 | EE10: =FIB(RC[-100]) -> 10946 | EF10: =FIB(RC[-100]) -> 10946 | EG10: =FIB(RC[-100]) -> 10946 | EH10: =FIB(RC[-100]) -> 10946 | EI10: =FIB(RC[-100]) -> 10946 | EJ10: =FIB(RC[-100]) -> 10946 | EK10: =FIB(RC[-100]) -> 10946 | EL10: =FIB(RC[-100]) -> 10946 | EM10: =FIB(RC[-100]) -> 10946 | EN10: =FIB(RC[-100]) -> 10946 | EO10: =FIB(RC[-100]) -> 10946 | EP10: =FIB(RC[-100]) -> 10946 | EQ10: =FIB(RC[-100]) -> 10946 | ER10: =FIB(RC[-100]) -> 10946 | ES10: =FIB(RC[-100]) -> 10946 | ET10: =FIB(RC[-100]) -> 10946 | EU10: =FIB(RC[-100]) -> 10946 | EV10: =FIB(RC[-100]) -> 10946 | EW10: =FIB(RC[-100]) -> 10946 | EX10: =FIB(RC[-100]) -> 10946 | EY10: =FIB(RC[-100]) -> 10946 | EZ10: =FIB(RC[-100]) -> 10946 | FA10: =FIB(RC[-100]) -> 10946 | FB10: =FIB(RC[-100]) -> 10946 | FC10: =FIB(RC[-100]) -> 10946 | FD10: =FIB(RC[-100]) -> 10946 | FE10: =FIB(RC[-100]) -> 10946 | FF10: =FIB(RC[-100]) -> 10946 | FG10: =FIB(RC[-100]) -> 10946 | FH10: =FIB(RC[-100]) -> 10946 | FI10: =FIB(RC[-100]) -> 10946 | FJ10: =FIB(RC[-100]) -> 10946 | FK10: =FIB(RC[-100]) -> 10946 | FL10: =FIB(RC[-100]) -> 10946 | FM10: =FIB(RC[-100]) -> 10946 | FN10: =FIB(RC[-100]) -> 10946 | FO10: =FIB(RC[-100]) -> 10946 | FP10: =FIB(RC[-100]) -> 10946 | FQ10: =FIB(RC[-100]) -> 10946 | FR10: =FIB(RC[-100]) -> 10946 | FS10: =FIB(RC[-100]) -> 10946 | FT10: =FIB(RC[-100]) -> 10946 | FU10: =FIB(RC[-100]) -> 10946 | FV10: =FIB(RC[-100]) -> 10946 | FW10: =FIB(RC[-100]) -> 10946 | FX10: =FIB(RC[-100]) -> 10946 | FY10: =FIB(RC[-100]) -> 10946 | FZ10: =FIB(RC[-100]) -> 10946 | GA10: =FIB(RC[-100]) -> 10946 | GB10: =FIB(RC[-100]) -> 10946 | GC10: =FIB(RC[-100]) -> 10946 | GD10: =FIB(RC[-100]) -> 10946 | GE10: =FIB(RC[-100]) -> 10946 | GF10: =FIB(RC[-100]) -> 10946 | GG10: =FIB(RC[-100]) -> 10946 | GH10: =FIB(RC[-100]) -> 10946 | GI10: =FIB(RC[-100]) -> 10946 | GJ10: =FIB(RC[-100]) -> 10946 | GK10: =FIB(RC[-100]) -> 10946 | GL10: =FIB(RC[-100]) -> 10946 | GM10: =FIB(RC[-100]) -> 10946 | GN10: =FIB(RC[-100]) -> 10946 | GO10: =FIB(RC[-100]) -> 10946 | GP10: =FIB(RC[-100]) -> 10946 | GQ10: =FIB(RC[-100]) -> 10946 | GR10: =FIB(RC[-100]) -> 10946
A11: 20 | B11: 20 | C11: 20 | D11: 20 | E11: 20 | F11: 20 | G11: 20 | H11: 20 | I11: 20 | J11: 20 | K11: 20 | L11: 20 | M11: 20 | N11: 20 | O11: 20 | P11: 20 | Q11: 20 | R11: 20 | S11: 20 | T11: 20 | U11: 20 | V11: 20 | W11: 20 | X11: 20 | Y11: 20 | Z11: 20 | AA11: 20 | AB11: 20 | AC11: 20 | AD11: 20 | AE11: 20 | AF11: 20 | AG11: 20 | AH11: 20 | AI11: 20 | AJ11: 20 | AK11: 20 | AL11: 20 | AM11: 20 | AN11: 20 | AO11: 20 | AP11: 20 | AQ11: 20 | AR11: 20 | AS11: 20 | AT11: 20 | AU11: 20 | AV11: 20 | AW11: 20 | AX11: 20 | AY11: 20 | AZ11: 20 | BA11: 20 | BB11: 20 | BC11: 20 | BD11: 20 | BE11: 20 | BF11: 20 | BG11: 20 | BH11: 20 | BI11: 20 | BJ11: 20 | BK11: 20 | BL11: 20 | BM11: 20 | BN11: 20 | BO11: 20 | BP11: 20 | BQ11: 20 | BR11: 20 | BS11: 20 | BT11: 20 | BU11: 20 | BV11: 20 | BW11: 20 | BX11: 20 | BY11: 20 | BZ11: 20 | CA11: 20 | CB11: 20 | CC11: 20 | CD11: 20 | CE11: 20 | CF11: 20 | CG11: 20 | CH11: 20 | CI11: 20 | CJ11: 20 | CK11: 20 | CL11: 20 | CM11: 20 | CN11: 20 | CO11: 20 | CP11: 20 | CQ11: 20 | CR11: 20 | CS11: 20 | CT11: 20 | CU11: 20 | CV11: 20 | CW11: =FIB(RC[-100]) -> 10946 | CX11: =FIB(RC[-100]) -> 10946 | CY11: =FIB(RC[-100]) -> 10946 | CZ11: =FIB(RC[-100]) -> 10946 | DA11: =FIB(RC[-100]) -> 10946 | DB11: =FIB(RC[-100]) -> 10946 | DC11: =FIB(RC[-100]) -> 10946 | DD11: =FIB(RC[-100]) -> 10946 | DE11: =FIB(RC[-100]) -> 10946 | DF11: =FIB(RC[-100]) -> 10946 | DG11: =FIB(RC[-100]) -> 10946 | DH11: =FIB(RC[-100]) -> 10946 | DI11: =FIB(RC[-100]) -> 10946 | DJ11: =FIB(RC[-100]) -> 10946 | DK11: =FIB(RC[-100]) -> 10946 | DL11: =FIB(RC[-100]) -> 10946 | DM11: =FIB(RC[-100]) -> 10946 | DN11: =FIB(RC[-100]) -> 10946 | DO11: =FIB(RC[-100]) -> 10946 | DP11: =FIB(RC[-100]) -> 10946 | DQ11: =FIB(RC[-100]) -> 10946 | DR11: =FIB(RC[-100]) -> 10946 | DS11: =FIB(RC[-100]) -> 10946 | DT11: =FIB(RC[-100]) -> 10946 | DU11: =FIB(RC[-100]) -> 10946 | DV11: =FIB(RC[-100]) -> 10946 | DW11: =FIB(RC[-100]) -> 10946 | DX11: =FIB(RC[-100]) -> 10946 | DY11: =FIB(RC[-100]) -> 10946 | DZ11: =FIB(RC[-100]) -> 10946 | EA11: =FIB(RC[-100]) -> 10946 | EB11: =FIB(RC[-100]) -> 10946 | EC11: =FIB(RC[-100]) -> 10946 | ED11: =FIB(RC[-100]) -> 10946 | EE11: =FIB(RC[-100]) -> 10946 | EF11: =FIB(RC[-100]) -> 10946 | EG11: =FIB(RC[-100]) -> 10946 | EH11: =FIB(RC[-100]) -> 10946 | EI11: =FIB(RC[-100]) -> 10946 | EJ11: =FIB(RC[-100]) -> 10946 | EK11: =FIB(RC[-100]) -> 10946 | EL11: =FIB(RC[-100]) -> 10946 | EM11: =FIB(RC[-100]) -> 10946 | EN11: =FIB(RC[-100]) -> 10946 | EO11: =FIB(RC[-100]) -> 10946 | EP11: =FIB(RC[-100]) -> 10946 | EQ11: =FIB(RC[-100]) -> 10946 | ER11: =FIB(RC[-100]) -> 10946 | ES11: =FIB(RC[-100]) -> 10946 | ET11: =FIB(RC[-100]) -> 10946 | EU11: =FIB(RC[-100]) -> 10946 | EV11: =FIB(RC[-100]) -> 10946 | EW11: =FIB(RC[-100]) -> 10946 | EX11: =FIB(RC[-100]) -> 10946 | EY11: =FIB(RC[-100]) -> 10946 | EZ11: =FIB(RC[-100]) -> 10946 | FA11: =FIB(RC[-100]) -> 10946 | FB11: =FIB(RC[-100]) -> 10946 | FC11: =FIB(RC[-100]) -> 10946 | FD11: =FIB(RC[-100]) -> 10946 | FE11: =FIB(RC[-100]) -> 10946 | FF11: =FIB(RC[-100]) -> 10946 | FG11: =FIB(RC[-100]) -> 10946 | FH11: =FIB(RC[-100]) -> 10946 | FI11: =FIB(RC[-100]) -> 10946 | FJ11: =FIB(RC[-100]) -> 10946 | FK11: =FIB(RC[-100]) -> 10946 | FL11: =FIB(RC[-100]) -> 10946 | FM11: =FIB(RC[-100]) -> 10946 | FN11: =FIB(RC[-100]) -> 10946 | FO11: =FIB(RC[-100]) -> 10946 | FP11: =FIB(RC[-100]) -> 10946 | FQ11: =FIB(RC[-100]) -> 10946 | FR11: =FIB(RC[-100]) -> 10946 | FS11: =FIB(RC[-100]) -> 10946 | FT11: =FIB(RC[-100]) -> 10946 | FU11: =FIB(RC[-100]) -> 10946 | FV11: =FIB(RC[-100]) -> 10946 | FW11: =FIB(RC[-100]) -> 10946 | FX11: =FIB(RC[-100]) -> 10946 | FY11: =FIB(RC[-100]) -> 10946 | FZ11: =FIB(RC[-100]) -> 10946 | GA11: =FIB(RC[-100]) -> 10946 | GB11: =FIB(RC[-100]) -> 10946 | GC11: =FIB(RC[-100]) -> 10946 | GD11: =FIB(RC[-100]) -> 10946 | GE11: =FIB(RC[-100]) -> 10946 | GF11: =FIB(RC[-100]) -> 10946 | GG11: =FIB(RC[-100]) -> 10946 | GH11: =FIB(RC[-100]) -> 10946 | GI11: =FIB(RC[-100]) -> 10946 | GJ11: =FIB(RC[-100]) -> 10946 | GK11: =FIB(RC[-100]) -> 10946 | GL11: =FIB(RC[-100]) -> 10946 | GM11: =FIB(RC[-100]) -> 10946 | GN11: =FIB(RC[-100]) -> 10946 | GO11: =FIB(RC[-100]) -> 10946 | GP11: =FIB(RC[-100]) -> 10946 | GQ11: =FIB(RC[-100]) -> 10946 | GR11: =FIB(RC[-100]) -> 10946
A12: 20 | B12: 20 | C12: 20 | D12: 20 | E12: 20 | F12: 20 | G12: 20 | H12: 20 | I12: 20 | J12: 20 | K12: 20 | L12: 20 | M12: 20 | N12: 20 | O12: 20 | P12: 20 | Q12: 20 | R12: 20 | S12: 20 | T12: 20 | U12: 20 | V12: 20 | W12: 20 | X12: 20 | Y12: 20 | Z12: 20 | AA12: 20 | AB12: 20 | AC12: 20 | AD12: 20 | AE12: 20 | AF12: 20 | AG12: 20 | AH12: 20 | AI12: 20 | AJ12: 20 | AK12: 20 | AL12: 20 | AM12: 20 | AN12: 20 | AO12: 20 | AP12: 20 | AQ12: 20 | AR12: 20 | AS12: 20 | AT12: 20 | AU12: 20 | AV12: 20 | AW12: 20 | AX12: 20 | AY12: 20 | AZ12: 20 | BA12: 20 | BB12: 20 | BC12: 20 | BD12: 20 | BE12: 20 | BF12: 20 | BG12: 20 | BH12: 20 | BI12: 20 | BJ12: 20 | BK12: 20 | BL12: 20 | BM12: 20 | BN12: 20 | BO12: 20 | BP12: 20 | BQ12: 20 | BR12: 20 | BS12: 20 | BT12: 20 | BU12: 20 | BV12: 20 | BW12: 20 | BX12: 20 | BY12: 20 | BZ12: 20 | CA12: 20 | CB12: 20 | CC12: 20 | CD12: 20 | CE12: 20 | CF12: 20 | CG12: 20 | CH12: 20 | CI12: 20 | CJ12: 20 | CK12: 20 | CL12: 20 | CM12: 20 | CN12: 20 | CO12: 20 | CP12: 20 | CQ12: 20 | CR12: 20 | CS12: 20 | CT12: 20 | CU12: 20 | CV12: 20 | CW12: =FIB(RC[-100]) -> 10946 | CX12: =FIB(RC[-100]) -> 10946 | CY12: =FIB(RC[-100]) -> 10946 | CZ12: =FIB(RC[-100]) -> 10946 | DA12: =FIB(RC[-100]) -> 10946 | DB12: =FIB(RC[-100]) -> 10946 | DC12: =FIB(RC[-100]) -> 10946 | DD12: =FIB(RC[-100]) -> 10946 | DE12: =FIB(RC[-100]) -> 10946 | DF12: =FIB(RC[-100]) -> 10946 | DG12: =FIB(RC[-100]) -> 10946 | DH12: =FIB(RC[-100]) -> 10946 | DI12: =FIB(RC[-100]) -> 10946 | DJ12: =FIB(RC[-100]) -> 10946 | DK12: =FIB(RC[-100]) -> 10946 | DL12: =FIB(RC[-100]) -> 10946 | DM12: =FIB(RC[-100]) -> 10946 | DN12: =FIB(RC[-100]) -> 10946 | DO12: =FIB(RC[-100]) -> 10946 | DP12: =FIB(RC[-100]) -> 10946 | DQ12: =FIB(RC[-100]) -> 10946 | DR12: =FIB(RC[-100]) -> 10946 | DS12: =FIB(RC[-100]) -> 10946 | DT12: =FIB(RC[-100]) -> 10946 | DU12: =FIB(RC[-100]) -> 10946 | DV12: =FIB(RC[-100]) -> 10946 | DW12: =FIB(RC[-100]) -> 10946 | DX12: =FIB(RC[-100]) -> 10946 | DY12: =FIB(RC[-100]) -> 10946 | DZ12: =FIB(RC[-100]) -> 10946 | EA12: =FIB(RC[-100]) -> 10946 | EB12: =FIB(RC[-100]) -> 10946 | EC12: =FIB(RC[-100]) -> 10946 | ED12: =FIB(RC[-100]) -> 10946 | EE12: =FIB(RC[-100]) -> 10946 | EF12: =FIB(RC[-100]) -> 10946 | EG12: =FIB(RC[-100]) -> 10946 | EH12: =FIB(RC[-100]) -> 10946 | EI12: =FIB(RC[-100]) -> 10946 | EJ12: =FIB(RC[-100]) -> 10946 | EK12: =FIB(RC[-100]) -> 10946 | EL12: =FIB(RC[-100]) -> 10946 | EM12: =FIB(RC[-100]) -> 10946 | EN12: =FIB(RC[-100]) -> 10946 | EO12: =FIB(RC[-100]) -> 10946 | EP12: =FIB(RC[-100]) -> 10946 | EQ12: =FIB(RC[-100]) -> 10946 | ER12: =FIB(RC[-100]) -> 10946 | ES12: =FIB(RC[-100]) -> 10946 | ET12: =FIB(RC[-100]) -> 10946 | EU12: =FIB(RC[-100]) -> 10946 | EV12: =FIB(RC[-100]) -> 10946 | EW12: =FIB(RC[-100]) -> 10946 | EX12: =FIB(RC[-100]) -> 10946 | EY12: =FIB(RC[-100]) -> 10946 | EZ12: =FIB(RC[-100]) -> 10946 | FA12: =FIB(RC[-100]) -> 10946 | FB12: =FIB(RC[-100]) -> 10946 | FC12: =FIB(RC[-100]) -> 10946 | FD12: =FIB(RC[-100]) -> 10946 | FE12: =FIB(RC[-100]) -> 10946 | FF12: =FIB(RC[-100]) -> 10946 | FG12: =FIB(RC[-100]) -> 10946 | FH12: =FIB(RC[-100]) -> 10946 | FI12: =FIB(RC[-100]) -> 10946 | FJ12: =FIB(RC[-100]) -> 10946 | FK12: =FIB(RC[-100]) -> 10946 | FL12: =FIB(RC[-100]) -> 10946 | FM12: =FIB(RC[-100]) -> 10946 | FN12: =FIB(RC[-100]) -> 10946 | FO12: =FIB(RC[-100]) -> 10946 | FP12: =FIB(RC[-100]) -> 10946 | FQ12: =FIB(RC[-100]) -> 10946 | FR12: =FIB(RC[-100]) -> 10946 | FS12: =FIB(RC[-100]) -> 10946 | FT12: =FIB(RC[-100]) -> 10946 | FU12: =FIB(RC[-100]) -> 10946 | FV12: =FIB(RC[-100]) -> 10946 | FW12: =FIB(RC[-100]) -> 10946 | FX12: =FIB(RC[-100]) -> 10946 | FY12: =FIB(RC[-100]) -> 10946 | FZ12: =FIB(RC[-100]) -> 10946 | GA12: =FIB(RC[-100]) -> 10946 | GB12: =FIB(RC[-100]) -> 10946 | GC12: =FIB(RC[-100]) -> 10946 | GD12: =FIB(RC[-100]) -> 10946 | GE12: =FIB(RC[-100]) -> 10946 | GF12: =FIB(RC[-100]) -> 10946 | GG12: =FIB(RC[-100]) -> 10946 | GH12: =FIB(RC[-100]) -> 10946 | GI12: =FIB(RC[-100]) -> 10946 | GJ12: =FIB(RC[-100]) -> 10946 | GK12: =FIB(RC[-100]) -> 10946 | GL12: =FIB(RC[-100]) -> 10946 | GM12: =FIB(RC[-100]) -> 10946 | GN12: =FIB(RC[-100]) -> 10946 | GO12: =FIB(RC[-100]) -> 10946 | GP12: =FIB(RC[-100]) -> 10946 | GQ12: =FIB(RC[-100]) -> 10946 | GR12: =FIB(RC[-100]) -> 10946
A13: 20 | B13: 20 | C13: 20 | D13: 20 | E13: 20 | F13: 20 | G13: 20 | H13: 20 | I13: 20 | J13: 20 | K13: 20 | L13: 20 | M13: 20 | N13: 20 | O13: 20 | P13: 20 | Q13: 20 | R13: 20 | S13: 20 | T13: 20 | U13: 20 | V13: 20 | W13: 20 | X13: 20 | Y13: 20 | Z13: 20 | AA13: 20 | AB13: 20 | AC13: 20 | AD13: 20 | AE13: 20 | AF13: 20 | AG13: 20 | AH13: 20 | AI13: 20 | AJ13: 20 | AK13: 20 | AL13: 20 | AM13: 20 | AN13: 20 | AO13: 20 | AP13: 20 | AQ13: 20 | AR13: 20 | AS13: 20 | AT13: 20 | AU13: 20 | AV13: 20 | AW13: 20 | AX13: 20 | AY13: 20 | AZ13: 20 | BA13: 20 | BB13: 20 | BC13: 20 | BD13: 20 | BE13: 20 | BF13: 20 | BG13: 20 | BH13: 20 | BI13: 20 | BJ13: 20 | BK13: 20 | BL13: 20 | BM13: 20 | BN13: 20 | BO13: 20 | BP13: 20 | BQ13: 20 | BR13: 20 | BS13: 20 | BT13: 20 | BU13: 20 | BV13: 20 | BW13: 20 | BX13: 20 | BY13: 20 | BZ13: 20 | CA13: 20 | CB13: 20 | CC13: 20 | CD13: 20 | CE13: 20 | CF13: 20 | CG13: 20 | CH13: 20 | CI13: 20 | CJ13: 20 | CK13: 20 | CL13: 20 | CM13: 20 | CN13: 20 | CO13: 20 | CP13: 20 | CQ13: 20 | CR13: 20 | CS13: 20 | CT13: 20 | CU13: 20 | CV13: 20 | CW13: =FIB(RC[-100]) -> 10946 | CX13: =FIB(RC[-100]) -> 10946 | CY13: =FIB(RC[-100]) -> 10946 | CZ13: =FIB(RC[-100]) -> 10946 | DA13: =FIB(RC[-100]) -> 10946 | DB13: =FIB(RC[-100]) -> 10946 | DC13: =FIB(RC[-100]) -> 10946 | DD13: =FIB(RC[-100]) -> 10946 | DE13: =FIB(RC[-100]) -> 10946 | DF13: =FIB(RC[-100]) -> 10946 | DG13: =FIB(RC[-100]) -> 10946 | DH13: =FIB(RC[-100]) -> 10946 | DI13: =FIB(RC[-100]) -> 10946 | DJ13: =FIB(RC[-100]) -> 10946 | DK13: =FIB(RC[-100]) -> 10946 | DL13: =FIB(RC[-100]) -> 10946 | DM13: =FIB(RC[-100]) -> 10946 | DN13: =FIB(RC[-100]) -> 10946 | DO13: =FIB(RC[-100]) -> 10946 | DP13: =FIB(RC[-100]) -> 10946 | DQ13: =FIB(RC[-100]) -> 10946 | DR13: =FIB(RC[-100]) -> 10946 | DS13: =FIB(RC[-100]) -> 10946 | DT13: =FIB(RC[-100]) -> 10946 | DU13: =FIB(RC[-100]) -> 10946 | DV13: =FIB(RC[-100]) -> 10946 | DW13: =FIB(RC[-100]) -> 10946 | DX13: =FIB(RC[-100]) -> 10946 | DY13: =FIB(RC[-100]) -> 10946 | DZ13: =FIB(RC[-100]) -> 10946 | EA13: =FIB(RC[-100]) -> 10946 | EB13: =FIB(RC[-100]) -> 10946 | EC13: =FIB(RC[-100]) -> 10946 | ED13: =FIB(RC[-100]) -> 10946 | EE13: =FIB(RC[-100]) -> 10946 | EF13: =FIB(RC[-100]) -> 10946 | EG13: =FIB(RC[-100]) -> 10946 | EH13: =FIB(RC[-100]) -> 10946 | EI13: =FIB(RC[-100]) -> 10946 | EJ13: =FIB(RC[-100]) -> 10946 | EK13: =FIB(RC[-100]) -> 10946 | EL13: =FIB(RC[-100]) -> 10946 | EM13: =FIB(RC[-100]) -> 10946 | EN13: =FIB(RC[-100]) -> 10946 | EO13: =FIB(RC[-100]) -> 10946 | EP13: =FIB(RC[-100]) -> 10946 | EQ13: =FIB(RC[-100]) -> 10946 | ER13: =FIB(RC[-100]) -> 10946 | ES13: =FIB(RC[-100]) -> 10946 | ET13: =FIB(RC[-100]) -> 10946 | EU13: =FIB(RC[-100]) -> 10946 | EV13: =FIB(RC[-100]) -> 10946 | EW13: =FIB(RC[-100]) -> 10946 | EX13: =FIB(RC[-100]) -> 10946 | EY13: =FIB(RC[-100]) -> 10946 | EZ13: =FIB(RC[-100]) -> 10946 | FA13: =FIB(RC[-100]) -> 10946 | FB13: =FIB(RC[-100]) -> 10946 | FC13: =FIB(RC[-100]) -> 10946 | FD13: =FIB(RC[-100]) -> 10946 | FE13: =FIB(RC[-100]) -> 10946 | FF13: =FIB(RC[-100]) -> 10946 | FG13: =FIB(RC[-100]) -> 10946 | FH13: =FIB(RC[-100]) -> 10946 | FI13: =FIB(RC[-100]) -> 10946 | FJ13: =FIB(RC[-100]) -> 10946 | FK13: =FIB(RC[-100]) -> 10946 | FL13: =FIB(RC[-100]) -> 10946 | FM13: =FIB(RC[-100]) -> 10946 | FN13: =FIB(RC[-100]) -> 10946 | FO13: =FIB(RC[-100]) -> 10946 | FP13: =FIB(RC[-100]) -> 10946 | FQ13: =FIB(RC[-100]) -> 10946 | FR13: =FIB(RC[-100]) -> 10946 | FS13: =FIB(RC[-100]) -> 10946 | FT13: =FIB(RC[-100]) -> 10946 | FU13: =FIB(RC[-100]) -> 10946 | FV13: =FIB(RC[-100]) -> 10946 | FW13: =FIB(RC[-100]) -> 10946 | FX13: =FIB(RC[-100]) -> 10946 | FY13: =FIB(RC[-100]) -> 10946 | FZ13: =FIB(RC[-100]) -> 10946 | GA13: =FIB(RC[-100]) -> 10946 | GB13: =FIB(RC[-100]) -> 10946 | GC13: =FIB(RC[-100]) -> 10946 | GD13: =FIB(RC[-100]) -> 10946 | GE13: =FIB(RC[-100]) -> 10946 | GF13: =FIB(RC[-100]) -> 10946 | GG13: =FIB(RC[-100]) -> 10946 | GH13: =FIB(RC[-100]) -> 10946 | GI13: =FIB(RC[-100]) -> 10946 | GJ13: =FIB(RC[-100]) -> 10946 | GK13: =FIB(RC[-100]) -> 10946 | GL13: =FIB(RC[-100]) -> 10946 | GM13: =FIB(RC[-100]) -> 10946 | GN13: =FIB(RC[-100]) -> 10946 | GO13: =FIB(RC[-100]) -> 10946 | GP13: =FIB(RC[-100]) -> 10946 | GQ13: =FIB(RC[-100]) -> 10946 | GR13: =FIB(RC[-100]) -> 10946
A14: 20 | B14: 20 | C14: 20 | D14: 20 | E14: 20 | F14: 20 | G14: 20 | H14: 20 | I14: 20 | J14: 20 | K14: 20 | L14: 20 | M14: 20 | N14: 20 | O14: 20 | P14: 20 | Q14: 20 | R14: 20 | S14: 20 | T14: 20 | U14: 20 | V14: 20 | W14: 20 | X14: 20 | Y14: 20 | Z14: 20 | AA14: 20 | AB14: 20 | AC14: 20 | AD14: 20 | AE14: 20 | AF14: 20 | AG14: 20 | AH14: 20 | AI14: 20 | AJ14: 20 | AK14: 20 | AL14: 20 | AM14: 20 | AN14: 20 | AO14: 20 | AP14: 20 | AQ14: 20 | AR14: 20 | AS14: 20 | AT14: 20 | AU14: 20 | AV14: 20 | AW14: 20 | AX14: 20 | AY14: 20 | AZ14: 20 | BA14: 20 | BB14: 20 | BC14: 20 | BD14: 20 | BE14: 20 | BF14: 20 | BG14: 20 | BH14: 20 | BI14: 20 | BJ14: 20 | BK14: 20 | BL14: 20 | BM14: 20 | BN14: 20 | BO14: 20 | BP14: 20 | BQ14: 20 | BR14: 20 | BS14: 20 | BT14: 20 | BU14: 20 | BV14: 20 | BW14: 20 | BX14: 20 | BY14: 20 | BZ14: 20 | CA14: 20 | CB14: 20 | CC14: 20 | CD14: 20 | CE14: 20 | CF14: 20 | CG14: 20 | CH14: 20 | CI14: 20 | CJ14: 20 | CK14: 20 | CL14: 20 | CM14: 20 | CN14: 20 | CO14: 20 | CP14: 20 | CQ14: 20 | CR14: 20 | CS14: 20 | CT14: 20 | CU14: 20 | CV14: 20 | CW14: =FIB(RC[-100]) -> 10946 | CX14: =FIB(RC[-100]) -> 10946 | CY14: =FIB(RC[-100]) -> 10946 | CZ14: =FIB(RC[-100]) -> 10946 | DA14: =FIB(RC[-100]) -> 10946 | DB14: =FIB(RC[-100]) -> 10946 | DC14: =FIB(RC[-100]) -> 10946 | DD14: =FIB(RC[-100]) -> 10946 | DE14: =FIB(RC[-100]) -> 10946 | DF14: =FIB(RC[-100]) -> 10946 | DG14: =FIB(RC[-100]) -> 10946 | DH14: =FIB(RC[-100]) -> 10946 | DI14: =FIB(RC[-100]) -> 10946 | DJ14: =FIB(RC[-100]) -> 10946 | DK14: =FIB(RC[-100]) -> 10946 | DL14: =FIB(RC[-100]) -> 10946 | DM14: =FIB(RC[-100]) -> 10946 | DN14: =FIB(RC[-100]) -> 10946 | DO14: =FIB(RC[-100]) -> 10946 | DP14: =FIB(RC[-100]) -> 10946 | DQ14: =FIB(RC[-100]) -> 10946 | DR14: =FIB(RC[-100]) -> 10946 | DS14: =FIB(RC[-100]) -> 10946 | DT14: =FIB(RC[-100]) -> 10946 | DU14: =FIB(RC[-100]) -> 10946 | DV14: =FIB(RC[-100]) -> 10946 | DW14: =FIB(RC[-100]) -> 10946 | DX14: =FIB(RC[-100]) -> 10946 | DY14: =FIB(RC[-100]) -> 10946 | DZ14: =FIB(RC[-100]) -> 10946 | EA14: =FIB(RC[-100]) -> 10946 | EB14: =FIB(RC[-100]) -> 10946 | EC14: =FIB(RC[-100]) -> 10946 | ED14: =FIB(RC[-100]) -> 10946 | EE14: =FIB(RC[-100]) -> 10946 | EF14: =FIB(RC[-100]) -> 10946 | EG14: =FIB(RC[-100]) -> 10946 | EH14: =FIB(RC[-100]) -> 10946 | EI14: =FIB(RC[-100]) -> 10946 | EJ14: =FIB(RC[-100]) -> 10946 | EK14: =FIB(RC[-100]) -> 10946 | EL14: =FIB(RC[-100]) -> 10946 | EM14: =FIB(RC[-100]) -> 10946 | EN14: =FIB(RC[-100]) -> 10946 | EO14: =FIB(RC[-100]) -> 10946 | EP14: =FIB(RC[-100]) -> 10946 | EQ14: =FIB(RC[-100]) -> 10946 | ER14: =FIB(RC[-100]) -> 10946 | ES14: =FIB(RC[-100]) -> 10946 | ET14: =FIB(RC[-100]) -> 10946 | EU14: =FIB(RC[-100]) -> 10946 | EV14: =FIB(RC[-100]) -> 10946 | EW14: =FIB(RC[-100]) -> 10946 | EX14: =FIB(RC[-100]) -> 10946 | EY14: =FIB(RC[-100]) -> 10946 | EZ14: =FIB(RC[-100]) -> 10946 | FA14: =FIB(RC[-100]) -> 10946 | FB14: =FIB(RC[-100]) -> 10946 | FC14: =FIB(RC[-100]) -> 10946 | FD14: =FIB(RC[-100]) -> 10946 | FE14: =FIB(RC[-100]) -> 10946 | FF14: =FIB(RC[-100]) -> 10946 | FG14: =FIB(RC[-100]) -> 10946 | FH14: =FIB(RC[-100]) -> 10946 | FI14: =FIB(RC[-100]) -> 10946 | FJ14: =FIB(RC[-100]) -> 10946 | FK14: =FIB(RC[-100]) -> 10946 | FL14: =FIB(RC[-100]) -> 10946 | FM14: =FIB(RC[-100]) -> 10946 | FN14: =FIB(RC[-100]) -> 10946 | FO14: =FIB(RC[-100]) -> 10946 | FP14: =FIB(RC[-100]) -> 10946 | FQ14: =FIB(RC[-100]) -> 10946 | FR14: =FIB(RC[-100]) -> 10946 | FS14: =FIB(RC[-100]) -> 10946 | FT14: =FIB(RC[-100]) -> 10946 | FU14: =FIB(RC[-100]) -> 10946 | FV14: =FIB(RC[-100]) -> 10946 | FW14: =FIB(RC[-100]) -> 10946 | FX14: =FIB(RC[-100]) -> 10946 | FY14: =FIB(RC[-100]) -> 10946 | FZ14: =FIB(RC[-100]) -> 10946 | GA14: =FIB(RC[-100]) -> 10946 | GB14: =FIB(RC[-100]) -> 10946 | GC14: =FIB(RC[-100]) -> 10946 | GD14: =FIB(RC[-100]) -> 10946 | GE14: =FIB(RC[-100]) -> 10946 | GF14: =FIB(RC[-100]) -> 10946 | GG14: =FIB(RC[-100]) -> 10946 | GH14: =FIB(RC[-100]) -> 10946 | GI14: =FIB(RC[-100]) -> 10946 | GJ14: =FIB(RC[-100]) -> 10946 | GK14: =FIB(RC[-100]) -> 10946 | GL14: =FIB(RC[-100]) -> 10946 | GM14: =FIB(RC[-100]) -> 10946 | GN14: =FIB(RC[-100]) -> 10946 | GO14: =FIB(RC[-100]) -> 10946 | GP14: =FIB(RC[-100]) -> 10946 | GQ14: =FIB(RC[-100]) -> 10946 | GR14: =FIB(RC[-100]) -> 10946
A15: 20 | B15: 20 | C15: 20 | D15: 20 | E15: 20 | F15: 20 | G15: 20 | H15: 20 | I15: 20 | J15: 20 | K15: 20 | L15: 20 | M15: 20 | N15: 20 | O15: 20 | P15: 20 | Q15: 20 | R15: 20 | S15: 20 | T15: 20 | U15: 20 | V15: 20 | W15: 20 | X15: 20 | Y15: 20 | Z15: 20 | AA15: 20 | AB15: 20 | AC15: 20 | AD15: 20 | AE15: 20 | AF15: 20 | AG15: 20 | AH15: 20 | AI15: 20 | AJ15: 20 | AK15: 20 | AL15: 20 | AM15: 20 | AN15: 20 | AO15: 20 | AP15: 20 | AQ15: 20 | AR15: 20 | AS15: 20 | AT15: 20 | AU15: 20 | AV15: 20 | AW15: 20 | AX15: 20 | AY15: 20 | AZ15: 20 | BA15: 20 | BB15: 20 | BC15: 20 | BD15: 20 | BE15: 20 | BF15: 20 | BG15: 20 | BH15: 20 | BI15: 20 | BJ15: 20 | BK15: 20 | BL15: 20 | BM15: 20 | BN15: 20 | BO15: 20 | BP15: 20 | BQ15: 20 | BR15: 20 | BS15: 20 | BT15: 20 | BU15: 20 | BV15: 20 | BW15: 20 | BX15: 20 | BY15: 20 | BZ15: 20 | CA15: 20 | CB15: 20 | CC15: 20 | CD15: 20 | CE15: 20 | CF15: 20 | CG15: 20 | CH15: 20 | CI15: 20 | CJ15: 20 | CK15: 20 | CL15: 20 | CM15: 20 | CN15: 20 | CO15: 20 | CP15: 20 | CQ15: 20 | CR15: 20 | CS15: 20 | CT15: 20 | CU15: 20 | CV15: 20 | CW15: =FIB(RC[-100]) -> 10946 | CX15: =FIB(RC[-100]) -> 10946 | CY15: =FIB(RC[-100]) -> 10946 | CZ15: =FIB(RC[-100]) -> 10946 | DA15: =FIB(RC[-100]) -> 10946 | DB15: =FIB(RC[-100]) -> 10946 | DC15: =FIB(RC[-100]) -> 10946 | DD15: =FIB(RC[-100]) -> 10946 | DE15: =FIB(RC[-100]) -> 10946 | DF15: =FIB(RC[-100]) -> 10946 | DG15: =FIB(RC[-100]) -> 10946 | DH15: =FIB(RC[-100]) -> 10946 | DI15: =FIB(RC[-100]) -> 10946 | DJ15: =FIB(RC[-100]) -> 10946 | DK15: =FIB(RC[-100]) -> 10946 | DL15: =FIB(RC[-100]) -> 10946 | DM15: =FIB(RC[-100]) -> 10946 | DN15: =FIB(RC[-100]) -> 10946 | DO15: =FIB(RC[-100]) -> 10946 | DP15: =FIB(RC[-100]) -> 10946 | DQ15: =FIB(RC[-100]) -> 10946 | DR15: =FIB(RC[-100]) -> 10946 | DS15: =FIB(RC[-100]) -> 10946 | DT15: =FIB(RC[-100]) -> 10946 | DU15: =FIB(RC[-100]) -> 10946 | DV15: =FIB(RC[-100]) -> 10946 | DW15: =FIB(RC[-100]) -> 10946 | DX15: =FIB(RC[-100]) -> 10946 | DY15: =FIB(RC[-100]) -> 10946 | DZ15: =FIB(RC[-100]) -> 10946 | EA15: =FIB(RC[-100]) -> 10946 | EB15: =FIB(RC[-100]) -> 10946 | EC15: =FIB(RC[-100]) -> 10946 | ED15: =FIB(RC[-100]) -> 10946 | EE15: =FIB(RC[-100]) -> 10946 | EF15: =FIB(RC[-100]) -> 10946 | EG15: =FIB(RC[-100]) -> 10946 | EH15: =FIB(RC[-100]) -> 10946 | EI15: =FIB(RC[-100]) -> 10946 | EJ15: =FIB(RC[-100]) -> 10946 | EK15: =FIB(RC[-100]) -> 10946 | EL15: =FIB(RC[-100]) -> 10946 | EM15: =FIB(RC[-100]) -> 10946 | EN15: =FIB(RC[-100]) -> 10946 | EO15: =FIB(RC[-100]) -> 10946 | EP15: =FIB(RC[-100]) -> 10946 | EQ15: =FIB(RC[-100]) -> 10946 | ER15: =FIB(RC[-100]) -> 10946 | ES15: =FIB(RC[-100]) -> 10946 | ET15: =FIB(RC[-100]) -> 10946 | EU15: =FIB(RC[-100]) -> 10946 | EV15: =FIB(RC[-100]) -> 10946 | EW15: =FIB(RC[-100]) -> 10946 | EX15: =FIB(RC[-100]) -> 10946 | EY15: =FIB(RC[-100]) -> 10946 | EZ15: =FIB(RC[-100]) -> 10946 | FA15: =FIB(RC[-100]) -> 10946 | FB15: =FIB(RC[-100]) -> 10946 | FC15: =FIB(RC[-100]) -> 10946 | FD15: =FIB(RC[-100]) -> 10946 | FE15: =FIB(RC[-100]) -> 10946 | FF15: =FIB(RC[-100]) -> 10946 | FG15: =FIB(RC[-100]) -> 10946 | FH15: =FIB(RC[-100]) -> 10946 | FI15: =FIB(RC[-100]) -> 10946 | FJ15: =FIB(RC[-100]) -> 10946 | FK15: =FIB(RC[-100]) -> 10946 | FL15: =FIB(RC[-100]) -> 10946 | FM15: =FIB(RC[-100]) -> 10946 | FN15: =FIB(RC[-100]) -> 10946 | FO15: =FIB(RC[-100]) -> 10946 | FP15: =FIB(RC[-100]) -> 10946 | FQ15: =FIB(RC[-100]) -> 10946 | FR15: =FIB(RC[-100]) -> 10946 | FS15: =FIB(RC[-100]) -> 10946 | FT15: =FIB(RC[-100]) -> 10946 | FU15: =FIB(RC[-100]) -> 10946 | FV15: =FIB(RC[-100]) -> 10946 | FW15: =FIB(RC[-100]) -> 10946 | FX15: =FIB(RC[-100]) -> 10946 | FY15: =FIB(RC[-100]) -> 10946 | FZ15: =FIB(RC[-100]) -> 10946 | GA15: =FIB(RC[-100]) -> 10946 | GB15: =FIB(RC[-100]) -> 10946 | GC15: =FIB(RC[-100]) -> 10946 | GD15: =FIB(RC[-100]) -> 10946 | GE15: =FIB(RC[-100]) -> 10946 | GF15: =FIB(RC[-100]) -> 10946 | GG15: =FIB(RC[-100]) -> 10946 | GH15: =FIB(RC[-100]) -> 10946 | GI15: =FIB(RC[-100]) -> 10946 | GJ15: =FIB(RC[-100]) -> 10946 | GK15: =FIB(RC[-100]) -> 10946 | GL15: =FIB(RC[-100]) -> 10946 | GM15: =FIB(RC[-100]) -> 10946 | GN15: =FIB(RC[-100]) -> 10946 | GO15: =FIB(RC[-100]) -> 10946 | GP15: =FIB(RC[-100]) -> 10946 | GQ15: =FIB(RC[-100]) -> 10946 | GR15: =FIB(RC[-100]) -> 10946
A16: 20 | B16: 20 | C16: 20 | D16: 20 | E16: 20 | F16: 20 | G16: 20 | H16: 20 | I16: 20 | J16: 20 | K16: 20 | L16: 20 | M16: 20 | N16: 20 | O16: 20 | P16: 20 | Q16: 20 | R16: 20 | S16: 20 | T16: 20 | U16: 20 | V16: 20 | W16: 20 | X16: 20 | Y16: 20 | Z16: 20 | AA16: 20 | AB16: 20 | AC16: 20 | AD16: 20 | AE16: 20 | AF16: 20 | AG16: 20 | AH16: 20 | AI16: 20 | AJ16: 20 | AK16: 20 | AL16: 20 | AM16: 20 | AN16: 20 | AO16: 20 | AP16: 20 | AQ16: 20 | AR16: 20 | AS16: 20 | AT16: 20 | AU16: 20 | AV16: 20 | AW16: 20 | AX16: 20 | AY16: 20 | AZ16: 20 | BA16: 20 | BB16: 20 | BC16: 20 | BD16: 20 | BE16: 20 | BF16: 20 | BG16: 20 | BH16: 20 | BI16: 20 | BJ16: 20 | BK16: 20 | BL16: 20 | BM16: 20 | BN16: 20 | BO16: 20 | BP16: 20 | BQ16: 20 | BR16: 20 | BS16: 20 | BT16: 20 | BU16: 20 | BV16: 20 | BW16: 20 | BX16: 20 | BY16: 20 | BZ16: 20 | CA16: 20 | CB16: 20 | CC16: 20 | CD16: 20 | CE16: 20 | CF16: 20 | CG16: 20 | CH16: 20 | CI16: 20 | CJ16: 20 | CK16: 20 | CL16: 20 | CM16: 20 | CN16: 20 | CO16: 20 | CP16: 20 | CQ16: 20 | CR16: 20 | CS16: 20 | CT16: 20 | CU16: 20 | CV16: 20 | CW16: =FIB(RC[-100]) -> 10946 | CX16: =FIB(RC[-100]) -> 10946 | CY16: =FIB(RC[-100]) -> 10946 | CZ16: =FIB(RC[-100]) -> 10946 | DA16: =FIB(RC[-100]) -> 10946 | DB16: =FIB(RC[-100]) -> 10946 | DC16: =FIB(RC[-100]) -> 10946 | DD16: =FIB(RC[-100]) -> 10946 | DE16: =FIB(RC[-100]) -> 10946 | DF16: =FIB(RC[-100]) -> 10946 | DG16: =FIB(RC[-100]) -> 10946 | DH16: =FIB(RC[-100]) -> 10946 | DI16: =FIB(RC[-100]) -> 10946 | DJ16: =FIB(RC[-100]) -> 10946 | DK16: =FIB(RC[-100]) -> 10946 | DL16: =FIB(RC[-100]) -> 10946 | DM16: =FIB(RC[-100]) -> 10946 | DN16: =FIB(RC[-100]) -> 10946 | DO16: =FIB(RC[-100]) -> 10946 | DP16: =FIB(RC[-100]) -> 10946 | DQ16: =FIB(RC[-100]) -> 10946 | DR16: =FIB(RC[-100]) -> 10946 | DS16: =FIB(RC[-100]) -> 10946 | DT16: =FIB(RC[-100]) -> 10946 | DU16: =FIB(RC[-100]) -> 10946 | DV16: =FIB(RC[-100]) -> 10946 | DW16: =FIB(RC[-100]) -> 10946 | DX16: =FIB(RC[-100]) -> 10946 | DY16: =FIB(RC[-100]) -> 10946 | DZ16: =FIB(RC[-100]) -> 10946 | EA16: =FIB(RC[-100]) -> 10946 | EB16: =FIB(RC[-100]) -> 10946 | EC16: =FIB(RC[-100]) -> 10946 | ED16: =FIB(RC[-100]) -> 10946 | EE16: =FIB(RC[-100]) -> 10946 | EF16: =FIB(RC[-100]) -> 10946 | EG16: =FIB(RC[-100]) -> 10946 | EH16: =FIB(RC[-100]) -> 10946 | EI16: =FIB(RC[-100]) -> 10946 | EJ16: =FIB(RC[-100]) -> 10946 | EK16: =FIB(RC[-100]) -> 10946 | EL16: =FIB(RC[-100]) -> 10946 | EM16: =FIB(RC[-100]) -> 10946 | EN16: =FIB(RC[-100]) -> 10946 | EO16: =FIB(RC[-100]) -> 10946 | EP16: =FIB(RC[-100]) -> 10946 | EQ16: =FIB(RC[-100]) -> 10946 | ER16: =FIB(RC[-100]) -> 10946 | ES16: =FIB(RC[-100]) -> 10946 | ET16: =FIB(RC[-100]) -> 10946 | EU16: =FIB(RC[-100]) -> 10946 | EV16: =FIB(RC[-100]) -> 10946 | EW16: =FIB(RC[-100]) -> 10946 | EX16: =FIB(RC[-100]) -> 10946 | EY16: =FIB(RC[-100]) -> 10946 | EZ16: =FIB(RC[-100]) -> 10946 | FA16: =FIB(RC[-100]) -> 10946 | FB16: =FIB(RC[-100]) -> 10946 | FC16: =FIB(RC[-100]) -> 10946 | FD16: =FIB(RC[-100]) -> 10946 | FE16: =FIB(RC[-100]) -> 10946 | FF16: =FIB(RC[-100]) -> 10946 | FG16: =FIB(RC[-100]) -> 10946 | FH16: =FIB(RC[-100]) -> 10946 | FI16: =FIB(RC[-100]) -> 10946 | FJ16: =FIB(RC[-100]) -> 10946 | FK16: =FIB(RC[-100]) -> 10946 | FL16: =FIB(RC[-100]) -> 10946 | FM16: =FIB(RC[-100]) -> 10946 | FN16: =FIB(RC[-100]) -> 10946 | FO16: =FIB(RC[-100]) -> 10946 | FP16: =FIB(RC[-100]) -> 10946 | FQ16: =FIB(RC[-100]) -> 10946 | FR16: =FIB(RC[-100]) -> 10946 | FS16: =FIB(RC[-100]) -> 10946 | FT16: =FIB(RC[-100]) -> 10946 | FU16: =FIB(RC[-100]) -> 10946 | FV16: =FIB(RC[-100]) -> 10946 | FW16: =FIB(RC[-100]) -> 10946 | FX16: =FIB(RC[-100]) -> 10946 | FY16: =FIB(RC[-100]) -> 10946 | FZ16: =FIB(RC[-100]) -> 10946 | GA16: =FIB(RC[-100]) -> 10946 | GB16: =FIB(RC[-100]) -> 10946 | GC16: =FIB(RC[-100]) -> 10946 | GD16: =FIB(RC[-100]) -> 10946 | GE16: =FIB(RC[-100]) -> 10946 | GF16: =FIB(RC[-100]) -> 10946 | GG16: =FIB(RC[-100]) -> 10946 | GH16: =FIB(RC[-100]) -> 10946 | GI16: =FIB(RC[-100]) -> 10946 | GJ16: =FIB(RC[-100]) -> 10946 | GK16: =FIB(RC[-100]) -> 10946 | GL16: =FIB(RC[-100]) -> 10946 | GM16: =FIB(RC[-100]) -> 10946 | GN16: =FIB(RC[-100]) -> 10946 | GO16: =FIB(RC[-100]) -> 10946 | GP16: =FIB(RC[-100]) -> 10946 | GQ16: =FIB(RC[-100]) -> 10946 | GR16: =FIB(RC[-100]) -> 10946
A17: 20 | B17: 20 | C17: 20 | D17: 20 | E17: 20 | F17: 20 | G17: 20 | H17: 20 | I17: 20 | J17: 20 | K17: 20 | L17: 20 | M17: 20 | N17: 20 | O17: 20 | P17: 20 | Q17: 20 | R17: 20 | S17: 20 | T17: 20 | U17: 20 | V17: 20 | W17: 20 | X17: 20 | Y17: 20 | Z17: 20 | AA17: 20 | AB17: 20 | AC17: 20 | AD17: 20 | AE17: 20 | AF17: 20 | AG17: 20 | AH17: 20 | AI17: 20 | AJ17: 20 | AK17: 20 | AL17: 20 | AM17: 20 | AN17: 20 | AO17: 20 | AP17: 20 | AQ17: 20 | AR17: 20 | AS17: 20 | AT17: 20 | AU17: 20 | AV17: 20 | AW17: 20 | AX17: 20 | AY17: 20 | AZ17: 20 | BA17: 20 | BB17: 20 | BC17: 20 | BD17: 20 | BE17: 20 | BF17: 20 | BG17: 20 | BH17: 20 | BI17: 20 | BJ17: 20 | BK17: 20 | BL17: 20 | BM17: 20 | BN17: 20 | BO17: 20 | BP17: 20 | BQ17: 20 | BR17: 20 | BS17: 20 | BT17: 20 | BU17: 20 | BV17: 20 | BW17: 20 | BX17: 20 | BY17: 20 | BZ17: 20 | CA17: 20 | CB17: 20 | CC17: 20 | CD17: 20 | CE17: 20 | CF17: 20 | CG17: 20 | CH17: 20 | CI17: 20 | CJ17: 20 | CK17: 20 | CL17: 20 | CM17: 20 | CN17: 20 | CO17: 20 | CP17: 20 | CQ17: 20 | CR17: 20 | CS17: 20 | CT17: 20 | CU17: 20 | CV17: 20 | CW17: =FIB(RC[-100]) -> 10946 | CX17: =FIB(RC[-100]) -> 10946 | CY17: =FIB(RC[-100]) -> 10946 | CZ17: =FIB(RC[-100]) -> 10946 | DA17: =FIB(RC[-100]) -> 10946 | DB17: =FIB(RC[-100]) -> 10946 | DC17: =FIB(RC[-100]) -> 10946 | DD17: =FIB(RC[-100]) -> 10946 | DE17: =FIB(RC[-100]) -> 10946 | DF17: =FIB(RC[-100]) -> 10946 | DG17: =FIB(RC[-100]) -> 10946 | DH17: =FIB(RC[-100]) -> 10946 | DI17: =FIB(RC[-100]) -> 10946 | DJ17: =FIB(RC[-100]) -> 10946 | DK17: =FIB(RC[-100]) -> 10946 | DL17: =FIB(RC[-100]) -> 10946 | DM17: =FIB(RC[-100]) -> 10946 | DN17: =FIB(RC[-100]) -> 10946 | DO17: =FIB(RC[-100]) -> 10946 | DP17: =FIB(RC[-100]) -> 10946 | DQ17: =FIB(RC[-100]) -> 10946 | DR17: =FIB(RC[-100]) -> 10946 | DS17: =FIB(RC[-100]) -> 10946 | DT17: =FIB(RC[-100]) -> 10946 | DU17: =FIB(RC[-100]) -> 10946 | DV17: =FIB(RC[-100]) -> 10946 | DW17: =FIB(RC[-100]) -> 10946 | DX17: =FIB(RC[-100]) -> 10946 | DY17: =FIB(RC[-100]) -> 10946 | DZ17: =FIB(RC[-100]) -> 10946 | EA17: =FIB(RC[-100]) -> 10946 | EB17: =FIB(RC[-100]) -> 10946 | EC17: =FIB(RC[-100]) -> 10946 | ED17: =FIB(RC[-100]) -> 10946 | EE17: =FIB(RC[-100]) -> 10946 | EF17: =FIB(RC[-100]) -> 10946 | EG17: =FIB(RC[-100]) -> 10946 | EH17: =FIB(RC[-100]) -> 10946 | EI17: =FIB(RC[-100]) -> 10946 | EJ17: =FIB(RC[-100]) -> 10946 | EK17: =FIB(RC[-100]) -> 10946 | EL17: =FIB(RC[-100]) -> 10946 | EM17: =FIB(RC[-100]) -> 10946 | EN17: =FIB(RC[-100]) -> 10946 | EO17: =FIB(RC[-100]) -> 10946 | EP17: =FIB(RC[-100]) -> 10946 | EQ17: =FIB(RC[-100]) -> 10946 | ER17: =FIB(RC[-100]) -> 10946 | ES17: =FIB(RC[-100]) -> 10946 | ET17: =FIB(RC[-100]) -> 10946 | EU17: =FIB(RC[-100]) -> 10946 | EV17: =FIB(RC[-100]) -> 10946 | EW17: =FIB(RC[-100]) -> 10946 | EX17: =FIB(RC[-100]) -> 10946 | EY17: =FIB(RC[-100]) -> 10946 | EZ17: =FIB(RC[-100]) -> 10946 | FA17: =FIB(RC[-100]) -> 10946 | FB17: =FIB(RC[-100]) -> 10946 | FC17: =FIB(RC[-100]) -> 10946 | FD17: =FIB(RC[-100]) -> 10946 | FE17: =FIB(RC[-100]) -> 10946 | FF17: =FIB(RC[-100]) -> 10946 | FG17: =FIB(RC[-100]) -> 10946 | FH17: =FIB(RC[-100]) -> 10946 | FI17: =FIB(RC[-100]) -> 10946 | FJ17: =FIB(RC[-100]) -> 10946 | FK17: =FIB(RC[-100]) -> 10946 | FL17: =FIB(RC[-100]) -> 10946 | FM17: =FIB(RC[-100]) -> 10946 | FN17: =FIB(RC[-100]) -> 10946 | FO17: =FIB(RC[-100]) -> 10946 | FP17: =FIB(RC[-100]) -> 10946 | FQ17: =FIB(RC[-100]) -> 10946 | FR17: =FIB(RC[-100]) -> 10946 | FS17: =FIB(RC[-100]) -> 10946 | FT17: =FIB(RC[-100]) -> 10946 | FU17: =FIB(RC[-100]) -> 10946 | FV17: =FIB(RC[-100]) -> 10946 | FW17: =FIB(RC[-100]) -> 10946 | FX17: =FIB(RC[-100]) -> 10946 | FY17: =FIB(RC[-100]) -> 10946 | FZ17: =FIB(RC[-100]) -> 10946 | GA17: =FIB(RC[-100]) -> 10946 | GB17: =FIB(RC[-100]) -> 10946 | GC17: =FIB(RC[-100]) -> 10946 | GD17: =FIB(RC[-100]) -> 10946 | GE17: =FIB(RC[-100]) -> 10946 | GF17: =FIB(RC[-100]) -> 10946 | GG17: =FIB(RC[-100]) -> 10946 | GH17: =FIB(RC[-100]) -> 10946 | GI17: =FIB(RC[-100]) -> 10946 | GJ17: =FIB(RC[-100]) -> 10946 | GK17: =FIB(RC[-100]) -> 10946 | GL17: =FIB(RC[-100]) -> 10946 | GM17: =FIB(RC[-100]) -> 10946 | GN17: =FIB(RC[-100]) -> 10946 | GO17: =FIB(RC[-100]) -> 10946 | GP17: =FIB(RC[-100]) -> 10946 | GQ17: =FIB(RC[-100]) -> 10946 | GR17: =FIB(RC[-100]) -> 10946
A18: 20 | B18: 20 | C18: 20 | D18: 20 | E18: 20 | F18: 20 | G18: 20 | H18: 20 | I18: 20 | J18: 20 | K18: 20 | L18: 20 | M18: 20 | N18: 20 | O18: 20 | P18: 20 | Q18: 20 | R18: 20 | S18: 20 | T18: 20 | U18: 20 | V18: 20 | W18: 20 | X18: 20 | Y18: 20 | Z18: 20 | AA18: 20 | AB18: 20 | AC18: 20 | AD18: 20 | AE18: 20 | AF18: 20 | AG18: 20 | AH18: 20 | AI18: 20 | AJ18: 20 | AK18: 20 | AL18: 20 | AM18: 20 | AN18: 20 | AO18: 20 | AP18: 20 | AQ18: 20 | AR18: 20 | AS18: 20 | AT18: 20 | AU18: 20 | AV18: 20 | AW18: 20 | AX18: 20 | AY18: 20 | AZ18: 20 | BA18: 20 | BB18: 20 | BC18: 20 | BD18: 20 | BE18: 20 | BF18: 20 | BG18: 20 | BH18: 20 | BI18: 20 | BJ18: 20 | BK18: 20 | BL18: 20 | BM18: 20 | BN18: 20 | BO18: 20 | BP18: 20 | BQ18: 20 | BR18: 20 | BS18: 20 | BT18: 20 | BU18: 20 | BV18: 20 | BW18: 20 | BX18: 20 | BY18: 20 | BZ18: 20 | CA18: 20 | CB18: 20 | CC18: 20 | CD18: 20 | CE18: 20 | CF18: 20 | CG18: 20 | CH18: 20 | CI18: 20 | CJ18: 20 | CK18: 20 | CL18: 20 | CM18: 20 | CN18: 20 | CO18: 20 | CP18: 20 | CQ18: 20 | CR18: 20 | CS18: 20 | CT18: 20 | CU18: 20 | CV18: 20 | CW18: =FIB(RC[-100]) -> 10946 | CX18: =FIB(RC[-100]) -> 10946 | CY18: =FIB(RC[-100]) -> 10946 | CZ18: =FIB(RC[-100]) -> 10946 | DA18: =FIB(RC[-100]) -> 10946 | DB18: =FIB(RC[-100]) -> 10946 | DC18: =FIB(RC[-100]) -> 10946 | DD18: =FIB(RC[-100]) -> 10946 | DE18: =FIB(RC[-100]) -> 10946 | DF18: =FIB(RC[-100]) -> 10946 | DG18: =FIB(RC[-100]) -> 10946 | DH18: =FIB(RC[-100]) -> 10946 | DI18: =FIB(RC[-100]) -> 10946 | DJ18: =FIB(RC[-100]) -> 10946 | DK18: =FIB(RC[-100]) -> 10946 | DL18: =FIB(RC[-100]) -> 10946 | DM18: =FIB(RC[-100]) -> 10946 | DN18: =FIB(RC[-100]) -> 10946 | DO18: =FIB(RC[-100]) -> 10946 | DP18: =FIB(RC[-100]) -> 10946 | DQ18: =FIB(RC[-100]) -> 10946 | DR18: =FIB(RC[-100]) -> 10946 | DS18: =FIB(RC[-100]) -> 10946 | DT18: =FIB(RC[-100]) -> 10946 | DU18: =FIB(RC[-100]) -> 10946 | DV18: =FIB(RC[-100]) -> 10946 | DW18: =FIB(RC[-100]) -> 10946 | DX18: =FIB(RC[-100]) -> 10946 | DY18: =FIB(RC[-100]) -> 10946 | DZ18: =FIB(RC[-100]) -> 10946 | EA18: =FIB(RC[-100]) -> 10946 | EB18: =FIB(RC[-100]) -> 10946 | EC18: =FIB(RC[-100]) -> 10946 | ED18: =FIB(RC[-100]) -> 10946 | EE18: =FIB(RC[-100]) -> 10946 | EF18: =FIB(RC[-100]) -> 10946 | EG18: =FIB(RC[-100]) -> 10946 | EH18: =FIB(RC[-100]) -> 10946 | EI18: =FIB(RC[-100]) -> 10946 | EJ18: =FIB(RC[-100]) -> 10946 | EK18: =FIB(RC[-100]) -> 10946 | EL18: =FIB(RC[-100]) -> 10946 | EM18: =FIB(RC[-100]) -> 10946 | EN18: =FIB(RC[-100]) -> 10946 | EO18: =FIB(RC[-100]) -> 10946 | EP18: =FIB(RC[-100]) -> 10946 | EQ18: =FIB(RC[-100]) -> 10946 | ER18: =FIB(RC[-100]) -> 10946 | ES18: =FIB(RC[-100]) -> 10946 | ET18: =FIB(RC[-100]) -> 10946 | EU18: =FIB(RC[-100]) -> 10946 | EV18: =FIB(RC[-100]) -> 10946 | EW18: =FIB(RC[-100]) -> 10946 | EX18: =FIB(RC[-100]) -> 10946 | EY18: =FIB(RC[-100]) -> 10946 | EZ18: =FIB(RC[-100]) -> 10946 | FA18: =FIB(RC[-100]) -> 10946 | FB18: =FIB(RC[-100]) -> 10946 | FC18: =FIB(RC[-100]) -> 10946 | FD18: =FIB(RC[-100]) -> 10946 | FE18: =FIB(RC[-100]) -> 10946 | FF18: =FIB(RC[-100]) -> 10946 | FG18: =FIB(RC[-100]) -> 10946 | FH18: =FIB(RC[-100]) -> 10946 | FI18: =FIB(RC[-100]) -> 10946 | FJ18: =FIB(RC[-100]) -> 10946 | FK18: =FIB(RC[-100]) -> 10946 | FL18: =FIB(RC[-100]) -> 10946 | FM18: =FIB(RC[-100]) -> 10946 | FN18: =FIB(RC[-100]) -> 10946 | FO18: =FIB(RC[-100]) -> 10946 | FP18: =FIB(RC[-100]) -> 10946 | FQ18: =FIB(RC[-100]) -> 10946 | FR18: =FIB(RC[-100]) -> 10946 | FS18: =FIB(RC[-100]) -> 10946 | FT18: =FIB(RC[-100]) -> 10946 | FU18: =FIB(RC[-100]) -> 10946 | FV18: =FIB(RC[-100]) -> 10946 | FW18: =FIB(RC[-100]) -> 10946 | FX18: =FIB(RC[-100]) -> 10946 | FY18: =FIB(RC[-100]) -> 10946 | FZ18: =FIB(RC[-100]) -> 10946 | GA18: =FIB(RC[-100]) -> 10946 | GB18: =FIB(RC[-100]) -> 10946 | GC18: =FIB(RC[-100]) -> 10946 | GD18: =FIB(RC[-100]) -> 10946 | GE18: =FIB(RC[-100]) -> 10946 | GF18: =FIB(RC[-100]) -> 10946 | GG18: =FIB(RC[-100]) -> 10946 | GH18: =FIB(RC[-100]) -> 10946 | GI18: =FIB(RC[-100]) -> 10946 | GJ18: =FIB(RC[-100]) -> 10946 | GK18: =FIB(RC[-100]) -> 10946 | GL18: =FIB(RC[-100]) -> 10946 | GM18: =FIB(RC[-100]) -> 10946 | GN18: =FIB(RC[-100]) -> 10946 | GO18: =FIB(RC[-100]) -> 10946 | GP18: =FIB(RC[-100]) -> 10946 | GQ18: =FIB(RC[-100]) -> 10946 | GR18: =FIB(RC[-100]) -> 10946
A19: 20 | B19: 20 | C19: 20 | D19: 20 | E19: 20 | F19: 20 | G19: 20 | H19: 20 | I19: 20 | J19: 20 | K19: 20 | L19: 20 | M19: 20 | N19: 20 | O19: 20 | P19: 20 | Q19: 20 | R19: 20 | S19: 20 | T19: 20 | U19: 20 | V19: 20 | W19: 20 | X19: 20 | Y19: 20 | Z19: 20 | AA19: 20 | AB19: 20 | AC19: 20 | AD19: 20 | AE19: 20 | AF19: 20 | AG19: 20 | AH19: 20 | AI19: 20 | AJ19: 20 | AK19: 20 | AL19: 20 | AM19: 20 | AN19: 20 | AO19: 20 | AP19: 20 | AQ19: 20 | AR19: 20 | AS19: 20 | AT19: 20 | AU19: 20 | AV19: 20 | AW19: 20 | AX19: 20 | AY19: 20 | AZ19: 20 | BA19: 20 | BB19: 20 | BC19: 20 | BD19: 20 | BE19: 20 | BF19: 20 | BG19: 20 | BH19: 20 | BI19: 20 | BJ19: 20 | BK19: 20 | BL19: 20 | BM19: 20 | BN19: 20 | BO19: 20 | BP19: 20 | BQ19: 20 | BR19: 20 | BS19: 20 | BT19: 20 | BU19: 20 | BV19: 20 | BW19: 20 | BX19: 20 | BY19: 20 | BZ19: 20 | CA19: 20 | CB19: 20 | CC19: 20 | CD19: 20 | CE19: 20 | CF19: 20 | CG19: 20 | CH19: 20 | CI19: 20 | CJ19: 20 | CK19: 20 | CL19: 20 | CM19: 20 | CN19: 20 | CO19: 20 | CP19: 20 | CQ19: 20 | CR19: 20 | CS19: 20 | CT19: 20 | CU19: 20 | CV19: 20 | CW19: =FIB(RC[-100]) -> 10946 | CX19: =FIB(RC[-100]) -> 10946 | CY19: =FIB(RC[-100]) -> 10946 | CZ19: =FIB(RC[-100]) -> 10946 | DA19: =FIB(RC[-100]) -> 10946 | DB19: =FIB(RC[-100]) -> 10946 | DC19: =FIB(RC[-100]) -> 10946 | DD19: =FIB(RC[-100]) -> 10946 | DE19: =FIB(RC[-100]) -> 10946 | DF19: =FIB(RC[-100]) -> 10946 | DG19: =FIB(RC[-100]) -> 10946 | DH19: =FIB(RC[-100]) -> 10946 | DI19: =FIB(RC[-100]) -> 10946 | DJ19: =FIB(RC[-100]) -> 10946 | DK19: =FIB(RC[-100]) -> 10946 | DL19: =FIB(RC[-100]) -> 10946 | DM19: =FIB(RC[-100]) -> 10946 | DN19: =FIB(RC[-100]) -> 10946 | DO19: =FIB(RC[-100]) -> 10946 | DP19: =FIB(RC[-100]) -> 10946 | DQ19: =FIB(RC[-100]) -> 10946 | DR19: =FIB(RC[-100]) -> 10946 | DS19: =FIB(RC[-100]) -> 10946 | DT19: =FIB(RC[-100]) -> 10946 | DU19: =FIB(RC[-100]) -> 10946 | DV19: =FIB(RC[-100]) -> 10946 | DW19: =FIB(RC[-100]) -> 10946 | DX19: =FIB(RC[-100]) -> 10946 | DY19: =FIB(RC[-100]) -> 10946 | DZ19: =FIB(RC[-100]) -> 10946 | EA19: =FIB(RC[-100]) -> 10946 | EB19: =FIB(RC[-100]) -> 10946 | EC19: =FIB(RC[-100]) -> 10946 | ED19: =FIB(RC[-100]) -> 10946 | EE19: =FIB(RC[-100]) -> 10946 | EF19: =FIB(RC[-100]) -> 10946 | EG19: =FIB(RC[-100]) -> 10946 | EH19: =FIB(RC[-100]) -> 10946 | EI19: =FIB(RC[-100]) -> 10946 | EJ19: =FIB(RC[-100]) -> 10946 | EK19: =FIB(RC[-100]) -> 10946 | EL19: =FIB(RC[-100]) -> 10946 | EM19: =FIB(RC[-100]) -> 10946 | EN19: =FIB(RC[-100]) -> 10946 | EO19: =FIB(RC[-100]) -> 10946 | EP19: =FIB(RC[-100]) -> 10946 | EQ19: =FIB(RC[-100]) -> 10946 | ER19: =FIB(RC[-100]) -> 10946 | ES19: =FIB(RC[-100]) -> 10946 | ET19: =FIB(RC[-100]) -> 10946 | EU19: =FIB(RC[-100]) -> 10946 | EV19: =FIB(RC[-100]) -> 10946 | EW19: =FIB(RC[-100]) -> 10946 | EX19: =FIB(RC[-100]) -> 10946 | EY19: =FIB(RC[-100]) -> 10946 | EZ19: =FIB(RC[-100]) -> 10946 | FA19: =FIB(RC[-100]) -> 10946 | FB19: =FIB(RC[-100]) -> 10946 | FC19: =FIB(RC[-100]) -> 10946 | FD19: =FIB(RC[-100]) -> 10946 | FE19: =FIB(RC[-100]) -> 10946 | FF19: =FIB(RC[-100]) -> 10946 | FG19: =FIB(RC[-100]) -> 10946 | FH19: =FIB(RC[-100]) -> 10946 | FI19: =FIB(RC[-100]) -> 10946 | FJ19: =FIB(RC[-100]) -> 10946 | FK19: =FIB(RC[-100]) -> 10946 | FL19: =FIB(RC[-100]) -> 10946 | FM19: =FIB(RC[-100]) -> 10946 | FN19: =FIB(RC[-100]) -> 10946 | FO19: =FIB(RC[-100]) -> 10946 | FP19: =FIB(RC[-100]) -> 10946 | FQ19: =FIB(RC[-100]) -> 10946 | FR19: =FIB(RC[-100]) -> 10946 | FS19: =FIB(RC[-100]) -> 10946 | FT19: =FIB(RC[-100]) -> 10946 | FU19: =FIB(RC[-100]) -> 10946 | FV19: =FIB(RC[-100]) -> 10946 | FW19: =FIB(RC[-100]) -> 10946 | FX19: =FIB(RC[-100]) -> 10946 | FY19: =FIB(RC[-100]) -> 10946 | FZ19: =FIB(RC[-100]) -> 10946 | GA19: =FIB(RC[-100]) -> 10946 | GB19: =FIB(RC[-100]) -> 10946 | GC19: =FIB(RC[-100]) -> 10946 | GD19: =FIB(RC[-100]) -> 10946 | GE19: =FIB(RC[-100]) -> 10946 | GF19: =FIB(RC[-100]) -> 10946 | GG19: =FIB(RC[-100]) -> 10946 | GH19: =FIB(RC[-100]) -> 10946 | GI19: =FIB(RC[-100]) -> 10946 | GJ19: =FIB(RC[-100]) -> 10946 | GK19: =FIB(RC[-100]) -> 10946 | GL19: =FIB(RC[-100]) -> 10946 | GM19: =FIB(RC[-100]) -> 10946 | GN19: =FIB(RC[-100]) -> 10946 | GO19: =FIB(RC[-100]) -> 10946 | GP19: =FIB(RC[-100]) -> 10946 | GQ19: =FIB(RC[-100]) -> 10946 | GR19: =FIB(RC[-100]) -> 10946
A20: 20 | B20: 20 | C20: 20 | D20: 20 | E20: 20 | F20: 20 | G20: 20 | H20: 20 | I20: 20 | J20: 20 | K20: 20 | L20: 20 | M20: 20 | N20: 20 | O20: 20 | P20: 20 | Q20: 20 | R20: 20 | S20: 20 | T20: 20 | U20: 20 | V20: 20 | W20: 20 | X20: 20 | Y20: 20 | Z20: 20 | AA20: 20 | AB20: 20 | AC20: 20 | AD20: 20 | AE20: 20 | AF20: 20 | AG20: 20 | AH20: 20 | AI20: 20 | AJ20: 20 | AK20: 20 | AL20: 20 | AM20: 20 | AN20: 20 | AO20: 20 | AP20: 20 | AQ20: 20 | AR20: 20 | AS20: 20 | AT20: 20 | AU20: 20 | AV20: 20 | AW20: 20 | AX20: 20 | AY20: 20 | AZ20: 20 | BA20: 20 | BB20: 20 | BC20: 20 | BD20: 20 | BE20: 20 | BF20: 20 | BG20: 20 | BH20: 20 | BI20: 20 | BJ20: 20 | BK20: 20 | BL20: 20 | BM20: 20 | BN20: 20 | BO20: 20 | BP20: 20 | BQ20: 20 | BR20: 20 | BS20: 20 | BT20: 20 | BU20: 20 | BV20: 20 | BW20: 20 | BX20: 20 | BY20: 20 | BZ20: 20 | CA20: 20 | CB20: 20 | CC20: 20 | CD20: 20 | CE20: 20 | CF20: 20 | CG20: 20 | CH20: 20 | CI20: 20 | CJ20: 20 | CK20: 20 | CL20: 20 | CM20: 20 | CN20: 20 | CO20: 20 | CP20: 20 | CQ20: 20 | CR20: 20 | CS20: 20 | CT20: 20 | CU20: 20 | CV20: 20 | CW20: =FIB(RC[-100]) -> 10946 | CX20: =FIB(RC[-100]) -> 10946 | CY20: =FIB(RC[-100]) -> 10946 | CZ20: =FIB(RC[-100]) -> 10946 | DA20: =FIB(RC[-100]) -> 10946 | DB20: =FIB(RC[-100]) -> 10946 | DC20: =FIB(RC[-100]) -> 10946 | DD20: =FIB(RC[-100]) -> 10946 | DE20: =FIB(RC[-100]) -> 10946 | DF20: =FIB(RC[-100]) -> 10946 | DG20: =FIB(RC[-100]) -> 10946 | DH20: =FIB(RC[-100]) -> 10946 | DI20: =FIB(RC[-100]) -> 10946 | DJ20: =FIB(RC[-100]) -> 10946 | DK20: =FIB(RC[-100]) -> 10946 | DL20: =FIB(RC[-100]) -> 10946 | DM20: =FIB(RC[-100]) -> 10946 | DN20: =FIB(RC[-100]) -> 10946 | DO20: =FIB(RC[-100]) -> 10946 | DP20: =FIB(RC[-100]) -> 10946 | DQ20: =FIB(RC[-100]) -> 10946 | DR20: =FIB(RC[-100]) -> 10946 | DS20: =FIB(RC[-100]) -> 10946 | DT20: =FIB(RC[-100]) -> 10946 | DU20: =FIB(RC[-100]) -> 10946 | DV20: =FIB(RC[-100]) -> 10946 | DW20: =FIB(RC[-100]) -> 10946 | DX20: =FIB(RC[-100]) -> 10946 | DY20: =FIB(RC[-100]) -> 10946 | DZ20: =FIB(RC[-100]) -> 10946 | EA20: =FIB(RC[-100]) -> 10946 | EB20: =FIB(RC[-100]) -> 10946 | EC20: =FIB(RC[-100]) -> 10946 | ED20: =FIB(RC[-100]) -> 10946 | EE20: =FIB(RC[-100]) -> 10946 | EF20: =FIB(RC[-100]) -> 10946 | EG20: =FIB(RC[-100]) -> 10946 | EH20: =FIB(RC[-100]) -> 10946 | EI20: =FIB(RC[-100]) -> 10946 | EJ20: =FIB(RC[-100]) -> 10946 | EK20: =FIB(RC[-100]) -> 10946 | EL20: =FIB(RC[-100]) -> 10946 | EM20: =FIB(RC[-100]) -> 10946 | EN20: =FIB(RC[-100]) -> 10946 | EO20: =FIB(RC[-100]) -> 10946 | EP20: =FIB(RC[-100]) -> 10946 | EQ20: =FIB(RC[-100]) -> 10946 | ER20: =FIB(RC[-100]) -> 10946 | ES20: =FIB(RC[-100]) -> 10946 | ET20: =FIB(RC[-100]) -> 10946 | EU20: =FIB(RC[-100]) -> 10946 | EV20: =FIB(RC[-100]) -> 10946 | EW20: =FIB(RC[-100]) -> 10946 | EX20: =FIB(RC[-100]) -> 10946 | EY20: =FIB(RC[-100]) -> 10946 | EZ20: =FIB(RC[-100]) -> 10946 | FA20: =FIB(RC[-100]) -> 10946 | FB20: =FIB(RC[-100]) -> 10946 | FC20: =FIB(RC[-100]) -> 10946 | FD20: =FIB(RC[-100]) -> 10946 | FE20: =FIB(RC[-100]) -> 10946 | FF20: =FIB(RC[-100]) -> 10946 | FG20: =FIB(RC[-100]) -> 10946 | FH20: =FIB(RC[-100]) -> 10946 | FI20: =FIB(RC[-100]) -> 10946 | FJ20: =FIB(RC[-100]) -> 10946 | FK20: =FIB(RC[-100]) -> 10946 | FL20: =FIB(RC[-100]) -> 10946 | FM20: =FIB(RC[-100]) -> 10946 | FN20: =FIB(RC[-100]) -> 10946 | FO20: =FIB(RC[-100]) -> 10946 | FP20: =FIB(RC[-100]) -> 10946 | FQ20: =FIB(RC[-100]) -> 10946 | FR20: =FIB(RC[-100]) -> 10946 | FS20: =FIB(RC[-100]) -> 10946 | FT20: =FIB(RC[-100]) -> 10946 | FU20: =FIB(RC[-100]) -> 10946 | FV20: =FIB(RC[-100]) -> 10946 | FW20: =FIB(RC[-100]) -> 10946 | FX20: =FIB(RC[-100]) -> 10946 | FY20: =FIB(RC[-100]) -> 10946 | FZ20: =FIB(RC[-100]) -> 10946 | GA20: =FIB(RC[-100]) -> 10946 | GB20: =FIB(RC[-100]) -> 10946 | GC20: =FIB(RC[-100]) -> 10946 | GD20: =FIB(RC[-100]) -> 10946 | GE20: =FIB(RC[-100]) -> 10946 | GF20: =FIB(RC[-100]) -> 10946 | GG20: =FIB(RC[-100]) -> 10946 | GH20: =FIB(RC[-100]) -> 10946 | GI20: =FIB(RC[-100]) -> 10946 | GJ20: =FIB(RC[-100]) -> 10946 | GK20: =FIB(RC[-100]) -> 10946 | GL20: =FIB(RC[-100]) -> 10946 | GM20: =FIB(RC[-100]) -> 10946 | GN20: =FIB(RC[-100]) -> 10946 | GO20: =FIB(RC[-100]) -> 10946 | GP20: =FIB(RC[-100]) -> 10946 | GQ20: =FIB(RC[-100]) -> 10946 | GR20: =FIB(RC[-100]) -> 10946
A21: 20 | B21: 20 | C21: 20 | D21: 20 | E21: 20 | F21: 20 | G21: 20 | H21: 20 | I21: 20 | J21: 20 | K21: 20 | L21: 20 | M21: 20 | N21: 20 | O21: 20 | P21: 20 | Q21: 20 | R21: 20 | S21: 20 | T21: 20 | U21: 20 | V21: 20 | W21: 20 | X21: 20 | Y21: 20 | Z21: 20 | AA21: 20 | AB21: 20 | AC21: 20 | AD21: 20 | AE21: 20 | AF21: 20 | AG21: 20 | AH21: 20 | AI21: 20 | AJ21: 20 | AK21: 20 | AL21: 20 | AM21: 20 | AN21: 20 | AO21: 20 | AP21: 20 | AQ21: 20 | AR21: 20 | AS21: 20 | AT21: 20 | AU21: 20 | AV21: 20 | AW21: 20 | AX21: 20 | AY21: 20 | AZ21: 20 | BA21: 20 | BB21: 20 | BC21: 20 | BD21: 20 | BE21: 20 | BF21: 20 | BG21: 20 | BH21: 20 | BI21: 20 | BJ21: 20 | BK21: 20 | BL21: 20 | BM21: 20 | BN21: 20 | BO21: 20 | BP21: 20 | BQ21: 20 | BR21: 20 | BS21: 20 | BT21: 20 | BU21: 20 | BV21: 20 | BW21: 20 | BX21: 20 | BY21: 20 | BZ21: 20 | CA21: 20 | CB21: 20 | CC21: 20 | CD21: 20 | CE21: 20 | CF21: 20 | CG21: 20 | CH21: 20 | CI21: 20 | CJ21: 20 | CK21: 20 | CL21: 20 | CM21: 20 | CN21: 20 | CO21: 20 | CP21: 20 | CQ21: 20 | CR21: 20 | CS21: 20 | CT21: 20 | CU21: 20 | CV21: 20 | CW21: =FIB(RC[-100]) -> 10946 | CX21: =FIB(RC[-100]) -> 10946 | CY21: =FIB(RC[-100]) -> 10946 | CZ21: =FIB(RC[-100]) -> 10946 | DA21: =FIB(RC[-100]) -> 10946 | DB21: =FIB(RC[-100]) -> 10946 | DC21: =FIB(RC[-100]) -> 10946 | DD21: =FIB(RC[-100]) -> 10946 | DE21: =FIB(RC[-100]) -> 10946 | DF21: =FIB(RC[-100]) -> 10946 | DG21: =FIB(RC[-100]) -> 10946 | DH21: =FIB(RC[-100]) -> 10946 | DI21: =FIB(RC[-100]) -> 10946 | DJ21: =FIB(RC[-100]) -> 10946 | DK21: =FIB(RC[-100]) -> 10946 | DL21: =FIB(RC[-100]) -> 10946 | DM21: =FIB(RC[-100]) -> 10946 | DN21: =FIB(RC[-100]) -> 10946 | DO21: =FIB(RC[-100]) -> 10946 | DP21: =FIB(RC[-100]) -> 10946 | DQ21: =FIB(RC[-100]) -> 10946 | DR21: =FIB(RC[-100]) -> 10946 | DS21: =FIB(RC[-100]) -> 10946 | DT21: =FIB(RC[-100]) -> 10946 | DU21: =FIB(RC[-100]) -> 10946 | DV21: =FIB(RC[-100]) -> 10946 | DW21: =FIB(RC[-100]) -> 10946 | DX21: =FIB(RC[-100]) -> 10946 | DY21: =FIB(RC[-100]) -> 10946 | DZ21: =FIB(RC[-100]) -> 10946 | EA21: =FIB(RC[-100]) -> 10946 | EB21: =FIB(RC[-100]) -> 10946 | EC21: =FIB(RC[-100]) -> 10946 | ED21: =FIB(RC[-100]) -> 10946 | EE21: =FIB(RC[-100]) -> 10946 | EF21: =FIB(RC[-100]) -> 10946 | EG21: =FIB(RC[-100]) -> 10946 | EH21: =FIB(RC[-100]) -> 10946 | EI21: =FIB(RC[-100]) -> 10946 | EJ21: =FIB(RC[-100]) -> 10946 | EK21: =FIB(RC[-100]) -> 10946 | EL21: =FIB(RC[-100]) -> 10946 | EM21: =FIB(RC[-100]) -> 10946 | EN21: =FIB(RC[-100]) -> 10946 | EO21: =FIB(RC[-100]) -> 10946 | EP21: =FIB(RC[-100]) -> 10946 | EQ21: =FIB(RC[-100]) -> 10946 | ER21: =FIB(RC[-100]) -> 10946 | ES21: =FIB(RC[-100]) -> 10946 | ET21: =FIB(RC[-100]) -> 10946 | EU21: =FIB(RC[-100]) -> 10946 | EV21: =FIB(RC[-100]) -> 10946 | EW21: =FIB(RC[-100]) -> 10946 | EX21: =FIB(RC[-100]) -> 10946 | EY21: =FIB(RC[-100]) -> 10946 | EZ21: =FIB(RC[-100]) -> 10946 | FA21: =FIB(RC[-100]) -> 10946 | FB21: =FIB(RC[-100]) -> 10946 | FC21: =FIB(RC[-100]) -> 10946 | FD21: =FIB(RC[-100]) -> 10946 | FE21: =FIB(RC[-100]) -> 10946 | FF21: =FIB(RC[-100]) -> 10946 | FG21: =FIB(RC[-100]) -> 10946 | FH21: =FIB(RC[-100]) -> 10946 | FI21: =FIB(RC[-100]) -> 10946 | FJ21: =FIB(RC[-100]) -> 10946 | FK21: =FIB(RC[-100]) -> 10946 | FL21: =FIB(RC[-100]) -> 10946 | FM21: =FIB(RC[-100]) -> 10946 | FN21: =FIB(RC[-100]) -> 10946 | FO21: =FIB(RC[-100]) -> 10946 | FP21: =FIB(RC[-100]) -> 10946 | FQ21: =FIB(RC[-100]) -> 10946 | FR21: =FIB(RC[-100]) -> 10946 | FS21: =FIB(RC[-100]) -> 10946 | FT21: =FIB(RC[-100]) -> 10946 | FU21: =FIB(RC[-100]) -> 10946 | FV21: =FIB(RC[-100]) -> 10946 | FW21: =FIB(RC[-100]) -> 10946 | FX21: =FIB(RC[-100]) -> 10946 | FY21: =FIB(RC[-100]) -> 10946 | FZ21: =FIB(RC[-100]) -> 10946 | GA21: =FIB(RC[-100]) -> 10946 | GB21: =FIB(RC[-100]) -> 10946 | GC21: =FIB(RC[-100]) -> 10946 | GD21: =FIB(RC[-100]) -> 10946 | GE21: =FIB(RC[-100]) -> 10946 | GF21: =FIB(RC[-100]) -> 10946 | GG21: =FIB(RC[-100]) -> 10946 | GH21: =FIB(RC[-100]) -> 10946 | GI21: =FIB(RC[-100]) -> 10946 | GJ21: =FIB(RC[-100]) -> 10946 | GK21: =FIB(RC[-100]) -> 10946 | GL21: =FIB(RC[-100]) -> 10946 | GM21: =FIB(RC[-100]) -> 10946 | GN21: =FIB(RC[-100]) -> 10946 | GO21: =FIB(RC[-100]) -> 10946 | GP21: =FIB(RC[-100]) -> 10946 | GQ21: =FIB(RC[-100]) -> 10946 | GR21: =FIB(RC[-100]) -> 10946
A22: 20 | B22: 20 | C22: 20 | D22: 20 | E22: 20 | F22: 20 | G22: 20 | H22: 20 | I22: 20 | J22: 20 | K22: 20 | L22: 20 | M22: 20 | N22: 20 | O22: 20 | P22: 20 | Q22: 20 | R22: 20 | S22: 20 | T22: 20 | U22: 20 | V22: 20 | W22: 20 | X22: 20 | Y22: 20 | Z22: 20 | AA22: 20 | AB22: 20 | AC22: 20 | AD22: 20 | AE22: 20 | AF22: 20 | AG22: 20 | AH22: 20 | AI22: 20 | AJ22: 20 | AK22: 20 | AL22: 20 | AM22: 20 | AN22: 20 | AO22: 20 | AP22: 20 | AQ22: 20 | AR22: 20 | AS22: 20 | AT22: 20 | AU22: 20 | AV22: 20 | AW22: 20 | AX22: 20 | AY22: 20 | AZ22: 20 | BA22: 20 | BB22: 20 | BC22: 20 | BD22: 20 | BE22: 20 | BF22: 20 | BG22: 20 | BH22: 20 | BI22: 20 | BJ22: 20 | BK22: 20 | BL22: 20 | BM22: 20 | BN22: 20 | BO22: 20 | BP22: 20 | BQ22: 20 | BR22: 20 | BS22: 20 | BT22: 20 | BU22: 20 | BV22: 20 | BW22: 20 | BX22: 20 | BY22: 20 | BZ22: 20 | CA22: 20 | CB22: 20 | CC22: 20 | CD22: 20 | CE22: 20 | CF22: 20 | CG22: 20 | CH22: 20 | CI22: 20 | CJ22: 20 | CK22: 20 | CL22: 20 | CM22: 20 | CN22: 20 | CO22: 20 | CP22: 20 | CQ22: 20 | CR22: 20 | CS22: 20 | CT22: 20 | CU22: 20 | CV22: 20 | CW22: =FIB(RC[-100]) -> 10946 | CX22: =FIB(RC[-100]) -> 10946 | CY22: =FIB(RC[-100]) -> 10946 | CZ22: =FIB(RC[-100]) -> 10946 | DA22: =FIB(RC[-100]) -> 10946 | DB22: =FIB(RC[-100]) -> 10946 | DC22: =FIB(RC[-100]) -> 10946 | DD22: =FIB(RC[-100]) -> 10946 | DE22: =FIB(RC[-100]) -> 10946 | DF22: =FIB(RC[-100]) -> 10946 | DG22: =FIB(RC[-100]) -> 10946 | DH22: =FIB(RC[-100]) -> 10946 | DI22: =FIB(RC[-100]) -> 10946 | DJ22: =FIB(RC[-100]) -> 10946 | DK22: =FIB(RC[-100]) -> 10946 | DL22: =FIB(RC[-100]) -> 10946 | DM22: =FIB(RC[-100]) -> 10946 | DN22: =FIB(RC[-100]) -> 10946 | DO22: =FIB(RC[-100]) -> 10946 | DP22: =FIB(RC[-100]) -> 10946 | DQ22: =FIB(RC[-100]) -> 10946 | DR22: =FIB(RC[-100]) -> 10946 | DS22: =FIB(RC[-100]) -> 10946 | DT22: =FIB(RC[-100]) -> 10946 | DU22: =FIB(RC[-100]) -> 10946 | DV22: =FIB(RC[-100]) -> 10946 | DW22: =FIB(RC[-100]) -> 10946 | DX22: =FIB(RC[-100]) -> 10946 | DY22: =FIB(RC[-100]) -> 10946 | DZ22: =FIB(RC[-100]) -> 10946 | EA22: =FIB(RC[-100]) -> 10946 | EB22: =FIB(RC[-100]) -> 10946 | EC22: =FIB(RC[-100]) -> 10946 | ED22: =FIB(RC[-100]) -> 10946 | EE22: =FIB(RC[-100]) -> 10946 | EF22: =FIB(RC[-100]) -> 10946 | EG22: =FIB(RC[-100]) -> 10946 | EH22: =FIB(RC[-100]) -> 10946 | EI22: =FIB(RC[-100]) -> 10946 | EJ22: =FIB(RC[-100]) -> 10946 | EK22: =FIB(RC[-100]) -> 10946 | EL22: =FIB(RC[-100]) -> 10946 | EM22: =FIB(RC[-100]) -> 10946 | EN22: =FIB(RC[-100]) -> 10946 | EO22: =FIB(RC[-100]) -> 10946 | EP22: =FIB(RC[-100]) -> 10946 | EQ22: =FIB(RC[-100]) -> 10946 | ER22: =FIB(RC[-100]) -> 10946 | ES22: =FIB(RC[-100]) -> 10946 | ET22: =FIB(RC[-100]) -> 10946 | EU22: =FIB(RC[-100]) -> 10946 | EV22: =FIB(RC[-100]) -> 10946 | EW22: =FIB(RC[-100]) -> 10946 | EX22: =FIB(RC[-100]) -> 10946 | EY22: =FIB(RC[-100]) -> 10946 | EZ22: =FIB(RC[-100]) -> 10946 | FA22: =FIB(RC[-100]) -> 10946 | FB22: =FIB(RC[-100]) -> 10946 | FC22: =FIB(RC[-100]) -> 10946 | FD22: =FIB(RC[-100]) -> 10946 | FE22: =FIB(RC[-100]) -> 10946 | FF22: =FIB(RC[-100]) -> 10946 | FG22: =FIB(RC[-100]) -> 10946 | FH22: =FIB(RC[-100]) -> 10946 | FI22: =FIB(RC[-100]) -> 10946 | FJ22: =FIB(RC[-100]) -> 10946 | FK22: =FIB(RC[-100]) -> 10946 | FL22: =FIB(RC[-100]) -> 10946 | FM22: =FIB(RC[-100]) -> 10946 | FN22: =FIB(RC[-100]) -> 10946 | FO22: =FIB(RC[-100]) -> 10946 | FP22: =FIB(RC[-100]) -> 10946 | FQ22: =FIB(RC[-100]) -> 10946 | FR22: =FIB(RC[-100]) -> 10946 | FS22: =FIB(RC[-100]) -> 10946 | FT22: =FIB(RC[-100]) -> 10946 | FU22: =FIB(RC[-100]) -> 10946 | FV22: =FIB(RC[-100]) -> 10946 | FW22: =FIB(RC[-100]) -> 10946 | FX22: =FIB(RC[-100]) -> 10946 | FY22: =FIB(RC[-100]) -> 10946 | FZ22: =FIB(RC[-100]) -> 10946 | GA22: =FIB(RC[-100]) -> 10946 | GB22: =FIB(RC[-100]) -> 10946 | GC22: =FIB(RC[-100]) -> 10946 | GD22: =FIB(RC[-100]) -> 10946 | GE22: =FIB(RC[-100]) -> 10946 | GF22: =FIB(RC[-100]) -> 10946 | GG22: =FIB(RC[-100]) -> 10946 | GH22: =FIB(RC[-100]) -> 10946 | GI22: =FIB(RC[-100]) -> 10946 | GJ22: =FIB(RC[-100]) -> 10946 | GK22: =FIB(RC[-100]) -> 10946 | GL22: =FIB(RC[-100]) -> 10946 | GM22: =FIB(RC[-100]) -> 10946 | GN22: =FIB(RC[-100]) -> 10946 | GO22: =FIB(RC[-100]) -> 10946 | GP22: =FIB(RC[-100]) -> 10946 | GQ22: =FIB(RC[-100]) -> 10946 | GR22: =FIB(RC[-100]) -> 10946
A23: 20 | B23: 20 | C23: 20 | D23: 20 | E23: 20 | F23: 20 | G23: 20 | H23: 20 | I23: 20 | J23: 20 | K23: 20 | L23: 20 | M23: 20 | N23: 20 | O23: 20 | P23: 20 | Q23: 20 | R23: 20 | S23: 20 | T23: 20 | U23: 20 | V23: 20 | W23: 20 | X23: 20 | Y23: 20 | Z23: 20 | AA23: 20 | AB23: 20 | AC23: 20 | AD23: 20 | AE23: 20 | AF23: 20 | AG23: 20 | AH23: 20 | AI23: 20 | AJ23: 20 | AK23: 20 | AL23: 20 | AM23: 20 | AN23: 20 | AO23: 20 | AP23: 20 | AQ23: 20 | AR23: 20 | AS23: 20 | AT23: 20 | AU23: 20 | AV23: 20 | AW23: 20 | AX23: 20 | AY23: 20 | AZ23: 20 | BA23: 20 | BB23: 20 | BC23: 20 | BD23: 20 | BE23: 20 | BF23: 20 | BG23: 20 | BH23: 20 | BI23: 20 | BJ23: 20 | BK23: 20 | BL23: 20 | BM23: 20 | BN23: 20 | BO23: 20 | BP23: 20 | BQ23: 20 | BR23: 20 | BS23: 20 | BT23: 20 | BU23: 20 | BV23: 20 | BW23: 20 | BX23: 20 | BY23: 20 | BZ23: 20 | CA23: 20 | CB23: 20 | CC23: 20 | CD23: 20 | CE23: 20 | CF23: 20 | CG23: 20 | CH23: 20 | CI23: 20 | CJ23: 20 | CK23: 20 | CL23: 20 | CM23: 20 | CN23: 20 | CO23: 20 | CP23: 20 | CQ23: 20 | CR23: 20 | CS23: 20 | CT23: 20 | CU23: 20 | CV23: 20 | CW23: =FIB(RC[-100]) -> 10946 | CX23: =FIB(RC[-100]) -> 10946 | CY23: =FIB(RC[-100]) -> 10946 | CZ23: =FIB(RC[-100]) -> 10946 | DA23: =FIB(RC[-100]) -> 10946 | DB23: =FIB(RC[-100]) -> 10946 | DC23: =FIB(RC[-100]) -> 10946 | DD23: =FIB(RC[-100]) -> 10946 | DE23: =FIB(RC[-100]) -> 10946 | DF23: =FIB(RC[-100]) -> 10946 | DG23: =FIB(RC[-100]) -> 10946 | DH23: =FIB(RC[-100]) -> 10946 | DI23: =FIB(RC[-100]) -> 10946 | DJ23: =FIB(RC[-100]) -> 10946 | DK23: =FIB(RC[-100]) -> 10946 | DL23: =FIB(RC[-100]) -> 10946 | DM23: =FIB(RC[-100]) -> 10946 | DN23: =FIB(RC[-100]) -> 10946 | DO23: =FIB(RC[-100]) -> 10946 | DP23: =FIB(RC[-100]) -> 10946 | DQ23: =FIB(RC[-100]) -> 10946 | DR23: =FIB(RC[-100]) -> 10946 | DS23: =FIB(RC[-100]) -> 10946 | DT23: =FIB(RC[-100]) -> 10946 | DU23: =FIB(RC[-100]) -> 10946 | DV23: =FIB(RC[-100]) -> 10946 | DW23: =FIB(RC[-100]) -> 10946 | DX23: =FIB(RC[-100]) -> 10946 | DY23: =FIB(RC[-100]) -> 10946 | DZ23: =FIB(RC[-100]) -> 10946 | EA23: =FIB(RC[-100]) -> 10946 | EB23: =FIB(RC[-100]) -> 10946 | EC23: =FIB(RC[-100]) -> 10946 | ED23: =FIB(RC[-100]) -> 10946 | EE23: =FIB(RC[-100]) -> 10946 | EF23: =FIB(RC[-100]) -> 10946 | EG23: =FIB(RC[-100]) -> 10946 | EH23: =FIB(RC[-100]) -> 10946 | EI23: =FIB(RC[-100]) -> 10946 | EJ23: =FIB(RC[-100]) -> 10946 | EK23: =FIB(RC[-100]) -> 10946 | EL23: =FIB(RC[-100]) -> 10946 | EM23: =FIB(RC[-100]) -> 10946 | EN23: =FIB(RC[-100]) -> 10946 | EO23: =FIB(RC[-100]) -> 10946 | EP23: =FIB(RC[-100]) -> 10946 | EQ23: =FIB(RC[-100]) -> 10946 | ER23: =FIB(RC[-100]) -> 10946 | ES23: =FIB(RC[-100]) -> 10946 | ET23: =FIB(RC[-100]) -> 10946 | EU23: =FIB(RC[-100]) -> 10946 | EV23: =FIB(RC[-100]) -> 10946 | EW23: =FIB(RC[-100]) -> 10946 | EX23: =FIB(RC[-100]) -> 10946 | EY23: =FIB(RC[-100]) -> 10946 | EZ23: =FIB(RC[-100]) -> 10946 | FA23: =FIB(RC[-100]) -> 10946 | FB23: =FIB(RC[-100]) -> 10946 | FC23: =FIB(RC[-100]) -> 10946 | FD23: =FIB(RC[-100]) -> 10946 | FE23: =FIB(RC[-100]) -> 10946 | FF23: =FIB(RC[-100]) -> 10946 | FG23: =FIB(RC[-100]) -> 10946 | FH23: =FIB(RC[-100]) -> 10946 | FI23: =FIB(RC[-100]) -> 10946 | FJ23: =FIB(RC[-100]) -> 10946 | FK23: =FIB(RC[-100]) -> 10946 | FL23: =FIB(RC[-100]) -> 10946 | FM23: =FIB(RC[-100]) -> 10946 | FN23: =FIB(RC[-100]) -> 10946 | FO23: =FIB(RC[-100]) -> 10946 | FP23: =FIB(RC[-100]) -> 10946 | FQ23: =FIB(RC[-100]) -> 10946 | FR23: =FIB(RC[-100]) -> 10946 | FS23: =FIB(RC[-100]) -> 10946 | FT23: =FIB(RC[-100]) -> 10946 | FU23: =FIB(RC[-100]) -> 10946 | FV23: =FIB(RC[-100]) -> 10946 | FW23: =FIB(RC[-100]) -> 10946 | FX23: =FIB(RC[-100]) -> 10946 | FY23: =FIB(RC[-100]) -> 10946 | FZ23: =FIB(RC[-100]) -> 10946 | GA23: =FIB(RC[-100]) -> 10946 | GB23: =FIB(RC[-100]) -> 10946 | GC23: =FIB(RC[-100]) -> 10946 | GD23: =FIB(RC[-100]) -> 10946 | GE23: =FIB(RC[-100]) -> 10946 | GF23: =FIB(RC[-100]) -> 10946 | GG23: =FIB(RC[-100]) -> 10946 | GH23: =FIB(RC[-100]) -> 10946 | GI23: =FIB(RC[-100]) -> 10946 | GJ23: =FIB(RC[-100]) -> 10946 | GK23: =FIB(RC[-100]) -> 10946 | GL23: =FIB(RC[-100]) -> 10946 | GM23: =FIB(RC[-100]) -> 10946 | GN23: =FIB(RC[-100]) -> 10946 | GO23: =FIB(RC[-100]) -> 10946 | GP23: =FIB(RC[-100]) -> 10946 | GQ23: =FIB(RC[-100]) -> 10946 | GR23: =FIB(RC[-100]) -> 10946
A24: 20 | B24: 20 | C24: 20 | D24: 20 | E24: 20 | F24: 20 | G24: 20 | H24: 20 | I24: 20 | J24: 20 | K24: 20 | L24: 20 | M24: 20 | N24: 20 | O24: 20 | P24: 20 | Q24: 20 | R24: 20 | S24: 20 | T24: 20 | U24: 20 | V24: 20 | W24: 20 | X24: 20 | Y24: 20 | Z24: 20 | AA24: 20 | AB24: 20 | AC24: 20 | AD24: 20 | AE24: 20 | AF24: 20 | AG24: 20 | AH24: 20 | AI24: 20 | AJ24: 20 | AK24: 20 | AL24: 20 | AM24: 20 | AN24: 20 | AO24: 20 | AP24: 20 | AQ24: 20 | AR24: 20 | AS24: 20 | AT24: 20 | AU24: 20 | AV24: 20 | AW24: 20 | AX24: 20 | AY24: 20 | AZ24: 20 | BA24: 20 | BB24: 20 | BC24: 20 | BD24: 20 | BE24: 20 | BF24: 20 | BG24: 20 | BH24: 20 | BI24: 20 | BJ24: 20 | BK24: 20 | BL24: 20 | BM24: 20 | BN24: 20 | BO24: 20 | BP24: 20 | BQ24: 20 | BR24: 20 | BS24: 20 | BT24: 20 | BU24: 20 | BV24: 20 | BW24: 20 | BX24: 20 | BY24: 20 | BZ24: 20 | CA24: 20 | CB24: 20 | CC24: 20 | CD24: 20 | CE24: 20 | CF24: 20 | CG24: 20 | CH24: 20 | CI24: 20 | CJ24: 20 | CK24: 20 | CL24: 20 | CM24: 20 | CN24: 20 | CO24: 20 | CP24: 20 | CQ24: 20 | CR24: 20 | CS24: 20 | CT24: 20 | CU24: 20 | CV24: 20 | CW24: =FIB(RC[-100]) -> 10946 | CX24: =FIB(RC[-100]) -> 10946 | CY24: =FIB(RC[-100]) -> 10946 | CZ24: =FIB(RC[-100]) -> 10946 | DA24: =FIB(RC[-100]) -> 10946 | DB24: =FIB(RC[-100]) -> 10946 | DC24: =FIB(RC[-100]) -> 10946 | DD24: =FIB(RC[-100]) -> 10946 | DE24: =FIB(RC[-100]) -> 10946 | DF24: =FIB(RC[-100]) -> 10946 | DG24: =FIB(RC[-100]) -> 10946 | DH24: =FIB(RC[-100]) -> 10946 | DI24: =FIB(RC[-100]) -> 10946 | DJ24: =FIB(RC[-100]) -> 10946 | DK24: =FIB(RC[-100]) -> 10946 | DL24: =FIB(RC[-100]) -> 10946 | DM24: =FIB(RC[-100]) -> 10946 | DN24: =FIB(RC[-100]) -> 10946 | DO24: =FIB(RC[-100]) -> 10946 | DP24: =FIB(RC[-100]) -> 10946 | DQ24: =FIB(RC[-100]) -> 10946 | DR24: =FIB(RC[-100]) -> 10946 | DS24: =FIB(RC[-100]) -> 10946 | DT24: =FIB(RC[-100]) -> 10946 | DU24: =FIB(RC[-100]) -> 10946 | DV24: =FIB(RC[-100]) -> 10946 | DW24: =FIB(RC[-100]) -> 10946 | DX24: =FIB(RC[-100]) -> 10946 | DY24: =FIB(RC[-100]) -> 10946 | DZ24: =FIB(RC[-100]) -> 10946 | EA24: =FIB(RC[-100]) -> 10946 | EB24: =FIB(RC[-100]) -> 10946 | EC24: =FIB(RC[-100]) -> 10946 | ED24: =FIB(RC[-100]) -> 10946 | EE24: =FIB(RC[-100]) -> 10946 | EF24: =FIB(RC[-100]) -> 10946 | EG24: =FIB(RC[-100]) -> 10946 | EH24: =FIB(RC[-100]) -> 10946 | EI24: =FIB(RC[-100]) -> 10946 | EJ24: =FIB(RC[-100]) -> 10946 | EK24: =FIB(RC[-100]) -> 10946 | EL24: =FIB(RC[-100]) -> 10946 | EM24: =FIB(RC[-100]) -> 10946 | EN24: =FIB(RC[-100]) -> 10946 | EO24: =FIB(RC[-100]) -> 10946 | EP24: =FIB(RC[-100]) -> 10946 | EQ24: =FIB(RC[-100]) -> 10946 | ER24: =FIB(RC[-100]) -> 10946 | ES24: =FIB(RC[-100]) -> 10946 | ET24: =FIB(RC[-100]) -> 10946 | EU24: =FIB(RC[-100]) -> 10946 | EV24: =FIB(RC[-100]) -> 10946 | EW24: =FIB(RC[-100]) -> 10946 | EX24: =FIB(RC[-100]) -> 10946 | EY24: =FIB(RC[-100]) -> 10946 | EZ24: =FIB(RC[-100]) -> 10946 | FA24: =FIB(RC[-100]) -> 10946 | FB24: =FIB(RC[-100]) -> 10946 | FC24: =FIB(RC[-100]) -> 10946 | FD24: =FIB(RC[-100]) -> 10946 | FE24: =FIB(RC[-100]) -> 10946 | FF24: =FIB(RC[-100]) -> 10946 | FG24: =FIB(RC[-100]) -> 10946 | FH24: =FIB(RC[-100]) -> 10946 | FI24: =FIB(RC[-100]) -> 10946 | FJ24: =FIB(RC[-100]) -> 10946 | FK24: =FIB(RC[-100]) -> 10946 | FL24: =FIB(RC[-100]) -> 10946 | FM24: =FIB(RC[-100]) -> 10946 | FN24: =FIB(RC[-100]) -> 10946 | FO24: =FIB(RC[-100]) -> 10946 | FP24: =FIB(RC[-100]) -> 10946 | FQ24: =FIB(RC[-100]) -> 10946 | FR24: =FIB(RC[-100]) -> 10946 | FS24: =FIB(RC[-100]) -> 10946 | FT24: =FIB(RC[-100]) -> 10946 | FU24: =FIB(RC[-100]) -> 10946 | FV24: =FIB(RC[-100]) -> 10946 | FW24: =FIB(RC[-100]) -> 10946 | FX24: =FIB(RC[-100]) -> 10946 | FY24: =FIB(RC[-100]) -> 10946 | FZ24: =FIB(RC[-100]) -> 10946 | GA24: =FIB(RC[-100]) -> 10946 | GB24: =FIB(RC[-100]) -> 10946 | GC24: =FIB(RC[-100]) -> 10946 | GD24: =FIB(RC[-100]) -> 10946 | GE24: =FIB(RC[-100]) -> 10946 | GF24: =FIB(RC[-100]) -> 10946 | GG24: =FIB(RC[-100]) -> 10946 | GH24: =FIB(RC[-100]) -> 10946 | GI24: =FIB(RC[-100]) -> 10946 | GJ24: =FIB(RC[-100]) -> 10946 | GK24: =FIB(RC[-100]) -> 10946 | GL24: =FIB(RC[-100]) -> 10946 | GM24: =FIB(RC[-100]) -> 10946 | GN24: =FIB(RC[-100]) -> 10946 | GO24: =FIB(RC[-100]) -> 10946 | GP24: =FIB(RC[-100]) -> 10946 | GQ24: =FIB(RC[-100]) -> 10946 | GR24: =FIB(RC[-100]) -> 10946
A25: 20 | B25: 20 | C25: 20 | D25: 20 | E25: 20 | F25: 20 | G25: 20 | H25: 20 | I25: 20 | J25: 20 | K25: 20 | L25: 20 | M25: 20 | N25: 20 | O25: 20 | P25: 20 | Q25: 20 | R25: 20 | S25: 20 | T25: 20 | U25: 20 | V25: 20 | W25: 20 | X25: 20 | Y25: 20 | Z25: 20 | AA25: 20 | AB25: 20 | AC25: 20 | AD25: 20 | AE25: 20 | AF25: 20 | AG25: 20 | AH25: 20 | AI25: 20 | AJ25: 20 | AK25: 20 | AL25: 20 | AM25: 20 | AN25: 20 | AO25: 20 | AP25: 20 | AQ25: 20 | AR25: 20 | AS25: 20 | AT25: 20 | AU25: 20 | AV25: 20 | AW25: 20 | AX25: 20 | AY25: 20 | AZ25: 20 | BA25: 20 | BB25: 20 | BC25: 20 | BD25: 20 | BE25: 20 | BF25: 20 | BG25: 20 | BH25: 20 | BI25: 20 | BJ25: 20 | BK25: 20 | BL25: 20 | BM25: 20 | BN25: 20 | BO25: 20 | BP25: 20 | BQ25: 20 | BR25: 20 | BS25: 20 | BT25: 20 | BU25: 20 | BV25: 20 | BW25: 20 | BX25: 20 | BY25: 20 | BZ25: 20 | CA25: 20 | CB25: 20 | CC25: 20 | CD25: 20 | CE25: 20 | CF25: 20 | CG25: 20 | CH25: 20 | CI25: 20 | CJ25: 20 | CK25: 20 | CL25: 20 | CM25: 20 | CN25: 20 | CO25: 20 | CP25: 20 | CQ25: 20 | CR25: 20 | CS25: 20 | CT25: 20 | CU25: 20 | CV25: 20 | CW25: =FIB(RC[-100]) -> 10946 | CX25: =FIB(RC[-100]) -> 10946 | CY25: =FIB(RC[-100]) -> 10946 | CZ25: =FIB(RC[-100]) -> 10946 | DA25: =FIB(RC[-100]) -> 10946 | DB25: =FIB(RC[-100]) -> 10946 | DC25: =FIB(RC[-100]) -> 10946 | DD25: =FIB(RC[-100]) -> 10946 | DE25: =FIB(RC[-100]) -> 10946 | DF25: =FIB(RC[-100]) -> 10946 | DG25: =FIB(RC[-100]) -> 10946 | DH25: =FIB(RC[-100]) -> 10946 | DI25: =FIB(RC[-100]) -> 10946 | DJ25: =FIB(RC[-100]) -> 10946 | DK25: =FIB(RC[-100]) -> 10946 | DL25: =FIB(RC[-100]) -> 10946 | DM25: =FIB(RC[-100]) -> 10946 | DN25: =FIB(RC[-100]) -> 10946 | DO25: =FIB(RC[-100]) -> 10946 | DP25: =FIB(RC[-100]) -> 10946 | DQ25: =FIB(RC[-100]) -> 10946 | DR25: =FIB(RC[-100]) -> 10946 | DS25: =FIB(RC[-100]) -> 10946 | DT25: =FIB(RC[-100]) -> 10946 | DU25: =FIB(RC[-100]) -> 10946 | DV25: =FIB(RC[-100]) -> 10946 | DW25: =FIB(RC[-100]) -> 10946 | DX25: =FIB(RC[-100]) -> 10946 | DY25: =FIB(RC[-100]) -> 10946 | DZ25: =FIB(RC[-100]) -> 10946 | EA25: =FIB(RC[-100]) -> 10946 | EB25: =FIB(RC[-100]) -> 10946 | EC25: =FIB(RC[-100]) -> 10946 | ED25: =FIB(RC[-100]) -> 10946 | EE25: =FIB(RC[-100]) -> 10946 | EF25: =FIB(RC[-100]) -> 10946 | EG25: =FIB(RC[-100]) -> 10946 | EH25: =FIB(RC[-100]) -> 10946 | EI25: =FIB(RC[-100]) -> 10946 | EJ25: =FIB(RC[-100]) -> 10946 | EK25: =FIB(RC[-100]) -> 10946 | EL25: =FIB(RC[-100]) -> 10946 | EM25: =FIB(RC[-100]) -> 10946 | EN25: =FIB(RC[-100]) -> 10946 | EO25: =FIB(RC[-100]) -> 10946 | EP25: =FIB(RC[-100]) -> 10946 | EQ25: =FIB(RC[-100]) -> 10946 | ER25: =FIB(RC[-100]) -> 10946 | ES25: =FIB(RC[-100]) -> 10946 | ET25: =FIB(RC[-100]) -> 10946 | EU25: =FIB(RC[-100]) -> 10946 | EV25: =FIB(RC[-100]) -> 10946 | EW25: =FIB(RC[-100]) -> 10946 | EX25: =FIB(RC[-100]) -> 10946 | EY25: =FIB(RC[-100]) -> 10946 | EZ25: =FIB(RC[-100]) -> 10946 | FA25: =FIB(RC[-100]) -> 10946 | FB25: =FIB(RC[-100]) -> 10946 | FC25: =FIB(RC[-100]) -> 10946 | FD25: =FIB(RC[-100]) -> 10946 | FE25: =FIB(RC[-100]) -> 10946 | FF25: =FIB(RC[-100]) -> 10946 | FG25: =FIB(RC[-100]) -> 10946 | FH25: =FIB(RC[-100]) -> 10946 | FI25: =FIB(RC[-100]) -> 10946 | FJ25: =FIB(RC[-100]) -> 10946 | FK25: =FIB(RC[-100]) -> 10946 | FL25: =FIB(RC[-100]) -> 10946 | FM25: =FIB(RC[-100]) -> 10946 | FN25: =FIB(RC[-100]) -> 10946 | FO25: =FIB(RC[-100]) -> 10946 | FP25: =FIB(RC[-100]) -> 10946 | FQ25: =FIB(RC[-100]) -> 10946 | FR25: =FIB(RC[-100]) -> 10946 | FS25: =FIB(RC[-100]) -> 10946 | FT25: =FIB(RC[-100]) -> 10946 | FU25: =FIB(RC[-100]) -> 10946 | FV25: =FIB(RC[-100]) -> 10946 | FW25: =FIB(RC[-100]) -> 10946 | FX25: =FIB(RC[-100]) -> 10946 | FY25: =FIB(RC[-100]) -> 10946 | FZ25: =FIB(RC[-100]) -> 10946 | GA25: =FIB(RC[-100]) -> 10946 | GB25: =FIB(RC[-100]) -> 10946 | GC25: =FIB(RC[-100]) -> 10946 | GD25: =FIB(RC[-100]) -> 10946 | GE25: =FIB(RC[-100]) -> 10946 | GF25: =FIB(RC[-100]) -> 10946 | GG25: =FIB(RC[-100]) -> 10946 | GH25: =FIB(RC[-100]) -> 10946 | GI25: =FIB(RC[-100]) -> 10946 | GJ25: =FIB(RC[-100]) -> 10946 | GK25: =FIB(RC[-100]) -> 10946 | GL25: =FIB(RC[-100]) -> 10946 | GM25: =FIB(RC[-100]) -> 10946 | GN25: =FIB(RC[-100]) -> 10946 | GO25: =FIB(RC[-100]) -> 10946 | GP25: =FIB(RC[-100]) -> 10946 | GQ25: =FIB(RC[-100]) -> 10946 | GR25: =FIB(RC[-100]) -> 10946
A26: 20 | B26: 20 | C26: 20 | D26: 20 | E26: 20 | F26: 20 | G26: 20 | H26: 20 | I26: 20 | J26: 20 | K26: 20 | L26: 20 | M26: 20 | N26: 20 | O26: 20 | P26: 20 | Q26: 20 | R26: 20 | S26: 20 | T26: 20 | U26: 20 | V26: 20 | W26: 20 | X26: 20 | Y26: 20 | Z26: 20 | AA26: 20 | AB26: 20 | AC26: 20 | AD26: 20 | AE26: 20 | AF26: 20 | AG26: 20 | AH26: 20 | AI26: 20 | AJ26: 20 | AK26: 20 | AL26: 20 | AM26: 20 | AN26: 20 | AO26: 20 | AP26: 20 | AQ26: 20 | AR26: 20 | AS26: 20 | AT26: 20 | AU26: 20 | AV26: 20 | AW26: 20 | AX26: 20 | AY26: 20 | AZ26: 20 | BA26: 20 | BB26: 20 | BC26: 20 | BD26: 20 | BE26: 20 | BF26: 20 | BG26: 20 | BH26: 20 | BI26: 20 | BJ26: 20 | BK26: 20 | BL26: 20 | BM26: 20 | BN26: 20 | BO26: 20 | BP26: 20 | BQ26: 20 | BR26: 20 | BS26: 20 | BT26: 20 | BU26: 20 | BV26: 20 | BW26: 20 | BX26: 20 | BY26: 20 | BZ26: 20 | CA26: 20 | CB26: 20 | CC26: 20 | CD26: 20 | CE26: 20 | CF26: 20 | CG26: 20 | CH26: 20 | CI26: 20 | CJ26: 20 | CK26: 20 | CL26: 20 | CM26: 20 | CN26: 20 | CO26: 20 | CP26: 20 | CQ26: 20 | CR26: 20 | CS26: 20 | CT26: 20 | CU26: 20 | CV26: 20 | CW26: =FIB(RC[-100]) -> 10946 | CX26: =FIB(RC[-100]) -> 10946 | CY26: =FIB(RC[-100]) -> 10946 | CZ26: =FIB(RC[-100]) -> 10946 | DA26: =FIB(RC[-100]) -> 10946 | DB26: =FIB(RC[-100]) -> 10946 | DC26: =FIB(RC[-100]) -> 10946 | DD26: =FIB(RC[-100]) -> 10946 | DE26: =FIB(RC[-100]) -> 10946 | DF26: =FIB(RC[-100]) -> 10946 | DG26: =FIB(RC[-100]) -> 10946 | DH26: =FIB(RC[-100]) -> 10946 | DI26: =FIB(RC[-100]) -> 10946 | DJ26: =FIB(RC[-100]) -> 10946 | DK26: =FIB(RC[-100]) -> 10946 | DL26: =FIB(RC[-100]) -> 10946 | DM26: =FIB(RC[-100]) -> 10946 | DN26: =FIB(RC[-100]) -> 10946 | DO26: =FIB(RC[-100]) -> 10946 | DP26: =FIB(RC[-100]) -> 10946 | DQ26: =FIB(RC[-100]) -> 10946 | DR26: =FIB(RC[-100]) -> 10946 | DS26: =FIB(RC[-100]) -> 10946 | DT26: =FIB(RC[-100]) -> 10946 | DU26: =FIB(RC[-100]) -> 10946 | DV26: =FIB(RC[-100]) -> 10946 | DW26: =FIB(RC[-100]) -> 10946 | DX26: =FIB(RC[-100]) -> 10946 | DY26: =FIB(RC[-100]) -> 10946 | DZ26: =FIB(RC[-100]) -> 10946 | EA26: =FIB(RC[-100]) -> 10946 | EB26: =FIB(RC[-100]) -> 10946 | EC26: =FIB(RC[-100]) -> 10946 | ED26: =FIB(RC[-100]) -> 10946 | EE26: =FIB(RC[-100]) -> 10946 | EF26: =FIB(RC[-100]) -> 10946 | EG26: =FIB(RC[-100]) -> 10946 | EH26: =FIB(RC[-100]) -> 10946 | EI26: =FIB(RC[-100]) -> 10946 | EJ26: =FIB(RC[-100]) -> 10946 | EK26: =FIB(RC[-100]) -> 10946 | EL26: =FIB(RC[-100]) -> 10946 | EM26: =FIB(RC[-100]) -> 10946 | EN26: =FIB(RC[-100]) -> 10946 | EO26: =FIB(RC[-100]) -> 10946 | EP26: =FIB(RC[-100]) -> 10946 | EQ26: =FIB(RC[-100]) -> 10946 | ER26: =FIB(RC[-100]) -> 10946 | ES26: =FIB(RC[-100]) -> 10946 | ET26: =FIB(RC[-100]) -> 10946 | EU26: =FIB(RC[-100]) -> 10946 | EV26: =FIB(RC[-100]) -> 10946 | EW26: =FIB(RC[-100]) -> 10946 | EX26: =FIB(RC[-100]) -> 10946 | EY26: =FIB(RC[-100]) -> 10946 | EZ26: =FIB(RC[-100]) -> 10946 | FA26: =FIB(RC[-100]) -> 10946 | FB26: =FIB(RC[-100]) -> 10946 | FC26: =FIB(RC[-100]) -> 10946 | FD26: =FIB(RC[-100]) -> 10946 | FE26: =FIB(RC[-100]) -> 10946 | FF26: =FIB(RC[-100]) -> 10946 | FG26: =FIB(RC[-100]) -> 10946 | FH26: =FIB(RC[-100]) -> 10946 | FI26: =FIB(RC[-100]) -> 10946 | FJ26: =FIB(RC[-100]) -> 10946 | FK26: =FIB(RC[-100]) -> 10946 | FL26: =FIB(RC[-100]) -> 10946 | FM26: =FIB(RC[-100]) -> 10946 | FN26: =FIB(RC[-100]) -> 10946 | FO26: =FIB(RC[-100]) -> 10946 | FP26: =FIB(RC[-100]) -> 10946 | FQ26: =FIB(RC[-100]) -> 10946 | FR26: =FIB(RC[-100]) -> 10946 | FS26: =FIB(RC[-100]) -> 10946 | FT26: =FIB(RC[-100]) -> 10946 | FU26: =FIB(RC[-100]) -> 10946 | FV26: =FIB(RC[-100]) -> 10946 | FW26: =FIB(RC[-100]) -> 10946 | FX26: =FIB(RC[-100]) -> 10946 | FY26: =FIB(RC[-100]) -> 10946 | FZ26: =FIB(RC[-100]) -> 10946 | GA26: =FIB(RC[-100]) -> 10946 | GB26: =FIB(RC[-100]) -> 10946 | GC26: =FIB(RC[-100]) -> 10946 | GD26: =FIB(RC[-100]) -> 10946 | GE26: =FIB(RC[-100]) -> 10946 | GF26: =FIB(RC[-100]) -> 10946 | GG26: =FIB(RC[-100]) -> 10946 | GH26: =FIB(RC[-100]) -> 10946 | GI26: =FIB(RC[-100]) -> 10946 | GJ26: =FIB(RC[-100]) -> 10946 | GK26: =FIB(RC[-100]) -> 10946 | GL26: =FIB(RC[-100]) -> 10946 | GM26: =FIB(RC[-100]) -> 10946 | GN26: =FIB(RC[-100]) -> 10946 | GO26: =FIB(RC[-100]) -> 10946 | GP26: =FIB(RC[-100]) -> 10946 | GQ26: =FIB(RC[-100]) -> 10946 | GR26: =FIB(RC[-100]) -> 10946
A27: 20 | B27: 20 | C27: 20 | D27: 20 | E27: 20 | F27: 20 | G27: 20 | H27: 20 | I27: 20 | J27: 20 | K27: 20 | L27: 20 | M27: 20 | N27: 20 | O27: 20 | P27: 20 | Q27: 20 | R27: 20 | S27: 20 | T27: 20 | U27: 20 | V27: 20 | W27: 20 | X27: 20 | Y27: 20 | Z27: 20 | AA27: 20 | AB27: 20 | AC27: 20 | AD27: 20 | AE27: 20 | AF27: 20 | AG27: 20 | AH27: 20 | AI27: 20 | AJ27: 20 | AK27: 20 | AL27: 20 | AM27: 20 | AN27: 20 | AO27: 20 | AP27: 20 | AQ27: 20 | AR27: 20 | AS27: 20 | AT27: 20 | AU27: 20 | AV27: 20 | AW27: 20 | AX27: 20 | AY27: 20 | AZ27: 20 | BA27: 20 | BB27: 20 | BC27: 20 | BD27: 20 | BE27: 20 | BF27: 20 | BG27: 20 | BH27: 20 | BI27: 20 | BJ27: 20 | BK27: 20 | BL27: 20 | BM27: 20 | BN27: 20 | BO27: 20 | BP27: 20 | BQ27: 20 | BR27: 20 | BS27: 20 | BT27: 20 | BU27: 20 | BV27: 20 | BW27: 20 | BX27: 20 | BY27: 20 | BZ27: 20 | CA27: 20 | CB27: 20 | CC27: 20 | CD27: 20 | CE27: 20 | CF27: 20 | CG27: 20 | CH27: 20 | CI27: 20 | CJ27: 20 | CK27: 20 | CL27: 20 | CM27: 20 | CN27: 20 | CO27: 20 | CP27: 20 | CQ27: 20 | CR27: 20 | CS27: 20 | CT27: 20 | CU27: 20 | CV27: 20 | CW27: =FIB(RC[-100]) -> 10946 | CX27: =FIB(RC[-100]) -> 10946 | CY27: =FIB(RC[-100]) -> 10946 | CZ27: =FIB(RC[-100]) -> 10946 | DA27: =FIB(RC[-100]) -> 10946 | DB27: =FIB(RC[-100]) -> 10946 | DC27: =FIB(RC[-100]) -> 10946 | DD27: =FIB(RC[-100]) -> 10946 | DE27: =FIB(RC[-100]) -> 10946 | DF27: =FIB(RC[-100]) -> 10946 | DG27: =FIB(RC[-100]) -> 10946 | DH27: =FIB(RC[-100]) -> 10946 | DI27: =FIB(RC[-100]) -> 10946 | DJ27: =FIB(RC[-100]) -> 10946 | DK27: =FIB(RC[-100]) -> 10946 | DL27: =FIB(RC[-100]) -> 10946 | DM27: =FIB(RC[-100]) -> 10946 | DN27: =FIB(RC[-100]) -> 10946 | DO27: =FIB(RC[-100]) -> 10946 | DP27: =FIB(RC[-100]) -> 10946 | DQ27: =FIB(RC[-100]) -> 10946 | DR27: =FIB(RC[-100]) -> 10946 | DS27: =FIB(RC[-100]) -> 10946 | DT27: =FIB(RC[-100]) -> 10946 | DU27: =FIB(RC[-100]) -> 10946 | DV27: =FIB(RC[-100]) -> 10946 | DW27: =FIB(RC[-100]) -> 10946 | DX27: =FIB(RC[-100]) -> 10946 | DY27: =FIB(RC[-100]) -> 10946 | DZ27: =FIB(RC[-100]) -> 10946 | EA27: =FIB(RC[-100]) -> 10946 | EB27: =FIB(RC[-100]) -> 10946 | EC27: =FIB(RC[-100]) -> 10946 | ED27: =FIB(RC[-100]) -> 10946 | EE27: =FIB(RC[-100]) -> 10946 | EF27: =FIB(RC[-100]) -> 10946 | EG27: =FIB(RC[-100]) -> 10946 | EH27: =FIB(RC[-100]) -> 10946 | EI27: =FIB(RC[-100]) -> 10946 | EJ27: =FIB(RC[-100]) -> 10946 | EK27: =FIB(RC[-100]) -> 10946 | EL27: =FIB(RC[-100]) -> 10946 | EM27: =FIB(RC[-100]) -> 10946 | EN27: =FIB(RC[-100]) -> 10946 | EO27: =FIB(RC[-100]) -> 10946 | EP27: =FIB(RC[-100]) -> 10946 | EQ27: =FIB(RC[-100]) -> 10946 | ER27: =FIB(RC[-100]) -> 10946 | ES27: =FIB(RC[-100]) -> 10946 | ET27: =FIB(RC[-100]) -> 10946 | EU27: =FIB(RC[-100]) -> 10946 | EV27: =FIB(RC[-100]) -> 10946 | EW27: =FIB(RC[-100]) -> 10946 | EX27: =FIB(RC[-100]) -> 10946 | EY27: =FIB(RC[-100]) -> 10946 | EZ27: =FIB(RC[-100]) -> 10946 | FA27: =FIB(RC[-100]) -> 10946 | FB27: =FIB(RC[-100]) -> 10946 | FC27: =FIB(RC[-100]) -> 10946 | FD27: =FIB(RC[-100]) -> 10946 | FE27: =FIB(RC[-100]) -> 10946 | FF27: =FIB(RC[-100]) -> 10946 | FG27: =FIB(RC[-100]) -> 10946 | FH27: =FIB(RC[-100]) -> 10946 | FI27: =FIB(RC[-100]) -> 10946 | FJ27: =FIB(RC[-100]) -> 10946 | FK27: =FIB(RC[-100]) -> 10946 | FL27: =FIB(RC[-100]) -> 10946 | FM27: =FIB(RC[-100]) -> 10946 | FN27: =FIB(RC[-100]) -> 10946 | FO27: =FIB(RC[-100]) -> 10946 | FP27: =FIB(RC[-100]) -> 10946 | FQ27: =FIB(RC[-100]) -> 10946 | FR27: =FIB(RC[-100]) -> 10946 | FS27: =FIB(RC[-100]) -> 10946 | FT27: =FIB(RC[-100]) -> 10946 | FU27: =FIB(RC[-100]) -> 10946 | FV27: =FIB(RC[-100]) -> 10946 | FW27: =FIB(RC[-100]) -> 10946 | FX27: =FIB(RC[-100]) -> 10946 | FY27: =FIB(RC[-100]) -> 10946 | FZ27: =FIB(RC[-100]) -> 10946 | GA27: =FIB(RC[-100]) -> 10946 | GB27: =FIB(RC[-100]) -> 10946 | GC27: =FIB(RC[-100]) -> 10946 | GD27: =FIB(RC[-100]) -> 10946 | GE27: =FIB(RC[-100]) -> 10946 | GF27: =FIB(RC[-100]) -> 10946 | GG27: =FIB(RC[-100]) -> 10946 | GH27: =FIB(RC[-100]) -> 10946 | GI27: =FIB(RC[-100]) -> 10946 | GJ27: =FIB(RC[-100]) -> 10946 | GK27: =FIB(RC[-100]) -> 10946 | GL27: =FIB(RC[-100]) -> 10946 | GM27: =FIB(RC[-100]) -> 10946 | GN27: =FIB(RC[-100]) -> 10946 | GO27: =FIB(RC[-100]) -> 10946 | GP27: =FIB(RC[-100]) -> 10946 | GQ27: =FIB(RC[-100]) -> 10946 | GR27: =FIB(RC[-100]) -> 10946
A28: 20 | B28: 20 | C28: 20 | D28: 20 | E28: 20 | F28: 20 | G28: 20 | H28: 20 | I28: 20 | J28: 20 | K28: 20 | L28: 20 | M28: 20 | N28: 20 | O28: 20 | P28: 20 | Q28: 20 | R28: 20 | S28: 20 | T28: 20 | U28: 20 | V28: 20 | W28: 20 | X28: 20 | Y28: 20 | Z28: 20 | AA28: 20 | AB28: 20 | AC28: 20 | AD28: 20 | AE28: 20 | AF28: 20 | AG28: 20 | AH28: 20 | AI28: 20 | AJ28: 20 | AK28: 20 | AL28: 20 | AM28: 20 | AN28: 20 | AO28: 20 | AP28: 20 | AQ28: 20 | AR28: 20 | AS28: 20 | AT28: 20 | AU28: 20 | AV28: 20 | AW28: 20 | AX28: 20 | AY28: 20 | AZ28: 20 | BA28: 20 | BB28: 20 | BC28: 20 | BD28: 20 | BE28: 20 | BF28: 20 | BG28: 20 | BH28: 20 | BI28: 20 | BJ28: 20 | BK28: 20 | BL28: 20 | BM28: 20 | BN28: 20 | BO28: 20 | BP28: 20 | BQ28: 20 | BR28: 20 | BS28: 20 | BT28: 20 | BU28: 20 | BV28: 20 | BW28: 20 | BX28: 20 | BY28: 20 | BZ28: 20 | CA28: 20 | CB28: 20 | CC28: 20 | CD28: 20 | CE28: 20 | CF28: 20 | CG28: 20 | CH28: 20 | CI28: 20 | CJ28: 20 | CK28: 20 | CL28: 20 | CM28: 20 | CN28: 20 | CO28: 20 | CP28: 20 | CQ28: 20 | CR28: 20 | CS28: 20 | CT28: 20 | CU28: 20 | CV28: 20 | CW28: =FIB(RC[-100]) -> 10946 | CX28: =FIB(RC[-100]) -> 10946 | CY28: =FIB(RC[-100]) -> 10946 | CZ28: =FIB(RC[-100]) -> 10946 | DA28: =FIB(RC[-100]) -> 10946 | DB28: =FIB(RC[-100]) -> 10946 | DC28: =FIB(RC[-100]) -> 10946 | DD28: =FIB(RC[-100]) -> 10946 | DE28: =FIB(RC[-100]) -> 10946 | DF28: =FIB(RC[-100]) -> 10946 | DG28: =FIB(RC[-100]) -> 10946 | DH28: =FIB(RC[-100]) -> 10946 | DI28: =FIB(RC[-100]) -> 10946 | DJ28: =FIB(RC[-100]) -> 10946 | DK28: =FIB(RC[-100]) -> 10946 | DL28: =FIB(RC[-100]) -> 10946 | DM28: =FIB(RC[-100]) -> 10946 | DN28: =FIB(RC[-100]) -> 10946 | DO28: =FIB(RC[-100]) -> 10946 | DP28: =FIB(RC[-100]) -> 10946 | DQ28: =FIB(RC[-100]) -> 10946 | DR28: =FIB(RC[-100]) -> 10946 | DS28: =FIB(RC[-100]) -> 10946 | DT28: =FIB(RC[-100]) -> 10946 | DU28: =FIB(RC[-100]) -> 10946 | DV28: =FIB(RC[-100]) -> 10946 | DW28: =FIB(RC[-100]) -> 10946 | DX28: =FIB(RC[-100]) -> 10946 | DY28: =FIB(RC[-100]) -> 10946 | DZ28: =FIB(RC[-100]) -> 10946 | EA28: =FIB(RC[-100]) -> 10946 | EB28: =FIB(RC[-100]) -> 10946 | EC28: =FIB(RC[-100]) -> 10946 | ED28: =FIB(RC[-100]) -> 10946 | EE28: =FIB(RC[-100]) -> 10946 | EF28: =FIB(RC[-100]) -> 10946 | EG28: =FIB(RC[-100]) -> 10946 | EH28: =FIB(RC[-100]) -> 10946 | EI28: =FIB(RC[-100]) -> 10946 | EJ28: =FIB(RC[-100]) -> 10946 | EK28: =FIB(RC[-100]) -> 10946 | EL28: =FIB(RC[-100]) -> 10946 | EM28: =FIB(RC[-100]) -> 10946 | EN28: =FIB(RC[-100]) -> 10946 | EO28: =FIB(RC[-100]) -> 10946 | EP28: =FIB(RC[-100]) -> 10946 | EQ28: =FIB(RC[-100]) -> 10946 | ER28: =FIB(RC[-100]) -> 10946 | ES28: =FIB(RC[-100]) -> 10946 | ET28: =FIB(RC[-100]) -> 10946 | EU28: =FIB(RC[-100]) -> 10946 | EV28: =FIB(RC[-100]) -> 10946 | EW28: =FIB(RC[-100]) -> 10946 | EX28: =FIB(RC[-100]) -> 10946 | EY28: =FIB(RC[-100]) -> 10946 | EZ28: =FIB(RC[-100]) -> 10946 | FA28: =FIB(RC[-100]) -> 10946 | FB28: =FIB(RC[-100]) -> 10946 | FC28: =FIB(RC[-100]) -> 10946 | FD28: =FIB(RC[-100]) -> 10946 | FE28: =FIB(RC[-100]) -> 10946 | FF28: =FIB(RC[-100]) -> 10946 | FG28: =FIB(RC[-100]) -> 10946 | FH28: =FIB(RC[-100]) -> 10946 | FI28: =FIB(RC[-100]) -> 10946 | FJ28: =FIB(RC[-100]) -> 10946 | FK28: =FIB(RC[-100]) -> 10946 | FL28: =FIB(RC[-100]) -> 10946 | FM28: =FIB(RC[-100]) -> 10946 | FN28: =FIB(RC[-100]) -> 10946 | FO28: =FIB(RC[-100]) -> 10946 | FP28: =FIB(RC[-100]) -> 10946 | FQ28: =FIB(RC[-100]) -> 10946 | FR28: =FIB(RC[-100]) -> 10946 | FS28: =FIB(RC[-100]) -> 10946 | FT28: =FIB(RC[-100]) -> 10946 | FU28: =FIB(RC[-100]) -> 10946 | FV28: =FIB(RC[-100]) -> 10946 | FW28: =FIB(RC[-100]) -> 10946 | FX28: =FIB(RC[-100]) -> 10946 | FY28: =FIB(RC[-100]) -> 10946 | FZ28: =FIB(RC[-100]) -> 10946 | GA28: =FIB(RC[-100]) -> 10946 | GB28: =FIB(RC[-100]) -> 10946 | GC28: =FIB(RC[-100]) -> 10946 | GD28: =FIB(RC[-100]) -> 10946 | GE28: =FIB(RC[-100]) -> 10946 | GF28: =FIB(RC[-100]) -> 10946 | GG28: =FIB(RC[-100]) -> 10946 | GH28: =FIB(RC[-100]) -> 10946 | GI28: =FIB(RC[-100]) -> 10946 | GJ28: =FIB(RC[-100]) -> 10946 | GK28: =FIB(RC[-100]) -> 10946 | GL28: =FIB(RC[-100]) -> 10946 | GM28: =FIB(RC[-100]) -> 10946 | GN28: =FIB(RC[-100]) -> 10946 | GO28: =FIB(RC[-100]) -> 10946 | GP28: =FIB(RC[-100]) -> 10946 | GQ28: =FIB(RC[-100]) -> 10946 | GR28: =FIB(RC[-100]) -> 10946
A29: 20 | B29: 20 | C29: 20 | D29: 20 | E29: 20 | F29: 20 | G29: 20 | H29: 20 | I29: 20 | J29: 20 | K29: 20 | L29: 20 | M29: 20 | N29: 20 | O29: 20 | P29: 20 | Q29: 20 | R29: 20 | S29: 20 | T29: 20 | U29: 20 | V29: 20 | W29: 20 | X29: 20 | Y29: 20 | Z29: 20 | AA29: 20 | AB29: 20 | AC29: 20 | AD29: 20 | AE29: 20 | AF29: 20 | AG29: 20 | AH29: 20 | AI29: 20 | AJ29: 20 | AK29: 20 | AL29: 20 | AM29: 20 | AN29: 20 | AO29: 20 | AP29: 20 | AQ29: 20 | AR29: 20 | AS29: 20 | AT29: 20 | AU29: 20 | AV29: 20 | AW29: 20 | AX29: 20 | AY29: 20 | AZ29: 20 | BA29: 20 | BB29: 20 | BC29: 20 | BD29: 20 | BE29: 20 | BF29: 20 | BG29: 20 | BH29: 20 | BI29: 20 | BJ29: 20 | BK29: 20 | BL29: 20 | BM29: 20 | BN29: 20 | BO29: 20 | BP29: 20 | BQ29: 20 | BR29: 20 | BS29: 20 | BT29: 20 | BU29: 20 | BV29: 20 | BW29: 20 | BX29: 20 | BY29: 20 | BZ29: 20 | CA29: 20 | CB29: 20 | CC29: 20 | CD29: 20 | CE29: 20 | CF29: 20 | CG29: 20 | CH29: 20 | CI29: 20 | CJ29: 20 | CK29: 20 | CL29: 20 | CM29: 20 | CN29: 20 | CO29: 20 | CP29: 20 | CQ29: 20 | CR29: 20 | CS29: 20 | CT29: 20 | CU29: 20 | CV29: 20 | CW29: =FIB(RC[-100]) -> 10946 | CX29: =FIB(RC[-100]) -> 10946 | CY29: =FIB(RC[-100]) -> 10946 | CZ29: =FIB(RC[-100]) -> 10946 | DA29: =FIB(RC[-100]) -> 10946 | DB29: =FIB(RC[-100]) -> 10946 | DC29: =FIB(RC[-100]) -> 10946 | DD29: =FIB(RC[-100]) -> 10946 | DE29: =FIB(RC[-100]) -> 10946 | DF29: =FIB(RC[-100]) -> 10946 | DG29: =FIB(RC[-100]) -> 10946 | DH29: =FIB(RC[-100]) -> 10946 | DI29: =FIB(RC[-100]) -> 10946 | DJ29: =FIB(RC[-100]) -> 10946 | DK29: =FIB(RC[-100]) -> 10946 | DL29: =FIB(RC[-100]) -> 10946 | DM29: =FIB(RC[-100]) -> 10946 | DN29: =FIB(RC[-100]) -> 10946 | DO29: =FIB(RC[-100]) -> 10946 | DP29: =FIB(RC[-100]) -> 10946 | DQ29: =FIB(RC[-100]) -> 10946 | DR29: =FIB(RC[-100]) -> 10946 | DS29: =FIB(RC[-100]) -> 10946 | DT29: =FIB(RC[-100]) -> 10946 | DU29: =FIB(RC[-100]) -> 10946 | DV29: =FIB(RC[-100]) -> 10946 | DW29: =FIB(RC[-100]) -> 10946 | DX29: =FIB(RC[-100]) -> 10946 | DY29: =FIB(RC[-100]) -> 10946 | DZ29: =FIB(RC[-100]) -> 10946 | EA29: =FIB(RC[-100]) -> 10946 | EB29: =FIB(RC[-100]) -> 10946 | EC29: =FIB(RC[-100]) -> 10946 | ED29: =FIB(RC[-100]) -> 10946 | EE29: =FIB(RC[-100]) -> 10946 | EF29: =FIB(RC[-100]) -> 10946 | EG29: =FIB(RC[-100]) -> 10946 | EH29: =FIB(RC[-100]) -> 10946 | EI29: =FIB(RC[-100]) -> 10946 | EJ29: =FIB(RC[-100]) -> 10946 | EK29: =FIB(RC[-100]) -> 10946 | EL29: =FIB(RC[-100]) -> 10946 | EM29: =FIB(RC[-100]) -> 10946 | EN29: =FIB(RC[-100]) -> 10946 | EO29: =FIB(RC[-100]) -> 10946 | EP29: =FIB(RC[-100]) -> 10946 | EQ29: =FIB(RC[-100]) -> 10946 | ER29: =FIB(RC[-100]) -> 10946 | ES29: =FIB(RC[-100]) -> 10946 | ET29: =FIB(RC[-100]) -> 10946 | EU29: =FIB(RC[-100]) -> 10946 | EV29: =FIB(RC[-100]) -> 10946 | EW29: =FIB(RC[-100]) -> 10946 | EX29: =FIB(RC[-100]) -> 10946 | EY29: =FIB(RC[-100]) -> 10946 | EZ29: =FIB(RC[-100]) -> 10946 | FA29: =FIB(RC[-100]) -> 10946 | FB29: =FIB(RC[-100]) -> 10946 | FC29: =FIB(RC[-100]) -> 10946 | FD29: =FIB(RC[-100]) -> 10946 | FE29: =FIB(RC[-100]) -> 10946 | FF29: =FIB(RC[-100]) -> 10946 | FG29: =FIB(RC[-100]) -> 10946 | FH29: =FIB(RC[-100]) -> 10946 | FI29: =FIB(RC[-100]) -> 10946 | FJ29: =FIB(RC[-100]) -> 10946 | FK29: =FIB(RC[-100]) -> 10946 | FL29: =FIB(RC[-100]) -> 10946 | FM29: =FIB(RC[-100]) -> 10946 | FN29: =FIB(RC[-100]) -> 10946 | FO29: =FIB(RC[-100]) -> 10946 | FP29: =FIB(RC[-100]) -> 10946 | FQ29: =FIB(RC[-100]) -> 10946 | FR29: =FIB(RC[-100]) -> 10946 | FS29: =FIB(RC[-100]) -> 10946 | FT29: =FIB(RC[-100]) -> 10946 | FU29: =FIB(RC[-100]) -> 10946 | FV29: =FIB(RC[-100]) -> 10946 | FW29: =FIB(RC[-100]) -> 10946 | FX29: =FIB(RC[-100]) -> 10946 | FY29: =FIB(RC[-100]) -> 10946 | FZ29: =FIB(RC[-100]) -> 10946 | GA29: =FIB(RC[-100]) -> 10946 | GB29: =FIB(RC[-100]) -> 10946 | GC29: =FIB(RC[-100]) -> 10946 | GD29: =FIB(RC[-100]) -> 10946 | GE29: =FIB(RC[-100]) -> 10946 | GF29: =FIB(RC[-100]) -> 10946 | GG29: =FIB(RC[-100]) -> 10946 | GH29: =FIB(RC[-100]) -> 10946 | GI29: =FIB(RC[-100]) -> 10946 | GJ29: =FIB(RC[-100]) -> 10946 | GK29: =FIB(RC[-100]) -> 10946 | GL29: =FIB(RC[-100]) -> 10946 | GM29: =FIB(RC[-100]) -> 10946 | GN29: =FIB(RC[-100]) -> 10946 | GO29: =FIB(RC[-100]) -> 10946 | GP29: =FIB(RC[-100]) -> 10946 | GQ29: =FIB(RC[-100]) -> 10946 | GR29: =FIB(RC[-100]) -> 10946
A30: 20 | B30: 20 | C30: 20 | D30: 20 | E30: 20 | F30: 20 | G30: 20 | H30: 20 | I30: 20 | J30: 20 | K30: 20 | L30: 20 | M30: 20 | N30: 20 | O30: 20 | P30: 20 | Q30: 20 | R30: 20 | S30: 20 | T30: 20 | U30: 20 | V30: 20 | W30: 20 | X30: 20 | Y30: 20 | Z30: 20 | AA30: 20 | AB30: 20 | AC30: 20 | AD30: 20 | AE30: 20 | AF30: 20 | AG30: 20 | AH30: 20 | AI30: 20 | AJ30: 20 | AK30: 20 | AL30: 20 | AM30: 20 | AN30: 20 | AO30: 20 | AP30: 20 | AQ30: 20 | AR30: 20 | AS30: 20 | AT30: 20 | AU30: 20 | AV30: 20 | AW30: 20 | AX30: 20 | AY30: 20 | AZ30: 20 | BA30: 20 | BB30: 20 | BC30: 20 | BD30: 20 | BE30: 20 | BF30: 20 | BG30: 20 | BH30: 20 | BI30: 20 | BJ30: 20 | BK30: 20 | BL30: 20 | BM30: 20 | BN30: 20 | BO30: 20 | BP30: 20 | BQ30: 20 | BR30: 20 | BS30: 20 | BT30: 20 | BU30: 20 | BV30: 20 | BW30: 20 | BX30: 20 | BY30: 20 | BZ30: 20 | CA30: 20 | CB30: 20 | CC30: 20 | CD30: 20 | CE30: 20 | CF30: 20 | CG30: 20 | CH30: 20 | CI30: 20 | CJ30: 20 | CK30: 20 | CL30: 20 | CM30: 20 | CN30: 20 | CO30: 20 | CP30: 20 | CQ30: 20 | CR30: 20 | CS30: 20 | CT30: 20 | CU30: 20 | CV30: 20 | CW30: =FIB(RC[-100]) -> 10946 | CX30: =FIB(RC[-100]) -> 10946 | CY30: =FIB(RC[-100]) -> 10946 | CZ30: =FIB(RC[-100]) -> 10946 | DA30: =FIB(RC[-100]) -> 10946 | DB30: =FIB(RC[-100]) -> 10946 | DC30: =FIB(RC[-100]) -> 10946 | DD30: =FIB(RC[-100]) -> 10946 | DE30: =FIB(RC[-100]) -> 10946 | DF30: =FIB(RC[-100]) -> 10946 | DG30: =FIB(RC[-100]) -> 10946 | DH30: =FIB(RC[-100]) -> 10946 | DI30: =FIB(RC[-100]) -> 10946 | DJ30: =FIB(RC[-100]) -> 10946 | DK30: =FIB(RC[-100]) -> 10946 | DL30: =FIB(RC[-100]) -> 10946 | DM30: =FIB(RC[-100]) -> 10946 | DN30: =FIB(RC[-100]) -> 10946 | DO30: =FIB(RC[-100]) -> 10946 | DP30: =FIB(RC[-100]) -> 10946 | DQ30: =FIB(RC[-100]) -> 10946 | DR30: =FIB(RC[-100]) -> 10946 | DS30: =FIB(RC[-100]) -> 10946 | DT30: =FIB(RC[-100]) -> 10946 | DU30: =FIB(RC[-100]) -> 10946 | DV30: =FIB(RC[-100]) -> 10946 | DW30: =FIB(RC[-100]) -> 10946 | DX30: =FIB(RC[-100]) -> 10946 | DY30: =FIB(RC[-100]) -> 10946 | DZ30: =FIB(RC[-100]) -> 10946 | EA30: =FIB(RC[-100]) -> 10946 | EB30: =FIB(RC[-100]) -> 10946 | EC30: =FIB(RC[-100]) -> 10946 | ED30: =FIB(RC[-100]) -> 10946 | EE30: =FIB(RC[-100]) -> 10946 | EF30: =FIB(RC[-100]) -> 10946 | EG30: =FIB(RC[-100]) -> 10946 | EH30: =FIB(RC[-100]) -> 10946 | EI30: =FIB(RC[-100]) -> 10946 | EJ30: =FIB(RC[-100]) -> 10946 | EK30: =FIB(RC[-100]) -> 10946 | EL30: =FIB(RC[-100]) -> 10946 | EM30: =FIB(RC[-100]) -> 10946 | EN30: =FIB(RC[-100]) -> 10946 | EO30: =FIB(RC[-100]) -> 10946 | EP30: =FIB(RC[-100]) -> 10946 | EQ30: =FIB(RC[-100]) -> 10946 | ER30: =FIB(RC[-100]) -> 10946 | ES30: =FIB(RC[-100]) -> 10946 | ET30: =FIB(RC[-100]) -> 10946 | EU30: =FIB(RC[-100]) -> 10946 | EV30: =FIB(RC[-100]) -> 10946 | EW30: =FIB(RC[-100]) -> 10946 | EX30: =FIB(RC[-100]) -> 10946 | EY30: =FIB(RC[-100]) -> 10946 | EZ30: =FIB(RC[-100]) -> 10946 | FA30: =FIB(RC[-100]) -> 10946 | FB30: =FIB(RC[-100]) -> 10946 | FC30: =FIB(RC[-100]) -> 10946 | FD30: =FIB(RC[-100]) -> 10946 | FE30: =FIB(RC[-100]) -> 10946 | FF30: =FIB(RC[-100]) -> 10946 | FG30: =FIB(RC[-100]) -> 10946 | FH30: =FIB(RC[-100]) -> 10946 | FI30: =FIB(RC[-100]) -> 10946 | FJ30: =FIB(RC[-100]) -> 10946 | FK30: =FIB(RC[-100]) -> 10946 | FL30: =FIB(RC[-100]) -> 10946 | FM30: =FIB(RC[-100]) -> 10946 | FN30: =FIB(RC[-100]) -> 10946 | FO30: =FIB(RC[-100]) -> 10946 | FP30: =FIB(RC[-100]) -> 10946 | FQ30: =FIB(RC[-100]) -> 10946 | FR30: =FIB(RC[-100]) -> 10946 | FS30: =FIB(RC[-100]) -> 10946 | FT30: =FIB(RC[-100]) -> 10946 | FU30: =FIB(RC[-100]) -> 10946 | FV30: =FIB(RC[-100]) -> 10946 | FW30: =FIB(RC[-100]) -> 10946 | FX30: =FIB(RC[-100]) -> 10946 | FY30: =FIB(RC[-100]) -> 10946 | FZ30: =FIB(RC[-100]) -> 10946 | GA30: =FIB(RC[-100]) -> 10946 | GB30: =FIB(RC[-100]) -> 10946 | GC30: =FIB(RC[-100]) -> 10946 | GD30: =FIB(RC[-100]) -> 10946 | GE30: =FIB(RC[-100]) -> 10946 | GF30: =FIB(RC[-100]) -> 10946 | GG30: =FIB(RC[-100]) -> 10946 | GH30: =FIB(RC[-100]) -> 10946 | GI30: =FIB(RC[-100]) -> 10946 | GJ30: =FIB(RC[-100]) -> 10946 | GK30: =FIB(RC[-100]) -> 10946 | GL30: =FIB(RC[-100]) -> 10946 | GM30: =FIB(RC[-100]) -> 10946 | GN30: =FIB(RC[-100]) -> 10946 | GO30: =FIB(RC[-100]) -> 10946 | GP30: =FIB(RC[-100]) -> 10946 | GQ30: =FIB(RC[-100]) -> 10946 | GR30: =FIB(RC[-100]) -> 10946
A31: 20 | B31: 20 | C31: 20 | D31: 20 | E31: 20 | F31: 20 | G31: 20 | H31: 20 | I31: 20 | J31: 20 | K31: 20 | L31: 20 | M31: 20 | N31: 20 | O31: 20 | P31: 20 | Q31: 20 | R31: 20 | S31: 20 | T31: 20 | U31: 20 | V31: 20 | W31: 20 | X31: 20 | Y31: 20 | Z31: 20 | AA31: 20 | AB31: 20 | AC31: 20 | AD31: 20 | AE31: 20 | AF31: 20 | AG31: 20 | AH31: 20 | AI31: 20 | AJ31: 20 | AK31: 20 | AL31: 20 | AM31: 20 | AN31: 20 | AO31: 20 | AP31: 20 | AQ31: 20 | AR31: 20 | AS31: 20 | AT31: 20 | AU31: 20 | AV31: 20 | AW31: 20 | AX31: 20 | AY31: 20 | AZ31: 20 | BA31: 20 | BB31: 20 | BC31: 20 | BD31: 20 | BE31: 20 | BF31: 20 | BG31: 20 | BH31: 20 | BI31: 20 | BJ31: 20 | BK31: 20 | BL31: 20 | BM31: 20 | BN31: 20 | BO31: 20 | BP31: 20 | BQ31: 20 | BR31: 20 | BS31: 20 | BT31: 20 | BU31: 20 | BV31: 20 | BW31: 20 | BX31: 20 | BY31: 20 | BZ31: 20 | CA31: 20 | CB31: 20 | CC31: 20 | CD31: 20 | CE31: 20 | CF31: 20 | CG31: 20 | CH31: 20 | CI31: 20 | CJ31: 20 | CK31: 20 | CL31: 20 | CM31: 20 | CN31: 20 | CO31: 20 | CP31: 20 | CQ31: 20 | CR31: 20 | CS31: 20 | CT31: 20 | CU31: 20 | CV31: 20 | CW31: =FIB(RC[-100]) -> 10946 | CX31: =FIB(RC[-100]) -> 10946 | CY31: =FIB(RC[-100]) -> 10946 | CZ31: =FIB(RC[-100]) -> 10946 | DA31: =FIB(RC[-100]) -> 10946 | DB31: =FIB(RC[-100]) -> 10946 | DC31: =FIB(RC[-100]) -> 10946 | DD31: =FIB(RC[-100]) -> 10946 | DE31: =FIB(RC[-100]) -> 10946 | DF31: =FIB(RC[-100]) -> 10946 | DG31: =FIB(RC[-100]) -> 10946 | DH31: =FIB(RC[-100]) -> 10946 | DI31: =FIB(RC[-100]) -> 10946 | DJ31: =FIB(RC[-100]) -> 10946 | DK31: =FIB(RC[-100]) -> 10946 | DL31: =FIB(RC[-100]) -> 10946 | DM31: =FIB(RC[-100]) -> 10946 | DN31: =FIB(RC[-100]) -> 10946 | DO31: =FIB(RC[-100]) -> 10946 | DP31: =FIB(RC[-100]) -> 10946 | DQ31: =FIB(RC[-100]) -> 10946 | DR31: =FIB(RC[-100]) -> 10946 | DS31: =FIB(RC[-100]) -> 10946 | DT31: =FIB(RC[-100]) -> 10946 | DU31: =FIB(RC[-100]) -> 10946 | DV31: =FIB(RC[-100]) -> 10946 | DW31: =FIB(RC[-100]) -> 10946 | DX31: =FIB(RC[-100]) -> 10946 | DY31: =FIB(RC[-100]) -> 10946 | DZ31: =FIB(RC[-100]) -> 10946 | EA31: =FIB(RC[-100]) -> 10946 | EB31: =FIB(RC[-100]) -> 10946 | EC31: =FIB(RC[-100]) -> 10946 | ED31: =FIB(RC[-100]) -> 10946 | EE31: =FIB(RC[-100]) -> 10946 | EF31: =FIB(RC[-100]) -> 10946 | EG31: =FIB(RC[-100]) -> 10946 | EH31: =FIB(RC[-100]) -> 10946 | EI31: =FIB(RC[-100]) -> 10946 | EJ31: =FIB(RC[-100]) -> 10946 | EK31: =FIB(RC[-100]) -> 10946 | EL31: =FIB(RC[-100]) -> 10946 | EM31: =FIB(RC[-100]) -> 10946 | EN31: =FIB(RC[-100]) -> 10946 | EO31: =FIB(RC[-100]) -> 10946 | EP31: =FIB(RC[-100]) -> 10946 | EQ31: =FIB(RC[-100]) -> 10946 | ER31: =FIB(RC[-100]) -> 10946 | ES31: =FIB(RC[-100]) -> 10946 | ET31: =FIB(RC[-100]) -> 10946 | EU31: =FIB(RC[-100]) -> 10946 | EV31: =FIB(RC[-100]) -> 10946 | EW31: =FIB(RC[-100]) -> 10946 | EX31: =FIB(RC[-100]) -> 10946 | EY31: =FIB(RC[-100]) -> 10946 | EZ31: =FIB(RC[-100]) -> 10946 | FA31: =FIB(RC[-100]) -> 10946 | FB31: =FIB(RC[-100]) -> 10946 | FC31: =FIB(RC[-100]) -> 10946 | FD31: =FIB(RC[-100]) -> 10946 | FE31: =FIB(RC[-100]) -> 10946 | FF31: =FIB(RC[-100]) -> 10946 | FG31: =FIB(RC[-100]) -> 10946 | FH31: =FIB(RC[-100]) -> 10946 | FI31: =FIB(RC[-100]) -> 10946 | FJ31: =FIB(RC[-100]) -> 10946 | FK31: =FIB(RC[-100]) -> 10946 | FL31: =FIB(RC[-100]) -> 10946 | FM31: =FIB(RC[-100]) -> 10946 | FN31: =FIB(RC[-100]) -> 10946 | FO31: =FIB(RC[-100]) -> 10946 | FP31: =FIB(RC[-100]) -> 10946 | FQ31: =FIB(RC[-100]) -> 10946 | FR31: =FIB(RC[-100]) -> 10946 | FS31: =FIB(RC[-100]) -> 10946 | FT31: =FIB(RC[-100]) -> 10946 | FU31: =FIB(RC[-100]) -> 10946 | FV31: =FIB(RC[-100]) -> 10946 | FW31: =FIB(RC[-100]) -> 10946 | FX31: =FIB(RC[-100]) -> 10946 | FY31: =FIB(RC[-100]) -> 10946 | FZ31: =FIB(RC[-100]) -> 10946 | GA31: =FIB(RC[-100]) -> 10946 | GB31: =FIB(RC[-100]) -> 10946 | GC31: =FIB(RC[-100]) -> 10946 | GD31: =FIB(RC[-100]) -> 10946 | GE31: =FIB(RC[-100]) -> 10946 | GF31: =FIB(RC[-100]) -> 10946 | GG31: =FIB(RC[-100]) -> 10946 | GH31: =FIB(RC[-100]) -> 10946 | GI31: =FIB(RC[-100]) -> 10946 | GJ31: =FIB(RC[-100]) -> 10946 | GK31: =FIB(RC[-100]) -> 10946 | GL31: =FIB(RC[-100]) -> 10946 | GM31: =FIB(RC[-100]) -> 10946 | GN31: =FIB(RC[-100]) -> 10946 | GO31: =FIB(RC[-100]) -> 10946 | GP31: =FIB(RC[-100]) -> 10946 | GQ31: =FIB(RC[-100]) -> 10946 | GR31: =FIB(RC[-100]) -> 10946
A32: 20 | B32: 20 | C32: 20 | D32: 20 | E32: 20 | F32: 20 | G32: 20 | H32: 20 | I32: 20 | J32: 20 | K32: 20 | L32: 20 | M32: 20 | N32: 20 | O32: 20 | P32: 20 | Q32: 20 | R32: 20 | S32: 20 | T32: 20 | U32: 20 | V32: 20 | W32: 20 | X32: 20 | Y32: 20 | Z32: 20 | AA32: 20 | AB32: 20 | AC32: 20 | AD32: 20 | AE32: 20 | AF32: 20 | AG32: 20 | AH32: 20 | AI32: 20 | AJ32: 20 | AK32: 20 | AL32: 20 | AM32: 20 | AN32: 20 | AO32: 20 | AP32: 20 | AQ32: 20 | AR32: 20 | AS32: 20 | AT32: 20 | AU32: 20 | AV32: 20 | AW32: 20 | AX32: 20 | AY32: 20 | AZ32: 20 | BA32: 20 | BB32: 20 | BC32: 20 | BD32: 20 | BE32: 20 | BF32: 20 | BG32: 20 | BH32: 20 | BI32: 20 | BJ32: 20 | BK32: 20 | BL32: 20 | BM32: 20 | BN32: 20 | BO32: 20 | BP32: 20 | BQ32: 20 | BR32: 20 | BS32: 20 | BT32: 20 | BU32: 20 | BV32: 20 | BW32: 20 | BX32: 20 | BY32: 20 | BZ32: 20 | CA32: 20 | CB32: 20 | CC32: 20 | CD32: 20 | CE32: 20 | CF32: 20 | CG32: 20 | CH32: 20 | CI32: 20 | CJ32: 20 | CK32: 20 | CL32: 20 | CM32: 20 | CN32: 20 | CO32: 20 | CP32: 20 | CQ32: 20 | CR32: 20 | CS32: 20 | CT32: 20 | CU32: 20 | CV32: 20 | CW32: =FIB(RC[-100]) -> 10946 | CX32: =FIB(RC[-100]) -> 10946 | CY32: =FIB(RC[-100]) -> 10946 | CZ32: =FIB(RC[-100]) -> 10946 | DA32: =FIB(RC[-100]) -> 10946 | DB32: =FIB(RC[-100]) -> 10946 | DC32: =FIB(RC[-100]) -> 10946 | DD32: =FIB(RC[-100]) -> 10946 | DE32: =FIB(RC[-100]) -> 10946 | DF32: =FIB(RC[-100]) -> 10946 | DG32: =FIB(RC[-100]) -> 10946 | DH32: =FIB(RC[-100]) -> 10946 | DI32: =FIB(RC[-100]) -> 10946 | DJ32: =FIB(RC[-100]) -> 10946 | DK32: =FIB(RC[-100]) -> 10946 | DL32: =FIB(RC[-100]) -> 10946 | DM32: =FIB(RC[-100]) -> 10946 | DN32: =FIB(RC[-100]) -> 10946 | DO32: =FIB(RC[-100]) -> 10946 | DP32: =FIB(RC[-100]) -> 10946 | DQ32: =FIB(RC[-100]) -> 10946 | DR32: =FIB(RC[-100]) -> 10946 | DS32: =FIB(RC[-100]) -> 10946 | DT32: =FIB(RC[-100]) -> 10946 | DU32: =FIB(RC[-100]) -> 10946 | DV32: =FIB(RC[-100]) -> 10946 | DW32: =FIB(RC[-100]) -> 10946 | DX32: =FIB(RC[-100]) -> 10946 | DY32: =FIB(RC[-100]) -> 10946 | DZ32: =FIB(RC[-100]) -> 10946 | EA32: =FIB(RC[-100]) -> 10946 | EB32: =FIB(RC[-100]) -> 10946 | EC32: =FIB(RC[-100]) -> 10946 | ED32: =FIB(RC[-100]) -> 10946 | EE32: =FIB(RC[-100]) -> 10946 | EF32: =FIB(RC[-100]) -> 10946 | EG32: =FIB(RC[-100]) -> 10946 | EH32: =FIB(RC[-100]) -> 10946 | EI32: =FIB(RC[-100]) -> 10946 | EJ32: =FIB(RC[-100]) -> 10946 | EK32: =FIB(RC[-100]) -> 10946 | EL32: =FIB(RC[-100]) -> 10946 | EM32: =FIB(RC[-100]) -> 10946 | EN32: =FIB(RC[-100]) -> 10946 | EO32: =FIB(RC[-100]) -> 10946 | EP32: =FIB(RC[-100]) -> 10946 | EQ32: =FIB(RC[-100]) -> 10946 | ER32: =FIB(RC[-100]) -> 10946 | ES32: =FIB(RC[-100]) -> 10946 | ET32: =FIB(RC[-100]) -> 10946 | EU32: =FIB(RC[-100]) -> 10946 | EV32: =FIB(RC[-100]) -> 10946 | EW32: =FIB(RC[-100]) -> 10946 | EX32: =FIB(RC[-100]) -> 10946 | EY32: =FIB(RC[-100]) -> 10946 | EZ32: =FIB(RC[-100]) -> 10946 | FA32: =FIB(RC[-100]) -> 10946 | FB32: =FIB(RC[-100]) -> 10946 | FC32: =FIB(RC[-100]) -> 10946 | FD32: =FIB(RC[-100]) -> 10946 | FE32: =FIB(RC[-100]) -> 10946 | FF32: =FIB(RC[-100]) -> 10946 | FG32: =FIB(RC[-100]) -> 10946 | FH32: =FIB(RC[-100]) -> 10946 | FI32: =FIB(RC[-100]) -> 10946 | FJ32: =FIB(RC[-100]) -> 10946 | FK32: =FIB(RC[-100]) -> 10946 | FL32: =FIB(RC[-100]) -> 10946 | FM32: =FIB(RC[-100]) -> 10946 | FN32: =FIB(RC[-100]) -> 10946 | FO32: =FIB(RC[-100]) -> 10946 | FP32: =FIB(RC[-100]) -> 10946 | FQ32: =FIB(RC[-100]) -> 10946 | FR32: =FIB(RC[-100]) -> 10946 | FS32: =FIB(RC[-100]) -> 10946 | FT32: =FIB(RC[-100]) -> 10946 | FU32: =FIB(RC[-100]) -> 10946 | FV32: =FIB(RC[-100]) -> 10946 | FW32: =FIB(RC[-100]) -> 10946 | FX32: =FIB(RC[-100]) -> 10946 | FY32: =FIB(RC[-100]) -> 10946 | FZ32: =FIB(RC[-100]) -> 10946 | GA32: =FIB(RC[-100]) -> 10946 | GB32: =FIB(RC[-100]) -> 10946 | GC32: =FIB(RC[-100]) -> 10946 | GD32: =FIB(RC[-100]) -> 10946 | GE32: =FIB(RC[-100]) -> 10946 | GF32: =FIB(RC[-100]) -> 10946 | GG32: =FIB(RC[-100]) -> 10946 | GH32: =FIB(RC[-100]) -> 10946 | GI32: =FIB(RC[-100]) -> 10946 | GJ32: =FIB(RC[-100]) -> 10946 | GK32: =FIB(RC[-100]) -> 10946 | GL32: =FIB(RC[-100]) -> 10946 | GM32: =FIB(RC[-100]) -> 10946 | GN32: =FIB(RC[-100]) -> 10946 | GO32: =FIB(RC[-100]) -> 10946 | GP32: =FIB(RC[-100]) -> 10946 | GQ32: =FIB(RC[-100]) -> 10946 | GR32: =FIB(RC[-100]) -> 10946
A33: 20 | B33: 20 | C33: 20 | D33: 20 | E33: 20 | F33: 20 | G33: 20 | H33: 20 | I33: 20 | J33: 20 | K33: 20 | L33: 20 | M33: 20 | N33: 20 | O33: 20 | P33: 20 | Q33: 20 | R33: 20 | S33: 20 | T33: 20 | U33: 20 | V33: 20 | W33: 20 | X33: 20 | Y33: 20 | Z33: 20 | AA33: 20 | AB33: 20 | AC33: 20 | AD33: 20 | AE33: 20 | AF33: 20 | AG33: 20 | AH33: 20 | AI33: 20 | AJ33: 20 | AK33: 20 | AL33: 20 | AM33: 20 | AN33: 20 | AO33: 20 | AP33: 20 | AQ33: 20 | AR33: 20 | AS33: 20 | AT33: 20 | AU33: 20 | AV33: 20 | AW33: 20 | AX33: 20 | AY33: 20 | AZ33: 20 | BA33: 20 | BB33: 20 | BC33: 20 | BD33: 20 | BE33: 20 | BF33: 20 | BG33: 20 | BH33: 20 | BI33: 20 | BJ33: 20 | BK33: 20 | BL33: 20 | BM33: 20 | BN33: 20 | BO33: 20 | BP33: 20 | BQ33: 20 | BR33: 20 | BS33: 20 | BT33: 20 | BU33: 20 | BV33: 20 | BW33: 20 | BX33: 20 | BY33: 20 | BZ33: 20 | CA33: 20 | CB33: 20 | CC33: 20 | CD33: 20 | CE33: 20 | CF33: 20 | CG33: 20 | CH33: 20 | CI33: 20 | CJ33: 20 | CK33: 20 | CL33: 20 | CM33: 20 | CN33: 20 | CO33: 20 | CP33: 20 | CQ33: 20 | CR33: 20 | CS33: 20 | CT33: 20 | CU33: 20 | CV33: 20 | CW33: =FIB(RC[-100]) -> 10946 | CX33: =FIB(RC[-100]) -> 10946 | CY33: =FIB(RC[-100]) -> 10946 | CZ33: =FIB(RC[-100]) -> 10946 | DA33: =FIB(RC[-100]) -> 10946 | DB33: =FIB(RC[-100]) -> 10946 | DC33: =FIB(RC[-100]) -> 10946 | DD33: =FIB(RC[-100]) -> 10946 | DE33: =FIB(RC[-100]) -> 10946 | DF33: =FIB(RC[-100]) -> 10946 | DG33: =FIB(RC[-100]) -> 10946 | DH33: =FIB(RC[-100]) -> 10946 | DI33: =FIB(RC[-100]) -> 10946 | DJ33: =FIB(RC[-100]) -> 10946 | DK33: =FIB(RC[-100]) -> 10946 | DL33: =FIB(RC[-100]) -> 10946 | DM33: =FIB(RC[-100]) -> 10946 | DN33: =FIB(RC[-100]) -> 10946 | DO33: =FIB(RC[-100]) -> 10946 | DP33: =FIB(RC[-100]) -> 10946 | DQ33: =FIB(RC[-100]) -> 10946 | DR33: =FIB(RC[-100]) -> 10946 | DS33: =FIB(RC[-100]) -> 10946 | DT33: =FIB(RC[-100]) -> 10946 | DU33: =FIB(RC[-100]) -> 10946 | DV33: =FIB(RC[-100]) -> 10946 | DW33: =FIB(RC[-100]) -> 10946 | DX33: =FIB(RC[-100]) -> 10946 | DY33: =FIB(RC[-100]) -> 10946 | DZ33: =FIB(RC[-100]) -> 10946 | EA33: =FIB(RC[-100]) -> 10946 | EB33: =FIB(RC[-100]) -> 10946 | EC33: =FIB(RC[-100]) -> 10946 | ED33: =FIB(RC[-100]) -> 10946 | EE33: =FIB(RC[-100]) -> 10946 | EF33: =FIB(RC[-100]) -> 10946 | EG33: =FIB(RC[-100]) -> 10946 | EH33: =FIB(RC[-100]) -> 10946 | EI33: =FIB(RC[-100]) -> 10946 | EJ33: =FIB(RC[-100]) -> 10946 | EK33: =FIB(RC[-100]) -> 10946 | EL33: =FIB(RC[-100]) -> 10946 | EM33: =FIB(RC[-100]) -> 10946 | EN33: =FIB(RC[-100]) -> 10946 | EO33: =FIB(RC[-100]) -> 10946 | EP33: =FIB(RC[-100]) -> 10946 | EQ33: =FIB(RC[-100]) -> 10946 | ER33: =FIB(RC[-100]) -> 10946 | ES33: =FIB(RC[-100]) -> 10946 | ET33: =FIB(RC[-100]) -> 10946 | EU33: =FIB(RC[-100]) -> 10946 | EV33: =FIB(RC[-100]) -> 10946 | EW33: =FIB(RC[-100]) -> 10946 | EX33: =FIB(RC[-100]) -> 10946 | EY33: =FIB(RC[-100]) -> 10946 | EZ33: =FIB(RC[-100]) -> 10946 | FA33: =FIB(RC[-100]) -> 10946 | FB33: =FIB(RC[-100]) -> 10946 | FC33: =FIB(RC[-100]) -> 10946 | FD33: =FIB(RC[-100]) -> 10946 | FE33: =FIB(RC[-100]) -> 10946 | FF33: =FIB(RC[-100]) -> 10946 | FG33: =FIB(RC[-100]) -> 10946 | FH33: =FIB(RC[-100]) -> 10946 | FI33: =FIB(RC[-100]) -> 10946 | FJ33: =FIB(RC[-100]) -> 10946 | FK33: =FIB(RC[-100]) -> 10946 | FL33: =FIB(RC[-100]) -> 10946 | FM33: =FIB(RC[-100]) -> 10946 | FN33: =FIB(RC[-100]) -> 10946 | FO33: =FIB(RC[-100]) -> 10946 | FP33: =FIB(RC[-100]) -> 10946 | FQ33: =FIB(RC[-100]) -> 10946 | FR33: =FIB(RC[-100]) -> 10946 | FS33: =FIB(RC[-100]) -> 10946 | FT33: =FIB(RC[-100]) -> 10946 | FU33: =FIB(RC[-100]) -> 10946 | FV33: =FIB(RC[-100]) -> 10946 | FW33: =FIB(RC[-100]) -> 10946 | FX33: =FIB(RC[-100]) -> 10946 | FY33: =FIB(RC[-100]) -> 10946 | FZ33: =FIB(RC[-100]) -> 10946 | GA33: =FIB(RC[-100]) -> 10946 | GB33: =FIB(RC[-100]) -> 10946 | GC33: =FIB(RC[-100]) -> 10946 | GD33: =FIB(RC[-100]) -> 10946 | GE33: =FIB(RC[-100]) -> 10946 | GF33: =FIB(RC[-100]) -> 10946 | GG33: =FIB(RC[-100]) -> 10946 | GH33: =FIB(RC[-100]) -> 10946 | GI33: =FIB(RC[-100]) -> 10946 | GJ33: =FIB(RC[-100]) -> 10946 | GK33: =FIB(RC[-100]) -> 10946 | GL33: =FIB(RC[-100]) -> 10946 | GM33: =FIB(RC[-100]) -> 10946 | GN33: =FIB(RC[-100]) -> 10946 | GO33: =FIB(RC[-100]) -> 10946 | GP33: =FIB(RC[-100]) -> 10946 | GQ33: =FIB(RC[-100]) -> 10946 | GR33: =FIB(RC[-100]) -> 10946
A34: 20 | B34: 20 | C34: 20 | D34: 20 | E34: 20 | F34: 20 | G34: 20 | H34: 20 | I34: 20 | J34: 20 | K34: 20 | L34: 20 | M34: 20 | N34: 20 | O34: 20 | P34: 20 | Q34: 20 | R34: 20 | S34: 20 | T34: 20 | U34: 20 | V34: 20 | W34: 20 | X34: 20 | Y34: 20 | Z34: 20 | AA34: 20 | AB34: 20 | AC34: 20 | AD34: 20 | AE34: 20 | AF34: 20 | AG34: 20 | AH34: 20 | AI34: 20 | AJ34: 20 | AK34: 20 | AL34: 20 | AM34: 20 | AN34: 20 | AO34: 20 | AP34: 20 | AQ34: 20 | AR34: 20 | AS34: 20 | AT34: 20 | AU34: 20 | AV34: 20 | AW34: 20 | AX34: 20 | AY34: 20 | AZ34: 20 | BA34: 20 | BB34: 20 | BC34: 20 | BD34: 20 | BE34: 20 | BF34: 20 | BG34: 20 | BH34: 20 | BI34: 20 | BJ34: 20 | BK34: 20 | BL34: 20 | BM34: 20 | BN34: 20 | BO34: 20 | BP34: 20 | BQ34: 20 | BR34: 20 | BS34: 20 | BT34: 20 | BU34: 20 | BV34: 20 | BW34: 20 | BX34: 20 | BY34: 20 | BZ34: 20 | CA34: 20 | CB34: 20 | CC34: 20 | CD34: 20 | CE34: 20 | CF34: 20 | CG34: 20 | CH34: 20 | CI34: 20 | CJ34: 20 | CK34: 20 | CL34: 20 | CM34: 20 | CN34: 20 | CO34: 20 | CP34: 20 | CQ34: 20 | CR34: 20 | CS34: 20 | CT34: 20 | CU34: 20 | CV34: 20 | CW34: =FIB(RC[-100]) -> 10946 | CX34: =FIB(RC[-100]) -> 10946 | CY34: =FIB(RC[-100]) -> 10946 | CZ34: =FIB(RC[-100]) -> 10946 | DA34: =FIB(RC[-100]) -> 10946 | DB34: =FIB(RC[-100]) -> 10946 | DC34: =FIB(RC[-100]) -> 10946 | DD34: =FIB(RC[-100]) -> 10946 | DE34: =FIB(RC[-100]) -> 10946 | DF34: =FIB(RC[-100]) -> 10946 | DG34: =FIB(RC[-100]) -> 10946 | DH34: =FIB(RC[-100]) -> 10946 | DI34: =FIB(RC[-100]) -> 10946 | DJ34: =FIB(RC[-100]) -> 10946 | DK34: =FIB(RC[-100]) -> 10946 | DL34: =FIB(RC[-100]) -> 10946 | DM34: =FIB(RC[-100]) -> 10946 | DN34: =FIB(RC[-100]) -> 10946 | DO34: =FIB(RC[-100]) -> 10946 | DP34: =FIB(RC[-100]) -> 10946 | DQ34: =FIB(RC[-100]) -> 10946 | DR34: =FIB(RC[-100]) -> 10946 | DS34: =FIB(RC[-100]) -> 10946 | DT34: =FIB(RC[-100]) -> 10946 | DU34: =FIB(RC[-100]) -> 10946 | DV34: =FIB(RC[-100]) -> 10946 | DW34: =FIB(RC[-100]) -> 10946 | DX34: =FIB(RC[-100]) -> 10946 | DY34: =FIB(RC[-100]) -> 10946 | DZ34: =FIB(RC[-100]) -> 10946 | EA34: =FIB(RC[-100]) -> 10946 | EB34: =FIB(RC[-100]) -> 10946 | EC34: =FIB(RC[-100]) -> 10946 | ED34: =FIB(RC[-100]) -> 10946 | EE34: =FIB(RC[-100]) -> 10946 | EF34: =FIB(RC[-100]) -> 10946 | EG34: =FIB(RC[-100]) -> 10946 | EH34: =FIB(RC[-100]) -> 10946 | EI34: =FIB(RC[-100]) -> 10946 | EJ34: =FIB(RC[-100]) -> 10946 | EK34: =FIB(RC[-100]) -> 10946 | EL34: =FIB(RC[-100]) -> 10946 | EM34: =FIB(RC[-100]) -> 10946 | EN34: =FIB(RC[-100]) -> 10946 | EO34: =FIB(RC[-100]) -> 10946 | EP34: =FIB(RC[-100]) -> 10946 | EQ34: =FIB(RC[-100]) -> 10946 | ER34: =FIB(RC[-100]) -> 10946 | ES34: =FIB(RC[-100]) -> 10946 | ET34: =FIB(RC[-100]) -> 10946 | EU34: =FIB(RC[-100]) -> 10946 | EV34: =FIB(RC[-100]) -> 10946 | EW34: =FIB(RC[-100]) -> 10946 | EX34: =FIB(RC[-100]) -> 10946 | EY34: =FIB(RC[-100]) -> 10946 | EZ34: =FIB(RC[-100]) -> 10946 | FA34: =FIB(RC[-100]) -> 10946 | FB34: =FIB(RC[-100]) -> 10946 | FC34: =FIB(RC[-100]) -> 10946 | FD34: =FIB(RC[-100]) -> 10946 | FE34: =FIB(RC[-100]) -> 10946 | FF34: =FIB(RC[-100]) -> 10946 | FG34: =FIB(RC[-100]) -> 10946 | FH34: =FIB(RC[-100]) -> 10946 | FI34: =FIB(RC[-100]) -> 10946 | FJ34: =FIB(RC[-100]) -> 10946 | FK34: =FIB(RC[-100]) -> 10946 | FL34: =FIB(RC[-100]) -> 10946 | FM34: =FIB(RC[-100]) -> 10946 | FN34: =FIB(RC[-100]) -> 10946 | FO34: =FIB(RC[-100]) -> 10946 | FP34: =FIB(RC[-100]) -> 10946 | FQ34: =FIB(RC[-100]) -> 10946 | FR34: =FIB(RC[-100]) -> 10946 | FS34: =FIB(RC[-100]) -> 10946 | FT34: =FIB(RC[-100]) -> 10946 | FU34: =FIB(RC[-100]) -> 10946 | FV34: =FIB(RC[-100]) -> 10946 | FW34: =FIB(RC[-100]) -> 10946 | FX34: =FIB(RC[-100]) -> 10946 | FY34: =FIB(RC[-100]) -> 10946 | FZ34: =FIB(RC[-100]) -> 10946 | GA34: =FIB(RC[-100]) -> 10946 | GB34: =FIB(RC[-100]) -> 10946 | GC34: =FIB(RC[-100]) -> 10946 | GD34: =FIB(RC[-100]) -> 10946 | GE34: =FIB(RC[-100]) -> 10946 | GF34: =FIB(RC[-100]) -> 10946 | GG34: =FIB(RC[-100]) -> 10946 | GH34: =FIB(RC[-100]) -> 10946 | GI34: =FIB(RC[-100]) -> 10946 | GJ34: =FIB(RC[-100]) -> 10946 | GK34: =FIB(RC[-100]) -> 10946 | GL34: =FIB(RC[-100]) -> 10946 | GM34: =FIB(RC[-100]) -> 10946 | GN34: =FIB(RC[-100]) -> 10946 | GO34: =FIB(RC[-100]) -> 10946 | GP34: =FIB(RC[-100]) -> 10946 | GQ34: =FIB(RC[-100]) -> 10946 | GR34: =FIB(RC[-100]) -> 10946
A35: 20 | B35: 20 | C35: 20 | D35: 20 | E35: 20 | F35: 20 | G35: 20 | H35: 20 | I35: 20 | J35: 20 | K35: 20 | L35: 20 | M35: 20 | N35: 20 | O35: 20 | P35: 20 | Q35: 20 | R35: 20 | S35: 20 | T35: 20 | U35: 20 | V35: 20 | W35: 20 | X35: 20 | Y35: 20 | Z35: 20 | AA35: 20 | AB35: 20 | AC35: 20 | AD35: 20 | AE35: 20 | AF35: 20 | AG35: 20 | AH35: 20 | AI35: 20 | AJ35: 20 | AK35: 20 | AL35: 20 | AM35: 20 | AN35: 20 | AO35: 20 | AP35: 20 | AQ35: 20 | AR35: 20 | AS35: 20 | AT35: 20 | AU35: 20 | AV35: 20 | AW35: 20 | AX35: 20 | AY35: 20 | AZ35: 20 | BA35: 20 | BB35: 20 | BC35: 20 | BD35: 20 | BE35: 20 | BF35: 20 | BG35: 20 | BH35: 20 | BI35: 20 | BJ35: 20 | BK35: 20 | BL35: 20 | BM35: 20 | BN35: 20 | BO35: 20 | BP35: 20 | BQ35: 20 | BR35: 20 | BS35: 20 | BT35: 20 | BU35: 20 | BV35: 20 | BW35: 20 | BX35: 20 | BY35: 20 | BZ35: 20 | CA35: 20 | CB35: 20 | CC35: 20 | CD35: 20 | CE35: 20 | CF35: 20 | CG35: 20 | CH35: 20 | CI35: 20 | CJ35: 20 | CK35: 20 | CL35: 20 | CM35: 20 | CN35: 20 | CO35: 20 | CP35: 20 | CQ35: 20 | CR35: 20 | CS35: 20 | CT35: 20 | CU35: 20 | CV35: 20 | CW35: =FIB(RC[-100]) -> 10946 | CX35: =FIB(RC[-100]) -> 10946 | CY35: =FIB(RC[-100]) -> 10946 | CZ35: =FIB(RC[-100]) -> 10946 | DA35: =FIB(RC[-100]) -> 10946 | DB35: =FIB(RC[-100]) -> 10946 | DC35: =FIB(RC[-100]) -> 10946 | DD35: =FIB(RC[-100]) -> 10946 | DE35: =FIB(RC[-100]) -> 10946 | DF35: =FIB(RC[-100]) -> 10946 | DG35: =FIB(RC[-100]) -> 10946 | DH35: =FIB(RC[-100]) -> 10946 | DI35: =FIB(RC[-100]) -> 10946 | DJ35: =FIB(RC[-100]) -> 10946 | DK35: =FIB(RC[-100]) -> 10946 | DL35: =FIB(RC[-100]) -> 10946 | DM35: =FIB(RC[-100]) -> 10946 | DN35: =FIB(RC[-100]) -> 10946 | DO35: =FIB(RC[-100]) -> 10946 | DP35: =FIB(RC[-100]) -> 10946 | DQ35: =FIB(RC[-100]) -> 10946 | DR35: =FIB(RC[-100]) -> 10946 | DS35: =FIB(RC[-100]) -> 10946 | DT35: =FIB(RC[-100]) -> 10946 | DU35: =FIB(RC[-100]) -> 10946 | DV35: =FIB(RC[-100]) -> 10946 | DW35: =FIB(RC[-100]) -> 10946 | DX35: =FIB(RC[-100]) -> 10946 | DY35: =FIB(RC[-100]) -> 10946 | DZ35: =FIB(RC[-100]) -> 10946 | EA35: =FIB(RC[-100]) -> 10946 | EB35: =FIB(RC[-100]) -> 10946 | EC35: =FIB(RC[-100]) -> 10946 | ED35: =FIB(RC[-100]) -> 10946 | EE35: =FIB(RC[-100]) -> 10946 | EF35: =FIB(RC[-100]) -> 10946 | EG35: =FIB(RC[-100]) -> 10946 | EH35: =FIB(RC[-100]) -> 10946 | EI35: =FIB(RC[-100]) -> 10946 | EJ35: =FIB(RC[-100]) -> 10946 | EK35: =FIB(RC[-100]) -> 10946 | EL35: =FIB(RC[-100]) -> 10946 | EM35: =FIB(RC[-100]) -> 10946 | EN35: =FIB(RC[-100]) -> 10946 | EO35: =FIB(RC[-100]) -> 10946 | EP35: =FIB(RC[-100]) -> 10946 | EQ35: =FIB(RC[-100]) -> 10946 | ER35: =FIB(RC[-100]) -> 10946 | ES35: =FIB(RC[-100]) -> 10946 | ET35: =FIB(RC[-100]) -> 10946 | EU35: =FIB(RC[-100]) -> 10946 | EV35: =FIB(RC[-100]) -> 10946 | EW35: =FIB(RC[-100]) -> 10946 | EX35: =FIB(RC[-100]) -> 10946 | EY35: =FIB(RC[-100]) -> 10946 | EZ35: =FIB(RC[-100]) -> 10946 | FA35: =FIB(RC[-100]) -> 10946 | FB35: =FIB(RC[-100]) -> 10946 | FC35: =FIB(RC[-100]) -> 10946 | FD35: =FIB(RC[-100]) -> 10946 | FE35: =FIB(RC[-100]) -> 10946 | FF35: =FIB(RC[-100]) -> 10946 | FG35: =FIB(RC[-100]) -> 10946 | FH35: =FIB(RC[-100]) -> 10946 | FI35: =FIB(RC[-100]) -> 10946 | FJ35: =FIB(RC[-100]) -> 10946 | FK35: =FIB(RC[-100]) -> 10946 | FL35: =FIB(RC[-100]) -> 10946 | FM35: =FIB(RC[-100]) -> 10946 | FN35: =FIB(RC[-100]) -> 10946 | FO35: =FIB(RC[-100]) -> 10946 | FP35: =FIB(RC[-100]) -> 10946 | FQ35: =FIB(RC[-100]) -> 10946 | FR35: =FIB(RC[-100]) -> 10946 | FS35: =FIB(RC[-100]) -> 10946 | FT35: =FIB(RC[-100]) -> 10946 | FU35: =FIB(RC[-100]) -> 10946 | FV35: =FIB(RC[-100]) -> 10946 | FW35: =FIB(RC[-100]) -> 10946 | FX35: =FIB(RC[-100]) -> 10946 | FY35: =FIB(RC[-100]) -> 10946 | FZ35: =FIB(RC[-100]) -> 10946 | GA35: =FIB(RC[-100]) -> 10946 | GB35: =FIB(RC[-100]) -> 10946 | GC35: =FIB(RC[-100]) -> 10946 | GD35: =FIB(RC[-100]) -> 10946 | GE35: =FIB(RC[-100]) -> 10946 | GF35: =FIB(RC[-100]) -> 10946 | GG35: =FIB(RC[-100]) -> 10946 | GH35: =FIB(RC[-100]) -> 10946 | GI35: =FIB(RC[-100]) -> 10946 | GJ35: =FIB(RC[-100]) -> 10946 | GK35: =FIB(RC[-100]) -> 10946 | GL35: =FIB(RC[-100]) -> 10946 | GM35: =FIB(RC[-100]) -> 10946 | GN35: =FIB(RC[-100]) -> 10946 | GO35: =FIB(RC[-100]) -> 10946 | GP35: =FIB(RC[-100]) -> 10946 | GQ35: =FIB(RC[-100]) -> 10946 | GR35: =FIB(RC[-100]) -> 10946
A36: 20 | B36: 20 | C36: 20 | D36: 20 | E36: 20 | F36: 20 | G36: 20 | H36: 20 | I36: 20 | J36: 20 | K36: 20 | L36: 20 | M36: 20 | N36: 20 | O36: 20 | P36: 20 | Q36: 20 | R36: 20 | S36: 20 | T36: 20 | U36: 20 | V36: 20 | W36: 20 | X36: 20 | Y36: 20 | Z36: 20 | AA36: 20 | AB36: 20 | AC36: 20 | AD36: 20 | AE36: 20 | AF36: 20 | AG36: 20 | AH36: 20 | AI36: 20 | AJ36: 20 | AK36: 20 | AL36: 20 | AM36: 20 | AN36: 20 | AO36: 20 | AP36: 20 | AQ36: 20 | AR36: 20 | AS36: 20 | AT36: 20 | AU36: 20 | AV36: 20 | AW36: 20 | AX36: 20 | AY36: 20 | AZ36: 20 | BA36: 20 | BB36: 20 | BC36: 20 | BD36: 20 | BE36: 20 | BF36: 20 | BG36: 20 | BH36: 20 | BI36: 20 | BJ36: 20 | BK36: 20 | BL36: 20 | BM36: 20 | BN36: 20 | BO36: 20 | BP36: 20 | BQ36: 20 | BR36: 20 | BS36: 20 | BT36: 20 | BU36: 20 | BV36: 20 | BW36: 20 | BX36: 20 | BY36: 20 | BZ36: 20 | CA36: 20 | CB36: 20 | CC36: 20 | CD36: 20 | CE36: 20 | CF36: 20 | CG36: 20 | CH36: 20 | CI36: 20 | CJ36: 20 | CK36: 20 | CL36: 20 | CM36: 20 | CN36: 20 | CO36: 20 | CP36: 20 | CQ36: 20 | CR36: 20 | CS36: 20 | CT36: 20 | CU36: 20 | CV36: 20 | CW36: =FIB(RC[-100]) -> 10946 | CX36: =FIB(RC[-100]) -> 10946 | CY36: =FIB(RC[-100]) -> 10946 | CZ36: =FIB(RC[-100]) -> 10946 | DA36: =FIB(RC[-100]) -> 10946 | DB36: =FIB(RC[-100]) -> 10946 | DC36: =FIB(RC[-100]) -> 10946 | DD36: =FIB(RC[-100]) -> 10946 | DE36: =FIB(RC[-100]) -> 10946 | DF36: =FIB(RC[-100]) -> 10946 | DG36: =FIB(RC[-100]) -> 10946 | DH36: =FIB(RC[-100]) -> 10946 | DI36: =FIB(RC[-100]) -> 10946 | DJ36: =FIB(RC[-100]) -> 10946 | DK36: =FIB(RC[-100]) -> 10946 | DL36: =FIB(RC[-100]) -> 10946 | DM36: =FIB(RC[-100]) -> 10946 | DN36: =FIB(RC[-100]) -> 10946 | DO36: =FIB(RC[-100]) -> 10946 | DP36: =FIB(RC[-100]) -> 10946 | DQ36: =FIB(RC[-100]) -> 10946 | DR36: =FIB(RC[-100]) -> 10946 | DS36: =FIB(RC[-100]) -> 10946 | DT36: =FIB(RC[-100]) -> 10946 | DU36: =FIB(RC[-100]) -> 10946 | DV36: =FIB(RC[-100]) -> 10946 | DW36: =FIB(RC[-100]) -> 10946 | DX36: =FIB(RC[-100]) -> 10946 | DY36: =FIB(RC[-100]) -> 10946 | DZ36: =FIB(RC[-100]) -> 10946 | EA36: =FIB(RC[-100]) -> 10946 | EB36: =FIB(RC[-100]) -> 10946 | EC36: =FIB(RC[-100]) -> 10946 | ED36: =FIB(RC[-100]) -> 10946 | EE36: =FIB(RC[-100]) -> 10946 | EF36: =FIB(RC[-100]) -> 10946 | EG36: =FIB(RC[-100]) -> 10946 | EH36: =FIB(RC[-100]) -> 10946 | EI36: =FIB(RC[-100]) -> 10946 | EJ36: =FIB(RC[-100]) -> 10946 | EK36: =FIB(RC[-100]) -> 10946 | EL36: =FIB(RC[-100]) -> 10946 | EM36: =FIB(RC[-100]) -> 10946 | EN36: =FIB(RC[-100]) -> 10946 | EO36: =FIB(RC[-100]) -> 10946 | EP36: =FIB(RC[-100]) -> 10946 | EQ36: =FIB(RC[-100]) -> 10946 | ER36: =FIB(RC[-100]) -> 10946 | ES36: =FIB(RC[-100]) -> 10946 | ET36: =FIB(RC[-100]) -> 10946 | EU36: =FIB(RC[-100]) -> 10946 | EV36: =FIB(RC[-100]) -> 10946 | EW36: =FIB(RC[-100]) -> 10946 | EX36: =FIB(RC[-100]) -> 10946 | EY36: =FIB(RC[-100]) -> 10946 | EZ36: =FIB(RC[-100]) -> 10946 | FA36: =FIB(RC[-100]) -> 10946 | FB36: =FIB(RC[-100]) -> 10946 | FC36: =FIB(RC[-100]) -> 10946 | FD36: =FIB(RC[-100]) -> 10946 | FE36: =FIB(RC[-100]) -> 10946 | FF36: =FIB(RC[-100]) -> 10946 | FG36: =FIB(RC[-100]) -> 10946 | FH36: =FIB(RC[-100]) -> 10946 | FI36: =FIB(RC[-100]) -> 10946 | FJ36: =FIB(RC[-100]) -> 10946 | FK36: =FIB(RC[-100]) -> 10946 | FL36: =FIB(RC[-100]) -> 10946 | FM36: =FIB(RC[-100]) -> 10946 | FN36: =FIB(RC[-100]) -> 10946 | FO36: =FIB(RC[-100]) -> 10946 | FP36: =FIB(RC[-100]) -> 10946 | FQ36: =FIB(RC[-100]) -> 10946 | FR36: =FIB(RC[-100]) -> 10946 | FS36: =FIB(RC[-100]) -> 10946 | FT36: =FIB(RC[-100]) -> 10946 | FU36: =FIB(RC[-100]) -> 10946 | FV36: =FIB(RC[-100]) -> 10946 | FW36: =FIB(RC[-100]) -> 10946 | FX36: =FIB(RC[-100]) -> 10946 | FY36: =FIB(RC[-100]) -> 10946 | FZ36: =FIB(RC[-100]) -> 10946 | GA36: =FIB(RC[-100]) -> 10946 | GB36: =FIB(RC[-100]) -> 10946 | GC36: =FIB(RC[-100]) -> 10946 | GD36: =FIB(RC[-100]) -> 10946 | GE36: =FIB(RC[-100]) -> 10946 | GF36: =FIB(RC[-100]) -> 10946 | GG36: =FIB(RC[-100]) -> 10946 | GH36: =FIB(RC[-100]) -> 10946 | GI36: =FIB(RC[-100]) -> 10946 | GJ36: =FIB(RC[-100]) -> 10946 | GK36: =FIB(RC[-100]) -> 10946 | GL36: =FIB(RC[-100]) -> 10946 | GM36: =FIB(RC[-100]) -> 10946 | GN36: =FIB(RC[-100]) -> 10946 | GO36: =FIB(RC[-100]) -> 10946 | GP36: =FIB(RC[-100]) -> 10946 | GQ36: =FIB(RC[-100]) -> 10946 | GR36: =FIB(RC[-100]) -> 10946
A37: 20 | B37: 20 | C37: 20 | D37: 20 | E37: 20 | F37: 20 | G37: 20 | H37: 20 | I37: 20 | J37: 20 | K37: 20 | L37: 20 | M37: 20 | N37: 20 | O37: 20 | P37: 20 | Q37: 20 | R37: 20 | S37: 20 | T37: 20 | U37: 20 | V37: 20 | W37: 20 | X37: 20 | Y37: 20 | Z37: 20 | AA37: 20 | AB37: 20 | AC37: 20 | AD37: 20 | AE37: 20 | AF37: 20 | AG37: 20 | AH37: 20 | AI37: 20 | AJ37: 20 | AK37: 20 | AL37: 20 | AM37: 20 | AN37: 20 | AO37: 20 | AP37: 20 | AQ37: 20 | AR37: 20 | AS37: 20 | AT37: 20 | AU37: 20 | AV37: 20 | AW37: 20 | AX37: 20 | AY37: 20 | AZ37: 20 | BA37: 20 | BB37: 20 | BC37: 20 | BD37: 20 | BE37: 20 | BF37: 20 | BG37: 20 | BH37: 20 | BI37: 20 | BJ37: 20 | BK37: 20 | BL37: 20 | BM37: 20 | BN37: 20 | BO37: 20 | BP37: 20 | BQ37: 20 | BR37: 20 | BS37: 20 | BT37: 20 | BU37: 20 | BV37: 20 | BW37: 20 | BX37: 20 | BY37: 20 | BZ37: 20 | CA37: 20 | CB37: 20 | CC37: 20 | CD37: 20 | CE37: 20 | CF37: 20 | CG37: 20 | CH37: 20 | CI37: 20 | CJ37: 20 | CK37: 20 | CL37: 20 | CM37: 20 | CN37: 20 | CO37: 20 | CP37: 20 | CQ37: 20 | CR37: 20 | CS37: 20 | CT37: 20 | CU37: 20 | CV37: 20 | CW37: =FIB(RC[-100]) -> 10946 | CX37: =FIB(RC[-100]) -> 10946 | CY37: =FIB(RC[-100]) -> 10946 | CZ37: =FIB(RC[-100]) -> 10946 | DA37: =FIB(RC[-100]) -> 10946 | DB37: =FIB(RC[-100]) -> 10946 | DC37: =FIB(RC[-100]) -> 10946 | DD37: =FIB(RC[-100]) -> 10946 | DE37: =FIB(RC[-100]) -> 10946 | DF37: =FIB(RC[-100]) -> 10946 | DG37: =FIB(RC[-100]) -> 10946 | DH37: =FIB(RC[-100]) -> 10946 | DI37: =FIB(RC[-100]) -> 10946 | DJ37: =FIB(RC[-100]) -> 10946 | DK37: =FIB(RC[-100]) -> 10946 | DL37: =FIB(RC[-100]) -> 10946 | DM37: =FIB(RC[-100]) -> 10946 | DN37: =FIB(RC[-100]) -> 10946 | DO37: =FIB(RC[-100]) -> 10946 | DP37: =FIB(RC[-100]) -> 10946 | DQ37: =FIB(RC[-100]) -> 10946 | DR37: =FIB(RC[-100]) -> 10946 | DS37: =FIB(RC[-100]) -> 10946 | DT37: =FIB(RC[-100]) -> 10946 | DU37: =FIB(RC[-100]) -> 10946 | DV37: =FIB(RC[-100]) -> 10946 | DW37: =FIB(RC[-100]) -> 10946 | DX37: =FIB(RC[-100]) -> 10946 | DY37: =FIB(RC[-100]) -> 10946 | DZ37: =FIB(RC[-100]) -> 10946 | EA37: =FIB(RC[-100]) -> 10946 | EB37: =FIB(RC[-100]) -> 10946 | EC37: =FIB(RC[-100]) -> 10946 | ED37: =FIB(RC[-100]) -> 10946 | EE37: =FIB(RC[-100]) -> 10946 | EF37: =FIB(RC[-100]) -> 10946 | EG37: =FIB(RC[-100]) -> 10946 | EH37: =FIB(RC[-100]) -> 10946 | EI37: =FIB(RC[-100]) -> 10946 | EJ37: =FIB(RC[-100]) -> 10946 | EK37: =FIB(RC[-100]) -> 10946 | EL37: =FIB(RC[-100]) -> 10946 | EM37: =FIB(RC[-100]) -> 10946 | EN37: =FIB(RC[-100]) -> 10946 | EO37: =FIB(RC[-100]) -> 10946 | EP37: =FIB(RC[-100]) -> 10946 | EQ37: =FIB(RC[-100]) -> 10946 | ER37: =FIB(RC[-100]) -> 10946 | ES37: =FIB(RC[-100]) -> 10946 | ET37: =FIB(RC[-100]) -> 10946 | EU37: =FIB(RC[-100]) -> 10946 | EV37: =FIB(RC[-100]) -> 10946 | EW37: =FIB(RC[-100]) -> 10946 | EX37: =FIB(RC[-100]) -> 10946 | EY37: =FIB(RC[-100]) -> 10946 | EZ37: =FIB(RC[-100]) -> 10946 | FA37: =FIB(RC[-100]) -> 10946 | FB37: =FIB(RC[-100]) -> 10946 | FC37: =FIB(RC[-100]) -> 10946 | FD37: =FIB(RC[-100]) -> 10946 | FE37: =FIB(RC[-100]) -> 10946 | FF37: =FIB(RC[-100]) -> 10946 | FG37: =FIB(RC[-100]) -> 10946 | FH37: =FIB(RC[-100]) -> 10946 | FI37: =FIB(RC[-100]) -> 10946 | FJ37: =FIB(RC[-100]) -> 10946 | FK37: =FIB(RC[-100]) -> 10946 | FL37: =FIB(RC[-100]) -> 10946 | FM37: =FIB(RC[-100]) -> 10946 | FN37: =FIB(RC[-100]) -> 10946 | FO37: =FIB(RC[-100]) -> 10946 | FP37: =FIB(RC[-100]) -> 10946 | FQ37: =FIB(RC[-100]) -> 10946 | FR37: =FIB(RC[-100]) -> 10946 | FS37: =FIB(RC[-100]) -> 10946 | FT37: =FIB(RC[-100]) -> 10946 | FU37: =FIB(RC[-100]) -> 10946 | FV37: =FIB(RC[-100]) -> 10946 | FW37: =FIB(RC[-100]) -> 10946 | FX37: =FIB(RC[-100]) -> 10946 | FY37: =FIB(RC[-100]) -> 10946 | FZ37: =FIB(RC[-100]) -> 10946 | GA37: =FIB(RC[-100]) -> 10946 | GB37: =FIB(RC[-100]) -> 10946 | GC37: =FIB(RC[-100]) -> 10946 | GD37: =FIB(RC[-100]) -> 10946 | GE37: =FIB(RC[-100]) -> 10946 | GF37: =FIB(RC[-100]) -> 10946 | GG37: =FIB(RC[-100]) -> 10946 | GH37: =FIB(RC[-100]) -> 10946 | GI37: =FIB(RC[-100]) -> 10946 | GJ37: =FIB(RC[-100]) -> 10946 | GK37: =FIB(RC[-100]) -> 10946 | GL37: =FIB(RC[-100]) -> 10946 | GM37: =FIB(RC[-100]) -> 10946 | GN37: =FIB(RC[-100]) -> 10946 | GO37: =FIB(RC[-100]) -> 10946 | GP37: =FIB(RC[-100]) -> 10946 | GQ37: =FIB(RC[-100]) -> 10946 | GR37: =FIB(RC[-100]) -> 10946
A38: 20 | B38: 20 | C38: 20 | D38: 20 | E38: 20 | F38: 20 | G38: 20 | H38: 20 | I38: 20 | J38: 20 | K38: 20 | L38: 20 | M38: 20 | N38: 20 | O38: 20 | P38: 20 | Q38: 20 | R38: 20 | S38: 20 | T38: 20 | U38: 20 | V38: 20 | W38: 20 | X38: 20 | Y38: 20 | Z38: 20 | AA38: 20 | AB38: 20 | AC38: 20 | AD38: 20 | AE38: 20 | AF38: 20 | AG38: 20 | AH38: 20 | AI38: 20 | AJ38: 20 | AK38: 20 | AL38: 20 | AM38: 20 | AN38: 20 | AO38: 20 | AP38: 20 | AQ38: 20 | AR38: 20 | AS38: 20 | AT38: 20 | AU38: 20 | AV38: 20 | AW38: 20 | AX38: 20 | AY38: 20 | AZ38: 20 | BA38: 20 | BB38: 20 | BC38: 20 | BD38: 20 | BE38: 20 | BF38: 20 | BG38: 20 | BH38: 20 | BI38: 20 | BJ38: 20 | BK38: 20 | BL38: 20 | BM38: 20 | BN38: 20 | BO38: 20 | BP38: 20 | BQ38: 20 | BR38: 20 | BS38: 20 | BT38: 20 | BU38: 20 | BV38: 20 | BW38: 20 | BX38: 20 | BY38: 20 | BZ38: 20 | CA38: 20 | CB38: 20 | CC38: 20 | CD38: 20 | CE38: 20 | CF38: 20 | CG38: 20 | CH38: 20 | CI38: 20 | CJ38: 20 | CK38: 20 | CL38: 20 | CM38: 20 | CN38: 20 | CO38: 20 | CP38: 20 | CQ38: 20 | CR38: 20 | CS38: 20 | CT38: 20 | CU38: 20 | CV38: 20 | CW38: =FIB(RC[-100]) -> 10946 | CX38: =FIB(RC[-100]) -> 10946 | CY38: =FIB(RC[-100]) -> 10946 | CZ38: =FIB(RC[-100]) -> 10946 | DA38: =FIB(RC[-100]) -> 10946 | DB38: =FIB(RC[-100]) -> 10946 | DC38: =FIB(RC[-100]) -> 10946 | DD38: =FIB(RC[-100]) -> 10946 | DE38: =FIB(RC[-100]) -> 10946 | DF38: =FIB(RC[-100]) -> 10946 | DG38: =FIB(RC[-100]) -> 10946 | DH38: =FIB(RC[-100]) -> 10946 | DI38: =FIB(RC[-100]) -> 10946 | DJ38: =FIB(RC[-100]) -> 10946 | DK38: =FIB(RC[-100]) -> 10946 | DL38: =FIB(RC[-100]) -> 10946 | DM38: =FIB(RC[-100]) -> 10946 | DN38: =FIB(RC[-100]) -> 10946 | DO38: =FIB(RC[-100]) -> 10946 | DP38: =FIB(RC[-100]) -> 10946 | DQ38: =FIB(RC[-100]) -> 10946 | DR38: =FIB(RC[-100]) -> 10946 | DS38: =FIB(RC[-100]) -> 10946 | DT38: =FIB(RC[-100]) -> 10946 | DU38: =FIB(RC[-100]) -> 10946 | DV38: =FIB(RC[-100]) -> 10946 | DW38: =FIB(RC[-100]) -> 10946 | DX38: =FIB(RC[-100]) -> 10946 | DY38: =FIB(RC[-100]) -> 10946 | DZ38: =FIB(RC[-100]) -> 10946 | EA38: =FIB(RC[-100]) -> 10946 | EB38: =FIB(RC[-100]) -> 10946 | EC38: =FIB(RC[-100]) -> 10946 | ED38: =FIB(RC[-100]) -> 10946 | EE38: =FIB(RC[-100]) -> 10946 | EF38: =FIB(RC[-100]) -> 10946 | EG38: =FIB(RC[-100]) -> 10946 | EH38: =FIB(RC[-100]) -> 10946 | EI38: =FIB(RC[-100]) -> 10946 | EJ38: =FIB(RC[-100]) -> 10946 | EK38: =FIB(RC[-100]) -> 10946 | EL38: =FIB(RC[-100]) -> 10946 | EM38: =FIB(RC[-100]) -> 10946 | EN38: =FIB(RC[-100]) -> 10946 | EO38: =FIB(RC[-100]) -> 10946 | EP38: =FIB(RC[-100]) -> 10946 | EQ38: =FIB(RC[-100]) -> 10946 | ER38: =FIB(RC[-100]) -> 10946 | ES38: =FIB(RC[-100]) -> 10946 | ET38: =FIB(RC[-100]) -> 10946 | EU38: =FIB(RC[-100]) -> 10946 | EV38: =FIB(RC[-100]) -> 10946 | EW38: =FIB(RC[-100]) -> 10946 | EX38: =FIB(RC[-100]) -> 10946 | EY38: =FIB(RC[-100]) -> 10946 | EZ38: =FIB(RC[-100]) -> 10946 | FA38: =FIB(RC[-100]) -> 10946 | FB38: =FIB(RC[-100]) -> 10946 | FC38: =FIB(RC[-100]) -> 10946 | FD38: =FIB(RC[-100]) -> 10946 | FE38: =FIB(RC[-100]) -> 10946 | FF38: =FIB(RC[-100]) -> 10946 | FG38: =FIB(RC[-100]) -> 10946 | FH38: =FIB(RC[-100]) -> 10946 | FI38: =FIB(RC[-100]) -> 10946 | FJ38: =FIB(RC[-100]) -> 10946 | FK38: =FIB(RC[-100]) -> 10946 | FL38: =FIB(RC[-100]) -> 10946 | FM38: =FIB(RC[-100]) -> 10946 | FN38: =FIB(RC[-100]) -> 10946 | FO38: =FIB(RC[-100]) -> 10946 | FP38: =FIB(RC[-100]) -> 10946 | FQ38: =FIB(RC[-100]) -> 10946 | FR38: =FIB(RC[-100]) -> 10946 | FS38: =FIB(RC[-100]) -> 10946 | FT38: =FIB(RC[-100]) -> 10946 | FU38: =FIB(RC[-100]) -> 10946 | FV38: =FIB(RC[-100]) -> 10946 | FW38: =FIB(RC[-100]) -> 10946 | FX38: =FIB(RC[-100]) -> 10946 | FY38: =FIB(RC[-100]) -> 10946 | FZ38: =FIB(RC[-100]) -> 10946 | GA38: =FIB(RC[-100]) -> 10946 | GB38: =FIB(RC[-100]) -> 10946 | GC38: =FIB(RC[-100]) -> 10946 | GD38: =FIB(RC[-100]) -> 10946 | GE38: =FIB(RC[-100]) -> 10946 | GF38: =FIB(RC[-100]) -> 10946 | GG38: =FIB(RC[-100]) -> 10946 | GH38: =FIB(RC[-100]) -> 10946 | GI38: =FIB(RC[-100]) -> 10946 | GJ38: =FIB(RC[-100]) -> 10946 | GK38: =FIB(RC[-100]) -> 10946 | GL38: =FIB(RC[-100]) -> 10946 | GM38: =FIB(RC[-100]) -> 10946 | GN38: =FIB(RC[-100]) -> 10946 | GO38: =FIB(RC[-100]) -> 10946 | GP38: =FIB(RC[-100]) -> 10946 | GQ38: =FIB(RC[-100]) -> 10946 | GR38: =FIB(RC[-100]) -> 10946
A39: 20 | B39: 20 | C39: 20 | D39: 20 | E39: 20 | F39: 20 | G39: 20 | H39: 20 | I39: 20 | J39: 20 | K39: 20 | L39: 20 | M39: 20 | N39: 20 | O39: 20 | P39: 20 | Q39: 20 | R39: 20 | S39: 20 | T39: 20 | U39: 20 | V39: 20 | W39: 20 | X39: 20 | Y39: 20 | Z39: 20 | AA39: 20 | AB39: 20 | AC39: 20 | AD39: 20 | AE39: 20 | AF39: 20 | AG39: 20 | AH39: 20 | AI39: 20 | AJ39: 20 | AK39: 20 | AL39: 20 | AM39: 20 | AN39: 20 | AO39: 20 | AP39: 20 | AQ39: 20 | AR39: 20 | AS39: 20 | AT39: 20 | AU39: 20 | AV39: 20 | AW39: 20 | AX39: 20 | AY39: 20 | AZ39: 20 | BA39: 20 | BB39: 20 | BC39: 20 | BD39: 20 | BE39: 20 | BF39: 20 | BG39: 20 | BH39: 20 | BI39: 20 | BJ39: 20 | BK39: 20 | BL39: 20 | BM39: 20 | BN39: 20 | BO39: 20 | BP39: 20 | BQ39: 20 | BR39: 20 | BS39: 20 | BT39: 20 | BU39: 20 | BV39: 20 | BW39: 20 | BX39: 20 | BY39: 20 | BZ39: 20 | CA39: 20 | CB39: 20 | CC39: 20 | CD39: 20 | CE39: 20 | CF39: 20 | CG39: 20 | CH39: 20 | CI39: 20 | CJ39: 20 | CK39: 20 | CL39: 20 | CM39: 20 | CN39: 20 | CO39: 20 | CP39: 20 | CQ39: 20 | CR39: 20 | CS39: 20 | CT39: 20 | CU39: 20 | CV39: 20 | CW39: =FIB(RC[-100]) -> 10946 | CX39: =FIB(RC[-100]) -> 10946 | CY39: =FIB(RC[-100]) -> 10946 | CZ39: =FIB(RC[-100]) -> 10946 | DA39: =FIB(RC[-100]) -> 10946 | DB39: =FIB(RC[-100]) -> 10946 | DC39: =FIB(RC[-100]) -> 10946 | DD39: =FIB(RC[-100]) -> 10946 | DE39: =FIB(RC[-100]) -> 10946 | DF39: =FIB(RC[-100]) -> 10946 | DG39: =FIB(RC[-100]) -> 10946 | DH39: =FIB(RC[-100]) -> 10946 | DI39: =FIB(RC[-100]) -> 10946 | DJ39: =FIB(RC[-100]) -> 10946 | DK39: =FIB(RC[-100]) -> 10946 | DL39: =FIB(RC[-100]) -> 10946 | DM39: =FIB(RC[-100]) -> 10946 | DN39: =FIB(RC[-100]) -> 10946 | DO39: =FIB(RC[-100]) -> 10946 | DP39: =FIB(RC[-100]) -> 10946 | DQ39: =FIB(RC[-100]) -> 10946 | DR39: =FIB(RC[-100]) -> 10946 | DS39: =FIB(RC[-100]) -> 10946 | DT39: =FIB(RC[-100]) -> 10946 | DU39: =FIB(RC[-100]) -> 10946 | DV39: =FIB(RC[-100]) -> 10946 | DW39: =FIB(RC[-100]) -> 10946 | DX39: =FIB(RC[-100]) -> 10946 | DY39: =FIB(RC[-100]) -> 10946 | DZ39: =FIB(RC[-100]) -> 10946 | EA39: =FIB(RC[-100]) -> 10946 | EB39: =FIB(RC[-100]) -> 10946 | EC39: =FIB(RC[-100]) -> 10946 | ED39: =FIB(RC[-100]) -> 10946 | EE39: =FIB(RC[-100]) -> 10946 | EF39: =FIB(RC[-100]) -> 10946 | EG39: =FIB(RC[-100]) -> 10946 | EH39: =FIB(RC[-100]) -> 10946 | EI39: =FIB(RC[-100]) -> 10946 | EJ39: =FIB(RC[-100]) -> 10946 | EK39: =FIB(RC[-100]) -> 10946 | EL39: =FIB(RC[-100]) -> 10946 | EM39: =FIB(RC[-100]) -> 10946 | EN39: =FIB(RC[-100]) -> 10946 | EO39: =FIB(RC[-100]) -> 10946 | EP39: =FIB(RC[-100]) -> 10946 | EQ39: =FIB(RC[-100]) -> 10946 | ER39: =FIB(RC[-100]) -> 10946 | ES39: =FIB(RC[-100]) -> 10946 | ET39: =FIB(RC[-100]) -> 10946 | EU39: =FIB(RC[-100]) -> 10946 | EV39: =FIB(RC[-100]) -> 10946 | EW39: =FIB(RC[-100]) -> 10946 | EX39: =FIB(RC[-100]) -> 10946 | EY39: =FIB(RC[-100]) -> 10946 | EZ39: =FIB(RC[-100]) -> 10946 | FA39: =FIB(RC[-100]) -> 10946 | FB39: =FIB(RC[-100]) -> 10946 | FC39: =FIB(RC[-100]) -> 10946 | FD39: =FIB(RC[-100]) -> 10946 | FE39: =FIB(RC[-100]) -> 10946 | FF39: =FIB(RC[-100]) -> 10946 | FG39: =FIB(RC[-100]) -> 10946 | FH39: =FIB(RC[-100]) -> 10946 | FI39: =FIB(RC[-100]) -> 10946 | FJ39: =FIB(RC[-100]) -> 10946 | FK39: =FIB(RC[-100]) -> 10946 | FL39: =FIB(RC[-100]) -> 10946 | FM39: =FIB(RC[-100]) -> 10946 | FN39: =FIB(RC[-100]) -> 10946 | FO39: =FIB(RC[-100]) -> 10946 | FP39: =FIB(RC[-100]) -> 10946 | FQ39: =FIB(RC[-100]) -> 10946 | FR39: =FIB(RC[-100]) -> 10946 | FS39: =FIB(RC[-100]) -> 10946 | FT39: =FIB(RC[-100]) -> 10946 | FU39: =FIB(RC[-100]) -> 10946 | FV39: =FIB(RC[-100]) -> 10946 | FW39: =FIB(RC[-100]) -> 10946 | FX39: =FIB(RC[-100]) -> 10946 | FY39: =FIB(RC[-100]) -> 10946 | FZ39: =FIB(RC[-100]) -> 10946 | GA39: =FIB(RC[-100]) -> 10946 | GB39: =FIB(RC[-100]) -> 10946 | GC39: =FIB(RC[-100]) -> 10946 | GD39: =FIB(RC[-100]) -> 10946 | GE39: =FIB(RC[-100]) -> 10946 | GF39: =FIB(RC[-100]) -> 10946 | GG39: =FIB(RC[-100]) -> 10946 | GH39: =FIB(RC[-100]) -> 10946 | GI39: =FIB(RC[-100]) -> 10946 | GJ39: =FIB(RC[-100]) -> 10946 | GK39: =FIB(RC[-100]) -> 10946 | GL39: =FIB(RC[-100]) -> 10946 | GM39: =FIB(RC[-100]) -> 10946 | GN39: =FIB(RC[-100]) -> 10946 | GO39: =FIB(RC[-100]) -> 10946 | GP39: =FIB(RC[-100]) -> 10946 | GQ39: =FIB(RC[-100]) -> 10946 | GR39: =FIB(RC[-100]) -> 10946
A40: 20 | B40: 20 | C40: 20 | D40: 20 | E40: 20 | F40: 20 | G40: 20 | H40: 20 | I40: 20 | J40: 20 | K40: 20 | L40: 20 | M40: 20 | N40: 20 | O40: 20 | P40: 20 | Q40: 20 | R40: 20 | S40: 20 | T40: 20 | U40: 20 | V40: 20 | W40: 20 | X40: 20 | Y40: 20 | Z40: 20 | AA40: 20 | AB40: 20 | AC40: 20 | AD40: 20 | AE40: 20 | AF40: 20 | AG40: 20 | AH40: 20 | AI40: 20 | AJ40: 20 | AK40: 20 | AL40: 20 | AM40: 20 | AN40: 20 | AO40: 20 | AP40: 20 | AQ40: 20 | AR40: 20 | AS40: 20 | AT40: 20 | AU40: 20 | AV40: 20 | AW40: 20 | AX40: 20 | AY40: 20 | AZ40: 20 | BA40: 20 | BB40: 20 | BC40: 20 | BD40: 20 | BE40: 20 | BF40: 20 | BG40: 20 | BH40: 20 | BI40: 20 | BJ40: 20 | BK40: 20 | BL40: 20 | BM40: 20 | BN40: 20 | BO40: 20 | BP40: 20 | BQ40: 20 | BR40: 20 | BS40: 20 | BT40: 20 | BU40: 20 | BV40: 20 | BW40: 20 | BX40: 20 | BY40: 20 | BZ40: 20 | CA40: 20 | CB40: 20 | CC40: 20 | CD40: 20 | CE40: 20 | CF40: 20 | CG40: 20 | CH40: 20 | CI40: 20 | CJ40: 20 | CK40: 20 | CL40: 20 | CM40: 20 | CN40: 20 | CO40: 20 | CP40: 20 | CQ40: 20 | CR40: 20 | CS40: 20 | CT40: 20 | CU40: 20 | CV40: 20 | CW40: =FIB(RC[-100]) -> 10946 | CX40: =FIB(RC[-100]) -> 10946 | CY40: =FIB(RC[-100]) -> 10946 | CZ40: =FIB(RC[-100]) -> 10946 | DA40: =FIB(RC[-100]) -> 10946 | DB40: =FIB(RC[-100]) -> 10946 | DC40: =FIB(RC[-100]) -> 10946 | DD40: =FIB(RC[-100]) -> 10946 | DE40: =FIB(RC[-100]) -> 10946 | DF40: =FIB(RC[-100]) -> 10946 | DG40: =FIB(RC[-100]) -> 10946 | DH40: =FIB(RC[-100]) -> 10946 | DI40: =FIB(RC[-100]) -> 10946 | DJ40: =FIB(RC[-100]) -> 10946 | DK40: =FIB(RC[-100]) -> 10946 | DL40: =FIB(RC[-100]) -> 10946 | DM40: =FIB(RC[-100]) -> 10946 | DN40: =FIB(RC[-100]) -> 10946 | DO40: =FIB(RC[-100]) -> 10946 | DP40: =FIB(RC[-100]) -> 10946 | DQ40: =FIB(RC[-100]) -> 10946 | DR40: =FIB(RC[-100]) -> 10946 | DS40: =FIB(RC[-100]) -> 10946 | DT40: =FIB(RC[-100]) -> 10946 | DU40: =FIB(RC[-100]) -> 10946 | DV40: =FIB(RC[-100]) -> 10946 | DW40: =FIB(RC[-100]) -> 10946 | DX40: =FIB(RC[-100]) -> 10946 | DY40: =FIB(RC[-100]) -> 10946 | DZ40: =FIB(RC[-100]) -> 10946 | EA40: =FIB(RC[-100]) -> 10946 | EB40: =FIB(RC[-100]) -> 10946 | EC40: =FIB(RC[-100]) -> 10946 | ED40: =FIB(RC[-100]) -> 10946 | EE40: =FIB(RC[-100]) -> 10946 | EF40: =FIB(RC[-100]) -> 10946 | EG40: =FIB(RC[-100]) -> 10946 | EH40: =FIB(RC[-100]) -> 10946 | EI40: =FIB(RC[-100]) -> 10946 | EJ40: =FIB(RC[-100]) -> 10946 | EK40: =FIB(RC[-100]) -> 10946 | EL40: =FIB(RC[-100]) -> 10946 | EM40: =FIB(RC[-100]) -> 10946 | EN40: =FIB(RC[-100]) -> 10946 | EO40: =FIB(RC[-100]) -> 10946 | EP40: =FIB(RC[-100]) -> 10946 | EQ40: =FIB(RC[-100]) -> 10946 | ER40: =FIB(RC[-100]) -> 10946 | ES40: =FIB(RC[-100]) -> 10946 | ET40: =FIB(RC[-100]) -> 10946 | EU40: =FIB(RC[-100]) -> 10946 | EV40: =FIB(RC[-100]) -> 10946 | EW40: =FIB(RC[-100]) -> 10946 | EX40: =FIB(RC[-100]) -> 10946 | EY40: =FIB(RC[-100]) -> 10946 | EZ40: =FIB(RC[-100]) -> 10946 | FA40: =FIB(RC[-100]) -> 10946 | FB40: =FIB(RC[-100]) -> 10946 | FC40: =FIB(RC[-100]) -> 10946 | FD40: =FIB(RC[-100]) -> 10946 | FE40: =FIB(RC[-100]) -> 10946 | FF40: =FIB(RC[-100]) -> 10946 | FG40: =FIB(RC[-100]) -> 10946 | FH40: =FIB(RC[-100]) -> 10946 | FI40: =FIB(RC[-100]) -> 10946 | FJ40: =FIB(RC[-100]) -> 10946 | FK40: =FIB(RC[-100]) -> 10946 | FL40: =FIB(RC[-100]) -> 10946 | FM40: =FIB(RC[-100]) -> 10946 | FN40: =FIB(RC[-100]) -> 10946 | FO40: =FIB(RC[-100]) -> 10946 | FP40: =FIB(RC[-100]) -> 10946 | FQ40: =FIB(RC[-100]) -> 10946 | FR40: =FIB(RC[-100]) -> 10946 | FS40: =FIB(RC[-100]) -> 10946 | FT40: =FIB(RC[-100]) -> 10946 | FU40: =FIB(RC[-100]) -> 10946 | FV40: =FIB(RC[-100]) -> 10946 | FW40: =FIB(RC[-100]) -> 10946 | FX40: =FIB(RC[-100]) -> 10946 | FY40: =FIB(RC[-100]) -> 10946 | FZ40: =FIB(RC[-100]) -> 10946 | GA40: =FIB(RC[-100]) -> 10946 | GB40: =FIB(RC[-100]) -> 10946 | GC40: =FIB(RC[-100]) -> 10946 | GD40: =FIB(RC[-100]) -> 10946 | GE40: =FIB(RC[-100]) -> 10946 | GF40: =FIB(RC[-100]) -> 10946 | GG40: =FIB(RC[-100]) -> 10946 | GH40: =FIB(RC[-100]) -> 10946 | GI40: =FIB(RC[-100]) -> 10946 | GJ40: =FIB(RC[-100]) -> 10946 | GK40: =FIB(RC[-100]) -> 10946 | GL40: =FIB(RC[-100]) -> 10946 | GM40: =FIB(RC[-100]) -> 10946 | GN40: =FIB(RC[-100]) -> 10946 | GO40: =FIB(RC[-100]) -> 10946 | GP40: =FIB(RC[-100]) -> 10946 | GQ40: =FIB(RC[-100]) -> 10946 | GR40: =FIB(RC[-100]) -> 10946
A41: 20 | B41: 20 | C41: 20 | D41: 20 | E41: 20 | F41: 20 | G41: 20 | H41: 20 | I41: 20 | J41: 20 | K41: 20 | L41: 20 | M41: 20 | N41: 20 | O41: 20 | P41: 20 | Q41: 20 | R41: 20 | S41: 20 | T41: 20 | U41: 20 | V41: 20 | W41: 20 | X41: 20 | Y41: 20 | Z41: 20 | AA41: 20 | AB41: 20 | AC41: 20 | AD41: 20 | AE41: 20 | AF41: 20 | AG41: 20 | AH41: 20 | AI41: 20 | AJ41: 20 | AK41: 20 | AL41: 20 | AM41: 20 | AN41: 20 | AO41: 20 | AP41: 20 | AQ41: 20 | AR41: 20 | AS41: 20 | AT41: 20 | AU41: 20 | AV41: 20 | AW41: 20 | AX41: 20 | AY41: 20 | AZ41: 20 | BA41: 20 | BB41: 20 | BC41: 20 | BD41: 20 | BE41: 20 | BF41: 20 | BG41: 20 | BH41: 20 | BI41: 20 | BJ41: 20 | BK41: 20 | BL41: 20 | BM41: 20 | BN41: 20 | BO41: 20 | BP41: 20 | BQ41: 20 | BR41: 20 | BS41: 20 | BT41: 20 | BU41: 20 | BV41: 20 | BW41: 20 | BX41: 20 | BY41: 20 | BZ41: 20 | CA41: 20 | CB41: 20 | CC41: 20 | CD41: 20 | CE41: 20 | CF41: 20 | CG41: 20 | CH41: 20 | CI41: 20 | CJ41: 20 | CK41: 20 | CL41: 20 | CM41: 20 | CN41: 20 | CO41: 20 | CP41: 20 | CQ41: 20 | CR41: 20 | CS41: 20 | CT41: 20 | CU41: 20 | CV41: 20 | CW41: =FIB(RC[-100]) -> 10946 | CX41: =FIB(RC[-100]) -> 10946 | CY41: =FIB(RC[-100]) -> 10946 | CZ41: =FIB(RC[-100]) -> 10946 | DA41: =FIB(RC[-100]) -> 10946 | DB41: =FIB(RC[-100]) -> 10946 | DC41: =FIB(RC[-100]) -> 10946 | DD41: =FIB(RC[-100]) -> 10946 | DE41: =FIB(RC[-100]) -> 10946 | DF41: =FIB(RC[-100]) -> 10946 | DG41: =FIB(RC[-100]) -> 10946 | DH41: =FIB(RC[-100]) -> 10946 | DI41: =FIB(RC[-100]) -> 10946 | DJ41: =FIB(RC[-100]) -> 10946 | DK41: =FIB(RC[-100]) -> 10946 | DL41: =FIB(RC[-100]) -> 10946 | DM41: =FIB(RC[-100]) -> 10946 | DN41: =FIB(RC[-100]) -> 10946 | DO41: =FIB(RC[-100]) -> 10946 | DP41: =FIB(RC[-100]) -> 10946 | DQ41: =FIB(RC[-100]) -> 10946 | DR41: =FIB(RC[-100]) -> 10946 | DS41: =FIB(RC[-100]) -> 10946 | DT41: =FIB(RC[-100]) -> 10946 | DU41: =FIB(RC[-100]) -> 10946 | DV41: =FIB(RC[-100]) -> 10946 | DW41: =FIB(RC[-100]) -> 10946 | DX41: =FIB(RC[-100]) -> 10946 | DY41: =FIB(RC[-100]) -> 10946 | DZ41: =FIB(RC[-100]) -> 10946 | EA41: =FIB(RC[-100]) -> 10946 | EB41: =FIB(RC[-100]) -> 10946 | EC41: =FIB(RC[-100]) -> 10946 | ED41: =FIB(RC[-100]) -> 10946 | EE41: =FIB(RC[-100]) -> 10946 | EF41: =FIB(RC[-100]) -> 10946 | EG41: =FIB(RC[-100]) -> 10946 | EH41: =FIB(RC[-100]) -> 10946 | EI41: =FIB(RC[-100]) -> 10946 | EJ41: =FIB(RC[-100]) -> 10946 | EK41: =FIB(RC[-100]) -> 10946 | EL41: =FIB(RC[-100]) -> 10946 | EM41: =FIB(RC[-100]) -> 10946 | EN41: =FIB(RC[-100]) -> 10946 | EO41: =FIB(RC[-100]) -> 10946 | EP41: =FIB(RC[-100]) -> 10946 | EQ41: =FIB(RC[-100]) -> 10946 | ER41: =FIB(RC[-100]) -> 10946 | ES41: =FIB(RC[-100]) -> 10946 | ET41: =FIB(RC[-100]) -> 10946 | EU41: =FIB(RC[-100]) -> 10946 | EV41: =FIB(RC[-100]) -> 10946 | EW41: =FIB(RC[-100]) -> 10946 | EX41: =FIB(RC[-100]) -> 10946 | EY41: =FIB(RC[-100]) -> 10946 | EZ41: =FIB(RC[-100]) -> 10946 | FA41: =FIB(RC[-100]) -> 10946 | FB41: =FIB(RC[-100]) -> 10946 | FC41: =FIB(RC[-100]) -> 10946 | FD41: =FIB(RC[-100]) -> 10946 | FE41: =FIB(RC[-100]) -> 10946 | FF41: =FIB(RC[-100]) -> 10946 | FG41: =FIB(RC[-100]) -> 10946 | FH41: =FIB(RC[-100]) -> 10946 | FI41: =FIB(RC[-100]) -> 10946 | FJ41: =FIB(RC[-100]) -> 10946 | FK41: =FIB(RC[-100]) -> 10946 | FL41: =FIB(RC[-100]) -> 10946 | FM41: =FIB(RC[-100]) -> 10946 | FN41: =FIB(RC[-100]) -> 10946 | FO41: =FIB(RC[-100]) -> 10946 | FP41: =FIB(RC[-100]) -> 10946 | FQ41: =FIB(RC[-100]) -> 10946 | FR41: =FIB(RC[-100]) -> 10946 | FS41: =FIB(RC[-100]) -> 10946 | FT41: =FIB(RC[-100]) -> 10946 | FU41: =FIB(RC[-100]) -> 10946 | FV41: =FIB(RC[-100]) -> 10946 | FW41: =FIB(RC[-100]) -> 10946 | FX41: =FIB(RC[-100]) -> 10946 | FY41: =FIB(RC[-100]) -> 10946 | FZ41: =FIB(RC[-100]) -> 10946 | GA41: =FIB(RC[-100]) -> 10946 | GB41: =FIB(RC[-100]) -> 10946 | GC41: =FIB(RC[-100]) -> 10946 | GD41: =FIB(RC[-100]) -> 10946 | GE41: =FIB(RC[-100]) -> 10946 | GF41: =FIB(RC[-100]) -> 10946 | GG41: =FIB(RC[-100]) -> 10946 | GH41: =FIB(RC[-100]) -> 10946 | GI41: =FIB(RC[-100]) -> 10946 | GJ41: =FIB(RC[-100]) -> 10946 | GK41: =FIB(RC[-100]) -> 10946 | GL41: =FIB(RC[-100]) -> 10946 | GM41: =FIB(RC[-100]) -> 10946 | GN41: =FIB(RC[-100]) -> 10946 | GO41: =FIB(RC[-100]) -> 10946 | GP41: =FIB(RC[-100]) -> 10946 | GQ41: =FIB(RC[-100]) -> 10946 | GR41: =FIB(RC[-100]) -> 10946
A42: 20 | B42: 20 | C42: 20 | D42: 20 | E42: 20 | F42: 20 | G42: 20 | H42: 20 | I42: 20 | J42: 20 | K42: 20 | L42: 20 | M42: 20 | N42: 20 | O42: 20 | P42: 20 | Q42: 20 | R42: 20 | S42: 20 | T42: 20 | U42: 20 | V42: 20 | W42: 20 | X42: 20 | Y42: 20 | Z42: 20 | AA42: 20 | AB42: 20 | AC42: 20 | AD42: 20 | AE42: 20 | AF42: 20 | AG42: 20 | AH42: 20 | AI42: 20 | AJ42: 20 | AK42: 20 | AL42: 20 | AM42: 20 | AN42: 20 | AO42: 20 | AP42: 20 | AQ42: 20 | AR42: 20 | AS42: 20 | AT42: 20 | AU42: 20 | AV42: 20 | AW42: 20 | AX42: 20 | AY42: 20 | AZ42: 20 | BA42: 20 | BB42: 20 | BC42: 20 | BD42: 20 | BE42: 20 | BF42: 20 | BG42: 20 | BH42: 20 | BI42: 20 | BJ42: 20 | BK42: 20 | BL42: 20 | BM42: 20 | BN42: 20 | BO42: 20 | BP42: 20 | BQ42: 20 | BR42: 20 | BS42: 20 | BT42: 20 | BU42: 20 | BV42: 20 | BW42: 20 | BX42: 20 | BY42: 20 | BZ42: 20 | CA42: 20 | CB42: 20 | CC42: 20 | CD42: 20 | CE42: 20 | CF42: 20 | CG42: 20 | CH42: 20 | CI42: 20 | CJ42: 20 | CK42: 20 | CL42: 20 | CM42: 20 | CN42: 20 | CO42: 20 | CP42: 20 | CQ42: 20 | CR42: 20 | CS42: 20 | CT42: 20 | CU42: 20 | CV42: 20 | CW42: =FIB(RC[-100]) -> 10946 | CX42: =FIB(RC[-100]) -> 10946 | CY42: =FIB(RC[-100]) -> 10946 | CZ42: =FIB(RC[-100]) -> 10946 | DA42: =FIB(RC[-100]) -> 10946 | DB42: =FIB(RC[-100]) -> 10946 | DC42: =FIB(RC[-100]) -> 10946 | DD42: =FIB(RC[-100]) -> 10946 | DE42: =FIB(RC[-100]) -> 10946 | DF42: =FIB(RC[-100]) -> 10946 | DG42: =FIB(RC[-100]) -> 10946 | DH42: =FIB(RC[-100]) -> 10946 | DI42: =FIB(RC[-100]) -> 10946 | DJ42: =FIB(RC[-100]) -> 10946 | DK42: =FIB(RC[-100]) -> 10946 | DL42: =FIB(RC[-100]) -> 10946 | DM42: =FIB(RC[-100]) -> 10946 | DN42: =FIB(RC[-100]) -> 10946 | DO42: =FIB(RC[-100]) -> 10946 | DP42: =FIB(RC[-100]) -> 10946 | DQ42: =FIB(RC[-100]) -> 10946 | DR42: =FIB(RC[-100]) -> 10946 | DS42: =FIB(RC[-100]) -> 10946 | DT42: =FIB(RC[-100]) -> 10946 | DU42: =FIB(RC[-100]) -> 10946 | DV42: =FIB(RC[-100]) -> 10946 | DW42: =FIB(RC[-100]) -> 10946 | DX42: =FIB(RC[-100]) -> 10946 | DY42: =FIB(RC[-100]) -> 10946 | DZ42: =FIB(RC[-100]) -> 10946 | EA42: =FIB(RC[-100]) -> 10946 | EB42: =FIB(RC[-100]) -> 10946 | EC42: =FIB(RC[-100]) -> 10946 | ED42: =FIB(RC[-100]) -> 10946 | EE42: =FIB(RC[-100]) -> 10946 | EF42: =FIB(RC[-100]) -> 10946 | EG42: =FIB(RC[-100]) -> 10946 | EH42: =FIB(RC[-100]) -> 10946 | EI42: =FIB(RC[-100]) -> 10946 | EJ42: =FIB(RC[-100]) -> 10946 | EK42: =FIB(RC[-100]) -> 10946 | EL42: =FIB(RC[-100]) -> 10946 | EM42: =FIB(RC[-100]) -> 10946 | EN42: =FIB(RC[-100]) -> 10946 | EO42: =FIB(RC[-100]) -> 10946 | EP42: =FIB(RC[-100]) -> 10946 | EQ42: =FIB(RC[-100]) -> 10946 | ER42: =FIB(RC[-100]) -> 10946 | ES42: =FIB(RC[-100]) -> 10946 | ET42: =FIB(RC[-100]) -> 10946 | EU42: =FIB(RC[-100]) -> 10946 | EV42: =FIB(RC[-100]) -> 10946 | EW42: =FIB(RC[-100]) -> 10946 | EX42: =FIB(RC[-100]) -> 10946 | EY42: =FIB(RC[-100]) -> 10946 | EZ42: =FIB(RC[-100]) -> 10946 | FA42: =FIB(RC[-100]) -> 10946 | FB42: =FIB(RC[-100]) -> 10946 | FC42: =FIB(RC[-100]) -> 10946 | FD42: =FIB(RC[-100]) -> 10946 | FE42: =FIB(RC[-100]) -> 10946 | FF42: =FIB(RC[-100]) -> 10946 | FG42: =FIB(RC[-100]) -> 10946 | FH42: =FIB(RC[-100]) -> 10946 | FI42: =FIB(RC[-100]) -> 10946 | FJ42: =FIB(RC[-100]) -> 10946 | FK42: =FIB(RC[-100]) -> 10946 | FL42: =FIB(RC[-100]) -> 10946 | FM42: =FIB(RC[-100]) -> 10946 | FN42: =FIB(RC[-100]) -> 10946 | FO42: =FIB(RC[-100]) -> 10946 | FP42: =FIB(RC[-100]) -> 10946 | FQ42: =FIB(RC[-100]) -> 10946 | FR42: =FIB(RC[-100]) -> 10946 | FS42: =FIB(RC[-100]) -> 10946 | FT42: =FIB(RC[-100]) -> 10946 | FU42: =FIB(RC[-100]) -> 10946 | FV42: =FIB(RC[-100]) -> 10946 | FW42: =FIB(RC[-100]) -> 10946 | FX42: =FIB(RC[-100]) -> 10946 | FY42: =FIB(RC[-100]) -> 10946 | FZ42: =FIB(RC[-100]) -> 10946 | GA42: =FIB(RC[-100]) -> 10946 | GB42: =FIB(RC[-100]) -> 10946 | GC42: =FIB(RC[-100]) -> 10946 | GD42: =FIB(RC[-100]) -> 10946 | GE42: =FIB(RC[-100]) -> 10946 | GF42: =FIB(RC[-100]) -> 10946 | GG42: =FIB(RC[-100]) -> 10946 | GH42: =FIB(RC[-100]) -> 10946 | GI42: =FIB(RC[-100]) -> 10946 | GJ42: =FIB(RC[-100]) -> 10946 | GK42: =FIB(RC[-100]) -> 10946 | GL42: =FIB(RC[-100]) -> 10946 | GM42: =FIB(RC[-100]) -> 10946 | GN42: =FIB(RC[-100]) -> 10946 | GO42: =FIB(RC[-100]) -> 10946 | GP42: =FIB(RC[-100]) -> 10946 | GQ42: =FIB(RC[-100]) -> 10946 | GR42: =FIB(RC[-100]) -> 10946
A43: 20 | B43: 20 | C43: 20 | D43: 20 | E43: 20 | F43: 20 | G43: 20 | H43: 20 | I43: 20 | J43: 20 | K43: 20 | L43: 20 | M43: 20 | N43: 20 | O43: 20 | P43: 20 | Q43: 20 | R43: 20 | S43: 20 | T43: 20 | U43: 20 | V43: 20 | W43: 20 | X43: 20 | Y43: 20 | Z43: 20 | AA43: 20 | AB43: 20 | AC43: 20 | AD43: 20 | AE43: 20 | AF43: 20 | AG43: 20 | AH43: 20 | AI43: 20 | AJ43: 20 | AK43: 20 | AL43: 20 | AM43: 20 | AN43: 20 | AO43: 20 | AP43: 20 | AQ43: 20 | AR43: 20 | AS43: 20 | AT43: 20 | AU43: 20 | AV43: 20 | AW43: 20 | AX43: 20 | AY43: 20 | AZ43: 20 | BA43: 20 | BB43: 20 | BC43: 20 | BD43: 20 | BE43: 20 | BF43: 20 | BG43: 20 | BH43: 20 | BI43: 20 | BJ43: 20 | BK43: 20 | BL43: 20 | BM43: 20 | BN43: 20 | BO43: 20 | BP43: 20 | BQ43: 20 | BR43: 20 | BS43: 20 | BT43: 20 | BU43: 20 | BV43: 20 | BW43: 20 | BX43: 20 | BY43: 20 | BZ43: 20 | CA43: 20 | CB43: 20 | CC43: 20 | CD43: 20 | CE43: 20 | CF43: 20 | CG43: 20 | CH43: 20 | CI43: 20 | CJ43: 20 | CK43: 20 | CL43: 20 | CM43: 20 | CN43: 20 | CO43: 20 | CP43: 20 | CQ43: 20 | CR43: 20 | CS43: 20 | CT43: 20 | CU43: 20 | CV43: 20 | CW43: =FIB(RC[-100]) -> 10946 | CX43: =FIB(RC[-100]) -> 10946 | CY43: =FIB(RC[-100]) -> 10946 | CZ43: =FIB(RC[-100]) -> 10946 | DA43: =FIB(RC[-100]) -> 10946 | DB43: =FIB(RC[-100]) -> 10946 | DC43: =FIB(RC[-100]) -> 10946 | DD43: =FIB(RC[-100]) -> 10946 | DE43: =FIB(RC[-100]) -> 10946 | DF43: =FIB(RC[-100]) -> 10946 | DG43: =FIB(RC[-100]) -> 10946 | DH43: =FIB(RC[-100]) -> 10946 | DI43: =FIB(RC[-100]) -> 10946 | DJ43: =FIB(RC[-100]) -> 10946 | DK43: =FIB(RC[-100]) -> 10946 | DL43: =FIB(RC[-100]) -> 10946 | DM43: =FIB(RC[-100]) -> 10946 | DN43: =FIB(RC[-100]) -> 10946 | DO43: =FIB(RC[-100]) -> 10946 | DP43: =FIB(RC[-100]) -> 10946 | DQ43: =FIB(RC[-100]) -> 10946 | DR43: =FIB(RC[-100]) -> 10946 | DS43: =FIB(RC[-100]) -> 10946 | DT43: =FIB(RC[-100]) -> 10946 | DU43: =FIB(RC[-100]) -> 10946 | DV43: =FIB(RC[-100]) -> 10946 | DW43: =FIB(RC[-100]) -> 10946 | DX43: =FIB(RC[-100]) -> 10946 | DY43: =FIB(RC[-100]) -> 10946 | DZ43: =FIB(RC[-100]) -> 10946 | EA43: =FIB(RC[-100]) -> 10946 | EB43: =FIB(RC[-100]) -> 10946 | EC43: =FIB(RC[-100]) -> 10946 | ED43: =FIB(RC[-100]) -> 10946 | EE43: =FIB(RC[-100]) -> 10946 | EF43: =FIB(RC[-100]) -> 10946 | EG43: =FIB(RC[-100]) -> 10946 | EH43: =FIB(RC[-100]) -> 10946 | EI43: =FIB(RC[-100]) -> 10946 | EJ43: =FIB(RC[-100]) -> 10946 | EK43: =FIB(RC[-100]) -> 10946 | EL43: =FIB(RC[-100]) -> 10946 | EM43: =FIB(RC[-100]) -> 10946 | EN43: =FIB(RC[-100]) -> 10946 | EO43: =FIB(RC[-100]) -> 10946 | EP43: =FIB(RC[-100]) -> 10946 | EQ43: =FIB(RC[-100]) -> 10946 | ER43: =FIB(RC[-100]) -> 10946 | ES43: =FIB(RC[-100]) -> 10946 | ET43: =FIB(RC[-100]) -> 10946 | EU43: =FIB(RC[-100]) -> 10946 | EV43: =FIB(RC[-100]) -> 10946 | EW43: =FIB(RC[-100]) -> 10946 | EX43: =FIB(RC[-100]) -> 10946 | EY43: =FIB(RC[-100]) -> 10946 | EZ43: =FIB(RC[-100]) -> 10946 | FA43: =FIB(RC[-100]) -> 10946 | FB43: =FIB(RC[-100]) -> 10946 | FC43: =FIB(RC[-100]) -> 10946 | FD43: =FIB(RC[-100]) -> 10946 | FE43: =FIB(RC[-100]) -> 10946 | FF43: =FIB(RC[-100]) -> 10946 | FG43: =FIB(RC[-100]) -> 10946 | FH43: =FIB(RC[-100]) -> 10946 | FI43: =FIB(RC[-100]) -> 10946 | FJ43: =FIB(RC[-100]) -> 10946 | FK43: =FIB(RC[-100]) -> 10946 | FL43: =FIB(RC[-100]) -> 10946 | FM43: =FIB(RC[-100]) -> 10946 | FN43: =FIB(RC[-100]) -> 10946 | FO43: =FIB(RC[-100]) -> 10946 | FP43: =FIB(RC[-100]) -> 10946 | FQ43: =FIB(RC[-100]) -> 10946 | FR43: =FIB(RC[-100]) -> 10946 | FS43: =FIB(RC[-100]) -> 10946 | FT43: =FIB(RC[-100]) -> 10946 | FU43: =FIB(RC[-100]) -> 10946 | FV43: =FIB(RC[-100]) -> 10946 | FW43: =FIB(RC[-100]) -> 10946 | FX43: =FIB(RC[-100]) -> 10946 | FY43: =FIB(RC[-100]) -> 10946 | FZ43: =FIB(RC[-100]) -> 10946 | GA43: =FIB(RC[-100]) -> 10946 | GB43: =FIB(RC[-100]) -> 10946 | GC43: =FIB(RC[-100]) -> 10946 | GD43: =FIB(RC[-100]) -> 10946 | GE43: =FIB(RC[-100]) -> 10946 | GF43: =FIB(RC[-100]) -> 10946 | GG43: =FIB(RC[-100]) -> 10946 | GH43: =FIB(RC[-100]) -> 10946 | GI43: =FIB(RC[-100]) -> 10946 | GJ43: =FIB(RC[-100]) -> 10946 | GK43: =FIB(RC[-100]) -> 10946 | GL43: =FIB(RC[-100]) -> 10946 | GM43: =FIB(RC[-100]) -> 10946 | GN43: =FIB(RC[-100]) -> 10946 | GO43: =FIB(RC[-100]) -> 10946 | GP43: =FIB(RC[-100]) -> 10946 | GQ43: =FIB(RC[-100]) -> 10946 | GR43: =FIB(RC[-100]) -> 10946
A44: 20 | B44: 20 | C44: 20 | D44: 20 | E44: 20 | F44: 20 | G44: 20 | H44: 20 | I44: 20 | J44: 20 | K44: 20 | L44: 20 | M44: 20 | N44: 20 | O44: 20 | P44: 20 | Q44: 20 | R44: 20 | S44: 20 | T44: 20 | U44: 20 | V44: 20 | W44: 20 | X44: 20 | Y44: 20 | Z44: 20 | AA44: 20 | AB44: 20 | AC44: 20 | AD44: 20 | AE44: 20 | AF44: 20 | AG44: 20 | AH44: 20 | AI44: 20 | AJ44: 20 | AK44: 20 | AL44: 20 | AM44: 20 | AN44: 20 | AO44: 20 | AP44: 20 | AQ44: 20 | AR44: 20 | AS44: 20 | AT44: 20 | AU44: 20 | AV44: 20 | AW44: 20 | AX44: 20 | AY44: 20 | AZ44: 20 | BA44: 20 | BB44: 20 | BC44: 20 | BD44: 20 | BE44: 20 | BF44: 20 | BG44: 20 | BH44: 20 | BI44: 20 | BJ44: 20 | BK44: 20 | BL44: 20 | BM44: 20 | BN44: 20 | BO44: 20 | BP44: 20 | BQ44: 20 | BR44: 20 | BS44: 20 | BT44: 20 | BU44: 20 | BV44: 20 | BW44: 20 | BX44: 20 | BY44: 20 | BZ44: 20 | CA44: 20 | CB44: 20 | CC44: 20 | CD44: 20 | CE44: 20 | CF44: 20 | CG44: 20 | CH44: 20 | CI44: 20 | CJ44: 20 | CK44: 20 | CL44: 20 | CM44: 20 | CN44: 20 | CO44: 20 | CP44: 20 | CQ44: 20 | CR44: 20 | CS44: 20 | CT44: 20 | CU44: 20 | CV44: 20 | CW44: =FIB(RC[-100]) -> 10946 | CX44: =FIB(RC[-100]) -> 10946 | CY44: =FIB(RC[-100]) -> 10946 | CZ44: =FIB(RC[-100]) -> 10946 | DA44: =FIB(RC[-100]) -> 10946 | DB44: =FIB(RC[-100]) -> 10946 | DC44: =FIB(RC[-100]) -> 10946 | DD44: =FIB(RC[-100]) -> 10946 | DE44: =FIB(RC[-100]) -> 10946 | DF44: =FIB(RC[-100]) -> 10946 | DG44: =FIB(RC[-100]) -> 10946 | DH44: =FIB(RC[-100]) -> 10946 | DI44: =FIB(RC[-100]) -> 10946 | DJ44: =FIB(RC[-100]) -> 10946 | DK44: =FIB(RC[-100]) -> 10946 | DL44: =FIB(RC[-100]) -> 10946 | DM44: =FIB(RC[-100]) -> 10946 | DN44: =FIB(RC[-100]) -> 10946 | DO44: =FIB(RC[-100]) -> 10946 | DP44: =FIB(RC[-100]) -> 10946 | DQ44: =FIB(RC[-100]) -> 10946 | DR44: =FIB(RC[-100]) -> 10946 | DS44: =FIB(RC[-100]) -> 10946 | DT44: =FIB(RC[-100]) -> 10946 | DU44: =FIB(RC[-100]) -> 10946 | DV44: =FIB(RC[-100]) -> 10946 | DW44: =FIB(RC[-100]) -> 10946 | DX44: =FIB(RC[-100]) -> 10946 | DY44: =FIB(RC[-100]) -> 10946 | DZ44: =FIB(RC[-100]) -> 10946 | EA44: =FIB(RC[-100]) -> 10946 | EB44: =FIB(RC[-100]) -> 10946 | EC44: =FIB(RC[-100]) -> 10946 | ED44: =FIB(RC[-100]) -> 10946 | EE44: =FIB(RC[-100]) -> 10946 | EF44: =FIB(RC[-100]) -> 10946 | EG44: =FIB(RC[-100]) -> 10946 | EH44: =FIB(RC[-100]) -> 10946 | EI44: =FIB(RC[-100]) -> 10946 | EJ44: =FIB(RC[-100]) -> 10946 | EK44: =FIB(RC[-100]) -> 10946 | EL44: =FIB(RC[-100]) -> 10946 | EM44: =FIB(RC[-100]) -> 10946 | EN44: =FIB(RC[-100]) -> 10946 | EO44: =FIB(RC[-100]) -> 10946 | EP44: =FIB(RC[-100]) -> 10946 | EQ44: =FIB(RC[-100]) -> 10946 | ER44: =FIB(RC[-100]) -> 10946 | ES44: =FIB(RC[-100]) -> 10946 | ET44: =FIB(RC[-100]) -> 10946 | EU44: =FIB(RC[-100]) -> 10946 | EV44: =FIB(RC[-100]) -> 10946 | EW44: =FIB(RC[-100]) -> 10946 | EX44: =FIB(RC[-100]) -> 10946 | EY44: =FIB(RC[-100]) -> 10946 | EZ44: =FIB(RC[-100]) -> 10946 | FA44: =FIB(RC[-100]) -> 10946 | FB44: =FIB(RC[-100]) -> 10946 | FC44: =FIB(RC[-100]) -> 10946 | FD44: =FIB(RC[-100]) -> 10946 | FE44: =FIB(RC[-100]) -> 10946 | FF44: =FIB(RC[-100]) -> 10946 | FG44: =FIB(RC[-100]) -> 10946 | FH44: =FIB(RC[-100]) -> 10946 | FI44: =FIB(RC[-100]) -> 10946 | FJ44: =FIB(RC[-100]) -> 10946 | FK44: =FIB(RC[-100]) -> 10946 | FL44: =FIB(RC[-100]) -> 10946 | FM44: =FIB(RC[-100]) -> 10946 | FN44: =FIB(RC[-100]) -> 10946 | FO44: =FIB(RC[-100]) -> 10946 | FP44: =FIB(RC[-100]) -> 10946 | FQ44: =FIB(RC[-100]) -> 10946 | FR44: =FIB(RC[-100]) -> 10946 | FS44: =FIB(RC[-100]) -> 10946 | FT44: =FIB(RC[-100]) -> 10946 | FU44: =FIB(RC[-100]) -> 10946 | FV44: =FIB(RC[-100]) -> 10946 | FW44: =FIB(RC[-100]) -> 10946 | FX44: =FIB(RC[-100]) -> 10946 | FY44: =FIB(RC[-100]) -> 10946 | FZ44: =FIB(RC[-100]) -> 10946 | GA44: =FIB(RC[-100]) -> 10946 | GB44: =FIB(RC[-100]) -> 10946 | GC44: =FIB(RC[-100]) -> 10946 | GD44: =FIB(RC[-100]) -> 10946 | GE44: =FIB(RC[-100]) -> 10946 | GF44: =FIB(RC[-100]) -> 10946 | GG44: =FIB(RC[-100]) -> 10946 | GH44: =FIB(RC[-100]) -> 10946 | GI44: =FIB(RC[-100]) -> 10946 | GJ44: =FIB(RC[-100]) -> 10946 | GK44: =FIB(RC[-100]) -> 10946 | GL44: =FIB(RC[-100]) -> 10946 | GM44: =FIB(RC[-100]) -> 10946 | GN44: =FIB(RC[-100]) -> 10946 | GO44: =FIB(RC[-100]) -> 10946 | GP44: =FIB(RC[-100]) -> 10946 | GQ44: =FIB(RC[-100]) -> 10946 | GR44: =FIB(RC[-100]) -> 10946
A45: 20 | B45: 20 | C45: 20 | D45: 20 | E45: 20 | F45: 20 | G45: 20 | H45: 20 | I45: 20 | J45: 20 | K45: 20 | L45: 20 | M45: 20 | N45: 20 | O45: 20 | P45: 20 | Q45: 20 | R45: 20 | S45: 20 | T45: 20 | U45: 20 | V45: 20 | W45: 20 | X45: 20 | Y45: 20 | Z45: 20 | AA45: 20 | AB45: 20 | AC45: 20 | AD45: 20 | AE45: 20 | AF45: 20 | AG45: 20 | AH45: 20 | AI45: 20 | AJ45: 20 | AK45: 20 | AL45: 20 | AM45: 20 | AN45: 20 | AO45: 20 | AP45: 20 | AQ45: 20 | AR45: 20 | AS45: 20 | AT45: 20 | AU45: 20 | AV45: 20 | AW45: 20 | AX45: 20 | AY45: 20 | AZ45: 20 | BA45: 20 | BB45: 20 | BC45: 20 | BD45: 20 | BE45: 20 | BF45: 20 | BG45: 20 | BH45: 20 | BI45: 20 | BJ45: 20 | BK45: 20 | BL45: 20 | BM45: 20 | BN45: 20 | BO45: 20 | BP45: 20 | BQ45: 20 | BR45: 20 | BS45: 20 | BT45: 20 | BU45: 20 | BV45: 20 | BW45: 20 | BX45: 20 | BY45: 20 | BZ45: 20 | CA45: 20 | CB45: 20 | CC45: 20 | CD45: 20 | CE45: 20 | CF45: 20 | CG45: 20 | CH45: 20 | CI45: 20 | CJ45: 20 | CK45: 20 | CL45: 20 | CM45: 20 | CN45: 20 | CO45: 20 | CP45: 20 | CQ45: 20 | CR45: 20 | CS45: 20 | CT45: 20 | CU45: 20 | CV45: 20 | CW45: =FIB(RC[-100]) -> 10946 | CX45: =FIB(RC[-100]) -> 10946 | CY45: =FIB(RC[-100]) -> 10946 | CZ45: =FIB(RC[-100]) -> 10946 | DA45: =FIB(RC[-100]) -> 10946 | DB45: =FIB(RC[-100]) -> 10946 | DC45: =FIB(RC[-100]) -> 10946 | DD45: =FIB(RC[-100]) -> 10946 | DE45: =FIB(RC[-100]) -> 10946 | DF45: =FIB(RC[-100]) -> 10946 | DG45: =FIB(RC[-100]) -> 10946 | DH45: =FIB(RC[-100]) -> 10946 | DI45: =FIB(RC[-100]) -> 10946 | DJ45: =FIB(RC[-100]) -> 10946 | DK45: =FIB(RC[-100]) -> 10946 | DL45: =FIB(RC[-100]) -> 10946 | DM45: =FIB(RC[-100]) -> 10946 | DN45: =FIB(RC[-100]) -> 10946 | DO45: =FIB(RC[-100]) -> 10946 | DP45: =FIB(RC[-100]) -> 10946 | DQ45: =FIB(RC[-100]) -> 10946 | DR45: =FIB(RC[-100]) -> 10946 | DS45: =FIB(RC[-100]) -> 10946 | DT45: =FIB(RC[-100]) -> 10946 | DU45: =FIB(RC[-100]) -> 10946 | DV45: =FIB(RC[-100]) -> 10946 | DW45: =FIB(RC[-100]) -> 10946 | DX45: =FIB(RC[-100]) -> 10946 | DY45: =FIB(RC[-100]) -> 10946 | DZ45: =FIB(RC[-100]) -> 10946 | EA45: =FIB(RC[-100]) -> 10946 | EB45: =FIB(RC[-100]) -> 10946 | EC45: =FIB(RC[-100]) -> 10946 | ED45: =FIB(RC[-100]) -> 10946 | EE45: =FIB(RC[-100]) -> 10946 | EF45: =FIB(RC[-100]) -> 10946 | EG45: =FIB(RC[-100]) -> 10946 | EH45: =FIB(RC[-100]) -> 10946 | EI45: =FIB(RC[-100]) -> 10946 | EJ45: =FIB(RC[-100]) -> 10946 | EK45: =FIB(RC[-100]) -> 10946 | EL45: =FIB(RC[-100]) -> 10946 | EM45: =FIB(RC[-100]) -> 10946 | EN45: =FIB(RC[-100]) -> 10946 | EO45: =FIB(RC[-100]) -> 10946 | EP45: =FIB(RC[-100]) -> 10946 | EQ45: =FIB(RC[-100]) -> 10946 | ER45: =FIB(RC[-100]) -> 10946 | ES45: =FIB(RC[-100]) -> 10946 | ET45: =FIB(RC[-100]) -> 10946 | EU45: =FIB(RC[-100]) -> 10946 | EV45: =FIB(RC[-100]) -> 10946 | EW45: =FIB(RC[-100]) -> 10946 | EX45: =FIB(RC[-100]) -> 10946 | EY45: =FIB(RC[-100]) -> 10946 | EZ45: =FIB(RC[-100]) -> 10946 | FA45: =FIB(RC[-100]) -> 10946 | FB45: =FIB(RC[-100]) -> 10946 | FC45: =FIB(RC[-100]) -> 10946 | FD45: =FIB(RC[-100]) -> 10946 | FE45: =FIB(RC[-100]) -> 10946 | FF45: =FIB(RC[-100]) -> 10946 | FG45: =FIB(RC[-100]) -> 10946 | FH45: =FIB(RC[-100]) -> 10946 | FI45: =FIB(RC[-100]) -> 10946 | FJ45: =FIB(RC[-100]) -> 10946 | FK45: =FIB(RC[-100]) -> 10946 | FL45: =FIB(RC[-100]) -> 10946 | FM45: =FIB(RC[-100]) -> 10946 | FN45: =FIB(RC[-100]) -> 10946 | FO45: =FIB(RC[-100]) -> 10946 | FP45: =FIB(RC[-100]) -> 10946 | FQ45: =FIB(RC[-100]) -> 10946 | FR45: =FIB(RC[-100]) -> 10946 | FS45: =FIB(RC[-100]) -> 10946 | FT45: =FIB(RC[-100]) -> 10946 | FU45: =FIB(RC[-100]) -> 10946 | FV45: =FIB(RC[-100]) -> 10946 | FW45: =FIB(RC[-100]) -> 10946 | FX45: =FIB(RC[-100]) -> 10946 | FY45: =FIB(RC[-100]) -> 10946 | FZ45: =FIB(RC[-100]) -> 10946 | GA45: =FIB(RC[-100]) -> 10946 | GB45: =FIB(RC[-100]) -> 10946 | GC45: =FIB(RC[-100]) -> 10946 | GD45: =FIB(RC[-100]) -> 10946 | GE45: =FIB(RC[-100]) -> 10946 | GF45: =FIB(RC[-100]) -> 10946 | GG45: =FIB(RC[-100]) -> 10946 | GH45: =FIB(RC[-100]) -> 10946 | GI45: =FIB(RC[-100]) -> 10946 | GJ45: =FIB(RC[-100]) -> 10946 | GK45: =FIB(RC[-100]) -> 10946 | GL45: =FIB(RC[-100]) -> 10946 | GM45: =FIB(RC[-100]) -> 10946 | GN45: =FIB(RC[-100]) -> 10946 | GO45: =FIB(RC[-100]) -> 10946 | GP45: =FIB(RC[-100]) -> 10946 | GQ45: =FIB(RC[-100]) -> 10946 | GR45: =FIB(RC[-100]) -> 10946
A46: 20 | B46: 20 | C46: 20 | D46: 20 | E46: 20 | F46: 20 | G46: 20 | H46: 20 | I46: 20 | J46: 20 | K46: 20 | L46: 20 | M46: 20 | N46: 20 | O46: 20 | P46: 20 | Q46: 20 | R46: 20 | S46: 20 | T46: 20 | U46: 20 | V46: 20 | W46: 20 | X46: 20 | Y46: 20 | Z46: 20 | AA46: 20 | AB46: 20 | AC46: 20 | AD46: 20 | AE46: 20 | AF46: 20 | AG46: 20 | AH46: 20 | AI46: 20 | AJ46: 20 | AK46: 20 | AL46: 20 | AM46: 20 | AN46: 20 | AO46: 20 | AP46: 20 | AQ46: 20 | AR46: 20 | AS46: 20 | AT46: 20 | AU46: 20 | AV46: 20 | AW46: 20 | AX46: 20 | AY46: 20 | AZ46: 20 | BA46: 20 | BB46: 20 | BC46: 20 | BD46: 20 | BE46: 20 | BF46: 20 | BG46: 20 | BH46: 20 | BI46: 20 | BJ46: 20 | BK46: 20 | BL46: 20 | BM46: 20 | BN46: 20 | BO46: 20 | BP46: 20 | BQ46: 20 | BR46: 20 | BS46: 20 | BT46: 20 | BU46: 20 | BV46: 20 | BW46: 20 | BX46: 20 | BY46: 20 | BZ46: 20 | CA46: 20 | CB46: 20 | CC46: 20 | CD46: 20 | CE46: 20 | CF46: 20 | CG46: 20 | CH46: 20 | CI46: 20 | CJ46: 20 | CK46: 20 | CL46: 20 | CM46: 20 | CN46: 20 | CO46: 20 | CP46: 20 | CQ46: 20 | CR46: 20 | CS46: 20 | CT46: 20 | CU46: 20 | CV46: 20 | CW46: =FIB(RC[-100]) -> 10946 | CX46: =FIB(RC[-100]) -> 10946 | CY46: =FIB(RC[-100]) -> 10946 | CZ46: =FIB(RC[-100]) -> 10946 | DA46: =FIB(RC[-100]) -> 10946 | DB46: =FIB(RC[-100]) -> 10946 | DC46: =FIB(RC[-100]) -> 10946 | DD46: =FIB(RC[-100]) -> 10946 | DE46: =FIB(RC[-100]) -> 10946 | DF46: =FIB(RC[-100]) -> 10946 | DG46: =FIB(RC[-100]) -> 10946 | DH46: =FIB(RC[-100]) -> 10946 | DI46: =FIB(RC[-100]) -> 10946 | DJ46: =FIB(RC[-100]) -> 10946 | DK46: =FIB(RC[-100]) -> 10946 | DL46: =FIB(RC[-100]) -> 10946 | DM46: =FIB(RC[-100]) -> 10946 | DN46: =FIB(RC[-100]) -> 10946 | DO46: =FIB(RC[-100]) -> 10946 | DP46: =FIB(RC[-100]) -> 10946 | DQ46: =FIB(RC[-100]) -> 10946 | DR46: =FIB(RC[-100]) -> 10946 | DS46: =FIB(RC[-100]) -> 10946 | DT46: =FIB(RC[-100]) -> 10946 | DU46: =FIB(RC[-100]) -> 10946 | DV46: =FIB(RC[-100]) -> 10946 | DW46: =FIB(RC[-100]) -> 10946 | DX46: =FIB(RC[-100]) -> 10946 | DY46: =FIB(RC[-100]) -> 10946 | DZ46: =FIB(RC[-100]) -> 10946 | EA46: =FIB(RC[-100]) -> 10946 | EB46: =FIB(RC[-100]) -> 10946 | EC46: =FIB(RC[-100]) -> 10946 | ED46: =FIB(RC[-100]) -> 10946 | EE46: =FIB(RC[-100]) -> 10946 | EF46: =FIB(RC[-100]) -> 10946 | EG46: =FIB(RC[-100]) -> 10946 | EH46: =FIB(RC[-100]) -> 10946 | EI46: =FIB(RC[-100]) -> 10946 | EJ46: =FIB(RC[-100]) -> 10946 | EK46: =FIB(RC[-100]) -> 10946 | EL46: =FIB(RC[-100]) -> 10946 | EM46: =FIB(RC[-100]) -> 10946 | EN46: =FIB(RC[-100]) -> 10946 | EO46: =FIB(RC[-100]) -> 10946 | EP46: =FIB(RC[-100]) -> 10946 | EQ46: =FIB(RC[-100]) -> 10946 | ER46: =FIB(RC[-100]) -> 10946 | ES46: =FIB(RC[-100]) -> 10946 | ET46: =FIB(RC[-100]) -> 10946 | EU46: =FIB(RC[-100]) -> 10946 | EV46: =FIB(RC[-100]) -> 10946 | EW46: =FIB(RC[-100]) -> 10946 | EX46: =FIB(RC[-100]) -> 10946 | EY46: =FIB(RC[-100]) -> 10946 | EZ46: =FIB(RC[-100]) -> 10946 | FA46: =FIB(RC[-100]) -> 10946 | FB46: =FIB(RC[-100]) -> 10946 | FC46: =FIB(RC[-100]) -> 10946 | FD46: =FIB(RC[-100]) -> 10946 | FE46: =FIB(RC[-100]) -> 10946 | FF46: =FIB(RC[-100]) -> 10946 | FG46: =FIB(RC[-100]) -> 10946 | FH46: =FIB(RC[-100]) -> 10946 | FI46: =FIB(RC[-100]) -> 10946 | FJ46: =FIB(RC[-100]) -> 10946 | FK46: =FIB(RC[-100]) -> 10946 | FL46: =FIB(RC[-100]) -> 10946 | FM46: =FIB(RC[-100]) -> 10946 | FN46: =FIB(RC[-100]) -> 10946 | FO46: =FIB(RC[-100]) -> 10946 | FP46: =FIB(RC[-100]) -> 10946 | FQ46: =FIB(RC[-100]) -> 10946 | FR46: =FIB(RC[-100]) -> 10946 | FS46: =FIB(RC[-100]) -> 10946 | FT46: =FIB(RC[-100]) -> 10946 | FU46: =FIB(RC[-100]) -> 10946 | FV46: =FIB(RC[-100]) -> 10946 | FW46: =FIB(RC[-100]) -> 10946 | FX46: =FIB(RC[-100]) -> 10946 | FY46: =FIB(RC[-100]) -> 10946 | FZ46: =FIB(RC[-100]) -> 10946 | GA46: =FIB(RC[-100]) -> 10946 | GB46: =FIB(RC[-100]) -> 10946 | GC46: =FIB(RC[-100]) -> 10946 | GD46: =FIB(RC[-100]) -> 10946 | GE46: =FIB(RC[-100]) -> 10946 | GF46: =FIB(RC[-100]) -> 10946 | GG46: =FIB(RC[-100]) -> 10946 | GH46: =FIB(RC[-100]) -> 10946 | GI46: =FIB(RC[-100]) -> 10946 | GJ46: =FIB(RC[-100]) -> 10946 | GK46: =FIB(RC[-100]) -> 10946 | GL46: =FIB(RC[-100]) -> 10946 | GM46: =FIB(RC[-100]) -> 10946 | GN46: =FIB(RC[-100]) -> 10946 | GO46: =FIB(RC[-100]) -> 10946 | GP46: =FIB(RC[-100]) -> 10946 | GQ46: =FIB(RC[-100]) -> 10946 | GR46: =FIB(RC[-100]) -> 10946
A47: 20 | B47: 20 | C47: 20 | D47: 20 | E47: 20 | F47: 20 | G47: 20 | H47: 20 | I47: 20 | J47: 20 | K47: 20 | L47: 20 | M47: 20 | N47: 20 | O47: 20 | P47: 20 | Q47: 20 | R47: 20 | S47: 20 | T47: 20 | U47: 20 | V47: 20 | W47: 20 | X47: 20 | Y47: 20 | Z47: 20 | AA47: 20 | AB47: 20 | AC47: 20 | AD47: 20 | AE47: 20 | AF47: 20 | AG47: 20 | AH47: 20 | AI47: 20 | AJ47: 20 | AK47: 20 | AL47: 20 | AM47: 20 | AN47: 20 | AO47: 20 | AP47: 20 | AQ47: 20 | AR47: 20 | AS47: 20 | AT47: 20 | AU47: 20 | AV47: 20 | AW47: 20 | AX47: 20 | AY47: 20 | AZ47: 20 | BA47: 20 | BB47: 20 | BC47: 20 | BD47: 20 | BE47: 20 | BF47: 20 | BG47: 20 | BH47: 20 | BI47: 20 | BJ47: 20 | BK47: 20 | BL47: 20 | BM47: 20 | BN47: 20 | BO47: 20 | BP47: 20 | BQ47: 20 | BR47: 20 | BS47: 20 | BT47: 20 | BU47: 20 | BV47: 20 | BW47: 20 | BX47: 20 | BY47: 20 | BZ47: 20 | CA47: 20 | CB47: 20 | CC47: 20 | CD47: 20 | CE47: 20 | CF47: 20 | CG47: 20 | CH47: 20 | CI47: 20 | CJ47: 20 | CK47: 20 | CL47: 20 | CM47: 20 | CN47: 20 | CO47: 20 | CP47: 20 | CQ47: 20 | CR47: 20 | CS47: 20 | CT47: 20 | CU47: 20 | CV47: 20 | CW47: =FIB(RC[-100]) -> 10946 | CX47: =FIB(RC[-100]) -> 10946 | CY47: =FIB(RC[-100]) -> 10946 | CZ47: =FIB(RC[-100]) -> 10946 | DA47: =FIB(RC[-100]) -> 10946 | DB47: =FIB(RC[-100]) -> 10946 | DC47: =FIB(RC[-100]) -> 10946 | DD47: =FIB(RC[-100]) -> 10946 | DE47: =FIB(RC[-100]) -> 10946 | DF47: =FIB(RC[-100]) -> 10946 | DG47: =FIB(RC[-100]) -> 10946 | DH47: =FIB(RC[-100]) -> 10946 | DI47: =FIB(RC[-100]) -> 10946 | DJ47: =FIB(RC[-100]) -> 10946 | DK47: =FIB(RC[-100]) -> 10946 | DL47: =FIB(RC[-100]) -> 10946 | DM47: =FIB(RC[-100]) -> 10946 | DN47: =FIB(RC[-100]) -> 10946 | DO47: =FIB(RC[-100]) -> 10946 | DP47: =FIB(RC[-100]) -> 10946 | DQ47: =FIB(RC[-100]) -> 10946 | DR47: =FIB(RC[-100]) -> 10946 | DS47: =FIB(RC[-100]) -> 10946 | DT47: =FIB(RC[-100]) -> 10946 | DU47: =FIB(RC[-100]) -> 10946 | DV47: =FIB(RC[-100]) -> 10946 | DW47: =FIB(RC[-100]) -> 10946 | DX47: =FIB(RC[-100]) -> 10946 | DY47: =FIB(RC[-100]) -> 10946 | DZ47: =FIB(RC[-100]) -> 10946 | EA47: =FIB(RC[-100]) -> 10946 | EB47: =FIB(RC[-100]) -> 10946 | EC47: =FIB(RC[-100]) -> 10946 | ED47: =FIB(RC[-100]) -> 10946 | EE47: =FIB(RC[-100]) -> 10946 | EF47: =FIB(RC[-100]) -> 10946 | EG47: =FIB(RC[-100]) -> 10946 | EH47: =FIB(RC[-100]) -> 10946 | EI47: =FIB(RC[-100]) -> 10946 | EJ47: =FIB(RC[-100]) -> 10946 | EK47: =FIB(RC[-100]) -> 10946 | EL47: =FIB(RC[-100]) -> 10946 | EM47: =FIB(RC[-100]) -> 10946 | EN47: =FIB(RC[-100]) -> 10946 | EO47: =FIB(RC[-100]) -> 10946 | EP47: =FIB(RC[-100]) -> 10946 | EQ47: =FIB(RC[-100]) -> 10946 | ER47: =FIB(RC[-100]) -> 10946 | ES47: =FIB(RC[-100]) -> 10946 | ET47: =FIB(RC[-100]) -> 10946 | EU47: =FIB(RC[-100]) -> 10946 | EV47: =FIB(RC[-100]) -> 10946 | EW47: =FIB(RC[-100]) -> 10946 | EX47: =FIB(RC[-100]) -> 10946 | EY47: =FIB(RC[-100]) -> 10946 | EZ47: =FIB(RC[-100]) -> 10946 | FA47: =FIB(RC[-100]) -> 10946 | FB47: =FIB(RC[-100]) -> 10946 | FC47: =FIB(RC[-100]) -> 10946 | FD47: =FIB(RC[-100]) -> 10946 | FE47: =FIB(RC[-100]) -> 10946 | FF47: =FIB(RC[-100]) -> 10946 | FG47: =FIB(RC[-100]) -> 10946 | FH47: =FIB(RC[-100]) -> 10946 | FI47: =FIB(RC[-100]) -> 10946 | FJ47: =FIB(RC[-100]) -> 10946 | FK47: =FIB(RC[-100]) -> 10946 | FL47: =FIB(RC[-100]) -> 10946 | FM47: =FIB(RC[-100]) -> 10946 | FN47: =FIB(RC[-100]) -> 10946 | FO47: =FIB(RC[-100]) -> 10946 | FP47: =FIB(RC[-100]) -> 10946 | FQ47: =FIB(RC[-100]) -> 10946 | FR47: =FIB(RC[-100]) -> 10946 | FS47: =FIB(RC[-100]) -> 10946 | FT47: =FIB(RC[-100]) -> 10946 | FU47: =FIB(RC[-100]) -> 10946 | FV47: =FIB(RC[-100]) -> 10946 | FW47: =FIB(RC[-100]) -> 10946 | FX47: =FIB(RC[-100]) -> 10946 | FY47: =FIB(RC[-100]) -> 10946 | FZ47: =FIB(RC[-100]) -> 10946 | GA47: =FIB(RC[-100]) -> 10946 | GB47: =FIB(RC[-100]) -> 10946 | GC47: =FIB(RC[-100]) -> 10946 | GD47: =FIB(RC[-100]) -> 10946 | GE47: =FIB(RC[-100]) -> 10946 | GF47: =FIB(RC[-100]) -> 10946 | GG47: =FIB(RC[-100]) -> 10946 | GH47: =FIB(RC[-100]) -> 10946 | GI47: =FIB(RC[-100]) -> 10946 | GJ47: =FIB(RC[-100]) -> 10946 | GK47: =FIB(RC[-100]) -> 10946 | GL47: =FIB(RC[-100]) -> 10946 | GM47: =FIB(RC[-100]) -> 10946 | GN47: =FIB(RC[-100]) -> 10946 | GO47: =FIB(RC[-100]) -> 10946 | GP47: =FIB(RC[-100]) -> 10946 | GQ47: =FIB(RC[-100]) -> 10946 | GR47: =FIB(RC[-100]) -> 10946
A48: 20 | B48: 20 | C48: 20 | D48: 20 | E48: 20 | F48: 20 | G48: 20 | H48: 20 | I48: 20 | J48: 20 | K48: 20 | L48: 20 | M48: 20 | N48: 20 | O48: 20 | P48: 20 | Q48: 20 | R48: 20 | S48: 20 | T48: 20 | U48: 20 | V48: 20 | W48: 20 | X48: 20 | Y48: 20 | Z48: 20 | AA48: 20 | AB48: 20 | AC48: 20 | AD48: 20 | AE48: 20 | AF48: 20 | AG48: 20 | AH48: 20 | AI48: 20 | AJ48: 20 | AK48: 20 | AL48: 20 | AM48: 20 | AN48: 20 | AO48: 20 | AP48: 20 | AQ48: 20 | AR48: 20 | AS48: 20 | AT48: 20 | AU48: 20 | AV48: 20 | AW48: 20 | AX48: 20 | AY48: 20 | AZ48: 20 | BA48: 20 | BB48: 20 | BC48: 20 | BD48: 20 | BE48: 20 | BF48: 20 | BG48: 20 | BH48: 20 | BI48: 20 | BJ48: 20 | BK48: 20 | BL48: 20 | BM48: 20 | BN48: 20 | BO48: 20 | BP48: 20 | BQ48: 20 | BR48: 20 | BS48: 20 | BT48: 20 | BU48: 20 | BV48: 20 | BW48: 20 | BX48: 20 | BY48: 20 | BZ48: 20 | CA48: 20 | CB48: 20 | CC48: 20 | CD48: 20 | CE48: 20 | CF48: 20 | CG48: 20 | CH48: 20 | CI48: 20 | CJ48: 20 | CK48: 20 | CL48: 20 | CM48: 20 | CN48: 20 | CO48: 20 | CP48: 20 | CQ48: 20 | CR48: 20 | CS48: 20 | CT48: 20 | CU48: 20 | CV48: 20 | CW48: =FIB(RC[-100]) -> 10946 | CX48: =FIB(RC[-100]) -> 10946 | CY48: =FIB(RC[-100]) -> 10946 | CZ48: =FIB(RC[-100]) -> 10946 | DA48: =FIB(RC[-100]) -> 10946 | DB48: =FIB(RC[-100]) -> 10946 | DC48: =FIB(RC[-100]) -> 10946 | DD48: =FIB(RC[-100]) -> 10946 | DE48: =FIB(RC[-100]) -> 10946 | DF48: =FIB(RC[-100]) -> 10946 | DG48: =FIB(RC[-100]) -> 10946 | DH48: =FIB(RC[-100]) -> 10946 | DI48: =FIB(RC[-100]) -> 10946 | DJ48: =FIB(RC[-100]) -> 10946 | DK48: =FIB(RC[-100]) -> 10946 | DL48: =FIB(RC[-100]) -> 10946 | DM48: =FIB(RC[-100]) -> 10946 | DN48: =FIB(RC[-100]) -> 10946 | DO48: =FIB(RC[-100]) -> 10946 | DP48: =FIB(RC[-100]) -> 10946 | DQ48: =FIB(RC[-100]) -> 10946 | DR48: =FIB(RC[-100]) -> 10946 | DS48: =FIB(RC[-100]) -> 10946 | DT48: =FIB(RC[-100]) -> 10946 | DU48: =FIB(RC[-100]) -> 10946 | DV48: =FIB(RC[-100]) -> 10946 | DW48: =FIB(RC[-100]) -> 10946 | DX48: =FIB(RC[-100]) -> 10946 | DY48: =FIB(RC[-100]) -> 10946 | DZ48: =FIB(RC[-100]) -> 10946 | EA48: =FIB(RC[-100]) -> 10946 | EB48: =FIB(RC[-100]) -> 10946 | EC48: =FIB(RC[-100]) -> 10946 | ED48: =FIB(RC[-100]) -> 10946 | EE48: =FIB(RC[-100]) -> 10946 | EF48: =FIB(RC[-100]) -> 10946 | EG48: =FIB(RC[-100]) -> 10946 | EH48: =FIB(RC[-100]) -> 10946 | EI48: =FIB(RC[-100]) -> 10946 | EJ48: =FIB(RC[-100]) -> 10946 | EK48: =FIB(RC[-100]) -> 10946 | EL48: =FIB(RC[-100]) -> 10946 | EM48: =FIB(RC[-100]) -> 10946 | EN48: =FIB(RC[-100]) -> 10946 | EO48: =FIB(RC[-100]) -> 10946 | EP48: =FIB(RC[-100]) -> 10946 | EQ48: =FIB(RC[-100]) -> 10946 | ER48: =FIB(RC[-100]) -> 10946 | ES48: =FIB(RC[-100]) -> 10946 | ET48: =FIB(RC[-100]) -> 10946 | EU48: =FIB(RC[-100]) -> 10946 | EV48: =FIB(RC[-100]) -> 10946 | EW48: =FIB(RC[-100]) -> 10946 | EX48: =FIB(RC[-100]) -> 10946 | EY48: =FIB(RC[-100]) -> 10946 | EZ48: =FIB(RC[-100]) -> 10946 | FA48: =FIB(RC[-100]) -> 10946 | FB48: =FIB(RC[-100]) -> 10946 | FC48: =FIB(RC[-100]) -> 10946 | FD48: =FIB(RC[-100]) -> 10946 | FE48: =FIB(RC[-100]) -> 10946 | FF48: =FIB(RC[-100]) -> 10946 | FG48: =FIB(RC[-100]) -> 10946 | FH48: =FIB(RC[-100]) -> 10946 | FI48: =FIB(RC[-100]) -> 10946 | FJ48: =FIB(RC[-100]) -> 10946 | FK48: =FIB(RC[-100]) -> 10946 | FL48: =FIB(RC[-100]) -> 10946 | FM48: =FIB(RC[-100]) -> 10946 | FN48: =FIB(RC[-100]) -> 10946 | FO48: =FIB(RC[-100]) -> 10946 | FP48: =FIB(RC[-100]) -> 10946 | FQ48: =FIB(RC[-100]) -> 10946 | FR48: =FIB(RC[-100]) -> 10946 | FS48: =FIB(RC[-100]) -> 10946 | FT48: =FIB(RC[-100]) -> 10946 | FU48: =FIB(RC[-100]) -> 10946 | FV48: =FIB(RC[-100]) -> 10946 | FW48: =FIB(RC[-100]) -> 10946 | FX48: =FIB(RC[-100]) -> 10946 | FY48: =FIB(RC[-100]) -> 10946 | FZ48: =FIB(RC[-100]) -> 10946 | GA48: =FIB(RC[-100]) -> 10946 | GB48: =FIB(RC[-100]) -> 10946 | GC48: =FIB(RC[-100]) -> 10946 | GD48: =FIB(RC[-100]) -> 10946 | GE48: =FIB(RC[-100]) -> 10946 | GF48: =FIB(RC[-100]) -> 10946 | GG48: =FIB(RC[-100]) -> 10946 | GH48: =FIB(RC[-100]) -> 10946 | GI48: =FIB(RC[-100]) -> 10946 | GJ48: =FIB(RC[-100]) -> 10946 | GK48: =FIB(RC[-100]) -> 10946 | GL48: =FIB(RC[-100]) -> 10946 | GM48: =FIB(RC[-100]) -> 10946 | GN48: =FIB(RC[-100]) -> 10946 | GO48: =FIB(RC[-100]) -> 10946 | GP48: =FIB(RC[-100]) -> 10946 | GQ48: =FIB(RC[-100]) -> 10946 | GR48: =FIB(RC[-100]) -> 10946
A49: 20 | B49: 20 | C49: 20 | D49: 20 | E49: 20 | F49: 20 | G49: 20 | H49: 20 | I49: 20 | J49: 20 | K49: 20 | L49: 20 | M49: 20 | N49: 20 | O49: 20 | P49: 20 | Q49: 20 | R49: 20 | S49: 20 | T49: 20 | U49: 20 | V49: 20 | W49: 20 | X49: 20 | Y49: 20 | Z49: 20 | AA49: 20 | AB49: 20 | AC49: 20 | AD49: 20 | AE49: 20 | AF49: 20 | AG49: 20 | AH49: 20 | AI49: 20 | AJ49: 20 | AK49: 20 | AL49: 20 | AM49: 20 | AN49: 20 | AO49: 20 | AP49: 20 | AQ49: 20 | AR49: 20 | AS49: 20 | AT49: 20 | AU49: 20 | AV49: 20 | AW49: 20 | AX49: 20 | AY49: 20 | AZ49: 20 | BA49: 20 | BB49: 20 | BC49: 20 | BD49: 20 | BE49: 20 | BF49: 20 | BG49: 20 | BH49: 20 | BI49: 20 | BJ49: 20 | BK49: 20 | BL49: 20 | BM49: 20 | BN49: 20 | BO49: 20 | BP49: 20 | BQ49: 20 | BR49: 20 | BS49: 20 | BT49: 20 | BU49: 20 | BV49: 20 | BW49: 20 | BX49: 20 | BY49: 20 | BZ49: 20 | CA49: 20 | CB49: 20 | CC49: 20 | CD49: 20 | CE49: 20 | CF49: 20 | CG49: 20 | CH49: 20 | CI49: 20 | CJ49: 20 | CK49: 20 | CL49: 20 | CM49: 20 | CN49: 20 | CO49: 20 | CP49: 20 | CQ49: 20 | CR49: 20 | CS49: 20 | CT49: 20 | CU49: 20 | CV49: 20 | CW49: =FIB(RC[-100]) -> 10946 | CX49: =FIB(RC[-100]) -> 10946 | CY49: =FIB(RC[-100]) -> 10946 | CZ49: =FIB(RC[-100]) -> 10946 | DA49: =FIB(RC[-100]) -> 10946 | DB49: =FIB(RC[-100]) -> 10946 | DC49: =FIB(RC[-100]) -> 10946 | DD49: =FIB(RC[-100]) -> 10946 | DE49: =FIB(RC[-100]) -> 10946 | DF49: =FIB(RC[-100]) -> 10946 | DG49: =FIB(RC[-100]) -> 10946 | DH49: =FIB(RC[-100]) -> 10946 | DI49: =FIB(RC[-100]) -> 10946 | DJ49: =FIB(RC[-100]) -> 10946 | DK49: =FIB(RC[-100]) -> 10946 | DL49: =FIB(RC[-100]) -> 10946 | DM49: =FIB(RC[-100]) -> 10946 | DN49: =FIB(RC[-100]) -> 10946 | DO49: =FIB(RC[-100]) -> 10946 | DP49: =FIB(RC[-100]) -> 10946 | DQ49: =FIB(RC[-100]) -> 10946 | DR49: =FIB(RC[-100]) -> 10946 | DS49: =FIB(RC[-100]) -> 10946 | DT49: =FIB(RC[-100]) -> 10946 | DU49: =FIB(RC[-100]) -> 10946 | DV49: =FIB(RC[-100]) -> 10946 | DW49: =FIB(RC[-100]) -> 10946 | DX49: =FIB(RC[-100]) -> 10946 | DY49: =FIB(RC[-100]) -> 10946 | DZ49: =FIB(RC[-100]) -> 10946 | EA49: =FIB(RC[-100]) -> 10946 | EB49: =FIB(RC[-100]) -> 10946 | EC49: =FIB(RC[-100]) -> 10946 | ED49: =FIB(RC[-100]) -> 10946 | EE49: =FIB(RC[-100]) -> 10946 | EF49: =FIB(RC[-100]) -> 10946 | EG49: =FIB(RC[-100]) -> 10946 | EH49: =FIB(RC[-100]) -> 10946 | EI49: =FIB(RC[-100]) -> 10946 | EJ49: =FIB(RC[-100]) -> 10946 | EK49: =FIB(RC[-100]) -> 10946 | EL49: =FIB(RC[-100]) -> 10946 | EM49: =FIB(RC[-100]) -> 10946 | EN49: =FIB(RC[-100]) -> 10946 | EO49: =FIB(RC[-100]) -> 10946 | EP49: =FIB(RC[-100]) -> 10946 | EQ49: =FIB(RC[-100]) -> 10946 | ER49: =FIB(RC[-100]) -> 10946 | ES49: =FIB(RC[-100]) -> 10946 | ET49: =FIB(RC[-100]) -> 10946 | EU49: =FIB(RC[-100]) -> 10946 | EV49: =FIB(RC[-100]) -> 10946 | EW49: =FIB(RC[-100]) -> 10946 | EX49: =FIB(RC[-100]) -> 10946 | EY49: =FIB(RC[-100]) -> 10946 | EZ49: =FIB(RC[-100]) -> 10946 | FA49: =FIB(RC[-100]) -> 10946 | FB49: =FIB(RC[-100]) -> 10946 | FC49: =FIB(RC[-100]) -> 10946 | FD49: =FIB(RC[-100]) -> 10946 | FE49: =FIB(RC[-100]) -> 10946 | FF49: =FIB(RC[-100]) -> 10946 | FG49: =FIB(RC[-100]) -> 10946 | FH49: =FIB(RC[-100]) -> 10946 | FI49: =FIB(RC[-100]) -> 10946 | FJ49: =FIB(RC[-100]) -> 10946 | FK49: =FIB(RC[-100]) -> 10946 | FL49: =FIB(RC[-100]) -> 10946 | FM49: =FIB(RC[-100]) -> 10946 | FN49: =FIB(RC[-100]) -> 10946 | FO49: =FIB(RC[-100]) -> 10946 | FP49: =FIB(RC[-100]) -> 10946 | FQ49: =FIB(RC[-100]) -> 10946 | FR49: =FIB(RC[-100]) -> 10946 | FS49: =FIB(RC[-100]) -> 10946 | FT49: =FIB(RC[-100]) -> 10946 | FU49: =FIB(RC[-100]) -> 10946 | FV49: =FIB(RC[-100]) -> 10946 | FW49: =FIB(RC[-100]) -> 10946 | FX49: =FIB(RC[-100]) -> 10946 | FY49: =FIB(RC[-100]) -> 10946 | FZ49: =FIB(RC[-100]) -> 10946 | GA49: =FIB(RC[-100]) -> 10946 | GB49: =FIB(RC[-100]) -> 10946 | GC49: =FIB(RC[-100]) -> 10946 | GD49: =FIB(RC[-100]) -> 10946 | GE49: =FIB(RC[-100]) -> 10946 | GF49: =FIB(RC[-100]) -> 10946 | GG49: =FIB(RC[-100]) -> 10946 | GH49: =FIB(RC[-100]) -> 10946 | GI49: =FIB(RC[-100]) -> 10946 | GJ49: =FIB(RC[-100]) -> 10946 | GK49: =FIB(RC[-100]) -> 10946 | GL49: =FIB(RC[-100]) -> 10946 | GM49: =FIB(RC[-100]) -> 10946 | GN49: =FIB(RC[-100]) -> 10946 | GO49: =FIB(RC[-100]) -> 10946 | GP49: =FIB(RC[-100]) -> 10946 | GQ49: =FIB(RC[-100]) -> 10946 | GR49: =FIB(RC[-100]) -> 10946
A50: 20 | B50: 20 | C50: 20 | D50: 20 | E50: 20 | F50: 20 | G50: 20 | H50: 20 | I50: 20 | J50: 20 | K50: 20 | L50: 20 | M50: 20 | N50: 20 | O50: 20 | P50: 20 | Q50: 20 | R50: 20 | S50: 20 | T50: 20 | U50: 20 | V50: 20 | W50: 20 | X50: 20 | Y50: 20 | Z50: 20 | AA50: 20 | AB50: 20 | AC50: 20 | AD50: 20 | AE50: 20 | AF50: 20 | AG50: 20 | AH50: 20 | AI50: 20 | AJ50: 20 | AK50: 20 | AL50: 20 | AM50: 20 | AN50: 20 | AO50: 20 | AP50: 20 | AQ50: 20 | AR50: 20 | AS50: 20 | AT50: 20 | AU50: 20 | AV50: 20 | AW50: 20 | AX50: 20 | AY50: 20 | AZ50: 20 | BA50: 20 | BB50: 20 | BC50: 20 | BD50: 20 | BE50: 20 | BF50: 20 | BG50: 20 | BH50: 20 | BI50: 20 | BJ50: 20 | BK50: 20 | BL50: 20 | BM50: 20 | BN50: 20 | BO50: 20 | BP50: 20 | BQ50: 20 | BR50: 20 | BS50: 20 | BT50: 20 | BU50: 20 | BV50: 20 | BW50: 20 | BX50: 20 | BY50: 20 | BZ50: 20 | CA50: 20 | CB50: 20 | CC50: 20 | CD50: 20 | CE50: 20 | CF50: 20 | CG50: 20 | CH50: 20 | CI50: 20 | CJ50: 20 | CK50: 20 | CL50: 20 | CM50: 20 | CN50: 20 | CO50: 20 | CP50: 20 | CQ50: 20 | CR50: 20 | CS50: 20 | CT50: 20 | CU50: 20 | CV50: 20 | CW50: =FIB(RC[-100]) -> 10946 | CX50: =FIB(RC[-100]) -> 10946 | CY50: =FIB(RC[-100]) -> 10946 | CZ50: =FIB(RC[-100]) -> 10946 | DA50: =FIB(RC[-100]) -> 10946 | DB50: =FIB(RC[-100]) -> 10946 | DC50: =FIB(RC[-100]) -> 10946 | DD50: =FIB(RC[-100]) -> 10946 | DE50: =FIB(RC[-100]) -> 10946 | DF50: =FIB(RC[-100]) -> 10946 | DG50: =FIB(RC[-100]) -> 10946 | DH50: =FIB(RC[-100]) -> 10946 | DI50: =FIB(RC[-100]) -> 10946 | DJ50: =FIB(RC[-100]) -> 10946 | DK50: =FIB(RC[-100]) -> 10946 | DL50: =FIB(RC[-100]) -> 10946 | DM50: =FIB(RC[-100]) -> 10946 | DN50: =FIB(RC[-100]) -> 10946 | DO50: =FIB(RC[-100]) -> 10946 | DP50: =FIB(RC[-100]) -> 10946 | DQ50: =FIB(RC[-100]) -> 10946 | DR50: =FIB(RC[-100]) -> 10946 | DS50: =FIB(RC[-100]) -> 10946 | DT50: =FIB(RC[-100]) -> 10946 | DU50: =FIB(RC[-100]) -> 10946 | DV50: =FIB(RC[-100]) -> 10946 | DW50: =FIB(RC[-100]) -> 10946 | DX50: =FIB(RC[-100]) -> 10946 | DY50: =FIB(RC[-100]) -> 10946 | DZ50: =FIB(RC[-100]) -> 10946 | EA50: =FIB(RC[-100]) -> 10946 | EB50: =FIB(RC[-100]) -> 10946 | EC50: =FIB(RC[-100]) -> 10946 | ED50: =FIB(RC[-100]) -> 10946 | EE50: =FIB(RC[-100]) -> 10946 | EF50: =FIB(RC[-100]) -> 10946 | EG50: =FIB(RC[-100]) -> 10946 | EH50: =FIB(RC[-100]) -> 10946 | EI50: =FIB(RC[-100]) -> 10946 | EJ50: =FIB(RC[-100]) -> 10946 | EK50: =FIB(RC[-100]) -> 10946 | EL50: =FIB(RC[-100]) -> 10946 | EM50: =FIB(RC[-100]) -> 10946 | EN50: =FIB(RC[-100]) -> 10946 | EO50: =FIB(RC[-100]) -> 10946 | EP50: =FIB(RC[-100]) -> 10946 | EQ50: =FIB(RC[-100]) -> 10946 | ER50: =FIB(RC[-100]) -> 10946 | ES50: =FIB(RC[-100]) -> 10946 | ET50: =FIB(RC[-100]) -> 10946 | EU50: =FIB(RC[-100]) -> 10946 | EV50: =FIB(RC[-100]) -> 10946 | EW50: =FIB(RC[-100]) -> 10946 | EX50: =FIB(RC[-100]) -> 10946 | EY50: =FIB(RC[-100]) -> 10946 | EZ50: =FIB(RC[-100]) -> 10946 | FA50: =FIB(RC[-100]) -> 10946 | FB50: =FIB(RC[-100]) -> 10946 | FC50: =FIB(RC[-100]) -> 10946 | FD50: =FIB(RC[-100]) -> 10946 | FE50: =FIB(RC[-100]) -> 10946 | FF50: =FIB(RC[-100]) -> 10946 | FG50: =FIB(RC[-100]) -> 10946 | FH50: =FIB(RC[-100]) -> 10946 | FI50: =FIB(RC[-100]) -> 10946 | FJ50: =FIB(RC[-100]) -> 10946 | FK50: =FIB(RC[-100]) -> 10946 | FL50: =FIB(RC[-100]) -> 10946 | FM50: =FIB(RC[-100]) -> 10946 | FN50: =FIB(RC[-100]) -> 10946 | FO50: =FIB(RC[-100]) -> 10946 | FP50: =FIB(RC[-100]) -> 10946 | FQ50: =FIB(RC[-100]) -> 10946 | FR50: =FIB(RC[-100]) -> 10946 | FS50: =FIB(RC[-100]) -> 10946 | FT50: =FIB(RC[-100]) -> 10946 | FU50: =FIB(RC[-100]) -> 10946 | FV50: =FIB(RC[-100]) -> 10946 | FW50: =FIB(RC[-100]) -> 10946 | FX50: =FIB(RC[-100]) -> 10946 | FY50: =FIB(RC[-100]) -> 10946 | FZ50: =FIB(RC[-100]) -> 10946 | GA50: =FIB(RC[-100]) -> 10946 | GB50: =FIB(RC[-100]) -> 10946 | GC50: =FIB(RC[-100]) -> 10946 | GD50: =FIB(RC[-100]) -> 10946 | GE50: =FIB(RC[-100]) -> 10946 | GF50: =FIB(RC[-100]) -> 10946 | GG50: =FIB(RC[-100]) -> 10946 | GH50: =FIB(RC[-100]) -> 10946 | GI50: =FIB(RC[-100]) -> 10946 | GJ50: =FIB(RC[-100]) -> 10946 | GK50: =FIB(RC[-100]) -> 10946 | GL50: =FIB(RC[-100]) -> 10946 | GM50: =FIB(RC[-100]) -> 10946 | GN50: =FIB(RC[-100]) -> 10946 | GO50: =FIB(RC[-100]) -> 10946 | GP50: =FIB(RC[-100]) -> 10946 | GQ50: =FIB(RC[-100]) -> 10946 | GR50: =FIB(RC[-100]) -> 10946
A51: 20 | B51: 20 | C51: 20 | D51: 20 | E51: 20 | F51: 20 | G51: 20 | H51: 20 | I51: 20 | J51: 20 | K51: 20 | L51: 20 | M51: 20 | N51: 20 | O51: 20 | P51: 20 | Q51: 20 | R51: 20 | S51: 20 | T51: 20 | U51: 20 | V51: 20 | W51: 20 | X51: 20 | Y51: 20 | Z51: 20 | AA51: 20 | AB51: 20 | AC51: 20 | AD51: 20 | AE51: 20 | AF51: 20 | AG51: 20 | AH51: 20 | AI51: 20 | AJ51: 20 | AK51: 20 | AL51: 20 | AM51: 20 | AN51: 20 | AO51: 20 | AP51: 20 | AQ51: 20 | AR51: 20 | AS51: 20 | AT51: 20 | AU51: 20 | AV51: 20 | AW51: 20 | AX51: 20 | AY51: 20 | AZ51: 20 | BA51: 20 | BB51: 20 | BC51: 20 | BD51: 20 | BE51: 20 | BF51: 20 | BG51: 20 | BH51: 20 | BI51: 20 | BJ51: 20 | BK51: 20 | BL51: 20 | BM51: 20 | BN51: 20 | BO51: 20 | BP51: 20 | BQ51: 20 | BR51: 20 | BS51: 20 | BT51: 20 | BU51: 20 | BV51: 20 | BW51: 20 | BX51: 20 | BY51: 20 | BZ51: 20 | CA51: 20 | CB51: 20 | CC51: 20 | CD51: 20 | CE51: 20 | CF51: 20 | CG51: 20 | CH51: 20 | CI51: 20 | CJ51: 20 | CK51: 20 | CL51: 20 | CM51: 20 | CN51: 20 | CO51: 20 | CP51: 20 | CQ51: 20 | CR51: 20 | CS51: 20 | CT51: 20 | CU51: 20 | CV51: 20 | CW51: =FIB(RC[-100]) -> 10946 | CX51: =FIB(RC[-100]) -> 10946 | CY51: =FIB(RC[-100]) -> 10946 | CZ51: =FIB(RC[-100]) -> 10946 | DA51: =FIB(RC[-100]) -> 10946 | DB51: =FIB(RC[-100]) -> 10946 | DC51: =FIB(RC[-100]) -> 10946 | DD51: =FIB(RC[-100]) -> 10946 | DE51: =FIB(RC[-100]) -> 10946 | DF51: =FIB(RC[-100]) -> 10946 | DG51: =FIB(RC[-100]) -> 10946 | DH51: =FIB(RC[-100]) -> 10946 | DI51: =FIB(RC[-100]) -> 10946 | DJ51: =FIB(RC[-100]) -> 10946 | DK51: =FIB(RC[-100]) -> 10946 | DL51: =FIB(RC[-100]) -> 10946 | DM51: =FIB(RC[-100]) -> 10946 | DN51: =FIB(RC[-100]) -> 10946 | DO51: =FIB(RC[-100]) -> 10946 | DP51: =FIB(RC[-100]) -> 10946 | DQ51: =FIB(RC[-100]) -> 10946 | DR51: =FIB(RC[-100]) -> 10946 | DS51: =FIB(RC[-100]) -> 10946 | DT51: =FIB(RC[-100]) -> 10946 | DU51: =FIB(RC[-100]) -> 10946 | DV51: =FIB(RC[-100]) -> 10946 | DW51: =FIB(RC[-100]) -> 10946 | DX51: =FIB(RC[-100]) -> 10946 | DY51: =FIB(RC[-100]) -> 10946 | DZ51: =FIB(RC[-100]) -> 10946 | EA51: =FIB(RC[-100]) -> 10946 | EB51: =FIB(RC[-100]) -> 10946 | EC51: =FIB(RC[-100]) -> 10946 | ED51: =FIB(RC[-100]) -> 10946 | EE51: =FIB(RC[-100]) -> 10946 | EF51: =FIB(RC[-100]) -> 10946 | EG51: =FIB(RC[-100]) -> 10946 | EH51: =FIB(RC[-100]) -> 10946 | EI51: =FIB(RC[-100]) -> 10946 | EJ51: =FIB(RC[-100]) -> 10946 | EK51: =FIB(RC[-100]) -> 10946 | EL51: =FIB(RC[-100]) -> 10946 | EM51: =FIB(RC[-100]) -> 10946 | EN51: =FIB(RC[-100]) -> 10946 | EO51: =FIB(RC[-100]) -> 10946 | EP51: =FIB(RC[-100]) -> 10946 | EQ51: =FIB(RC[-100]) -> 10946 | ER51: =FIB(RC[-100]) -> 10946 | ES51: =FIB(RC[-100]) -> 10946 | ET51: =FIB(RC[-100]) -> 10946 | EU51: =FIB(RC[-100]) -> 10946 | EV51: =FIB(RC[-100]) -> 10946 | EW51: =FIB(RC[-100]) -> 10946 | EX51: =FIB(RC[-100]) -> 10946 | EY51: =FIB(RC[-100]) -> 10946 | EZ51: =FIB(RC[-100]) -> 10946 | FA51: =FIB(RC[-100]) -> 10946 | FB51: =FIB(RC[-100]) -> 10946 | FC51: =FIB(RC[-100]) -> 10946 | FD51: =FIB(RC[-100]) -> 10946 | FE51: =FIB(RC[-100]) -> 10946 | FF51: =FIB(RC[-100]) -> 10946 | FG51: =FIB(RC[-100]) -> 10946 | FH51: =FIB(RC[-100]) -> 10946 | FI51: =FIB(RC[-100]) -> 10946 | FJ51: =FIB(RC[-100]) -> 10946 | FK51: =FIB(RC[-100]) -> 10946 | FL51: =FIB(RC[-100]) -> 10946 | FM51: =FIB(RC[-100]) -> 10946 | FN51: =FIB(RC[-100]) -> 10946 | FO51: =FIB(RC[-100]) -> 10946 | FP51: =FIB(RC[-100]) -> 10946 | FQ51: =FIB(RC[-100]) -> 10946 | FR51: =FIB(RC[-100]) -> 10946 | FS51: =FIB(RC[-100]) -> 10946 | FT51: =FIB(RC[-100]) -> 10946 | FU51: =FIB(RC[-100]) -> 10946 | FV51: =FIB(RC[-100]) -> 10946 | FW51: =FIB(RC[-100]) -> 10946 | FX51: =FIB(RC[-100]) -> 10946 | FY51: =FIB(RC[-100]) -> 10946 | FZ51: =FIB(RC[-100]) -> 10946 | GA51: =FIB(RC[-100]) -> 10946 | GB51: =FIB(RC[-100]) -> 10946 | GC51: =FIB(RC[-100]) -> 10946 | GD51: =FIB(RC[-100]) -> 10946 | GE51: =FIB(RC[-100]) -> 10946 | GF51: =FIB(RC[-100]) -> 10946 | GG51: =FIB(RC[-100]) -> 10946 | GH51: =FIB(RC[-100]) -> 10946 | GI51: =FIB(RC[-100]) -> 10946 | GJ51: =FIB(RC[-100]) -> 10946 | GK51: =FIB(RC[-100]) -> 10946 | GL51: =FIB(RC[-100]) -> 10946 | GM51: =FIB(RC[-100]) -> 10946 | GN51: =FIB(RC[-100]) -> 10946 | GO51: =FIB(RC[-100]) -> 10946 | GP51: =FIB(RC[-100]) -> 10946 | GQ51: =FIB(RC[-100]) -> 10946 | GR51: =FIB(RC[-100]) -> 10946
A52: 20 | B52: 20 | C52: 20 | D52: 20 | E52: 20 | F52: 20 | G52: 20 | H52: 20 | I52: 20 | J52: 20 | K52: 20 | L52: 20 | M52: 20 | N52: 20 | O52: 20 | P52: 20 | Q52: 20 | R52: 20 | S52: 20 | T52: 20 | U52: 20 | V52: 20 | W52: 20 | X52: 20 | Y52: 20 | Z52: 20 | AA52: 20 | AB52: 20 | AC52: 20 | AD52: 20 | AE52: 20 | AF52: 20 | AG52: 20 | AH52: 20 | AI52: 20 | AJ52: 20 | AK52: 20 | AL52: 20 | AM52: 20 | AN52: 20 | AO52: 20 | AP52: 20 | AQ52: 20 | AR52: 20 | AS52: 20 | AT52: 20 | AU52: 20 | AV52: 20 | AW52: 20 | AX52: 20 | AY52: 20 | AZ52: 20 | BA52: 20 | BB52: 20 | BC52: 20 | BD52: 20 | BE52: 20 | BF52: 20 | BG52: 20 | BH52: 20 | BI52: 20 | BJ52: 20 | BK52: 20 | BL52: 20 | BM52: 20 | BN52: 20 | BO52: 20 | BP52: 20 | BQ52: 20 | BR52: 20 | BS52: 20 | BT52: 20 | BU52: 20 | BV52: 20 | BW52: 20 | BX52: 20 | BY52: 20 | BZ52: 20 | CA52: 20 | CB52: 20 | CC52: 20 | CD52: 20 | CE52: 20 | CF52: 20 | CG52: 20 | CH52: 20 | CI52: 20 | CJ52: 20 | CK52: 20 | CL52: 20 | CM52: 20 | CN52: 20 | CO52: 20 | CP52: 20 | CQ52: 20 | CR52: 20 | CS52: 20 | CT52: 20 | CU52: 20 | CV52: 20 | CW52: =FIB(RC[-100]) -> 10946 | CX52: =FIB(RC[-100]) -> 10946 | CY52: =FIB(RC[-100]) -> 10946 | CZ52: =FIB(RC[-100]) -> 10946 | DA52: =FIB(RC[-100]) -> 10946 | DB52: =FIB(RC[-100]) -> 10946 | DC52: =FIB(RC[-100]) -> 10946 | DD52: =FIB(RC[-100]) -> 10946 | DE52: =FIB(RC[-100]) -> 10946 | DF52: =FIB(RC[-100]) -> 10946 | DG52: =FIB(RC[-100]) -> 10946 | DH52: =FIB(RC[-100]) -> 10946 | DI52: =FIB(RC[-100]) -> 10946 | DJ52: =FIB(RC[-100]) -> 10946 | DK52: =FIB(RC[-100]) -> 10946 | DL52: =FIB(RC[-100]) -> 10946 | DM52: =FIB(RC[-100]) -> 10946 | DN52: =FIB(RC[-100]) -> 10946 | DO52: =FIB(RC[-100]) -> 10946 | DP52: =FIB(RC[-100]) -> 10946 | DQ52: =FIB(RC[-100]) -> 10946 | DR52: =FIB(RC[-100]) -> 10946 | DS52: =FIB(RC[-100]) -> 10946 | DT52: =FIB(RC[-100]) -> 10946 | DU52: =FIB(RC[-100]) -> 10946 | DV52: =FIB(RC[-100]) -> 10946 | DW52: =FIB(RC[-100]) -> 10946 | DX52: =FIB(RC[-100]) -> 10946 | DY52: =FIB(RC[-100]) -> 10946 | DZ52: =FIB(RC[-100]) -> 10946 | EA52: =FIB(RC[-100]) -> 10946 | EB52: =FIB(RC[-100]) -> 10946 | EC52: =FIB(RC[-100]) -> 10946 | ED52: =FIB(RC[-100]) -> 10946 | EE52: =FIB(RC[-100]) -> 10946 | EF52: =FIB(RC[-100]) -> 10946 | EG52: =FIB(RC[-100]) -> 10946 | EH52: =FIB(RC[-100]) -> 10946 | EI52: =FIB(RC[-100]) -> 10946 | EJ52: =FIB(RC[-100]) -> 10946 | EK52: =FIB(RC[-100]) -> 10946 | EL52: =FIB(RC[-100]) -> 10946 | EM52: =FIB(RC[-100]) -> 10946 | EN52: =FIB(RC[-100]) -> 10946 | EO52: =FIB(RC[-100]) -> 10946 | EP52: =FIB(RC[-100]) -> 10946 | EQ52: =FIB(RC[-100]) -> 10946 | ER52: =FIB(RC[-100]) -> 10946 | ES52: =FIB(RC[-100]) -> 10946 | ET52: =FIB(RC[-100]) -> 10946 | EU52: =FIB(RC[-100]) -> 10946 | EV52: =FIB(RC[-100]) -> 10946 | EW52: =FIB(RC[-100]) -> 10946 | EX52: =FIB(RC[-100]) -> 10946 | EY52: =FIB(RC[-100]) -> 10946 | EZ52: =FIB(RC[-100]) -> 10946 | FA52: =FIB(RC[-100]) -> 10946 | FB52: =FIB(RC[-100]) -> 10946 | FC52: =FIB(RC[-100]) -> 10946 | FD52: =FIB(RC[-100]) -> 10946 | FE52: =FIB(RC[-100]) -> 10946 | FF52: =FIB(RC[-100]) -> 10946 | FG52: =FIB(RC[-100]) -> 10946 | FH52: =FIB(RC[-100]) -> 10946 | FI52: =FIB(RC[-100]) -> 10946 | FJ52: =FIB(RC[-100]) -> 10946 | FK52: =FIB(RC[-100]) -> 10946 | FL52: =FIB(RC[-100]) -> 10946 | FM52: =FIB(RC[-100]) -> 10946 | FN52: =FIB(RC[-100]) -> 10946 | FO52: =FIB(RC[-100]) -> 10946 | FP52: =FIB(RC[-100]) -> 10946 | FQ52: =FIB(RC[-100]) -> 10946 | FR52: =FIB(RC[-100]) -> 10946 | FS52: =FIB(RC[-100]) -> 10946 | FT52: =FIB(RC[-100]) -> 10946 | FU52: =FIB(RC[-100]) -> 10946 | FV52: =FIB(RC[-100]) -> 10946 | FW52: =FIB(RC[-100]) -> 10946 | FX52: =FIB(RC[-100]) -> 10946 | FY52: =FIB(RC[-100]) -> 10946 | FZ52: =FIB(RC[-100]) -> 10946 | GA52: =FIB(RC[-100]) -> 10946 | GB52: =FIB(RC[-100]) -> 10946 | GC52: =FIB(RC[-100]) -> 10946 | GD52: =FIB(RC[-100]) -> 10946 | GE52: =FIB(RC[-100]) -> 10946 | GF52: =FIB(RC[-100]) -> 10946 | GG52: =FIB(RC[-100]) -> 10946 | GH52: =FIB(RC[-100]) -> 10946 | GI52: =FIB(RC[-100]) -> 10946 | GJ52: =FIB(RC[-100]) -> 10946 | GK52: =FIB(RC[-100]) -> 10946 | GL52: =FIB(RC[-100]) -> 10946 | GM52: =FIB(RC[-100]) -> 10946 | GN52: =FIB(RC[-100]) -> 10946 | GO52: =FIB(RC[-100]) -> 10946 | GP52: =FIB(RC[-100]) -> 10946 | GQ52: =FIB(RC[-100]) -> 10946 | GR52: =FIB(RC[-100]) -> 10946
A53: 20 | B53: 20 | C53: 20 | D53: 20 | E53: 20 | F53: 20 | G53: 20 | H53: 20 | I53: 20 | J53: 20 | K53: 20 | L53: 20 | M53: 20 | N53: 20 | O53: 20 | P53: 20 | Q53: 20 | R53: 20 | S53: 20 | T53: 20 | U53: 20 | V53: 20 | W53: 20 | X53: 20 | Y53: 20 | Z53: 20 | AA53: 20 | AB53: 20 | AC53: 20 | AD53: 20 | AE53: 20 | AF53: 20 | AG53: 20 | AH53: 20 | AI53: 20 | AJ53: 20 | AK53: 20 | AL53: 20 | AM53: 20 | AN53: 20 | AO53: 20 | AP53: 20 | AQ53: 20 | AR53: 20 | AS53: 20 | AT53: 20 | AU53: 20 | AV53: 20 | AW53: 20 | AX53: 20 | AY53: 20 | AZ53: 20 | BA53: 20 | BB53: 20 | BC53: 20 | BD53: 20 | BE53: 20 | BF53: 20 | BG53: 20 | BH53: 20 | BI53: 20 | BJ53: 20 | BK53: 20 | BL53: 20 | BM53: 20 | BN53: 20 | BO53: 20 | BP53: 20 | BQ53: 20 | BR53: 20 | BS53: 20 | BT53: 20 | BU53: 20 | BV53: 20 | BW53: 20 | BX53: 20 | BY53: 20 | BZ53: 20 | CA53: 20 | CB53: 20 | CC53: 20 | CD53: 20 | CE53: 20 | CF53: 20 | CG53: 20 | CH53: 20 | CI53: 20 | CJ53: 20 | CK53: 20 | CL53: 20 | CM53: 20 | CN53: 20 | CO53: 20 | CP53: 20 | CQ53: 20 | CR53: 20 | CS53: 20 | CT53: 20 | CU53: 20 | CV53: 20 | CW53: =FIB(RC[-100]) -> 10946 | CX53: =FIB(RC[-100]) -> 10946 | CY53: =FIB(RC[-100]) -> 10946 | CZ53: =FIB(RC[-100]) -> 10946 | DA53: =FIB(RC[-100]) -> 10946 | DB53: =FIB(RC[-100]) -> 10946 | DC53: =FIB(RC[-100]) -> 10946 | DD53: =FIB(RC[-100]) -> 10946 | DE53: =FIB(RC[-100]) -> 10946 | DF53: =FIB(RC[-100]) -> 10946 | DG53: =FIB(RC[-100]) -> 10946 | DH53: =FIB(RC[-100]) -> 10946 | DI53: =FIB(RC[-100]) -> 10946 | DJ53: =FIB(RC[-100]) -> 10946 | DK53: =FIB(RC[-100]) -> 10946 | DL53: =FIB(RC[-100]) -> 10946 | DM53: =FIB(RC[-100]) -> 10946 | DN53: =FIB(RC[-100]) -> 10946 | DO53: =FIB(RC[-100]) -> 10946 | DP53: =FIB(RC[-100]) -> 10946 | DQ53: =FIB(RC[-100]) -> 10946 | DR53: =FIB(RC[-100]) -> 10946 | DS53: =FIB(RC[-100]) -> 10946 | DT53: =FIB(RC[-100]) -> 10946 | DU53: =FIB(RC[-100]) -> 10946 | DV53: =FIB(RC[-100]) -> 10946 | DW53: =FIB(RC[-100]) -> 10946 | DX53: =FIB(RC[-100]) -> 10946 | DY53: =FIB(RC[-100]) -> 10946 | DZ53: =FIB(RC[-100]) -> 10946 | EA53: =FIB(RC[-100]) -> 10946 | EB53: =FIB(RC[-100]) -> 10946 | EC53: =FIB(RC[-100]) -> 10946 | ED53: =FIB(RC[-100]) -> 10946 | EE53: =FIB(RC[-100]) -> 10946 | EF53: =FIB(RC[-100]) -> 10946 | EG53: =FIB(RC[-100]) -> 10946 | EH53: =FIB(RC[-100]) -> 10946 | EI53: =FIB(RC[-100]) -> 10946 | EJ53: =FIB(RC[-100]) -> 10946 | EK53: =FIB(RC[-100]) -> 10946 | EL53: =FIB(RC[-100]) -> 10946 | EM53: =FIB(RC[-100]) -> 10946 | EN53: =FIB(RC[-100]) -> 10946 | EO53: =FIB(RC[-100]) -> 10946 | EP53: =FIB(RC[-100]) -> 10946 | EQ53: =FIB(RC[-100]) -> 10946 | ER53: =FIB(RC[-100]) -> 10946 | ES53: =FIB(RC[-100]) -> 10946 | ET53: =FIB(RC[-100]) -> 10946 | EU53: =FIB(RC[-100]) -> 10946 | EV53: =FIB(RC[-100]) -> 10946 | EW53: =FIB(RC[-100]) -> 10946 | EX53: =FIB(RC[-100]) -> 10946 | EY53: =FIB(RC[-100]) -> 10946 | EZ53: =FIB(RC[-100]) -> 10946 | FA53: =FIB(RC[-100]) -> 10946 | FB53: =FIB(RC[-100]) -> 10946 | FC53: =FIB(RC[-100]) -> 10946 | FD53: =FIB(RC[-100]) -> 10946 | FE53: =FIB(RC[-100]) -> 10946 | FF53: =FIB(RC[-100]) -> 10946 | FG53: =FIB(RC[-100]) -> 10946 | FH53: =FIB(RC[-100]) -> 10946 | FI53: =FIB(RC[-100]) -> 10946 | FJ53: =FIB(RC[-100]) -> 10946 | FK53: =FIB(RC[-100]) -> 10946 | FL53: =FIB(RC[-100]) -> 10946 | FM53: =FIB(RC[-100]) -> 10946 | FN53: =FIB(RC[-100]) -> 10946 | FO53: =FIB(RC[-100]) -> 10946 | FP53: =FIB(RC[-100]) -> 10946 | FQ53: =FIB(RC[-100]) -> 10946 | FR53: =FIB(RC[-100]) -> 10946 | FS53: =FIB(RC[-100]) -> 10946 | FT53: =FIB(RC[-100]) -> 10946 | FU53: =FIB(RC[-100]) -> 10946 | FV53: =FIB(RC[-100]) -> 10946 | FW53: =FIB(RC[-100]) -> 10946 | FX53: =FIB(RC[-100]) -> 10946 | FY53: =FIB(RC[-100]) -> 10946 | FZ53: =FIB(RC[-100]) -> 10946 | GA53: =FIB(RC[-100]) -> 10946 | GB53: =FIB(RC[-100]) -> 10946 | GC53: =FIB(RC[-100]) -> 10946 | GD53: =FIB(RC[-100]) -> 10946 | GE53: =FIB(RC[-100]) -> 10946 | GF53: =FIB(RC[-100]) -> 10946 | GG53: =FIB(RC[-100]) -> 10946 | GH53: =FIB(RC[-100]) -> 10946 | GI53: =FIB(RC[-100]) -> 10946 | GJ53: =FIB(RC[-100]) -> 10946 | GK53: =FIB(RC[-100]) -> 10946 | GL53: =FIB(RC[-100]) -> 10946 | GM53: =FIB(RC[-100]) -> 10946 | GN53: =FIB(RC[-100]) -> 10946 | GO53: =FIB(RC[-100]) -> 10946 | GP53: =FIB(RC[-100]) -> 10946 | GQ53: =FIB(RC[-100]) -> 10946 | GR53: =FIB(RC[-100]) -> 10946
A54: 20 | B54: 20 | C54: 20 | D54: 20 | E54: 20 | F54: 20 | G54: 20 | H54: 20 | I54: 20 | J54: 20 | K54: 20 | L54: 20 | M54: 20 | N54: 20 | O54: 20 | P54: 20 | Q54: 20 | R54: 20 | S54: 20 | T54: 20 | U54: 20 | V54: 20 | W54: 20 | X54: 20 | Y54: 20 | Z54: 20 | AA54: 20 | AB54: 20 | AC54: 20 | AD54: 20 | AE54: 20 | AF54: 20 | AG54: 20 | AH54: 20 | AI54: 20 | AJ54: 20 | AK54: 20 | AL54: 20 | AM54: 20 | AN54: 20 | AO54: 20 | AP54: 20 | AQ54: 20 | AR54: 20 | AS54: 20 | AT54: 20 | AU54: 20 | AV54: 20 | AW54: 20 | AX54: 20 | AY54: 20 | AZ54: 20 | BA54: 20 | BB54: 20 | BC54: 20 | BD54: 20 | BE54: 20 | BF54: 20 | BG54: 20 | BH54: 20 | BI54: 20 | BJ54: 20 | BK54: 20 | BL54: 20 | BM54: 20 | BN54: 20 | BO54: 20 | BP54: 20 | BQ54: 20 | BR54: 20 | BS54: 20 | BT54: 20 | BU54: 20 | BV54: 20 | BW54: 20 | BX54: 20 | BY54: 20 | BZ54: 20 | CA54: 20 | CB54: 20 | CC54: 20 | CD54: 20 | CE54: 20 | CF54: 20 | CG54: 20 | CH54: 20 | CI54: 20 | CJ54: 20 | CK54: 20 | CL54: 20 | CM54: 20 | CN54: 20 | CO54: 20 | CP54: 20 | CQ54: 20 | CR54: 20 | CS54: 20 | CT54: 20 | CU54: 20 | CV54: 20 | CW54: =FIB(RC[-100]) -> 10946 | CX54: =FIB(RC[-100]) -> 10946 | CY54: =FIB(RC[-100]) -> 10946 | CZ54: =FIB(RC[-100]) -> 10946 | DA54: =FIB(RC[-100]) -> 10946 | DB54: =FIB(RC[-100]) -> 10946 | DC54: =FIB(RC[-100]) -> 10946 | DD54: =FIB(RC[-100]) -> 10946 | DE54: =FIB(RC[-100]) -> 10946 | DF54: =FIB(RC[-100]) -> 10946 | DG54: =FIB(RC[-100]) -> 10946 | DH54: =FIB(RC[-100]) -> 10946 | DI54: =FIB(RC[-100]) -> 10946 | DJ54: =FIB(RC[-100]) -> 10946 | DK54: =FIB(RC[-100]) -> 10946 | DL54: =FIB(RC[-100]) -> 10946 | DM54: =FIB(RC[-100]) -> 10946 | DN54: =FIB(RC[-100]) -> 10946 | DO54: =FIB(RC[-100]) -> 10946 | DP54: =FIB(RC[-100]) -> 10946 | DQ54: =FIB(RC[-100]) -> 10946 | DR54: =FIB(RC[-100]) -> 10946 | DS54: =FIB(RC[-100]) -> 10946 | DT54: =FIB(RC[-100]) -> 10946 | DU54: =FIB(RC[-100]) -> 10946 | DV54: =FIB(RC[-100]) -> 10946 | DW54: =FIB(RC[-100]) -> 10946 | DX54: =FIB(RC[-100]) -> 10946 | DY54: =FIB(RC[-100]) -> 10946 | DZ54: =FIB(RC[-100]) -> 10946 | EA54: =FIB(RC[-100]) -> 10946 | EB54: =FIB(RC[-100]) -> 10946 | EC54: =FIB(RC[-100]) -> 10946 | ED54: =FIB(RC[-100]) -> 10946 | EE54: =FIB(RC[-100]) -> 10946 | EF54: =FIB(RC[-100]) -> 10946 | EG54: =FIB(RC[-100]) -> 10946 | EH54: =FIB(RC[-100]) -> 10946 | EI54: =FIB(RC[-100]) -> 10946 | EJ54: =FIB(RC[-100]) -> 10946 | EK54: =FIB(RC[-100]) -> 10946 | EL54: =FIB(RC[-100]) -> 10946 | EM54: =FIB(RC[-100]) -> 10946 | EN54: =FIB(RC[-100]) -> 10946 | EO54: =FIB(RC[-100]) -> 10946 | EP54: =FIB(RC[-100]) -> 10946 | EQ54: =FIB(RC[-100]) -> 10946 | ER54: =FIB(RC[-100]) -> 10946 | ES54: =FIB(RC[-100]) -> 10946 | ET54: =FIB(RC[-100]) -> 10946 | EU54: =FIB(RC[-100]) -> 10946 | EV54: =FIB(RC[-100]) -> 10946 | EW54: =FIB(RC[-100]) -> 10946 | EX54: =FIB(RC[-100]) -> 10946 | EY54: =FIB(RC[-100]) -> 10946 | EZ54: =FIB(RC[-100]) -> 10946 | FA54: =FIB(RC[-100]) -> 10946 | FB54: =FIB(RC[-100]) -> 10946 | FC54: =FIB(RC[-100]) -> 10946 | FD54: =FIB(RC[-100]) -> 10946 | FE54: =FIB(RC[-100]) -> 10946 | FF54: =FIB(RC[-100]) -> 10946 | FG54: =FIB(RC[-100]) -> 10946 | FH54: =FIB(RC[-100]) -> 10946 | FI54: =FIB(RC[-100]) -> 10946 | FJ54: =FIB(RC[-100]) -> 10946 | FK54: =FIB(RC[-100]) -> 10946 | FL54: =FIB(RC[-100]) -> 10946 | FM54: =FIB(RC[-100]) -> 10946 | FN54: =FIB(RC[-100]) -> 10946 | FO54: =FIB(RC[-100]) -> 10946 | FP54: =FIB(RC[-100]) -> 10946 | FQ54: =FIB(RC[-100]) -> 10946 | FR54: =FIB(RC[-100]) -> 10946 | FS54: =FIB(RC[-100]) -> 10946 | FT54: =FIB(RC[-100]) -> 10946 | FU54: =FIB(RC[-100]) -> 10946 | FV54: =FIB(RC[-100]) -> 10946 | FW54: =FIB(RC[-100]) -> 10946 | FX54: =FIB(RC[-100]) -> 10946 | FY54: =FIB(RC[-100]) -> 10946 | FZ54: =FIB(RC[-100]) -> 10946 | GA54: =FIB(RC[-100]) -> 10946 | GB54: =FIB(RC[-100]) -> 10946 | GC54: =FIB(RC[-100]) -> 10946 | GD54: =FIB(RC[-100]) -> 10946 | GE54: =FIB(RC[-100]) -> 10946 | GF54: =FIB(RC[-100]) -> 10946 | GG54: =FIB(RC[-100]) -> 10946 | GH54: =FIB(RC[-100]) -> 10946 | GI54: =FIB(RC[-100]) -> 10946 | GJ54: =FIB(RC[-100]) -> 10946 | GK54: =FIB(RC[-100]) -> 10946 | GL54: =FIB(RC[-100]) -> 10946 | GM54: =FIB(RC[-100]) -> 10946 | GN54: =FIB(RC[-100]) -> 10946 | GO54: =FIB(RC[-100]) -> 10946 | GP54: =FIB(RC[-100]) -> 10946 | GQ54: =FIB(RC[-100]) -> 10946 | GR54: =FIB(RC[-100]) -> 10946
A55: 20 | B55: 20 | C55: 20 | D55: 20 | E55: 20 | F55: 20 | G55: 20 | H55: 20 | I55: 20 | J55: 20 | K55: 20 | L55: 20 | M55: 20 | N55: 20 | O55: 20 | P55: 20 | Q55: 20 | R55: 20 | S55: 20 | T55: 20 | U55: 20 | V55: 20 | W55: 20 | X55: 20 | Y55: 20 | Z55: 20 | AA55: 20 | AB55: 20 | AC55: 20 | AD55: 20 | AE55: 20 | AF55: 20 | AG55: 20 | AH55: 20 | AI55: 20 | AJ55: 20 | AK55: 20 | AL55: 20 | AM55: 20 | AN55: 20 | AO55: 20 | AP55: 20 | AQ55: 20 | AR55: 20 | AS55: 20 | AT55: 20 | AU55: 20 | AV55: 20 | AW55: 20 | AX55: 20 | AY55: 20 | AZ55: 20 | BA55: 20 | BB55: 20 | BC55: 20 | BD55: 20 | BE55: 20 | BF55: 20 | BG55: 20 | BH55: 20 | BI55: 20 | BJ55: 20 | BK55: 20 | BL55: 20 | BM55: 20 | BN55: 20 | BO55: 20 | BP55: 20 | BQ55: 20 | BR55: 20 | BS55: 20 | BT55: 20 | BU55: 20 | BV55: 20 | BW55: 20 | BX55: 20 | BY55: 20 | BZ55: 20 | CA55: 20 | CB55: 20 | CC55: 20 | CD55: 20 | CE55: 20 | CF55: 20 | CG55: 20 | CH55: 20 | CI55: 20 | CJ55: 20 | CK55: 20 | CL55: 20 | CM55: 20 | CN55: 20 | CO55: 20 | CP55: 20 | CQ55: 20 | CR55: 20 | CS55: 20 | CT55: 20 | CU55: 20 | CV55: 20 | CW55: =FIB(RC[-100]) -> 10946 | CX55: =FIB(RC[-100]) -> 10946 | CY55: =FIB(RC[-100]) -> 10946 | CZ55: =FIB(RC[-100]) -> 10946 | DA55: =FIB(RC[-100]) -> 10946 | DB55: =FIB(RC[-100]) -> 10946 | DC55: =FIB(RC[-100]) -> 10946 | DD55: =FIB(RC[-100]) -> 10946 | DE55: =FIB(RC[-100]) -> 10946 | DF55: =FIB(RC[-100]) -> 10946 | DG55: =FIB(RC[-100]) -> 10946 | DH55: =FIB(RC[-100]) -> 10946 | DI55: =FIB(RC[-100]) -> 10946 | DJ55: =FIB(RC[-100]) -> 10946 | DK55: =FIB(RC[-100]) -> 10946 | DL55: =FIB(RC[-100]) -> 10946 | DM55: =FIB(RC[-100]) -> 10946 | DN55: =FIB(RC[-100]) -> 10946 | DO55: =FIB(RC[-100]) -> 10946 | DP55: =FIB(RC[-100]) -> 10946 | DQ55: =FIB(RC[-100]) -> 10946 | DR55: =FIB(RC[-100]) -> 10946 | DS55: =FIB(RC[-100]) -> 10946 | DT55: =FIB(RC[-100]) -> 10946 | DU55: =FIB(RC[-100]) -> 10946 | DV55: =FIB(RC[-100]) -> 10946 | DW55: =FIB(RC[-100]) -> 10946 | DX55: =FIB(RC[-100]) -> 10946 | DY55: =FIB(RC[-100]) -> 10946 | DZ55: =FIB(RC[-100]) -> 10946 | EA55: =FIB(RC[-100]) -> 10946 | EB55: =FIB(RC[-100]) -> 10946 | EC55: =FIB(RC[-100]) -> 10946 | ED55: =FIB(RC[-100]) -> 10946 | EE55: =FIB(RC[-100]) -> 10946 | EF55: =FIB(RC[-100]) -> 10946 | EG55: =FIB(RC[-100]) -> 10946 | EH55: =FIB(RC[-100]) -> 10946 | EI55: =FIB(RC[-100]) -> 10946 | EJ55: =FIB(RC[-100]) -> 10946 | EK55: =FIB(RC[-100]) -> 10946 | EL55: =FIB(RC[-100]) -> 10946 | EM55: =FIB(RC[-100]) -> 10946 | EN55: =FIB(RC[-100]) -> 10946 | EO55: =FIB(RC[-100]) -> 10946 | EP55: =FIB(RC[-100]) -> 10946 | EQ55: =FIB(RC[-100]) -> 10946 | ER55: =FIB(RC[-100]) -> 10946 | ES55: =FIB(RC[-100]) -> 10946 | ET55: =FIB(RC[-100]) -> 10946 | EU55: =FIB(RC[-100]) -> 10946 | EV55: =FIB(RC[-100]) -> 10946 | EW55: =FIB(RC[-100]) -> 10946 | EX55: =FIB(RC[-100]) -> 10946 | EY55: =FIB(RC[-100]) -> 10946 | EZ55: =FIB(RC[-100]) -> 10946 | FA55: =FIB(RC[-100]) -> 10946 | FB55: =FIB(RC[-100]) -> 10946 | FC55: =FIB(RC[-100]) -> 10946 | FD55: =FIB(RC[-100]) -> 10946 | FE55: =FIB(RC[-100]) -> 10946 | FF55: =FIB(RC[-100]) -> 10946 | FG55: =FIB(RC[-100]) -> 10946 | FH55: =FIB(RC[-100]) -> 10946 | FI55: =FIB(RC[-100]) -> 10946 | FJ55: =FIB(RC[-100]) -> 10946 | FK55: =FIB(RC[-100]) -> 10946 | FL55: =FIB(RC[-100]) -> 10946 | FM55: =FIB(RC[-100]) -> 10946 | FN55: =FIB(RC[-100]) -> 10946 | FO55: =FIB(RC[-100]) -> 10946 | FP55: =FIB(RC[-100]) -> 10946 | FQ55: =FIB(RC[-100]) -> 10946 | FR55: =FIB(RC[-100]) -> 10946 | FS55: =FIB(RC[-100]) -> 10946 | FT55: =FIB(RC[-100]) -> 10946 | FU55: =FIB(RC[-100]) -> 10946 | FV55: =FIB(RC[-100]) -> 10946 | FW55: =FIB(RC[-100]) -> 10946 | FX55: =FIB(RC[-100]) -> 10946 | FY55: =FIB(RC[-100]) -> 10946 | FZ55: =FIB(RC[-100]) -> 10946 | GA55: =FIB(RC[-100]) -> 10946 | GB55: =FIB(RC[-100]) -> 10946 | GC55: =FIB(RC[-100]) -> 10946 | GD55: =FIB(RC[-100]) -> 10946 | GE55: =FIB(RC[-100]) -> 10946 | GF55: =FIB(RC[-100]) -> 10946 | GG55: =FIB(RC[-100]) -> 10946 | GH55: =FIB(RC[-100]) -> 10946 | GI55: =FIB(RC[-100]) -> 10946 | GJ55: =FIB(RC[-100]) -> 10946 | GK55: =FIB(RC[-100]) -> 10946 | GL55: =FIB(RC[-100]) -> 10946 | GM55: =FIB(RC[-100]) -> 10946 | GN55: =FIB(RC[-100]) -> 10946 | GO55: =FIB(RC[-100]) -> 10946 | GP55: =FIB(RC[-100]) -> 10946 | GQ55: =FIB(RC[-100]) -> 10946 | GR55: =FIB(RC[-100]) -> 10946
A56: 20 | B56: 20 | C56: 20 | D56: 20 | E56: 20 | F56: 20 | G56: 20 | H56: 20 | I56: 20 | J56: 20 | K56: 20 | L56: 20 | M56: 20 | N56: 20 | O56: 20 | P56: 20 | Q56: 20 | R56: 20 | S56: 20 | T56: 20 | U56: 20 | V56: 20 | W56: 20 | X56: 20 | Y56: 20 | Z56: 20 | AA56: 20 | AB56: 20 | AC56: 20 | AD56: 20 | AE56: 20 | AF56: 20 | AG56: 20 | AH56: 20 | AI56: 20 | AJ56: 20 | AK56: 20 | AL56: 20 | AM56: 20 | AN56: 20 | AO56: 20 | AP56: 20 | AQ56: 20 | AR56: 20 | AS56: 20 | AT56: 20 | AU56: 20 | AV56: 20 | AW56: 20 | AX56: 20 | AY56: 20 | AZ56: 20 | BA56: 20 | BB56: 20 | BC56: 20 | BD56: 20 | BE56: 20 | BF56: 20 | BG56: 20 | BH56: 20 | BI56: 20 | BJ56: 20 | BK56: 20 | BL56: 20 | BM56: 20 | BN56: 20 | BO56: 20 | BP56: 20 | BQ56: 20 | BR56: 20 | BS56: 20 | BT56: 20 | BU56: 20 | BV56: 20 | BW56: 20 | BX56: 20 | BY56: 20 | BZ56: 20 | CA56: 20 | CB56: 20 | CC56: 20 | CD56: 20 | CE56: 20 | CF56: 20 | CG56: 20 | CH56: 20 | CI56: 20 | CJ56: 20 | CK56: 20 | CL56: 20 | CM56: 20 | CN56: 20 | CO56: 20 | CP56: 20 | CQ56: 20 | CR56: 20 | CS56: 20 | CT56: 20 | CU56: 20 | CV56: 20 | CW56: =FIB(RC[-100]) -> 10946 | CX56: =FIB(RC[-100]) -> 10946 | CY56: =FIB(RC[-100]) -> 10946 | CZ56: =FIB(RC[-100]) -> 10946 | DA56: =FIB(RC[-100]) -> 10946 | DB56: =FIB(RC[-100]) -> 10946 | DC56: =FIB(RC[-100]) -> 10946 | DD56: =FIB(RC[-100]) -> 10946 | DE56: =FIB(RC[-100]) -> 10946 | DF56: =FIB(RC[-100]) -> 10946 | DG56: =FIB(RC[-100]) -> 10946 | DH56: =FIB(RC[-100]) -> 10946 | DI56: =FIB(RC[-100]) -> 10946 | DJ56: =FIB(RC[-100]) -> 10946 | DK56: =FIB(RC[-100]) -> 10946 | DL56: =FIB(RC[-100]) -> 10946 | DM56: =FIB(RC[-100]) -> 10946 | DN56: =FIB(RC[-100]) -> 10946 | DO56: =FIB(RC[-100]) -> 10946 | DP56: =FIB(RC[-100]) -> 10946 | DQ56: =FIB(RC[-100]) -> 10946 | DR56: =FIB(RC[-100]) -> 10946 | DS56: =FIB(RC[-100]) -> 10946 | DT56: =FIB(RC[-100]) -> 10946 | DU56: =FIB(RC[-100]) -> 10946 | DV56: =FIB(RC[-100]) -> 10946 | DW56: =FIB(RC[-100]) -> 10946 | DX56: =FIB(RC[-100]) -> 10946 | DY56: =FIB(RC[-100]) -> 10946 | DZ56: =FIB(RC[-100]) -> 10946 | EA56: =FIB(RC[-100]) -> 10946 | EB56: =FIB(RC[-100]) -> 10946 | EC56: =FIB(RC[-100]) -> 10946 | ED56: =FIB(RC[-100]) -> 10946 | EE56: =FIB(RC[-100]) -> 10946 | EF56: =FIB(RC[-100]) -> 10946 | EG56: =FIB(RC[-100]) -> 10946 | EH56: =FIB(RC[-100]) -> 10946 | EI56: =FIB(RC[-100]) -> 10946 | EJ56: =FIB(RC[-100]) -> 10946 | EK56: =FIB(RC[-100]) -> 10946 | EL56: =FIB(RC[-100]) -> 10946 | EM56: =FIB(RC[-100]) -> 10946 | EN56: =FIB(RC[-100]) -> 10946 | EO56: =FIB(RC[-100]) -> 10946 | EP56: =FIB(RC[-100]) -> 10946 | EQ56: =FIB(RC[-100]) -> 10946 | ER56: =FIB(RC[-100]) -> 10946 | ES56: =FIB(RC[-100]) -> 10946 | ET56: =FIB(RC[-100]) -> 10946 | EU56: =FIB(RC[-100]) -> 10946 | EV56: =FIB(RC[-100]) -> 10946 | EW56: =FIB(RC[-100]) -> 10946 | EX56: =FIB(RC[-100]) -> 10946 | EY56: =FIB(RC[-100]) -> 10946 | EZ56: =FIB(RC[-100]) -> 10946 | FA56: =FIB(RC[-100]) -> 10946 | FB56: =FIB(RC[-100]) -> 10946 | FC56: =FIB(RC[-100]) -> 10946 | FD56: =FIB(RC[-100]) -> 10946 | FE56: =FIB(RC[-100]) -> 10946 | FF56: =FIB(RC[-100]) -> 10946 | FG56: =FIB(RC[-100]) -> 10946 | FH56: =FIB(RC[-100]) -> 10946 | FI56: =FIB(RC[-100]) -> 10946 | FJ56: =FIB(RC[-100]) -> 10946 | FK56: =FIB(RC[-100]) -> 10946 | FL56: =FIB(RC[-100]) -> 10946 | FM56: =FIB(RC[-100]) -> 10946 | FN56: =FIB(RC[-100]) -> 10946 | FO56: =FIB(RC[-100]) -> 10946 | FP56: =FIB(RC[-100]) -> 10946 | FQ56: =FIB(RC[-100]) -> 10946 | FR56: =FIB(RC[-100]) -> 10946 | FS56: =FIB(RC[-100]) -> 10946 | FT56: =FIB(RC[-100]) -> 10946 | FU56: =FIB(RC[-100]) -> 10946 | FV56: =FIB(RC[-100]) -> 10946 | FW56: =FIB(RC[-100]) -> 10946 | FX56: =FIB(RC[-100]) -> 10946 | FY56: =FIB(RC[-100]) -> 10946 | FZ56: =FIB(RC[-100]) -> 10946 | GA56: =FIB(RC[-100]) -> 10946 | GB56: =FIB(RC[-100]) -> 10946 | GC56: =FIB(RC[-100]) -> 10946 | GD56: =FIB(RC[-100]) -> 10946 | GE56: =FIB(RC[-100]) -> 10946 | GF56: =FIB(RC[-100]) -> 10946 | GG56: =FIB(RC[-100]) -> 10946 | GH56: =FIB(RC[-100]) -> 10946 | GI56: =FIB(RC[-100]) -> 10946 | GJ56: =FIB(RC[-100]) -> 10946 | GK56: =FIB(RC[-100]) -> 10946 | GL56: =FIB(RC[-100]) -> 10946 | GM56: =FIB(RC[-100]) -> 10946 | GN56: =FIB(RC[-100]) -> 10946 | GO56: =FIB(RC[-100]) -> 10946 | GP56: =FIB(RC[-100]) -> 10946 | GQ56: =FIB(RC[-100]) -> 10946 | GR56: =FIB(RC[-100]) -> 10946
A57: 20 | B57: 20 | C57: 20 | D57: 20 | E57: 20 | F57: 20 | G57: 20 | H57: 20 | I57: 20 | J57: 20 | K57: 20 | L57: 20 | M57: 20 | N57: 20 | O57: 20 | P57: 20 | Q57: 20 | R57: 20 | S57: 20 | T57: 20 | U57: 20 | V57: 20 | W57: 20 | X57: 20 | Y57: 20 | Z57: 20 | AA57: 20 | AB57: 20 | AC57: 20 | AD57: 20 | AE57: 20 | AF57: 20 | AG57: 20 | AH57: 20 | AI57: 20 | AJ57: 20 | AK57: 20 | AL57: 20 | AM57: 20 | AN57: 20 | AO57: 20 | AP57: 20 | AQ57: 20 | AR57: 20 | AS57: 20 | AT57: 20 | AU57: 20 | AV57: 20 | AW57: 20 | AX57: 20 | AY57: 20 | AZ57: 20 | BA57: 20 | BB57: 20 | BC57: 20 | BD57: 20 | BE57: 20 | BF57: 20 | BG57: 20 | BH57: 20 | BI57: 20 | BJ57: 20 | BK57: 20 | BL57: 20 | BM57: 20 | BN57: 20 | BO57: 20 | BP57: 20 | BQ57: 20 | BR57: 20 | BS57: 20 | BT57: 20 | BU57: 20 | BV57: 20 | BW57: 20 | BX57: 20 | BY57: 20 | BZ57: 20 | CA57: 20 | CB57: 20 | CC57: 20 | CD57: 20 | CE57: 20 | CF57: 20 | CG57: 20 | CH57: 20 | CI57: 20 | CJ57: 20 | CK57: 20 | CL57: 20 | CM57: 20 | CN57: 20 | CO57: 20 | CP57: 20 | CQ57: 20 | CR57: 20 | CS57: 20 | CT57: 20 | CU57: 20 | CV57: 20 | CW57: =FIB(RC[-100]) -> 10946 | CX57: =FIB(RC[-100]) -> 10946 | CY57: =FIB(RC[-100]) -> 10946 | CZ57: =FIB(RC[-100]) -> 10946 | DA57: =FIB(RC[-100]) -> 10946 | DB57: =FIB(RC[-100]) -> 10946 | DC57: =FIB(RC[-100]) -> 10946 | DD57: =FIB(RC[-100]) -> 10946 | DE57: =FIB(RC[-100]) -> 10946 | DF57: =FIB(RC[-100]) -> 10946 | DG57: =FIB(RC[-100]) -> 10946 | DH57: =FIB(RC[-100]) -> 10946 | DI57: =FIB(RC[-100]) -> 10946 | DJ57: =FIB(RC[-100]) -> 10946 | DK57: =FIB(RC[-100]) -> 10946 | DL57: =FIB(RC[-100]) -> 10946 | DM57: =FIB(RC[-100]) -> 10946 | DN57: =FIB(RC[-100]) -> 10946 | DO57: =FIB(RC[-100]) -> 10946 | DP57: =FIB(RC[-100]) -> 10946 | DQ57: =FIB(RC[-100]) -> 10946 | DR57: =FIB(RC[-100]) -> 10946 | DS57: =FIB(RC[-100]) -> 10946 | DT57: =FIB(RC[-100]) -> 10946 | DU57: =FIB(RC[-100]) -> 10946 | DV57: =FIB(RC[-100]) -> 10946 | DW57: =FIB(RC[-100]) -> 10946 | DX57: =FIB(RC[-100]) -> 10946 | DY57: =FIB(RC[-100]) -> 10946 | DZ57: =FIB(RC[-100]) -> 10946 | EA57: =FIB(RC[-100]) -> 10946 | EB57: =FIB(RC[-100]) -> 10946 | EC57: =FIB(RC[-100]) -> 10946 | ED57: =FIB(RC[-100]) -> 10946 | EE57: =FIB(RC[-100]) -> 10946 | EF57: =FIB(RC[-100]) -> 10946 | EG57: =FIB(RC[-100]) -> 10946 | EH57: =FIB(RC[-100]) -> 10946 | EI57: =FIB(RC[-100]) -> 10946 | EJ57: =FIB(RC[-100]) -> 10946 | EK57: =FIB(RC[-100]) -> 10946 | EL57: =FIB(RC[-100]) -> 10946 | EM57: =FIB(RC[-100]) -> 10946 | EN57: =FIB(RC[-100]) -> 10946 | EO57: =FIB(RC[-100]) -> 10946 | EP57: =FIB(RC[-100]) -> 10946 | EQ57: =FIB(RC[-100]) -> 10946 | ER57: =FIB(RC[-100]) -> 10946 | ES57: =FIB(RC[-100]) -> 10946 | ET57: =FIB(RC[-100]) -> 10946 | EU57: =FIB(RC[-100]) -> 10946 | EV57: =FIB(RC[-100]) -> 10946 | EW57: =FIB(RC[-100]) -> 10946 | EX57: =FIB(RC[-100]) -> 10946 | EY57: =FIB(RC[-100]) -> 10946 | EZ57: =FIB(RC[-100]) -> 10946 | FA57: =FIB(RC[-100]) -> 10946 | FB57: =FIB(RC[-100]) -> 10946 | FC57: =FIB(RC[-100]) -> 10946 | FD57: =FIB(RC[-100]) -> 10946 | FE57: =FIB(RC[-100]) -> 10946 | FF57: =FIB(RC[-100]) -> 10946 | FG57: =FIB(RC[-100]) -> 10946 | FH57: =FIB(RC[-100]) -> 10946 | FI57: =FIB(RC[-100]) -> 10946 | FJ57: =FIB(RC[-100]) -> 10946 | FK57: =FIB(RC[-100]) -> 10946 | FL57: =FIB(RC[-100]) -> 10946 | FM57: =FIB(RC[-100]) -> 10946 | FN57: =FIB(RC[-100]) -> 10946 | FO57: =FIB(RC[-100]) -> 10946 | FP57: =FIB(RC[-100]) -> 10946 | FQ57: =FIB(RC[-100]) -> 10946 | FR57: =FIB(RC[-100]) -> 10946 | FS57: =FIB(RC[-100]) -> 10946 | FT57: =FIB(RC[-100]) -> 10946 | FU57: =FIB(RC[-100]) -> 10946 | FV57: =FIB(RC[-100]) -> 10946 | FW57: =FIB(RC[-100]) -> 10946 | FX57: =FIB(RC[-100]) -> 10946 | FY57: =FIB(RC[-100]) -> 10946 | FZ57: =FIB(RC[-100]) -> 10946 | GA57: =FIB(RC[-100]) -> 10946 | GB57: =FIB(RC[-100]) -> 10946 | GC57: =FIB(RC[-100]) -> 10946 | GD57: =FIB(RC[-100]) -> 10946 | GE57: =FIB(RC[-100]) -> 10946 | GF57: =FIB(RC[-100]) -> 10946 | GG57: =FIB(RC[-100]) -> 10946 | GH57: =FIB(RC[-100]) -> 10946 | GI57: =FIB(RC[-100]) -> 10946 | GJ57: =FIB(RC[-100]) -> 10946 | GK57: =FIB(RC[-100]) -> 10946 | GL57: =FIB(RC[-100]) -> 10946 | GM57: =FIB(RC[-100]) -> 10946 | GN57: =FIB(RC[-100]) -> 10946 | GO57: =FIB(RC[-100]) -> 10946 | GP57: =FIB(RC[-100]) -> 10946 | GQ57: =FIB(RC[-100]) -> 10946 | GR57: =FIB(RC[-100]) -> 10946
A58: 20 | B58: 20 | C58: 20 | D58: 20 | E58: 20 | F58: 20 | G58: 20 | H58: 20 | I58: 20 | J58: 20 | K58: 20 | L58: 20 | M58: 20 | N58: 20 | O58: 20 | P58: 20 | Q58: 20 | R58: 20 | S58: 20 | T58: 20 | U58: 20 | V58: 20 | W58: 20 | X58: 20 | Y58: 20 | Z58: 20 | AA58: 20 | AB58: 20 | AC58: 20 | AD58: 20 | AE58: 20 | AF58: 20 | AG58: 20 | AH58: 20 | AI58: 20 | AJ58: 20 | AK58: 20 | AL58: 20 | AM58: 20 | AN58: 20 | AO58: 20 | AP58: 20 | AQ58: 20 | AR58: 20 | AS58: 20 | AT58: 20 | AU58: 20 | AV58: 20 | AW58: 20 | AX58: 20 | AY58: 20 | AZ58: 20 | BA58: 20 | BB58: 20 | BC58: 20 | BD58: 20 | BE58: 20 | BF58: 20 | BG58: 20 | BH58: 20 | BI58: 20 | BJ58: 20 | BK58: 20 | BL58: 20 | BM58: 20 | BN58: 20 | BO58: 20 | BP58: 20 | BQ58: 20 | BR58: 20 | BS58: 20 | BT58: 20 | BU58: 20 | BV58: 20 | BW58: 20 | BX58: 20 | BY58: 20 | BZ58: 20 | CA58: 20 | CB58: 20 | CC58: 20 | CD58: 20 | CE58: 20 | CF58: 20 | CG58: 20 | CH58: 20 | CI58: 20 | CJ58: 20 | CK58: 20 | CL58: 20 | CM58: 20 | CN58: 20 | CO58: 20 | CP58: 20 | CQ58: 20 | CR58: 20 | CS58: 20 | CT58: 20 | CU58: 20 | CV58: 20 | CW58: =FIB(RC[-100]) -> 10946 | CX58: =FIB(RC[-100]) -> 10946 | CY58: =FIB(RC[-100]) -> 10946 | CZ58: =FIB(RC[-100]) -> 10946 | DA58: =FIB(RC[-100]) -> 10946 | DB58: =FIB(RC[-100]) -> 10946 | DC58: =FIB(RC[-100]) -> 10946 | DD58: =FIB(RC[-100]) -> 10946 | DE58: =FIB(RC[-100]) -> 10946 | DF58: =FIB(RC[-100]) -> 10946 | DG58: =FIB(RC[-100]) -> 10946 | DH58: =FIB(RC[-100]) -> 10946 | DI58: =FIB(RC[-100]) -> 10946 | DJ58: =FIB(RC[-100]) -> 10946 | DK58: =FIB(RC[-100]) -> 10946 | DL58: =FIB(RC[-100]) -> 10946 | DM58: =FIB(RC[-100]) -> 10946 | DN58: =FIB(RC[-100]) -> 10946 | DO58: =FIB(RC[-100]) -> 10946 | DP58: =FIB(RC[-100]) -> 10946 | DQ58: =FIB(RC[-100]) -> 10946 | DR58: =FIB(RC[-100]) -> 10946 | DS58: =FIB(RC[-100]) -> 10946 | DT58: =FIB(RC[-100]) -> 10946 | DU58: =FIB(RC[-100]) -> 10946 | DV58: =FIB(RC[-100]) -> 10946 | DW58: =FIB(RC[-100]) -> 10946 | DX58: =FIB(RC[-100]) -> 10946 | DY58: =FIB(RC[-100]) -> 10946 | DZ58: =FIB(RC[-100]) -> 10946 | EA58: =FIB(RC[-100]) -> 10946 | EB58: =FIB(RC[-100]) -> 10946 | EC58: =FIB(RC[-100]) -> 10946 | ED58: =FIB(RC[-100]) -> 10946 | EE58: =FIB(RC[-100]) -> 10946 | EF58: =FIB(RC[-100]) -> 10946 | EG58: =FIB(RC[-100]) -> 10946 | EH58: =FIB(RC[-100]) -> 10946 | EI58: =FIB(RC[-100]) -> 10946 | EJ58: =FIB(RC[-100]) -> 10946 | EK58: =FIB(RC[-100]) -> 10946 | EL58: =FIB(RC[-100]) -> 10946 | EM58: =FIB(RC[-100]) -> 10946 | EN58: =FIB(RC[-100]) -> 10946 | EO58: =FIB(RC[-100]) -> 10946 | EP58: =FIB(RC[-100]) -> 10946 | EQ58: =FIB(RC[-100]) -> 10946 | ER58: =FIB(RC[-100]) -> 10946 | ES58: =FIB(RC[-100]) -> 10946 | ET58: =FIB(RC[-100]) -> 10946 | EU58: =FIB(RC[-100]) -> 10946 | EV58: =FIB(RC[-100]) -> 10946 | EW58: =FIB(RC[-100]) -> 10946 | EX58: =FIB(RC[-100]) -> 10946 | EY58: =FIB(RC[-100]) -> 10946 | EZ58: =FIB(RC[-100]) -> 10946 | FA58: =FIB(RC[-100]) -> 10946 | FB58: =FIB(RC[-100]) -> 10946 | FC58: =FIB(RC[-100]) -> 10946 | FD58: =FIB(RC[-100]) -> 10946 | FE58: =FIB(RC[-100]) -> 10946 | FF58: =FIB(RC[-100]) -> 10946 | FG58: =FIB(RC[-100]) -> 10946 | FH58: =FIB(RC[-100]) -> 10946 | FI58: =FIB(RC[-100]) -> 10946 | FJ58: =FIB(RC[-100]) -> 10946 | FK58: =FIB(RC[-100]) -> 10946 | FL58: =FIB(RC[-100]) -> 10946 | FM58: =FIB(RC[-100]) -> 10946 | FN58: =FIB(RC[-100]) -> 10946 | FO58: =FIB(RC[-100]) -> 10946 | FP58: =FIB(RC[-100]) -> 10946 | FQ58: =FIB(RC[-100]) -> 10946 | FR58: =FIB(RC[-100]) -> 10946 | FS58: =FIB(RC[-100]) -> 10946 | FT58: =FIB(RC[-100]) -> 10946 | FU58: =FIB(RC[-100]) -> 10946 | FV58: =FIB(RC[-100]) -> 10946 | FW58: =FIB(RC[-100]) -> 10946 | FX58: =FIB(RC[-100]) -> 10946 | FY58: =FIB(RC[-100]) -> 10946 | FZ58: =FIB(RC[-100]) -> 10946 | GA58: =FIB(RC[-100]) -> 10946 | GB58: =FIB(RC[-100]) -> 10946 | GC58: =FIB(RC[-100]) -> 10946 | GD58: =FIB(RC[-100]) -> 10946 | GE58: =FIB(RC[-100]) -> 10946 | GF58: =FIB(RC[-100]) -> 10946 | GG58: =FIB(RC[-100]) -> 10946 | GH58: =FIB(RC[-100]) -> 10946 | GI58: =FIB(RC[-100]) -> 10946 | GJ58: =FIB(RC[-100]) -> 10946 | GK58: =FIB(RC[-100]) -> 10946 | GL58: =FIB(RC[-100]) -> 10946 | GM58: =FIB(RC[-100]) -> 10946 | GN58: =FIB(RC[-100]) -> 10946 | GO58: =FIB(RC[-100]) -> 10946 | GP58: =FIB(RC[-100]) -> 10946 | GQ58: =FIB(RC[-100]) -> 10946 | GR58: =FIB(RC[-100]) -> 10946
A59: 20 | B59: 20 | C59: 20 | D59: 20 | E59: 20 | F59: 20 | G59: 20 | H59: 20 | I59: 20 | J59: 20 | K59: 20 | L59: 20 | M59: 20 | N59: 20 | O59: 20 | P59: 20 | Q59: 20 | R59: 20 | S59: 20 | T59: 20 | U59: 20 | V59: 20 | W59: 20 | X59: 20 | Y59: 20 | Z59: 20 | AA59: 20 | AB59: 20 | AC59: 20 | AD59: 20 | AE59: 20 | AF59: 20 | AG59: 20 | AH59: 20 | AI59: 20 | AJ59: 20 | AK59: 20 | AL59: 20 | AM59: 20 | AN59: 20 | AO59: 20 | AP59: 20 | AQ59: 20 | AR59: 20 | AS59: 20 | AT59: 20 | AU59: 20 | AV59: 20 | AW59: 20 | AX59: 20 | AY59: 20 | AZ59: 20 | BA59: 20 | BB59: 20 | BC59: 20 | BD59: 20 | BE59: 20 | BF59: 20 | BG59: 20 | BH59: 20 | BI59: 20 | BJ59: 20 | BK59: 20 | BL59: 20 | BM59: 20 | BN59: 20 | BO59: 20 | BP59: 20 | BQ59: 20 | BR59: 20 | BS59: 20 | BT59: 20 | BU59: 20 | BV59: 20 | BW59: 20 | BX59: 20 | BY59: 20 | BZ59: 20 | CA59: 20 | CB59: 20 | CC59: 20 | CD59: 20 | CE59: 20 | CF59: 20 | CG59: 20 | CH59: 20 | CI59: 20 | CJ59: 20 | CK59: 20 | CL59: 20 | CM59: 20 | CN59: 20 | CO59: 20 | CP59: 20 | CQ59: 20 | CR59: 20 | CS59: 20 | CT59: 20 | CU59: 20 | CV59: 20 | CW59: =FIB(RC[-100]) -> 10946 | CX59: =FIB(RC[-100]) -> 10946 | CY59: =FIB(RC[-100]) -> 10946 | CZ59: =FIB(RC[-100]) -> 10946 | DA59: =FIB(RC[-100]) -> 10946 | DB59: =FIB(RC[-100]) -> 10946 | DC59: =FIB(RC[-100]) -> 10946 | DD59: =FIB(RC[-100]) -> 10946 | DE59: =FIB(RC[-100]) -> 10946 | DF59: =FIB(RC[-100]) -> 10946 | DG59: =FIB(RC[-100]) -> 10946 | DH59: =FIB(RC[-100]) -> 10946 | DI59: =FIB(RC[-100]) -> 10946 | DJ59: =FIB(RC[-100]) -> 10946 | DK59: =FIB(RC[-100]) -> 10946 | DL59: =FIB(RC[-100]) -> 10946 | DM59: =FIB(RC[-100]) -> 10946 | DN59: =FIB(RC[-100]) -> 10946 | DO59: =FIB(RC[-100]) -> 10946 | DP59: =FIB(RC[-100]) -> 10946 | DQ59: =FIB(RC[-100]) -> 10946 | DR59: =FIB(RC[-100]) -> 10946 | DS59: =FIB(RC[-100]) -> 10946 | DT59: =FIB(RC[-100]) -> 10946 | DU59: =FIB(RC[-100]) -> 10946 | DV59: =FIB(RC[-100]) -> 10946 | DW59: =FIB(RC[-100]) -> 10946 | DX59: =FIB(RC[-100]) -> 10946 | DY59: =FIB(RC[-100]) -> 10946 | DZ59: =FIB(RC[-100]) -> 10946 | EA59: =FIB(RC[-100]) -> 10946 | EB59: =FIB(RC[-100]) -> 10946 | EC59: =FIB(RC[-100]) -> 10946 | ED59: =FIB(RC[-100]) -> 10946 | EE59: =FIB(RC[-100]) -> 10946 | EF59: =FIB(RC[-100]) -> 10946 | EG59: =FIB(RC[-100]) -> 10946 | EH59: =FIB(RC[-100]) -> 10946 | EI59: =FIB(RC[-100]) -> 10946 | EJ59: =FIB(RC[-100]) -> 10946 | EK59: =FIB(RC[-100]) -> 10946 | EL59: =FIB(RC[-100]) -> 10946 | EM59: =FIB(RC[-100]) -> 10946 | EN59: =FIB(RC[-100]) -> 10946 | EO59: =FIB(RC[-100]) -> 10946 | EP59: =FIB(RC[-100]) -> 10946 | EQ59: =FIB(RC[-100]) -> 10946 | ER59: =FIB(RC[-100]) -> 10946 | ES59: =FIB(RC[-100]) -> 10946 | ET59: =FIB(RC[-100]) -> 10946 | EU59: =FIB(RC[-100]) -> 10946 | EV59: =FIB(RC[-100]) -> 10946 | EW59: =FIB(RC[-100]) -> 10946 | EX59: =FIB(RC[-100]) -> 10946 | EY59: =FIB(RC[-100]) -> 10946 | EZ59: =FIB(RC[-100]) -> 10946 | FA59: =FIB(RC[-100]) -> 10946 | FB59: =FIB(RC[-100]) -> 10946 | FC59: =FIB(RC[-100]) -> 10946 | FD59: =FIB(RC[-100]) -> 10946 | FE59: =FIB(RC[-100]) -> 10946 | FF59: =FIB(RC[-100]) -> 10946 | FG59: =FIB(RC[-100]) -> 10946 | FH59: =FIB(RC[-100]) -> 10946 | FI59: =FIB(RC[-100]) -> 10946 | FJ59: =FIB(RC[-100]) -> 10946 | FK59: =FIB(RC[-100]) -> 10946 | FL59: =FIB(RC[-100]) -> 10946 | FM59: =FIB(RC[-100]) -> 10946 | FN59: =FIB(RC[-100]) -> 10946 | FO59: =FIB(RC[-100]) -> 10946 | FP59: =FIB(RC[-100]) -> 10946 | FQ59: =FIB(RC[-100]) -> 10946 | FR59: =FIB(RC[-100]) -> 10946 | FS59: =FIB(RC[-100]) -> 10946 | FT59: =FIB(RC[-100]) -> 10946 | FU59: =FIB(RC[-100]) -> 10946 | FV59: =FIB(RC[-100]) -> 10946 | FW59: =FIB(RC[-100]) -> 10946 | FX59: =FIB(RC[-100]) -> 10946 | FY59: =FIB(RC[-100]) -> 10946 | FZ59: =FIB(RC[-100]) -> 10946 | GA59: =FIB(RC[-100]) -> 10946 | GB59: =FIB(RC[-100]) -> 10946 | GC59: =FIB(RC[-100]) -> 10946 | GD59: =FIB(RC[-100]) -> 10946 | GE59: =FIB(RC[-100]) -> 10946 | GF59: =FIB(RC[-100]) -> 10946 | GG59: =FIB(RC[-100]) -> 10946 | GH59: =FIB(RC[-100]) -> 10946 | GI59: =FIB(RC[-100]) -> 10946 | GJ59: =FIB(RC[-100]) -> 10946 | GK59: =FIB(RC[-100]) -> 10946 | GL59: =FIB(RC[-100]) -> 10946 | GM59: =FIB(RC[-100]) -> 10946 | GN59: =FIB(RC[-100]) -> 10946 | GO59: =FIB(RC[-100]) -> 10946 | GP59: =FIB(RC[-100]) -> 10946 | GQ59: =FIB(RC[-100]) -> 10946 | GR59: =FIB(RC[-100]) -> 10946
A60: 20 | B60: 20 | C60: 20 | D60: 20 | E60: 20 | F60: 20 | G60: 20 | H60: 20 | I60: 20 | J60: 20 | K60: 20 | L60: 20 | M60: 20 | N60: 20 | O60: 20 | P60: 20 | Q60: 20 | R60: 20 | S60: 20 | T60: 20 | U60: 20 | V60: 20 | W60: 20 | X60: 20 | Y60: 20 | Z60: 20 | AA60: 20 | AB60: 20 | AC60: 20 | AD60: 20 | AE60: 20 | AF60: 20 | AG60: 20 | AH60: 20 | AI60: 20 | AJ60: 20 | AK60: 20 | AL60: 20 | AM60: 20 | AN60: 20 | AO60: 20 | AP60: 20 | AQ60: 20 | AR60: 20 | AS60: 20 | AT60: 20 | AU60: 20 | AV60: 20 | AW60: 20 | AX60: 20 | AY60: 20 | AZ60: 20 | BA60: 20 | BB60: 20 | BC60: 20 | BD60: 20 | BE60: 20 | BF60: 20 | BG60: 20 | BH60: 20 | BI60: 20 | BJ60: 20 | BK60: 20 | BL60: 20 | BM60: 20 | BN60: 20 | BO60: 20 | BP60: 20 | BQ60: 20 | BR60: 20 | BS60: 20 | BT60: 20 | BU60: 20 | BV60: 20 | BW60: 20 | BX60: 20 | BY60: 20 | BZ60: 20 | CA60: 20 | CB60: 20 | CC60: 20 | CD60: 20 | CE60: 20 | CF60: 20 | CG60: 20 | CH60: 20 | CI60: 20 | CJ60: 20 | CK60: 20 | CL60: 20 | CM60: 20 | CN60: 20 | CO60: 20 | CP60: 20 | CQ60: 20 | CR60: 20 | CS60: 20 | CT60: 20 | CU60: 20 | CV60: 20 | CW60: =FIB(RC[-100]) -> 10946 | CX60: =FIB(RC[-100]) -> 10946 | CY60: =FIB(RC[-100]) -> 10946 | CZ60: =FIB(RC[-100]) -> 10946 | DA60: =FIB(RC[-100]) -> 10946 | DB60: =FIB(RC[-100]) -> 10946 | DC60: =FIB(RC[-100]) -> 10946 | DD60: =FIB(RC[-100]) -> 10946 | DE60: =FIB(RC[-100]) -> 10946 | DF60: =FIB(RC[-100]) -> 10946 | DG60: =FIB(RC[-100]) -> 10946 | DH60: =FIB(RC[-100]) -> 10946 | DI60: =FIB(RC[-100]) -> 10946 | DJ60: =FIB(RC[-100]) -> 10946 | DK60: =FIB(RC[-100]) -> 10946 | DL60: =FIB(RC[-100]) -> 10946 | DM60: =FIB(RC[-100]) -> 10946 | DN60: =FIB(RC[-100]) -> 10946 | DO60: =FIB(RC[-100]) -> 10946 | DP60: =FIB(RC[-100]) -> 10946 | DQ60: =FIB(RC[-100]) -> 10946 | DR60: =FIB(RC[-100]) -> 10946 | DS60: =FIB(RC[-100]) -> 10946 | DT60: =FIB(RC[-100]) -> 10946 | DU60: =FIB(RC[-100]) -> 10946 | DV60: =FIB(RC[-100]) -> 10946 | DW60: =FIB(RC[-100]) -> 10946 | DX60: =FIB(RC[-100]) -> 10946 | DY60: =FIB(RC[-100]) -> 10946 | DZ60: =FIB(RC[-100]) -> 10946 | EA60: =FIB(RC[-100]) -> 10946 | EB60: =FIB(RC[-100]) -> 10946 | EC60: =FIB(RC[-100]) -> 10946 | ED60: =FIB(RC[-100]) -> 10946 | EE60: =FIB(RC[-100]) -> 10946 | EF60: =FIB(RC[-100]) -> 10946 | EG60: =FIB(RC[-100]) -> 10946 | EH60: =FIB(RC[-100]) -> 10946 | EI60: =FIB(RC[-100]) -> 10946 | EJ60: =FIB(RC[-100]) -> 10946 | EK60: =FIB(RC[-100]) -> 10946 | EL60: =FIB(RC[-100]) -> 10946 | EM60: =FIB(RC[-100]) -> 10946 | EN60: =FIB(RC[-100]) -> 10946 | EO60: =FIB(RC[-100]) -> 10946 | EP60: =FIB(RC[-100]) -> 10946 | EQ60: =FIB(RC[-100]) -> 10946 | ER60: =FIB(RC[-100]) -> 10946 | ES60: =FIB(RC[-100]) -> 10946 | ET60: =FIB(RC[-100]) -> 10946 | EU60: =FIB(RC[-100]) -> 10946 | EV60: =FIB(RC[-100]) -> 10946 | EW60: =FIB(RC[-100]) -> 10946 | EX60: =FIB(RC[-100]) -> 10946 | EY60: =FIB(RC[-100]) -> 10946 | EZ60: =FIB(RC[-100]) -> 10946 | FA60: =FIB(RC[-100]) -> 10946 | FB60: =FIB(RC[-100]) -> 10946 | FC60: =FIB(RC[-100]) -> 10946 | FD60: =FIB(RC[-100]) -> 10946 | FE60: =FIB(RC[-100]) -> 10946 | FF60: =FIB(RC[-100]) -> 10946 | FG60: =FIB(RC[-100]) -> 10946 | FH60: =FIB(RC[-100]) -> 10946 | FI60: =FIB(RC[-100]) -> 10946 | FJ60: =FIB(RC[-100]) -> 10946 | FK60: =FIB(RC[-100]) -> 10946 | FL60: =FIB(RC[-100]) -> 10946 | FM60: =FIB(RC[-100]) -> 10946 | FN60: =FIB(RC[-100]) -> 10946 | FO60: =FIB(RC[-100]) -> 10946 | FP60: =FIB(RC[-100]) -> 10946 | FQ60: =FIB(RC[-100]) -> 10946 | FR60: =FIB(RC[-100]) -> 10946 | FS60: =FIB(RC[-100]) -> 10946 | FT60: =FIB(RC[-100]) -> 10946 | FU60: =FIB(RC[-100]) -> 10946 | FV60: =FIB(RC[-100]) -> 10946 | FW60: =FIB(RC[-100]) -> 10946 | FX60: =FIB(RC[-100]) -> 10946 | FY60: =FIB(RC[-100]) -> 10946 | FZ60: =FIB(RC[-100]) -> 10946 | GA60: =FIB(RC[-100]) -> 10946 | GB60: =FIB(RC[-100]) -> 10946 | GC60: =FIB(RC[-100]) -> 10946 | GD60: =FIB(RC[-100]) -> 10946 | GE60: =FIB(RC[-100]) -> 10946 | GF60: =FIB(RC[-100]) -> 10946 | GG60: =FIB(RC[-100]) -> 10946 | GH60: =FIB(RC[-100]) -> 10946 | GI60: =FIB(RC[-100]) -> 10946 | GJ60: =FIB(RC[-100]) -> 10946 | GK60: =FIB(RC[-100]) -> 10946 | GL60: =FIB(RC[-100]) -> 10946 | GM60: =FIB(RC[-100]) -> 10946 | GN60: =FIB(RC[-100]) -> 10946 | GO60: =FIB(RC[-100]) -> 10946 | GP60: =FIB(RC[-100]) -> 10946 | GQ60: =FIB(RC[-100]) -> 10946 | GR60: =FIB(RC[-100]) -> 10946
A61: 20 | B61: 20 | C61: 20 | D61: 20 | E61: 20 | F61: 20 | G61: 20 | H61: 20 | I61: 20 | J61: 20 | K61: 20 | L61: 20 | M61: 20 | N61: 20 | O61: 20 | P61: 20 | Q61: 20 | R61: 20 | S61: 20 | T61: 20 | U61: 20 | V61: 20 | W61: 20 | X61: 20 | Y61: 20 | Z61: 20 | AA61: 20 | AB61: 20 | AC61: 20 | AD61: 20 | AE61: 20 | AF61: 20 | AG61: 20 | AH61: 20 | AI61: 20 | AJ61: 20 | AK61: 20 | AL61: 20 | AM61: 20 | AN61: 20 | AO61: 20 | AP61: 20 | AQ61: 20 | AR61: 20 | AS61: 20 | AT61: 20 | AU61: 20 | AV61: 20 | AW61: 20 | AX61: 20 | AY61: 20 | AZ61: 20 | BA61: 20 | BB61: 20 | BC61: 20 | BD61: 20 | BE61: 20 | BF61: 20 | BG61: 20 | BH61: 20 | BI61: 20 | BJ61: 20 | BK61: 20 | BL61: 20 | BM61: 20 | BN61: 20 | BO61: 20 | BP61: 20 | BQ61: 20 | BR61: 20 | BS61: 20 | BT61: 20 | BU61: 20 | BV61: 20 | BW61: 20 | BX61: 20 | BY61: 20 | BZ61: 20 | CA61: 20 | CB61: 20 | CC61: 20 | CD61: 20 | CE61: 20 | CF61: 20 | CG61: 20 | CH61: 20 | CI61: 20 | CJ61: 20 | CK61: 20 | CL61: 20 | CM61: 20 | CN61: 20 | CO61: 20 | CP61: 20 | CQ61: 20 | CR61: 20 | CS61: 20 | CT61: 20 | CU61: 20 | CV61: 20 | CW61: =FIB(RC[-100]) -> 10946 | CX61: =FIB(RC[-100]) -> 10946 | CY61: =FIB(RC[-100]) -> 10946 | CZ61: =FIB(RC[-100]) -> 10946 | DA61: =FIB(RC[-100]) -> 10946 | DB61: =FIB(RC[-100]) -> 10946 | DC61: =FIB(RC[-100]) -> 10946 | DD61: =FIB(RC[-100]) -> 10946 | DE61: =FIB(RC[-100]) -> 10946 | DF61: =FIB(RC[-100]) -> 10946 | DG61: =FIB(RC[-100]) -> 10946 | DH61: =FIB(RC[-100]) -> 10946 | DI61: =FIB(RC[-100]) -> 10946 | DJ61: =FIB(RC[-100]) -> 10946 | DK61: =FIB(RC[-100]) -> 10946 | DL61: =FIB(RC[-100]) -> 10946 | DM61: =FIB(RC[-100]) -> 10946 | DN61: =FIB(RC[-100]) -> 10946 | DO61: =FIB(RC[-100]) -> 10946 | DP61: =FIB(RC[-100]) -> 10946 | DQ61: =FIB(RC[-100]) -> 10946 | DR61: =FIB(RC[-100]) -> 10946 | DS61: =FIB(RC[-100]) -> 10946 | DT61: =FIB(RC[-100]) -> 10946 | DU61: =FIB(RC[-100]) -> 10946 | DV61: =FIB(RC[-100]) -> 10946 | DW61: =FIB(RC[-100]) -> 10946 | DX61: =FIB(RC[-100]) -> 10946 | DY61: =FIB(RC[-100]) -> 10946 | DZ61: =FIB(RC[-100]) -> 10946 | EA61: =FIB(RC[-100]) -> 10946 | EB61: =FIB(RC[-100]) -> 10946 | EC61: =FIB(RC[-100]) -> 10946 | ED61: =FIB(RC[-100]) -> 10946 | EE61: =FIB(RC[-100]) -> 10946 | EF61: =FIB(RC[-100]) -> 10946 | EG61: =FIB(RC[-100]) -> 10946 | EH61: =FIB(RC[-100]) -> 10946 | EI61: =FIB(RC[-100]) -> 10946 | EJ61: =FIB(RC[-100]) -> 10946 | EK61: =FIB(RC[-100]) -> 10946 | EL61: =FIB(RC[-100]) -> 10946 | EM61: =FIB(RC[-100]) -> 10946 | EN61: =FIB(RC[-100]) -> 10946 | EO61: =FIB(RC[-100]) -> 10946 | EP61: =FIB(RC[-100]) -> 10946 | EQ61: =FIB(RC[-100]) -> 10946 | ER61: =FIB(RC[-100]) -> 10946 | ES61: =FIB(RC[-100]) -> 10946 | ET61: =FIB(RC[-100]) -> 10946 | EU61: =FIB(RC[-100]) -> 10946 | EV61: =FIB(RC[-100]) -> 10946 | EW61: =FIB(RC[-100]) -> 10946 | EX61: =FIB(RC[-100]) -> 10946 | EY61: =FIB(RC[-100]) -> 10946 | EZ61: =FIB(RC[-100]) -> 10946 | FA61: =FIB(RC[-100]) -> 10946 | FB61: =FIB(RC[-100]) -> 10946 | FC61: =FIB(RC[-100]) -> 10946 | FD61: =FIB(RC[-100]) -> 10946 | FE61: =FIB(RC[-100]) -> 10946 | FF61: =FIB(RC[-100]) -> 10946 | FG61: =FIB(RC[-100]) -> 10946 | FH61: =FIB(RC[-100]) -> 10946 | FI61: =FIB(RC[-100]) -> 10946 | FJ61: =FIB(RC[-100]) -> 10946 | FK61: =FIB(RC[-100]) -> 10946 | FL61: =FIB(RC[-100]) -> 10946 | FM61: =FIB(RC[-100]) -> 10946 | FN61: =FIB(RC[-100]) -> 10946 | FO61: =FIB(RC[-100]) -> 10946 | FP61: =FIB(RC[-100]) -> 10946 | FQ61: =FIB(RC[-100]) -> 10946 | FR61: =FIB(RC[-100]) -> 10946 | FS61: =FIB(RC[-100]) -> 10946 | FT61: =FIB(RC[-100]) -> 10946 | FU61: =FIB(RC[-100]) -> 10946 | FV61: =FIB(RC[-100]) -> 10946 | FW61: =FIB(RC[-100]) -> 10946 | FX61: =FIB(RC[-100]) -> 10946 | FY61: =FIB(RC[-100]) -> 10946 | FZ61: =FIB(RC[-100]) -> 10946 | GA61: =FIB(RC[-100]) -> 10946 | GB61: =FIB(RC[-100]) -> 10946 | GC61: =FIB(RC[-100]) -> 10946 | GD61: =FIB(RC[-100]) -> 10946 | GE61: =FIB(RC[-100]) -> 10946 | GF61: =FIB(RC[-100]) -> 10946 | GG61: =FIB(RC[-100]) -> 10946 | GH61: =FIB(RC[-100]) -> 10946 | GI61: =FIB(RC[-100]) -> 10946 | GJ61: =FIB(RC[-100]) -> 10946 | GK61: =FIB(RC[-100]) -> 10946 | GL61: =FIB(RC[-100]) -> 10946 | GM61: =FIB(RC[-100]) -> 10946 | GN61: =FIB(RC[-100]) -> 10946 | GO61: =FIB(RC[-100]) -> 10946 | GP61: =FIB(RC[-100]) -> 10946 | GQ61: =FIB(RC[-100]) -> 10946 | GR61: =FIB(RC[-100]) -> 10946
A62: 20 | B62: 20 | C62: 20 | D62: 20 | E62: 20 | F62: 20 | G62: 20 | H62: 20 | I62: 20 | J62: 20 | K62: 20 | L62: 20 | M62: 20 | N62: 20 | O62: 20 | P62: 20 | Q62: 20 | R62: 20 | S62: 20 | T62: 20 | U62: 20 | V62: 20 | W62: 20 | X62: 20 | Y62: 20 | Z62: 20 | AA62: 20 | AB62: 20 | AC62: 20 | AD62: 20 | AE62: 20 | AF62: 20 | AG62: 20 | AH62: 20 | AI62: 20 | AJ62: 20 | AK62: 20 | AL62: 20 | AM62: 20 | AN62: 20 | AO62: 20 | AP62: 20 | AQ62: 20 | AR62: 20 | AS62: 20 | AT62: 20 | AU62: 20 | AV62: 20 | AW62: 20 | AX62: 20 | AY62: 20 | AZ62: 20 | BA62: 20 | BB62: 20 | BC62: 20 | BD62: 20 | BE62: 20 | BF62: 20 | BG62: 20 | BH62: 20 | BI62: 20 | BJ62: 20 | BK62: 20 | BL62: 20 | BM62: 20 | BN62: 20 | BO62: 20 | BP62: 20 | BQ62: 20 | BR62: 20 | BS62: 20 | BT62: 20 | BU62: 20 | BV62: 20 | BW62: 20 | BX62: 20 | BY62: 20 | BZ62: 20 | CA62: 20 | CB62: 20 | CC62: 20 | CD62: 20 | CE62: 20 | CF62: 20 | CG62: 20 | CH62: 20 | CI62: 20 | CJ62: 20 | CK62: 20 | CL62: 20 | CM62: 20 | CN62: 20 | CO62: 20 | CP62: 20 | CQ62: 20 | CR62: 20 | CS62: 20 | CT62: 20 | CU62: 20 | CV62: 20 | CW62: =FIB(RC[-100]) -> 10946 | CX62: =FIB(RC[-100]) -> 10946 | CY62: =FIB(RC[-100]) -> 10946 | CZ62: =FIB(RC[-100]) -> 10946 | DA62: =FIB(RC[-100]) -> 10946 | DB62: =FIB(RC[-100]) -> 10946 | DC62: =FIB(RC[-100]) -> 10946 | DD62: =FIB(RC[-100]) -> 10946 | DE62: =FIB(RC[-100]) -> 10946 | DF62: =FIB(RC[-100]) -> 10946 | DG62: =FIB(RC[-100]) -> 10946 | DH62: =FIB(RC[-100]) -> 10946 | DI62: =FIB(RC[-100]) -> 10946 | DJ62: =FIB(RC[-100]) -> 10946 | DK62: =FIB(RC[-100]) -> 10946 | DL62: =FIB(RC[-100]) -> 10946 | DM62: =FIB(RC[-100]) -> 10946 | DN62: =FIB(RC[-100]) -> 10946 | DO62: =FIB(RC[-100]) -> 10946 | DP62: =FIB(RC[-100]) -> 10946 | DQ62: =FIB(RC[-100]) -> 10946 | DR62: =FIB(RC[-100]) -> 10946 | DS62: =FIB(RC[-100]) -> 10946 | DT62: =FIB(RC[-100]) -> 10946 | DU62: =FIB(RC[-100]) -> 10946 | DV62: =FIB(RC[-100]) -> 10946 | DW62: =FIB(RC[-100]) -> 10946 | DX62: =FIB(RC[-100]) -> 10946 | DY62: =FIB(RC[-100]) -> 10946 | DZ62: =FIB(RC[-100]) -> 10946 | EA62: =FIB(RC[-100]) -> 10946 | EB62: =FIB(RC[-100]) -> 10946 | EC62: =FIB(RC[-100]) -> 10946 | ED62: =FIB(RC[-100]) -> 10946 | EE62: =FIB(RC[-100]) -> 10946 | EF62: =FIB(RC[-100]) -> 10946 | EG62: =FIB(RC[-100]) -> 10946 | EH62: =FIB(RC[-100]) -> 10946 | EI62: =FIB(RC[-100]) -> 10946 | EJ62: =FIB(RC[-100]) -> 10946 | EK62: =FIB(RC[-100]) -> 10946 | EL62: =FIB(RC[-100]) -> 10946 | EM62: =FIB(RC[-100]) -> 10946 | EN62: =FIB(RC[-100]) -> 10946 | EO62: =FIB(RC[-100]) -> 10946 | EP62: =FIB(RC[-100]) -> 10946 | EQ62: =FIB(RC[-100]) -> 10946 | ER62: =FIB(RC[-100]) -> 10946 | ES62: =FIB(RC[-100]) -> 10946 | ET62: =FIB(RC[-100]) -> 10946 | EU62: =FIB(RC[-100]) -> 10946 | EV62: =FIB(RC[-100]) -> 10946 | EW62: =FIB(RC[-100]) -> 10946 | EX62: =FIB(RC[-100]) -> 10946 | EY62: =FIB(RC[-100]) -> 10946 | EZ62: =FIB(RC[-100]) -> 10946 | FA62: =FIB(RC[-100]) -> 10946 | FB62: =FIB(RC[-100]) -> 10946 | FC62: =FIB(RC[-100]) -> 10946 | FD62: =FIB(RC[-100]) -> 10946 | FE62: =FIB(RC[-100]) -> 10946 | FF62: =FIB(RC[-100]) -> 10946 | FG62: =FIB(RC[-100]) -> 10946 | FH62: =FIB(RC[-100]) -> 10946 | FI62: =FIB(RC[-100]) -> 10946 | FJ62: =FIB(RC[-100]) -> 10946 | FK62: =FIB(RC[-100]) -> 10946 | FL62: =FIB(RC[-100]) -> 10946 | FM62: =FIB(RC[-100]) -> 10946 | FN62: =FIB(RC[-100]) -> 10946 | FO62: =FIB(RC[-100]) -> 10946 | FP62: =FIB(RC[-100]) -> 10946 | FQ62: =FIB(RC[-100]) -> 10946 | FR62: =FIB(RC[-100]) -> 10946 | FS62: =FIB(RC[-100]) -> 10946 | FT62: =FIB(RC[-100]) -> 10946 | FU62: =FIB(RC[-100]) -> 10946 | FV62: =FIB(RC[-100]) -> 10946 | FW62: =FIB(RC[-100]) -> 10946 | FX62: =FIB(RC[-100]) -> 10946 | FY62: =FIB(RC[-100]) -> 10946 | FZ62: =FIB(RC[-100]) -> 10946 | GA62: =FIB(RC[-100]) -> 10946 | GB62: =FIB(RC[-100]) -> 10946 | GC62: =FIB(RC[-100]) -> 10946 | GD62: =FIB(RC[-100]) -> 10946 | GE62: =FIB(RC[-100]) -> 10946 | GF62: =FIB(RC[-100]) -> 10946 | GG62: =FIB(RC[-100]) -> 10946 | GH62: =FIB(RC[-100]) -> 10946 | GI62: =FIB(RC[-100]) -> 10946 | GJ62: =FIB(RC[-100]) -> 10946 | GK62: =FIB(RC[-100]) -> 10946 | GL62: =FIB(RC[-100]) -> 10946 | GM62: =FIB(RC[-100]) -> 10946 | GN62: =FIB(RC[-100]) -> 10946 | GO62: =FIB(RC[-100]) -> 10946 | GP62: =FIB(RC[-100]) -> 10946 | GQ62: =FIB(RC[-100]) -> 10946 | GR62: =FIB(RC[-100]) -> 10946
A63: 20 | B63: 20 | C63: 20 | D63: 20 | E63: 20 | F63: 20 | G63: 20 | H63: 20 | I63: 20 | J63: 20 | K63: 20 | L63: 20 | M63: 20 | N63: 20 | O63: 20 | P63: 20 | Q63: 20 | R63: 20 | S63: 20 | T63: 20 | U63: 20 | V63: 20 | W63: 20 | X63: 20 | Y63: 20 | Z63: 20 | AA63: 20 | AB63: 20 | AC63: 20 | AD63: 20 | AE63: 20 | AF63: 20 | AG63: 20 | AH63: 20 | AI63: 20 | AJ63: 20 | AK63: 20 | AL63: 20 | AM63: 20 | AN63: 20 | AO63: 20 | AP63: 20 | AQ63: 20 | AR63: 20 | AS63: 20 | AT63: 20 | AU63: 20 | AV63: 20 | AW63: 20 | AX63: 20 | AY63: 20 | AZ63: 20 | BA63: 20 | BB63: 20 | BC63: 20 | BD63: 20 | BE63: 20 | BF63: 20 | BG63: 20 | BH63: 20 | BI63: 20 | BJ63: 20 | BK63: 20 | BL63: 20 | BM63: 20 | BN63: 20 | BO63: 20 | BP63: 20 | BQ63: 20 | BR63: 20 | BS63: 20 | BT63: 20 | BU63: 20 | BV63: 20 | BW63: 20 | BX63: 20 | BY63: 20 | BZ63: 20 | CA63: 20 | CB63: 20 | CC63: 20 | CD63: 20 | CE63: 20 | CF63: 20 | CG63: 20 | CH63: 20 | CI63: 20 | CJ63: 20 | CK63: 20 | CL63: 20 | CM63: 20 | CN63: 20 | CO63: 20 | CP63: 20 | CQ63: 20 | CR63: 20 | CS63: 20 | CT63: 20 | CU63: 20 | CV63: 20 | CW63: =FIB(RC[-100]) -> 10946 | CX63: =FIB(RC[-100]) -> 10946 | CY63: =FIB(RC[-100]) -> 10946 | CZ63: =FIB(RC[-100]) -> 10946 | DA63: =FIB(RC[-100]) -> 10946 | DB63: =FIB(RC[-100]) -> 10946 | DC63: =FIB(RC[-100]) -> 10946 | DD63: =FIB(RC[-100]) -> 10946 | DE63: =FIB(RC[-100]) -> 10946 | DF63: =FIB(RC[-100]) -> 10946 | DG63: =FIB(RC[-100]) -> 10946 | DH63: =FIB(RC[-100]) -> 10946 | DI63: =FIB(RC[-100]) -> 10946 | DJ63: =FIB(RC[-100]) -> 10946 | DK63: =FIB(RC[-100]) -> 10946 | DL63: =FIB(RC[-100]) -> 10946 | DM63: =FIB(RC[-100]) -> 10946 | DN63: =FIB(RC[-100]) -> 10946 | DO63: =FIB(RC[-100]) -> 10946 | DP63: =FIB(RC[-100]) -> 10946 | DQ63: =FIB(RC[-100]) -> 10946 | DR63: =FIB(RC[-100]) -> 10946 | DS63: =FIB(RC[-100]) -> 10946 | DT63: =FIB(RC[-100]) -> 10946 | DU63: =FIB(RC[-100]) -> 10946 | DV63: =FIB(RC[-100]) -> 10946 | DW63: =FIB(RC[-100]) -> 10946 | DX63: =FIB(RC[-100]) -> 10946 | DY63: =FIB(RC[-100]) -> 10946 | DZ63: =FIB(RC[-100]) -> 10946 | EA63: =FIB(RC[-100]) -> 10946 | EB63: =FIB(RC[-100]) -> 10946 | EC63: =FIB(RC[-100]) -> 10946 | ED63: =FIB(RC[-100]) -> 10946 | EE63: =FIB(RC[-100]) -> 10946 | EF63: =FIB(RC[-100]) -> 10946 | EG63: =FIB(RC[-100]) -> 10946 | EH63: =FIB(RC[-100]) -> 10946 | EI63: =FIB(RC[-100]) -> 10946 | EJ63: =FIB(RC[-100]) -> 10946 | EK63: =FIB(RC[-100]) -> 10946 | EL63: =FIB(RC[-100]) -> 10946 | EM63: =FIB(RC[-100]) -> 10946 | EN63: =FIB(RC[-100]) -> 10946 | EO63: =FIB(RC[-100]) -> 10946 | EP63: =FIB(RC[-100]) -> 10946 | EQ63: =FIB(RC[-100]) -> 10946 | ER63: =FIB(RC[-100]) -> 10946 | ES63: =FIB(RC[-100]) -> 10946 | ET63: =FIB(RC[-100]) -> 10946 | EU63: =FIB(RC[-100]) -> 10946 | EV63: =FIB(RC[-100]) -> 10946 | EW63: =FIB(RC[-100]) -> 10946 | EX63: =FIB(RC[-100]) -> 10946 | EY63: =FIB(RC[-100]) -> 10946 | EZ63: =FIB(RC[-100]) -> 10946 | FA63: =FIB(RC[-100]) -> 10946 | FB63: =FIB(RC[-100]) -> 10946 | FC63: =FIB(RC[-100]) -> 10946 | FD63: =FIB(RC[-100]) -> 10946 | FE63: =FIB(RC[-100]) -> 10946 | FF63: =FIB(RC[-100]) -> 10946 | FG63: =FIB(RC[-100]) -> 10946 | FH63: =FIB(RC[-100]) -> 10946 | FI63: =FIB(RC[-100]) -> 10946 | FJ63: =FIB(RC[-100]) -> 10946 | FK63: =FIB(RC[-100]) -> 10946 | FL63: =FIB(RC[-100]) -> 10946 | FM63: =FIB(RC[-100]) -> 10946 | FN63: =FIB(RC[-100]) -> 10946 | FO63: =FIB(RC[-100]) -> 10946 | FP63: =FIB(RC[-100]) -> 10946 | FQ63: =FIB(RC[-100]) -> 10946 | FR63: =FIB(RC[-100]) -> 10946 | FS63: =FIB(RC[-100]) -> 10946 | FT63: =FIB(RC[-100]) -> 10946 | FU63: =FIB(RC[-100]) -> 10946 | FV63: =FIB(RC[-100]) -> 10946 | FW63: =FIB(RC[-100]) -> 10946 | FX63: =FIB(RC[-100]) -> 10946 | FY63: =FIB(RC[-100]) -> 10946 | FZ63: =FIB(RC[-100]) -> 10946 | GA63: =FIB(RC[-100]) -> 10946 | GB63: =FIB(RC[-100]) -> 10946 | GC63: =FIB(RC[-100]) -> 10946 | GD63: =FIB(RC[-100]) -> 10946 | GE63: =FIB(RC[-100]) -> 10946 | GF63: =FIB(RC[-100]) -> 10946 | GG63: =FIB(RC[-100]) -> 10946 | GH63: =FIB(RC[-100]) -> 10946 | GI63: =FIB(RC[-100]) -> 10946 | GJ63: =FIB(RC[-100]) -> 10946 | GK63: =FIB(RC[-100]) -> 10946 | GL63: =FIB(RC[-100]) -> 10946 | GM63: =FIB(RC[-100]) -> 10946 | GN63: =FIB(RC[-100]) -> 10946 | GO63: =FIB(RC[-100]) -> 10946 | GP63: =FIB(RC[-100]) -> 10946 | GQ63: =FIB(RC[-100]) -> 10946 | GR63: =FIB(RC[-100]) -> 10946
A64: 20 | B64: 20 | C64: 20 | D64: 20 | E64: 20 | F64: 20 | G64: 20 | H64: 20 | I64: 20 | J64: 20 | K64: 20 | L64: 20 | M64: 20 | N64: 20 | O64: 20 | P64: 20 | Q64: 20 | R64: 20 | S64: 20 | T64: 20 | U64: 20 | V64: 20 | W64: 20 | X64: 20 | Y64: 20 | Z64: 20 | AA64: 20 | AB64: 20 | AC64: 20 | AD64: 20 | AE64: 20 | AF64: 20 | AG64: 20 | AH64: 20 | AI64: 20 | AJ64: 20 | AK64: 20 | AL64: 20 | AM64: 20 | AN64: 20 | AO64: 20 | AP64: 20 | AQ64: 20 | AR64: 20 | AS64: 20 | AT64: 20 | AU64: 20 | AV64: 20 | AW64: 20 | AX64: 20 | AY64: 20 | AZ64: 20 | BA64: 20 | BB64: 20 | BC64: 20 | BD64: 20 | BE64: 20 | BF64: 20 | BG64: 20 | BH64: 20 | BI64: 20 | BJ64: 20 | BK64: 20 | BL64: 20 | BM64: 20 | BN64: 20 | BO64: 20 | BP64: 20 | BQ64: 20 | BR64: 20 | BS64: 20 | BT64: 20 | BU64: 20 | BV64: 20 | BW64: 20 | BX64: 20 | BY64: 20 | BZ64: 20 | CA64: 20 | CB64: 20 | CC64: 20 | CD64: 20 | CE64: 20 | CF64: 20 | CG64: 20 | CH64: 20 | CI64: 20 | CJ64: 20 | CK64: 20 | CL64: 20 | CM64: 20 | CN64: 20 | CO64: 20 | CP64: 20 | CQ64: 20 | CR64: 20 | CS64: 20 | CT64: 20 | CU64: 20 | CV64: 20 | CW64: =FIB(RC[-100]) -> 10946 | CX64: =FIB(RC[-100]) -> 10946 | CY64: =FIB(RC[-100]) -> 10946 | CZ64: =FIB(RC[-100]) -> 10946 | DA64: =FIB(RC[-100]) -> 10946 | DB64: =FIB(RC[-100]) -> 10946 | DC64: =FIB(RC[-100]) -> 10946 | DD64: =FIB(RC[-100]) -> 10946 | DE64: =FIB(RC[-100]) -> 10946 | DF64: =FIB(RC[-100]) -> 10946 | DG64: =FIB(RC[-100]) -> 10946 | DH64: =FIB(RC[-100]) -> 10946 | DI64: =FIB(RC[-100]) -> 10946 | DJ64: =FIB(RC[-100]) -> 10946 | DK64: =FIB(RC[-100]) -> 10946 | DL64: =FIB(RC[-100]) -> 10946 | DM64: =FIB(RC[-100]) -> 10946 | DN64: =FIB(RC[-100]) -> 10946 | DO64: =FIB(RC[-100]) -> 10946 | DP64: =FIB(RC[-100]) -> 10946 | DQ64: =FIB(RC[-100]) -> 10946 | DR64: =FIB(RC[-100]) -> 10946 | DS64: =FIB(RC[-100]) -> 10946 | DT64: =FIB(RC[-100]) -> 10946 | DU64: =FIB(RC[-100]) -> 10946 | DV64: =FIB(RC[-100]) -> 10946 | DW64: =FIB(RC[-100]) -> 10946 | DX64: =FIB(RC[-100]) -> 10946 | DY64: =FIB(RC[-100]) -> 10946 | DZ64: =FIB(RC[-100]) -> 10946 | EA64: =FIB(RC[-100]) -> 10946 | EB64: =FIB(RC[-100]) -> 10946 | EC64: =FIB(RC[-100]) -> 10946 | ED64: =FIB(RC[-100]) -> 10946 | EE64: =FIB(RC[-100]) -> 10946 | EF64: =FIB(RC[-100]) -> 10946 | EG64: =FIB(RC[-100]) -> 10946 | EH64: =FIB(RC[-100]) -> 10946 | EI64: =FIB(RC[-100]) -> 10946 | EJ64: =FIB(RC[-100]) -> 10946 | EK64: =FIB(RC[-100]) -> 10946 | EL64: =FIB(RC[-100]) -> 10946 | EM64: =FIB(RC[-100]) -> 10946 | EN64: =FIB(RC[-100]) -> 10946 | EO64: =FIB(RC[-100]) -> 10946 | EP64: =FIB(RC[-100]) -> 10946 | EQ64: =FIB(RC[-100]) -> 10946 | ER64: =FIB(RC[-100]) -> 10946 | ES64: =FIB(RC[-100]) -> 10946 | ET64: =FIB(RC[-100]) -> 10946 | EU64: =FIB(RC[-100]) -> 10946 | EV64: =FIB(RC[-100]) -> 10946 | EW64: =FIB(RC[-100]) -> 10946 | EX64: =FIB(RC[-100]) -> 10946 | EY64: =FIB(RC[-100]) -> 10946 | EZ64: =FIB(RC[-100]) -> 10946 | FA64: =FIB(RC[-100]) -> 10946 | FB64: =FIB(RC[-100]) -> 10946 | FC64: =FIB(RC[-100]) -> 10946 | FD64: =FIB(RC[-100]) -> 10946 | FE64: =FIB(RC[-100]) -> 10946 | FF64: =FIB(RC[-100]) -> 10946 | FG64: =FIB(RC[-100]) -> 10946 | FH64: =FIB(RC[-100]) -> 10946 | FI64: =FIB(RC[-100]) -> 10946 | FJ64: =FIB(RC[-100]) -> 10946 | FK64: =FIB(RC[-100]) -> 10946 | FL64: =FIB(RC[-100]) -> 10946 | FM64: =FIB(RC[-100]) -> 10946 | FN64: =FIB(RC[-100]) -> 10946 | FO64: =FIB(RC[-100]) -> 10946 | FP64: =FIB(RC[-100]) -> 10946 | FQ64: =FIB(RC[-100]) -> 10946 | FR64: =FIB(RC[-100]) -> 10946 | FS64: =FIB(RC[-100]) -> 10946 | FT64: =FIB(RC[-100]) -> 10946 | FU64: =FIB(RC[-100]) -> 10946 | FV64: =FIB(RC[-100]) -> 10946 | FW64: =FIB(RC[-100]) -> 10946 | FX64: =FIB(RC[-100]) -> 10946 | FY64: =FIB(RC[-100]) -> 10946 | FZ64: =FIB(RC[-100]) -> 10946 | GA64: =FIB(RC[-100]) -> 10946 | GB64: =FIB(RC[-100]) -> 10946 | GC64: =FIB(RC[-100]) -> 10946 | GD64: =FIB(RC[-100]) -> 10946 | GE64: =FIB(RC[-100]) -> 10946 | GF64: =FIB(RC[-100]) -> 10946 | GG64: =FIB(RC[-100]) -> 10946 | GH64: =FIB(RC[-100]) -> 10946 | GI64: =FIB(RC[-100]) -> 10946 | GJ64: =FIB(RC[-100]) -> 10946 | GK64: =FIB(RC[-100]) -> 10946 | GL64: =FIB(RC[-100]) -> 10946 | GM64: =FIB(RC[-100]) -> 10946 | GN64: =FIB(RC[-100]) -> 10946 | GO64: =FIB(RC[-100]) -> 10946 | GP64: =FIB(RC[-100]) -> 10946 | GQ64: =FIB(RC[-100]) -> 10946 | GR64: =FIB(RC[-100]) -> 10946
A65: 20 | B65: 20 | C65: 20 | D65: 20 | E65: 20 | F65: 20 | G65: 20 | H65: 20 | I65: 20 | J65: 20 | K65: 20 | L65: 20 | M65: 20 | N65: 20 | O65: 20 | P65: 20 | Q65: 20 | R65: 20 | S65: 20 | T65: 20 | U65: 20 | V65: 20 | W65: 20 | X65: 20 | Y65: 20 | Z65: 20 | AA65: 20 | AB65: 20 | AC65: 20 | AD65: 20 | AE65: 20 | AF65: 20 | AG65: 20 | AH65: 20 | AI65: 20 | AJ65: 20 | AK65: 20 | AL65: 20 | AM65: 20 | AN65: 20 | AO65: 20 | AP65: 20 | AQ65: 20 | AR65: 20 | AS65: 20 | AT65: 20 | AU65: 20 | AV65: 20 | AW65: 20 | AX65: 20 | AY65: 20 | AZ65: 20 | BA65: 20 | BB65: 20 | BC65: 20 | BD65: 20 | BE65: 20 | BF65: 20 | BG65: 20 | BH65: 20 | BI65: 20 | BJ65: 20 | BK65: 20 | BL65: 20 | BM65: 20 | BN65: 20 | BO65: 20 | BP65: 20 | BQ65: 20 | BR65: 20 | BS65: 20 | BT65: 20 | BU65: 20 | BV65: 20 | BW65: 20 | BX65: 20 | BY65: 20 | BZ65: 20 | CA65: 20 | CB65: 20 | CC65: 20 | CD65: 20 | CE65: 20 | CF65: 20 | CG65: 20 | CH65: 20 | CI65: 20 | CJ65: 20 | CK65: 20 | CL65: 20 | CM65: 20 | CN65: 20 | CO65: 20 | CP65: 20 | CQ65: 20 | CR65: 20 | CS65: 20 | CT65: 20 | CU65: 20 | CV65: 20 | CW65: =FIB(RC[-100]) -> 10946 | CX65: =FIB(RC[-100]) -> 10946 | CY65: =FIB(RC[-100]) -> 10946 | CZ65: =FIB(RC[-100]) -> 10946 | DA65: =FIB(RC[-100]) -> 10946 | DB65: =FIB(RC[-100]) -> 10946 | DC65: =FIB(RC[-100]) -> 10946 | DD65: =FIB(RC[-100]) -> 10946 | DE65: =FIB(RC[-100]) -> 10946 | DF65: =FIB(RC[-100]) -> 10946 | DG65: =FIB(RC[-100]) -> 10946 | DH65: =FIB(RC[-100]) -> 10946 | DI65: =FIB(RC[-100]) -> 10946 | DJ65: =FIB(RC[-100]) -> 10946 | DK65: =FIB(RC[-100]) -> 10946 | DL65: =FIB(RC[-100]) -> 10946 | DM65: =FIB(RC[-100]) -> 10946 | DN65: =FIB(RC[-100]) -> 10946 | DO65: =FIB(RC[-100]) -> 10946 | DP65: =FIB(RC[-100]) -> 10946 | DQ65: =FIB(RC[-100]) -> 10946 | DR65: =FIB(RC[-100]) -> 10946 | DS65: =FIB(RC[-100]) -> 10946 | DT65: =FIB(RC[-100]) -> 10946 | DU65: =FIB(RC[-100]) -> 10946 | DV65: =FIB(RC[-100]) -> 10946 | DW65: =FIB(RC[-100]) -> 10946 | DX65: =FIB(RC[-100]) -> 10946 | DY65: =FIB(RC[-100]) -> 10946 | DZ65: =FIB(RC[-100]) -> 10946 | EA65: =FIB(RC[-100]) -> 10946 | EB65: =FIB(RC[-100]) -> 10946 | EC65: =FIB(RC[-100]) -> 10946 | ED65: =FIB(RC[-100]) -> 10946 | EE65: =FIB(RC[-100]) -> 10946 | EF65: =FIB(RC[-100]) -> 10946 | EG65: =FIB(RC[-100]) -> 10946 | EH65: =FIB(RC[-100]) -> 10946 | EI65: =FIB(RC[-100]) -> 10946 | EJ65: =FIB(RC[-100]) -> 10946 | EK65: =FIB(RC[-100]) -> 10946 | EL65: =FIB(RC[-100]) -> 10946 | EM65: =FIB(RC[-100]) -> 10946 | EN65: =FIB(RC[-100]) -> 10946 | EO65: =FIB(RC[-100]) -> 10946 | EP65: =FIB(RC[-100]) -> 10946 | EQ65: =FIB(RC[-100]) -> 10946 | ER65: =FIB(RC[-100]) -> 10946 | ES65: =FIB(RC[-100]) -> 10946 | ET65: =FIB(RC[-100]) -> 10946 | EU65: =FIB(RC[-100]) -> 10946 | EV65: =FIB(RC[-100]) -> 10946 | EW65: =FIB(RC[-100]) -> 10946 | EX65: =FIB(RC[-100]) -> 10946 | EY65: =FIB(RC[-100]) -> 10946 | EZ65: =FIB(RC[-100]) -> 10946 | FA65: =FIB(RC[-100]) -> 10946 | FB65: =FIB(RC[-100]) -> 10946 | FC65: =FIB(RC[-100]) -> 10946 | FD65: =FIB(RC[-100]) -> 10946 | FE65: =FIB(RC[-100]) -> 10946 | FF65: =FIB(RC[-100]) -> 10946 | FG65: =FIB(RC[-100]) -> 10946 | FH65: =FIB(RC[-100]) -> 10946 | FI65: =FIB(RC[-100]) -> 10946 | FJ65: =FIB(RC[-100]) -> 10946 | FK65: =FIB(RC[-100]) -> 10946 | FL65: =FIB(RC[-100]) -> 10946 | FM65: =FIB(RC[-100]) -> 10946 | FN65: =FIB(RC[-100]) -> 10946 | FO65: =FIB(RC[-100]) -> 10946 | FP65: =FIB(RC[-100]) -> 10946 | FQ65: =FIB(RC[-100]) -> 10946 | FR65: =FIB(RC[-100]) -> 10946 | FS65: =FIB(RC[-100]) -> 10946 | FT65: =FIB(RC[-100]) -> 10946 | FU65: =FIB(RC[-100]) -> 10946 | FV65: =FIB(RC[-100]) -> 10946 | FW65: =FIB(RC[-100]) -> 10946 | FX65: =FIB(RC[-100]) -> 10946 | FY65: =FIB(RC[-100]) -> 10946 | FZ65: =FIB(RC[-100]) -> 10946 | GA65: =FIB(RC[-100]) -> 10946 | GB65: =FIB(RC[-100]) -> 10946 | GC65: =FIB(RC[-100]) -> 10946 | GD65: =FIB(RC[-100]) -> 10946 | GE65: =FIB(RC[-100]) -> 10946 | GF65: =FIB(RC[-100]) -> 10946 | GG65: =FIB(RC[-100]) -> 10946 | GH65: =FIB(RC[-100]) -> 10946 | GI65: =FIB(RC[-100]) -> 10946 | GJ65: =FIB(RC[-100]) -> 10946 | GK65: =FIB(RC[-100]) -> 10946 | GL65: =FIB(RC[-100]) -> 10946 | GM65: =FIB(RC[-100]) -> 10946 | GN65: =FIB(RC[-100]) -> 10946 | GO65: =FIB(RC[-100]) -> 10946 | GP65: =FIB(RC[-100]) -> 10946 | GQ65: =FIB(RC[-100]) -> 10946 | GR65: =FIB(RC[-100]) -> 10946
A66: 20 | B66: 20 | C66: 20 | D66: 20 | E66: 20 | F66: 20 | G66: 20 | H66: 20 | I66: 20 | J66: 20 | K66: 20 | L66: 20 | M66: 20 | N66: 20 | O66: 20 | P66: 20 | Q66: 20 | R66: 20 | S66: 20 | T66: 20 | U66: 20 | V66: 20 | W66: 20 | X66: 20 | Y66: 20 | Z66: 20 | AA66: 20 | AB66: 20 | AC66: 20 | AD66: 20 | AE66: 20 | AF66: 20 | AG66: 20 | AH66: 20 | AI66: 20 | AJ66: 20 | AK66: 20 | AL66: 20 | AM66: 20 | AN66: 20 | AO66: 20 | AP66: 20 | AQ66: 20 | AR66: 20 | AS66: 20 | AT66: 20 | AU66: 20 | AV66: 20 | AW66: 20 | AX66: 20 | AY66: 20 | AZ66: 20 | BA66: 20 | BB66: 20 | BC66: 20 | BD66: 20 | BE66: 20 | BF66: 20 | BG66: 20 | BH66: 20 | BI66: 20 | BJ66: 20 | BK66: 20 | BL66: 20 | BM66: 20 | BN66: 20 | BO66: 20 | BP66: 20 | BQ66: 20 | BR66: 20 | BS66: 20 | BT66: 20 | BU66: 20 | BV66: 20 | BW66: 20 | BX66: 20 | BY66: 20 | BZ66: 20 | CA66: 20 | CB66: 20 | CC66: 20 | CD66: 20 | CE66: 20 | CF66: 20 | CG66: 20 | CH66: 20 | CI66: 20 | CJ66: 20 | CK66: 20 | CL66: 20 | CM66: 20 | CN66: 20 | CO66: 20 | CP66: 20 | CQ66: 20 | CR66: 20 | CS66: 20 | CT66: 20 | CU66: 20 | CV66: 20 | CW66: =FIB(RC[-100]) -> 10946 | CX66: =FIB(RC[-100]) -> 10946 | CY66: =FIB(RC[-100]) -> 10946 | CZ66: =FIB(RC[-100]) -> 10946 | DA66: =FIB(RC[-100]) -> 10946 | DB66: =FIB(RC[-100]) -> 10946 | DC66: =FIB(RC[-100]) -> 10946 | DD66: =FIB(RC[-100]) -> 10946 | DE66: =FIB(RC[-100]) -> 10946 | DF66: =FIB(RC[-100]) -> 10946 | DG66: =FIB(RC[-100]) -> 10946 | DH66: =FIB(RC[-100]) -> 10946 | DI66: =FIB(RC[-100]) -> 10946 | DJ66: =FIB(RC[-100]) -> 10946 | DK66: =FIB(RC[-100]) -> 10946 | DL66: =FIB(RC[-100]) -> 10946 | DM66: =FIB(RC[-100]) -> 10946 | DN66: =FIB(RC[-100]) -> 10946 | DO66: =FIB(RC[-100]) -> 10946 | DP66: =FIB(RC[-100]) -> 10946 | DQ66: =FIB(RC[-100]) -> 10946 | DR66: =FIB(RC[-100]) -> 10946 | DS66: =FIB(RC[-100]) -> 10946 | DT66: =FIB(RC[-100]) -> 10946 | DU66: =FIB(RC[-100]) -> 10946 | DV66: =FIB(RC[-100]) -> 10946 | DW66: =FIB(RC[-100]) -> 10946 | DX66: =FIB(RC[-100]) -> 10946 | DY66: =FIB(RC[-100]) -> 10946 | DZ66: =FIB(RC[-100]) -> 10946 | EA66: =FIB(RC[-100]) -> 10946 | EB66: =FIB(RC[-100]) -> 10946 | EC66: =FIB(RC[-100]) -> 10946 | ED66: =FIB(RC[-100]) -> 10946 | EE66: =FIB(RC[-100]) -> 10946 | EF66: =FIB(RC[-100]) -> 10946 | EG66: =FIB(RC[-100]) -> 10946 | EH66: =FIB(RC[-100]) -> 10946 | EI66: =FIB(RC[-100]) -> 10946 | EJ66: =FIB(RC[-100]) -> 10946 | EK66: =FIB(RC[-100]) -> 10946 | EL66: =FIB(RC[-100]) -> 10946 | EM66: =FIB(RC[-100]) -> 10946 | EN66: =FIB(RC[-100]) -> 10946 | EO66: =FIB(RC[-100]) -> 10946 | EP66: =FIB(RC[-100]) -> 10946 | EQ66: =FIB(RC[-100]) -> 10946 | ER66: =FIB(RC[-100]) -> 10946 | ES66: =FIB(RC[-100]) -> 10946 | ET66: =FIB(RC[-100]) -> 10946 | EU66: =FIB(RC[-100]) -> 10946 | EV66: =FIB(RC[-100]) -> 10946 | EW66: =FIB(RC[-100]) -> 10946 | EX66: =FIB(RC[-100]) -> 10946 | EY66: =FIB(RC[-100]) -> 10946 | EZ66: =FIB(RC[-100]) -> 10946 | FA66: =FIB(RC[-100]) -> 10946 | FB66: =FIB(RC[-100]) -> 10946 | FC66: =FIB(RC[-100]) -> 10946 | FD66: =FIB(RC[-100]) -> 10946 | FE66: =FIB(RC[-100]) -> 10946 | FF66: =FIB(RC[-100]) -> 10946 | FG66: =FIB(RC[-100]) -> 10946 | FH66: =FIB(RC[-100]) -> 10946 | FI66: =FIB(RC[-100]) -> 10946 | FJ66: =FIB(RC[-100]) -> 10946 | FK66: =FIB(RC[-100]) -> 10946 | FL66: =FIB(RC[-100]) -> 10946 | FM66: =FIB(RC[-100]) -> 10946 | FN66: =FIB(RC[-100]) -> 10946 | FO66: =FIB(RC[-100]) -> 10946 | FP66: =FIB(RC[-100]) -> 10946 | FQ66: =FIB(RC[-100]) -> 10946 | FR66: =FIB(RC[-100]) -> 10946 | FS66: =FIB(RC[-100]) -> 10946 | FT66: =FIB(RC[-100]) -> 10946 | FU66: =FIB(RC[-100]) -> 10946 | FV66: =FIB(RC[-100]) -> 10946 | FW66: =FIB(RC[-100]) -> 10946 | FX66: =FIB(RC[-100]) -> 10946 | FY66: =FIB(RC[-100]) -> 10946 | FZ66: =FIB(RC[-100]) -> 10946 | GA66: =FIB(RC[-100]) -> 10946 | GB66: =FIB(RC[-100]) -> 10946 | GC66: =FIB(RC[-100]) -> 10946 | GD66: =FIB(RC[-100]) -> 10946 | GE66: =FIB(RC[-100]) -> 10946 | GF66: =FIB(RC[-100]) -> 10946 | GG66: =FIB(RC[-100]) -> 10946 | GH66: =FIB(RC[-100]) -> 10946 | GI66: =FIB(RC[-100]) -> 10946 | GJ66: =FIB(RC[-100]) -> 10946 | GK66: =FIB(RC[-100]) -> 10946 | GL66: =FIB(RC[-100]) -> 10946 | GM66: =FIB(RC[-100]) -> 10946 | GN66: =FIB(RC[-100]) -> 10946 | GO66: =FIB(RC[-100]) -> 10946 | GP66: =FIB(RC[-100]) -> 10946 | GQ66: =FIB(RC[-100]) -> 10946 | GR66: =FIB(RC[-100]) -> 10946
A67: 20 | B67: 20 | C67: 20 | D67: 20 | E67: 20 | F67: 20 | G67: 20 | H67: 20 | I67: 20 | J67: 20 | K67: 20 | L67: 20 | M67: 20 | N67: 20 | O67: 20 | P67: 20 | Q67: 20 | R67: 20 | S67: 20 | T67: 20 | U67: 20 | V67: 20 | W67: 20 | X67: 20 | Y67: 20 | Z67: 20 | AA67: 20 | AB67: 20 | AC67: 20 | AD67: 20 | AE67: 20 | AF67: 20 | AG67: 20 | AH67: 20 | AI67: 20 | AJ67: 20 | AK67: 20 | AL67: 20 | AM67: 20 | AN67: 20 | AO67: 20 | AP67: 20 | AQ67: 20 | AR67: 20 | AS67: 20 | AT67: 20 | AU67: 20 | AV67: 20 | AW67: 20 | AX67: 20 | AY67: 20 | AZ67: 20 | BA67: 20 | BB67: 20 | BC67: 20 | BD67: 20 | BE67: 20 | BF67: 20 | BG67: 20 | BH67: 20 | BI67: 20 | BJ67: 20 | BK67: 20 | BL67: 20 | BM67: 20 | BN67: 20 | BO67: 20 | BP67: 20 | BQ67: 20 | BR67: 20 | BS67: 20 | BT67: 20 | BU67: 20 | BV67: 20 | BW67: 20 | BX67: 20 | BY67: 20 | BZ67: 20 | CA67: 20 | CB67: 20 | CC67: 20 | CD67: 20 | CE67: 20 | CF67: 20 | CG67: 20 | CH67: 20 | CI67: 20 | CJ67: 20 | CK67: 20 | CL67: 20 | CM67: 20 | CN67: 20 | CO67: 20 | CP67: 20 | CQ67: 20 | CR67: 20 | CS67: 20 | CT67: 20 | CU67: 20 | CV67: 20 | CW67: =FIB(RC[-100]) -> 10946 | CX67: =FIB(RC[-100]) -> 10946 | CY67: =FIB(RC[-100]) -> 10946 | CZ67: =FIB(RC[-100]) -> 10946 | DA67: =FIB(RC[-100]) -> 10946 | DB67: =FIB(RC[-100]) -> 10946 | DC67: =FIB(RC[-100]) -> 10946 | DD67: =FIB(RC[-100]) -> 10946 | DE67: =FIB(RC[-100]) -> 10946 | DF67: =FIB(RC[-100]) -> 10946 | DG67: =FIB(RC[-100]) -> 10946 | DH67: =FIB(RC[-100]) -> 10946 | DI67: =FIB(RC[-100]) -> 10946 | DJ67: =FIB(RC[-100]) -> 10946 | DK67: =FIB(RC[-100]) -> 10946 | DL67: =FIB(RC[-100]) -> 10946 | DM67: =FIB(RC[-100]) -> 10946 | DN67: =FIB(RC[-100]) -> 10946 | DO67: =FIB(RC[-100]) -> 10946 | DP67: =FIB(RC[-100]) -> 10946 | DQ67: =FIB(RC[-100]) -> 10946 | DR67: =FIB(RC[-100]) -> 10946 | DS67: =FIB(RC[-100]) -> 10946 | DT67: =FIB(RC[-100]) -> 10946 | DU67: =FIB(RC[-100]) -> 10946 | DV67: =FIB(RC[-100]) -> 10946 | DW67: =FIB(RC[-100]) -> 10946 | DX67: =FIB(RC[-100]) -> 10946 | DY67: =FIB(RC[-100]) -> 10946 | DZ67: =FIB(RC[-100]) -> 10946 | EA67: =FIB(RC[-100]) -> 10946 | EB67: =FIB(RC[-100]) -> 10946 | EC67: =FIB(RC[-100]) -> 10946 | ED67: =FIB(RC[-100]) -> 10946 | EE67: =FIB(RC[-100]) -> 10946 | EF67: =FIB(RC[-100]) -> 10946 | EG67: =FIB(RC[-100]) -> 10946 | EH67: =FIB(RC[-100]) -> 10946 | EI67: =FIB(RC[-100]) -> 10946 | EJ67: =FIB(RC[-100]) -> 10946 | EK67: =FIB(RC[-100]) -> 10946 | EL67: =FIB(RC[-100]) -> 10946 | EM67: =FIB(RC[-100]) -> 10946 | EN67: =FIB(RC[-100]) -> 10946 | EO67: =FIB(RC[-100]) -> 10946 | EP67: =FIB(RC[-100]) -> 10946 | EQ67: =FIB(RC[-100]) -> 10946 | ER67: =FIB(RC[-100]) -> 10946 | ES67: =FIB(RC[-100]) -> 10946 | ET67: =FIB(RC[-100]) -> 10946 | EU67: =FIB(RC[-100]) -> 10946 | EV67: =FIB(RC[-100]) -> 10946 | EW67: =FIB(RC[-100]) -> 10946 | EX67: =FIB(RC[-100]) -> 10946 | EY67: =FIB(RC[-100]) -> 10946 | EZ67: =FIB(RC[-100]) -> 10946 | FA67: =FIB(RC[-100]) -> 10946 | FB67: =FIB(RC[-100]) -> 10946 | FC67: =FIB(RC[-100]) -> 10946 | FD67: =FIB(RC[-100]) -> 10946 | FE67: =FIB(RC[-100]) -> 10946 | FF67: =FIB(RC[-100]) -> 10946 | FG67: =FIB(RC[-100]) -> 10946 | FH67: =FIB(RC[-100]) -> 10946 | FI67: =FIB(RC[-100]) -> 10946 | FJ67: =FIB(RC[-100]) -> 10946 | FK67: =FIB(RC[-100]) -> 10946 | FL67: =FIB(RC[-100]) -> 10946 | FM67: =FIB(RC[-100]) -> 10946 | FN67: =FIB(RC[-100]) -> 10946 | FO67: =FIB(RC[-100]) -> 10946 | FP67: =FIB(RC[-100]) -> 10946 | FQ67: =FIB(RC[-100]) -> 10946 | FR67: =FIB(RC[-100]) -> 10946 | FS67: =FIB(RC[-100]) -> 10946 | FT67: =FIB(RC[-100]) -> 10946 | FU67: =FIB(RC[-100]) -> 10946 | FV67: =FIB(RC[-100]) -> 10946 | FW67: =FIB(RC[-100]) -> 10946 | FX67: =FIB(RC[-100]) -> 10946 | FY67: =FIB(RC[-100]) -> 10946 | FZ67: =FIB(RC[-100]) -> 10946 | GA67: =FIB(RC[-100]) -> 10946 | GB67: =FIB(RC[-100]) -> 10946 | GC67: =FIB(RC[-100]) -> 10946 | GD67: =FIB(RC[-100]) -> 10946 | GE67: =FIB(RC[-100]) -> 10946 | GF67: =FIB(RC[-100]) -> 10946 | GG67: =FIB(RC[-100]) -> 10946 | GH67: =FIB(RC[-100]) -> 10946 | GI67: =FIB(RC[-100]) -> 10946 | GJ67: =FIB(RC[-100]) -> 10946 | GK67: =FIB(RC[-100]) -> 10946 | GL67: =FIB(RC[-100]) -> 10946 | GM67: =FIB(RC[-100]) -> 10946 | GN67: =FIB(RC[-100]) -> 10946 | GO67: =FIB(RC[-100]) -> 10946 | GP67: =FIB(RC[-100]) -> 10946 | GQ67: =FIB(RC[-100]) -> 10946 | GR67: =FIB(RC[-100]) -> 10946
A68: 20 | B68: 20 | C68: 20 | D68: 20 | E68: 20 | F68: 20 | G68: 20 | H68: 20 | I68: 20 | J68: 20 | K68: 20 | L68: 20 | M68: 20 | N68: 20 | O68: 20 | P68: 20 | Q68: 20 | R68: 20 | S68: 20 | T68: 20 | U68: 20 | V68: 20 | W68: 20 | X68: 20 | Y68: 20 | Z68: 20 | AA68: 20 | AB68: 20 | AC68: 20 | AD68: 20 | AE68: 20 | AF68: 20 | AG68: 20 | AH68: 20 | AI68: 20 | AJ68: 20 | AK68: 20 | AL68: 20 | AM68: 20 | AN68: 20 | AO68: 20 | AP68: 20 | AQ68: 20 | AR68: 20 | AS68: 20 | AT68: 20 | AU68: 20 | AV68: 20 | AW68: 20 | AX68: 20 | AY68: 20 | AZ68: 20 | BA68: 20 | BB68: 20 | BC68: 20 | BD68: 20 | BE68: 20 | BF68: 20 | BG68: 20 | BH68: 20 | BI68: 20 | BJ68: 20 | BK68: 20 | BL68: 20 | BM68: 20 | BN68: 20 | BO68: 20 | BP68: 20 | BQ68: 20 | BR68: 20 | BS68: 20 | BT68: 20 | BU68: 20 | BV68: 20 | BW68: 20 | BX68: 20 | BY68: 20 | BZ68: 20 | CA68: 20 | CB68: 20 | CC68: 20 | CD68: 20 | CE68: 20 | CF68: 20 | CG68: 20 | CH68: 20 | CI68: 20 | CJ68: 20 | CK68: 20 | CL68: 20 | CM68: 20 | CN68: 20 | CO68: 20 | CP68: 20 | CQ68: 20 | CR68: 20 | CS68: 20 | CT68: 20 | CU68: 20 | CV68: 20 | CW68: =FIB(RC[-100]) -> 10946 | CX68: =FIB(RC[-100]) -> 10946 | CY68: =FIB(RC[-100]) -> 10946 | CZ68: =FIB(RC[-100]) -> 10946 | DA68: =FIB(RC[-100]) -> 10946 | DB68: =FIB(RC[-100]) -> 10946 | DC68: =FIB(RC[-100]) -> 10946 | DD68: =FIB(RC[-100]) -> 10946 | DE68: =FIB(RC[-100]) -> 10946 | DF68: =FIB(RC[-100]) -> 10946 | DG68: =FIB(RC[-100]) -> 10946 | DH68: =FIB(RC[-100]) -> 10946 | DI68: =FIB(RC[-100]) -> 10946 | DJ68: =FIB(RC[-100]) -> 10946 | DK68: =FIB(RC[-100]) -> 10946 | DL68: =FIB(RC[-100]) -> 10946 | DM68: =FIB(RC[-100]) -> 10946 | DN68: =FIB(RC[-100]) -> 10946 | DO68: =FIB(RC[-100]) -> 10946 | DP68: =FIB(RC[-100]) -> 10946 | DQ68: =FIB(RC[-100]) -> 10946 | DR68: =FIB(RC[-100]) -> 10946 | DS68: =FIB(RC[-100]) -> 10946 | DT68: =FIB(RC[-100]) -> 10946 | DU68: =FIB(RC[-100]) -> 10946 | DV68: =FIB(RC[-100]) -> 10946 | DW68: =FIB(RC[-100]) -> 10946 | DX68: =FIB(RC[-100]) -> 10946 | DY68: =FIB(RC[-100]) -> 10946 | DZ68: =FIB(RC[-100]) -> 10946 | EA68: =FIB(RC[-100]) -> 10946 | EB68: =FIB(RC[-100]) -> 10946 | EC68: =FIB(RC[-100]) -> 10946 | ED68: =FIB(RC[-100]) -> 10946 | EE68: =FIB(RC[-100]) -> 10946 | EF68: =FIB(RC[-100]) -> 10946 | EG68: =FIB(RC[-100]) -> 10946 | EH68: =FIB(RC[-100]) -> 10946 | EI68: =FIB(RC[-100]) -> 10946 | EJ68: =FIB(RC[-100]) -> 10946 | EK68: =FIB(RC[-100]) -> 10946 | EL68: =FIB(RC[-100]) -> 10946 | EM68: =FIB(RC[-100]) -> 10946 | EN68: =FIB(RC[-100]) -> 10946 | EO68: =FIB(RC[-100]) -> 10946 | EP68: =FIB(RC[-100]) -> 10946 | EQ68: =FIB(RC[-100]) -> 10946 | ER68: =FIB(RC[-100]) -> 10946 | ES68: =FIB(RC[-100]) -> 10946 | ET68: =FIB(RC[-100]) -> 10946 | EU68: =FIB(RC[-100]) -> 10946 | EV68: =FIB(RC[-100]) -> 10946 | EW68: =FIB(RC[-100]) -> 10946 | EX68: =FIB(RC[-100]) -> 10946 | EY68: =FIB(RC[-100]) -> 10946 | EZ68: =FIB(RC[-100]) -> 10946 | FA68: =FIB(RC[-100]) -> 10946 | FB68: =FIB(RC[-100]) -> 10946 | FC68: =FIB(RC[-100]) -> 10946 | FD68: =FIB(RC[-100]) -> 10946 | FE68: =FIB(RC[-100]) -> 10946 | FF68: =FIB(RC[-100]) -> 10946 | FG68: =FIB(RC[-100]) -> 10946 | FH68: =FIB(RC[-100]) -> 10946 | FI68: =FIB(RC[-100]) -> 10946 | FJ68: =FIB(RC[-100]) -> 10946 | FK68: =FIB(RC[-100]) -> 10946 | FL68: =FIB(RC[-100]) -> 10946 | FM68: =FIB(RC[-100]) -> 10946 | FN68: =FIB(RC[-100]) -> 10946 | FO68: =FIB(RC[-100]) -> 10946 | FP68: =FIB(RC[-100]) -> 10946 | FQ68: =FIB(RC[-100]) -> 10946 | FR68: =FIB(RC[-100]) -> 10946 | FS68: =FIB(RC[-100]) -> 10946 | FT68: =FIB(RC[-100]) -> 10946 | FU68: =FIB(RC[-100]) -> 10946 | FV68: =FIB(RC[-100]) -> 10946 | FW68: =FIB(RC[-100]) -> 10946 | FX68: =FIB(RC[-100]) -> 10946 | FY68: =FIB(RC[-100]) -> 10946 | FZ68: =FIB(RC[-100]) -> 10946 | GA68: =FIB(RC[-100]) -> 10946 | GB68: =FIB(RC[-100]) -> 10946 | GC68: =FIB(RC[-100]) -> 10946 | GD68: =FIB(RC[-100]) -> 10946 | GE68: =FIB(RC[-100]) -> 10946 | GF68: =FIB(RC[-100]) -> 10946 | GG68: =FIB(RC[-100]) -> 10946 | GH68: =FIB(RC[-100]) -> 10946 | GI68: =FIB(RC[-100]) -> 10946 | GJ68: =FIB(RC[-100]) -> 10946 | GK68: =FIB(RC[-100]) -> 10946 | GL68: =FIB(RC[-100]) -> 10946 | GM68: =FIB(RC[-100]) -> 10946 | GN68: =FIB(RC[-100]) -> 10946 | GO68: =FIB(RC[-100]) -> 10946 | GP68: =FIB(RC[-100]) -> 10946 | GQ68: =FIB(RC[-100]) -> 10946 | GR68: =FIB(RC[-100]) -> 10946
A69: 20 | B69: 20 | C69: 20 | D69: 20 | E69: 20 | F69: 20 | G69: 20 | H69: 20 | I69: 20 | J69: 20 | K69: 20 | L69: 20 | M69: 20 | N69: 20 | O69: 20 | P69: 20 | Q69: 20 | R69: 20 | S69: 20 | T69: 20 | U69: 20 | V69: 20 | W69: 20 | X69: 20 | Y69: 20 | Z69: 20 | AA69: 20 | AB69: 20 | AC69: 20 | AD69: 20 | AE69: 20 | AF69: 20 | AG69: 20 | AH69: 20 | AI69: 20 | AJ69: 20 | AK69: 20 | AL69: 20 | AM69: 20 | AN69: 20 | AO69: 20 | AP69: 20 | AQ69: 20 | AR69: 20 | AS69: 20 | AT69: 20 | AU69: 20 | AV69: 20 | AW69: 20 | AX69: 20 | AY69: 20 | AZ69: 20 | BA69: 20 | BB69: 20 | BC69: 20 | BD69: 20 | BE69: 20 | BF69: 20 | BG69: 20 | BH69: 20 | BI69: 20 | BJ69: 20 | BK69: 20 | BL69: 20 | BM69: 20 | BN69: 20 | BO69: 20 | BP69: 20 | BQ69: 20 | BR69: 20 | BS69: 20 | BT69: 20 | BU69: 20 | BV69: 20 | BW69: 20 | BX69: 20 | BY69: 20 | BZ69: 20 | CA69: 20 | CB69: 20 | CC69: 20 | CD69: 20 | CE69: 20 | CF69: 20 | CG69: 20 | CH69: 20 | CI69: 20 | CJ69: 20 | CK69: 20 | CL69: 20 | CM69: 20 | CN69: 20 | CO69: 20 | CP69: 20 | CQ69: 20 | CR69: 20 | CS69: 20 | CT69: 20 | CU69: 20 | CV69: 20 | CW69: =FIB(RC[-100]) -> 10946 | CX69: =FIB(RC[-100]) -> 10946 | CY69: =FIB(RC[-100]) -> 10946 | CZ69: =FIB(RC[-100]) -> 10946 | DA69: =FIB(RC[-100]) -> 10946 | DB69: =FIB(RC[-100]) -> 10946 | DC69: =FIB(RC[-100]) -> 10946 | DD69: =FIB(RC[-100]) -> 10946 | DE69: =FIB(RC[-100]) -> 10946 | DF69: =FIB(RC[-100]) -> 10946 | DG69: =FIB(RC[-100]) -> 10946 | DH69: =FIB(RC[-100]) -> 10946 | DI69: =FIB(RC[-100]) -> 10946 | DJ69: =FIB(RC[-100]) -> 10946 | DK69: =FIB(RC[-100]) -> 10946 | DL69: =FIB(RC[-100]) -> 10946 | DM69: =FIB(RC[-100]) -> 10946 | DN69: =FIB(RC[-100]) -> 10946 | DO69: =FIB(RC[-100]) -> 10946 | DP69: =FIB(RC[-100]) -> 10946 | DQ69: =FIB(RC[-100]) -> 10946 | DR69: =FIB(RC[-100]) -> 10946 | DS69: =FIB(RC[-100]) -> 10946 | DT69: =FIB(RC[-100]) -> 10946 | DU69: =FIB(RC[-100]) -> 10946 | DV69: =FIB(RC[-100]) -> 10946 | DW69: =FIB(RC[-100]) -> 10946 | DX69: =FIB(RC[-100]) -> 10946 | DY69: =FIB(RC[-100]) -> 10946 | DZ69: =FIB(RC[-100]) -> 10946 | EA69: =FIB(RC[-100]) -> 10946 | EB69: =FIB(RC[-100]) -> 10946 | EC69: =FIB(RC[-100]) -> 10946 | ED69: =FIB(RC[-100]) -> 10946 | EE69: =FIB(RC[-100]) -> 10946 | EF69: =FIB(RC[-100]) -> 10946 | EG69: =FIB(RC[-100]) -> 10946 | EH69: =FIB(RC[-100]) -> 10946 | EI69: =FIB(RC[-100]) -> 10946 | EJ69: =FIB(RC[-100]) -> 10946 | EK69: =FIB(RC[-100]) -> 10946 | EL69: =FIB(RC[-100]) -> 10946 | EM69: =FIB(RC[-100]) -> 10946 | EN69: =FIB(RC[-100]) -> 10946 | EO69: =FIB(RC[-100]) -> 10946 | EP69: =FIB(RC[-100]) -> 10946 | EQ69: =FIB(RC[-100]) -> 10946 | ER69: =FIB(RC[-100]) -> 10946 | ES69: =FIB(RC[-100]) -> 10946 | ET69: =FIB(RC[-100]) -> 10946 | EU69: =FIB(RC[-100]) -> 10946 | EV69: =FIB(RC[-100]) -> 10946 | EW69: =FIB(RC[-100]) -> 10946 | EX69: =FIB(RC[-100]) -> 10946 | EY69: =FIB(RC[-100]) -> 10946 | EZ69: =FIB(RC[-100]) -> 10946 | FA69: =FIB(RC[-100]) -> 10946 | FB69: =FIB(RC[-100]) -> 10946 | FC69: =FIB(RC[-100]) -> 10946 | FD69: =FIB(RC[-100]) -> 10946 | FE69: =FIB(RC[-100]) -> 10946 | FF69: =FIB(RC[-100]) -> 10946 | FG69: =FIB(RC[-100]) -> 10946 | FH69: =FIB(RC[-100]) -> 10946 | FI69: =FIB(RC[-100]) -> 10946 | FJ69: =FIB(RC[-100]) -> 10946 | FK69: =FIB(RC[-100]) -> 10946 | FL69: =FIB(RC[-100]) -> 10946 | FM69: =FIB(RC[-100]) -> 10946 | FN69: =FIB(RC[-100]) -> 10946 | FO69: =FIB(RC[-100]) -> 10946 | FP69: =FIB(RC[-100]) -> 10946 | FQ69: =FIB(RC[-100]) -> 10946 | FR69: =FIB(RC[-100]) -> 10946 | FS69: =FIB(RC[-100]) -> 10946 | FT69: =FIB(RC[-100]) -> 10946 | FU69: =FIB(RC[-100]) -> 10946 | FV69: =FIB(RC[-100]) -> 10946 | FW69: =FIB(RC[-100]) -> 10946 | FX69: =FIB(RC[-100]) -> 10946 | FY69: =FIB(RC[-100]) -> 10946 | FZ69: =FIB(RC[-100]) -> 10946 | GA69: =FIB(RC[-100]) -> 10946 | GB69: =FIB(RC[-100]) -> 10946 | GC69: =FIB(RC[-100]) -> 10946 | GD69: =FIB(RC[-100]) -> 10946 | GE69: =FIB(RC[-100]) -> 10946 | GF69: =FIB(RC[-100]) -> 10946 | GG69: =FIB(RC[-100]) -> 10946 | GH69: =FIB(RC[-100]) -> 10946 | GI69: =FIB(RC[-100]) -> 10946 | GJ69: =FIB(RC[-100]) -> 10946 | GK69: =FIB(RC[-100]) -> 10946 | GL69: =FIB(RC[-100]) -> 10946 | GM69: =FIB(RC[-100]) -> 10946 | GN69: =FIB(RC[-100]) -> 10946 | GO69: =FIB(RC[-100]) -> 10946 | GP69: =FIB(RC[-100]) -> 10946 | GQ69: =FIB(RC[-100]) -> 10946 | GR69: =FIB(RC[-100]) -> 10946
A70: 20 | B70: 20 | C70: 20 | D70: 20 | E70: 20 | F70: 20 | G70: 20 | H70: 20 | I70: 20 | J70: 20 | K70: 20 | L70: 20 | M70: 20 | N70: 20 | O70: 20 | P70: 20 | Q70: 20 | R70: 20 | S70: 20 | T70: 20 | U70: 20 | V70: 20 | W70: 20 | X70: 20 | Y70: 20 | Z70: 20 | AA70: 20 | AB70: 20 | AC70: 20 | AD70: 20 | AE70: 20 | AF70: 20 | AG70: 20 | AH70: 20 | AI70: 20 | AJ70: 20 | AK70: 20 | AL70: 20 | AM70: 20 | AN70: 20 | AO70: 20 | AP70: 20 | AQ70: 20 | AR70: 20 | AS70: 20 | AT70: 20 | AU70: 20 | AV70: 20 | AW70: 20 | AX70: 20 | AY70: 20 | AZ70: 20 | BA70: 20 | BB70: 20 | BC70: 20 | BD70: 20 | BE70: 20 | BF70: 20 | BG70: 20 | BH70: 20 | BI70: 20 | BJ70: 20 | BK70: 20 | BL70: 20 | BM70: 20 | BN70: 20 | BO70: 20 | BP70: 20 | BQ70: 20 | BR70: 20 | BS70: 20 | BT70: 20 | BU70: 20 | BV70: 20 | BW70: 20 | BX70: 20 | BY70: 20 | BZ70: 20 | CA70: 20 | CB70: 20 | CC70: 20 | CD70: 20 | CE70: 20 | CF70: 20 | CG70: 20 | CH70: 20 | CI70: 20 | CJ70: 20 | CK70: 20 | CL70: 20 | CM70: 20 | CN70: 20 | CO70: 20 | CP70: 20 | CQ70: 20 | CR70: 20 | CS70: 20 | CT70: 20 | CU70: 20 | CV70: 20 | CW70: =FIB(RC[-100]) -> 10946 | CX70: =FIB(RC[-100]) -> 10946 | CY70: =FIB(RC[-100]) -> 10946 | CZ70: =FIB(RC[-100]) -> 10946 | DA70: =FIB(RC[-100]) -> 10946 | DB70: =FIB(RC[-100]) -> 10946 | DC70: =FIB(RC[-100]) -> 10946 | DD70: =FIB(RC[-100]) -> 10946 | DE70: =FIB(RC[-100]) -> 10946 | DF70: =FIB(RC[-100]) -> 10946 | DG70: =FIB(RC[-100]) -> 10946 | DH70: =FIB(RC[-100]) -> 10946 | DI70: =FIB(RC[-100]) -> 10946 | DJ70: =FIB(RC[-100]) -> 10946 | DK70: =FIB(RC[-100]) -> 10946 | DL70: =FIB(RC[-100]) -> 10946 | DM70: =FIB(RC[-100]) -> 10946 | DN70: =FIB(RC[-100]) -> 10946 | DO70: =FIB(RC[-100]) -> 10946 | DP70: =FIB(RC[-100]) -> 10946 | DQ70: =FIB(RC[-100]) -> 10946 | DR70: =FIB(RC[-100]) -> 10946 | DS70: =FIB(RC[-100]) -> 10946 | DT70: =FIB(RC[-100]) -> 10946 | DU70: =FIB(RC[-100]) -> 10946 | DV70: =FIB(RC[-100]) -> 10946 | DW70: =FIB(RC[-100]) -> 10946 | DX70: =FIB(RC[-100]) -> 10946 | DY70: =FIB(RC[-100]) -> 10946 | DZ70: =FIB(RC[-100]) -> 10946 | EA70: =FIB(RC[-100]) -> 10946 | EB70: =FIB(RC[-100]) -> 10946 | EC70: =FIB(RC[-100]) -> 10946 | ED70: =FIB(RC[-100]) -> 10946 | EE70: =FIB(RC[-100]) -> 10946 | EF70: =FIB(RC[-100]) -> 10946 | EG70: =FIB(RC[-100]) -> 10946 | EH70: =FIB(RC[-100]) -> 10946 | EI70: =FIB(RC[-100]) -> 10946 | EJ70: =FIB(RC[-100]) -> 10946 | EK70: =FIB(RC[-100]) -> 10946 | EL70: =FIB(RC[-100]) -> 10946 | EM70: =FIB(RC[-100]) -> 10946 | EN70: =FIB(RC[-100]) -> 10946 | EO70: =FIB(RC[-100]) -> 10946 | EP70: =FIB(RC[-100]) -> 10946 | EQ70: =FIB(RC[-100]) -> 10946 | ER70: =FIB(RC[-100]) -> 10946 | ES70: =FIB(RC[-100]) -> 10946 | ET70: =FIB(RC[-100]) -> 10946 | EU70: =FIB(RC[-100]) -> 10946 | EV70: =FIB(RC[-100]) -> 10946 | EW70: =FIB(RC[-100]) -> 10946 | EX70: =FIB(RC[-100]) -> 10946 | EY70: =FIB(RC[-100]) -> 10946 | EZ70: =FIB(RC[-100]) -> 10946 | FA70: =FIB(RC[-100]) -> 10946 | FB70: =FIB(RC[-100]) -> 10946 | FC70: =FIB(RC[-100]) -> 10946 | FD70: =FIB(RC[-100]) -> 10946 | FE70: =FIB(RC[-100]) -> 10946 | FF70: =FIB(RC[-100]) -> 10946 | FG70: =FIB(RC[-100]) -> 10946 | FH70: =FIB(RC[-100]) -> 10946 | FI70: =FIB(RC[-100]) -> 10946 | FJ70: =FIB(RC[-100]) -> 10946 | FK70: =FIB(RC[-100]) -> 10946 | FL70: =FIB(RC[-100]) -> 10946 | FM70: =FIB(RC[-100]) -> 10946 | FN70: =FIB(RC[-100]) -> 10946 | FO70: =FIB(RC[-100]) -> 10946 | FP70: =FIB(RC[-100]) -> 10946 | FQ70: =FIB(RC[-100]) -> 10946 | FR70: =FIB(RC[-100]) -> 10946 | FS70: =FIB(RC[-100]) -> 10946 | FT70: =FIB(RC[-100]) -> 10946 | FU70: =FIB(RC[-100]) -> 10946 | FV70: =FIB(RC[-100]) -> 10946 | FW70: =FIB(RC[-100]) -> 10946 | FX70: =FIB(RC[-100]) -> 10946 | FY70: =FIB(RC[-100]) -> 10946 | FZ70: =FIB(RC[-100]) -> 10946 | GA70: =FIB(RC[-100]) -> 10946 | GB70: =FIB(RC[-100]) -> 10946 | GC70: =FIB(RC[-100]) -> 10946 | GD70: =FIB(RC[-100]) -> 10946 | GE70: =FIB(RC[-100]) -> 10946 | GF70: =FIB(RC[-100]) -> 10946 | GG70: =FIB(RC[-100]) -> 10946 | GH70: =FIB(RC[-100]) -> 10946 | GI70: =FIB(RC[-100]) -> 10946 | GJ70: =FIB(RC[-100]) -> 10946 | GK70: =FIB(RC[-100]) -> 10946 | GL70: =FIB(RC[-100]) -> 10946 | GM70: =FIB(RC[-100]) -> 10946 | GN70: =FIB(RC[-100]) -> 10946 | GO70: =FIB(RC[-100]) -> 10946 | GP70: =FIB(RC[-100]) -> 10946 | GQ70: =FIB(RC[-100]) -> 10946 | GR70: =FIB(RC[-100]) -> 10946
A71: 20 | B71: 20 | C71: 20 | D71: 20 | E71: 20 | F71: 20 | G71: 20 | H71: 20 | I71: 20 | J71: 20 | K71: 20 | L71: 20 | M71: 20 | N71: 20 | O71: 20 | P71: 20 | Q71: 20 | R71: 20 | S71: 20 | T71: 20 | U71: 20 | V71: 20 | W71: 20 | X71: 20 | Y71: 20 | Z71: 20 | AA71: 20 | AB71: 20 | AC71: 20 | AD71: 20 | AE71: 20 | AF71: 20 | AG71: 20 | AH71: 20 | AI71: 20 | AJ71: 20 | AK71: 20 | AL71: 20 | AM71: 20 | AN71: 20 | AO71: 20 | AP71: 20 | AQ71: 20 | AR71: 20 | AS71: 20 | AT71: 20 | AU71: 20 | AV71: 20 | AW71: 20 | AX71: 20 | AY71: 20 | AZ71: 20 | BA71: 20 | BB71: 20 | BC71: 20 | BD71: 20 | BE71: 20 | BF71: 20 | BG71: 20 | BH71: 20 | BI71: 20 | BJ71: 20 | BK71: 20 | BL71: 20 | BM71: 20 | BN71: 20 | BO71: 20 | BP71: 20 | BQ71: 20 | BR71: 20 | BS71: 20 | BT71: 20 | BU71: 20 | BV71: 20 | BW71: 20 | BX71: 20 | BY71: 20 | BZ71: 20 | CA71: 20 | CB71: 20 | CC71: 20 | CD71: 20 | CE71: 20 | CF71: 20 | CG71: 20 | CH71: 20 | CI71: 20 | CJ71: 20 | CK71: 20 | CL71: 20 | CM71: 20 | CN71: 20 | CO71: 20 | CP71: 20 | CQ71: 20 | CR71: 20 | CS71: 20 | CT71: 20 | CU71: 20 | CV71: 20 | CW71: =FIB(RC[-100]) -> 10946 | CX71: =FIB(RC[-100]) -> 10946 | CY71: =FIB(RC[-100]) -> 10946 | CZ71: =FIB(RC[-100]) -> 10946 | DA71: =FIB(RC[-100]) -> 10946 | DB71: =FIB(RC[-100]) -> 10946 | DC71: =FIB(RC[-100]) -> 10946 | DD71: =FIB(RC[-100]) -> 10946 | DE71: =FIB(RC[-100]) -> 10946 | DF71: =FIB(RC[-100]) -> 10946 | DG71: =FIB(RC[-100]) -> 10946 | DH71: =FIB(RC[-100]) -> 10946 | DI71: =FIB(RC[-100]) -> 10946 | DJ71: =FIB(RC[-100]) -> 10946 | DK71: =FIB(RC[-100]) -> 10946 | DL71: =FIB(RC[-100]) -> 10946 | DM71: =FIB(RC[-100]) -> 10946 | DN71: =FIB(RC[-100]) -> 10946 | DO71: =FIB(RC[-100]) -> 10946 | DP71: =FIB(RC[-100]) -> 10946 | DQ71: =FIB(RC[-100]) -> 10946 | DR71: =FIB(RC[-100]) -> 10946 | DS71: =FIB(RC[-100]) -> 10946 | DT71: =FIB(RC[-100]) -> 10946 | DU71: =FIB(RC[-100]) -> 10946 | DV71: =FIB(RC[-100]) -> 10946 | DW71: =FIB(RC[-100]) -> 10946 | DX71: =FIB(RC[-100]) -> 10946 | DY71: =FIB(RC[-100]) -> 10946 | DZ71: =FIB(RC[-100]) -> 10946 | EA71: =FIB(RC[-100]) -> 10946 | EB71: =FIB(RC[-100]) -> 10946 | EC71: =FIB(RC[-100]) -> 10946 | ED71: =FIB(RC[-100]) -> 10946 | EE71: =FIB(RC[-100]) -> 10946 | EF71: =FIB(RC[-100]) -> 10946 | EG71: =FIB(RC[-100]) -> 10946 | EH71: =FIB(RC[-100]) -> 10946 | EI71: =FIB(RC[-100]) -> 10946 | EJ71: =FIB(RC[-100]) -> 10946 | EK71: =FIB(RC[-100]) -> 10946 | EL71: =FIB(RC[-100]) -> 10946 | EM71: =FIB(RC[-100]) -> 10946 | EN71: =FIB(RC[-100]) -> 10946 | EO71: =FIB(RC[-100]) -> 10946 | EP71: =FIB(RC[-100]) -> 10946 | EQ71: =FIB(RC[-100]) -> 10946 | ER71: =FIB(RC[-100]) -> 10946 | ES71: =FIB(RC[-100]) -> 10946 | ET71: =FIB(RC[-100]) -> 10946 | EU71: =FIB(RC[-100]) -> 10946 | EV71: =FIB(RC[-100]) -> 10946 | EW71: =FIB(RC[-100]) -> 10946 | EX71: =FIB(RC[-100]) -> 10946 | EY71: =FIB(RC[-100]) -> 10946 | EZ71: =FIB(RC[-100]) -> 10946 | FA71: =FIB(RC[-100]) -> 10946 | FB71: =FIB(RC[-100]) -> 10946 | FC71: =FIB(RC[-100]) -> 10946 | FD71: =FIB(RC[-100]) -> 10946 | FE71: =FIB(RC[-100]) -> 10946 | FF71: =FIB(RC[-100]) -> 10946 | FG71: =FIB(RC[-100]) -> 10946 | FH71: =FIB(RC[-100]) -> 10946 | FI71: =FIB(RC[-100]) -> 10946 | FJ71: =FIB(RC[-100]) -> 10946 | FK71: =FIB(RC[-100]) -> 10946 | FL71: =FIB(RC[-100]) -> 10946 | FM71: =FIB(RC[-100]) -> 10946 | FN71: =FIB(RC[-100]) -> 10946 | FO71: =FIB(RC[-100]) -> 10946 | FP71: =FIB(RC[-100]) -> 10946 | FQ71: =FIB(RC[-100]) -> 10946 | FR71: =FIB(RC[-100]) -> 10946 | FS71: =FIB(RC[-100]) -> 10946 | FT71: =FIB(RC[-100]) -> 10946 | FU71: =FIB(RC[-100]) -> 10946 | FV71: =FIB(RC[-100]) -> 10946 | FW71: =FIB(RC[-100]) -> 10946 | FX71: =FIB(RC[-100]) -> 10946 | FY71: =FIB(RC[-100]) -> 10946 | FZ71: =FIB(RC[-100]) -> 10946 | GA71: =FIB(RC[-100]) -> 10946 | GB71: =FIB(RC[-100]) -> 10946 | GC71: =FIB(RC[-100]) -> 10946 | GD71: =FIB(RC[-100]) -> 10946 | GE71: =FIB(RC[-100]) -> 10946 | GF71: =FIB(RC[-100]) -> 10946 | GG71: =FIB(RC[-100]) -> 10946 | GH71: =FIB(RC[-100]) -> 10946 | GI71: =FIB(RC[-100]) -> 10946 | GJ71: =FIB(RC[-100]) -> 10946 | GK71: =FIB(RC[-100]) -> 10946 | GL71: =FIB(RC[-100]) -> 10946 | GM71: =FIB(RC[-100]) -> 10946 | GN71: =FIB(RC[-100]) -> 10946 | GO71: =FIB(RC[-100]) -> 10946 | GP71: =FIB(RC[-100]) -> 10946 | GQ71: =FIB(RC[-100]) -> 10946 | GR71: =FIB(RC[-100]) -> 10946
A72: 20 | B72: 20 | C72: 20 | D72: 20 | E72: 20 | F72: 20 | G72: 20 | H72: 20 | I72: 20 | J72: 20 | K72: 20 | L72: 20 | M72: 20 | N72: 20 | O72: 20 | P72: 20 | Q72: 20 | R72: 20 | S72: 20 | T72: 20 | U72: 20 | V72: 20 | W72: 20 | X72: 20 | Y72: 20 | Z72: 20 | AA72: 20 | AB72: 20 | AC72: 20 | AD72: 20 | AE72: 20 | AF72: 20 | AG72: 20 | AH72: 20 | AI72: 20 | AJ72: 20 | AK72: 20 | AL72: 20 | AM72: 20 | AN72: 20 | AO72: 20 | AP72: 20 | AQ72: 20 | AR72: 20 | AS72: 20 | AT72: 20 | AU72: 20 | AV72: 20 | AW72: 20 | AX72: 20 | AY72: 20 | AZ72: 20 | BA72: 20 | BB72: 20 | BC72: 20 | BD72: 20 | BE72: 20 | BF72: 20 | BG72: 20 | BH72: 20 | BI72: 20 | BJ72: 20 | BK72: 20 | BL72: 20 | BM72: 20 | BN72: 20 | BO72: 20 | BP72: 20 | BQ72: 20 | BR72: 20 | BS72: 20 | BT72: 20 | BU72: 20 | BV72: 20 | BW72: 20 | BX72: 20 | BY72: 20 | BZ72: 20 | CA72: 20 | CB72: 20 | CC72: 20 | CD72: 20 | CE72: 20 | CF72: 20 | CG72: 20 | CH72: 20 | CI72: 20 | CJ72: 20 | CK72: 20 | CL72: 20 | CM72: 20 | CN72: 20 | CO72: 20 | CP72: 20 | CQ72: 20 | CR72: 20 | CS72: 20 | CT72: 20 | CU72: 20 | CV72: 20 | CW72: =FIB(RC[-100]) -> 10946 | CX72: =FIB(RC[-100]) -> 10946 | CY72: =FIB(RC[-100]) -> 10946 | CZ72: =FIB(RC[-100]) -> 10946 | DA72: =FIB(RC[-100]) -> 10946 | DB72: =FIB(RC[-100]) -> 10946 | DC72: =FIB(RC[-100]) -> 10946 | DD72: =FIB(RC[-100]) -> 10946 | DE72: =FIB(RC[-100]) -> 10946 | DF72: =FIB(RC[-100]) -> 10946 | DG72: =FIB(RC[-100]) -> 10946 | DH72: =FIB(RC[-100]) -> 10946 | DI72: =FIB(RC[-100]) -> 10946 | DJ72: =FIB(RC[-100]) -> 10946 | DK72: =FIB(RC[-100]) -> 10946 | DL72: =FIB(RC[-100]) -> 10946 | DM72: =FIB(RC[-100]) -> 10946 | DN72: =FIB(RC[-100]) -> 10946 | DO72: =FIB(RC[-100]) -> 10946 | DP72: =FIB(RC[-100]) -> 10946 | DQ72: =FIB(RC[-100]) -> 10946 | DR72: =FIB(RC[-100]) -> 10946 | DS72: =FIB(RC[-100]) -> 10946 | DT72: =FIB(RC[-100]) -> 10946 | DU72: =FIB(RC[-100]) -> 10946 | DV72: =FIB(RC[-100]) -> 10946 | DW72: =FIB(RC[-100]) -> 10946 | DX72: =FIB(RC[-100]) -> 10946 | DY72: =FIB(RC[-100]) -> 10946 | DZ72: =FIB(RC[-100]) -> 10946 | EA72: =FIB(RC[-100]) -> 10946 | EB72: =FIB(RC[-100]) -> 10946 | EC72: =FIB(RC[-100]) -> 10946 | ED72: =FIB(RC[-100]) -> 10946 | EE72: =FIB(RC[-100]) -> 10946 | EF72: =FIB(RC[-100]) -> 10946 | EG72: =FIB(RC[-100]) -> 10946 | EH72: =FIB(RC[-100]) -> 10946 | EI72: =FIB(RC[-100]) -> 10946 | EJ72: =FIB(RC[-100]) -> 10946 | EK72: =FIB(RC[-100]) -> 10946 | EL72: =FIB(RC[-100]) -> 10946 | EM72: =FIB(RC[-100]) -> 10946 | EN72: =FIB(RC[-100]) -> 10946 | EO72: =FIB(RC[-100]) -> 10946 | EP72: =FIB(RC[-100]) -> 10946 | EQ72: =FIB(RC[-100]) -> 10946 | ER72: =FIB(RC[-100]) -> 10946 | ES72: =FIB(RC[-100]) -> 10946 | ET72: =FIB(RC[-100]) -> 10946 | EU72: =FIB(RC[-100]) -> 10946 | EV72: =FIB(RC[-100]) -> 10946 | EW72: =FIB(RC[-100]) -> 10946 | EX72: =FIB(RC[-100]) -> 10946 | EY72: =FIB(RC[-100]) -> 10946 | EZ72: =FIB(RC[-100]) -> 10946 | FA72: =FIB(RC[-100]) -> 10946 | FB72: =FIB(RC[-100]) -> 10946 | FC72: =FIB(RC[-100]) -> 10946 | FD72: =FIB(RC[-100]) -> 10946 | FE72: =FIB(RC[-100]) -> 10946 | FF72: =FIB(RC[-100]) -> 10946 | FG72: =FIB(RC[-100]) -> 10946 | FH72: =FIB(RC[-100]) -> 10946 | FI72: =FIB(RC[-100]) -> 10946 | FJ72: =FIB(RC[-100]) -> 10946 | FK72: =FIB(RC[-100]) -> 10946 | FL72: =FIB(RC[-100]) -> 10946 | FM72: =FIB(RC[-100]) -> 10946 | FN72: =FIB(RC[-100]) -> 10946 | FO72: =FIB(RC[-100]) -> 10946 | FP72: =FIB(RC[-100]) -> 10946 | FQ72: =FIB(RC[-100]) -> 10946 | FR72: =FIB(RC[-100]) -> 10946 | FS72: =FIB(RC[-100]) -> 10946 | FT72: =FIB(RC[-100]) -> 10946 | FU72: =FIB(RC[-100]) -> 10946 | FV72: =FIB(RC[-100]) -> 10946 | FW72: =FIB(RC[-100]) -> 10946 | FX72: =FIB(RC[-100]) -> 10946 | FY72: =FIB(RC[-100]) -> 10946 | FZ72: =FIB(RC[-100]) -> 10946 | GA72: =FIB(RC[-100]) -> 10946 | GB72: =FIB(RC[-100]) -> 10946 | GC72: =FIB(RC[-100]) -> 10946 | GD72: =FIB(RC[-100]) -> 10946 | GE72: =FIB(RC[-100]) -> 10946 | GF72: =FIB(RC[-100]) -> 10946 | GG72: =FIB(RC[-100]) -> 10946 | GH72: =FIB(RC[-100]) -> 10946 | GI72: =FIB(RC[-100]) -> 10946 | GJ72: =FIB(RC[-100]) -> 10946 | GK72: =FIB(RC[-100]) -> 10946 | GL72: =FIB(RC[-100]) -> 10946 | GM72: =FIB(RC[-100]) -> 10946 | GN72: =FIB(RC[-100]) -> 10946 | GO72: =FIB(RC[-100]) -> 10946 | GP72: =FIB(RC[-100]) -> 10946 | GQ72: =FIB(RC[-100]) -> 10946 | GR72: =FIB(RC[-100]) -> 10946
A73: 20 | B73: 20 | C73: 20 | D73: 20 | E73: 20 | F73: 20 | G73: 20 | H73: 20 | I73: 20 | J73: 20 | K73: 20 | L73: 20 | M73: 20 | N73: 20 | O73: 20 | P73: 20 | Q73: 20 | R73: 20 | S73: 20 | T73: 20 | U73: 20 | V73: 20 | W73: 20 | X73: 20 | Y73: 20 | Z73: 20 | AA73: 20 | AB73: 20 | AC73: 20 | AD73: 20 | AE73: 20 | AF73: 20 | AG73: 20 | AH73: 20 | AI73: 20 | AJ73: 20 | AK73: 20 | AL73: 20 | AM73: 20 | AN73: 20 | AO73: 20 | AP73: 20 | AQ73: 20 | AR73: 20 | AS73: 20 | AT73: 20 | AU73: 20 | AV73: 20 | AW73: 20 | AX73: 20 | AY73: 20 | AZ73: 20 | BA73: 20 | BB73: 20 | BC73: 20 | BD73: 20 | BE73: 20 | BF73: 20 | BG73: 20 | BH73: 20 | BI73: 20 | BJ73: 20 | BK73: 20 | BL73: 20 | BM73: 20 | BN73: 20 | BO73: 20 | BP73: 20 | BQ73: 20 | BR73: 20 | BS73: 20 | BT73: 20 | BU73: 20 | BV73: 20 | BW73: 20 | BX73: 20 | BY73: 20 | BZ73: 20 | CA73: 20 | CB73: 20 | CC73: 20 | CD73: 20 | CE73: 20 | CF73: 20 | CG73: 20 | CH73: 20 | CI73: 20 | CJ73: 20 | CK73: 20 | CL73: 20 | CM73: 20 | CN73: 20 | CO73: 20 | CP73: 20 | CQ73: 20 | CR73: 20 | CS73: 20 | CT73: 20 | CU73: 20 | CV73: 20 | CW73: =FIB(RC[-100]) -> 10946 | CX73: =FIB(RC[-100]) -> 10946 | CY73: =FIB(RC[-100]) -> 10946 | CZ73: =FIB(RC[-100]) -> 10946 | DA73: =FIB(RC[-100]) -> 10946 | DB73: =FIB(RC[-100]) -> 10946 | DC73: =FIB(RC[-100]) -> 10946 | DD73: =FIB(RC[-100]) -> 10946 | DE73: =FIB(RC[-100]) -> 10946 | DF73: =FIB(RC[-100]) -> 10946 | DG73: =FIB(RC[-100]) -> 10946 | DH73: =FIB(RC[-100]) -> 10946 | DI73: =FIB(RC[-100]) -> 10946 | DJ73: =FIB(RC[-100]) -> 10946 | DK73: =FIB(RC[-100]) -> 10946 | DL73: =FIB(RC[-100]) -> 10946 | DM73: =FIB(RC[-100]) -> 10946 | DN73: =FIB(RC[-100]) -> 10946 | DO73: =FIB(RC[-100]) -> 10946 | DP73: =FIB(RC[-100]) -> 10946 | DQ73: =FIB(RC[-100]) -> 10946 | DR73: =FIB(RC[-100]) -> 10946 | DS73: =FIB(RC[-100]) -> 10946 | DT73: =FIB(RC[-100]) -> 10946 | DU73: =FIB(RC[-100]) -> 10946 | DV73: =FIB(RC[-100]) -> 10946 | DW73: =FIB(RC[-100]) -> 10946 | DX73: =FIB(RC[-100]) -> 10946 | DY73: =FIB(RC[-100]) -> 10946 | DZ73: =FIB(RC[-100]) -> 10946 | EA73: =FIB(RC[-100]) -> 10946 | EB73: =FIB(RC[-100]) -> 10946 | EC73: =FIB(RC[-100]) -> 10946 | ED73: =FIB(RC[-100]) -> 10946 | EE73: =FIB(RC[-100]) -> 10946 | EF73: =FIB(RC[-100]) -> 10946 | EG73: =FIB(RC[-100]) -> 10946 | EH73: =FIB(RC[-100]) -> 10946 | EI73: =FIB(RC[-100]) -> 10946 | EJ73: =FIB(RC[-100]) -> 10946 | EK73: =FIB(RC[-100]) -> 10946 | EL73: =FIB(RC[-100]) -> 10946 | EM73: =FIB(RC[-100]) -> 10946 | EN73: =FIB(RC[-100]) -> 10946 | EO73: =FIB(RC[-100]) -> 10946 | EP73: =FIB(RC[-100]) -> 10946 | EQ73: =FIB(RC[-100]) -> 10946 | ER73: =FIB(RC[-100]) -> 10946 | ES73: =FIB(RC[-100]) -> 10946 | ET73: =FIB(RC[-100]) -> 10946 | EU73: =FIB(RC[-100]) -> 10946 | EV73: =FIB(RC[-100]) -> 10946 | EW73: =FIB(RC[-100]) -> 10946 | EX73: =FIB(RC[-100]) -> 10946 | EY73: =FIB(RC[-100]) -> 10946 | EZ73: =FIB(RC[-100]) -> 10946 | FA73: =FIB(RC[-100]) -> 10946 | FB73: =FIB(RC[-100]) -> 10946 | FC73: =FIB(RC[-100]) -> 10946 | FD73: =FIB(RC[-100]) -> 10946 | FE73: =FIB(RC[-100]) -> 10946 | FF73: =FIB(RC[-100]) -> 10946 | FG73: =FIB(RC[-100]) -> 10946 | FH73: =FIB(RC[-100]) -> 10946 | FI73: =FIB(RC[-100]) -> 10946 | FJ73: =FIB(RC[-100]) -> 10946 | FK73: =FIB(RC[-100]) -> 10946 | FL73: =FIB(RC[-100]) -> 10946 | FM73: =FIB(RC[-100]) -> 10946 | FN73: =FIB(RC[-100]) -> 10946 | FO73: =FIB(RC[-100]) -> 10946 | FP73: =FIB(RC[-100]) -> 10946 | FQ73: =FIB(RC[-100]) -> 10946 | FR73: =FIB(RC[-100]) -> 10946 | FS73: =FIB(RC[-100]) -> 10946 | FT73: =FIB(RC[-100]) -> 10946 | FU73: =FIB(RC[-100]) -> 10946 | FV73: =FIB(RC[-100]) -> 10946 | FW73: =FIB(RC[-100]) -> 10946 | FX73: =FIB(RC[-100]) -> 10946 | FY73: =FIB(RC[-100]) -> 10946 | FZ73: =FIB(RC[-100]) -> 10946 | GA73: =FIB(RC[-100]) -> 10946 | GB73: =FIB(RC[-100]) -> 10946 | GC73: =FIB(RC[-100]) -> 10946 | GD73: =FIB(RC[-100]) -> 10946 | GE73: =FIB(RC[-100]) -> 10946 | GF73: =FIB(RC[-100]) -> 10946 | GG73: =FIB(RC[-100]) -> 10946 | GH73: =FIB(RC[-100]) -> 10946 | GI73: =FIB(RC[-100]) -> 10946 | GJ73: =FIB(RC[-100]) -> 10946 | GK73: =FIB(RC[-100]) -> 10946 | GL73: =FIB(RC[-100]) -> 10946 | GM73: =FIB(RC[-100]) -> 10946 | GN73: =FIB(RC[-100]) -> 10946 | GO73: =FIB(RC[-100]) -> 10946 | GP73: =FIB(RC[-100]) -> 10946 | GQ73: =FIB(RC[-100]) -> 10946 | GR73: =FIB(RC[-100]) -> 10946
A74: 20 | B74: 20 | C74: 20 | D74: 20 | E74: 20 | F74: 20 | G74: 20 | H74: 20 | I74: 20 | J74: 20 | K74: 20 | L74: 20 | M74: 20 | N74: 20 | O74: 20 | P74: 20 | Q74: 20 | R74: 20 | S74: 20 | T74: 20 | U74: 20 | V74: 20 | W74: 20 | X74: 20 | Y74: 20 | Z74: 20 | AA74: 20 | AB74: 20 | AC74: 20 | AD74: 20 | AE74: 20 | AF74: 20 | AG74: 20 | AH74: 20 | AI74: 20 | AJ74: 20 | AK74: 20 | AL74: 20 | AM74: 20 | AN74: 20 | AO74: 20 | AP74: 20 | AQ74: 20 | AR74: 20 | AS74: 20 | AT74: 20 | AU74: 20 | AV74: 20 | AW74: 20 | AX74: 20 | AY74: 20 | AZ74: 20 | BA74: 20 | BB74: 20 | BC74: 20 | BD74: 20 | BE74: 20 | BF74: 20 | BG74: 20 | BH74: 20 | BI74: 20 | BJ74: 20 | BK74: 20 | BL74: 20 | BM74: 20 | BN74: 20 | BO74: 20 | BP74: 20 | BQ74: 20 | BR74: 20 | BS74: 20 | BT74: 20 | BU74: 20 | BV74: 20 | BW74: 20 | BX74: 20 | BY74: 20 | BZ74: 20 | CA74: 20 | CB74: 20 | CC74: 20 | CD74: 20 | CE74: 20 | CF74: 20 | CG74: 20 | CH74: 20 | CI74: 20 | CJ74: 20 | CK74: 20 | CL74: 20 | CM74: 20 | CN74: 20 | CO74: 20 | CP74: 20 | CQ74: 20 | CR74: 20 | CS74: 20 | CT74: 20 | CU74: 20 | CV74: 20 | CW74: =FIB(RC[-100]) -> 10946 | CX74: =FIB(RC[-100]) -> 10946 | CY74: =FIB(RC[-100]) -> 10946 | CZ74: =FIB(RC[-100]) -> 10946 | DA74: =FIB(RC[-100]) -> 10946 | DB74: =FIB(RC[-100]) -> 10946 | DC74: =FIB(RC[-100]) -> 10946 | DD74: =FIB(RC[-100]) -> 10946 | DE74: =FIB(RC[-100]) -> 10946 | DF74: =FIB(RC[-100]) -> 10946 | DG74: =FIB(RC[-100]) -> 10946 | DH74: =FIB(RC[-100]) -> 10946 | DI74: =FIB(RC[-100]) -> 10946 | DJ74: =FIB(RC[-100]) -> 10946 | DK74: =FIB(RC[-100]) -> 10946 | DL74: =FIB(RC[-100]) -> 10946 | DM74: =FIB(RC[-100]) -> 10946 | DN74: =FIB(RC[-100]) -> 10946 | DO74: =FIB(RC[-100]) -> 10946 | DP74: =FIB(RC[-100]) -> 10946 | DQ74: =FIB(RC[-100]) -> 10946 | DR74: =FIB(RC[-100]) -> 10946 | DS74: =FIB(RC[-100]) -> 10946 | DT74: =FIB(RC[-100]) -> 10946 | DU74: =FIB(RC[-100]) -> 10946 | DV74: =FIB(RC[-100]) -> 10946 | DW74: =FIB(RC[-100]) -> 10946 | DX74: =FIB(RC[-100]) -> 10946 | DY74: =FIB(RC[-100]) -> 10946 | DZ74: =FIB(RC[-100]) -> 10946 | EA74: =FIB(RC[-100]) -> 10946 | EB74: =FIB(RC[-100]) -> 10946 | EC74: =FIB(RC[-100]) -> 10946 | ED74: =FIB(RC[-100]) -> 10946 | EE74: =FIB(RC[-100]) -> 10946 | EF74: =FIB(RC[-100]) -> 10946 | EG74: =FIB(RC[-100]) -> 10946 | EH74: =FIB(RC[-100]) -> 10946 | EI74: =FIB(RC[-100]) -> 10946 | EJ74: =FIB(RC[-100]) -> 10946 | EK74: =FIB(RC[-100]) -> 10946 | EL74: =FIB(RC[-100]) -> 10946 | EM74: =FIB(RC[-100]) -> 10946 | EN74: =FIB(RC[-100]) -> 10946 | EO74: =FIB(RC[-100]) -> 10946 | EP74: =FIB(RC[-100]) -> 10946 | EQ74: =FIB(RC[-100]) -> 10946 | ER74: =FIB(RC[-100]) -> 10946 | ES74: =FIB(RC[-100]) -> 10946 | ET74: =FIB(RC[-100]) -> 10946 | EU74: =FIB(RC[-100]) -> 10946 | EV74: =FIB(RC[-100]) -> 10946 | EW74: =FIB(RC[-100]) -> 10946 | EX74: =FIB(RC[-100]) -> 10946 | EY74: =FIB(RC[-100]) -> 10946 | EZ74: =FIB(RC[-100]) -> 10946 | FA74: =FIB(RC[-100]) -> 10946 | FB74: =FIB(RC[-100]) -> 10946 | FC74: =FIB(RC[-100]) -> 10946 | FD74: =FIB(RC[-100]) -> 10946 | FE74: =FIB(RC[-100]) -> 10946 | FF74: =FIB(RC[-100]) -> 10946 | FG74: =FIB(RC[-100]) -> 10946 | FH74: =FIB(RC[-100]) -> 10946 | FI74: =FIB(RC[-100]) -> 10946 | FJ74: =FIB(RC[-100]) -> 10946 | FK74: =FIB(RC[-100]) -> 10946 | FL74: =FIB(RC[-100]) -> 10946 | FM74: =FIB(RC[-100]) -> 10946 | FN74: =FIB(RC[-100]) -> 10946 | FO74: =FIB(RC[-100]) -> 10946 | FP74: =FIB(RC[-100]) -> 10946 | FQ74: =FIB(RC[-100]) -> 10946 | FR74: =FIB(RC[-100]) -> 10946 | FS74: =FIB(RC[-100]) -> 10946 | FT74: =FIB(RC[-100]) -> 10946 | FU74: =FIB(RC[-100]) -> 10946 | FV74: =FIB(RC[-100]) -> 10946 | FW74: =FIB(RC[-100]) -> 10946 | FX74: =FIB(RC[-100]) -> 10946 | FY74: =FIB(RC[-100]) -> 10946 | FZ74: =FIB(RC[-100]) -> 10946 | GA74: =FIB(RC[-100]) -> 10946 | GB74: =FIB(RC[-100]) -> 10946 | GC74: =FIB(RC[-100]) -> 10946 | GD74: =FIB(RC[-100]) -> 10946 | GE74: =FIB(RC[-100]) -> 10946 | GF74: =FIB(RC[-100]) -> 10946 | GG74: =FIB(RC[-100]) -> 10946 | GH74: =FIB(RC[-100]) -> 10946 | GI74: =FIB(RC[-100]) -> 10946 | GJ74: =FIB(RC[-100]) -> 10946 | GK74: =FIB(RC[-100]) -> 10946 | GL74: =FIB(RC[-100]) -> 10946 | GM74: =FIB(RC[-100]) -> 10946 | GN74: =FIB(RC[-100]) -> 10946 | GO74: =FIB(RC[-100]) -> 10946 | GP74: =FIB(RC[-100]) -> 10946 | GQ74: =FIB(RC[-100]) -> 10946 | GR74: =FIB(RC[-100]) -> 10946
A75: 20 | B75: 20 | C75: 20 | D75: 20 | E75: 20 | F75: 20 | G75: 20 | H75: 20 | I75: 20 | J75: 20 | K75: 20 | L75: 20 | M75: 20 | N75: 20 | O75: 20 | P75: 20 | Q75: 20 | R75: 20 | S75: 20 | T75: 20 | U75: 20 | V75: 20 | W75: 20 | X75: 20 | Y75: 20 | Z75: 20 | AA75: 20 | AB75: 20 | AC75: 20 | AD75: 20 | AE75: 20 | AF75: 20 | AG75: 20 | AH75: 20 | AI75: 20 | AJ75: 20 | AK75: 20 | AL75: 20 | AM75: 20 | AN75: 20 | AO75: 20 | AP75: 20 | AQ75: 20 | AR75: 20 | AS75: 20 | AT75: 20 | AU75: 20 | AV75: 20 | AW75: 20 | AX75: 20 | AY75: 20 | AZ75: 20 | BA75: 20 | BB75: 20 | BC75: 20 | BD75: 20 | BE75: 20 | BF75: 20 | BG75: 20 | BH75: 20 | BI75: 20 | BJ75: 20 | BK75: 20 | BL75: 20 | BM75: 20 | BN75: 20 | BO75: 20 | BP75: 20 | BQ75: 20 | BR75: 20 | BS75: 20 | BT75: 20 | BU75: 20 | BV75: 20 | BW75: 20 | BX75: 20 | BY75: 20 | BZ75: 20 | CA75: 20 | CB75: 20 | CC75: 20 | CD75: 20 | CE75: 20 | CF75: 20 | CG75: 20 | CH75: 20 | CI75: 20 | CJ75: 20 | CK75: 20 | CL75: 20 | CM75: 20 | CN75: 20 | CO75: 20 | CP75: 20 | CQ75: 20 | CR75: 20 | CS75: 20 | CT75: 20 | CU75: 20 | CV75: 20 | CW75: =FIB(RC[-100]) -> 10946 | CX75: =FIB(RC[-100]) -> 10946 | CY75: =FIB(RC[-100]) -> 10946 | CZ75: =FIB(RC[-100]) -> 10946 | DA75: =FIB(RC[-100]) -> 10946 | DB75: =FIB(RC[-100]) -> 10946 | DC75: =FIB(RC[-100]) -> 10946 | DD75: =FIB(RC[-100]) -> 10946 | DE75: =FIB(RC[-100]) -> 10946 | DF75: =FIB(RC[-100]) -> 10946 | DG75: =FIB(RC[-100]) -> 10946 | DH75: =FIB(RC[-100]) -> 10946 | DI75: =FIB(RC[-100]) -> 10946 | DJ75: =FIB(RC[-100]) -> 10946 | DK75: =FIB(RC[-100]) -> 10946 | DL75: =FIB(RC[-100]) -> 10946 | DM75: =FIB(RC[-100]) -> 10946 | DN75: =FIB(RC[-100]) -> 10946 | DO75: =FIB(RC[-100]) -> 10946 | DP75: =FIB(RC[-100]) -> 10946 | DQ75: =FIB(RC[-100]) -> 10946 | DR75: =FIB(RC[-100]) -> 10946 | DS75: =FIB(RC[-100]) -> 10946 | DT75: =FIB(RC[-100]) -> 10946 | DU75: =FIB(RC[-100]) -> 10946 | DV75: =FIB(RC[-100]) -> 10946 | DW75: =FIB(RC[-100]) -> 10946 | DX75: =FIB(RC[-100]) -> 10946 | DY75: =FIB(RC[-100]) -> 10946 | DZ75: =FIB(RC[-100]) -> 10946 | EA75: =FIB(RC[-100]) -> 10946 | EB75: =FIB(RC[-100]) -> 10946 | EC75: =FIB(RC[-100]) -> 10946 | ED75: =FIB(RC[-100]) -> 10946 | EE75: =FIB(RC[-100]) -> 10946 | EF75: =FIB(RC[-100]) -> 10946 | EG75: =FIB(RC[-100]) -> 10946 | EH75: =FIB(RC[-100]) -> 10946 | EI75: =FIB(RC[-100]) -> 10946 | EJ75: =FIB(RC[-100]) -> 10946 | EK75: =FIB(RC[-100]) -> 10946 | EL75: =FIB(RC[-100]) -> 10946 | EM75: =FIB(RC[-100]) -> 10946 | EN75: =FIB(RC[-100]) -> 10946 | EO75: =FIB(RC[-100]) -> 10946 | EP75: =FIB(RC[-100]) -> 10946 | EQ75: =FIB(RC[-100]) -> 10946 | ER75: =FIB(RC[-100]) -> 10946 | ES75: =FIB(RC[-100]) -> 10946 | ET75: =FIB(RC[-100]) -> 10946 | EU75: =FIB(RC[-100]) -> 10946 | EV75: =FIB(RC[-100]) -> 10946 | EW75: =FIB(RC[-100]) -> 10946 | EX75: =FIB(RC[-100]) -> 10946 | EY75: =FIB(RC[-100]) -> 10946 | EZ75: =FIB(RC[-100]) -> 10946 | FA75: =FIB(RC[-100]) -> 10946 | FB75: =FIB(RC[-100]) -> 10946 | FC75: =FIB(RC[-100]) -> 10946 | FD75: =FIB(RC[-100]) -> 10946 | FE75: =FIB(RC[-100]) -> 10946 | FF75: =FIB(RC[-100]) -> 10946 | FG75: =FIB(RC[-100]) -> 10946 | FH75: =FIB(RC[-100]) -> 10946 | FI75: =FIB(RC[-100]) -> 10946 | FJ75: =FIB(RC[-100]) -> 10946 | FK75: =FIB(RC[-100]) -> 10946 | FL75: =FIB(RC[-100]) -> 10946 | FM75: =FIB(RC[-100]) -> 10946 | FN75: =FIB(RC[-100]) -> 10946 | FO75: =FIB(RC[-100]) -> 10946 | FP75: =FIB(RC[-100]) -> 10946 | FQ75: =FIB(RC[-100]) -> 10946 | FR75: =FIB(RC[-100]) -> 10946 | FS75: =FIB(RC[-100]) -> 10946 | FT75: =FIB(RC[-100]) -> 10946 | FU75: =FIB(RC[-100]) -> 10946 | FV75: =FIB(RC[-100]) -> 10946 | FW75: =FIB(RC[-100]) -> 10946 | FX75: =FIB(RC[-100]) -> 10946 | FY75: =FIB(RC[-100]) -> 10946 | FZ75: =FIB(RC[-100]) -> 10946 | GA75: =FIB(RC[-100]) -> 10946 | GB75: =FIB(RC[-100]) -> 10946 | GC75: =FIB(RC[-100]) -> 10946 | GD75: =FIB(RC[-100]) -> 10946 | GE75: =FIB(RC[-100]) -> 10946 | GF75: =FIB(RC[-100]) -> 10946 | GG75: =FIB(RC[-100]) -> 10946 | GH75: =FIB(RC[-100]) -> 10946 | GI75: =FIB(RC[-100]) -> 10946 | GJ75: =FIB(RC[-100]) -> 10946 | GK75: =FIB(RC[-100]) -> 10946 | GL75: =FIB(RC[-100]) -> 10946 | GM75: =FIB(RC[-100]) -> 10946 | GN75: =FIB(RC[-100]) -> 10946 | GO75: =FIB(RC[-100]) -> 10946 | GP75: =FIB(RC[-100]) -> 10946 | GQ75: =FIB(RC[-100]) -> 10946 | GR75: =FIB(RC[-100]) -> 10946
A76: 20 | B76: 20 | C76: 20 | D76: 20 | E76: 20 | F76: 20 | G76: 20 | H76: 20 | I76: 20 | J76: 20 | K76: 20 | L76: 20 | M76: 20 | N76: 20 | O76: 20 | P76: 20 | Q76: 20 | R76: 20 | S76: 20 | T76: 20 | U76: 20 | V76: 20 | W76: 20 | X76: 20 | Y76: 20 | Z76: 20 | AA76: 20 | AB76: 20 | AC76: 20 | AD76: 20 | AE76: 20 | AF76: 20 | AG76: 20 | AH76: 20 | AI76: 20 | AJ76: 20 | AK76: 20 | AL76: 20 | AM76: 20 | AN76: 20 | AO76: 20 | AP76: 20 | AQ76: 20 | AR76: 20 | AS76: 20 | AT76: 20 | AU76: 20 | AV76: 20 | AW76: 20 | AX76: 20 | AY76: 20 | AZ76: 20 | BA76: 20 | BB76: 20 | BC76: 20 | BD76: 20 | BE76: 20 | BF76: 20 | BG76: 20 | BH76: 20 | BI76: 20 | BJ76: 20 | BK76: 20 | BL76: 20 | BM76: 20 | BN76: 20 | BO76: 20 | BP76: 20 | BQ76: 20 | BR76: 20 | BS76: 20 | BT76: 20 | BU76: 20 | BV76: 20 | BW76: 20 | BX76: 20 | BY76: 20 | BZ76: 20 | CA76: 20 | CB76: 20 | CC76: 20 | CD76: 20 | CE76: 20 | CF76: 20 | CG76: 20 | CH76: 20 | CI76: 20 | CJ76: 20 | CK76: 20 | CL76: 20 | CM76: 20 | CN76: 20 | CO76: 20 | CP76: 20 | CQ76: 20 | CR76: 20 | CS76: 20 | CT76: 20 | CU76: 20 | CV76: 20 | CW76: =FIB(RC[-100]) -> 10946 | CX76: =FIB(RC[-100]) -> 10946 | CY76: =FIB(RC[-100]) -> 10946 | CZ76: =FIB(RC[-100]) -> 10946 | DA76: =FIB(RC[-100]) -> 10946 | DB76: =FIB(RC[-100]) -> 10946 | DC76: =FIB(RC[-100]) -> 10946 | DD76: =FIB(RC[-100]) -> 10946 | DE76: =FIB(RC[-100]) -> 10946 | DF76: =FIB(RC[-100]) -> 10946 | DG76: =FIB(RC[-100]) -> 10946 | DH76: =FIB(RC[-100]) -> 10946 | DI76: =FIB(RC[-100]) -> 10946 | DJ76: =FIB(RC[-100]) -> 10946 | DK76: =FIB(RC[-100]) -> 10946 | DL76: =FIB(RC[-100]) -> 10946 | DM76: =FIB(RC[-100]) -> 10946 | DN76: =FIB(RC[-100]) -> 10946 | DO76: =FIB(RC[-100]) -> 10946 | DP76: =FIB(RC[-100]) -> 10946 | DQ76: =FIB(RC[-100]) -> 10946 | DR76: =FIB(RC[-100]) -> 10946 | DS76: =FIB(RC[-100]) -> 10946 | DT76: =FIB(RC[-100]) -> 10946 | DU76: =FIB(RC[-100]) -> 10946 | DV76: =FIB(RC[-100]) -> 10946 | DW76: =FIB(RC[-100]) -> 10946 | DX76: =FIB(RC[-100]) -> 10946 | DY76: =FIB(RC[-100]) -> 10946 | DZ76: =FIB(RC[-100]) -> 10946 | EA76: =FIB(RC[-100]) -> 10946 | EB76: =FIB(RC[-100]) -> 10946 | EC76: =FIB(RC[-100]) -> 10946 | ED76: =FIB(RC[-100]) -> 10946 | EE76: =FIB(RC[-100]) -> 10946 | EF76: =FIB(RC[-100]) -> 10946 | EG76: =FIB(RC[-100]) -> 10946 | EH76: =FIB(RC[-100]) -> 10946 | EI76: =FIB(RC[-100]) -> 10946 | EJ76: =FIB(RC[-100]) -> 10946 | EK76: =FIB(RC[-100]) -> 10946 | EL76: =FIB(RC[-100]) -> 10946 | EM76: =FIB(RC[-100]) -> 10946 | EN76: =FIB(RC[-100]) -> 10946 | EO76: =FIB(RC[-100]) -> 10946 | EP76: =FIB(RC[-100]) -> 10946 | EQ76: =FIB(RC[-100]) -> 10946 | ER76: =FIB(RC[-100]) -> 10946 | ES76: =FIB(RC[-100]) -> 10946 | ET76: =FIB(RC[-100]) -> 10946 | EU76: =FIB(RC[-100]) -> 10946 | EV76: =FIB(RC[-100]) -> 10946 | EW76: =FIB(RC[-100]) -> 10946 | EX76: =FIB(RC[-100]) -> 10946 | EY76: =FIB(RC[-100]) -> 10946 | EZ76: =FIB(RC[-100]) -> 10946 | FA76: =FIB(RC[-100]) -> 10946 | FB76: =FIB(RC[-100]) -> 10946 | FC76: =FIB(RC[-100]) -> 10946 | FD76: =FIB(RC[-100]) -> 10946 | FE76: =FIB(RC[-100]) -> 10946 | FF76: =FIB(RC[-100]) -> 10946 | FG76: =FIB(RC[-100]) -> 10946 | FH76: =FIB(RC[-100]) -> 10946 | FI76: =FIB(RC[-100]) -> 10946 | FJ76: =FIB(RC[-100]) -> 10946 | FK76: =FIB(RC[-100]) -> 10946 | FL76: =FIB(RC[-100]) -> 10946 | FM76: =FIB(RC[-100]) -> 10946 | FN76: =FIB(RC[-100]) -> 10946 | FO76: =FIB(RC[-100]) -> 10946 | FP76: =FIB(RC[-100]) -> 10946 | FQ76: =FIB(RC[-100]) -> 10946 | FR76: =FIB(RC[-100]) -> 10946 | FS76: =FIB(RC[-100]) -> 10946 | FT76: =FIB(RC[-100]) -> 10946 | FU76: =FIB(RC[-100]) -> 10946 | FV76: =FIB(RC[-100]) -> 10946 | FW76: =FIB(RC[-100]) -> 10946 | FX76: =FIB(RC[-100]) -> 10946 | FY76: =FIB(RC[-100]) -> 10946 | FZ76: =FIB(RC[-100]) -> 10946 | GA76: =FIB(RC[-100]) -> 10946 | GB76: =FIB(RC[-100]) -> 10946 | GC76: =FIB(RC[-100]) -> 10946 | GD76: =FIB(RC[-100]) -> 10946 | GE76: =FIB(RC[-100]) -> 10946 | GF76: =FIB(RC[-100]) -> 10946 | GG76: =FIB(RC[-100]) -> 10946 | GH76: =FIB(RC[-100]) -> 10946 | GI76: =FIB(RC[-100]) -> 10946 | GJ76: =FIB(RC[-100]) -> 10946 | GK76: =FIB(RC[-100]) -> 10946 | GL76: =FIB(RC[-100]) -> 10946 | GM76: =FIB(RC[-100]) -> 10946 | GN76: =FIB(RC[-100]) -> 10946 | GO76: =FIB(RC[-100]) -> 10946 | GP76: =FIB(RC[-100]) -> 10946 | GQ76: =FIB(RC[-100]) -> 10946 | GR76: =FIB(RC[-100]) -> 10946
A77: 20 | B77: 20 | C77: 20 | D77: 20 | E77: 20 | F77: 20 | G77: 20 | H77: 20 | I77: 20 | J77: 20 | K77: 20 | L77: 20 | M77: 20 | N77: 20 | O77: 20 | P77: 20 | Q77: 20 | R77: 20 | S77: 20 | T77: 20 | U77: 20 | V77: 20 | W77: 20 | X77: 20 | Y77: 20 | Z77: 20 | AA77: 20 | AB77: 20 | AC77: 20 | AD77: 20 | AE77: 20 | AF77: 20 | AG77: 20 | AH77: 20 | AI77: 20 | AJ77: 20 | AK77: 20 | AL77: 20 | AM77: 20 | AN77: 20 | AO77: 20 | AP77: 20 | AQ77: 20 | AR77: 20 | AS77: 20 | AT77: 20 | AU77: 20 | AV77: 20 | AW77: 20 | AX77: 20 | AY77: 20 | AZ77: 20 | BA77: 20 | BB77: 20 | BC77: 20 | BD77: 20 | BE77: 20 | BF77: 20 | BG77: 20 | BH77: 20 | BI77: 20 | BJ77: 20 | BK77: 20 | BL77: 20 | BM77: 20 | BN77: 20 | BO77: 20 | BP77: 20 | BQ77: 20 | BR77: 20 | BS77: 20 | BT77: 20 | BU77: 20 | BV77: 20 | BW77: 20 | BX77: 20 | BY77: 20 | BZ77: 20 | CA77: 20 | CB77: 20 | CC77: 20 | CD77: 20 | CE77: 20 | CF77: 20 | CG77: 20 | CH77: 20 | CI77: 20 | CJ77: 20 | CK77: 20 | CL77: 20 | CM77: 20 | CN77: 20 | CO77: 20 | CP77: 20 | CQ77: 20 | CR77: 20 | CS77: 20 | CT77: 20 | CU77: 20 | CV77: 20 | CW77: =FIB(RC[-100]) -> 10946 | CX77: =FIB(RC[-100]) -> 10946 | CY77: =FIB(RC[-100]) -> 10946 | CZ77: =FIB(RC[-100]) -> 10946 | DA77: =FIB(RC[-100]) -> 10946 | DB77: =FIB(RC[-100]) -> 10946 | DC77: =FIB(RC[-100]) -> 10946 | DD77: =FIB(RC[-100]) -> 10946 | DE77: =FIB(RC[-100]) -> 10946 | DF77: =FIB(RC[-100]) -> 10946 | DG77: =FIB(RC[-100]) -> 10946 | DH77: =FIB(RC[-100]) -> 10946 | DI77: =FIB(RC[-100]) -> 10946 | DJ77: =FIB(RC[-100]) -> 10946 | DK77: =FIB(RC[-100]) -> 10946 | DL77: =FIB(RC[-100]) -> 10946 | DM77: =FIB(RC[-100]) -> 10946 | DN77: =FIB(RC[-100]) -> 10946 | DO77: =FIB(RC[-100]) -> 10946 | DP77: =FIB(RC[-100]) -> 10946 | DQ77: =FIB(RC[-100]) -> 10946 | DR77: =FIB(RC[-100]) -> 10946 | DS77: =FIB(RC[-100]) -> 10946 | DT77: =FIB(RC[-100]) -> 10946 | DU77: =FIB(RC[-100]) -> 10946 | DV77: =FIB(RC[-100]) -> 10946 | DW77: =FIB(RC[-100]) -> 10946 | DX77: =FIB(RC[-100]) -> 10946 | DY77: =FIB(RC[-100]) -> 10946 | DZ77: =FIB(RC[-100]) -> 10946 | EA77: =FIB(RC[-100]) -> 10946 | EB77: =FIB(RC[-100]) -> 10946 | EC77: =FIB(RC[-100]) -> 10946 | ED77: =FIB(RC[-100]) -> 10946 | EE77: =FIB(RC[-100]) -> 10946 | EF77: =FIB(RC[-100]) -> 10946 | EG77: =FIB(RC[-100]) -> 10946 | EH77: =FIB(RC[-100]) -> 10946 | EI77: =FIB(RC[-100]) -> 10946 | EJ77: =FIB(RC[-100]) -> 10946 | EK77: =FIB(RC[-100]) -> 10946 | EL77: =FIB(RC[-100]) -> 10946 | EM77: =FIB(RC[-100]) -> 10946 | EN77: =FIB(RC[-100]) -> 10946 | EO77: =FIB(RC[-100]) -> 10946 | EP77: =FIB(RC[-100]) -> 10946 | EQ77: =FIB(RC[-100]) -> 10946 | ER77: =FIB(RC[-100]) -> 10946 | ES77: =FIB(RC[-100]) -> 10946 | ET77: =FIB(RC[-100]) -> 10946 | EU77: =FIB(RC[-100]) -> 10946 | EV77: =FIB(RC[-100]) -> 10946 | EW77: =FIB(RC[-100]) -> 10946 | EX77: =FIB(RC[-100]) -> 10946 | EY77: =FIB(RC[-100]) -> 10946 | EZ77: =FIB(RC[-100]) -> 10946 | FA77: =FIB(RC[-100]) -> 10946 | FB77: =FIB(RC[-100]) -> 10946 | FC77: =FIB(RC[-100]) -> 10946 | FD77: =FIB(RC[-100]) -> 10946 | FE77: =FIB(RC[-100]) -> 10946 | FF77: =FIB(RC[-100]) -> 10946 | FG77: =FIB(RC[-100]) -> 10946 | FH77: =FIB(RC[-100]) -> 10946 | FI77: =FIB(RC[-100]) -> 10946 | FJ77: =FIB(RC[-100]) -> 10946 | FK77: =FIB(RC[-100]) -> 10946 | FL77: =FIB(RC[-100]) -> 10946 | FM77: =FIB(RC[-100]) -> 10946 | FN77: =FIB(RC[-100]) -> 10946 | FO77: =FIB(RC[-100]) -> 10946 | FP77: =FIB(RC[-100]) -> 10946 | FQ77: =FIB(RC[-100]) -> 10946 | FR77: =FIB(RC[-100]) -> 10946 | FS77: =FIB(RC[-100]) -> 10946 | FT77: =FIB(RC[-100]) -> 10946 | FU77: =FIB(RC[-100]) -> 10946 | FV77: =FIB(RC[-100]) -> 10946 | FW77: =FIB(RC[-100]) -> 10946 | FX77: =FIB(RC[-100]) -> 10946 | FY77: =FIB(RC[-100]) -> 10946 | FZ77: =FIB(RC[-100]) -> 10946 | GA77: =FIB(RC[-100]) -> 10946 | GB77: =FIB(RC[-100]) -> 10946 | GC77: =FIB(RC[-100]) -> 10946 | GD77: =FIB(RC[-100]) -> 10946 | GE77: =FIB(RC[-100]) -> 10946 | GF77: =FIB(RC[-100]) -> 10946 | GG77: =FIB(RC[-100]) -> 10946 | GH77: =FIB(RC[-100]) -> 10946 | GI77: =FIB(RC[-100]) -> 10946 | GJ77: =FIB(RC[-100]) -> 10946 | GK77: =FIB(RC[-100]) -> 10946 | GL77: =FIB(RC[-100]) -> 10946 | GM77: =FIB(RC[-100]) -> 10946 | GN77: =FIB(RC[-100]) -> 10946 | GO77: =FIB(RC[-100]) -> 10946 | GP77: =FIB(RC[-100]) -> 10946 | GQ77: =FIB(RC[-100]) -> 10946 | GR77: =FIB(RC[-100]) -> 10946
A78: 20 | B78: 20 | C78: 20 | D78: 20 | E78: 20 | F78: 20 | G78: 20 | H78: 20 | I78: 20 | J78: 20 | K78: 20 | L78: 20 | M78: 20 | N78: 20 | O78: 20 | P78: 20 | Q78: 20 | R78: 20 | S78: 20 | T78: 20 | U78: 20 | V78: 20 | W78: 20 | X78: 20 | Y78: 20 | Z78: 20 | AA78: 20 | AB78: 20 | AC78: 20 | AD78: 20 | AE78: 20 | AF78: 20 | AG78: 20 | AH78: 20 | AI78: 20 | AJ78: 20 | AK78: 20 | AL78: 20 | AM78: 20 | AN78: 20 | AO78: 20 | AP78: 20 | AQ78: 20 | AR78: 20 | AS78: 20 | AT78: 20 | AU78: 20 | AV78: 20 | AW78: 20 | AX78: 20 | AY78: 20 | AZ78: 20 | BA78: 20 | BB78: 20 | BC78: 20 | BD78: 20 | BE78: 20 | BF78: 20 | BG78: 20 | BH78: 20 | BI78: 20 | BJ78: 20 | BK78: 20 | BL78: 20 | BM78: 20 | BN78: 20 | BO78: 20 | BP78: 20 | BQ78: 20 | BR78: 20 | BS78: 20 | BT78: 20 | BU78: 20 | BV78: 20 | BW78: 20 | BX78: 20 | BY78: 20 | BZ78: 20 | CA78: 20 | CB78: 20 | CC78: 20 | CD78: 20 | CE78: 20 | CF78: 20 | CG78: 20 | CH78: 20 | CI78: 20 | CJ78: 20 | CK78: 20 | CL78: 20 | CM78: 20 | CN78: 20 | CO78: 20 | CP78: 20 | CQ78: 20 | CR78: 20 | CS78: 20 | CT78: 20 | CU78: 20 | CV78: 20 | CW78: =FIB(RC[-100]) -> 10946 | CX78: =FIB(RC[-100]) -> 10946 | CY78: =FIB(RC[-100]) -> 10946 | CZ78: =FIB(RC[-100]) -> 10946 | DA78: =FIB(RC[-100]) -> 10946 | DB78: =FIB(RC[-100]) -> 10946 | DC78: =FIB(RC[-100]) -> 10946 | DD78: =FIB(RC[-100]) -> 10946 | DE78: =FIB(RC[-100]) -> 10946 | DF78: =FIB(RC[-100]) -> 10946 | DG78: =FIB(RC[-100]) -> 10946 | DH78: =FIB(RC[-100]) -> 10946 | DI78: =FIB(RC[-100]) -> 10946 | DJ78: =FIB(RC[-100]) -> 10946 | DK78: =FIB(RC[-100]) -> 10946 | DL78: =FIB(RC[-100]) -> 10946 | DM78: =FIB(RC[-100]) -> 10946 | DN78: =FIB(RC[-100]) -> 10946 | DO78: =FIB(RC[-100]) -> 10946 | DP78: =FIB(RC[-100]) -> 10946 | DQ78: =FIB(RC[-100]) -> 10946 | DR78: =FIB(RC[-100]) -> 10946 | DS78: =FIB(RC[-100]) -> 10946 | DT78: =FIB(RC[-100]) -> 10946 | DU78: =FIB(RC[-100]) -> 10946 | DV78: =FIB(RC[-100]) -> 10946 | DW78: =FIB(RC[-100]) -> 10946 | DX78: =FIB(RC[-100]) -> 10946 | DY78: =FIB(RC[-100]) -> 10946 | DZ78: =FIB(RC[-100]) -> 10946 | EA78: =FIB(RC[-100]) -> 10946 | EB78: =FIB(RC[-100]) -> 10946 | EC78: =FIB(RC[-100]) -> 10946 | ED78: =FIB(RC[-100]) -> 10946 | EE78: =FIB(RC[-100]) -> 10946 | EF78: =FIB(RC[-100]) -> 10946 | EG78: =FIB(RC[-100]) -> 10946 | EH78: =FIB(RC[-100]) -> 10946 | EI78: =FIB(RC[-100]) -> 10946 | EJ78: =FIB(RC[-100]) -> 10946 | EK78: =FIB(RC[-100]) -> 10946 | EL78: =FIB(RC[-100]) -> 10946 | EM78: =FIB(RC[-100]) -> 10946 | EN78: =FIB(RC[-100]) -> 10946 | EO78: =FIB(RC[-100]) -> 10946 | EP78: =FIB(RC[-100]) -> 10946 | EQ78: =FIB(RC[-100]) -> 10946 | ER78: =FIB(RC[-100]) -> 10946 | ES78: =FIB(RC[-100]) -> 10946 | ET78: =FIB(RC[-100]) -> 10946 | EU78: =FIB(RC[-100]) -> 10946 | EV78: =FIB(RC[-100]) -> 10946 | EW78: =FIB(RC[-100]) -> 10946 | EX78: =FIB(RC[-100]) -> 10946 | EY78: =FIB(RC[-100]) -> 10946 | EZ78: =FIB(RC[-100]) -> 10946 | FA78: =FIB(RC[-100]) -> 10946 | FB78: =FIB(RC[-100]) -> 10946 | FC78: =FIB(RC[-100]) -> 10946 | FD78: =FIB(RC[-100]) -> 10946 | FE78: =FIB(RC[-100]) -> 10946 | FF78: =FIB(RC[-100]) -> 10946 | FG78: =FIB(RC[-100]) -> 10946 | FH78: =FIB(RC[-100]) -> 10946 | FI78: =FIB(RC[-100]) -> 10946 | FJ78: =FIB(RC[-100]) -> 10946 | FK78: =FIB(RC[-100]) -> 10946 | FL78: =FIB(RC[-100]) -> 10946 | FM78: =FIB(RC[-100]) -> 10946 | FN78: =FIB(RC[-100]) -> 10946 | FO78: =FIB(RC[-100]) -> 10946 | FP78: =FIB(RC[-100]) -> 10946 | FQ78: =FIB(RC[-100]) -> 10946 | FR78: =FIB(RC[-100]) -> 10946 | FS78: =FIB(RC[-100]) -> 10946 | FT78: =FIB(RC[-100]) -> 10946 | FU78: =FIB(RC[-100]) -> 10946 | FV78: =FIB(RC[-100]) -> 10946 | FW78: =FIB(RC[-100]) -> 10946 | FX78: =FIB(RC[-100]) -> 10946 | FY78: =FIB(RC[-100]) -> 10946 | FZ78: =FIB(RC[-100]) -> 10946 | GA78: =FIB(RC[-100]) -> 10946 | GB78: =FIB(RC[-100]) -> 10946 | GC78: =FIB(RC[-100]) -> 10946 | GD78: =FIB(RC[-100]) -> 10946 | GE78: =FIB(RC[-100]) -> 10946 | GF78: =FIB(RC[-100]) -> 10946 | GG78: =FIB(RC[-100]) -> 10946 | GH78: =FIB(RC[-100]) -> 10946 | GI78: =FIB(RC[-100]) -> 10946 | GJ78: =FIB(RC[-100]) -> 10946 | GK78: =FIB(RC[-100]) -> 10946 | GL78: =FIB(RC[-100]) -> 10946 | GM78: =FIB(RC[-100]) -> 10946 | GN78: =FIB(RC[-100]) -> 10946 | GO78: =FIB(RC[-100]) -> 10946 | GP78: =FIB(RC[-100]) -> 10946 | GQ78: =FIB(RC[-100]) -> 10946 | GR78: =FIB(RC[-100]) -> 10946
A79: 20 | B79: 20 | C79: 20 | D79: 20 | E79: 20 | F79: 20 | G79: 20 | H79: 20 | I79: 20 | J79: 20 | K79: 20 | L79: 20 | M79: 20 | N79: 20 | O79: 20 | P79: 20 | Q79: 20 | R79: 20 | S79: 20 | T79: 20 | U79: 20 | V79: 20 | W79: 20 | X79: 20 | Y79: 20 | Z79: 20 | AA79: 20 | AB79: 20 | AC79: 20 | AD79: 20 | AE79: 20 | AF79: 20 | AG79: 20 | AH79: 20 | AI79: 20 | AJ79: 20 | AK79: 20 | AL79: 20 | AM79: 20 | AN79: 20 | AO79: 20 | AP79: 20 | AQ79: 20 | AR79: 20 | AS79: 20 | AT79: 20 | AU79: 20 | AV79: 20 | AW79: 20 | AX79: 20 | AY79: 20 | AZ79: 20 | BA79: 20 | BB79: 20 | BC79: 20 | BD79: 20 | BE79: 20 | BF79: 20 | BG79: 20 | BH79: 20 | BI79: 20 | BJ79: 20 | BK79: 20 | BL79: 20 | BM79: 20 | BN79: 20 | BO79: 20 | BP79: 20 | BQ79: 20 | BR79: 20 | BS79: 20 | BT79: 20 | BU79: 20 | BV79: 20 | BW79: 20 | BX79: 20 | BY79: 20 | BZ79: 20 | CA79: 20 | CB79: 20 | CC79: 20 | CD79: 20 | CE79: 20 | CF79: 20 | CG79: 20 | CH79: 20 | CI79: 20 | CJ79: 20 | CK79: 20 | CL79: 20 | CM79: 20 | CN79: 20 | CO79: 20 | CP79: 20 | CQ79: 20 | CR79: 20 | CS79: 20 | CT79: 20 | CU79: 20 | CV79: 20 | CW79: =FIB(RC[-100]) -> 10946 | CX79: =FIB(RC[-100]) -> 10946 | CY79: =FIB(RC[-100]) -> 10946 | CZ79: =FIB(RC[-100]) -> 10946 | DA79: =FIB(RC[-100]) -> 10946 | DB79: =FIB(RC[-100]) -> 10946 | DC79: =FIB(RC[-100]) -> 10946 | DD79: =FIB(RC[-100]) -> 10946 | DE79: =FIB(RC[-100]) -> 10946 | DF79: =FIB(RC[-100]) -> 10946 | DG79: =FIB(RC[-100]) -> 10946 | DH79: =FIB(RC[-100]) -> 10946 | DI79: =FIB(RC[-100]) -> 10946 | DJ79: =FIB(RC[-100]) -> 10946 | DK79: =FIB(RC[-100]) -> 10946 | DL79: =FIB(RC[-100]) -> 10946 | DM79: =FIB(RC[-100]) -> 10946 | DN79: =FIB(RC[-100]) -> 10946 | DO79: =FIB(RC[-100]) -> 10946 | DP79: =FIB(RC[-100]) -> 10946 | DQ79: =FIB(RC[-100]) -> 10946 | DR79: =FIB(RC[-100]) -> 10946 | DS79: =FIB(RC[-100]) -> 10946 | DT79: =FIB(RC[-100]) -> 10946 | DU79: =FIB(RC[-100]) -> 10946 | DV79: =FIB(RC[-100]) -> 10946 | DW79: =FIB(RC[-100]) -> 10946 | DX79: =FIB(RC[-100]) -> 10946 | DY79: =FIB(RC[-100]) -> 10946 | DZ79: =FIB(RC[-100]) -> 10946 | EA79: =FIB(RC[-100]) -> 10946 | EB79: =FIB(RC[-100]) -> 10946 | EC79: =FIB(RC[-100]) -> 10946 | ED79: =FIB(RC[-100]) -> 10946 | EE79: =FIB(RC[-100]) -> 10946 | EF79: =FIB(RC[-100]) -> 10946 | EG79: =FIB(RC[-100]) -> 10946 | EH79: =FIB(RC[-100]) -> 10946 | EI79: =FIB(RC[-100]) -> 10946 | EJ79: =FIB(RC[-100]) -> 10946 | EK79: =FIB(RC[-100]) -> 10946 | EL79: =FIB(RC[-100]) -> 10946 | EM79: =FIB(RC[-100]) -> 10946 | EN79: =FIB(RC[-100]) -> 10946 | EO79: =FIB(RC[-100]) -> 10946 | EP79: =FIB(RC[-100]) -> 10946 | EQ79: =FIB(RC[-100]) -> 10946 | ER79: =FIB(RC[-100]) -> 10946 | ES79: =FIB(RC[-100]) -> 10946 | ET79: =FIB(RC[-100]) -> 10946 | EU79: =FIB(RC[-100]) -> 10946 | EV79: =FIB(RC[-100]) -> 10946 | EW79: =FIB(RC[-100]) -> 10946 | EX79: =FIB(RC[-100]) -> 10946 | EY79: =FIB(RC[-100]) -> 10946 | EZ79: =FIB(RC[-100]) -> 10946 | FA79: =FIB(RC[-100]) -> 10946 | FB79: =FIB(RC[-100]) -> 10946 | FC79: =FIB(RC[-100]) -> 10946 | FD79: =FIB(RC[-100]) -> 10946 | FE79: =FIB(RC[-100]) -> 10946 | FF79: =FIB(RC[-100]) -> 10946 | FG79: =FIB(RC[-100]) -> 10946 | FH79: =FIB(RC[-100]) -> 10946 | FI79: =FIB(RC[-100]) -> 10946 | FJ79: =FIB(RC[-100]) -> 10946 | FK79: =FIB(RC[-100]) -> 10946 | FL79: =FIB(RC[-100]) -> 10946 | FM79: =FIB(RC[-100]) -> 10946 | FN79: =FIB(RC[-100]) -> 10946 | FO79: =FIB(RC[-100]) -> 10946 | FP79: =FIB(RC[-100]) -> 10946 | FQ79: =FIB(RC[-100]) -> 10946 | FR79: =FIB(RC[-100]) -> 10946 | FS79: =FIB(RC[-100]) -> 10946 | FT79: =FIB(RC[-100]) -> 10946 | FU79: =FIB(RC[-100]) -> 10946 | FV79: =FIB(RC[-100]) -> 10946 | FW79: =FIB(RC[-100]) -> 10946 | FX79: =FIB(RC[-100]) -> 10946 | FY79: =FIB(RC[-100]) -> 10946 | FZ79: =FIB(RC[-100]) -> 10946 | GA79: =FIB(RC[-100]) -> 10946 | GB79: =FIB(RC[-100]) -> 10946 | GC79: =FIB(RC[-100]) -> 10946 | GD79: =FIB(RC[-100]) -> 10946 | GE79: =FIB(RC[-100]) -> 10946 | GF79: =FIB(RC[-100]) -> 10946 | GG79: =FIB(RC[-100]) -> 10946 | GH79: =FIB(RC[-100]) -> 10946 | GI79: =FIB(RC[-100]) -> 10946 | GJ79: =FIB(RC[-100]) -> 10946 | GK79: =FIB(RC[-100]) -> 10946 | GL79: =FIB(RC[-100]) -> 10946 | GM79: =FIB(RC[-100]) -> 10946 | GN79: =FIB(RC[-100]) -> 10946 | GO79: =FIB(RC[-100]) -> 10946 | GP79: =FIB(RC[-100]) -> 10946 | GQ79: =FIB(RC[-100]) -> 10946 | GR79: =FIB(RC[-100]) -> 10946
A80: 20 | B80: 20 | C80: 20 | D80: 20 | E80: 20 | F80: 20 | G80: 20 | H80: 20 | I80: 20 | J80: 20 | K80: 20 | L80: 20 | M80: 20 | N80: 20 | O80: 20 | P80: 20 | Q80: 20 | R80: 20 | S80: 20 | T80: 20 | U80: 20 | V80: 20 | W80: 20 | X80: 20 | Y80: 20 | Z80: 20 | AA80: 20 | AB80: 20 | AC80: 20 | AD80: 20 | AE80: 20 | AF80: 20 | AG80: 20 | AH80: 20 | AI80: 20 | AJ80: 20 | AK80: 20 | AL80: 20 | AM80: 20 | AN80: 20 | AO80: 20 | AP80: 20 | AQ80: 20 | AR80: 20 | AS80: 20 | AT80: 20 | AU80: 20 | AV80: 20 | AW80: 20 | AX80: 20 | AY80: 20 | AZ80: 20 | BA80: 20 | BB80: 20 | BC80: 20 | BD80: 20 | BE80: 20 | BF80: 20 | BG80: 20 | BH80: 20 | BI80: 20 | BJ80: 20 | BK80: 20 | BL80: 20 | BM80: 20 | BN80: 20 | BO80: 20 | BP80: 20 | BQ80: 20 | BR80: 20 | BS80: 20 | BT80: 20 | BU80: 20 | BV80: 20 | BW80: 20 | BX80: 20 | BY80: 20 | BZ80: 20 | CA80: 20 | CB80: 20 | CC80: 20 | CD80: 20 | CE80: 20 | CF80: 20 | CG80: 20 | CH80: 20 | CI80: 20 | CJ80: 20 | CK80: 20 | CL80: 20 | CM80: 20 | CN80: 20 | CO80: 20 | CP80: 20 | CQ80: 20 | CR80: 20 | CS80: 20 | CT80: 20 | CU80: 20 | CV80: 20 | CW80: =FIB(RC[-100]) -> 10946 | CX80: =FIB(RC[-100]) -> 10946 | CY80: =FIB(RC[-100]) -> 10946 | CZ80: =FIB(RC[-100]) -> 10946 | DA80: =FIB(RC[-100]) -> 10946 | DB80: =FIB(RC[-100]) -> 10946 | DC80: =FIB(RC[-100]) -> 10946 | DD80: =FIB(RC[-100]) -> 10946 | DE80: =FIB(RC[-100]) -> 10946 | DF80: =FIB(RC[-100]) -> 10946 | DG80: =FIB(RC[-100]) -> 10946 | DH80: =FIB(RC[-100]) -> 10946 | DI80: =FIB(RC[-100]) -> 10946 | DJ80: =FIB(RC[-100]) -> 10946 | DK80: =FIB(RC[-100]) -> 10946 | DL80: =FIB(RC[-100]) -> 10946 | DM80: =FIB(RC[-100]) -> 10946 | DN80: =FIB(RC[-100]) -> 10946 | DO80: =FIB(RC[-100]) -> 10946 | DP80: =FIB(RC[-100]) -> 10946 | DQ80: =FIB(RC[-100]) -> 10946 | DR80: =FIB(RC[-100]) -> 10946 | DS80: =FIB(RC[-100]) -> 10946 | DT80: =FIB(RC[-100]) -> 10946 | DU80: =FIB(RC[-100]) -> 10946 | DV80: =FIB(RC[-100]) -> 10946 | DW80: =FIB(RC[-100]) -> 10946 | DX80: =FIB(RC[-100]) -> 10946 | DY80: =FIB(RC[-100]) -> 10946 | DZ80: =FIB(RC[-100]) -> 10946 | EA80: =FIB(RC[-100]) -> 10946 | EB80: =FIB(RC[-100]) -> 10946 | EC80: =FIB(RC[-100]) -> 10946 | ED80: =FIB(RC[-100]) -> 10946 | EE80: =FIB(RC[-100]) -> 10946 | EF80: =FIB(RC[-100]) -> 10946 | EG80: =FIB(RC[-100]) -> 10946 | EH80: =FIB(RC[-100]) -> 10946 | EI80: =FIB(RC[-100]) -> 10946 | EJ80: =FIB(RC[-100]) -> 10946 | EK80: =FIB(RC[-100]) -> 10946 | EL80: =FIB(RC[-100]) -> 10946 | EM80: =FIB(RC[-100]) -> 10946 | EN80: =FIB(RC[-100]) -> 10946 | EO80: =FIB(RC[-100]) -> 10946 | EP80: =FIB(RC[-100]) -> 10946 | EQ80: =FIB(RC[-100]) -> 10946 | ER80: =FIB(RC[-100]) -> 10946 | ES80: =FIB(RC[-100]) -> 10946 | ET80: =FIB(RC[-100]) -> 10946 | EU80: =FIB(RC[-100]) -> 10946 | EV80: =FIB(RC[-100]) -> 10946 | EW80: =FIB(RC[-100]) -> 10946 | EX80: =FIB(RC[-100]) -> 10946 | EY80: =FIB(RC[-100]) -> 10946 | EZ80: =FIB(RC[-100]) -> 10946 | FA80: =FIB(RC[-100]) -> 10946 | FB80: =FIB(RC[-100]) -> 10946 | FC80: =FIB(RC[-100]) -> 10946 | FD80: =FIB(RC[-100]) -> 10946 | FE80: =FIB(RC[-100]) -> 10946 | FF80: =FIB(RC[-100]) -> 10946 | FG80: =FIB(RC[-100]) -> 10946 | FH80: =FIB(RC[-100]) -> 10946 | FI80: =FIB(RC[-100]) -> 10946 | FJ80: =FIB(RC[-100]) -> 10946 | FK80: =FIB(RC[-100]) -> 10946 | FL80: =FIB(RC[-100]) -> 10946 | FM80: =FIB(RC[-100]) -> 10946 | FN80: =FIB(RC[-100]) -> 10946 | FO80: =FIB(RC[-100]) -> 10946 | FP80: =FIB(RC[-100]) -> 10946 | FQ80: =FIB(RC[-100]) -> 10946 | FR80: =FIB(RC[-100]) -> 10946 | FS80: =FIB(RC[-100]) -> 10946 | FT80: =FIB(RC[-100]) -> 10946 | FU80: =FIB(RC[-100]) -> 10946 | FV80: =FIB(RC[-100]) -> 10946 | FW80: =FIB(RC[-100]) -> 10946 | FX80: =FIB(RC[-100]) -> 10946 | FY80: =FIB(RC[-100]) -> 10946 | FZ80: =FIB(RC[-100]) -> 10946 | GA80: =FIB(RC[-100]) -> 10946 | GB80: =FIB(RC[-100]) -> 10946 | GC80: =FIB(RC[-100]) -> 10946 | GD80: =FIB(RC[-100]) -> 10946 | GE80: =FIB(RC[-100]) -> 10946 | GF80: =FIB(RC[-100]) -> 10946 | GG80: =FIB(RC[-100]) -> 10946 | GH80: =FIB(RC[-100]) -> 10946 | GI80: =FIB(RC[-100]) -> 10946 | GJ80: =FIB(RC[-100]) -> 10946 | GK80: =FIB(RC[-100]) -> 10946 | GL80: =FIB(RC[-100]) -> 10946 | GM80: =FIB(RC[-100]) -> 10946 | GN80: =FIB(RC[-100]) -> 10946 | GO80: =FIB(RC[-100]) -> 10946 | GP80: =FIB(RC[-100]) -> 10946 | GQ80: =FIB(RC[-100]) -> 10946 | GR80: =FIB(RC[-100]) -> 10946
A81: 20 | B81: 20 | C81: 20 | D81: 20 | E81: 20 | F81: 20 | G81: 20 | H81: 20 | I81: 20 | J81: 20 | K81: 20 | L81: 20 | M81: 20 | N81: 20 | O81: 20 | P81: 20 | Q81: 20 | R81: 20 | S81: 20 | T81: 20 | U81: 20 | V81: 20 | W81: 20 | X81: 20 | Y81: 20 | Z81: 20 | AA81: 20 | AB81: 20 | AC81: 20 | AD81: 20 | AE81: 20 | AF81: 20 | AG81: 20 | AH81: 20 | AI81: 20 | AJ81: 20 | AK81: 20 | AL81: 20 | AM81: 20 | AN81: 20 | AO81: 20 | AP81: 20 | AQ81: 20 | AR81: 20 | AS81: 20 | AT81: 20 | AU81: 20 | AV81: 20 | AW81: 20 | AX81: 20 | AY81: 20 | AZ81: 20 | BA81: 20 | BB81: 20 | BC81: 20 | BD81: 20 | BE81: 20 | BF81: 20 | BG81: 20 | BH81: 20 | BI81: 20 | BJ81: 20 | BK81: 20 | BL81: 20 | BM81: 20 | BN81: 20 | BO81: 20 | BP81: 20 | BQ81: 20 | BR81: 20 | BS81: 20 | BT81: 20 | BU81: 20 | BV81: 20 | BW81: 20 | BX81: 20 | BY81: 20 | BZ81: 20 | CA81: 20 | CB81: 20 | CC81: 20 | CD81: 20 | CE81: 20 | CF81: 20 | CG81: 20 | CH81: 20 | CI81: 20 | CJ81: 20 | CK81: 20 | CL81: 20 | CM81: 20 | CN81: 20 | CO81: 20 | CP81: 20 | CQ81: 20 | CR81: 20 | CS81: 20 | CT81: 20 | CU81: 20 | CV81: 20 | CW81: =FIB(RC[-100]) -> 10946 | CX81: =FIB(RC[-100]) -> 10946 | CY81: =FIB(RC[-100]) -> 10946 | CZ81: =FIB(RC[-100]) -> 10946 | DA81: =FIB(RC[-100]) -> 10946 | DB81: =FIB(RC[-100]) -> 10946 | DC81: =FIB(RC[-100]) -> 10946 | DD81: =FIB(RC[-100]) -> 10946 | DE81: =FIB(RC[-100]) -> 10946 | DF81: =FIB(RC[-100]) -> 10946 | DG81: =FIB(RC[-100]) -> 10946 | DH81: =FIB(RC[-100]) -> 10946 | DI81: =FIB(RC[-100]) -> 10946 | DJ81: =FIB(RC[-100]) -> 10946 | DK81: =FIB(RC[-100]) -> 10946 | DL81: =FIB(RC[-100]) -> 10946 | DM81: =FIB(RC[-100]) -> 10946 | DN81: =FIB(RC[-100]) -> 10946 | DO81: =FIB(RC[-100]) -> 10946 | DP81: =FIB(RC[-100]) -> 10946 | DQ81: =FIB(RC[-100]) -> 10946 | DR81: =FIB(RC[-100]) -> 10946 | DS81: =FIB(RC[-100]) -> 10946 | DT81: =FIB(RC[-100]) -> 10946 | DU81: =FIB(RC[-100]) -> 10946 | DV81: =FIB(RC[-100]) -> 10946 | DW81: =FIB(RC[-100]) -> 10946 | DX81: =FIB(RC[-100]) -> 10946 | DY81: =FIB(RC[-100]) -> 10946 | DZ81: =FIB(RC[-100]) -> 10946 | EA81: =FIB(RC[-100]) -> 10946 | EB81: =FIB(RC[-100]) -> 10946 | EC81: =FIB(RC[-100]) -> 10946 | ED81: =FIB(RC[-100]) -> 10946 | EE81: =FIB(RC[-100]) -> 10946 | EF81: =FIB(RC[-100]) -> 10946 | EG81: =FIB(RC[-100]) -> 10946 | EH81: =FIB(RC[-100]) -> 10946 | EI81: =FIB(RC[-100]) -> 10946 | EJ81: =FIB(RC[-100]) -> 10946 | EK81: =FIB(RC[-100]) -> 10946 | EL81: =FIB(RC[-100]) -> 10946 | EM81: =FIB(RC[-100]) -> 10946 | EN81: =FIB(RC[-100]) -> 10946 | EO81: =FIB(RC[-100]) -> 10946 | EP81: =FIB(RC[-100]) -> 10946 | EQ81: =FIB(RC[-100]) -> 10946 | ER81: =FIB(RC[-100]) -> 10946 | ES81: =FIB(RC[-100]) -> 10946 | ET81: =FIB(RC[-100]) -> 10946 | EU81: =FIB(RC[-100]) -> 10946 | EV81: =FIB(RC[-100]) -> 10946 | EW81: =FIB(RC[-100]) -> 10946 | EX81: =FIB(RC[-100]) -> 10946 | EY81: =FIB(RC[-100]) -> 10946 | EZ81: =FIB(RC[-100]) -> 10946 | FA81: =FIB(RC[-100]) -> 10946 | FB81: =FIB(RC[-100]) -> 10946 | FC81: =FIB(RC[-100]) -> 10946 | FD81: =FIB(RC[-100]) -> 10946 | FE81: =FIB(RC[-100]) -> 10946 | FF81: =FIB(RC[-100]) -> 10946 | FG81: =FIB(RC[-100]) -> 10946 | FH81: =FIB(RC[-100]) -> 10946 | FI81: =FIB(RC[-100]) -> 10946 | FJ81: =FIB(RC[-100]) -> 10946 | FK81: =FIB(RC[-100]) -> 10946 | FL81: =FIB(RC[-100]) -> 10946 | FM81: =FIB(RC[-100]) -> 10946 | FN81: =FIB(RC[-100]) -> 10946 | FO81: =FIB(RC[-100]) -> 10946 | FP81: =FIB(RC[-100]) -> 10946 | FQ81: =FIB(RC[-100]) -> 10946 | FR81: =FIB(RC[-100]) -> 10946 | FS81: =FIB(RC[-100]) -> 10946 | FT81: =FIB(RC[-100]) -> 10946 | FU81: =FIB(RC[-100]) -> 10946 | FV81: =FIB(RC[-100]) -> 10946 | FW81: =FIB(RC[-100]) -> 10946 | FX81: =FIB(RC[-100]) -> 10946 | FY81: =FIB(RC[-100]) -> 10946 | FZ81: =FIB(RC[-100]) -> 10946 | GA81: =FIB(RC[-100]) -> 10946 | GB81: =FIB(RC[-100]) -> 10946 | GC81: =FIB(RC[-100]) -> 10946 | GD81: =FIB(RC[-100]) -> 10946 | GE81: =FIB(RC[-100]) -> 10946 | GF81: =FIB(RC[-100]) -> 10946 | GG81: =FIB(RC[-100]) -> 10946 | GH81: =FIB(RC[-100]) -> 10946 | GI81: =FIB(RC[-100]) -> 10946 | GJ81: =FIB(RC[-100]) -> 10946 | GK81: =FIB(RC[-100]) -> 10946 | GL81: =FIB(RC[-100]) -> 10946 | GM81: =FIB(RC[-100]) -> 10946 | GN81: =FIB(RC[-100]) -> 10946 | GO81: =FIB(RC[-100]) -> 10946 | GP81: =FIB(RC[-100]) -> 10946 | GQ81: =FIB(RC[-100]) -> 10946 | GR81: =FIB(RC[-100]) -> 10946
A82: 20 | B82: 20 | C82: 20 | D82: 20 | E82: 20 | F82: 20 | G82: 20 | H82: 20 | I82: 20 | J82: 20 | K82: 20 | L82: 20 | M82: 20 | N82: 20 | O82: 20 | P82: 20 | Q82: 20 | R82: 20 | S82: 20 | T82: 20 | U82: 20 | V82: 20 | W82: 20 | X82: 20 | Y82: 20 | Z82: 20 | AA82: 20 | AB82: 20 | AC82: 20 | AD82: 20 | AE82: 20 | AF82: 20 | AG82: 20 | AH82: 20 | AI82: 20 | AJ82: 20 | AK82: 20 | AL82: 20 | AM82: 20 | AN82: 20 | AO82: 20 | AP82: 20 | AQ82: 20 | AR82: 20 | AS82: 20 | AT82: 20 | AU82: 20 | AV82: 20 | AW82: 20 | AX82: 20 | AY82: 20 | AZ82: 20 | BA82: 20 | BB82: 20 | BC82: 20 | BD82: 20 | BE82: 20 | BF82: 20 | BG82: 20 | BH82: 20 | BI82: 20 | BJ82: 20 | BK82: 20 | BL82: 20 | BM82: 20 | BN82: 20 | BO82: 20 | BP82: 20 | BQ82: 20 | BR82: 20 | BS82: 20 | BT82: 20 | BU82: 20 | BV82: 20 | BW82: 20 | BX82: 20 | BY82: 20 | BZ82: 20 | CA82: 20 | CB82: 20 | CC82: 20 | CD82: 20 | CE82: 20 | CF82: 20 | CG82: 20 | CH82: 20 | CI82: 20 | CJ82: 20 | CK82: 20 | CL82: 20 | CM82: 20 | CN82: 20 | CO82: 20 | CP82: 20 | CQ82: 20 | CR82: 20 | CS82: 20 | CT82: 20 | CU82: 20 | CV82: 20 | CW82: =FIB(RC[-100]) -> 10946 | CX82: =FIB(RC[-100]) -> 10946 | CY82: =FIB(RC[-100]) -> 10946 | CZ82: =FIB(RC[-100]) -> 10946 | DA82: =FIB(RC[-100]) -> 10946 | DB82: =FIB(RC[-100]) -> 10946 | DC82: =FIB(RC[-100]) -> 10946 | DD82: =FIB(RC[-100]) -> 10946 | DE82: =FIB(RC[-100]) -> 10946 | DF82: =FIB(RC[-100]) -> 10946 | DG82: =FIB(RC[-100]) -> 10946 | DH82: =FIB(RC[-100]) -> 10946 | DI82: =FIB(RC[-100]) -> 10946 | DJ82: =FIB(RC[-100]) -> 10946 | DK82: =FIB(RC[-100]) -> 10946 | DL82: =FIB(RC[-100]) -> 10946 | DM82: =FIB(RC[-100]) -> 10946 | DN82: =FIB(RC[-100]) -> 10946 | DO82: =FIB(RC[-100]) -> 10946 | DP82: =FIB(RC[-100]) -> 10946 | DQ82: =FIB(RC[-100]) -> 10946 | DR82: =FIB(RC[-100]) -> 10946 | DS82: =FIB(RC[-100]) -> 10946 | DT82: =FIB(RC[-100]) -> 10946 | DU82: =FIB(RC[-100]) -> 10946 | DV82: =FIB(RC[-100]) -> 10946 | DW82: =FIB(RC[-100]) -> 10946 | DX82: =FIB(RC[-100]) -> 10946 | DY82: =FIB(RC[-100]) -> 10946 | DZ82: =FIB(RC[-100]) -> 10946 | EA82: =FIB(RC[-100]) -> 10946 | EB82: =FIB(RC[-100]) -> 10946 | EC82: =FIB(RC[-100]) -> 10946 | ED82: =FIB(RC[-100]) -> 10946 | EE82: =FIB(RC[-100]) -> 10946 | EF82: =FIB(RC[-100]) -> 10946 | EG82: =FIB(RC[-100]) -> 10946 | EH82: =FIB(RC[-100]) -> 10946 | EI82: =FIB(RC[-100]) -> 10946 | EJ82: =FIB(RC[-100]) -> 10946 | EK82: =FIB(RC[-100]) -> 10946 | EL82: =FIB(RC[-100]) -> 10946 | EM82: =FIB(RC[-100]) -> 10946 | EN82: =FIB(RC[-100]) -> 10946 | EO82: =FIB(RC[-100]) -> 10946 | EP82: =FIB(RC[-100]) -> 10946 | EQ82: =FIB(RC[-100]) -> 10946 | ER82: =FIB(RC[-100]) -> 10946 | ES82: =FIB(RC[-100]) -> 10946 | ET82: =FIB(RC[-100]) -> 10946 | EU82: =FIB(RC[-100]) -> 10946 | EV82: =FIB(RC[-100]) -> 10946 | EW82: =FIB(RC[-100]) -> 10946 | EX82: =FIB(RC[-100]) -> 10946 | EY82: =FIB(RC[-100]) -> 10946 | EZ82: =FIB(RC[-100]) -> 10946 | FA82: =FIB(RC[-100]) -> 10946 | FB82: =FIB(RC[-100]) -> 10946 | FC82: =FIB(RC[-100]) -> 10946 | FD82: =FIB(RC[-100]) -> 10946 | FE82: =FIB(RC[-100]) -> 10946 | FF82: =FIB(RC[-100]) -> 10946 | FG82: =FIB(RC[-100]) -> 10946 | FH82: =FIB(RC[-100]) -> 10946 | FI82: =FIB(RC[-100]) -> 10946 | FJ82: =FIB(RC[-100]) -> 10946 | FK82: =FIB(RC[-100]) -> 10946 | FL82: =FIB(RC[-100]) -> 10946 | FM82: =FIB(RC[-100]) -> 10946 | FN82: =FIB(RC[-100]) -> 10946 | FO82: =FIB(RC[-100]) -> 10946 | FP82: =FIB(RC[-100]) -> 10946 | FQ82: =FIB(RC[-100]) -> 10946 | FR82: =FIB(RC[-100]) -> 10946 | FS82: =FIB(RC[-100]) -> 10946 | FT82: =FIB(RC[-100]) -> 10946 | FU82: =FIB(RC[-100]) -> 10946 | FV82: =FIB(RC[-100]) -> 10946 | FW82: =FIB(RC[-100]) -> 10946 | FX82: =FIB(RC[-100]) -> 10946 | FY82: =FIB(RC[-100]) -> 10946 | FZ82: =FIB(RC[-100]) -> 10946 | GA82: =FIB(RC[-100]) -> 10946 | GB82: =FIB(RC[-100]) -> 10946 | GC82: =FIB(RC[-100]) -> 10946 | GD82: =FIB(RC[-100]) -> 10946 | GE82: =FIB(RC[-100]) -> 10946 | GF82: =FIB(RC[-100]) -> 10946 | GG82: =FIB(RC[-100]) -> 10946 | GH82: =FIB(RC[-100]) -> 10946 | GI82: =FIB(RC[-100]) -> 10946 | GJ82: =FIB(RC[-100]) -> 10946 | GK82: =FIB(RC[-100]) -> 10946 | GL82: =FIB(RC[-100]) -> 10946 | GM82: =FIB(RC[-100]) -> 10946 | GN82: =FIB(RC[-100]) -> 10946 | GO82: =FIB(RC[-100]) -> 10946 | GP82: =FIB(RC[-100]) -> 10946 | GQ82: =FIB(RC[-100]) -> 10946 | GR82: =FIB(RC[-100]) -> 10946
A83: 20 | B83: 20 | C83: 20 | D83: 20 | E83: 20 | F83: 20 | G83: 20 | H83: 20 | I83: 20 | J83: 20 | K83: 20 | L83: 20 | M83: 20 | N83: 20 | O83: 20 | P83: 20 | Q83: 20 | R83: 20 | S83: 20 | T83: 20 | U83: 20 | V83: 20 | W83: 20 | X83: 20 | Y83: 20 | Z83: 20 | AA83: 20 | AB83: 20 | AC83: 20 | AD83: 20 | AE83: 20 | AF83: 20 | AG83: 20 | AH83: 20 | AI83: 20 | AJ83: 20 | AK83: 20 | AL83: 20 | AM83: 20 | AN83: 20 | AO83: 20 | AP83: 20 | AQ83: 20 | AR83: 20 | AS83: 20 | AT83: 20 | AU83: 20 | AV83: 20 | AW83: 20 | AX83: 20 | AY83: 20 | AZ83: 20 | BA83: 20 | BB83: 20 | BC83: 20 | BD83: 20 | BE83: 20 | BF83: 20 | BG83: 20 | BH83: 20 | BI83: 20 | BJ83: 20 | BK83: 20 | BL83: 20 | BM83: 20 | BN83: 20 | BO83: 20 | BP83: 20 | BQ83: 20 | BR83: 20 | BS83: 20 | BT83: 20 | BU83: 20 | BV83: 20 | BW83: 20 | BX83: 20 | BY83: 20 | BZ83: 20 | CA83: 20 | CB83: 20 | CC83: 20 | CD83: 20 | CE83: 20 | CF83: 20 | CG83: 20 | CH83: 20 | CI83: 20 | CJ83: 20 | CK83: 20 | CL83: 20 | CM83: 20 | CN83: 20 | CO83: 20 | CP83: 20 | CQ83: 20 | CR83: 20 | CS83: 20 | CT83: 20 | CU83: 20 | CV83: 20 | CW83: =FIB(RC[-100]) -> 10946 | CX83: =FIB(RC[-100]) -> 10946 | CY83: =FIB(RC[-100]) -> 10946 | CZ83: =FIB(RC[-100]) -> 10946 | DA83: =FIB(RC[-100]) -> 10946 | DB83: =FIB(RC[-100]) -> 10946 | DC83: =FIB(RC[-100]) -> 10946 | DD83: =FIB(RC[-100]) -> 10946 | DE83: =FIB(RC[-100]) -> 10946 | DF83: =FIB(RC[-100]) -> 10946 | DG83: =FIB(RC[-100]) -> 10946 | DH83: =FIB(RC[-100]) -> 10946 | DI83: =FIB(RC[-100]) -> 10946 | DJ83: =FIB(RC[-100]) -> 10946 | DK83: =FIB(RC[-100]) -> 10946 | DL83: =FIB(RC[-100]) -> 10946 | DM83: =FIB(RC[-100]) -> 10946 | DN83: =FIB(RC[-100]) -> 10946 | DO83: =FIB(RC[-100]) -> 10946 | DP83: =FIB(RC[-100]) -> 10946 | DQ83: =FIB(RC[-100]) -> 10946 | DR83: =FIB(RC[-100]) -> 10946 | DS83: =FIB(RC[-100]) -> 10946 | DT83: =FIB(RC[-100]) -> 10946 | DU83: =FIB(RC[-100]) -> 10946 | DV83: =FIB(RC[-100]) -> 10946 | DW83: =FIB(RC[-100]) -> 10946 | DX83: =FIB(RC[-100]) -> 10946 | DY83: =FIB(RC[-100]) -> 10946 | DZ83: =FIB(RC[-100]) -> 10946 | EA83: =FIB(RC[-100]) -> 10946 | EB83: =FIB(RC[-100]) -> 10946 | EC83: =FIB(RC[-100]) -> 10946 | ED83: =FIB(RC[-100]) -> 10946 | EE83: =FIB(RC[-100]) -> 10946 | EF83: =FIB(RC[-100]) -> 10946 | EG83: =FIB(RC[-100]) -> 10946 | EH83: =FIB(RC[-100]) -> 10946 | EI83: =FIB(RC[-100]) -> 10946 | EJ83: =FIB(RC[-100]) -> 10946 | EK83: =FIB(RC[-100]) -> 10946 | EL83: =FIB(RC[-100]) -> 10946 | EM83: =FIB(RC[-100]) -> 10946 | EN83: =FIB(RC[-100]) -> 10946 | EO83: =FIB(RC[-100]) -> 10946 | EP83: =FIB(RC[-100]) -> 10946 | EQ83: =FIB(RC[-100]) -> 10946 | ER83: =FIB(RC[-100]) -> 10946 | ES83: =FIB(RC[-100]) -> 10946 | ET83: =FIB(RC[-100]) -> 10946 | EU83: =FIB(RC[-100]) -> 10946 | EV83: =FIB(RC[-100]) -> 10946 | EW83: =FIB(RC[-100]) -> 10946 | EX83: =FIB(RC[-100]) -> 10946 | EY83: =FIB(RC[-100]) -> 10946 | EZ83: =FIB(RC[-100]) -> 10946 | FA83: =FIB(RC[-100]) -> 10946 | FB83: =FIB(RC[-100]) -> 10946 | FC83: =FIB(RC[-100]) -> 10946 | FD83: =FIB(RC[-100]) -> 10946 | FE83: =FIB(RC[-100]) -> 10946 | FF83: =FIB(RC[-100]) -> 10946 | FG83: =FIB(RC[-100]) -> 10946 | FH83: =FIB(RC[-100]) -> 10946 | FI83: =FIB(RC[-100]) -> 10946 | FJ83: =FIB(RC[-100]) -> 10946 | FK83: =FIB(RC[-100]) -> 10946 | FL83: =FIB(RC[-100]) -> 10946 | FM83: =FIB(RC[-100]) -> 10946 | FN83: =FIB(RC[-100]) -> 10946 | FO83: =FIB(RC[-100]) -> 10946 | FP83: =FIB(RC[-100]) -> 10946 | FQ83: =FIB(RC[-100]) -> 10946 | FR83: =FIB(RC[-100]) -> 10946 | FS83: =FIB(RC[-100]) -> 10946 | FT83: =FIB(RC[-100]) -> 10946 | FU83: =FIB(RC[-100]) -> 10946 | FV83: =FIB(RC[-100]) -> 10946 | FW83: =FIB(RC[-100]) -> 10946 | FX83: =FIB(RC[-100]) -> 10946 | FY83: =FIB(RC[-100]) -> 10946 | FZ83: =FIB(RC[-100]) -> 10946 | GA83: =FIB(RC[-100]) -> 10946 | GB83: =FIB(RC[-100]) -> 10946 | GC83: =FIB(RC[-100]) -> 10946 | GD83: =FIB(RC[-100]) -> 10946 | GE83: =FIB(RC[-100]) -> 10946 | GF83: =FIB(RC[-100]) -> 10946 | GG83: =FIB(RC[-100]) -> 10946 | GH83: =FIB(RC[-100]) -> 10946 | GI83: =FIB(RC[-100]) -> 10946 | GJ83: =FIB(RC[-100]) -> 10946 | GK83: =FIB(RC[-100]) -> 10946 | GL83: =FIB(RC[-100]) -> 10946 | GM83: =FIB(RC[-100]) -> 10946 | GN83: =FIB(RC[-100]) -> 10946 | GO83: =FIB(RC[-100]) -> 10946 | GP83: =FIB(RC[-100]) -> 10946 | GQ83: =FIB(RC[-100]) -> 10946 | GR83: =FIB(RC[-100]) -> 10946
A84: 20 | B84: 20 | C84: 20 | D84: 20 | E84: 20 | F84: 20 | G84: 20 | H84: 20 | I84: 20 | J84: 20 | K84: 20 | L84: 20 | M84: 20 | N84: 20 | O84: 20 | P84: 20 | Q84: 20 | R84: 20 | S84: 20 | T84: 20 | U84: 20 | V84: 20 | W84: 20 | X84: 20 | Y84: 20 | Z84: 20 | AA84: 20 | AB84: 20 | AC84: 20 | AD84: 20 | AE84: 20 | AF84: 20 | AG84: 20 | AH84: 20 | AI84: 20 | AJ84: 20 | AK84: 20 | AL84: 20 | AM84: 20 | AN84: 20 | AO84: 20 | AP84: 20 | AQ84: 20 | AR84: 20 | AS84: 20 | AT84: 20 | AU84: 20 | AV84: 20 | AW84: 20 | AX84: 20 | AY84: 20 | AZ84: 20 | BA84: 20 | BB84: 20 | BC84: 20 | BD84: 20 | BE84: 20 | BF84: 20 | BG84: 20 | BH84: 20 | BI84: 20 | BJ84: 20 | BK84: 20 | BL84: 20 | BM84: 20 | BN84: 20 | BO84: 20 | BP84: 20 | BQ84: 20 | BR84: 20 | BS84: 20 | BT84: 20 | BU84: 20 | BV84: 20 | BW84: 20 | BX84: 20 | BY84: 20 | BZ84: 20 | CA84: 20 | CB84: 20 | CC84: 20 | CD84: 20 | CE84: 20 | CF84: 20 | CG84: 20 | CH84: 20 | CI84: 20 | CJ84: 20 | CK84: 20 | CL84: 20 | CM84: 20 | CN84: 20 | CO84: 20 | CP84: 20 | CQ84: 20 | CR84: 20 | CS84: 20 | CT84: 20 | CU84: 20 | CV84: 20 | CW84: =FIB(RC[-100]) -> 10946 | CX84: =FIB(RC[-100]) -> 10946 | CY84: =FIB(RC[-100]) -> 10946 | CZ84: =FIB(RC[-100]) -> 10946 | DA84: =FIB(RC[-100]) -> 10946 | DB84: =FIB(RC[-100]) -> 10946 | DC84: =FIB(RC[-100]) -> 10946 | DD84: =FIB(RC[-100]) -> 10946 | DE84: =FIB(RC[-100]) -> 10946 | DF84: =FIB(RC[-100]) -> 10946 | DG84: =FIB(RC[-100]) -> 10946 | DH84: =FIB(RC[-100]) -> 10946 | DI84: =FIB(RC[-100]) -> 10946 | DJ84: =FIB(RC[-100]) -> 10946 | DK84: =FIB(RC[-100]) -> 10946 | DL84: =FIB(RC[-100]) -> 10946 | DM84: =FIB(RC[-100]) -> 10946 | DN84: =FIB(RC[-100]) -> 10946 | DO84: =FIB(RC[-100]) -> 10946 | DP84: =FIB(RC[-100]) -> 10946 | DQ84: =FIB(RC[-100]) -> 10946 | DR84: =FIB(RC[-100]) -> 10946 | DS84: =FIB(RC[-100]) -> 10946 | DT84: =FIB(RC[-100]) -> 10946 | DU84: =FIB(RC[-100]) -> 10946 | DV84: =FIB(RC[-100]) -> 10946 | DW84: =FIB(RC[-100]) -> 10946 | DX84: =FIB(RC[-100]) -> 10946 | DY84: =FIB(RC[-100]) -> 10946 | DZ84: =FIB(RC[-100]) -> 10946 | EA84: =FIB(RC[-100]) -> 10946 | EB84: =FIB(RC[-100]) -> 10946 | EC84: =FIB(RC[-100]) -> 10946 | ED84: =FIB(RC[-100]) -> 10946 | EE84: =FIB(RC[-100]) -> 10946 | EF84: =FIB(RC[-100]) -> 10946 | EG84: =FIB(RC[-100]) -> 10946 | EH84: =FIB(RC[-100]) -> 10946 | EI84: =FIB(RC[-100]) -> 10946 | EJ84: =FIB(RC[-100]) -> 10946 | EK84: =FIB(RC[-100]) -> 10946 | EL84: =FIB(RC[-100]) -> 10946 | EM84: =FIB(RC[-100]) -> 10946 | EN84: =FIB(RC[-100]) -> 10946 | EO84: =FIB(RC[-100]) -> 10946 | EP84: =FIB(RC[-100]) -> 10946 | EQ84: =FIB(RC[-100]) -> 10946 | ER84: =FIB(RC[-100]) -> 10946 | ES84: =FIB(RC[-100]) -> 10946 | ET84: =FIB(RC[-100]) -> 10946 | EU84: =FIB(RC[-100]) -> 10946 | EV84: =FIB(RC[-100]) -> 10946 | EW84: =FIB(RC[-100]) -> 10946 | EX84: =FIB(RC[-100]) -> 10946 | EY84: =FIB(RC[-100]) -> 10946 | EZ84: =FIB(RC[-100]) -> 10946 | FA84: =FIB(RC[-100]) -> 10946 | FB84: =FIB(RC[-100]) -> 10946 | FC84: =FIB(RC[-100]) -> 10946 | FD84: =FIB(RC[-100]) -> 10946 | FE84: =FIB(RC[-100]) -> 10946 | FF84: =FIB(RC[-100]) -> 10946 | FG84: =FIB(RC[-100]) -> 10946 | FH84: =FIB(RC[-100]) -> 10946 | FI84: =FIB(RC[-100]) -> 10946 | FJ84: =FIB(RC[-100]) -> 10946 | FK84: =FIB(RC[-100]) -> 10946 | FL84: =FIB(RC[-100]) -> 10946 | FM84: =FIB(RC[-100]) -> 10946 | FN84: =FIB(RC[-100]) -> 10946 | FO84: =FIB(RC[-100]) -> 10946 | FP84: =FIB(RC[-100]) -> 10946 | FQ84: =FIB(RC[-100]) -> 10946 | FR84: =FIB(RC[-100]) -> 10946 | FS84: =FIB(RC[-100]) -> 10946 | FT84: =FIB(RC[-100]) -> 10946 | FU84: =FIB(RC[-100]) -> 10946 | FV84: =FIB(RC[-100]) -> 10946 | FW84: =FIB(RC[-100]) -> 10946 | FX84: =FIB(RC[-100]) -> 10946 | FY84: =FIB(RC[-100]) -> 10946 | FZ84: =FIB(RC[-100]) -> 10946 | GA84: =FIB(RC[-100]) -> 10946 | GB84: =FIB(RC[-100]) -> 10946 | GC84: =FIB(RC[-100]) -> 10946 | GD84: =FIB(RC[-100]) -> 10946 | GE84: =FIB(RC[-100]) -> 10946 | GF84: =FIB(RC[-100]) -> 10946 | GG84: =FIB(RC[-100]) -> 10946 | GH84: =FIB(RC[-100]) -> 10946 | GI84: =FIB(RC[-100]) -> 10946 | GJ84: =FIB(RC[-100]) -> 10946 | GK84: =FIB(RC[-100]) -> 10946 | GL84: =FIB(RC[-100]) -> 10946 | GM84: =FIB(RC[-100]) -> 10946 | GN84: =FIB(RC[-100]) -> 10946 | GO84: =FIB(RC[-100]) -> 10946 | GP84: =FIB(RC[-100]) -> 10946 | GQ84: =FIB(RC[-100]) -> 10946 | GR84: =FIB(RC[-100]) -> 10946
A85: 20 | B85: 20 | C85: 20 | D85: 20 | E85: 20 | F85: 20 | G85: 20 | H85: 20 | I85: 20 | J85: 20 | K85: 20 | L85: 20 | M85: 20 | N85: 20 | O85: 20 | P85: 20 | Q85: 20 | R85: 20 | S85: 20 | T85: 20 | U85: 20 | V85: 20 | W85: 20 | X85: 20 | Y85: 20 | Z85: 20 | AA85: 20 | AB85: 20 | AC85: 20 | AD85: 20 | AE85: 20 | AF85: 20 | AG85: 20 | AH85: 20 | AI85: 20 | AJ85: 20 | AK85: 20 | AL85: 20 | AM85: 20 | AN85: 20 | AO85: 20 | AP85: 20 | AQ85: 20 | AR85: 20 | AS85: 20 | AT85: 20 | AU85: 20 | AV85: 20 | AW85: 20 | AX85: 20 | AY85: 20 | AZ85: 20 | BA85: 20 | BB85: 20 | BC85: 20 | BD85: 20 | BE85: 20 | BF85: 20 | BG85: 20 | BH85: 20 | BI85: 20 | BJ85: 20 | BK85: 20 | BL85: 20 | BM85: 20 | BN85: 20 | BO85: 20 | BP85: 20 | BQ85: 20 | BR85: 20 | BS85: 20 | BT85: 20 | BU85: 20 | BV85: 20 | BW85: 20 | BX85: 20 | BY85: 20 | BZ85: 20 | CA85: 20 | CB85: 20 | CC85: 20 | CD85: 20 | CE85: 20 | CF85: 20 | CG85: 20 | CH85: 20 | CI85: 20 | CJ85: 20 | CK85: 20 | CL85: 20 | CM85: 20 | CN85: 20 | CO85: 20 | CP85: 20 | CQ85: 20 | CR85: 20 | CS85: 20 | CT85: 20 | CU85: 20 | CV85: 20 | CW85: =FIB(RC[-100]) -> 10946 | CX85: =FIB(RC[-100]) -> 10946 | CY85: =FIB(RC[-100]) -> 10946 | CZ85: =FIB(RC[-100]) -> 10946 | DA85: =FIB(RC[-100]) -> 10946 | DB85: =FIB(RC[-100]) -> 10946 | DC85: =FIB(RC[-100]) -> 10946 | DD85: =FIB(RC[-100]) -> 10946 | DE85: =FIB(RC[-100]) -> 10946 | DF85: =FIB(RC[-100]) -> 10946 | DG85: =FIB(RC[-100]) -> 10946 | DH85: =FIB(RC[-100]) -> 10946 | DI85: =FIB(RC[-100]) -> 10946 | DJ85: =FIB(RC[-100]) -> 10946 | DK85: =FIB(RC[-100]) -> 10946 | DL85: =FIB(RC[-100]) -> 10946 | DM85: =FIB(RC[-100]) -> 10946 | DN85: =FIB(RC[-100]) -> 10946 | DO85: =FIB(RC[-100]) -> 10946 | DP85: =FIB(RC[-100]) -> 10946 | DQ85: =FIB(RC[-100]) -> 10946 | DR85: =FIB(RC[-100]) -> 10946 | DS85: =FIB(RC[-100]) -> 10946 | DT85: =FIB(RC[-100]) -> 10946 | DU85: =FIB(RC[-100]) -> 10946 | DV85: =FIB(RC[-100]) -> 10946 | DW85: =FIB(RC[-100]) -> 10946 | DX85: =FIB(RC[-100]) -> 10946 | DY85: =FIB(RC[-100]) -> 10946 | DZ85: =FIB(RC[-100]) -> 10946 | EA85: =FIB(RC[-100]) -> 10946 | EB85: =FIB(RC[-100]) -> 10946 | EC85: =FIB(RC[-100]) -> 10946 | ED85: =FIB(RC[-100]) -> 10946 | EE85: =FIB(RC[-100]) -> 10946 | EF85: =FIB(RC[-100]) -> 10946 | EG85: =FIB(RC[-100]) -> 10946 | EH85: =FIB(RC[-100]) -> 10946 | EI85: =FIB(RC[-100]) -> 10946 | EJ85: =FIB(RC[-100]) -> 10946 | EK85: =FIB(RC[-100]) -> 10946 | EL85: =FIB(RC[-100]) -> 10946 | EM85: =FIB(RC[-100]) -> 10946 | EN85: =FIB(RC[-100]) -> 10946 | EO85: =FIB(RC[-100]) -> 10946 | EP85: =FIB(RC[-100]) -> 10946 | EQ85: =FIB(RC[-100]) -> 10946 | ER85: =FIB(RC[-100]) -> 10946 | ES85: =FIB(RC[-100]) -> 10946 | ET85: =FIB(RC[-100]) -> 10946 | EU85: =FIB(RC[-100]) -> 10946 | EV85: =FIB(RC[-100]) -> 10946 | EW85: =FIB(RC[-100]) -> 10946 | EX85: =FIB(RC[-100]) -> 10946 | EY85: =FIB(RC[-100]) -> 10946 | EZ85: =FIB(RC[-100]) -> 10946 | FA85: =FIB(RC[-100]) -> 10946 | FB85: =FIB(RC[-100]) -> 10946 | FC85: =FIB(RC[-100]) -> 10946 | FD85: =FIB(RC[-100]) -> 10946 | FE85: =FIB(RC[-100]) -> 10946 | FF85: =FIB(RC[-100]) -> 10946 | FG85: =FIB(RC[-100]) -> 10946 | FH85: =FIB(RC[-100]) -> 10946 | FI85: =FIB(RC[-100]) -> 10946 | FJ85: =FIB(RC[-100]) -> 10946 | FK85: =FIB(RC[-100]) -> 10946 | FL85: =FIB(RC[-100]) -> 10946 | FM85: =FIB(RC[-100]) -> 10946 | FN85: =FIB(RC[-100]) -> 10946 | FO85: =FIB(RC[-100]) -> 10946 | FP85: =FIB(RC[-100]) -> 10946 | FQ85: =FIB(RC[-100]) -> 10946 | FR85: =FIB(RC[-100]) -> 10946 | FS85: =FIB(RC[-100]) -> 10946 | FT85: =FIB(RC[-100]) -> 10946 | FU85: =FIB(RC[-100]) -> 10946 | FV85: =FIB(RC[-100]) -> 10946 | FW85: =FIB(RC[-100]) -> 10946 | FX85: =FIB(RC[-100]) -> 10946 | FY85: =FIB(RC[-100]) -> 10946 | FZ85: =FIB(RC[-100]) -> 10946 | GA85: =FIB(RC[-100]) -> 10946 | GB85: =FIB(RC[-100]) -> 10946 | GC85: =FIB(RC[-100]) -> 10946 | GD85: =FIB(RC[-100]) -> 10946 | GE85: =FIB(RC[-100]) -> 10946 | GF85: =FIB(RC[-100]) -> 10946 | GG85: =FIB(RC[-100]) -> 10946 | GH85: =FIB(RC[-100]) -> 10946 | GI85: =FIB(RC[-100]) -> 10946 | GJ85: =FIB(RC[-100]) -> 10946 | GK85: =FIB(RC[-100]) -> 10946 | GL85: =FIB(RC[-100]) -> 10946 | GM85: =FIB(RC[-100]) -> 10946 | GN85: =FIB(RC[-100]) -> 10946 | GO85: =FIB(RC[-100]) -> 10946 | GP85: =FIB(RC[-100]) -> 10946 | GQ85: =FIB(RC[-100]) -> 10946 | GR85: =FIB(RC[-100]) -> 10946
A86: 20 | B86: 20 | C86: 20 | D86: 20 | E86: 20 | F86: 20 | G86: 20 | H86: 20 | I86: 20 | J86: 20 | K86: 20 | L86: 20 | M86: 20 | N86: 20 | O86: 20 | P86: 20 | Q86: 20 | R86: 20 | S86: 20 | T86: 20 | U86: 20 | V86: 20 | W86: 20 | X86: 20 | Y86: 20 | Z86: 20 | AA86: 20 | AB86: 20 | AC86: 20 | AD86: 20 | AE86: 20 | AF86: 20 | AG86: 20 | AH86: 20 | AI86: 20 | AJ86: 20 | AK86: 20 | AL86: 20 | AM86: 20 | AN86: 20 | AO86: 20 | AP86: 20 | AQ86: 20 | AR86: 20 | AS86: 20 | AT86: 20 | AU86: 20 | AV86: 20 | AW86: 20 | AX86: 20 | AY86: 20 | AZ86: 20 | BA86: 20 | BB86: 20 | BC86: 20 | BD86: 20 | BE86: 20 | BF86: 20 | BG86: 20 | BH86: 20 | BI86: 20 | BJ86: 20 | BK86: 20 | BL86: 20 | BM86: 20 | BN86: 20 | BO86: 20 | BP86: 20 | BQ86: 20 | BR86: 20 | BS86: 20 | BT86: 20 | BU86: 20 | BV86: 20 | BW86: 20 | BX86: 20 | BY86: 20 | BZ86: 20 | CA86: 20 | CB86: 20 | CC86: 20 | CD86: 20 | CE86: 20 | CF86: 20 | CG86: 20 | CH86: 20 | CI86: 20 | CJ86: 20 | CK86: 20 | CL86: 20 | CM86: 20 | CN86: 20 | CO86: 20 | CP86: 20 | CQ86: 20 | CR86: 20 | CS86: 20 | CT86: 20 | CU86: 20 | CV86: 20 | CW86: =FIB(RC[-100]) -> 10946 | CX86: =FIB(RC[-100]) -> 10946 | CY86: =FIB(RC[-100]) -> 10946 | CZ86: =FIB(RC[-100]) -> 10946 | DA86: =FIB(RC[-100]) -> 10946 | DB86: =FIB(RC[-100]) -> 10946 | DC86: =FIB(RC[-100]) -> 10946 | DD86: =FIB(RC[-100]) -> 10946 | DE86: =FIB(RC[-100]) -> 10946 | DF86: =FIB(RC[-100]) -> 10946 | DG86: =FIB(RC[-100]) -> 10946 | DH86: =FIB(RC[-100]) -> 10946 | DI86: =FIB(RC[-100]) -> 10946 | DJ86: =FIB(RC[-100]) -> 10946 | DK86: =FIB(RC[-100]) -> 10946 | DL86: =FIB(RC[-100]) -> 10946 | DM86: =FIB(RC[-100]) -> 10946 | DN86: =FIB(RC[-100]) -> 10946 | DO86: =FIB(RC[-100]) -> 10946 | DP86: =FIB(RC[-100]) -> 10946 | DQ86: =FIB(RC[-100]) -> 10946 | DR86: =FIB(RC[-100]) -> 10946 | DS86: =FIB(RC[-100]) -> 10946 | DT86: =FIB(RC[-100]) -> 10946 | DU86: =FIB(RC[-100]) -> 10946 | DV86: =FIB(RC[-100]) -> 10946 | DW86: =FIB(RC[-100]) -> 10946 | DX86: =FIB(RC[-100]) -> 10946 | DY86: =FIB(RC[-100]) -> 10946 | DZ86: =FIB(RC[-100]) -> 10946 | EA86: =FIB(RC[-100]) -> 10946 | EB86: =FIB(RC[-100]) -> 10946 | EC86: =FIB(RC[-100]) -> 10946 | ED86: =FIB(RC[-100]) -> 10946 | EE86: =FIB(RC[-100]) -> 10946 | EF86: =FIB(RC[-100]) -> 10946 | EG86: =FIB(RC[-100]) -> 10946 | EH86: =FIB(RC[-100]) -> 10946 | EI86: =FIB(RC[-100]) -> 10946 | EJ86: =FIB(RC[-100]) -> 10946 | EK86: =FIB(RC[-100]) -> 10946 | EL86: =FIB(RC[-100]) -> 10946 | EM86: =FIB(RC[-100]) -> 10946 | EN86: =FIB(RC[-100]) -> 10946 | EO86: =FIB(RC[-100]) -> 10946 | EP86: =FIB(RC[-100]) -> 10946 | EQ86: =FIB(RC[-100]) -> 10946 | ER86: =FIB(RC[-100]) -> 10946 | ES86: =FIB(RC[-100]) -> 10946 | ET86: =FIB(RC[-100]) -> 10946 | EU86: =FIB(RC[-100]) -> 10946 | EV86: =FIB(RC[-100]) -> 10946 | EW86: =FIB(RC[-100]) -> 10946 | EX86: =FIB(RC[-100]) -> 10946 | EY86: =FIB(RC[-100]) -> 10946 | EZ86: =FIB(RC[-100]) -> 10946 | FA86: =FIB(RC[-100]) -> 10946 | FB86: =FIB(RC[-100]) -> 10946 | FC86: =FIB(RC[-100]) -> 10946 | FD86: =FIB(RC[-100]) -> 10946 | FE86: =FIB(RC[-100]) -> 10946 | FF86: =FIB(RC[-100]) -> 10946 | FG86: =FIB(RC[-100]) -> 10946 | FH86: =FIB(RC[-100]) -> 10946 | FI86: =FIB(RC[-100]) -> 10946 | FJ86: =FIB(RC[-100]) -> 10946 | FK86: =FIB(RC[-100]) -> 10946 | FL86: =FIB(RC[-100]) -> 10946 | FM86: =FIB(RC[-100]) -> 10946 | FN86: =FIB(RC[-100]) -> 10946 | FO86: =FIB(RC[-100]) -> 10946 | FP86: =FIB(RC[-100]) -> 10946 | FQ86: =FIB(RC[-100]) -> 10946 | FR86: =FIB(RC[-100]) -> 10946 | FS86: =FIB(RC[-100]) -> 10946 | FT86: =FIB(RC[-100]) -> 10946 | FU86: =FIB(RC[-100]) -> 10946 | FV86: =FIB(RC[-100]) -> 10946 | FW86: =FIB(RC[-100]) -> 10946 | FX86: =FIB(RC[-100]) -> 10946 | FY86: =FIB(RC[-100]) -> 10946 | FZ86: =FIB(RC[-100]) -> 10946 | GA86: =FIB(RC[-100]) -> 10946 | GB86: =FIB(RC[-100]) -> 10946 | GC86: =FIB(RC[-100]) -> 10946 | GD86: =FIB(RC[-100]) -> 10946 | GE86: =FIB(RC[-100]) -> 10946 | GF86: =FIB(RC[-100]) -> 10946 | GG86: =FIB(RC[-100]) -> 10946 | GH86: =FIB(RC[-100]) -> 10946 | GI86: =FIB(RC[-100]) -> 10946 | GJ86: =FIB(RC[-100]) -> 10946 | GK86: =FIB(RC[-100]) -> 10946 | GL86: =FIB(RC[-100]) -> 10946 | GM86: =FIB(RC[-100]) -> 10946 | GN86: =FIB(RC[-100]) -> 10946 | GO86: =FIB(RC[-100]) -> 10946 | GP86: =FIB(RC[-100]) -> 10946 | GQ86: =FIB(RC[-100]) -> 10946 | GR86: =FIB(RC[-100]) -> 10946
A87: 20 | B87: 20 | C87: 20 | D87: 20 | E87: 20 | F87: 20 | G87: 20 | H87: 20 | I87: 20 | J87: 20 | K87: 20 | L87: 20 | M87: 20 | N87: 20 | O87: 20 | P87: 20 | Q87: 20 | R87: 20 | S87: 20 | T87: 20 | U87: 20 | V87: 20 | W87: 20 | X87: 20 | Y87: 20 | Z87: 20 | AA87: 20 | AB87: 20 | AC87: 20 | AD87: 20 | AE87: 20 | AF87: 20 | AG87: 20 | AH87: 20 | AI87: 20 | AJ87: 20 | AK87: 20 | AL87: 20 | AM87: 20 | AN87: 20 | AO87: 20 | AP87: 20 | AQ87: 20 | AR87: 20 | AS87: 20 | AT87: 20 | AU87: 20 | AV87: 20 | AW87: 20 | AX87: 20 | AY87: 20 | AZ87: 20 | BA87: 20 | BB87: 20 | BC87: 20 | BD87: 20 | BE87: 20 | BF87: 20 | BG87: 20 | BH87: 20 | BI87: 20 | BJ87: 20 | BK87: 20 | BL87: 20 | BM87: 20 | BN87: 20 | BO87: 20 | BP87: 20 | BQ87: 20 | BR87: 20 | BS87: 20 | BT87: 20 | BU87: 20 | BV87: 20 | BW87: 20 | BX87: 20 | BY87: 20 | BZ87: 20 | CA87: 20 | CB87: 20 | CC87: 20 | CD87: 20 | CE87: 20 | CF87: 20 | CG87: 20 | CH87: 20 | CI87: 20 | CJ87: 20 | CK87: 20 | CL87: 20 | CM87: 20 | CN87: 20 | CO87: 20 | CP87: 20 | CQ87: 20 | CR87: 20 | CS87: 20 | CT87: 20 | CU87: 20 | CV87: 20 | CW87: =FIB(RC[-100]) -> 10946 | CX87: =FIB(RC[-100]) -> 10946 | CY87: =FIB(RC[-100]) -> 10946 | CZ87: =FIB(RC[-100]) -> 10946 | DA87: =FIB(RC[-100]) -> 10946 | DB87: =FIB(RC[-100]) -> 10946 | DC87: =FIB(RC[-100]) -> 10946 | DD87: =FIB(RC[-100]) -> 10946 | DE87: =FIB(RC[-100]) -> 10946 | DF87: =FIB(RC[-100]) -> 10946 | DG87: =FIB(RC[-100]) -> 10946 | DH87: =FIB(RC[-100]) -> 10946 | DI87: =FIB(RC[-100]) -> 10946 | DJ87: =FIB(RC[-100]) -> 10946 | DK87: =FIB(RC[-100]) -> 10946 | DL87: =FIB(RC[-100]) -> 10946 | DM87: =FIB(RC[-100]) -> 10946 | DN87: =FIB(RC[-100]) -> 10946 | DO87: =FIB(RC[-100]) -> 10946 | DP87: =FIB(RC[-100]) -> 10946 | DQ87: =FIB(RC[-100]) -> 10946 | DR87: =FIB(RC[-100]) -> 10946 | DS87: =FIB(RC[-100]) -> 10946 | DT87: =FIB(RC[-100]) -> 10946 | DU87: =FIB(RC[-100]) -> 10946 | DV87: =FIB(RC[-100]) -> 10946 | DW87: =FIB(RC[-100]) -> 10946 | DX87: =FIB(RC[-100]) -> 10946 | DY87: =FIB(RC[-100]) -> 10946 | DZ87: =FIB(RC[-100]) -> 10946 | EA87: =FIB(RC[-100]) -> 10946 | EB87: =FIB(RC[-100]) -> 10946 | EC87: =FIB(RC[-100]) -> 10946 | ED87: =FIB(RC[-100]) -> 10946 | EE87: =FIB(RC[-100]) -> 10946 | EF87: =FIB(RC[-100]) -> 10946 | EG87: =FIB(RC[-100]) -> 10946 | EH87: =FIB(RC[-100]) -> 10946 | EI87: =FIB(RC[-100]) -> 10946 | EJ87: =FIB(RC[-100]) -> 10946 | EK87: =FIB(RC[-100]) -> 10946 | EL87: =FIB(RC[-100]) -> 10946 | EM87: =FIB(RC[-100]) -> 10946 | EN87: =FIB(RC[-100]) -> 10946 | EO87: =FIB(RC[-100]) -> 10946 | EP87: =FIB(RC[-100]) -> 10946 | EQ87: =FIB(RC[-100]) -> 10946 | ER87: =FIB(RC[-100]) -> 10946 | ES87: =FIB(RC[-100]) -> 10946 | ET87: =FIB(RC[-100]) -> 10946 | EU87: =FIB(RC[-100]) -> 10946 | EV87: =FIB(RC[-100]) -> 10946 | EW87: =FIB(RC[-100]) -> 10946 | EX87: =FIB(RC[-100]) -> 10946 | EY87: =FIB(RC[-100]) -> 10946 | EZ87: =FIB(RC[-100]) -> 10946 | FA87: =FIB(RC[-100]) -> 10946 | FB87: =FIB(RC[-100]) -> 10946 | FC87: =FIB(RC[-100]) -> 10946 | FD87: =FIB(RC[-100]) -> 10946 | FE87: =FIB(RC[-100]) -> 10946 | FF87: =FIB(RC[-100]) -> 10946 | FG87: =FIB(RC[-100]) -> 10946 | FH87: =FIB(RC[-100]) -> 10946 | FI87: =FIB(RC[-100]) -> 10946 | FJ87: =FIB(RC[-100]) -> 10946 | FK87: =FIB(RC[-100]) -> 10946 | FL87: =FIB(RC[-100]) -> 10946 | FM87: =FIB(RC[-100]) -> 10946 | FN87: =FIB(RC[-100]) -> 10946 | FO87: =FIB(RC[-100]) -> 10946 | FP87: =FIB(RC[-100]) -> 10946 | FQ87: =FIB(RC[-100]) -> 10946 | FR87: =FIB(RC[-100]) -> 10946 | FS87: =FIB(RC[-100]) -> 10946 | FT87: =FIB(RC[-100]) -> 10946 | FU87: =FIB(RC[-100]) -> 10946 | FV87: =FIB(RC[-100]) -> 10946 | FW87: =FIB(RC[-100]) -> 10946 | FX87: =FIB(RC[-100]) -> 10946 | FY87: =FIB(RC[-100]) -> 10946 | FZ87: =FIB(RC[-100]) -> 10946 | GA87: =FIB(RC[-100]) -> 10946 | GB87: =FIB(RC[-100]) -> 10946 | GC87: =FIB(RC[-100]) -> 10946 | GD87: =FIB(RC[-100]) -> 10946 | GE87: =FIB(RC[-100]) -> 10946 | GF87: =FIB(RC[-100]) -> 10946 | GG87: =FIB(RC[-100]) -> 10946 | GH87: =FIB(RC[-100]) -> 10946 | GI87: =FIB(RC[-100]) -> 10946 | GJ87: =FIB(RC[-100]) -> 10946 | GK87: =FIB(RC[-100]) -> 10946 | GL87: =FIB(RC[-100]) -> 10946 | GM87: =FIB(RC[-100]) -> 10946 | GN87: =FIB(RC[-100]) -> 10946 | GO87: =FIB(RC[-100]) -> 10946 | GP87: =FIB(RC[-100]) -> 10946 | GQ87: =FIB(RC[-100]) -> 10946 | GR87: =FIB(RC[-100]) -> 10946
A88: 20 | B88: 20 | C88: 20 | D88: 20 | E88: 20 | F88: 20 | G88: 20 | H88: 20 | I88: 20 | J88: 20 | K88: 20 | L88: 20 | M88: 20 | N88: 20 | O88: 20 | P88: 20 | Q88: 20 | R88: 20 | S88: 20 | T88: 20 | U88: 20 | V88: 20 | W88: 20 | X88: 20 | Y88: 20 | Z88: 20 | AA88: 20 | AB88: 20 | AC88: 20 | AD88: 20 | AE88: 20 | AF88: 20 | AG88: 20 | AH88: 20 | AI88: 20 | AJ88: 20 | AK88: 20 | AL88: 20 | AM88: 20 | AN88: 20 | AO88: 20 | AP88: 20 | AQ88: 20 | AR88: 20 | AS88: 20 | AT88: 20 | AU88: 20 | AV88: 20 | AW88: 20 | AX88: 20 | AY88: 20 | AZ88: 20 | BA88: 20 | BB88: 20 | BC88: 20 | BD88: 20 | BE88: 20 | BF88: 20 | BG88: 20 | BH88: 20 | BI88: 20 | BJ88: 20 | BK88: 20 | BL88: 20 | BM88: 20 | BN88: 20 | BO88: 20 | BP88: 20 | BQ88: 20 | BR88: 20 | BS88: 20 | BT88: 20 | BU88: 20 | BV88: 20 | BW88: 20 | BX88: 20 | BY88: 20 | BZ88: 20 | CA88: 20 | CB88: 20 | CC88: 20 | CD88: 20 | CE88: 20 | CF88: 20 | CG88: 20 | CH88: 20 | CI88: 20 | CJ88: 20 | CK88: 20 | CL88: 20 | CM88: 20 | CN88: 20 | CO88: 20 | CP88: 20 | CQ88: 20 | CR88: 20 | CS88: 20 | CT88: 20 | CU88: 20 | CV88: 20 | CW88: =FIB(RC[-100]) -> 10946 | CX88: =FIB(RC[-100]) -> 10946 | CY88: =FIB(RC[-100]) -> 10946 | CZ88: =FIB(RC[-100]) -> 10946 | DA88: =FIB(RC[-100]) -> 10946 | DB88: =FIB(RC[-100]) -> 10946 | DC88: =FIB(RC[-100]) -> 10946 | DD88: =FIB(RC[-100]) -> 10946 | DE88: =FIB(RC[-100]) -> 10946 | DF88: =FIB(RC[-100]) -> 10946 | DG88: =FIB(RC[-100]) -> 10946 | DH88: =FIB(RC[-100]) -> 10946 | DI88: =FIB(RC[-100]) -> 10946 | DJ88: =FIB(RC[-100]) -> 10946 | DK88: =FIB(RC[-100]) -> 10946 | DL88: =FIB(RC[-100]) -> 10946 | DM88: =FIB(RC[-100]) -> 10946 | DN88: =FIB(RC[-100]) -> 10946 | DO88: =FIB(RC[-100]) -> 10946 | DP88: =FIB(RC[-100]) -> 10946 | DQ88: =FIB(RC[-100]) -> 10946 | DR88: =FIB(RC[-100]) -> 10946 | DS88: =FIB(RC[-100]) -> 10946 | DT88: =FIB(RC[-100]) -> 10946 | DU88: =FIB(RC[-100]) -> 10946 | DV88: =FIB(RC[-100]) -> 10946 | DW88: =FIB(RC[-100]) -> 10946 | DX88: =FIB(RC[-100]) -> 10946 | DY88: =FIB(RC[-100]) -> 10946 | DZ88: =FIB(RC[-100]) -> 10946 | EA88: =FIB(RC[-100]) -> 10946 | EB88: =FIB(RC[-100]) -> 10946 | EC88: =FIB(RC[-100]) -> 10946 | ED88: =FIB(RC[-100]) -> 10946 | EE88: =FIB(RC[-100]) -> 10946 | EF88: =FIB(RC[-100]) -> 10946 | EG88: =FIB(RC[-100]) -> 10946 | EH88: =FIB(RC[-100]) -> 10946 | EI88: =FIB(RC[-100]) -> 10946 | EJ88: =FIB(RC[-100]) -> 10946 | EK88: =FIB(RC[-100]) -> 10946 | EL88: =FIB(RC[-100]) -> 10946 | EM88: =FIB(RC[-100]) -> 10946 | EN88: =FIB(RC[-100]) -> 10946 | EO88: =FIB(RC[-100]) -> 10946 | EP88: =FIB(RC[-100]) -> 10946 | EQ88: =FIB(RC[-100]) -> 10946 | ER88: =FIB(RC[-100]) -> 10946 | ES88: =FIB(RC[-100]) -> 10946 | ET88: =FIB(RC[-100]) -> 10946 | EU88: =FIB(RC[-100]) -> 10946 | EV88: =FIB(RC[-100]) -> 10946 | EW88: =FIB(RC[-100]) -> 10946 | EX88: =FIB(RC[-100]) -> 10946 | EY88: =FIB(RC[-100]) -> 10946 | EZ88: =FIB(RC[-100]) -> 10946 | FA88: =FIB(RC[-100]) -> 10946 | FB88: =FIB(RC[-100]) -> 10946 | FC88: =FIB(RC[-100]) -> 10946 | FD88: =FIB(RC[-100]) -> 10946 | FE88: =FIB(RC[-100]) -> 10946 | FF88: =FIB(RC[-100]) -> 10946 | FG88: =FIB(RC[-100]) -> 10946 | FH88: =FIB(RC[-100]) -> 10946 | FI88: =FIB(RC[-100]) -> 10946 | FJ88: =FIB(RC[-100]) -> 10946 | FK88: =FIB(RC[-100]) -> 10946 | FL88: =FIB(RC[-100]) -> 10946 | FM88: =FIB(RC[-100]) -> 10946 | FN88: =FIB(RC[-100]) -> 10946 | FO88: =FIB(RC[-100]) -> 10946 | FP88: =FIB(RC[-100]) -> 10946 | FQ88: =FIB(RC[-100]) -> 10946 | FR88: =FIB(RC[-100]) -> 10946 | FS88: =FIB(RC[-100]) -> 10946 | FT88: =FIB(RC[-100]) -> 10946 | FU88: =FIB(RC[-100]) -> 10946 | FV88: =FIB(RC[-100]) -> 10946 | FW88: =FIB(RC[-100]) -> 10946 | FX88: =FIB(RC[-100]) -> 10946 | FY88: =FIB(RC[-100]) -> 10946 | FZ88: =FIB(RC[-100]) -> 10946 | GA88: =FIB(RC[-100]) -> 10946 | GB88: =FIB(RC[-100]) -> 10946 | GC88: =FIB(RC[-100]) -> 10946 | GD88: =FIB(RC[-100]) -> 10946 | GE88: =FIB(RC[-100]) -> 10946 | GF88: =FIB(RC[-100]) -> 10946 | GG88: =FIB(RC[-100]) -> 10946 | GH88: =FIB(RC[-100]) -> 10946 | GI88: =FIB(RC[-100]) -> 10946 | GJ88: =FIB(RC[-100]) -> 10946 | GK88: =FIB(RC[-100]) -> 10946 | GL88: =FIB(RC[-100]) -> 10946 | GM88: =FIB(RC[-100]) -> 10946 | GN88: =FIB(RC[-100]) -> 10946 | GO88: =FIB(RC[-100]) -> 10946 | GP88: =FIB(RC[-100]) -> 10946 | GQ88: =FIB(RC[-100]) -> 10946 | GR88: =FIB(RC[-100]) -> 10946
A89: 20 | B89: 20 | C89: 20 | D89: 20 | E89: 20 | F89: 20 | G89: 20 | H89: 20 | I89: 20 | J89: 20 | K89: 20 | L89: 20 | M89: 20 | N89: 20 | O89: 20 | P89: 20 | Q89: 20 | R89: 20 | S89: 20 | T89: 20 | U89: 20 | V89: 20 | W89: 20 | X89: 20 | Y89: 20 | Z89: 20 | AA89: 20 | AB89: 20 | AC89: 20 | AD89: 20 | AE89: 20 | AF89: 20 | AG89: 20 | AH89: 20 | AI89: 20 | AJ89: 20 | AK89: 20 | AL89: 20 | AM89: 20 | AN89: 20 | AO89: 20 | AP89: 20 | AQ89: 20 | AR89: 20 | AS89: 20 | AT89: 20 | AU89: 20 | AV89: 20 | AW89: 20 | AX89: 20 | AY89: 20 | AZ89: 20 | BA89: 20 | BB89: 20 | BC89: 20 | BD89: 20 | BE89: 20 | BF89: 20 | BG89: 20 | BH89: 20 | BI89: 20 | BJ89: 20 | BK89: 20 | BL89: 20 | BM89: 20 | BN89: 20 | BO89: 20 | BP89: 20 | BQ89: 20 | BR89: 20 | BS89: 20 | BT89: 20 | BU89: 20 | BV89: 20 | BW89: 20 | BX89: 20 | BY89: 20 | BZ89: 20 | CA89: 20 | CB89: 20 | CC89: 20 | CD89: 20 | CE89: 20 | CF89: 20 | CG89: 20 | CH89: 20 | CI89: 20 | CJ89: 20 | CK89: 20 | CL89: 20 | CM89: 20 | CN89: 20 | CO89: 20 | CP89: 20 | CQ89: 20 | CR89: 20 | CS89: 20 | CT89: 20 | CU89: 20 | CV89: 20 | CW89: =FIB(RC[-100]) -> 10946 | CX89: =FIB(RC[-100]) -> 10946 | CY89: =FIB(RC[-100]) -> 10946 | CZ89: =FIB(RC[-100]) -> 10946 | DA89: =FIB(RC[-100]) -> 10946 | DB89: =FIB(RC[-100]) -> 10946 | DC89: =FIB(RC[-100]) -> 10946 | DD89: =FIB(RC[-100]) -> 10946 | DE89: =FIB(RC[-100]) -> 10946 | DF89: =FIB(RC[-100]) -> 10946 | DG89: =FIB(RC[-100]) -> 10946 | DH89: =FIB(RC[-100]) -> 10946 | DI89: =FIB(RC[-100]) -> 10946 | DJ89: =FIB(RC[-100]) -> 10946 | DK89: =FIB(RC[-100]) -> 10946 | DL89: =FIB(RC[-100]) -> 10946 | DM89: =FIB(RC[-100]) -> 10946 | DN89: =FIB(RC[-100]) -> 10946 | DO89: =FIB(RC[-100]) -> 10946 | DP89: =FIB(RC[-100]) -> 10946 | DQ89: =FIB(RC[-100]) -> 10946 | DR89: =FIB(RC[-100]) -> 10946 | DS89: =FIB(RC[-100]) -> 10946 | DT89: =FIB(RC[-100]) -> 10946 | DU89: =FIB(RC[-100]) -> 10946 | DV89: =FIB(RC[-100]) -> 10946 | DW89: =FIB(RC[-100]) -> 10946 | DX89: =FIB(RC[-100]) -> 10946 | DY89: =FIB(RC[-100]) -> 10946 | DZ89: =FIB(RC[-100]) -> 10946 | EA89: =FIB(RC[-100]) -> 10946 | EB89: =FIB(RC[-100]) -> 10946 | EC89: =FIB(RC[-100]) -> 10946 | ED89: =FIB(RC[-100]) -> 10946 | EE89: =FIB(RC[-100]) -> 10946 | EF89: =FIB(RC[-100]) -> 10946 | EG89: =FIB(RC[-100]) -> 10946 | EH89: =FIB(RC[-100]) -> 10946 | EI89: =FIB(RC[-100]) -> 10946 | EJ89: =FIB(RC[-100]) -> 10946 | EK89: =FIB(RC[-100]) -> 10946 | EL89: =FIB(RC[-100]) -> 10946 | EM89: =FIB(RC[-100]) -> 10946 | EN89: =FIB(RC[-100]) -> 10946 | EO89: =FIB(RC[-100]) -> 10946 | EP89: =FIB(RC[-100]) -> 10946 | EQ89: =FIB(RC[-100]) -> 10946 | ER89: =FIB(RC[-100]) -> 10946 | ES89: =FIB(RC[-100]) -> 10946 | ET89: =FIB(RC[-100]) -> 10946 | EU89: =FIB(RC[-100]) -> 10946 | EV89: =FIB(RC[-100]) -> 10946 | EW89: =FIB(RC[-100]) -> 10946 | EX89: =FIB(RC[-100]) -> 10946 | EY89: =FIB(RC[-100]) -> 10946 | EZ89: =FIB(RC[-100]) -> 10946 | FA89: =FIB(RC[-100]) -> 10946 | FB89: =FIB(RC[-100]) -> 10946 | FC89: =FIB(RC[-100]) -> 10946 | FD89: =FIB(RC[-100]) -> 10946 | FE89: =FIB(RC[-100]) -> 10946 | FF89: =FIB(RC[-100]) -> 10946 | FG89: =FIB(RC[-100]) -> 10946 | FH89: =FIB(RC[-100]) -> 10946 | FI89: =FIB(RC[-100]) -> 10946 | FJ89: =FIB(RC[-100]) -> 10946 | FK89: =FIB(RC[-100]) -> 10946 | FL89: =FIB(RC[-100]) -> 10946 | FM89: =FIB(RC[-100]) -> 10946 | FN89: =FIB(RC[-100]) -> 10946 | FO89: =FIB(RC[-100]) -> 10946 | FP89: =FIB(RC[-100]) -> 10946 | FQ89: =FIB(RC[-100]) -> 10946 | FR89: =FIB(RC[-100]) -> 10946 | FS89: =FIB(RC[-100]) -> 10946 | FT89: =FIB(RC[-100]) -> 10946 | FU89: =FIB(RC[-100]) -> 10946 | FV89: =FIB(RC[-100]) -> 10946 | FW89: =FIB(RC[-100]) -> 10946 | FX89: =FIB(RC[-100]) -> 10946 | FY89: =FIB(RC[-100]) -> 10946 | FZ89: =FIB(RC[-100]) -> 10946 | GA89: =FIB(RC[-100]) -> 10946 | GB89: =FIB(RC[-100]) -> 10946 | GC89: =FIB(RC[-100]) -> 10946 | GD89: =FIB(RC[-100]) -> 10946 | GE89: =FIB(RC[-100]) -> 10946 | GF89: =FIB(RC[-100]) -> 10946 | GG89: =FIB(RC[-100]) -> 10946 | GH89: =FIB(RC[-100]) -> 10946 | GI89: =FIB(RC[-100]) -> 10946 | GJ89: =FIB(RC[-100]) -> 10946 | GK89: =FIB(RC[-100]) -> 10946 | GL89: =FIB(RC[-100]) -> 10946 | GM89: =FIB(RC[-100]) -> 10946 | GN89: =FIB(RC[-100]) -> 10946 | GO89: =FIB(RC[-100]) -> 10946 | GP89: =FIB(RC[-100]) -> 10946 | GQ89: =FIB(RC[-100]) -> 10946 | GR89: =FIB(RC[-100]) -> 10946
A90: 20 | B90: 20 | C90: 20 | D90: 20 | E90: 20 | F90: 20 | G90: 20 | H90: 20 | I90: 20 | J90: 20 | K90: 20 | L90: 20 | M90: 20 | N90: 20 | O90: 20 | P90: 20 | Q90: 20 | R90: 20 | S90: 20 | T90: 20 | U90: 20 | V90: 20 | W90: 20 | X90: 20 | Y90: 20 | Z90: 20 | AA90: 20 | AB90: 20 | AC90: 20 | AD90: 20 | AE90: 20 | AF90: 20 | AG90: 20 | AH90: 20 | AI90: 20 | AJ90: 20 | AK90: 20 | AL90: 20 | AM90: 20 | AN90: 20 | AO90: 20 | AP90: 20 | AQ90: 20 | AR90: 20 | AS90: 20 | AT90: 20 | AU90: 20 | AV90: 20 | AW90: 20 | AX90: 20 | AY90: 20 | AZ90: 20 | BA90: 20 | BB90: 20 | BC90: 20 | BD90: 20 | BE90: 20 | BF90: 20 | BG90: 20 | BH90: 20 | BI90: 20 | BJ90: 20 | BK90: 20 | BL90: 20 | BM90: 20 | BN90: 20 | BO90: 20 | BP90: 20 | BQ90: 20 | BR90: 20 | BS90: 20 | BT90: 20 | BU90: 20 | BV90: 20 | BW90: 20 | BX90: 20 | BY90: 20 | BZ90: 20 | CA90: 20 | CB90: 20 | CC90: 20 | CD90: 20 | CE90: 20 | CF90: 20 | CG90: 20 | CH90: 20 | CI90: 20 | CJ90: 20 | CK90: 20 | CL90: 20 | CM90: 20 | CN90: 20 | CO90: 20 | CP90: 20 | CQ90: 20 | CR90: 20 | CS90: 20 | CT90: 20 | CU90: 20 | CV90: 20 | CW90: =FIB(RC[-100]) -> 10946 | CX90: =FIB(RC[-100]) -> 10946 | CY90: =FIB(RC[-100]) -> 10946 | CZ90: =FIB(RC[-100]) -> 10946 | DA90: =FIB(RC[-100]) -> 10946 | DB90: =FIB(RC[-100]) -> 10946 | DC90: =FIB(RC[-100]) -> 10946 | DD90: =FIB(RC[-100]) -> 10946 | DE90: =FIB(RC[-100]) -> 10946 | DF90: =FIB(RC[-100]) -> 10946 | DG90: =FIB(RC[-100]) -> 10946 | DH90: =FIB(RC[-100]) -> 10946 | DI90: =FIB(RC[-100]) -> 10946 | DJ90: =FIB(RC[-100]) -> 10946 | DK90: =FIB(RC[-100]) -> 10946 | DL90: =FIB(RC[-100]) -> 10946 | DM90: =FIB(RC[-100]) -> 10946 | DN90: =FIB(RC[-100]) -> 10946 | DO90: =FIB(RC[-100]) -> 10946 | DP90: =FIB(RC[-100]) -> 10946 | DQ90: =FIB(RC[-100]) -> 10946 | DR90: =FIB(RC[-100]) -> 10946 | DS90: =FIB(RC[-100]) -> 10946 | DT90: =FIB(RC[-100]) -> 10946 | DU90: =FIB(RC[-100]) -> 10946 | DV90: =FIB(RC[-100]) -> 10946 | DW90: =FIB(RC[-100]) -> 10946 | DX90: =FIB(RC[-100]) -> 10946 | DY90: =FIB(RC[-100]) -> 10946 | DZ90: =FIB(RC[-100]) -> 10946 | EA90: =FIB(RC[-100]) -> 10946 | EB90: =FIB(RC[-100]) -> 10946 | EC90: =FIB(RC[-100]) -> 10946 | ED90: =FIB(RC[-100]) -> 10946 | EE90: =FIB(RC[-100]) -> 10946 | EF90: =FIB(RC[-100]) -> 10946 | EG90: =FIB(RC[-100]) -> 10946 | EH90: =FIB(RC[-100]) -> 10946 | EI90: =FIB(RC[-100]) -> 10946 | EJ90: =FIB(RC[-100]) -> 10946 | EK90: =FIB(RC[-100]) -> 10946 | EL90: =FIB(RC[-100]) -> 10946 | EM90: =FIB(RC[-100]) -> 10946 | EN90: =FIB(RC[-100]) -> 10946 | EO90: =FIB(RC[-100]) -> 10946 | EP90: =FIB(RC[-100]) -> 10946 | EQ90: =FIB(RC[-100]) -> 10946 | ER90: =FIB(RC[-100]) -> 10946 | ES90: =FIB(RC[-100]) -> 10946 | ET90: =FIB(RC[-100]) -> 10946 | EU90: =FIB(RC[-100]) -> 10946 | EV90: =FIB(RC[-100]) -> 10946 | EW90: =FIB(RC[-100]) -> 10946 | EX90: =FIB(RC[-100]) -> 10946 | EY90: =FIB(RC[-100]) -> 10946 | EZ90: =FIB(RC[-100]) -> 10946 | FA90: =FIB(RC[-100]) -> 10946 | FB90: =FIB(RC[-100]) -> 10946 | FC90: =FIB(RC[-100]) -> 10946 | FD90: =FIB(RC[-100]) -> 10946 | FE90: =FIB(RC[-100]) -> 10946 | FF90: =FIB(RC[-100]) -> 10946 | FG90: =FIB(RC[-100]) -> 10946 | FH90: =FIB(RC[-100]) -> 10946 | FI90: =FIB(RC[-100]) -> 10946 | FJ90: =FIB(RC[-100]) -> 10946 | FK90: =FIB(RC[-100]) -> 10946 | FL90: =FIB(RC[-100]) -> 10946 | FM90: =FIB(RC[-100]) -> 10946 | FN90: =FIB(RC[-100]) -> 10946 | FO90: =FIB(RC[-100]) -> 10946 | FP90: =FIB(RC[-100]) -> 10946 | FQ90: =FIB(RC[-100]) -> 10946 | FR90: =FIB(RC[-100]) -> 10946 | FS90: =FIB(RC[-100]) -> 10946 | FT90: =FIB(RC[-100]) -> 10946 | FU90: =FIB(RC[-100]) -> 10946 | FV90: =FIB(RC[-100]) -> 10946 | FW90: =FIB(RC[-100]) -> 10946 | FX90: =FIB(RC[-100]) -> 10946 | FY90: =FIB(RC[-100]) -> 10946 | FZ90: =FIB(RC[-100]) -> 10946 | GA90: =FIB(RC[-100]) -> 10946 | GB90: =FIB(RC[-100]) -> 10946 | GC90: =FIB(RC[-100]) -> 10946 | GD90: =FIB(RC[-100]) -> 10946 | GE90: =FIB(RC[-100]) -> 10946 | GF90: =FIB(RC[-100]) -> 10946 | GG90: =FIB(RC[-100]) -> 10946 | GH90: =FIB(RC[-100]) -> 10946 | GI90: =FIB(RC[-100]) -> 10946 | GJ90: =FIB(RC[-100]) -> 10946 | GK90: =FIB(RC[-100]) -> 10946 | GL90: =FIB(RC[-100]) -> 10946 | GM90: =FIB(RC[-100]) -> 10946 | GN90: =FIB(RC[-100]) -> 10946 | GO90: =FIB(RC[-100]) -> 10946 | GP90: =FIB(RC[-100]) -> 10946 | GQ90: =FIB(RC[-100]) -> 10946 | GR90: =FIB(RC[-100]) -> 10946
A91: 20 | B91: 20 | C91: 20 | D91: 20 | E91: 20 | F91: 20 | G91: 20 | H91: 20 | I91: 20 | J91: 20 | K91: 20 | L91: 20 | M91: 20 | N91: 20 | O91: 20 | P91: 20 | Q91: 20 | R91: 20 | S91: 20 | T91: 20 | U91: 20 | V91: 20 | W91: 20 | X91: 20 | Y91: 20 | Z91: 20 | AA91: 20 | AB91: 20 | AC91: 20 | AD91: 20 | AE91: 20 | AF91: 20 | AG91: 20 | AH91: 20 | AI91: 20 | AJ91: 20 | AK91: 20 | AL91: 20 | AM91: 20 | AN91: 20 | AO91: 20 | AP91: 20 | AQ91: 20 | AR91: 20 | AS91: 20 | AT91: 20 | AU91: 20 | AV91: 20 | AW91: 20 | AX91: 20 | AY91: 20 | AZ91: 20 | BA91: 20 | BB91: 20 | BC91: 20 | BD91: 20 | BE91: 20 | BF91: 20 | BG91: 20 | BH91: 20 | BI91: 20 | BJ91: 20 | BK91: 20 | BL91: 20 | BM91: 20 | BN91: 20 | BO91: 20 | BP91: 20 | BQ91: 20 | BR91: 20 | BS91: 20 | BT91: 20 | BU91: 20 | BV91: 20 | BW91: 20 | BX91: 20 | BY91: 20 | BZ91: 20 | CA91: 20 | CB91: 20 | CC91: 20 | CD91: 20 | CE91: 20 | CF91: 20 | CG91: 20 | CH91: 20 | CI91: 20 | CJ91: 20 | CK91: 20 | CL91: 20 | CM91: 20 | CN91: 20 | CO91: 20 | CP91: 20 | CQ91: 20 | CR91: 20 | CS91: 20 | CT91: 20 | CU91: 20 | CV91: 20 | CW91: =FIB(RC[-100]) -> 10946 | CX91: =FIB(RC[-100]) -> 10946 | CY91: =FIB(RC[-100]) -> 10946 | CZ91: =FIB(RC[-100]) -> 10946 | DA91: =FIB(RC[-100]) -> 10946 | DB91: =FIB(RC[-100]) -> 10946 | DC91: =FIB(RC[-100]) -> 10946 | DD91: =FIB(RC[-100]) -> 10946 | DE91: =FIB(RC[-100]) -> 10946 | DF91: =FIB(RC[-100]) -> 10946 | DG91: =FIB(RC[-100]) -> 10946 | DH91: =FIB(RC[-100]) -> 10946 | DI91: =FIB(RC[-100]) -> 10946 | DJ91: =FIB(RC[-100]) -> 10946 | DK91: =FIB(RC[-100]) -> 10946 | DL91: =FIB(RC[-100]) -> 10946 | DM91: =FIB(RC[-100]) -> 10946 | DN91: =FIB(RC[-100]) -> 10946 | DO91: =FIB(RC[-100]) -> 10946 | DP91: =FIB(RC[-100]) -> 10946 | DQ91: =FIB(RC[-100]) -> 10946 | DR91: =FIB(RC[-100]) -> 10946 | DS91: =FIB(RC[-100]) -> 10946 | DT91: =FIB(RC[-100]) -> 10946 | DU91: =FIB(RC[-100]) -> 10946 | DV91: =FIB(RC[-100]) -> 10946 | DW91: =FIB(RC[-100]) -> 10946 | DX91: =FIB(RC[-100]) -> 10946 | DY91: =FIB(RC[-100]) -> 10946 | DZ91: =FIB(RC[-100]) -> 10946 | EA91: =FIB(RC[-100]) -> 10946 | EB91: =FIB(RC[-100]) -> 10946 | EC91: =FIB(RC[-100]) -> 10946 | ED91: =FIB(RC[-100]) -> 10946 | EE91: =FIB(RC[-100]) -> 10946 | EF91: =FIB(RC[-100]) -> 10946 | EG91: =FIB(RC[-100]) -> 10946 | EH91: =FIB(RC[-100]) -> 10946 | EI91: =FIB(RC[-100]) -> 10946 | EJ91: =FIB(RC[-100]) -> 10946 | EK91: =FIB(RC[-100]) -> 10946 | EL91: =FIB(RC[-100]) -> 10946 | EM91: =FIB(RC[-100]) -> 10946 | EN91: =FIB(RC[-100]) -> 10946 | EO91: =FIB(RC[-100]) -> 10946 | EP91: =FIB(RC[-100]) -> 10946 | EQ91: =FIB(RC[-100]) -> 10946 | ER91: =FIB(RC[-100]) -> 10946 | ES91: =FIB(RC[-100]) -> 10946 | ET91: =FIB(RC[-100]) -> 10946 | EU91: =FIB(RC[-100]) -> 10946 | EV91: =FIB(RC[-100]) -> 10946 | EW91: =FIB(RC[-100]) -> 10946 | EX91: =FIB(RC[-100]) -> 10946 | EY91: =FIB(RC[-100]) -> 10946 | EZ91: =FIB(RC[-100]) -> 10946 | FA91: =FIB(RC[-100]) -> 10946 | FB91: =FIB(RC[-100]) -> 10946 | FC91: =FIB(RC[-100]) -> 10946 | FD91: =FIB(RC[-100]) -> 10946 | FE91: =FIB(RC[-100]) -> 10946 | FF91: =FIB(RC[-100]) -> 10946 | FG91: =FIB(RC[-100]) -> 10946 | FH91: =FIB(RC[-100]) -> 10946 | FI91: =FIB(RC[-100]) -> 10946 | FJ91: =FIB(RC[-100]) -> 10946 | FK91: =FIB(RC[-100]) -> 10946 | FL91: =FIB(RC[-100]) -> 10946 | FM91: =FIB(RC[-100]) -> 10946 | FN91: =FIB(RC[-100]) -> 10946 | FO91: =FIB(RC[-100]) -> 10946 | FP91: =FIB(RC[-100]) -> 10946 | FQ91: =FIB(RC[-100]) -> 10946 | FR91: =FIB(RC[-100]) -> 10946 | FS91: =FIB(RC[-100]) -> 10946 | FT91: =FIB(RC[-100]) -> 10946 | FU91: =FIB(RC[-100]) -> 10946 | FV91: =FIB(RC[-100]) -> 10946 | FW91: =FIB(RC[-100]) -> 10946 | FX91: =FIB(RC[-100]) -> 10946 | FY91: =FIB(RC[-100]) -> 10946 | FZ91: =FIB(RC[-100]) -> 10946 | GA91: =FIB(RC[-100]) -> 10946 | GB91: =FIB(RC[-100]) -> 10946 | GC91: =FIB(RC[-100]) -> 10946 | GD91: =FIB(RC[-100]) -> 10946 | GE91: =FIB(RC[-100]) -> 10946 | GF91: =FIB(RC[-100]) -> 10946 | GG91: =FIB(RC[-100]) -> 10946 | GH91: =FIB(RC[-100]) -> 10946 | GI91: =FIB(RC[-100]) -> 10946 | GJ91: =FIB(RC[-100]) -> 10946 | GK91: =FIB(RC[-100]) -> 10946 | GL91: =FIB(RC[-100]) -> 10946 | GM91: =FIB(RC[-100]) -> 10946 | GN91: =FIB(RC[-100]) -> 10946 | GO91: =FIB(RC[-100]) -> 10946 | GP91: =FIB(RC[-100]) -> 10946 | GQ91: =FIB(RC[-100]) -> 10946 | GR91: =FIB(RC[-100]) -> 10946
A92: 20 | B92: 20 | C92: 20 | D92: 20 | E92: 20 | F92: 20 | G92: 20 | H92: 20 | I92: 20 | J92: 20 | K92: 20 | L92: 20 | M92: 20 | N92: 20 | O92: 20 | P92: 20 | Q92: 20 | R92: 20 | S92: 20 | T92: 20 | U92: 20 | V92: 20 | W92: 20 | X92: 20 | Y92: 20 | Z92: 20 | AA92: 20 | AB92: 20 | AC92: 20 | AD92: 20 | AE92: 20 | AF92: 20 | AG92: 20 | AH92: 20 | AI92: 20 | AJ92: 20 | AK92: 20 | AL92: 20 | AM92: 20 | AN92: 20 | AO92: 20 | AP92: 20 | AQ92: 20 | AR92: 20 | AS92: 20 | AT92: 20 | AU92: 20 | AV92: 20 | AW92: 20 | AX92: 20 | AY92: 20 | AZ92: 20 | BA92: 20 | BB92: 20 | BC92: 20 | BD92: 20 | BE92: 20 | BF92: 20 | BG92: 20 | BH92: 20 | BI92: 20 | BJ92: 20 | BK92: 20 | BL92: 20 | BM92: 20 | BN92: 20 | BO92: 20 | BP92: 20 | BQ92: 20 | BR92: 20 | BS92: 20 | BT92: 20 | BU92: 20 | BV92: 20 | BW92: 20 | BX92: 20 | BY92: 20 | BZ92: 20 | CA92: 20 | CB92: 20 | CC92: 20 | CD92: 20 | CE92: 20 | CF92: 20 | CG92: 20 | CH92: 20 | CI92: 20 | CJ92: 20 | CK92: 20 | CL92: 20 | CM92: 20 | CN92: 20 | CO92: 20 | CP92: 20 | CQ92: 20 | CR92: 20 | CS92: 20 | CT92: 20 | CU92: 20 | CV92: 20 | CW92: =FIB(RC[-100]) -> 10946 | CX92: =FIB(RC[-100]) -> 10946 | CY92: =FIB(RC[-100]) -> 10946 | CZ92: =FIB(RC[-100]) -> 10946 | DA92: =FIB(RC[-100]) -> 10946 | DB92: =FIB(RC[-100]) -> 10946 | DC92: =FIB(RC[-100]) -> 10946 | DD92: =FIB(RC[-100]) -> 10946 | DE92: =FIB(RC[-100]) -> 10946 | DF92: =FIB(RC[-100]) -> 10946 | DG92: =FIB(RC[-100]) -> 10946 | DH92: =FIB(RC[-100]) -> 10946 | DI92: =FIB(RC[-100]) -> 10946 | DJ92: =FIB(RC[-100]) -> 10946 | DK92: =FIB(RC[-100]) -> 10946 | DL92: =FIB(RC[-100]) -> 10946 | DM92: =FIB(RC[-100]) -> 10946 | DN92: =FIB(RC[-100]) -> 10946 | DO92: =FIB(RC[-100]) -> 10946 | DP92: =FIB(RC[-100]) -> 10946 | DQ92: =FIB(RC[-100]) -> 10946 | DR92: =FIB(RC[-100]) -> 10946 | DS92: =FIB(RC[-100]) -> 10946 | DT92: =FIB(RC[-100]) -> 10946 | DU92: =FIB(RC[-100]) -> 10946 | DV92: =FIB(RC[-100]) -> 10946 | DW92: =FIB(RC[-100]) -> 10946 | DX92: =FIB(RC[-100]) -> 10946 | DY92: =FIB(RC[-100]) -> 10946 | DZ92: =FIB(RC[-100]) -> 10946 | EA92: =FIB(RC[-100]) -> 10946 | EB92: =FIB(RC[-100]) -> 10946 | EC92: =FIB(RC[-100]) -> 10946 | ED92: =FIB(RC[-100]) -> 10946 | EE92: =FIB(RC[-100]) -> 10946 | EF92: =FIB(RC[-100]) -> 10946 | EG92: =FIB(RC[-100]) -> 10946 | EH92: =FIB(RC[-100]) -> 10946 | EI92: =FIB(RC[-100]) -> 10946 | EJ92: =FIB(RC[-100]) -> 10946 | EK92: =FIB(RC[-100]) -> 10946 | EL92: =FIB(RC[-100]) -> 10946 | EM92: =FIB(RC[-100]) -> 10946 | EN92: =FIB(RC[-100]) -> 10946 | EO92: =FIB(RC[-100]) -> 10946 | EP92: =FIB(RC[-100]) -> 10946 | EQ92: =FIB(RC[-100]) -> 10946 | ER92: =FIB(RC[-100]) -> 10946 | ES92: =FIB(RC[-100]) -> 10946 | ET92: =FIB(RC[-100]) -> 10946 | EU92: =FIB(RC[-100]) -> 10946 | EV92: =FIB(RC[-100]) -> 10946 | EW92: =FIB(RC[-100]) -> 10946 | EX92: =FIB(RC[-100]) -> 10946 | EY92: =FIB(RC[-100]) -> 10946 | EZ92: =FIB(RC[-100]) -> 10946 | FA92: =FIB(RC[-100]) -> 10946 | FB92: =FIB(RC[-100]) -> 10946 | FC92: =FIB(RC[-100]) -> 10946 | FD92: =FIB(RC[-100]) -> 10946 | FE92: =FIB(RC[-100]) -> 10946 | FF92: =FIB(RC[-100]) -> 10946 | FG92: =FIB(RC[-100]) -> 10946 | FH92: =FIB(RC[-100]) -> 10946 | FI92: =FIB(RC[-100]) -> 10946 | FJ92: =FIB(RC[-100]) -> 10946 | FK92: =FIB(RC[-100]) -> 10946 | FL92: =FIB(RC[-100]) -> 10946 | FM92: =FIB(RC[-100]) -> 10946 | FN92: =FIB(RC[-100]) -> 10946 | FO92: =FIB(RC[-100]) -> 10946 | FP92: =FIB(RC[-100]) -> 10946 | FQ92: =FIB(RC[-100]) -> 10946 | FR92: =FIB(RC[-100]) -> 10946 | FS92: =FIB(RC[-100]) -> 10946 | FT92: =FIB(RC[-100]) -> 10946 | FU92: =FIB(RC[-100]) -> 10946 | FV92: =FIB(RC[-100]) -> 10946 | FW92: =FIB(RC[-100]) -> 10946 | FX92: =FIB(RC[-100]) -> 10946 | FY92: =FIB(RC[-100]) -> 10946 | FZ92: =FIB(RC[-100]) -> 10946 | GA92: =FIB(RC[-100]) -> 10946 | GB92: =FIB(RC[-100]) -> 10946 | GC92: =FIB(RC[-100]) -> 10946 | GD92: =FIB(RC[-100]) -> 10946 | GE92: =FIB(RC[-100]) -> 10946 | GF92: =FIB(RC[-100]) -> 10946 | GG92: =FIB(RC[-100]) -> 10946 | GH92: =FIB(RC[-100]) -> 10946 | GI92: =FIB(RC[-100]) -> 10946 | GJ92: =FIB(RC[-100]) -> 10946 | GK92: =FIB(RC[-100]) -> 10946 | GL92: =FIB(RC[-100]) -> 10946 | GM92: =FIB(RC[-100]) -> 10946 | GN92: =FIB(RC[-100]) -> 10946 | GO92: =FIB(RC[-100]) -> 10946 | GP92: =FIB(RC[-100]) -> 10946 | GQ92: =FIB(RC[-100]) -> 10946 | GR92: =FIB(RC[-100]) -> 10946
A93: 20 | B93: 20 | C93: 20 | D93: 20 | E93: 20 | F93: 20 | G93: 20 | H93: 20 | I93: 20 | J93: 20 | K93: 20 | L93: 20 | M93: 20 | N93: 20 | O93: 20 | P93: 20 | Q93: 20 | R93: 20 | S93: 20 | T93: 20 | U93: 20 | V93: 20 | W93: 20 | X93: 20 | Y93: 20 | Z93: 20 | AA93: 20 | AB93: 20 | AC93: 20 | AD93: 20 | AE93: 20 | AF93: 20 | AG93: 20 | AH93: 20 | AI93: 20 | AJ93: 20 | AK93: 20 | AL93: 20 | AM93: 20 | AN93: 20 | AO93: 20 | AP93: 20 | AQ93: 20 | AR93: 20 | AS93: 20 | AT93: 20 | AU93: 20 | AV93: 20 | AW93: 20 | AX93: 20 | AY93: 20 | AZ93: 20 | BA93: 20 | BB93: 20 | BC93: 20 | BD93: 20 | BE93: 20 | BF93: 20 | BG93: 20 | BH93: 20 | BI93: 20 | BJ93: 20 | BK93: 20 | BL93: 20 | BM93: 20 | BN93: 20 | BO93: 20 | BP93: 20 | BQ93: 20 | BR93: 20 | BS93: 20 | BT93: 20 | BU93: 20 | BV93: 20 | BW93: 20 | BX93: 20 | BY93: 20 | BZ93: 20 | CA93: 20 | CB93: 20 | CC93: 20 | CD93: 20 | CE93: 20 | CF93: 20 | CG93: 20 | CH93: 20 | CI93: 20 | CJ93: 20 | CK93: 20 | CL93: 20 | CM93: 20 | CN93: 20 | CO93: 20 | CP93: 20 | CQ93: 20 | CR93: 20 | CS93: 20 | CT93: 20 | CU93: 20 | CV93: 20 | CW93: =FIB(RC[-100]) -> 10946 | CX93: =FIB(RC[-100]) -> 10946 | CY93: =FIB(RC[-100]) -> 10946 | CZ93: =FIB(RC[-100]) -> 10946 | DA93: =FIB(RC[-100]) -> 10946 | DB93: =FIB(RC[-100]) -> 10946 | DC93: =FIB(RC[-100]) -> 10946 | DD93: =FIB(RC[-100]) -> 10946 | DE93: =FIB(RC[-100]) -> 10946 | DF93: =FIB(RC[-100]) -> 10946 | DG93: =FIB(RC[-100]) -> 10946 | DH93: =FIB(RC[-100]) -> 10946 | DI93: =FIB(RC[-100]) -> 10946 | DJ93: =FIB(RC[-100]) -> 10946 | DK93: =FIB(RC[-100]) -> 10946 | DL93: =FIB(RC[-100]) -> 10946 | DM93: =FIB(RC[-100]) -> 10946 | DN93: =FIB(RC[-100]) -> 10946 | DO93: =FIB(RC[-100]) -> 10946 | DP93: =FIB(RC[-100]) -> 10946 | DQ93: =FIB(RC[-100]) -> 10946 | DR93: =FIB(RC[-100]) -> 10946 | DS93: =FIB(RC[-100]) -> 10946 | DT93: =FIB(RC[-100]) -> 10946 | DU93: =FIB(RC[-100]) -> 10946 | DV93: =FIB(RC[-100]) -> 10946 | DW93: =FIB(RC[-100]) -> 10946 | DX93: =FIB(RC[-100]) -> 10946 | DY93: =FIB(RC[-100]) -> 10946 | DZ93: =FIB(RC[-100]) -> 10946 | EA93: =FIB(RC[-100]) -> 10946 | EB93: =FIB(RC[-100]) -> 10946 | EC93: =FIB(RC[-100]) -> 10946 | ED93: =FIB(RC[-100]) -> 10946 | EE93: =FIB(RC[-100]) -> 10946 | EF93: =FIB(RC[-100]) -> 10946 | EG93: =FIB(RC[-100]) -> 10946 | EH93: =FIB(RC[-100]) -> 10946 | EI93: =FIB(RC[-100]) -> 10946 | EJ93: =FIB(RC[-100]) -> 10946 | EK93: =FIB(RC[-100]) -> 10946 | EL93: =FIB(RC[-100]) -> 10946 | EM93: =FIB(RC[-100]) -> 10946 | EN93: =FIB(RC[-100]) -> 10946 | EO93: =FIB(RC[-100]) -> 10946 | EP93: =FIB(RC[-100]) -> 10946 | EQ93: =FIB(RC[-100]) -> 10946 | ER93: =FIB(RC[-100]) -> 10946 | ES93: =FIB(RC[-100]) -> 10946 | ET93: =FIB(RC[-100]) -> 10946 | EU93: =FIB(RC[-100]) -> 10946 | EV93: =FIB(RC[-100]) -> 10946 | EW93: =FIB(RC[-100]) -> 10946 | EX93: =FIB(RC[-100]) -> 10946 | EY93: =FIB(RC[-100]) -> 10946 | EZ93: =FIB(RC[-100]) -> 10946 | FA93: =FIB(RC[-100]) -> 10946 | FB93: =FIB(RC[-100]) -> 10946 | FC93: =FIB(RC[-100]) -> 10946 | FD93: =FIB(RC[-100]) -> 10946 | FE93: =FIB(RC[-100]) -> 10946 | FF93: =FIB(RC[-100]) -> 10946 | FG93: =FIB(RC[-100]) -> 10946 | FH93: =FIB(RC[-100]) -> 10946 | FI93: =FIB(RC[-100]) -> 10946 | FJ93: =FIB(RC[-100]) -> 10946 | FK93: =FIB(RC[-100]) -> 10946 | FL93: =FIB(RC[-100]) -> 10946 | FM93: =FIB(RC[-100]) -> 10946 | FN93: =FIB(RC[-100]) -> 10946 | FO93: =FIB(RC[-100]) -> 10946 | FP93: =FIB(RC[-100]) -> 10946 | FQ93: =FIB(RC[-100]) -> 10946 | FR93: =FIB(RC[-100]) -> 10946 | FS93: =FIB(RC[-100]) -> 10946 | FT93: =FIB(RC[-100]) -> 10946 | FU93: =FIB(RC[-100]) -> 10946 | FV93: =FIB(RC[-100]) -> 10946 | FW93: =FIB(RC[-100]) -> 10946 | FX93: =FIB(RC[-100]) -> 10946 | FY93: =FIB(RC[-100]) -> 10946 | FZ93: =FIB(RC[-100]) -> 10946 | GA93: =FIB(RC[-100]) -> 10946 | GB93: =FIB(RC[-100]) -> 10946 | GC93: =FIB(RC[-100]) -> 10946 | GD93: =FIB(RC[-100]) -> 10946 | GE93: =FIB(RC[-100]) -> 10946 | GF93: =FIB(RC[-100]) -> 10946 | GG93: =FIB(RC[-100]) -> 10946 | GH93: =FIB(RC[-100]) -> 10946 | GI93: =FIB(RC[-100]) -> 10946 | GJ93: =FIB(RC[-100]) -> 10946 | GK93: =FIB(RC[-100]) -> 10946 | GL93: =FIB(RC[-100]) -> 10946 | GM93: =FIB(RC[-100]) -> 10946 | GN93: =FIB(RC[-100]) -> 10946 | GO93: =FIB(RC[-100]) -> 10946 | GP93: =FIB(RC[-100]) -> 10946 | GQ93: =FIB(RC[-100]) -> 10946 | GR93: =FIB(RC[-100]) -> 10946
A94: 20 | B94: 20 | C94: 20 | D94: 20 | E94: 20 | F94: 20 | G94: 20 | H94: 20 | I94: 20 | J94: 20 | K94: 20 | L94: 20 | M94: 20 | N94: 20 | O94: 20 | P94: 20 | Q94: 20 | R94: 20 | S94: 20 | T94: 20 | U94: 20 | V94: 20 | W94: 20 | X94: 20 | Y94: 20 | Z94: 20 | AA94: 20 | AB94: 20 | AC94: 20 | AD94: 20 | AE94: 20 | AF94: 20 | AG94: 20 | AH94: 20 | AI94: 20 | AJ94: 20 | AK94: 20 | AL94: 20 | AM94: 20 | AN94: 20 | AO94: 20 | AP94: 20 | AQ94: 20 | AR94: 20 | AS94: 20 | AT94: 20 | AU94: 20 | AV94: 20 | AW94: 20 | AX94: 20 | AY94: 20 | AZ94: 20 | BA94: 20 | BB94: 20 | BC94: 20 | BD94: 20 | BE94: 20 | BF94: 20 | BG94: 20 | BH94: 20 | BI94: 20 | BJ94: 20 | BK94: 20 | BL94: 20 | BM94: 20 | BN94: 20 | BO94: 20 | BP94: 20 | BQ94: 20 | BR94: 20 | BS94: 20 | BT94: 20 | BU94: 20 | BV94: 20 | BW94: 20 | BX94: 20 | BY94: 20 | BZ94: 20 | CA94: 20 | CB94: 20 | CC94: 20 | CD94: 20 | CE94: 20 | CF94: 20 | CG94: 20 | CH94: 20 | CI94: 20 | CJ94: 20 | CK94: 20 | CL94: 20 | CM94: 20 | CN94: 20 | CO94: 20 | CP94: 20 | CQ94: 20 | CR94: 20 | CS94: 20 | CT94: 20 | CU94: 20 | CV94: 20 | CW94: =FIB(RC[-100]) -> 10946 | CX94: =FIB(RC[-100]) -> 10946 | CY94: =FIB(RC[-100]) -> 10946 | CZ94: =FIB(RC[-100]) -> 10946 | DA94: =FIB(RC[-100]) -> 10946 | DB94: =FIB(RC[-100]) -> 10946 | DC94: =FIB(RC[-100]) -> 10946 | DD94: =FIB(RC[-100]) -> 10946 | DE94: =FIB(RC[-100]) -> 10946 | DF94: =FIB(RC[-100]) -> 10946 | DG94: =FIB(RC[-100]) -> 10946 | DH94: =FIB(RC[-100]) -> 10946 | DI94: =FIB(RC[-100]) -> 10946 | DJ94: =FIB(RC[-100]) -> 10946 | DK94: =FIB(RC[-100]) -> 10946 | DL94: =FIB(RC[-100]) -> 10946 | DM94: =FIB(RC[-100]) -> 10946 | DN94: =FIB(RC[-100]) -> 10946 | DO94: =FIB(RC[-100]) -> 10946 | DP94: =FIB(RC[-100]) -> 10946 | DQ94: =FIB(RC[-100]) -> 10946 | DR94: =FIB(RC[-100]) -> 10946 | DS94: =FIB(RC[-100]) -> 10946 | DT94: =FIB(RC[-100]) -> 10946 | DU94: =FIB(RC[-100]) -> 10946 | DV94: =FIB(RC[-100]) -> 10946 | DW94: =FIB(RC[-100]) -> 10946 | DX94: =FIB(RC[-100]) -> 10946 | DY94: =FIB(RC[-100]) -> 10946 | DZ94: =FIB(RC[-100]) -> 10946 | EA94: =FIB(RC[-100]) -> 10946 | EB94: =FIB(RC[-100]) -> 10946 | EC94: =FIB(RC[-100]) -> 10946 | ED94: =FIB(RC[-100]) -> 10946 | EE94: =FIB(RC[-100]) -> 10946 | EF94: =FIB(RC[-100]) -> 10946 | EG94: =FIB(RC[-100]) -> 10946 | EH94: =FIB(RC[-100]) -> 10946 | EI94: =FIB(RC[-100]) -> 10946 | EJ94: =FIB(RC[-100]) -> 10946 | EK94: =FIB(RC[-100]) -> 10946 | EL94: =FIB(RC[-100]) -> 10946 | EM94: =FIB(RC[-100]) -> 10946 | EN94: =FIB(RC[-100]) -> 10946 | EO94: =FIB(RC[-100]) -> 10946 | EP94: =FIB(RC[-100]) -> 10946 | EQ94: =FIB(RC[-100]) -> 10946 | ER94: =FIB(RC[-100]) -> 10946 | ES94: =FIB(RC[-100]) -> 10946 | ET94: =FIB(RC[-100]) -> 10946 | EU94: =FIB(RC[-100]) -> 10946 | EV94: =FIB(RC[-100]) -> 10946 | EW94: =FIB(RC[-100]) -> 10946 | EX94: =FIB(RC[-100]) -> 10946 | EY94: =FIB(RC[-100]) -> 10946 | EZ94: =FIB(RC[-100]) -> 10946 | FA94: =FIB(RC[-100]) -> 10946 | FB94: =FIB(RC[-100]) -> 10946 | FC94: =FIB(RC[-100]) -> 10946 | FD94: =FIB(RC[-100]) -> 10946 | FE94: =FIB(RC[-100]) -> 10946 | FF94: =FIB(RC[-100]) -> 10946 | FG94: =FIB(RC[-100]) -> 10946 | FH94: =FIB(RC[-100]) -> 10946 | FI94: =FIB(RC[-100]) -> 10946 | FJ94: =FIB(RC[-100]) -> 10946 | FK94: =FIB(RC[-100]) -> 10946 | FL94: =FIB(RC[-100]) -> 10946 | FM94: =FIB(RC[-100]) -> 10946 | FN94: =FIB(RC[-100]) -> 10946 | FO94: =FIB(RC[-100]) -> 10946 | FP94: =FIB(RC[-100]) -> 10946 | FQ94: =FIB(RC[-100]) -> 10946 | FR94: =FIB(RC[-100]) -> 10946 | FS94: =FIB(RC[-100]) -> 10946 | FT94: =FIB(RC[-100]) -> 10946 | FU94: =FIB(RC[-100]) -> 10946 | FV94: =FIB(RC[-100]) -> 10946 | FW94: =FIB(RC[-100]) -> 10946 | FX94: =FIB(RC[-100]) -> 10946 | FY94: =FIB(RC[-100]) -> 10946 | FZ94: =FIB(RC[-100]) -> 10946 | GA94: =FIB(RC[-100]) -> 10946 | GB94: =FIB(RC[-100]) -> 10946 | GC94: =FIB(RC[-100]) -> 10946 | GD94: =FIB(RC[-100]) -> 10946 | GE94: =FIB(RC[-100]) -> 10946 | GF94: =FIB(RC[-100]) -> 10946 | GG94: =FIB(RC[-100]) -> 10946 | GH94: =FIB(RC[-100]) -> 10946 | GI94: =FIB(RC[-100]) -> 10946 | GJ94: =FIB(RC[-100]) -> 10946 | GK94: =FIB(RC[-100]) -> 10946 | GL94: =FIB(RC[-100]) -> 10946 | GM94: =FIB(RC[-100]) -> 10946 | GN94: =FIB(RC[-100]) -> 10946 | GO94: =FIB(RC[-100]) -> 10946 | GP94: =FIB(RC[-100]) -> 10946 | GQ94: =FIB(RC[-100]) -> 10946 | GR94: =FIB(RC[-100]) -> 10946
A95: 20 | B95: 20 | C95: 20 | D95: 20 | E95: 20 | F95: 20 | G95: 20 | H95: 20 | I95: 20 | J95: 20 | K95: 20 | L95: 20 | M95: 20 | N95: 20 | O95: 20 | P95: 20 | Q95: 20 | R95: 20 | S95: 20 | T95: 20 | U95: 20 | V95: 20 | W95: 20 | X95: 20 | Y95: 20 | Z95: 20 | AA95: 20 | AB95: 20 | AC95: 20 | AD95: 20 | AE95: 20 | AF95: 20 | AG95: 20 | AH95: 20 | AI95: 20 | AJ95: 20 | AK95: 20 | AL95: 20 | AM95: 20 | AN95: 20 | AO95: 20 | AP95: 20 | AQ95: 20 | AR95: 20 | AS95: 20 | AT95: 20 | AU95: 20 | AV95: 20 | AW95: 20 | AX95: 20 | AY95: 20 | AZ95: 20 | BA95: 20 | BB95: 20 | BC95: 20 | BD95: 20 | BE95: 20 | BF95: 20 | BG95: 20 | BH95: 20 | BI95: 20 | BJ95: 20 | BK95: 20 | BL95: 20 | BM95: 20 | BN95: 20 | BO95: 20 | BP95: 20 | BQ95: 20 | BR95: 20 | BS95: 20 | BT95: 20 | BU95: 20 | BV95: 20 | BW95: 20 | BX95: 20 | BY95: 20 | BZ95: 20 | CA95: 20 | CB95: 20 | CC95: 20 | CD95: 20 | CE95: 20 | CF95: 20 | CG95: 20 | CH95: 20 | CI95: 20 | CJ95: 20 | CK95: 20 | CL95: 20 | CM95: 20 | CN95: 20 | CO95: 20 | CP95: 20 | CQ95: 20 | CR95: 20 | CS95: 20 | CT95: 20 | CU95: 20 | CV95: 20 | CW95: =FIB(RC[-100]) -> 10946 | CX95: =FIB(RC[-100]) -> 10946 | CY95: =FIB(RC[-100]) -> 10946 | CZ95: =FIB(RC[-100]) -> 10946 | DA95: =FIB(RC[-100]) -> 10946 | DB95: =FIB(RC[-100]) -> 10946 | DC95: =FIB(RC[-100]) -> 10946 | DD95: =FIB(RC[-100]) -> 10946 | DE95: =FIB(RC[-100]) -> 10946 | DF95: =FIB(RC[-100]) -> 10946 | DG95: =FIB(RC[-100]) -> 10946 | DH95: =FIB(RC[-100]) -> 10946 | DI95: =FIB(RC[-100]) -> 10946 | DJ95: =FIB(RC[-100]) -> 10946 | DK95: =FIB(RC[-100]) -> 10946 | DL95: =FIB(RC[-100]) -> 10946 | DM95: =FIB(RC[-100]) -> 10946 | DN95: =FIB(RC[-100]) -> 10946 | DO95: =FIB(RC[-100]) -> 10946 | DP95: =FIB(RC[-100]) -> 10946 | DQ95: =FIB(RC[-100]) -> 10946 | DR95: =FIB(RC[-100]) -> 10946 | DS95: =FIB(RC[-100]) -> 10946 | DT95: =FIB(RC[-100]) -> 10946 | DU95: =FIB(RC[-100]) -> 10946 | DV95: =FIB(RC[-100]) -> 10946 | DW95: =FIB(RC[-100]) -> 10946 | DX95: =FIB(RC[-100]) -> 10946 | DY95: =FIB(RC[-100]) -> 10946 | DZ95: =FIB(RC[-100]) -> 10946 | EA95: =FIB(RC[-100]) -> 10946 | EB95: =FIB(RC[-100]) -> 10946 | EC95: =FIB(RC[-100]) -> 10946 | ED95: =FIB(RC[-100]) -> 10946 | EE95: =FIB(RC[-100]) -> 10946 | EF95: =FIB(RC[-100]) -> 10946 | EG95: =FIB(RC[-100]) -> 10946 | EH95: =FIB(RC[-100]) -> 10946 | EI95: =FIB(RC[-100]) -> 10946 | EJ95: =FIB(RC[-100]) -> 10946 | EK95: =FIB(RC[-100]) -> 10946 | EL95: =FIB(RC[-100]) -> 10946 | EM95: =FIB(RC[-100]) -> 10946 | EN95: =FIB(RC[-100]) -> 10946 | EO95: =FIB(RC[-100]) -> 10946 | EP95: =FIB(RC[-100]) -> 10946 | EQ95: =FIB(RC[-100]) -> 10946 | ER95: =FIB(RC[-100]) -> 10946 | ES95: =FIB(RC[-100]) -> 10946 | ET95: =FIB(RC[-100]) -> 10946 | EU95: =FIB(RC[-100]) -> 10946 | EV95: =FIB(RC[-100]) -> 10946 | EW95: =FIB(RC[-100]) -> 10946 | EX95: =FIB(RC[-100]) -> 10946 | EY95: =FIB(RC[-100]) -> 10946 | EZ95: =FIB(RC[-100]) -> 10946 | FA95: =FIB(RC[-100]) -> 10946 | FB95: =FIB(RC[-100]) -> 10946 | FC95: =FIB(RC[-100]) -> 10946 | FD95: =FIB(RC[-100]) -> 10946 | FE95: =FIB(RC[-100]) -> 10946 | FF95: =FIB(RC[-100]) -> 10946 | FG95: =FIB(RC[-100]) -> 10946 | FH95: =FIB(RC[-100]) -> 10946 | FI95: =FIB(RC[-100]) -> 10946 | FJ95: =FIB(RC[-100]) -> 10946 | FK95: =FIB(RC[-100]) -> 10946 | FL95: =FIB(RC[-100]) -> 10946 | FM95: =FIB(RC[-100]) -> 10946 | FN95: =FIB(RC[-100]) -> 10946 | FO95: =FIB(RC[-100]) -> 10946 | FP95: =FIB(RC[-100]) -> 10946 | FQ95: =FIB(RC[-100]) -> 10946 | FR95: =FIB(RC[-100]) -> 10946 | FS95: =FIB(RC[-100]) -> 10946 | FT95: =FIB(RC[-100]) -> 10946 | FU95: =FIB(RC[-100]) -> 10946 | FV95: =FIB(RC[-100]) -> 10946 | FW95: =FIB(RC[-100]) -> 10946 | FX95: =FIB(RC[-100]) -> 10946 | FY95: =FIB(RC[-100]) -> 10946 | FZ95: =FIB(RC[-100]) -> 10946 | GA95: =FIB(RC[-100]) -> 10946 | GB95: =FIB(RC[-100]) -> 10946 | GC95: =FIB(RC[-100]) -> 10946 | GD95: =FIB(RC[-100]) -> 10946 | GE95: =FIB(RC[-100]) -> 10946 | GF95: =FIB(RC[-100]) -> 10946 | GG95: =FIB(RC[-100]) -> 10946 | GH95: =FIB(RC[-100]) -> 10946 | GI95: =FIB(RC[-100]) -> 10946 | GJ95: =FIB(RC[-100]) -> 10946 | GK95: =FIB(RC[-100]) -> 10946 | GL95: =FIB(RC[-100]) -> 10946 | GM95: =FIB(RC[-100]) -> 10946 | GN95: =FIB(RC[-100]) -> 10946 | GO95: =FIB(RC[-100]) -> 10946 | GP95: =FIB(RC[-100]) -> 10946 | GQ95: =FIB(RC[-100]) -> 10946 | GR95: =FIB(RC[-100]) -> 10946
A96: 20 | B96: 20 | C96: 20 | D96: 20 | E96: 20 | F96: 20 | G96: 20 | H96: 20 | I96: 20 | J96: 20 | K96: 20 | L96: 20 | M96: 20 | N96: 20 | O96: 20 | P96: 20 | Q96: 20 | R96: 20 | S96: 20 | T96: 20 | U96: 20 | V96: 20 | W96: 20 | X96: 20 | Y96: 20 | Z96: 20 | AA96: 20 | AB96: 20 | AC96: 20 | AD96: 20 | AE96: 20 | AF96: 20 | AG96: 20 | AH96: 20 | AI96: 20 | AJ96: 20 | AK96: 20 | AL96: 20 | AM96: 20 | AN96: 20 | AO96: 20 | AP96: 20 | AQ96: 20 | AR96: 20 | AS96: 20 | AT96: 20 | AU96: 20 | AV96: 20 | AW96: 20 | AX96: 20 | AY96: 20 | AZ96: 20 | BA96: 20 | BB96: 20 | BC96: 20 | BD96: 20 | BE96: 20 | BF96: 20 | BG96: 20 | BH96: 20 | BI96: 20 | BJ96: 20 | BK96: 20 | BL96: 20 | BM96: 20 | BN96: 20 | BO96: 20 | BP96: 20 | BQ96: 20 | BR96: 20 | BS96: 20 | BT96: 20 | BU96: 20 | BV96: 20 | BW96: 20 | BX96: 20 | BY96: 20 | BZ96: 20 | CA96: 20 | CB96: 20 | CC96: 20 | CD96: 20 | CE96: 20 | CF96: 20 | CG96: 20 | CH96: 20 | CI96: 20 | CJ96: 20 | CK96: 20 | CL96: 20 | CM96: 20 | CN96: 20 | CO96: 20 | CP96: 20 | CQ96: 20 | CR96: 20 | CS96: 20 | CT96: 20 | CU96: 20 | CV96: 20 | CW96: =FIB(RC[-100]) -> 10946 | CX96: =FIB(RC[-100]) -> 10946 | CY96: =FIB(RC[-100]) -> 10946 | CZ96: =FIB(RC[-100]) -> 10946 | DA96: =FIB(RC[-100]) -> 10946 | DB96: =FIB(RC[-100]) -> 10946 | DC96: =FIB(RC[-100]) -> 10946 | DD96: =FIB(RC[-100]) -> 10946 | DE96: =FIB(RC[-100]) -> 10946 | DF96: =FIB(RC[-100]) -> 10946 | DG96: =FIB(RC[-100]) -> 10946 | DH96: =FIB(RC[-100]) -> 10946 | DI96: =FIB(RC[-100]) -> 10946 | DJ96: =FIB(RC[-100]) -> 10946 | DK96: =FIB(RC[-100]) -> 10946 | DL96: =FIB(RC[-100]) -> 10946 | DM96: =FIB(RC[-100]) -> 10946 | DN96: =FIB(RC[-100]) -> 10946 | DO96: =FIB(RC[-100]) -> 10946 | DP96: =FIB(RC[-100]) -> 10946 | DQ96: =FIB(RC[-100]) -> 10946 | DR96: =FIB(RC[-100]) -> 10946 | DS96: =FIB(RC[-100]) -> 10946 | DT96: =FIB(RC[-100]) -> 10946 | DU96: =FIB(RC[-100]) -> 10946 | DV96: =FIB(RC[-100]) -> 10946 | DW96: =FIB(RC[-100]) -> 10946 | DX96: =FIB(RC[-100]) -> 10946 | DY96: =FIB(RC[-100]) -> 10946 | DZ96: =FIB(RC[-100]) -> 10946 | EA96: =FIB(RC[-100]) -> 10946 | EB96: =FIB(RC[-100]) -> 10946 | EC96: =FIB(RC[-100]) -> 10946 | ED96: =FIB(RC[-100]) -> 10946 | EE96: =FIB(RC[-100]) -> 10946 | EF96: =FIB(RC[-100]) -> 10946 | EG96: =FIB(RC[-100]) -> 10946 | EH96: =FIB(RC[-100]) -> 10946 | EI96: =FIB(RC[-100]) -> 10946 | EJ96: =FIB(RC[-100]) -> 10946 | EK96: =FIB(RC[-100]) -> 10946 | EL96: =FIB(RC[-100]) -> 10946 | EM96: =FIB(RC[-100]) -> 10946 | EN96: =FIB(RC[-100]) -> 10946 | EO96: =FIB(RC[-100]) -> 10946 | EP96: =FIB(RC[-100]) -> 10946 | EQ96: =FIB(RC[-100]) -> 10946 | ER96: =FIB(RC[-100]) -> 10946 | ES96: =FIB(RC[-100]) -> 10946 | ET96: =FIB(RC[-100]) -> 10946 | EU96: =FIB(RC[-100]) -> 10946 | EV96: =FIB(RC[-100]) -> 10946 | EW96: =FIB(RC[-100]) -> 10946 | EX96: =FIB(RC[-100]) -> 10946 | EY96: =FIB(RC[-100]) -> 10946 | EZ96: =FIB(RC[-100]) -> 10946 | FA96: =FIB(RC[-100]) -> 10946 | FB96: =FIB(RC[-100]) -> 10946 | FC96: =FIB(RC[-100]) -> 10946 | FD96: =FIB(RC[-100]) -> 10946 | FE96: =FIB(RC[-100]) -> 10946 | FF96: =FIB(RC[-100]) -> 10946 | FG96: =FIB(RC[-100]) -> 10946 | FH96: =FIB(RC[-100]) -> 10946 | FI96: =FIB(RC[-100]) -> 10946 | FJ96: =FIB(RC[-100]) -> 10946 | FK96: =FIB(RC[-100]) -> 10946 | FL96: =FIB(RC[-100]) -> 10946 | FM96: =FIB(RC[-100]) -> 10946 | FN96: =FIB(RC[-100]) -> 10946 | FO96: =FIB(RC[-100]) -> 10946 | FP96: =FIB(RC[-100]) -> 10946 | FQ96: =FIB(RC[-100]) -> 10946 | FR96: =FIB(RC[-100]) -> 10946 | FS96: =FIB(RC[-100]) -> 10946 | FT96: =FIB(RC[-100]) -> 10946 | FU96: =FIB(RC[-100]) -> 10946 | FV96: =FIB(RC[-100]) -> 10946 | FW96: =FIB(RC[-100]) -> 10946 | FX96: =FIB(RC[-100]) -> 10946 | FY96: =FIB(RC[-100]) -> 10946 | FZ96: =FIB(RC[-100]) -> 10946 | GA96: =FIB(RC[-100]) -> 10946 | GB96: =FIB(RC[-100]) -> 10946 | GC96: =FIB(RC[-100]) -> 10946 | GD96: =FIB(RC[-100]) -> 10946 | GE96: =FIB(RC[-100]) -> 10946 | GF96: =FIB(RC[-100]) -> 10946 | GG96: =FIB(RC[-100]) -> 10946 | GH96: =FIB(RC[-100]) -> 10946 | GI96: =FIB(RC[-100]) -> 10946 | GJ96: =FIB(RC[-100]) -> 10946 | GK96: =FIB(RC[-100]) -> 10946 | GL96: =FIB(RC[-100]) -> 10946 | GM96: =FIB(RC[-100]) -> 10946 | GN96: =FIB(RC[-100]) -> 10946 | GO96: =FIB(RC[-100]) -> 10946 | GP96: =FIB(RC[-100]) -> 10946 | GQ96: =FIB(RC[-100]) -> 10946 | GR96: =FIB(RC[-100]) -> 10946
A97: 20 | B97: 20 | C97: 20 | D97: 20 | E97: 20 | F97: 20 | G97: 20 | H97: 20 | I97: 20 | J97: 20 | K97: 20 | L97: 20 | M97: 20 | N97: 20 | O97: 20 | P97: 20 | Q97: 20 | R97: 20 | S97: 20 | T97: 20 | U97: 20 | V97: 20 | W97: 20 | X97: 20 | Y97: 20 | Z97: 20 | AA97: 20 | AB97: 20 | AC97: 20 | AD97: 20 | AE97: 20 | AF97: 20 | AG97: 20 | AH97: 20 | AI97: 20 | AJ97: 20 | AK97: 20 | AL97: 20 | AM97: 20 | AN97: 20 | AO97: 20 | AP97: 20 | AQ97: 20 | AR97: 20 | AS97: 20 | AT97: 20 | AU97: 20 | AV97: 20 | AW97: 20 | AX97: 20 | AY97: 20 | AZ97: 20 | BA97: 20 | BB97: 20 | BC97: 20 | BD97: 20 | BE97: 20 | BF97: 20 | BG97: 20 | BH97: 20 | BI97: 20 | BJ97: 20 | BK97: 20 | BL97: 20 | BM97: 20 | BN97: 20 | BO97: 20 | BP97: 20 | BQ97: 20 | BR97: 20 | BS97: 20 | BT97: 20 | BU97: 20 | BV97: 20 | BW97: 20 | BX97: 20 | BY97: 20 | BZ97: 20 | CA97: 20 | CB97: 20 | CC97: 20 | CD97: 20 | CE97: 20 | CF97: 20 | CG97: 20 | CH97: 20 | CI97: 20 | CJ97: 20 | CK97: 20 | CL97: 20 | CM97: 20 | CN97: 20 | CO97: 20 | CP97: 20 | CQ97: 20 | CR97: 20 | CS97: 20 | CT97: 20 | CU97: 20 | CV97: 20 | CW97: =FIB(RC[-100]) -> 10946 | CX97: =FIB(RC[-100]) -> 10946 | CY97: =FIB(RC[-100]) -> 10946 | CZ97: =FIB(RC[-100]) -> 10946 | DA97: =FIB(RC[-100]) -> 10946 | DB97: =FIB(RC[-100]) -> 10946 | DC97: =FIB(RC[-100]) -> 10946 | DD97: =FIB(RC[-100]) -> 10946 | DE97: =FIB(RC[-100]) -> 10946 | DF97: =FIB(RC[-100]) -> 10946 | DG97: =FIB(RC[-100]) -> 10946 | DH97: =FIB(RC[-100]) -> 10946 | DI97: =FIB(RC[-100]) -> 10946 | DJ97: =FIB(RC[-100]) -> 10946 | DK97: =FIB(RC[-100]) -> 10946 | DL97: =FIB(RC[-100]) -> 10946 | DM97: =FIB(RC[-100]) -> 10946 | DN97: =FIB(RC[-100]) -> 10946 | DO97: =FIB(RC[-100]) -> 10946 | DP97: =FIB(RC[-100]) -> 10946 | DQ97: =FIB(RC[-100]) -> 10946 | DR97: =FIB(RC[-100]) -> 10946 | DS97: =FIB(RC[-100]) -> 10946 | DT97: =FIB(RC[-100]) -> 10946 | DU97: =FIB(RC[-100]) -> 10946 | DV97: =FIB(RC[-100]) -> 10946 | DW97: =FIB(RC[-100]) -> 10946 | DX97: =FIB(RC[-100]) -> 10946 | DY97: =FIB(RC[-100]) -> 10946 | DZ97: =FIB(RC[-100]) -> 10946 | EA97: =FIB(RC[-100]) -> 10946 | EB97: =FIB(RC[-100]) -> 10946 | EC97: =FIB(RC[-100]) -> 10946 | ED97: =FIB(RC[-100]) -> 10946 | EE97: =FIB(RC[-100]) -> 10946 | EF97: =FIB(RC[-100]) -> 10946 | EG97: =FIB(RC[-100]) -> 10946 | EH97: =FIB(RC[-100]) -> 10946 | EI97: =FIB(RC[-100]) -> 10946 | EJ97: =FIB(RC[-100]) -> 10946 | EK97: =FIB(RC[-100]) -> 10946 | EL97: =FIB(RC[-100]) -> 10946 | EM97: =FIB(RC[-100]) -> 10946 | EN97: =FIB(RC[-100]) -> 10946 | EO97: =FIB(RC[-100]) -> 10946 | EP97: =FIB(RC[-100]) -> 10946 | EQ97: =FIB(RC[-100]) -> 10946 | ER97: =FIB(RC[-100]) -> 10946 | ES97: =FIB(RC[-100]) -> 10946 | ET97: =FIB(RC[-100]) -> 10946 | EU97: =FIB(RC[-100]) -> 10946 | EV97: =FIB(RC[-100]) -> 10946 | EW97: =FIB(RC[-100]) -> 10946 | EX97: =FIB(RC[-100]) -> 10946 | EY97: =FIB(RC[-100]) -> 10946 | EZ97: =FIB(RC[-100]) -> 10946 | FA97: =FIB(RC[-100]) -> 10946 | FB97: =FIB(RC[-100]) -> 10946 | FC97: =FIB(RC[-100]) -> 10946 | FD97: =FIB(RC[-100]) -> 10946 | FE97: =FIB(RC[-100]) -> 10946 | FF97: =FIB(RC[-100]) -> 10946 | FG97: =FIB(RC[-100]) -> 10946 | FH97: =FIB(RC[-100]) -> 10946 | FI97: =FIB(RC[-100]) -> 10946 | FJ97: =FIB(RC[-100]) -> 10946 | FK97: =FIB(RC[-100]) -> 10946 | FL97: =FIB(RC[-100]) -> 10946 | FM97: =FIB(RC[-100]) -> 10946 | FN97: =FIB(RC[-100]) -> 10946 | FO97: =FIB(RC[-100]) -> 10946 | FP97: =FIB(RC[-100]) -> 10946 | FQ97: =FIB(RC[-100]) -> 10946 | FR97: =FIB(RC[-100]) -> 10946 | FS97: =FIB(RC[-100]) -> 10946 | FT97: =FIB(RC[-100]) -> 10946 | FU97: =FIB(RC[-100]) -> 10946 | FV97: =FIB(RC[-100]) -> 10946 | FW97: =FIB(RC[-100]) -> 10946 | FX97: =FIB(RC[-100]) -> 10946 | FY97: =FIB(RC[-100]) -> 10946 | FZ97: =FIB(RC[-100]) -> 10946 | GA97: =FIB(RC[-100]) -> 10946 | GB97: =FIB(RC[-100]) -> 10946 | GC97: =FIB(RC[-100]) -> 10946 | GD97: =FIB(RC[-100]) -> 10946 | GE97: =FIB(RC[-100]) -> 10946 | GF97: =FIB(RC[-100]) -> 10946 | GG97: =FIB(RC[-100]) -> 10946 | GH97: =FIB(RC[-100]) -> 10946 | GI97: =FIB(RC[-100]) -> 10946 | GJ97: =FIB(RC[-100]) -> 10946 | GK97: =FIB(RC[-100]) -> 10946 | GL97: =FIB(RC[-100]) -> 10946 | GM97: =FIB(RC[-100]) -> 10946 | GN97: =FIB(RC[-100]) -> 10946 | GO97: =FIB(RC[-100]) -> 10946 | GP97: =FIB(RC[-100]) -> 10946 | GQ97: =FIB(RC[-100]) -> 10946 | GR97: =FIB(RC[-100]) -> 10946
A98: 20 | B98: 20 | C98: 20 | D98: 20 | E98: 20 | F98: 20 | G98: 20 | H98: 20 | I98: 20 | J98: 20 | K98: 20 | L98: 20 | M98: 20 | N98: 20 | O98: 20 | P98: 20 | Q98: 20 | R98: 20 | S98: 20 | T98: 20 | U98: 20 | V98: 20 | W98: 20 | X98: 20 | Y98: 20 | Z98: 20 | AA98: 20 | AB98: 20 | AC98: 20 | AD98: 20 | AE98: 20 | AF98: 20 | AG98: 20 | AH98: 20 | AI98: 20 | AJ98: 20 | AK98: 20 | AL98: 20 | AM98: 20 | AN98: 20 | AO98: 20 | AP98: 20 | AQ98: 20 | AR98: 20 | AS98: 20 | AT98: 20 | AU98: 20 | AV98: 20 | AW98: 20 | AX98: 20 | AY98: 20 | AZ98: 20 | BA98: 20 | BB98: 20 | BC98: 20 | BD98: 20 | BE98: 20 | BF98: 20 | BG98: 20 | BH98: 20 | BI98: 20 | BJ98: 20 | BK98: 20 | BL98: 20 | BM98: 20 | BN98: 20 | BO98: 20 | BP98: 20 | BQ98: 20 | BR98: 20 | BS98: 20 | BT98: 20 | BU98: 20 | BV98: 20 | BW98: 20 | BX98: 20 | BY98: 20 | BZ98: 20 | CA98: 20 | CB98: 20 | CC98: 20 | CD98: 20 | CE98: 20 | CF98: 20 | CG98: 20 | CH98: 20 | CI98: 20 | CJ98: 20 | CK98: 20 | CL98: 20 | CM98: 20 | CN98: 20 | CO98: 20 | CP98: 20 | CQ98: 20 | CR98: 20 | CS98: 20 | CT98: 20 | CU98: 20 | CV98: 20 | CW98: =FIB(RC[-100]) -> 10946 | CX98: =FIB(RC[-100]) -> 10946 | CY98: =FIB(RC[-100]) -> 10946 | CZ98: =FIB(RC[-100]) -> 10946 | DA98: =FIB(RC[-100]) -> 10946 | DB98: =FIB(RC[-100]) -> 10946 | DC98: =FIB(RC[-100]) -> 10946 | DD98: =FIB(RC[-100]) -> 10946 | DE98: =FIB(RC[-100]) -> 10946 | DF98: =FIB(RC[-100]) -> 10946 | DG98: =FIB(RC[-100]) -> 10946 | DH98: =FIB(RC[-100]) -> 10946 | DI98: =FIB(RC[-100]) -> 10946 | DJ98: =FIB(RC[-100]) -> 10946 | DK98: =FIB(RC[-100]) -> 10946 | DL98: =FIB(RC[-100]) -> 10946 | DM98: =FIB(RC[-100]) -> 10946 | DN98: =FIB(RC[-100]) -> 10946 | DO98: =FIB(RC[-100]) -> 10946 | DP98: =FIB(RC[-100]) -> 10946 | DQ98: =FIB(RC[-100]) -> 10946 | DR98: =FIB(RC[-100]) -> 10946 | DS98: =FIB(RC[-100]) -> 10946 | DT98: =FIB(RC[-100]) -> 10946 | DU98: =FIB(RC[-100]) -> 10946 | DV98: =FIB(RC[-100]) -> 10946 | DW98: =FIB(RC[-100]) -> 10946 | DX98: =FIB(RC[-100]) -> 10946 | DY98: =FIB(RC[-100]) -> 10946 | DZ98: =FIB(RC[-100]) -> 10946 | EA98: =FIB(RC[-100]) -> 10946 | EB98: =FIB(RC[-100]) -> 10946 | EC98: =FIB(RC[-100]) -> 10946 | ED98: =FIB(RC[-100]) -> 10946 | EE98: =FIB(RC[-100]) -> 10946 | EF98: =FIB(RC[-100]) -> 10946 | EG98: =FIB(RC[-100]) -> 10946 | EH98: =FIB(RC[-100]) -> 10946 | EI98: =FIB(RC[-100]) -> 10946 | EJ98: =FIB(RC[-100]) -> 10946 | EK98: =FIB(RC[-100]) -> 10946 | EL98: =FIB(RC[-100]) -> 10946 | EM98: =FIB(RC[-100]) -> 10946 | EN98: =FIB(RC[-100]) -> 10946 | EO98: =FIB(RC[-100]) -> 10946 | EP98: =FIB(RC[-100]) -> 10946 | EQ98: =FIB(RC[-100]) -> 10946 | ER98: =FIB(RC[-100]) -> 10946 | ES98: =FIB(RC[-100]) -> 10946 | ET98: =FIB(RC[-100]) -> 10946 | EU98: =FIB(RC[-100]) -> 10946 | EV98: =FIB(RC[-100]) -> 10946 | EW98: =FIB(RC[-100]) -> 10946 | EX98: =FIB(RC[-100]) -> 10946 | EY98: =FIB(RC[-100]) -> 10946 | EZ98: =FIB(RC[-100]) -> 10946 | FA98: =FIB(RC[-100]) -> 10946 | FB98: =FIB(RC[-100]) -> 10946 | FC98: =FIB(RC[-100]) -> 10946 | FD98: =FIB(RC[-100]) -> 10946 | FE98: =FIB(RC[-100]) -> 10946 | FF98: =FIB(RC[-100]) -> 10946 | FG98: =FIB(RC[-100]) -> 10946 | FH98: =FIB(RC[-100]) -> 10946 | FI98: =FIB(RC[-100]) -> 10946 | FJ98: =FIB(RC[-100]) -> 10946 | FK98: =FIB(RC[-100]) -> 10946 | FL98: =FIB(RC[-100]) -> 10946 | FM98: =FIB(RC[-100]) -> 10946 | FN98: =FIB(RC[-100]) -> 10946 | FO98: =FIB(RC[-100]) -> 10946 | FP98: =FIB(RC[-100]) -> 10946 | FQ98: =FIB(RC[-100]) -> 10946 | FR98: =FIB(RC[-100]) -> 10946 | FS98: =FIB(RC[-100]) -> 10946 | FT98: =FIB(RC[-100]) -> 10946 | FU98: =FIB(RC[-100]) -> 10946 | FV98: =FIB(RC[-100]) -> 10946 | FW98: =FIB(RC[-100]) -> 10946 | FX98: =FIB(RC[-100]) -> 10946 | FY98: =FIB(RC[-100]) -> 10946 | FZ98: =FIB(RC[-100]) -> 10946 | GA98: =FIB(RC[-100]) -> 10946 | GB98: =FIB(RC[-100]) -> 10946 | GC98: =FIB(RC[-100]) -> 10946 | GD98: =FIB(RC[-100]) -> 10946 | GE98: =FIB(RC[-100]) -> 10946 | GF98: =FIB(RC[-100]) -> 10946 | GG98: =FIB(RC[-100]) -> 10946 | GH98: =FIB(RC[-100]) -> 10946 | GI98: =FIB(RC[-100]) -> 10946 | GJ98: =FIB(RC[-100]) -> 10946 | GK98: =FIB(RC[-100]) -> 10946 | GL98: =FIB(RC[-100]) -> 10946 | GM98: =FIB(RC[-100]) -> 10946 | GN98: =FIB(RC[-100]) -> 10946 | GO98: =FIB(RC[-100]) -> 10946 | GP98: =FIB(RC[-100]) -> 10946 | GQ98: =FIB(RC[-100]) -> 10946 | GR98: =FIB(RC[-100]) -> 10946
A99: 20 | B99: 20 | C99: 20 | D99: 20 | E99: 20 | F99: 20 | G99: 20 | H99: 20 | I99: 20 | J99: 20 | K99: 20 | L99: 20 | M99: 20 | N99: 20 | O99: 20 | P99: 20 | Q99: 20 | R99: 20 | S99: 20 | T99: 20 | U99: 20 | V99: 20 | W99: 20 | X99: 20 | Y99: 20 | Z99: 20 | AA99: 20 | AB99: 20 | AC99: 20 | AD99: 20 | AE99: 20 | AF99: 20 | AG99: 20 | AH99: 20 | AI99: 20 | AJ99: 20 | AK99: 20 | AL99: 20 | AM99: 20 | AN99: 20 | AO99: 20 | AP99: 20 | AQ99: 20 | AR99: 20 | AS99: 20 | AT99: 20 | AU99: 20 | AV99: 20 | AW99: 20 | AX99: 20 | AY99: 20 | AZ99: 20 | BA99: 20 | BB99: 20 | BC99: 20 | BD99: 20 | BE99: 20 | BF99: 20 | BG99: 20 | BH99: 20 | BI99: 20 | BJ99: 20 | BK99: 20 | BL99: 20 | BM99: 20 | BN99: 20 | BO99: 20 | BP99: 20 | BQ99: 20 | BR99: 20 | BS99: 20 | BT99: 20 | BU99: 20 | BV99: 20 | BW99: 20 | BX99: 20 | BY99: 20 | BZ99: 20 | CA99: 20 | CB99: 20 | CC99: 20 | CD99: 20 | CE99: 20 | CF99: 20 | CG99: 20 | CH99: 20 | CI99: 20 | CJ99: 20 | CK99: 20 | CL99: 20 | CM99: 20 | CN99: 20 | CO99: 20 | CP99: 20 | CQ99: 20 | CR99: 20 | CS99: 20 | CT99: 20 | CU99: 20 | CV99: 20 | CW99: =FIB(RC[-100]) -> 10946 | CX99: =FIB(RC[-100]) -> 10946 | CY99: =FIB(RC[-100]) -> 10946 | CZ99: =FIB(RC[-100]) -> 10946 | DA99: =FIB(RC[-100]) -> 10946 | DB99: =FIB(RC[-100]) -> 10946 | DC99: =FIB(RC[-100]) -> 10946 | DD99: =FIB(RC[-100]) -> 10946 | DE99: =FIB(RC[-100]) -> 10946 | DF99: =FIB(RC[-100]) -> 10946 | DG99: =FIB(RC[-100]) -> 10946 | DH99: =FIB(RC[-100]) -> 10946 | DI99: =FIB(RC[-100]) -> 10946 | DJ99: =FIB(RC[-100]) -> 10946 | DK99: =FIB(RC[-100]) -> 10946 | DL99: =FIB(RC[-100]) -> 10946 | DM99: =FIB(RC[-100]) -> 10946 | DN99: =FIB(RC[-100]) -> 10946 | DO99: =FIB(RC[-100]) -> 10946 | DP99: =FIB(RC[-100]) -> 10946 | DQ99: =FIB(RC[-100]) -> 10946 | DR99: =FIB(RC[-100]) -> 10946 | DS99: =FIB(RC[-100]) -> 10946 | DT99: =FIB(RC[-100]) -> 10946 | DU99: =FIB(RC[-100]) -> 10946 | DV99: =FIB(RC[-100]) -> 10946 | DW99: =FIB(RC[-100]) -> 10946 | DX99: =FIB(RC[-100]) -> 10946 | DY99: =FIB(RC[-100]) -> 10946 | DZ99: =FIB(RC[-100]) -> 10946 | EA99: =FIB(RC[-100]) -> 10946 | EB99: =FIB(RC[-100]) -> 10946 | EC99: =FIB(RC[-100]) -> 10946 | ED99: =FIB(RC[-100]) -> 10946 | EE99: =FIB(RC[-100]) -> 10946 | EF99: =FIB(RC[-100]) -> 10946 | EG99: =FIB(RC[-100]) -> 10946 | EH99: =FIB(RC[-100]) -> 10946 | EI99: =FIB(RC[-100]) -> 10946 | EJ99: =FIB(RC[-100]) -> 10946 | EK99: =FIB(RC[-100]) -> 10946 | EL99: =FIB(RC[-100]) -> 10946 | EM99: =FIB(RC[-100]) -> 10946 | EN99: =FIB(RC[-100]) -> 10946 | EO99: =FIB(RC[-100]) -> 10946 | EP99: =FIB(RC[-100]) -> 10946 | EQ99: =FIB(RC[-100]) -> 10946 | ER99: =FIB(RC[-100]) -> 10946 | ES99: =FIB(RC[-100]) -> 10946 | ET99: =FIB(RC[-100]) -> 10946 | EU99: =FIB(RC[-100]) -> 10946 | EV99: =FIB(RC[-100]) -> 10946 | EW99: =FIB(RC[-100]) -> 10946 | EX99: =FIB(RC[-100]) -> 10946 | EY99: =FIB(RC[-100]) -> 10946 | EZ99: =FIB(RC[-100]) -> 10946 | FA99: =FIB(RC[-100]) -> 10946 | FB99: =FIB(RC[-100]) -> 10946 | FC99: =FIB(RC[-100]) -> 10946 | FD99: =FIB(RC[-100]) -> 10946 | FE99: =FIB(RC[-100]) -> 10946 | FF99: =FIB(RC[-100]) -> 10946 | FG99: =FIB(RC[-100]) -> 10946 | FH99: =FIB(RC[-100]) -> 10946 | FI99: =FIB(RC[-100]) -> 10946 | FJ99: =FIB(RC[-100]) -> 10946 | FK99: =FIB(RC[-100]) -> 10946 | FL99: =FIB(RC[-100]) -> 10946 | FM99: =FIB(RC[-100]) -> 10946 | FN99: =FIB(RC[-100]) -> 10946 | FO99: =FIB(RC[-100]) -> 10946 | FP99: =FIB(RC[-100]) -> 10946 | FQ99: =FIB(RC[-100]) -> 10946 | FR99: =FIB(RC[-100]) -> 10946 | FS99: =FIB(RC[-100]) -> 10946 | FT99: =FIB(RC[-100]) -> 10946 | FU99: =FIB(RC[-100]) -> 10946 | FV99: =FIB(RC[-100]) -> 10946 | FW99: =FIB(RC[-100]) -> 10946 | FX99: =FIB(RC[-100]) -> 10946 | FY99: =FIB(RC[-100]) -> 10946 | FZ99: =FIB(RC[-100]) -> 10946 | GA99: =FIB(RC[-100]) -> 10946 | GB99: =FIB(RC[-100]) -> 10946 | GC99: =FIB(RC[-100]) -> 10946 | GD99: =FIB(RC[-100]) -> 10946 | GE99: =FIB(RC[-100]) -> 10946 | GF99: =FIB(RC[-100]) -> 10946 | GG99: =FIB(RC[-100]) -> 10946 | GH99: =FIB(RC[-100]) -> 10946 | GI99: =FIB(RC[-100]) -> 10946 | GJ99: =FIB(RC[-100]) -> 10946 | GK99: =FIB(RC[-100]) -> 10946 | GL99: =FIB(RC[-100]) -> 10946 | GM99: =FIB(RC[-100]) -> 10946 | GN99: =FIB(RC[-100]) -> 10946 | GO99: =FIB(RC[-100]) -> 10946 | GP99: =FIB(RC[-100]) -> 10946 | GQ99: =FIB(RC[-100]) -> 10946 | GR99: =FIB(RC[-100]) -> 10946
A100: 20 | B100: 20 | C100: 20 | D100: 20 | E100: 20 | F100: 20 | G100: 20 | H100: 20 | I100: 20 | J100: 20 | K100: 20 | L100: 20 | M100: 20 | N100: 20 | O100: 20 | P100: 20 | Q100: 20 | R100: 20 | S100: 20 | T100: 20 | U100: 20 | V100: 20 | W100: 20 | X100: 20 | Y100: 20 | Z100: 20 | AA100: 20 | AB100: 20 | AC100: 20 | AD100: 20 | AE100: 20 | AF100: 20 | AG100: 20 | AH100: 20 | AI100: 20 | AJ100: 20 | AK100: 20 | AL100: 20 | AM100: 20 | AN100: 20 | AO100: 20 | AP100: 20 | AQ100: 20 | AR100: 20 | AS100: 20 | AT100: 20 | AU100: 20 | AV100: 20 | AW100: 20 | AX100: 20 | AY100: 20 | AZ100: 20 | BA100: 20 | BB100: 20 | BC100: 20 | BD100: 20 | BE100: 20 | BF100: 20 | BG100: 20 | BH100: 20 | BI100: 20 | BJ100: 20 | BK100: 20 | BL100: 20 | BM100: 20 | BN100: 20 | BO100: 20 | BP100: 20 | BQ100: 20 | BR100: 20 | BS100: 20 | BT100: 20 | BU100: 20 | BV100: 20 | BW100: 20 | BX100: 20 | BY100: 20 | BZ100: 20 | CA100: 20 | CB100: 20 | CC100: 20 | CD100: 20 | CE100: 20 | CF100: 20 | CG100: 20 | CH100: 20 | CI100: 20 | CJ100: 20 | CK100: 20 | CL100: 20 | CM100: 20 | CN100: 20 | CO100: 20 | CP100: 20 | CQ100: 20 | CR100: 20 | CS100: 20 | CT100: 20 | CU100: 20 | CV100: 20 | CW100: =FIB(RC[-100]) -> 10946 | CX100: =FIB(RC[-100]) -> 10946 | CY100: =FIB(RC[-100]) -> 10946 | CZ100: =FIB(RC[-100]) -> 10946 | DA100: =FIB(RC[-100]) -> 10946 | DB100: =FIB(RC[-100]) -> 10946 | DC100: =FIB(RC[-100]) -> 10946 | DD100: =FIB(RC[-100]) -> 10946 | DE100: =FIB(RC[-100]) -> 10946 | DF100: =FIB(RC[-100]) -> 10946 | DG100: =FIB(RC[-100]) -> 10946 | DH100: =FIB(RC[-100]) -> 10946 | DI100: =FIB(RC[-100]) -> 10946 | DJ100: =FIB(RC[-100]) -> 10946 | DK100: =FIB(RC[-100]) -> 10946 | DL100: =FIB(RC[-100]) -> 10946 | DM100: =FIB(RC[-100]) -> 10946 | DN100: =FIB(RC[-100]) -> 10946 | DO100: =FIB(RC[-100]) -> 10946 | DP100: =FIB(RC[-100]) -> 10946 | DQ100: =FIB(RC[-100]) -> 10946 | DR100: =FIB(RC[-100]) -> 10946 | DS100: =FIB(RC[-100]) -> 10946 | DT100: =FIB(RC[-100]) -> 10946 | DU100: =FIB(RC[-100]) -> 10946 | DV100: =FIB(RC[-100]) -> 10946 | DW100: =FIB(RC[-100]) -> 10946 | DX100: =FIB(RC[-100]) -> 10946 | DY100: =FIB(RC[-100]) -> 10946 | DZ100: =FIB(RC[-100]) -> 10946 | EA100: =FIB(RC[-100]) -> 10946 | EB100: =FIB(RC[-100]) -> 10946 | EC100: =FIB(RC[-100]) -> 10946 | ED100: =FIB(RC[-100]) -> 10946 | EE100: =FIB(RC[-100]) -> 10946 | EF100: =FIB(RC[-100]) -> 10946 | EG100: =FIB(RC[-100]) -> 10946 | EH100: =FIB(RC[-100]) -> 10946 | EI100: =FIB(RC[-100]) -> 10946 | EJ100: =FIB(RC[-100]) -> 10946 | EK100: =FIB(RC[-100]) -> 10946 | EL100: =FIB(RC[-100]) -> 10946 | EM100: =FIB(RC[-100]) -> 10946 | EN100: =FIB(RC[-100]) -> 10946 | EO100: =FIB(RC[-100]) -> 10946 | EP100: =FIB(RC[-100]) -> 10946 | EQ100: =FIB(RC[-100]) -> 10946 | ER100: =FIB(RC[-100]) -> 10946 | ES100: =FIB(RC[-100]) -> 10946 | ET100: =FIB(RC[-100]) -> 10946 | EU100: =FIB(RC[-100]) -> 10946 | EV100: =FIB(RC[-100]) -> 10946 | EW100: =FIB(RC[-100]) -> 10946 | EX100: =FIB(RC[-100]) -> 10946 | EY100: =FIB(RC[-100]) -> 10946 | EZ100: =FIB(RC[-100]) -> 10946 | FA100: =FIB(RC[-100]) -> 10946 | FB100: =FIB(RC[-100]) -> 10946 | FC100: =FIB(RC[-100]) -> 10946 | FD100: =FIB(RC[-100]) -> 10946 | FE100: =FIB(RC[-100]) -> 10946 | FF100: =FIB(RC[-100]) -> 10946 | FG100: =FIB(RC[-100]) -> 10946 | FH100: =FIB(RC[-100]) -> 10946 | FI100: =FIB(RC[-100]) -> 10946 | FJ100: =FIB(RC[-100]) -> 10946 | FK100: =FIB(RC[-100]) -> 10946 | FL100: =FIB(RC[-100]) -> 10946 | FM100: =FIB(RC[-100]) -> 10946 | FN100: =FIB(RC[-100]) -> 10946 | FO100: =FIB(RC[-100]) -> 10946 | FP100: =FIB(RC[-100]) -> 10946 | FQ100: =FIB(RC[-100]) -> 10946 | FR100: =FIB(RC[-100]) -> 10946 | FS100: =FIB(RC[-100]) -> 10946 | FT100: =FIB(RC[-100]) -> 10946 | FU100: =FIB(RC[-100]) -> 10946 | FV100: =FIB(RC[-100]) -> 10946 | FW100: =FIB(RC[-100]) -> 10946 | FX100: =FIB(RC[-100]) -> 10946 | FY100: =FIB(RC[-100]) -> 10946 | FZ100: =FIB(RC[-100]) -> 10946 | GA100: =FIB(RC[-100]) -> 10946 | GB100: =FIB(RC[-100]) -> 10946 | GC100: =FIB(RC[-100]) -> 10946 | GD100: =FIB(RC[-100]) -> 10946 | GE100: =FIB(RC[-100]) -> 10946 | GF100: =FIB(RC[-100]) -> 10946 | GG100: =FIB(RC[-100]) -> 10946 | GH100: =FIB(RC[-100]) -> 10946 | GI100: =FIB(RC[-100]) -> 10946 | GJ100: =FIB(RC[-100]) -> 10946 | GK100: =FIB(RC[-100]) -> 10946 | GL100: =FIB(RC[-100]) -> 10946 | GM100: =FIB(RC[-100]) -> 10946 | GN100: =FIB(RC[-100]) -> 10946 | GO100: =FIB(RC[-100]) -> 10946 | GP100: =FIB(RC[-100]) -> 10946 | GQ100: =FIB(RC[-100]) -> 10946 | GR100: =FIB(RC[-100]) -> 10946

Sheet: @sdf
A1: =DEFINE("FIB", R[+2]C[+1], R[+1]C[+1]) -> FUN FIB AT #0
B2: 10
B3: =IF(R[-1]C<=1, 1, FIB(R[-1]C-1)+FIB(R[-1]C-2)) -> #NAME?