Sheet: prefix
CW1: 0 | CX1: 0 | CY1: 0 | CZ1: 0 | DA1: 0 | DB1: 0 | DC1: 0 | DD1: 0 | DE1: 0 | DF1: 0 | DG1: 0 | DH1: 0 | DI1: 0 | DJ1: 0 | DK1: 0 | DL1: 0 | DM1: 0 | DN1: 0 | DO1: 0 | DP1: 0 | DQ1: 0 | DR1: 0 | DS1: 0 | DT1: 0 | DU1: 0 | DV1: 0 | DW1: 0 | DX1: 0 | DY1: 0 | DZ1: 0 | EA1: 0 | EB1: 0 | EC1: 0 | ED1: 0 | EE1: 0 | EF1: 0 | EG1: 0 | EH1: 0 | EI1: 0 | EJ1: 0 | EK1: 0 | EL1: 0 | EM1: 0 | EN1: 0 | EO1: 0 | EP1: 0 | EQ1: 0 | ER1: 0 | ES1: 0 | ET1: 0 | EU1: 0 | EV1: 0 | EW1: 0 | EX1: 0 | EY1: 0 | EZ1: 0 | FA1: 0 | FB1: 0 | FC1: 0 | FD1: 0 | FE1: 0 | FF1: 0 | FG1: 0 | FH1: 0 | FI1: 0 | FJ1: 0 | FK1: 0 | FL1: 0 | FM1: 0 | FN1: 0 | FO1: 0 | FP1: 0 | FQ1: 0 | FR1: 0 | FS1: 0 | FT1: 0 | FU1: 0 | FV1: 0 | FW1: 0 | FX1: 0 | FY1: 0 | FZ1: 0 | GA1: 0 | GB1: 0 | GC1: 0 | GD1: 0 | GE1: 0 | GF1: 0 | GG1: 0 | GH1: 0 | GI1: 0 | GJ1: 0 | GK1: 0 | GL1: 0 | GM1: 0 | GN1: 0 | GO1: 0 | GP1: 0 | GQ1: 0 | GR1: 0 | GS1: 0
A2: 20 | B2: 20 | C2: 20 | D2: 20 | E2: 20 | F2: 20 | G2: 20 | H2: 20 | I2: 20 | J2: 20 | K2: 20 | L2: 20 | M2: 20 | N2: 20 | O2: 20 | P2: 20 | Q2: 20 | R2: 20 | S2: 20 | T2: 20 | U2: 20 | V2: 20 | W2: 20 | X2: 20 | Y2: 20 | Z2: 20 | AA2: 20 | AB2: 20 | AC2: 20 | AD2: 20 | AE2: 20 | AF2: 20 | AG2: 20 | AH2: 20 | AI2: 20 | AJ2: 20 | AK2: 20 | AL2: 20 | AM2: 20 | AN2: 20 | AO2: 20 | AP2: 20 | AQ2: 20 | AR2: 20 | AS2: 20 | AT2: 20 | AU2: 20 | AV2: 20 | AW2: 20 | AX2: 20 | AY2: 20 | AZ2: 20 | BA2: 20 | BB2: 20 | BC2: 20 | BD2: 20 | BE2: 20 | BF2: 20 | BG2: 20 | BH2: 20 | BI2: 20 | BJ2: 20 | BK2: 20 | BL2: 20 | BM2: 20 | BN2: 20 | BO2: 20 | BP2: 20 | BQ2: 20 | BR2: 20 | BS2: 20 | BT2: 20 | BU2: 20 | BV2: 20 | BW2: 20 | BX2: 20 | BY2: 20 | BZ2: 20 | CA2: 20 | CB2: 20 | CC2: 20 | CD2: 20 | CE2: 20 | CF2: 20 | CG2: 20 | CH2: 20 | CI2: 20 | CJ2: 20 | CK2: 20 | CL2: 20 | CM2: 20 | CN2: 20 | CO2: 20 | CP2: 20 | CQ2: 20 | CR2: 20 | CS2: 20 | CT2: 20 | CU2: 20 | CV2: 20 | CW2: 0 | CX2: =FIB(RC[-101])+RC[-1]+R[-1]C+R[-1]C[-1] -> 10946 | CY2: =FIB(RC[-101])+RC[-1]+R[-1]C+R[-1]C[-1] -> 21892 | CZ2: =FIB(RC[-101])+RC[-1]+R[-1]C+R[-1]C[-1] -> 32838 | DA2: =FIB(RC[-101])+RC[-1]+R[-1]C+R[-1]C[-1] -> 43784 | DB2: =FIB(RC[-101])+RC[-1]+R[-1]C+R[-1]C[-1] -> 54730 | DC2: =FIB(RC[-101])+RC[-1]+R[-1]C+R[-1]C[-1] -> 65676 | DD2: =FIB(RC[-101])+RC[-1]+R[-1]C+R[-1]C[-1] -> 76622 | DE2: =FIB(RC[-101])+RC[-1]+R[-1]C+R[-1]C[-1] -> 87568 | DF2: =FIB(RC[-101])+RC[-1]+R[-1]C+R[-1]C[-1] -> 98514 | DG2: =FIB(RC[-101])+RC[-1]+R[-1]C+R[-1]C[-1] -> 109460 | DH2: =FIB(RC[-101])+RC[-1]+R[-1]C+R[-1]C[-1] -> 120406 | DI2: =FIB(RC[-101])+RC[-1]+R[-1]C+R[-1]C[-1] -> 131352 | DJ2: =FIB(RC[-101])+RC[-1]+R[-1]C+R[-1]C[-1] -> 142298 | DK2: =FIB(RC[-101])+RC[-1]+R[-1]C+R[-1]C[-1] -> 153244 | DL2: =FIB(RC[-101])+RC[-1]+R[-1]C+R[-1]C[-1] -> 164190 | DM2: =FIB(RC[-101])+RC[-1]+R[-1]C+R[-1]C[-1] -> 175136 | DN2: =FIB(RC[-101])+RC[-1]+R[-1]C+R[-1]C[-1] -> 186082 | DO2: =FIB(RC[-101])+RC[-1]+R[-1]C+R[-1]C[-1] -> 197028 | DP2: =FIB(RC[-101])+RC[-1]+R[-1]C+R[-1]C[-1] -> 207974 | DQ2: =FIB(RC[-101])+RC[-1]+R[-1]C+R[-1]C[-1] -> 218920 | DR2: =FIB(RC[-101])+RC[-1]+R[-1]C+R[-1]C[-1] -> 229866 | DS2: =FIB(RC[-101])+RC[-1]+R[-1]C+R[-1]C[-1] -> 240812 | DT2: =FIB(RC[-101])+RC[-1]+R[-1]C+R[-1]C[-1] -> 251758 | DU2: =FIB(RC[-101])+RC[-1]+R[-1]C+R[-1]C[-1] -> 262704 | DV2: =FIB(RC[-101])+RC[-1]+R[-1]C+R[-1]C[-1] -> 273650 | DW2: =FIB(RC[-101])+RC[-1]+R[-1]C+R[-1]C[-1] -> 284596 | DX2: =FIB(RC[-101])+RC[-1]+R[-1]C+R[-1]C[-1] -> 295542 | DY2: =FIB(RC[-101])+RC[-1]+R[-1]C+R[-1]C[-1] -> 306488 | DZ2: =FIB(RC[-101])+RC[-1]+R[-1]C+R[-1]C[-1] -> 317434 | EA2: =FIB(RC[-101])+RC[-1]+R[-1]C+R[-1]C[-1] -> 328380 | EB2: =FIB(RC[-101])+RC[-1]+R[-1]C+R[-1]C[-1] -> 339326 | EC2: =FIB(RC[-101])+RC[-1]+R[-1]C+R[-1]C[-1] -> 350272 | ED2: =FIB(RC[-101])+RC[-1]+R[-1]C+R[-1]C[-1] -> 361218 | EE2: =FIB(RC[-101])+RC[-1]+R[-1]C+R[-1]C[-1] -> 372164 | EF2: =FIB(RC[-101])+RC[-1]+R[-1]C+R[-1]C[-1] -> 383110 | EG2: =FIB(RC[-101])+RC[-1]+R[-1]C+R[-1]C[-1] -> 394056 | EH2: =FIB(RC[-101])+RC[-1]+R[-1]C+R[-1]C[-1] -> 405002 | EI2: =FIB(RC[-101])+RC[-1]+R[-1]C+R[-1]C[-1] -> 415948 | EJ2: =FIB(RC[-101])+RC[-1]+R[-1]C+R[-1]C[-1] -> 426894 | EK2: =FIB(RC[-101])+RC[-1]+R[-1]C+R[-1]C[-1] -> 437840 | EL2: =FIB(RC[-101])+RC[-1]+R[-1]C+R[-1]C[-1] -> 448786 | EM2: =FIB(RC[-101])+RC[-1]+R[-1]C+R[-1]C[-1] -> 459732 | EN2: =FIB(RC[-101])+RC[-1]+R[-1]C+R[-1]C[-1] -> 470678 | EO2: =FIB(RC[-101])+RC[-1]+R[-1]C+R[-1]C[-1] -> 481624 | EP2: =FIB(RC[-101])+RC[-1]+R[-1]C+R[-1]C[-1] -> 492570 | EQ2: =FIB(RC[-101])+RC[-1]+R[-1]C+R[-1]C[-1] -> 503516 | ER2: =FIB(RC[-101])+RC[-1]+R[-1]C+R[-1]C[-1] -> 514462 | ES2: =FIB(RC[-101])+RC[-1]+R[-1]C+R[-1]C[-1] -> 525408 | ET2: =FIB(RC[-101])+RC[-1]+R[-1]C+R[-1]C[-1] -> 536354 | EU2: =FIB(RC[-101])+RC[-1]+R[-1]C+R[-1]C[-1] -> 547300 | EV2: =FIB(RC[-101])+RC[-1]+R[-1]C+R[-1]C[-1] -> 558246 | EW2: =FIB(RC[-101])+RC[-1]+R[-1]C+R[-1]C[-1] -> 569192 | EX2: =FIB(RC[-101])+RC[-1]+R[-1]C+R[-1]C[-1] -> 580138 | EY2: =FIB(RC[-101])+RC[-1]+R[-1]C+R[-1]C[-1] -> 591084 | EZ2: =FIB(RC[-101])+RC[-1]+R[-1]C+R[-1]C[-1] -> 602030 | FA2: =FIB(RC[-101])+RC[-1]+R[-1]C+R[-1]C[-1] -> 612976 | FB2: =FIB(RC[-101])+RC[-1]+R[-1]C+R[-1]C[-1] -> 623922 | FC2: =FIB(RC[-101])+RC[-1]+R[-1]C+R[-1]C[-1] -> 634868 | FD2: =FIB(RC[-101])+RC[-1]+R[-1]C+R[-1]C[-1] -> 645814 | FE2: =FIB(RC[-101])+RC[-1]+R[-1]C+R[-1]C[-1] -> 656760 | FF2: =FIB(RC[-101])+RC[-1]+R[-1]C+R[-1]C[-1] -> 667706 | FG2: =FIB(RC[-101])+RC[-1]+R[-1]C+R[-1]C[-1] -> 678652 | FH2: =FIB(RC[-101])+RC[-1]+R[-1]C+R[-1]C[-1] -> 689598 | FI2: =FIB(RC[-101])+RC[-1]+R[-1]C+R[-1]C[-1] -> 700544 | FJ2: =FIB(RC[-101])+RC[-1]+R[-1]C+R[-1]C[-1] -> 711490 | FK2: =FIB(RC[-101])+RC[-1]+R[-1]C+R[-1]C[-1] -> 722436 | FL2: =FIB(RC[-101])+RC[-1]+R[-1]C+R[-1]C[-1] -> 733382 | FM2: =FIB(RC[-101])+RC[-1]+R[-1]C+R[-1]C[-1] -> 744328 | FN2: =FIB(RC[-101])+RC[-1]+R[-1]C+R[-1]C[-1] -> 755274 | FO2: =FIB(RC[-101])+RC[-1]+R[-1]C+R[-1]C[-1] -> 766220 | FP2: =FIB(RC[-101])+RC[-1]+R[-1]C+R[-1]C[-1] -> 777166 | FQ2: =FIB(RC[-101])+RC[-1]+R[-1]C+R[-1]C[-1] -> 788112 | FR2: =FIB(RC[-101])+RC[-1]+R[-1]C+R[-1]C[-1] -> 799058 | FS2: =FIB(RC[-101])+RC[-1]+R[-1]C+R[-1]C[-1] -> 810004 | FT2: =FIB(RC[-101])+RC[-1]+R[-1]C+R[-1]C[-1] -> 820950 | FU2: =FIB(RC[-101])+RC[-1]+R[-1]C+R[-1]C[-1] -> 831896 | FV2: =FIB(RC[-101])+RC[-1]+R[-1]C+R[-1]C[-1] -> 842842 | FW2: =FIB(RC[-101])+RC[-1]+R[-1]C+R[-1]C[-1] -> 853788 | FX2: =FIB(RC[-101])+RC[-1]+R[-1]C+R[-1]C[-1] -> 864734 | FY2: =FIB(RC[-101])+RC[-1]+R[-1]C+R[-1]C[-1] -> 875680 | FZ2: =FIB(RC[-101])+RC[-1]+R[-1]C+R[-1]C[-1] -> 886626 | GA2: =FIB(RC[-101])+RC[-1]+R[-1]C+R[-1]C[-1] -> 897572 | GB2: =FIB(RC[-101])+RC[-1]+R[-1]C+R[-1]C[-1] -> 908518 | GC2: =FIB(RC[-101])+RC[-1]+R[-1]C+R[-1]C[-1] -> 919464 | GD2: =FIB(RC[-101])+RC[-1]+R[-1]C+R[-1]C[-1] -> 930410 | GE2: =FIB(RC[-101])+RC[-1]+R[-1]C+R[-1]C[-1] -> 941356 | GF2: =FIB(RC[-101])+RC[-1]+R[-1]C+R[-1]C[-1] -> 952302 | GG2: =FIB(RC[-101])+RC[-1]+R[-1]C+R[-1]C[-1] -> 963248 | GH2: =FIB(RC[-101])+RC[-1]+R[-1]C+R[-1]C[-1] -> 974194 | GI2: =FIB(RC[-101])+RC[-1]+R[-1]C+R[-1]C[-1] -> 985140 | GJ2: =FIB(RC[-101])+RC[-1]+R[-1]C+R[-1]C[-1] -> 996086 | GK2: =FIB(RC[-101])+RC[-1]+R[-1]C+R[-1]C[-1] -> 1007032 | GL2: =FIB(RC[-101])+RC[-1]+R[-1]C+R[-1]C[-1] -> 1017978 | GM2: =FIB(RC[-101])+RC[-1]+R[-1]C+R[-1]C[-1] -> 1028924 | GN2: =FIB(RC[-101])+RC[-1]+R[-1]C+R[-1]C[-1] -> 1039870 | GO2: =FIB(RC[-101])+RC[-1]+R[-1]C+R[-1]C[-1] -> 1050816 | GP2: =FIB(RC[-101])+RC[-1]+R[-1]C+R[-1]C[-1] -> 1061762 | GQ2: =FIB(RC[-101])+RC[-1]+R[-1]C+R[-1]C[-1] -> 1072708 | GR2: =FIB(RC[-101])+RC[-1]+R[-1]C+R[-1]C[-1] -> 1083654 | GS2: =FIB(RC[-101])+RC[-1]+R[-1]C+R[-1]C[-1] -> 1094600
A3: 20 | B3: 20 | C3: 20 | D3: 20 | E3: 20 | F3: 20 | G3: 20 | H3: 20 | I3: 20 | J3: 20 | K3: 20 | L3: 20 | M3: 20 | N3: 20 | O3: 20 | P3: 20 | Q3: 20 | R3: 20 | S3: 20 | T3: 20 | U3: 20 | V3: 20 | W3: 20 | X3: 20 | Y3: 20 | Z3: 20 | AA3: 20 | AB3: 20 | AC3: 20 | AD3: 20 | AE3: 20 | AF3: 20 | AG3: 20 | AH3: 20 | AI3: 20 | AJ3: 20 | AK3: 20 | AL3: 20 | AM3: 20 | AN3: 20 | AO3: 20 | AP3: 20 | AQ3: 20 | AR3: 20 | AS3: 20 | AT3: 20 | AU3: 20 | AV3: 20 | AW3: 20 | AX3: 20 | AY3: 20 | AZ3: 20 | BA3: 20 | BB3: 20 | BC3: 20 | BD3: 20 | BE3: 20 | BF3: 20 | BG3: 20 | BH3: 20 | BI3: 20 | BJ3: 20 | BK3: 20 | BL3: 20 | BM3: 20 | BN3: 20 | BO3: 20 | BP3: 20 | BQ3: 20 | BR3: 20 | BS3: 20 | BT3: 20 | BU3: 20 | BV3: 20 | BW3: 20 | BX3: 20 | BY3: 20 | BZ3: 20 | CA3: 20 | CB3: 20 | CC3: 20 | CD3: 20 | CE3: 20 | CF3: 20 | CG3: 20 | CH3: 20 | CI3: 20 | CJ3: 20 | CK3: 20 | CL3: 20 | CM3: 20 | CN3: 20 | CO3: 20 | CP3: 20 | CQ3: 20 | CR3: 20 | CS3: 20 | CT3: 20 | CU3: 20 | CV3: 20 | CW3: 0 | CX3: =FIB(RC[-101])+RC[-1]+R[-1]C+R[-1]C[-1] -> 21892 | CY3: =FIB(RC[-101])+RC[-1]+R[-1]C+R[-1]C[-1] -> 65676 | CZ3: =FIB(RC[-101])+RC[-1]+R[-1]C+R[-1]C[-1] -> 131352 | DA3: =FIB(RC[-101])+RC[-1]+R[-1]C+R[-1]C[-1] -> 218920 | DB3: =FIB(RC[-101])+RC[-1]+R[-1]C+R[-1]C[-1] -> 328380 | DC3: =FIB(RC[-101])+RC[-1]+R[-1]C+R[-1]C[-1] -> 459732 | DD3: =FIB(RC[-101])+RC[-1]+R[-1]C+R[-1]C[-1] -> 612976 | DE3: =FIB(RC[-101])+RC[-1]+R[-1]C+R[-1]C[-1] -> 788112 | DF3: =FIB(RC[-101])+RC[-1]+R[-1]C+R[-1]C[-1] -> 985140 | DG3: =FIB(RC[-101])+RC[-1]+R[-1]C+R[-1]C[-1] -> 1204060 | DH3: =FIB(RC[-101])+RC[-1]+R[-1]C+R[-1]C[-1] -> 1444872 | DI3: =FIB(RC[-101])+RC[-1]+R[-1]C+R[-1]C[-1] -> 1707576 | DJ3: =FIB(RC[-101])+RC[-1]+R[-1]C+R[-1]C[-1] -> 1992172 | DK3: =FIB(RC[-101])+RC[-1]+R[-1]C+R[-1]C[-1] -> 2298660 | DL3: =FIB(RC[-101])+RC[-1]+R[-1]C+R[-1]C[-1] -> 2627040 | DM3: =FIB(RC[-101])+RC[-1]+R[-1]C+R[-1]C[-1] -> 2977312 | DN3: =FIB(RC[-101])+RC[-1]+R[-1]C+R[-1]C[-1] -> 3349476 | DO3: =FIB(RC[-101])+RC[-1]+R[-1]C+R[-1]C[-1] -> 3743532 | DP3: =FIB(RC[-101])+RC[-1]+R[-1]C+R[-1]C[-1] -> 4159480 | DQ3: =FIB(RC[-101])+RC[-1]+R[-1]C+R[-1]C[-1] -> 4597320 | DR3: =FIB(RC[-101])+RC[-1]+R[-1]C+R[-1]C[-1] -> 5057052 | DS3: =FIB(RC[-101])+RC[-1]+R[-1]C+R[-1]C[-1] -> 5538676 | DT3: =FIB(RC[-101])+RC[-1]+R[-1]C+R[-1]C[-1] -> 6042192 | DU3: =FIB(RC[-101])+RC[-1]+R[-1]C+R[-1]C[-1] -> 6567600 | DV3: =FIB(RC[-101])+RC[-1]+R[-1]C+R[-1]C[-1] -> 7114900 | DW3: =FIB(RC[-101])+RC[-1]+R[-1]C+R[-1]C[-1] -> 7684092 | DX3: =FIB(RC[-101])+RC[-1]+R[-1]C+R[-1]C[-1] -> 8275176 | DY3: =FIB(RC[-101])+RC[-1]+R[-1]C+R[-1]C[-1] -> 8888152 | DZ3: =FIB(RC[-101])+RC[-1]+R[-1]C+R[-1]C[-1] -> 9523020 | EA3: =FIB(RC[-101])+RC[-1]+R[-1]C+R[-1]C[-1] -> 10179780 | EB3: =FIB(RC[-101])+RC[-1]+R[-1]C+R[-1]C[-1] -> 10858432 | EC3: =FIB(RC[-101])+RC[-1]+R[-1]C+R[-1]C[-1] -> 11558976 | ED3: =FIB(RC[-101])+RC[-1]+R[-1]C+R[-1]C[-1] -> 12281412 | EE3: =FIB(RC[-101])+RC[-1]+R[-1]C+R[-1]C[-1] -> 13025740 | EF3: =FIB(RC[-101])+RC[-1]+R[-1]C+R[-1]C[-1] -> 13791960 | EG3: =FIB(RC[-101])+RC[-1]+R[-1]C+R[-1]C[-1] -> 14580072 | EH3: =FIB(RC[-101])+RC[-1]+R[-1]C+R[-1]C[-1] -> 15390076 | EI3: =FIB(RC[-101])+RC[-1]+R[-1]C+R[-1]C[-1] -> 16221972 | EJ3: =FIB(RC[-101])+RC[-1]+R[-1]C+R[-1]C[-1] -> 17075760 | EK3: =FIB(RC[-101])+RC[-1]+R[-1]C+R[-1]C[-1] -> 17951440 | EL3: =FIB(RC[-101])+RC[-1]+R[-1]C+R[-1]C[-1] -> 18849012 | EM3: =FIB(RC[-101])+RC[-1]+R[-1]C+R[-1]C[-1] -> 19768476 | EN3: =FIB(RC[-101])+RC[-1]+R[-1]C+R[-1]C[-1] -> 20709832 | EO3: =FIB(RC[-101])+RC[-1]+R[-1]C+R[-1]C[-1] -> 21673080 | EP3: =FIB(RC[-101])+RC[-1]+R[-1]C+R[-1]C[-1] -> 22658220 | EQ3: =FIB(RC[-101])+RC[-1]+R[-1]C+R[-1]C[-1] -> 23665252 | ER3: =FIB(RC[-101])+RC[-1]+R[-1]C+R[-1]C[-1] -> 24694176 | ES3: =FIB(RC[-101])+RC[-1]+R[-1]C+R[-1]C[-1] -> 25744992 | ET3: =FIB(RC[-101])+RC[-1]+R[-1]C+R[-1]C[-1] -> 26817700 | EU3: =FIB(RC[-101])+RC[-1]+R[-1]C+R[-1]C[-1] -> 27912300 | EV3: =FIB(RC[-101])+RC[-1]+R[-1]C+R[-1]C[-1] -> 29028792 | EW3: =FIB(RC[-101])+RC[-1]+R[-1]C+R[-1]C[-1] -> 30167176 | EX3: =FIB(RC[-101])+RC[-1]+R[-1]C+R[-1]C[-1] -> 31327452 | EY3: =FIB(RC[-101])+RC[-1]+R[-1]C+R[-1]C[-1] -> 32509620 | EZ3: =FIB(RC[-101])+RC[-1]+R[-1]C+R[-1]C[-1] -> 33713680 | FA3: =FIB(RC[-101])+RC[-1]+R[-1]C+R[-1]C[-1] -> 34939632 | FB3: =FIB(RC[-101])+RC[-1]+R[-1]C+R[-1]C[-1] -> 36187476 | FC3: =FIB(RC[-101])+RC[-1]+R[-1]C+R[-1]C[-1] -> 37457212 | FD3: =FIB(RC[-101])+RC[-1]+R[-1]C+R[-1]C[-1] -> 38748840 | FE3: =FIB(RC[-101])+RC[-1]+R[-1]C+R[-1]C[-1] -> 40062360 | FF3: =FIB(RC[-101])+RC[-1]+R[-1]C+R[-1]C[-1] -> 41397772 | FG3: =FIB(RC[-101])+RC[-1]+R[-1]C+R[-1]C[-1] -> 42755076 | FH3: =FIB(RC[-101])+RC[-1]+R[-1]C+R[-1]C[-1] -> 44134272 | FI3: =FIB(RC[-101])+RC[-1]+R[-1]C+R[-1]C[-1] -> 45535360 | FJ3: =FIB(RC[-101])+RC[-1]+R[-1]C+R[-1]C[-1] -> 46958340 | FK3: =FIB(RC[-101])+RC[-1]+R[-1]C+R[-1]C[-1] -> 48403212 | FL3: =FIB(RC[-101])+RC[-1]+R[-1]C+R[-1]C[-1] -> 49869976 | FM3: =FIB(RC[-101])+RC[-1]+R[-1]C+R[-1]C[-1] -> 51358632 | FN3: =FIB(RC[-101])+RC[-1]+R[-1]C+R[-1]C[-1] -> 52869180 | FO3: =FIB(RC[-101])+RC[-1]+R[-1]C+R[-1]C[-1] -> 54401620 | FP3: =FIB(RC[-101])+RC[-1]+R[-1]C+R[-1]C[-1] -> 55955952 | FQ3: =FIB(RC[-101])+RC[-1]+R[-1]C+R[-1]C[-1] -> 57532176 | FR3: =FIB(RC[-101])+RC[-1]+R[-1]C+R[-1]C[-1] -> 59130292 | FS3: =FIB(RC[-101])+RC[-1]+R[-1]C+R[-1]C[-1] -> 60750300 | FT3: =FIB(RC[-101])+RC[-1]+R[-1]C+R[-1]C[-1] -> 62392200 | FU3: =FIB(RC[-101])+RC[-1]+R[-1]C+R[-1]C[-1] -> 64055992 | FV3: =FIB(RC[-101])+RC[-1]+R[-1]C+R[-1]C[-1] -> 65741676 | FW3: =FIB(RC[-101])+RC[-1]+R[-1]C+R[-1]C[-1] -> 67449252 | FX3: =FIB(RC[-101])+RC[-1]+R[-1]C+R[-1]C[-1] -> 69178720 | FY3: =FIB(RC[-101])+RC[-1]+R[-1]C+R[-1]C[-1] -> 70930080 | FZ3: =FIB(RC[-101])+RC[-1]+R[-1]C+R[-1]C[-1] -> 72703332 | GA3: =FIB(RC[-101])+RC[-1]+R[-1]C+R[-1]C[-1] -> 74498476 | GB3: =FIB(RC[-101])+RC[-1]+R[-1]C+R[-1]C[-1] -> 76315512 | GC3: =FIB(RC[-101])+RC[-1]+R[-1]C+R[-1]C[-1] -> 78154440 | GD3: =FIB(RC[-101])+RC[-1]+R[-1]C+R[-1]C[-1] -> 80015260 | GE3: =FIB(RC[-101])+RC[-1]+R[-1]C+R[-1]C[-1] -> 81897972 | GF3: =FIB(RC[-101])+RC[-1]+R[-1]C+R[-1]C[-1] -> 83802576 | GG3: =FIB(RC[-101])+RC[-1]+R[-1]C+R[-1]C[-1] -> 85729072 | GH3: =FIB(RC[-101])+RC[-1]+R[-1]C+R[-1]C[-1] -> 87677460 | GI3: =FIB(RC[-101])+RC[-1]+R[-1]C+R[-1]C[-1] -> 89647740 | GJ3: =FIB(RC[-101])+RC[-1]+R[-1]C+R[-1]C[-1] -> 91639912 | GK3: =FIB(RC[-101])+RC[-1]+R[-1]C+R[-1]C[-1] -> 93653976 | GL3: =FIB(RC[-101])+RC[-1]+R[-1]C+R[-1]C[-1] -> 95689932 | GM3: =FIB(RC[-101])+RC[-1]+R[-1]C+R[-1]C[-1] -> 97747780 | GN3: =FIB(RC[-101])+RC[-1]+R[-1]C+R[-1]C[-1] -> 99827520 | GO3: =FIB(RC[-101])+RC[-1]+R[-1]C+R[-1]C[-1] -> 101929152 | GP3: =FIB(RC[-101])+RC[-1]+R[-1]C+R[-1]C[-1] -> 104052676 | GQ3: =FIB(RC[-101])+RC[-1]+R[-1]C+R[-1]C[-1] -> 106198092 | GR3: =FIB(RC[-101])+RC[-1]+R[-1]C+R[-1]C[-1] -> 108365400 | GS3: =FIB(RC[-101])+RC[-1]+R[-1]C+R[-1]C[-1] -> 110554600
A4: 20 | B4: 20 | C4: 20 | D4: 20 | E4: 20 | F4: 20 | G4: 20 | H4: 20 | I4: 20 | J4: 20 | K4: 20 | L4: 20 | M4: 20 | N4: 20 | O4: 20 | P4: 20 | Q4: 20 | R4: 20 | S4: 20 | T4: 20 | U4: 20 | V4: 20 | W4: 20 | X4: 20 | Y4: 20 | Z4: 20 | AA4: 20 | AB4: 20 | AC4: 20 | AD4: 20 | AE4: 20 | AF4: 20 | AG4: 20 | AH4: 20 | AI4: 20 | AJ4: 20 | AK4: 20 | AL4: 20 | AM4: 20 | AN4: 20 | AO4: 20 | AP4: 20 | AQ4: 20 | AR4: 20 | AS4: 20 | AT4: 20 | AU4: 20 | AV4: 20 | AW4: 20 | AX4: 20 | AY4: 20 | AZ4: 20 | BA4: 20 | BB4: 20 | BC4: 20 | BD4: 20 | BE4: 20 | BF4: 20 | BG4: 20 | BH4: 20 | BI4: 20 | BJ4: 20 | BK4: 20 | BL4: 20 | BM4: 20 | BN4: 20 | BO4: 20 | BP4: 20 | BQ4: 20 | BR4: 20 | BS4: 20 | BT4: 20 | BU4: 20 | BV4: 20 | BW4: 20 | BX4: 20 | BY4: 20 | BZ4: 20 | CA4: 20 | CB4: 20 | CC4: 20 | CD4: 20 | CE4: 20 | CF4: 20 | CG4: 20 | CH4: 20 | CI4: 20 | CJ4: 20 | CK4: 20 | CL4: 20 | CM4: 20 | CN4: 20 | CO4: 20 | CP4: 20 | CQ4: 20 | CR4: 20 | CS4: 20 | CT4: 20 | CU4: 20 | CV4: 20 | CW4: 0 | CX4: =FIB(RC[-101])+RC[-1]+R[-1]C+R[-1]C[-1] -> 32838 | CY4: =FIB(RC[-101])+RC[-1]+R[-1]C+R[-1]C[-1] -> 131352 | CZ4: =FIB(RC[-101])+RC[-1]+R[-1]C+R[-1]C[-1] -> 339326 | DA4: =FIB(RC[-101])+RC[-1]+R[-1]C+R[-1]C[-1] -> 700544 | DB4: =FIB(RC[-101])+RC[-1]+R[-1]C+R[-1]C[-1] -> 1258790 | DC4: =FIB(RC[-101])+RC[-1]+R[-1]C+R[-1]C[-1] -> 2057848 | DD4: =FIB(RC[-101])+RC[-1]+R[-1]C+R[-1]C[-1] -> 3141502 | DE4: =FIB(RC[-101])+RC[-1]+R[-1]C+R[-1]C[-1] -> 4553536 | DF4: =FIB(RC[-101])+RC[-1]+R[-1]C+R[-1]C[-1] -> 6337734 | DG4: =FIB(RC[-101])+RC[-1]+R[-1]C+R[-1]C[-1] -> 8537880 | DH4: =FIB(RC[-101])+RC[-1]+R[-1]C+R[-1]C[-1] -> 11197758 | DI4: =FIB(RC[-101])+RC[-1]+R[-1]C+R[-1]C[-1] -> 14361152 | DJ4: =FIB(RC[-101])+RC[-1]+R[-1]C+R[-1]C[-1] -> 18071846 | DK4: =FIB(RC[-101])+RC[-1]+R[-1]C+R[-1]C[-1] -> 22373624 | DL4: =FIB(RC[-101])+RC[-1]+R[-1]C+R[-1]C[-1] -> 27310270 | DM4: =FIB(RC[-101])+RC[-1]+R[-1]C+R[-1]C[-1] -> 32925568 | DN4: =FIB(RC[-101])+RC[-1]+R[-1]C+R[-1]C[-1] -> 39263302 | DO4: =FIB(RC[-101])+RC[-1]+R[-1]C+R[-1]C[-1] -> 46367256 | DP4: =FIB(RC[-101])+RC[-1]+R[-1]C+R[-1]C[-1] -> 54281214 | DQ4: =FIB(RC[-101])+RC[-1]+R[-1]C+R[-1]C[-1] -> 63048960 | DR4: =FIB(RC[-101])+RC[-1]+R[-1]C+R[-1]C[-1] -> 72714278 | DS4: =FIB(RC[-101])+RC[-1]+R[-1]C+R[-1]C[-1] -> 83320952 | DT4: =FIB(RC[-101])+RC[-1]+R[-1]C+R[-1]C[-1] -> 94912766 | DU4: =FIB(RC[-101])+RC[-1]+R[-1]C+R[-1]C[-1] -> 107533504 | DV4: =FIB(RC[-101])+RC[-1]+R[-1]C+R[-1]C[-1] -> 121226950 | DW4: =FIB(RC[-101])+RC[-1]+R[-1]C+R[-1]C[-1] -> 136036888 | DX4: =FIB(RC[-101])+RC[-1]+R[-1]C+R[-1]C[-1] -> 152007102 | DY4: =FIB(RC[-101])+RC[-1]+R[-1]C+R[-1]C[-1] -> 169181376 | DZ4: =FIB(RC[-101])+RC[-1]+R[-1]C+R[-1]C[-1] -> 187603494 | EA4: =FIB(RC[-101])+RC[-1]+R[-1]C+R[-1]C[-1] -> 207317240 | EB4: =FIB(RC[-101])+RC[-1]+R[-1]C+R[-1]C[-1] -> 228366398 | EC4: =FIB(RC[-101])+RC[-1]+R[-1]C+R[-1]C[-1] -> 250794752 | ED4: =FIB(RC[-101])+RC[-1]+R[-1]C+R[-1]C[-1] -> 274646086 | EE4: =FIB(RC[-101])+RC[-1]+R[-1]C+R[-1]C[-1] -> 299964184 | EF4: =FIB(RC[-101])+RC[-1]+R[-1]C+R[-1]C[-1] -> 326792830 | EG4: =FIB(RC[-101])+RC[-1]+R[-1]C+R[-1]C[-1] -> 355175808 | EH4: =FIB(RC[-101])+RC[-1]+R[-1]C+R[-1]C[-1] -> 385156902 | EI4: =FIB(RC[-101])+RC[-1]+R[-1]C+R[-1]C[-1] -> 416779896 | EJ4: =FIB(RC[-101])+RC[-1]+R[-1]C+R[-1]C[-1] -> 450088574 | EK4: =FIB(RC[-101])+RC[-1]+R[-1]C+R[-1]C[-1] -> 485126720 | EL4: =FIB(RC[-101])+RC[-1]+R[-1]C+R[-1]C[-1] -> 521938118 | EM4: =FIB(RC[-101])+RC[-1]+R[-1]C+R[-1]C[-1] -> 560566552 | EN4: =FIB(RC[-101])+RC[-1]+R[-1]C+R[-1]C[-1] -> 601055806 | EO4: =FIB(RC[-101])+RC[-1]+R[-1]C+R[-1]C[-1] -> 643449664 | EP4: =FIB(RC[-101])+RC[-1]+R[-1]C+R[-1]C[-1] -> 687791910 | EQ4: =FIB(RC[-101])+RC[-1]+R[-1]C+R[-1]C[-1] -> 734126328 | ER4: =FIB(RC[-101])+RC[-1]+R[-1]C+R[-1]C[-1] -> 782496702 | ES4: =FIB(RC[-101])+RC[-1]+R[-1]C+R[-1]C[-1] -> 832946816 | ET4: =FIB(RC[-101])+RC[-1]+R[-1]C+R[-1]C[-1] -> 885520454 | EU4: =FIB(RC[-101])+RC[-1]+R[-1]C+R[-1]C[-1] -> 940261400 | EV4: =FIB(RC[-101])+RC[-1]+R[-1]C+R[-1]C[-1] -> 997213438 | EW4: =FIB(RC[-101])+RC[-1]+R[-1]C+R[-1]C[-1] -> 1056420352 | EX4: =FIB(RC[-101])+RC[-1]+R[-1]C+R[-1]C[-1] -> 1117925926 | EY4: =FIB(RC[-101])+RC[-1]+R[-1]C+R[-1]C[-1] -> 1181773944 | EZ4: =FIB(RC[-101])+RC[-1]+R[-1]C+R[-1]C[-1] -> 1248008190 | FA4: =FIB(RC[-101])+RC[-1]+R[-1]C+R[-1]C[-1] -> 1316672448 | FB4: =FIB(RC[-101])+RC[-1]+R[-1]C+R[-1]C[-1] -> 1387810502 | FC4: =FIB(RC[-101])+RC[-1]+R[-1]C+R[-1]C[-1] -> 1461466136 | FD4: =FIB(RC[-101])+RC[-1]+R[-1]C+R[-1]C[-1] -> 1537683134 | FE4: =FIB(RC[-101])+RC[-1]+R[-1]C+R[-1]C[-1] -> 1616505280 | FF4: =FIB(RC[-101])+RC[-1]+R[-1]C+R[-1]C[-1] -> 1697976358 | FG4: =FIB(RC[-101])+RC[-1]+R[-1]C+R[-1]C[-1] -> 1782140152 | FH4: =FIB(RC[-101])+RC[-1]+R[-1]C+R[-1]C[-1] -> 1869040446 | FI4: =FIB(RC[-101])+RC[-1]+R[-1]C+R[-1]C[-1] -> 1958721024 | FJ4: =FIB(RC[-101])+RC[-1]+R[-1]C+R[-1]C[-1] -> 2051225670 | FK4: =FIB(RC[-101])+RC[-1]+R[-1]C+R[-1]C[-1] -> 2146598168 | FL4: =FIB(RC[-101])+RC[-1]+R[-1]C+R[-1]C[-1] -> 2244882302 | FM4: =FIB(RC[-101])+RC[-1]+R[-1]C+R[-1]C[-1] -> 2346121856 | FN4: =FIB(RC[-101])+RC[-1]+R[-1]C+R[-1]C[-1] -> 2450360614 | FO4: =FIB(RC[-101])+RC[-1]+R[-1]C+R[-1]C[-1] -> 2557642360 | FP4: =FIB(RC[-101])+RC[-1]+R[-1]C+R[-1]C[-1] -> 2668010878 | FQ4: =FIB(RC[-101])+RC[-1]+R[-1]C+R[-1]C[-1] -> 2781509952 | FR4: =FIB(RC[-101])+RC[-1]+R[-1]C+R[-1]C[-1] -> 2898183366 | FS4: =FIB(RC[-101])+RC[-1]+R[-1]C+R[-1]C[-1] -> 3018074904 | FT4: =FIB(RC[-101])+RC[-1]+R[-1]C+R[-1]C[-1] -> 3141228350 | FU4: =FIB(RC[-101])+RC[-1]+R[-1]C+R[-1]C[-1] -> 3267687488 | FV4: =FIB(RC[-101])+RC[-1]+R[-1]C+R[-1]C[-1] -> 3397496102 | FW4: =FIB(RC[-101])+RC[-1]+R[-1]C+R[-1]C[-1] -> 3530697976 | FX4: =FIB(RC[-101])+RC[-1]+R[-1]C+R[-1]C[-1] -> 3667336894 | FY4: =FIB(RC[-101])+RC[-1]+R[-1]C+R[-1]C[-1] -> 3807456640 | FZ4: =FIB(RC[-101])+RC[-1]+R[-1]C+R[-1]C[-1] -> 3951100998 | GA4: =FIB(RC[-101])+RC[-1]+R[-1]C+R[-1]C[-1] -> 4098313752 | GB4: =FIB(RC[-101])+RC[-1]+R[-1]C+R[-1]C[-1] -> 4249138686 | GC4: =FIB(RC[-101])+RC[-1]+R[-1]C+R[-1]C[-1] -> 4403619584 | GD4: =FIB(RC[-101])+RC[-1]+R[-1]C+R[-1]C[-1] -> 4561800230 | GE4: =FIB(RC[-101])+RC[-1]+R[-1]C+R[-1]C[-1] -> 4723724408 | GF4: =FIB(RC[-101])+RC[-1]+R[-1]C+R[-1]C[-1] -> 4889435902 | GG4: =FIB(RC[-101])+RC[-1]+R[-1]C+R[-1]C[-1] -> 5058978496 | GH4: =FIB(RC[-101])+RC[-1]+R[-1]C+R[-1]C[-1] -> 5232395974 | GI4: =FIB(RC[-101])+RC[-1]+R[-1]C+R[-1]C[-1] -> 5409732120 | GJ4: =FIB(RC[-101])+RC[-1]+R[-1]C+R[-1]C[-1] -> 5591030718 | GK4: =FIB(RC[-101])+RC[-1]+R[-1]C+R[-1]C[-1] -> 5776335552 | GL4: =FIB(RC[-101])+RC[-1]+R[-1]C+R[-1]C[-1] -> 5965690406 | GM4: =FIB(RC[-101])+RC[-1]+R[-1]C+R[-1]C[-1] -> 6159139064 | GN4: =FIB(RC[-101])+RC[-1]+R[-1]C+R[-1]C[-1] -> 6356725310 | GO4: =FIB(RC[-101])+RC[-1]+R[-1]C+R[-1]C[-1] -> 6558492928 | GP4: =FIB(RC[-101])+RC[-1]+R[-1]C+R[-1]C[-1] -> 6764485702 | GQ4: =FIB(RC[-101])+RC[-1]+R[-1]C+R[-1]C[-1] -> 6974747416 | GR4: =FIB(RC[-101])+RC[-1]+R[-1]C+R[-1]C[-1] -> 7189321854 | GS4: =FIB(RC[-101])+RC[-1]+R[-1]C+R[-1]C[-1] -> 7408252800
A5: 20 | B5: 20 | C5: 20 | D5: 20 | E5: 20 | F5: 20 | G5: 20 | H5: 20 | I5: 20 | J5: 20 | K5: 20 | L5: 20 | M5: 20 | N5: 20 | O5: 20 | P5: 20 | Q5: 20 | R5: 20 | S5: 20 | T5: 20 | U5: 20 | V5: 20 | W5: 20 | X5: 20 | Y5: 20 | Z5: 20 | AA5: 20 | AB5: 20 | AC5: 20 | AD5: 20 | AE5: 20 | AF5: 20 | AG5: 20 | AH5: 20 | AI5: 20 | AJ5: 20 | AK5: 20 | AL5: 20 | AM5: 20 | AN5: 20 | AO5: 20 | AP5: 20 | AQ5: 20 | AR5: 20 | AS5: 20 | AT5: 20 | AU5: 20 | AV5: 20 | AW5: 20 | AX5: 20 | AY5: 20 | AZ5: 20 | BA5: 20 | BB5: 20 | BC5: 20 | BD5: 20 | BE5: 20 | BF5: 20 | BG5: 20 | BH5: 20 | BI5: 20 | BJ5: 20 | BK5: 20 | BL5: 20 | BM5: 20 | BN5: 20 | BO5: 20 | BP5: 20 | BQ5: 20 | BR5: 20 | BS5: 20 | BT5: 20 | BU5: 20 | BV5: 20 | BW5: 20 | BX5: 20 | BY5: 20 | BZ5: 20 | CA5: 20 | CB5: 20 | CC5: 20 | CD5: 20 | CE5: 20 | CF5: 20 | CG5: 20 | CH5: 20 | CI5: 20 | CJ5: 20 | CK5: 20 | CL5: 20 | CM5: 20 | CN5: 20 | CO5: 20 | CP5: 20 | CQ5: 20 | CR5: 20 | CS5: 20 | CT5: 20 | CU5: 20 | CV5: 20 | CW5: 0 | CX5: =FIB(RC[-101])+RC[-1]+R[-1]C+R[-1]C[-1] -> 43784 | CY5: =FIB(RC[-101])+RC[-1]+R[-1]C+R[-1]C[-1] -> 218920 | CZ5: =FIB(RC[-101])+RC[-1]+R[-1]C+R[-1]C[-1] -> 700544 | DA5: =FIB(RC[-101])+RC[-1]+R[-1]C+R[-1]C[-1] -> 1751360 | DB5: =FIB(RC[-101])+RC[-1]+R[-1]C+R[-1]C[-1] -> 3721640 | DC5: =FIB(RC[-101])+RC[-1]+R[-1]C+R[-1]C[-1] -> 7049224 | DD5: =FIB(RC[-101])+RC[-1]+R[-1]C+R[-1]C[-1] -> 12259520 | DE5: =FIB(RC[-101])+RC[-1]+R[-1]C+R[-1]C[-1] -> 19965504 | DF5: =FIB(RC[-101])+RC[-1]+R[-1]C+R[-1]C[-1] -> 30867720 | DG5: =FIB(RC[-101])+RC[-1]+R[-1]C+R[-1]C[-1] -> 45754280 | DH5: =FIB(RC[-101])+RC[-1]+R[-1]C+R[-1]C[-1] -> 65500864 | DI5: =FIB(RC[-101])+RC[-1]+R[-1]C+R[-1]C[-1] -> 91070720 | DJ5: =FIB(RC[-101])+RC[-1]+R[-1]C+R[-1]C[-1] -> 123514664 | DK5: =FIB(RC[-101])+RC[-1]+R[-1]C+R[-1]C[-1] -> 163971080 | DL5: =FIB(RC[-101])+RC[-1]+R[-1]C+R[-1]C[-1] -> 213665920 | DM5: =FIB(RC[-101])+RC[-1]+R[-1]C+R[-1]C[-1] -> 273912704 | DN5: =FIB(RC[-101])+RC[-1]+R[-1]C+R[-1]C[-1] -> 346112520 | DO5: =FIB(RC[-101])+RC[-1]+R[-1]C+R[-1]C[-1] -> 431754024 | DP5: =FIB(RC[-101])+RC[-1]+R[-1]C+R[-1]C[-1] -> 532413440 | DQ5: =FIB(RC[-101])+RC[-1]+R[-1]C+R[-1]C[-1] -> 649754560 | DR5: =FIB(RC[-101])+RC[-1]+R[-1]C+R[-1]C[-1] -> 785528744 | DS5: =FIB(RC[-101])+RC[-1]+R[-1]C+R[-1]C[-1] -> 941574920 | DT5: =FIB(RC[-101])+RC[-1]+R[-1]C+R[-1]C[-1] -> 1119819584 | DU5: =FIB(RC[-101])+RC[-1]+R[-1]C+R[-1]C[-1] -> 1322276800 | DV5: =FIB(RC[-101])+RC[-1]+R[-1]C+R[-1]C[-1] -> 1551048200 | DW5: =FIB(RC[-101])+RC[-1]+R[-1]C+R[-1]C[-1] -> 1808322984 | DX5: =FIB(RC[-101])+RC[-1]+R[-1]C+R[-1]C[-1] -> 2096377920 | DY5: =FIB(RC[-101])+RC[-1]+R[-1]C+R[-1]C[-1] -> 2417577344 | DZ5: =FIB(RC[-101])+RC[-1]+R[-1]C+R[-1]C[-1] -> 2774373160 | EA5: =FIB(RC[-101])+RC[-1]+R[-1]C+R[-1]C[-1] -> 3169304840 | EB5: =FIB(RC[-101])+RC[-1]+R[-1]C+R[-1]C[-1] -> 3604999424 | EC5: =FIB(RC[-101])+RC[-1]+R[-1]C+R[-1]C[-1] -> 4084171520 | ED5: =FIB(RC[-101])+RC[-1]+R[-1]C+R[-1]C[-1] -> 4609623304 | EE5: =FIB(RC[-101])+RC[-1]+R[-1]C+R[-1]C[-1] -> 5184244520 | EF5: =FIB(RC[-101])+RC[-1]+R[-1]C+R[-1]C[-1] -> 5811012480 | EG5: =FIB(RC[-101])+RC[-1]+R[-1]C+R[-1]C[-1] -> 6492992064 | EH5: =FIB(RC[-101])+RC[-1]+R[-1]C+R[-1]C[-1] -> 7233335720 | EI5: =FIB(RC[-101])+RC[-1]+R[-1]C+R[-1]C[-1] -> 8035283464 | EJ5: =FIB(RC[-101])+RC[-1]+R[-1]C+R[-1]C[-1] -> 8902162880 | EK5: =FIB(RC[-101])+RC[-1]+R[-1]C+R[-1]C[-1] -> 9837389120 | EL5: =FIB(RC[-101])+RC[-1]+R[-1]C+R[-1]C[-1] -> 10844464904 | EM5: =FIB(RC[-101])+RC[-1]+R[-1]C+R[-1]C[-1] -> 11926980520 | EN5: =FIB(RC[-101])+RC[-1]+R[-1]C+R[-1]C[-1] -> 13088613824 | EO5: =FIB(RC[-101])+RC[-1]+R[-1]C+R[-1]C[-1] -> 14333130240 | EP5: =FIB(RC[-101])+RC[-1]+R[-1]C+R[-1]C[-1] -> 15664382760 | EQ5: =FIB(RC[-101])+RC[-1]+R[-1]C+R[-1]C[-1] -> 17086311944 | ER5: =FIB(RC[-101])+RC[-1]+R[-1]C+R[-1]C[-1] -> 18602945920 | ES5: =FIB(RC[-101])+RC[-1]+R[-1]C+R[-1]C[-1] -> 20218400384 | ET5: =FIB(RC[-101])+RC[-1]+R[-1]C+R[-1]C[-1] -> 21936878600 | EU5: =FIB(RC[-101])+RC[-1]+R[-1]C+R[-1]C[-1] -> 23762671400 | EV5: =FIB(RC[-101])+RC[-1]+R[-1]C+R[-1]C[-1] -> 25700157184 | EW5: =FIB(RC[-101])+RC[-1]+R[-1]C+R[-1]C[-1] -> 27753801920 | EX5: =FIB(RC[-101])+RC[-1]+R[-1]C+R[-1]C[-1] -> 29928159144 | EY5: =FIB(RC[-101])+RC[-1]+R[-1]C+R[-1]C[-1] -> 32227869960 | EZ5: =FIB(RC[-101])+RC[-1]+R[-1]C+R[-1]C[-1] -> 34657663040 | FA5: =FIB(RC[-101])+RC[-1]+R[-1]C+R[-1]C[-1] -> 37222354624 | FB5: =FIB(RC[-101])+RC[-1]+R[-1]C+R[-1]C[-1] -> 39926848520 | FC5: =FIB(RC[-101])+RC[-1]+R[-1]C+R[-1]C[-1] -> 42776136104 | FD5: =FIB(RC[-101])+RC[-1]+R[-1]C+R[-1]C[-1] -> 45775296320 | FE5: =FIB(RC[-101])+RC[-1]+R[-1]C+R[-1]C[-1] -> 48929495680 | FF5: =FIB(RC[-101])+RC[-1]+R[-1]C+R[-1]C[-1] -> 52243988264 | FG5: =FIB(RC[-101])+RC[-1]+R[-1]C+R[-1]C[-1] -> 55724115720 | FH5: =FIB(RC[-101])+RC[-1]+R[-1]C+R[-1]C[-1] -> 59375307264 | FI5: =FIB(RC[-101])+RC[-1]+R[-1]C+R[-1]C[-1] -> 63203079680 | FJ5: =FIB(RC[-101])+RC[-1]+R[-1]C+R[-1]C[-1] -> 67213037320 | FK5: =FIB(RC[-101])+RC[-1]+R[-1]C+R[-1]C[-1] -> 71410872104 | FL5: =FIB(RC[-101])+RC[-1]+R[-1]C+R[-1]C[-1] -> 75802363520 | FM5: =FIB(RC[-101])+RC[-1]+R[-1]C+R[-1]C[-1] -> 80393378624 | FN5: =FIB(RC[-101])+RC[-1]+R[-1]C+R[-1]C[-1] -> 85189872040 | FO5: =FIB(RC[-101])+RC[-1]+R[-1]C+R[-1]C[-1] -> 90197885960 | FP5: =FIB(RC[-101])+RC[-1]+R[-1]C+R[-1]C[-1] -> 95423550144 | FQ5: =FIB(RC[-101])+RC[-1]+R[-1]C+R[-1]C[-1] -> 100873081920 | FR5: =FIB(RC[-101])+RC[-1]+R[-1]C+R[-1]C[-1] -> 106552786184 | FS5: =FIB(RC[-101])+RC[-1]+R[-1]C+R[-1]C[-1] -> 112469055400 | FT5: =FIB(RC[-101])+RC[-1]+R[-1]C+R[-1]C[-1] -> 118628369600 | FU5: =FIB(RC[-101])+RC[-1]+R[-1]C+R[-1]C[-1] -> 125037296384 | FV5: =FIB(RC[-101])+RC[-1]+R[-1]C+R[-1]C[-1] -> 131702490920 | FW5: =FIB(RC[-101])+RC[-1]+R[-1]C+R[-1]C[-1] -> 138630695944 | FX5: =FIB(RC[-101])+RC[-1]+R[-1]C+R[-1]C[-1] -> 145828741760 | FY5: =FIB(RC[-101])+RC[-1]+R[-1]C+R[-1]C[-1] -> 153303546240 | FZ5: =FIB(RC[-101])+RC[-1]+R[-1]C+R[-1]C[-1] -> 161062114824 | GA5: =FIB(RC[-101])+RC[-1]+R[-1]C+R[-1]C[-1] -> 169111540520 | GB5: =FIB(RC[-101])+RC[-1]+R[-1]C+R[-1]C[-1] -> 177459003904 | GC5: =FIB(RC[-101])+RC[-1]+R[-1]C+R[-1]C[-1] -> 186111773120 | GD5: =FIB(RC[-101])+RC[-1]+R[-1]C+R[-1]C[-1] -> 195077203880 | GE5: =FIB(RC[-101])+RC[-1]+R[-1]C+R[-1]C[-1] -> 204362739464 | GF5: =FIB(RC[-101])+RC[-1]+R[-1]C+R[-1]C[-1] -> 213975910720 | GG5: =FIB(RC[-101])+RC[-1]+R[-1]C+R[-1]C[-1] -> 223924336064 | GH5: =FIB(RC[-101])+RC[-1]+R[-1]C+R[-1]C[-1] -> 234215721480 | GI5: =FIB(RC[-101])+RC[-1]+R[-1]C+R[-1]C[-1] -> 244857860520 | GJ5: =FIB(RC[-101])+RC[-1]+R[-1]C+R[-1]C[-1] -> 255858634304 | GK5: =FIB(RC[-101])+RC[-1]+R[-1]C+R[-1]C[-1] -> 267226011520 | GL5: =FIB(RC[-101])+RC[-1]+R[-1]C+R[-1]C[-1] -> 278968048424 | GM5: =FIB(RC[-101])+RC[-1]+R[-1]C+R[-1]C[-1] -> 291092888840 | GN5: =FIB(RC[-101])+RC[-1]+R[-1]C+R[-1]C[-1] -> 303608764160 | GO5: =FIB(RC[-101])+RC[-1]+R[-1]C+R[-1]C[-1] -> 316523993344 | GP5: =FIB(RC[-101])+RC[-1]+R[-1]C+R[-1]C[-1] -> 329846982920 | GQ5: =FIB(RC[-101])+RC[-1]+R[-1]C+R[-1]C[-1] -> 343586226984 | GR5: =FIB(RC[-101])+RC[-1]+R[-1]C+R[-1]C[-1] -> 357750307200 | GS5: =FIB(RC[-101])+RC[-1]+R[-1]C+R[-1]C[-1] -> 372347892800
A6: 20 | B6: 20 | C6: 20 | D6: 20 | E6: 20 | F6: 20 | G6: 20 | H6: 20 | I6: 20 | J6: 20 | K6: 20 | L6: 20 | M6: 20 | N6: 20 | O6: 20 | P6: 20 | Q6: 20 | R6: 20 | S6: 20 | T6: 20 | U6: 20 | V6: 20 | W6: 20 | X6: 20 | Y6: 20 | Z6: 20 | AA6: 20 | AB6: 20 | AC6: 20 | AD6: 20 | AE6: 20 | AF6: 20 | AG6: 20 | AH6: 20 | AI6: 20 | AJ6: 20 | AK6: 20 | AL6: 20 | AM6: 20 | AN6: 20 | AO6: 20 | AP6: 20 | AQ6: 20 | AR6: 20 | AS6: 20 | AT6: 20 | AU6: 20 | AV6: 20 | AW6: 20 | AX6: 20 | AY6: 20 | AZ6: 20 | BA6: 20 | BB6: 20 | BC6: 20 | BD6: 20 | BE6: 20 | BF6: 20 | BG6: 20 | BH6: 20 | BI6: 20 | BJ6: 20 | BK6: 20 | BL6: 20 | BM6: 20 | BN6: 20 | BO6: 20 | BP6: 20 | BQ6: 20 | BR6: 20 | BS6: 20 | BT6: 20 | BU6: 20 | BV6: 20 | BW6: 20 | BX6: 20 | BY6: 20 | BZ6: 20 | CA6: 20 | CB6: 20 | CC6: 20 | CD6: 20 | CE6: 20 | CF6: 20 | CG6: 20 | CH6: 20 | CI6: 20 | CJ6: 20 | CK6: 20 | CL6: 20 | CM6: 20 | CN6: 20 | CO6: 20 | CP6: 20 | CQ6: 20 | CR6: 20 | CS6: 20 | CT6: 20 | CU6: 20 | CV6: 20 | CW6: 0 | CX6: =FIB(RC[-101])+RC[-1]+R[-1]C+R[-1]C[-1] -> 54730 | CY6: =FIB(RC[-101])+RC[-1]+R[-1]C+R[-1]C[-1] -> 328380 | CZ6: =FIB(RC[-101])+RC[-1]+R[-1]C+R[-1]C[-1] -> 1258790 | DA6: =FIB(RC[-101])+RC[-1]+R[-1]C+R[-1]C[-1] -> 3721640 | DB6: =FIB(RC[-101])+RC[-1]+R[-1]C+R[-1]C[-1] -> 9205586 | DC6: =FIB(RC[-101])+RC[-1]+R[-1]C+R[-1]C[-1] -> 19987396 | DD6: =FIB(RC[-101])+RC[-1]+R[-1]C+R[-1]C[-1] -> 39307086 | DE6: =FIB(RC[-101])+RC[-1]+R[-1]C+R[-1]C[-1] -> 71543056 | DF6: =FIB(RC[-101])+RC[-1]+R[-1]C+R[-1]C[-1] -> 122387226 | DG6: =FIB(RC[-101])+RC[-1]+R[-1]C+R[-1]C[-1] -> 199020172 | DH6: =FIB(RC[-101])+RC[-1]+R[-1]C+R[-1]C[-1] -> 310286262 | DI6: =FIB(RC[-101])+RC[-1]+R[-1]C+R[-1]C[-1] -> 466868792 | DJ6: =FIB(RC[-101])+RC[-1]+R[-1]C+R[-1]C[-1] -> 681465122 | DK6: =FIB(RC[-101])+RC[-1]+R[-1]C+R[-1]C[-1] -> 968961812 | DL6: =FIB(RC[-101])+RC[-1]+R[-1]C+R[-1]C[-1] -> 1346609758 | DM6: =FIB(RC[-101])+RC[-1]+R[-1]C+R[-1]C[-1] -> 1834199328 | DN6: =FIB(RC[-101])+RC[-1]+R[-1]C+R[-1]C[-1] -> 2454235498 | DO6: =FIB(RC[-101])+RC[-1]+R[-1]C+R[-1]C[-1] -> 3232112988 | DP6: =FIB(RC[-101])+RC[-1]+R[-1]C+R[-1]C[-1] -> 4196291398 | DQ6: =FIB(RC[-101])+RC[-1]+R[-1]C+R[-1]C[-1] -> 5378470344 | DR6: =FIB(RC[-101])+RC[-1]+R[-1]C+R[-1]C[-1] -> 6813764594 | DS6: =FIB(RC[-101])+RC[-1]+R[-1]C+R[-1]C[-1] -> 8540879204 | DT6: =FIB(RC[-101])+RC[-1]+R[-1]C+R[-1]C[-1] -> 10602284654 | DU6: =FIB(RC[-101])+RC[-1]+R[-1]C+R[-1]C[-1] -> 13044391984 | DV6: =FIB(RC[-101])+RC[-1]+R[-1]C+R[-1]C[-1] -> 15917727930 | DW6: =FIB(RC[-101])+RC[-1]+R[-1]C+R[-1]C[-1] -> 19277110060 | DX6: =FIB(RC[-101])+RC[-1]+R[-1]C+R[-1]C[-1] -> 23181821910 | DY6: =FIB(RC[-101])+RC[-1]+R[-1]C+R[-1]C[-1] -> 27695788120 | DZ6: =FIB(RC[-101])+RC[-1]+R[-1]C+R[-1]C[-1] -> 32887749570 | EA6: =FIB(RC[-101])+RC[-1]+R[-1]C+R[-1]C[-1] -> 38831438516 | EB6: =FIB(RC[-101])+RC[-1]+R[-1]C+R[-1]C[-1] -> 45605753726 | EC6: =FIB(RC[-101])+RC[-1]+R[-1]C+R[-1]C[-1] -> 53294935616 | ED6: =FIB(RC[-101])+RC[-1]+R[-1]C+R[-1]C[-1] -> 61988741386 | EE6: =FIB(RC[-101])+RC[-1]+R[-1]C+R[-1]C[-1] -> 71782620156 | EF6: =FIB(RC[-101])+RC[-1]+R[-1]C+R[-1]C[-1] -> 82777888102 | EG6: =FIB(RC[-101])+RC[-1]+R[-1]C+R[-1]C[-1] -> 95081903592 | EH6: =FIB(RC[-101])+RC[-1]+R[-1]C+R[-1]C[-1] -> 108808242322 | EI6: =FIB(RC[-101])+RC[-1]+R[-1]C+R[-1]C[-1] -> 124076872452 | EJ6: =FIB(RC[-101])+RC[-1]+R[-1]C+R[-1]C[-1] -> 141014329742 | EK6: =FIB(RC[-101])+RC[-1]+R[-1]C+R[-1]C[-1] -> 159753892688 | EL6: =FIB(RC[-101])+RC[-1]+R[-1]C+R[-1]C[-1] -> 180435757658 | EM6: =FIB(RC[-101])+RC[-1]+R[-1]C+R[-1]C[-1] -> 203207214028 | EN6: =FIB(RC[-101])+RC[-1]+R[-1]C+R[-1]C[-1] -> 228222819318 | EO6: =FIB(RC[-101])+RC[-1]+R[-1]C+R[-1]C[-1] -> 255644574328 | EP6: =FIB(RC[-101])+RC[-1]+R[-1]C+R[-1]C[-1] -> 285642098274 | EQ6: =FIB(RC[-101])+RC[-1]+R[-1]C+R[-1]C[-1] -> 318392803924 | ER6: =FIB(RC[-101])+RC[-1]+R[-1]C+R[-1]C[-1] -> 354082072734 | ES6: =FIB(RC[-101])+RC[-1]+R[-1]C+R[-1]C[-1] -> 392903429984 | ET6: =FIB(RC[-101])+RC[-1]+R[-1]C+R[-1]C[-1] -> 435058719914 | EU6: =FIB(RC[-101])+RC[-1]+R[-1]C+R[-1]C[-1] -> 480758280860 | EV6: =FIB(RC[-101])+RC[-1]+R[-1]C+R[-1]C[-1] -> 530221120390 | EW6: =FIB(RC[-101])+RC[-1]+R[-1]C+R[-1]C[-1] -> 583675090440 | EX6: =FIB(RC[-101])+RC[-1]+R[-1]C+R[-1]C[-1] -> 641357062450 | EY6: =FIB(RC[-101])+RC[-1]+R[-1]C+R[-1]C[-1] -> 703513102500 | EZ6: =FIB(RC[-101])+RC[-1]+R[-1]C+R[-1]C[-1] -> 770398646446 | FA6: =FIB(RC[-101])+RC[-1]+R[-1]C+R[-1]C[-1] -> 842278675056 | FB6: =FIB(RC[-101])+RC[-1]+R[-1]C+R[-1]C[-1] -> 919427889146 | FC6: =FIB(RC[-101])+RC[-1]+R[-1]C+R[-1]C[-1] -> 1002130884716 | FD6: =FIB(RC[-101])+RC[-1]+R[-1]C+R[-1]C[-1] -> 1090682328086 | FE6: =FIB(RC[-101])+RC[-1]+R[-1]C+R[-1]C[-1] -> 1185387131032 | FF6: =FIB(RC[-101])+RC[-1]+R[-1]C+R[-1]C[-1] -> 1286560625922 | FG6: =FIB(RC[-101])+RC[-1]+R[-1]C+R[-1]C[-1] -> 1394528740852 | FH6: =FIB(RC[-101])+RC[-1]+R[-1]C+R[-1]C[-1] -> 1509628174782 | FI6: =FIB(RC[-101])+RC[-1]+R[-1]C+R[-1]C[-1] -> 1632206572672 | FJ6: =FIB(RC[-101])+RC[-1]+R[-1]C+R[-1]C[-1] -> 1762622700618 | FK6: =FIB(RC[-101])+RC[-1]+R[-1]C+R[-1]C[-1] -> 1901246620988 | FL6: =FIB(RC[-101])+RC[-1]+R[-1]C+R[-1]C[-1] -> 2048459867558 | FM6: =FIB(RC[-101])+RC[-1]+R[-1]C+R[-1]C[-1] -> 2204655620648 | FN6: =FIB(RC[-101])+RC[-1]+R[-1]C+R[-1]C[-1] -> 2370238882258 | FO6: =FIB(RC[-101])+RC[-1]+R[-1]C+R[-1]C[-1] -> 2545626651204 | FP6: =FIB(RC[-101])+RC[-1]+R[-1]C+R[-1]C[-1] -> 2731248098254 | FQ6: =FIB(RC[-101])+RC[-1]+R[-1]C+R[-1]C[-1] -> 2927544741264 | FR6: =FIB(RC[-101])+RC[-1]+R[-1]C+R[-1]C[-1] -> 3134970620314 | FS6: =FIB(RC[-101])+RC[-1]+R[-1]C+R[-1]C[-1] -> 3353992472844 | FT6: =FIB(RC[-101])+RC[-1]+R[-1]C+R[-1]C[-1] -> 3585089908790 | FU6: =FIB(RC[-101])+RC[-1]+R[-1]C+R[-1]C[-1] -> 3828755585720 | FV6: =FIB(RC[-101])+RC[-1]+R[-1]C+R[-1]C[-1] -> 4085495383970 | FW6: =FIB(RC[-101])+RC[-1]+R[-1]C+R[-1]C[-1] -> 4355828581780 | FX6: =FIB(RC[-101])+RC[-1]+R[-1]C+R[-1]C[-1] -> 4640288030430 | FY6: =FIB(RC[-101])+RC[-1]+R[-1]C+R[-1]C[-1] -> 4939420329376 | FZ6: =FIB(RC[-101])+RC[-1]+R[-1]C+R[-1]C[-1] -> 5253786001386 | GA6: =FIB(RC[-101])+RC[-1]+R[-1]C+R[-1]C[-1] -> 5583959667676 | GB6: =FIB(RC[-101])+RC[-1]+R[-1]C+R[-1]C[-1] -> 5930530223046 | GC6: =FIB(RC[-101])+RC[-1]+R[-1]C+R[-1]C[-1] -> 6294101011016 | GD6: =FIB(RC[-101])+RC[-1]+R[-1]C+R[-1]C[-1] -> 6675289998962 | GE6: =FIB(RC[-101])+RC[-1]+R[-1]C+R[-1]C[-1] -> 7074729953252 | GF6: =FIB(RC[-101])+RC[-1]+R[-1]C+R[-1]C[-1] -> 7493068614382 | GG6: =FIB(RC[-101])+RC[-1]+R[-1]C+R[-1]C[-1] -> 7930968872112 | GH6: =FIB(RC[-101])+RC[-1]+R[-1]C+R[-1]C[-1] -> 8389108940602 | GI6: =FIB(RC[-101])+RC[-1]+R[-1]C+R[-1]C[-1] -> 8868182533548 | GJ6: =FIB(RC[-101])+RC[-1]+R[-1]C+R[-1]C[-1] -> 9368899039318 | GK6: =FIB(RC[-101])+RC[-1]+R[-1]C+R[-1]C[-1] -> 9891983696088 | GL6: =FIB(RC[-101])+RC[-1]+R[-1]C+R[-1]C[-1] -> 10438177766978 | GM6: =FIB(RC[-101])+RC[-1]+R[-1]C+R[-1]C[-1] -> 11008238715188 | GN6: =FIB(RC[-101])+RC[-1]+R[-1]C+R[-1]C[-1] -> 11602940379134 | GO6: =FIB(RC[-101])+RC[-1]+R[-1]C+R[-1]C[-1] -> 12223073147584 | GP6: =FIB(RC[-101])+RC[-1]+R[-1]C+R[-1]C[-1] -> 12869444134794 | GQ6: =FIB(RC[-101])+RC[-1]+R[-1]C+R[-1]C[-1] -> 13542877355644 | GR6: =FIB(RC[-101])+RC[-1]+R[-1]C+R[-1]C[-1] -> 14244213900774 | GS6: =FIB(RC[-101])+RC[-1]+R[-1]C+R[-1]C[-1] -> 14974312111720
A7: 20 | B7: 20 | C7: 20 | D7: 20 | E7: 20 | F7: 20 | G7: 20 | H7: 20 | I7: 20 | J7: 20 | K7: 20 | L7: 20 | M7: 20 | N7: 20 | O7: 20 | P7: 20 | Q7: 20 | R7: 20 | S7: 20 | T7: 20 | U7: 20 | V7: 20 | W7: 20 | X7: 20 | Y7: 20 | Z7: 20 | AA7: 20 | AB7: 20 | AC7: 20 | AD7: 20 | AE7: 20 | AF7: 20 | AG7: 20 | AH7: 20 | AI7: 20 | AJ7: 20 | AK7: 20 | AL7: 20 | AM7: 20 | AN7: 20 | AO7: 20 | AP7: 20 | AQ7: 20 | AR7: 20 | AS7: 20 | AT7: 20 | AU7: 20 | AV7: 20 | AW7: 20 | AX7: 20 | AY7: 20 | AZ7: 20 | BA7: 20 | BB7: 20 | BC7: 20 | BD7: 20 | BE7: 20 | BF7: 20 | BG7: 20 | BH7: 20 | BI7: 20 | BJ7: 20 | BK7: 20 | BL7: 20 | BM7: 20 | BN7: 20 | BO7: 20 | BP7: 20 | BQ7: 20 | BR7: 20 | BS7: 20 | BT7: 20 | BU7: 20 | BV7: 20 | BW7: 20 | BX7: 20 | BY7: 20 | BZ7: 20 | CA7: 20 | CB7: 20 | CC7: 20 | CD7: 20 | CE7: 20 | CF7: 20 | CG7: 20 | CH7: 20 | CI7: 20 | CJ7: 20 | CK7: 20 | CL7: 20 | CM7: 20 | CN7: 20 | CO7: 20 | CP7: 20 | CQ7: 20 | CR7: 20 | CS7: 20 | CT7: 20 | CU7: 20 | CV7: 20 | CW7: 0 | CX7: =FIB(RC[-101])+RC[-1]+R[-1]C+R[-1]C[-1] -> 65676 | CY7: =FIB(RC[-101])+RC[-1]+R[-1]C+R[-1]C[-1] -> 459732 | CZ7: =FIB(RC[-101])+RC[-1]+R[-1]C+R[-1]C[-1] -> 2057848 | DA7: =FIB(RC[-101])+RC[-1]+R[-1]C+R[-1]C[-1] -> 7049224 | DB7: =FIB(RC[-101])+RC[-1]+R[-1]C+R[-1]C[-1] -> 19987396 | DC7: =FIB(RC[-101])+RC[-1]+R[-1]C+R[-1]C[-1] -> 49191324 | DD7: =FIB(RC[-101])+RC[-1]+R[-1]C+R[-1]C[-1] -> 108496752 | DE7: =FIB(RC[-101])+RC[-1]+R[-1]C+R[-1]C[-1] -> 219357840 | DF7: =FIB(RC[-101])+RC[-1]+R[-1]C+R[-1]C[-1] -> 413299068 | DG7: =FIB(RC[-101])+RC[-1]+R[-1]C+R[-1]C[-1] -> 734717412 | DH7: =FIB(RC[-101])+RC[-1]+R[-1]C+R[-1]C[-1] -> 1244034792 | DI7: =FIB(RC[-101])+RC[-1]+R[-1]C+R[-1]C[-1] -> 2021200792 | DJ7: =FIB(RC[-101])+RC[-1]+R[-1]C+R[-1]C[-1] -> 3169545652 | DK7: =FIB(RC[-101])+RC[-1]+R[-1]C+R[-1]C[-1] -> 4819983532 | DL7: =FIB(RC[-101])+RC[-1]+R[-1]C+R[-1]C[-1] -> 7135566048 | DM7: =FIB(RC[-101])+RC[-1]+R[-1]C+R[-1]C[-1] -> 10316386080 | DN7: =FIB(RC[-101])+RC[-1]+R[-1]C+R[-1]C[-1] -> 14604831852 | DO7: =FIB(RC[-101])+RC[-1]+R[-1]C+R[-1]C[-1] -> 20291191284 | DP7: =FIB(RC[-101])+RC[-1]+R[-1]C+R[-1]C[-1] -> 27719606616 | DQ7: =FIB(RC[-101])+RC[-1]+R[-1]C+R[-1]C[-1] -> 37294379304 | DR7: =FIB(RC[-101])+RC[-1]+R[-1]C+R[-1]C[-1] -> 49486625188 | DS7: =FIB(RC[-101])+RC[-1]+R[-1]C+R[-1]C[-1] -> 64841279932 | DT7: =FIB(RC[-101])+RC[-1]+R[-1]C+R[-1]C[-1] -> 83984454736 | DU7: =FIB(RC[-101])+RC[-1]+R[-1]C+R[-1]C[-1] -> 107631142320 | DV7: =FIB(RC[-101])+RC[-1]+R[-1]C+R[-1]C[-1] -> 136593273180 | DW7: =FIB(RC[-101])+RC[-1]+R[-1]C+R[-1]C[-1] -> 171788122116 | DX7: =FIB(RC[-101])+RC[-1]+R[-1]C+R[-1]C[-1] -> 214247065032 | DY7: =FIB(RC[-101])+RC[-1]+R[-1]C+R[-1]C[-1] -> 265124686008 | DZ7: =FIB(RC[-101])+RC[-1]+R[-1]C+R[-1]C[-1] -> 325708234644 | EA7: =FIB(RC[-101])+RC[-1]+R[-1]C+R[-1]C[-1] -> 397427433676 | EB7: =FIB(RC[-101])+RC[-1]+R[-1]C+R[-1]C[-1] -> 481864636864 | EC7: =FIB(RC[-101])+RC[-1]+R[-1]C+R[-1]C[-1] -> 580765337152 | ED7: =FIB(RC[-101])+RC[-1]+R[-1]C+R[-1]C[-1] -> 696049025100 | EE7: =FIB(RC[-101])+RC[-1]+R[-1]C+R[-1]C[-1] -> 829820397588 | EF7: =FIB(RC[-101])+RC[-1]+R[-1]C+R[-1]C[-1] -> 984380916792 | EG7: =FIB(RC[-101])+RC[-1]+R[-1]C+R[-1]C[-1] -> 1162240719432 | EH7: =FIB(RC[-101])+RC[-1]+R[-1]C+R[-1]C[-1] -> 1366130876292 | EI7: =FIB(RC[-101])+RC[-1]+R[-1]C+R[-1]C[-1] -> 1599016002012 | EJ7: =FIB(RC[-101])+RC[-1]+R[-1]C+R[-1]C[-1] -> 1864107215152 | EK7: =FIB(RC[-101])+RC[-1]+R[-1]C+R[-1]C[-1] -> 2164875448528 | EL7: =FIB(RC[-101])+RC[-1]+R[-1]C+R[-1]C[-1] -> 2505065109820 | EM7: =FIB(RC[-101])+RC[-1]+R[-1]C+R[-1]C[-1] -> 2888708092452 | EN7: =FIB(RC[-101])+RC[-1]+R[-1]C+R[-1]C[-1] -> 3320138136744 | EO7: =FIB(RC[-101])+RC[-1]+R[-1]C+R[-1]C[-1] -> 3804005541336 | EP7: =FIB(RC[-101])+RC[-1]+R[-1]C+R[-1]C[-1] -> 4345292224884 | EQ7: =FIB(RC[-101])+RC[-1]+R[-1]C+R[-1]C[-1] -> 4949327138028 | ER7: =FIB(RC[-101])+RC[-1]+R[-1]C+R[-1]C[-1] -> 5621802025632 | ES7: =FIB(RC[-101])+RC[-1]+R[-1]C+R[-1]C[-1] -> 6368787539296 | ET7: =FIB(RC[-101])+RC[-1]+R[-1]C+R[-1]C[-1] -> 7196749700140 | EU7: =FIB(RC[-101])+RC[-1]+R[-1]C+R[-1]C[-1] -> 8112566711860 | EV7: =FIB(RC[-101])+RC[-1]+R[-1]C+R[-1]C[-1] -> 9123546124056 | EW7: =FIB(RC[-101])+RC[-1]+R[-1]C+R[-1]C[-1] -> 10237442345832 | EX7: =FIB(RC[-101])+RC[-1]+R[-1]C+R[-1]C[-1] -> 11462474509668 | EY7: =FIB(RC[-101])+RC[-1]+R[-1]C+R[-1]C[-1] -> 12807344685564 | EZ7: =FIB(RC[-101])+RC[-1]+R[-1]C+R[-1]C[-1] -> 14281256445456 | FA7: =FIB(RC[-101])+RC[-1]+R[-1]C+R[-1]C[-1] -> 15893933777904 | FB7: =FIB(RC[-101])+RC[-1]+R[-1]C+R[-1]C[-1] -> 17655640353052 | FC7: =FIB(RC[-101])+RC[-1]+R[-1]C+R[-1]C[-1] -> 19577199137860 | FD7: =FIB(RC[-101])+RC[-1]+R[-1]C+R[-1]C[-1] -> 21670012361608 | FE7: =FIB(RC[-101])+RC[-1]+R[-1]C+R[-1]C[-1] -> 23946081831672 | FF7: =FIB(RC[-101])+RC[-1]+R[-1]C+R[-1]C[-1] -> 26418029599572 | FG7: =FIB(RC[-101])+RC[-1]+R[-1]C+R[-1]C[-1] -> 29099118977292 | FH7: =FIB(RC[-101])+RC[-1]+R[-1]C+R[-1]C[-1] -> 32003275903872 | FI7: =FIB(RC[-101])+RC[-1]+R[-1]C+R[-1]C[-1] -> 35145110662272 | FJ7: =FIB(RC[-101])+RC[-1]+R[-1]C+R[-1]C[-1] -> 38539939946508 | FK7: =FIB(RC[-101])+RC[-1]+R[-1]C+R[-1]C[-1] -> 42203809279060 | FL7: =FIB(RC[-101])+RC[-1]+R[-1]C+R[-1]C[-1] -> 46153515778552 | FM7: =FIB(RC[-101])+RC[-1]+R[-1]C+R[-1]C[-1] -> 50406631277704 | FN7: =FIB(RC[-101])+RC[-1]+R[-1]C+R[-1]C[-1] -> 54981525791556 | FO7: =FIB(RC[-101])+RC[-1]+R[-1]C+R[-1]C[-1] -> 59897391335964 | FP7: =FIB(RC[-101])+RC[-1]+R[-1]C+R[-1]C[-1] -> 65174266096368 | FQ7: =FIB(RC[-101])+RC[-1]+R[-1]C+R[-1]C[-1] -> 70833058946832 | FR7: =FIB(RC[-101])+RC[-1]+R[-1]C+R[-1]C[-1] -> 76895574319356 | FS7: =FIB(RC[-101])+RC[-1]+R[-1]C+R[-1]C[-1] -> 83384537423460 | FT7: =FIB(RC[-101])+RC[-1]+R[-1]C+R[-1]C[-1] -> 90323619816040 | FU7: =FIB(RC[-101])+RC[-1]+R[-1]C+R[-1]C[-1] -> 97737465321496 | FV7: =FIB(RC[-101])+RC[-1]+R[-1]C+R[-1]C[-1] -> 105651716302132 | FW7: =FIB(RC[-101])+RC[-1]+R[-1]C+R[-1]C[-1] -> 114093040278828 | FX7: =FIB(RC[-101])+RC[-1]+R[-1]C+R[-1]C[-1] -> 123089156901984 | FY7: =FIB(RC[-101])+RC[-1]+R[-1]C+R[-1]C[-1] -> 132668865272736 | FZ7: =FIB(RC[-101])+RC[-1]+R[-1]C+R[-1]C[-1] -> 142862071614444 | GA7: =FIB(RC[-101])+RC[-1]+R[-1]C+R[-1]C[-1] -> 153699817294452 | GB7: =FIB(RC[-101])+RC[-1]+R[-1]C+R[-1]C[-1] -> 165214307196120 | GC7: =FIB(RC[-101])+RC[-1]+R[-1]C+R[-1]C[-1] -> 177438938441128 | GD7: =FIB(RC[-101])+RC[-1]+R[-1]C+R[-1]C[-1] -> 190408329462052 | GE7: =FIB(RC[-101])+RC[-1]+R[-1]C+R[-1]C[-1] -> 204158349425212 | GF7: =FIB(RC[-101])+RC[-1]+R[-1]C+R[-1]C[-1] -> 218726148003792 | GG7: =FIB(RC[-101])+RC[-1]+R[-1]C+R[-1]C[-1] -> 234150185501232 | GH7: =FIB(RC[-101])+RC[-1]+R[-1]C+R[-1]C[-1] -> 250470263324892 | GI7: =FIB(RC[-101])+RC[-1]+R[-1]C+R[-1]C[-1] -> 267727554809988 | GJ7: =FIB(RC[-101])+RC[-1]+R[-1]C+R[-1]C[-1] -> 285964636393800 | GK7: =FIB(RC[-101])+RC[-1]+R[-1]C+R[-1]C[-1] -> 305225519140152 | GL7: =FIB(RC[-101])+RC[-1]+R[-1]C+R[-1]C[-1] -> 325555680614164 | GM7: =FIB(RC[-101])+RC[-1]+R[-1]C+R[-1]C[-1] -> 347002097107276 | GN7: =FIB(RC[-101])+RC[-1]+R[-1]C+R[-1]C[-1] -> 369613276212544 | GO7: =FIB(RC[-101])+RC[-1]+R[-1]C+R[-1]C[-1] -> 393439289750208 | GP7: =FIB(RC[-101])+RC[-1]+R[-1]C+R[-1]C[-1] -> 418531807043532 | GQ7: =FIB(RC[-101])+RC[-1]+R[-1]C+R[-1]C[-1] -> 444944128544916 | GR7: =FIB(RC[-101])+RC[-1]+R[-1]C+R[-1]C[-1] -> 472731219812280 | GS7: =FIB(RC[-101])+RC[-1]+R[-1]C+R[-1]C[-1] -> 501949745835720
A8: 20 | B8: 20 | C8: 20 | D8: 20 | E8: 20 | F8: 20 | G8: 20 | H8: 20 | I8: 20 | J8: 20 | K8: 20 | L8: 20 | M8: 20 | N8: 20 | O8: 20 | P8: 20 | Q8: 20 | R8: 20 | S8: 20 | T8: 20 | U8: 20 | V8: 20 | W8: 20 | X8: 20 | Y8: 20 | Z8: 20 | AA8: 20 | AB8: 20 | AC8: 20 | AD8: 20 | AE8: 20 | AF8: 20 | AG8: 20 | AH8: 20 | AI8: 20 | AJ8: 20 | AK8: 20 | AL8: 20 | AM8: 20 | AN8: 20 | AO8: 20 | AP8: 20 | AQ8: 20 | AR8: 20 | AS8: 20 | AT8: 20 | AU8: 20 | AV8: 20 | AW8: 20 | AX8: 20 | AY8: 20 | AZ8: 20 | BA8: 20 | BB8: 20 | BC8: 20 | BD8: 20 | BE8: 20 | BF8: 20 | BG8: 20 | BH8: 20 | BI8: 20 | BJ8: 20 | BK8: 20 | BL8: 20 | BM8: 20 | BN8: 20 | BO8: 20 | BP8: 20 | BQ8: 20 | BR8: 20 | BS8: 20 | BT8: 20 | BU8: 20 | BV8: 20 | BW8: 20 | BX8: 20 | BY8: 20 | BZ8: 20 | CA8: 20 | CB8: 20 | CC8: 20 | CD8: 20 | CE8: 20 | CF8: 20 | CG8: 20 | CH8: 20 | CI8: 20 | CJ8: 20 | CK8: 20 | CL8: 20 | CM8: 20 | CN8: 20 | CO8: 20 | CP8: 20 | CQ8: 20 | CR8: 20 | CS8: 20 | CT8: 20 | CU8: 20 | CV8: 20 | CW8: 0 | CX8: =FIB(RC[-101])+RC[-1]+R[-1]C+R[-1]C[-1] -> 76622 | CY8: =FIB(RC[-101])+RC[-1]+R[-1]C+R[-1]C[-1] -> 612976 | CZ8: =FIB(RC[-101])+RC[-1]+R[-1]C+R[-1]C[-1] -> 3141502 | DA8: =FIB(RC[-101])+RC[-1]+R[-1]C+R[-1]C[-1] -> 12259520 | DB8: =FIB(RC[-101])+RC[-1]+R[-1]C+R[-1]C[-1] -> 39307086 | DC8: =FIB(RC[-101])+RC[-1]+R[-1]C+R[-1]C[-1] -> 108496752 | DD8: =FIB(RC[-101])+RC[-1]+R[-1]C+R[-1]C[-1] -> 266195774 | DE8: =FIB(RC[-101])+RC[-1]+R[-1]C+R[-1]C[-1] -> 594061312 | DF8: =FIB(RC[-101])+RC[-1]+R[-1]C+R[-1]C[-1] -> 1226729166 | DG8: =FIB(RC[-101])+RC[-1]+R[-1]C+R[-1]C[-1] -> 2374756592 | DH8: =FIB(RC[-101])+RC[-1]+R[-1]C+R[-1]C[-1] -> 4353519742 | DI8: =FIB(RC[-101])+RC[-1]+R[-1]C+R[-1]C[-1] -> 7618766272 | DJ8: =FIB(RC[-101])+RC[-1]+R[-1]C+R[-1]C[-1] -> 12809523662 | DK8: =FIB(RC[-101])+RC[-1]+R[-1]C+R[-1]C[-1] -> 20799063792 | DL8: =FIB(RC[-101])+RC[-1]+R[-1]C+R[-1]C[-1] -> 32754624318 | DM8: =FIB(RC[-101])+RC[-1]+R[-1]C+R[-1]C[-1] -> 50206587392 | DN8: =FIB(RC[-101])+RC[-1]+R[-1]C+R[-1]C[-1] -> 75127816270 | DO8: =FIB(RC[-101])+RC[-1]+R[-1]C+R[-1]C[-1] -> 110023850352 | DP8: =FIB(RC[-101])+RC[-1]+R[-1]C+R[-1]C[-1] -> 158034659198 | DQ8: =FIB(RC[-101])+RC[-1]+R[-1]C+R[-1]C[-1] -> 223048656064 | DR8: =FIB(RC[-101])+RC[-1]+R[-1]C+R[-1]C[-1] -> 309829671502 | DS8: =FIB(RC[-101])+RC[-1]+R[-1]C+R[-1]C[-1] -> 424157587568 | DT8: =FIB(RC[-101])+RC[-1]+R[-1]C+R[-1]C[-1] -> 572983333182 | DU8: =FIB(RC[-101])+RC[-1]+R[-1]C+R[-1]C[-1] -> 764598941184 | DV8: =FIB(RC[-101])+RC[-1]+R[-1]C+R[-1]C[-1] -> 1008823367630 | DW8: =FIB(RC[-101])+RC[-1]+R[-1]C+R[-1]C[-1] -> 1317204773872 | DX8: =FIB(RC[-101])+RC[-1]+R[-1]C+R[-1]C[-1] -> 1703239971966 | DY8: =FIB(RC[-101])+RC[-1]+R[-1]C+R[-1]C[-1] -> 2182611733952 | DZ8: =FIB(RC[-101])+RC[-1]+R[-1]C+R[-1]C[-1] -> 2773444665550 | EA8: =FIB(RC[-101])+RC[-1]+R[-1]C+R[-1]C[-1] -> 3496580344816 | EB8: =FIB(RC[-101])+RC[-1]+R[-1]C+R[-1]C[-1] -> 4375872426302 | EC8: =FIB(RC[-101])+RC[-1]+R[-1]C+R[-1]C[-1] -> 5438502411264 | ED8: =FIB(RC[-101])+RC[-1]+R[-1]C+R[-1]C[-1] -> 6715316784462 | EE8: =FIB(RC[-101])+RC[-1]+R[-1]C+R[-1]C[-1] -> 8241186218096 | EF8: =FIB(RC[-101])+RC[-1]+R[-1]C+R[-1]C[-1] -> 10055387543422 | EG8: =FIB(RC[-101])+RC[-1]+R[-1]C+R[-1]C[-1] -> 12202009190592 | EH8: =FIB(RC[-101])+RC[-1]+R[-1]C+R[-1]C[-1] -> 14730380797262 | EI8: =FIB(RC[-101])+RC[-1]+R[-1]C+R[-1]C[-1] -> 17695527686512 | EJ8: =FIB(RC[-101])+RC[-1]+R[-1]C+R[-1]C[-1] -> 21158650914622 | EK8: =FIB(RC[-101])+RC[-1]+R[-1]C+R[-1]C[-1] -> 25187633589248 | EL8: =FIB(RC[-101])+RC[-1]+R[-1]C+R[-1]C[-1] -> 29857574158542 | EM8: =FIB(RC[-101])+RC[-1]+R[-1]C+R[-1]C[-1] -> 35251347371760 | EN8: =FIB(RC[-101])+RC[-1]+R[-1]C+R[-1]C[-1] -> 41460193611902 | EO8: =FIB(RC[-101])+RC[-1]+R[-1]C+R[-1]C[-1] -> 48584337300928 | EP8: =FIB(RC[-101])+RC[-1]+R[-1]C+R[-1]C[-1] -> 56733635078094 | EQ8: =FIB(RC[-101])+RC[-1]+R[-1]C+R[-1]C[-1] -> 66028254451952 | ER8: =FIB(RC[-101])+RC[-1]+R[-1]C+R[-1]C[-1] -> 76599383626558 | ES8: =FIB(RC[-101])+RC[-1]+R[-1]C+R[-1]C[-1] -> 88589973202432 | ET8: =FIB(RC[-101])+RC[-1]+R[-1]C+R[-1]C[-1] -> 102155510452814 | EU8: =FIB(RC[-101])+RC[-1]+R[-1]C+R[-1]C[-1] -> 117464826875760 | EV8: =FIB(RC[-101])+RC[-1]+R[-1]C+R[-1]C[-1] -> 134700939722622 | EW8: =FIB(RC[-101])+RC[-1]+R[-1]C+R[-1]C[-1] -> 154061928203456 | EX8: =FIB(RC[-101])+RC[-1]+R[-1]C+R[-1]C[-1] -> 175761845069902 | EY8: =FIB(RC[-101])+RC[-1]+R[-1]C+R[-1]C[-1] -> 200031664276080 | EZ8: =FIB(RC[-101])+RC[-1]+R[-1]C+R[-1]C[-1] -> 227120265418046 | FA8: =FIB(RC[-101])+RC[-1]+R[-1]C+R[-1]C[-1] -> 257295455652352 | FB8: =FIB(RC[-101])+RC[-1]+R[-1]C+R[-1]C[-1] -> 290845029794254 | FC8: =FIB(RC[-101])+RC[-1]+R[-1]C+R[-1]C[-1] -> 328077869296112 | FD8: =FIB(RC[-101])+RC[-1]+R[-1]C+R[-1]C[-1] -> 369325080806526 | FE8: =FIB(RC[-101])+RC[-1]+R[-1]C+R[-1]C[-1] -> 414941175010752 | FF8: =FIB(RC[-101])+RC[-1]+R[-1]C+R[-1]C[-1] -> 465305286452942 | FG8: =FIB(RC[-101])+RC[-1]+R[-1]C+R[-1]C[-1] -> 520822435040752 | FH8: =FIB(RC[-101])+RC[-1]+R[-1]C+R[-1]C[-1] -> 581924829932862 | FI8: =FIB(RC[-101])+RC[-1]+R[-1]C+R[-1]C[-1] -> 649073216509952 | FJ8: =FIB(RC[-101])+RC[-1]+R[-1]C+R[-1]C[-1] -> 722758267129678 | FK8: =FIB(RC[-101])+RC[-1]+R[-1]C+R[-1]C[-1] -> 803502016366192 | FL8: =FIB(RC[-101])+RC[-1]+R[-1]C+R[-1]C[-1] -> 891859341434750 | FM8: =FIB(RC[-101])+RC[-1]+R[-1]C+R[-1]C[-1] -> 988419488501952 | FN8: =FIB(RC[-101])+RC[-1]+R[-1]C+R[-1]C[-1] -> 1.09380764558216E+15 | FO8: =FIB(RC[-101])+RC[-1]+R[-1]C+R[-1]C[-1] -> 1.20868656272062E+15 | FP8: =FIB(RC[-101])+RC[-1]+R[-1]C+R[-1]C[-1] -> 1.3337582201639E+15 | FQ8: =FIB(RC[-101])+RC[-1]+R[-1]C+R[-1]C[-1] -> 1.46976554521805E+15 | FR8: =FIB(RC[-101])+RC[-1]+R[-1]C+R[-1]C[-1] -> 1.61749417849518E+15 | FS8: =FIB(RC[-101])+RC[-1]+R[-1]C+R[-1]C[-1] -> 1.77777429024894E+15 | FT8: =FIB(RC[-101])+RC[-1]+R[-1]C+R[-1]C[-1] -> 1.95148244749939E+15 | FU8: =FIB(RC[-101])+RC[-1]+R[-1]C+R[-1]C[-1] -> 2.13954353264787E+15 | FV8: =FIB(RC[-101])+RC[-1]+R[-1]C+R[-1]C[-1] -> 2.34293271428245E+15 | FW8: =FIB(RC[-101])+RC[-1]+R[-1]C+R[-1]C[-1] -> 2.56267747087435E+15 | FX8: =FIB(RC[-101])+RC[-1]+R[-1]C+R[-1]C[-1] -> 2.79985966806611E+15 | FY8: =FIB(RC[-101])+RC[-1]+R[-1]C+R[-1]C[-1] -> 3.05561769025178E+15 | FZ8: =FIB(RC[-101])+RC[-1]+R[-1]C+R[-1]C[-1] -> 3.3311486271499E+15 | GA8: =FIB(RC[-101])+RC[-1]+R[-1]C+R[-1]C[-1] -> 3.62771051606974E+15 | GB8: =FIB(RC[-101])+RC[-1]+R[-1]C+R[-1]C[-1] -> 3.94662464057126E+15 | GC8: =FIB(RC[-101])+RC[-1]+R[-1]C+R[-1]C[-1] -> 4.28927788621946E+15 | GD8: =FIB(RC[-101])+RC[-1]+R[-1]C+R[-1]C[-1] -> 4.65712515413358E+15 | GE8: =FIB(RC[-101])+RC[-1]+R[-1]C+R[-1]C[-1] -> 5.05169183303179E+15 | GF8: =FIB(RC[-101])+RC[-1]+R[-1]C+R[-1]C[-1] -> 5.47457633047174E+15 | GG8: =FIB(RC[-101])+RC[-1]+R[-1]C+R[-1]C[-1] -> 5.92745266398771E+15 | GH8: =FIB(RC[-101])+RC[-1]+R[-1]C+R[-1]C[-1] -> 6.41207311282478E+15 | GI8: =FIB(RC[-101])+RC[-1]+R[-1]C+R[-1]C[-1] -> 6.93027093097061E+15 | GJ8: =FIB(RC[-101])+RC[-1]+R[-1]C+R[-1]C[-1] -> 7.48396312218534E+15 | GK8: =FIB(RC[-101])+RC[-1]+R[-1]C+R[-1]C[-1] -> 8.07515327773024E+15 | GL8: =FIB(RC[-101])+RC[-1]+R[-1]C+R[-1]C[-1] -> 8.7059344774955E+15 | GM8: =FIB(RC[-101])+RC[-1]+R[-1]C+R[-1]C[-1] -> 9.37849225522789E+15 | GN8: =FIB(RC[-101])+RC[-1]+R[-1]C+R[-1]C[-1] -> 1.00951076285587E+16 | GO8: =FIB(RC[-101])+RC[-1]+R[-1]C+R[-1]C[-1] -> 1.08581601945324E+16 | GP8: =FIB(RC[-101])+RC[-1]+R[-1]C+R[-1]C[-1] -> 1.1670131291337E+16 | GQ8: =FIB(RC[-101])+RC[-1]+R[-1]C+R[-1]C[-1] -> 1.25336072269364E+16 | GR8: =FIB(RC[-101])+RC[-1]+R[-1]C+R[-1]C[-1] -> 1.34512825753046E+16 | GS8: =FIB(RC[-101])+RC[-1]+R[-1]C+R[-1]C[-1] -> 1.44259635409635E+16
A9: 20 | B9: 20 | C9: 20 | D9: 20 | E9: 20 | F9: 20 | G9: 20 | H9: 20 | I9: 20 | J9: 20 | K9: 20 | L9: 20 | M9: 20 | N9: 20 | O9: 20 | P9: 20 | Q9: 20 | R9: 20 | S9: 20 | T9: 20 | U9: 20 | V9: 20 | W9: 20 | X9: 20 | Y9: 20 | Z9: 20 | AA9: 20 | AB9: 20 | AC9: 20 | AD9: 20 | AE9: 20 | AF9: 20 | AG9: 20 | AH9: 20 | AI9: 20 | AJ9: 20 | AK9: 20 | AL9: 20 | AM9: 20 | AN9: 20 | AO9: 20 | AP9: 20 | AQ9: 20 | AR9: 20 | AS9: 20 | AT9: 20 | AU9: 20 | AV9: 20 | AW9: 20 | AX9: 20 | AY9: 20 | AZ9: 20 | BA9: 20 | BB9: 20 | BC9: 20 | BD9: 20 | BE9: 20 | BF9: 20 | BG9: 20 | BH9: 20 | BI9: 20 | BJ9: 20 | BK9: 20 | BL9: 20 | BM9: 20 | BN9: 20 | BO9: 20 | BP9: 20 | BQ9: 20 | BR9: 20 | BS9: 20 | BT9: 20 | BU9: 20 | BV9: 20 | BW9: 20 | BX9: 20 | BY9: 20 | BZ9: 20 | CA9: 20 | CB9: 20 | CC9: 20 | CD9: 20 | CE9: 20 | CF9: 20 | CG9: 20 | CH9: 20 | CI9: 20 | CJ9: 20 | CK9: 20 | CL9: 20 | CM9: 20 | CN9: 20 | CO9: 20 | CP9: 20 | CQ9: 20 | CR9: 20 | CS9: 20 | CT9: 20 | CU9: 20 | CV9: 20 | CW9: 0 | CX9: =FIB(RC[-101])+RC[-1]+R[-1]C+R[-1]C[-1] -> 87568 | CY9: =FIB(RC[-101])+RC[-1]+R[-1]C+R[-1]C[-1] -> 788112 | CZ9: =FIB(RC[-101])+RC[-1]+R[-1]C+R[-1]C[-1] -> 4553536 | DA9: =FIB(RC[-101])+RC[-1]+R[-1]C+R[-1]C[-1] -> 19965504 | DB9: =FIB(RC[-101])+RC[-1]+R[-1]C+R[-1]C[-1] -> 71543056 | DC9: =FIB(RC[-101])+RC[-1]+R[-1]C+R[-1]C[-1] -> 219357840 | DD9: =FIB(RC[-101])+RC[-1]+R[-1]C+R[-1]C[-1] -> 594061312 | DE9: =FIB(RC[-101])+RC[-1]+R[-1]C+R[-1]C[-1] -> 1454329344 | DF9: =FIB(RC[-101])+RC[-1]+R[-1]C+R[-1]C[-1] -> 3275130768 | DG9: =FIB(RC[-101])+RC[-1]+R[-1]C+R[-1]C[-1] -> 6876627472 | DH9: =FIB(RC[-101])+RC[-1]+R[-1]C+R[-1]C[-1] -> 13604914752 | DI9: =FIB(RC[-101])+RC[-1]+R[-1]C+R[-1]C[-1] -> 25577211712 | DJ9: =FIB(RC[-101])+RC[-1]+R[-1]C+R[-1]C[-1] -> 46005512592 | DK9: =FIB(RC[-101])+RC[-1]+R[-1]C+R[-1]C[-1] -> 79614110992 | DL9: =FIB(RC[-101])+RC[-1]+R[-1]C+R[-1]C[-1] -> 133167810048 | DM9: =FIB(RC[-101])+RC[-1]+R[-1]C+R[-1]C[-1] -> 216129032704 | DN9: =FIB(RC[-101])+RC[-1]+R[-1]C+R[-1]C[-1] -> 341463447312 | DO9: =FIB(RC[-101])+RC[-1]+R[-1]C+R[-1]C[-1] -> 526615124880 | DP9: =FIB(RC[-101])+RC[-1]+R[-1]C+R[-1]C[-1] -> 794673645376 | DQ9: =FIB(RC[-101])+RC[-1]+R[-1]C+R[-1]C[-1] -> 1175756971584 | DR9: =FIB(RC[-101])+RC[-1]+R[-1]C+R[-1]C[-1] -> 1708635310096 | DS9: =FIB(RC[-101])+RC[-1]+R[-1]C+R[-1]C[-1] -> 2442622580112 | DT9: =FIB(RC[-101])+RC[-1]+R[-1]C+R[-1]C[-1] -> 3439763511808 | DU9: =FIB(RC[-101])+RC[-1]+R[-1]C+R[-1]C[-1] -> 4777345797120 | DV9: =FIB(RC[-101])+RC[-1]+R[-1]C+R[-1]C[-1] -> 6550768116880 | DW9: =FIB(RC[-101])+RC[-1]+R[-1]C+R[-1]C[-1] -> 8876796269328 | DX9: =FIB(RC[-101])+RC[-1]+R[-1]C+R[-1]C[-1] -> 11897241026112 | DY9: =FIB(RC[-101])+RC[-1]+R[-1]C+R[-1]C[-1] -> 15783092742976 | DZ9: =FIB(RC[-101])+RC[-1]+R[-1]C+R[-1]C[-1] -> 20739149153424 | EA9: =FIB(RC[-101])+RC[-1]+R[-1]C+R[-1]C[-1] -> 27009174174736 | EB9: =FIB(RC[-101])+RC[-1]+R[-1]C+R[-1]C[-1] -> 34881626956800 | EC9: =FIB(RC[-101])+RC[-1]+R[-1]C+R[-1]C[-1] -> 44696001805312 | ED9: =FIB(RC[-101])+RC[-1]+R[-1]C+R[-1]C[-1] -> 56849821011984 | EE9: =FIB(RC[-101])+RC[-1]+R[-1]C+R[-1]C[-1] -> 71806324025488 | EF9: =FIB(RC[-101])+RC[-1]+R[-1]C+R[-1]C[-1] -> 90102897797952 | EG9: =FIB(RC[-101])+RC[-1]+R[-1]C+R[-1]C[-1] -> 112360294542912 | EH9: =FIB(RC[-101])+RC[-1]+R[-1]C+R[-1]C[-1] -> 139292684541712 | EI9: =FIB(RC[-101])+RC[-1]+R[-1]C+R[-1]C[-1] -> 171718593036432 | EJ9: =FIB(RC[-101])+RC[-1]+R[-1]C+R[-1]C[-1] -> 210572771648512 | EK9: =FIB(RC[-101])+RC[-1]+R[-1]C+R[-1]C[-1] -> 256919056163328 | EL9: =FIB(RC[-101])+RC[-1]+R[-1]C+R[-1]C[-1] -> 311964263922064 | EM9: =FIB(RC[-101])+RC[-1]+R[-1]C+R[-1]C[-1] -> 377073185463312 | EN9: =FIB(RC[-101])+RC[-1]+R[-1]C+R[-1]C[-1] -> 453784726457920 | EO9: =FIB(RC[-101])+RC[-1]+R[-1]C+R[-1]C[-1] -> 543829257381696 | EP9: =FIB(RC[-101])+RC[-1]+R[-1]C+R[-1]C[-1] -> 649147229771664 | EQ9: =FIB(RC[-101])+RC[-1]+R[-1]C+R[-1]C[-1] -> 771909119312656 | ER9: =FIB(RC[-101])+RC[-1]+R[-1]C+R[-1]C[-1] -> 914536757402112 | ES9: =FIB(RC[-101])+RC[-1]+R[-1]C+R[-1]C[-1] -> 1.07972611424205E+15 | ET9: =FIB(RC[-101])+RC[-1]+R[-1]C+R[-1]C[-1] -> 1.27047159790824E+15 | EU9: =FIB(RC[-101])+RC[-1]+R[-1]C+R[-1]C[-1] -> 1.49009193524776E+15 | EV9: =FIB(RC[-101])+RC[-1]+R[-1]C+R[-1]C[-1] -> 1.74225770185709E+15 | EW9: =FIB(RC[-101])+RC[-1]+R[-1]C+R[-1]C[-1] -> 2.03102056979411E+15 | EX9: =FIB(RC[-101])+RC[-1]+R[-1]C+R[-1]C[-1] -> 2.36084434307842E+15 | EY9: =FIB(RC[-101])+RC[-1]+R[-1]C+R[-1]C[-1] -> 2.73663785243534E+15 | EZ9: =FIB(RC[-101])+RC[-1]+R[-1]C+R[-1]C[-1] -> 3.16378978214042E+15 | FA9: =FIB(RC[-101])+RC[-1]+R[-1]C+R[-1]C[-1] -> 3.64820550322176E+15 | FB9: =FIB(RC[-101])+RC[-1]+R[-1]C+R[-1]C[-1] -> 4.19634598867931E+15 | FC9: =FIB(RC[-101])+RC[-1]+R[-1]C+R[-1]C[-1] -> 4.81526888778062E+15 | FD9: =FIB(RC[-101])+RC[-1]+R[-1]C+R[-1]C[-1] -> 5.51267183789421E+15 | FE9: =FIB(RC[-101])+RC[-1]+R[-1]C+R[-1]C[-1] -> 6.29693809372243E+15 | FF9: =FIB(RC[-101])+RC[-1]+R[-1]C+R[-1]C[-1] -> 7.17718455519707E+15 | FG9: =FIB(RC[-101])+RC[-1]+R[-1]C+R[-1]C[-1] -> 8.16331227670171E+15 | FH9: =FIB(RC[-101])+RC[-1]+R[-1]C+R[-1]C[-1] -> 9.26605954168627E+15 | FI9: =FIB(RC[-101])+RC[-1]+R[-1]C+R[-1]C[-1] -> 1.049705758814E+16 | FJ9: =FIB(RC[-101])+RC[-1]+R[-1]C+R[-1]C[-1] -> 1.18688890717906E+16 | FK9: =FIB(RC[-101])+RC[-1]+R[-1]C+R[-1]C[-1] -> 1.33951493552974E+16 | FL9: =FIB(RC[-101])+RC[-1]+R[-1]C+R[-1]C[-1] -> 1.50905107131093E+16 | FM9: =FIB(RC[-101])+RC[-1]+R[-1]C+R[-1]C[-1] -> 1.6970789543057E+16 | FN9: =FIB(RC[-101])+RC[-1]+R[-1]C+R[-1]C[-1] -> 1.9053016677152E+16 | FO9: =FIB(RC[-101])+RC[-1]+R[-1]C+R[-1]C[-1] -> 2.13555108854657E+16 | FP9: =FIB(RC[-101])+RC[-1]+R[-1]C+R[-1]C[-1] -> 2.38979556683612E+16 | FQ9: =FIB(RC[-101])+RC[-1]+R[-1]C+R[-1]C[-1] -> 2.67014794337541E+16 | FR9: =FIB(RC[-101])+RC[-1]+R[-1]C+R[-1]C[-1] -> 2.97887391574783E+16 | FS9: =FIB(RC[-101])+RC[-1]+R[-1]C+R[-1]C[-1] -> 3.31840076262334E+16 | FT9: =FIB(RC[-101])+RC[-1]+R[-1]C+R[-1]C[-1] -> 3.69132643639926E+16 | FU9: =FIB(RC[-101])+RC[-1]+R[-1]C+R[-1]C[-1] -> 4.10042903441508E+16 | FV9: =FIB(RC[-101])+RC[-1]+R[-1]C+R[-1]C[-1] -> 4.54867665910921E+16 | FW9: =FIB(RC[-101])+RC[-1]+R[-1]C+R[-1]C[-1] -> 5.03923767762599E+16 | FX9: =FIB(RC[-101])+RC[-1]+R[-1]C+R[-1]C[-1] -> 5.57549139152113E+16 | FY9: =FIB(RC[-101])+RC[-1]+R[-1]C+R[-1]C[-1] -> 6.16103912735401E+16 | FZ9: =FIB(RC[-101])+RC[-1]+R[-1]C+R[-1]C[-1] -> 6.79971575909527E+16 | GA9: =FIB(RC[-101])+RC[-1]+R[-1]C+R[-1]C[-1] -> 7.49560167341833E+16 | GB9: =FIB(RC[-101])+RC[-1]+R[-1]C+R[-1]C[-1] -> 8.25303518908353E+16 | GC9: =FIB(RC[-101])+RC[-1]+R[-1]C+R[-1]C[-1] -> 9.07662544176369E+16 | GD9: =FIB(RC[-101])+RC[-1]+R[-1]C+R[-1]C[-1] -> 9.97126574580009E+16 | GE9: =FIB(RC[-101])+RC[-1]+R[-1]C+R[-1]C[-1] -> 1.09421474445177E+17 | GF9: =FIB(RC[-101])+RC[-1]+R[-1]C+R[-1]C[-1] -> 1.19947742608692E+17 | GG9: =FIB(RC[-101])+RC[-1]+R[-1]C+R[-1]C[-1] -> 1.31349771603162E+17 | GH9: =FIB(RC[-101])+RC[-1]+R[-1]C+R[-1]C[-1] -> 1.43689297379986E+17 | GI9: =FIB(RC[-101])+RC[-1]+R[-1]C+R[-1]C[-1] -> 1.57031641423792E+17 | GJ9: =FIB(RC[-101])+RC[-1]+R[-1]C+R[-1]C[-1] -> 1.71445875476959E+17 | GK9: =FIB(RC[-101])+RC[-1]+R[-1]C+R[-1]C[-1] -> 1.87004991876885E+17 | GL9: =FIB(RC[-101])+RC[-1]+R[-1]C+R[-1]C[-1] -> 2.03786079632122E+17 | GM9: =FIB(RC[-101])+RC[-1]+R[-1]C+R[-1]C[-1] -> 2.21870506364856E+17 | GN9: =FIB(RC[-101])+RC[-1]+R[-1]C+R[-1]C[-1] -> 2.41344106248654E+17 | GO9: =FIB(RC[-101])+RC[-1]+R[-1]C+R[-1]C[-1] -> 2.62297374071756E+17 | GP9: =FIB(RC[-101])+RC[-1]+R[-1]C+R[-1]C[-1] -> 2.84825665557636E+17 | GQ9: =FIB(RC[-101])+RC[-1]+R[-1]C+R[-1]C[-1] -> 3.09029404075921E+17 | GR9: =FIB(RC[-101])+RC[-1]+R[-1]C+R[-1]C[-1] -> 3.35014293878172E+17 | GS9: =FIB(RC[-101])+RC[-1]+R[-1]C+R[-1]C[-1] -> 3.62891539994452E+17
A10: 20 | B10: 20 | C10: 20 | D10: 20 | E10: 20 | F10: 20 | G10: 20 | H10: 20 | I10: 20 | J10: 20 | K10: 20 | L10: 20 | M10: 20 | N10: 20 | O10: 20 | P10: 20 | Q10: 20 | R10: 20 | S10: 20 | T10: 20 | U10: 20 | V10: 20 | W10: 20 | X10: 20 | Y10: 20 | Z10: 20 | AA10: 20 | AB10: 20 | AC10: 20 | AD10: 20 | AE10: 20 | AF10: 20 | AG10: 20 | AH10: 20 | AI10: 20 | AJ10: 20 | AK10: 20 | AL10: 20 | AM10: 20 | AN10: 20 | AO10: 20 | AP10: 20 | AQ10: 20 | AR10: 20 | AS10: 20 | AT10: 20 | AU10: 20 | AV10: 20 | AW10: 20 | AX10: 20 | AY10: 20 | AZ10: 20 | BA10: 20 | BB10: 20 | BC10: 20 | BD10: 20 | BE10: 20 | BF10: 20 | BG10: 20 | BH10: 20 | BI10: 20 | BJ10: 20 | BK10: 20 | BL10: 20 | BM10: 20 | BN10: 20 | BO10: 20 | BP10: 20 | BQ10: 20 | BR10: 20 | BS10: 20 | BT10: 20 | BU10: 20 | BV10: 20 | BW10: 20 | BX10: 20 | BY10: 20 | BZ10: 20 | CA10: 20 | CB10: 20 | CC10: 20 | CD10: 20 | CE10: 20 | CF10: 20 | CG10: 20 | CH10: 20 | CI10: 20 | CJ10: 20 | CK10: 20 | CL10: 20 | CM10: 20 | CN10: 20 | CO10: 20 | CP10: 20 | CQ10: 20 | CR10: 20 | CS10: 20 | CT10: 20 | CU10: 20 | CV10: 20 | CW10: 0 | CX10: =FIB(RC[-101])+RC[-1]+R[-1]C+R[-1]C[-1] -> 98514 | CY10: =FIB(RC[-101])+RC[-1]+R[-1]C+R[-1]C[-1] -> 985140 | CZ10: =FIB(RC[-101])+RC[-1]+R[-1]C+R[-1]C[-1] -> 6337734 | DA10: =FIB(RC[-101])+RC[-1]+R[-1]C+R[-1]C[-1] -> 30867720 | DB10: =FIB(RC[-101])+RC[-1]+R[-1]C+R[-1]C[-1] -> 122387226 | DC10: =FIB(RC[-101])+RC[-1]+R[-1]C+R[-1]C[-1] -> 413299068 | DD10: =FIB(RC[-101])+RC[-1]+R[-1]C+R[-1]C[-1] -> 1226729166 | DE10: =FIB(RC[-101])+RC[-1]+R[-1]C+R[-1]C[-1] -> 3275130768 | DF10: =FIB(RC[-101])+RC[-1]+R[-1]C+R[-1]C[-1] -> 8004601826 | DG10: =FIB(RC[-101])+RC[-1]+R[-1]C+R[-1]C[-1] -> 18156371012 | DH10: =FIB(RC[-101])+RC[-1]+R[-1]C+R[-1]C[-1] -> 38637924182 | DI10: =FIB(RC[-101])+RC[-1]+R[-1]C+R[-1]C[-1] -> 77820061592 | DJ10: =FIB(RC[-101])+RC[-1]+R[-1]C+R[-1]C[-1] -> 149402796842 | DK10: =FIB(RC[-101])+RC[-1]+R[-1]C+R[-1]C[-1] -> 275022431372 | DL10: =FIB(RC[-101])+RC[-1]+R[-1]C+R[-1]C[-1] -> 487804363358 | DM10: =FIB(RC[-101])+RC[-1]+R[-1]C+R[-1]C[-1] -> 837101217056 | DN10: =FIB(RC[-101])+RC[-1]+R[-1]C+R[-1]C[-1] -> 1394693708018 | DO10: =FIB(RC[-101])+RC[-1]+R[-1]C+R[-1]C[-1] -> 2262772291156 | DP10: =FIB(RC[-101])+RC[-1]+R[-1]C+R[-1]C[-1] -> 3584061072358 | DQ10: =FIB(RC[-101])+RC[-1]+R[-1]C+R[-1]C[-1] -> 5554491700264 | DR10: =FIB(RC[-101])+RC[-1]+R[-1]C+R[-1]C[-1] -> 8438883992890 | DS10: =FIB(RC[-101])+RC[-1]+R[-1]C+R[-1]C[-1] -> 12590141894044 | DT10: =FIB(RC[-101])+RC[-1]+R[-1]C+R[-1]C[-1] -> 18472527996910 | DU10: =FIB(RC[-101])+RC[-1]+R[-1]C+R[-1]C[-1] -> 26689637316784 | DV10: =FIB(RC[-101])+RC[-1]+R[-1]C+R[-1]C[-1] -> 38017751241730 | DW10: =FIB(RC[-101])+RC[-1]+R[-1]C+R[-1]C[-1] -> 53445315638884 | DX10: =FIB(RC[-101])+RC[-1]+R[-1]C+R[-1]C[-1] -> 74219352945270 | DY10: =FIB(RC[-101])+RC[-1]+R[-1]C+R[-1]C[-1] -> 101899686725304 | DZ10: =FIB(RC[-101])+RC[-1]+R[-1]C+R[-1]C[-1] -> 138421928632650 | EA10: =FIB(RC[-101])+RC[-1]+R[-1]C+R[-1]C[-1] -> 186170251971756 | EB10: =FIB(RC[-101])+RC[-1]+R[-1]C+R[-1]C[-1] -> 248061053114238 | EC10: =FIB(RC[-101])+RC[-1]+R[-1]C+R[-1]C[-1] -> 327638681887296 | ED10: =FIB(RC[-101])+RC[-1]+R[-1]C+R[-1]C[-1] -> 429184504715538 | EE10: =FIB(RC[-101])+RC[-1]+R[-1]C+R[-1]C[-1] -> 557840649763956 | EF10: =FIB(RC[-101])+RC[-1]+R[-1]C+R[-1]C[-1] -> 719749871598342 | EG10: =FIB(RC[-101])+RC[-1]+R[-1]C+R[-1]C[-1] -> 922213063950152 | EH10: =FIB(RC[-101])+RC[-1]+R[-1]C+R[-1]C[-1] -> 1.17386604304572E+15 | EI10: =FIB(RC[-101])+RC[-1]+R[-1]C+R[-1]C[-1] -> 1.48487732063481E+15 | EJ10: =FIB(RC[-101])+RC[-1]+R[-1]C+R[-1]C[-1] -> 1.8671686853307E+15 | EK10: =FIB(RC[-101])+RC[-1]+R[-1]C+R[-1]C[-1] -> 2.33466051315349E+15 | EL10: =FIB(RC[-101])+RC[-1]+R[-1]C+R[-1]C[-1] -> 2.90354383324983E+15 | EM10: =FIB(RC[-101])+RC[-1]+R[-1]C+R[-1]C[-1] -> 3.59258128264615E+15 | EN10: =FIB(RC[-101])+RC[-1]+R[-1]C+R[-1]C[-1] -> 4.42343919457833E+15 | EO10: =FIB(RC[-101])+RC[-1]+R[-1]C+R[-1]C[-1] -> 5.42105317842889E+15 | EP10: =FIB(RC[-101])+RC[-1]+R[-1]C+R[-1]C[-1] -> 6.61402966559319E+15 | EQ10: =FIB(RC[-101])+RC[-1]+R[-1]C+R[-1]C[-1] -> 8.03508601468846E+15 | ER10: =FIB(RC[-101])+RC[-1]+R[-1]C+R[-1]C[-1] -> 9.72153189141417E+15 | ES10: =FIB(RC[-101])+RC[-1]+R[-1]C+R[-1]C[-1] -> 1.17157947630693E+16 | ET10: =FIB(RC[-101])+RC[-1]+R[-1]C+R[-1]C[-1] -> 1.40659924752305E+16 | EU10: =FIB(RC[-101])+RC[-1]+R[-1]C+R[-1]C[-1] -> 1.68265560083975E+16 | EV10: =FIB(RC[-101])+RC[-1]+R[-1]C+R[-1]C[-1] -> 2.00589056455133E+16 | EW10: =FIB(RC[-101])+RC[-1]+R[-1]C+R[-1]C[-1] -> 2.38321839171754E+16 | EX10: =FIB(RC[-101])+RC[-1]+R[-1]C+R[-1]C[-1] -> 2.82240488300589E+16 | EY10: =FIB(RC[-101])+RC[-1]+R[-1]C+R[-1]C[-1] -> 3.33215310255836E+16 | EZ10: =FIB(RC[-101])+RC[-1]+R[-1]C+R[-1]C[-1] -> 3.92219586601703E+16 | FA10: =FIB(RC[-101])+RC[-1]+R[-1]C+R[-1]C[-1] -> 4.60339539455434E+16 | FB10: =FIB(RC[-101])+RC[-1]+R[-1]C+R[-1]C[-1] -> 5.38785054374554E+16 | FC10: =FIB(RC[-101])+RC[-1]+R[-1]C+R[-1]C[-1] -> 6.28901203139263E+16 | FD10: =FIB(RC[-101])+RC[-1]+R[-1]C+R[-1]C[-1] -> 7.32180610396121E+16 | FE10: =FIB(RC[-101])+RC[-1]+R[-1]C+R[-1]C[-1] -> 8.50276709712396E+16 | FF10: =FIB(RC[-101])+RC[-1]+R[-1]C+R[-1]C[-1] -> 9.85017936201701E+16 | FG10: =FIB(RC[-101])+RC[-1]+R[-1]C+R[-1]C[-1] -> 1.1384229045208E+17 | FH10: =FIB(RC[-101])+RC[-1]+R[-1]C+R[-1]C[-1] -> 1.31271662270479E+17 | FI10: =FIB(RC[-101])+RC[-1]+R[-1]C+R[-1]C[-1] -> 1.51034779400316E+17 | FJ10: =FIB(RC[-101])+RC[-1]+R[-1]C+R[-1]C[-1] -> 1.73400726060258E+17 | FK10: =FIB(RC[-101])+RC[-1]+R[-1]C+R[-1]C[-1] -> 1.98664764487357E+17 | FL10: =FIB(RC[-101])+RC[-1]+R[-1]C+R[-1]C[-1] -> 2.27150424555774E+17 | FM10: =FIB(RC[-101])+RC[-1]+R[-1]C+R[-1]C[-1] -> 2.59211724811951E+17 | FN10: =FIB(RC[-101])+RC[-1]+R[-1]C+R[-1]C[-1] -> 2.95235531032171E+17 | FO10: =FIB(RC[-101])+RC[-1]+R[-1]C+R[-1]C[-1] -> 3.356440585948E+17 | FP10: =FIB(RC[-101])+RC[-1]+R[-1]C+R[-1]C[-1] -> 3.80897525148638E+17 | FQ10: =FIB(RC[-101])+RC[-1]+R[-1]C+R[-1]C[-1] -> 4.31496960250764E+17 | FR10: =FIB(RC[-101])+RC[-1]+R[-1]C+R[-1]C[-1] -> 4.87987178842007E+17 | FS10: =FIB(RC[-101])+RC[-1]+R[-1]C+R[-1]C[-1] -> 5.5095992562573E+17 | FT10: =FIB(RC[-101])+RC[-1]+R[-1]C+R[-1]C[-1] -> 6.21057197615967E+17 | FU10: =FIB(RC[-101])+RC[-1]+R[-1]C+R[-1]C[-1] -> 6.98974752324121E+17 | FV10: =FIB(RC[-101])+RC[-1]+R[-1]C+R[-1]C[-1] -> 7.85465809259375E+17 | FW10: =FIB(RC[-101])+RC[-1]+R[-1]C+R[-1]C[-1] -> 8.81344952626738E+17 | FX10: =FIB(RC[-101])+RC[-1]+R[-1]C+R[-1]C[-1] -> 9.8749224331822E+17 | FY10: =FIB(RC[-101])+RC[-1]+R[-1]C+R[-1]C[-1] -> 1.10485754850698E+18 | FZ10: =FIB(RC[-101])+RC[-1]+R[-1]C+R[-1]C[-1] -> 1.23446509737149E+18 | GA10: =FIB(RC[-101])+RC[-1]+R[-1]C+R[-1]C[-1] -> 1.37741827169663E+18 | GB10: =FIB(RC[-101])+RC[-1]+R[-1]C+R[-1]C[-1] -> 1.53490464032166E+18 | GC10: =FIB(RC[-101])+RC[-1]+R[-1]C+R[-1]C[-1] -> 1.70820124663015E+18 | GD10: =FIB(RC[-101])+RC[-1]+R[-1]C+R[-1]C[-1] -> 1.8986801585058E+18 | GE10: =FIB(RC[-101])+RC[-1]+R[-1]C+R[-1]C[-1] -> 2.10781429040898E+18 | GF10: =FIB(RC[-101])+RC[-1]+R[-1]C+R[-1]C[-1] -> 2.33718350746286E+18 | GG10: =FIB(RC[-101])+RC[-1]+R[-1]C+R[-1]C[-1] -> 2.58848102167473E+18 | GH10: =FIB(RC[-101])+RC[-1]+R[-1]C+R[-1]C[-1] -> 2.86352009065789E+18 | GI10: =FIB(RC[-101])+RC[-1]+R[-1]C+R[-1]C[-1] -> 3.16424102946168E+18 | GJ10: =FIB(RC[-101])+RC[-1]+R[-1]C+R[-1]C[-1] -> 3.49271854636244E+18 | GK10: =FIB(RC[-101])+RC[-1]+R[-1]C+R[-1]C[-1] -> 3.85116941371629E+18 | GL10: =FIB(RC[-101])+RC[-1]+R[-1]C+R[-1]C[-1] -> 4.24196048522531E+18 | GM10: =FIB(RC[-101])+RC[-1]+R[-1]C+R[-1]C[-1] -> 4.6676170712223E+18 | GN10: =FIB(RC[-101])+RC[-1]+R[-1]C+R[-1]C[-1] -> 5.13083168383582E+18 | GO10: =FIB(RC[-101])+RC[-1]+R[-1]C+R[-1]C[-1] -> 5.63447316415624E+18 | GP10: =FIB(RC[-101])+RC[-1]+R[-1]C+R[-1]C[-1] -> 6.18159620378564E+18 | GQ10: =FIB(RC[-101])+RC[-1]+R[-1]C+R[-1]C[-1] -> 6.77545127341921E+18 | GR10: =FIB(RC[-101])+RC[-1]+R[-1]C+R[-1]C[-1] -> 7.41949497137332E+18 | GS10: =FIB(RC[-101])+RC[-1]+R[-1]C+R[-1]C[-1] -> 8.11740080524595E+18
A11: 20 | B11: 20 | C11: 20 | D11: 20 | E11: 20 | F11: 20 | G11: 20 | H11: 20 | I11: 20 | J11: 20 | K11: 20 | L11: 20 | M11: 20 | N11: 20 | O11: 20 | P11: 20 | Q11: 20 | R11: 20 | S11: 20 | T11: 20 | U11: 20 | V11: 20 | W11: 20 | X11: 20 | Y11: 20 | Z11: 20 | AA11: 20 | AB11: 20 | AC11: 20 | AD11: 20 | AE11: 20 | AF11: 20 | AG11: 20 | AH11: 20 | AI11: 20 | AJ11: 20 | AK11: 20 | AL11: 20 | AM11: 20 | AN11: 20 | AO11: 20 | AP11: 20 | AQ11: 20 | AR11: 20 | AS11: 20 | AT11: 20 | AU11: 20 | AV11: 20 | AW11: 20 | AX11: 20 | AY11: 20 | AZ11: 20 | BA11: 20 | BB11: 20 | BC11: 20 | BD11: 20 | BE11: 20 | BF11: 20 | BG11: 20 | BH11: 20 | BI11: 20 | BJ11: 20 | BK11: 20 | BL11: 20 | BM11: 20 | BN11: 20 | BO11: 20 | BP11: 20 | BQ11: 20 | BR11: 20 | BS11: 20 | BT11: 20 | BU11: 20 | BV11: 20 | BW11: 20 | BX11: 20 | BY11: 20 | BZ11: 20 | CA11: 20 | CB11: 20 | CC11: 20 | CD11: 20 | CE11: 20 | CF11: 20 | CG11: 20 | CH11: 20 | CI11: 20 | CJ11: 20 | CK11: 20 | CL11: 20 | CM11: 20 | CN11: 20 | CO11: 20 | CP11: 20 | CQ11: 20 | CR11: 20 | CS11: 20 | CT11: 20 | CU11: 20 | CV11: 20 | CW11: 0 | CX11: =FIB(RC[-101])+RC[-1]+R[-1]C+R[-1]C[-1] -> 109460 | CY11: =FIB(RC[-101])+RC[-1]+R[-1]C+R[-1]C[-1] -> 1204060 | CZ11: =FIB(RC[-101])+RC[-1]+R[-1]C+R[-1]C[-1] -> 8537880 | DA11: =FIB(RC[-101])+RC[-1]+R[-1]C+R[-1]C[-1] -> 45754280 | DB11: =FIB(RC[-101])+RC[-1]+R[-1]C+R[-1]C[-1] -> 199020172 | DC11: =FIB(RC[-101])+RC[-1]+R[-1]C+R[-1]C[-1] -> 734717412 | DD11: =FIB(RC[-101])+RC[-1]+R[-1]C+R[-1]C[-1] -> 2374756592 | DE11: =FIB(RC[-101])+RC[-1]+R[-1]C+R[-1]C[-1] -> 6876627472 | DF11: =FIB(RC[-101])+RC[-1]+R[-1]C+R[-1]C[-1] -> 18156371012 | DG11: =FIB(RC[-101])+RC[-1]+R[-1]C+R[-1]C[-1] -> 44317354796 | DH11: =FIB(RC[-101])+RC[-1]+R[-1]C+R[-1]C[-1] -> 101111660936 | DI11: =FIB(RC[-101])+RC[-1]+R[-1]C+R[-1]C[-1] -> 217569657656 | DJ11: =FIB(RC[-101])+RC[-1]+R[-1]C+R[-1]C[-1] -> 444792527036 | DK11: =FIB(RC[-101])+RC[-1]+R[-1]C+R[-1]C[-1] -> 869217766196 | DL11: =FIB(RC[-101])+RC[-1]+R[-1]C+R[-1]C[-1] -> 1632044571872 | DM11: =FIB(RC[-101])+RC[-1]+R[-1]C+R[-1]C[-1] -> 2956950163232 | DN11: =FIB(RC[-101])+RC[-1]+R[-1]C+R[-1]C[-1] -> 5188745099252 | DO11: =FIB(RC[-101])+RC[-1]+R[-1]C+R[-1]C[-1] -> 8846211109372 | DP11: =FIB(RC[-101])+RC[-1]+R[-1]C+R[-1]C[-1] -> 14693044483832 | DQ11: =FIB(RC[-101])+RC[-1]+R[-1]C+R[-1]C[-1] -> 23831597267400 | DR11: =FIB(RC[-101])+RC[-1]+R[-1]C+R[-1]C[-1] -> 37824972971500 | DS11: =FIB(RC[-101])+RC[-1]+R[-1]C+R[-1]C[-1] -> 58853998869380 | DT11: =FIB(RC[-101])+RC[-1]+R[-1]C+R[-1]C[-1] -> 89916668771280 | DU11: =FIB(RC[-101])+RC[-1]+R[-1]C+R[-1]C[-1] -> 135078834095920 | DV11: =FIB(RC[-101])+RC[-1]+R[-1]C+R[-1]C[-1] -> 199786222665380 | DW11: =FIB(RC[-101])+RC[-1]+R[-1]C+R[-1]C[-1] -> 291249289556940 | DX11: =FIB(RC[-101])+RC[-1]+R[-1]C+R[-1]C[-1] -> 418913958152040 | DY11: =FIB(RC[-101])+RC[-1]+R[-1]C+R[-1]C[-1] -> 595032997833560 | DZ11: =FIB(RC[-101])+RC[-1]+R[-1]C+R[-1]C[-1] -> 835354613202460 | EA11: =FIB(RC[-101])+RC[-1]+R[-1]C+R[-1]C[-1] -> 1.15994679381781E+15 | EB11: =FIB(RC[-101])+RC[-1]+R[-1]C+R[-1]C[-1] -> 1.59417809891475E+15 | EC11: =FIB(RC[-101])+RC[-1]+R[-1]C+R[-1]C[-1] -> 2.16987783392723E+15 | ED11: =FIB(RC[-101])+RC[-1]+R[-1]C+R[-1]C[-1] -> 2.92670102054101E+15 | EE11: =FIB(RC[-101])+RC[-1]+R[-1]C+R[-1]C[-1] -> 3.91372617503145E+15 | EF11: =FIB(RC[-101])+RC[-1]+R[-1]C+R[-1]C[-1] -> 5.1913166964047E+15 | EG11: =FIB(RC[-101])+RC[-1]+R[-1]C+R[-1]C[-1] -> 6.83327963196414E+15 | EH11: =FIB(RC[-101])+RC[-1]+R[-1]C+R[-1]C[-1] -> 8.92935873897096E+15 | EI11: =FIB(RC[-101])+RC[-1]+R[-1]C+R[-1]C[-1] -> 1.15881021026624E+16 | EJ11: =FIB(RC[-101])+RC[-1]+R[-1]C+R[-1]C[-1] -> 1.49401481086389E+16 | EK11: =FIB(RC[-101])+RC[-1]+R[-1]C+R[-1]C[-1] -> 1.9141977307134E+16 | EL11: =FIB(RC[-101])+RC[-1]+R[-1]C+R[-1]C[-1] -> 2.43801816535483E+16 | EM11: =FIB(RC[-101])+RC[-1]+R[-1]C+R[-1]C[-1] -> 3.08763067694552E+16 | EN11: =FIB(RC[-101])+RC[-1]+R[-1]C+R[-1]C[-1] -> 3.88923272466906E+16 | EO11: =FIB(RC[-101])+RC[-1]+R[-1]C+R[-1]C[-1] -> 4.87368196197088E+16 | EP11: =FIB(RC[-101])+RC[-1]+R[-1]C+R[-1]C[-1] -> 6.07719024637418E+16 | EQ11: =FIB(RC[-101])+RC[-1]+R[-1]C+R[-1]C[-1] -> 7.54210181440344E+16 | ER11: =FIB(RC[-101])+RC[-1]+R[-1]C+R[-1]C[-1] -> 9.3177636050148E+16 | ES11: =FIB(RC[-101])+RC[-1]+R[-1]C+R[-1]C[-1] -> 1.14614962704642E+17 | ET11: =FIB(RC[-101])+RC[-1]+R[-1]C+R[-1]C[-1] -> 1.40396749942953E+17 | EU11: =FIB(RC[-101])+RC[-1]+R[-1]C+R[-1]C[-1] -> 1.71289298426592E+17 | EV11: =FIB(RC[-101])+RC[-1]+R[-1]C+R[-1]C[-1] -> 2.08174760080514E+17 | EW11: =FIB(RC[-101])+RC[-1]+R[-1]C+R[-1]C[-1] -> 2.52065849643213E+17 | EX11: =FIB(RC[-101])+RC[-1]+R[-1]C+R[-1]C[-1] -> 3.04122082390459E+17 | EY11: =FIB(RC[-101])+RC[-1]+R[-1]C+R[-1]C[-1] -> 3.65667662246112E+17 | EZ11: =FIB(RC[-101])+RC[-1]+R[-1]C+R[-1]C[-1] -> 4.38211151931877E+17 | FA11: =FIB(RC[-101])+RC[-1]+R[-1]C+R[-1]C[-1] -> 5.23467064537601E+17 | FB11: =FIB(RC[-101])+RC[-1]+R[-1]C+R[-1]C[-1] -> 6.23379523920611E+17 | FC11: =FIB(RC[-101])+RC[-1]+R[-1]C+R[-1]C[-1] -> 7.40148149672004E+17 | FD11: =FIB(RC[-101])+RC[-1]+R[-1]C+R[-1]C[-1] -> 8.76256331025553E+17 | FE11: =FIB(RC[-101])+RC[-1]+R[-1]C+R[-1]C[-1] -> 1.03450206303642E+18 | FF11: =FIB(RC[-101])+RC[-1]+R[-1]C+R[-1]C[-1] -> 1.21803152762784E+18 | FG11: =FIB(RC[-101])+RC[-1]+R[-1]C+R[-1]C[-1] -> 1.4303756117001E+18 | FH11: =FIB(RC[-101])+RC[-1]+R[-1]C+R[-1]C[-1] -> 1.67548956442267E+18 | FI11: =FIB(RC[-101])+RC[-1]+R[-1]C+R[-1]C[-1] -> 1.95779600609347E+18 | FJ11: =FIB(RC[-101])+RC[-1]+R[-1]C+R[-1]C[-1] -> 2.28223151155406E+18 | FK11: =FIB(RC[-101])+RC[-1]+R[-1]C+R[-1]C[-1] -> 2.65429700210168E+18 | FL11: =FIB(RC[-101])+RC[-1]+R[-1]C+R[-1]C[-1] -> 3.08011219114482E+18 | FM11: =FIB(RC[-101])+RC[-1]+R[-1]C+R[-1]C[-1] -> 3.56647434051256E+18 | FN11: =FIB(RC[-101])+RC[-1]+R[-1]C+R[-1]C[-1] -> 4.12092159635669E+18 | FO11: =FIB(RC[-101])+RC[-1]+R[-1]C+R[-1]C[-1] -> 4.75180118598368E+18 | FP11: =FIB(RC[-101])+RC[-1]+R[-1]C+R[-1]C[-1] -> 5.46834276972713E+18 | FQ11: =FIB(RC[-101])+RC[-1]+R[-1]C+R[-1]C[-1] -> 6.28073725512654E+18 | FR11: =FIB(RC[-101])+RC[-1]+R[-1]C+R[-1]C[-1] -> 7.20022139421932E+18 | FS11: =FIB(RC[-101])+RC[-1]+R[-1]C+R[-1]C[-1] -> 8.23916849868707E+18 | FT11: =FIB(RC[-101])+RC[-1]+R[-1]C+R[-1]C[-1] -> 9.41118562192878E+18 | FU11: =FIB(RC[-101])+RC[-1]+R[-1]C+R[-1]C[-1] -> 1.07312175718689E+19 | FV11: =FIB(RC[-101])+RC[-1]+R[-1]C+R[-1]C[-1] -> 1.22156581334524E+19 | FW11: =FIB(RC[-101])+RC[-1]+R[-1]C+R[-1]C[-1] -> 1.38824688953385E+19 | FX11: =FIB(RC[-101])+RC[-1]+R[-1]C+R[-1]C[-1] -> 1.57513060912835E+19 | FY11: =FIB(RC[-101])+RC[-1]+R[-1]C+R[-1]C[-1] -> 1.78436558831087E+19 | FZ11: =FIB(RC[-101])+RC[-1]+R[-1]C+R[-1]C[-1] -> 2.01829785289872E+19 | GA11: =FIB(RC[-101])+RC[-1]+R[-1]C+R[-1]C[-1] -> 2.27948618980553E+19 | GB11: =FIB(RC[-101])+RC[-1]+R[-1]C+R[-1]C[-1] -> 2.57071848100736E+19 | GC11: =FIB(RC[-101])+RC[-1]+R[-1]C+R[-1]C[-1] -> 2.89502906970254E+19 | GD11: =FIB(RC[-101])+RC[-1]+R[-1]C+R[-1]C[-1] -> 3.25571721021614E+19 | GE11: =FIB(RC[-101])+RC[-1]+R[-1]C+R[-1]C[-1] -> 3.65636665510762E+19 | GF11: =FIB(RC[-101])+RC[-1]+R[-1]C+R[-1]C[-1] -> 4.1008664348948E+19 | GG11: =FIB(RC[-101])+RC[-1]+R[-1]C+R[-1]C[-1] -> 4.59343288780856E+19 | GH11: =FIB(RC[-101])+RC[-1]+R[-1]C+R[-1]C[-1] -> 5.13863299904183E+19 | GI11: =FIB(RC[-101])+RC[-1]+R[-1]C+R[-1]C[-1] -> 5.74140911105378E+19 | GJ11: =FIB(RC[-101])+RC[-1]+R[-1]C+R[-1]C[-1] -> 6.40710506863619E+19 | GK11: =FIB(RC[-101])+RC[-1]+R[-1]C+R[-1]C[-1] -> 7.14149386464407E+19 | GL11: =FIB(RC[-101])+RC[-1]+R[-1]C+R[-1]C[-1] -> 7.95080685453823E+19 | GM11: =FIB(RC[-101])+RC[-1]+R[-1]C+R[-1]C[-1] -> 8.84176461018299E+19 | GN11: =FIB(RC[-101])+RC[-1]+R[-1]C+R[-1]C[-1] -> 9.8216094856888E+19 | GO11: =FIB(RC[-101])+RC[-1]+R[-1]C+R[-1]C[-1] -> 1.0898139970488E+20 | GP11: =FIB(RC[-101])+RC[-1]+R[-1]C+R[-1]C[-1] -> 1.20797469072822E+20 | GQ11: =FIB(RC[-101])+RC[-1]+R[-1]C+R[-1]C[-1] -> 1.33754516550027E+20 | GR11: =FIB(RC[-101])+RC[-1]+R[-1]C+R[-1]C[-1] -> 1.47949462794819E+20 | GS11: =FIB(RC[-101])+RC[-1]+R[-1]C+R[-1]C[-1] -> 1.63486358571439E+20
A12: 20 | B12: 20 | C12: 20 | D12: 20 | E12: 20 | F12: 20 | G12: 20 | H12: 20 | I12: 20 | J12: 20 | K12: 20 | L12: 20 | M12: 20 | N12: 20 | O12: 20 | P12: 20 | Q12: 20 | R12: 20 | S12: 20 | T12: 20 | U12: 20 | V12: 20 | W12: 20 | X12: 20 | Y12: 20 | Z12: 20 | AA12: 20 | AB12: 20 | AC12: 20 | AD12: 20 | AE12: 20 | AF12: 20 | AG12: 20 | AH12: 20 | AI12: 20 | AJ12: 20 | AK12: 20 | AL12: 20 | AM12: 20 | AN12: 20 | AO12: 20 | AP12: 20 | AQ12: 20 | AR12: 20 | AS12: 20 | AT12: 20 | AU12: 20 | AV12: 20 | AW12: 20 | AX12: 20 | AY12: 20 | AZ12: 20 | BA12: 20 | BB12: 20 | BC12: 20 | BD12: 20 | BE12: 20 | BF12: 20 | BG12: 20 | BH12: 20 | BI12: 20 | BJ12: 20 | BK12: 20 | BL12: 20 | BM12: 20 | BN12: 20 | BO12: 20 | BP12: 20 | BQ12: 20 | BR12: 20 | BS12: 20 | BT12: 20 | BU12: 20 | BV12: 20 | BW12: 20 | BX12: 20 | BY12: 20 | BZ12: 20 | CA12: 20 | CB12: 20 | CC12: 20 | CD12: 20 | CE12: 20 | CF12: 20 | CG12: 20 | CH12: 20 | CI12: 20 | CJ12: 20 | CK12: 20 | CL12: 20 | CM12: 20 | CN12: 20 | CO12: 20 | CP12: 20 | CQ12: 20 | CR12: 20 | CS12: 20 | CT12: 20 | CU12: 20 | CV12: 20 | CW12: 0 | CX12: =FIB(RC[-101])+RC[-1]+R[-1]C+R[-1]C[-1] -> 120406 | CY12: =FIB(RC[-101])+RC[-1]+R[-1]C+R[-1]C[-1] -> 1444872 | CZ12: =FIB(RC[-101])+RC[-1]+R[-1]C+R[-1]C[-1] -> 11197758 | DA12: =FIB(RC[-101])+RC[-1]+R[-1]C+R[-1]C[-1] -> 65500864 | DB12: =FIB(RC[-101])+RC[-1]+R[-1]C+R[-1]C[-1] -> 310286262 | DC12: =FIB(RC[-101])+RC[-1]+R[-1]C+R[-1]C[-1] -> 1244034792 | DD12: =FIB(RC[-101])+RC[-1]+R[-1]C+R[-1]C[-1] -> 4353519742 | DE12: =FIB(RC[-101])+RC[-1]+R[-1]C+R[-1]C[-1] -> 13604914752 | DF12: =FIB(RC[-101])+RC[-1]+R[-1]C+R[-1]C[-1] -> 38637924182 | DG12: =FIB(RC[-101])+RC[-1]+R[-1]C+R[-1]C[-1] -> 101111660936 | DH12: =FIB(RC[-101])+RC[-1]+R[-1]C+R[-1]C[-1] -> 246540687614 | DI12: =FIB(RC[-101])+RC[-1]+R[-1]C+R[-1]C[-1] -> 565222017152 | DJ12: =FIB(RC[-101])+RC[-1]+R[-1]C+R[-1]C[-1] -> 1227584212790 | DK12: =FIB(RC[-101])+RC[-1]+R[-1]C+R[-1]C[-1] -> 2541594516968 | DL12: =FIB(RC[-101])+RC[-1]+R[-1]C+R[-1]C[-1] -> 5042856865982 | DM12: =FIB(RC[-101])+RC[-1]+R[-1]C+R[-1]C[-1] -> 9631851612032 | DN12: =FIB(RC[-101])+RC[-1]+R[-1]C+R[-1]C[-1] -> 17777546885462 | DO12: =FIB(RC[-101])+RC[-1]+R[-1]C+R[-1]C[-1] -> 31812503105032 | DP12: =FIB(RC[-101])+RC[-1]+R[-1]C+R[-1]C[-1] -> 55351758709182 | DQ12: =FIB(RC[-101])+RC[-1]+R[-1]C+R[-1]C[-1] -> 93876400471360 | DR12: =FIB(RC[-101])+RC[-1]+R[-1]C+R[-1]C[-1] -> 155532970721206 | DS12: =FIB(RC[-101])+RC[-1]+R[-1]C+R[-1]C[-1] -> 252211942573032 | DT12: =FIB(RC[-101])+RC[-1]+R[-1]C+R[-1]C[-1] -> 400982610224638 | DU12: =FIB(RC[-101])+RC[-1]+R[-1]C+R[-1]C[-1] -> 625978113102784 | DV12: =FIB(RC[-101])+RC[-1]+R[-1]C+R[-1]C[-1] -> 960843169875030 | DW12: =FIB(RC[-101])+RC[-1]+R[-1]C+R[-1]C[-1] -> 1.4518786821083E+15 | DX12: =FIB(RC[-101])+RC[-1]+R[-1]C+R[-1]C[-1] -> 2.16204192982822E+15 | DY12: =FIB(RC[-101])+RC[-1]+R[-1]C+R[-1]C[-1] -> 3.17598888582477E+15 | DZ12: =FIB(RC[-101])+RC[-1]+R[-1]C+R[-1]C[-1] -> 4.60637649687173E+15 | EA12: =FIB(RC[-101])+RC[-1]+R[-1]C+R[-1]C[-1] -> 6.60167790390295E+15 | EB12: =FIB(RC[-101])+RC[-1]+R[-1]C+R[-1]C[-1] -> 9.35580279664646E+15 | EC12: =FIB(RC[-101])+RC[-1]+R[-1]C+R[-1]C[-1] -> 1.31198587294994E+16 | ED12: =FIB(RC[-101])+RC[-1]+R[-1]C+R[-1]C[-1] -> 1.82164375839786E+16 | EE12: =FIB(RC[-101])+RC[-1]+R[-1]C+R[-1]C[-1] -> 2.5056864779562E+16 | EF12: =FIB(RC[-101])+RC[-1]+R[-1]C+R[-1]C[-1] -> 3.41619076510091E+16 | EG12: =FIB(RC[-101])+RC[-1]+R[-1]C+R[-1]C[-1] -> 4.61865039793889E+16 | EH12: =FIB(RC[-101])+RC[-1]+R[-1]C+R[-1]C[-1] -> 6.19491423503349E+16 | EI12: =FIB(RC[-101])+RC[-1]+R[-1]C+R[-1]C[-1] -> 8.24666031919792E+16 | EJ12: =FIB(RC[-101])+RC[-1]+R[-1]C+R[-1]C[-1] -> 1.08994853403292E+17 | EK12: =FIB(RC[-101])+RC[-1]+R[-1]C+R[-1]C[-1] -> 1.43076978819075E+17 | EL12: =FIB(RC[-101])+RC[-1]+R[-1]C+R[-1]C[-1] -> 1.86599137779769E+17 | EM12: =FIB(RC[-101])+RC[-1]+R[-1]C+R[-1]C[-1] -> 2.41855626202783E+17 | EN12: =FIB(RC[-101])+RC[-1]+R[-1]C+R[-1]C[-1] -> 3.1162426021894E+17 | EO12: =FIB(RC[-101])+RC[-1]+R[-1]C+R[-1]C[-1] -> 3.9925340708535E+17 | EP12: =FIB(RC[-101])+RC[-1]+R[-1]C+R[-1]C[-1] -> 5.08762129168812E+17 | EQ12: =FIB(RC[-101])+RC[-1]+R[-1]C+R[-1]C[-1] -> 6.44955049776599E+17 | ER12: =FIB(RC[-101])+RC[-1]+R[-1]C+R[-1]C[-1] -> 8.13553703970792E+17 | ES12: =FIB(RC[-101])+RC[-1]+R[-1]C+R[-1]C[-1] -> 1.02134630272559E+18 | ET12: =FIB(RC[-101])+RC[-1]+R[-1]C+R[-1]C[-1] -> 1.2763580153732E+18 | EU12: =FIB(RC[-101])+RC[-1]+R[-1]C+R[-1]C[-1] -> 1.58804406374276E+18 | EV12: =FIB(RC[-101])+RC[-1]+R[-1]C+R[-1]C[-1] -> 1.96750812224987E+18 | EW12: =FIB(RC[-101])+RC[-1]+R[-1]C+R[-1]C[-1] -> 2.42774873197361E+18 | EX12: =FIB(RC[-101])+RC[-1]+R[-1]C+R[-1]C[-1] -> 2.98393666400729E+18 | EY12: =FIB(RC[-101])+RC[-1]+R[-1]C+R[-1]C[-1] -> 3.65372640864387E+18 | EZ12: =FIB(RC[-101])+RC[-1]+R[-1]C+R[-1]C[-1] -> 4.45760522282187E+18 | FA12: =FIB(RC[-101])+RC[-1]+R[-1]C+R[-1]C[-1] -> 5.41928343929136E+18 | FB12: =FIB(RC[-101])+RC[-1]+R[-1]C+R[-1]C[-1] -> 6.56613002774959E+18 | FC12: =FIB(RC[-101])+RC[-1]+R[-1]C+R[-1]C[-1] -> 7.92965770134221E+18 | FD12: =FIB(RC[-101])+RC[-1]+R[-1]C+R[-1]C[-1] -> 9.54606218203978E+18 | FE12: =FIB(RC[-101])+RC[-1]+R[-1]C+R[-1]C[-1] -> 1.14568205761018E+19 | FF12: =FIB(RC[-101])+RC[-1]+R[-1]C+R[-1]C[-1] -> 1.3709354166766E+19 | FG12: =FIB(RC[-101])+RC[-1]+R[-1]C+R[-1]C[-1] -> 1.6357761306094E+19 | FH12: =FIB(RC[-101])+RC[-1]+R[-1]C+R[-1]C[-1] -> 1.94636264822167E+19 | FI12: =FIB(RC[-101])+RC[-1]+R[-1]C+R[-1]C[-1] -> 2.30969120527329E+19 | FJ12: =FIB(RC[-101])+RC[-1]+R[-1]C+R[-1]C[-1] -> 2.73369395703804E+19 | FK12: =FIB(RC[-101])+RC[-1]+R[-1]C+R[-1]C[-1] -> 3.22734680840362E+19 | FL12: =FIB(RC[-101])+RC[-1]+R[-1]C+R[-1]C[-1] -> 3.80078772772827E+19 | FM12: =FIB(RC[-101])+RC[-1]+R[-1]C+R[-1]C[-1] -> 4.46544638089401E+19 | FN12: =FIB(RC[-101])+RC[-1]+R[-1]C+R[-1]C[-1] -> 5.23418597458094E+19 | FO12: =FIB(RC[-101])+RC[-1]+R[-1]C+R[-1]C[-1] -> 6.12145825281498E+19 | FP12: =FIB(RC[-101])+RC[-1]+R[-1]C+R[-1]C[-1] -> 7.14347264838606E+19 | FQ12: =FIB(RC[-101])+RC[-1]+R[-1]C+R[-1]C[-1] -> 8.31838065087142E+19 | FR12: =FIB(RC[-101])+RC[-1]+R[-1]C+R[-1]C[-1] -> 9.66647651580601E+19 | FS12: =FIB(RC[-101])+RC[-1]+R[-1]C+R[-1]C[-1] -> 1.12104155050966E+20 | FT12: =FIB(RC[-101])+RC[-1]+R[-1]C+R[-1]C[-1] -> 1.29754509171582E+20 | FU12: =FIB(RC[-101])+RC[-1]+R[-1]C+R[-1]C[-1] -> 1.4989691236538E+20 | FV12: =FIB(RC[-101])+RC[-1]+R[-1]C+R[-1]C[-1] -> 1.72843788070701E+20 | FW12: =FIB(RC[-101])+RC[-1]+R[-1]C+R[-1]C[-1] -> 1.98941915099492E+20 | FX12: =FIB(RC[-101])+RC[-1]+R[-1]C+R[-1]C[-1] -> 2.28575690086114E+20 | FY12: =FIB(RC[-101])+RC[-1]+R[-1]C+R[-1]C[-1] -> 2.62170652060506E+20 | FZ12: =FIB(RC[-101])+RC[-1]+R[-1]C+R[-1]C[-1] -> 3.00197286472602E+20 | GA12: =FIB(RC[-101])+RC[-1]+R[-1]C+R[-1]C[-1] -> 3.43175126899645E+20 | GB12: =FIB(RC[-101])+RC[-1]+R[-1]C+R[-1]C[-1] -> 3.91677173607774E+20 | GC12: =FIB(RC[-101])+RC[-1]+R[-1]C+R[-1]C[-1] -> 4.46334649114873E+20 | GD12: =FIB(RC[-101])+RC[-1]+R[-1]C+R[-1]C[-1] -> 5.07842111914059E+20 | GE12: =FIB(RC[-101])+RC[-1]+R[-1]C+R[-1]C[-1] -> 5.76962950567297E+20 | GF12: =FIB(RC[-101])+RC[-1]+R[-1]C+R[-1]C[-1] -> 6.54535281467321E+20 | GG12: =FIB(RC[-101])+RC[-1]+R[-1]C+R[-1]C[-1] -> 7.41478274694355E+20 | GH12: =FIB(RC[-101])+RC[-1]+R[-1]C+R[-1]C[-1] -> 8.38798933562859E+20 | GI12: =FIB(RC[-101])+RC[-1]+R[-1]C+R[-1]C[-1] -> 9.47599354663815E+20 | GJ12: =FIB(RC[-101])+RC[-1]+R[-1]C+R[-1]C[-1] -> 1.06908449646071E+21 | GK12: =FIB(RC[-101])+RC[-1]+R[-1]C+R[-1]C[-1] -> 1.20457048579352E+21 | GL12: =FIB(RC[-101])+RC[-1]+R[-1]C+R[-1]C[-1] -> 1.35549349298534E+21 | GM12: =FIB(RC[-101])+RC[-1]+R[-1]C+R[-1]C[-1] -> 1.52341920763255E+21 | GN12: =FIB(RC[-101])+RC[-1]+R[-1]C+R[-1]C[-1] -> 1.71005294859127E+21 | GO12: =FIB(RC[-101])+RC[-1]+R[-1]C+R[-1]C[-1] -> 1.91725044315304E+21 | GP12: =FIB(RC[-101])+RC[-1]+R[-1]C+R[-1]C[-1] -> 2.14702931193074E+21 | GQ12: =FIB(RC[-101])+RC[-1]+R[-1]C+R[-1]C[-1] -> 2.40158129755359E+21 | GR12: =FIB(RC[-101])+RC[-1]+R[-1]C+R[-1]C[-1] -> 2.68328527689844E+21 | GS12: =FIB(RC[-101])+RC[-1]+R[-1]C+R[-1]C[-1] -> 2.99472109826469E+21
A13: 20 | B13: 20 | C13: 20 | D13: 20 | E13: 20 | F13: 20 | G13: 20 | H13: 20 | I13: 20 | J13: 20 | K13: 20 | L13: 20 | M13: 20 | N13: 20 | O13: 20 | P13: 20 | Q13: 20 | R13: 20 | S13: 20 | T13: 20 | U13: 20 | V13: 20 | W13: 20 | X13: 20 | Y13: 20 | Z13: 20 | AA13: 20 | AB13: 20 | AC13: 20 | AD13: 20 | AE13: 20 | AF13: 20 | AG13: 20 | AH13: 20 | AI13: 20 | AJ13: 20 | AK13: 20 | AL13: 20 | AM13: 20 | AN13: 20 | AO13: 20 | AP13: 20 | AQ13: 20 | AR13: 20 | AS13: 20 | AT13: 20 | AU13: 20 | AV13: 20 | AW13: 20 | AX13: 20 | AY13: 20 | AZ13: 20 | BA13: 20 | BB13: 20 | BC13: 20 | BD13: 20 | BE13: 20 | BF13: 20 | BG13: 20 | BH13: 20 | BI13: 20 | BJ13: 20 | BK13: 20 | BL13: 20 | BM13: 20 | BN13: 20 | BO13: 20 | BP13: 20 | BQ13: 20 | BR13: 20 | BS13: 20 | BT13: 20 | BU13: 20 | BV13: 20 | BW13: 20 | BX13: 20 | BY13: 20 | BZ13: 20 | CA13: 20 | CB13: 20 | CC13: 20 | CD13: 20 | CE13: 20 | CF13: 20 | CG13: 20 | CH13: 20 | CI13: 20 | CJ13: 20 | CK13: 20 | CL13: 20 | CM13: 20 | CN13: 20 | CO13: 20 | CP13: 20 | CQ13: 20 | CR13: 20 | CS13: 20 | CT13: 20 | CU13: 20 | CV13: 20 | CW13: 0 | CX13: =FIB(RC[-101])+RC[-1]+R[-1]C+R[-1]C[-1] -> 131352 | CY13: =FIB(RC[-101])+RC[-1]+R[-1]C+R[-1]C[-1] -> 1707576 | CZ13: =FIB(RC[-101])+RC[-1]+R[-1]C+R[-1]C[-1] -> 14361152 | DA13: =FIB(RC[-101])+RC[-1]+R[-1]C+R[-1]C[-1] -> 91070720 | DB13: =FIB(RC[-101])+RC[-1]+R[-1]C+R[-1]C[-1] -> 466868792 | DC13: =FIB(RC[-101])+RC[-1]+R[-1]C+R[-1]C[-1] -> 2021200792 | DD13: =FIB(RC[-101])+RC[-1]+R[-1]C+R[-1]C[-1] -> 7618766272 | DE13: =FIB(RC[-101])+RC[-1]+R[-1]C+R[-1]C[-1] -> 25577211712 | DF13: =FIB(RC[-101])+RC[-1]+R[-1]C+R[-1]C[-1] -> 77820061592 | DG13: =FIB(RC[-101])+RC[-1]+R[-1]C+R[-1]C[-1] -> 217569657656 | DH13: =FIB(RC[-101])+RC[-1]+R[-1]C+R[-1]C[-1] -> 565222017152 | DI13: =FIB(RC[-101])+RC[-1]+R[-1]C+R[-1]C[-1] -> 1376984732864 | DJ13: =FIB(RC[-101])+RC[-1]+R[-1]C+R[-1]C[-1] -> 3169790973752 | DK13: =FIB(RC[-101])+RC[-1]+R[-1]C+R[-1]C[-1] -> 6938969714456 | DL13: =FIB(RC[-101])+RC[-1]+R[-1]C+R[-1]C[-1] -> 14523421108352 | DM13: =FIB(RC[-101])+RC[-1]+R[-1]C+R[-1]C[-1] -> 29198129597312 | DN13: =FIB(RC[-101])+RC[-1]+R[-1]C+R[-1]C[-1] -> 56607528105752 | DO13: =FIB(RC[-101])+RC[-1]+R[-1]C+R[-1]C[-1] -> 106197578107192 | DP13: =FIB(RC[-101])+RC[-1]+R[-1]C+R[-1]C[-1] -> 193361839932352 | DQ13: =FIB(RC[-101])+RC[-1]+R[-1]C+R[-1]C[-1] -> 342589999123840 | DR13: =FIB(RC[-101])+RC[-1]+R[-1]C+R[-1]C[-1] -> 591999370327352 | DS13: =FIB(RC[-101])+RC[-1]+R[-1]C+R[-1]C[-1] -> 999744283632536 | DT13: =FIB(RC[-101])+RC[-1]+R[-1]C+R[-1]C[-1] -> 1.65293883644115E+15 | DU13: =FIB(RC[-101])+RC[-1]+R[-1]C+R[-1]C[-1] -> 2.67989955977952E+15 | DV13: =FIB(RC[-101])+RC[-1]+R[-1]C+R[-1]C[-1] -> 4.26672084276828E+15 | DW13: =FIB(RC[-101])+RC[-1]+R[-1]C+R[-1]C[-1] -> 6.67944269476255E+15 | DX13: =FIB(RC[-101])+RC[-1]+R[-1]C+R[-1]C[-1] -> 1.029336330671E+16 | DY13: =FIB(RC[-101])+RC[-1]+R[-1]C+R[-1]C[-1] -> 1.5631394122374E+16 | DZ13: =FIB(RC[-101])+RC[-1]+R[-1]C+R[-1]C[-1] -> 2.34137595050814E+16 | EA13: =FIB(RC[-101])+RC[-1]+R[-1]C+R[-1]C[-1] -> 3.4621813905867E+16 | EB13: =FIB(RC[-101])+RC[-1]+R[-1]C+R[-1]C[-1] -> 5.05792946064274E+16 | EC13: =FIB(RC[-101])+RC[-1]+R[-1]C+R[-1]C[-1] -> 7.30549561325842E+16 | ED13: =FIB(RC[-101])+RC[-1]+R[-1]C+R[-1]C[-1] -> 1.04391252446073E+17 | EE13: =FIB(RC[-101])+RC[-1]+R[-1]C+R[-1]C[-1] -> 1.47664554809625E+17 | EF13: =FIB(RC[-101])+RC[-1]+R[-1]C+R[-1]C[-1] -> 2.06883327240207E+17 | EG13: =FIB(RC[-101])+RC[-1]+R[-1]C+R[-1]C[-1] -> 2.87231738870616E+17 | EH13: =FIB(RC[-101])+RC[-1]+R[-1]C+R[-1]C[-1] -> 3.9536738520035E+17 | EI13: =FIB(RC[-101])+RC[-1]+R[-1]C+R[-1]C[-1] -> 5.39783130742675E+17 | EJ13: =FIB(RC[-101])+RC[-1]+R[-1]C+R[-1]C[-1] -> 7.31244587337957E+17 | EK13: =FIB(RC[-101])+RC[-1]+R[-1]C+R[-1]C[-1] -> 9.83316419560335E+17 | EL13: =FIB(RC[-101])+RC[-1]+R[-1]C+R[-1]C[-1] -> 1.31299253615919E+18 | EM13: =FIB(RC[-101])+RC[-1]+R[-1]C+R[-1]C[-1] -> 1.74144730014175E+18 | EN13: =FIB(RC[-101])+RC[-1]+R[-1]C+R[-1]C[-1] -> 2.29492718656349E+18 | EO13: =FIB(RC[-101])+RC[-1]+R[-1]C+R[-1]C[-1] -> 3.00580485386779E+18 | EP13: =FIB(RC[-101])+RC[-1]+R[-1]C+R[-1]C[-1] -> 3.91382039012196E+18 | EQ13: =FIB(RC[-101])+RC[-1]+R[-1]C+R[-1]C[-1] -> 5.06753756906738E+18 | ER13: =FIB(RC[-101])+RC[-1]+R[-1]C+R[-1]C[-1] -> 6.52604632281479E+18 | ES13: =FIB(RC[-101])+RC[-1]+R[-1]C+R[-1]C[-1] -> 8.36094632951118E+18 | ET13: =FIB(RC[-101])+RC[-1]+R[-1]C+R[-1]C[-1] -> 1.065865064761E+19 | EU13: =FIB(RC[-101])+RC[-1]+R[-1]C+R[-1]C[-1] -> 1.3523052726726E+19 | EV13: =FIB(RC[-101])+RC[-1]+R[-1]C+R[-1]C[-1] -> 1.70786049127186E+19 | EW13: =FIB(RC[-101])+RC[-1]+R[-1]C+R[-1]C[-1] -> 2.14738617669421E+19 | EX13: =FIB(RC[-101])+RC[-1]+R[-1]C+R[-1]C[-1] -> 2.6885547162923E+19 | EY13: =FIB(RC[-101])+RC[-1]+R[-1]C+R[-1]C[-1] -> 3.35232102355742E+19 | EZ13: =FIB(RC[-101])+RC[-1]+R[-1]C+R[-1]C[-1] -> 4.16345418670399E+19 | FA13: =FIB(RC[-101])+RC[-1]+R[-1]C+R[-1]C[-1] -> 5.15114305291532E+19 | FB13: =FIB(RC[-101])+RC[-1]+R[-1]C+R[-1]C[-1] -> 6.34968439961941E+19 | FC13: =FIB(RC[-101])+RC[-1]+R[-1]C+R[-1]C[-1] -> 7.79926317252859E+19 | FD13: =FIB(RC[-101])+RC[-1]+R[-1]C+R[-1]C[-1] -> 9.5468351608668E+19 | FE13: =FIB(RC[-101])+RC[-1]+R[-1]C+R[-1]C[-1] -> 1.1647123436681E+20 | FF13: =FIB(RC[-101])+RC[-1]+R[-1]C+R[-1]C[-1] -> 1.41637409109677E+20 | FG13: =FIB(RC[-101])+RC[-1]+R[-1]C+R[-1]C[-1] -> 1.71704524582537E+20 | FH13: =FIB(RC[-101])+RC[-1]+R[-1]C+R[-1]C[-1] -> 2.07525912370848E+20 | FI13: =FIB(RC[-101])+RC[-1]+R[-1]C+R[-1]C[-1] -> 2.50086450905798E+20 | FJ13: =FIB(RC[-101])+RC[-1]+R[-1]C+R[-1]C[-1] -> 3.00520302528911E+20 | FK13: =FIB(RC[-101])+RC[-1]+R[-1]C+R[-1]C[-1] -> 3.60130710183328E+20 | FL13: =FIB(RC[-101])+RC[-1]+R[-1]C+R[-1]C[-1] -> 4.30412055544646E+20 | FM13: =FIB(RC[-101])+RC[-1]+R[-1]C+R[-1]C[-1] -> 5.13074396630869E+20 | FN13: =FIB(RC[-101])+RC[-1]+R[-1]C+R[-1]C[-1] -> 6.10070720185619E+20 | FO13: =FIB(RC[-101])+RC[-1]+R[-1]C+R[-1]C[-1] -> 7.23627162459578E+20 | FP13: =FIB(RC[-101])+RC[-1]+R[-1]C+R[-1]C[-1] -> 8.56276471471588E+20 | FQ13: =FIB(RC[-101])+RC[-1]+R[-1]C+R[-1]C[-1] -> 1.01089500446416E+21 | FR13: =FIB(RC[-101])+RC[-1]+R[-1]C+R[-1]C[-1] -> 1.19074357613094E+21 | FS13: =FIB(RC[-101])+RC[-1]+R[-1]C+R[-1]C[-1] -> 1.39951249633996E+21 | FT13: =FIB(RC[-101])+RC[-1]+R[-1]C+R[-1]C[-1] -> 1.64137116056251E+21 | FU13: =FIB(RC[-101])+RC[-1]+R[-1]C+R[-1]C[-1] -> 1.92102258209947E+21 | FV13: =FIB(RC[-101])+RC[-1]+R[-1]C+R[-1]C[-1] -> 2.24376328253556E+21 | FW13: =FIB(RC[-101])+RC[-1]+R[-1]C+R[-1]C[-1] -> 2.61554898570575E+21 | FX13: =FIB(RC[-101])+RC[-1]+R[-1]C+R[-1]C[-1] -> 3.04306659089136E+21 | FY13: =FIB(RC[-101])+RC[-1]+R[-1]C+R[-1]C[-1] -> 3.53381293303798E+21 | FZ13: =FIB(RC[-101])+RC[-1]+R[-1]C+R[-1]C[-1] -> 4.09618087157108E+21 | GA13: =FIB(RC[-101])+RC[-1]+R[-1]C+R[-1]C[-1] -> 4.73955328494333E+21 | GB13: =FIB(RC[-101])+RC[-1]+R[-1]C+R[-1]C[-1] -> 5.47440558545075E+21 | GC13: =FIB(RC[-101])+RC[-1]+R[-1]C+R[-1]C[-1] -> 6.3124174081734E+21 | GD13: =FIB(RC[-101])+RC[-1]+R[-1]C+R[-1]C[-1] -> 7.26659416920233E+21 | GE13: =FIB(RC[-101])+RC[-1]+R[-1]C+R[-1]C[-1] -> 8.35139923168368E+21 | GF13: =FIB(RC[-101])+RC[-1]+R[-1]C+R[-1]C[-1] -> 9.5828974637183E+21 | GG13: =FIB(RC[-101])+RC[-1]+R[-1]C+R[-1]C[-1] -> 1.097891101988E+22 | GH13: =FIB(RC[-101])+RC[-1]+R[-1]C+R[-1]C[-1] -> 1.25591882281372E+22 | GI13: =FIB(RC[-101])+RC[-1]+R[-1]C+R[-1]C[-1] -> 1.43455865163639E+22 | GJ13: =FIB(RC[-101])+RC[-1]+R[-1]C+R[-1]C[-1] -> 1.63622703674884E+22 | GK13: =FIB(RC[-101])+RC[-1]+R[-1]C+R[-1]C[-1] -> 1.86359253497426E+22 | GL13: =FIB(RC[-101])+RC[-1]+R[-1]C+R[-1]C[-1] -> 2.11959893285215E+22 | GM13: =FIB(RC[-101])+RC[-1]+R[-1]C+R[-1]C[-1] -> 2.40749020291394E+22 | GN13: =FIB(RC[-101])+RC[-1]+R[-1]C+R[-1]C[-1] -> 2.73083741853632E+22 | GO13: =FIB(RC[-101])+RC[-1]+R[-1]C+R[-1]C[-1] -> 3.09356775771075E+22 | GP13: =FIB(RC[-101])+RC[-1]+R[-1]C+R[-1]C[-1] -> 3.49999573321913E+22 | GQ13: =FIB(RC[-101])+RC[-1]+R[-1]C+R[-1]C[-1] -> 3.95485679416756E+22 | GR13: =FIB(RC[-101])+RC[-1]+R[-1]C+R[-1]C[-1] -> 4.46334345161276E+22 | GS13: =FIB(RC[-101])+RC[-1]+R[-1]C+R[-1]C[-1] -> 5.03114408912908E+22
A14: 20 | B14: 20 | C14: 20 | D14: 20 | E14: 20 | F14: 20 | G14: 20 | H14: 20 | I14: 20 | J14: 20 | K14: 20 | L14: 20 | M14: 20 | N14: 20 | O14: 20 | P14: 20 | Q14: 20 | R14: 20 | S14: 20 | T14: 20 | U14: 20 | V14: 20 | W14: 20 | X14: 20 | Y14: 20 | Z14: 20 | AA14: 20 | AB14: 20 | AC14: 20 | AD14: 20 | AE14: 20 | AF14: 20 | AG14: 20 | AH14: 20 | AI14: 20 | AJ14: 20 | AK14: 20 | AL14: 20 | AM14: 20 | AN14: 20 | AO14: 20 | AP14: 20 | AQ14: 20 | AR14: 20 | AS14: 20 | AT14: 20 | AU14: 20 | AV14: 20 | AW14: 20 | AX14: 20 | AY14: 20 | AZ14: 20 | BA14: 20 | BB14: 20 | BC14: 20 | BD14: 20 | BE14: 20 | BF14: 20 | BG14: 20 | BH14: 20 | BI14: 20 | BJ14: 20 | BK14: 20 | BL14: 20 | BM14: 20 | BN14: 20 | BO14: 20 | BP14: 20 | BQ14: 20 | BR14: 20 | BS14: 20 | BT14: 20 | BU14: 20 | BV14: 20 | BW14: 20 | BX14: 20 | BY14: 20 | BZ14: 20 | CA14: 20 | CB14: 20 | CC14: 20 | CD14: 20 | CE14: 20 | CF14: 20 | CG14: 20 | CH14: 20 | CI14: 20 | CJ14: 20 | CK14: 20 | CL14: 20 | CM14: 20 | CN14: 20 | CO14: 20 | CP14: 20 | CQ14: 20 | CR14: 20 | CS14: 20 | CT14: 20 | CU14: 20 | CV14: 20 | CW14: 0 | CX14: =FIB(RC[-101])+RC[-1]+R[-1]C+R[-1]C[-1] -> 142298 | CY14: =FIB(RC[-101])+RC[-1]+R[-1]C+R[-1]C[-1] -> 1992172 | CZ14: =FIB(RC[-101])+RC[-1]+R[-1]C+R[-1]C[-1] -> 18071846 | DA14: =FIB(RC[-101])+RC[-1]+R[-1]C+R[-1]C[-1] -> 123514664 | DB14: =FIB(RC[-101])+RC[-1]+R[-1]C+R[-1]C[-1] -> 681465122 | DC14: =FIB(RC[-101])+RC[-1]+R[-1]C+R[-1]C[-1] -> 3169545652 | DD14: =FIB(RC[-101])+RC[-1]+R[-1]C+R[-1]C[-1] -> 12809523662 | DE14: =FIB(RC[-101])+RC[-1]+R[-1]C+R[-1]C[-1] -> 46005512592 | DF14: =FIB(RC[-101])+RC[-1]+R[-1]C+R[-1]C[-1] -> 149402796842 | DG14: =FIB(RC[-101])+RC[-1]+R[-1]C+R[-1]C[-1] -> 444792527036 | DH14: =FIB(RC[-101])+RC[-1]+R[-1]C+R[-1]C[-1] -> 1227584212790 | DI14: =FIB(RC[-101])+RC[-1]+R[-1]C+R[-1]C[-1] -> 3169790973752 | DJ14: =FIB(RC[-101])+RC[-1]+R[-1]C+R[-1]C[-1] -> 7716566691314 | DK14: =FIB(RC[-101])+RC[-1]+R[-1]C+R[-1]C[-1] -> 17825327390468 | DL14: =FIB(RC[-101])+RC[-1]+R[-1]C+R[-1]C[-1] -> 39287718224222 | DM14: =FIB(RC[-101])+RC[-1]+R[-1]C+R[-1]C[-1] -> 83009268940832 | DN14: =FIB(RC[-101])+RC[-1]+R[-1]C+R[-1]C[-1] -> 168814926654842 | DO14: =FIB(RC[-101])+RC[-1]+R[-1]C+R[-1]C[-1] -> 331620032878732 | DP14: =FIB(RC[-101])+RC[-1]+R[-1]C+R[-1]C[-1] -> 631179450929222 | DQ14: =FIB(RC[-101])+RC[-1]+R[-1]C+R[-1]C[-1] -> 1.16713128999636E+15 | DR14: =FIB(RC[-101])+RC[-1]+R[-1]C+R[-1]C[-1] -> 2.1017206594585E+15 | DS14: =FIB(RC[-101])+RC[-1]+R[-1]C+R[-1]C[-1] -> 3.69346431342933E+15 | DT14: =FIB(RC[-101])+RC[-1]+R[-1]C+R[-1]C[-1] -> 6.34614743351397E+15 | DU14: =FIB(RC[-101])+RC[-1]+R[-1]C+R[-1]C[-1] -> 1.06789858297456E+16 | DV14: =FIB(RC[-101])+RC[-1]+R[-1]C+R[-1]C[-1] -> 1.76256062323043E+16 | DW14: =FIB(RC[-101])+RC[-1]+R[-1]C+R[-1]C[-1] -> 2.85717697698461E+16 | DX14: =FIB(RC[-101])+RC[-1]+R[-1]C+R[-1]C[-1] -> 4.55445757713296E+16 | DY14: =FIB(RC[-101])+RC[-1]+R[-1]C+R[-1]C[-1] -> 7.14693332004245E+16 | DZ14: =FIB(RC[-101])+RC[-1]+R[-1]C+R[-1]C[-1] -> 1.10514486827891E+17 | EA14: =FIB(RC[-101])+RC[-1]+R[-1]C+R[-1]C[-1] -> 1.6855006023885E+17 | EB14: =FIB(RC[-101])+RC[-1]+R[-1]C+R[-1]C[-1] -> 2.53751168751156E+17 | EC14: =FIB(RC[-101])+RC[-1]+R[-1]C+R[-1]C[-1] -> 3.77385419490178E+17 | ED14: =FIB(RC[-101])+RC[-1]+R[-1]C+R[-1]C[-1] -> 5.54831628068846E+17 | EE14: =FIB(RC[-101])+RC[-1]+R[-1]C+R[-1]C[-1] -> 8.06887435324555E+17 | EF14: =FIB(RC[-101])+RC[-1]+R[-1]C+R[-1]C[-1] -> 1.1614353173744E+18 | EG14: =FIB(RC[-101])+RC[-1]+R[-1]C+R[-1]C[-1] -> 1.65555038348523E+18 | EH14: =FIB(RC[-101])+RC[-1]+R[-1]C+R[-1]C[-1] -> 2.33814950755621E+18 | EI14: =FIB(RC[-101])+RC[-1]+R[-1]C+R[-1]C[-1] -> 3.27330002349924E+18 | EJ14: =FIB(RC[-101])+RC[-1]+R[-1]C+R[-1]C[-1] -> 4.54432774157989E+18 | EK14: =FIB(RC[-101])+RC[-1]+R[-1]C+R[-1]C[-1] -> 6.25888874847819E+18 | EL14: =FIB(RC[-101])+RC[-1]+R[-1]C+R[-1]C[-1] -> 8.55519770419773E+18 | EM14: =FIB(RC[-101])+RC[-1]+R[-1]C+R[-1]C[-1] -> 1.16096375404987E+19 | EN14: =FIB(RC[-101])+RC[-1]+R[-1]C+R[-1]C[-1] -> 1.56460120272039E+19 | EO14: =FIB(RC[-101])+RC[-1]+R[-1]C+R[-1]C[-1] -> 2.09467440676352E+19 | EP14: =FIB(RC[-101])+RC[-1]+R[-1]C+R[-1]C[-1] -> 2.7866369311625E+19 | EQ14: =FIB(RC[-101])+RC[-1]+R[-1]C+R[-1]C[-1] -> 3.68477272708143E+19 | ER14: =FIB(RC[-101])+RC[-1]+R[-1]C+R[-1]C[-1] -> 4.84413111626965E+19 | ES14: =FIB(RC[-101])+RC[-1]+R[-1]C+R[-1]C[-1] -> 6.33283038150225E+19 | ET14: =FIB(RC[-101])+RC[-1]+R[-1]C+R[-1]C[-1] -> 8.23479007921437E+19 | EU14: =FIB(RC[-101])+RC[-1]+R[-1]C+R[-1]C[-1] -> 1.0652960416648E+20 | EV14: =FIB(RC[-101])+RC[-1]+R[-1]C+R[-1]C[-1] -> 1.37131261805924E+20 | EW14: =FIB(RC[-101])+RC[-1]+R[-1]C+R[-1]C[-1] -> 1.75683728485585E+20 | EX14: =FIB(RC[-101])+RC[-1]+R[-1]C+R[-1]C[-1] -> 2.2404313741545E+20 | EY14: =FIB(RC[-101])+RC[-1]+R[-1]C+R[-1]C[-1] -> 2.84451894813947E+20 | EZ14: =FIB(RC[-101])+RC[-1]+R[-1]C+R[-1]C[-1] -> 3.59609646916561E+20 | FA14: =FIB(RC[-101])+RC[-1]+R[-1]C+R[-1]C[-1] -> 4.52755619312754E+20 | FB14: =FIB(RC[-101])+RC[-1]+R[-1]C+R[-1]C[-1] -> 5.67763893838102E+20 | FC14: =FIB(RC[-101])+RC[-1]+R[-1]C+R[-1]C[-1] -> 7.09253369559582E+20 | FD14: =FIB(RC[-101])+RC[-1]+R[-1]C+R[-1]C[-1] -> 8.82714352893536E+20 | FE14: =FIB(RC[-101])+RC[-1]+R[-1]C+R[-1]C[-1] -> 1.09465393886901E+21 | FF14: =FIB(RC[-101])+RC[-1]+R[-1]C+R[-1]C[-1] -> 1.3527625823455E+21 | FG14: =FIB(RC[-101])+RC[-1]+R[-1]C+R[-1]C[-1] -> 1.66610451603772E+21 | FH14: =FIB(RC[-101])+RC[-1]+R[-1]C+R[-1]C[-1] -> 2.0453349529911E+21 | FI14: =FIB(RC[-101])+RC[-1]+R[-1]C+R[-1]C[-1] -> 2.50294731626775E+21 | FJ14: =FIB(RC[-101])+RC[-1]+R[-1]C+R[-1]C[-1] -> 3.05355406970246E+21 | FK14: =FIB(RC[-101])+RC[-1]+R[-1]C+R[-1]C[-1] -> 3.71420508241469E+21 | FL14: =FIB(RC[-101])+RC[-1]+R[-1]C+R[-1]C[-1] -> 4.50474784814267E+21 | FM14: =FIB(RC[-101])+RC[-1]+R[-1]C+R[-1]C[-1] -> 5.44823430031818E+21 | FN14: =FIB(RC[-101])+RC[-1]+R[-1]C+R[-1]C[-1] -> 6.57137941713467E+21 | FO14: =FIB(RC[-101])+RC[-1]+R[-1]C+R[-1]C[-1] -> 7.90507729977987E+21 | FP14: =FIB(RC[-101])+RC[-1]+R[-1]C+R[-1]C[-1] -> 9.48498093371103E+21 | FQ14: =FIB(RC[-101])+RC[-1]+R[-1]C+R[-1]C[-1] -> 1.13521524096468E+22 | FR14: =FIB(RC[-101])+RC[-1]+R[-1]C+R[-1]C[-1] -> 1.35537909902419E+22 | FS14: =FIB(RC[-101])+RC[-1]+R[-1]C+R[-1]C[-1] -> 1.61440470627128E+22 | FT14: =FIB(RC[-101])+RC[-1]+R[-1]C+R[-1]C[-1] -> 1.91849307196153E+22 | FU14: =FIB(RC[-101])+RC[-1]+R[-1]C+R[-1]C[-1] -> 2.27473244622772E+22 | FV14: =FIB(RC[-101])+RC[-1]+R[-1]C+R[-1]C[-1] -> 2.69121103269123E+22 | FW14: =FIB(RC[-101])+RC[-1]+R[-1]C+R[-1]C[-1] -> 3.17714225951536E+22 | FX14: =FIB(RC[-101])+RC[-1]+R[-1]C+R[-1]C[-1] -> 3.74300381717507E+22 | FY14: =FIB(RC[-101])+RC[-1]+R[-1]C+R[-1]C[-1] -> 4.400691769568E+22 | FZ14: =FIB(RC[-101])+RC[-1]+R[-1]C+R[-1]C[-1] -> 5.16369115002891E+22 | GA14: =FIB(RC[-101])+RC[-1]+R[-1]C+R[-1]C[-1] -> 6.04726456568035E+22 | GB14: =FIB(RC[-101])+RC[-1]+R[-1]C+R[-1]C[-1] -> 7.06866045271976E+22 | GC14: =FIB(RC[-101])+RC[-1]+R[-1]C+R[-1]C[-1] -> 8.24734275208217E+22 | GD14: =FIB(RC[-101])+RC[-1]+R[-1]C+R[-1]C[-1] -> 9.60524390981975E+22 | GE14: =FIB(RC[-101])+RC[-1]+R[-1]C+R[-1]C[-1] -> 1.11670432499083E+23 | GF14: =FIB(RC[-101])+RC[-1]+R[-1]C+R[-1]C[-1] -> 1.29604729194485E+23 | GG14: =FIB(RC[-101])+RC[-1]+R[-1]C+R[-1]C[-1] -> 1.50166537678084E+23 | GH14: =FIB(RC[-101])+RC[-1]+R[-1]C+R[-1]C[-1] -> 1.73704636926101E+23 | GI14: =FIB(RC[-101])+RC[-1]+R[-1]C+R[-1]C[-1] -> 2.00609411670602E+23 | GJ14: =FIB(RC[-101])+RC[-1]+R[-1]C+R[-1]C[-1] -> 2.31317268554454E+23 | GK14: =FIB(RC[-101])+RC[-1]+R[-1]C+R[-1]C[-1] -> 2.66315464271685E+23 | GL14: =FIB(RC[-101])+RC[-1]+R[-1]C+R[-1]C[-1] -> 3.06147378949949E+23 | GM14: =FIB(RC[-101])+RC[-1]+R[-1]C+R[-1]C[-1] -> 3.5141827030761E+23 | GN14: =FIB(RC[-101])+RC[-1]+R[-1]C+R[-1]C[-1] -> 4.02801546522113E+23 | GO14: =FIB(RC[-101])+RC[-1]+R[-1]C+R[-1]C[-1] -> 4.61045598284583E+23 | GP14: =FIB(RC[-101])+RC[-1]+R[-1]C+R[-1]C[-1] -> 5.26981233193882E+23 | GQ14: =FIB(RC[-101])+RC[-1]+R[-1]C+R[-1]C[-1] -> 6.01529758467749E+23 | GR14: =FIB(RC[-101])+RC[-1]+R[-1]C+R[-1]C[-1] -> 6.85711760925552E+23 | GS14: =FIB(RC[-101])+RC[-1]+R[-1]C+R[-1]C[-1] -> 7.80656636332971E+23
A15: 20 | B15: 20 | C15: 20 | D15: 20 | E15: 20 | F15: 20 | G15: 20 | H15: 20 | I15: 20 | J15: 20 | K15: 20 | L15: 20 | M15: 20 | N15: 20 | O15: 20 | P15: 20 | Q15: 20 | R15: 20 | S15: 20 | T15: 20 | U15: 20 | V15: 20 | W15: 20 | X15: 20 | Y15: 20 | Z15: 20 | AA15: 20 | AB15: 20 | AC15: 20 | AD15: 20 | AE15: 20 | AF15: 20 | AG15: 20 | AH15: 20 | AI15: 20 | AJ15: 20 | AK15: 20 | AL15: 20 | AM15: 20 | AN15: 20 | AO15: 20 | AP15: 20 | AQ15: 20 | AR15: 20 | AS15: 20 | AT15: 20 | AU15: 20 | AV15: 20 | AW15: 20 | AX15: 20 | AY15: 20 | AZ15: 20 | BA15: 20 | BB15: 20 | BC15: 20 | BD15: 20 | BE15: 20 | BF15: 20 | BG15: 20 | BH15: 20 | BI15: 20 | BJ15: 20 | BK15: 20 | BL15: 20 | BM15: 20 | BN15: 20 | BO15: 20 | BP15: 20 | BQ15: 20 | BR15: 20 | BS15: 20 | BT15: 20 | BU15: 20 | BV15: 20 | BW15: 20 | BX15: 20 | BY15: 20 | BZ15: 20 | CA15: 20 | CB15: 20 | CC15: 20 | CD15: 20 | CE15: 20 | CF15: 20 | CG15: 20 | CH15: 20 | CI15: 20 | CJ15: 20 | CK15: 20 | CL15: 20 | CM15: 20 | CN15: 20 | CO15: 20 | CP15: 20 | CQ15: 20 | CR15: 20 | CS15: 20 | CT15: 20 | CU15: 20 | CV15: 20 | CW15: 0 | CX15: =FIB(RC[-101])+RC[-1]+R[-1]C+R[-1]C[-1] -> 153244 | CY15: =FIB(RC[-101])+RC[-1]+R[-1]C+R[-1]C[-1] -> 2298660 | CZ15: =FIB(RC[-101])+RC[-1]+R[-1]C+R[-1]C[-1] -> 22373624 | DA15: =FIB(RC[-101])+RC[-1]+R[-1]C+R[-1]C[-1] -> 163971080 | DB15: =FIB(RC[-101])+RC[-1]+R[-1]C+R[-1]C[-1] -> 968961812 | DC15: =FIB(RC[-101])+RC[-1]+R[-1]C+R[-1]C[-1] -> 4819983532 | DD15: =FIB(RC[-101])+RC[-1]+R[-1]C+R[-1]C[-1] -> 20799063792 | DE15: =FIB(RC[-101])+RC[-1]+R[-1]C+R[-1]C[-1] -> 79614110992 | DF15: =FIB(RC[-101])+RC[-1]+R[-1]C+R[-1]C[-1] -> 275022431372 | DG15: =FIB(RC[-101])+RC[-1]+R[-1]C+R[-1]C[-1] -> 869217766196 | DH15: =FIB(RC[-101])+RC[-1]+R[-1]C+R[-1]C[-1] -> 2541594516968 | DI15: =FIB(RC[-101])+RC[-1]+R[-1]C+R[-1]C[-1] -> 6938969714456 | DJ15: =FIB(RC[-101])+RC[-1]+R[-1]C+R[-1]C[-1] -> 17825327390468 | DK15: =FIB(RC[-101])+RC[-1]+R[-1]C+R[-1]C[-1] -> 43367221483196 | DL15: =FIB(RC[-101])+RC[-1]+R[-1]C+R[-1]C[-1] -> 100480267108832 | DM15: =FIB(RC[-101])+RC[-1]+R[-1]C+R[-1]C[-1] -> 222777254284832 | DN15: =FIB(RC[-101])+RC[-1]+R[-1]C+R[-1]C[-1] -> 474601449891452 | DO15: =FIB(RC[-101])+RC[-1]+R[-1]C+R[-1]C[-1] -> 975036409435972 | DP15: =FIB(RC[-101])+RC[-1]+R[-1]C+R[-1]C[-1] -> 1.93783589325487E+15 | DQ15: =FIB(RC[-101])+RC[-1]+R[-1]C+R[-1]C[-1] -> 3.7361466341914E+15 | DR15: =FIB(RC[-101])+RC[-1]+R[-1]C+R[-1]C[-1] -> 7.0049985836572E+15 | DS15: =FIB(RC[-101])+RC[-1]+R[-1]C+R[-1]C[-1] -> 1.2800183556556E+16 | DT15: =FIB(RC[-101])+RC[-1]+R[-1]C+R[-1]C[-1] -> 2.28397953035102E+16 | DU15: =FIB(RC[-101])+RC[-1]+R[-1]C+R[-1]C[-1] -> 3.98649285667807E+16 | DV15: =FIB(RC[-101])+RC[-1]+R[-1]C+R[-1]C[-1] -> 6.81695206288416E+16 | DW15: =FIB(RC[-101])+RC[-1]+R[-1]C+R[-1]C[-1] -> 1.14366896631003E+17 | DX15: =FIB(RC[-101])+RC[-1]+R[-1]C+R[-1]C[-1] -> 1.8848324217219E+17 | DY15: =FIB(RC[-101])+RC[-1]+R[-1]C+R[-1]C[-1] -> 3.05497151143955E+17 | DZ15: =FIB(RC[-101])+RC[-1]+R[-1]C+R[-1]C[-1] -> 4.87480971172281E+17 | EA15: =FIB(RC[-101])+RC[-1]+R[-1]C+R[-1]C[-1] -> 7.66545518239033E+17 | EB15: =FIB(RC[-101])+RC[-1]+R[-1]C+R[-1]C[-1] -> 1.18884674722905E+18 | EC15: =FIB(RC[-101])+RC[-1]+R[-1]C+R[-1]C[-1] -> 1.81998333547039E+18 | ED15: =FIB(RC[-101])+RC[-1]+R[-1]C+R[-1]C[-1] -> 2.75220038302943E+18 | EE15: =FIB(RC[-101])+RC[-1]+R[-1]C+R[-1]C[-1] -> 4.11391944642284E+18 | EF15: =FIB(RC[-101])+RC[-1]+R[-1]C+R[-1]C[-1] -> 6.08224219912181E+18 | EG15: =FIB(RC[-101])+RC[-1]+R[-1]C+R[-1]C[-1] -> 8.89922789998144E+18 | EH15: =FIB(RC[-101])+RC[-1]+R[-1]C+R[-1]C[-1] -> 1.28929277910229E+19 | EI15: =FIB(RC[-101])+RC[-1]+R[-1]C+R[-1]C[-1] -> 1.85043773220784E+19 | EJ15: =FIB(RC[-101])+RC[-1]+R[-1]C+R[-1]C[-1] -> 2.63220050871575E+19 | EK15: =FIB(RC[-101])+RC[-1]+R[-1]C+R[-1]C[-1] -> 3.71252215772156E+19 | EL15: =FIB(RC[-101])+RC[-1]+R[-1]C+R[-1]C[-1] -> 5.19393080298915E+19 | EM15: =FIB(RC[-101])+RC[-1]+R[-1]C+R[-1]C[-1] -> 7.21041432745879E+19 | EN15: =FIB(RC[-101])+RC[-1]+R[-1]C+R[-1]C[-1] -> 9.93597928422905E+19 | EO15: =FIB(RC[-101])+RC[-1]+R[-1]C+R[-1]C[-1] -> 1.3595254893713E+20 | EP15: =FIB(RC[-101])+RC[-1]+R[-1]C+R[-1]C[-1] -> 1.8476566231639E+20 | EQ15: =FIB(RC[-101])+RC[-1]+R[-1]C+R[-1]C[-1] -> 2.49479758898829E+20 | ER15: =FIB(RC[-101])+RC[-1]+R[-1]C+R[-1]C[-1] -> 3.3476879733234E+20 | ES15: =FIB(RC[-101])+RC[-1]+R[-1]C+R[-1]C[-1] -> 4.46538412310059E+20 | ET15: =FIB(RC[-101])+RC[-1]+R[-1]C+R[-1]C[-1] -> 5.92214616917225E+20 | EU15: =FIB(RC[-101])+RC[-1]+R[-1]C+R[-1]C[-1] -> 7.81092121875849E+20 | EV15: =FIB(RC[-101])+RC[-1]+R[-1]C+R[-1]C[-1] -> 1.02475298784825E+21 | EW15: =FIB(RC[-101])+RC[-1]+R[-1]C+R[-1]C[-1] -> 1.33756797813976E+21 | EX15: =FIB(RC[-101])+RC[-1]+R[-1]C+R[-1]C[-1] -> 1.7372948440408E+21 | EY15: =FIB(RC[-101])+RC[-1]+R[-1]C+R[-1]C[-1] -> 2.24578987627019E+21 | EZ15: =FIB(RC[-101])+RC[-1]+R[-1]C+R[-1]C[-1] -> 2.8898514180007E+21 | FA15: =FIB(RC[-101])+RC[-1]+R[-1]C+R[-1]C[-1] -> 3.70221668423002E+21 | FB15: =FIB(RC[-101])+RC[-1]+R[-1]C+R[-1]C[-1] -> 4.72273619738087E+21 | FC15: =FIB(RC[-101])+RC[-1]+R[-1]C+R[-1]C[-1] -> 5.99975346077856E+21 | FD15: =FIB(RC[-101])+RC[-1]+R[-1]C+R[-1]C[-1] -> 7.59172118323167E+21 | FE15: =FIB(RC[-101])+RC[-1]+R[-1]C+R[-1]C[-1] -> 9.56908947499422E+21 | FF15: =FIB(RC[-101])+RC[-1]+R[-1]C+R[-1]C[-1] -> 1.20165059962087E+22 | FG15: =FIB(RC[-101])+RC[-1]+R[-1]C+R[-1]C[-1] -> 1.5035373094592E+22 | FH15: =FIB(RC[-101])+RC[-1]+R[-1]C+R[-1]C[-1] -> 1.87468125636208E+22 | FI15: =FIB(RC[-101])+RC[-1]+R[-1]C+R[-1]C[-1] -> 2.32950948328796E+22 | FJ15: =FIB(RC[-101])+RC[-1]+R[-1]C+R[-1]C[-1] -> 2.88515962188498E+22 | FK15: =FIB(RC[-101])+RC[-1]+R[-1]C+R[-1]C[-1] -> 3.5619355370967E+22 | FL15: =FIB(RC[-101])+RC[-1]+R[-1]C+R[-1]C[-1] -> 4.38383083015243E+22 | FM15: =FIB(RC[-101])+RC[-1]+R[-1]C+R[-1]C[-1] -> 5.37912904499852E+22 | FN15: =FIB(RC[-101])+RC[-1]+R[-1]C+R[-1]C[-1] -> 6.5810904167438E+22 | FO15: =FIB(RC[-101])+RC[-1]+R[-1]C+R[-1]C[-1] -> 8.02873608843526E+22 | FP15: =FIB(RC[-101])+RC[-1]+R[-1]C+R[-1]C[-1] -> 9.76774191178435E+22 | FQ15: =FIB(RC[-101])+RC[-1]+R[-1]C+R[-1]C[-1] -> 1.18514552461201E+23 | FR15: =FIB(RC[-101])+RC[-1]+R[-1]C+R[-1]C[-1] -> 1.4342049586109E+23 | FS15: =FIB(RC[-101])+RC[-1]+R[-1]C+R[-1]C[-1] -> 1.73118333914045E+23 | FT15: =FIB(RC[-101])+RC[-1]+R[-1]C+R[-1]C[-1] -> 2.08447311696373E+23 | FU15: =FIB(RC[-101])+RC[-1]+R[-1]C+R[-1]C[-1] -> 2.50379566878265E+23 | FV15: =FIB(RC[-101])+RC[-1]+R[-1]C+R[-1]C[-1] -> 3.00039001667455E+23 | FW15: =FIB(RC[-101])+RC[-1]+R[-1]C+R[-1]C[-1] -> 3.5872253458952E+23 | FX15: =FIB(RC[-101])+RC[-1]+R[-1]C+R[-1]C[-1] -> 4.27923995356425E+23 | FY15: =FIB(RC[-101])+RC[-1]+R[-1]C+R[-1]C[-1] -> 5.09360951223855E+23 | FZ15: =FIB(RC[-101])+RC[-1]+R[-1]C+R[-1]C[-1] -> 6.05004780419825E+23 | GA15: =FIB(RC[-101])+RC[-1]+R[-1]C+R[-1]C[-1] -> 7.17114337576917E+23 | GB15: =FIB(RC[-101])+RC[-1]+R[-1]C+R[-1]C[-1] -> 8.48273587760918E+23 | GC15: =FIB(RC[-101])+RC[-1]+R[-1]C+R[-1]C[-1] -> 1.00143361980894E+24 | GD15: =FIB(RC[-101])+RC[-1]+R[-1]C+R[-1]C[-1] -> 1.17995948642796E+24 | GE15: =FIB(RC[-101])+RC[-1]+R[-1]C+R[-1]C[-1] -> 1.38768235802524E+24 | GF15: =FIB(RC[-101])+RC[-1]+R[-1]C+R[-1]C[-1] -> 1.62895751971881E+24 | GG15: =FIB(RC[-101])+RC[-1]+R[-1]C+R[-1]C[-1] -> 1.90872878659138E+24 | GH15: =FIB(RC[-101])+RC[-1]+R[-1]C+R[-1]C[-1] -> 2.23259996119556E+24 | GI15: =FIB(RC[-101])+RC[-1]+R[-1]C+R[-1]C[-1] -> 2.60691400979226E+24 | GJ15: =FIB(RC[-101])+RC[-1]+R[-1]C+R[-1]C[-1] -> 3.03884069001732E+24 | GK15: =FIB(RC[-101])+RC[-1]+R[-1]C+R[-1]C[-1] -> 3.53647342284346E+24 | GL15: =FIB(RC[-101])+RC[-1]+R[-1]C+R[-1]C[-1] -> 4.10893626606509E+24 | GM15: =FIB(RC[-101])+RC[-1]+R[-1]C+R[-1]C[-1] -> 4.76650191532265E+24 | GN15: =FIB(RC[-101])+RC[-1]+R[-1]C+R[-1]C[-1] -> 5.52072173215238E+24 | GO15: =FIB(RC[-101])+RC[-1]+R[-1]C+R[-1]C[-1] -> 6.38456887695907E+24 | GP15: =FIB(RC[-101])+RC[-1]+R[-1]C+R[-1]C[-1] -> 7.37259570843754E+24 | GQ15: =FIB(RC[-101])+RC[-1]+R[-1]C+R[-1]C[-1] -> 8.50110670009917E+24 | GR15: =FIB(RC[-101])+RC[-1]+R[-1]C+R[-1]C[-1] -> 9.78834821949247E+24 | GS15: =FIB(RC[-101])+RC[-1]+R[-1]C+R[-1]C[-1] -> 1.1254716616751E+25
A16: 20 | B16: 20 | C16: 20 | D16: 20 | E16: 20 | F16: 20 | G16: 20 | H16: 20 | I16: 20 | J16: 20 | K16: 20 | L16: 20 | M16: 20 | N16: 20 | O16: 20 | P16: 20 | Q16: 20 | R16: 20 | S16: 20 | T16: 20 | U16: 20 | V16: 20 | W16: 20 | X16: 20 | Y16: 20 | Z16: 20 | AA16: 20 | AB16: 20 | AC16: 20 | AD16: 20 | AE16: 20 | AF16: 20 | AG16: 20 | AH16: 20 | AI16: 20 | AJ16: 20 | AK16: 20 | AL16: 20 | AM16: 20 | AN16: 20 | AO16: 20 | AP16: 20 | AQ16: 20 | AR16: 20 | AS16: 20 | AT16: 20 | AU16: 20 | AV16: 20 | AW16: 20 | AX16: 20 | AY16: 20 | AZ16: 20 | BA16: 20 | BB16: 20 | BC16: 20 | BD16: 20 | BE16: 20 | BF16: 20 | BG16: 20 | BH16: 20 | BI16: 20 | BJ16: 20 | BK16: 20 | BL16: 20 | BM16: 20 | BN16: 20 | BO16: 20 | BP16: 20 | BQ16: 20 | BR16: 20 | BS16: 20 | BT16: 20 | BU16: 20 | BV16: 20 | BW16: 20 | BX16: 20 | BY16: 20 | BZ16: 20 | CA16: 20 | CB16: 20 | CC16: 20 | CD16: 20 | CE16: 20 | CF16: 20 | CG16: 20 | CH16: 20 | CI16: 20 | CJ16: 20 | CK16: 20 | CL16: 20 | CM16: 20 | CN16: 20 | CO16: 20 | CP16: 20 | CQ16: 20 | CR16: 20 | CS16: 20 | CT16: 20 | CU16: 20 | CV16: 20 | CW16: 0 | CX16: =FIB(RC[-101])+RC[-1]+R[-1]C+R[-1]C[-1] -> 164190 | CY16: =FIB(RC[-101])+RC[-1]+R[-1]C+R[-1]C[-1] -> 2627040 | CZ16: =FIB(RC[-101])+RC[-1]+R[-1]C+R[-1]C[-1] -> 27310270 | DA16: =FIB(RC[-101])+RC[-1]+R[-1]C+R[-1]C[-1] -> 213665920 | DB16: =FIB(RC[-101])+RC[-1]+R[-1]C+R[-1]C[-1] -> 1346609758 | DC16: =FIB(RC[-101])+RC[-1]+R[-1]C+R[-1]C[-1] -> 7135566048 | DD16: =FIB(RC[-101])+RC[-1]+R[-1]C+R[-1]C[-1] -> 32754624318 | DE16: =FIB(RC[-101])+RC[-1]+R[-1]C+R[-1]C[-1] -> 133167810048 | DF16: =FIB(RC[-101])+RC[-1]+R[-1]C+R[-1]C[-1] -> 487804363358 | DG16: =FIB(RC[-101])+RC[-1]+R[-1]C+R[-1]C[-1] -> 1632044571872 | DH16: =FIB(RC[-101])+RC[-1]+R[-1]C+R[-1]C[-1] -> 5042856865982 | DI16: =FIB(RC[-101])+RC[-1]+R[-1]C+R[-1]C[-1] -> 14523421108352 | DJ16: =FIB(RC[-101])+RC[-1]+R[-1]C+R[-1]C[-1] -> 39287718224222 | DK16: =FIB(RC[-101])+RC[-1]+R[-1]C+R[-1]C[-1] -> 100480267108832 | DL16: =FIB(RC[-101])+RC[-1]+R[-1]C+R[-1]C[-1] -> 244327755711806 | DM16: =FIB(RC[-101])+RC[-1]+R[-1]C+R[-1]C[-1] -> 567585277116416 | DN16: =FIB(RC[-101])+RC[-1]+R[-1]C+R[-1]C[-1] -> 1.26496398130365E+15 | DO16: =FIB(RC[-101])+RC[-1]+R[-1]C+R[-1]C[-1] -> 2.71460184064202E+15 | DP16: =FIB(RC[-101])+RC[-1]+R[-1]C+R[-1]C[-1] -> 5.62747414334381E+15 | DQ16: =FIB(RC[-101])+RC[-1]+R[-1]C+R[-1]C[-1] -> 1.1301456670801E+16 | DR16: =FIB(RC[-101])+RC[-1]+R[-1]C+R[-1]C[-1] -> 2.20426018886606E+16 | DS16: =FIB(RC[-101])+RC[-1]+R[-1]C+R[-1]C[-1] -> 4.18477840288847E+16 | DT16: =FIB(RC[-101])+RC[-1]+R[-1]C+R[-1]C[-1] -> 7.74877628889619E+16 | DU16: =FIB(RC[-101])+RC[-1]+R[-1]C+R[-1]C[-1] -> 1.40192486759264E+17 | DV16: =FIB(RC[-101])+RC[-1]+R[-1]C+R[-1]C[-1] -> 2.48226935954897E+17 | DW16: =FIB(RC[-101])+RC[-1]+R[-1]C+R[-1]C[-1] -> 4.30763353214752E+17 | DX16: =FIB(RC[-101])+RC[-1]+R[-1]C+R[-1]C[-1] -> 7.33613492017956E+17 | DY16: =FIB(RC[-101])+RC[-1]+R[-1]C+R[-1]C[-1] -> 1.22759388533411E+18 | DZ16: =FIB(RC[-101])+RC[-1]+R[-1]C+R[-1]C[-1] -> 2.02057200765036E+18 | EA16: =FIB(RC[-101])+RC[-1]+R[-1]C+R[-1]C[-1] -> 3.27459849706168E+18 | EB16: =FIB(RC[-101])+RC[-1]+R[-1]C+R[-1]C[-1] -> 5.22999076252978E+18 | EC16: =FIB(RC[-101])+RC[-1]+R[-1]C+R[-1]C[-1] -> 8.23882084522923E+18 | ED16: =FIB(RC[-101])+RC[-1]+R[-1]C+R[-1]C[-1] -> 1.28110045637291E+19 | EE16: =FIB(RC[-101])+RC[-1]+R[-1]C+R[-1]C[-1] -> 1.96771243931813E+19 | EF16: =FIB(RC[-101])+RC[-1]+R[-1]C+R[-1]C[-1] -> 2.9873286038726E+19 | EG16: =FIB(RC[-101])+RC[-1]+R[-1]C+R[-1]C[-1] -> 4.48547561378293E+19 | EH16: =FIB(RC[-101])+RC[-1]+R[-1]C+R[-1]C[-1] -> 6.66469118288336E+19 | EI16: =FIB(RC[-101])+RC[-1]+R[-1]C+R[-1]C[-1] -> 9.80442169419349E+19 | EJ16: =FIB(RC[-101])+RC[-1]+R[-1]C+R[-1]C[-1] -> 1.42870599351171E+20 | EK16: =FIB(RC[-101])+RC[-1]+R[-1]C+R[-1]C[-1] -> 2.06317826015544E+20 | EL16: =FIB(RC[-101])+RC[-1]+R[-1]C+R[-1]C[-1] -> 2.95382355622651E+20 | EM16: =FIB(RC[-101])+RC[-1]+R[-1]C+R[-1]C[-1] -> 4.1942580692713E+20 | EN16: =FIB(RC[-101])+RC[-1]+R[-1]C+R[-1]C[-1] -> 5.90889743044009E+20 | EO16: =FIB(RC[-101])+RC[-1]+R[-1]C+R[-1]C[-1] -> 8.26202084823429E+20 | EP16: =FIB(RC[-101])+RC[-1]+R[-1]C+R[-1]C[-1] -> 1.14692029607695E+21 | EQ16: =FIB(RC[-101])+RC[-1]+R[-1]C+R[-1]C[-1] -> 1.58116571729217E+21 | ER16: =FIB(RC[-101])+RC[-1]+R[-1]C+R[-1]C[-1] -> 2.16541427352334E+21 | ES16: =FIB(RC[-101])+RC[-1]+R[-1]C+R[-1]C[-1] -> 2.94672148316574E+21 | ET16: =FIB(RC[-101])+RC[-1]+R[-1]C+R[-1]C[-1] -> 3.98547451239302E+21 | EU16: =FIB(RC[-101])+RC[-1]+R[-1]C+R[-1]C[-1] -> 5.35878125118609E+21 | EV16: =FIB(RC[-101])+RC[-1]+R[-1]C+R[-1]C[-1] -> 7.1646263609102E+21 | EW16: =FIB(RC[-101])+RC[-1]+R[-1]C+R[-1]C[-1] -> 9.52694732689821E+21 | EX16: =FIB(RC[-101])+RC[-1]+R[-1]C+R[-1]C[-1] -> 1.26018101490788E+22 | EY16: =FIB(RC[-101])+RC[-1]+R[-1]C+R[-1]C[-1] -> 1.65848948693898E+22 | EZ16: =FIB(RC[-101])+RC[-1]+R[-1]C+R[-1]C[-1] -> 2.17205361636606E+22 | FA16: =FIB(RC[-101])+RC[-1]+R[-1]C+R[-1]C[-1] -> 2.83126042658914E+22 | FB16: =FIB(RC[-101])+RC[-1]+R[-1]C+R[-1]C[-1] -> 3.67375571475023E+22 | FC16: =FIB(RC[-101])+RC[-1]+R[-1]C+R[-1]C[-1] -> 4.74600468056617E+22 | FD16: =FIB(RC[-101])+RC[-1]+R[-1]C+R[-1]C[-1] -> 6.10515214496719E+22 | FE16: =FIB(RC[-101])+RC[-1]+R[-1]C+R[-1]C[-1] -> 7.82123321078978E+22 | FF16: =FIB(RC[-101])+RC[-1]+R[-1]C+R[-1]C[-1] -> 9.97979275791008E+22 | FG16: =FIB(RC[-101])+RC[-1]+R[-1]C+R[-1]C[-1] -> 1.26849806669901E+23 | FH16: =FIB(RC[-101])+RC[-1]+R[-1]C+R[-1]C[-1] -> 1.60631992328114E+23 | FI16: =FIB(RC[-101])+RC[-1]+R[-1]C+R[-1]C[-1] -> 2.02673899724615E+23 | FJ16: =FIB(RC[-101])+RC[-1]+R[-1]C+R[-1]C[-1] -> 2.54820590776344E+23 | FK16: =FIB(RC[-101])+RC[-1]+R[-1]C+R[-1]C[-1] -> 3.19291542366161E+23 | FL16: =FIB(RC[-101])+RC[-1]+R[-1]C+R[-1]C[-1] -> 3.98749206038652E+23 | FM16: =FIB(RC[-101])+RC[-1]+R[-1]C+R[-1]C[-1] -> 4.96378804790162E+23 | FN16: =FIB(RC[-101])+RC[-1]+R[-1]C+R[-1]C[-1] -> 6.15980999407585E+23 | FO16: =FIB(RC[-101])+RC[-1]+R[-1]C+R[-1]C[-1] -> 7.62079264459375E+23 | FP16: =FIB(RC[-101])+RC[-1]+R[-1]C+R[-1]C[-1] -> 9.40044044461571E+23 | FQ16: =FIB(RC[-101])+RC[-1]+R[-1]C+R[-1]C[-1] -> 1.15623601604062E+24 | FR16: =FIB(RC[-101])+RC[-1]+R[-1]C+R[-1]C[-1] -> 1.41817106436291E+24 | FS16: =FIB(RC[-101])+RC[-1]+R[-1]C+R[-1]C[-1] -> 1.73470989413804E+24 | FT16: =FIB(RC[-101])+RC[-1]+R[-1]C+R[-1]C[-1] -> 2.11627553974846E+24 | FU16: =FIB(RC[-101])+RC[-1]+R[-1]C+R[-1]C[-1] -> 2.5751024183231E+24 | FV16: =FIB(RC[-101])+RC[-1]+R[-1]C+R[-1]C[-1] -> 3.12552098686882E+24 | FW16: =FIB(RC[-101])+RC[-1]+R[-1]C+R[-1]C[-1] -> 3.78428252312579E+24 | FX16: =FIB(RC[-101])+RC[-1]+R[-1]C+R[-1]C[-1] -> 4.57092905307174E+24 | FY16: =FIB(RC[-101])+RC[-1]+R[-1]C+R[-1]C[-1] -> 5.50821399965202E+24 | FZ16: =FIB(RC[-101])+RC[-1]+R[-1]C+R[-1]C[-1] -> 6.6225797312957E+24 | GA16: =FIB(RC[-101])+RC[-1]+R[-1]C+R[-1]C[-1] -> 7.94469884929244E+24 | GB16: =FIB(RC[-101])+RC[-1]+R[-1]C+R[-1]C[-1] -> 9.51008677463027E+24 | GC16: =FIB(RC[-101])+RC[-1]+R[-1]C+R[-1]C[-1] -> 1.13597939822001E+25 | GD16: =FIB(RC[-101])+RC[-1]+R[-1]C+R[-1]C[-1] -> 1.3541187088437E+25 | GE16: =FIB(RC[-101])+RC[-1]+R[-1]C+R[-1]C[-1] -> 1.61088289328902E+25 | GF16: =FIB(RC[-101])+RC[-1]+R[-1]C+R[-1]C[-1] -> 1.91254688106343E+25 | GG16: =FIB(RC[-101])+RC[-1]+R[-1]C+R[-1]C[-1] -> 2.26631551169444E+25 | GH16: =FIB(RC[-101])+RC[-1]+R[-1]C+R[-1]C[-1] -> 2.68044838647314E+25 | GI16: =FIB(RC[-101])+RC[-1]+R[-1]C+R[-1]C[-1] -> 3.16439978357192E+25 | GJ16: =FIB(RC[-101])+RC[-1]+R[-1]C+R[-1]C[-1] -> 3.72897525355288E+25 | GK16: =FIB(RC[-101])+RC[-1]+R[-1]C+R[-1]C[-1] -> 4.38650666483896E+25 | GL16: =FIB(RC[-101])+RC[-1]+R[-1]C+R[-1]C[-1] -> 5.15104763372981E+25 | GM16: =FIB(RC[-101])+RC[-1]+R[-1]C+R[-1]C[-1] -> 6.03859145186859E+25 | GN16: =FIB(RC[-101])+RC[-1]+R[-1]C+R[-1]C[-1] -> 7.06731381661609E+25 | GO16: =FIB(RC[-101])+RC[-1]+R[-1]C+R[-1]C[-1] -> 8.25784287752724E+25 | GP16: =FIB(RC[-101])+RC[-1]+R[-1]C+R[-1]C[-1] -> 9.6335593360669E+25 | GQ16: =FIB(RC[-101])+RC[-1]+R[-1]C+R[-1]C[-1] -> 1.12209295769206E+26 | GR16: =FIB(RC[-101])+RC[-1]+R[-1]C+R[-1]C[-1] -> 1.30498750688797E+26 | GS16: =FIB(RC[-101])+RC[-1]+R[-1]C+R[-1]C[-1] -> 1.51541815525041E+26
A17: 20 | B17: 20 | C17: 20 | D17: 20 | E17: 20 | F17: 20 | G17: 20 | H17: 20 | I17: 20 | J17: 20 | K17: 20 | L17: 20 | M17: 20 | N17: 20 | O17: 20 | P17: 20 | Q17: 20 | R17: 20 | S17: 20 | T17: 20 | U17: 20 | V17: 20 | W17: 20 | X17: 20 | Y17: 20 | Z17: 20 | AA17: 20 | AB17: 20 | AC17: 20 | AD17: 20 | AE17: 20 | AF17: 20 | AG17: 20 | AH17: 20 | AI17: 20 | AJ17: 20 | AK17: 20 | AL17: 20 | AM17: 20 | AN17: 20 | AO17: 20 | AP17: 20 | AQ17: 20 | AR17: 20 | AS17: 20 | AT17: 20 | AU17: 20 | AV17: 20 | AW17: 20 | AX17: 20 | AY17: 20 | AZ17: 20 | BA17: 20 | BB17: 20 | BC17: 20 | BD17: 20 | BE17: 20 | BF17: 20 | BG17: 20 | BH17: 20 | BI17: 20 | BJ17: 20 | BK17: 20 | BL17: 20 | BM17: 20 | BN17: 20 | BO17: 20 | BP17: 20 | BQ17: 20 | BR17: 20 | BS17: 20 | BT17: 20 | BU17: 20 | BV17: 20 | BW17: 20 | BX17: 20 | BY17: 20 | BZ17: 20 | CA17: 20 | CB17: 20 | CC17: 20 | CD17: 20 | CE17: 20 | CF17: 20 | CG17: 20 | CH17: 20 | CI17: 20 | CJ17: 20 | CK17: 20 | CL17: 20 | CM17: 20 | CN17: 20 | CO17: 20 | CP17: 20 | CQ17: 20 | CR17: 20 | CS17: 20 | CT17: 20 | CU17: 20 | CV17: 20 | CW17: 0 | CX17: =FIB(RC[-101])+RC[-1]+R[-1]C+R[-1]C[-1] -> 175136 | CY17: =FIB(RC[-101])+RC[-1]+R[-1]C+R[-1]C[-1] -> 2977312 | CZ17: =FIB(RC[-101])+RC[-1]+R[-1]C+R[-1]C[-1] -> 32925568 | DA17: =FIB(RC[-101])+RC[-1]+R[-1]C+R[-1]C[-1] -> 273912704 | DB17: =FIB(RC[-101])+RC[-1]+R[-1]C+R[-1]C[-1] -> 1834199328 | DC17: =FIB(RC[-101])+RC[-1]+R[-1]C+R[-1]C[-1] -> 10316386080 | DD17: =FIB(RC[-101])+RC[-1]+R[-1]C+R[-1]C[-1] -> 50206587392 | DE17: =FIB(RC[-101])+RC[-1]+R[-1]C+R[-1]C[-1] -> 216129032704 | DF17: =FIB(RC[-101])+RC[-1]+R[-1]C+R[-1]C[-1] -> 837101217056 | DG17: =FIB(RC[-101])+RC[-1]+R[-1]C+R[-1]C[-1] -> 2956950163232 | DH17: =FIB(RC[-101])+RC[-1]+R[-1]C+R[-1]C[-1] -> 9631851612032 | DI17: =FIB(RC[-101])+RC[-1]+R[-1]C+R[-1]C[-1] -> 29198129597312 | DJ17: =FIB(RC[-101])+RC[-1]+R[-1]C+R[-1]C[-1] -> 83009268940832 | DK17: =FIB(RC[-101])+RC[-1]+R[-1]C+R[-1]C[-1] -> 222777254284832 | DL17: =FIB(RC[-101])+RC[-1]+R[-1]C+R[-1]C[-1] -> 567585277116416 | DM17: =FIB(RC[-101])+RC[-1]+R[-1]C+R[-1]C[-1] -> 1.37949830995558E+15 | DN17: =FIB(RC[-101])+RC[-1]+R[-1]C+R[-1]C[-1] -> 3.21204756838659E+15 | DO17: =FIB(RC[-101])+RC[-1]+R[-1]C+R[-1]C[-1] -> 7.1916133903432E+15 | DP17: =FIB(RC[-101])+RC[-1]+R[-1]C+R[-1]C[-1] -> 1.553368937434E+16 | DQ17: =FIB(RC[-101])+RC[-1]+R[-1]C+R[-1]C[-1] -> 3.24626201884957E+16 | DR17: =FIB(RC[-101])+RC[-1]+R[-1]C+R[-1]C[-1] -> 6.58066787479683E+16 | DS17: =FIB(RC[-101])+RC[-1]+R[-1]C+R[-1]C[-1] -> 1.29697064665525E+17 | DT17: =FIB(RC[-101])+RC[-1]+R[-1]C+R[-1]C[-1] -> 2.49032611583382E+17 | DU17: =FIB(RC[-101])+RC[-1]+R[-1]C+R[-1]C[-1] -> 4.66712861231619E+17 | DV17: =FIB(RC[-101])+RC[-1]+R[-1]C+R[-1]C[-1] -> 8.5513228394579E+17 | DW17: =FIB(RC[-101])+RC[-1]+R[-1]C+R[-1]C[-1] -> 1.53412257311545E+18 | DX17: =FIB(RC[-101])+RC[-1]+R[-1]C+R[-1]C[-1] -> 2.69849941834817E+18 | DY17: =FIB(RC[-101])+RC[-1]+R[-1]C+R[-1]C[-1] -> 4.65970679570025E+18 | DZ17: =FIB(RC[-101])+RC[-1]+R[-1]C+R[-1]C[-1] -> 7.90787268868473E+18 | EA17: =FIB(RC[-101])+RC[-1]+R[-1]C+R[-1]C[-1] -> 1.32030431933968E+19 | EB17: =FIB(RC[-101])+RC[-1]+R[-1]C+R[-1]C[-1] -> 2.17076324529883E+19 | EC17: =FIB(RC[-101])+RC[-1]+R[-1]C+R[-1]C[-1] -> 3.51764440607473E+19 | ED17: =FIB(RC[-101])+RC[-1]+R[-1]C+R[-1]C[-1] -> 5.62262694697056E+19 | EE17: =FIB(RC[-101])+RC[-1]+R[-1]C+R[-1]C[-1] -> 8.8714398426616E+19 | EF17: =FIB(RC[-101])+RC[-1]+R[-1]C+R[-1]C[-1] -> 1.38264808858523E+20 | EG17: =FIB(RC[-101])+RC[-1]+R[-1]C+R[-1]C[-1] -> 2.12992851035079E+20 | EH17: =FIB(RC[-101])+RC[-1]+R[-1]C+R[-1]C[-1] -> 3.24494519001742E+20 | EI17: =FIB(RC[-101])+RC[-1]+R[-1]C+R[-1]C[-1] -> 4.8918564777251E+20 | EJ17: =FIB(RC[-101])+RC[-1]+R[-1]C+R[-1]C[-1] -> 7.30100464065616E+20 | EK17: =FIB(RC[-101])+RC[-1]+R[-1]C+R[-1]C[-1] -> 1.07928888943233E+21 | EL17: =FIB(RC[-101])+RC[-1]+R[-1]C+R[-1]C[-1] -> 1.58098907107052E+21 | EM17: =FIB(RC[-101])+RC[-1]+R[-1]C+R[-1]C[-1] -> 2.29579723362031E+21 | EN17: =FIB(RC[-101])+RC[-1]+R[-1]C+R[-1]C[-1] -> 3.30611278359145E+21 | EO17: =FIB(RC[-101])+RC[-1]+R[-1]C+R[-1]C[-1] -> 4.72320461145888E+21 | EP17: =FIB(RC[-101])+RC[-1]+R[-1]C+R[-1]C[-1] -> 6.69632699235926E+21 | EQ17: =FIB(RC[-101])+RC[-1]+R[-1]C+R[-1]C[-1] -> 9.42441300572838E+21 | ER17: =FIB(RC[-101])+RC[-1]+R[-1]C+R[-1]C[-1] -> 1.31709929965439E+22 | ES17: =FIB(RC[-101])+RC[-1]+R[-1]C+R[-1]C[-1] -> 1.8283128753233E+22 | ET17: =FIB(RC[-101])+RC[-1]+R[-1]C+R[-1]C[-1] -> 2.52153247487917E+22 | EU17: =FIB(RC[-101])+RC[-1]+R[-1]C+R[-1]C[-1] -> 3.45595805123708E+22 | EV17: =FIB(RC[-101])+RC[-1]+R[-1]C+R[-1]C[-1] -> 4.70829881244671E+22 | EW17: =FIB(RC[-101])+RC[-1]+R[-1]C+R[-1]C[-1] -> 6.37745618122755E+22 | EX17: =FIB(RC[-101])+RC[-1]+R[-1]C+R[-1]C[-1] -> 8.59033192882525E+22 | EY17: =FIB(RC[-101])+RC[-1]+R[-1]C+R[-1]C[-1] -> 1.15090024306721E+23 | EZ17: =FIB(RC[-101])+RC[-1]+R[-1]C+R[-1]C[-1] -> 1.53395455339771E+23 | FA17: =FIB(RC[-101])+RC[-1]+R[-1]C+R[-1]C[-1] -> 2.03428595769323E+23 | FB17: =FIB(RC[-101])+RC[-1]+R[-1]C+R[-1]C[-1] -> 2.68478757182717E+23 | FC17: =FIB(RC[-101])+RC[-1]+R[-1]C+R[-1]C[-1] -> 3.52676361135881E+23 | FD17: =FIB(RC[-101])+RC[-1]+R[-1]C+R[-1]C[-1] -> 4.61187929391215E+23 | FE17: =FIB(RC[-101])+RC[-1]+R[-1]C+R[-1]C[-1] -> 6.00451782948784E+23 | FF17: =FIB(RC[-101])+RC[-1]+R[-1]C+R[-1]C[-1] -> 7.78462042635783E+23 | FG17: =FIB(RC[-101])+RC[-1]+R[-1]C+R[-1]C[-1] -> 1.00510977688479E+24 | FH17: =FIB(RC[-101])+RC[-1]+R[-1]C+R[-1]C[-1] -> 1.2925915758828E+24 | FI17: =FIB(RC[-101])+RC[-1]+R[-1]C+R[-1]C[-1] -> 1.65589746793553E+24 | FJ17: =FIB(RC[-101])+RC[-1]+R[-1]C+R[-1]C[-1] -> 2.11339195843649E+24 | FK17: =FIB(RC[-101])+RC[-1]+R[-1]C+R[-1]C[-1] -> 2.68750409157899E+24 | FL17: =FIB(RC[-101])+RC[-1]+R[-1]C+R[-1]C[-1] -> 3.40554483998381E+24 | FM17: =FIB(RC[-101])+RC[-1]+R[-1]C+R[-1]C[-1] -> 4.30067285081262E+24 | FN17: =FIB(RC[-101])+RC[-1]+R[-1]C+R[-1]C[-1] -> 5.41303265501037E+24 | FO17: =FIB(RC[-101])+RC[-1]+R[-1]C+R[-1]C[-1] -> 6.79109291887733E+24 | FP17: =FIB(RC[-101])+RC[-1]+R[-1]C+R[-1]C[-1] -> 8.49321622779827E+24 | FQ17: =FIB(RC[-101])+RC[-1]+R[-1]C+R[-1]C[-1] -> 1.05894962883005E+25 | FR17: =FIB(RC[-101])+RC[-1]+R[-1]C+R[-1]C[-1] -> 1.3163903368704E+25 | FS17: =FIB(RC[-101])+RC[-1]+R[-1]C+R[-1]C[-1] -> 1.63167843272049E+25 | FT17: =FIB(RC[-101])+RC[-1]+R[-1]C+R[-1]C[-1] -> 2.01677697610914E+25 | FU17: =FIB(RC[-101])+RC[-1]+R[-1]C+R[-1]C[-1] -> 2.4859147719163E+25 | FV17: =FIB(RC[-101])+RC[-1]+R[-1]C+R[-1]C[-1] -> 3.05597711243549E+25 | FW17: =FIB(RC[-101])+RC[-1]+R[-1]C+R[-1]C[-1] -> 3.74695746343495E+25 | FX17: =FIB(RC[-101])+RC[-1]+R[-1]C+R[-1]C[-1] -> 4.5824786210547E+25 | FY17: =FIB(RC[-101])+RC[-1]+R[-1]C+R[-1]C[-1] -> 5.59039292632708E+25 | FZ17: =FIB(RC[-101])+RC[-1]+R[-1]C+R[-1]C[-1] -> 6.80347229942185E+25 | GA17: =FIB(RC[-101])+RC[-1]+R[-1]C+R[-1]C[-1] -> 8.26020015748066E+25 | GB17: =FIB(RC[-101])+RC[-1]+R[-1]C+R[-1]C[-1] -> 1.00056787198729E+26 | GC17: =FIB(RC[-101])+RC[-1]+R[-1]C+R[-1]C[-1] -> 1.2092666795556E+26 | GD17: =FIB(RC[-101])+RC[-1]+R[-1]C+R[-1]C[-1] -> 1.45827649026197E+26 | GE17: =FIB(RC[-101])+RC[-1]+R[-1]C+R[-1]C[-1] -> 1.75477665047524E+26 | GF17: =FIB(RC[-101])+RC[-1]+R[-1]C+R[-1]C[-1] -> 2.10711962791049E+26 | GG17: =FIB(RC[-101])+RC[-1]+R[-1]C+R[-1]C[-1] -> 2.52500586718627E+26 | GH17: =FIB(RC[-101])+RC[-1]+R[-1]C+R[-1]C[-1] -> 3.01968225700303E+26 | GI17: =FIB(RC[-101])+RC[-1]+R[-1]C+R[-1]C[-1] -> 3.60416707400754E+26 | GJ17: =FIB(RC[-101])+RC[-1]+R[-1]C+R[-1]C[-1] -> 4.29350457772002E+26 | GK17: =FIB(RC[-101])+RC[-1]+R[-1]C+R[-1]C[-1] -> 5.1050527695592E+26 | GL17: =FIB(RC[-101])+RC[-1]+R[-1]C+R[-1]C[-1] -> 6.05880819941608E+26 | GM17: =FIB(RC[-101])+RC[-1]+R[-1]C+R[-1]C[-1] -> 7.17777210797592E+26 | GN17: =FIB(RC[-101])+RC[-1]+R[-1]C+R[-1]C[-1] -> 8.48836263482439E+26 | GO17: =FIB(RC[-101])+RC[-1]+R[-1]C+R[-1]C[-1] -> 1.00208783042387E+27 | GP17: =FIB(RC[-101])+RC[-1]+R[-1]C+R[-1]C[-1] -> 1.18100185255981E+27 | GQ17: =FIB(RC[-101])+RC[-1]+R[-1]C+R[-1]C[-1] -> 1.38954674168969E+27 | GR17: =FIB(RC[-101])+RC[-1]+R[-1]C+R[-1]C[-1] -> 1.63225478814769E+27 | GS17: =FIB(RC[-101])+RC[-1]+R[-1]C+R[-1]C[-1] -> 1.91429535436153E+27
A18: 20 | B18: 20 | C18: 20 | D18: 20 | E18: 20 | F18: 20 | G18: 20 | H18: 20 | I18: 20 | J18: 20 | K18: 20 | L18: 20 | M18: 20 | N18: 20 | O18: 20 | P18: 20 | Q18: 20 | R18: 20 | S18: 20 | T18: 20 | U18: 20 | V18: 20 | W18: 20 | X18: 20 | Y18: 20 | Z18: 20 | AA18: 20 | AB18: 20 | AC18: 20 | AD18: 20 | AE18: 20 | AF18: 20 | AG18: 20 | AH18: 20 | AI18: 20 | AJ18: 20 | AK18: 20 | AL18: 20 | AM18: 20 | AN18: 20 | AO18: 20 | AP18: 20 | AQ18: 20 | AR18: 20 | AS18: 20 | AT18: 20 | AU18: 20 | AV18: 20 | AW18: 20 | AX18: 20 | AY18: 20 | AZ18: 20 | BA18: 20 | BB18: 20 | BC18: 20 | BD18: 20 | BE18: 20 | BF18: 20 | BG18: 20 | BH18: 20 | BI18: 20 | BJ18: 20 | BK18: 20 | BL18: 20 | BM18: 20 | BN18: 20 | BO18: 20 | BP18: 20 | BQ18: 20 | BR18: 20 | BS18: 20 | BT18: 20 | BU18: 20 | BV18: 20 | BW18: 20 | BX18: 20 | BY18: 20 | BZ18: 20 | CA18: 20 | CB18: 20 | CC18: 20 | CD18: 20 | CE18: 20 | CF18: 20 | CG18: 20 | CH18: 20 | CI18: 20 | CJ18: 20 | CK18: 20 | CL18: 20 | CM18: 20 | CN18: 20 | CO18: 20 | CP18: 20 | CQ18: 20 | CR18: 20 | CS18: 20 | CT18: 20 | CU18: 20 | CV18: 20 | CW18: 0 | CX18: =FIB(RC[-101])+RC[-1]+R[-1]C+R[-1]C[-1] -> 186082 | CY18: =FIB(RC[-101])+RC[-1]+R[-1]C+R[-1]C[-1] -> 3349476 | CZ18: =FIB(RC[-101])+RC[-1]+R[-1]C+R[-1]C[-1] -> 39263302 | DA18: =FIB(RC[-101])+RC[-1]+R[-1]C+R[-1]C[-1] -> 346112520 | DB18: =FIB(RC[-101])+RC[-1]+R[-1]C+R[-1]C[-1] -> 2454235498 | DC18: =FIB(RC[-101])+RC[-1]+R[-1]C+R[-1]C[-1] -> 14604831852 | DD18: =FIB(RC[-101])+RC[-1]+R[-1]C+R[-1]C[-1] -> 75127816270 | DE18: =FIB(RC[-101])+RC[-1]+R[-1]C+R[-1]C[-1] -> 341463447312 | DF18: =FIB(RC[-101])+RC[-1]+R[-1]C+R[-1]C[-1] -> 1394693708018 | DG18: =FIB(RC[-101])+RC[-1]+R[-1]C+R[-1]C[-1] -> 5188745099252 | DH18: =FIB(RC[-101])+RC[-1]+R[-1]C+R[-1]C[-1] -> 17777546885462 | DI18: =FIB(RC[-101])+RC[-1]+R[-1]C+R[-1]C[-1] -> 56607528105752 | DJ18: =FIB(RC[-101])+RC[-1]+R[-1]C+R[-1]C[-1] -> 168814926654842 | DK18: =FIB(RC[-101])+RC[-1]+R[-1]C+R[-1]C[-1] -> 474601449891452 | DL18: =FIB(RC[-101])+RC[-1]+R[-1]C+R[-1]C[-1] -> 1.26496398130365E+15 | DM18: =FIB(RC[-101])+RC[-1]+R[-1]C+R[-1]C[-1] -> 3.21204756838659E+15 | DN18: =FIB(RC[-101])+RC[-1]+R[-1]C+R[-1]C[-1] -> 7.80359344673971E+15 | DO18: =FIB(RC[-101])+RC[-1]+R[-1]C+R[-1]C[-1] -> 1.82072544054805E+16 | DP18: =FIB(RC[-101])+RC[-1]+R[-1]C+R[-1]C[-1] -> 4.09325571701746E+16 | DQ18: =FIB(RC[-101])+RC[-1]+R[-1]C+R[-1]C[-1] -> 8.89288667330212E+16 | DR18: =FIB(RC[-101])+RC[-1]+R[-1]C+R[-1]C[-1] -> 1.87198165669496E+17 | DS18: =FIB(RC[-101])+RC[-1]+R[-1]C+R[-1]C[-1] -> 3.82701909083E+17 | DT18: =FIB(RC[-101])+RC[-1]+R[-1]C+R[-1]C[-1] -> 7.61431585331917E+17 | DU18: =FIB(RC[-101])+RC[-1]+R[-1]C+R[-1]C[-1] -> 1.47717705814693E+18 | DV18: =FIB(RC[-101])+RC[-1]+R[-1]C+R[-1]C[-1] -> 2.79902220332435E+18 | DW18: =FIB(RC[-101])+RC[-1]+R[-1]C+R[-1]C[-1] -> 5.1882770603856E+18 | DX18: =FIB(RC[-101])+RC[-1]+R[-1]C+R[-1]C[-1] -> 9.42089905184923E+18 | DY18: =FIB(RC[-101])+RC[-1]+R[-1]C+R[-1]C[-1] -> 1.67791052658977E+19 | DZ18: =FIB(RC[-101])+RC[-1]+R[-1]C+R[-1]C[-1] -> 2.93466847502826E+19 | EA18: =FIB(RC[-101])+RC[-1]+R[-1]C+R[-1]C[-1] -> 5.04576006323642E+19 | EB18: =FIB(RC[-101])+RC[-1]+R[-1]C+R[-1]C[-1] -> 8.53682762787492E+19 | EC18: =FIB(RC[-101])+RC[-1]+R[-1]C+R[-1]C[-1] -> 1.42252352792485E+20 | ED18: =FIB(RC[-101])+RC[-1]+R[-1]C+R[-1]C[-1] -> 2.33655066322938E+20 | EE18: =FIB(RC[-101])+RC[-1]+R[-1]C+R[-1]C[-1] -> 3.78595734219259E+20 | EF18: =FIB(RC[-101])+RC[-1]+R[-1]C+R[-1]C[-1] -> 6.05574941504399E+20 | EG18: =FIB(RC[-101])+RC[-1]+R[-1]C+R[-1]C[-1] -> 9.56832601398001E+20 | EH18: =FIB(RC[-101])+RC[-1]+R[-1]C+R[-1]C[-1] -> 1.49431997143482E+21 | EI18: =FIB(RC[-101])+RC[-1]+R[-1]C+R[-1]C[-1] -> 2.30800013820907E+21 | EJ18: =FIB(RC[-101])+RC[-1]+R[-1]C+R[-1]C[-1] -> 3.5272862500472E+21 | EK18: =FIB(RC[-101])+RC[-1]+R[-1]C+R[-1]C[-1] -> 5.33667560354515E+21 | EL18: =FIB(RC[-101])+RC[-1]+R[-1]C+R[-1]C[-1] -> 7.996953564048E+21 | EM18: =FIB(RC[-101])+RC[-1]+R[-1]C+R[-1]C[-1] -> 1.18737398687388E+22 | EN18: =FIB(RC[-101])+RC[-1]+R[-1]C+R[-1]C[-1] -> 1.74756498859506E+22 | EO18: =FIB(RC[-101])+RC[-1]+R[-1]C+R[-1]C[-1] -> 2.55049672810009E+22 | EP18: =FIB(RC[-101])+RC[-1]+R[-1]C+R[-1]C[-1] -> 3.69244988848191E+22 | EQ18: =FIB(RC[-101])+RC[-1]+R[-1]C+R[-1]C[-1] -> 5.30452388829067E+22 | ER18: =FIB(RC[-101])+RC[-1]+R[-1]C+R[-1]C[-1] -> 7.56406448851789E+22 | ES18: =FIB(RC[-101])+RC[-1]+R[-1]C+R[-1]C[-1] -> 1.07094766634956E+23 | ET18: =FIB(RC[-101])+RC[-1]+R[-1]C+R[-1]C[-1] -> 1.5059322013698E+23 | EU18: =FIB(RC[-101])+RC[-1]+R[-1]C+R[-1]C[-1] -> 2.10368125398143E+23 | EV18: =FIB(RC[-101])+RC[-1]+R[-1]C+R[-1]C[-1] -> 2.92010694034981E+23 | EW18: =FIB(RC[-101])+RC[-1]+R[-1]C+R[-1]C[-1] -> 4.02868243971724E+23 | EX18: =FIB(RC[-101])+RC[-1]+R[-1]C+R[-1]C[-1] -> 5.52546125072252E+23 | EY18: =FIB(RC[-101])+RC[-1]+R[-1]C+R[-1]C[-1] -> 7.53539468667225E+23 | EZ18: =FIB(RC[-101])+RC[-1]+R[-1]C+R[-1]C[-1] -> 1.02202494831372E+24 | FA18: =FIB(RC[-101])+RC[-1]+R[-1]C+R[-1]C[-1] -> 1.37884899942281E+24 | FB18: =FIB(RC[-101])+RC[-1]+R[-1]C+R[-1]C[-1] -> 1.85075635237485E+24 | FC18: =FIB(RC[-101])+RC[-1]+R[-1]C+R[-1]C[-1] -> 2.47191147069345E+24 | FD18: =FIB(RC[-101])+RC[-1]+R[-1]C+R[-1]C[-1] -> 3.28577576122055E+24 | FE18: =FIB(RC[-101])+RC[-1]+R[-1]C+R[-1]C[-1] -> 4.34741547356055E+24 | FF18: =FIB(RC[-101])+RC[-1]+R[-1]C+R[-1]C[-1] -> 5.72632929914511E+24 | FG18: =FIB(RC[-101])+RC[-1]+R[-1]C+R[-1]C[-1] -> 7.50990111866568E+24 | FH18: =FIB(RC[-101])+RC[-1]+R[-1]C+R[-1]C[-1] -> 9.80760247143327E+24 | FI18: =FIB(RC[-101])+RC[-1]+R[-1]C+R[-1]C[-1] -> 1.27560915152516E+25 | FJ18: =FIB(RC[-101])+RC[-1]+R[-1]C+R[-1]C[-1] -> 1.65253809416236E+25 | FK18: =FIB(RC[-101])+RC[-1]+R[-1]C+R[-1]C[-1] -> 2.13262769916391E+25 | FL18: =FIB(RC[-101])+RC[-1]+R[-1]C+R[-1]C[-1] -> 2.74193259232019E+25 | FM18: =FIB(RC[-101])+RC[-1]+R[-1]C+R[-1]C[-1] -> 3.51255436139983E+25 | FN18: =FIB(RC[-101])+RC[-1]+R[-1]C+R[-1]C[-1] -> 4.48392491198213E+25 | FO18: =FIB(RC[-101])+RC[-1]+R[-1]C+R[-1]C[-1] -> 5.7043374693709E+25 | FP18: =FIB(RC[-101])+RC[-1]+R[-1]C+R[-1]C[-1] -> 7.23276838403846E+25 | FQ18: =FIB(RC[-101])+RC[-1]+R[-1]C+R[-1]C[-1] -> 9.14103963564833E+25 | FR18: =FIB(RC[-101])+RC[-1]+R[-1]C+R[-1]C[-1] -> 1.15163796013488E+26 | FS18: =FIB(RC[-101])+RC[-1]+R[-1]C+R[-1]C[-1] -> 1.44644483709397E+26 | FT18: =FIB(RC[-101])+RC[-1]+R[-1]C+R[-1]C[-1] -> 1.81129037797693E+26 | FU18: =FIB(RC[-101])+RC[-1]+R[-1]C+R[-1]C[-1] -> 2.26155955277947E+26 | FV18: =FIB(RC[-101])+RC[-1]+R[-1]C+R[-1]C[-1] -> 2.81574874121465E+26 | FW18: =FIB(RC[-101])+RC[-1]+R[-1]C+R[-1]C[-1] -> 3.4960421988017E+26 | FX18: =FIB(RC[-101])+RC[-1]+R[-1]C+R[-1]C[-1] -> 4.32898580725066E+26 | FY18: =FIB(RC[-101])+RC[-1]+R[-1]C+R[-1]C[-1] -> 5.34627296198884E+26 | FZ18: =FIB(RC[-101])+RC[-1]+R[-1]C+R[-1]C[-1] -> 6.58565948456374E+26 | GA18: =FIB(RC[-101])+RC[-1]+R[-1]C+R[-1]C[-1] -> 8.09202673025399E+26 | GB18: =FIB(RC[-101])+RC[-1]+R[-1]C+R[-1]C[-1] -> 9.91861461798935E+26 | GC18: =FIB(RC[-101])+RC[-1]+R[-1]C+R[-1]C[-1] -> 1.21284491695322E+27 | GD18: =FIB(RC[-101])+RC[-1]+R[-1]C+R[-1]C[-1] -> 1.47959923393498E+27 | GE18: =FIB(RC[-101])+RC[-1]+R[-1]C+R[-1]C[-1] -> 1.8009045480087E+27 | GF18: =FIB(RC[-101])+RC[-1]+R[-1]C+R[-1]C[-1] -> 2.18709417584727E+27 | GG18: =FIB(RC[-101])+RC[-1]+R[-1]C+R[-1]C[-1] -> 2.65030672535695E+27 | GH18: =FIB(RC[-101])+RC[-1]+R[-1]C+R[-1]C[-1] -> 3.20477553777588E+27 | GI18: =FIB(RC[-101])+RC[-1]+R[-1]C+R[-1]C[-1] -> 3.86716047087694E+27 | GJ18: =FIB(RC[-101])+RC[-1]+R[-1]C+R[-1]C[-1] -> 4.65692763604969E+27 | GK18: =FIB(RC[-101])+RC[-1]+R[-1]C+R[-1]C[-1] -> 5.59678337077762E+27 | GL18: =FIB(RC[-101])+RC[-1]+R[-1]C+R[-1]C[-1] -> 6.71316946767514E+27 | GM18: =FIB(RC[-101])+RC[-1]+R[-1]C+R[-1]C[-1] -> 8.03682749841434E+27 | GN18: =FIB(RC[-101])+RC[-1]+R[-1]C+R[-1]C[-1] -> 9.60344097269437E+27 | GO18: =FIB(RC[-101])+RC[-1]+R[-1]C+R[-1]C[-1] -> 1.14543650666007E+28 | GP18: =FIB(RC[-101])+RC[-1]+R[-1]C+R[-1]C[-1] -> 1.36374547495844E+28 | GQ18: =FIB(RC[-101])+RC[-1]+R[-1]C+R[-1]C[-1] -> 1.62080033438339E+28 | GR18: =FIB(RC[-101])+RC[-1]+R[-1]C+R[-1]C[-1] -> 1.92298048736713E+28 | GS18: =FIB(RC[-101])+RC[-1]+R[-1]C+R[-1]C[-1] -> 2.27763550161805E+28
A19: 20 | B19: 20 | C19: 20 | D19: 20 | E19: 20 | F19: 20 | G19: 20 | H19: 20 | I19: 20 | J19: 20 | K19: 20 | L19: 20 | M19: 20 | N19: 20 | O19: 20 | P19: 20 | Q19: 20 | R19: 20 | S19: 20 | T19: 20 | U19: 20 | V19: 20 | W19: 20 | X19: 20 | Y19: 20 | Z19: 20 | AA19: 20 | AB19: 20 | AC19: 20 | AD19: 20 | AE19: 20 | AF19: 20 | AG19: 20 | AH19: 20 | AI19: 20 | AJ19: 20 | AK19: 20 | AL19: 20 | AM19: 20 | AN19: 20 | AO19: 20 | AP19: 20 | AQ19: 20 | AR19: 20 | AS19: 20 | AT19: 20 | AU19: 20 | AV19: 20 | AW19: 20 | AX19: 20 | AY19: 20 | AZ19: 20 | BA19: 20 | BB19: 20 | BC19: 20 | BD19: 20 | BE19: 20 | BF19: 20 | BG19: 20 | BH19: 20 | BI19: 20 | BJ19: 20 | BK19: 20 | BL19: 20 | BM19: 20 | BN19: 20 | BO19: 20 | BP19: 20 | BQ19: 20 | BR19: 20 | BS19: 20 | BT19: 20 | BU19: 20 | BV19: 20 | BW19: 20 | BX19: 20 | BY19: 20 | BZ19: 20 | CA19: 20 | CB19: 20 | CC19: 20 | CD19: 20 | CE19: 20 | CF19: 20 | CG19: 20 | CH19: 20 | CI19: 20 | CJ19: 20 | CK19: 20 | CL19: 20 | CM19: 20 | CN19: 20 | CO19: 20 | CP19: 20 | CQ19: 20 | CR19: 20 | CS19: 20 | CT19: 20 | CU19: 20 | CV19: 20 | CW19: 0 | CX19: =FIB(RC[-101])+RC[-1]+R[-1]C+R[-1]C[-1] -> 197028 | CY19: =FIB(RC[-101])+RC[-1]+R[-1]C+R[-1]C[-1] -> 3743532 | CZ19: =FIB(RC[-101])+RC[-1]+R[-1]C+R[-1]C[-1] -> 46367256 | DA19: =FIB(RC[-101])+RC[-1]+R[-1]C+R[-1]C[-1] -> 431754024 | DB19: =FIB(RC[-101])+RC[-1]+R[-1]C+R[-1]C[-1] -> 3232112988 | DC19: =FIB(RC[-101])+RC[-1]+R[-1]C+R[-1]C[-1] -> 20291191284 | DD19: =FIB(RC[-101])+RC[-1]+R[-1]C+R[-1]C[-1] -> 110023850352 | DE19: =FIB(RC[-101])+RC[-1]+R[-1]C+R[-1]C[-1] -> 526615124880 | DF19: =FIB(RC[-101])+RC[-1]+R[-1]C+R[-1]C[-1] -> 2262772291156 | DG19: =FIB(RC[-101])+RC[-1]+R[-1]C+R[-1]C[-1] -> 8846211109372 | DH19: =FIB(RC[-101])+RC[-1]+R[-1]C+R[-1]C[-1] -> 31812503105032 | DI19: =FIB(RC[-101])+RC[-1]+R[-1]C+R[-1]C[-1] -> 106197578107192 | DJ19: =FIB(RC[-101])+RC[-1]+R[-1]C+R[-1]C[-1] -> 331620032878732 | DK19: =FIB(RC[-101])+RC[-1]+R[-1]C+R[-1]C[-1] -> 975036409435972 | DL19: =FIB(RC[-101])+RC[-1]+R[-1]C+R[-1]C[-1] -> 2.71460184064202E+15 | DM19: =FIB(RC[-101])+RC[-1]+R[-1]C+R[-1]C[-1] -> 7.1916133903432E+15 | DN19: =FIB(RC[-101])+RC[-1]+R[-1]C+R[-1]C[-1] -> 1.82072544054805E+16 | DO19: =FIB(RC[-101])+RC[-1]+R[-1]C+R[-1]C[-1] -> 4.42181022577116E+16 | DP19: =FIB(RC[-101])+RC[-1]+R[-1]C+R[-1]C[-1] -> 1.03357913833378E+17 | DQ19: =FIB(RC[-101])+RC[-1]+R[-1]C+R[-1]C[-1] -> 2.33219337736584E+17 | DR19: =FIB(RC[-101])+RC[-1]+R[-1]C+R[-1]C[-1] -> 5.09346370139113E+17 | DS19: =FIB(RC[-101])+RC[-1]+R[-1]C+R[-1]C[-1] -> 1.07924644489162E+18 | DT19: =FIB(RC[-101])+RC[-1]+R[-1]C+R[-1]C[-1] -> 2.22337993930655E+18 | DU19: =FIB(RC[-101])+RC[-1]+R[-1]C+R[-1]C[-1] -> 4.4619885827854E+18 | DV19: =FIB(RC[-101])+RC[-1]+R[-1]C+R[-1]C[-1] -> 8.73818784425669E+18 | DW19: =FIB(RC[-101])+RC[-1]+R[-1]C+R[-1]C[-1] -> 1.67254871079667E+19 | DX19: =FIB(RC[-101])+RC[-1]+R[-1]C+R[-1]C[-1] -> 3.13346632202015E+19 | DY19: =FIB(RC[-101])+RC[-1]+R[-1]C+R[-1]C[-1] -> 5.75346675379484E+19 | DZ19: =FIB(RC[-101])+RC[-1]+R[-1]C+R[-1]C[-1] -> 1.03660457554129E+20 | EA19: =FIB(RC[-101])+RC[-1]+R[-1]C+R[-1]C[-1] -> 1.83464742936776E+20 | EB19: =FIB(RC[-101])+RC[-1]+R[-1]C+R[-1]C[-1] -> 3.19290619847889E+20 | EC19: =FIB(RC[-101])+RC[-1]+R[-1]C+R[-1]C[-1] -> 5.46911248919123E+20 | ED19: =FIB(RC[-101])+RC[-1]+R[-1]C+R[-1]C[-1] -> 9.22818668034545E+20 | EE19: =FIB(RC[-101])+RC[-1]+R[-1]C+R[-1]C[-1] -> 1.53506946857674E+21 | EF19: =FIB(RC[-101])+RC[-1]+R[-1]C+R[-1]C[-1] -> 2.5192401443004E+21 | EG19: =FIB(RC[-101])+RC[-1]+R[-1]C+R[-1]C[-1] -> 4.0816476872028E+21 | EH19: =FIB(RC[-101])+RC[-1]+R[-1]C+R[-1]C[-1] -> 6.53280026003562E+21 | EI19: =FIB(RC[-101])+RC[-1]+R[-1]C+R[-1]C[-1] -> 1.03351203696795E+22 | EJ19: =FIB(RC[-101])+RC[-1]+R[-1]C+R[-1]C[-1] -> 1.61704067579358E+22 | EK19: =FIB(RC[-101])+RC[-1]+R[-1]C+R[-1]C[-1] -> 2.50343686115281E+22 | EL19: =FIB(RC[-101])+RC[-1]+R[-1]C+R[-1]C[-1] -> 3.83679977791213E+22 | EM19: =FIB(RC[-101])+RC[-1]+R[-1]C+R[-1]C[-1] -> 5.82386912119081E+22 | EN19: =FIB(RC[-101])+RC[-1]+R[-1]C+R[-1]C[-1] -> 8.75880809665975E+22 | EO19: =FIB(RC[-101])+RC[-1]+R[-1]C+R[-1]C[-1] -> 1.30568698133549E+23 | EP19: =FIB(RC[-101])+RC[-1]+R[-1]C+R[-1]C[-1] -> 1.92998164299369E+23 | EQ19: =FIB(RC[-101])+RC[-1]+R[-1]C+R[-1]C[-1] -> 2.82967902067095E+23 | ER19: =FIB(RC[-101])+RC[-1]+R[-1]C+R[-1]C[-1] -> 4.1165378583518E+23 | ES19: =FIB(RC[-101])+RC[-1]+R[-1]C+R[-1]C[-1] -> 5.94389197355315E+23 | ET19: =FIB(RC[-101])+RC[-1]+R[-1]C+R[-1]C[-1] -> 8.52077184127251E+23 | EU19: =FIB(RC[-101])+RC[-1]+R[-1]C+R[-1]C[-1] -> 1.21303852966237E+24 | EV19: =FIB(RC[-101])+RC[-1]+R[-1]C+R[-1]C[-1] -> 1.7154173490955E+24 | EW19: =FIB(RC[-101])+RC[-1]+R[-1]C+R[-1]C[-1] -> 2.4102962871022E+24 | EX19: =FIB(RC[-101])+RC[-1]+R[-1]C+R[-1]C[-1] -> 3.36571065614618E+24 | EY19: =FIB(RC[-101])+RC[-1]+R[-1]C+R[-1]C[-1] -> 4.67179624988566E+24 | EZ19: =FIB(RC[-101])+RC[-1]+R[-1]C+R[-1]C[-1] -> 6.4473606668666E+24 | FA19: =FIB(RC[-101])+RC[-1]+R[-1]C+R[-1]C[-1] -> 8.84823461460313E+24 | FB19: =FIB(RC[-101])+RC[-1]+R[-1]C+R[-1]C[-1] -> 1.20778399664008E+25 | FC19: =FIB(RC[-101])+RC[-1]+R[-1]C+R[-1]C[-1] -> 1.64005077894691E+25 | FD19: =FIB(RC[-101])+RC[-1]+R[-1]C+R[-1]C[-1] -> 2.21581950213831E+25 | FE19: =FIB(RC[-101])+RC[-1]+R[-1]C+R[-1]C[-1] -> 2.97913862561642E+25 | FF19: =FIB(RC[-101])+RC[-1]+R[-1]C+R[-1]C[-1] -> 3.98651310288698E+25 | FG19: =FIB(RC[-101])+RC[-1]+R[-1]C+R[-1]C[-1] -> 5.31013614466806E+25 | FH19: =FIB(RC[-101])+RC[-1]+R[-1]C+R[-1]C[-1] -> 7.04188650367796E+25 | FI19: =FIB(RC[-101])+RC[-1]+R[-1]C+R[-1]C[-1] -> 9.29825590234645E+25 | FJ19: =FIB(RC[-101])+RC[-1]+R[-1]C+R[-1]C[-1] -> 1.2226403148034E+26 | FK19: =FIB(RC[-101])+RC[-1]+R[-1]C+R[-1]C[-1] -> 1.60115689413602E+26 | FL19: =FIB(RC[-101])+RC[-1]+R[-1]C+R[-1]C[-1] -> 2.08861292328443E+26 | FM19: =FIB(RC[-101])+RC[-1]+R[-1]C+R[-1]C[-1] -> 2.71406161865644E+26 | FN19: =FIB(RC[-101])+RC[-1]+R[-1]C+R[-1]C[-1] -> 3.51370954599463E+26 | FO19: =FIB(RC[-101])+RC[-1]+R[-1]C+R[-1]C[-1] -> 4.53253578412993E+26 | FP19: =FIB(RC[-101])+RC[-1]+R[-1]C+R[-1]C[-1] -> 5.82624636947087E+26 | FQ19: =FIB(RC[-101])+RC[-1]+R[-1]C+R[-1]C[-1] -> 7.46362717143955E+26 | FR19: =FIB(RC[-101])+RC[-1]+R[-1]C+R[-1]C[-1] -> 9.52936909513926E+26 | FS19: =FIB(RC[-101])+RC[-1]+R[-1]C+R[-1]C[-1] -> 1.21274518923681E+27 | FT19: =FIB(RC[-101])+RC[-1]+R[-1]C+R[-1]C[-1] -> 1.5385187107439E+27 | FU19: =FIB(RC[-101])+RC[-1]+R[-1]C+R[-1]C[-1] -> 1.94580370381954E+27 | FV19: =FIB(RC[-101])+RC[-1]+R[-1]C+R[-1]C[-1] -> 2.45353453321895E+27 | FW19: =FIB(RC[-101])+RC[-1]+R[-1]C+R[-1]C[-1] -> 3.08471362722059E+27 | FX19: =FIB(RC[-101])+RC[-1]+R[-1]C+R[-1]C[-1] -> 3.86721642782582E+27 | FY19: =FIB(RC[-101])+RC[-1]+R[-1]C+R[-1]C[-1] -> 4.83474230474977E+27 | FZ19: =FIB(RC[-101])+RC[-1]+R[-1]C+R[-1]C[-1] -> 6.02793554940503E+27 | GA19: =FIB(RC[-101])+RC[-1]+R[-1]C+R[-1]C[-1] -> 7.4957041708868E+27 | GB19: =FIB(RC[-101])+RC[-1]+R[-1]C+R[-1]C[-1] -> 9.29676830571114E+27 | GC19: =FIB(RC[-101])+RC[-1]+R[-1]C+R[-1]C[-1] -> 1.15014746844633E+28 | GD19: =FIB(RC[-101])+RC[-1]+R[-1]C+R[-1]C[-1] -> 1.41939188353515E+28 | GE19: =FIB(RC[-101])+RC[-1]+R[-1]C+R[-1]C[-1] -> 1.74744226172952E+28 | GF19: =FIB(RC[-101])+RC[-1]+R[-1]C+R[-1]C[-1] -> 2.14624213411512E+28 | GG19: =FIB(RC[-101])+RC[-1]+R[-1]C+R[-1]C[-1] -> 2.62998222423554E+28 | GH19: =FIB(RC[-101])+RC[-1]+R[-1]C+R[-1]C[-1] -> 3.21549045054882E+28 | GI19: =FIB(RC[-101])+RC[-1]+R[-1]C+R[-1]C[-1] -> 3.9226840514141E+28 | GJ19: =FIB(RC[-101])+RC[-1]+R[-1]C+R[-1]C[-1] -> 4.77509286210677E+28 | GK19: =FIB(RC[-101])+RC[-1]+R[-1]C+R[-1]C[-1] -> 5.8004639627895E+28 | GL19: =FIB(RC[-101])+RC[-1]+R[-1]C+R[-1]C[-1] -> 7.03145924663477E+28 | GM19: =FIB(RC[-101])+RC[-1]+R[-1]C+R[-1]C[-1] -> 8.50645894324372E+28 | GN19: =FIB(RC[-101])+RC[-1]+R[-1]C+R[-1]C[-1] -> 1.02704857903546E+29 | GO19: =FIB(RC[-101])+RC[-1]+R[-1]C+R[-1]C[-1] -> 1.23762663942841E+29 | GP19: =FIB(RC[-101])+RC[-1]+R[-1]C+R[-1]C[-1] -> 1.48854483759026E+29 | GQ19: =FIB(RC[-101])+RC[-1]+R[-1]C+R[-1]C[-1] -> 1.78699941852444E+29 | GR19: =FIB(RC[-101])+RC[-1]+R[-1]C+R[-1]C[-1] -> 2.14137750069949E+29 | GS19: =FIB(RC[-101])+RC[-1]+R[-1]C+R[-1]C[-1] -> 2.56143909959801E+29
A20: 20 | B20: 20 | C20: 20 | D20: 20 | E20: 20 | F20: 20 | G20: 20 | H20: 20 | I20: 20 | J20: 20 | K20: 20 | L20: 20 | M20: 20 | N20: 20 | O20: 20 | P20: 20 | Q20: 20 | R20: 20 | S20: 20 | T20: 20 | U20: 20 | V20: 20 | W20: 20 | X20: 20 | Y20: 20 | Z20: 20 | AA20: 20 | AB20: 20 | AC20: 20 | AD20: 20 | AE20: 20 | AF20: 20 | AG20: 20 | AH20: 20 | AI20: 20 | AJ20: 20 | AK20: 20 | AL20: 20 | AM20: 20 | AN20: 20 | AO20: 20 | AP20: 20 | AQ20: 20 | AR20: 20 | AS20: 20 | AT20: 20 | AU20: 20 | AV20: 20 | AW20: 20 | AX20: 20 | AY20: 20 | AZ20: 20 | BA20: 20 | BB20: 20 | BC20: 20 | BD20: 20 | BE20: 20 | BF20: 20 | BG20: 20 | BH20: 20 | BI20: 20 | BJ20: 20 | BK20: 20 | BL20: 20 | BM20: 20 | BN20: 20 | BO20: 20 | BP20: 20 | BQ20: 20 | BR20: 20 | BS20: 20 | BT20: 20 | BU20: 20 | BV20: 20 | BW20: 20 | BX20: 20 | BY20: 20 | BZ20: 20 | CA20: 20 | CB20: 20 | CC20: 20 | CD20: 20 | CE20: 20 | CF20: 20 | CG20: 20 | CH20: 20 | CI20: 20 | CJ20: 20 | CK20: 20 | CL20: 20 | CM20: 20 | CN20: 20 | CO20: 20 | CP20: 20 | CQ20: 20 | CR20: 20 | CS20: 20 | CT20: 20 | CU20: 20 | CV20: 20 | CW20: 0 | CX20: =FIB(RC[-101])+RC[-1]+R[-1]C+R[-1]C[-1] -> 207974 | CY20: =FIB(RC[-101])+RC[-1]+R[-1]C+R[-1]C[-1] -> 4159480 | CZ20: =FIB(RC[-101])+RC[-1]+R[-1]C+R[-1]C[-1] -> 54281214 | DA20: =FIB(RC[-101])+RC[-1]+R[-1]C+R[-1]C[-1] -> 532413440 | DB20: =FIB(RC[-101])+RC[-1]+R[-1]C+R[-1]C[-1] -> 4196291398 | DC20: =FIB(RC[-101])+RC[-1]+R[-1]C+R[-1]C[-1] -> 27719606616 | DD20: =FIB(RC[-101])+RC[-1]+R[-1]C+R[-1]C[-1] -> 158034659198 | DE20: =FIB(RC[-101])+RC[-1]+R[-1]C+R[-1]C[-1] -> 794673645376 | DF20: =FIB(RC[-101])+RC[-1]+R[-1]C+R[-1]C[-1] -> 3584061072358 | DG20: =FIB(RC[-101])+RC[-1]+R[-1]C+R[-1]C[-1] -> 14693044483832 | DH20: =FIB(RC[-101])+RC[-1]+R[-1]C+R[-1]C[-1] -> 55351758709182 | DI20: =FIB(RC[-101])+RC[-1]+R[-1]C+R[-1]C[-1] -> 193361839932352 | DJ20: =FIB(RC[-101])+RC[-1]+R[-1]C+R[-1]C[-1] -> 631179450929222 | DK20: =FIB(RC[-101])+RC[-1]+R[-1]C+R[-1]C[-1] -> 1.93783589325487E+15 | DL20: =FIB(RC[-101])+RC[-1]+R[-1]C+R[-1]C[-1] -> 5.62747414334381E+15 | DM20: =FIB(RC[-101])+RC[-1]+R[-1]C+R[-1]C[-1] -> 1.553368937434E+16 | DN20: =FIB(RC[-101])+RC[-1]+R[-1]C+R[-1]C[-1] -> 4.09325571701746E+16 | DO20: =FIB(RC[-101])+RC[-1]+R[-1]C+R[-1]C[-1] -> 1.03357913833378E+17 | DP20: =FIB(RC[-101])+RC[-1]+R[-1]C+R[-1]C[-1] -> 2.50933929924478E+17 | DQ20: =FIB(RC[-101])+RC[-1]+R[-1]C+R[-1]C[-1] -> 5.8751118149445E+17 | DR20: =FIB(RC[-101])+RC[-1]+R[-1]C+R[-1]C[-1] -> 1.33007688937016E+18 | DS20: =FIB(RC[-101])+RC[-1]+R[-1]C+R[-1]C[-1] -> 2.9186697044009E+18 | DT20: =FIB(RC[-101])+RC[-1]+R[-1]C+R[-1]C[-1] -> 6.22129608859908E+18 | DU20: =FIB(RC[-101])+RC[-1]+R[-1]C+R[-1]C[-1] -> 1.2906664610691E+19 | DV20: =FIB(RC[-101])+RC[-1]+R[-1]C+R[-1]C[-1] -> 2.61068410377332E+19 | DW20: =FIB(RC[-101])+RC[-1]+R[-1]C+R[-1]C[-1] -> 5.15705159899565E+19 | DX20: =FIB(RC[-101])+RC[-1]+R[-1]C+R[-1]C[-1] -> 9.96306663181247E+19 | DY20: =FIB(RC[-101])+RC[-1]+R[-1]C+R[-1]C[-1] -> 1.88499997076275E+20 | DZ20: =FIB(RC[-101])+RC[-1]+R[-1]C+R[-1]C[-1] -> 3.49695122168352E+20 | EA20: =FIB(RC[-101])+RC[-1]+R[-1]C+R[-1]C[-1] -> 6.36820322659256E+20 | EB20: =FIB(RC[-101])+RC[-1]+R[-1]C+R[-1]C[-1] -> 1.13957568544392E+21 | EC20: =FIB(RC[-101])+RC[-1]+R[-1]C+R[-1]C[-1] -> 2.00577755421093E+21 | ED20: =FIB(RC[-101])+RC[-1]+R[-1]C+R[-1]C[-1] -> 3.4755074711646E+21 | EE20: =FIB(RC[-101])+RC[-1]+R[-1]C+R[-1]C[-1] -> 5.93339560777589E+21 | EF20: =FIB(RC[-101])+RC[-1]+R[-1]C+R[-1]C[-1] -> 9.98770522065303E+21 | EG20: =FIB(RC[-101])+RC[-1]+R[-1]C+R[-1]C[-1] -> 1.65885930521562E+22 | EH20: =FIB(RC[-101])+RC[-1]+R[-1]C+R[-1]C[-1] -> 2.72030409993946E+22 | EI20: =FIB(RC[-101])+RC[-1]+R[-1]C+R[-1]C[-1] -> 4.40709616291098E+22 | EJ20: =FIB(RC[-101])+RC[-1]+R[-1]C+R[-1]C[-1] -> 7.05764887567251E+22 | EK20: =FIB(RC[-101])+RC[-1]+R[-1]C+R[-1]C[-1] -> 1.11781264126189E+23 | EL20: =FIB(RC[-101])+RC[-1]+R[-1]C+R[-1]C[-1] -> 1.75183630516838E+23 | EM20: =FIB(RC[-101])+RC[-1]+R[-1]C+R[-1]C[-1] -> 2.71790319507868E+23 | EN20: =FIB(RC[-101])+RC[-1]+R[-1]C+R[-1]C[-1] -> 4.17617091686373E+23 | EO20: =FIB(RC[-101])+RC[-1]+R[-1]C+R[-1]C[-1] -> 6.3577387078652E+23 | EP20: =FIB(RC[-101])+RC[-1]+R[-1]C+R[-1]C[-1] -> 9.59340733219438E+23 | EQ20: =FIB(RC[-101])+RC[-1]+R[-1]C+R[-1]C[-1] -> 1.4353067995859E+24 | ER20: =FIB(RC[-101])+RC[-1]+R[-1]C+R[-1]C[-1] -> 2.12992848748818E+24 | ES20: =FIB(RC[-101])+RC[-1]+R[-1]C+R[-1]C[-1] -> 3.13597147067867E+24 | ET20: =FIB(RC[-101])+RC[-1]+R[-1]C+R[-1]C[-1] -> 4.58243785216124E+24 | EU20: =FIB(RC[-101])+RC[-1]+R[-1]C+R[-1]C[-1] -> 6.64755356595087E+24 | EV20: =FIB(RC[-101])+RC[-1]+R[-1]C+R[-1]C[-1] -> 9.57600944470874E+24 | EW20: =FIB(RC[-101])+RC[-1]+R[-1]C+R[-1]C[-1] -> 1.37017230809064E+25 | EX20: =FIB(RC[-101])+RC[-1]+R[-1]C+R[-1]C[-1] -> 1.94777300241548E+25 | EY20: =FIB(RC[-101])+RC[-1]+R[-1]C+R[-1]C[-1] -> 2.75152369301867E+25 | EZ20: =FIB(RC[-101])+RC[-1]+R[-1]C+R[-1]C[-1] -> 3.86343938469389E+25 | FA20: =FIB(RC[-101])+RC[-1]+R[-1]C+R[-1]C[-1] -> 5.39299891284086E+25 | FB20: =FIB(RC[-101])+RC[-1]+R[-1]C+R[-1]C[-1] -> 7.48560637094126E+25 | FC20: =FIB(RC[-101])+RC[-1]+R[-1]C+R[-1]C[-1] -> 1.03334411465282E+26 | FD20: =FIB(RC[-101])+RC[-1]+R[-1]C+R[-1]C[-1] -> 1.41893114276135E+26 | FE20: =FIB(RC[-101])+RC[-1]+R[-1]C+R[-1]C[-1] -> 1.93842695553682E+26 | FF20: =FIB(RC[-101])+RC[-1]+R[-1]C+R[-1]C[-1] -> 2.63499212838716E+26 | FG20: =FIB(RC[-101])+RC[-1]+R[-1]C+R[-1]C[-1] -> 3.56465705314266E+26 | FH20: =FIB(RC[-101])+RC[-1]+R[-1]C+R[-1]C[-1] -> 4.79985931797727E+26 | FI20: =FIB(RC[-101])+RC[-1]+R[-1]C+R[-1]C[-1] -> 6.43387355857971E+26 | FJ20: =FIB(RC[-101])+RC[-1]+R[-1]C+R[-1]C[-1] -> 8.58633946361775E+26 | FK20: =FIB(RC[-101])+RC[-1]+R[-1]C+R[-1]C[-1] -> 1.14101366725572E+27 | FL20: =FIB(RC[-101])+RC[-1]+R[-1]C+R[-1]C[-1] -> 1.50999064899776E+27 | FM20: =FIB(RC[-101])+RC[-1]+R[-1]C+R[-1]C[-1] -> 1.99025810319185E+27 | FN20: =FIB(RC[-101])+RC[-1]+R[-1]C+R[-1]C[-1] -> 2.61303521965696E+27 | FO20: =FIB(RC[-101])+RC[-1]+R[-1]C+R[-1]C[-1] -> 3.41765975266941E+27 | FP20: =FIB(RC[-101])+RC[-1]+R[-1]C+R[-1]C[-1] -> 4.45353796802949E+27 | FQ20: =FIB(RC[-101])+RC[-1]+R[-1]C+R[-1]C[-1] -> 5.78252532212054E+27 | FR20: =FIB(RC[-101])+RC[-1]+R[-1]C+R[-1]C[-1] -> 7.48182494877842E+27 | FS20: =FIB(RC[-101])+RC[-1]+R[-1]C+R[-1]C[-1] -> 9.64750704752915E+27 | FT20: =FIB(RC[-101])+RC[-1]+R[-1]C+R[-1]C[-1] -> 1.23987709475099E+28 | FU20: =FIB(RC[-101])+RC[-1]+R[-1]C+R[-1]C[-1] -> 1.58830933620733E+28 | FV20: =FIB(RC[-101])+RC[-1]+R[-1]C+R[-1]C[-1] -> 2.02824315991118E+28 | FW20: =FIB(RC[-101])+RC[-1]+R[-1]C+R[-1]C[-1] -> 2.58206797595513E+28 | FX20: =FIB(RC[-101])+RC[-1]+R[-1]C+R[-1]C[-1] -> 3.27726098145977E+28 | FY20: =FIB(RC[-101])+RC[-1]+R[-1]C+R[-1]C[-1] -> 4.14745685471734E+28 | FZ20: =FIB(RC[-101])+RC[-1]+R[-1]C+R[-1]C[-1] -> 5.23372464013282E+28 | GA20: =FIB(RC[-101])+RC[-1]+R[-1]C+R[-1]C[-1] -> 6.586088612162E+28 | GB20: =FIB(RC[-101])+RC[-1]+R[-1]C+R[-1]C[-1] -> 8.26533585982179E+28 | GC20: =FIB(RC[-101])+RC[-1]+R[-1]C+R[-1]C[-1] -> 1.03451601588392E+29 | GD20: =FIB(RC[-101])+RC[-1]+R[-1]C+R[-1]C[-1] -> 1.29146995108207E+29 | GE20: =FIB(RC[-101])+RC[-1]+R[-1]C+R[-1]C[-1] -> 1.60815336560854E+29 | GF20: =FIB(RC[-101])+RC[-1]+R[-1]C+R[-1]C[-1] -> 1.997521805193E+29 | GG20: =FIB(RC[-101])+RC[-1]+R[-1]C+R[-1]C[-1] -> 2.47514424102807E+29 | GH20: =FIB(RC[-101])+RC[-1]+R[-1]C+R[-1]C[-1] -> 3.0596915085065E+29 | GI20: =FIB(RC[-101])+RC[-1]+R[-1]C+R[-1]C[-1] -> 3.7735089587028E+29 | GJ20: =FIB(RC[-101])+RC[-1]+R[-1]C+R[-1]C[-1] -> 4.64328665005488E+29 | GK20: =FIB(RC[-101])+RC[-1]+R[-1]C+R[-1]C[-1] -> 5.70084233254451E+29 | GL20: =FIB(RC[-101])+RC[-1]+R[-1]C+R[-1]C[-1] -> 6.98403465348694E+29 | GM20: =FIB(RC[-101])+RC[-1]+R[-1]C+R[-1]C[-1] -> 8.53782647247479E+29 | GN20: =FIB(RC[-101])+RC[-1]+R[-1]C+R[-1]C[-1] -> 1.04155209458346E+30 | GO20: =FIB(RC[-101])+RC[-1]+R[-1]C+R[-1]C[-1] -> 1.26801961642985E+30 | GP20: =FIB(RC[-101])+RC[-1]+R[-1]C+R[-1]C[-1] -> 1.54063676413172E+30 | GQ20: =FIB(RC[-101])+RC[-1]+R[-1]C+R[-1]C[-1] -> 1.86819118974319E+30 | GR20: =FIB(RC[-101])+RC[-1]+R[-1]C+R[-1]C[-1] -> 2.26102888166558E+30 | GS20: =FIB(RC[-101])+RC[-1]+R[-1]C+R[-1]C[-1] -> 2.73131054169533E+30
A21: 20 | B21: 20 | C21: 20 | D21: 20 | E21: 20 | F21: 20 | G21: 20 | H21: 20 | I21: 20 | J21: 20 | K21: 20 | L21: 20 | M21: 20 | N21: 20 | O21: 20 | P21: 20 | Q21: 20 | R21: 20 | S21: 20 | T21: 20 | U21: 20 | V21: 20 | W21: 20 | X21: 20 | Y21: 20 | Z21: 20 | AA21: 20 | AB21: 20 | AC21: 20 | AD21: 20 | AE21: 20 | AF21: 20 | AG21: 20 | AH21: 20 | AI21: 20 | AJ21: 20 | AK21: 20 | AL21: 20 | AM21: 20 | AN21: 20 | AO21: 20 | AP21: 20 | AQ21: 20 | AR21: 20 | AS21: 20 | AT21: 20 | AU21: 20 | AV21: 20 | AW21: 20 | AX21: 20 | AY21: 20 | AZ21: 20 | BA21: 20 | BB21: 20 | BC21: 20 | BD21: 20 | BE21: 20 | BF21: 20 | BG21: 20 | BH21: 20 | BI21: 20 | BJ21: 20 | BK21: 20 | BL21: 20 | BM21: 20 | BN21: 20 | BO21: 20 | BP21: 20 | BQ21: 20 | BR21: 20 | BS21: 20 | BT21: 20 | BU21: 20 | BV21: 20 | BW21: 20 | BX21: 20 | BY21: 20 | BZ21: 20 | CA21: 20 | CB21: 20 | CC21: 20 | CD21: 20 | CE21: 20 | CF21: 20 | CG21: 20 | CH21: 20 | CI21: 20 | CJ21: 20 | CK21: 20 | CL21: 20 | CM21: 20 | CN21: 20 | CO21: 20 | CP21: 20 | CQ21: 20 | CR21: 20 | CS21: 20 | CT21: 20 | CU21: 20 | CV21: 20 | CW21: 0 | CX21: =FIB(RC[-101])+RC[-1]+R[-1]C+R[-1]C[-1] -> 218920 | CY21: =FIB(RC[-101])+RC[-1]+R[-1]C+R[-1]C[-1] -> 4597320 | CZ21: =FIB(RC[-101])+RC[-1]+R[-1]C+R[-1]C[-1] -> 63048960 | DA21: =FIB(RC[-101])+RC[-1]+R[-1]C+R[-1]C[-1] -> 649754560 | DB21: =FIB(RC[-101])+RC[-1]+R[-1]C+R[-1]C[-1] -> 5378470344 | DC21: =FIB(RC[-101])+RC[-1]+R[-1]C+R[-1]C[-1] -> 37294379304 | DD21: =FIB(RC[-101])+RC[-1]+R[-1]C+R[-1]C[-1] -> 223048656064 | DE21: =FIB(RC[-101])+RC[-1]+R[-1]C+R[-1]C[-1] -> 1175756971584 | DF21: =FIB(RC[-101])+RC[-1]+R[-1]C+R[-1]C[-1] -> 5554491700264 | DG21: =FIB(RC[-101])+RC[-1]+R[-1]C+R[-1]C[-1] -> 23831597267400 | DH21: =FIB(RC[-101])+RC[-1]+R[-1]C+R[-1]C[-1] -> 93876400471360 | DI21: =FIB(RC[-101])+RC[-1]+R[-1]C+R[-1]C[-1] -> 342589999123840 | DJ21: =FIB(RC[-101])+RC[-1]+R[-1]C+R[-1]C[-1] -> 1.16713128999636E+15 | DK21: =FIB(RC[-101])+RC[-1]+R[-1]C+R[-1]C[-1] -> 3.7361466341914E+15 | DL21: =FIB(RC[-101])+RC[-1]+R[-1]C+R[-1]C[-1] -> 1.1301456670801E+16 | DM21: =FIB(RC[-101])+RC[-1]+R[-1]C+R[-1]C[-1] -> 3.24626201884957E+16 | DN21: =FIB(RC[-101])+RC[-1]+R[-1]C+R[-1]C[-1] -> 8.89288667330212E+16 | DO21: =FIB(RC[-101])+RC[-1]+R[-1]C+R[-1]C[-1] -> 2.33219337736584E+17 | DP21: =FIB(RC[-101])+RC[-1]+R[-1]C+R[-1]C[-1] -> 5.8751118149445E+17 | DQ21: =FIB(RC[-101])+RC[-1]+R[-1]C+R[-1]C[-1] -> 1.42595629291339E+18 | DR21: =FIB(RC[-101])+RC[-1]+R[-1]C+R[-1]C[-1] -> 3.34354436377801E+18 | DS21: =FIB(RC[-101])+RC[-1]+R[-1]C+R[-1]C[-1] -> 7.59229095754908E+18 | DT21: =FIB(RC[-101])+RC[-1]+R[-1]C+R[-1]C[-1] -> 1.67322567505491E+19 | DU21: =FIB(RC[-101])+RC[-1]+R[-1]C+R[-1]C[-1] -> 3.58602174498392E+19 | DV21: =FIB(RC[-101])+RC[-1]+R[-1]C+R[-1]C[-1] -> 7.48737230982634E+19 | DW21: =FIB(RC[-101])+RC[-1]+R[-1]C+R[-1]C[-1] -> 1.52551080125953E+20 | DX21: =FIB(RC[-101])+RC[-1]+R[-1]C+R[-1]C[-1] -> 3.03752262434034E+20 | DY21: =FIB(RC[-101])+RC[-1]+R[-1]C+R[-1]C[-1] -> 5.91882925828434E+20 | DZ21: =FIB(RC[-101])+RC[-1]+R[-1]C+R[-1]C[-1] -> 1.13007804507306E+21 | EA21: =FIB(RC[-101])+RC[-1]+R[-1]C+R[-1]C[-1] -> 2.11659348990067E+21 | EB21: =FIB(RC[-101])+RC[-1]+R[-1]C+R[-1]C[-1] -> 3.89298949800384E+21 | EC21: =FIB(RC[-101])+RC[-1]+R[-1]C+R[-1]C[-1] -> 7.03834273765869E+21 | ED21: =FIB(RC[-101])+RC[-1]+R[-1]C+R[-1]C[-1] -> 1.25196277630342E+22 | EE21: =FIB(RC[-101])+RC[-1]+R[-1]C+R[-1]C[-1] -> 2.19285308419747E+22 | EF21: =FIB(RC[-101])+RC[-1]+R[-1]C+R[-1]C[-1] -> 3.78496316704036E+22 | EG21: =FIB(RC[-101])+RC[-1]+R[-1]C+R[-1]C[-1] -> 6.44259299432129E+22 | EH21: =FIB(RC[-101])+RC[-1]+R[-1]C+R[-1]C[-1] -> 1.08217563994764E+23 | EI21: =FIB(RC[-101])+RC[-1]+R[-1]C+R[-1]C[-1] -> 1.79491566623268E+23 | EJ21: =FIB(RC[-101])+RC[-1]+R[-1]C+R[-1]C[-1] -> 2.94139017009103E+23 | EK21: =FIB(RC[-101])+RC[-1]+R[-1]C+R[-1]C[-1] -> 4.76496769892017E+23 | EL21: =FIB(RC[-101])+RC[-1]+R[-1]C+R[-1]C[-1] -> 7.63461664535044E+23 | EM21: =FIB(RC[-101])+RC[-1]+R[-1]C+R[-1]C[-1] -> 1.21043561455975E+24 | EN21: =FIB(RC[-101])+RC[-1]+R[-1]C+R[-1]C[-1] -> 1.89984302575399E+24 | EO21: =FIB(RC[-101])+RC[-1]+R[-1]C+R[-1]C[-1] -> 2.95323398822689E+24 | EP21: =FIB(RC[-101])+RC[-1]+R[-1]C+R[-1]C[-1] -> 4.54834859223284E+24 | EQ21: =FIB(RC[-101])+RC[-1]+R[-1]C+R[-1]C[-1] -> 6.94299612503818E+24 | ER21: =FIB(RC[-101])+RC[-1]+R[-1]C+R[-1]C[-1] -> 1.05082314121123E+25 | ES21: =FIB(RC[-101])+RC[-1]+R[-1]C+R[-1]C[-1] -> 1.57741313702791E+25 | ET21: =FIB(RC[-101])+RC[-1]+R[-1]C+R[-1]C[-1] -> 2.3492540693119E+25 | EU21: =FIB(RC[-101])+RC[-1]+R[-1]C+R[-1]C[-1] -> 3.47225321112311E+25 | EV21: =FIB(RC[-101])+RC[-1]+R[-1]C+R[-1]C[-1] -> 5.09460951218907E+25 | EW21: =FIB(RC[-101])+RC[-1]+R[-1]C+R[-1]C[-1] -> 7.42238276475059E+25 | EX21: =FIB(RC[-101])+RC[-1]+R[-1]C+R[-1]C[-1] -> 1.07403280752567E+26 | EY21: =FIB(RC[-101])+RC[-1]+R[-1]C+R[-1]C[-1] -> 1.54396247706909E+26 | EZ21: =FIB(RC[-101])+RC[-1]+R[-1]C+R[-1]C[-1] -> 2.20545878484034E+26 | FA21: =FIB(RC[-101])+RC[-1]+R[-1]C+R[-1]C[-1] -> 3.13110261459382E+26 | FB21: =FIB(RC[-101])+RC[-1]+R[-1]C+R[-1]C[-1] -> 4.41896314297203E+26 | FC21: =FIB(RC[-101])+RC[-1]+R[-1]C+R[-1]C[-1] -> 6.20086789471898E+26 | FD21: =FIB(RC[-101])+RC[-1]+R[-1]C+R[-1]C[-1] -> 8.65314315213315E+26 | FE21: =FIB(RC[-101])+RC[-1]+R[-1]C+R[-1]C[-1] -> 1.20105012504313E+27 | FF21: =FIB(RC[-101])+RC[-1]+R[-1]C+R[-1]C[-1] -> 1.65839203343553E+27 | FG21: =FIB(RC[-101])+RC[-1]+R[-1]C+R[-1]C[-1] -> 2.27835695158851E+27 | FH21: =FIB(RC[-101])+RC[-1]+R[-1]C+R[-1]C[-1] -> 3.11480858870051E+27 | FI21: =FIB(RC[-101])+RC[-1]+R[-1]C+R[-1]C[-1] -> 4.2381818763562E+27 | FJ21: =FIB(RC[-101])+RC[-1]+R[-1]C+R[-1]C[-1] -> 5.74020317857595E+27 | FK21: =FIB(RC[-101])+RC[-1]+R[-1]C+R[-1]C[-1] -> 7.73985079219344E+27 | FL21: =FIB(RC[-101])+RC[-1]+R[-1]C+R[-1]C[-1] -> 1.03908551084469E+28 | FM21: =FIB(RC[-101])+RC[-1]+R[-1]C+R[-1]C[-1] -> 1.38911038606365E+28 | FN21: =FIB(RC[-101])+RC[-1]+R[-1]C+R[-1]C[-1] -> 1.84943971834853E+28 | FO21: =FIB(RC[-101])+RC[-1]+R[-1]C+R[-1]C[-1] -> 2.45250921558117E+28 | FP21: =FIB(RC[-101])+RC[-1]+R[-1]C+R[-1]C[-1] -> 3.23962898765106E+28 | FQ21: =FIB(RC[-101])+RC[-1]+R[-1]C+R[-1]C[-1] -> 4.26323531666606E+28 | FR21: =FIB(RC[-101])+RC[-1]+R[-1]C+R[-1]C[-1] -> 5.58967034375596E+28 | FS21: =FIB(RC[-101])+RC[-1]+R[-1]C+R[-1]C[-1] -> 7.30260354338672E+28 | FT21: =FIB(RC[-101])+RC[-1]+R[-1]C+R[-1]C[-1] -> 9.50723134289062E+28 | FU21: =FIB(RC[-101])+RC[-1]+R[-1]C+R[-1]C[-1] -> 1.23354177738489E+29 | FV21: =FIB(RC[-101])+RC[-1]+R[-1]C+R[-1]C[-1] -> 1.59519702699674E+29 | FW21: =FIB(RC[-101])+RC[-1]+R[-1]C+R[-1]C[-1] -> 2.05622814058338E+29 | FX21: =FIB(RC[-101])+RC[-1]+R[-1]C+R[-1]C[-1] -> 2.64216103632487E+29 | FY21: =FIB(RC[-101])+RC[-1]+R[-1]C+R[-1]C[-1] -> 3.38463281994258E+29 | FZ21: =FIB(RC[-101])+RC[-1]+R[-1]C+R[-1]C[-1] -> 4.32275096942759E+29 | GA21: =FIB(RC[-101])+RC[-1]+R[-1]C+R[-1]C[-1] -> 5.50473229465707E+29 | GB21: =FIB(RC[-101])+RC[-1]+R[-1]C+R[-1]C[-1] -> 6.98987474185545E+29 | GC21: =FIB(RC[-101])+RC[-1]+R[-1]C+R[-1]C[-1] -> 8.85092434372156E+29 | GD21: =FIB(RC[-101])+RC[-1]+R[-1]C+R[-1]C[-1] -> 1.11769103106875E+30 | GE21: =FIB(RC[-101])+RC[-1]+R[-1]C+R[-1]C[-1] -> 1.40765336273782E+30 | GF21: =FIB(RC[-101])+RC[-1]+R[-1]C+R[-1]C[-1] -> 1.76822087981797E+30 | GG21: =FIB(RC[-101])+RC[-1]+R[-1]C+R[-1]C[-1] -> 2.21548748444008E+30 | GH21: =FIB(RC[-101])+RC[-1]+R[-1]C+R[-1]C[-1] -> 2.76897105939353E+30 | GI21: =FIB(RC[-101])+RC[-1]+R[-1]C+R[-1]C[-1] -> 3.45229110611446E+30 | GJ21: =FIB(RC[-101])+RC[-1]+R[-1]C+R[-1]C[-1] -> 4.29397066699023E+30 | GK21: =FIB(RC[-101])+RC[-1]+R[-1]C+R[-1]C[-1] -> 5.32838356525017E+30 | GL21: =FIB(RC[-101])+RC[-1]+R[-1]C+R[-1]C[-1] -> 6.59687126385332E+30 | GM21: =FIB(RC[-101])+RC[-1]+R[-1]C+R[-1]C[-1] -> 8.14905737644949E+30 | GN21: =FIB(RC[-101])+RC[-1]+R[-1]C+R[-1]C[-1] -> 1.00443921182804E+31 | GO21: =FIB(RC[-101])+RC[-1]+R[-1]C+R[-1]C[-1] -> 1.23539638292937E+31 | GP21: =FIB(RC[-101])+RC[-1]+R[-1]C+R[-1]C[-1] -> 1.51626202098553E+31 | GQ21: =FIB(RC[-101])+RC[-1]+R[-1]C+R[-1]C[-1] -> 1.85714481637302E+31 | GR21: =FIB(RC[-101])+RC[-1]+R[-1]C+R[-1]C[-1] -> 2.2700668235139E+31 | GS21: =FIB(RC[-101])+RC[-1]+R[-1]C+R[-1]C[-1] -> 2.76930076584999E+31
A22: 20 | B22: 20 | C22: 20 | D22: 20 | E22: 20 | F22: 20 | G22: 20 | H22: 20 | I22: 20 | J22: 20 | K22: 20 | L22: 20 | M22: 20 | N22: 20 | O22: 20 | P22: 20 | Q22: 20 | R22: 20 | S22: 20 | T22: 20 | U22: 20 | V22: 20 | W22: 20 | X22: 20 | Y22: 20 | Z22: 20 | AA22: 20 | AB22: 20 | AC22: 20 | AD22: 20 | AE22: 20 | AF22: 20 | AG22: 20 | AH22: 20 | AI22: 20 | AJ22: 20 | AK22: 20 | AL22: 20 | AM22: 20 | AN22: 20 | AO22: 20 | AP22: 20 | AQ22: 20 | AR22: 20 | AS22: 20 | AT22: 20 | AU22: 20 | AV22: 20 | AW22: 20 | AX22: 20 | AY22: 20 | AZ22: 20 | BA22: 20 | BB22: 20 | BC22: 20 | BD22: 20 | BE22: 20 | BF22: 20 | BG22: 20 | BH22: 20 | BI22: 20 | BJ22: 20 | BK22: 20 | BL22: 20 | BM22: 20 | BN22: 20 | BO22: 20 | BP22: 20 | BQ22: 20 | BR22: 20 | BS22: 20 | BT22: 20 | BU22: 20 | BV22: 20 | BW22: 20 | BX22: 20 | BY22: 20 | BZ22: 20 | CA22: 20 | CB22: 20 | CC22: 20 | CD22: 20 | CE22: 20 | CF22: 20 | CG22: 20 | CH22: 20 | CI22: 20 | CJ22: 20 | CK22: 20 | CL22: 20 | CM22: 20 | CN22: 20 | CO22: 20 | CP22: 20 | CQ22: 20 | CR22: 20 | CS22: 20 | CT22: 20 | CU22: 20 | CV22: 20 | CW22: 0 | CX22: =FIB(RC[-101])+RC[-1]+R[-1]C+R[-1]C[-1] -> 229866 | CY22: =FIB(RC[-101])+RC[-1]+R[-1]C+R[-1]C[-1] -> 5057052 | CZ22: =FIB(RC[-101])+RC[-1]+R[-1]C+R[-1]C[-1] -> 72714278 | DA22: =FIB(RC[-101])+RC[-1]+R[-1]C+R[-1]C[-1] -> 785528744 | DB22: =FIB(RC[-101])+RC[-1]+R[-1]C+R[-1]C[-1] -> 6813764594 | DC22: =FIB(RC[-101])+RC[-1]+R[-1]C+R[-1]C[-1] -> 49486625188 | DD22: =FIB(RC[-101])+RC[-1]+R[-1]C+R[-1]C[-1] -> 309829671502 | DE22: =FIB(RC[-101])+RC[-1]+R[-1]C+R[-1]C[-1] -> 1708635310096 | DF22: =FIB(RC[-101])+RC[-1]+R[-1]C+R[-1]C[-1] -> 8438883992890 | DG22: =FIB(RC[-101])+RC[-1]+R[-1]C+R[-1]C[-1] -> 37824972971500 | DH22: =FIB(RC[-101])+RC[-1]+R[-1]C+R[-1]C[-1] -> 155532970721206 | DI22: =FIB(RC[-101])+RC[-1]+R[-1]C+R[-1]C[-1] -> 591999370327352 | DJ22: =FIB(RC[-101])+RC[-1]+R[-1]C+R[-1]C[-1] -> 2.1017206594585E+15 | DK22: =FIB(RC[-101])+RC[-1]+R[-1]C+R[-1]C[-1] -> 7.0049985836572E+15 | DL22: =FIB(RC[-101])+RC[-1]+R[-1]C+R[-1]C[-1] -> 2.20426018886606E+16 | DM22: =FIB(RC[-101])+RC[-1]+R[-1]C+R[-1]C[-1] -> 6.58066787479683E+16 | DN22: =FIB(RC[-101])+RC[-1]+R[-1]C+R[-1]C[-1] -> 1.87198165669496E+17 | DO22: =FIB(RC[-101])+RC[-1]+R[-1]C+R[-1]C[-1] -> 5.09346370139113E+17 | DP22: =FIB(RC[-101])+RC[-1]+R[-1]C+R[-1]C[-1] -> 1.33007688937016E+18 | DQ22: =FIB(RC[-101])+RC[-1]+R[-1]C+R[-1]C[-1] -> 3.34354436377801E+18 | DR22: =FIB(RC[-101])+RC[-1]+R[-1]C+R[-1]C[-1] -> 8.11304502046942E+18 | DS22: =FIB(RC[-101])+RC[-1]+R[-1]C+R[-1]C[-1] -> 1.90488803417965E+19 | DT22: =FIB(RC[-101])+RC[-1]+R[-1]C+R[-1]C[-1] -> 4.33734280498947E+19 | DU22: =FIB(RC[-101])+RC[-1]+R[-1]C+R[-1]C[-1] -> 9.59659022502829E+19 | DV22: =FIB(RC[-101])+RC[-1]+R[-1]C+R[-1]C[-1] -> 2.06699842798386E+20 | DW22: =FIB(RC[-101])+RC[-1]+R[-1]C+R[-1]C[-1] -> 4.34124646022602E+20 | DX22: =FIB(RC[-101])+RC[-1]+R[-1]C+R[-1]C[-1] -> 8.90427988582589E+20 | DY22: =FIB(RC[-101])+RC[-1]+R[-1]C+R[-1]C[-1] -> 1.78606317684506E+21 | DZ22: =FIB(RC[-101])+RC[-1]+R[-1]C+R[-1]C[-1] -> 3.50802414774655E+21 | EA22: =FIB(RC[-101])+RC[-1]+R[-1]C+R[-1]C[-1] -> 6.75469568272028E+21 | EB22: =FIB(RC[-101])+RC[-1]+R[-1]C+R[-1]C[-1] -> 1.27642786706248E+22 | EC22: =FIB(RC[-101])+RC[-1]+R[-1]C+R[-1]C[-1] -> 2.36956109062873E+22 | ED22: =FIB(RC[-101])+RC[-1]+R[-1]C+R[-1]C[-1] -> 4.32535814069803E+22 | EE22: =FIB(RC[-101])+RC[-1]+R[-1]C+R[-1]C[-1] -> 7.77017400119892E+22 | EF22: =FIB(RC[-101])+RC[-1]+R[-1]C+R[-1]C[-1] -> 1.37479902524368E+23 | EG22: =FIB(RC[-101])+RC[-1]+R[-1]C+R[-1]C[-1] -> 2.39755464137984E+23 | EH22: =FIB(RC[-101])+RC[-1]+R[-1]C+R[-1]C[-1] -> 4.12398958075961E+23 | EI22: =FIB(RC[-101])+RC[-1]+R[-1]C+R[-1]C[-1] -> 7.00108088693993E+23 | EJ22: =FIB(RC[-101])+RC[-1]+R[-1]C+R[-1]C[-1] -> 1.17373867232636E+24 | EK22: =FIB(RC[-101])+RC[-1]+R[-1]C+R[-1]C[-1] -> 1.94437445922748E+24 | EL22: =FIB(RC[-101])+RC[-1]+R[-1]C+R[-1]C[-1] -> 3.18433289365455E+24 | EM22: =FIB(RC[-101])+RC[-1]+R[-1]C+R[-1]C[-1] -> 5.15823017274934E+24 | EN22: =FIB(RC[-101])+RC[-1]+R[-1]C+R[-1]C[-1] -> 8.26850881306308E+24 | EO22: =FIB(RC[-101])+RC[-1]+R[-1]C+R[-1]C[-1] -> 1.3121585827044E+25 | EP22: =FIB(RC[-101])+RC[-1]+R[-1]C+R[-1]C[-1] -> 2.06231684075037E+25 | EQ22: =FIB(RC[-101])+RC[-1]+R[-1]C+R[-1]C[-1] -> 3.21145131247747E+25 | ER22: =FIB(RC[-101])+RC[-1]+R[-1]C+R[-1]C[-1] -> 4.95657406619252E+25 | ES22: =FIB(RC[-101])+RC[-1]+R[-1]C+R[-1]C[-1] -> 7.58481034443165E+25 | ET22: =FIB(RC[-101])+RC[-1]+R[-1]C+R[-1]C[-1] -> 1.15114775507715E+26 | EU22: =FIB(RC[-101])+RC[-1]+R[-1]C+R[-1]C[-1] -> 1.73329848312065E+26 | EV22: =FIB(RC[-101])+RC[-1]+R[-1]C+R[-1]C[-1] -> 2.58998475545187E+26 | EW22: =FIB(RC[-101])+RC[-1]+R[-1]C+R[-1]C[-1] -> 3.84168398314583E+26 | EX22: =FIB(RC[-101])+RC[-1]+R[-1]C+R[-1]C[-1] -> 5.65795506714656E+26 | EY22: =FIB(RC[-101])+RC[-1]+R[-1]C+R[-1]C[-1] -> 8.27595035174132E+26 | EZ22: =FIB(RC[-101])+RC[-1]+R[-1]C+R[-1]C[-1] -> 1.20253716136507E+27 | FA22: =FIB(RC[-101])+RC[-1]+R[-1]C+R[-1]C[-1] -> 1.73619330130849E+27 | FB22: =FIB(RC[-101])+RC[-1]+R[-1]C+R[-1]C[-1] -> 2.49119987706508E+27 | FC22: =FIB(RC[-101])+RC[-1]+R[-1]C+R[-1]C[-1] -> 3.55318298083418E+27 | FD22: =FIB(RC[-101])+RC[-1]+R[-1]C+R[-1]C[-1] -> 5.03858408551939E+27 | FE22: =FIB(RC[-101])+RC[-1]+R[-1]C+R[-1]C[-1] -> 7.10494852577584E+27 | FF22: =FIB(RC[-101])+RC[-1]+R[-1]C+R[-1]C[-1] -> 9.9643906842545E+27 | FG22: =FIB(RC[-101])+RC[-1]+R[-1]C+R[-1]C[-1] -> 1.39011396692785E+28 | FH22: =FIB(RC[-101])+RC[-1]+R[-1]C+R[-1]C[-1] -> 1.92943052095676E+28 | FI22: =FIB(RC[-101])+RC[-1]+R[-1]C+R[-1]C[-1] -> 2.66472956746243E+28 | FJ22: =FIB(RC[-101])+RC[-1]+R[-1]C+R[-1]C[-1] -> 3.66256807295564E+28 | FK22: =FIB(RC[-101])+RC[-1]+R[-1]C+R[-1]C[-1] -> 5.01057347003258E+28 | FL22: =FIB(RC[-101])+RC[-1]+R[-1]C+R[-1]C[-1] -> 6.82364406009662E+28 | FM22: =FIB(RC[-101])+RC[-1]+R[-1]C+R[-1]C[-1] -> 9.25183995700496E+28 | FN22: =FIB(RC[-101])+RC[-1]+R[-1]C+R[-1]C[-1] -> 1.24903900614171E+29 | FO22: =FIB(RC[-101])+RC[-1]+R[-1]C+R[-1]C[-1] -> 1.67923389953469E+29 | FP22: =FIB(RC[-101])+RC[-1]+R[-1]C+R[-1]C[-1] -> 2.24844771985791E+29 | FQ22: =FIB(RC[-101])+RC[-1]+R[-1]C+R[-1]C[-1] -> 2.99873415028962E+29 | FR22: =FIB(RC[-101])+RC[-1]+R[-1]C+R[-1]C[-1] -> 3.98402471633182E+29 | FS22: =FIB(RC[-101])+RC[-1]+R[-1]C+R[-1]C[-1] -> 5.27325210504609E+29 | FT22: =FIB(RC[-101])+RC[-1]+R[-1]C+R[-1]C[-1] -> 6.95423559367382E+29 | FU22: =FIB(RC[-101])+RC[-1]+R[-1]C+R[-1]C[-1] -> 9.13850050534778E+29 | FV22: =FIB(RC[-101])+RC[-1]+R[-1]C+R[-1]C[-1] -> 1.19672393097294E+30 | FW22: =FIB(RC[-101])+RC[-1]+R[-1]C+R[-1]C[-1] -> 1.56186644773095E+30 | FX22: =FIB(RC[-101])+RC[-1]+R[-1]C+R[-1]C[-1] -> 2.03170536542178E+30 | FY22: =FIB(RC[-101])+RC[-1]+R[-1]C+R[-1]C[-1] -> 2.63438475104852E+30 | FZ22: =FIB(RC[-101])+RC[-1]+R[-1]C+R[-1]C[-1] -> 3.40512312998554E+30 | GA22: =FIB(RC[-101])+RC[-1]+R[-1]C+R[-1]C[-1] -> 4.38787145639401E+30 | GB22: =FIB(RC[-101])+RC[-1]+R[-1]C+R[-1]C[-1] -> 5.63733216004526E+30 | GC22: =FIB(RC[-101])+RC[-1]+R[-1]C+R[-1]C[-1] -> 7.22141206860296E+30 | GD22: =FIB(RC[-101])+RC[-1]+R[-1]C+R[-1]C[-1] -> 9.22419553404387E+30 | GE22: =FIB(RC[-101])+RC[-1]+R[-1]C+R[-1]C[-1] -> 1.17495399278504E+31 | GF22: =FIB(RC[-101])+RC[-1]+R[-1]C+R[-1]C[-1] -> 1.49254141704062E+31 | GG22: =FIB(RC[-101])+RC[-1]+R[-1]C+R[-1]C[-1] -> 1.89091225346643E+31 | GH22: =FIB(RC[-101])+RC[-1]+R[-1]C+R[-1]C[-1] -> 2.38935810784979E+31 | GI22: =FIB(RC[-101])+RC[-1]+R[-1]C+R[-1]C[-1] -> 3.01148432440059E+31 | GJ22: =FIB(RC[-101])+RC[-1]+R[-1]C+R[-1]C[-1] -> 3.78611050171106E+31 | GK22: =FIB(RC[-101])+RC[-1]+R[-1]C+R[-1]C[-1] -> 4.7483459249351E+31 | GL22: =FIB(RC[-101])+RC[-1]+R[-1]C+R[-1]C[-1] -> 5.94087140784545E+31 | GM22: =FIB(RC[-101])+RC[-1]+R[-1]C+R[-1]C[-1] -> 7.41546427187573E+31 | GN22: =FIB(RC[-101])+RC[-1]+R[-1]C+R[-1]C[-1] -> 9.23480922134872E+31 | GO22: =FIB(RC[-101])+RC[-1]+R[-1]C+R[-1]C[-1] -> 1.14746448161061E+32 | GP22: =FIB(RC[-101])+RC[-1]+R[-1]C+R[-1]C[-1] -> 1.4226303220021E+32 | GQ22: =FIB(RC[-101])+RC[-1]+R[-1]C+R[-1]C[-1] -> 1.75997100573796E+32 | GR22: =FIB(RC[-101])+RC[-1]+R[-1]C+R[-1]C[-1] -> 2.17269216972665E+32 | GS22: =FIB(RC[-101])+RC[-1]+R[-1]C+R[-1]C[-1] -> 2.67662892866304E+32
A23: 20 | B23: 20 | C23: 20 | D23: 20 | E23: 20 | F23: 20 | G23: 20 | H23: 20 | I23: 20 | J23: 20 | K23: 20 | L23: 20 | M23: 20 | N23: 20 | O23: 20 | P23: 20 | Q23: 20 | R23: 20 | S23: 20 | T23: 20 | U23: 20 | V23: 20 | W23: 20 | X23: 20 | Y23: 20 | Z23: 20 | AA23: 20 | AB23: 20 | AC23: 20 | AD23: 20 | AE23: 20 | AF23: 20 | AG23: 20 | AH23: 20 | AI23: 20 | AJ23: 20 | AK23: 20 | AL23: 20 | AM23: 20 | AN23: 20 | AO23: 20 | AP23: 20 | AQ23: 20 | AR23: 20 | AS23: 20 | AT23: 20 | AU23: 20 | AV23: 20 | AW23: 20 | AX23: 20 | AY23: 20 | AZ23: 20 | BA23: 20 | BB23: 20 | BC23: 20 | BD23: 20 | BE23: 20 | BF23: 20 | BG23: 20 | BH23: 20 | BI23: 20 | BJ23: 20 | BK23: 20 | BL23: 20 | BM23: 20 | BN23: 20 | BO23: 20 | BP23: 20 | BQ23: 20 | BR23: 20 | BS23: 20 | BT23: 20 | BU23: 20 | BV23: 20 | BW23: 20 | BX23: 20 | BY23: 20 | BZ23: 20 | CA23: 20 | CB23: 20 | CC23: 20 | CD23: 20 | CE23: 20 | CF23: 20 | CG23: 20 | CH23: 20 | CI23: 20 | CJ23: 20 | CK23: 20 | CL23: 20 | CM23: 20 | CN23: 20 | CO23: 20 | CP23: 20 | CQ23: 20 | CR23: 20 | CS23: 20 | CT23: 20 | CU23: 20 | CV23: 20 | CW23: 0 | CX23: =FIB(RC[-101])+RC[-1]+R[-1]C+R[-1]C[-1] -> 240812 | CY23: =FIB(RC[-101])+RC[-1]+R[-1]C+R[-1]C[-1] -> 5538676 | CZ23: =FIB(RC[-101])+RC[-1]+R[-1]C+R[-1]C[-1] -> 83320952 | DA23: =FIB(RC[-101])+RC[-1]+R[-1]C+R[-1]C[-1] -> 941574920 | DB23: =FIB(RC[-101])+RC[-1]+R[-1]C+R[-1]C[-1] -> 8540879204 | DC23: =FIB(RC[-101])+RC[-1]+R[-1]C+R[-1]C[-1] -> 64841279932 | DD23: =FIB(RC[-101])+RC[-1]+R[-1]C+R[-1]C[-1] -> 424157587568 | DE23: =FIB(RC[-101])+RC[-1]+R[-1]C+R[-1]C[-1] -> 2442622580112 | DF23: =FIB(RC[-101])+RC[-1]+R[-1]C+R[-1]C[-1] -> 12590141894044 | DG23: =FIB(RC[-101])+RC[-1]+R[-1]C+R[-1]C[-1] -> 58853998869380 | DH23: =FIB(RC[-101])+RC[-1]+R[-1]C+R[-1]C[-1] -> 252211942573032 | DI23: =FIB(RC[-101])+RC[-1]+R[-1]C+R[-1]C[-1] -> 999744283632536 | DJ23: =FIB(RC[-101])+RC[-1]+R[-1]C+R[-1]C[-1] -> 3.69346431342933E+15 | DK23: =FIB(RC[-101])+RC[-1]+R[-1]C+R[-1]C[-1] -> 1.2800183556556E+16 | DL23: =FIB(RC[-101])+RC[-1]+R[-1]C+R[-1]C[-1] -> 4.18477840288847E+16 | DM23: =FIB(RC[-101])+RC[-1]+R[-1]C+R[-1]C[-1] -> 1.29697064665525E+17 | DN23: =FIB(RC[-101])+RC[-1]+R[-1]C+R[-1]C[-1] -> 3.82701909083E+17 | DO23: =FIB(RC[-101])+RC[-1]+R[-1]C+R[-1]C[-1] -> 1.07924644489162E+18 | DP23: =FIB(RC[-101])+RC[-1]+R[-1]C+R[-1]C[-1] -> 2.9186697044009E+18 | DQ23: =FIB(RC[-101])+RC[-1]+R[-1]C+R[-1]C[-1] -> 7.59229095754908E+18 | DR23: =FIB(RC[-101])+RC[-1]+R[-1]C+R[-1]C[-1] -> 1.90488803417965E+19 | DS23: =FIB(RC[-101])+RC[-1]+R[-1]C+R[-1]C[-1] -> 4.62108057040625E+19 | DT23: =FIB(RC[-101])+RC[-1]+R[-1]C+R[-1]C[-1] -> 1.08633114095754E+20 | DU23: =FIB(RC[-101])+RC[-1]+R[-1]C+R[-1]C[-1] -> 2.47972444395931E+20 | DV23: =FIB(RC[-101])+RC[-1]+R[-1]C+R[-1]C[-1] -> 5.506381894446E+20 | DW23: =FIB(RC[-101])+RC[-1]+R[-1]C+R[-1]C[-1] -> 1.19146267826559E+21 | DX23: =FIB(RC[-101])+RC[-1]+R[-1]C+R[-1]C[-1] -> 2.51601531287078E+21 | DY23: =FIB(RC[-101])+RC[-1]+R[-1]C+R[-1]C[-1] -> 5.19250647829842E+21 | DZ23: =FIB(RC[-101])+RC[-1]+R[-1]C+R[-1]C[-1] -> 1.048659380289E+22 | EA23: =FIB(RC[-101])+RC[-1]+R[-1]C+R[-1]C[-1] -> 2.07493136333569E+22 | EB23: =FIB(RC[-101])+RC[-1]+R[-1]C+R[-1]C[-1] -> 4.02682879867019E+22 | EC23: =FIB(RC[-101])+RC[-1]+R[-1]C+R[-1]C[-1] -> 7.6728177563614E+22 | ED23: =FIB(RC[-101])+RC[-1]+R[-1]C+R[-1]C[-1] -> 1.43677369876882E+23 | EE23: =FIB(RC[-101])+RC[-1]+R[-1]C+R[-1]C[-1] -> 2.64632691295851E+23 | EF23: =FIB(RC[-101])+RC[-1]+R[-1]C+R[-1]C[-1] -> 4.79814333832208E+23 | EG23: =FIB(RC[-101])+RC[-1]+R[-1]C+R[-1]C[-1] -> 8.57049700494559E+23 | EH23: =FIB(RC[-101])+RC[-1]+R[-1]C+R[-1]C[-1] -> 1.5092041227085E+24 | EI23: =FIB(RC[-101])+RC[-1]+R[-1]C+R[-1]C[-1] -> 2.62171116947846E+24 | EJ23: =FIB(RC[-101])+RC[-1]+R[-1]C+R[-1]C[-1] -> 4.49555793049881E+24 | EK23: =FIB(RC[-101])+RC[-1]+R[-1]C+R[-1]C[-1] -> 7.61367106205266E+24 | EL23: =FIB(RC[-101])+RC[-1]+R[-1]C+R[-1]C[-1] -> 1.27423784149347E+25 | EM23: =FIB(RC[-101])+RC[-1]+R[-1]C+R[-1]C[-1] -> 2.10849414813386E+25 | EN23: =FIB(RC[-101])+RC[-1]+R[-1]C+R[-1]C[-1] -> 3.4511680467151E+25 | EO23: =FIB(RC[-101])+RC[-1]+R[-1]C+R[-1]C[-1] -> 5.5901775107258E+25 | EP23: =FIB(RC[-101])+RC[-1]+R[-1]C+R[-1]C[-1] -> 8.96465293418057E+25 | EQ23: =FIB(RC[-101])+RC[-1]+R[-1]C+R[-1]C[-1] -> 1.42384210874084E+26 | ER23: =FIB(RC[-101])+RC[-1]+R[-1]C+R[-1]C[-1] -> 2.24064464660784E+26 | ES23: =FIB(RC[-101])+RC[-1]+R[-1]C+R[-1]C[-1] -> 3.49478308767026E+26 | ET23: =FIB(RC[-101])+RC[-1]+R[-1]C+R[-1]C[-1] -> 5.40441187719057E+26 | EU23: =FIB(RC[-101])+RC[-1]+R[-1]C+R[-1]C[-1] -> 8.28885811538836E+26 | EV23: =FIB(RC[-101])+RC[-1]+R[-1]C+R[-1]C[-1] -> 1.26121413539609E+27 | EW23: =FIB(RC[-101])+RC[-1]+R[-1]C+R[-1]C[-1] -> 1.90438100925586E+27 | EX23: =FIB(RC[-101])+RC[-1]+R[-1]C+R[-1]C[-1] -> 2.8543449142851E+27 | EY23: =FIB(RC[-101])+RC[-1]+R[-1]C+R[-1]C[-1] -> 4.24773545617389E+27 | EZ23: =FIB(RC[-101])+RC[-1]+R[-1]C+R[-1]C[-1] -> 6.27786765271309E+27 | FA23: =FIB(RC[-101])+RC[-1]+R[-1]C+R[-1]C[-1] -> 9.21659811538666E+27 | FB23: =FIB(RC[-101])+RC[-1]+R[-1]C+R[-1]C[-1] -> 1.34439912937602E+28 | FC23: =FIB(RC[-101])+RC[-1]+R[-1]C+R[-1]C[-1] -> 1.94883741516595E+28 | FD23: =FIB(RC[-101])+RC[-1]+R[-1]C+R[-1]C[-1] -> 2.8080141218013E+28 | FE23: =FIB(RC[-101])+RC[-1]+R[-1]C+R[-1]C[-1] -> 4.02236738293083E+28 | FF23: =FIB(RC[-101])+RC[-1]+R[-1]C+R[-1]C[-1] -> 5.72930130393386E+28 | FG23: =FIB(RC[-101])+RC[-1]+R[-1]C+R[-1]C[-1] -> 8.11585433928716E+28 | FH23: =FIB(RC[-101])+RC[-1]+R[-1]C+R[-1]C[-1] -> 1.14353988271718E+29 | FI23: =FIB(RC[-101])+RC[-1]+R[-1]C+R[-1]C[-1] -> 1.6029558915591E+29 | FJ23: =FIB(RC[-101])+RC[-1]+R[-1]C+R[-1]C[-1] -> 2.2356856556009E+29 | FK23: =FIB(RC[-101])+RC[-1]+R[-1]C+R[-1]C[-1] -> 3.10299980989972E+29 | FL23: =FIB(RC[-101])+RC[-1]+R[-1]C+R[-1]C[-1] -> 4.28642156291264E+29 | FM23: =FIB(RC[-101])+RC[-1]+R[-1]C+R[-1]C[-1] -> 5.8939699646228E+29 | FN23: =FIB(RC[-101])+RC[-1]+R[-1]C+R[-1]C[-1] -> 8.06819296646501E+29 | FO23: =FIB(RC[-101])+RC[-1]+R[-1]C+R[-1]C[-1] -> 1.09964658721414E+30 | FP23: =FIB(RC[-101])+RC[-1]+R[-1]C+R[-1]C[-1] -> 1.4924147491534E+30 | FQ23: =FIB(RC[-101])+RC[-1]+R[-1]C+R[-1]C[-1] -> 2.01713293616815E+30 | FR23: =FIB(RC[-101])+RC[-1]+R[-1]C+R[-1]C[-1] -> 2.7154088228303E+30 | FS23: =FIB(RC[-101])+RC[-1]+R[-1]C+R[-1]C[-1] -> 3.64113650496809E+30 | FT23: =FIB(RC[-101])+RC[-1]+R[-1]C+R[-1]C[-1] -> 4.86388527484008E+30 | FU23: =FIB(RC[-101])+RC[-1]+R[-1]C+R[-1]C[-1] -> 6.47315888474224E+30 | FV23: =FIB(RC[-101])+RC[-1]+R[-1]C+R[-1]C[-1] -> 8.58373286624996E+30 | FW23: =FIB(RC[-101])+RC[-1]+R[-1]C+R[-1]C[-1] -> 1.13423232449539E+31 | FX23: =FIB(RC[-101])+RC[-1]+R[-1]C+R[-1]C[-1] -> 1.49358950581066E+31 | FY23: =FIB(RC[-101])+RC[-1]+R[-1]C+R[-1]C[-1] -> 1.96019851745769E+31 | FZ23: =FIB(RC[-101])+RC[-1]+R[-1]C+R[-1]C[-1] -> 2.56414930556109E+31 | GA23: =FIB(RC[-101])+RC[-1]+R[-1]C+R[-1]C[-1] -> 3.34344876419905E+31 | GB23: =FIB(RC[-101])+RC[-1]+R[-1]C+R[-1]C[-1] -> 4.34596912584298E+31 | GC23: =FIB(RC[-101])+RC[-1]+R[-1]C+R[-1]C[-1] -> 5.6318435487078E+31 | GD23: =FIB(RC[-101])+RC[-1]+R[-1]C+R[-1]C[-1] -> 7.27640430897248E+31 | GE23: =FIB(RC[-101])+RC[-1]+R[-1]C+R[-1]C[-1] -> 9.37377785516191E+31 | GF23: =FIB(RC[-101])+RC[-1]+R[-1]C+R[-1]C[-1] -> 1.20412732649876E+32 | GG23: =FIB(RC[-101])+RC[-1]+R[-1]C+R[-1]C[-1] -> 1.54247269354946E+32 | GH23: =FIB(RC[-101])+RC[-1]+R[-1]C+R[-1]C[-1] -> 1.97049972968108E+32 | GI23: =FIB(RC[-101])+RC[-1]+R[-1]C+R[-1]C[-1] -> 2.51058397290612E+32 | GJ23: =FIB(RC[-101])+RC[-1]+R[-1]C+R[-1]C[-1] -> 3.19034345551729E+32 | GK23: =FIB(RC[-101])+RC[-1]+R[-1]C+R[-1]C[-1] -> 4.0437890981819E+32 | GL23: =FIB(RC[-101])+RC[-1]+R[-1]C+R[-1]C[-1] -> 5.11271083145996E+32 | GM23: =FIB(RC[-101])+RC[-1]+R[-1]C+R[-1]C[-1] -> 6.44834439943208E+32 | GN23: =FIB(RC[-101])+RC[-1]+R[-1]C+R[-1]C[-1] -> 8.11337174875452E+32 | GO23: =FIB(RC[-101])+RC[-1]+R[-1]C+R[-1]C[-1] -> 1.01843171525E+33 | GP23: =FIB(RC[-101])+RC[-1]+R[-1]C+R[-1]C[-1] -> 1.27544119561127E+33 | GQ23: =FIB(RC[-101])+RC[-1]+R[-1]C+R[-1]C[-1] -> 1.59370132838528E+33 | GR23: =FIB(RC[-101])+RC[-1]+R[-1]C+R[-1]C[-1] -> 1.98696764593174E+33 | GS23: =FIB(RC[-101])+RC[-1]+R[-1]C+R[-1]C[-1] -> 2.47189975577071E+33
A24: 20 | B24: 20 | C24: 20 | D24: 20 | E24: 20 | F24: 20 | G24: 20 | H24: 20 | I24: 20 | J24: 20 | K24: 20 | L24: 20 | M24: 20 | N24: 20 | O24: 20 | P24: 20 | Q24: 20 | R24: 20 | S24: 20 | T24: 20 | U24: 20 | V24: 20 | W24: 20 | X24: 20 | Y24: 20 | Z24: 20 | AA24: 20 | AB24: 20 | AC24: 20 | AD24: 20 | AE24: 20 | AF24: 20 | AG24: 20 | AH24: 20 | AI24: 20 | AJ24: 20 | AK24: 20 | AL24: 20 | AM24: 20 | AN24: 20 | AO24: 20 | AP24: 20 | AQ24: 20 | AR24: 20 | AS24: 20 | AT24: 20 | AU24: 20 | AV24: 20 | AW24: 20 | AX24: 20 | AY24: 20 | AZ24: 20 | BA24: 20 | BB24: 20 | BC24: 20 | BD24: 20 | BE24: 20 | BF24: 20 | BG24: 20 | BH24: 20 | BI24: 20 | BJ24: 20 | BK24: 20 | BL24: 20 | BM24: 20 | BN24: 20 | BO24: 20 | BP24: 20 | BQ24: 20 | BR24: 20 | BS24: 20 | BT24: 20 | BU24: 20 | BV24: 20 | BW24: 20 | BX24: 20 | BY24: 20 | BZ24: 20 | CA24: 20 | CB24: 20 | CC24: 20 | CD24: 20 | CE24: 20 | CF24: 20 | CG24: 20 | CH24: 20 | CI24: 20 | CJ24: 20 | CK24: 20 | CL24: 20 | CM24: 20 | CN24: 20 | CO24: 20 | CP24: 20 | CQ24: 20 | CR24: 20 | CS24: 20 | CT24: 20 | CU24: 20 | CV24: 20 | CW24: 0 | CX24: =FIB(RC[-101])+RC[-1]+R[-1]C+R[-1]C[-1] -> 251758 | CY24: =FIB(RC[-101])+RC[-1]+R[-1]C+R[-1]C[-1] -> 6042192 | CZ24: =FIB(RC[-101])+RC[-1]+R[-1]C+R[-1]C[-1] -> 94912766 | DA24: =FIB(RC[-101])+RC[-1]+R[-1]C+R[-1]C[-1] -> 1119819584 | DB24: =FIB(RC[-101])+RC[-1]+R[-1]C+R[-1]C[-1] -> 10602284654 | DC24: =FIB(RC[-101])+RC[-1]+R[-1]C+R[-1]C[-1] -> 83984454736 | DD24: =FIB(RC[-101])+RC[-1]+R[-1]C+R[-1]C[-1] -> 572983333182 | DE24: =FIB(RC[-101])+RC[-1]+R[-1]C+R[-1]C[-1] -> 3439763511808 | DF24: =FIB(RC[-101])+RC[-1]+R[-1]C+R[-1]C[-1] -> 18472527996910 | DG24: =FIB(RC[-101])+RC[-1]+R[-1]C+R[-1]C[-1] -> 89916668771280 | DH24: =FIB(RC[-101])+RC[-1]+R[-1]C+R[-1]C[-1] -> 400982610224638 | DI24: =FIB(RC[-101])+RC[-1]+R[-1]C+R[-1]C[-1] -> 1.65293883644115E+15 | DJ24: =FIB(RC[-101])+RC[-1]+R[-1]C+R[-1]C[-1] -> 6.34614743351397E+15 | DK24: =FIB(RC[-101])+RC[-1]+R[-1]C+R[-1]C[-1] -> 2.28397953035102E+16 | DL24: =FIB(RC[-101])+RC[-1]+R[-1]C+R[-1]C[-1] -> 7.74877628889619E+16 | DM24: =FIB(RC[-101])+RC[-1]+R[-1]C+R[-1]C[-1] -> 2.49032611583382E+17 | DN24: =FIB(RC[-101])+RC[-1]+R[-1]C+R[-1]C[-1] -> 7.61431585331917E+17 | DO24: =FIB(RC[-101])+RC[-1]+R[-1]C+R[-1]C[-1] -> 2.22337993930655E+18 | DP24: =FIB(RC[-101])+RC[-1]+R[-1]C+R[-1]C[-1] -> 6.22129608859908E+18 | DQ24: =FIB(RC[-101])+RC[-1]+R[-1]C+R[-1]C[-1] -> 1.67322567505491E+19 | DR24: =FIB(RC[-101])+RC[-1]+R[-1]C+R[-1]C[-1] -> 4.33734280498947E+19 | DS24: =FIB(RC[-101])+RC[-1]+R[-1]C+R[-1]C[-1] -> 1.08633114095754E+20 | DT24: =FIB(RC[-101])+RC[-1]+R[-1]C+R[-1]C[-1] -> 2.6347703389557E+20 | DU24: =FIB(RC[-101])+RC[-1]+R[-1]C+R[-1]C[-1] -> 6.20082592387255E+20 | DV24: =FIB(RC[-101])+RC[-1]+R[-1]C+R[-1]C[-1] -> 1.41869322622779E+21 | DW24: =FIB(RC[-101])+RC[-1]+R[-1]C+R[-1]C[-1] -> 3.16079409393797E+21 | DX24: =FIB(RC[-101])+RC[-1]+R[-1]C+R[-1]C[-1] -> 6.86827208507434E+21 | DY24: =FIB(RC[-101])+RC[-1]+R[-1]C+R[-1]C[-1] -> 1.45767938762435E+22 | DZ24: =FIB(RC[-101])+RC[-1]+R[-1]C+R[-1]C[-1] -> 3.0255894157432E+22 | EA24: =FIB(RC[-101])+RC[-1]+R[-1]C+R[-1]C[-1] -> 6.14918015936789E+22 | EB24: =FIB(RC[-101])+RC[-1]+R[-1]C+R[-1]C[-1] -> 1.22509403213738E+23 | EC24: =FIB(RC[-101])+RC[-1]+R[-1]C+R[-1]C[-1] -> 2.39505868764054E+23 | ED24: =FIB(RC[-101])+RC[-1]+R[-1]C+R[-1]C[-1] -> 4.59911416204549E+23 | EE24: =FIB(RC[-101])+RC[-1]+R[-1]C+R[-1]C[-1] -> 8.68221477377282E+23 | EF24: =FIB(RC[-101])+RC[-1]+R[-1]C+R[-1]C[-1] -> 1.61266850250534E+24 | EG24: =FIB(RC[-101])+RC[-1]+R[-1]C+R[-1]C[-1] -> 2.94953253683211E+24 | EH24: =FIB(RC[-101])+RC[-1]+R[-1]C+R[-1]C[-1] -> 5.31578636003517E+24 | EI24: =FIB(RC[-101])+RC[-1]+R[-1]C+R[-1]C[-1] -> 9.44670165222213E+24 | EJ24: =FIB(RC[-101])+RC[-1]+R[-1]C+R[-1]C[-1] -> 1.65639707521994E+25 | EK24: =FIB(RC[-101])+RC[-1]+R[-1]C+R[-1]C[-1] -> 2.86731997447509E+25 | EL24: =FIB(RC[-101])+RC[-1]+R[-1]C+R[-1]C[-1] -> 4.90292492217382E+25 | EM24: =FIB(RC[-101])+RC[-1]+R[-1]C+R[-1]C[-1] -> 8.28565691180115E+25 | EN24: =FIB(RC[-101])+RC[-1]+R[-1]C+R[-1]C[-1] -> 1.38453191066501E+26 | EO24: =FIB(RC[-101])+RC[-1]+R[-1]C+R[-1]C[-1] -> 2.2886664664091E+26 | EP24: =FIB(RC[-101])+RC[-1]+R[-1]C+R[-1]C[-1] -> 3.74414951089974E+26 | EQ24: =FIB(RC[-101])+RC[-1]+R[-1]C+R[-1]C[-1] -> 6.06445691305864E+26 | ER24: =FIB(RC[-101])+RC[-1]+R[-1]C+R[-1]C[-1] -> 9.72894366840732E+26 | ES24: =FIB(RC[-101])+RC[-1]+R[-1]C+R[-1]C[-1] -> 1.54643714026854E+27 | ET24: =FIB(RC[-101])+RC[-1]+R[-1]C+R[-1]C[-1] -> 2.43635663675462E+27 | EU24: =FIB(RC[-101])+RC[-1]+R[-1]C+R[-1]C[-1] -> 3.80568363601252E+27 | EV24: =FIB(RC[-101])+RC[-1]+R[-1]C+R[-1]C[-1] -> 5.89578358294744E+27 | EW24: =FIB(RC[-101])+RC[-1]+R[-1]C+R[-1]C[-1] -> 9.06137872759939E+27 | EX24: =FIB(RC[-101])+RC[-1]+R[-1]C+R[-1]C[-1] -> 1.38201046511403E+28 | EY24: =FIB(RC[-101])+RC[-1]+R[-1]C+R[-1]C[-1] -> 2.09221850215993E+28 | EZ24: =FIB(RC[-101])+RC[-1]+R[-1]C+R[-1]C[-1] -> 3.14477881304863E+28 | FA24: =FIB(RC[-101])+RC[-1]+R[-1]C+R[-1]C[-1] -> 4.69422538985861E+28 | FB24: =FIB(RC[-101])+RC[-1]+R[-1]C+R[-1]C[-1] -> 6.96028433077329E+28 | FC24: =FIB(RC[-101])+RC[-1]+R[-1]C+R[-1]C[-1] -> 1.02535208753153E+29 | FD24: =FIB(RC[-101])+RC[-1]+R[-1]C+R[-1]C[-1] -> 1.50103724122825E+29 | FE24: =FIB(RC[-101])+RC[-1]+R[-1]C+R[-1]C[-1] -> 2.18407539170146E+29 | FF24: =FIB(RC[-101])+RC[-1]+R[-1]C+R[-1]C[-1] -> 3.15924226038793E+29 | FG24: =FIB(RC[-101])+RC[-1]+R[-1]C+R[-1]C[-1] -> 4.54375782471004E+29 | FH24: =FIB(RC[-101])+RC[-1]+R[-1]C+R[-1]C[-1] -> 6.49888314135593E+29 | FI24: =FIB(RC[-101])+RC[-1]+R[-1]C+R[-1]C[-1] -> 9.2453789156322E+29 | FJ24: =FIB(RC[-101])+RC[-1]+R[-1]C+R[-1]C[-1] -> 1.30840204627922E+30 | FK24: =FIB(RC[-101])+RC[-1]+R[-1]C+R[-1]C[-1] -> 1.84227059282928E+30 | FL24: =FIB(RC[-101])+RC[-1]+R[-1]C+R[-1]C[-1] -> 2.58121273011052E+30 | FM24: =FIB(RC[-101])+RC[-1]+R[-1]C+R[-1]C[-1] -> 3.59925188286406E+30 | FN24: =FIB(RC[-101])+RC[-1]+R[-1]C+R[-1]C[-1] -> 4.99546817597285E+30 | FO24: =FIB(RC[-101])+RC[-1]+R[-1]C+R[-1]C[-1] -> 6.90193405983349E+30 | FP24: =FIB(RC[-101])+RC[-1]+R[-1]C+R[-1]C[-1] -> 9.49399539620103E+30 | FQ24: =FIB(RC[-101])+RC[-1]+R[-1]C+R[-1]C[-1] -> 1.30035430815226E+31 | FR24: =FIB(RC[-101])+RC[-1]+R[-1]C+R[-1]C[-1] -> 1.7736084840521E+31 | FS24: =FIB(RC[-101])+RC[-1]+R[-1]C+R[-1]C[-1] -> 2.40926301683194E+31 | FT24: =FIB(RC[-101])+RC[-1]+R[-1]C+R[-1]C[-1] -> 3.25976519481276E+31 | FU24: =FIB(RC[-101])+RC[-1]+R[-1]C+R[-1]C[-1] -> 4.39346961077099E+31 | FV24: =FIB(RC[-101])+RC[-1]+R[-1]C+R[-1]C[-1] -> 5.89915878587021E+31 | FW24: =FIB(RC[-101])+RC[-1]+R[-1]C+R[-1]C[-1] -> 7.8917643969906E+31 | FX24: =FIB(RC[-101])+RC[-1]+R[-1]C+R[-1]C[-1] -> 1.05195862272966E+32 | FY24: =FIB(RC[-101])+RC[-1]+R[-1]C+R[-1]C[-1] -> 1.3973374250565E+32 | FZ24: =FIB(RC[-101])+RC[-1]+R[-1]C+R[-1]C[-1] -> 1.84977220735838E+32 | GA24: =FIB(RC[-101])+RC[-1]+R[-1]C+R[-1]C[-1] -> 2.44053201433439E+32 | GB24: =FIB(RC[-101])+RC[-1]+R[-1]C+R[-1]C[-1] -> 3.20947380333859E+32 | GC24: =FIB(RC[-101])+RC[-1]+R[-1]C+R[-1]C[-1] -> 4.20725507079367E+32 | GD24: =FIB(RC[-101])+RC[-1]+R[-1]C+R[-1]C[-1] -> 5.4980798565617E+32 | GE24: =FIB(RC[-101])+RC[-1]+R[-1]C+R[-1]C[-1] -> 7.16309807297514E+32 | GF24: =FIB(RC[-101])+RC[-1]+R[-1]C+R[-1]C[-1] -> 9.30460318499009E+32 | GG24: =FIB(RC[-101])+RC[-1]+R[-1]C+R[-1]C[-1] -> 1.20512032050383E+33 | GH24: =FIB(RC[-101])+RC[-1]+R[-1]C+R[-1]C[-1] -> 1.55641756282689E+33 | GI24: =FIB(RC[-101])+RC[-1]+R[-1]C+R[-1]C[-1] -> 2.00452593308561E+33 | GJ24: =FIB(RC[-101])+RC[-1]+R[-1]C+R[-1]C[-1] -> 2.57461867592795E+33 | GK24: =FIB(RC[-101])+RC[-1]+R[-1]C+R[-1]C[-1] -> 3.29803193129787E+33 | GL24: =FIB(RC[-101])+RC[-1]+R[-1]C+R[-1]C[-1] -> 4.21368192426205E+33 | GM24: =FIB(RC[-101])+RC[-1]+R[-1]C+R[-1]C[-1] -> 5.36978744735126E+33 | GN24: =FIB(RC[-101])+RC[-1]+R[-1]C+R[-1]C[-1] -> 6.82595906216991E+33 | GO24: =FIB(RC[-101])+RC[-1]+R[-1]C+R[-1]C[-1] -> 8.65572795229537E+33 | GP24: =FIB(RC[-101])+RC[-1]+R[-1]C+R[-1]C[-1] -> 1.09496008631566E+34 | GQ24: =FIB(RC[-101])+RC[-1]+R[-1]C+R[-1]C[-1] -> 1.38187433871532E+34 | GR24: =FIB(RC[-101])+RC[-1]+R[-1]C+R[-1]C[-1] -> 1.73994123614702E+34 | GS24: =FIB(RC[-101])+RC[-1]+R[-1]C+R[-1]C[-1] -> 2.18582797631727E+34
A25: 20 | B25: 20 | C25: 20 | D25: 20 | E25: 20 | F25: 20 | G25: 20 | H25: 20 | I25: 20 | J25: 20 | K25: 20 | L25: 20 | M25: 20 | N25: 20 | O25: 20 | P25: 20 | Q25: 20 | R25: 20 | S25: 20 | T25: 20 | U25: 20 | V25: 20 | W25: 20 | X25: 20 | Y25: 20 | Z25: 20 | AA25: 20 | AB25: 20 | AC25: 20 | AD25: 20 | AE25: 20 | AF25: 20 | AG25: 20 | AH25: 20 | AI25: 20 | AJ25: 20 | AK25: 20 | AL25: 20 | AM25: 20 | AN25: 20 | AO25: 20 | AP25: 20 | AQ25: 20 | AR25: 20 | AS25: 20 | AT25: 20 | AU25: 20 | AV25: 20 | AW25: 20 | AX25: 20 | AY25: 20 | AZ25: 20 | BA25: 20 | BB25: 20 | BC25: 20 | BD25: 20 | BE25: 20 | BF25: 20 | BG25: 20 | BH25: 20 | BI25: 20 | BJ25: 20 | BK25: 20 | BL25: 20 | BM25: 20 | BN25: 20 | BO25: 20 | BP25: 20 | BQ25: 20 | BR25: 20 | BS25: 20 | BT25: 20 | BU25: 20 | BV25: 20 | BW25: 20 | BX25: 20 | BY25: 20 | BZ25: 20 | CA25: 20 | CB25: 20 | CC25: 20 | CD25: 20 | CE25: 20 | CF25: 20 | CG25: 20 | CH25: 20 | CI25: 20 | CJ25: 20 | CK25: 20 | CL25: 20 | CM25: 20 | CN25: 20 | CO25: 20 | CP25: 20 | CQ25: 20 | CR25: 20 | CS25: 20 | CT25: 20 | CU25: 20 | CV25: 20 | CW25: 0 | CX25: =FIB(RC[-101])+RC[-1]+R[-1]C+R[-1]C[-1] -> 262704 | CY25: =FIB(RC[-101])+RC[-1]+R[-1]C+R[-1]C[-1] -> 6567600 | CZ25: =FIB(RC[-101])+RC[-1]+R[-1]C+R[-1]C[-1] -> 107533504 | DA25: =FIB(RC[-101])+RC[-1]+R[-1]C+R[-1]C[-1] -> 1322276800 | DB25: =FIB(RC[-101])+RC[-1]+R[-1]C+R[-1]C[-1] -> 13044391984 | DC25: =FIB(RC[-101])+RC[-1]+R[-1]C+R[-1]C[-1] -> 107631142320 | DD25: =FIB(RC[-101])+RC[-1]+R[-1]C+R[-1]C[-1] -> 764598941184 | DE25: =FIB(RC[-101])+RC[-1]+R[-1]C+R[-1]C[-1] -> 4777345797120 | DF25: =FIB(RC[-101])+RC[-1]+R[-1]C+R[-1]C[-1] -> 26689637316784 | DG25: =FIB(RC[-101])+RC[-1]+R[-1]C+R[-1]C[-1] -> 135078834095920 | DH25: =FIB(RC[-101])+RC[-1]+R[-1]C+R[-1]C[-1] -> 625978113102784 | DI25: =FIB(RC[-101])+RC[-1]+R[-1]C+R[-1]C[-1] -> 2.67989955977952E+15 | DJ25: =FIB(RC[-101])+RC[-1]+R[-1]C+R[-1]C[-1] -> 1.06789858297456E+16 | DK25: =FIB(RC[-101])+RC[-1]+R[-1]C+R[-1]C[-1] -> 3.98649285667807E+16 | DL25: =FIB(RC[-101])+RC[-1]+R[-1]C+R[-1]C[-1] -> 1.40192486759264E+17 | DM25: =FIB(RC[-101])+RC[-1]+R[-1]C+R[-1]C[-1] -> 4.66712861231619E+17 | DN25: =FIB(RC[-101])+RC[-1]+R[-1]C+R[-1]C[-1] -> 1.47717705814693E+18 | DO25: =FIB(RC[-101])+RC[-1]+R[-1]C+R[-1]C[-1] -> 4.4619885827854E+18 | DP25: =FIB(RC[-101])+RC[-1]+R[-1]C+R[-1]C[-1] -> 1.2906664610691E+19 | DQ25: =FIB(RC[-101])+RC[-1]+R[-1]C+R[-1]C[-1] -> 3.58602174498392E+19 | DR25: =FIB(RC[-101])+RC[-1]+R[-1]C+R[-1]C[-1] -> 9.5965902250283E+19 | DS25: =FIB(RC[-101])+RC[-1]+R[-1]C+R[-1]C[-1] -> 2.47972444395931E+20 | DT25: =FIB(RC[-101])+RC[-1]+R[-1]C+R[-1]C[-1] -> 6.20082592387255E+20 | DU25: =FIB(RC[-101])+RC[-1]+R[-1]C+R[-1]C[-1] -> 1.50364221867008E+21 | DV25: =FIB(RC[-101])+RC[-1]+R[-1]C+R[-1]C[-1] -> 3.54241803728512E+21 | DW25: =FIB(RC[-101])+RC[-1]+R[-1]C+R[-1]C[-1] -> 8.12190535745088E+21 | DX25: =FIB(RC[-101])+RC[-1]+R[-1]C+R[-1]C[-1] -> 1.81509715364632E+22 | DY25: =FIB(RC[-101])+RC[-1]+R[-1]C+R[-1]C[-1] -> 3.95960374977811E+22 | DZ25: =FIB(RC[-101])+RC[-1]+R[-1]C+R[-1]C[-1] -> 8.44287255314566E+22 | EA25: =FIB(RC[-101])+RC[-1]+R[-1]C+R[-1]C[-1] -> 1.76176421282567E+23 | EB25: =FIB(RC[-101])+RC[-1]+R[-1]C+R[-1]C[-1] -> 3.60177626089984E+23 | EC25: =FIB(RC[-101])+RC[-1]+R[-1]C+R[-1]C[-1] -> 7.22192898067775E+23 | ED25: =FIB(RC[-101])+RC[-1]+R[-1]C+R[-1]C[-1] -> 1.42161018303638E+24 | EE25: =FIB(RC[-101])+RC[-1]+R[-1]C+R[-1]C[-1] -> 2.74974307661821E+24 | EF25: =FIB(RC[-101])+RC[-1]+R[-1]C+R[-1]C[-1] -> 5.23063305650083E+24 | EG25: =FIB(RC[-101])+RC[-1]+R[-1]C+R[-1]C[-1] -> 9.79283409583828E+24 | EH25: =FIB(RC[-101])+RC[-1]+R[-1]C+R[-1]C[-1] -> 1.80581529927056E+25 | EI25: =FIB(RC[-101])+RC[-1]+R[-1]C+R[-1]C[-1] -> 3.28206410049629E+25 | EJ25: =FIB(RC[-101])+RC[-1]+R[-1]C+R[-1]C[-1] -> 5.88313134093844E+25 | EK25: =FIB(RC[-101])+RC[-1]+R[-1]C+R[-1]C[-1] -> 1.04068483906335E+26 | EL25: =FIB(RC[-101])+RC[-1]+R[-1]C+R[-1]C[-1] -> 1.81770932872824E+26 | EM25: =FIB(RC[-101])+RC[-1]+R[-1]C+R[-1]C[-1] -> 3.13656751212574E+26 | EN25: =FIB(RC[-101])+RC[-1]+R[-1]C+R[-1]C[-1] -> 5.34966511397086E+26 | EO25: =FIB(RC[-101])+RC[-1]+R[-1]C+R[-1]C[-1] -> 9.02286349104497E+26 | EP25: =FIB(RC[-101])+RC[-1]+R[-1]C+R[-1]C[-1] -> 1.50556794683538E+27 | EQ25: =FIB(RC[-101])+RC[-1]+R[-1]C+R[-1]C[-1] -> 2.48642858923122E+27 | ER25: =FIB(RC[-101])+RC[-1]+R[-1]C+R[-1]C[-1] -> 4.06576864737781E+27 | ES25: =FIB(RC[-101])+RC[-1]+R[-1]C+R[-1]C[-1] -> 6.58510015448709E+27 | ET25: =FIB(RC[-101])+RC[-1]+R[-1]C+R[-1]C[-1] -> 1.05678939315103E+28 | EU25: =FIB(RC[-101])+RC[-1]+R[-1]C+R[-1]C[-1] -> 1.68099342042774E+28 | EV25: =FIB(RC[-101])+RC[-1]+R[-1]C+R[-1]C[-1] -> 2.65114014232373E+28 | EW25: =FIB(RC[-101])+RC[-1]+R[-1]C+R[-1]C[-1] -> 4.14685637337842E+28 | EX25: =FIB(RC[-101])+RC[-1]+R[-1]C+R[-1]C[-1] -> 6.43500471125239E+28 | EY25: =FIB(RC[-101])+RC[-1]+R[-1]C+R[-1]C[-1] -> 9.90923367852636E+28 | EZ25: =FIB(RC[-101])+RC[-1]+R[-1]C+R[-1]C[-1] -> 1.51462309937349E+29 | FA25: =FIB(RC[-101])+RC[-1]+R[-1]C+R[-1]C[-1] -> 2.29852351966422E+29 | FB25: =FIB(RC[-101])+RC[-1]+R[-1]C+R[-1]C[-1] -> 3.46397449172741E+29 | FC25: =FIB(RC[-101])+RC[-1]+R[-1]C+R[-1]C[-1] -> 5.18535501233626E+29 | FD25: =FIB(RC[-101])+RC[-1]+R[-1]C+R[-1]C[-1] -> 7.71174434109604E+29 | FE25: =FIB(RC[-101])+RC[-1]+R[-1]C+R[-1]C[-1] -> 1.13968569740258E+30 | FF25: =FIB(RC[-101])+RC[-1]+R[-1]C+R[-1]C[-1] -> 1.67401746261152E+30 | FG25: =FIB(RC[-101])+RC[-1]+R[-1]C+R[-1]C[-1] -> 2.44431747112131E+30 | FH25: =FIB(RC[-101])+RC[-1]+R[-1]C+R[-1]C[-1] -> 3.54858156772791E+30 | FI25: =FIB(RC[-101])+RC[-1]+R[-1]C+R[-1]C[-1] -> 5.12300777342672E+30 | FJ25: =FIB(RC[-101])+RC[-1]+R[-1]C+R[-1]C[-1] -> 7.35594771126916E+30 | FK25: =FIB(RC[-101])+RC[-1]+R[-1]C+R[-1]C[-1] -> 1.05066203503777E+31 | FL25: =FIB(RC[-101])+RC[-1]+R[-1]C+R[-1]C[-1] -> 1.49301036733175E+31 | FM25: =FIB(RC[-101])+RC[-1]+R[-1]C+R[-1]C[-1] -> 2.11105682862921E+31 | FN25: =FIB(RC[-101])+RC[-1]+R[-1]C+R[-1]C[-1] -> 2.9705288345129E+31 | FO25: =FIB(RC[-101])+RC[-1]+R[-1]C+R[-1]C[-1] -> 4.16026905809353E+31 | FP25: =FIB(RC[-101])+RC[-1]+R[-1]C+R[-1]C[-1] -> 5.79986200369698E+31 | FQ25: =FIB(RC[-101])+RC[-1]+R[-1]C+R[-1]C[-1] -> 8.04961585146934E+31 | FR25: =FIB(RC[-101])+RC[-1]+R[-1]C+R[-1]C[-1] -> 1.11235786436737E+32 | FS25: =FIB(RC[-101])+RC[-1]+R[-1]C+R[-1]C[-1] -> 1.53064501445578E+32 | FT25: =FIB(RC[-101])+RC[-1]+R[-1]C+R[-1]C[-1] -> 2.09754783562025E+32 | FU25: =FIB(RC[-101])+RC[-1]+R[-1]C+R[-1]C[-1] -> 2.86287131617862E+32 | FV25: =FIB(RC[-101])+RC[-1]+R[-1]C+R[-1]C[-1] -> 3.89213415584274E+32 | FW25: =FIB(RC[-101])+RC[-1]+R[-1]C+R[-1]C[-1] -> 5.27122647412882E+32 | FX25: =FIB(RC[-101])+RC[-1]+R[-1]C+R[-1]C[-1] -> 7.11236153655755E+32 | FY25: =FIB(RC[-101])+RC[-1]+R[-1]C+R[-1]C[-1] -> 9.56165758434371E+32 | FZ25: =FIB(RC[-101])+RC[-1]+R[-1]C+R[-1]C[-1] -> 1.28087672167586E+33 | GA25: =FIB(RC[-101])+RC[-1]+R[-1]C+R[-1]C[-1] -> 1.70990714384514E+33 | GB25: =FIB(RC[-101])+RC[-1]+R[-1]C+R[-1]C[-1] -> 2.27490772561243E+33 | GC25: =FIB(RC[-101])+RC[-1]+R[-1]C+R[-1]C[-1] -> 3.01658061302566E+33 | GD25: =FIB(RC[-101])+RC[-1]+R[-1]C+R[-1]C[-1] -> 3.9871141057612E+33 | GE25: =FIB(RC[-101])+RC[-1]+R[-1]C+R[-1]C[-1] -> 5.25323189871488E+33 | GF25: =FIB(RC[-101])+RC[-1]+R[-1]C+R[-1]C[-1] -> 6.9000020245114E+33 | GG25: =FIB(RC[-101])+RC[-1]+R[-1]C+R[-1]C[-1] -> 9.03558266351425E+33 | GH25: =FIB(RC[-101])+RC[-1]+R[-1]C+R[-1]C[-1] -> 1.1797120546845E+34 | GI25: =FIB(RC[-101])+RC[-1]+R[-1]C+R[-1]C[-1] -> 1.53580640427575E+34 | GJ25: =FIB(RC[-101])+RC[-1]+R[-1]C+R[-1]C[-1] -> 1.9937208651771E+34 | GK25: =FIB(RC[-101])+RC[-1]+R[-1]C+R[-1]C[-1] -> 2.58098592589968E+34 | GL25: =FIB(RC[-101])+RC[-1]+R[-1]C+R[-1]C[-1] -> 3.33215731145567E+34 | GM25: =FIB(RC[-101])+RC[-1]+R[-1]C+R[-1]C[-1] -> 4.29050424861701E+34 | GN25: =FIB(RC[-101])+RC[-1]+R[-1]C+R[-1]C[-1] -> 5.51007889956912E+34 | GO25: =FIB(RC[-101])+RC[-1]+R[-1]C+R[-1]C[-1] -> 7.05824760101565E+34 | GP25: =FIB(RC[-101])+RC[-1]+R[-1]C+R[-1]C[-1] -> 9.01878048256085E+34 | GQ25: =FIB(RC[-101])+RC[-1]+R[-1]C+R[-1]C[-1] -> 1.14956149075918E+35 | GR25: =FIB(RC[-101])+RC[-1]+R[-1]C+R[-1]C[-1] -> 1.46174304824542E+35 | GS25: =FIB(RC[-101])+RC[-1]+R[-1]C+R[-1]C[-1] -> 1.85431996949185E+35
A26: 20 | B26: 20 | C26: 20 | D26: 20 | E26: 20 | F26: 20 | G26: 20 | H26: 20 | I26: 20 | J26: 20 | K26: 20 | L26: 20 | M26: 20 | N26: 20 | O26: 20 | P26: 20 | Q26: 20 | R26: 20 | S26: 20 | T26: 20 | U26: 20 | V26: 20 | W26: 20 | X26: 20 | Y26: 20 | Z26: 20 | AA26: 20 | AB26: 20 | AC26: 20 | AD26: 20 | AE26: 20 | AF26: 20 | AG26: 20 | AH26: 20 | AI26: 20 | AJ26: 20 | AK26: 20 | AL26: 20 | AM26: 20 | AN26: 20 | AO26: 20 | AP26: 20 | AQ26: 20 | AR26: 20 | AS26: 20 | AT26: 20 | AU26: 20 | AV26: 20 | AW26: 20 | AX26: 20 | AY26: 20 | AZ26: 20 | BA26: 20 | BB26: 20 | BC26: 20 | BD26: 20 | BE26: 20 | BF26: 20 | BG26: 20 | BH26: 20 | BI26: 20 | BJ26: 20 | BK26: 20 | BL26: 20 | BM26: 20 | BN26: 20 | BO26: 20 | BP26: 20 | BQ26: 20 | BR26: 20 | BS26: 20 | BT26: 20 | BU26: 20 | BV26: 20 | BW26: 20 | BX26: 20 | BY26: 20 | BZ26: 20 | CA26: 20 | CB26: 20 | CC26: 20 | CD26: 20 | CE26: 20 | CF26: 20 | CG26: 20 | CH26: 20 | CI26: 20 | CJ26: 20 | CK26: 20 | CL26: 20 | CM26: 20 | CN26: 20 | CO26: 20 | CP26: 20 | CQ26: 20 | CR26: 20 | CS26: 20 | CT26: 20 | CU26: 20 | CV26: 20 | CW26: 0 | CX26: =FIB(RC[-101])+RC[-1]+R[-1]C+R[-1]C[-1] -> 273650 | CY26: =FIB(RC[-101])+RC[-1]+R[-1]C+R[-1]C[-1] -> 7114900 | CZ26: =FIB(RC[-101])+RC[-1]+R[-1]C+R[-1]C[-1] -> 121226950 | DA26: =FIB(RC[-101])+RC[-1]+R[-1]C+R[-1]C[-1] -> 1551048200 | DB26: =FIB(RC[-101])+RC[-1]+R[-1]C+R[-1]C[-1] -> 15917727930 | DC26: =FIB(RC[-101])+RC[-1]+R[-1]C+R[-1]C[-1] -> 136593273180 | DD26: =FIB(RC[-101])+RC[-1]+R[-1]C+R[-1]C[-1] -> 1008823367630 | DE26: =FIB(RC[-101])+RC[-1]+R[-1]C+R[-1]C[-1] -> 6550768116880 | DF26: =FIB(RC[-101])+RC[-1]+R[-1]C+R[-1]C[-1] -> 38017751241730 | DG26: =FIB(RC[-101])+RC[-1]+R[-1]C+R[-1]C[-1] -> 199786222665380 | DH26: =FIB(RC[-101])+RC[-1]+R[-1]C+R[-1]C[-1] -> 960843169875030 | DI26: =FIB(RC[-101])+RC[-1]+R[-1]C+R[-1]C[-1] -> 4.26672084276828E+15 | DJ26: =FIB(RC[-101])+RC[-1]+R[-1]C+R[-1]C[-1] -> 1.76256062323043E+16 | DK26: =FIB(RC[-101])+RC[-1]+R[-1]C+R[-1]C[-1] -> 6.81695206288416E+16 | DL26: =FIB(RC[-101])+RC[-1]+R[-1]C+R[-1]C[-1] -> 2.48226935954897E+17 | DM26: =FIB(RC[-101])+RC[-1]+R[-1]C+R[-1]C[-1] -> 8.5513228394579E+17 | DN26: =FIB(RC[-101])+RC[-1]+R[-1]C+R[-1]C[-1] -> 2.79902220332435E+18 | DO26: =FIB(RC[-101])+RC[-1]+R[-1]C+R[-1]C[-1] -> 8.73818784425669E+18 | DP26: =FIB(RC[-101])+RC[-1]+R[-1]C+R[-1]C[-1] -> 2.61068410377332E+19 | DQ26: =FIB(RC[-101])+RC[-1]+R[-1]C+R[-1]C[-1] -> 7.48737230982634E+19 | DR26: =FIB(RC[-101])+RC[-1]+R[-1]C+R[-1]C[-1] -> 2.06699842798386E+20 | DS26: =FIB(RC[-101])+RC[-1]+R[-1]C+R[-1]C[-1] -> 5.506381894446E+20 | DT26: =FIB(RC[-101])+RC[-1]+R[-1]C+R[-1]C[-1] -> 1.41869322622779E+21 | DU26: =FIB(RC[-101])+RC[-1]+R[-1]C+R[-1]C[-1] -> 3.54241803728512E+21 | DV26: =FIB(RC[-101])+RC[-1]+R[-1]C+R[-1]C[-1] -> 8.58847829324032E+21 | DW26: =FIB(RC[-101])+RC[-1]+R[-1]C+R[-1]C[-1] -> 2.02528016879763E+22 | DX26: =FIB(RC[-101])+RC[-1]+R[-1]C+R[-1]C[-1] -> 4.65256785818904E+22 | DY26: =FIB(RC[-101])+RC[-1]+R[-1]C+R[-1]C[-1] -> 1.04272687616135E+23 | DZ26: =FIB(RC[-101])+RC[-1]+R[-1]C+R[-1]C[-1] -> 2.28297450645372E+23 | EA26: =FIB(RC[-101])+RC[-1]+R[-1]C+R[-1]C[-1] -> 4.88902597459396E+23 | EB26: =FIB(RC[-101])+RC[-1]+R[-1]C+R[-1]C[-1] -> 1.02525664483195E+24 | EC26: =FIB(RC[-101])+RC[-1]+R[-1]C+R[-1]C[-1] -> 2.10762716898971E+24 | ED26: =FIB(RC[-101])+RC[-1]+R[-1]C+R[-1]C[-1] -> 4.25143025009386E+24 | EE26: =FIB(RC[-101])+RC[-1]+R[-1]C+R[-1]C[-1] -> 8.42278350974845E+24 | EF26: =FIB(RC[-101])+RC[-1]+R[-1]C+R[-1]C[-1] -> 1.64031596428675E+25 | EG26: =FIB(RC[-101])+RC[-1]+R[-1]C+R[-1]C[-1] -> 3.14266267952066E+25 | EH26: =FIB(RC[-101])+RC[-1]+R[-1]C+R[-1]C[-1] -> 5.92776138837505E+25 | EI26: =FIB(RC[-101])+RC[-1]+R[-1]C+R[-1]C[-1] -> 1.10156407881419E+26 | EJ26: =FIB(RC[-101])+RC[-1]+R[-1]C+R[-1]C[-1] -> 2.01808362295766E+26 | EK26: =FIB(RC[-101])+RC[-1]+R[-1]C+R[-1]C[-1] -> 3.64708159611485E+26 | EL26: =FIB(RC[-101])+RC[-1]+R[-1]C+R[-1]C[-1] -> 6.50547576390644E+26 | EM26: =FIB(RC[-101])+RC[-1]+R[-1]C+R[-1]C[-1] -> 1.14597526047604E+27 | EN26: =FIB(RC[-101])+RC[-1]+R[-1]C+R[-1]C[-1] -> 1.9945985230857E+27 | EO26: =FIB(RC[-101])+RC[-1]+R[-1]C+R[-1]C[-1] -> 3.43185138358728E+27 | EP26: =FIB(RC[-101])+RC[-1]+R[-1]C+R[-1]C[-1] -> 5.83970567952716E+27 | EQ26: =FIB(RC[-101])+RC[-1]+R[-1]C+R[-1]C[-1] -> 9.83170221559376E+27 | ER26: =FIB(RC[-101])+RC[-1]+R[-1]C+R[-1]C[-1] -> 1.63838994522028E+28 | ES26: =FIB(RC[-101])+RC[-1]+R[-1]C+R[-1]C[-1] -> 2.70347682540677E+28 | ET26: =FIB(RC[-101])+RC[-1]+R[-1]C+R[-1]C[-1] -> 4.4187762340065E+28 | EU26: =FIB(RC[-101])+RC[-1]+R[-1]C+R[-1]C[-1] -> 7.15655904758527E+28 | EV26: =FIB(RC[-101])+RC[-1]+R[-1]C+R[-1]C[-1] -> 1.14886926103367E+29 | EW26: =FIB(RC[-101])+RC[-1]+R[-1]C+R[-1]C[-1] -> 1.82866891260389E+29 | EX26: =FIB(RC[-101])+RC[-1]+R[-1]C+R[-1]C[-1] -> 2.88685502106697E+29 | EY26: =FIB(RC[-101])+RC[-1]+R[-1]C+R[-1]C[-1] -> 4.52127886004484E+29 | EZ26: =FIB(RC[-101])+RC[-1]+R[-1]C+R[-1]C[-1] -> 7.02682532727097E+29 | FA26: =FIB(RC[-101])+RC[-1]+R[-1]C+R[-1]C[-1] -> 1.08399719463087E+30 | FB26: =FIB(RC[-101])+RC[-1]+R[-1]C+R[-1]C[-1] -> 1.66024699577003E+30 | FC26: =FIB(RC[-101])+RC[-1]+R[-1]C+R[-1]C[-1] -> 2.5251799461764E+30 | FD26: =FIB(RC[-101])+RC[-1]+R[-1]C+R[-1]C[-1] -> 3.81488988151963E+30 | FE26: =FIB(RC[-101])+RC[-1]+R[-1]C+R[-1]C[-1] -> 5.72575001303181E+30 | FF26: =FIB(RC[-101])+RC[-1]+R[-1]C+R[-1]C[-1] -> 8.5394531730459E+30 | FG26: =FIB(RC[-101])+RC[-1]+R[-1]C+R[-1]C[-1] -> 1.26577881067787E+31 | FH26: =FIB(RC[-101])+RC[-1]+R[-1]C+R[-1]C[-1] -> 1.8650687145628E+31 | FI26: =FIB(RC[-101])+RC[-1]+R[-1]C+R[-1]C[-1] -> 2.73222764867826E+31 | FJ26: =FIB(RC[-101])+RC[-1]+R[-1]C+R[-1]C[-1] -> 3.98012319714785E+31 | FK26: =FIB(RC[-101])+RC[-1]+R[-1]C+R[-1]C[-1] -> 5.76638000331253E+31 | FL26: =FIB(RC[-101])+RC[-1]+R[-1]C+R[-1]C[-1] -> 8.31005240568204E+31 | FM26: =FIB(RC[-101])+RC[-1]+R[-1]C+R[-1]C[-1] -> 1.1914119601643E+32 | FN26: =FIB(RC[-101])+RC[-1]+R[-1]C+R[-1]C[-1] -> 1.69957052647851E+32 | FO26: =FIB(RC[-101])+RC[-1]+R[-1]C+R[-1]C[-1] -> 2.41265031573915E+32 | FP26: =FIB(RC[-101])+RC[-1]+R[-1]C+R[-1]C[-1] -> 3.4086634219182E+32 | FQ26: =FIB(RC[-101])+RC[-1]+R[-1]C+R[-1]C[-1] -> 4.79361120743484E+32 | FR26: =FIB(RC[-101])+RC[-1]+R[-1]C+R[-1]C[-1] -> 6.71093065694914E+32 | FS26: =FIB(RC[-101])+RC[-1]+R[-1]C+R[-1]C[-1] -> 9.35393353577229E+32 | FT26: =FIB(RC[-101])+RC[-1]+R[-1]C+R[-1]C[-1] -> 1.29821263858483E+33 | FU26: =FIB(RC[-101])+RC[-1]+R[-1]C+R[-1]C[-1] -> 1.79425455376472E+33 | FV26: =FIB(RC[-101])+RC[-1]+R[-1]C+R[-1]C[-1] -> 2.46975510096685E+33 | FW26: =FIB(RC[-101])+RC[-1]+R[-1]C+R[-1]C[-1] -> 3.38609116396401E+33 | FX26: =FIB(RC[-101])+RC[-1]+R[-1]C+R[-1]C[-1] -> 4.62444996503265E+33 | FY26: =FIB(RC[-101])+RC[-1]+R[-1]C+R[-1]C[-1] -> 6.29185187712277E+33 | FZ26: =FIB(RC[-101])+RC[-1]+R[-1]C+R[-1]C[-1] -> 8.528894357233E+33 | GA26: =FIB(RC[-101])+RC[-1]+R[-1]C+R[-1]C[-1] -> 1.1519678222754E+34 | GB26: =FIB(RC[-101])+RC[-1]+R[-1]C+R[-1]C[-1] -> 1.55044930922116E+34 | GC26: =FIB(RC[-101])+RC[-1]+R[-1]C+R[-1]C[-1] -> 2.07959814308497E+34 | GD26: =FIB(RC[-101])+RC[-1]+R[-1]C+R[-1]C[-1] -> 2.77996761496365E+34 | GE26: =FIB(RC[-101])+RC[-1]+R[-1]C+R[-1]C[-1] -> 3.70400221541126E+34 | GF26: =FIB(RC[-101])+RC[-1]+R[-1]C+R[-1]C[-1] -> 4.91932560773389E+34 | GG26: =FIB(RC[-101])+RC[-1]+R[-1]C+R[-1]C[-1] -> 6.51288407653645E+34 | GH26: =FIB(RC[-101])+RC[-1]+R[-1]C+R[-1]C[-1] -> 8.59615439757237E+34 | GI26: =FIB(RC[-101])+RC[-1]+R[-1]C+R[-1]C[-1] -> 1.13116728565326E+35 | GJ26: =FIB(RC[-101])+RC[-1]+R[-1]C+R[-1]C[-1] -> 1.48412001259855E+35 | GK26: =FIB(RC[-101])+RC[-1]+R[-1]C+R[-1]C[-1] -> 1.94159069170622E+35 | GL26: =FIB(RC[-101])+RC[-1]+R[-1]C+R[-1]C[-1] -> 2.53290501544176E+35 | GM26: =FIB(RC[-101])+RC[-1]+R[-1]C+R[-1]C[-1] -> 3.29517117144903E+35 | GN26: =FIB(RC[-101])+RC[-1]+R[-1]C+R[-1]C[-1] -> 4.27522948626764E+35 | GO26: =FIB(RC[-101])+RC[-1]+R[-1]C+R[-1]C[-1] -> 5.53206213632612E+35 | GP26: =FIB(RC[-101])+RC[-1]+R[-1]C+R[-1]C[-1] -> 7.13976494468377E+35 | GQ26: =FIB(RC[-101])+RC[-1]+R[-1]C+R[-1]C[-1] -> 9.19120448369904E+35 | GR26: =FIB(RC[-101])+RC[-1]+R[-1]C+R[-1]C[-1] -> 1.18025090227036E+36 | GS26: =FIB(RC[-101])+RC[-1]+R[-1]C+R[-1]C[-1] -> 1.51185720404409E+36
A27: 20 | B27: 20 | C27: 20 | D27: 20 | E27: 20 | F27: 20 | G27: 20 | H27: 20 | I27: 20 | J27: 20 | K27: 20 | L27: 20 | M27: 20 | N27: 20 | O27: 20 | P27: 20 | Q27: 20 | R27: 20 | S27: 20 | T27: 20 | U27: 20 | V27: 20 | W27: 20 | X27: 20 | Y27: 20 | Z27: 20 | AA27: 20 | AB27: 20 | AC27: 20 | AD27: 20 | AE27: 20 | AF27: 20 | AG27: 20 | AH27: 20 | AI27: 20 | AJ27: 20 | AK27: 20 | AL27: 20 | AM27: 20 | AN27: 20 | AO27: 20 | AP27: 20 | AQ27: 20 | AR27: 20 | AS27: 20 | AT27: 20 | AU27: 20 | AV27: 20 | AW27: 20 | AX27: 20 | AY27: 20 | AZ27: 20 | BA27: 20 | BB27: 20 | BC27: 20 | BD27: 20 | BE27: 20 | BF27: 20 | BG27: 20 | BH27: 20 | BI27: 20 | BJ27: 20 | BK27: 20 | BL27: 20 | BM27: 20 | BN27: 20 | BO27: 20 | BP27: 20 | BQ27: 20 | BR27: 20 | BS27: 20 | BT27: 20 | BU27: 20 | BV27: 20 | BW27: 20 | BX27: 20 | BY27: 20 | BZ27: 20 | CA27: 20 | CB27: 20 | CC27: 20 | CD27: 20 | CE27: 20 | CF27: 20 | CG27: 20 | CH27: 20 | CI27: 20 | CJ27: 20 | CK27: 20 | CL27: 20 | CM27: 20 | CN27: 20 | CO27: 20 | CP27: 20 | CQ27: 20 | CR27: 20 | CS27: 20 | CT27: 20 | CU27: 20 | CV27: 20 | CW27: 0 | CX27: =FIB(RC[-101])+RC[-1]+R[-1]C+R[-1]C[-1] -> 284596 | CY27: =FIB(RC[-101])+RC[-1]+R[-1]C+R[-1]C[-1] -> 7684092 | CZ27: =FIB(RC[-101])+RC[-1]+R[-1]C+R[-1]C[-1] -> 136036888 | DA27: =FIB(RC[-101])+RC[-1]+R[-1]C+R[-1]C[-1] -> 1808322984 | DB27: =FIB(RC[-101])+RC[-1]+R[-1]C+R[-1]C[-1] -> 19277110060 | DC27: =FIB(RC[-101])+RC[-1]+R[-1]C+R[-1]C[-1] -> 171788122116 | DD27: =FIB(RC[-101])+RC[-1]+R[-1]C+R[-1]C[-1] -> 1317204773872 | DE27: =FIB(RC[-101])+RC[-1]+R[-1]C+R[-1]C[-1] -> 8876796269328 | DF27: =FIB(RC[-101])+RC[-1]+R[-1]C+R[-1]C[-1] -> 53445315638884 | DG27: =FIB(RC[-101])+RC[-1]+R[-1]C+R[-1]C[-1] -> 291249289556940 | DH27: =FIB(RC[-101])+RC[-1]+R[-1]C+R[-1]C[-1] -> 1.4518786821083E+15 | DI27: =FIB(RC[-101])+RC[-1]+R[-1]C+R[-1]C[-1] -> 6.67944269476255E+15 | DJ27: =FIB(RC[-101])+RC[-1]+R[-1]C+R[-1]C[-1] -> 2.85717697698461E+16 | DK27: =FIB(RC[-101])+RC[-1]+R[-1]C+R[-1]C[-1] -> 1.14366896631003E+17 | DL27: =FIB(RC[-101])+RC[-1]+R[-1]C+R[-1]C[-1] -> 4.30763353214753E+17 | DM27: =FIB(RC[-101])+RC[-1]+R[-1]C+R[-1]C[-1] -> 1.53412257311545E+18 | DN27: =FIB(RC[-101])+RC[-1]+R[-1]C+R[-1]C[-1] -> 5.1882770603856E+18 | DO27: =FIB(RC[-101])+RC[-1]+R[-1]C+R[-1]C[-1] -> 1.67254871079667E+19 | DP27: =FIB(RC[-101])+RC[-1]+R[-1]C+R[-1]C[-1] -> 5.15705159899565E+19 | DQ27: =FIB(RC[-101])+RC[-1]+R[-1]C+R[-1]C[-1] -> 1.52551080125953E+20 | DR27: =FIB(RC[-101])+RC[-1]+R[-1]C+R[-1]C[-1] -> 4.34124646022602E+20 | DS27: =FIB(RC[-101])+RC[-1]+R[-1]C+R[-1]C[-1] -> 1.19146267826559E+21 | DT27: =FIB(RC[-101])+RC[-1]+R[-1]C+R[-1]C[-1] -> 3.16079409393797E+21 | DU27: =FIB(RC[-101])+RC[-1]+R[-1]C+R[-1]C[-1] -> 8.12190535745088E+21 | DV27: =FIB(RC[-101])+RC[-1]+R[-1]C+R[-1]C[-1] -> 2.02528016879763E+22 | DW27: =FIB(RC[-101])+RC[-1]+R[-1]C+R[-1]C[-1] -> 4.9094081669193E+22 | DX27: =FIB(RC[-101])+RC[-1]+R[-1]C+R[-1]C[-1] -> 1.1587256193906E+23 | DY27: =FIB(RC[-101])+RC[-1]+R[-1]C+R[-1]C[-1] -> 2.66670928137085E+23 | DZ27: =FIB(RC[-101])+RC[-1]+R[-1]C+R[-1]C[-1] -> 5.99241066398592E+23 | EA27: =FIB(RC[-101])+RC[-1]+R[-1]C+R[-1]C[-1] -> 1.31644111450336E+24 | EB27: =FIB(RC[-101])+RC[-1]+R[-1]C+R[-1]C[-1] -> 2.8306003567947E+24 | EC27: =FIB(RC[-101])+RC[-1]+R[-1]C+R[-1]C[-1] -> 5.96348417061636E+24 | ED27: =FIB(RC[-101])+RC[-1]+R[-1]C+R[-1]C[-1] -> 1.23225415896999E+25 | EE27: =FIB(RC[-101])+RC[-1]+R[-1]C+R[-1]C[-1] -> 2.49967553495422E+25 | EF27: =FIB(RC[-101])+RC[-1]+R[-1]C+R[-1]C[-1] -> 4.98226985021582E+25 | EG27: =FIB(RC[-101])+RC[-1]+R[-1]C+R[-1]C[-1] -> 9.76524849402323E+25 | EH27: =FIB(RC[-101])+RC[-1]+R[-1]C+R[-1]C[-1] -> 1.88356725619189E+26 | EI27: =FIB(RC[-101])+RC[-1]+R[-1]C+R[-1]C[-1] -> 3.57790747384359E+26 | EJ27: =FIB(RC[-101])+RC[-1]+R[-1]C+R[-1]C[-1] -> 6.69755517561544E+26 | EK27: =FIB(RC[-101])+RC[-1]+R[-1]C+R[-1]C[-1] -> 1.2362720394688E+27 | EL27: =FIB(RC[-101])+RC[-1]+R[-1]C+R[-1]C[-1] -> 2.25152777547092E+27 | EM27: =FIB(RC[-101])+RC[-1]+R[-1]C+R[-1]C[-1] -> 4.04805061233761E+27 | EN27: =FIB(RC[-101])+RC[-1]+R[-1]C+R[-1]C[-1] -> 7.18862439589935E+27 | EO27: =FIB(RC[-101])+RC[-1]+R[-1]C+R[-1]C[-1] -> 1.26150743025723E+28 | EP27: =FIB(RC[-101])+RC[-1]+R[-1]C+R[-1]C[-1] -> 2.18866313656868E+28 | EQ27: =FIB(RC[-101])+RC[-1]+R[-1]C+R[-1]C[-1] -> 3.75580392608077E+28 | ER27: =FIB(RC[-101])+RC[-1]+R[-1]C+R[-1]C[-1] -> 6.37736409286043E+28 | ES27: =FIB(RC[-101])+RC[-1]+R[-1]C+R[-1]C[-1] -> 1.07192308634875E+29 | ET27: =FIB(RC[-101])+RC[-1]+R[-1]C+R[-1]C[-1] -> 1.78414839229007E+29 | EU27: =FIB(RC[-101])+RC[-1]+R[-1]C+R[-1]C[-1] -> 2.94168192044925E+29 | EV27: =FIB(RC[-101])+RC[-1]+R[-1]C+R[-1]C[-1] -> 4.80620708624145E+29 | EW27: =FIB(RC[-101])+RC[-1]+R[-1]C+R[-1]C[-1] -> 7.78374525987902E+29 | EX27: =FIB(RC[-101])+RC[-1]+R[-1]C+R[-1]C[-1] -> 1.24992691935499E+30 | EY27: =FIB(RC[-101])+RC[-1]+R[-1]C+R[-1]C[-1] -> 1.99074030746617E+30 | EZ27: =FIB(RC[-101])+RC[-1]+R[-1]C+R[-1]C[-1] -> 3.14555072619775E+30 | FA27: =FIB(RC[-101])+RC[-1]+R[-1]C+R[-1]C[-1] -> 4.93223045355572E+30 | FB27: =FIB(RC[-101])+RC[-1]+R[-1]C+R[-1]C[-1] -> 7.67647464395661E+30 | FC27: =FIB(RC[-101])+RC[-1]+R[-1]C+R[-1]C[-1] -> 1.1861901585903E+31 | FD27: =FIB(RC[-101])+RC[-1]+R[-1]C+R[-1]C[-1] -> 1.82019714135991E+31 | FE27: =FIB(RC[-101])+RC[-1]+R[-1]C+R[-1]C[-1] -> 2.77426113081505E+31 | FF27: =FIB(RC[-101])+RC[-1]+R[-1]C+R[-1]C[-1] -> 4.20078144942282E+31 | FG27: =FIB(RC[-101])+RC[-1]+R[-1]C+R[-1]C[-1] -> 6.32050557740528E+31 | FH27: =FIB(RC[-101])+RC[-1]+R[-1]C+R[-1]C[-1] -> 9.45135310264595E+31 | FI27: =FIB(RC[-101])+RC[-1]+R[-1]C+R[-1]C[-1] -> 1.4048649465887E+32 | FJ27: =FIB(RC[-101])+RC[-1]+R[-1]C+R[-1]C[-1] -> 2.07610003117131E+32 | FK27: =FIB(RC[-101])+RC[-1]+R[-1]C+R[-1]C[-1] -> 3.05075035121735E+32 | FL27: =FIB(RC[-101])+RC[-1]+R[-1]C+R[-1]C[-1] -> 4.45839359211681E+32 | FM27: =FIB(RC[-101])+RC[-1]+R[-1]C+R[-1]C[-1] -> 6.48081079284931E+32 | FN27: =FIB(RC[-101])+RC[-1]+R[-1]C+R[-1]C[-1] -> 9.37179327949212E+32 | FO27: =FIB(RC[-101])+RC[-1]+R[-1]C+R[-1]C[-1] -> 1.34840141217098E+33 | FP27: =FIB(RC[-101])+RC[-1]+R[-1]C+R[-1]C[-1] -> 1.93053278593671E+33 | FQ27: =FIB(RC[-101])+RC[-1]+R[-1]C+R[-1]C[-1] -> 2.75076024887202E+33 | FR27: =FIB(RC[-101])+RC[-1]+R[-1]C+R[-1]C[-1] -> 3.90121443531042E+33 | FS27: =FIB(RC[-101])+RC[-1]+R[-1]C+R[-1]C[-1] -> 5.50770085458256E+33 | FT27: =FIB(RC[-101])+RC[-1]+R[-1]C+R[-1]C[-1] -> 7.74130684674462E+33 | FU27: =FIB(RC[-101])+RC[-1]+R[-1]C+R[-1]C[-1] -> 1.08337740390942E+34 | FV27: =FIB(RC[-101])+RC[-1]+R[-1]C+R[-1]C[-1] -> 1.50977836938257E+34 | FW27: =FIB(RC[-101])+RC[-1]+R[-1]C+R[-1]C[-1] -> 2.09536299587566E+34 | FX27: =FIB(RC[-101])+RC[-1]+R[-1]C+R[-1]C[-1] -> 2.89641710877533E+34 | FY27: =FIB(RC[-101])+RC[-1]+R[-1]C+R[-1]C[-1] -> 3.98804729299087E+34 | FZ27: =FIB(RC[-101])+RC[-1]+R[-1]C+R[-1]C[-1] -> 5.47012191642645E+34 | GA27: =FIB(RC[-101])+RC[-1]+R[-1]C+R[-1]C[-1] -> 7.47497917442514E+34 | GB27: =FIB(RC[-101])+RC[-1]+R[-1]C+R[-1]C[-1] -> 1.01773963059217E+35 | GC27: =FIB(RC[-101])+RC[-1]+R[-1]C+R[-1]C[-1] -> 1.38074437582278E+35 | GD27: =FIB(RC[-101])+RC[-1]+R[-1]C+R[-1]C[-1] -> 1.86670095162764E+35 | GE27: =FIB(RC[-101])+RC[-1]+R[-1]C+R[-1]C[-1] -> 2.51509793466514E+35 | GF27: =FIB(RC[-101])+RC[-1]+R[-1]C+R[-1]C[-1] -> 3.37743071697965E+35 | GG27: =FIB(RC[-101])+RC[-1]+R[-1]C+R[-1]C[-1] -> 4.52065168540668E+35 | GH27: =FIB(RC[-101])+RC[-1]+R[-1]C+R[-1]C[-1] -> 6.03155553281757E+35 | GI27: =FIB(RC[-101])+RC[-1]+R[-1]C+R[-1]C[-1] -> 8.02233825822807E+35 | GJ27: =FIB(RC[-101])+RC[-1]+R[-1]C+R[-1]C[-1] -> 1.06376255564799E+36 | GK27: =FIB(RC[-101])+RC[-1]+R[-1]C+R[-1]C[-1] -> 1.40633362607846E+36 | GL27: =FIB(RC[-101])+RC[-1]+R[-1]C+R[-1]C[-1] -> 1.85378319679326E+36 | GM27: =FIB(RC[-101])+RC[-1]+R[-1]C+R[-1]C[-1] -> 2.43659081548234E+36 | GN27: =FIB(RC[-101])+RC[-1]+R[-1]C+R[-1]C[-1] -> 3.19363088125401E+36 | GO27: =FIB(RC[-101])+RC[-1]+R[-1]C+R[-1]C[-1] -> 4.17436004351338E+36 | GP27: =FIB(RC[-101])+RC[-1]+R[-1]C+R[-1]C[-1] -> 5.44154275161437E+36 | GQ27: =FIB(RC[-101])+RC[-1]+R[-1]C+R[-1]C[-1] -> 7.07463969445265E+36 | GR27: =FIB(RC[-101])+RC[-1]+R[-1]C+R[-1]C[-1] -> 9.17401104509292E+36 | GS27: =FIB(RC[-101])+RC[-1]+R[-1]C+R[-1]C[-1] -> 1.18661191514074E+37
A28: 20 | B28: 20 | C28: 20 | D28: 20 | E28: 20 | F28: 20 | G28: 20 | H28: 20 | I28: 20 | J28: 20 | K28: 20 | L28: 20 | M28: 20 | N28: 20 | O28: 20 | P28: 20 | Q28: 20 | R28: 20 | S28: 20 | T28: 20 | U28: 20 | V28: 20 | W28: 20 | X28: 20 | Y28: 20 | Z28: 20 | AA28: 20 | AB28: 20 | AC28: 20 | AD28: 20 | AE28: 20 | AF28: 20 | AG28: 20 | AH28: 20 | AI28: 20 | AJ28: 20 | AK28: 20 | AL28: 20 | AM28: 20 | AN28: 20 | AO28: 20 | AP28: 20 | AQ28: 20 | AR28: 20 | AS28: 20 | AT28: 20 | AU28: 20 | AV28: 20 | AW28: 20 | AX28: 20 | AY28: 20 | AZ28: 20 | BA28: 20 | BB28: 20 | BC28: 20 | BD28: 20 | BE28: 20 | BF28: 20 | BG28: 20 | BH28: 20 | BI28: 20 | BJ28: 20 | BK28: 20 | BL28: 20 | BM28: 20 | BN28: 20 | BO28: 20 | BP28: 20 | BQ28: 20 | BR28: 20 | BS28: 20 | BT28: 20 | BU28: 20 | BV28: 20 | BW28: 20 | BX28: 20 | BY28: 20 | BZ28: 20 | CA28: 20 | CB28: 20 | CC28: 20 | CD28: 20 | CE28: 20 | CF28: 20 | CG28: 20 | CH28: 20 | CI28: 20 | CJ28: 20 | CK28: 20 | CL28: 20 | CM28: 20 | CN28: 20 | CO28: 20 | CP28: 20 | CQ28: 20 | CR28: 20 | CS28: 20 | CT28: 20 | CU28: 20 | CV28: 20 | CW28: 0 | CX28: =FIB(RC[-101])+RC[-1]+R[-1]C+R[-1]C[-1] -> 295542 | CY28: =FIB(RC[-101])+RC[-1]+R[-1]C+R[-1]C[-1] -> 8275176 | CZ28: =FIB(RC[-101])+RC[-1]+R[-1]C+R[-1]C[-1] -> 152007102 | DA28: =FIB(RC[-101])+RC[-1]+R[-1]C+R[-1]C[-1] -> 2096377920 | DB28: =FIB(RC[-101])+RC[-1]+R[-1]C+R[-1]C[-1] -> 23181821910 | DC28: =FIB(RC[-101])+RC[-1]+R[-1]C+R[-1]C[-1] -> 214247065032 | DD28: =FIB(RC[-101])+RC[-1]+R[-1]C+R[-1]C[-1] -> 1703239971966 | DE28: =FIB(RC[-101])+RC[-1]+R[-1]C+R[-1]C[-1] -> 11897241026112 | DF28: =FIB(RC[-101])+RC[-1]+R[-1]C+R[-1]C[-1] -> 74219352945270 | DG28: =FIB(RC[-101])+RC[-1]+R[-1]C+R[-1]C[-1] -> 418913958152040 | DH28: =FIB(RC[-101])+RC[-1]+R[-1]C+R[-1]C[-1] -> 2.16204192982822E+15 | DI28: =FIB(RC[-101])+RC[-1]+R[-1]C+R[-1]C[-1] -> 1.029336330671E+16 | DJ28: =FIB(RC[-101])+RC[-1]+R[-1]C+R[-1]C[-1] -> 4.55445757713296E+16 | DK28: =FIB(RC[-101])+RC[-1]+R[-1]C+R[-1]C[-1] -> 1.8848324217219E+17 | DL28: =FIB(RC[-101])+RC[-1]+R[-1]C+R[-1]C[-1] -> 7.33613492017956E+17 | DM28: =FIB(RC[-101])+RC[-1]+R[-1]C+R[-1]C[-1] -> 2.69849941834817E+18 | DN28: =FIB(RC[-101])+RC[-1]+R[-1]C+R[-1]C[-1] -> 9.42089905184923E+18 | DO28: =FIB(RC[-101])+RC[-1]+R[-1]C+R[-1]C[-1] -> 3.13346632202015E+19 | DP28: =FIB(RC[-101])+RC[-1]+R[-1]C+R[-1]C[-1] -> 9.96306663181247E+19 | DQ28: =FIB(RC[-101])+RC[-1]+R[-1]C+R[-1]C[-1] -> 3.03752262434034E+20 | DR28: =FIB(RC[-101])+RC[-1]+R[-1]C+R[-1]C[-1] -> 8.90427988582589E+20 | DS28: =FIB(RC[-101])+RC[-1]+R[-1]C+R[-1]C[-1] -> 2.51601531287078E+21 | DT28: =FIB(RC[-101])+RC[-1]+R[-1]C+R[-1]C[-1] -> 6.86827208507434E+21 | DU28: =FIB(RC[-101])+RC[-1]+R[-1]C+R[-1]C[-1] -> 1.81509715364632E+22 | DV28: =FIB(RC[-101])+RC[-1]+R[-1]C+R[-1]C[-1] -> 4.65256785818904E+22 | DW28: =FIB(RC[-101])+RC[-1]+R[-1]C+R[-1]C[-1] -> 1.1587256193906E+23 | DX28: =FIB(RC[-101])+RC[-1]+R[-1]C+R[-1]C[-1] -> 2.80839205547312E+23 | DY28: =FIB(RC[-101])+RC[-1]+R[-1]C+R[-1]C[-1] -> 6.63382695623457E+23 | DZ28: =FIB(RC[-101])+RC[-1]+R[-1]C+R[-1]C[-1] -> 1.52929469015913E+24 | EA28: =FIB(RC[-101])+RC[-1]+R[-1]C+R[-1]C[-1] -> 3.44497687106109E+24 | EB28: =FIB(RC[-101])+RC[-1]+R[-1]C+R[-1]C[-1] -> 7.59201834235915E+24 | EC28: =FIB(RC[-101])+RC[-1]+R[-1]C+R[-1]C[-1] -> 1.63861028697702E+25 | ED28: =FIB(RC[-101])+RC[-1]+R[-1]C+R[-1]C[-1] -> 3.46721286300865E+25 | EE28: =FIB(RC[-101])+RC[-1]+R[-1]C+R[-1]C[-1] -> 7.19914255693287E+25 | EF28: =FIB(RC[-101])+RC[-1]+R[-1]C+R[-1]C[-1] -> 1.46810879421029E+26 | EG28: =FIB(RC[-101])+RC[-1]+R[-1]C+R[-1]C[-1] -> 2.9428606286342E+26 | EH28: =FIB(RC[-101])+RC[-1]+R[-1]C+R[-1]C[-1] -> 5.80295273422841E+26 | EI28: =FIB(RC[-101])+RC[-1]+R[-1]C+R[-1]C[-1] -> 1.12644274642639E+27 | EJ28: =FIB(RC[-101])+RC[-1]+R[-1]C+R[-1]C[-1] -> 2.15398901137229E+27 | EK28: =FIB(RC[-101])+RC[-1]+R[-1]C+R[-1]C[-1] -> 4.06001656840263E+27 | EL28: =FIB(RC[-101])+RC[-1]+R[-1]C+R[-1]C[-1] -> 7.54781638334235E+27 | EM28: =FIB(RC[-101])+RC[-1]+R[-1]C+R[-1]C[-1] -> 1.38473947711509E+28 | EN28: =FIB(RC[-101])+RC[-1]+R[-1]C+R[-1]C[-1] -> 2.50840697793878E+28 | EO28: =FIB(RC[-101])+RC[-1]+R[-1]C+R[-1]C[-1] -> 4.48877684778595E+28 | EP28: =FIB(RC[-101])+RC[-1]+R[-1]C+R[-1]C[-1] -> 7.93894741461186E+28 | EQ28: =FIB(RC[-101])+RC[-1]+R[-1]C+R[-1]C[-1] -> 1.38834144772613E+29 | ER28: =FIB(RC[-101])+RC[-1]+R[-1]C+R[-1]C[-1] -> 2.40165824962025E+29 | ES28: =FIB(RC[-101])+RC[-1]+R[-1]C+R[-1]C[-1] -> 4.11131774525504E+29 | ET28: =FIB(RC[-101])+RC[-1]+R[-1]C+R[-1]C[-1] -> 6.96738922389386E+29 | EU28: =FIB(RC[-101])+RC[-1]+R[-1]C+R[-1]C[-1] -> 1.16932195366332E+30 | EV28: =FIB(RC[-101])+RC[-1]+R[-1]C+R[-1]C[-1] -> 1.94411085433239E+30 | EW28: =FIB(RC[-101])+RC[-1]+R[-1]C+R[-1]C[-1] -> 3.20310608894444E+30 | EX28: =FIB(RC[-101])+RC[-1]+R[-1]C+R[-1]C[-1] -> 5.23140753428733E+30 | EY28: =FIB(RC[-101])+RC[-1]+R[-1]C+R[-1]C[-1] -> 8.47207476110848E+30 | EZ28: =FIB(RC[-101])+RC[-1]+R[-1]C+R[-1]C[-1] -> 1.36083657947724E+31 | FA28: =FIB(RC[-101])+RC[-1]+R[-1]C+R[-1]C[-1] -> 2.16861469745259E+31 | FB28: =FIB(RC[-101])+RC[-1]+R[-1]C+R[-1]C[-1] -> 3.42948520720382E+31 | FC28: =FIB(RC[-101])+RC[-1]+R[-1]C+R[-1]C[-1] -> 5.38332283018978E+31 | FD28: =FIB(RC[-101])+RC[-1]+R[-1]C+R[-1]C[-1] -> 8.38971013014E+31 | FE28: =FIB(RC[-101])+RC[-1]+R[-1]C+R[-1]C[-1] -> 1.2984168402315E+32 | FF28: =FIB(RC[-101])+RC[-1]+R[-1]C+R[-1]C[-1] -> 1.99592109825528E+32 | FG28: =FIB(RC[-101])+RC[-1]+R[-1]C+R[-1]C[-1] -> 3.04804980093809E+32 | FH28: =FIB(RC[-101])+RC[-1]+R[-1]C+R[-1]C[-1] -> 4.62523566894322E+32 | FI28: =FIB(RC[-101])+RC[-1]+R[-1]C+R[-1]C[-1] -> 6.97523592579651E+32 | FJ28: =FIB(RC[-101])+RC[-1]+R[-1]C+R[-1]C[-1] -> 1.04562009035565E+33 | FK28: =FIB(RC[-101])+RC[-1]+R[-1]C+R[-1]C[-1] -> 1.55830512859452E+33 | FL28: =FIB(RC[-101])+RC[-1]+R[-1]C+R[-1]C[-1] -> 2.30921952292793E+33 | FM28: =FIB(RC[-101])+RC[-1]+R[-1]C+R[-1]C[-1] -> 3.40313996142455E+33 | FN28: =FIB(RC[-101])+RC[-1]+R[-1]C+R[-1]C[-1] -> 4.98840036865869E+33 | FO28: =FIB(RC[-101])+RC[-1]+R[-1]C+R[-1]C[-1] -> 7.27398110877888E+33 | FP28: =FIB(RC[-101])+RC[-1]+R[-1]C+R[-1]C[-1] -> 1.05529153068866E+34 | FQ28: =FIB(RC[-101])+RC[-1]+R[-1]C+R[-1]C[-1] -> 1.52342083416953E+34 | FR28: =FIB(RC[-101])+RC[-1]+R[-1]C+R[-1]C[-1] -> 2.18861830258777E+34 | FS28: =FIB(RC[-101])+RC[-1]+R[-1]C+R[-1]C[-1] -> 3.12950983157707E+34 | FT28: =FIB(RC[-101])+RC[-1]+R[-1]C+R[-1]C[-1] -> 4.45441060170979E+34 | FU28: =FIB(RC[-101])+RC[-1]+R[-1]C+R[-1]C[-1] -> 6.31191869029367E+34 | FV28: =FIB(RC[-101])+RC[-1]+R[-1]C+R[-1]C[-1] -> 8.90507446358566E+34 | FW28: =FIB(RC[-101])+RC[-1]+R[-1]C+R[-1]C[-1] -> 1.25102158288439E+35 | FX28: =FIB(RC[-101])+RC[-1]+R[-1]C+R[-1]C[-1] -> 1.75019959334949E+35 | FY28: =FIB(RC[-101])+RC[-1]+R[-1]C+R[-1]C[-1] -> 2.43864603352611E+35 | FZ28: =FIB(RC[-101])+RC[-1]+R[-1]C+R[-1]C[-1] -> 3.38446295446784E+35 | GA28: =FIB(RC[-101])+RC[-1]+R[-1]C+R[-1]C[-1] -> 4.678973063553E+35 | GB28: =FIB(RC[-101])+RC[-1]+R[-1]C+R[-1]C[-1] -> 6.44421061158768E+35 | GC28: =FIB(RC[-101])+RC[-1]+R[-1]C+R[-1]C[-1] -> 8.84269461800263E+35 | GD28: =FIB(RC[-101])+RC[-1]+R[-1]C+R[-1]C[-1] -> 1.20901399454531E+36 | GE28: =FIB(RC[-101])+RC[-1]+R[-1]C+R[-1]C[-1] -> 1.64719388317458E+36 | GF28: =FIB(RC[-101])+RC[-1]+R[-1]C+R[-1]C[-1] -> 2.23644674833906E+36 | GG28: =FIB(RC[-101])+RC[-1]+R[-1]C+R[-1]C[-1] -> 3.0262549885777E+36 | GH28: =FIB(RC[-101])+RC[-1]+R[-1]C+R[-1]C[-1] -> 4.08147571040012E+36 | GI28: =FIB(RC[-101])+RC[-1]+R[-1]C+R[-1]C[-1] -> 5.48686508950469E+36 | GJ28: =FIB(RC[-101])+RC[-1]+R[-1]C+R[-1]C[-1] -> 7.35286147097548E+36 | GK28: =FIB(RC[-101])+RC[-1]+R[-1]C+R[-1]C[-1] -> 9.82295765270193E+36 | GL28: =FIB(RC[-101])+RC[-1]+R[-1]C+R[-1]C[-1] -> 1.30830744755737E+37 | GM28: =FIB(RC[-101])+RC[-1]+R[-1]C+R[-1]C[-1] -> 1.73734484878493E+37 | GN28: =FIB(RC[-101])+RC[-1]+R[-1]C+R[-1]C[-1] -> 2.30036701845856E+37 | GO28: =FIB(RC[-101])+RC[-1]+R[-1]C+R[-1]C[-1] -> 3.0371661109353E+37 | GP28: =FIB(RC[-101])+RC[-1]+R[-1]C+R[-1]C[-1] -> 3.99875639044808E+37 | GQ28: =FIB(RC[-101])+RC[-1]+R[-1]C+R[-1]C[-1] -> 5.25037463505478E+37 | GR28: =FIB(RC[-101])+RC[-1]+R[-1]C+R[-1]C[-1] -> 6.87523970900934E+37 | GS28: =FIB(RC[-101])+RC[-1]+R[-1]C+R[-1]C[-1] -> 8.97925272865937E+37
A29: 20 | B29: 20 | C29: 20 | D29: 20 | E29: 20 | F29: 20 | G29: 20 | H29: 20 | I29: 20 | J29: 20 | K29: 20 | L29: 20 | M29: 20 | N29: 20 | O29: 20 | P29: 20 | Q29: 20 | R29: 20 | S29: 20 | T29: 20 | U29: 20 | V29: 20 | W29: 20 | X29: 20 | Y29: 20 | Z29: 20 | AA29: 20 | AB29: 20 | AC29: 20 | AD29: 20 | AE29: 20 | AF29: 20 | AG29: 20 | AH29: 20 | AI29: 20 | AJ29: 20 | AK29: 20 | AL29: 20 | AM29: 20 | AN29: 20 | AO29: 20 | AP29: 20 | AQ29: 20 | AR29: 20 | AS29: 20 | AT29: 20 | AU29: 20 | AV29: 20 | AW29: 20 | AX29: 20 | AY29: 20 | AZ29: 20 | BA29: 20 | BB29: 20 | BC29: 20 | BD29: 20 | BE29: 20 | BF29: 20 | BG29: 20 | BH29: 20 | BI29: 20 | BJ29: 20 | BK29: 20 | BL29: 20 | BM29: 20 | BN29: 20 | BO29: 20 | BP29: 20 | BQ29: 20 | BR29: 20 | BS29: 20 | BT29: 20 | BU29: 20 | BV29: 20 | BW29: 20 | BX29: 20 | BY29: 20 | BZ29: 20 | CA29: 20 | CB29: 20 | CC29: 20 | CD29: 20 | CE29: 20 | CF29: 20 | CG29: 20 | CH29: 20 | CI29: 20 | CJ29: 20 | CK29: 20 | CL29: 20 | CM29: 20 | CN29: 20 | CO29: 20 | CP29: 20 | CQ29: 20 | CR29: 20 | CS29: 20 | CT29: 20 | CU29: 20 | CV29: 20 | CW29: 0 | CX29: =FIB(RC[-101])+RC[-1]+R[-1]C+R[-1]C[-1] -> 306488 | CY29: =FIB(RC[-101])+RC[-1]+R[-1]C+R[-1]C[-1] -> 8888152 | CZ29: =FIB(RC[-101])+RC[-1]+R[-1]C+R[-1]C[-1] -> 169181376 | DA29: =FIB(RC[-101])+RC[-1]+R[-1]C+R[-1]C[-1] -> 2417577344 | DB29: =FIB(RC[-101])+RC[-1]+R[-1]C+R[-1]C[-1] -> 27695788120 | DC29: =FIB(RC[-101])+RC[-1]+R[-1]C+R[-1]C[-1] -> 265124686008 | DD29: =FIB(RC[-101])+RC[-1]+R[-1]C+R[-1]C[-1] -> 2182611733952 | DE29: =FIB(RC[-101])+RC[-1]+R[-1]C+R[-1]C[-1] -> 15783092742976 | DF29: =FIB(RC[-101])+RC[-1]+R[-1]C+R[-1]C[-1] -> 101899686725304 | DG29: =FIB(RC[-101])+RC[-1]+R[-1]C+R[-1]C[-1] -> 595032997833560 | DH29: =FIB(RC[-101])+RC[-1]+R[-1]C+R[-1]C[-1] -> 3.17598888582477E+15 | DI29: =FIB(RC[-101])+RC[-1]+R[-1]C+R[-1]C[-1] -> 1.5631394122374E+16 | DJ29: =FIB(RC[-101])+RC[-1]+R[-1]C+R[-1]C[-1] -> 7.14693332004245E+16 | DK29: =FIB(RC[-101])+RC[-1]+R[-1]C+R[-1]C[-1] -> 3.05497151143955E+17 | DL29: =FIB(RC[-101])+RC[-1]+R[-1]C+R[-1]C[-1] -> 1.22759388533411E+18 | DM29: =FIB(RC[-101])+RC[-1]+R[-1]C+R[-1]C[-1] -> 4.65970679570025E+18 | DN29: =FIB(RC[-101])+RC[-1]+R[-1]C+R[-1]C[-1] -> 1.67791052658977E+19 | DO29: =FIB(RC[-101])+RC[-1]+R[-1]C+R[-1]C[-1] -> 5.75346675379484E+19 | DP29: =FIB(RC[-101])+RC[-1]+R[-1]C+R[-1]C[-1] -> 1.88499997076275E+20 | DQ29: =FIB(RC[-101])+RC[-1]+R[-1]C+R[-1]C[-1] -> 5.91882925828434E+20 | DR29: =FIB(RC[-101])+RC[-1]+R[-1]C+R[-1]C[-1] -> 1.78606317684506E+21 | DS29: =FIB(RC[-101])+RC[-1]+R[-1]C+R[-1]C[-1] -> 5.19250647829842E+21 | DT29: =FIB(RC[-101])+RC[-1]+R[-1]C+R[-1]C[-1] -> 1.45767938762435E+22 | DU29: =FIB(RC[-101])+RC[-1]+R[-1]C+R[-1]C[-1] -> 3.95960374977811E+22 | DV29: =FIB(RC[-101])+RC[-1]+R[-1]C+R[-1]C[-1] -> 1.04272687616135E+23 | DW29: =FIB(RC[-101])+RC[-1]+R[-1]C+R[-1]C[-1] -> 2.66670928137085E+23 | DX29: =FIB(RC[-101])+RC[-1]+R[-1]C+R[-1]C[-1] -> 6.63382695623457E+23 | DY29: =FIB(RC[-101])+RC[-1]+R[-1]C+R[-1]C[-1] -> 1.60760459679423E+24 | DZ29: =FIB(RC[-101])+RC[-1]+R[-1]C+R[-1]C[-1] -> 3.80028198257682E+24 | EA29: =FIB(RC[-101])+RC[-1]+R[-1]C+R[-1]C[-1] -> 8.77455354379703E+24 | EB29: =FIB(RC[-101])+RC[-1]+R[-1]C+R[-1]C[-1] -> 1.98115487572173E+25 | EC29: =FIB(RC[-101])+RC[-1]+R[-1]C+R[-1]C[-1] -> 4.37896699693466E+25 | ED29: =FIB(RC[-101])+RC[-1]+R[-1]C+R[-1]C[-1] -> 9.48479014692034E+25 | EE29: =FIB(RC[-101])+RC[-1]+R[-1]C+R[-1]C[-1] -> 2.01511455668619E+26 | EF29: =FIB(RC[-101])+RC[-1]+R[-1]C+R[-1]C[-1] -> 4.20313760658976E+26 | EG29: =FIB(RC[-101])+RC[-1]+R[-1]C+R[-1]C[-1] -> 8.61410702943425E+26 | EH29: =FIB(RC[-101])+RC[-1]+R[-1]C+R[-1]C[-1] -> 1.73599203922969E+27 | EI29: =FIB(RC[-101])+RC[-1]+R[-1]C+R[-1]C[-1] -> 3.44273005907892E+27 | EJ29: =FIB(RC[-101])+RC[-1]+R[-1]C+R[-1]C[-1] -> 6.7231618168776E+27 | EK29: =FIB(RC[-101])+RC[-1]+R[-1]C+R[-1]C[-1] -> 1.29371673966525E+28 | EL29: =FIB(RC[-101])+RC[-1]+R[-1]C+R[-1]C[-1] -> 2.45450003483975E+28 | EM29: =FIB(RC[-101])+RC[-1]+R[-1]C+R[-1]C[-1] -> 4.59402115028907E+28 | EN29: =FIB(RC[-101])+RC[-1]+R[-1]C+R[-1]C[-1] -> 8.48716760534294E+28 | EO29: =FIB(RC[-101])+RC[-1]+R[-1]C+R[-1]C[-1] -> 1.54843514310677E+29 | EP29: =FIB(RC[-101])+RC[-1]+R[-1]C+R[-1]C[-1] -> 2.79120756934655E+29 | EQ29: =FIB(RC[-101])+RC[-1]+R[-1]C+R[-1]C[-1] -> 4.97344375853387E+29 | ER29: =FIB(RC[-101])+RC[-1]+R[-1]C+R[-1]C[-1] -> 8.76344345588025E+29 | ES29: =FIB(RC[-101])+RC[-1]+R[-1]C+R[-1]C[-1] -> 1.52764194507555E+30 | ET29: =FIB(RC[-101])+RC[-1]+R[-1]C+R[-1]C[-1] -> 2.63551264199044E+30 | EU29: =FIB(RC[-101])+RC[-1]+R[-1]C+R[-1]C[-1] -> 4.50157351804315E+30 | EV29: =FIB(RC[-101])+RC[-1]+R[-1]C+R[-1]C[-1] -> 7.61500632603886E+30 | EW29: =FIB(RC[-101])+RC[-1]+R[-1]C+R[-1]C[-1] -> 1.27622232693157E+31 | EX29: =FIB(RC[-101])+RC[-1]+R[-1]C+R[-1]C[-1] -> 2.11967368925474E+31 | EY29: =FIB(RC[-101])+RC[-1]+R[-1]C+R[-1]C[-1] -> 3.49002191879433E+31 | EZ29: =FIB(RC[-101])+RC[-1]+R[-1]C+R[-1]C[-1] -> 5.69806597438241E+31 | FA29: =FIB(RC[-101])+RC[-1]+R[-1]C+R[-1]C[-1] -> 9.22751725131224E+31 | FB29: =FIB(RC[-101])+RC[-1]+R[-1]C+R[-1]C[-1] -> 1.48256171559686E+32 | FC29: =FIB(RC[-101])+RC[-1]+R[-1]C+R[-1]C[-1] -> 2.36384251933623E+32 | FD29: =FIB(RC[-101])+RC[-1]+R[-1]C+R[-1]C[-1] -> 3.7411458153692E+32 | FE29: =FIB(RC[-101])+RC[-1]+R[-1]C+R[-1]C[-1] -> 5.8785336686147E+32 | FF29: =FIB(RC[-101])+RC[-1]+R[-1]C+R[-1]C[-1] -> 9.17287160710148E+32 | FG29: =FIB(RC[-101])+RC[-1]+R[-1]C+R[-1]C[-1] -> 1.42168425062949E+33 | FH29: =FIB(RC[-101])+RC[-1]+R[-1]C+R[-1]C[-1] -> 2.18901279761762E+33 | FI29: =FIB(RC[-101])+RC[-1]+R[-1]C+R[-1]C[-1] -> 3.34905995709159E+33 | FJ29: =FIB(RC[-101])+RC[-1]+R[-1]C+R[-1]C[-1] -> 5.09220364002689E+33 | FK29: =FIB(RC[-101])+RC[-1]+R[-1]C+R[-1]C[-1] -> 7.69612885897706E+33 | FL29: =FIB(RC[-101])+RC[-1]+R[-1]C+R[-1]C[-1] -> 1.15636535104995E+34 | FM29: =FIB(RC[-101])+RC[-1]+R[-1]C+R[-1]C[-1] -> 1.7276012994852E+34 | FN29: =FIB(RC[-101])+RC[-1]+R[-1]C+R[-1]C[-1] -> 2.56675533249352E+34 | FO29: =FIB(RC[-101])+RC[-1]+R[-1]C+R[-1]C[-1] -> 3.79299348023728E+34 | FP29: =FIB(RC[-101])+RC[-1]+R[-1]C+R[-1]C[-1] -> 5.57568312180382E+34 | FQ29: =FIB(RC[-101])+RC[-1]+R[-1]C+R[-1]C[-1] -> 8.15439548666201E+34 | FR29: =FIB(RC[-101])+RC[-1]+R[-1]C+R[-1]C[-1] -> 1.18664346234193E+35 | FS29: =FIB(RC[-101])+RC[-1]+R[-1]C+R[-1]C[-1] -> 1.71845627575842E+35 | FT29: =FIB(RC[-101])+RC[-1]+R[-1]C+R[-1]C[-1] -> 2.4768483190871E+35 | FU29: =FIB(RC[-101])+RC[-1]+R[-1]C+R[-1]C[-1] -> 3.55348124828745E+35 | FV29: =FIB(RC[-101])+RC[-1]+R[-1]C+R[-1]C[-1] -> 5.07518056367538E+35 | FW29: =FIB(RC[-101])+RC[-1]+R[-1]C+R[-1]C[-1] -> 7.21670959291834E+35 | FX29: =FIB(RC[-101])+RC[-1]+R[-1]C+R[-1]C[-1] -> 1.02179307691522E+36 | FY29: =FIB(RC[-101])+RC[-1]+R[-1]C+R[-1]C[-1] -> 1.44067763960278E+36 | FZ29: =FIB(RC[-101])+RC[-1]+R[-1]C+R[-1]C[-1] -> 2.02298853840218E+36 | GA29: =FIB(RC[-101])+RC[-1]+R[-1]C+R[-1]C[-1] -> 2.82933214020426E+36 | GB29: =FIB(RC[-101])+RC[-1]+R[-1]C+R[-1]C[-1] -> 3.94165050771833E+36 | GC29: =FIB(RC[-101])+RC[-1]+R[-1]C+R[-1]C[-1] -> 5.47034103067736E+36 | GD29: =FIB(RC[-101])+RC[-1]+R[-1]C+R[-1]C[-1] -> 7.56362448702293E+36 | GE29: =FIB(RC[-101])+RC[-1]+R[-1]C+R[-1]C[-1] -> 1.04198323647428E+37 | GF29: =FIB(RC[-101])+RC[-1]+R[-1]C+R[-1]C[-1] -> 1.43034729962565E+37 | GG29: =FIB(RC[-101])+RC[-1]+R[-1]C+R[-1]C[-1] -> 1.95661747331732E+37 | GH29: =FIB(RC[-101])+RC[-1]+R[-1]C+R[-1]C[-1] -> 2.6673905432151E+37 | GI29: =FIB(RC[-101])+RC[-1]+R[-1]C+R[-1]C[-1] -> 3.62422462320559E+37 | GJ29: =FIB(RC[-101])+RC[-1]+R[-1]C+R[-1]C[-1] -> 4.9081972792536E+37 | GK29: =FIB(RC[-101])+RC[-1]+R[-1]C+R[-1]C[-1] -> 6.62577919162134E+37 | GL29: =FIB(RC[-101])+RC[-1]+R[-1]C+R[-1]C[-1] -> 8.9163824044489E+37 | GM29: =FIB(RC[-101])+RC[-1]+R[-1]C+R[-1]C[-1] -> 1.19620347007912E+38 | GN29: =FIB(RC[-101])+RC[-1]+R[-1]C+R[-1]C[-1] -> 1.59997465680347E+38 | GO29: =FIB(RC[-101])+RC[-1]+R[-1]C+R[-1]C[-1] -> 2.13372796974285E+38 | GP29: =FIB(RC[-101])+RC[-1]+R[-1]C+R[-1]C[-1] -> 2.83732021988119E+38 | GQ29: =FIB(RC[-101])+RC[-1]+R[-1]C+R[-1]C[-1] -> 3.76223332243148E+38 | GR29: =FIB(RC[-101])+RC[-1]+R[-1]C+R[-1]C[-1] -> 4.97479475683789E+38 | GS29: =FIB(RC[-101])+RC[-1]+R[-1]C+R[-1]C[-1] -> 6.56024400060476E+38
A30: 20 | B30: 20 | C30: 20 | D30: 20 | E30: 20 | F30: 20 | G30: 20 | H30: 20 | I30: 20 | J30: 20 | K30: 20 | L30: 20 | M30: 20 | N30: 20 | O30: 20 | P30: 20 | Q30: 20 | R30: 20 | S30: 20 | T30: 20 | U30: 20 | V30: 20 | W30: 20 | X30: 20 | Y30: 20 | Z30: 20 | AA30: 20 | AB30: 20 | AC30: 20 | AD30: 20 | AE30: 20 | AF30: 20 | AG30: 20 | AH30: 20 | AI30: 20 | AJ30: 20 | AK30: 20 | AL30: 20 | AM30: 20 | AN30: 20 | AO30: 20 | AP30: 20 | AQ30: 20 | AR30: 20 | AS30: 20 | AT30: 20 | AU30: 20 | AV30: 20 | AW30: 20 | AX30: 20 | AY30: 20 | AZ30: 20 | BA30: 20 | BB30: 20 | BC30: 20 | BD30: 20 | BE30: 20 | BF30: 20 | BG30: 20 | BH30: 20 | BI30: 20 | BJ30: 20 | BK30: 20 | BL30: 20 | BM30: 20 | BN30: 20 | BO30: 20 | BP30: 20 | BQ30: 20 | BR30: 20 | BS30: 20 | BT30: 20 | BU30: 20 | BV30: 20 | BW30: 20 | BX30: 20 | BY30: 20 | BZ30: 20 | CA30: 20 | CB30: 20 | CC30: 20 | CD30: 20 | CE30: 20 | CF30: 20 | CG30: 20 | CH30: 20 | CI30: 20 | CJ30: 20 | CK30: 20 | CL30: 20 | CM30: 20 | CN30: 20 | CO30: 20 | CP30: 20 | CQ30: 20 | CR30: 20 | CS30: 20 | CT30: 20 | CU30: 20 | CV30: 20 | CW30: 0 | CX30: =FIB(RC[-101])+RC[-1]+R[-1]C+R[-1]C[-1] -> 317434 | CY30: =FIB(RC[-101])+RC[-1]+R[-1]C+R[-1]C[-1] -> 9523020 | CZ30: =FIB(RC[-101])+RC[-1]+R[-1]C+R[-1]C[-1] -> 187603494 | DA30: =FIB(RC[-101])+RC[-1]+R[-1]C+R[-1]C[-1] -> 2774373160 | DB30: =FIB(RC[-101])+RC[-1]+R[-1]C+R[-1]C[-1] -> 32887749570 | DC30: =FIB(RC[-101])+RC[-1]+R[-1]C+R[-1]C[-1] -> 325708234644 | DD30: =FIB(RC[-101])+RC[-1]+R[-1]C+R[-1]C[-1] -> 2773444665550 | DE30: =FIB(RC[-101])+RC[-1]+R[-1]C+R[-1]C[-1] -> 20739149153424 | DF30: =FIB(RC[-101])+RC[-1]+R[-1]C+R[-1]C[-1] -> 138421928632650 | DG30: =FIB(RC[-101])+RC[-1]+R[-1]C+R[-1]C[-1] -> 835354613202460 | DH30: =FIB(RC[-101])+RC[-1]+R[-1]C+R[-1]C[-1] -> 4.60637649687173E+15 | DI30: =FIB(RC[-101])+RC[-1]+R[-1]C+R[-1]C[-1] -> 2.34137595050814E+16 | DJ30: =FIB(RC[-101])+RC[-1]+R[-1]C+R[-1]C[-1] -> 1.10514486827891E+17 | DK30: =FIB(RC[-101])+RC[-1]+R[-1]C+R[-1]C[-1] -> 4.87480971172281E+17 | DL30: =FIB(RC[-101])+RC[-1]+R[-1]C+R[-1]C[-1] -> 2.02057200765036E+18 | DM30: =FIB(RC[-101])+RC[-1]+R[-1]C+R[-1]C[-1] -> 7.90787268868473E+18 | DN30: =FIB(RC[-101])+RC[-1]+R[-1]C+R[-1]C[-1] -> 2.93466847502827E+19 | DO30: =FIB(RC[-101])+RC[-1]+R[-1]C+R[-1]C[-1] -> 1.03660457554129E+20 | DP30: =FIB(RC[-101])+RC[-1]+R[-1]C+R[-1]C[-1] -> 3.49695122168352E+20 | DQ30: =FIB(RC[-101])+RC[-1]+R[-1]C+R[-1]C[-1] -> 1.13007804507306E+21 | DR30: =FIB(RC[-101])+RC[-1]+R[-1]C+R[-1]C[-1] -> 3.50802414774655E+21 | DS30: =FIB(RC[-101])+RC[-1]+R[-1]C+R[-1]C[-1] -> 1.048659380289E+22 | DT30: =FIB(RC[-101])+RC[-1]+R[-1]C+R[-1]C[-1] -> 3.0255894157432E+22 | DU30: =FIB(RC[-101])+RC[-1]+R[-1]C+R[-1]C[-1] -> 8.44287255314566E+22 | DV30: =FIB(RC[-101])+RC[-1]+R[-1]C+R[-1]C[-1] -> 2.28297450645372E+23 | DW30: =FIB(RC[-101])+RC[-1]+R[-1]C+R[-1]C[-1] -> 5.99241066398592E+23 | DX30: =FIB(RC[-101])+RC[-1]+R[-1]C+R[-1]C[-1] -> 1.52929469015913E+24 | DY30: =FIB(RC[-101])+RC[-1]+R[-1]C+R[-1]C[-1] -> 3.80028198257682E+24 | DZ30: =FIB(RC[-101])+RC[-1]+R[-1]C+R[-1]C[-1] -> 9.20816856194786E+24 | EA30: =FIB(RC[-101])+RC[-1]+R[-1]C+R[-1]C[-1] -> 2.17830040883217E+25 | EB30: =FIB(RC[-101])+RC[-1]+R[-1]C+R[-1]C[-1] -> 5.0369106389336E+25 | EC30: =FIB(RC[-101])+RC[-1]+R[-1]C+R[-1]C[-1] -> 1.139703251159E+26 | ED30: =FIB(RC[-101])+RC[-1]+R[-1]C+R[-1]C[-1] -> 2.5260789655445E+26 | EE30: =FIB(RC[-101])+RC[-1]+R[-1]C+R[-1]C[-1] -> 5.48967253692272E+26 | EF30: =FIB(RC[-101])+RC[-1]+R[-1]C+R[-1]C[-1] -> 1.17079247001987E+27 | EG30: =FIB(RC[-101])+RC[-1]+R[-1]C+R[-1]C[-1] -> 2.45251693362227E+27 | EH30: =FIB(RC[-101])+RC[-1]+R[-1]C+R[-1]C[-1] -> 5.04991967579538E+27 | EI30: =FIB(RC[-101])+RC[-1]+R[-1]C+R[-1]C[-1] -> 1.0228641774104E+28 | EJ30: =FIB(RC[-101])+RC[-1]+R[-1]C+R[-1]C[-1] -> 2.03945336500605E+28 | EK30: =FIB(RC[-101])+RC[-1]+R[-1]C+R[-1]C[-1] -> 4.00548628635906E+28 | EL30: =FIB(RC[-101])+RC[-1]+R[-1]C+R[-1]C[-1] -> 7.75370306086406E+28 | EM30: =FIB(RC[-101])+RC[-1]+R[-1]C+R[-1]C[-1] -> 1.48022242459929E+29 | EN30: =FIB(RC[-101])+RC[-1]+R[-1]C+R[-1]C[-1] -> 2.78834130016249E+29 | EO30: =FIB(RC[-101])+RC[-1]+R[-1]C+R[-1]C[-1] -> 5.18549320380355E+29 | EP30: =FIB(RC[-101])+RC[-1]+R[-1]C+R[-1]C[-1] -> 9.52513591625687E+29 | EQ30: =FIB(RC[-101])+RC[-1]+R[-1]C+R[-1]C[-1] -> 1.72897872441373E+30 | ER30: =FIB(RC[-101])+RC[-1]+R[-1]C+R[-1]C[-1] -> 3.10266744585514E+30 | ES30: =FIB(RC[-101])+RC[-1]+R[-1]C+R[-1]C[-1] -> 5.50665373651872E+30 | ET30: =FIB(RC[-101])+RC[-1]+R[-1]C+R[-1]C[-1] -> 9.66980832358472E+30 | EU30: =FIB(RC[-101])+RC[-1]+R[-1]C+R[-1]C[-1] -> 1.68068944836183E+31 | EV30: =FIB(RC[-101])+RC[-1]+R[-1]C+R[-1]C[-1] -> 2.89234743277003E+31 | EW30: =FIB(RC[-101])+RC[-1]+R[-1]C+R[-1]C[-1] -> 4.93007039230549E+31 | EX30: =FIB(RC[-101])+RC[-1]+R[-1]C+R[-1]C[-1] -> 8.3259664084918E+31 | EY30: =FIB(RC[-101])+RC[-1]+R[-1]C+R[-1]C[-1] -> 1.39356620165409E+32 | EZ30: =FIB(RC[-101])+RC[-1]+R[-1]C+R[-1]C[-1] -> 2.31237499097176E+32 | FA30: =FIB(RC[-101])+RC[-1]+R[-1]C+R[-1]C[-1] -> 3.80493331354123E+32 | FB30: =FIB(RC[-101])+RC[-1]+R[-1]C+R[-1]C[-1] -> 6.21024675426931E+32 | FC30: =FIB(RC[-101])+RC[-1]+R[-1]C+R[-1]C[-1] -> 1.00566509892024E+33 | FD30: =FIB(RC[-101])+RC[-1]+R[-1]C+R[-1]C[-1] -> 1.61616393239078E+33 | FE30: =FIB(RC[-101])+RC[-1]+R[-1]C+R[-1]C[-1] -> 2.57813188078917E+33 | FF30: =FIB(RC[-101])+RC[-1]+R[-1]C+R[-1]C[-1] -> 4.08327240836079E+33 | FG30: =FIB(RC[-101])+RC[-1]+R[-1]C+R[-1]C[-1] -> 6.42224381970042E+33 | FH30: =FIB(RC[-101])+RC[-1]+R[-1]C+R[-1]C[-1] -> 1.00329408679475E+34 | FI30: =FIB(RC[-101])+RC[-1]+R[-1]C+R[-1]C[-1] -> 1.55710136226567E+34 | FJ30: =FIB(RC[-101])+RC[-1]+R[-1]C+R[-1]C[-1] -> 2.40122772197752E+34 | FK30: =FIB(RC[-101])+RC[-1]+R[-1]C+R[-1]C[-1] -> 3.68006097187792E+34 | FL30: =FIB(RC[-101])+RC[-1]+R[-1]C+R[-1]C[-1] -> 5.60603920882557E+34 | FM30: =FIB(RC[-101])+RC[-1]+R[-1]C+R[-1]C[-1] -> 8.49000585936072E+34 | FN30: =FIB(RC[-101])+RC[-1]+R[-1]C+R[-1]C[-1] -> 1.27843624913394E+35 | FO30: =FIB(RC[-101])+RC[-1]+R[-1]C+R[-1]C[-1] -> 1.91441113040703E+35 | FP30: =FIB(RC[-101])+RC[-1]+R[-1]C+R[-1]C[-1] -> 2.85127879061114E+35 | FQ30: =FIB(RC[-101])+RC[-1]+R[-1]C+R[-1]C[-1] -> 4.22428665145772E+35 | FR30: =FIB(RC[-101])+RC[-1]+R[-1]C+R[-1]C[-1] -> 6.22636966246585E+35 | FS30: =FIB(RC[-101])+RC[-1]+R[-1]C+R[-1]C[-1] -> 9.1314694005662E+35 | FT30: =FIB(RC[-101])+RC[-1]+R[-1]C+R[-1]C[-1] -> 1.33267739954117E+36 | FU30: =FIB(RC[-101])+RC[-1]+R[-1]C+R[-1]C[-1] -> 1.93571035627863E+36 | FV30: =FIB(RC[-101])+RC[-1]+R[-1]C+R[-1]C[-1] -> 2.79857653747491E+36 | FW30: =FIB(RC[-101])+RC[-1]+R[-1]C+R[-1]C[-1] -> 4.02776555313428E+36 | FX30: =FIB(RC[-101])+RC[-1]+R[-1]C+R[-1]C[-1] -> 5.77122958934134E+36 | FY30: =FIB(RC[-101])+RC[-1]+R[-1]C+R[-1]C[-1] -> 8.23370030585934E+36 | FZ30: =FIB(RC[-101])+RC[-1]+R[-1]C+R[-1]C[-1] -> 1.16973664838643E+37 | GA30: =FIB(RC[-101])+RC[-1]+R[-1]C+R[-1]C[-1] -> 1.65496871624707E+37 | GB30: =FIB(RC[-101])+RC[-1]+R[-1]C+R[-1]C[-1] -> 2.33206698103933E+37 | GC30: =FIB(RC[-101])+RC[-1]+R[-1]C+R[-1]C[-1] -> 3.2732661348789E+37 | GD30: =FIB(RC[-101])+RC[-1]+R[-1]C+R[-1]C[-1] -> 4.57666268664893E+37 | GE30: =FIB(RC[-101])+RC[-1]+R[-1]C+R[-1]C[-1] -> 6.3750083718255E+37 | GF30: =FIB(RC[-101])+RC[-1]+R[-1]C+R[-1]C[-1] -> 8.84733890792543E+37 | GG30: =FIB(RC[-101])+RC[-1]+R[-1]C+R[-1]C[-1] -> 1.22343036808684E+38 | GH30: =FIB(RC[-101])+RC[-1]+R[-1]C+R[-1]C[-1] -> 1.68583116974008E+38 | GI30: =FIB(RC[-101])+RC[-1]+R[-1]C+R[-1]C[-1] -> 2.31499268638215E+38 | GJ30: =FIB(RC[-101])+RC[-1]+R[-1]C+R[-1]C[-1] -> 3.16823487662807E+38 | GK30: =FIB(RC[-101])+RC[-1]+R[-1]C+R[-1]C[-1] -> 4.32163252371557E+38 | GL30: =FIB(RC[-101])+RC[-1]+R[-1]C+R[-1]C[-1] -> 5.87584868332259E+38 | GM30: =FIB(RC[-101])+RC[-1]+R[-1]C+R[-1]C[-1] -> 7.9636903938466E+38 | GN30: =FIB(RC[-101])+RC[-1]+R[-1]C+R[-1]C[-1] -> 1.07598685207292E+39 | GO30: =FIB(RC[-101])+RC[-1]+R[-1]C+R[-1]C[-1] -> 1.44935711472755E+39 | GP30: =FIB(RC[-101])+RC[-1]+R[-1]C+R[-1]C[-1] -> 1.94646193368996E+39 | GQ30: =FIB(RC[-101])+RC[-1]+R[-1]C+R[-1]C[-1] -> 2.60641728792122E+39 | GR30: =FIB(RC[-101])+RC[-1]+R[-1]C+R[-1]C[-1] -> 3.48012009584816E+39 | GS30: =FIB(RC[-101])+RC[-1]+R[-1]C+R[-1]C[-1] -> 4.63362397159242E+39
A31: 20 | B31: 20 | C31: 20 | D31: 20 | E31: 20 | F31: 20 | G31: 20 | H31: 20 | I31: 20 | J31: 20 | K31: 20 | L31: 20 | M31: 20 | N31: 20 | O31: 20 | P31: 20 | Q31: 20 | R31: 20 | S31: 20 | T31: 20 | U31: 20 | V31: 20 | W31: 20 | X31: 20 | Y31: 20 | Z31: 20 | AA31: 20 | AB31: 20 | AC31: 20 | AD31: 20 | AE31: 20 | AF31: 20 | AG31: 20 | AH31: 20 | AI31: 20 | AJ31: 20 | AK31: 20 | AL31: 20 | AM31: 20 | AN31: 20 | AO31: 20 | AP31: 20 | AQ31: 20 | AR31: 20 | AS31: 20 | AT31: 20 | AU31: 20 | AV31: 20 | AW31: 20 | AX31: 20 | AY31: 20 | AZ31: 20 | BA31: 20 | BB31: 20 | BC31: 20 | BD31: 20 | BE31: 20 | BF31: 20 | BG31: 20 | BH31: 20 | BI31: 20 | BJ31: 20 | BK31: 20 | BL31: 20 | BM31: 20 | BN31: 20 | BO31: 20 | BP31: 20 | BQ31: 20 | BR31: 20 | BS31: 20 | BT31: 20 | BU31: 20 | BV31: 20 | BW31: 20 | BX31: 20 | BY31: 20 | BZ31: 20 | CA31: 20 | CB31: 20 | CC31: 20 | CD31: 20 | CE31: 20 | CF31: 20 | CG31: 20 | CH31: 20 | CI31: 20 | CJ31: 20 | CK31: 20 | CL31: 20 | CM31: 20 | CN31: 20 | CO31: 20 | CP31: 20 | CQ31: 20 | CR31: 20 | CS31: 20 | CT31: 20 | CU31: 20 | CV31: 20 | CW31: 0 | CX31: =FIB(RC[-101])+RC[-1]+R[-1]C+R[-1]C[-1] -> 328380 | CY31: =FIB(RC[-101])+RC[-1]+R[-1]C+R[-1]C[-1] -> 10179780 | CZ31: =FIB(RC[-101])+RC[-1]+R[-1]C+R[-1]C[-1] -> 207317240 | DA31: =FIB(RC[-101])+RC[-1]+R[-1]C+R[-1]C[-1] -> 3169304840 | DB31: =FIB(RC[-101])+RC[-1]+R[-1]C+R[-1]C[-1] -> 38831438516 | DC31: =FIB(RC[-101])+RC[-1]+R[-1]C+R[-1]C[-1] -> 397427433676 | DD31: =FIB(RC[-101])+RC[-1]+R[-1]C+R[-1]C[-1] -> 3496580344816 | DE31: =FIB(RC[-101])+RC[-1]+R[-1]C+R[-1]C[-1] -> 27009174174736 | DF31: =FIB(RC[-101])+RC[-1]+R[-1]C+R[-1]C[-1] -> 186170251971756 | DG31: =FIB(RC[-101])+RC[-1]+R[-1]C+R[-1]C[-1] -> 1.15994679381781E+15 | DH31: =FIB(RC[-101])+RC[-1]+R[-1]C+R[-1]C[-1] -> 6.60167790390295E+15 | DI31: =FIB(RC[-101])+RC[-1]+R[-1]C+R[-1]C[-1] -> 3.4621813905867E+16 | DJ31: =FIB(RC[-101])+RC[-1]+R[-1]C+R[-1]C[-1] -> 1.6855006023885E+17 | DK31: =FIB(RC[-101])+RC[-1]+R[-1]C+R[-1]C[-1] -> 7.66545518239033E+17 | DL31: =FIB(RC[-101])+RC[-1]+R[-1]C+R[-1]C[-1] -> 3.27459849706168E+18 | DM31: =FIB(RC[-101])+RC[-1]+R[-1]C+R[-1]C[-1] -> 1.32030431933968E+19 | DN31: =FIB(RC[-101])+RC[-1]+R[-1]C+R[-1]C[-1] -> 5.04576006323642E+19 | DO31: =FIB(RC[-101])+RC[-1]+R[-1]C+R[-1]C[-1] -> 1.83464742936776E+20 | DP31: =FIB(RC[-101])+RC[-1]+R[-1]C+R[-1]C[-1] -> 6.36820322659256E+20 | DQ31: =FIB(RC[-101])+RC[-1]+R[-1]C+R[-1]C[-1] -> 2.11659348990067E+21 | DR31: =FIB(RC[-101])+RC[-1]+R[-1]C+R[-1]C[-1] -> 6.75469568272028E+21 | DS31: =FIB(RC[-101])+RC[-1]+R[-1]C+R[-1]C[-1] -> 2.07493136333569E+22 | DT31: =FIB(RC[-101])+RC[-1]+R[-1]C+R[-1]C[-1] -> 6.14918015936789E+22 | DU31: =FIB(RC[-101])+RC[-1]+R[-1]C+R[-1]C[-1] -> 1.76176421282567E+23 | DV31: =FIB(RC[-101])+RC[-1]+R[-1]C+R[-1]C[-1] -> 4.88902597459396E+23 | DW31: =FIB(RC[-101])+RC[-1]+R[-1]C+R[-1]C[-1] -> 1.31644111450336E+24 | DX31: =FIB(RC[-101])+RC[-1]+R[-1]C+R[-1]C[-1] -> 3.44497687106109E+24 | DY31: =FIB(RC[-101])+RC[-1]+R[-1]C+R[-1]C[-1] -> 8.77455354379703E+24 | DZ31: =FIB(RC[-101])+RC[-1]+R[-1]C+R[-1]C[-1] -> 2.17830040883217E+25 | EA31: =FIB(RC[-101])+RC[-1]+R[-1]C+R[-1]C[-1] -> 5.27741767385913E+25 | EB31: =FIB(RC[-101])+RC[-1]+R[-1]C+R[-1]C[-1] -> 1.24926287216249E+26 | EC31: =FIB(RC[-101])+RC[-1]+R[-1]C+R[-1]C[-1] -> 2.89265718721485E+26 | ED31: =FIB(RC[-101])+RC[-1]+R[-1]C+R[-1]C[-1] -> 6.55843940391835E+26 | EE31: =FIB(RC[-101])+RC[-1]+R[-1]C+R[-1]C[-1] -> 1.45741909063856E+27 | EF31: =FIB(RC[-101])+RC[-1]+R[-1]C+R[-1]C[-1] -> 3.17717881435069E+27 | EG31: =FIB(RC[-101])+RC[-1]+R[-1]C+R[-1]C[-1] -> 6.80048821799283E+27 | EH31: =FIB(RC[-101])+RC[-1]+R[-1]C+R[-1]C[-1] -> 1.43029248274105E+28 | EI31: =FIB(RC[-101])+RC[-1]+R[-1]C+R[-1]C[-1] -> 2.95814862773098E+28 | EJ31: =FIB(RC[-101])+RC[-1]+R[-1]C+R[-1]C[-1] -> 6.02046617014743E+28 | EK31: =FIB(RC[-101])+RC[-1]+R[-1]C+R[-1]C[-1] -> 1.20654058215125E+29 | EL31: =FIB(RC[-101])+RC[-1]+R[-1]C+R[-1]C[-1] -> 2.38245951687357E+29 | EM31: =FIB(RC[-101])+RC[-1]+R[-1]C+R[-1]C[-1] -> 4.63805224755926E+29 | EN31: =FIB(RC[-101])+RC[-1]+R[-1]C+R[-1]C[-1] -> 8.90661597232104E+29 | EO31: =FIB(RC[-101])+RC[-1]+R[-1]C+R[-1]C[-1] -> 1.68804504762871E+30 | EP31: =FIB(RC[-101])+RC[-1]+R[-1]C+R[-1]C[-1] -> 3.15910795963475E+30 | EQ31: =FIB(RC[-101])+RC[-1]+R[-1]C+R[-1]C[-1] -> 5.84060027567417E+30 | ER31: =FIB(RC[-101])+RC[-1]+R[-1]C+R[-1]C[-1] -> 1.0672246445943E+31 | ES31: =FIB(RC[-101])+RC[-1]+R[-1]C+R[-1]C[-1] -> 1.92815676283169E+31 | ET31: =FIB(RC[-101])+RC[-1]+R[-1]C+R[-1]C[-1] -> 3.44580296884203E+31 | EU31: =FIB(RC[-101])+RC[-1]+R[-1]C+R[-1]C[-1] -> 6.09347324956234E+31 | EV31: =FIB(RC[-101])+RC[-1]+R[-1]C+R[-1]C[-1] -> 1.06665101306942E+32 | EW31: =FIB(RC[-101])+RC[-1]+R[-1]C+R[-1]C[-1] -> 1.84889279557697E+32 | EX31: =FIB(RC[-101])+RC[-1]+R[-1]C+R[-1]C[-1] -> 3.1744964756567E+32 | EY31: =FIB(RC[-101])+RC[-1]+R[-1]C+R[-1]C[-1] -> 5.40065931815997E+32 | EZ31: =FIB(RC[-101])+RC[-1]+R[-1]C+R[-1]C[-1] -> 9.10660051078581E+32 | FA31: =FIB(RC[-101])+RC[-1]+R[-1]C+R[-1]C[-1] -> 1.52239088152988E+33 | FB31: =FIB(RC[-101])+RC[-1]+R[-1]C+R[-1]C[-1] -> 2.52390888831093E+33 | FC31: =FIB(RC[-101])+RC[-1]+R[-1]C+R[-1]C[-1] -> 4.15059866265811E+33 | FD31: =FIB(RC[-101])+RC[-1]+R[-1]C+R[-1]C[-1] -> 6.77242769396913E+33 | FE31: =FIB(RC[-101])+RC[-1]+R[-1]C+R[-1]C[-1] -> 1.09667235071491E+34 | FF31: =FIB(RC[-101])+RC[-1]+R[-1]C+R[-1]C[-1] -> 1.76281277962991E+34 | FG31: =FIB(RC[-101])+RC[-1]+R[-1]C+R[-1]C[-1] -> 2.81336440243603E+34 | FH31: =FIB(RC[-101])+RC[-1]+R[-1]C+R[-1]C[-1] -> 4.45888287120082E+34 | FI31: =FIB(RC[-101])+RC[-1]+R[-1]C+R[-1]C[-1] -> 7.01927832026125E+34 | FJ31: =FIB(RC[-101])+RC[-1]+R[-1]C+R[-1]C[-1] -> 1.09776074045044E+35 | FK31: =FIB(RC[-101])+RC[-1]+R[-1]C+R[-1]C[-1] -> 1.70588960983599E+35 | FL31: =FIB(RC[-101])+RC[-1]+R[-1]C+R[-1]C[-1] -> 2.63449962790634E+35 | FM31: =FIB(RC[-101])+RC[-1]+R[-1]C+R[-1]C[-1] -> 4.04410413472497E+35 | FN31: =FIB(RC[-101])+RC[-1]+R[-1]C+R[-1]C[-1] -> 6.17154096979498E+35 | FO31: =FIB(RC[-101])+RC[-1]+R[-1]C+R[-1]C[-1] -> 9.36438834933595E+35 | FP31: =FIB(RC[-101])+RC[-1]+R[-1]C+R[-1]C[-1] -> 1.41300782703541E+36 | FQ31: =FIB(RC[-101])+RC[-1]+R[-1]C+R[-1]C[-1] -> 2.1205643712423E+36 | FR31: =FIB(RC[-101])+RC[-1]+R[-1]C+R[-1]C[-1] -> 3.16563000263465E+36 | FS31: =FIB(RC[-101])+RC[-1]+R[-1]C+R[-1]C[-1] -> 4.70141390893786E+36 | FT31: =FIB(RC[-101])+RC[-1]+R[-1]C+R[-1]C[-1] -> 6.94723824853565E+36 | FU31: =FIB(RC[-101])+RC[-1]+R[-1]C+R[-1]C[-1] -> 1.02156260043554E+37 | FV31: =FIB(RC[-101])+RC[-1]+R[-1]C+R[-1]C[-1] -> 1.4949912898109E+37 | FW31: =FIB(RC[-101])+RC[-1]+R[-1]C+R[-1]C[-1] -> 2.17762549887182E+37 | FX31: =FIB(RC[-101])+RC[-1]+R[-1]C+R[-1]C[-1] -> 3.15752501311938E+37 | FY31: =FIB(RC[-101])+RC[-1]+R[-1]C+R[-1]C[-1] -> 4.55801800263945E+37 | FZ31: =FIB(RC[-101])+RC[-1]+R[-1]C+R[-1]C[-1] -> 6.55112468161181E+37 | GA31: =FIB(RC[-101])+RC[-1]+R[-1]C+R[-1]C[-1] -> 9.37583004624531E+37 | GB31: =FIB(RC[-101])+RC[-1]+R[-1]C+R[-1]C[-1] -> 1.33628657435317E+38 | GC31: =FIB(RC[-101])+RC[-1]+R[-1]C+R[-1]C[-1] -> 1.89681988594499E+38 | GD31: =FIB(RC[-101])+RC[-1]+R[-1]C+R[-1]C[-1] -> 2.68181276809778E+38 | GE31: =FIB(RC[-101])+RC[-1]+R[-1]C+R[-1]C[-1] -> 3.77697987394522E+38 | GF31: =FIB(RC[-101])+RC[-1]+R[-1]C+R[-1]C[-1] -> 5.29921460192031E+38 | GG31: =FIB(RC[-101])+RC[-1]+R[-1]C+R[-1]C[-1] -> 7.4073788607997E+38 | GH31: =FIB(RC[-101])+RC[-1]+R[-1]C+R[-1]C[-1] -> 1.03166403986266E+39 | GI31: =FIB(RC[-101])+RC[-1]+R[-1]C+R[-1]C[-1] -> 1.43174642547489E+39 | GJ31: =FIB(RC[-101])+RC[-1]+R[-1]C+R[-1]C[-1] -> 1.98006918177591E+39 | GK31: =FIB(RC[-101])+RC[-1]+R[-1]C+R[-1]C[-1] -> 2.72905592181027E+39 | GL31: =FIB(RC[-101])+RC[-1]+R[-1]C+R[-1]C[-1] -> 3.74880404251409E+39 | GM31: =FIB(RC[-101])+RC[-1]+R[-1]C+R[-1]C[-1] -> 5.13275795023101E+39 | GN31: =FIB(RC[-101])+RC[-1]+R[-1]C+R[-1]C[-1] -> 7.00511384168858E+39 | GO31: =FIB(RC[-101])+RC[-1]+R[-1]C+R[-1]C[-1] -> 9.53045780848905E+39 | GP31: =FIB(RC[-101])+RC[-1]+R[-1]C+R[-1]C[-1] -> 1.29262768569066E+40 | GQ31: =FIB(RC[-101])+RC[-1]+R[-1]C+R[-1]C[-1] -> 1.74791560785177E+40 | GR31: =FIB(RC[-101])+RC[-1]+R[-1]C+R[-1]C[-1] -> 2.35656934622871E+40 | GS31: =FIB(RC[-101])+RC[-1]+R[-1]C+R[-1]C[-1] -> 3.16794375297277E+40
A32: 20 | B32: 20 | C32: 20 | D32: 20 | E32: 20 | F32: 20 | G32: 20 | H32: 20 | I32: 20 | J32: 20 | K32: 20 | L32: 20 | M32: 20 | N32: 20 | O32: 20 | P32: 20 | Q32: 20 | R32: 20 | S32: 20 | T32: 20 | U32: 20 | V32: 20 | W32: 20 | X32: 20 | Y32: 20 | Z32: 20 | AA32: 20 | AB32: 20 | AC32: 20 | AD32: 20 | AE32: 20 | AF32: 20 | AG32: 20 | AH32: 20 | AI32: 20 | AJ32: 20 | AK32: 20 | AL32: 20 | AM32: 20 | AN32: 20 | AO32: 20 | AP32: 20 | AQ32: 20 | AR32: 20 | AS32: 20 | AT32: 20 | AU32: 20 | AV32: 20 | AW32: 20 | AX32: 20 | AY32: 20 | AZ32: 20 | BA32: 20 | BB32: 20 | BC32: 20 | BD32: 20 | BE32: 20 | BF32: 20 | BG32: 20 | BH32: 20 | BI32: 20 | BJ32: 20 | BK32: 20 | BL32: 20 | BM32: 20 | BN32: 20 | BO32: 20 | BP32: 20 | BQ32: 20 | BR32: 20 | BS32: 20 | BT32: 20 | BU32: 20 | BV32: 20 | BW32: 20 | BX32: 20 | BY32: 20 | BZ32: 20 | CA32: 20 | CB32: 20 | CC32: 20 | CD32: 20 | CE32: 20 | CF32: 20 | CG32: 20 | CH32: 20 | CI32: 20 | CJ32: 20 | CK32: 20 | CL32: 20 | CM32: 20 | CN32: 20 | CO32: 20 | CP32: 20 | CQ32: 20 | CR32: 20 | CS32: 20 | CT32: 20 | CU32: 20 | CV32: 20 | CW32: 0 | CX32: =FIB(RC[-101])+RC[-1]+R[-1]C+R[-1]C[-1] -> 339326 | CY32: =FIB(RC[-101])+RC[-1]+R[-1]C+R[-1]C[-1] -> 10858432 | CZ32: =FIB(RC[-101])+RC[-1]+R[-1]C+R[-1]C[-1] -> 228366398 | DA32: =FIB(RC[-101])+RC[-1]+R[-1]C+R[-1]C[-1] -> 3604999424 | DB32: =FIB(RC[-101])+RC[-1]+R[-1]C+R[-1]C[-1] -> 45605753726 | DC32: =FIB(RC[-101])+RC[-1]+R[-1]C+R[-1]C[-1] -> 481864636864 | DD32: =FIB(RC[-101])+RC[-1]+R[-1]C+R[-1]C[-1] -> 4375872426302 | DE32: =FIB(RC[-101])+RC[-1]+R[-1]C+R[-1]C[-1] -> 34881626956800 | DF32: =FIB(RC[-101])+RC[-1]+R[-1]C+R[-1]C[-1] -> 248061053114238 | DG32: =FIB(RC[-101])+RC[-1]+R[-1]C+R[-1]C[-1] -> 1.59417809891475E+15 | DH32: =FIB(RC[-101])+RC[-1]+R[-1]C+R[-1]C[-1] -> 9.35580279664646E+15 | DI32: =FIB(RC[-101])+RC[-1]+R[-1]C+R[-1]C[-1] -> 5.05792946064274E+16 | DJ32: =FIB(RC[-101])+RC[-1]+R[-1]C+R[-1]C[-1] -> 2.53751168751156E+17 | DK32: =FIB(RC[-101])+RC[-1]+R[-1]C+R[-1]C[-1] -> 1.18884674722905E+18 | DL32: =FIB(RC[-101])+RC[-1]+R[-1]C+R[-1]C[-1] -> 5.22999076252978E+18 | DM32: =FIB(RC[-101])+RC[-1]+R[-1]C+R[-1]C[-1] -> 2.17076324529883E+19 | DN32: =FIB(RC[-101])+RC[-1]+R[-1]C+R[-1]C[-1] -> 8.53682762787492E+19 | DO32: =FIB(RC[-101])+RC[-1]+R[-1]C+R[-1]C[-1] -> 3.19290619847889E+20 | DP32: =FIB(RC[-101])+RC[-1]+R[-1]C+R[-1]C[-1] -> 1.13957568544392E+21 | DQ32: =FIB(RC[-101])+RC[-1]+R[-1]C+R[-1]C[-1] -> 3.89298949800384E+21 | DR32: =FIB(RC[-101])+RC[-1]+R[-1]C+R[-1]C[-1] -> 1.27642786706248E+22 | DS32: =FIB(RC[-101])+RC[-1]+R[-1]C+R[-1]C[-1] -> 4.02682879867019E+22 | DT32: =FIB(RC[-101])+RC[-1]+R[-1]C+R[-1]C[-1] -> 1.22509403213738E+23 | DU32: =FIB(RC[-101])+RC[-1]+R[-1]C+R[-1]C[-1] -> 3.60177626089984E+23 | DV32: =FIB(RC[-101])+RC[-1]+R[-1]C+R[-1]C[-1] -> 1.02525664483195E+24 | DW32: =FIB(RC[-101])+RC[-1]+R[-1]C+R[-1]C[-1] -> 2.8306003567947E+24 | DX32: =FIB(RC[-101])+RC[-1]+R[-1]C+R[-1]C[-1] -> 7.59201834235915E+24 | DY32: =FIB(RC[-101])+RC[-1]+R[-1]C+R[-1]C[-1] -> 1.98115487572173E+25 | DZ32: =FIB(RC[-101])+RC[-1]+R[-1]C+R[-1]C[-1] -> 5.0369106389336E+25 | EA32: =FIB(RC[-101])+RC[-1]+R[-1]C+R[-1]C[-1] -> 1.24926287216249E+26 | EB32: =FIB(RC[-101])+RC[-1]+R[-1]C+R[-1]C[-1] -> 3.02626751171089E+26 | EC32: =FIB(RC[-101])+RC[-1]+R[-1]C+R[-1]C[-1] -> 7.16818757108823E+26 | ED32: =FIB(RC[-101])+RC[-1]+R[-1]C+R[-1]C[-1] -> 1.66192841622214E+27 | EE32: =FIB(RC[-101])+RC[-1]+R[-1]C+R[-1]C[-1] -> 3.77519144725253E+27 | EF32: =FIB(RC[-101])+RC[-1]+R[-1]C+R[-1]C[-1] -> 8.40978935224178E+27 | EG32: =FIB(RC[-101])+RC[-1]+R[-1]C+R[-1]C[-1] -> 1.83874563845853E+28 | EH32: =FIB(RC[-101])+RC[-1]+R[-1]C+R[-1]C[-1] -> 3.94908694299886E+28 | EI32: =FIB(RC[-101])+RC[-1]+R[-1]C+R[-1]C[-1] -> 8.33752805347089E+28 | EJ32: =FIB(RC[-101])+RC[-1]+R[-1]C+R[-1]C[-1] -> 1.73161428513493E+29 | EK32: =FIB(RC[-101])+RC[-1]+R[-1]C+R[-1]C[-1] -> 3.54020148430093E+29 | EL32: =FIB(RC[-101])+RC[-1]+R[-1]C+R[-1]C[-1] -> 7.12920158332575E+29 | EM32: =FIB(RC[-101])+RC[-1]+R[-1]C+R[-1]C[-1] -> 1.41497133477586E+30 | EN32: =FIB(RC[-101])+RC[-1]+R[-1]C+R[-1]C[-1] -> 2.76943815676389E+30 | EO32: =FIB(RC[-101])+RC[-1]+R[-1]C+R[-1]C[-1] -> 5.3481448016247E+30 | EP32: =FIB(RC[-101])+RC[-1]+R[-1]C+R[-1]C[-1] -> 1.01952978088882E+31 | EQ32: =FIB(RC[-101])+RC[-1]+R[-1]C+R[-1]C[-1] -> 1.91950060441971E+31 | ER32: =FIB(RC[-101])+RC[-1]+R[-1]C+R[-1]C[-1] -> 3.57078527658143E+31 | ES32: =FIB(RC[-101])+RC[-1]+R[-1]C+R[-1]C[-1] -> 6.56616668400742E+31 | ET32: =FIB(RC[-101])+RC[-1]+R[-1]C+R[-1]C[-1] -> 1.19401264156811E+32 | EU32: =FIB(RC[-101])+RC[-1]+R[-1]C+R[-1]C[-1] -> 2.14794026340855E+32 | EV32: =FIB(RC[-101])+RC[-1]+R[-1]C+R[-1]C[-1] -> 3.8239386014342E+32 | EW32: =FIB(RC[-101])+RC[-1]+R[-1]C+R[-1]C[-1] -> 6.7394824100806E+32 | EX32: =FIB(RC[-101])+RC[-1]+R[-1]C+R[-1]C[-1] -> 1.17628716813143E+33 | EY32: =FIB(RC[-101])+RC[-1]+R[-1]C+R[-1]C[-1] -> 2.03380274751309E+33 | EZ32: =FIB(RC[-101])+RC[-1]+R[-1]C+R[-1]C[-1] -> 3.48452873040767E+33 | FA32: =FIB(RC[-101])+RC[-1]+R[-1]C+R[-1]C[-1] -> 5.91757966301613E+33 | FB32: =FIB(RC[-101])+RC[-1]+R[-1]C+R[-1]C[-1] -> 9.96387943285695E+33 | FC32: =FIB(RC[-101])+RC[-1]+R[-1]C+R[-1]C[-1] -> 1.6638386983826E+34 | FD32: =FIB(RC[-101])+RC[-1]+R[-1]C+R[-1]C[-1] -> 2.75614133404532E+34 | FE32: =FIB(RC[-101])+RC[-1]+R[-1]C+R[-1]C[-1] -> 4.53005645415714E+34 | FF32: =FIB(RC[-101])+RC[-1]+R[-1]C+R[-1]C[-1] -> 7.38954158450196E+34 | FG32: =FIB(RC[-101])+RC[-1]+R[-1]C+R[-1]C[-1] -> 1.19657187665679E+35 | FH32: =FIB(RC[-101])+RC[-1]+R[-1]C+R[-1]C[-1] -> 1.92379660402047E+35 | FI32: =FIB(RC[-101])+RC[-1]+R[-1]C+R[-1]C[-1] -> 3.07161272316668E+35 | FJ32: =FIB(RC[-101])+RC[-1]+R[-1]C+R[-1]C[-1] -> 4.87130129564325E+35 | FK32: =FIB(RC[-101])+RC[-1]+R[-1]C+R[-1]C[-1] -> 7.67495164592968E+35 | FL32: =FIB(RC[-101])+RC[-1]+R[-1]C+R[-1]C[-1] -> 1.2015340883672E+36 | FM32: =FIB(RC[-101])+RC[-1]+R[-1]C+R[-1]C[-1] -> 1.86939446463033E+36 | FN32: =FIB(RC[-101])+RC[-1]+R[-1]C+R[-1]C[-1] -> 2.89095897508233E+36 | FO32: =FIB(RC[-101])+RC[-1]+R[-1]C+R[-1]C[-1] -> 4.44455190699542E+36 | FP32: =FIB(RC[-101])+RC[-1]+R[-1]C+R[-1]C[-1] -> 6.79399856896443E+36 | FQ32: =FIB(RC[-101])+RC[-1]+R[-1]C+R[-1]C[-1] -> 1.03275707672421E+37 | FR32: =FIB(RC[-101])+RC[-1]+R[-1]C+R[-1]C[-1] -> 1.56137651411191E+37 | FS32: =FIB(RC[-101])+RC[-1]+R[-1]C+R[-1]C[-1] -> 2.34808090526916E+37 | FT32: =FIB(RC[-101])+RC[-1]+R[-1]C+R[-1]C[-1] -> 3.51294612101651E+37 | FU32: =FIB(RC[-101])+RC[-1]+R[-1]C+R[-1]C[-1] -> 5.22923254630562E+37 | FV32: =FIB(RC[-101])+RC[-1]+R[-1]C+R[-1]C[-1] -> 7.74578643655206E+37 | FW32: =FIB(RC[-101])+RC[-1]+R[-1]C+R[-1]C[-1] -> 1.14184032252348E+38 | FX32: =FIB(RC[-101])+RC[-1]+R[-1]C+R[-1]C[-1] -> 1.6753553737226E+38 | FY32: =FIB(RC[-101])+RC[-1]+R[-1]C+R[-1]C[-1] -> 2.44690967529848E+38 | FZ32: =FIB(RC[-101])+RC[-1]+R[-1]C+R[-1]C[-1] -> 3.55782394372361E+38 | GA32: =FIB(RC[-101])+RC[-1]+R[-1]C+R[-1]C[-1] -> 5.15051941650932E+38 | GB32: =FIB(RC[-101])+RC[-1]+R[-1]C+R[-1]C[-1] -> 7.42438899548702E+38 | GC32: =FIB(RC[-101])+RC[-1]+R[-1]C+R[-1]C[-1] -> 1.06574954557852E+39 | GD32: =FIB(RC[-101])+RC[-1]+R[-1]C+R[-1]C[-1] -> 1.5236128109828E+39 | GE32: =FIB(RC[-101])+RC[-1]+R[-1]C+R[-1]C[-1] -> 2.1694920751871E+39 | GF32: =FIB(RC[-101])+RC[-1]+R[-1]C+R[-1]C[-1] -> 3.07711152277365E+39 | GG32: =FIB(RC[-101])+RC[-1]+R[-1]C+R[-1]C[-1] -> 4.34777086904565E+39 | GH32: =FIB(RC[-101])+RC[-1]+R[-1]C+R[-1]C[-1] -> 6.12017279498828E+39 | GI32: =FIB(RC[-101])+RC[-1]+R[-1]C+R[-1]C[-1] -> 8.58358326032583E+39 | GJ32: =FIB(RC[-101])+RC[-1]+R[-1]C+R[-1]C[-1] -> 1.19953988675766E+40 | GK32: =FIB(RC[-101])+RC[-1]+R[-1]C+R[-1]C[-1] -> 1.67045239711628E+40 | GL32: =FIB(RC[-101])+RC[-1]+R[-1]C+R[-1]C[-1] -> 2.31823839354872E+40 | GM32: =FIB(RC[-101])+RC[-1]+R[-1]C+R[-1]C[-1] -> 3.20639459282322E+40 | GN32: =FIB(RC[-101])+RC[-1]+R[-1]C+R[-1]C[-1] -> 4.42018177201518E+40 | GO32: =FIB(RC[-101])+RC[-1]+R[-1]C+R[-1]C[-1] -> 6.07373893703295E+40 | GP32: =FIB(RC[-101])+RC[-1]+R[-1]C+R[-1]C[-1] -> 8.31941240357251E+40 | GQ32: =FIB(RC[-101])+RC[-1]+R[-1]C+R[-1]C[-1] -> 1.13599556971149E+41 | GR32: =FIB(RC[-101])+RC[-1]+R[-1]C+R[-1]C[-1] -> 1.54644406511954E+41 | GS32: =FIB(RC[-101])+RC[-1]+R[-1]C+R[-1]C[-1] -> 2.09889537503969E+41
A33: 20 | B33: 20 | C33: 20 | D33: 20 | E33: 20 | F33: 20 | G33: 20 | H33: 20 | I33: 20 | J33: 20 | K33: 20 | L33: 20 | M33: 20 | N33: 20 | O33: 20 | P33: 20 | Q33: 20 | R33: 20 | S33: 20 | T33: 20 | U33: 20 | V33: 20 | W33: 20 | X33: 20 | Y33: 20 | Z33: 20 | AA33: 20 | AB33: 20 | AC33: 20 | AD33: 20 | AE33: 20 | AF33: 20 | AG33: 20 | AH33: 20 | AI33: 20 | AJ33: 20 | AK33: 20 | AL33: 20 | AM33: 20 | AN33: 20 | AO33: 20 | AP33: 20 | AQ33: 20 | AR33: 20 | AS33: 20 | AT33: 20 | AU33: 20 | AV33: 20 | AW33: 20 | AX33: 20 | AY33: 20 | AZ33: 20 | BA33: 20 | BB33: 20 | BC33: 20 | BD33: 20 | BE33: 20 | BF33: 20 | BG33: 20 | BH33: 20 | BI33: 20 | BJ33: 20 | BK33: 20 | BL33: 20 | BM33: 20 | BN33: 20 | BO33: 20 | BP33: 20 | BQ33: 20 | BR33: 20 | BS33: 20 | BT33: 20 | BU33: 20 | BV33: 20 | BW33: 20 | BX33: 20 | BY33: 20 | BZ33: 20 | CA33: 20 | CB33: 20 | CC33: 20 | CD33: 20 | CE33: 20 | CF33: 20 | CG33: 20 | CH33: 20 | CI33: 20 | CJ33: 20 | CK33: 20 | CL33: 20 | CM33: 20 | CN33: 20 | CO33: 20 | CP33: 20 | CQ33: 20 | CR33: 20 | CS33: 20 | CT33: 20 | CU33: 20 | CV33: 20 | CW33: 0 | CX33: =FIB(RC[-101])+RC[-1]+R[-1]C+R[-1]C[-1] -> 350272 | CY33: =FIB(RC[-101])+RC[-1]+R[-1]C+R[-1]C[-1] -> 11558976 | CZ33: =FIB(RC[-101])+RC[-1]+R[-1]C+R[-1]C[-1] -> 250794752 | DA33: =FIB(RC[-101])+RC[-1]+R[-1]C+R[-1]C[-1] -> 4084171520 | DB33: =FIB(RC[-101])+RC[-1]+R[-1]C+R[-1]C[-1] -> 53294935616 | DC33: =FIB(RC[-101])+RC[-1]+R[-1]C+R[-1]C[-1] -> 580765337152 | DD33: =FIB(RC[-101])+RC[-1]+R[-1]C+R[-1]C[-1] -> 5438502411264 | DE33: =FIB(RC[-101])+RC[-1]+R[-1]C+R[-1]C[-1] -> 44696001805312 | DF33: =FIB(RC[-101])+RC[-1]+R[-1]C+R[-1]C[-1] -> 327638681887296 | DG33: =FIB(RC[-101])+RC[-1]+R[-1]C+R[-1]C[-1] -> 2.16987783392723E+15 | DH33: =FIB(RC[-101])+RC[-1]+R[-1]C+R[-1]C[-1] -> 1.31198587294994E+16 | DI33: =FIB(RC[-101])+RC[-1]+R[-1]C+R[-1]C[-1] -> 7.30549561325842E+16 | DJ33: =FIB(RC[-101])+RC[-1]+R[-1]C+R[-1]C[-1] -> 3.77385419490178E+17 | DK33: =FIB(RC[-101])+RC[-1]+R[-1]C+R[-1]C[-1] -> 1.81998333547039E+18 | DL33: =FIB(RC[-101])+RC[-1]+R[-1]C+R[-1]C[-1] -> 8.23882084522923E+18 | DM33: =FIB(RC[-101])+RC[-1]+R[-1]C+R[-1]C[-1] -> 3.51764440607473E+19 | DN33: =FIB(RC[-101])+RC[-1]+R[-1]C+R[-1]C[-1] -> 1.42252352792485E+20 | DO33: =FIB(RC[-101])+RC[-1]+R[-1]C+R[-1]C[-1] -> 5.46911248919123E+20 | DP33: =FIB(RC[-101])+RC[-1]+R[-1]C+R[-1]C[-1] -> 2.00577755421093E+21 | DQ33: =FIB(RC[-101])+RC[-1]+R[-1]C+R[-1]C[-1] -> 7.0383427376587E+21 | DR33: =FIB(RC[-101])+RC[-1]+R[-1]C+R[-1]C[-1] -> 2.36956109062873E+22 | DS33: =FIB(RC[-101])+RC[-1]+R[-1]C+R[-1]C[-1] -> 7.67281775636141E+22 | DT33: =FIB(RC[-101])+RC[-1]+R[-1]C+R[-1]C[-1] -> 2.39505868764054E+23 | DU33: =FIB(RC[-101])+RC[-1]+R[-1]C+R[-1]C[-1] -> 7.22192898067775E+23 | DV33: =FIB(RC[-101])+RC[-1]+R[-1]C+R[-1]C[-1] -> 2.10762716898971E+24 | DW33: =FIB(RC[-101])+RC[-1]+R[-1]C+R[-1]C[-1] -> 5.96348417061636E+24 | DX33: =FIB(RC[-101])+RC[-1]+R[-1]C+R[-1]C[-1] -> 1.63861028697702E+25 | DY33: =FIB(RC[-101])+RC[-1]+R[-1]C+R[-1]C[-1] -> 4.37896699693466E+25 | DZ33: =FIB(RC[-101])+RC[-1]+R[-1]C+R[-1]C[-1] -> 1.139703251159E+26 | EA33: =FIB(RC[-101])+RC[-1]+R[-1]C+R[-1]C[-1] -> 2.89265718721485E+26 | EB33: =FIB(RC[-101])+RC[-1]+R[-1]C+R[-1]C[-1] -> 7.16818757108823E+26 | EC33: =FIB(RC[-101])+RC[-1]+R[-1]C+R[-1]C[-1] -> 1.73626426538874E+27 | ED33: =FIB(RC[-101])+RC[-1]+R[-1]C+R[-1]C[-1] -> 4.1150114387197E+27 | EE33: =FIB(RC[-101])+RC[-1]+R[-1]C+R[-1]C[-1] -> 9.55213130219438E+27 | EF33: =FIB(RC[-101])+RC[-1]+R[-1]C+R[-1]C[-1] -> 2.17371121016887E+28 | EG33: =FIB(RC[-101])+RC[-1]+R[-1]C+R[-1]C[-1] -> 4.85343578385158E+28 | EH33: =FIB(RC[-101])+RC[-1]+R[-1]C+R[-1]C[-1] -> 1.0641268365309E+29 | EI33: =FIB(RC[-101])+RC[-1]+R[-1]C+R[-1]C[-1] -> 2.29278833617787E+29 | EJ33: =FIB(RC[-101])+RC[-1]+R[-1]C+R[-1]C[-1] -> 4.85815542665989E+29 | EK33: =FIB(RC[-101])+RC[-1]+R[-1]C+R[-1]C[-1] -> 1.01299711960957E+30 | EL33: =FIB(RC[-101])+RC[-1]+R[-1]C+R[-1]C[-1] -> 2.07993742637224E+30 | EM33: =FIB(RC[-101])+RC[-1]+R[-1]C+R[-1]C[-1] -> 4.20782891948067E+30 | EN33: =FIB(RC[-101])+RC[-1]+R[-1]C+R[-1]C[-1] -> 8.39223841102042E+30 | EO33: =FIB(RC[-101])+RC[-1]+R[-1]C+R[-1]C[-1] -> 1.6509821369409E+31 | EP33: =FIB(RC[-101])+RC[-1]+R[-1]C+R[-1]C[-1] -> 3.20532639799219E+31 | EQ33: =FIB(RC[-101])+RC[-1]+R[-1]C+R[-1]C[-1] -> 6.14435678330071E+31 | ER33: =FIB(RC[-101])+RC[-1]+R[-1]C+R[-1]C[-1] -> 1.16346426643018E+32 | ES33: =FIB(RC[-101])+RC[-1]+R[-1]C+R[-1]C[-1] -> 2.17715946248907E+32 | ET33: =FIB(RC[-101])+RC[-1]+R[-1]C+R[-1]C[-1] -> 4.02778877245793E+32 | EU33: =FIB(RC[-101])+RC[-1]+R[-1]C+R[-1]C[-1] -> 7.36974167743459E+32 | EV33: =FIB(RC[-101])+RC[-1]+R[-1]C+R[-1]C[-1] -> 1.33416205422773E+33 | EW33: =FIB(RC[-101])+RC[-1]+R[-1]C+R[-1]C[-1] -> 2.39050415537922E+33 | EX33: =FIB(RC[-101])+RC[-1]+R[-1]C+R[-1]C[-1] -> 4.2407395645187E+33 | EY33: =FIB(RC[-101])+RC[-1]+R[-1]C+R[-1]C[-1] -> 7.45082948016322E+33 | EZ33: =FIB(RC[-101])+RC[-1]+R[-1]C+R[-1]C[-1] -> 1.2969160958084E+34 | FA33: =FIB(RC[-101])+RC[-1]+R[-1]C+R[-1]C[-1] -> 2.23712693515078E+34 | FB33: =FIB(RC[-101])+RC[-1]+R[-1]C+R[-1]C[-1] -> 3.82527284473809E+34 | FC33: =FIB(RC[-101])+RC[-1]+R[-1]C+R[-1]C[-1] -> 6.48549948640638E+34 | FD33: =FIB(RC[-101])+RC[-1]+R[-1]C+R[-1]C[-1] -> 1.09054795188343E+35 | FE33: =FIB(RC[-101])+RC[-1]+R[-1]C+R[-1]C[-1] -> 1.81916773070368E+35 | FF33: =FIB(RC[-101])+RC[-1]+R[-1]C+R[-1]C[-1] -> 3.01112753456959E+35 | FG33: =FIB(RC[-101])+RC[-1]+R[-1]C+R[-1]C[-1] -> 4.94665356967657E+35 | FH33: =FIB(RC[-101])+RC[-1]+R[-1]C+R[-1]C[-1] -> 8.06702205035383E+35 | FI33: =FIB(RC[-101])+RC[-1]+R[-1]C+R[-1]C[-1] -> 1.3062431377541E+36 | FJ33: =FIB(RC[-101])+RC[-1]+R[-1]C+R[-1]C[-1] -> 2.10053453963509E+36 | FK33: =FIB(RC[-101])+RC[-1]+R[-1]C+R[-1]C[-1] -> 3.35515983379239E+36 | FL33: =FIB(RC[-101])+RC[-1]+R[-1]C+R[-1]C[-1] -> 5.32418908675255E+36 | FM33: =FIB(RC[-101])+RC[-1]+R[-1]C+R[-1]C[-1] -> 8.39511763975008E+36 | FN33: =FIB(RC[-101])+RC[-1]+R[-1]C+R[-1]C[-1] -> 1.31554710794627E+37 | FO33: =FIB(RC[-101])+RC[-1]+R[-1]C+R[-1]C[-1] -> 2.04909819615405E+37 | FP33: =FIB(RC[-101])+RC[-1]+R[-1]C+R[-1]C[-1] -> 3.17295324375003E+37 | FQ33: =FIB(RC[-101])+RC[-1]+R[-1]C+R[-1]C[-1] -> 4.88511017737069E+37 | FR33: =FIB(RC[-101])+RC[-1]+R[-1]C+R[-1]C[-1] -> 7.47924376820681E+37 | FS33: =FIB(RC[-101])+RC[-1]+R[-1]C+R[-1]C[-1] -> 1.13887011875879E+38 | FT33: =FIB(RC[-101])+RC[-1]+R[-1]C+R[-1]C[-1] -> 1.72497282138736E+38 | FU33: =FIB(RC[-101])+RC[-1]+R[-1]C+R[-1]C[-1] -> 2.59919068811957E+38 | FV33: =FIB(RC[-101])+RC[-1]+R[-1]C+R[-1]C[-1] -> 3.89669258640534E+38 | FW33: =FIB(RC[-101])+RC[-1]+R[-1]C+R[-1]C[-1] -> 5.81311155258402E+38 | FX33: =FIB(RC[-101])+RC[-1]+R[-1]C+R[-1]C[-1] -> 8.6303072488301E+38 | FY33: =FIB(RC[-101])+RC[-1]+R[-1]C+R[-1]C[-1] -> 1.27525722978512E+39 | FZ33: =FIB(RC[-101])+RC[-1]+R[-1]C+R[-1]C[-1] -> 1.87573059168733E+39 | GA33: =FIB(RC[-101])+RC[-1]+R[-1]C+R[-1]C[-1] -> 2.74656492771062E+39 | GB33: =FIB(RC[-101])+RC[-1]+R[-1]C+R[-1]C[-1] -> 4.00405576891025E+39 | GC33: =FIB(RC[-101])+RC[-1]+R[-1]C+R[-1]C[-1] -> 5.81224421403747E+39 | GD33: =FIB(RC[-101])+RC[-1]+R[-1]C+R[-1]C[-1] -> 8.40160657059879E+39 | GE33: =FIB(RC[-101])+RC[-1]+R[-1]C+R[-1]C[-1] -> 1.20947114567687E+40 | GF33: =FIB(RC[-101])+RC[-1]+R[-1]C+R[-1]C[-1] -> 1.73413150547294E+40 | GG33: =FIB(RC[-101])+RC[-1]+R[-1]C+R[-1]C[-1] -> 2.47661974465487E+40 | GH33: =FIB(RC[-101])+RC[-1]+R[-1]C+R[-1]C[-1] -> 3.52341411105827E+40 | GI33: =FIB(RC[-101])+RC[-1]+R[-1]C+R[-1]C[-1] -> 4.99378971658968E+40 | GJ33: =FIB(RC[-101])+RC[-1]+R[-1]C+R[-1]C[-1] -> 7.05168792937992E+40 | GK33: =FIB(RC[-101])+RC[-1]+R[-1]C+R[-1]C[-1] -> 9.92168021325386E+40 | GL33: =FIB(RC[-101])+RC[-1]+R[-1]C+R[-1]C[-1] -> 1.39103710039189E+41 | GM33: =FIB(RC[-101])+RC[-1]+R[-1]C+R[-1]C[-1] -> 1.94350039902908E+41 | GN33: =FIB(RC[-101])+RC[-1]+R[-1]C+R[-1]C[-1] -> 2.70615803551292E+41 | GO33: =FIB(RC[-101])+RC[-1]+R[-1]C+R[-1]C[-1] -> 3.75555010641773E+41 | GP33: =FIB(RC[-101])+RC[-1]+R[-1]C+R[-1]C[-1] -> 5.19486524047828E+41 | GQ33: =FIB(RC[-101])+RC[-1]+R[-1]C+R[-1]C[-1] -> 7.16280205054702E+41 | GR33: =FIB(RC[-101])+RC[-1]+R[-1]C+R[-1]C[-1] -> 9.84524168537806E+41 | GS33: =FIB(RC[-101])+RC[-1]+R[-1]C+R[-1]C[-1] -> 1.34905811255373E+42
A34: 20 | B34: 20 | C34: 20 | D34: 20 | E34: 20 | F34: 20 | G34: 20 | H34: 20 | I34: 20 | J34: 20 | K34: 20 | L34: 20 | M34: 20 | N34: 20 | O34: 20 | P34: 20 | Q34: 20 | R34: 20 | S34: 20 | T34: 20 | U34: 20 | V34: 20 | W34: 20 | X34: 20 | Y34: 20 | Z34: 20 | AA34: 20 | AB34: 20 | AC34: 20 | AD34: 20 | AE34: 20 | AF34: 20 | AG34: 20 | AH34: 20 | AI34: 20 | AJ34: 20 | AK34: 20 | AL34: 20 | AM34: 20 | AN34: 20 | AO34: 20 | AP34: 20 | AQ34: 20 | AR34: 20 | AS34: 20 | AT34: 20 | AU34: 20 | AV34: 20 | AW34: 20 | AX34: 20 | AY34: 20 | AZ34: 20 | BA34: 20 | BB34: 20 | BC34: 20 | BD34: 20 | BE34: 20 | BF34: 20 | BG34: 20 | BH34: 20 | BI34: 20 | BJ34: 20 | BK34: 20 | BL34: 20 | BM34: 20 | BN34: 20 | BO34: 20 | BP34: 20 | BQ34: 20 | BR34: 20 | BS34: 20 | BT34: 20 | BU34: 20 | BV34: 20 | BW34: 20 | BX34: 20 | BY34: 20 | BZ34: 20 | CA34: 20 | CB34: 20 | CC34: 20 | CD34: 20 | CE34: 20 | CF34: 20 | CG34: 20 | CH34: 20 | CI34: 20 | CJ34: 20 | CK34: 20 | CL34: 20 | CM34: 20 | CN34: 20 | CO34: 20 | CP34: 20 | CQ34: 20 | CR34: 20 | CS34: 20 | CT34: 20 | CU34: 20 | CV34: 20 | CW34: 0 | CX34: =FIB(RC[-101])+RC[-1]+R[-1]C+R[-1]C[-1] -> 361218 | CY34: =FIB(RC[-101])+RC[-1]+R[-1]C+R[-1]C[-1] -> 12281412 | CZ34: =FIB(RC[-101])+RC[-1]+R[-1]C+R[-1]C[-1] -> 274646086 | DA34: =FIB(RC[-101])+RC[-1]+R[-1]C+R[-1]C[-1] -> 4609623304 | DB34: =FIB(RC[-101])+RC[-1]+R[-1]C+R[-1]C[-1] -> 61988741386 | DC34: =FIB(RC[-101])+RC[-1]+R[-1]C+R[-1]C[-1] -> 696049025100 | DD34: =FIB(RC[-101])+RC[-1]+R[-1]C+R[-1]C[-1] -> 6715316784462 | DE34: =FIB(RC[-101])+RC[-1]+R[-1]C+R[-1]C[-1] -> 56849821011984 | DF34: =FIB(RC[-101])+RC[-1]+R[-1]C+R[-1]C[-1] -> 429184504715538 | DG34: =FIB(RC[-101])+RC[-1]+R[-1]C+R[-1]C[-1] -> 2.92670102054101E+15 | DH34: =FIB(RC[-101])+RC[-1]+R[-1]C+R[-1]C[-1] -> 1.82164375839786E+16 | DI34: =FIB(RC[-101])+RC[-1]+R[-1]C+R[-1]C[-1] -> 1.04391252446073E+17 | DJ34: =FIB(RC[-101])+RC[-1]+R[-1]C+R[-1]C[-1] -> 5.54831628068846E+17 | DK34: =FIB(RC[-101])+RC[-1]+R[-1]C+R[-1]C[-1] -> 2.75220038302943E+18 | DL34: =FIB(RC[-101])+RC[-1]+R[-1]C+R[-1]C[-1] -> 1.28110045637291E+19 | DM34: =FIB(RC[-101])+RC[-1]+R[-1]C+R[-1]C[-1] -> 5.62262694697056E+19 | DN34: =FIB(RC[-101])+RC[-1]+R[-1]C+R[-1]C[-1] -> 2.33655066322938E+20 | DO34: =FIB(RC[-101])+RC[-1]+R[-1]C+R[-1]C[-1] -> 9.22818668034545E+20 | DP34: =FIB(RC[-101])+RC[-1]+R[-1]C+R[-1]C[-1] -> 3.4755074711646E+21 | DQ34: =FIB(RC[-101])+RC[-1]+R[-1]C+R[-1]C[-1] -> 1.25196277630342E+22 | DR34: =FIB(RC[-101])+RC[-1]+R[-1]C+R[-1]C[-1] -> 4.32535814069803E+22 | DS34: =FIB(RC[-101])+RC[-1]+R[-1]C+R[-1]C[-1] -> 1.43677369876882E+23 | DT34: =FIB(RC[-101])+RC[-1]+R[-1]C+R[-1]C[-1] -> 4.59911416204549E+23 | DU34: =FIB(RC[-101])+RC[-1]+R[-1]C+R[-1]C[-1] -> 1.42161018303638E+24 | DV34: =FIB(RC[-101])+RC[-1]+R[-1]C+R[-1]C[-1] -> 4.25143025009386E+24 | DW34: =FIB(RC[-101])+RC[-1]+R[-1]C+R[-1]C[-1] -> 1.23225415896999E+25 | DX34: =FIB(RC[-101])+RC[-1]+R[-1]C+R[-1]C[-1] -> 3.46721286300865E+25 | DY34: =FIB(RC[-101])+RC[-1]+R[-1]C+R[-1]C[-1] -> 9.48479014692034E+25 | DZ34: =FIB(RC[-101])+RC[-1]+R[-1]C+R[-1]C[-1] -> 2.5260789655445E+26 | EA34: =FIB(RC[-101])+RC[-1]+R[-1]C+R[-1]C[-1] -> 6.55843940391835E+26 | EB34: =FIB(RC[-101])+RC[-1]+R[-1]C+R[-1]C[-1] -> 1.66192841622214E+27 | EC34: =FIB(RC[-101])+RC[-1]+R[-1]C+R[-1]C[-1] -> 4.1150114387197E+27 | ED34: =FIB(RC[-101])+RC[-1]+R[-1]C+R[-1]C[-1] -> 9.96628714282814E+27 | EE34: =FIB(RC[-101])+RC[-1]+R[-1]C+R[-1]C[-1] -> 2.36334298837422E+28 | EF34: =FIB(RC[-101])+RC[-1]+R[-1]C+R[-1]C[-1] -> 5.49226732876253E+28 | EG34: =FIB(RC[-101])+RC[-1]+R[-1]C+R[-1]C[-1] -> 1.2519414322783E+29 | EH34: =FIB(RC[-101])+RC[-1]+R[-1]C+R[-1]C[-1] -> 2.80141184719435E+29 | EI34: =FIB(RC[-101])+RC[-1]+R[-1]C+R[-1]C[-1] -> 6.15832701990312E+29 | EJ34: =FIB(RC[-101])+RC[-1]+R[-1]C+R[-1]C[-1] -> 1.33092707827409E+30 | EK34: =FIB(RC[-101])+RC[-1]+R[-1]C+R[-1]C[-1] -> 2.82973974054965E+30 | EL34: =FIB(RC[-101])+RC[-1]+R[-1]C+R[-1]C[-1] -> 5.92267428653147E+30 | EM34: =FIB(RC[-101])+RC[-1]+R[-1]C+R[-1]C[-1] -> 1.22104406323844E+31 | EN34: =FIB(RC[-101])+RC[-1]+R[-1]C+R[-1]C[-1] -> 2.48105079628855E+31 | EO34: =FIB(RC[-101])+RC[-1]+R[-1]C+R[-1]C[-1] -> 4.97125677433149E+31 | EP34: =FIB(RC[-101])+RC[-1]+R[-1]C+R[-1]C[-1] -> 9.82756530926458E+31 | EQ34: =FIB(RC[-101])+RC[-1]+R[-1]C+R[-1]C[-1] -> 1.91772484905575E+32 | ER34: =FIB(RC[-101])+RC[-1]+R[-1]C+R[-1]C[-1] -> 3.695624793816E+32 | ES34: =FIB(RC[-101])+RC[-1]+R[-1]C+R[-1]C[-1] -> 7.03624852273526E+32 | ET34: =FIB(RC[-101])+RC[-1]+R[-1]C+R[-1]C[-1] -> 1.32411967576822E+33 | EU34: =FIB(RC[-101])+RC[-1]+R[-1]C+R[-1]C[-1] -> 2.46387272075748E+33 | EV34: =FIB(RC[-101])+RC[-1]+R[-1]C+R[-1]C[-1] -> 4.53500894272867E+33 | EW34: =FIB(RC[-101])+RC[-1]+R[-1]C+R[-1]C[-1] -> 8.25967515233562E+33 | EX34: =FIB(RC[-101])+RC[-1]+R[-1]C+R[-1]C[-1] -> 1.48909188722335E+34 | EY34: =FIB(RC[-101])+RC[-1]+R[-1]C+R[-1]C[-1] -> 2.65824879169155E+34 | EZ34: =FIB(RC[-101])+RC[-1]+R[-1]C+R[-1]C[-1] -> 4.70024783551627E+34 | FA34: =FIB(RC[-101])+RC[-1]+R[-1]C+R[-1]C[-1] -> 8.23429086647545E+34 | FB34: =FIB(RC[-101])+RC[-1]+R[-1]C+R[-1]C[-1] -> 1.42966906463643E+35 | FC34: =FIB(RC[-101])+RC[-1]+R[-1]C+R[-1]C[-1] -> 2.46074629775088E+35 | FD34: =FIB(RC[-101])+RC[-1]+R[-1]C+R[-1]C[-1] -> 4.19984419827495E+35 | FE34: =FIB(RC[-101])+RC[-1]+R[-1]C+R[-1]C[-1] -> 7.10955988086205E+35 | FF34: =FIB(RC[-101])+RC[-1]+R[-1]C+R[-1]C[-1] -> 1.19398551461353E+36 | FG34: =FIB(RC[-101])+RC[-1]+R[-1]C+R[-1]C[-1] -> 1.98976362503815E+36 | FH34: =FIB(RC[-101])+RC[-1]+R[-1]C+R[-1]C[-1] -> 3.29113118704119E+36 | FI34: =FIB(RC[-101])+RC[-1]+R[-1]C+R[-1]C[-1] -> 5.40407652983067E+36 | FJ34: =FIB(RC[-101])+RC[-1]+R[-1]C+R[-1]C[-1] -> 8.81085420721986E+36 | FK34: =FIB(RC[-101])+RC[-1]+R[-1]C+R[-1]C[-1] -> 1.42665485806473E+37 | FL34: =FIB(RC[-101])+RC[-1]+R[-1]C+R[-1]C[-1] -> 2.29458975011923E+37 | FM34: =FIB(RC[-101])+RC[-1]+R[-1]C+R[-1]C[-1] -> 3.66652042276949E+37 | FN34: =FIB(RC[-101])+RC[-1]+R[-1]C+R[-1]C[-1] -> 5.82157929469077E+37 | FO34: =FIB(RC[-101])+RC[-1]+R[-1]C+R[-1]C[-1] -> 9.1862245987911E+37 | FP34: =FIB(RC[-101])+RC[-1]+R[-1]C+R[-1]C[-1] -> 1.44082760386952E+38 | FQ34: =FIB(RC[-101])+RC[-1]+R[-1]C+R[-1]C[-1] -> 2.24663394598159E+38 | FR34: =FIB(RC[-101])+RC[-1]+R[-1]C+R[-1]C[-1] -> 3.48306934053934E+38 | FS34: =FIB(RC[-101])+RC[-1]+R[-1]C+R[-1]C[-1] -> 5.36986383611881E+38 | FT34: =FIB(RC[-101])+RC[-1]+R[-1]C+R[-1]C[-1] -> 8.23370677626495E+38 | FU34: =FIB(RC[-101])+RC[-1]+R[-1]C+R[-1]C[-1] -> 1.25578702857719E+39 | FV34: =FIB(RC[-101])+RC[-1]+R[-1]C+R[-1]C[-1] -> 1.90537535602968E+39 | FW34: =FIB(RC[-101])+RC[-1]+R[-1]C+R[-1]C[-1] -> 2.87635576992861E+39 | FX34: =FIB(RC[-101])+RC[-1]+R[-1]C+R[-1]C[-1] -> 4.32069765007003E+39 | FY34: =FIB(RC[-101])+RC[-1]+R[-1]C+R[-1]C[-1] -> 6.45898560473815E+39 | FZ34: =FIB(RC[-101])+RC[-1]+R[-1]C+R[-1]C[-1] -> 9.6099734262106E+39 | GA34: =FIB(RC[-101])+RC[-1]+R[-1]C+R[-1]C[-1] -> 1.42322689456085E+40 | GB34: =FIB(RC[-101])+RC[-1]+R[-1]C+R[-1]C[-1] -> 2.09828896422294E+40 | GC34: =FIB(RC[-101])+RC[-1]+R[-1]C+R[-1]C[-1] -> 3.07991896251771E+40 | GD34: =FIB(RC[-101])+RC[-1]+R[-1]C+R[-1]C[-1] -> 4.50130404098134E+40 | GE34: =FIB(RC[-101])+RC[-1]+R[-1]C+R[-1]C[-1] -> 6.55093584371809E+40 | GF34: =FIB(RC[-101])+RC[-1]+R[-1]C+R[-1]C[-1] -> 9.4945384948679E+40 | GG34: =FIB(RC[-101])+RC[-1]+R[-1]C+R[-1]C[-1] -> 1.37052897449957E+41 | GH34: =FIB(RC[-101])+RC[-1]+R[-1]C+R[-1]C[-1] -> 1.97053236007089E+41 | GI34: =FIB(RC[-101])+RC[-1]+R[-1]C+R[-1]C[-1] -> 2.82225274283568E+41 | GJ34: =FIB(RC[-101])+RC[-1]+R[-1]C+R[-1]C[-1] -> 4.02680050743264E+41 | GK34: =FIB(RC[-101])+RC[-1]+R[-1]C+R[-1]C[-1] -> 5.72413732169602E+41 | GL34: =FIB(RC[-101])+RC[-1]+R[-1]C+R[-1]C[-1] -> 8.10734244341329E+41 | GM34: =FIB(RC[-101])+RC[-1]+R[-1]C+R[-1]C[-1] -> 1.14418799428343E+42 | GN34: =FIB(RC[-101])+RC[-1]+R[-1]C+R[-1]C[-1] -> 1.60915383773763E+42 | GO34: =FIB(RC[-101])+RC[-1]+R[-1]C+R[-1]C[-1] -> 2.25532465193069E+42 | GP34: =FIB(RC[-101])+RC[-1]+R[-1]C+R[-1]C[-1] -> 3.15036618662029E+42 | GQ34: =FIB(RC[-101])+RC[-1]+R[-1]C+R[-1]C[-1] -> 4.38613291572282E+42 | GR34: =FIB(RC[-101])+RC[-1]+R[-1]C+R[-1]C[-1] -> 6.08693728931533E+42 | GS34: =FIB(RC[-101])+RC[-1]+R[-1]C+R[-1]C[-1] -> 8.42051957040687E+42
A35: 20 | B35: 20 | C35: 20 | D35: 20 | E35: 20 | F35: 20 | G35: 20 | H35: 20 | I35: 20 | J35: 20 | K35: 20 | L35: 20 | M35: 20 | N35: 20 | O35: 20 | P35: 20 | Q35: 20 | R35: 20 | S35: 20 | T35: 20 | U35: 20 | V35: 20 | W35: 20 | X35: 20 | Y35: 20 | Z35: 20 | AA35: 20 | AB35: 20 | AC35: 20 | AD35: 20 | AE35: 20 | AF35: 20 | AG35: 20 | AH35: 20 | AI35: 20 | AJ35: 20 | AK35: 20 | AL35: 20 | AM35: 20 | AN35: 20 | AO35: 20 | AP35: 20 | AQ35: 20 | AR35: 20 | AS35: 20 | AT35: 20 | AU35: 20 | AV35: 20 | AW35: 20 | AX35: 20 | AY35: 20 | AZ35: 20 | BA35: 20 | BB35: 20 | BC35: 20 | BD35: 20 | BE35: 20 | BF35: 20 | BG35: 20 | BH35: 20 | BI35: 20 | BJ35: 20 | BK35: 20 | BL35: 20 | BM35: 20 | BN35: 20 | BO35: 20 | BP35: 20 | BQ35: 20 | BR35: 20 | BS35: 20 | BT35: 20 | BU35: 20 | BV35: 20 | BW35: 20 | BX35: 20 | BY35: 20 | BZ35: 20 | CA35: 20 | CB35: 20 | CC35: 20 | CD35: 20 | CE35: 20 | CF35: 20 | CG35: 20 | CH35: 20 | CI35: 20 | CJ35: 20 | CK35: 20 | CL35: 20 | CM35: 20 | CN35: 20 | CO35: 20 | CP35: 20 | CQ35: 20 | CR35: 20 | CS35: 20 | CT35: 20 | CU35: 20 | CV35: 20 | CW35: 0 | CX35: =FIB(RC[-101])+RC[-1]+R[-1]C+R[-1]C[-1] -> 372164 | CY35: =FIB(RC[-101])+RC[-1]+R[-1]C+R[-1]C[-1] -> 13025740 | CZ35: =FIB(RC[-101])+RC[-1]+R[-1]C+R[-1]C[-1] -> 299964184 | DA35: =FIB(RC[-101])+RC[-1]+R[-1]C+R[-1]C[-1] -> 5184244520 | DB35: =FIB(RC[-101])+RC[-1]+R[-1]C+R[-1]C[-1] -> 71782620156 | DC35: =FIB(RC[-101])+RC[-1]+R[-1]C+R[-1]C[-1] -> 829820397588 | DD35: =FIB(RC[-101])+RC[-1]+R[-1]C+R[-1]C[-1] -> 8241186218096 | DE35: =FIB(RC[-101])+RC[-1]+R[-1]C+R[-1]C[-1] -> 71806324025488 | DF35: =FIB(RC[-101])+RC[-1]+R[-1]C+R[-1]C[-1] -> 557840649763956 | DG35: =FIB(RC[-101])+RC[-1]+R[-1]C+R[-1]C[-1] -> 3.91372617503145E+15 | DH35: =FIB(RC[-101])+RC[-1]+R[-1]C+R[-1]C[-1] -> 2.5056864779562E+16 | DI35: =FIB(RC[-101])+RC[-1]+R[-1]C+R[-1]C[-1] -> 1.47664554809625E+17 | DJ35: =FIB(RC[-101])+RC[-1]+R[-1]C+R[-1]C[-1] -> 8.06887435324555E+17 | DK35: =FIB(RC[-101])+RC[-1]+R[-1]C+R[-1]C[-1] -> 4.11391944642284E+18 | DL35: =FIB(RC[-101])+RC[-1]+R[-1]C+R[-1]C[-1] -> 1.96771243931814E+19 | DM35: =FIB(RC[-101])+RC[-1]+R[-1]C+R[-1]C[-1] -> 8.8714398426616E+19 | DN35: =FIB(RC[-101])+RC[-1]+R[-1]C+R[-1]C[-1] -> 3.78595734219259E+20 | DO35: =FIB(RC[-101])+RC[-1]+R[-1]C+R[-1]C[-1] -> 1.53506946857674E+21 | DP35: =FIB(RC[-101])+RC[-1]+R[-1]C+R[-1]C[-1] -> 5.93339560777589E+21 | DQ35: =FIB(RC[-101])+RC[-1]+R[-1]C+R[-1]C[-1] -> 2.19285308419747E+22 | DR35: =FIB(RC[-101])+RC[-1]+R[-1]C+R[-1]C[-1] -> 7.77017400119892E+22 | DS35: =FIB(RC[-101])+RC[-1]+R[-1]C+R[-1]C[-1] -> 2.64632691295851E+23 | DT35: =FIB(RC[-101])+RC[-1]+R[-1]C+R[-1]C[-1] -> 8.68221477377282E+23 | DU35: =FIB(RC[-101])+RC[-1]+R[-1]C+R[-1]C[-1] -> 2.74974307661821E+24 | DV35: =FIB(RC[-101])+RC[-1]+R[-1]C+R[-1]C[-1] -> 8.42278350974845E+24 | DW35: =FIB(RC[-101])+RC[-1]+R[-1]C+R[-1]C[-1] -> 2.49967553495422E+25 | DX35: =FIB(RC[-101])+RC[-1]+R[-1]C+R[-1]C[-1] -> 7.19914255693287E+25 | DY35: =FIB(RC[-101])+RC[-1]+R[-1]C+R[-1]C[-1] -> 2.01511455668619E+26 | DZ35: =FIB(RC[-101])+RC[-1]+R[-1]C+R[-1]C[-1] -> 5.48967253692272E+26 | EA35: =FIB(RC[-101])+RC[-1]+R[-1]C+R[-1]C[-1] -> 1.45741909063856E+27 | EB35: =FIB(RC[-101])+RC[-1]+R[-1]C+R[-1]C[-1] -> 3.77519144725253E+27 | EC35: =FIB(RC[-101])+RC[-1]+R[-1]C+R[-1]C[-1] -> 9.55213130219438E+27 | ED35: =FIB(RC[-101])+RC[-1]+R[-1]C+R[-1]C[-1] -> 2.36334298837422E+28 | EE35: =FIB(RC[-101])+RC[-1]+R[-1]C+R[-1]C[-1] -> 5.72331469103126E+28 | EF35: =FIB(RC[-101])+RC[-1]+R[-1]C+R[-1]C[-1] -> 1.3578925008168E+29 | EG35: =FIB(RC[-101])+RC[-1]+R[-1]C+R[-1]C[-1] -> 3.15906066597135E+29 | EH35: =FIB(RC[-101])+RC[-1]+R[-1]C+R[-1]C[-1] -> 7.212413945444E+29 | EI35: =FIB(RC[-101])+RC[-1]+R[-1]C+R[-1]C[-1] -> 1.61721528125415E+30 | EJ35: =FIB(RC[-101])+RC[-1]+R[-1]C+R[-1]C[-1] -> 3.56397506151855E+30 | EK35: =FIB(RC[-101])+RC[-1]+R[-1]C+R[-1]C[-1] -> 7.72464188034229E+30 | EL35: =FIB(RC[-101])+RC[-1]+R[-1]C+R[-1]C[-1] -> 1.64770559074234E+31 | EM35: =FIB(RC[-101])+RC[-1]+R[-1]C+R[-1]C[-1] -> 3.46101708263393E+31 | EN35: =FIB(RC[-101])+RC[-1]+R[-1]C+R[-1]C[-1] -> 7.16311194216091E+31 | EO35: =FIB(RC[-101])+RC[-1]+R[-1]C+R[-1]C[-1] -> 1.4615419512781E+32 | EP35: =FIB(RC[-101])+RC[-1]+R[-1]C+R[-1]C[-1] -> 2.9414241596377E+32 | EQ35: =FIB(RC[-101])+RC[-1]+R[-1]C+R[-1]C[-1] -> 5.84190553961991E+32 | ER35: =FIB(RC[-101])+RC[-1]+R[-1]C+R[-1]C[-1] -> 1.14552551824917E+33 | ES35: =FIB(RC[-101])+RC[-1]+R[-1]C+R[-1]C[-1] -> 2.21871284990429E+33 | ET35: =FIB(RC[-101])+RC[-1]+R[-1]C+R[-1]C[-1] -> 4.24645737794604E+33 | EU35: =FIB(RC[-101])+RC[-1]+R[-1]C+R[-1]C[-1] -> 8.03444977447174E+33 | EV35: =FIB(RC[-101])+RC[-1]+R[-1]C+R[-1]C[-1] -> 1.50333314379579E+34 | EW35: =FIB(RC[-101])+RC[-1]+R[-1]C+R[-1]C[-1] -> 2.78280155330222E+34 | EX35: =FIB(RC[-101])+RC[-1]+R[-1]C+R[-1]C[-1] -> 5.09786095575913E+34 | EY35: =FIB(RC[-101])+RC[-1]+R[-1]C+R[-1]C[-1] -> 9.24520163467403E+34 | EZ35: =FIB(RC[-101])+RC[-1]+R[-1]C+R[-1]C[-1] -> 1.66036982618818E+35 | FA35: =FIB(RC[-101])+RC[-1]+R[-1]C+R[-1]C[-1] -> 2.95382369638736E+35 | FB35: =FIB(RC[-101])+RC[-1]+R[-1]C+R[-1]C[-1] -> 5.20692184767133E+35 | FC35: =FIB(RC[-101])+RC[-1]+R[-1]C+R[-1]C[-1] -> 9.09733721005864E+35 | FD35: =FIB(RC[-101])+RC[-1]+R[-1]C+R[-1]C[-1] -> 1.57579277060845E+36 | FE35: =FIB(RC[-101])+RC[-1]+R[-1]C+R[-1]C[-1] -> 2.70673317852215E+36 | FF35: =FIB(RC[-101])+RC[-1]+R[-1]C+R[-1]C[-1] -> 4.61167468122188E+36 | FG35: =FIB(RC[-101])+RC[-1]+R[-1]C+R[-1]C[-1] -> 7.79542382087356E+36 | FH35: =FIB(RC[-101])+RC[-1]+R[-1]C+R[-1]C[-1] -> 1.30763186329529E+37 | FI35: =FIB(RC[-101])+RC[-1]+R[-1]C+R[-1]C[-1] -> 2.17715263498248E+37 | FJ35: =FIB(RC[-101])+RC[-1]+R[-1]C+R[-1]C[-1] -> 3.59864570868753E+37 | FK35: =FIB(RC[-101])+RC[-1]+R[-1]C+R[-1]C[-1] -> 5.90638598747425E+37 | FL35: =FIB(RC[-101])+RC[-1]+R[-1]C+R[-1]C[-1] -> 9.62763059565821E+37 | FM35: =FIB(RC[-101])+RC[-1]+R[-1]C+R[-1]C[-1] -> 1.55887407685469E+38 | FN35: =FIB(RC[-101])+RC[-1]+R[-1]C+R[-1]C[-1] -> 2.50768404860072E+38 | FO35: =FIB(RC[-101])+RC[-1]+R[-1]C+R[-1]C[-1] -> 4.00846443794891E+38 | FP35: =FIB(RC[-101])+RC[-1]+R[-1]C+R[-1]C[-1] -> 6.36791450169754E+38 | FQ35: =FIB(RC[-101])+RC[-1]+R[-1]C+R[-1]C[-1] -> 1.00553760515486E+39 | FR35: =FIB(RC[-101])+RC[-1]+R[-1]C+R[-1]C[-1] -> 1.57850793380696E+39 | FS35: =FIB(RC[-101])+RC[-1]+R[-1]C+R[-1]C[-1] -> 2.46380125147277E+39 | FT35: =FIB(RC[-101])+RC[-1]+R[-1]C+R[-1]C[-1] -> 3.82415831271115E+39 | FU35: =FIB(RC[-101])+RC[-1]+R[-1]C+R[-1]C[-1] -> 5.90331601891483E+39 | FV35: =FIB(RC[-101])+RC[-1]+R[-1]C+R[-1]C[-1] -> 9.0644784035217E+39 | FW35: =FIB(RC[-101])+RC[-1]+R[-1]C+R[-1]C[-1] -> 1.384620952948E+40 | FX35: =FIB(RC[-101])+RC[-1]+R[-1]C+R[-1]C[-1] -> 2.10432629494786E+40 | FY35: =FIB(RC[-101])+RC[-1]+R[-1]C+R[-1]C[-1] -> 3.18229462042868E+40 | FZ35: =FIB(RC[-101])+RC[-1]+R[-1]C+R[-1]C[-1] -> 4.78919052352356E+40 | GA35: =FIB(RC[-101])+RC[-1]+R[-1]C+R[-1]C[-1] -> 7.17341476070547E+40 | GB35: =FIB(RC[-101])+RC[-1]+R[-1]C+R[-1]C[-1] -> 1.06949306194893E+41 | GC35: =FIB(RC[-101])+RC[-1]+R[-1]C+R[-1]C[-1] -> 1.58731385462299E+41 | GD35: =FIB(RC[-101])+RC[-1]+R[-1]C+R[-1]C[-1] -> 2.3454361549729E+41 | GE35: =FIB(RC[-101])+RC[-1]+R[-1]C+R[-1]C[-1] -> 3.45066014344284E+41 | GF35: =FIB(RC[-101])+RC[-1]+R[-1]C+R[-1]C[-1] -> 5.05520757730144E+41 | GG35: =FIB(RC[-101])+RC[-1]+R[-1]C+R[-1]C[-1] -> 7.3751904012878E+41 | GH35: =FIB(RC[-101])+RC[-1]+R[-1]C+R[-1]C[-1] -> 1.07162517358583E+42 | GI35: =FIB(RC[-101])+RC[-1]+R[-1]C+R[-1]C[-1] -> 1.55090368387648E+42 | GJ35: =FIB(RC[-101])+RC[-1]+R[-1]C+R[-1]C[-1] -> 2.23580900890331E+42 | GK35: =FIB(RC[-101])+RC[-1]+R[-1]C+R[-1]C[-1] -> 3.21090279181618E+42 | GL35: =FIB(RC[-101])+RC[-1]+R[-1]C+R[-1]C[-1] -> 4.59405076832711E+42 | GM35: =FIB(RC[-101])+RC[-1]+R[-1]C+R[-1]C[-1] -> 6.54897300695186E+42 | GN35: =FIB(RC[-101])+RC[-1]+R[-1]C+R[-1]C[-1] -> 9.30231483897292E+42 | GO35: =FIB(RC[-101])+RC[-1]+R[-1]C+R[-1]C[-1] -> 1.31667933286412E+43 | GP35: =FIB(RC[-101])+RC[-1]+R[-1]C+R[-1]C[-1] -> 1.85724841671922E+43 | GQ35: =FIB(RC[-101])+RC[-1]+R[-1]C+R[-1]C[-1] -> 2.61089832695353E+43 | GR35: =FIB(RC[-101])+RC[-1]+R[-1]C+R[-1]C[-1] -> 3.65820534745735E+43 | GS35: =FIB(RC[-101])+RC[-1]+R[-1]C+R[-1]C[-1] -> 5.10895103342957E+43
A36: 20 | B36: 20 | C36: 20 | D36: 20 | E36: 20 | F36: 20 | G36: 20 | H36: 20 | I36: 20 | J36: 20 | K36: 20 | L36: 20 | M36: 20 | N36: 20 | O36: 20 | P36: 20 | Q36: 20 | R36: 20 | S36: 20 | T36: 20 | U36: 20 | V36: 20 | W36: 20 | X36: 20 | Y36: 20 | Z36: 20 | AA36: 20 | AB36: 20 | AC36: 20 | AD36: 20 | AE36: 20 | AF36: 20 | AG36: 20 | AH36: 20 | AI36: 20 | AJ36: 20 | AK36: 20 | AL36: 20 | AM36: 20 | AN36: 20 | AO36: 20 | AP36: 20 | AQ36: 20 | AR36: 20 | AS36: 20 | AT36: 20 | AU36: 20 | AV36: 20 | AW36: 20 | AX36: 20 | AY36: 20 | AZ36: 20 | BA36: 20 | BB36: 20 | BC36: 20 | BD36: 20 | BE36: 20 | BF36: 20 | BG36: 20 | BH36: 20 | BI36: 20 | BJ36: 20 | BK36: 20 | BL36: 20 | BM36: 20 | BN36: 20 | BO36: 20 | BP36: 20 | BQ36: 20 | BR36: 20 | BS36: 20 | BT36: 20 | BU36: 20 | BV36: 20 | BW36: 20 | BX36: 20 | BY36: 20 | BZ36: 20 | CA36: 20 | CB36: 20 | CC36: 20 | CD36: 20 | CE36: 20 | CF36: 20 | CG36: 20 | CH36: 20 | CI36: 20 | CJ36: 20 | CK36: 20 | CL36: 20 | CM36: 20 | CN36: 20 | CO36: 20 | CP36: 20 | CQ36: 20 | CR36: 20 | CS36: 20 | CT36: 20 | CU36: 20 | CV36: 20 | CW36: 0 | CX36: =FIB(RC[-101])+RC[-1]+R[-1]C+R[-1]C[-1] -> 383110 | CY36: =FIB(RC[-101])+RC[-1]+R[-1]C+R[-1]C[-1] -> 13791960 | CZ36: =FIB(RC[-101])+RC[-1]+R[-1]C+R[-1]C[-1] -> 326792830 | DA36: =FIB(RC[-101])+RC[-1]+R[-1]C+R[-1]C[-1] -> 5811012480 | DB36: =FIB(RC[-101])+RC[-1]+R[-1]C+R[-1]C[-1] -> 82777888102 | DC36: =FIB(RC[-101])+RC[-1]+R[-1]C+R[-1]C[-1] -> 984380916792 | DD36: =FIB(RC[-101])+RC[-1]+R[-1]C+R[-1]C[-1] -> 10055387543422 | DE36: =FIB(RC[-101])+RC[-1]+R[-1]C+R[-1]C[-1] -> 90102897797952 | DF36: =FIB(RC[-101])+RC[-1]+R[-1]C+R[-1]C[-1] -> 719749871598342 | DG36: =FIB(RC[-101])+RC[-1]+R[-1]C+R[-1]C[-1] -> 5.1913166964047E+15 | DH36: =FIB(RC[-101])+RC[-1]+R[-1]C+R[-1]C[-1] -> 3.41619076510091E+16 | DI36: =FIB(RC[-101])+RC[-1]+R[-1]C+R[-1]C[-1] -> 2.06883327240207E+17 | DJ36: =FIB(RC[-101])+RC[-1]+R[-1]C+R[-1]C[-1] -> 1.1614353173744E+18 | DK36: =FIB(RC[-101])+RC[-1]+R[-1]C+R[-1]C[-1] -> 6.08224219912181E+18 | DL36: =FIB(RC[-101])+RC[-1]+R[-1]C+R[-1]C[-1] -> 2.9873286038726E+19 | DM36: =FIB(RC[-101])+RC[-1]+R[-1]C+R[-1]C[-1] -> 1.38264808858523E+20 | DN36: =FIB(RC[-101])+RC[-1]+R[-1]C+R[-1]C[-1] -> 6.05574941504399E+20 | DO36: =FIB(RC[-101])+RC[-1]+R[-1]C+R[-1]C[-1] -> 2.5192401443004E+21 | DP36: =FIB(RC[-101])+RC[-1]+R[-1]C+R[-1]C[-1] -> 9.98770522065303E+21 | DQ36: =FIB(RC[-101])+RC[-1]+R[-1]C+R[-1]C[-1] -> 3.78496316704036E+22 | DR36: =FIB(RC[-101])+RC[-1]+R[-1]C+R[-1]C[-1] -> 1.37479902524368E+23 | DS36: =FIB(RC[-101])+RC[-1]+R[-1]C+R[-1]C[-1] -> 4.79814333832208E+23 | DT36: =FIB(RC[-101])+RC[-1]+R[-1]C+R[-1]C[-1] -> 1.61266850250534E+24 | DU36: =FIB(RC[-101])+RC[-1]+R[-1]C+R[-1]C[-1] -> 5.23063305650083E+24 | DV36: =FIB(RC[-101])+RC[-1]+R[-1]C+R[-1]C[-1] -> 1.64031596428675E+25 | DW36: =FIB(RC[-101])+RC[-1]+R[-1]C+R[-1]C[-1] -> 4.98226985021582E+25 | DX36: =FIB(RC[-101])+RC[-1]+R[-1]C+R[-1]C[-1] -> 1.46810879421029E+26 | DY36: =FIB(RC[-101])+RC[-1]+R[-1]C+R[-1]C[-1] -> 4.20313760658976E+26 | DZ36: =FIB(RC[-101])+RC[-1]+R[-1]C+R[-1]C[-1] -> 1.17079247001987E+27 | EA36: =FIB(RC[-101])+RC[-1]+R[-1]C+R[-1]C[-1] -> 3.17717881435069E+27 | EB36: =FIB(RC[-101])+RC[-1]+R[-1]C+R[-1]C[-1] -> 8.40978935224178E+27 | EC36: =FIB(RC[-101])+RC[-1]+R[-1]C+R[-1]C[-1] -> 2.17371121016887E+28 | ED36: =FIB(RC[-101])+RC[-1]+R[-1]C+R[-1]C[-1] -> 5.49226732876253E+28 | EE36: =FIB(RC[-101])+RC[-1]+R[-1]C+R[-1]C[-1] -> 1.3578925008168E+29 | EF36: =FIB(RC[-101])+RC[-1]+R[-1]C+R[-1]C[-1] -> 3.28811647073673E+29 | EG36: =FIB(RC[-101])+RC[-1]+R[-1]C+R[-1]C[-1] -> 7.80506963752488E+29 | EH36: =FIB(RC[-101])+RC[-1]+R[-1]C+R[-1]C[-1] -> 1.81765442489402E+30 | EI36: =FIB(RC[-101])+RC[-1]+R[-1]C+R[-1]C[-1] -> 4.15611110069257E+30 | EJ36: =FIB(RC[-101])+RC[-1]+R[-1]C+R[-1]C[-1] -> 9.33730144346527E+30 | EK36: =FIB(RC[-101])+RC[-1]+R[-1]C+R[-1]C[-1] -> 2.06259183853261E+31 | EL36: =FIB(RC[-101])+RC[-1]+R[-1]C+R[-1]C[-1] -> 4.48276161730918E+31 | EM36: =FIB(RC[-101])+RC[-1]+R[-1]C+R[-1]C[-1] -> 9.59148429068545E+31 | EN36: =FIB(RC[-101])+RC[-1]+R[-1]C+R[-1]C[-1] -> 2.02156133154803E+32 | EO36: =FIB(RC[-101])+RC[-1]+R[-1]C+R[-1]C[-1] -> 4.19941447704222E+32 | EP36: =FIB(RC[-101])+RC[-1]+R[-1]C+R[-1]C[-1] -> 8.60238058795801E+32 | EQ36: =FIB(RC[-101])+RC[-1]+R[-1]C+R[-1]C[-1] -> 1.73857102872156E+33 | ER36: =FIB(RC[-101])+RC[-1]+R[-1]C+R[-1]C[-1] -> 3.46828710093272E+33 | ES36: =FIB(RC[-101])+RC[-1]+R[-1]C+R[-1]C[-1] -> 6.83252546908618E+33 | ET36: =FIB(RC[-101])+RC[-1]+R[-1]C+R[-1]C[-1] -> 1.32976956969365E+34 | EU36: =FIB(RC[-101])+RC[-1]+R[-1]C+R[-1]C[-1] -> 2.55786028493543E+34 | EV36: =FIB(RC[-101])+RC[-1]+R[-1]C+R[-1]C[-1] -> 4.86463840617839E+34 | EW36: =FIB(RC[-101])+RC[-1]+R[-1]C+R[-1]C[-1] -> 9.1507731032764E+34 | EX36: =FIB(RC[-101])+RC[-1]+R[-1]C+R[-1]C[-1] -> 1.70314356123378E+35 | EY36: =FIB(RC[-101])+RC[-1]+R[-1]C+R[-1]C[-1] -> 3.13744982027709E+35 | EZ36: =FIB(RC[-101])+RC[-1]+R[-1]C+R[-1]C[-1] -> 5.72233980993268E+35 | FA36: =FIB(RC[-101])+RC[-1]+R[-1]C+R[-1]C[-1] -> 1.03365333325082E+36 | FB36: =FIB(RC[-101])+RC[-1]+R[-1]C+R[-1]C[-1] -> 1.84972788765669E+36 | FC36: =FIB(RC[-101])+RC[-1]+R[-1]C+R[-1]C[-1] -> 3.28015379342969E+36 | FD36: =FIB(RC[-101])+RC[-1]+R[-1]C+R[-1]C[-1] -> 5.765680285044E+36 | FE36: =FIB(RC[-101])+RC[-1]+R[-1]C+R[-1]C[-1] -> 1.00482062341746E+37 | FF36: =FIB(RC[-101])+RC[-1]+R[-1]C+R[-1]C[-1] -> 1.73666140939186E+37 | FG36: =FIB(RC[-101])+RC[-1]+R[-1]C+R[-1]C[-1] -> 2.97737125960141E+37 | FH36: =FIB(RC[-101])+RC[-1]+R[-1]C+R[-1]C[-1] -> 5.06454550498405E+37 | FI36: =FIB(RC[-101])+RC[-1]+R[-1]C+R[-1]C[-1] -> 8.54933000326182E+37 | FJ36: =FIB(RC[-101])+RC[-1]+R[-1]C+R[-1]C[-1] -> 1.43251283469318E+38 | FK36: =FIB(RC[-101])+RC[-1]+R[-1]C+R[-1]C[-1] -> 2.38301600430936E+38 | FL36: =FIB(RC[-101])+RC[-1]+R[-1]C+R[-1]C[-1] -> 3.93641766262261E+38 | FM36: =FIB(RC[-101])+RC[-1]+R[-1]C+R[-1]C[-1] -> 6.45805479904312E+38 | FN36: =FIB(RC[-101])+RC[-1]+R[-1]C+R[-1]C[-1] -> 1.05246129244985E+39 | FO36: =FIB(RC[-101])+RC[-1]+R[-1]C+R[-1]C[-1] -> 1.70407614110482E+39 | FP36: =FIB(RC[-101])+RC[-1]+R[-1]C+R[-1]C[-1] -> 2.74171403506946E+39 | FQ36: =FIB(RC[-101])+RC[-1]+R[-1]C+R[-1]C[-1] -> 4.38404309039408E+39 | FR36: =FIB(RC[-101])+RC[-1]+R[-1]C+R[-1]C[-1] -> 6.9680886293559E+39 | FS36: =FIB(RC[-101])+RC[-1]+R[-1]C+R[-1]C[-1] -> 1.10103978146356E+40 | FT36: =FIB(RC[-101])+RC[-1]+R[-1]C+R[-1]C[-1] -> 1.72983573788195E+40 | FU36: =FIB(RC[-101])+RC[-1]+R[-1]C+R[-1]C[-1] -> 2.70258317104455E+40 | FV36: =FIB(RC[-101])+RC[-1]+R[-1]C+R[-1]C[-1] -> 4.19936261328821E+40 | FW36: =FIB(RC[-101])+RC[-1]+R[-1]C+R[-1]C[-1] -> 6.49043140658837E+40 | FX36: =FIB(RC[-101])+RC[-1]+R[-1]C+R[-1]C[-1] -> 9.97937865448424E+40 | FY36: =FIB(RC[-101])+RC[-1]+R[-1]C+R[-1]C[-1] -> 1.52659995698608E+41 | FZ36: =FIB(RC[-101])+RC[-1]+R[-1]C+R[-1]C[-1] -> 2.3237484713813E+41 | GA36: =FIB(RC[-101])+RC[-1]+R[-1]C+R[-1]C[-1] -> 3.5200089998042E+41 | GB36: =FIB(RC[-101])+RC[-1]+R[-1]C+R[-1]C[-1] -> 5.30684353782368E+41 | GC36: =FIB(RC[-101])+RC[-1]+R[-1]C+R[-1]C[-1] -> 7.9636504543956E+41 | GD36: =FIB(RC[-101])+RC[-1]+R[-1]C+R[-1]C[-1] -> 1.18964004639915E+42 | GE36: =FIB(RC[-101])+RC[-1]+R[-1]C+R[-1]C[-1] -> 1.76924967624072E+42 | GF36: =FIB(RC[-101])+RC[-1]+R[-1]C+R[-1]C[-1] -> 2.61983644831515E+42 | GG36: =FIB(RC[-101])+RC[-1]+R[-1]C+R[-1]C[-1] -> 3.86287624617407E+42 | GH36: =FIB(RC[-101])+RC[-1]+R[-1]C+R[-1]C[-1] -> 5.67202045988868E+42 | GI36: =FIB(RC[-101])+RC[-1]+R[-1]C+R[-1]C[-1] -> 8.29454931735099E+42 | GJ36: =FIB(RC[-101])+RC[-1]+R[-1]C+R[-1]C[-1] -> 1.20812620101308E+43 | GK36: =FIB(RC[-101])+RC[-1]+R[-1]C+R[-1]C[-1] -> 1.75279738108503E+43 | GL36: =FIB(RC[-101])+RC[-1]+R[-1]C+R[-1]C[-1] -> 2.53329273709936E+43 | GM36: =FIB(RC[-101])+RC[-1]+R[-1]C+R[-1]C[-1] -> 3.64759511462725E+43 | GN36: =FIB(RC[-101])+RC[-1]+R[-1]C+R[-1]C[-1] -> 5.23272389921973E+43 | GO36: =FIB(RC[-101])+RC[-1]+R[-1]C+R[-1]C[-1] -> 7.47963471598115E+43 | GP36: =FIB(RC[-101])+RC[-1]+R[-1]C+R[-1]C[-1] -> 1.06535624655645E+44 | GQ36: =FIB(RC[-101])+RC[-1]+R[-1]C+R[-1]C[-1] -> 1.51217092092372E+44 | GR36: =FIB(RC[-101])+RC[-1]+R[-1]C+R[-1]C[-1] -> 2.13908128836481E+44 | GS36: =FIB(RC[-101])+RC[-1]+R[-1]C+R[-1]C[-1] -> 3.0157969264535E+44
A37: 20 | B37: 20 | C37: 20 | D37: 20 | E37: 20 | F37: 20 | G37: 20 | H37: 20 | I37: 20 | J37: 20 | K37: 20 | L37: 20 | M37: 20 | N37: 20 | O37: 20 | P37: 20 | Q37: 20 | R37: 20 | S37: 20 | T37: 20 | U37: 20 | V37: 20 | W37: 20 | X37: 20 | Y37: 20 | Z37: 20 | AA37: 20 | AB37: 20 | AC37: 20 | AD37: 20 | AE37: 20 | AF37: 20 | AG37: 20 | AH37: 20 | AI37: 20 | AJ37: 20 | AK37: 20 | AL37: 20 | AM37: 20 | AN37: 20 | AO37: 20 | AP37: 20 | AQ37: 20 | AR37: 20 | AS37: 20 | AT37: 20 | AU37: 20 | AV37: 20 | AW37: 20 | AX37: 20 | AY37: 20 | AZ37: 20 | BA37: 20 | BB37: 20 | BC37: 20 | BD37: 20 | BE37: 20 | BF37: 20 | BG37: 20 | BH37: 20 | BI37: 20 | BJ37: 20 | BK37: 20 | BL37: 20 | BM37: 20 | BN37: 20 | BO37: 20 | BP37: 20 | BQ37: 20 | BR37: 20 | BS37: 20 | BT37: 20 | BU37: 20 | BV37: 20 | BW37: 20 | BX37: 20 | BY37: 20 | BZ37: 20 | CA37: 20 | CB37: 20 | CC37: 20 | CD37: 20 | CE37: 20 | CF37: 20 | CG37: 20 | CH37: 20 | CI37: 20 | CJ37: 20 | CK37: 20 | CL37: 20 | CM37: 20 | CN37: 20 | CO37: 20 | CP37: 20 | CQ37: 20 | CR37: 20 | CS37: 20 | CT37: 20 | CU37: 20 | CV37: 20 | CW37: 0 | CX37: =FIB(RC[-101])+RC[-1]+R[-1]C+R[-1]C[-1] -> 394056 | CY37: =FIB(RC[-101])+RC[-1]+R[-1]C+R[-1]C[-1] -> 14580072 | CZ37: =FIB(RC[-101])+RC[-1]+R[-1]C+R[-1]C[-1] -> 355175808 | DA37: =FIB(RC[-101])+RC[-1]+R[-1]C+R[-1]C[-1] -> 6492992064 | DB37: =FIB(RC[-101])+RC[-1]+R[-1]C+R[-1]C[-1] -> 95081903592 | DC37: =FIB(RC[-101])+RC[-1]+R[-1]C+R[-1]C[-1] -> 1162240719432 | DD37: =FIB(RC[-101])+RC[-1]+R[-1]C+R[-1]C[-1] -> 12202009190592 | DE37: =FIB(RC[-101])+RC[-1]+R[-1]C+R[-1]C[-1] -> 112360294542912 | DF37: =FIB(RC[-101])+RC[-1]+R[-1]C+R[-1]C[-1] -> 922213063950152 | DG37: =FIB(RC[-101])+RC[-1]+R[-1]C+R[-1]C[-1] -> 6.83327963196414E+15 | DH37: =FIB(RC[-101])+RC[-1]+R[-1]C+R[-1]C[-1] -> 4.61865039793889E+16 | DI37: =FIB(RC[-101])+RC[-1]+R[-1]C+R[-1]C[-1] -> 2.87231738870616E+17 | DJ37: =FIB(RC[-101])+RC[-1]+R[-1]C+R[-1]C[-1] -> 1.65555038348523E+18 | DK37: =FIB(RC[-101])+RC[-1]+R[-1]C+R[-1]C[-1] -> 8.89922789998144E+18 | DL37: =FIB(RC[-101])+RC[-1]+R[-1]C+R[-1]C[-1] -> 4.48547561378293E+19 | DM37: =FIB(RC[-101])+RC[-1]+R[-1]C+R[-1]C[-1] -> 2.12992851035079E+20 | DN37: =FIB(RC[-101])+RC[-1]+R[-1]C+R[-1]C[-1] -> 9.56832601398001E+20 | DO37: =FIB(RC[-101])+RC[-1]+R[-1]C+R[-1]C[-1] -> 4.0816476872028E+21 | DP37: =FIB(RC[-101])+RC[-1]+R[-1]C+R[-1]C[-1] -> 1.65885930521562E+22 | DQ37: =FIB(RC[-101])+RC[-1]+R[-1]C+R[-1]C[-1] -> 6.44259299432129E+22 | DR37: =FIB(RC[-101])+RC[-1]+R[-1]C+R[-1]C[-1] -> 2.39755464137984E+23 | DS37: =FIB(RC[-101])+RC[-1]+R[-1]C+R[-1]C[-1] -> 8.5704970049456E+23 | DT37: =FIB(RC[-101])+RC[-1]+R[-1]C+R[-1]C[-1] -> 2.94953253683211E+24 | DU37: =FIB(RC[-101])+RC[-1]+R[-1]C+R[-1]C[-1] -> 9.79283409583828E+24 | DV37: =FIB(RC[-101])+RC[-1]+R[-1]C+R[-1]C[-1] -> 3.14266267952066E+25 | DW37: =FIB(RC[-101])+RC[-1]+R[-1]C+R[-1]C[-1] -> 9.76524849402323E+25 | DX37: =FIB(RC[-101])+RC[-1]+R[-1]C+R[-1]C[-1] -> 2.9428606286342E+26 | DY37: =FIB(RC[-101])+RC[-1]+R[-1]C+R[-1]C[-1] -> 8.61410702943425E+26 | DZ37: =FIB(RC[-101])+RC[-1]+R[-1]C+R[-1]C[-1] -> 2.45251693362227E+27 | EA37: =FIB(RC[-101])+RC[-1]+R[-1]C+R[-1]C[-1] -> 6.80048821799283E+27 | EB37: =FIB(RC[-101])+RC[-1]+R[-1]C+R[-1]C[-1] -> 1.83874563845853E+28 | EC37: =FIB(RC[-101])+RC[-1]+R[-1]C+R[-1]C[-1] -> 4.85343578385158E+28 | ED37: =FIB(RC[-101])+RC[-1]+R[-1]C+R[-1]C[-1] -> 1.2519414322783E+29 | EE37: =FIB(RC[-101])+RC[-1]+R[-1]C+R[-1]C[-1] -> 3.15906066597135E+29 | EF37: =FIB(RC[-101])+RC[-1]+R[-1]C+R[-1]C[-1] -> 7.80506963752488E+29 | EG37: =FIB(RC[-101])+RC[-1]+R[-1]C+R[-1]C[-1] -> 1.88982557457865E+30 | EH37: =FIB(RC[-101])+RC[-1]+R[-1]C+R[-1]C[-1] -> 4.48798696322516E+30 | EI37: =FIB(RC[-101])+RC[-1]+R[-1]C+R[-1]C[-1] -> 1.04617524888118E+31 | EJ37: =FIB(RC[-101])+RC[-1]+R[-1]C+R[-1]C[-1] -> 2.39551650329696E+31 | EK37: =FIB(RC[-101])+RC[-1]+R[-1]C+R[-1]C[-1] -> 5.3918384861761E+31 | EL37: =FIB(RC[-101])+RC[-1]+R[-1]C+R[-1]C[-1] -> 1.19371919420179E+32 | EM37: =FIB(RC[-101])+RC[-1]+R[-1]C+R[-1]C[-1] -> 2.60114378500125E+32 | EN37: =FIB(RC[-101])+RC[-1]+R[-1]C+R[-1]C[-1] -> 5.58185354561783E+32 | EO37: =FIB(RC[-101])+RC[-1]+R[-1]C+R[-1]C[-1] -> 1.18028293542081E+33 | EP37: =FIB(RC[-101])+RC[-1]+R[-1]C+R[-1]C[-1] -> 2.46046244192083E+33 | EQ37: =FIB(RC[-101])+RC[-1]+R[-1]C+R[-1]C[-1] -> 5.05927152943819E+33 | ER37: =FIB(RC[-101])+RC[-1]+R[-1]C+R[-1]C[-1] -> 1.02661296590925E+34 | ES37: =FIB(RC[-101])+RC[-1]+R[-1]C+R[-1]C[-1] -> 2.05669422291114E+34 | ET37: =FIB(RC[-101])+RC[-1]+R[-1]C+R[-1]C[-1] -> 4.06971633951341E+34 | EU37: =FIB(RC[-101])+RC[-1]+R[-1]C+R[-1]C[-1] -> 7.95734619414249E+34 | EV37: =FIB(RC[-101])+RC[-1]+R[-1]C+R[-1]C[-1] -> 1.53798448852563E+35 | EW37: =FIB(RC[-101])+RC[-1]+R[-1]C+R[-1]C[-1] -> 2.93952563947111E+35 | EX37: =FIB(RC[-101])+RC[-1]+R[-1]C+R[-1]C[-1] -> 5.55774651103253E+35 | EY37: =FIB(RC[-101])+RC[-1]+R[-1]C+R[-1]C[-1] -> 1.03983398925434E+36 | EZ37: =FIB(RC[-101])+RC[-1]+R[-1]C+R[-1]C[-1] -> 1.92581295227532E+36 | FA37: =FIB(RC[-101])+RC[-1]+R[-1]C+R[-1]C[-1] -> 3.53170026651941E+36 | FB37: =FIB(RC[-101])+RC[-1]+R[-1]C+R[-1]C[-1] -> 6.41508148742692E+36 | FC37: =FIB(RC[-101])+RC[-1]+R[-1]C+R[-1]C[-1] -> 1.15449631685133E+37 | FD37: =FIB(RC[-101])+RC[-1]+R[-1]C+R[-1]C[-1] -> 2.0590797246987E+37 | FE37: =FIB(RC[-101])+RC[-1]+R[-1]C+R[-1]C[-1] -> 3.64046837662056E+37 | FF37: =FIB(RC[-101])+RC[-1]+R[-1]C+R[-1]C[-1] -> 6.38195040942988E+37 | FG37: =FIB(RC[-101])+RC[-1]+R[-1]C+R[-1]C[-1] -> 1.10959830784231E+38 | FH37: =FIB(RC[-101])+RC[-1]+R[-1]C+R[-1]C[-1] -> 1.91378998430086E+38 | FI37: =FIB(RC[-101])+RC[-1]+R[-1]C+R[-1]C[-1] -> 3.27517753512545E+38 | FJ37: =FIB(RC[-101])+RC[-1]+R[-1]C+R[-1]C[-1] -> 5.56262337014481E+38 | FK37: =FIB(RC[-101])+RC[-1]+R[-1]C+R[-1]C[-1] -> 9.37815220914736E+38 | FL37: =FIB(RC[-101])+RC[-1]+R[-1]C+R[-1]C[-1] -> 1.56975858760793E+39 | FM37: =FIB(RC[-101])+RC[-1]+R[-1]C+R[-1]C[-1] -> 2.60920583377451E+39 | FN37: =FIB(RC[-101])+RC[-1]+R[-1]C+R[-1]C[-1] -> 4.30747260612867E+39 | FO37: =FIB(RC[-101])+RC[-1]+R[-1]C+R[-1]C[-1] -> 7.06401003968334E+39 | FP37: =FIB(RC[-101])+RC[-1]+R[-1]C+R[-1]C[-1] -> 1.15098002158576E+40 | FQ37: =FIB(RC[-101])+RC[-1]+R[-1]C+R[-1]C[-1] -> 1.86355573413212E+40 | FR37: =FIB(RC[-101])+RC[-1]+R[-1]C+R[-1]C[-1] -> 2.99876890610711E+40 | FS37: =FIB(RC[-101])+RC[-1]+R[-1]C+R[-1]C[-1] -> 4.79661755050627E+40 | FT37: =FIB(RC[-101])+RC[-1]+R[-1]C+R[-1]C[-1] -> 7.62749306985178E+40 | FU37: =FIB(RC[-101])+RC[-1]+R[-1]C+R[-1]C[-1] -> 1.20599119787783E+41 | FV37: =FIB(RC[-101])+RC[-1]+R[-1]C+R[-1]C[-1] -> 1.8961857763111E+41 | FW37: =FIB(RC[-101])+RC[-1]+R[-1]C+R[-1]C[-1] -> 2.96516517829876E+41 | FX37: =FIB(RC[-101])+RC[-1]+R[-1]C+R[-1]C[-1] -> 4.61214618440602E+41 | FY37: =FIB(RC[-101])+RC[-1]+R[-1]C+R[-1]C[-1] -> 7.13668400684053E+41 | FZ37: =FIB(RC[-101])+RC[-1]+R[-1]C+R[-1]C[-1] -> 1.09870324352079E+42 | GA37: =FIB(RC[-101])+RC[-1]+R[-1]C+R[-1]C[-1] -> 1.68307899063934E+42 | GB37: =FIB(RC[-101])+RC[-1]+R[-1]C+R[-1]C[-1] -> 2.56576424440213E+42 | GC37: =FIB(RC[-101])+RC[-1]+R[-1]C+R[-1]C[-1] -> 3.89281364362406E+42 | GD37: =FIB(RC[-101])+RC[-1]+R[-1]C+R[-1]C[-1] -> 5.87881873546276E+42 | GE37: =FIB(RC[-101])+RC[-1]+R[-1]C+R[-1]C[-1] -> 8.83770845810264E+42 | GF37: =FIB(RC[-101])+RC[-1]+R[-1]C+R[-1]C[-1] -> 1.32267945826585E+43 | GG37: =FIB(RC[-101])+RC[-1]+R[-1]C+R[-1]C[-1] -> 1.97095072771477E+43 | GH37: =FIB(RC[-101])+RC[-1]+R[-1]C+R[-1]C[-1] -> 2.92444039832105E+43 | GI37: =FIB(RC[-101])+RC[-1]+R[-1]C+R[-1]C[-1] -> 4.32109737604502E+43 | GJ37: =FIB(RC[-101])+RC[-1]+R[-1]C+R[-1]C[-1] -> 6.35867850879319E+43 | GK37: =FIB(RC[-101])+RC[-1]+R[-1]C+R[-1]C[-1] -> 9.3196020908913E+43 | GL37: =FIB(RC[-101])+RC[-1]+R[-1]C+R[-1]C[-1] -> 1.36056922090757E+44 | GM37: =FIB(RC[-101])+RC[-1]+R[-1]C+R[-1]C[-1] -> 1.97865800608023E+44 | GN37: =FIB(RC[-101])+RC[-1]+R[-1]C+R[-1]C[-1] -> 2.86668990746493E+44 | GO37: =FIB(RC[-101])+RC[-1]+R[-1]C+R[-1]C[-1] -> 4.13792576898502E+44 | GP37: =FIB(RC[-101])+RC[-1]+R[-1]C+R[-1]C[-1] -> 5.95124548713958E+44 | GQ37: =FIB(RC[-101])+RC[-1]+R[-1]C+R[-1]C[-1] -> 8.52877265461975E+44 | GR37: =FIB(RC[-101])+RC[-1]+R[-1]C+R[-1]C[-1] -> 1.21800248639083E+45 | GS37: =FIB(RC[-101])+RC[-1]+R[-1]C+R[-1]C[-1] -> 1.73349030787266E+45
A38: 20 | B38: 20 | C38: 20 | D38: 20 | E38: 20 | F38: 20 | G38: 20 | H38: 20 | I38: 20 | J38: 20 | K38: 20 | L38: 20 | M38: 20 | N38: 20 | O38: 20 | P38: 20 | Q38: 20 | R38: 20 | S38: 20 | T38: 20 | U38: 20 | V38: 20 | W38: 20 | X38: 20 | Y38: 20 | Z38: 20 | AA38: 20 | AB38: 20 | AC38: 20 | AD38: 20 | AE38: 20 | AF38: 20 | AG38: 20 | AH38: 20 | AI38: 20 | AJ38: 20 | AK38: 20 | AL38: 20 | AM38: 20 | AN38: 20 | AO38: 20 | AP38: 20 | AQ38: 20 | AR38: 20 | AS38: 20 | AT38: 20 | AU38: 20 | AV38: 20 | AW38: 20 | AX38: 20 | AY38: 20 | AZ38: 20 | BA38: 20 | BB38: 20 | BC38: 20 | BD38: 20 | BE38: 20 | BF38: 20 | BG38: 20 | BH38: 20 | BI38: 20 | BJ38: 20 | BK38: 20 | BL38: 20 | BM38: 20 | BN38: 20 | BO38: 20 | BP38: 20 | BQ38: 20 | BR38: 20 | BS38: 20 | BT38: 20 | BU38: 20 | BV38: 20 | BW38: 20 | BX38: 20 | BY38: 20 | BZ38: 20 | CA38: 20 | CB38: 20 | CC38: 20 | CD38: 20 | CE38: 20 | CF38: 20 | CG38: 20 | CH38: 20 | CI38: 20 | CJ38: 20 | CK38: 20 | CL38: 20 | CM38: 20 | CN38: 20 | CO38: 20 | CP38: 20 | CQ38: 20 | CR38: 20 | CS38: 20 | CT38: 20 | CU38: 20 | CV38: 20 | CW38: 0 | CX38: =FIB(RC[-101])+RC[-1]+R[-1]C+R[-1]C[-1] -> 405002 | CY38: =FIB(RC[-101])+RC[-1]+R[-1]C+R[-1]C[-1] -> 15390076 | CZ38: =FIB(RC[-101])+RC[-1]+R[-1]C+R[-1]C[-1] -> 385156902 | DA38: =FIB(RC[-101])+RC[-1]+R[-1]C+R[-1]C[-1] -> 7233335720 | DB38: =FIB(RC[-101])+RC[-1]+R[-1]C+R[-1]C[-1] -> 108808242322 | DC38: =FIB(RC[-101])+RC[-1]+R[-1]C+R[-1]C[-1] -> 1366130876292 | DD38: =FIB(RC[-101])+RC[-1]+R[-1]C+R[-1]C[-1] -> 14730380797262 | DE38: =FIB(RC[-101])+RC[-1]+R[-1]C+R[-1]C[-1] -> 139292684541712 | DF38: =FIB(RC[-101])+RC[-1]+R[-1]C+R[-1]C[-1] -> 1.17386604304572E+15 | DG38: =FIB(RC[-101])+RC[-1]+R[-1]C+R[-1]C[-1] -> 8.92935873897096E+15 | DH38: =FIB(RC[-101])+RC[-1]+R[-1]C+R[-1]C[-1] -> 6.19491423503349E+16 | DI38: =FIB(RC[-101])+RC[-1]+R[-1]C+R[-1]C[-1] -> 3.9536738520035E+17 | DJ38: =FIB(RC[-101])+RC[-1]+R[-1]C+R[-1]C[-1] -> 2.33814950755621E+18 | DK38: =FIB(RC[-101])+RC[-1]+R[-1]C+R[-1]C[-1] -> 1.28929277910229E+19 | DL38: =FIB(RC[-101])+RC[-1]+R[-1]C+R[-1]C[-1] -> 6.66469118288336E+19 | DM38: =FIB(RC[-101])+RC[-1]+R[-1]C+R[-1]C[-1] -> 3.24494519001742E+20 | DN38: =FIB(RC[-101])+RC[-1]+R[-1]C+R[-1]C[-1] -> 1.49431997143482E+21 | DO38: =FIB(RC[-101])+RC[-1]+R[-1]C+R[-1]C[-1] -> 6.53280026003562E+21 | DP38: =FIB(RC[-101])+RC[-1]+R[-1]C+R[-1]C[-1] -> 2.72030409993946E+22 | DQ38: =FIB(RC[-101])+RC[-1]+R[-1]C+R[-1]C[-1] -> 1.08217563994764E+23 | DR38: =FIB(RC[-101])+RC[-1]+R[-1]C+R[-1]C[-1] -> 4.12398958075961E+23 | DS38: =FIB(RC[-101])+RC[-1]+R[-1]C+R[-1]C[-1] -> 1.5092041227085E+24 | DT38: =FIB(RC[-101])+RC[-1]+R[-1]C+R[-1]C[-1] -> 5.31578636003517E+24 | DU38: =FIB(RC[-101])+RC[-1]+R[-1]C+R[-1]C[-1] -> 1.80581529927056E+25 | DV38: =FIB(RC[-101])+RC[-1]+R[-1]C+R[-1]C[-1] -> 5.92776138837505E+25 | DW38: =FIB(RC[-101])+RC[-1]+R[-1]C+R[-1]C[-1] -> 1.88356725619189E+26 | DX38: =FIB(RC[-101])+RC[-1]+R[-1]C+R[-1]C[-1] -> 5.80295273422841E+26 | DY38: =FIB(RC[-101])+RC[-1]+R[-1]C+R[-1]C[-1] -> 1.73599203922969E+27 | DZ38: =FIB(RC[-101])+RC[-1]+R[-1]C+R[-1]C[-1] -> 5.04991967579538E+27 | EA38: =FIB(RC[-101])+RC[-1]+R[-1]C+R[-1]C[-1] -> 1.43029248274105E+28 | EB38: =FIB(RC[-101])+RC[-1]+R[-1]C+R[-1]C[-1] -> 3.94908694299886E+28 | EC38: =FIB(RC[-101])+RC[-1]+R[-1]C+R[-1]C[-1] -> 1.0641268365309E+29 | ED38: =FIB(RC[-101])+RC[-1]+R[-1]C+R[-1]C[-1] -> 2.80141184719435E+29 | EE38: =FIB(RC[-101])+RC[-1]+R[-1]C+R[-1]C[-1] -> 7.212413945444E+29 | EF38: =FIB(RC[-101])+RC[-1]+R[-1]C+R[-1]C[-1] -> 1.81765442489402E+30 | EG38: =FIB(RC[-101])+RC[-1]+R[-1]C+R[-1]C[-1] -> 4.48798696322516E+30 | EH38: =FIB(RC[-101])+RC[-1]+R[-1]C+R[-1]C[-1] -> 1.0865799501029E+31 | EI38: =FIB(RC[-101])+RC[-1]+R[-1]C+R[-1]C[-1] -> 2.58155389530659E+31 | EJ38: =FIB(RC[-101])+RC[-1]+R[-1]C+R[-1]C[-1] -> 6.02324564748472E+31 | EK38: =FIB(RC[-101])+RC[-1]+R[-1]C+R[-1]C[-1] -> 1.38106006369578E+32 | EL38: =FIB(RC[-101])+RC[-1]+R[-1]C+R[-1]C[-1] -> 3.11396310651518E+32 | EM38: =FIB(RC[-101])+RC[-1]+R[-1]C+R[-1]C[-1] -> 6.90882608571822E+32 | EN38: =FIB(RC[-101])+RC[-1]+R[-1]C+R[-1]C[-1] -> 1.50918234163373E+33 | EO38: =FIB(RC[-101])+RC[-1]+R[-1]C+R[-1]C[-1] -> 3.24765063161632E+33 | EP38: =FIB(RC[-101])+RC[-1]+R[-1]C+R[-1]C[-1] -> 6.88839600895796E+33 | EQ38: =FIB(RC[-101])+RC[-1]+R[-1]C+R[-1]C[-1] -> 1.4408129980317E+34 | ER38: =FIB(RC[-101])+RC[-1]+R[-1]C+R[-1]C[-1] -> 2.97335311688476E+34 | ES38: =FIB(RC[-101])+RC[-1]+R[-1]C+R[-1]C[-1] -> 6.05666030570515E+34 | ET38: =FIB(RC[-101])+RC[-1]+R[-1]C+R[-1]C[-1] -> 1.21830708681297E+35 | EU38: =FIB(RC[-101])+RC[-1]+R[-1]C+R[-1]C[-1] -> 2.42101334017856E+35 | EV38: =FIB(RC[-101])+RC[-1]+R[-1]C+R[-1]C[-1] -> 4.75473244811844E+35 | EW38: =FIB(RC[-101])+RC[-1]+R[-1]C+R[-1]C[-1] -> 9.23224257611518E+35 | EX38: =FIB(RC[-101])+RC[-1]+R[-1]C+R[-1]C[-1] -> 1.77295147266188E+36 | EY38: =FIB(RC[-101])+RC[-1]+R[-1]C+R[-1]C[-1] -> 3.36856011301947E+36 | EZ38: =FIB(RC[-101])+RC[-1]+R[-1]C+R[-1]C[-1] -> 6.33420705454913E+36 | FA38: =FIB(RC[-101])+RC[-1]+R[-1]C+R[-1]C[-1] -> 1.17917202733439E+37 | FB38: =FIB(RC[-101])+RC[-1]+R[-1]C+R[-1]C[-1] -> 2.17385020272902E+37 | FC38: =FIB(RC[-101])+RC[-1]+R[-1]C+R[-1]C[-1] -> 3.96985466832304E+37 | FD38: =FIB(RC[-101])+RC[-1]+R[-1]C+R[-1]C[-1] -> 7.18343070987307E+37 | FE38: =FIB(RC[-101])+RC[-1]+R[-1]C+R[-1]C[-1] -> 1.28829788111923E+38 | FF38: =FIB(RC[-101])+RC[-1]+R[-1]C+R[-1]C[-1] -> 2.29053975972428E+38 | FG38: =FIB(RC[-101])+RC[-1]+R[-1]C+R[-1]C[-1] -> 4.03833310850958E+38 | FH38: =FIB(RC[-101])+RC[-1]+R[-1]C+R[-1]C[-1] -> 7.06172140065275E+38 | FI38: =FIB(RC[-101])+RC[-1]+R[-1]C+R[-1]C[-1] -> 1.22506889200791E+39 | FJ38: =FIB(RC[-101])+RC[-1]+R[-1]C+R[-1]C[-1] -> 2.10884898253493E+39 | FK38: =FIB(RC[-101])+RC[-1]+R[-1]C+R[-1]C[-1] -> 3.60292654046415E+39 | FL38: =FIB(RC[-101])+RC[-1]+R[-1]C+R[-1]C[-1] -> 6.11050034898682E+39 | FM38: =FIB(RC[-101])+RC[-1]+R[-1]C+R[-1]C[-1] -> 1.02894647703693E+40 | FN38: =FIB(RC[-101])+RC[-1]+R[-1]C+R[-1]C[-1] -> 1.72061432102724E+40 | FO38: =FIB(RC[-101])+RC[-1]+R[-1]C+R[-1]C[-1] -> 2.85776258560844E+40 | FP38: =FIB(RC[-101])+RC[-1]+R[-1]C+R[-1]C[-1] -> 4.71514361116254E+40 | FQ38: =FIB(RC[-101])+RC[-1]+R[-1]C+R[-1]C[-1] -> 7.72967936688042E+40 | FR38: =FIB(RC[-101])+RC[-1]+R[-1]C+R[-1]C[-1] -> 1.25920040071196E+41 | FS38: =FIB(RC[-101])+RC[-1]+R[-1]C+R[-1]C[-1] -> 2.0387390463733E+41 | FT38: =FIB(RC[-101])+RC[-1]+R[-1]C+R[-1]C[-1] -> 3.28115010840911E+41 | FU38: =FIB(RC[-101])+RC[-1]+R[-1]C+R[-1]C[-1] -> 5.24989061327211E+41 | FV38: =FIB(RC[-101])+RC[-1]+R[-1]C+R[-1]C[-1] -> 8.35206758746105E+41 | FW38: =FIB(RC[-101])+RC[-1]+R[-1]C+R[-1]C[-1] -> 1.32134185420709E+42 | FX38: =FIB(RC[-101])+RC[-1]+R[-1]C+R[-1]C[-1] -> 2.07907299047757E+42 | FY38: =FIB(RC[-101])+RC[-1]+R[-1]C+R[-1]C[-1] -> 3.25395600960223E+42 | FZ38: =FIB(RC[-101])+RC[-1]+R[-1]C+R[-1]C[-1] -> 5.06632765380707E+42 | GA38: =FIB(RC[-101])+RC[-1]+R[-1]C+R[-1]C[-1] -> 7.8481098879672E+42 | GB38: =FIB(RC[-101])+RC[-1]+R[-1]C+R[-1]C[-1] -> 1.20969531230087E+43 | GC38: =FIB(RC[-101])+RC[-1]+R[-1]C+R[-1]C[-1] -> 1.85555310110349E+43 | GD38: =FIB(RC[-101])+RC[-1]+R[-1]C+R[-1]C[-1] -> 2.83271633901217E+43 | GE38: =FIB(RC[-101])+RC[-1]+R[-1]C+R[-1]C[-1] -> 4.30436905836871E+43 | GF38: =FIB(RC[-101])+RC[-1]+R[-1]C+R[-1]C[-1] -> 6.51081936244482E+43 | GG38: =FIB(RC[-101])+RC[-1]+R[-1]C+R[-1]C[-1] -> 9.80444954842545E+43 | GH38: =FIB(RC[-101])+RC[-1]+R[-1]C+R[-1]C[-1] -> 1.46998406744613E+44 | GI38: =FIB(RC[-101])+RC[-1]+R[-1]C+R[-1]C[-1] -> 2.19453784488273E+44 | GJ38: =FIB(RC[-101])+RC[-1]+R[-1]C+R[-1]C[-1] -> 3.26251543336655E+44 | GK38: =FIB(RC[-101])+RC[-1]+R[-1]C+R[-1]C[-1] -> 4.830343493335E+44 | GL38: =FIB(RC[-101])+RC[-1]+R[-1]C+R[-1]C[-1] -> 7.1228729233317E+44 | GM38: =FIB(RC[-101])+RC[-1]+R[-1]C+R[-1]C[-1] -> 1.04621001503195E+45 | GN38: =FIB(RC[-101])+RC[-1]+R[-1]C+R[-1]C[-1] -> 1.53074480638647E+45 | GO38: =FIB(RC[-101])+RC[-1]+R[-1]C+R[-1]C[-1] -> 2.23120637403146E+45 | GP38: =FIB(RC[-101])+RC[-1]+R[-1]C+R[-1]C[-1] -> 3.24012349964392E+45 | GQ38: =FIB(RC[-101])+RC[-1]+R[-1]C+R[-1]C[-1] -> 4.68812531381985E+45 | GR38: =FIB(RC[-101])+RC[-1]+R[-1]C+R[-1]C[-1] -> 6.75900506567266E+45 | GS38: =FIB(RC[-101])+RC[-1]+R[-1]C+R[-1]C[-1] -> 9.71049785993615E+45
A39: 20 | B39: 20 | C39: 20 | D39: 20 | E39: 20 | F39: 20 | G39: 20 | H39: 20 | I39: 20 | J39: 20 | K39: 20 | L39: 20 | M39: 20 | N39: 20 | O39: 20 | P39: 20 | Q39: 20 | R39: 20 | S39: 20 | T39: 20 | U39: 20 | V39: 20 | W39: 20 | X39: 20 | Y39: 20 | Z39: 20 | AA39: 20 | AB39: 20 | AC39: 20 | AD39: 20 | AE39: 20 | AF39: 20 | AG39: 20 | AH39: 20 | AI39: 20 | AJ39: 20 | AK39: 20 | AL39: 20 | AM39: 20 | AN39: 20 | AO39: 20 | AP39: 20 | AQ39: 20 | AR39: 20 | AS39: 20 | AT39: 20 | AU39: 20 | AV39: 20 | AW39: 20 | AX39: 20 | AY39: 20 | AZ39: 20 | BA39: 20 | BB39: 20 | BC39: 20 | BD39: 20 | BE39: 20 | BF39: 20 | BG39: 20 | BH39: 20 | BI39: 20 | BJ39: 20 | BK39: 20 | BL39: 20 | BM39: 20 | BN39: 20 | BO39: 20 | BP39: 20 | BQ39: 20 | BR39: 20 | BS39: 20 | BT39: 20 | BU39: 20 | BV39: 20 | BW39: 20 | BX39: 20 | BY39: 20 | BZ39: 20 | CA39: 20 | CB39: 20 | CC39: 20 | CD39: 20 | CE39: 20 | CF39: 20 | CG39: 20 | CH39: 20 | CI39: 20 | CJ39: 20 | CK39: 20 | CL39: 20 | CM39: 20 | CN39: 20 | CO39: 20 | CP39: 20 | CQ39: 20 | CR39: 20 | CS39: 20 | CT39: 20 | CU39: 20 | CV39: 20 | CW39: 0 | CX39: =FIB(RC[-101])+RC[-1]+R[-1]C+R[-1]C[-1] -> 415948 | CY39: =FIB(RC[-101])+RC[-1]+R[-1]C+R[-1]C[-1] -> 16221972 | CZ39: =FIB(RC[-101])+RC[-1]+R[-1]C+R[-1]C[-1] -> 416779896 | DA39: =FIB(RC[-101])+RC[-1]+R[-1]C+R[-1]C[-1] -> 8035283464 | DB39: =FIB(RC[-101])+RC[-1]+R[-1]C+R[-1]C[-1] -> 124076872452 | DC39: =FIB(RC[-101])+RC[-1]+R[-1]C+R[-1]C[-1] -> 1599016002012 | DD39: =FIB(RC[-101])+RC[-1]+R[-1]C+R[-1]C[-1] -> 17695527686512 | DE39: =FIB(RC[-101])+RC[-1]+R[-1]C+R[-1]C[-1] -> 171718593036432 | DF39: =FIB(RC[-101])+RC[-1]+R[-1]C+R[-1]C[-1] -> 1.48487732063481E+15 | DG39: =FIB(RC[-101])+RC[-1]+R[-1]C+R[-1]C[-1] -> 1.15881021026624E+16 | DH39: =FIB(RC[-101])+RC[-1]+R[-1]C+R[-1]C[-1] -> 8.24666031919792E+16 | DI39: =FIB(RC[-101])+RC[-1]+R[-1]C+R[-1]C[-1] -> 5.39783130742675E+17 | DJ39: =FIB(RC[-101])+RC[-1]+R[-1]C+R[-1]C[-1] -> 3.27330002349924E+18 | DK39: =FIB(RC[-101])+RC[-1]+R[-1]C+R[-1]C[-1] -> 1.85043773220784E+19 | DL39: =FIB(RC[-101])+RC[-1]+R[-1]C+R[-1]C[-1] -> 9.80442169419349E+19 | DM39: =FIB(RC[-101])+RC[-1]+R[-1]C+R[-1]C[-1] -> 4.8918564777251E+20 | DN39: =FIB(RC[-101])+RC[-1]+R[-1]C+R[-1]C[-1] -> 2.30800013820907E+21 | DO39: =FIB(RC[-101])+RC[-1]+R[-1]C+R[-1]C[-1] -> 1.03351203696795E+22 | DP39: =FIB(RC[-101])+RC[-1]+R[-1]C+R[-1]C[-1] -> 4.40709616291098E+22 | DQ39: =FIB(RC[-101])+RC[-1]+R[-1]C+R[-1]C[-1] -> 1.79491566623268E+23 | DR39: =FIB(RC[-101])+RC[-1]+R[-1]C+R[-1]C[-1] -> 7.00108088693993E+23 | DS39: =FIB(RC[-101])+RC[-1]+R[-1]C+R[-1]C[-1] -> 2.62171116947846E+24 | DT39: =FIB(RC[-101])+RC[-1]+R[-1]C+R[-1]C[-1] -> 9.44670165222213E+24 | DU39: =FIB(RC[-101])+RC[-1]+R[-1]C+R[-1]C[-1] -> 3.28206410049629E+25 | DV39: =FIB(RC[-101])+RC[-1]+R[-1]C+R[-1]C[-1] -> 1.10156407881419E+26 | DW39: =FIB(RC[-101])+RC[-1]+R[-1]C+R[-1]C[-1] -> 3.57790747384359E+26 | DX39: =FIB(RC[-101])+RC[-1]+R[-1]C+R[-1]C[-1] -> 1.12644274642639E+27 | DY39: =FIB(RC[-101])+RC[-1]+R[-1]C+R[-1]C[-1] -> 3.44273005907892E+27 | DZ39: =FIB(RC[-101])+RC[-1]+R[-1]C+R[-1]C[-1] -> 1.0228641774104E+28 | EA39: =FIB(RC[-101])+RC[-1]+R[-1]C+R[-1]C[-1] -> 2.95814862773098E+28 | EB39: =FIB(RC[-101])+RC[-1]+R[-1]C+R[-1]C[-1] -> 8.33752805347089E+28 | EC39: =FIB(RC[-101])+RC[-1]+R[-1]C+R[-1]C[-1] -> 2.29278833617787E+29 | ED39: =FIB(RC[-101])+RC[-1]+R[-1]C+R[-1]C[-1] -> 6.15832701990312E+29 | EE39: =FIB(RC[-101])+RC[-1]+R[-1]C+R[-1]C[-1] -> 1.61721528125415E+30 | EF39: =FIB(RC[-101])+RC[-1]+R[-1]C+R[-1]C[-1] -> 4.15611110069257E+30 | EG39: =FIB(RC[-101])+RC[-1]+R[-1]C+R[-1]C[-1] -> 1.04617524888118E+31 | EH39: =FIB(RC[-101])+RC[-1]+R[-1]C+R[-1]C[-1] -> 2.58155389530659E+31 | EI39: =FIB(RC[-101])+RC[-1]+R[-1]C+R[-1]C[-1] -> 6.24968774071607E+31 | EJ39: =FIB(RC[-101])+RC[-1]+R[-1]C+R[-1]C[-1] -> 1.48544872835074E+32 | EK39: =FIB(RC[-101])+RC[-1]+R[-1]C+R[-1]C[-1] -> 3.46883335679499E+32 | EL39: =FIB(RC[-101])+RC[-1]+R[-1]C+R[-1]C[-1] -> 7.96385652700594E+32 | EM39: =FIB(RC[-101])+RC[-1]+R[-1]C+R[-1]C[-1] -> 1.79866457192393E+33 | EN39: =FIB(RC[-101])+RC[-1]+R[-1]C+R[-1]C[-1] -> 3.99872952212948E+33 | EO39: =FIB(RC[-101])+RC[-1]+R[-1]C+R[-1]C[-1] -> 8.75556249537953E+33 | EP39: =FIB(RC[-101])+RC[-1]+R[-1]C+R[-1]C[-1] -> 1.88916091359538E+34 | EQ39: =FIB(RC[-101])+RC[-1]+R[-1]C+R[-1]C[-1] -> 4.01881351252287E+34 | ER39: =FIB(RC[-101])+RC[-1]+R[-1]C+R[-1]C[-1] -> 8.43297962743934E+34 | ES39: =FIB(RC[-101])+RC[-1]+R[-1]C+R[-1]C[-1] -> 1.74629930500293E+35 | ET39: =FIB(RC[-101])+RC[-1]+R[-1]C+R[-1]C[-1] -> 3.57027242238641E+35 | EU39: =FIB(RC[-101])+RC[-1]+R[-1]C+R[-1]C[-1] -> 7.20959284937794E+35 | EV39: =FIB(RC[-101])+RC[-1]+R[-1]C+R[-1]C[-1] -> 1.43853386376749E+36 | EW39: =FIB(RC[-101])+RC[-1]+R[-1]C+R[-1]C[-1] -> 2.83723136619086E+36 | EX39: =FIB(RC[-101])+RC[-1]+R[-1]C+R[-1]C[-1] -> 5.53340709646425E+36 | EY39: =FIB(RC[-101])+RC[-1]+R[-1]C+R[-1]C[-1] -> 1.06749186821456E+37 | EZ39: =FIB(RC[-101])+RC[-1]+R[-1]C+R[-1]C[-1] -> 2.03776858497142E+37 | FA39: =FIB(RC[-101])+RC[-1]+R[-1]C+R[-1]C[-1] -> 3.85036131776072E+37 | FB39: =FIB(RC[-101])+RC[-1]+R[-1]C+R[-1]C[-1] -> 7.20338354782412E+37 | FC39: =FIB(RC[-101])+RC[-1]+R[-1]C+R[-1]C[-1] -> 1.33470884188762E+38 | FD39: =FIB(RC[-101])+RC[-1]+R[-1]C+R[-1]C[-1] -> 2.45003737970723E+38 | FE39: =FIB(RC[-101])+RC[-1]+R[-1]C+R[-1]C[-1] -> 4.45667833181377E+38 | FF39: =FIB(RC[-101])+RC[-1]+R[-1]C+R[-1]C[-1] -> 8.03551597265728E+38 | FG39: =FIB(RC[-101])+RC[-1]+R[-1]C+R[-1]C[-1] -> 1.43643888408911E+39 | FH39: =FIB(RC[-101])+RC[-1]+R[-1]C+R[-1]C[-1] -> 2.54644433500535E+39 | FI39: =FIB(RC[-101])+RC[-1]+R[-1]C+R[-1]C[-1] -> 4.47768536707853E+39 | FJ39: =FIB(RC[-101])+RC[-1]+R[-1]C+R[-1]C[-1] -> 7.81160324162137E+39 | FK39: =FIB(RC[-101])+RC[-1]+R[-1]C+R[-1]C[-1] -> 1.35233787646204E+40 | FL39: =FIB(RC[-101])+RC[-1]+R[-1]C+R[-1]C[-1] -> 2.32368056540714E+40 | FM39: =FIB(RC[-101])+RC[-1]+R[-1]C+R[-1]C[-1] -> 3.96367707734275E+40 | FN39: =FIB(RC[-101])+RC[-1]+R[-1]C+R[-1]C[-1] -> 6.71323787540692E+40 | FO39: =FIB(RC[-101])+RC[-1]+R[-1]C+R[-1]C[-1] -> 1.12916147820426E+41 | FP39: =FIB(RC[-101])+RC[-1]+R[-1]C+R[-1]C[-1] -> 1.88645209788136E+41 | FQ39: =FIB(RC[-101])+RC[-1]+R[-1]C+R[-1]C[-1] -> 3.13093439568565E+41 | FR39: =FIB(RC[-101])+RC[-1]+R[-1]C+R[-1]C[-1] -> 5.16310273308566E+41 | FS39: =FIB(RC[-101])+RC[-1]+R[-1]C+R[-1]C[-1] -> 8.46104218017093E+41 | FT39: =FIB(RC[-101])+RC[-1]+R[-1]C+R[-1]C[-1] -> 1.37809313349533E+42 | FU39: =FIB(RC[-101])+RC[-1]+R[-1]C+R[-1]C[-1] -> 2.23119720566346E+42 | FV39: =FIB(RC[-101])+RC[-1]+R[-1]C+R[-1]C[-1] -> 3.59139302573677E+42 | FW39: =FIB(RC[-101])+RC[-1]+R[-1]C+R[-1]C[-1] -> 5.74794163868997E+42 | FX39: =FIB(RC[-101])+RC[-1]+R[-1]C+R[-1]C[-1] -> 9.14835648337463E+42 | FY39: =FIB(RC[-101])+RC[-1]+R[-1]C+R[-1]C[-1] -> 1.44813854834544E+43 | FZ39: =FIB(RC[-101])+RC[-1]+R[-1]C+R[-1]C[-1] -> 2.28016691468637E+43 | GA39: =FIB(RC[-101])+RC[-1]+R[-1]C+R[-1]C[-1] -> 3.5716106688638E+43 | GB39: =FIB(RC[-101])+RC[-1]+R[-1]C+R[-1]C[-1] -> 5.56611696996139E+43 | GC39: =FIB(RC[-101])+RC[-1]+R[-1]C+R[-1]C[-1] -> 8.63136538336574E+43 | GD39: =FIB(RC[-101])+RC[-1]+R[-1]C+R[-1]C[-1] -> 1.33196348234814E+44 | GE39: =FIB(RC[-101])+RC[-1]+R[-1]C+R[-1]C[-1] -> 2.04567202208623E+44 | GF39: =FIB(RC[-101])+RC[-1]+R[-1]C+R[-1]C[-1] -> 3.12719086416758E+44 | GG39: =FIB(RC[-101])+RC[-1]+R[-1]C+R[-1]C[-1] -> 4.75871775525461E+44 | GH39: =FIB(RC[-101])+RC[-1]+R[-1]C+R[-1]C[-1] -> 7.20914677754328E+44 | GI39: =FIB(RC[-101])+RC[-1]+R[-1]C+R[-1]C[-1] -> 1.08736686898721E+45 | GJ39: =FIB(RC[-101])+RC[-1]+R[-1]C+R[-1]C[-1] -> 1.63307219681214E+45 | GK39: =FIB(RC[-101])+RC[-1]+R[-1]C+R[-1]C[-1] -> 2.4423580894823E+45 | GL39: =FIB(RC[-101])+RC[-1]+R[-1]C+R[-1]C[-1] -> 3.63767973114897E+45 | GM39: =FIB(RC[-101])+RC[-1]+R[-1]C+R[-1]C[-1] -> 5.39617703851409E+45 | GN39: =FIB(RC[-101])+RC[-1]+R[-1]C+R[-1]C[-1] -> 7.97313185993251E+45 | GO39: =FIB(RC[-101])+RC[-1]+R[-1]C+R[-1]C[-1] -> 1.17350830403504E+46 | GP39: =FIB(RC[-101])+RC[-1]+R[-1]C+R[-1]C[-1] -> 1.72064129140258E+46 | GQ39: =FIB(RC[-101])+RC[-1]+R[-1]C+R[-1]C[-1] -> 2.51346617274896E+46 | GR39: =FIB(RC[-101])+RC[-1]+R[-1]C+R[-1]C[-1] -> 3.65817921069821E+46 | GS39: =FIB(RC[-101])+RC[-1]+R[-1]C+R[-1]C[-1] -> 5.30512950325909E+46
A40: 20 | B40: 20 | C40: 20 | D40: 20 | E40: 20 | F40: 20 | G40: 20 | H40: 20 | I40: 20 | J40: 20 | K40: 20 | L40: 20 | M40: 20 | N40: 20 | O40: 20 | P40: 20 | Q40: 20 | R40: 20 | S40: 20 | T40: 20 | U40: 20 | V40: 20 | W40: 20 | X40: 20 | Y40: 20 | Z40: 20 | AA40: 20 | AB40: 20 | AC40: 20 | AD40: 20 | AE40: 20 | AF40: 20 | AG40: 20 | AH40: 20 | AI40: 20 | AJ40: 20 | AK40: 20 | AL40: 20 | AM40: 20 | AN40: 20 | AO40: 20 | AP40: 20 | AQ40: 20 | AR40: 20 | AS40: 20 | AT40: 20 | AU40: 20 | AV40: 20 | AW40: 20 | AX40: 20 | AY40: 20 | AZ40: 20 | BA40: 20 | BB40: 20 | BC40: 20 | BD40: 20 | BE40: 20 | BF40: 20 | BG40: 20 | BH40: 20 | BI40: 20 | BJ40: 20 | BK40: 20 | BL40: 20 | BM40: 20 | BN40: 20 | BO40: 20 | BP40: 20 | BQ40: 20 | BR40: 20 | BS40: 20 | BT40: 20 | BU40: 20 | BV40: 20 | BW40: 20 | BX40: 20 | BY40: 20 | BZ40: 20 | CA40: 20 | CB40: 20 | CC40: 20 | CD40: 20 | CE40: 20 | CF40: 20 | CG40: 20 | CH40: 20 | CI40: 20 | CJ40: 20 | CK40: 20 | CL40: 20 | CM40: 20 | CN40: 20 | CO40: 20 | CP40: 20 | CQ40: 20 | CR40: 20 | CS40: 20 | CT40: 20 | CU40: 20 | CV40: 20 | CW40: 0 | CX40: =FIB(RC[-101])+RC[-1]+R[-1]C+R[-1]C[-1] -> 426894 | CY40: =FIB(RC[-101])+RC[-1]+R[-1]C+R[-1]C[-1] -> 17075760 | CZ40: =FIB(RC[-101])+RC[-1]+R[-1]C+R[-1]C[-1] -> 450088574 | DA40: =FIB(RC[-101])+RC[-1]+R[-1]C+R[-1]C[-1] -> 8902162880 | DB40: =FIB(RC[-101])+RC[-1]+R[-1]C+R[-1]C[-1] -> 141014329742 | DC40: =FIB(RC[-101])+RC[-1]+R[-1]C+R[-1]C[-1] -> 1864107215152 | DD40: =FIB(RC[-101])+RC[-1]+R[-1]C+R[-1]C[-1] -> 21158650914622 | DE40: =FIB(RC[-101])+RC[-1]+R[-1]C+R[-1]C[-1] -> 210572771648512 | DF40: =FIB(RC[-101])+RC[-1]+R[-1]C+R[-1]C[-1] -> 1.8671686853307E+15 | DG40: =FIB(RC[-101])+RC[-1]+R[-1]C+R[-1]C[-1] -> 1.49401481086389E+16 | DH40: =FIB(RC[-101])+RC[-1]+R[-1]C+R[-1]C[-1] -> 1.08994853403292E+17 | DI40: =FIB(RC[-101])+RC[-1]+R[-1]C+R[-1]C[-1] -> 7.31244587337957E+17 | DJ40: =FIB(RC[-101])+RC[-1]+R[-1]C+R[-1]C[-1] -> 4.54432774157989E+18 | DK40: =FIB(RC[-101])+RC[-1]+R[-1]C+R[-1]C[-1] -> 2.63220050871575E+19 | DL40: =FIB(RC[-101])+RC[-1]+R[-1]C+R[-1]C[-1] -> 1.42870599351171E+20 | DM40: =FIB(RC[-101])+RC[-1]+R[-1]C+R[-1]C[-1] -> 7.30100464065616E+20 | DN40: =FIB(RC[-101])+RC[-1]+R[-1]C+R[-1]C[-1] -> 3.5272862500472E+21 | DO40: =FIB(RC[-101])+RC[-1]+R[-1]C+R[-1]C[-1] -> 1.61704067579358E+22 | DP40: =FIB(RC[-101])+RC[-1]+R[-1]C+R[-1]C[-1] -> 7.05764887567251E+22 | DQ40: =FIB(RC[-101])+RC[-1]+R[-1]C+R[-1]C[-1] -> 2.94139017009103E+23 | DR40: =FIB(RC[-101])+RC[-1]+R[-1]C+R[-1]C[-1] -> 1.17373867232636E+24 | DS40: =FIB(RC[-101])+RC[-1]+R[-1]C+R[-1]C[-1] -> 4.49555793049881E+24 | DT40: =FIB(RC[-101])+RC[-1]+R[-1]C+R[-1]C[-1] -> 1.65639707521994E+25 | DU40: =FIB(RC[-101])+RC[-1]+R[-1]C+R[-1]C[-1] -> 5.88313134093844E+25 | DV40: =FIB(RC[-101])+RC[-1]+R[-1]C+R[-1]C[-1] -> 2.01808362295766E+26 | DW40: =FIB(RC[-101])+RC[-1]+R[-1]C+R[-1]C[-1] -> 6.69755517561544E+26 | DX40: =FIB(RC[-101])+RC[-1]+R[-1]C+R[-1]C[-1] -> 2.15398901137229E+27 | DY40: =FIB(RC[-101])+RC[-1]+R[-1]C+R[-1]C[-1] -> 6.7231618168776E+27 | DZ40: =FIB(RC[-101])+RC[-1]+R[-1]C+R[-1]C[-1] -> 2.03945336500605E+28 | EA40: =FIB(RC[-101])+RC[-1]+R[-1]C+R[-1]C[-1] -> 6.02046617014743E+28 | EB40: =FIB(RC[-101])+RC[-1]+R[-1]C+R[-1]C[-1] -> 1.73161428513493E+29 | EC40: =FIB(RC[-101])+RC[-1]+R[-1]C+R[-1]C[-1] -> 4.85815542665989E+29 | ED40: =FIB(RC[-101])+RC[-1]+R[-1]C+R[-1]C[-1] -> 1.33092707827409E+30 | EE40: =FIB(RC[-101])+RC[-1]+R[-1]C+R[-1]C[-1] -> 3.56397506151855E+30 | EF40: =FIB(RC[-101])+RC[-1]+R[-1]C+R[-1]C[-1] -> 9.33730144346527E+30 | EG40: =FIB(RC[-101])+RC[-1]+R[-1]C+R[-1]C[-1] -> 2.39551650329696E+31 | EH40: =FIB(RC[-101])+RC[-1]+R[-1]C+R[-1]C[-1] -> 6.02324564748472E+31 | EI40: =FIB(RC[-101])+RC[-1]+R[-1]C+R[-1]C[-1] -> 1.48544872835074E+32 | EJ40: =FIB(RC[-101])+RC[-1]+R[-1]C+R[-1]C[-1] -> 3.59586623077308E+32 | EK40: =FIB(RC[-101])+RC[-1]+R[-1]C+R[-1]C[-1] -> 8.55014831591881E+32 | EL40: =FIB(RC[-101])+RC[-1]+R[-1]C+R[-1]C[-1] -> 1.99828381997197E+33 | EM40: =FIB(RC[-101])+RC[-1]+R[-1]C+R[-1]C[-1] -> 4.5933340445965E+33 | EN40: =FIB(RC[-101])+RC[-1]+R[-1]C+R[-1]C[-1] -> 1.03907281386499E+34 | EO40: =FIB(RC[-101])+RC[-1]+R[-1]C+R[-1]C[-1] -> 2.31450201561589E+34 | EP40: =FIB(RC[-101])+RC[-1]+R[-1]C+R[-1]C[-1] -> 5.07921917874923E+34 | EQ40: =FIB(RC[-101])+RC[-1]+R[-1]C+R[-1]C[-1] -> 1.09871936048675E+35 | ER40: =FIB(RC[-101])+RC[-1]+R[-1]C+R[-1]C[-1] -> 2.34389867448297E+35 | ES40: =FIB(RC[-101])+RC[-1]+R[-1]C+R[-1]C[-1] -> 4.93349594222983E+35 | ET40: =FIB(RC[-101])+RC[-1]+R[-1]C+R[-1]C[-1] -> 1.02500676696192E+36 | EU40: =FIB(RC[-101])+RC[-1]+R[-1]C+R[-1]C[-1] -> 2.10299329413835E+36 | EV40: =FIB(RC[-101])+RC[-1]+R[-1]C+R[-1]C[-1] -> 4.26248644284364E+36 | EW40: =FIB(RC[-101])+RC[-1]+R[-1]C+R[-1]C[-1] -> 8.53825167280199E+36 | EX40: =FIB(RC[-101])+RC[-1]+R[-1]C+R[-1]C[-1] -> 1.69088901354571E+37 | EY40: =FIB(RC[-101])+RC[-1]+R[-1]C+R[-1]C[-1] -> 3.3117215914067E+37 | EZ40: =FIB(RC[-101])+RC[-1]+R[-1]C+R[-1]C[-1] -> 6.41698204459268E+37 | FA40: =FIB(RC[-101])+RC[-1]+R[-1]C+R[-1]C[-1] -> 1.23051119473248E+38 | FB40: =FIB(RC[-101])+RC[-1]+R[-1]C+R[-1]C[-1] -> 2.33588568129097E+38 | FC40: =FIB(RC[-101])+RC[-1]+R[-1]C+R[-1]C[-1] -> 4.390932877961E+38 | FD40: =FIB(RC[-101])+RC[-1]+R[-1]C+R[-1]C[-1] -> 8.17567909955584E+38 | FE40: =FIB(RC[-101])+RC[-1]+R[-1]C+R[-1]C[-1] -> 1.50823948110768E+39 | FF40: =FIB(RC[-101])+RC[-1]+R[-1]C+R[-1]C[-1] -> 2.75745891155479E+39 | FG40: =FIB(RC[-101])+RC[-1]+R[-1]C+R[-1]C[-1] -> 4.99744939290963E+39 | FH40: =FIB(RC[-101])+RC[-1]+R[-1]C+R[-1]C[-1] -> 8.98033261200409E+39 | FI40: =FIB(RC[-101])+RC[-1]+R[-1]C+R[-1]C[-1] -> 1.6004462314088E+40 | FJ40: =FIB(RC[-101])+RC[-1]+R[-1]C+R[-1]C[-1] -> 2.82937509227879E+40 | FK40: =FIB(RC[-101])+RC[-1]+R[-1]C+R[-1]C[-1] -> 4.96287329290297E+40 | FL40: =FIB(RC[-101])+RC[-1]+R[-1]C+R[-1]C[-1] -> 8.63889173477216E+40 | FM40: =FIB(RC[-101])+RC[-1]+R[-1]C+R[-1]C[-1] -> 1.4926249377522E+41 | FN40: =FIB(RC[-101])+RC[-1]+R[-1]C+R[-1]C[-1] -> 2.56031643302717E+41 | FO40: =FIB(RC[-101])+RC[-1]+R[-1]C+R[-1]C[-1] -> 4.36080169877212E+41 | FP40: =FIB(RC[-101])+RC[-1]+R[-1]C+R[-1]C[-1] -> 7.37641527485774E+41 | FQ40: =FIB(RC[-101])+RC[-1]+R[-1]C+R[-1]C[-1] -> 1.23938017684248E+42 | FR40: =FIB(RC[-101])+RC[-1]+R[-1]C+R[-1]C[-1] -> 2.06878388971961E+42 | FS40: =FIB(RC[-101])+RC[-1]+R[-1]C+R[-1]C[-1] -> 3.43119838104527E+42 | FT40: =FIB(RC[-101])+RC[-1]+R[-1]C+R[-1]C[-1] -> 5.65539573255769E+42 | FU40: =FIB(RC[-101])+RC[-1]+R[-1]C+R[-1]C[-1] -> 9.26468607171648E+42 | FV40: =FIB(RC[-101])+RC[-1]+R[-1]C+R[-1]C[-1] -> 1.50872763031167E+43 | FW40: =FIB(RC[-101])+RC[-1]+R[-1]C+R[-1]C[-1] -> 2.44266109675434E+43 | FX40: =FIB(RC[-101])+RC[-1]+R[-1]C+R[-1]C[-1] -> 3.9322909089608E+43 | FY40: =FIB(RC[-101])+RC[-1]+R[-1]C+R[-1]C[-1] -> 6.29526510564371E+43 | FZ40: =FIB(RC[-101])+RC[-1]+R[-1]C+R[-1]C[-1] -> 1.00235705686755E+44 | GA40: =FIB(RC[-101])+RC[-1]+R[-1]C+R[-1]C[-1] -> 1.58753481522257E+44 | GB40: =FIB(RC[-101])+RC[-1]+R[-1]C+R[-1]C[-1] -> 2.50130757910509E+44 | GC40: =FIB(RC[-101])+RC[-1]+R[-1]C+R[-1]C[-1] -> 3.9210558144378E+44 | GD40: =FIB(RC[-101])+RC[-1]+R[-1]C+R[-1]C[-1] -> 6.11615583512251E+44 | GE40: =FIB(RC[-101])+RC[-1]+R[-1]C+R[-1]C[-1] -> 9.49379133955688E+44 | GF40: =FIB(RC[-101])+RC[-1]+R[-1]C+R[-1]C[-1] -> 1.46666542258107E+45 | GG40: =FIB(RC[-101])+RC[-1]+R[-1]C+R[-1]C[-1] -> 2.25525628452329E+45 | GH40: =FIB(RC[-101])+RC[-1]+R[-1]C+R[-1]C[-1] -> 3.45204273780308E+45 | GI40: =FIB(RC[-101])+RC[-1]+R[-1]C+R[-1]C[-1] -> 5.26032428454462E+45 | GJ40: =FIB(RC[-101])+RC[-1]+R[-1]C+R[-1]C[-1] -> 7.98076335034397E+45 | GK40: =FIB(RC[-101])+RC[-1]+R[-1]C+R[-1]C[-1] -> 1.20561936366384E+46 | GL40: =FIB(RC[-101])+RC[-1]+R[-1]C+R[-1]C[-1] -> 1.81362314572697E+46 | GM40: =FIB(RC[-101])+RC[-1]+R[-1]C+R[-1]C[-1] -> 2.71700882269327E+46 | GN40: =FIB(RC[-101])+RC[-1]+R[-1]C+R[-1]C[-1] -> 4.05393971253793E+46 | GO40: =FIB(RC[-101])+RC[-1]+R[-1]C+R[-1]C[-1] -> 6.02476120256623E+46 | GP40: =FIB(RC[-101])+RC[-1]+R[-1]C+R[-1]C[-1] -> 8.91891079800385E+46 | GQ40: =FIB(RC[-101])+RC[-1]+R[-1]C+R[-1]C[-1] -> 1.31530182621554E+47 | GR40: =FIB(RC[-101])+RC[-1]+R[-1]C+R[-1]C[-1] -> 1.93246636456026E+47 | GS40: =FIB(RC[-101])+RC[-1]+R[-1]C+R[-1]C[-1] -> 2.82879723595599E+47
A41: 20 | B41: 20 | C41: 20 | D41: 20 | E41: 20 | F41: 20 | G41: 20 | H41: 20 | I41: 20 | J41: 20 | K41: 20 | L41: 20 | M41: 20 | N41: 20 | O41: 20 | P41: 20 | Q41: 20 | R41: 20 | S41: 20 | T41: 20 | U41: 20 | V41: 20 | W41: 20 | X41: 20 | Y41: 20 | Z41: 20 | AA41: 20 | AB41: 20 | AC41: 20 | AD41: 20 | AE41: 20 | AF41: 20 | AG41: 20 | AH41: 20 | AI41: 20 | AJ41: 20 | AK41: 20 | AL41: 20 | AM41: 20 | AN41: 20 | AO41: 20 | AP41: 20 | AQ41: 20 | AR41: 20 | AS41: 20 | AT41: 20 | AU41: 20 | AV41: 20 | AW41: 20 | AX41: 20 | AY41: 20 | AZ41: 20 | BA41: 20 | BB41: 20 | BC41: 20 | BD41: 20 | BE41: 20 | BF41: 20 | BG41: 20 | BH41: 20 | BI41: 20 | BJ41: 20 | BK41: 20 | BL41: 20 | BM41: 20 | BN41: 20 | BO41: 20 | BP41: 20 | BQ41: 20 | BR41: 20 | BS41: 20 | BT41: 20 | BU41: 20 | BV41: 20 | BW41: 20 | BX41: 20 | BY41: 20 | BZ41: 20 | CA41: 20 | CB41: 20 | CC41: 20 | CD41: 20 | CE41: 20 | CF41: 20 | CG41: 20 | CH41: 20 | CI41: 20 | CJ41: 20 | CK41: 20 | CL41: 20 | CM41: 20 | CN41: 20 | CO41: 20 | CP41: 20 | CQ41: 20 | CR41: 20 | CS41: 20 | CT41: 20 | CU41: 20 | CV41: 20 | CW41: 0 | CX41: =FIB(RC[-101])+RC[-1]+R[-1]C+R[-1]C[-1] -> 437840 | CY41: =FIB(RC[-101])+RC[-1]+R[-1]C+R[-1]C[-1] -> 17951440 | CZ41: =FIB(RC[-101])+RC[-1]+R[-1]C+R[-1]C[-1] -> 485126720 | DA41: =FIB(RC[-101])+RC[-1]+R[-1]C+R[-1]C[-1] -> 9837389120 | DB41: =FIB(RC[-101])+RC[-1]+R[-1]C+R[-1]C[-1] -> 159753892688 | DC41: =FIB(RC[-101])+RC[-1]+R[-1]C+R[-1]C[-1] -> 2164875448528 | DD41: =FIB(RC[-101])+RC[-1]+R[-1]C+R[-1]C[-1] -> 25187633589248 | DE41: =FIB(RC[-101])+RC[-1]+R[-1]C+R[-1]C[-1] -> 256919056163328 | DF41: =FIB(RC[-101])+RC[-1]+R[-1]C+R[-1]C[-1] -> 2.33466051315349E+15 | DG41: =FIB(RC[-101])+RC[-1]+R[-1]C+R[-1]C[-1] -> 1.9141977307134E+16 | DH41: =FIB(RC[-101])+RC[-1]+R[-1]C+R[-1]C[-1] -> 1.43076978819075E+17 | DI41: =FIB(RC[-101])+RC[-1]+R[-1]C+R[-1]C[-1] -> 9.83316419560335E+17 | DJ41: =FIB(RC[-101])+RC[-1]+R[-1]C+R[-1]C[-1] -> 6.25888874847819E+18 | DK41: =FIB(RC[-101])+RC[-1]+R[-1]C+R[-1]C[-1] -> 3.71252215772156E+19 | DL41: =FIB(RC[-101])+RC[-1]+R[-1]C+R[-1]C[-1] -> 2.06317826015544E+20 | DM41: =FIB(RC[-101])+RC[-1]+R[-1]C+R[-1]C[-1] -> 1.07928888943233E+21 | DN41: =FIB(RC[-101])+RC[-1]+R[-1]C+R[-1]C[-1] -> 5.33667560354515E+21 | DO41: =FIB(RC[-101])+RC[-1]+R[-1]C+R[-1]C[-1] -> 2.50343686115281E+22 | DP41: =FIB(RC[-101])+RC[-1]+R[-1]C+R[-1]C[-1] -> 1.11781264126189E+23 | DQ41: =FIB(RC[-101])+RC[-1]+R[-1]C+R[-1]C[-1] -> 4.76496769892017E+23 | DR41: =FIB(RC[-101])+RC[-1]+R[-1]C+R[-1]C[-1] -> 1.94437445922748E+24 | DS41: =FIB(RC[-101])+RC[-1]+R[-1]C+R[-1]C[-1] -> 7.61367106205266E+24 | DT41: =FIB(RC[-101])+RC[-1]+R[-1]C+R[-1]C[-1] -> 2.86731997447509E+25 | DU41: =FIB(RC[-101])+RC[-1]+R[-1]C+R[-1]C[-1] -> 1.04068483906335E+26 | DV41: =FIB(RC[-101])+RC[-1]+R[-1]C+R[-1]C[-1] -> 3.64708159611485E+26 | DW41: =FIB(RC[-101])+RC[-1]+R[-1]C+R[-1]C[-1] -> 1.2362720394688E+27 | DX41: =FIB(RC[-101])+RC[-1]+R[-1]C+R[-1]C[-1] -> 4.06001656840263E+27 | DY41: =FIB(RC[-101])+RC[-1]+R[-1]C+R[-1]C[-1] -> 1.29371673966525E+28 | DZ41: =FIB(RC[-101])+RC[-1]+R[-1]C+R[-1]C[-1] -> 4.00548628635906E+28 | EA41: =FIB(RC[-101])+RC[-1]+R[-1]C+R[-1]C[-1] -> 1.20654058215125E+29 | EB41: =FIB(RC[-101])+RC[-1]+R[-1]C+R[-1]C[-1] -> 3.54020148430093E+29 | EC41: =FIB(RC[-101])+RC[-1]+R[-1]C+R[-1]C[-1] -> 1.01299711960957E+30 | ED41: =FIB(RC[-101])+RC[-1]+R[-1]C+R[-1]C[-1] -> 2.82973974054965E+30 | EE41: =FIB(RC[-101])+RC[-1]+R[-1]C+R[-1]C[-1] -> 7.72464188034229E+30 | EF41: =FIB(RC[-101])+RC[-1]+R[-1]C+R[-1]C[-1] -> 2.06259183853261E+31 | EG41: =FIB(RC[-101])+RC[-1]+R[-1]C+R[-1]C[-1] -> 5.3918384861761E+31 | EH41: =FIB(RC[-101])+RC[-1]+R[-1]C+R[-1]C[-1] -> 1.38106006369578E+32 | EI41: =FIB(RC[-101])+RC[-1]+R[-1]C+R[-1]C[-1] -> 3.46883335679499E+32 | EJ41: =FIB(RC[-101])+RC[-1]+R[-1]C+R[-1]C[-1] -> 8.55014831591881E+32 | EK41: =FIB(RC[-101])+RC[-1]+R[-1]C+R[-1]C[-1] -> 2.06961628626107E+33 | EL41: =FIB(RC[-101])+RC[-1]+R[-1]C+R[-1]C[-1] -> 4.92291493782493E+33 | EM41: =FIB(RC[-101])+RC[-1]+R[-1]C+R[-1]C[-1] -> 1.15145328023934E+34 | EN41: =FIB(RC[-101])+RC[-1]+R[-1]C+R[-1]C[-1] -> 2.64985949856398E+34 | EO41: =FIB(RC[-101])+RC[-1]+R[-1]C+R[-1]C[-1] -> 6.00343432804487E+34 | EP41: =FIB(RC[-101])+RC[-1]+R[-1]C+R[-1]C[-1] -> 1.339715552241E+35 | EQ41: =FIB(RC[-101])+RC[-1]+R[-1]C+R[-1]C[-1] -> 2.94635683060267E+35 | ER41: =FIB(RC[-101])+RC[-1]+R[-1]C+R[-1]C[-1] -> 6.38897486557239E+35 | ES41: =FIB(RC[-101])+RC[-1]+R[-1]C+R[-1]C[-1] -> 1.36663694822852E+36 | ET41: =FIB(RC[-101])+RC[-1]+R[-1]C+R[-1]C[-1] -> 2.88499330941342E+36 | EU41: =FIB(RC[-101])+RC[-1]+R[-1]C+R[-1]C[-1] -> 6.01299337051368E+36 | EV41: =FIB(RC[-101])+RC[-1]+R[-1]C+R[-1]C[-1] -> 1.23784731074957E+37 | EW41: =FIB(RC[-101])+RC[-1]+R[-1]C+R[-1]C[-1] -> 2.51792112231413E+37 | EX41: =FIB(RC[-101])+RC[-1]+R[-1]C+R[-1]C[-1] -> 5.06263530314004E+37 | EY41: =FIB(RC[-101])+RC[-1]+R[-1]C+R[-1]C[-1] -> 1.00652459080924E+38 | EZ41: =FIB(RC[-101])+RC[-1]+R[-1]C+R[-1]C[-1] -> 1.97939495440918E+38 | FA41: =FIB(RC[-101])+RC[-1]+R[-1]C+R[-1]C[-1] -> 3.85160435360093E+38 | FB41: =FIB(RC[-101])+RC[-1]+R[-1]C+R[-1]C[-1] -> 7.41800122962438E+38 | FC41: =FIB(RC[-101])+RC[-1]+R[-1]C+R[-1]C[-1] -> 1.41448197888763E+39 | FD41: =FIB(RC[-101])+RC[-1]+R[-1]C+R[-1]C[-1] -> 2.67114317663932E+39 | FE41: =FIB(RC[-101])+RC[-1]+R[-1]C+R[-1]C[-1] -> 4.99695056770259E+39 | FF41: =FIB(RC[-101])+RC[-1]+R[-1]C+R[-1]C[-1] -> 9.26264896036506E+39 | FG41: =FIB(RC[-101])+RC[-1]+R[-1]C+R[-1]C[-1] -> 1.70175572648295E+40 | FH41: =FIB(RC[-101])+RC[-1]+R[-1]C+R[-1]C[-1] -> 3.09953392697432E+40 | FI41: =FIB(RC[-101])+RC[-1]+R[-1]C+R[-1]C[-1] -> 5.59801341958352E+40 | FJ41: =FIB(RC[-101])+RC[-1]+R[-1]C+R[-1]C[-1] -> 1.00278347432711E+41 | FK41: =FIB(RC[-101])+RC[-1]+R[-1]C+R[-1]C[-1] -> 1.78200831284529E+41 | FL41: =FIB(RC[-101])+RC[-1]+R[-1]C+R[-1]C[-1] -> 3.1421848156128E+41 | FM41: =FIB(RC[-101])+RC[-1]+R[-1]C+R[-1]C[-1] -> 5.49869892684222E+41 | FN41: =FIB(RC[-101])+RC[-1]+R[-1]C+R[-1]C[-1] -> 9.55164029762159E+41 | FO41: =FIB(RC[-101])+RC[-1]+R[-1]C+R[-1]C[-1] -> 1.64727584294209E+42 | FP41: =FIB(RC[-101])+RC[-1]+R[-1]C+R[-1]C[-1] -> 2.82099754030508E+42 | FQ41: =FIB(RC[-101])+RC[-1]+R[-1]C+R[-1]C[-1] -> 4.79801924463333E+42 | FR41: =FIB(RC[-101])+RC[-1]+R[-1]C+R[-1]C[-1] -> 8.10618331119541E+42 | FS41: =FIB(RC[-101])+RC[-1]+R[-1]C+R[-1]C[-1] -> 1.36061655819603E+43 | FT41: =FIB(RC[-101])+RC[-1]+R[-1]C+R[-1]C[-1] -> 2.26927596955632E+43 | FU41: =FIB(RC[-101])+RC[-1]+R[-1]C+R[-1]C[-1] -> 3.76128414998374E+43 | FV41: =FIB(RC[-101])+RC[-1]+R[-1]C+R[-1]C[-1] -> 6.19648038746706E+43 | FW41: =FIB(RC[-101])+RC[-1]+R[-1]C+R[-1]C[-1] -> 1.01478691145331E+44 | FX41: =FIB(RC[-101])+RC[-1]+R[-1]C+R[-1]C[-1] -> 1.65228211202482E+44 | FY41: =FIB(RC[-101])+RC[-1]+R[-1]C+R[-1]C[-1] -> 2.67503771348527E+44 | FZ41: =FIB(RC[-101])+RC[-1]+R[-1]C+R[-1]C[-1] -> 4.3069212809172E+44 | GA41: =FIB(RC[-101])+RC[-1]+R[-1]C+R[-1]C[-1] -> 6.89681315300732E+44 | GB41: =FIB(RC[-101])+RC[-1]+R[-1]C+R[-1]C[-1] -> 1.0985655547335E+45 | GC41: =FIB(RC[-101])+RC[-1]+R[-1]C+R[-1]C[-1] -> 1.74080189408779E+45 | GD41: =FIB(RC[-101])+RC[-1]+R[-1]C+R[-1]C[-1] -> 2.74452305904382E+45 | GE41: =FIB(RC[-101])+RC[-1]+R[-1]C+R[-1]C[-1] -> 4.30551777651176E+45 | GF41: =FIB(RC[-101])+RC[-1]+R[-1]C+R[-1]C[-1] -> 6.72156233304851E+45 | GG41: =FIB(RC[-101])+RC[-1]+R[-1]C+R[-1]C[-1] -> 1.04434840401529E+46 | GH41: =FIB(RC[-101])+RC[-1]+R[-1]C+R[-1]C[-1] -> 1.61507830624792E+46 | GI41: =FIB(RC[-101])+RC[-1]+R[-1]C+R[-1]C[-1] -> 2.48631500848269E+46 | GJ41: =FIB(RC[-101])+RC[-1]+R[-1]C+R[-1]C[-1] -> 3.81042377197155E+46 | GK41: =FIB(RC[-101])+RC[-1]+R[-1]C+R[-1]C[-1] -> 5.81411947066979E+46 | GL41: =FIB(RC[-101])+RC[-1]+R[-1]C+R[-1]C[-1] -> 8.8333619800606E+46 | GM41: =FIB(RC[-101])+RC[-1]+R[-1]C+R[-1]C[-1] -> 1.33639939484808E+47 | GN41: =FIB(RC[-101])+RC[-1]+R[-1]C+R[-1]C[-1] -> 2.01349424837121E+47 | GO41: =FIB(RC[-101])+RC[-1]+R[-1]C+R[-1]C[-1] -> 3.02136433988162E+47 | GP41: =FIB(RC[-101])+RC[-1]+R[-1]C+R[-1]C[-1] -> 4.51573153993863E+47 | GQ41: =FIB(RC[-101])+RC[-1]+R[-1]C+R[-1]C[-1] -> 6.72292444595455E+47 | GR41: =FIB(RC[-101])+RC[-1]+R[-1]C+R[-1]C[-1] -> 9.97069263673035E+47 | GS41: =FIB(RC[-101])+RC[-1]+R[-1]C+R[-1]C[-1] -> 1.47319562372466E+48
A42: 20 | B42: 20 | C42: 20 | D42: 20 | E42: 20 | F42: 20 | G42: 20 | H42: 20 | I42: 20 | J42: 20 | K42: 20 | L42: 20 | M42: 20 | N42: 20 | O42: 20 | P42: 20 | Q42: 20 | R42: 20 | S42: 20 | T42: 20 | U42: 20 | V42: 20 | W42: 20 | X42: 20 | Y42: 20 | Z42: 20 | AA42: 20 | AB42: 20 | AC42: 20 | AD42: 20 | AE42: 20 | AF42: 20 | AG42: 20 | AH42: 20 | AI42: 20 | AJ42: 20 | AK42: 20 | AL42: 20 | AM42: 20 | AN42: 20 | AO42: 20 | AP42: 20 | AQ42: 20 | AR42: 20 | AS42: 20 | AT42: 20 | AU42: 20 | AV42: 20 | AW42: 20 | AX42: 20 | AY42: 20 | AZ42: 20 | BA42: 20 | BB42: 20 | BC42: 20 | BD42: 20 | BE42: 20 | BF42: 20 | BG42: 20 | BH42: 20 | BI42: 20 | BJ42: 20 | BK42: 20 | BL42: 20 | BM42: 20 | BN42: 20 | BO42: 20 | BP42: 20 | BQ42: 20 | BR42: 20 | BS42: 20 | BT42: 20 | BU42: 20 | BV42: 20 | BW42: 20 | BX42: 20 | BY42: 20 | BZ42: 20 | CA42: 20 | CB42: 20 | CC42: 20 | CD42: 20 | CE42: 20 | CF42: 20 | CG42: 20 | CH42: 20 | CI42: 20 | CJ42: 20 | CK42: 20 | CL42: 20 | CM42: 20 | CN42: 20 | CO42: 20 | CP42: 20 | CQ42: 20 | CR42: 20 | CS42: 20 | CT42: 20 | CU42: 20 | CV42: 20 | CW42: 0 | CX42: =FIB(RC[-101])+RC[-1]+R[-1]C+R[-1]C[-1] -> 448786 | CY42: =FIB(RC[-101])+RC[-1]+R[-1]C+R[-1]C[-1] -> 18849012 | CZ42: =FIB(RC[-101])+RC[-1]+R[-1]C+R[-1]C[-1] -> 521938118 | DA42: =FIB(RC[-101])+RC[-1]+R[-1]C+R[-1]C[-1] -> 10844464904 | DB42: =FIB(RC[-101])+RC[-1]+R[-1]C+R[-1]C[-1] -> 180435757658 | DC42: =FIB(RC[-101])+RC[-1]+R[-1]C+R[-1]C[-1] -> 2505065109820 | DD42: =FIB(RC[-101])+RC[-1]+R[-1]C+R[-1]C[-1] -> 29857574158542 | DE42: =FIB(RC[-101])+RC[-1]+R[-1]C+R[-1]C[-1] -> 311964263922064 | DF42: =FIB(RC[-101])+RC[-1]+R[-1]C+R[-1]C[-1] -> 2.90354383324983E+15 | DG42: =FIB(RC[-101])+RC[-1]+R[-1]C+R[-1]C[-1] -> 2.43801816535483E+16 | DH42: =FIB(RC[-101])+RC[-1]+R[-1]C+R[-1]C[-1] -> 1.86599137779769E+17 | DI42: =FIB(RC[-101])+RC[-1]+R[-1]C+R[-1]C[-1] -> 1.31299253615919E+18 | DJ42: =FIB(RC[-101])+RC[-1]+R[-1]C+R[-1]C[-1] -> 8.55519770419773E+18 | DK42: =FIB(RC[-101])+RC[-1]+R[-1]C+R[-1]C[-1] -> 5.19393080298915E+19 | DL42: =FIB(RC[-101])+RC[-1]+R[-1]C+R[-1]C[-1] -> 2.95382355622651E+20 | DM42: =FIB(RC[-101])+RC[-1]+R[-1]C+R[-1]C[-1] -> 1.58098907107052E+21 | DN42: =FIB(RC[-101])+RC[-1]+R[-1]C+R[-1]C[-1] -> 7.996953564048E+21 | DO42: =FIB(RC[-101])+RC[-1]+R[-1]C+R[-1]C[-1] -> 3.83679977791213E+22 | DP42: =FIB(RC[-101])+RC[-1]+R[-1]C+R[-1]C[-1] -> 1.75183630516838E+23 | DQ42: =FIB(RC[-101])+RC[-1]+R[-1]C+R[-1]C[-1] -> 7.63461664535044E+23 | DR42: =FIB(RC[-101])+RC[-1]+R[-1]C+R[-1]C[-1] -> 3.18433289365455E+24 | DS42: =FIB(RC[-101])+RC[-1]+R[-1]C+R[-1]C[-1] -> 1.27423784149347E+25 | DT42: =FIB(RC[-101])+RC[-1]+R[-1]C+R[-1]C[-1] -> 4.90292492217382E+25 | DU42: =FIB(RC[-101])+RC[-1]+R[-1]C+R[-1]C[-1] -> 1.81770932872824E+26 | DV42: =FIB(RC[-101])+RC[-1]+R[-1]C+R[-1]C[-1] -> 6.50547576390644E+26 | DW42: =FIB(RC[-101])+RC[-1]+R[-1]C+R[-1]C[-1] -> 2.25152777547092E+27 | DX42: =FIB(RC[-101])+RC[-1]+R[-1]C+R[-1]C[-1] -> 7.54781638334235E+27 | DY42: =FIB(RC[-101])+RC[-1]+R[-1]C+R[-1]C[-1] -> 2.45450003483975E+28 | DZ42: =FIB(RC[-101])+RC[-1]+R[-1]C+R[-1]C[-1] -> 7.75370306086407E+28 | EA42: =FIB(RC[-101])+RC[-1]+R[-1]C+R[-1]C[-1] -> 2.38245951687357E+29 | EB42: =FIB(RC[-101])+RC[-1]+R[-1]C+R[-1]C[-1] -> 7.12920158332575E+29 | EC42: =FIB(RC[-101])+RC[-1]+R[-1]C+R[-1]C[-1] -> 2.07993742637224E+30 | ED42: =FIB(RC[-101])+RC[-1]+R[-1]C+R[-1]C[-1] -> 5.92267428653147E+30 | EE42: =FIB(RC[-101])+RC[-1]+R[-1]C+R[-1]C[-1] -> 1.64770559074234E+31 | EF42: =FIB(RC[-101])+RC[-1]+R[-1]C+R[-1]C[-1] -> 4.48276161730918E+31 | EG42: =FIB(RC[-101])+RC[-1]+R[-1]C+R[-1]C[-1] -> 1.19371919420179E+32 | EH42: =FIB(RC[-101])+RC[-1]+R[-1]C+R[-1]C[-1] -> 3.11396310651518E+32 | EI42: =FIB(RC[-101])+RC[-1]+R[-1]C+R[-1]C[-1] -> 7.96385652700594E+32 | EJ42: =FIB(RC[-101])+RC[-1]+R[-1]C+R[-1]C[-1] -> 1.99828381997197E+33 | EK42: =FIB(RC[-101])+RC[-1]+R[-1]C+R[-1]C[-1] -> 4.92291493782493E+33 | EL42: =FIB(RC[-101])+RC[-1]+R[-1]C+R[-1]C[-1] -> 1.19154461619109E+34 | EM42: =FIB(RC[-101])+RC[-1]+R[-1]C+R[-1]C[-1] -> 2.83528939021293E+34 | EN42: =FIB(RC[-101])+RC[-1]+R[-1]C+R[-1]C[-1] -> 6.63660216901625E+34 | EO42: =FIB(RC[-101])+RC[-1]+R[-1]C+R[-1]C[-1] -> 1.52898959956251E+35 | EP42: =FIB(RC[-101])+RC[-1]+R[-1]C+R[-1]C[-1] -> 3.46904858460799E+35 | EQ42: =FIB(RC[-101])+RC[-1]+R[-1]C+R[-1]C[-1] -> 7.75512096745166E+35 | ER42: =FIB(RC[-101])+RC[-1]+R[-1]C+R[-1]C[-1] -> 1.70904526636267E+36 | ES42: =FIB(RC[-101])+RC[-1]+R[-1]C+R[-1]C[-1] -> 3.71457970114843E+36 | ET42: =FIB(RC[-101])+RC[-1]+R[-1]C+R[-1]C[-1] -> 7.96620995879036E+36 | EU42: =FIB(RC[-101])+RC[-1]+R[-1]C+R[-1]C[-1] -> 1.68641966387175E+37 | EV42: =FIB(RC[-101])+RC[-1]+R[-1]C+R[-1]C[-1] -> 3.52556631167268E+37 | EW42: =FIB(RC[-101])+RC[-1]+R[-1]C+R[-1]C[-1] -> 7.28133474473638E+37 | EX42: =FIB(RC[-101])+RC[-1]+R[-1]C+R[-1]C[-1] -> 1.48618911701905E+38 | EY42: =FIB(RC[-101])+RC[-1]+R[-1]C+R[-1]C[-1] -> 2.9989772381423E+38 | EZ42: =FIB(RC[-101])+RC[-1]+R[-1]C+R[-1]C[-1] -> 5.98489678336073E+38 | FA42: =FIB(RC[-101])+RC[-1]+R[-1]C+R[-1]C[-1] -> 1.18158960913708E+39 | FB42: =FIB(RC[-101])+RC[-1]+R[-1]C+R[-1]C[-1] -> 2.30855016745962E+39 | FC42: =FIB(RC[-101])+RC[-1]+R[-1]C+R[-1]C[-1] -> 4.46483226930969E+39 | FD42: =FIB(RC[-101])+RC[-1]+R[-1]C+R[-1]C[-1] -> 8.55045742483664E+39 | FE42: =FIB(RC[-101])+RC[-1]+R[-1]C+R[-1]C[-1] -> 1.62185511691785E+40 | FF42: =FIB(RC[-101])+RC[-1]+R[-1]C+R[-1]C[-1] -> 3.04781506972462E+40 | FG42: =FIB(RC[-101])+RC[-1]+R[-1]C+R[-1]C[-1] -> 5.67583569224407E+40 | FH42: =FIB(RC[-101])+RC[-1]+R[-1]C+R[-1]C[-1] -> 1.04771253457013E+41 | FI42: =FIB(RC[-101])+RC[-1]+R[-1]C+R[-1]C[-1] -> 1.91746726922592E+41 | FJ42: =FIB(RC[-101])+RC[-1]+R[-1]C+R[-1]C[-1] -> 3.48005208551138E+41 | FK42: =FIB(RC[-101])+RC[-1]+R[-1]C+R[-1]C[-1] -> 6.26484387268378E+41 | FL42: =FIB(RC[-101])+RC[-1]+R[-1]C+R[-1]C[-1] -> 1.11890370011419E+42 | FM42: =FIB(RC[-101])+RC[-1]+R[-1]C+R[-1]C[-1] -> 1.98299207435969E+42 | FN42: =FIB(RC[-101])+RC[-1]+R[-1]C+R[-1]C[-1] -> 3.48802599680607E+42 | FO42: =FIB(RC[-101])+RC[-1]+R[-1]C+R[-1]C[-1] -> 6.09046586951032E+42 | FP42: =FIB(RC[-101])+RC[-1]+R[-1]C+R[-1]C[-1] -> 1.05587392527575E+43 | FQ42: =FIB(RC[-101])+RC[-1]+R[-1]C+R[-1]C[-1] -> 1.81777560376959E+43 | FR42: =FIB(RC[-101])+RC[-1]+R[-1]C+R[-1]C[-1] -> 3.10819585935246E+43 | FS42: =FIB(RC[-101])+RC[-1]+R[-1]C+R[-1]C[-1] -> 5.27943074866803E+43 | FT42: =FIB(RC[-101])+RC[-1]+R[-1]C+R[-1]C[-1] -> 8.90932327642038E+43 | FU42: =FIB(RC[-101])+RC[-1]+R[-1]C+R[-1]C[-1] -> 1.49398833959604E+44 | FV42: =FIB(RC[-101])+RC[-1]+R[-1]C+R[-1]C[-1] -> 2.48976479334113E+44 | FW42: =FIB(RC[-101])+RC[-1]+R[-1]C+R[-1]C[-1] -> 4.12419974354114E+44 | FX42: =FIB(RC[-101])+RC[-1]+R[-1]C+R[-1]C[-1] -> 6.79126876701927E+44 | FY42: =FIB(RC[-101])+RC[-1]+R[-1]C+R[-1]C[-1] -> 1.11185885925294E+45 | FZ42: =FIB(RC[-101])+RC[-1]+R[-1]C+R[-1]C[-1] -> 1.81005475869318E+45 | GA42: =FIB(RC[-101])+RC[-1]+R[-1]C+R[-1]C[-1] -> 2.93042820208564E+45 | GB42: =FIB(RC[-101])+RC[-1]+R[-1]C+R[-1]C[-1] -> 4.71867507211987E+45 | GC42: =FIB(RC[-101])+RC[-1]+R[-1]C+R[-1]C[-1] -> 7.55804252094115E+45 | GD42: =FIB(RC[-101])+RC[-1]+R[-1]C+R[-1]C[-1] -> 1.20433674740728E+46 | GE42: =FIB(RC[-101])+RC[-1]+R[-1]C+R[-1]C[-1] -> 1.90934083096283E+46 | GF42: =FIB(RC[-101])+RC[-1]+R[-1]C+R[-1]C[-1] -> 3.01204884191886E+46 | GG42: =FIB(RC[-101])+RC[-1]+R[-1]C+R[-1]C[-1] -> 4.728553479239E+46 | GH42: =FIB(RC[-101])+RC[-1]+R[-1]C+R[-1]C[-1] -> 7.38798018950221E+46 | GI42: =FIB(RC[-101])+RC[-1]+R[-1]C+R[-1]C[-1] -> 1.14893735042328E+47 | GJ42: =FIB(RC[-101])+RC[-1]+R[-1]C+R[-1]C[-1] -> 1.77861122846871E+47 | GK42: =FIB(RC[-101])+RC[-1]+R[-1]C+R[-1]C[-1] -> 2.74106555273284E+47 | GL42: =FIB(RC[-101])+RC[-1]+R[-1]C+R[-1]C[-1] -> 4.20581369780588E+47 | GM42: =FIB(RC[-101])+RC[-1]+R[-1]C+R[-1]C[-1] -> 6.42554929066002E+47 | GN42: =FIB(RC[-101])+RC[-1]+R[-1]C+R[-1]C[-1] -> 9.77544293387931E+47 | GO42: =FIB(RC[-101])+RC[-1]+R[-1]C+R[-1]C[-1] -> 1.48103015221321E+48 | GP42: =FIB(RC[-101])+RC[-1]+R[-1]C+R[-1]C[-1] -> 2.23473974019524E+48 | GQ42: =FIB(RC[-101])+RC[-1]+R[-1]C+R[-1]C[-1] -> 3.35860533878456E+48 | GR42: =FIB(RC[-101])+RC[-1]+R[-1]C+R[-1]C[-1] -> 5.02796704705305E+48 | GS42: =FIB(RC[-101])+RC[-1]+R[-1]C+R[-1]C[-1] -> 7.49823193445074E+48
A43: 20 | B43: 20 | C43: 20 | D43: 20 | E43: 20 | F43: 20 | G43: 20 | H43: 20 | I43: 20 | J43: 20 | K43: 20 | L43: 20 | M43: 20 | N43: 20 | O43: 20 | P43: 20 | Q43: 20 | R43: 20 | S43: 20 | T43: 20 | U43: 20 | V43: 20 | W43: 20 | X43: 20 | Y43: 20 | Z43: 20 | AA43: 20 | AB43: 20 | AC43: 20 | AD43: 20 | AE43: 20 | AF43: 20 | AG43: 20 | AH43: 20 | AI43: 20 | AJ43: 20 | AK43: 20 | AL43: 20 | AM43: 20 | AN43: 20 | AO43: 20 | AP43: 20 | AQ43: 20 | AR43: 20 | AS43: 20 | AT43: 20 | AU43: 20 | AV43: 20 | AW43: 20 | AX43: 20 | AY43: 20 | AZ43: 20 | BA43: 20 | BB43: 20 | BC43: 20 | BD43: 20 | BE43: 20 | BF43: 20 | BG43: 20 | BH43: 20 | BI43: 20 | BJ43: 20 | BK43: 20 | BL43: 20 | BM43: 20 | BN43: 20 | BO43: 20 | BP43: 20 | BQ43: 20 | BR43: 20 | BS43: 20 | BT43: 20 | BU43: 20 | BV43: 20 | BW43: 20 | BX43: 20 | BY43: 20 | BZ43: 20 | CA43: 20 | CB43: 20 | CC43: 20 | CD43: 20 | CE43: 20 | CF43: 20 | CG43: 20 | CH43: 20 | CI43: 20 | CJ43: 20 | CK43: 20 | CL43: 20 | CM43: 20 | CN43: 20 | CO43: 20 | CP43: 20 | CQ43: 20 | CR43: 20 | CS43: 20 | CT43: 20 | CU43: 20 | CV43: 20 | CW43: 0 | CX43: =FIB(RC[-101])+RC[-1]+R[-1]C+R[-1]C[-1] -> 459732 | CY43: =FIB(RC[-101])+RC[-1]+R[-1]C+R[-1]C[-1] -> 19768476 | CZ43: =FIB(RC[-101])+RC[-1]+R[-1]C+R[-1]C[-1] -> 560566552 | DA43: =FIB(RC[-101])+RC[-1]+R[-1]C+R[-1]C[-1] -> 11926980520 | DB43: =FIB(RC[-101])+RC[-1]+R[-1]C+R[-1]C[-1] -> 203207214028 | DC43: =FIB(RC[-101])+RC[-1]+R[-1]C+R[-1]C[-1] -> 2888708092452 | DD43: =FIB(RC[-101])+RC[-1]+R[-1]C+R[-1]C[-1] -> 35251347371760 | DE43: =FIB(RC[-101])+RC[-1]+R[-1]C+R[-1]C[-1] -> 377073185463312 | DF43: =FIB(RC[-101])+RC[-1]+R[-1]C+R[-1]C[-1] -> 3.59258128264615E+15 | DG43: =FIB(RC[-101])+RC[-1]+R[-1]C+R[-1]C[-1] -> 3.08763067694552E+16 | DH43: =FIB(RC[-101])+RC[-1]+R[-1]C+R[-1]C[-1] -> 2.41855626202783E+17 | DI43: =FIB(RC[-101])+RC[-1]+R[-1]C+R[-1]C[-1] -> 1.74144730014175E+18 | DJ43: =FIB(RC[-101])+RC[-1]+R[-1]C+R[-1]C[-1] -> 1.16096375404987E+19 | DK43: =FIB(RC[-101])+RC[-1]+R[-1]C+R[-1]C[-1] -> 7.21041432745879E+19 | DL43: =FIB(RC[-101])+RC[-1]+R[-1]C+R[-1]C[-1] -> 4.1942580692713E+20 | DM43: =FIB(RC[-101])+RC[-1]+R[-1]C+R[-1]C[-1] -> 2.29579723362031E+21 | DN43: =FIB(RC[-101])+RC[-1]+R[-1]C+R[-1]C[-1] -> 1.18737398687388E+22 | DO43: =FIB(RC[-101])+RC[-1]+R[-1]C+R[-1]C[-1] -> 5.82386912119081E+22 | DP43: =FIB(RC[-101])+RC[-1]+R[-1]C+R[-1]C[-1] -> 2.71790319507868E+23 | DQ43: =FIB(RC[-101])+RC[-1]+R[-1]C+R[-1]C[-1] -> 1.21043561455975E+24 | DR43: =FIB(RC[-101])+RC[-1]+R[-1]C+R[-1]C[-1] -> 5.15823017274934E+24 | DS43: =FIB(RC[-101])+RC[-1]+R[-1]C+R[-1]C[-1] -> 2.10849414813386E+25 | DT43: =FIB(RC[-101])+RC[-1]+R[-1]C+R[-1]C[-1] -> 8.28565691180115E+25 | DU43: =FIB(RC[-101])+RC[-1]+R[-1]C+R[-1]C[-1] -> 3.13656751212574E+26 | DV43: =FIB(RC[-101])+RC[-1]+R[-1]C+R[-1]C[-1] -> 1.14597526047604E+27 | DW43: =FIB(RC[-101])+RC[-1]+R[-1]C+R[-1]C[-1] -> 4.04805061233761E+27 | DX43: =FIB(RC[-101])+RC[-1]+R[-1]C+R[-1]C[-1] -> 1.38473947711509E+28 | DY43: =FIB(RC[-101])+RC[-1]+R[-1]C+R[-1]C[-1] -> 4.59402115028907E+28 | DZ43: =FIB(RC[-101])+RC[-1]+R[-1]C+R[-1]C[-1] -> 1.48022242459929E+29 | EA43: =FIB(RC[-101])+RC[-1]+R[-1]C+R[-1]C[-1] -> 4.63805224755926E+29 | EB43: =FIB(RC[-101])+RC[-1]+R[-1]C+R[-1]C[-1] -> 1.41497133477586E+30 | EC43: =FIB(RC[-101])+RC[-1]+R[-1]C+R[-1]C[-1] -> 4.20782891948068E+30 | ED43: =FIB(RC[-101])+RC[-1]+R[-1]C+R[-1]C[-1] -> 1.22104406323844E+31 | EE43: =FIB(RC[-101])+RC[-1]+R[-1]C+R[-1]C[-1] -> 3.46101708263393E+31 | EF43: =FIB(RC[-101])+RC[-1]+R[-1]C+R[-1]C[-1] -> 9.59148429068545E+31 | EG43: =FIB(RC[-101])+RC[-1]+R[-1]C+R[-1]C[-1] -> 2.60114378500125E+32 | EH43: =FIB(RC[-101])+RC[-1]+R[-1]C+R[-1]C[-1] -> 6.90882608571822E+32 | EI43: =FIB(RC[-101])+RC[-1]+R[-1]C+R[-1]C[-1] -> 1.79866457192393E+33 | EJ43: =FIB(RC[-101])+RC[-1]+R[-1]C+R[-1]C[-1] -> 4.5933340445965E+33 | EK43: =FIB(RC[-101])+RC[-1]+R[-1]C+R[-1]C[-1] -> 1.15145328023934E+34 | EL43: =FIB(RC[-101])+RC[-1]+R[-1]C+R[-1]C[-1] -> 2.83528939021293E+34 | EM43: =FIB(RC[-101])+RC[-1]+R[-1]C+R[-1]C[-1] -> 6.86212339661694E+34 | EN43: =FIB(RC[-101])+RC[-1]+R[-1]C+R[-1]C[-1] -> 1.63340149558461E+35 | EO43: =FIB(RC[-101])+RC[-1]+R[-1]C+R[-1]C[-1] -> 3.82605131204875E+35 | EP43: =FIB(RC[-101])+RC[-1]+R[-1]C+R[-1]C[-1] -> 8.82408949621925E+35 | EQ43: =FIB(RC[-101])+RC[-1]+R[-1]C+R[-1]C[-1] -> 2.00482590482789E+36 | ER43: =FIB(RC[-101])+RC[-1]+R[-1]C+R[-1]C[-1] -> 4.48938326793573E+36 | ES43: =FIB(RC[-101])+RC[-1]+R[-1]C+R[-1]C[-1] -> 9.91300823544683E+36 | ET43: =FIB(RC[-101])+RC[-1]+R[-1]C+R[-1]C[-1] -> 2.15937978953856E+37 | EU43: =FIB(RC[-101])+RC[-1]+R[-1]C+R[-1]C[-1] -> 4.64242044928935E+37 | EV43: =FIB(RC[-101])+RC[-1]+R[-1]C+R[-1]C[-1] -> 9.85440642483378E+37 | EW43: =FIB(RC[-101])+RC[-1]+R[-1]C+R[-1]C[-1] -> 2.06613074812428E+38 | EX43: =FIB(RC[-101])+RC[-1]+R[-1]C+R[-1]C[-1] -> 4.28045333961698E+38 | EY43: =FIB(RC[-101])+RC[-1]+R[-1]C+R[-1]C[-1] -> 8.76561969477833E+38 | EZ43: =FIB(RC[-101])+RC[-1]+R[-1]C+R[-1]C[-1] -> 1.77494937162814E+39 | FA43: =FIB(RC[-101])+RC[-1]+R[-1]C+R[-1]C[-1] -> 3.55502865910129E+39 | FB43: =FIB(RC[-101])+RC[-1]+R[-1]C+R[-1]C[-1] -> 7.04516843569799E+39 | FC43: =FIB(RC[-101])+RC[-1]+R[-1]C+R[-1]C[-1] -> 1.38185508724673E+40 | FD43: =FIB(RC[-101])+RC[-1]+R[-1]C+R[-1]C[-1] -> 2.68338405666136E+40 | FE43: =FIB(RC[-101])+RC[-1]+R[-1]C+R[-1]C[-1] -> 5.16028491606288E+40 | FF43: =FIB(RC[-101])+RC[-1]+R[-1]C+R[-1]C[-1] -> 9.82995510270535E+40 | FG43: =FIB(RC[-101])+RC[-1]+R[-1]C+R[-1]C[-1] -> 1.8553605864674E+41 | FH43: =FIB(RC[-101])+RC[-1]+R[-1]C+R[-1]C[-1] -> 3.47065669026195E+41 | FI43: =FIB(RC[-101])+RC[-1]+R[-1]C+R[-1]C[-1] -> 6.435836494058E+41 | FJ43: =FIB(RC[-101])+RC[-1]+R[-1]C+R[-1]C[-1] -> 1.18333558487953E+42 | FK43: =FIB(RC[-101])+RC[-1]+R[-1]C+R[-1]C[-1] -> 2.15782518069905E+42 | FL43: =FIB(RC[-101])+RC[-1]+R[-1]C+R[-1]C[-1] -> 3.90321326808161E+42 | FM43: =FIB(RC[-101])+RC[-1]+R[-1]C+R[-1]C[-1] -> 7.00510904255548E+42 | FN43: =FIB(RC[-101])+RC[-1]+R[-1]C+R[-1]C[-1] -> 1.24761271137212E+43 | FO43: =FIB(RC[-101])+RC[-1]+R[-1]C+R[-1]C[-1] -> 2.20546189800376E+43 | FP43: =FIB(RC[-101])+RC[-1]+R[-1]C+R[-1]C[-1] -> 3.87038241023054E+43 | FQ43: =FIB(RC[-101])+RC[-1]+R[-1]C+R[-1]C[-1] -> 6.74403193927588E+43 | FR43: =FIB(RC[-101])+RC[-1]+R[-1]C+R[-1]C[-1] -> 1.16700034023979E+44 | FS43: =FIB(RC[-101])+RC[-1]+R[-1]C+R[-1]C[-1] -> 2.00576300104184E+44 | FT43: =FIB(RC[-101])+RC[-1]+R[-1]C+R[-1]C[-1] -> 3.42463840355068E+44 | FU43: =FIB(RC[-101])+RC[-1]+R[-1]C+R[-1]C[-1] -> 5.80955907078877E+44 | FV43: =FIB(RC[-101])+RC[-1]+R[-1]C+R[-1]C[-1] -> 9.79331220372594E+44 | FW43: =FIB(RC[-101])+RC[-1]+R[-1]C+R[-1]C[-1] -> 1.64072767406082E+45 | FX43: =FIB(RC[-101])+RC[-1]+R[-1]C+R[-1]C[-1] -> 2.73227452511686E+45 | FY43: =FIB(RC[-101])+RC[-1]+R[-1]C+R[-1]C[-1] -> 4.52326026107172E+45 | FZ43: =FIB(RC[-101])+RC[-1]+R[-1]C+R[-1]C[-1] -> 7.44517387901785E+45 | GA43: =FIB(RC[-101])+RC[-1]+R[-1]C+R[-1]C[-1] -> 1.21856568397967E+46 | GB43: =FIB(RC[-101])+RC[-1]+R[-1]C+R[-1]C[-1] -> 1.98347601140022E+46 | GC43: =FIB(RC[-101])+RC[-1]+R[-1]C+R[-1]C[-1] -> 3.21114777070632E+46 | GD43: =FIB(RC[-101])+RC[-1]+R[-1]C+R[-1]C[-1] -> 5.17128877020771E+46 | GE43: =FIB(RC[-101])+RC[-1]+R[-1]C+R[-1]C[-1] -> 8.28496634857782E+46 | GF43: =FIB(RC[-101])+RC[-1]+R[-1]C+R[-1]C[-1] -> 1.32063560214595E+47 | GG43: =FIB(RC[-101])+RC[-1]+R[-1]C+R[-1]C[-1] -> 2.09469583426174E+47 | GH43: =FIB(RC[-101])+RC[-1]+R[-1]C+R[-1]C[-1] -> 3.30634920113586E+47 | GI43: =FIB(RC[-101])+RC[-1]+R[-1]C+R[-1]C[-1] -> 5.19408457050936E+47 | GJ43: =FIB(RC[-101])+RC[-1]+R[-1]C+R[-1]C[-1] -> 8.12163314940135E+47 | GK43: =FIB(RC[-101])+RC[-1]+R[-1]C+R[-1]C[-1] -> 1.26413099306029E+48 | GL43: =FIB(RC[-101])+RC[-1]+R[-1]C+R[-1]C[-1] -> 1.95881891811416E+48 | GM43: =FIB(RC[-101])+RC[-1]+R[-1]C+R[-1]C[-1] -> 3.02195521696075E+48 | GN43: =FIB(RC[-101])+RC[-1]+R[-1]C+R[-1]C[-1] -> 4.64205443941469E+48 | GO43: =FIB(RC[-101])+RC[-1]+R[-1]C+R[-1]C[-1] -> 7.10062888501583E+48 | GP43: =FIB(RC[-101])+RC[-1]+R[-1]C+R[-1]C[-1] -> 1.08163987774243E+49 | GQ43: =FIB(RC[-101])+RC[-1]+R[-1]C+R[-1]C[-1] -> 1.64097438564041E+49 | GR43: =FIB(RC[-101])+RC[-1]+R[-1]C+R[-1]C[-1] -> 2.47963162422417E+49 | GS43: =FIB(RC[-101])+RC[-1]+R[-1]C+R[-1]C[-1] -> 3.73225152237455E+49
A44: 20 | B44: 20 | C44: 20 | D44: 20 | E44: 20 | F44: 20 | G44: 20 | H44: 20 | I44: 20 | J44: 20 | K44: 20 | L44: 20 | M44: 20 | N44: 20 | O44: 20 | P44: 20 | Q44: 20 | R44: 20 | S44: 20 | T44: 20 | U44: 20 | V44: 20 | W44: 20 | X44: 20 | Y44: 20 | Z44: 20 | AA44: 20 | AB44: 20 | AC44: 20 | AD44: 20 | AE44: 20 | AF44: 20 | AG44: 20 | AH44: 20 | AI44: 20 | AJ44: 20 | AK44: 20 | AL44: 20 | AM44: 20 | AN44: 20 | AO44: 20 | AP44: 20 | AQ44: 20 | AR44: 20 | AS44: 20 | AT44: 20 | AU44: 20 | AV44: 20 | AW44: 20 | AX44: 20 | AY44: 20 | AZ44: 20 | BA44: 20 | BB44: 20 | BC44: 20 | BD44: 20 | BE44: 20 | BF44: 20 | BG44: 20 | BH44: 20 | BI44: 20 | BJ44: 20 | BK44: 20 | BL44: 20 | BM44: 20 | BN44: 20 | BO44: 20 | BP44: 20 | BQ44: 20 | BR44: 20 | BS44: 20 | BT44: 20 | BU44: 20 | BV44: 20 | BW44: 20 | BX44: 20 | BY44: 20 | BZ44: 20 | CA44: 20 | CB44: 20 | CC44: 20 | CD44: 20 | CE44: 20 | CF44: 20 | CG44: 20 | CH44: 20 | CI44: 20 | CJ44: 20 | CK44: 20 | CL44: 20 | CM44: 20 | CN44: 20 | CO44: 20 | CP44: 20 | CQ44: 20 | CR44: 20 | CS44: 20 | CT44: 20 | CU44: 20 | CV44: 20 | CW44: 0 | CX44: =FIB(RC[-101])+RC[-1]+R[-1]C+R[-1]C[-1] -> 470678 | CY44: =FIB(RC[-101])+RC[-1]+R[-1]C+R[-1]C[-1] -> 20709832 | CZ44: =FIB(RC[-101])+RC[-1]+R[-1]C+R[-1]C[-1] -> 601055806 | DA44: =FIB(RC[-101])+RC[-1]+R[-1]C+R[-1]C[-1] -> 13088613824 | DB44: =FIB(RC[-101])+RC[-1]+R[-1]C+R[-1]C[-1] -> 228222819318 | DC44: =FIB(RC[-101])+RC[-1]+R[-1]C+R[-1]C[-1] -> 3320138136744 | DD44: =FIB(RC[-101])+RC[-1]+R[-1]C+R[-1]C[-1] -> 41460193611902 | DE44: =FIB(RC[-101])+RC[-1]+R[-1]C+R[-1]C[-1] -> 453784726457920 | DF44: =FIB(RC[-101])+RC[-1]+R[-1]C+R[-1]C[-1] -> 4.42343919457833E+15 | DG44: =FIB(RC[-101])+RC[-1]+R[-1]C+R[-1]C[-1] -> 3.88923272466906E+16 | DH44: =FIB(RC[-101])+RC[-1]+R[-1]C+R[-1]C[-1] -> 3.1162426021894E+17 | DI44: =FIB(RC[-101])+RC[-1]+R[-1]C+R[-1]C[-1] -> 2.29492718656349E+18 | DJ44: =FIB(RC[-101])+RC[-1]+R[-1]C+R[-1]C[-1] -> 1.56460120272039E+19 | DK44: =FIB(RC[-101])+RC[-1]+R[-1]C+R[-1]C[-1] -> 9.93597928422906E+19 | DL44: =FIB(RC[-101])+RC[-1]+R[-1]C+R[-1]C[-1] -> 5.90889743044009E+20 | DM44: =FIB(RC[-101])+RC[-1]+R[-1]C+R[-1]C[-1] -> 3.30611278359145E+21 | DN44: =FIB(RC[-101])+RC[-1]+R[-1]C+R[-1]C[-1] -> 1.74756498859506E+22 | DO44: =FIB(RC[-101])+RC[-1]+R[-1]C+R[-1]C[-1] -> 8.75880809665975E+22 | DP44: =FIB(RC[-101])+RC[-1]+R[-1]C+R[-1]C[-1] -> 4.17617091686373E+23 | DQ44: =FIB(RC[-101])+RC[-1]+R[-1]C+R[-1]C[-1] -> 1.89984302575399E+24 | DR44: =FIB(RC[-101])+RC[-1]+R[-1]C+R[-1]C[-1] -> 8.26850881306308E+24 | DS44: =FIB(RC[-101])+RC[-1]+R[-1]C+R[-1]C[-1] -> 3.4511680467151E+25 | DT44: =FIB(RC[-101])+RC[-1]+R[-1]C+R[-1]C[-1] -> 1.38453191066501E+26 | DU44: =FIB(RC[-101])+RC[-1]+R[-1]C+R[-1]C[-1] -> 5.34966511397086E+26 | DV44: =FIB(RC[-101])+RC[-1]+R[-1]C+R[-1]C[-1] -> 1.9945985230857E+27 | DW44: =FIB(RC[-101])+RC[-1]+R[-1]C+R[-1]C[-1] -> 7.18862439589935E+27 | DX44: =FIB(RC[-101])+RC[-1]+R[-1]C+R[-1]C[-1] -> 2.50840697793878E+28 | DY44: =FIB(RC[-101])+RC[-1]+R[-1]C+R[-1]C[-1] -> 8.48716760534295E+28 | DZ44: =FIB(RC[-101])+RC[-1]+R[-1]C+R[-1]C[-1] -> 2.78834130016249E+29 | EA44: =FIB(RC[-101])+RC[-1]+R[-1]C+R[-1]C[-1] -> 8.90661597232104E+29 | EB44: =FIB(RC[-101])+RC[-1]+R[-1]C+R[-1]C[-1] -> 2.76943815676389E+30 | EC44: =FIB(RC[-101])+RC[-1]+R[-1]C+R[-1]C[-1] -> 8.39223841102042E+30 | ED44: =FIB(RC[-101])+RC[-1]+R[-1]C+R[-1]C[-1] -> 2.48105079628855E+31 | EE44: =FIB(RC[-101])+RC[-1]+R[-1]C+R[-1]C[-1] -> 7.16311194216091E+31 | EF44: =FIB(RC[-101])+RC[-1]+R[-1]C+R[-1]C[-1] -> 2.02156133154803E+32 | EG44: =FIB(RC[-101])+RC[-1]+R[-1]C+R[-1]C[-1] -> 5.58185354561783E+32 | EH44: =FIB(RC[-101])+RC[-1]+R[-1]C+R[-1]C[-1] -> 1.50918234163373E+33 | EI44: =FIB(RC[-101])+RC[-1]+R[-1]C+R[-1]C[-1] -> 3.99872952212948E+33 | EJ44: =FIB(RC[-101])+RC[-1]+R[-1]C+R[-1]C[-1] -> 1.03907281386499E+34 | EK44: =FIB(RC[-101])+RC[-1]+R[-1]C+R[-1]C[-1] -> 2.64985949856398E+34 | EL44: =FIB(RC[-101])+RC[-1]+R[-1]C+R[-1]C[-1] -> 6.63660216901625E+34 | EM44: =FIB(RC[-101])+RC[-1]+R[-1]C+R[-1]C[-1] -> 1.63340149558461E+35 | EN44: =FIB(RC[-101])+RC[-1]+R[-1]C+R[-1]C[-1] -> 3.95301533083092E+35 | EO44: =FIB(RC[-101])+RC[-1]+R[-1]C+R[-1]C[-1] -> 9.41246813846427E+35 | EP44: =FIB(RC[-101])+RC[-1]+R[-1]C+R[-1]C[-1] -> 2.20626089467323E+36 | EQ44: =FIB(RC[-101])+RC[-1]+R[-1]C+R[-1]C[-1] -> 5.09349574912304E+36 | ER44: =FIB(RC[-101])+RC[-1]+R[-1]C+R[-1]C[-1] -> 1.15877049218867E+37 | ES44: =FIB(RC[-101])+RC[-1]+R[-1]C+R[-1]C[-1] -> 2.59900964252692E+37 | ET44: =FIB(RC[-101])+RC[-1]+R[-1]C+R[-1]C[-1] -> 5.74969025561017E+37 | EU44: =FIB(RC[-101])+RC[-1]+R[-1]C+R[-1]C[-1] -> 1.25514904944381E+38 | EV44: =FIB(RC[-101])+RC[-1]+R[-1]C+R[-1]C[-1] -> 2.70483173685612E+38 | EW44: =FIB(RC[-101])+RC[-1]+R[-1]C+R[-1]C[-1] -> 5.75640312746378E+38 | EX44: =FIB(RC[-101])+RC[-1]+R[-1]C+R[-1]C[-1] -> 1.2102987215205E+39 | EY44: =FIB(RC[-101])+RC[-1]+R[-1]C+R[-1]C[-1] -> 2.51490602496003E+39 | EZ44: =FIB(RC[-101])+RC[-1]+R[-1]C+R[-1]C[-1] -> 5.166417366066E+39 | FA44: =FIB(RC[-101])+RC[-1]+R[-1]C+R[-1]C[-1] -> 1.04963953967954E+40 | FB44: =FIB(RC[-101])+RC[-1]+R[-1]C+R[-1]C[-1] -> 2.10965924915947E+40 | FC44: =FIB(RC[-101])+RC[-1]+R[-1]C+R[-1]C[-1] -> 4.196031179976E+40 | FD44: =FIB(RC[-101])+RC[-1]+R[-1]C+R[-1]C[-1] -> 8.26127032388409E+40 | FE44: =FIB(RC[-101])+RC[-1]+R[-1]C+R[-1]C[-1] -> 1.61049392966083E+41 | FF44: =FIB(RC[-101])+RC[-1]+R[-1]C+R[-1]C[-1] -> 3.10951793153766E+41 | FG44: =FIB(RC[-101])+RC[-1]+R[-1]C+R[-1]C[-1] -> 5.9478740282756E+41 | FH44: =FIB(RC[-101])+RC[-1]+R[-1]C+R[-1]C[-1] -> 1.12738913050049E+42 | FI44: =FIB(RC[-101])+RC[-1]+R[-1]C+R[-1]C[-1] -> 2.11803844893249E+42 | FJ44: =FIB(RC[-101])+RC[-1]+R[-1]C+R[-1]C[-1] -> 3.94495768321782E+42 | FK44: =FIB(RC[-101])+RC[-1]+R[-1]C+R[-1]C[-1] -> 7.2861184487964E+42 | FL44: =FIB(RC[-101])+RC[-1]+R[-1]C+R[-1]C[-1] -> 1.33471568975771E+43 | FM44: =FIB(RC[-101])+RC[-1]+R[-1]C+R[-1]C[-1] -> 2.42554792082141E+43 | FN44: =FIB(RC[-101])+RC[-1]+R[-1]C+R[-1]C[-1] -> 4.37367153644909E+43 | FO44: =FIB(RC[-101])+RC[-1]+R[-1]C+R[-1]C[-1] -> 7.82674614582497E+43 | FP44: =FIB(RC[-101])+RC[-1]+R[-1]C+R[-1]C[-1] -> 1.39025904540593E+44 | FQ44: =FIB(RC[-101])+RC[-1]+R[-1]C+R[-1]C[-1] -> 2.45170048035657E+44 | FR44: =FIB(RC[-101])+RC[-1]+R[-1]C+R[-1]C[-1] -> 4.29310401452395E+44 | FS44: =FIB(RC[-101])+RC[-1]+R[-1]C+R[-1]C[-1] -> 7.46586735580559E+44 | FT44: =FIB(RC[-101])+RC[-1]+R[-1]C+R[-1]C[-1] -> 1.28962687603981E+45 | FU44: =FIB(RC[-101])+RC[-1]+R[-1]C+R[-1]C[-1] -> 2.21304662347376E+45 | FV44: =FIB(RC[-101])+RC[-1]+R[-1]C+R[-1]C[-1] -> 3.77333375092523E+45 | FW44: =FIB(RC[-101])+RC[-1]+R[-1]C+R[-1]C[-1] -> 6.39339264535864E+45 | FX44: =FIB(RC[-101])+RC[-1]+R[-1]C+R[-1]C[-1] -> 1.07663948445363E+46 | FY44: =FIB(RC[-101])+RC[-1]+R[-1]C+R[-1]C[-1] -> 1.80219296307249E+46 | FZ44: =FIB(RC[-101])+RC[-1]+R[-1]C+R[-1]C[-1] -> 2.99903637708145E+46 | GA44: =FIB(RC[-101])+RC[-1]+R[-1]C+R[-1]C[-1] -> 4.9621194489629E+46 | GB44: =FIB(RC[-101])+RC[-1]+R[-1]C+R[-1]C[-1] -> 8.16416114434278E+46 | GC44: =FIB(RC[-101])+RC[-1]+R[-1]C+R[-1]C[-1] -> 1.33587849264493E+47 | GD44: =FIB(RC[-101])+RC[-1]+R[-1]C+R[-1]C[-1] -> 2.17412214673633E+47 | GE44: =FIB(RC[-101])+RC[-1]+R[-1]C+R[-1]C[-1] -> 3.51974765861489E+47 | GF44: =FIB(RC[-101])+RC[-1]+R[-1]C+R[-1]C[-1] -> 5.66887989561862E+47 | GG44: =FIB(RC[-101])+RC[-1]+R[-1]C+R[-1]C[-1] -> 9.08421133202631E+47 | GH44: =FIB(RC[-101])+RC[-1]+R[-1]C+R[-1]C[-1] -> 1.44852563674239E+48 | GI44: =FIB(RC[-101])+RC[-1]+R[-1]C+R[-1]C[-1] -> 2.29856901390691E+48 | GJ44: =FIB(RC[-101])+RC[-1]+R[-1]C+R[-1]C[-1] -> 3.63014078589798E+48 | GK44: =FIB(RC[-101])+RC[-1]+R[-1]C+R[-1]C[-1] -> 5.70643509389841E+48 | GL44: =FIB(RC[-101])+RC[-1]+R[-1]C+R[-1]C[-1] -> 8.92938500507286E+48 | GM44: =FIB(RC[-101])+RC[-1]+R[-1]C+R[-1]C[-1] -> 1.39101591401478E+49 | GN44: =FIB(RC[-101])+RC[-1]+R[-1]C+R[-1]C[-1] -> 2.15741687965232E+49 | GO44: =FIB(RC[-101])+RC[-1]+R[-1]C+R[-1]C[-1] -> 3.33168521209537E+49 | GP44: =FIB(RC[-101])+RC[-1]+R[-1]C+R[-1]C[-1] -> 5.12338797833938E+49 | GQ44: =FIB(RC[-101])+RC[-1]+R[-1]C+R[-1]C[-1] -> 7.84600224172222E+49 | GR44: =FIB(RC[-101])+RC[-1]+R[-1]C+R[-1]C[-1] -> 1.19666082515868E+50 | GS44: =FIB(RC[-101])+RC[-1]+R[-1]C+R[-1]C[-1] -> 1.81784913981855E+50
A45: 20 | B45: 20 | C45: 20 | D45: 20 | E45: 20 | F45: 20 | G45: 20 | H45: 20 | I45: 20 | J45: 20 | K45: 20 | L45: 20 | M45: 20 | N45: 20 | O45: 20 | P45: 20 | Q45: 20 | R45: 20 | S45: 20 | T45: 20 | U45: 20 | V45: 20 | W45: 20 | X45: 20 | Y45: 20 | Z45: 20 | AA45: 20 | AB45: 20 | AC45: 20 | AD45: 20 | AE45: 20 | AF45: 20 | AG45: 20 | AH45: 20 | AI45: 20 | AJ45: 20 | AK45: 20 | AL45: 20 | AM45: 20 | AN45: 20 | AO45: 20 | AP45: 20 | AQ45: 20 | AR45: 20 | AS45: 20 | AT45: 20 | AU45: 20 | AV45: 20 | AW45: 20 | AX45: 20 | AY45: 20 | AZ45: 20 | BA45: 20 | BB45: 20 | BC45: 20 | BD45: 20 | BE45: 20 | BF45: 20 | BG45: 20 | BH45: 20 | BI45: 20 | BJ45: 20 | BK45: 20 | BL45: 20 | BM45: 20 | BN45: 20 | BO45: 20 | BP45: 20 | BQ45: 20 | BR45: 20 | BS45: 20 | BT45: 20 | BU45: 20 | BV45: 20 | BW45: 20 | BX45: 20 | BY45: 20 | BZ45: 20 | CA45: 20 | CB45: 20 | CC45: 20 | CD45: 20 | CE45: 20 | CF45: 20 | CG45: 20 | CH45: 20 | CI45: 20 | CJ45: 20 | CK45: 20 | CL45: 20 | CM45: 20 | CN45: 20 | CO45: 20 | CP45: 20 | CQ45: 20 | CR45: 20 | CS45: 20 | CT45: 20 | CU45: 20 | CV45: 20 | CW45: 0 | CX45: =FIB(RC[-101])+RC[-1]+R[-1]C+R[-1]C[-1] -> 481624 | CY45: =FIB(RC[-101])+RC[-1]+R[-1]C+R[-1]C[-1] -> 21673080 | CZ45: =FIB(RC[-101])+RC[-1]+R[-1]C+R[-1]C[-1] -> 643449664 | DA45: =FIB(RC[-101])+RC[-1]+R[-1]C+R[-1]C[-1] -> 14333130240 | DB45: =FIB(RC[-101])+RC[-1]+R[-1]C+R[-1]C[-1] -> 255644574328 | DC45: =FIB(RC[-101])+RC[-1]+R[-1]C+R[-1]C[-1] -> 3804005541336 | DD45: =FIB(RC[-101])+RC[-1]+R[-1]C+R[-1]C[-1] -> 48584337300928 | DE45: =FIB(RC[-101])+RC[-1]+R[-1]C+R[-1]C[-1] -> 543829257381696 | DF45: =FIB(RC[-101])+RC[-1]+R[-1]C+R[-1]C[-1] -> 5.42105317842889E+15 | DG45: =FIB(RC[-101])+RC[-1]+R[-1]C+R[-1]C[-1] -> 4.87368196197088E+16 | DH45: =FIB(RC[-101])+RC[-1]+R[-1]C+R[-1]C[-1] -> 3.9925340708535E+17 | DI45: =FIB(RC[-101])+RC[-1]+R[-1]C+R[-1]C[-1] -> 3.00580485386779E+18 | DJ45: =FIB(RC[-101])+RC[-1]+R[-1]C+R[-1]C[-1] -> 2.09467440676352E+19 | DK45: =FIB(RC[-101])+RC[-1]+R[-1]C+R[-1]C[-1] -> 1.3595254893713E+20 | DL45: =FIB(RC[-101])+RC[-1]+R[-1]C+R[-1]C[-1] -> 8.26202084823429E+20 | DM45: =FIB(RC[-101])+RC[-1]+R[-1]C+R[-1]C[-1] -> 4.72320461145888E+21 | DN45: =FIB(RC[-101])+RC[-1]+R[-1]C+R[-1]C[-1] -> 2.55049672810009E+22 | DO45: =FIB(RC[-101])+RC[-1]+R[-1]C+R[-1]C[-1] -> 1.30568698133549E+23 | DP45: =FIB(RC[-101])+RC[-1]+R[-1]C+R[-1]C[-1] -> 6.3577387078652E+23 | DQ45: =FIB(RC[-101])+RC[-1]+R[-1]C+R[-1]C[-1] -> 2.95323398822689E+24 | DR45: =FIB(RC[-101])+RC[-1]+R[-1]C+R[-1]C[-1] -> 1.3121585827044E+25 | DS45: =FIB(RC[-101])+RC[-1]+R[-1]C+R[-1]C[-1] -> 5.5901775107258E+25 | DT45: =FIB(RC[-101])+RC[-1]+R[-1]C+R[-1]C[-1] -> 2.2886664664091E+26 | DU45: =FIB(RC[-101])+RC[-1]+R[-1]C+R[-1]C[-1] -> 9.02286349104497E+26 | DV45: =FIB(RC[-101])+RC[-1]+R[-1]C+R[-1]C[-1] -> 3.43185138358728E+27 | DW45: =FIB(RC[-101])+RC[-1]+R[-1]C+R[-1]C[-1] -> 1.26150743025723E+28 | DX45: =FIB(RC[-101])+RC[-1]+R[-1]C+R[-1]C[-1] -> 4.48877684778595E+28 | DY45: =FIB(RC[-101])+RC[-1]+R[-1]C+R[-1]C[-1] -> 1.54843514310677E+29 | DZ45: =FIB(RC[-101])+RC[-1]+R[-1]C+R[-1]C[-1] -> 5.18549320380355E+29 | EA45: =FIB(RC[-101])+RC[-1]+R[-1]C+R[-1]C[-1] -> 1.68804504762871E+30 | EB45: =FIB(RC[-101])+RC[-1]+R[-1]C+R[-1]C[-1] -> 5.3481448016247E+30 | EC45: =FIB(RC[-101])+RC[-1]+R[-1]C+R[-1]C[-1] -> 1.6509821369409E+31 | ED45: =FIB(RC[-101])+RC[-1]+R[-1]C+R[-1]C[-1] -> 4.97125677433149E+31 | EE45: =FIB(RC[-101])+RC[-1]+R[-1]C+R[-1]C[-1] -> 1.4615419512781E+32 | EF45: =FIB(RC[-101])+RC[-1]+R[-1]C+R[-1]C[-1] -> 4.19941447704222E+32 | EG45: =FIB(RC[-101])+RC[-1]+R[-1]C+R[-1]C[-1] -> 1.18028293542081E+33 | EH45: =FIB(RC[-101])+RC[-1]+R[-1]C+R[-1]C[-1] -> 3.24765063161632E+33 | EI45: =FIB(RC[-101])+RC[-1]+R[-1]C+R[-1]C[-1] -> 8.75556249537953E+33 | EJ45: =FIB(RC[-101])+RC[-1]+R[-1]C+R[-1]C[-1] -> 2.31450201561589E+34 | EK45: =FIB(RC[-101])+RC[-1]+R[-1]C+R[-1]C[-1] -> 6.00343432804487E+34 | EL45: =FIB(RC[-101])+RC[-1]+R[-1]C+R[-1]C[-1] -> 1.52898959956251E+35 | EM45: =FIB(RC[-101])+RC[-1]+R[-1]C+R[-1]C[-1] -> 3.82605131204875E+35 | EN45: =FIB(RC[-101])+RC[-1]+R[-1]C+R[-1]C[-1] -> 9.41246813846427E+35 | EO45: =FIB(RC[-101])+RC[-1]+R[-1]C+R[-1]C[-1] -> 2.27779516077595E+36 | EP45: =FIB(RC[-101])+RC[-1]+R[-1]C+R[-1]C[-1] -> 5.4253028692956E+36 | EQ45: =FIB(RC[-101])+RC[-1]+R[-1]C+R[-1]C[-1] -> 1.27250595130919E+37 | ER45: =FIB(RC[-101])+RC[-1]+R[-1]C+R[-1]C[-1] -> 2.94062601841016E+37 | ES45: =FIB(RC[-101])+RC[-1]+R[-1]C+R[-1]C[-1] -> 6.69840615312575E+37 | ET45: =FIB(RC[-101])+RC[-1]+R[-1]C+R[-1]C[-1] -> 1.50471060512628E+38 | EU45: =FIB(RC[-101])+RC[-1]+R[-1]C+R[-1]C[-1] -> 3.33482868013111E+38 | EV45: =FIB(RC[-101])+RC[-1]+R[-1]C+R[-1]C[-1] -> 7.29480946643103E+38 | EW45: =FIB(RC[-101])+RC[-1]+R[-1]C+R[-1]C[-1] -> 1.57560443307509E+39 | EX45: =FIB(RC[-101])+RC[-1]+R[-1]C+R[-1]C[-1] -> 3.36154346734198E+39 | EY45: =FIB(RC[-101])+RC[-1]+R[-1]C+R[-1]C[-1] -> 7.08674821382252E+39 | EZ45: =FIB(RC[-101])+RC[-1]+R[-1]C+R[-1]C[-1] -> 1.47680716048486E+40 | FA45: =FIB(RC[-101])+RC[-1]+R[-1]C+R[-1]C[-1] -> 3.043088436771E+40 | FB45: =FIB(RC[-101])+RC[-1]+R[-1]C+R[-1]C[-1] -> 6.20238722561002E+40 | FC45: =FIB(RC[-101])+RC[-1]+R[-1]C+R[-1]C[-1] -> 1.25080776547455E+41 | FD45: =FIB(RC[-101])+RC[-1]+R[-1]C+R[-1]C[-1] -> 2.49653791586056E+41 | FE45: =FIB(RC[-101])+RC[-1]+R[-1]C+R[-1]C[-1] -> 4.9331588779098E+41 | FF45: =FIB(RC[-101])+RC[-1]+R[-1]C+R[-1]C[-1] -> 9.65317073910829E+41 | FG45: =FIB(RC[-101])+RC[-1]+R[-1]C+R[-1]C[-1] -> 1.87105626989215E+42 | FH45: =FIB(RC[-101])+RC[-1]+R[-1]C+R[-1]C[-1] -> 3.59323280322021E+42 | FI45: =FIB(RC[-101])+RC[-1]+R[-1]C+R[-1]C[-1] -> 6.83866038265319E+42 | FJ45: =FIB(RC[-101])+RC[-1]+R[-1]C+R[-1]C[-1] -> 1.29016565148035E+43 | FK45: =FIB(RC[-101])+RC[-1]+R[-1]C+R[-1]C[-1] -> 2.41327326468177E+43 | FL45: =FIB(RC[-101])+RC[-1]+R[-1]C+R[-1]C[-1] -> 4.47660079931912E+43 | FM45: =FIB(RC[-101])+RC[-1]+R[-1]C+R[-1]C[-1] -> 8.23686440989824E+43 | FN45: =FIB(RC[-101])+RC[-1]+R[-1]C+R[-1]C[-1] -> 1.50360838671687E+44 | FO45: =FIB(RC[-101])+RC[-1]+R[-1]C+R[-1]C[-1] -> 2.72365015494428E+44 | FP45: =FIB(RC[-101])+RC[-1]+R[-1]C+R[-1]C[-1] -> 4.89658381493271E+44 | FQ45: =FIB(RC[-101])+RC[-1]+R[-1]C+R[-1]C[-1] -> 8.7385433406952E+44 | FR45: =FIB(RC[-101])+RC[-1]+R[-1]C+R[-1]C[-1] -> 1.54833478355757E+45 | FS45: =FIB(RC[-101])+RC[-1]+R[-1]C+R[-1]C[-1] -> 2.72423192059053E+45 | FT45: =FIB(RC[-101])+RC[-1]+R[-1]C+R[-1]C[-1] -> 4.7604455322109E+45 | FU45: =FIB(RC[-101])+RC[-1]+R[-1]C+R[-1]C[-1] -> 8.26311903172446E+45 | FV45: =FIB(RC[-101])+RC[-1]+R[-1]C+R[-1]C[-1] -> 1.42494994061234E+46 | FW45: =FIB(RC[-101])+RC[-1]+R[-1]C+R[-1]C[-1] -> 2.44162258024073E+46 | FX45: =FIB(RC[-101])+RC[-1]+R[-1]C+R[-1]C[-1] -> 4.15760132923023E+46 | FY45: =FIB(RC[-101])+RC[-1]+R[-1]C+R[-1]C[-1] -> 7.03643377675635E+46 | FZ45: =FIB(RC[-101])+RC[-1]+R[-1]C+R[-1]C[-1] -> 1.18376631169103E+47 | GA45: =FIB(RC[-101])+RC[-1]+R[-1]C+R[-1]C[-1] -> 1.97988189429546E+47 | GB45: =FIB(RC[-101])+RC[-1]+R[-1]C+R[-1]C[-1] -> 3.29250995362603E+47 | GC45: =FIB(RC[-101])+RC[-1]+R[-1]C+R[-1]C[-1] -> 5.44480456070524E+47 | GD45: =FIB(RC[-101])+RC[-1]+R[-1]C+R[-1]C[-1] -> 8.95480520008651E+47 | GE45: =FIB(RC[-101])+RC[-1]+R[-1]C+R[-1]C[-1] -> 1.46486750054377E+48 | GF45: =FIB(RC[-101])+RC[-1]+R[-1]C+R[-1]C[-1] -> 2.38373025596712E+48 | GG45: =FIB(RC[-101])+RC[-1]+R[-1]C+R[-1]C[-1] -> 3.85903937873162E+48 | GH45: =FIB(RC[-101])+RC[-1]+R[-1]C+R[-1]C[-1] -> 6.21598614867664E+48 | GI45: =FIB(RC[-101])+RC[-1]+R[-1]C+R[-1]C[-1] -> 9.96308079932594E+48 | GJ45: =FIB(RC[-101])+RC[-1]+R[-1]C+R[-1]C[-1] -> 1.58917905991308E+49 | GK45: =FIB(RC[-101])+RC[-1]+R[-1]C+R[-1]C[-1] -> 2.52283664789272E+49 | GL45: =FIB(RC[-101])+RC[-1]+R[-1]C+R[-1]C[-1] -> 3.98641865778985E+49 | GM45: =FIB(RC[-101])+RC[-1]+R[-1]C+R[-1]C[-1] -> 6.27037307231191E+49 | GN45: =FIB(RC[-101])+RC[-1]+R[-1]C+R[-1]C[-1] -> 9.81880586597901E+49 | GO45: =FIB(RC[-101])+RC[-1]+R[-1]C+R[-1]C[-1] -> 1.53079079577267E+50 | GP45: =FIB(RC[-101])+RC[-1]+R[-1]C+R[-1]C[-1] -> 2.37629811481615E+50 | GQ45: =FIB(RC[-101])+RC[-1]+R[-1]C+R[-1]C[-1] -> 3.67323713682231E+50 | GR45: =FIB(RC[-101])+RC[-1]+R[-1]C+R[-1]C[-1] -> 5.65449818615321E+50 | GS45: =FIB(RC[-101])+RC[-1]+R[-1]C+R[-1]C[-1] -> 8.66900815113044E+50
A46: 20 | B46: 20 | C46: 20 | D46: 20 | E46: 20 | F46: 20 | G46: 20 | H46: 20 | I46: 20 | J46: 20 | K46: 20 | L46: 20 | M46: 20 | N46: 20 | O46: 20 | P46: 20 | Q46: 20 | R46: 20 | S46: 20 | T46: 20 | U46: 20 | V46: 20 | W46: 20 | X46: 20 | Y46: 20 | Z46: 20 | AA46: 20 | AB46: 20 | AC46: 20 | AD46: 20 | AE46: 20 | AF46: 20 | AG46: 20 | AH46: 20 | AI46: 20 | AJ46: 20 | AK46: 20 | AL46: 20 | AM46: 20 | AN46: 20 | AO46: 20 | AP46: 20 | AQ46: 20 | AR46: 20 | AS46: 20 | AT46: 20 | AU46: 20 | AV46: 20 | AW46: 20 | AX46: 20 | AY46: 20 | AZ46: 20 | BA46: 20 | BB46: 20 | BC46: 20 | BD46: 20 | BE46: 20 | BF46: 20 | BG46: 20 | BH46: 20 | BI46: 20 | BJ46: 20 | BK46: 20 | BL46: 20 | BM46: 20 | BN46: 20 | BO46: 20 | BP46: 20 | BQ46: 20 | BR46: 20 | BS46: 20 | BT46: 20 | BU46: 20 | BV46: 20 | BW46: 20 | BX46: 20 | BY46: 20 | BZ46: 20 | CA46: 20 | CB46: 20 | CC46: 20 | CD46: 20 | CE46: 20 | CF46: 20 | CG46: 20 | CH46: 20 | CI46: 20 | CJ46: 20 | CK46: 20 | CL46: 20 | CM46: 20 | CN46: 20 | CO46: 20 | CP46: 20 | CQ46: 20 | CR46: 20 | CS46: 20 | CT46: 20 | CU46: 20 | CV46: 20 | CW46: 0 | CX46: =FIB(RC[-101])+RC[-1]+R[-1]C+R[-1]C[-1] -> 492570 | CY46: =FIB(RC[-101])+RC[-1]+R[-1]C+R[-1]C[-1] -> 22658220 | CZ46: =FIB(RC[-101])+RC[-1]+R[-1]C+R[-1]C[-1] -> 687791910 | DA46: =FIB(RC[-101])+RC[-1]+R[-1]C+R[-1]C[-1] -> 15664382760 | DB46: =FIB(RC[-101])+RC[-1]+R[-1]C+R[-1]C[-1] -> 285642098274 | DC46: =FIB(RC[-101])+RC[-1]+R[-1]C+R[-1]C[-1] -> 4345292224884 | DD46: =FIB(RC[-101])+RC[-1]+R[-1]C+R[-1]C[-1] -> 56733635078094 | DE46: =FIB(RC[-101])+RC[-1]+R[-1]C+R[-1]C[-1] -> 649147229771664 | DF46: =FIB(RC[-101])+RC[-1]+R[-1]C+R[-1]C[-1] -> 6.61402966559319E+15 | DG46: =FIB(RC[-101])+RC[-1]+R[-1]C+R[-1]C[-1] -> 6.07719024637418E+16 | DH46: =FIB(RC[-101])+RC[-1]+R[-1]C+R[-1]C[-1] -> 5.08762129168812E+17 | DI46: =FIB(RC[-101])+RC[-1]+R[-1]C+R[-1]C[-1] -> 3.91382039012196E+18 | DJ46: =FIB(RC[-101])+RC[-1]+R[-1]C+R[-1]C[-1] -> 2.7866369311625E+19 | DK46: =FIB(RC[-101])+RC[-1]+R[-1]C+R[-1]C[-1] -> 1.8476566231639E+20 | DL46: =FIB(RC[-101])+RC[-1]+R[-1]C+R[-1]C[-1] -> 1.14692029607695E+21 | DM46: =FIB(RC[-101])+RC[-1]+R[-1]C+R[-1]C[-1] -> 6.69632699235926E+21 | DN46: =FIB(RC[-101])+RC[-1]+R[-1]C+R[-1]C[-1] -> 3.69244988848191E+22 | DO46: =FIB(RC[-101])+RC[-1]+R[-1]C+R[-1]C[-1] -> 1.92998164299369E+23 | DP46: =FIB(RC[-101])+RC[-1]+R[-1]C+R[-1]C[-1] -> 9.59340733219438E+23 | DQ46: =FIB(RC[-101])+RC[-1]+R[-1]C+R[-1]C[-1] -> 4.54834859223284E+24 | DR46: =FIB(RC[-101])+RC[-1]+R[-1]C+R[-1]C[-1] -> 2.06231684075037E+25 | DS46: =FIB(RC[-101])+RC[-1]+R[-1]C+R[-1]C[-1] -> 8.96465293418057E+25 | DT46: =FIB(RC[-101])+RC[-1]+R[-1]C+R[-1]C[-1] -> 3.74414951089974E+26 | DU46: =FIB(RC[-101])+RC[-1]+R[-1]C+R[-1]C[-1] -> 1.50556794683538E+27 | DV46: =FIB(RC[-101])+RC[-1]+R[-1]C+R[-1]C[-1] -> 5.83970567952716E+27 | DW46: =FIB(RC[-101])+RC[-1]+R[-1]C+R[-1]C[-1] -> 2.18866313656868E+28 | DX46: =FIB(RC[-101])+RC[-1]+R[-1]C+R[-1]C[-1] -> 7.93894741461186E+28 | DY46: =FIB(RC[-101])+RC[-1]+R[-1]C+R[-1]C[-1] -> 2.79120756934655E+29 | DZ46: =FIB(RC[-101])+RC[-1]+R[-1]C+R[-1]C[-1] -> 9.52513591625687E+29 | EA46: =FIB(RC[-101])+RC[-1]+R[-1]C+R[-1]C[-1] -> 3.15910795963475E+30 | EB46: =FIB(RC[-101])+RC[-1]+R[-1]C+R[-1]C[-1] -> 1.01952978088882E+31 | EC46: =FIB(RC[-101])+RC[-1]+R[-1]C+R[-1]C[-1] -> 3.20532639799219E+31 | ED46: =FIB(RC[-101])+RC[-1]+R[-1]C+R[-1]C[-1] -> 9.82756530926458E+31 | EE46: =FIB(RC[-101])+RC[-1]+R[-1]C+R[-1]C[-1] -> 2.9414241596377E+32 | EF46: =FIB(RC[-101])+RC[-1]+R[-1]C+R[-1]C[-1] -> 8.60238058795801E+32 | EG46: =FIB(RC[-101])+RC[-1]+R[-1]C+R[-1]C[-1] -> 2.46046244192083E+33 | EH46: =FIB(RC[-101])+RC[-1]+R[-1]C+R[-1]C[-1] -> 6.88839600895796E+33 | EI46: =FIB(RC[-101])+RC[-1]+R[-1]C+R[-1]C[-1] -> 1.88916091359538E+34 | EJ46: =FIB(RC[-101])+RC[-1]+R[-1]C+R[-1]C[-1] -> 5.07921917874923E+34 | EK46: =FIB(RC[-101])+RC[-1]+R[-1]C+R[-1]C[-1] -> 1.339715552241E+35 | EL46: =FIB(RC[-101])+RC[-1]+R[-1]C+R[-1]C[-1] -> 3.46904858460799E+35 | EM46: =FIB(RC[-101])+RC[-1]+R[-1]C+R[-1]C[-1] -> 8.82408949621925E+35 | EN46: =FIB(RC[-101])+RC[-1]+R[-1]C+R[-1]C[-1] -> 2.20626089467323E+36 | EO46: =FIB(RC[-101])+RC[-1]+R[-1]C+R[-1]C[-1] -> 5.4253028692956E+36 | EP46: =FIB(RC[-101])+RC[-1]+R[-1]C+R[-1]C[-1] -> 1.31284008993671E+37 | EQ46: =FIB(RC[-101])+RC[-1]+R[-1]C+R[-1]C[-1] -> 3.12787632817546E+37 | ER46: =FIB(RC[-101])+RC[-1]+R[-1]C+R[-1]C[-1] -> 7.34100829789481E+37 | ES46: =FIB(RC[-101])+RC[-1]+R[-1]C+R[-1]C[-1] -> 1.69800404694307E+38 | ET46: =FIB(RC[-101])+RC[-1]+R[-1]C+R[-1]C[-1] -> 3.87255526738193E+38 | EU46: =FIB(RC[-101])+RC[-1]+R[-1]C+R[-1]C[-1] -> 8.71209455263932E+38 | EV46: =FIB(RC[-101])+RC[-1]+R[-1]C+R[-1]C[-1] -> 1.93417326992015E+39 | EW46: =FIB(RC[-101])+RC[-1]+R[-1]C+R[-1]C[-1] -> 4.23925864963834E+39 | EX46: =FIB(RC[-101])+RC[-1]+R[-1]C+R[-1]C[-1] -> 9.17640655005541E+39 | EY46: =FIB(RC[-101])+RC[-1]+R[-1]C+R[-1]C[-1] -> 1.96246982312199E+40 | EZ46: =FIB(RC[-101])+RC[-1]+R[-1]C+R[-1]C[-1] -> 4.1479518049891E+40 | FA46: =FIB(RC[-101])+RC[-1]+R[-1]C+R[-1]C[-1] -> 8.66784740224495E+40 | FB46: =FIB(RC[-101])+RC[-1]+R[-1]C+R[-1]C[-1] -> 1.7913323064626E+41 | FC46: =FIB(RC[-101])+RC[-1]+R[-1]C+R[-1]C[-1] -> 3.66237879449815E+41 | FD46: =FIB(RC[-101])+RC[-1]+R[-1]C+R[-1]C[-1] -> 7.40972447583326E+41 | FE46: =FIB(RC[-101])+RC[-1]+R[-1]C+R[-1]C[-1] -> 1.48394212696036E+42 | FF46: =FIB(RC[-101])+RC[-1]+R[-1]C+R[-1]C[-1] -> 2.94257508866217E+42 | FG46: =FIB(RC[-101])+RC[-1]+R[-1]C+R[-1]C[-1] -> 5.77894843246515E+42 | FH46: =FIB(RC[-101])+RC[-1]+R[-1]C+R[-1]C[-1] -> 1.12432375055775E+43 | FI46: =FIB(RC[-101])+RC[-1]+R[-1]C+R[-1]C[-1] -> 2.16751306914509E+43 | FJ46: =FIB(RC[-101])+RC[-1]+R[-1]C+R[-1]C[-1] -> 4.14154475889076E+43 | FK46: =FIB(RC[-101])+RC[-1]+R[-1]C+R[-1]C[-1] -> 7.84498367505288E+43 | FL46: =FIB(RC[-101])+RC[-1]+R[-1]C+R[-1]C[-1] -> 1.47348577390538E+44 | FM46: =FIB(RC[-101])+RC[-1]+R[-1]C+R[-1]C[-1] -> 2.74483229482711E+44 | FN46: =FIB(RC[-101])+RC[-1]+R[-1]C+R[-1]C[-1] -> 5.07212712253381E+44 | FO46: =FIB(RC[-101])+RC[-1]+R[-1]C+R[-1]C[-1] -> 9.29938566419496E+44 | FP46: =FIB(RC[-101])+RC[-1]+R[-1]C+R[-1]C[-1] -> 1.6919619634072E+45 | FQ46: =FIB(RC[-101])+RC[-1]+R[-1]C+R[-1]C[-1] -> 3.05547467896999E+45 | FR46: =FIB(RC[-101])+RC[-1]+R[-1]C+R[-1]C[-1] -> 5.47766379659708E+45 | FS46: =FIB(RC[-101])+RC[-1]+R[-1]C+R[-1]C[-1] -> 9.75023050074518E+45 | FT46: =FIB(RC[-101])+RC[-1]+R[-1]C+R[-1]C[-1] -> 1.72349079535466E+46 | FU46: =FIB(RC[-101])+RC[-1]+R[-1]C+R[-1]C[-1] -> 3.0258472517482E+46 | FV46: =FIB(RC[-101])+RC[-1]+R[-1]C+R[-1]C[-1] -> 5.27710909553299E+46 | FW46: =FIB(RC[-101])+RC[-1]+R[-1]C+R[-1]C[-1] -> 9.14368161638606E+46 | FX46: =FIB(RC[-101])+RC[-1]+R[-1]C+R[-1]C[-1] -> 1.5742905525857E+47 | FY46: =FIB(RC[-101])+RC[-1]+R[-1]C+R[-1]C[-1] -> 2.69369406318436E+47 | FZ46: =FIB(RC[-101])+RC[-1]+R[-1]C+R[-1]C[-1] -> 4.58110375255102E+47 | GA46: =FIB(RC[-101])+RC[-1]+R[-1]C+R[-1]C[-1] -> 7.74475195853752E+47 | GB46: =FIB(RC[-101])+RC[-1]+R[-1]C+R[-1]C[-1] -> 1.3017143806459E+48 | GC46: =FIB(RC[-101])+RC[-1]+R[-1]C+R[-1]C[-1] -> 2.17544583207903E+48 | GD46: =FIB(RC[-101])+RC[-1]+R[-1]C+R[-1]C[-1] -> 3.6154068081582E+48 | GE46: =FIB(RC[-101])+RC[-1]+R[-1]C+R[-1]C[-1] -> 5.97575482871063E+48 | GF46: =FIB(RC[-101])+RC[-1]+R[-1]C+R[-1]C[-1] -> 9.82435258522152E+48 | GG46: =FIB(RC[-101])+RC[-1]+R[-1]C+R[-1]C[-1] -> 1.60671222199203E+49 | GH46: =FIB(RC[-101])+RC[-1]+R[-1]C+R[-1]C[-1] -> 2.61421477473285E+49 | GI46: =FIB(RC[-101])+RC[-1]+R[-1]C+R[-1]C[-1] -> 4.23212146953311E+49 | GJ46: =FIB(RC[-101])+RC[-1]+R[-1]C+R[-1]C[-1] -> 6.81760860937879E+49 | GK46: =FIB(RC[-101])+RC[-1]+R[-1]C+R[-1]C[-1] -> 1.09296243171846E+50 | GL46: =FIB(RC[-101])+RC[-1]+R[-1]C+R[-1]C[-1] -> 1.74388796228672E+50 | GM46: =FIB(RC[-101])+RC[-1]+R[-1]C+R[-1]C[-1] -> 2.76956713529689E+50 | GN46: =FIB(RC[-101])+RC[-1]+R[-1]C+R[-1]C[-1] -> 4.37848502912599E+50 | GO46: =FIB(RC[-101])+RC[-1]+R[-1]C+R[-1]C[-1] -> 6.89115641149656E+50 | GP46: =FIB(RC[-101])+RC[-1]+R[-1]C+R[-1]C[-1] -> 1.07982453220854E+51 | GQ46: =FIB(RC[-101])+RC[-1]+R[-1]C+R[-1]C[-1] -> 1.68477805737238E+51 | GR46: =FIB(RC[-101])+RC[-1]+R[-1]C+R[-1]C[-1] -> 2.61755158966993E+51 | GS46: =FIB(RC[-101])+RC[-1]+R[-1]C+R[-1]C[-1] -> 4.0499022233983E+51
A47: 20 | B47: 20 | C47: 20 | D47: 20 | E47: 20 | F47: 20 | G47: 20 | H47: 20 | I47: 20 | J47: 20 | K47: 20 | L47: 20 | M47: 20 | N47: 20 | O47: 20 | P47: 20 | Q47: 20 | R47: 20 | S47: 20 | T47: 20 | U47: 20 | V47: 20 | W47: 20 | X47: 20 | Y47: 20 | Z47: 20 | AA47: 20 | AB47: 20 | AC47: 20 | AD47: 20 | AE47: 20 | AF47: 20 | AG47: 20 | AH47: 20 | AI47: 20 | AJ47: 20 | AK47: 20 | AL47: 20 | AM47: 20 | AN47: 20 | AO47: 20 | AP47: 20 | AQ47: 20 | AR47: 20 | AS47: 20 | AT47: 20 | AU47: 20 | AV47: 20 | AW47: 20 | AX47: 20 | AY47: 20 | AZ47: 20 | BA47: 20 | BB47: 20 | BC47: 20 | BD47: 20 | BE47: 20 | BF47: 20 | BG47: 20 | BH47: 20 | BI47: 20 | BJ47: 20 | BK47: 20 | BL47: 20 | BM47: 20 | BN47: 20 | BO47: 20 | BP47: 20 | BQ47: 20 | BR47: 20 | BS47: 20 | BT47: 20 | BU47: 20 | BV47: 20 | BW47: 20 | BX47: 20 | BY47: 20 | BZ47: 20 | CA47: 20 | CB47: 20 | CC47: 20 | CD47: 20 | CE47: 20 | CF47: 20 | CG47: 20 | CH47: 20 | CI47: 20 | CJ47: 20 | CK47: 20 | CL47: 20 | CM47: 20 | CN47: 20 | CO47: 20 | CP47: 20 | CQ47: 20 | CR47: 20 | CS47: 20 | CT47: 20 | CU47: 20 | CV47: 20 | CW47: 0 | CX47: =FIB(RC[-101])+RC[-1]+R[-1]C+R[-1]C[-1] -> 503516 | CY47: =FIB(RC[-101])+RC[-1]+R[-1]C+R[-1]C[-1] -> 23665252 | CZ47: =FIB(RC[-101])+RC[-1]+R[-1]C+R[-1]C[-1] -> 734126328 | DA47: =FIB(RC[-101])+RC[-1]+R[-1]C+R[-1]C[-1] -> 17086311944 | DB47: =FIB(RC[-101])+RC[-1]+R[-1]C+R[-1]C[-1] -> 318392803924 | DC47: =FIB(RC[-101])+RC[-1]+R[-1]C+R[-1]C[-1] -> 4949327138028 | DD47: =FIB(RC[-101])+RC[-1]+R[-1]C+R[-1]C[-1] -> 66028254451952 | DE47: =FIB(RC[-101])+RC[-1]+R[-1]C+R[-1]C[-1] -> 771909119312656 | DF47: =FIB(RC[-101])+RC[-1]+R[-1]C+R[-1]C[-1] -> 8.03508601468846E+15 | DG47: =FIB(RC[-101])+RC[-1]+R[-1]C+R[-1]C[-1] -> 7.54210181440344E+16 | DH47: =FIB(RC[-101])+RC[-1]+R[-1]C+R[-1]C[-1] -> 6.44955049776599E+17 | DI47: =FIB(RC[-101])+RC[-1]+R[-1]C+R[-1]C[-1] -> 5.06753756906738E+18 | DJ47: =FIB(RC[-101])+RC[-1]+R[-1]C+R[-1]C[-1] -> 3.68477272708143E+19 | DK47: =FIB(RC[-101])+RC[-1]+R[-1]C+R[-1]C[-1] -> 2.49479758898829E+20 | DL47: =FIB(RC[-101])+RC[-1]+R[-1]C+R[-1]C[-1] -> 1.58116571729217E+21 | DM47: =FIB(RC[-101])+RC[-1]+R[-1]C+R[-1]C[-1] -> 9.42441300572838E+21 | DN47: =FIB(RC[-101])+RC[-1]+R[-1]C+R[-1]C[-1] -> 5.30452388829067E+22 | DO47: =FIB(RC[-101])+RC[-1]+R[-1]C+R[-1]C[-1] -> 2.82967902067095E+23 | DP47: =FIB(RC[-101])+RC[-1]+R[-1]C+R[-1]C[-1] -> 1.4353067995859E+24 | DQ47: =FIB(RC[-101])+RC[-1]+R[-1]C+R[-1]C[-1] -> 6.94299612503818E+24 | DR47: =FIB(RC[-101])+RC[-1]+R[-1]C+R[-1]C[-1] -> 3.21145131247747E+25 | DS47: =FIB(RC[-101])+RC[-1]+R[-1]C+R[-1]C[-1] -> 1.42384210874084E+26 | DT47: =FIB(RC[-101])+RC[-1]+R[-1]C+R[-1]C[-1] -> 6.06445691305864E+26 | DU47: =FIB(RC[-101])+RC[-1]+R[-1]C+R[-1]C[-1] -> 2.48642858923122E+27 | DV47: =FIB(RC[-101])+RC[-1]+R[-1]C+R[-1]C[-1] -> 9.83170221559376E+27 | DW47: =FIB(RC[-101])+RC[-1]+R[-1]C+R[-1]C[-1] -> 3.75580392608077E+28 | DX47: =FIB(RC[-101])+RC[-1]+R[-1]C+R[-1]C[-1] -> 1.38834144772613E+29 | DY47: =FIB(RC[-101])+RC[-1]+R[-1]C+R[-1]C[-1] -> 4.97344375853387E+29 | DZ47: =FIB(RC[-101])+RC[-1]+R[-1]C+R[-1]C[-1] -> 1.72897872441373E+30 | EA47: =FIB(RC[-101])+RC[-1]+R[-1]C+R[-1]C[-1] -> 5.84060027567417E+30 | EB47: =FIB(RC[-101])+RC[-1]+R[-1]C+R[-1]C[-1] -> 1.91950060441971E+31 | EC47: =FIB(RC[-101])+RC[-1]+R[-1]C+R[-1]C[-1] -> 6.14435678330071E+31 | ED47: =FIB(RC[-101])+RC[-1]+R[-1]C+R[-1]C[-1] -> 1.91772484905575E+32 | EE47: =FIB(RC[-101])+RC[-1]+R[-1]C+R[-1]C[-1] -> 5.84190553961991E+32 | EF47: =FIB(RC[-101])+RC[-1]+R[-1]C+R[-1]C[-1] -> 1.73857102872156E+33 | EG47: =FIB(RC[-101])+RC[-1]+R[-1]C+R[-1]C[-1] -> 5.05927152943819E+33 | EH47: =FIB(RC[-101])+RC[-1]+R[-1]C+R[-1]C[-1] -> 1.4408129980317E+34 | EI47: =FIB(RC[-101])+RC[-1]+R[-1]C+R[-1]C[-1] -> 4.01881351252287E+34 | EJ47: =FIB(RC[-101])+RC[-1]+R[-1]C+R[-1]C[-1] -> 1.09871936048675E+35 | EK47: =FIB(RC[-101])+RC[-1]+R[-1]C+R[-1]C[-1] -> 2.94635683060267E+35 | EL47: =FIB(RC[-101])+RC[-1]+R[-1]C+R[-1]C[-1] -> 7.75512096745166E+35 | EM47: =FIB(RC[-101])+RC[-1]+R[-1]C+R[-1]C[-1] -> 2.00482590482789E+36 | EN47: =FIB(RC[-101])+RC[-1]+R[-1]C+R[-1]C[-1] -> 5.09349574912304E+36 | EO47: =FIB(RC[-101])+RC[-1]+R[-1]C+R[-1]C[-1] -> 1.27250595130919E+37 | EP47: =FIB(RC[-101])+RC[-1]+R[-1]C+R[-1]C[-1] -> 3.12787632817546E+37 | EQ47: =FIB(RC[-101])+RC[-1]+R[-1]C+R[-1]C[-1] -> 7.56859274628764E+37 | ER47: =FIB(RC[-101])+RC[-1]+R[-1]C+R[-1]C[-1] -> 1.80374773723579E+38 | ES47: =FIB(RC[-101])+RC[-1]+R[-1]C+R[-1]C[-1] -> 4.23585261396834E+38 | ET47: =FIB(RC[-101])+RC[-1]+R[-1]C+R[-1]C[-1] -> 9.80641192829334E+38 | EU47: =FIB(RC[-101])+RC[-1]+R[-1]C+R[-1]C[-1] -> 2.23910617483146E+39 | EV47: =FIB(RC[-101])+RC[-1]+R[-1]C+R[-1]C[-1] -> 5.04448890001554E+39 | EW47: =FIB(RC[-101])+RC[-1]+R[-1]C+R[-1]C[-1] -> 1.1217920819574E+40 | EX47: =FIB(RC[-101])+RC[-1]+R[-1]C+R[-1]C[-1] -> 2.46335860192678E+40 | EY47: =FIB(RC[-101])+RC[-1]+R[-1]C+R[-1]C[-1] -> 5.34346908005431E+40 | EZ47: =FIB(RC[-101])+RC[-1]+R[-1]C+R[-1]C[-1] -> 1.14538907081654E+41 | FA47: =FIB(RC[-101])+RC[-1]+R[-1]C+R[-1]C[-1] -> 2.42696899153994E+41 | FB47: =FIB(RC[-101])+RC[-1]+R[-1]C+R[-1]C[-1] -> 5.08508603822704E+41 | FC47: =FIB(RC[-101])+RC[-1]+R[-1]C+R[-1]C[-1] -> 1.05387971391878E+42 | FD47: =FIB(RC[-101])+RC[-1]+R[-1]C+R[-1]C[-1] -> 2.16109004095192E+42 | FE47: =FIB(RC[-101])+RC[-1]+R[-1]C+R[-1]C[-1] -> 4.38600461549561E+42 | FF47: =FIB(RC[-101])+RC[-1]+R[-1]C+R[-1]C[-1] -> 8.81252183111814E+42 | FG47: =FIB(RC[-101])+RC[-1]+R[-1]C+R[-1]C[-1] -> 1.75340453522455E+43 | FH47: =FIB(RC[-101])+RC[-1]+R[-1]C+R[-1]C[-1] -> 3.45562312902881E+43 | FI47: =FIB(RC[-101])+RC[-1]+R[-1]C+R[-1]C[-1] -> 6.74745994873166E+43 | FJ47: =FIB(RC[-101])+RC[-1]+R[-1]C+R[-1]C[-1] -> 1.30565177767675E+44 | FK47: =FIB(RC[-101])+RC[-1]+R[-1]C+R[-1]C[-1] -> 2.50430462107112E+44 | FL47: =FIB(RC[-101])+RC[-1]+R[-1]C+R[-1]C[-1] -> 4.76228876248178E+44 | FM47: =FIB(RC[-101])+RC[-1]+R[-1]C+R[-1]C[-1] -> 8.98060683121427E+44 | FN47: =FIB(RC[-101])+RC[-1]+R[-1]C+R[-1]C[-1] -> 1.67975662485752E+45 | FO47: =FIB(RC[-101])+RC[-1]+R[-1]C+R[-1]C[-1] -> 3.1169079035304E+45 | FP47: =FIB(RC[-101])+RC[-1]+R[-1]C+R[-1]C[-1] -> 5.73880843335709E+45 | FQ47: =FIB(RC[-101])+RC[-1]+R[-1]C+R[-1]C[-1] -> 1.04862450757343E+46 | FR47: =FIB(RC[-101])+RC[-1]+R[-1]C+R[-1]C[-1] -> 1.90193835513013E+46 | FS47: =FIB(RC[-101])+RC[-1]+R[-1]C+R[-1]C[-1] -> 3.42472778486436E+46 | FT47: =FIB(RC[-101])+RC[-1]+R[-1]C+R[-1]C[-1] -> 6.12324163029354E+46 | FU47: =FIB(RC[-101])+RC[-1]+R[-1]C+R[-1]C[-1] -> 1.08725796773964E+47 | FV47: =FIB(RC[-101])+RC[-1]+R[-1]C+R[-1]C[-1] -> 1.91755360246776E+47 | FW47: =FIB(RC[-101])+RC[-1]+R[-1]C+R[-1]C[-1] -> 3.35963267365966E+47 | FX47: =FIB(RC[-101])+RC[-1]+R[-1]C+R[-1]C[-1] -> 5.84829138788397E+47 | FY47: =FIB(RC[-101])+RC[-1]+R[-1]C+R[-1]C[-1] -> 1.0116276003654E+48 | FZ47: =FIB(RC[-101])+RC[-1]+R[-1]C+R[-1]C[-1] -> 1.73910738193894E+48 | GA47: =FIB(RC[-101])+RC[-1]+R[-1]C+R[-1]C[-1] -> 2.9716929530478E+48 | GB47: =FIB(RC[-101])+RC[-1]+R[-1]C+R[-1]C[-1] -> 5.04788252954745E+48 | GC47: =FIB(RC[-101])+RC[-1]+R[-1]C+R[-1]C[-1] -> 8.52504274227238E+48 | GD47: =FIB(RC[-101])+RC[-1]+R[-1]C+R[-1]C[-1] -> 1.43158953825096E+49 | GE47: =FIB(RC[-101])+RC[-1]+R[-1]C+R[-1]C[-1] -> 2.39070570193784E+49 | GF47: =FIB(RC[-101])+RC[-1]+R[-1]C+R[-1]C[-1] -> 3.97071644333106E+49 | GG47: =FIB(RC[-101])+RC[-1]+R[-1]C+R[-1]C[-1] -> 6.55986392384524E+49 | GH47: =FIB(RC[-101])+RC[-1]+R[-1]C+R[-1]C[-1] -> 1.07807909205701E+50 | GI47: =FIB(RC[-101])+RC[-1]+R[-1]C+R[-1]C[-1] -> 1.76271271648361E+50 | GJ47: =FIB(RC[-101])+RC[-1]+R[-1]C+R[-1]C[-1] -> 2.8676857243748E+50 | GK47: =FIB(RC[-101])+RC[-1]+R[-1]C+R[-1]C[-1] -> 4.64240901703114E+50 | GL47: =FIB(RC[-101])+RC[-1]+R[-1]C+R[-1]C[-1] -> 7.47925941103631E+50 | GM47: =FIB(RC[-101])+RC[-1]+R[-1]C+R[-1]C[-1] -> 1.19927145086199E+51 | GN47: =FIB(RC[-101])+RC[-1]+R[-1]C+R[-1]C[-1] -> 1.91407666730428E+51 | GO47: =FIB(RC[-101])+RC[-1]+R[-1]C+R[-1]C[-1] -> 3.04104081136653E+51 | GP47: =FIB(RC[-101])+RC[-1]+R[-1]C+R[-1]C[-1] -> 4.80998098472473E+51 | GQ47: =FIB(RC[-101])+RC[-1]+R[-1]C+R[-1]C[-1] -> 7.57458357430565E+51 | GR47: =FIB(RC[-101])+RC[-1]+R[-1]C+R[-1]C[-1] -> 1.1876913221348E+52 | GS47: =FIB(RC[-101])+RC[-1]+R[-1]C+R[-1]C[-1] -> 1.85443670344162E+52
A48: 20 | B48: 20 | C48: 20 | D48: 20 | E48: 20 | F48: 20 | G48: 20 | H48: 20 | I48: 20 | J48: 20 | K48: 20 | L48: 20 | M48: 20 | N48: 20 | O48: 20 | P48: 20 | Q48: 20 | R48: 20 | S48: 20 | T48: 20 | U48: 20 | V48: 20 | W48: 20 | X48: 20 | Y48: 20 | Z48: 20 | AA48: 20 | AB48: 20 | AC48: 20 | AD48: 20 | AE48: 20 | AF48: 20 | AG48: 20 | AH48: 20 | AI48: 20 | AJ48: 20 | AK48: 20 | AL48: 20 | AM48: 20 | AN48: 20 | AO48: 20 | AP48: 20 | AQ48: 20 | AR48: 20 | AS48: 20 | AT48: 20 | AU48: 20 | AV48: 20 | AW48: 20 | AX48: 20 | AY48: 20 | AZ48: 20 | BA48: 20 | BB48: 20 | BC48: 20 | BD48: 20 | BE48: 20 | BF48: 20 | BG48: 20 | BH48: 20 | BI48: 20 | BJ48: 20 | BK48: 20 | BL48: 20 | BM48: 20 | BN48: 20 | BO48: 20 | BP48: 20 | BQ48: 20 | BR48: 20 | BS48: 20 | BT48: 20 | BU48: 20 | BV48: 20 | BW48: 20 | BX48: 20 | BY48: 20 | BZ48: 20 | CA48: 20 | CB48: 20 | CC48: 20 | CD48: 20 | CE48: 20 | CF48: 20 | CG48: 20 | CH48: 20 | CI48: 20 | CJ48: 20 | CK48: 20 | CL48: 20 | CM48: 20 | CN48: 20 | CO48: 20 | CP48: 20 | CQ48: 20 | CR48: 20 | CS48: 20 | CT48: 20 | CU48: 20 | CV48: 20 | CW48: 0 | CX48: =FIB(RC[-101])+RC[-1]+R[-1]C+R[-1]C[-1] -> 514462 | CY48: =FIB(RC[-101])+RC[-1]+R[-1]C+R[-1]C[-1] -> 24694176 | CZ48: =FIB(RC[-101])+RC[-1]+R[-1]C+R[-1]C[-1] -> 782496702 | DA48: =FIB(RC[-101])+RC[-1]+R[-1]C+R[-1]C[-1] -> 18602945920 | DB48: =FIB(RC[-101])+RC[-1]+R[-1]C+R[-1]C[-1] -> 354082072734 | DC48: =FIB(RC[-101])+RC[-1]+R[-1]C+R[-1]C[-1] -> 5621802025632 | DD48: =FIB(RC[-101])+RC[-1]+R[-1]C+R[-1]C[-1] -> 76599383626558 | DE48: =FIB(RC[-101])+RC[-1]+R[-1]C+R[-1]C[-1] -> 914536757402112 | DF48: =FIB(RC[-101])+RC[-1]+R[-1]C+R[-1]C[-1] -> 9.72153189141417E+15 | DG48: =FIB(RC[-101])+RC[-1]+R[-1]C+R[-1]C[-1] -> 9.3177636050148E+16 | DH48: =FIB(RC[-101])+RC[-1]+R[-1]C+R[-1]C[-1] -> 8.13553703970792E+17 | DI48: =FIB(RC[-101])+RC[-1]+R[-1]C+R[-1]C[-1] -> 6.52604632281478E+18 | DJ48: =FIB(RC[-101])+RC[-1]+R[-1]C+R[-1]C[-1] -> 4.84413111626965E+19 | DK48: =FIB(RC[-101])+RC[-1]+R[-1]C+R[-1]C[-1] -> 3.3476879733234E+20 | DL48: =FIB(RC[-101])+RC[-1]+R[-1]C+R[-1]C[-1] -> 2.16541427352334E+21 | DM48: =FIB(RC[-101])+RC[-1]+R[-1]C+R[-1]C[-1] -> 1.31709929965439E+22 | DN48: =FIB(RC[-101])+RC[-1]+R[-1]C+R[-1]C[-1] -> 7.56406448851789E+22 | DO48: =FIB(RC[-101])+RC[-1]+R[-1]C+R[-1]C[-1] -> 4.1165378583518E+23 | DP48: =FIB(RC[-101])+RC[-1]+R[-1]C+R[-1]C[-1] -> 2.12992848748818E+24 | DQ48: =FIB(RC[-101])+RC[-1]+R[-1]C+R[-1]C[-1] -> 1.05082314121123E+25 | DR48: =FIB(RC[-101])+RC[-1]+R[-1]C+R[-1]C[-1] -> 4.95657406619252E+25 | DS48: =FIB(RC[-101])+RC[-1]+R[-1]C+R[-1]C[-1] -> 2.24064464660784E+26 | DT48: =FIB(RC[-101])+RC[-1]+R[-1]C+R[-1]C[-1] -> 9.72894366840732E+26 | DU48: =FIB(RC[-101])+RC[-1]+R[-1]C+R[-1]C[-1] -> 4.06576864737781E+27 | DV48: =FIB(RC[-101])+RC[-1]+R[-1]C+R[-1]C[-1] -> 1.63838994522028E+28 | DW48: =FIB(RC[-101])+RC[-1]+R[-1]C+R[-1]C[-1] -> 6.37736409286043E+28 | DX48: =FIB(RC[-101])+RC[-1]+R[-1]C+R[-1]C[-1] -> 2.40165824962025E+29 | DY48: =FIB(RC[-101])+RC[-1]+R[-1]C+R[-1]C[-1] -> 8.76344345588025E+29 | DZ48: =FIB(RC[-101])+RC[-1]+R[-1]C+R[-1]C[-1] -> 3.10266744585514E+30 | EA48: =FIB(RC[-101])+RC[-1]+R[-1]C+R[-1]C[-1] -> 1.0672246445943E+31 | EB48: =FIB(RC[-101])+RC[-1]+R[-1]C+R[-1]C[-1] -> 3.57078527658143E+31 | EC48: =FIB(RC[-101])+RC[-1]+R[-1]C+R[-1]C[-1] -> 1.16346426643018E+32 | ED48: =FIB(RC[-101])+RC[-1]+R[-1]C+R[-1]C[-1] -> 3.695624793816E+32 | EE48: =FIB(RC[-101])+RC[-1]+R[-1]C+R[-1]C[-1] -> 1.14552551824917E+33 | EF48: =FIB(RC[-101])+RC[-1]+R[-1]C+R[-1]C[-1] -> 3.46828710093272E+33 | EG48: =FIB(RC[-101])+RC[-1]+R[-1]C+R[-1]C[-1] -> 1.02661296590925E+34 | EH48: =FIB(RC[-101])+RC[-1]+R[-1]C+R[-1]C[-1] -> 2.97335311688476E+34 | EI48: =FIB(RC[-101])+RC[-1]+R[-1]C+R[-1]C[-1] -> 8.43297962743934E+34 | EJ48: =FIB(RC[-101])+RC[-1]+R[-1]C+R[-1]C[-1] -> 2.34389867448297E+35 | EK48: =FIB(RC[-101])+RC[-1]+R[-1]C+R[-1]C[-1] -> 6.38897486557239E+35 | EL48: =FIB(RC[-101])+RC[-1]+R[-1]C+R[-1]C[-1] -> 1.70904526636267E+36 | EM48: =FIB(RC[-101])+RC[-1]+R[-1]C+R[-1]C[-1] -> 4.48938326793573E+36 | EN48: =FIB(RC[-101])+RC[-1]+R[-1]C+R[-1]C[-1] -> 1.15877049218867E+37 | EO48: =FIB(RC[-101])+RC[-1]+R[-1]C+R[-1]C[-1] -> 2.94062601841016E+37 | EP48: =FIB(RC[-101])+RC[-1]+R[-1]C+R[-1]C[-1] -> 7.34100829789481E+37 | EQ48: =FIB(RC[-101])+RC[-1]+R[-1]C+R[-1]C[-1] -> 1.80374773723579E+38 | ER48: =FIB(RC[-101])+RC[-1]+R[-1]C+R[-1]C[-1] -> 4.36435474910035E+38 | ES48: =FIB(RC[-101])+RC[-1]+R[-1]C+R[-1]C[-1] -> 1.04039551003045E+39 | ET48: =FIB(RC[-101])+RC[-1]+R[-1]C+R[-1]C[-1] -> 2.44462196425662E+39 | EU48: =FIB(RC[-101])+RC[-1]+R[-1]C+R[-1]C[-1] -> 5.66436933191741E+39 | EV48: =FIB(RC[-101])+RC[-1]+R[-1]C+R[-1]C[-1] -> 1.29479644067644E+40 | EW48: =FIB(RC[-101])+RC[-1]+R[-1]C+R[-1]C[-1] -> 2.9210374126354E+40 | EX48: =FIB(RC[-101])+RC[-1]+R[-1]C+R[-1]C[-1] -> 6.50618809651958E+40 | EY48: =FIB(RC[-101])+RC[-1]+R[-1]C+R[-1]C[-1] -> 1.43130157785007E+41 | EZ48: =FIB(RC[-101])+RC[-1]+R[-1]C+R[-1]C[-1] -> 3.11103755667204E+41 | FA48: =FIB(RC[-101])+RC[-1]+R[-1]C+R[-1]C[-1] -> 6.68339561902852E+41 | FB48: =FIB(RC[-101])+RC[-1]+R[-1]C+R[-1]C[-1] -> 1.41954506487955E+42 | FC48: =FIB(RC[-101])+RC[-1]+R[-1]C+R[-1]C[-1] -> 2.98193338262103E+42 | FD48: =FIB(RC[-101])+RC[-1]+R[-1]C+R[-1]C[-1] -> 6.19690313749173E+42 | FE48: =FIB(RC[-101])+RC[-1]+R[-1]C+R[-1]C[-1] -> 1.27439977939393E+43 | FF48: =FIB(RC[-101])+RC[-1]+R[-1]C+R[-1]C[-1] -> 2.5942524240553E+43 | FG48: =FIB(RC[-101])+RC[-1]+R[-1]C+R[-1]C[-1] -> 5.22890914239166E+43 | FH48: =FIB(RC[-101])+RC[-1]+R[-1]C+R[-1]C[-1] -> 1.0437936806645E+44 | FI48: =FIB(RC[-101])+RC[-1]+R[-1]C+R[-1]C[-1] -> 2.06410198844055E+44 | FJ48: =FIB(RC[-101])+RC[-1]+R[-1]C+R[-1]C[-1] -> 4.04449976099047E+44 | FK48: =FIB(RC[-101])+RC[-1]+R[-1]C+R[-1]C[-1] -> 7.85445615973833E+44 | FL48: =FIB(RC[-101])+RC[-1]+R[-1]C+R[-1]C[-1] -> 1.51210495432912E+45 | FM48: =FIB(RC[-101])+RC[-1]+R[-1]C+R[-1]C[-1] -> 2.88639451369873E+45 | FN48: =FIB(RC[-101])+RC[-1]+R[-1]C+R[-1]C[-1] -> 5.46421182167767E+45 | FO48: =FIB(RC[-101])+RC[-1]+R[-1]C+R[-1]C[-1] -> 1.02608763500656E+46 | FP48: =FIB(RC[-101])+RC[-1]+R[-1]C+R[-1]C[-1] -> 1.91165926869531E+46 | FQ48: =FIB(RC[-101])+RC[-1]+R[-1]C+R[-1]C[-1] -> 3.53416461960444E+46 | FR48: =FIB(RC[-101])+RC[-1]+R[-1]C+R[-1]C[-1] -> 6.484727482308E+46 | FS48: =FIB(RC[-101])+RC[-1]+R[-1]C+R[-1]C[-1] -> 1.18113936223025E+47 | FT48: =FIB(RC[-101])+RC[-1]+R[-1]C+R[-1]C[-1] -> 2.13593630374604E+47 | FU48: =FIB(RC[-101])+RC[-1]+R[-1]C+R[-1]C[-1] -> 3.83551843451503E+47 | FV48: =FIB(RC[-101])+RC[-1]+R[-1]C+R[-1]C[-1] -> 6.84033000472243E+47 | FW48: =FIB(RC[-101])+RC[-1]+R[-1]C+R[-1]C[-1] -> 1.21175162808498E+48 | FX48: =FIB(RC[-101])+RC[-1]+R[-1]C+R[-1]C[-1] -> 2.13254403423935E+48 | FY48: =FIB(RC[-101])+RC[-1]+R[-1]C+R[-1]C[-1] -> 3.72900077339315E+48 | FZ48: =FIB(RC[-101])+RC[-1]+R[-1]C+R[-1]C[-1] -> 6.47973575569749E+48 | GA48: =FIB(RC[-101])+RC[-1]+R[-1]C+R[-1]C[-1] -> 1.11905360906842E+49 | GB48: =FIB(RC[-101])+RC[-1]+R[-1]C+R[-1]C[-1] -> 1.92101115732795E+49 | GC48: =FIB(RC[-101])+RC[-1]+R[-1]C+R[-1]C[-1] -> 3.27830368450993E+49 | GD48: =FIB(RC[-101])+RC[-1]+R[-1]C+R[-1]C[-1] -> 5.56239749698813E+49 | GE48: =FIB(RC[-101])+RC[-1]+R[-1]C+R[-1]C[-1] -> 9.38469273717693E+49 | GF48: =FIB(RC[-101])+RC[-1]+R[-1]C+R[-1]C[-1] -> 1.57461148824458E+50 | GG48: =FIB(RC[-101])+RC[-1]+R[-1]C+R[-1]C[-1] -> 2.62766952496221E+50 | GH48: =FIB(RC[-101])+RC[-1]+R[-1]C+R[-1]C[-1] -> 4.36173500940375E+50 | GI48: =FIB(RC[-101])+RC[-1]+R[-1]C+R[-1]C[-1] -> 7.20252681794437E+50 | GJ48: =FIB(RC[-101])+RC[-1]+R[-1]C+R[-1]C[-1] -> 1.18329252588028E+51 | GK48: =FIB(RC[-101])+RC[-1]+R[-1]C+R[-1]C[-1] -> 1.93430200002087E+51 | GL48: =FIB(RC[-101])+RC[-1]+R[-1]C+R[-1]C[-1] -> 3.14646884282762E+51 | GM48: =FIB(RC[-101])+RC[-1]+R[-1]C+R[-1]C[-1] -> 5.09366623479324E+51 | GN48: =FIB(RC[-101])+RC[-1]+R[-1]C+R[-1]C[-1] -> 8.20701435295951E+51 | GO48: =FIB(RC[-101])+RC[-1]+R[-1]C+R[-1]C[-1] -> 1.31621318316303E+52 | GP48: =FIB(RC[-101])+RC[-1]+R[-1]C+R[-1]C[-1] -> 2.10131536277216E+52 | GQ48: =FIB(RC[-101])+RC[-1]+R[-1]C+R[-1]C[-1] -> 3.3397718186752E+52 | GR48: =FIB(RC[-101])+RC[-1]+R[-1]C+R[-1]C[-1] -> 5.28492149824056E+52 | GS48: =FIB(RC[-101])+RC[-1]+R[-1]C+R[-1]C[-1] -> 8.32704952381697E+52
A49: 20 | B49: 20 | C49: 20 | D49: 20 | E49: 20 | F49: 20 | G49: 20 | H49: 20 | I49: 20 | J49: 20 | K49: 20 | L49: 20 | M49: 20 | N49: 20 | O49: 20 | P49: 20 | Q49: 20 | R49: 20 | S49: 20 | T49: 20 | U49: 20 | V49: 20 | W49: 20 | X49: 20 | Y49: 20 | Z49: 20 | AA49: 20 | AB49: 20 | AC49: 20 | AD49: 20 | AE49: 20 | AF49: 20 | AG49: 20 | AH49: 20 | AI49: 20 | AJ49: 20 | AK49: 20 | AL49: 20 | AM49: 20 | AN49: 20 | AO49: 20 | AP49: 20 | AQ49: 20 | AR49: 20 | AS49: 20 | AT49: 20 | AU49: 20 | AV49: 20 | AW49: 20 | AX49: 20 | AY49: 20 | AZ49: 20 | BA49: 20 | BB49: 20 | BC49: 20 | BD49: 20 | BE49: 20 | BF49: 20 | BG49: 20 | BH49: 20 | BI49: 20 | BJ49: 20 | BK49: 20 | BL49: 20 | BM49: 20 | BN49: 20 | BO49: 20 | BP49: 20 | BQ49: 20 | BR49: 20 | BS49: 20 | BT49: 20 | BU49: 20 | BV49: 20 | BW49: 20 | BX49: 20 | BY49: 20 | BZ49: 20 | CA49: 20 | CB49: 20 | CC49: 20 | CD49: 20 | CE49: 20 | CF49: 20 | CG49: 20 | CH49: 20 | CI49: 20 | CJ49: 20 | CK49: 20 | CL49: 20 | CM49: 20 | CN49: 20 | CO49: 20 | CP49: 20 | CQ49: 20 | CR49: 20 | CS49: 20 | CT49: 20 | CU49: 20 | CV49: 20 | CW49: 0 | CX49: =FIB(RC[-101])+RC[-1]+R[-1]C+R[-1]C[-1] -> 525408 | CY49: =FIB(RC[-101])+RC[-1]+R[-1]C+R[-1]C[-1] -> 25744992 | CZ49: =FIB(RC[-101])+RC[-1]+R[-1]C+R[-1]C[-1] -> 832946816 | DA49: =FIB(RC[-101])+RC[-1]+R[-1]C+R[-1]C[-1] -> 20218400384 | DB49: =FIB(RC[-101])+RC[-1]+R[-1]C+R[-1]C[-1] -> 392903429984 | DC49: =FIB(RC[-101])+RC[-1]+R[-1]C+R[-1]C[-1] -> 6368787539296 | DD49: =FIB(RC[-101])+RC[-1]+R[-1]C+R[-1]C[-1] -> 88589973202432 | DE49: =FIB(RC[-101])+RC[-1]+R[-1]C+R[-1]C[-1] -> 1.07972611424205E+15 | DF49: =FIB(RC[-101])+RC[-1]+R[-1]C+R[-1]C[-1] -> 1.17157947630693E+16 | DG49: =FIB(RC[-101])+RC[-1]+R[-1]C+R[-1]C[-1] -> 1.14614962704642E+17 | DH49: =FIB(RC[-101])+RC[-1]+R[-1]C+R[-1]C[-1] -> 1.02134630272559E+18 | DI49: =FIB(RC[-101])+RC[-1]+R[-1]C+R[-1]C[-1] -> 8.36094632951118E+18 | DJ49: =FIB(RC[-101])+RC[-1]+R[-1]C+R[-1]C[-1] -> 6.33283038150225E+19 | DK49: =FIB(RC[-101])+RC[-1]+R[-1]C+R[-1]C[-1] -> 4.46538412310059E+20 | DL49: =FIB(RC[-101])+RC[-1]+R[-1]C+R[-1]C[-1] -> 2.94672148316574E+21 | DM49: =FIB(RC[-101])+RC[-1]+R[-1]C+R[-1]C[-1] -> 1.8283128753233E+22 | DN49: =FIB(RC[-101])+RC[-1]+R[-1]C+R[-1]C[-1] -> 1.07094766634956E+23 | DO49: =FIB(RC[-101])+RC[-1]+R[-1]C+R[-1]C[-1] -> 5.94389197355315E+23 | DP49: =FIB(RC[-101])+RC[-1]+R[-1]C+R[-1]C[-1] -> 3.13597147067867E+24 | DQ49: =FIB(RC[-101])+RC[-1]+R[-1]C+R[-1]C[-1] -> 1.57741313702791E+25 | DR49: =FIB(RC[-101])+RC[-1]+R[-1]C+R[-1]C[-1] -> 7.58481034443165E+25 | DS49: =FIB(RC[-101])+RC[-1]+R[-1]C+R[-1]C[-1] -> 3.49478308767026E+26 | DT49: =FIB(RC[-101])+RC[-1]+R[-1]C+R[-1]C[-1] -> 1.54643714026854E+27 | DU49: =FIB(RC[-101])+RC[-1]+R[-1]C+R[-1]C[-1] -> 6.58510015448709E+27 | DV49: =FIB(RC[-101])+RC[-1]+R[-1]C+R[-1]C[-1] -> 2.70347682540677E+28 | DW49: =FIB(RC[-101])+RC[-1]+R[-1]C+R[-1]C[-1] -> 1.07192308634875E+29 | DX49: =FIB(RC[-101])+RC[-1]+R[-1]C+R[-1]C[-1] -> 4.11131774525504E+29 | DY49: =FIB(RC[-101])+RC[-1]+R[-1]C+R[-1]C[-1] -> 1.52764194507555E+30 | DZ49: =FIB(RC[-101])+RC[-1]+R[-1]C+R[-1]C[-1] -> 5.50665373651872E+30 | EA49: =FIB(RC[-101])+RC[-1]+R[-1]C+R[-1]C[-1] -> 1.92815676283169E+31 | EB49: =FIB(RC[-101])+RC[-1]+R[-1]C+R[-1]C[-1] -> 6.56616668400742E+31 | EC49: =FIB(RC[-101])+RC[-1]+R[-1]C+R[-1]C[-1] -> 2.17715946248907E+32 | ED49: =FIB(RC[-101])+RC[-1]+R[-1]C+R[-1]C[-1] -> 7.03624852273526E+32 | EE49: =FIB(RC[-101])+RC[-1]+R[-1]C+R[-1]C[-1] -> 2.21871284990429E+33 | EF49: =FIB(RC[-101])+RC[-1]+R[-1]C+R[-1]C[-1] -> 6.83252546908618E+33 | EG49: =FIB(RC[-101])+RC[-1]+R[-1]C+R[-1]C[-1] -> 2.05669422291114E+34 | EH49: =FIB(RC[-101])+RC[-1]+R[-1]C+R[-1]C[-1] -> 6.05666030570515E+34 | EI49: =FIB(RC[-101])+RC[-1]+R[-1]C+R[-1]C[-1] -> 1.74629930500293E+35 | EJ49: =FIB(RC[-101])+RC[-1]+R[-1]C+R[-1]C[-1] -> 4.93349594222983E+35 | EK49: =FIB(RC[-101])+RC[-1]+R[-1]C+R[-1]C[-1] -> 1.36663694822852E+36 | EL49: =FIB(RC[-101])+RC[-1]+R[-1]C+R[-1]C[-1] -> 3.71457970114843E+36 | EM49: =FIB(RC[-101])+RC[-1]+R[-1]C+R[-1]C[-1] -> 9.91300823544683E+36 | EN49: =FIB(RC[-101])+RC[-1]+R[-1]C+R[-1]C[-1] -> 2.59900964252692E+37 | EO49: =FIB(RC[-101])+RC[-1]+R[-1]C+R[-1]C[-1] -> 6.69840615312575E+37 | EP49: =FIB(RC[-101])+RC[-1]+R[-1]C+R[-1]C[-1] -> 1.69800404694307E+38 | EQ49: =FIB(RC[-101])+RC[-1]+R[-1]C+R[-1]C[-1] -> 4.23585261396834E+38 | ER49: =FIB(RC[-101])+RC[-1]+R[-1]C+R[-1]C[-1] -> 1.04039551003045E+39 | ES49: =FIB(RC[-101])+RC[-1]+R[-1]C+R[-1]C[-1] -> 2.51722649497093E+39 | ET49: =FIB(RC[-101])+RC[-1]+R[-1]C+R[-1]C[-1] -> 6.00224396925799E+39 | EU49: =FIB(RC[-101])+RC[-1]+R[-1]C+R[-1]C[-1] -> 1.4111235265432E+40 | EV49: =FIB(RC[-101])+RC[-1]+R[-1]C+R[-1]C[-1] -> 3.27235690041138E+40 | EW49: =FIB(RC[-101])+RC[-1]+R[-1]C+R[-1]C[-1] -> 7.48819075372322E+40 | EX49: =FIB(RC[-101])+RC[-1]+R[-1]C+R[-1]C[-1] -> 1.69154162628782E+41 | EY49: =FIB(RC[-101])+RC[-1]+R[-1]C+R[-1]C[-1] -> 3.77346201378984E+41 | EZ49: =FIB(RC[-101])+RC[-1]+R[-1]C+R[-1]C[-1] -> 8.31580114831195E+41 | FA49: =FIB(RC[-101])+RC[-1]+R[-1]C+R[-1]C[-1] -> 1.81102343240125E+42 | FB49: =FIB(RC[-101])+RC[-1]+R[-1]C+R[-1]C[-1] -> 3.89890805918365E+42 | FC49: =FIB(RC[-101])+RC[-1]+R[-1]C+R[-1]C[-1] -> 8.30038650668423E+42 | FD49: =FIB(RC[-101])+RC[-1]+R[-1]C+R[-1]C[-1] -> 1.7479223026797E+43 | FE49: =FIB(RC[-101])+RC[-1]+R[-1]C+R[-1]C[-1] -> 3.6420123958228E+43 | FF49: =FIB(RC[-101])+RC[-1]+R[-1]C+R[-1]C[-1] -> 7.51066459927202E+43 | FG49: =FIB(RC[-101])+RC[-1]+R[-1]C+R[-1]C[-1] -> 1.5333826165719E+44 | FH49: =FIB(RC[-101])+RC[-1]+R[-1]C+R[-1]C[-1] -> 3.10006721147557E+44 | FI49: =FIB(RC[-101])+RC[-1]+R[-1]C+R[-1]C[-1] -> 6.20796288058062E+44 | FJ49: =FIB(RC[-101])+RC[-1]+R[-1]C+R[-1]C[-1] -> 1.23165646300116E+45 | FK49: =FIB(RC[-101])+RC[-1]+R[-1]C+R[-1]C[-1] -> 2.42155205507404E+45 | FL49: =FIB(RC[-101])+RC[-1]+R[-1]C+R[-1]C[-1] -> 4.719102625377E+45 | FM49: =FIB(RC[-101])+RC[-1]+R[-1]C+R[-1]C[-1] -> 9.11760209340485E+45 | FN49: =FIB(RC[-101])+RC[-1]+R[-1]C+R[-1]C[-1] -> 1.74682084287813E+46 | FO49: =FIB(RC[-101])+RC[-1]+R[-1]C+R[-1]C[-1] -> 3.31932966005245E+46 | FP49: =FIB(RC[-101])+RC[-1]+R[-1]C+R[-1]C[-1] -> 6.25707656375432E+46 | FQ49: =FIB(RC[-101])+RC[-1]+R[-1]C+R[-1]C[-1] -> 1.17029004520541E+47 | FR49: =FIB(RC[-101])+RC[-1]+R[-1]C+R[-1]C[-1] -> 2.17217925539665E+47 | FS49: =FIB(RC[-101])+RC[-1]+R[-1]C+R[-1]C[-1] -> 4.0017913658577E+47 | FT49: =FIB(RC[-101])+RC[-1]+R[-1]C+R[-1]C[-1] -> 7.31886703183399E+47 | FU49: =FIB(RC[-101])+RC[-1]+R[-1]C+R[-1]C[-1] -> 1.32903217700951E+48 | FV49: =FIB(RC[-101])+RC[-1]+R[-1]C+R[-1]C[-1] -> 2.39661702093325E+48 | FW49: =FIB(RC[-101])+RC[-1]+R[-1]C+R[-1]C[-1] -> 4.29240164949048E+48 | FX49: =FIB(RC[-101])+RC[-1]+R[-1]C+R[-1]C[-1] -> 7.63669731181481E+48 | FY49: =FIB(RC[-101])+RC[-1]+R[-1]C+R[-1]C[-1] -> 1.34982421194473E+49 | FZ49: =FIB(RC[-101])+RC[-1]+R[-1]C+R[-1]C[-1] -> 2.37069786485379E+49 | GA49: =FIB(RC[-101])+RC[-1]+R[-1]C+R[-1]C[-1] -> 4.13772504949197E+49 | GB49: =FIB(RC[-101])+RC[-1]+R[-1]C+R[-1]C[-1] -> 7.17778981588834E+49 | GC49: =FIB(RC[-101])+RC[-1]+R[-1]C+R[-1]C[-1] -> 1.23771046577262E+50 | GD49: =FIB(RC[-101])+RC[-1]+R[-1]C+R[-1]C[-1] -> 2.12178058392243E+50 | GE49: =FIB(RC[-101])+RC[-1]+R[-1]C+R[-1]C[-1] -> 3.61648960733893E+50 | GF49: =FIB(RC[-101])+RC[-1]+R[-1]C+R[-1]C[-1] -> 6.12957036930121E+50 | GG49: =FIB(RC[-101])+RC[-1]+R[-1]C+R[-1]C[-1] -> 1.0331851382508E+51 | GH49: =FIB(RC[-101])+RC[-1]+R[-1]C+R[-1]C[-1] -> 1.7321255916874E+51 | GI49: =FIB(RC[-101])+RC[-1]+R[-1]C+R[-1]C[-1] -> 2.88855177442221E+51 | GJ49: =FIB(RC[-101])+RC[-1]+R[-1]C+R[-1]C[-1] -> 4.79209698209692E+51 | GK49: =FIB(RC[-101])+RC[-1]+R[-1]C+R[-1]C[-1] -> 7.90969150799807E+51 | GL49: =FIB(RC[-101])+RC[-1]+R[-1]C+R[-1]C[-1] -> 1.29904623508466E+52 | GM49: =FIB(RC[-101])+RC[-1]+R[-1]C+R[-1]C[-1] -> 2.12305974284674E+52 | GN49: =FIB(RC[-101])+RC[-1]+R[-1]C+R[-1]C[-1] -> 3.45312780162202E+52 | GO49: =FIB(RC[-101])+RC[-1]+R[-1]C+R[-1]C[-1] -> 5.590042420081E+52 | GP49: =FIB(RC[-101])+RC[-1]+R[-1]C+R[-1]C[-1] -> 9.00757096601619E+52 | GQ49: =FIB(RC[-101])+RC[-1]+R[-1]C+R[-1]C[-1] -> 1.44486581474635E+53 | GR49: =FIB(RC[-101])+RC[-1]+R[-1]C+R[-1]C[-1] -> 2.30733514643793E+53 | GS49: =FIB(RC[-101])+RC[-1]+R[-1]C+R[-1]C[-1] -> 3.66853224864368E+53
A50: 20 | B50: 20 | C50: 20 | D50: 20 | E50: 20 | F50: 20 | G50: 20 | H50: 20 | I50: 20 | J50: 20 | K50: 20 | L50: 20 | M50: 20 | N50: 20 | O50: 20 | P50: 20 | Q50: 20 | R50: 20 | S50: 20 | T50: 20 | U50: 20 | V50: 20 | W50: 20 | X50: 20 | Y50: 20 | Z50: 20 | AA50: 20 | AB50: 20 | AC50: 20 | AD50: 20 | AE50: 20 | AF50: 20 | AG50: 20 | AH50: 20 | AI50: 20 | AJ50: 20 | AK50: 20 | AL50: 20 | AM50: 20 | AN50: 20 | AO50: 20 | AP50: 20 | AQ50: 20 | AR50: 20 | AS50: 20 | AT50: 20 | AU50: 20 | AV50: 20 | AW50: 20 | AX50: 20 | AY50: 20 | AZ50: 20 | BA50: 20 | BB50: 20 | BC50: 20 | BD50: 20 | BE50: 20 | BF50: 20 | BG50: 20 | BH50: 20 | BI50: 20 | BJ50: 20 | BK50: 20 | BL50: 20 | BM50: 20 | BN50: 20 | BO50: 20 | BP50: 20 | BQ50: 20 | BR50: 20 | BS50: 20 | BT50: 20 | BU50: 20 | BV50: 20 | BW50: 20 | BX50: 20 | BY50: 20 | BZ50: 20 | CA50: 20 | CB50: 20 | CC50: 20 | CD50: 20 | CE50: 20 | CF50: 20 | CG50: 20 | CH50: 20 | CI50: 20 | CJ50: 20 | CK50: 20 | CL50: 20 | CM50: 20 | CN50: 20 | CO50: 20 | CP50: 20 | CQ50: 20 | CR50: 20 | CS50: 20 | CT50: 20 | CU50: 20 | CV50: 20 | CW50: 0 | CX50: =FIB(RC[-101])+RC[-1]+R[-1]C+R[-1]C[-1] -> 536354 | CY50: =FIB(RC[-101])+RC[-1]+R[-1]C+R[-1]C[-1] -> 26817700 | CZ50: =FIB(RC[-101])+RC[-1]+R[-1]C+R[-1]C[-1] -> 885520454 | DA50: =FIB(RC[-101])+RC[-1]+R[-1]C+R[-1]C[-1] -> 21936878600 | DB50: =FIB(RC[-101])+RC[-1]+R[-1]C+R[-1]C[-1] -> 435058719914 | DC50: =FIB(RC[-101])+RC[-1]+R[-1]C+R[-1]C[-1] -> 7196749700140 | DD50: =FIB(RC[-101])+RC[-1]+R[-1]C+R[-1]C[-1] -> 102155510452814 | DE50: =FIB(RC[-101])+RC[-1]+R[-1]C+R[-1]C[-1] -> 1.27047159790824E+15 | DF50: =FIB(RC[-101])+RC[-1]+R[-1]C+R[-1]C[-1] -> 1.40659924752305E+16 | DG50: =FIB(RC[-101])+RC[-1]+R[-1]C+R[-1]C[-1] -> 1.40396749942953E+17 | DH50: =FIB(RC[-101])+RC[-1]+R[-1]C+R[-1]C[-1] -> 1.2763580153732E+18 | DI50: =FIB(RC[-101])+RC[-1]+R[-1]C+R[-1]C[-1] -> 1.065865064761E+19 | DJ50: =FIB(RC[-101])+RC[-1]+R[-1]C+R[-1]C[-1] -> 8.23479007921437E+19 | DK50: =FIB(RC[-101])+RC[-1]+R[-1]C+R[-1]C[-1] -> 5.92214616917225E+20 | DL50: =FIB(RC[-101])+RC[-1]+R[-1]C+R[-1]C[-1] -> 3.98547451239302E+21 | DM50: =FIB(RC[-101])+RC[-1]+R[-1]C+R[-1]C[-1] -> 2.52153247487917E+22 | DN50: =FIB(RC[-101])+RC[-1]+R[-1]C+R[-1]C[-1] -> 1.5059322013698E+23 | DO50: =FIB(RC[-101])+RC[-1]+R[-1]C+R[-1]C[-1] -> 8.52077184127251E+23 | DP50: =FIB(RC[-101])+RC[-1]+R[-1]C+R[-1]C[-1] -> 4.58243785216124E+24 | DQ50: =FIB(RC[-101])+RC[-1]+R[-1]C+R[-1]C[-1] -> 2.3492540693119E+25 | DR50: =FIB(RC[-101])+RC[-1]+R[-1]C+R[-1]C[-1] -> 1.15114775507715E+26 | DS50: =FIB(RC[-101])+RC[-1]+R[-1]C+R[-1]C[-1] -> 5.40441187719057E+26 | DT50: =FIB(RC[-101])+RC[-1]+R[-1]C+R[-1]C[-1] -> 2.43635663675462E+27 | DU50: =FIB(RC[-101])+RC[-1]+R[-1]C+R[-1]C[-1] -> 1.05678939315103E+28 | DV50: =FIB(RC[-101])+RC[-1]+R[-1]C+R[-1]C[-1] -> 4.4187762340065E+28 | DW50: =FIB(RC[-101])+RC[-1]+R[-1]C+R[-1]C[-1] -> 1.78414839229007E+29 | DX50: =FIB(RC[-101])+RC[-1]+R[-1]C+R[-1]C[-1] -> 6.96738922389386E+29 | DY50: =FIB(RC[-101])+RC[-1]+R[-1]C+R[-1]C[-1] -> 2.63551264199044E+30 | DZ50: =FIB(RC[-101])+RC[-1]+R[-1]C+R[-1]C[-1] -> 9.66980832358472E+30 | EA50: =FIB(RC[-101])+RC[-1]+R[-1]C+R[-1]C[-1] -> 3.44580296884203E+31 | EB50: =FIB(RC[-101])+RC[-1]+R[-1]C+R[-1]C[-1] -> 1.19401264156811E+32 | EC50: =FIB(RC[-101])+RC[-1]+R[-1]C+R[-1]C[-1] -> 4.02778877245793E+32 | ED50: =FIB(RC[-101])+RC[-1]+R[-1]C+R[-1]C[-1] -> 1.32411967576823E+33 | EE50: =FIB(RC[-101])+RC[-1]+R[-1]C+R[-1]C[-1] -> 4.24645737794604E+33 | EF50: =FIB(RC[-101])+RC[-1]+R[-1]C+R[-1]C[-1] -> 1.32976956969365E+34 | EG50: =FIB(RC[-101])+RC[-1]+R[-1]C+R[-1]C[-1] -> 4.06971633951341E+34 | EH50: =FIB(RC[-101])+RC[-1]+R[-1]C+R[-1]C[-1] -> 1.21830708681297E+35 | EI50: =FIB(RC[-101])+RC[-1]+R[-1]C+R[-1]C[-1] -> 3.57027242238641E+35 | EJ50: =FIB(RC[-101])+RC[-1]+R[-1]C+R[-1]C[-1] -> 1.02500676696192E+36 | EK50: =FIB(RC[-101])+RC[-1]+R[-1]C+R[-1]C[-1] -> 2.88499330941342E+36 | EL50: =FIB(RC[-101])+RC[-1]+R[-1]C+R[-1]C[-1] -> 7.96620995879036E+36 | EM50: =FIB(RC[-101])+RC[-1]+R[-1]C+R[-1]C[-1] -> 2.15937978953856E+37 | EN50: =FIB(RC[-101])+RC[-1]+R[-1]C+R[-1]C[-1] -> 5.74969025561017E+37 | EO50: =FIB(RC[-101])+RC[-1]+R[-1]C+R[-1]C[-1] -> 1.50471060512628E+38 | EP50: =FIB(RC[-101])+RC[-1]+R[-1]C+R[-1]C[-1] -> 3.87255526738193E+38 | EQ50: =FIB(RC[-101])+RC[-1]+R[-1]C+R[-1]C[-1] -> 9.80641192829334E+38 | ER50: =FIB(RC[-101])+RC[-1]+R[-1]C+R[-1]C[-1] -> 2.44462196425662E+39 | ES50: =FIB(RC[-101])+RC[-1]+R[-1]C+R[-1]C[-1] -> 6.00224396925799E+39 | ET50: =FIB(RC[-101])+RC[-1]+R[-1]C+R[-1]C[-1] -> 1.45217144334869E+40 | EU50: =FIB(RC[-101])+RC[-1]+R[-1]C+R[-1]C[-1] -> 3.46351936681769E+40 | EV50: =FIB(RC[-101])+RC[-1]+R[-1]C+R[-1]C[-1] -> 8.14699979377228E+40 | EW50: =FIB(RC[-101])+RC[-1]+R[-1]C+R[-1]C[-1] -> 1.89075474479069E+41 | EX50: =FIB(RC[-101])+RC[-1]+R[-1]C+R[-1]C[-1] -> 4.33111544645083E+41 | EY50: =FIB(RC[-101])+RC[-1]+R[-1]C+R[-1]C[-1] -> 9.79611908652849E+41 | EZ50: =FIB(RC[-101])+RC[-1]+R[-1]C+R[-1]C[-1] -> 2.18853822486303E+42 | FA50: =FIB(RC[-101])+RC[-1]+R[-1]C+R[-1]C[-1] -> 4.83114177209547E+42 | FB50: =FIB(RC[-101])+RC[-1]+R[-1]C+R[-1]C[-1] -> 1.05410732636804E+43 | FC50: =FIB(RC[-101])+RC[-1]+R[-1]C+R[-1]C[-1] -> 2.27403678295483E+43 | FD50: =FIB(RC[-101])+RC[-1]+R[-1]C+R[-1]C[-1] -> 4.85199773630295E+43 | FE50: =FIB(RC[-101])+RC[-1]+R[-1]C+R[-1]C[-1] -> 1.02419324348054E+44 | FF50: =FIB(RC[-101])+RC[-1]+R[-1]C+R[-1]C[-1] -> 2.13946094299003E+44 | FG50: =FIB(RC[-101])+RC[-1]+R[-1]C+R[-1]C[-1] -> 4.42391001948913E+44 | FH50: =FIB(RC[-101])+RC[-1]+R[-1]C+R[-1]C[-1] -> 9.05735984753659E+44 | FI50: =FIB(RC[-101])+RC[-1]+R[-1]C+R[-1]C[-1] -> 1.83653899395928E+45 | FJ50: =FIB(RC[-101])+RC[-1]+R[-1]C+R[-1]C[-1] -> 3.6889917450185E+45 | FK50: =FIB(RC[-101])+RC[-1]+R[-1]C+R[-1]C[-1] -> 7.34220026309371E+45 | FL50: =FIB(RC[-101])+RC[-1]+R[-1]C+R[-1]C[-1] -> 1.44828549435447E+46 | FM50: =FIB(RC[-101])+RC[-1]+R[-1]C+R[-1]C[-1] -> 2.83195596623266E+46 | FN50: =FIB(RC[-101])+RC[-1]+R[-1]C+R[-1]C[-1] -> 5.49053701845127E+46 | FO50: =FIB(RC[-101])+RC[-1]+R[-1]C+R[-1]C[-1] -> 1.05566875213818E+47 | FP50: =FIB(RC[-101])+RC[-1]+R[-1]C+R[-1]C[-1] -> 2.01330937451886E+47 | FQ50: =FIB(RC[-101])+RC[-1]+R[-1]C+R[-1]C[-1] -> 3.8093070760997E+47 | FR50: =FIB(RC[-101])+RC[-1]+R[-1]C+R[-1]C[-1] -> 7.15177637670176E+47 | FS50: =FIB(RC[-101])+RC[-1]+R[-1]C+R[-1]C[-1] -> 1.33257469979561E+48 | FT50: =FIB(RC[-101])+RC[-1]+R[-1]C+R[-1]C[-1] -> 2.46464053956478E+48 | FU50: =FIB(RC[-101])+RC[-1]+R[-1]C+R[-1]C[-1] -> 4.52555941975769E+48 | FV50: =FIB(RC[-101])+RC[-1]+R[-1]C+R[-1]C[-1] -> 8.25120861770044E+48 | FW50: =FIB(RC[-101])+RC[-1]+R[-1]C+R[-1]C[-1] -> 1.49402272881242E+49 | FX50: =FIB(RC[-101])+RC[-1]+R[-1]C+R[-1]C[-1] -> 2.68693262494295E+49 | FY50: =FIB(RC[-101])+RC[-1]+R[-1]C+R[-1]C[-1] -> 4.80042656806916E+49 | FZ50: =FIB(RC[-101])+RC[-1]+R[-1]C+R[-1]C[-1] -> 8.52094864486769E+49 | GA50: =FIB(RC[-101])+RC[-1]+R[-1]C+R[-1]C[-1] -> 1.50293715592134E+50 | GB50: =FIB(RC[-101])+RC[-1]+R[-1]C+R[-1]C[-1] -> 2.63448864245937E+50 | GC50: =FIB(RC[-101])+RC[-1]+R[-1]C+R[-1]C[-1] -> 4.58997808982083E+50 | GD50: =FIB(RC[-101])+RC[-1]+R[-1]C+R[-1]C[-1] -> 7.94946913951588E+50 | GE50: =FIB(RC[-101])+RC[-1]+R[-1]C+R[-1]C[-1] -> 1.36877393307772E+51 | GF50: =FIB(RC[-101])+RC[-1]+R[-1]C+R[-1]C[-1] -> 2.34337993074174E+51 | GG50: =FIB(RC[-101])+RC[-1]+R[-1]C+R[-1]C[-1] -> 3.98952210592266E+51 | GH50: =FIB(RC[-101])+RC[-1]+R[-1]C+R[-1]C[-1] -> 6.75483283586086E+51 | GI50: =FIB(RC[-101])+RC[-1]+R[-1]C+R[-1]C[-1] -> 1.13755102019705E+52 | GJ50: =FIB(RC[-101])+RC[-1]+R[-1]C+R[-1]C[-1] -> 1.90561589584896E+52 | GK50: =FIB(RC[-101])+RC[-1]+R[-1]C+R[-1]C[-1] -> 3.17579474485846E+52 | GL50: =FIB(RC[-101])+RC[-1]+R[-1]C+R[-1]C[-1] -> 5.26581013074292E+52 | GM50: =FIB(RC[-101])+RC[-1]+R[-1]C+R[-1]C[-1] -> 8.68791610867432E+52 | GN50: =FIB(RC[-101])+RC[-1]+R[-1]C+R[-1]C[-1] -> 1.42641036531431E+53 | GO50: =FIB(RC[-101])+RC[-1]+R[-1]C+R[-1]C[-1] -> 2.33072738748461E+53 | GP50: =FIB(RC[-101])+RC[-1]+R[-1]C+R[-1]C[-1] -> 3.79048872609433E+53 | GQ50: =FIB(RC[-101])+RC[-1]+R[-1]C+R[-1]C[-1] -> 6.1361116374423E+53 | GR50: =FIB(RC[-101])+RC[-1]+R[-1]C+R[-1]C[-1] -> 9.88831259862658E+53 | GS50: =FIB(RC[-101])+RC[-1]+R[-1]C+R[-1]C[-1] -> 1.58641799937082E+54
A51: 20 | B51: 20 | C51: 20 | D51: 20 | E51: 20 | F51: 20 | G51: 20 | H51: 20 | I51: 20 | J51: 20 | K51: 20 | L51: 20 | M51: 20 | N51: 20 | O51: 20 | P51: 20 | Q51: 20 | R51: 20 | S51: 20 | T51: 20 | U51: 20 | V51: 20 | W51: 20 | X51: 20 | Y51: 20 | Z51: 20 | AA51: 20 | AB51: 20 | AC51: 20 | AD51: 20 | AE51: 20 | AF51: 20 | AG51: 20 | AH51: 20 | AI51: 20 | AJ51: 20 | AK51: 20 | AL51: 20 | AM51: 20 | AN51: 20 | AO51: 20 | AP51: 20 | AQ51: 20 | AR51: 20 | AS51: 20 | AT51: 20 | AU51: 20 | AV51: 20 | AW51: 20 | AX51: 20 | AY51: 20 | AZ51: 20 | BA51: 20 | BB51: 20 | BC51: 20 | BD51: 20 | BE51: 20 | BF51: 20 | BG51: 20 | BH51: 20 | BI51: 20 | BJ51: 20 | BK51: 20 | BL51: 20 | BM51: 20 | BN51: 20 | BO51: 20 | BP51: 20 | BQ51: 20 | BR51: 20 | BS51: 20 | BT51: 20 | BU51: 20 | BV51: 20 | BW51: 20 | BX51: 20 | BY51: 20 | BZ51: 20 | CA51: 20 | CB51: 20 | CC51: 20 | CD51: 20 | CE51: 20 | CF51: 20 | CG51: 20 | CH51: 20 | CI51: 20 | CJ51: 20 | CK51: 20 | CL51: 20 | CM51: 20 | CN51: 20 | CO51: 20 | CP51: 20 | CQ51: 20 | CR51: 20 | CS51: 20 | CT51: 20 | CU51: 20 | CV51: 20 | CW51: 0 | CX51: =FIB(RC[-101])+RC[-1]+R[-1]C+R[-1]C[-1] -> 547300 | CY51: =FIB(RC[-101])+RC[-1]+R[-1]C+R[-1]C[-1] -> 27912300 | CZ51: =FIB(RC[-101])+RC[-1]+R[-1]C+R[-1]C[-1] -> 940261400 | DA51: =FIB(RC[-101])+RC[-1]+R[-1]C+R[-1]C[-1] -> 23762671400 | DB51: =FIB(RC[-101])+RC[-1]+R[-1]C+R[-1]C[-1] -> 480758280860 | DC51: =FIB(RC[-101])+RC[-1]+R[-1]C+R[-1]C[-1] -> 8112566711860 | DD51: =FIB(RC[-101])+RC[-1]+R[-1]C+R[-1]C[-1] -> 117464826875760 | DE51: =FIB(RC[-101])+RC[-1]+R[-1]C+R[-1]C[-1] -> 1.49009193524776E+15 | DF51: =FIB(RC[-101])+RC[-1]+R[-1]C+R[-1]C[-1] -> 1.68265560083975E+16 | DG51: =FIB(RC[-101])+RC[-1]+R[-1]C+R[-1]C[-1] -> 1.71289298426592E+17 | DH51: =FIB(RC[-101])+RC[-1]+R[-1]C+R[-1]C[-1] -> 1.58804406374276E+18 | DI51: =FIB(RC[-101])+RC[-1]+R[-1]C+R[-1]C[-1] -> 1.3523052726726E+19 | DJ51: =FIB(RC[-101])+RC[-1]+R[-1]C+R[-1]C[-1] -> 1.0652960416648E+20 | DK51: =FIB(RC[-101])+RC[-1]+R[-1]C+R[-1]C[-1] -> 7.81092121875849E+20 | DL51: =FIB(RC[-101])+RC[-1]+R[-1]C+R[-1]C[-1] -> 5.35878125118609E+21 | DM51: =FIB(RC[-101])+RC[-1]+R[-1]C+R[-1]C[-1] -> 3.45595805123708E+22 | DN51: =FIB(RC[-101])+RC[-1]+R[-1]C+R[-1]C[-1] -> 2.10368125398143E+23 | DO51: =FIB(RC[-101])+RC[-1]+R[-1]C+R[-1]C[-1] -> 1.21303852966237E+24 | DP51: =FIB(RC[-101])+RC[-1]+R[-1]C+R[-1]C[-1] -> 6.64755356595087E+24 | DQ51: =FIB(RC[-101])+RC[-1]+R[-1]C+R[-1]C[-1] -> 3.47225321112311E+25 | DR51: =FIB(RC[-101])+RC[-1]+R[-1]C+R[-1]C[-1] -> 1.73329848312065E+26 | DS51: =FIB(RC[-101])+RC[-1]+R[-1]C+R[-1]C[-1] -> 8.28885811538836E+26 | DT51: =FIB(RC[-101])+RC[-1]+R[-1]C+R[-1]C[-1] -> 3.80568363601252E+27 | DU51: =FIB(RC[-101])+RC[-1]+R[-1]C+R[-1]C[-1] -> 1.68099342042774E+28 | DV51: =FIB(RC[-101])+RC[-1]+R[-1]C+R[-1]C[-1] -> 7.15655904758527E+28 | DW51: =FIB(RC[-101])+RC[-1]+R[-1]C+R[-1]C[-1] -> 2.94168192044925E+29 | DX51: =FIB(RC[-101])+RC[-1]+R[-1]C+R[-1]C[-1] -> 1.16932195366332E+30 | DY51: =FIB(RC[-101])+RC[-1]+R[-1]C+R[-1]C[-1] -> 4.50157351804315E+30 | DZ51: =FIB(RC[-101])+RC[-1]+R[-1]C+R[-1]C[-1] -> 1.68068944836183E+31 | EA51: =FIB(RC[-101])+RC[-1]+R[-1]C+R[-1]C[-1] -> 6.09347324956234E+31 | EB51: =FIB(RC[-101])+RC[-1]+R[-1]C+R[-1]C[-1] -> 2.14794026340855E+32 | EC51: =FIB(RC[-101])+RC[-1]+R[-1]C+R[-1]C[-1] -> 7.36974167743459E+32 | ED51: =FIB(RC[-101])+RC[-1]+R[-1]C+R[-1]C[-1] -> 2.46387272075748E+33 | EE51: =FIB(RC[-101])+RC[-1]+R[-1]C+R[-1]C[-1] -> 8.03444977447175E+33 | EF51: =FIB(RC[-101])+RC[-1]+R[-1]C+R[-1]C[-1] -> 2.55786028493543E+34 | EG51: =FIB(RC[-101])+RC[-1]+R[-1]C+R[-1]C[-1] -> 7.95734619414249E+34 | EH51: =FIB(RC[-101])+RC[-1]+R[-1]C+R[-1]C[-1] -> 2.42101334017856E+35 | EI51: =FIB(RC[-101])+RC[-1]+R[-1]C+R[-1]C[-1] -> 7.20959284937794E+35 | EJ51: =FIB(RC[-101])+RC[-1]+R[-1]C+R[-1]C[-1] -> 2.10299329413835E+36 | EK51: =FIB(RC[-101])+RC[-1]+R[-1]C+R[-1]C[-1] -> 6.01299337051368E+36 | EL51: =FIB(RC[-101])+RC[-1]+R[-1]C+R[-1]C[-1] -> 1.68641966387175E+37 | EM51: =FIB(RC[-101])+RC[-1]+R[-1]C+R[-1]C[-1] -> 4.64242044928935E+37 | EN51: =FIB(RC[-101])+RC[-1]+R[-1]C+R[-1]C[-1] -> 1.25514904944381E+38 | EO51: =FIB(RC[-101])+RC[-1]+R[-1]C+R[-1]C[-1] -> 3.33482868013111E+38 | EP51: =FIB(RC[-101])+RC[-1]+R[-1]C+R[-1]C[-1] -> 8.71209455263932E+38 | EQ51: =FIB(RC[-101])+RC[-1]+R[-1]C+R[-1]C[-1] -> 2.23910617483146E+39 | ER51: =FIB(RC[-101])+RC[-1]+R[-1]C+R[-1]C[-1] -> 5.66436933191741E+39 | ES51: =FIB(RC[-101])+RC[-1]+R[-1]C+R[-1]C[-1] -> 1.4111235265432E+40 | ET51: =FIB(RC[-101])+RC[-1]+R[-1]C+R[-1]C[-1] -> 3.46351936681769E+40 | EU51: =FIB(RC[-101])+RC[-1]+R[-1]C+R[-1]C[-1] -> 8.37921017698408E+40 | EV51: =FIB(RC[-101])+RC[-1]+R[-1]C+R[-1]C[-1] -> 1.9989729337574E+41 | EW51: =FIB(RC[-101])+RC[-1]+R[-1]C+R[-1]C[-1] -> 4.70442765792532E+41 | EX51: =FIB(RC[-101])+RC[-1]+R[-1]C+R[-1]C[-1] -> 1.09262978491668E+42 | EY51: =FIB(RC[-101])+RC[-1]+R[-1]C+R[-1]C[-1] -> 2.50535323821462E+42 | EZ51: =FIB(RC[-101])+RC[-1]+R[-1]C+R[-1]C[-1] -> 5.67350337173049E+42 | FA51: =FIB(RC[-101])+RC[-1]+R[-1]C+R[-1]C[-1] -> 1.2693183368689E+43 | FB51: =FIB(RC[-101])+RC[-1]+R[-1]C+R[-1]C[-1] -> 2.80653984044648E+43 | FC51: =FIB(RC[-101])+RC[-1]+R[-1]C+R[-1]C[-1] -> 6.13468394976935E+43 | FD51: =FIB(RC[-101])+RC[-1]+R[-1]C+R[-1]C[-1] -> 1.32607184690271E+44 | FE51: =FIB(RC[-101])+RC[-1]+R[-1]C+R[-1]C[-1] -> 2.83546486401355E+44 | FF51: =FIB(RC[-101])+RC[-1]+R[-1]C+R[-1]C[-1] -> 5.99911905048412E+44 | FG51: =FIB(RC[-101])+RC[-1]+R[-1]C+R[-1]C[-1] -> 1.25624900129633E+45 | FH51: =FIB(RC[-101])+RC[-1]+R[-1]C+R[-1]C[-1] -> 2.6043759879989E+45 | FI51: =FIB(RC[-101])+RC[-1]+R[-1]C+R[-1]C[-1] -> 5.34665096671184E+45 | FJ51: =FIB(RC[-101])+RC[-1]+R[-1]C+R[-1]C[-1] -> 1.08721817056896E+46 | FK51: =FIB(RC[-101])+RC[-1]+R[-1]C+R[-1]C[-1] -> 2.19033737138018E+46 | FL51: =FIB(RC[-101])+RC[-1]+R[-1]C+R[-1]C[-1] -> 4.37284289204403E+46 | FM51: =FIB(RC[-101])+RC[-1]+R[-1]C+R[-1]C[-1] -> 8.65308435263116E+46 | FN51: =FIB(RC[-101])+RC[-1]+R[-1]C+R[-1]C[-1] -> 1.69755773373151E+47 | FO51: =FIB(RC[-101])+RC[-1]+R[-1]C+R[-1]C[-1] -> 3.30228018771482E+47 | FP51: =FIB(RC[-101])+RC[-1]+R[-1]C+R[-1]C[-1] -> 6.37125831437187E+47 | FQ51: =FIB(RC[-101])+RC[-1]+R[-1]C+R[-1]C[-1] -> 1.21938747649904E+48 | FR51: =FIB(RC[-101])+RC[-1]+R[-1]C+R[-1]C[-1] -> 2.31549582177919E+48 | FS51: =FIB(RC[-101])+RC[-1]+R[-1]C+R[-1]C[-1] -> 4.36324815924498E+48 | FT51: =FIB(RC[-101])+RC[-1]+R[-1]C+R[-1]C[-1] -> 8.16046339860537E+48 | FU51: =FIB(RC[-101])+RC[-1]+R[-1]C+R[-1]C[-1] -> 1.51506633579278E+49 | FV51: =FIB(RC[-101])+RC[-1]+R[-1]C+R[-1]C[-1] -> 2.7927431395386E+49 | FW51: =FIB(RC[-101])+RC[-1]+R[-1]C+R[-1]C[-1] -> 5.11188673012106E+49 | FX51: =FIB(RC[-101])+RC[-1]+R[-1]C+R[-1]C[-1] -> 9.29284208387642E+49 | FY51: =FIB(RC[-101])+RC[-1]+R[-1]C+R[-1]C[-1] -> 1.67802012768885E+50 | FZ51: =FIB(RC[-101])+RC[-1]+R[-1]C+R[-1]C[-1] -> 3.01015764898254E+50 | GA51: =FIB(RC[-101])+RC[-1]+R[-1]C+R[-1]C[-1] -> 5.36518966939065E+50 | GB51: =FIB(RC[-101])+RC[-1]+R[-1]C+R[-1]C[-1] -> 9.50261546777137E+50 | GC51: =FIB(RC[-101])+RC[-1]+R[-1]C+R[-1]C[-1] -> 1.67270822000516E+51 | GD51: =FIB(RC[-101])+RC[-1]+R[-1]C+R[-1]C[-1] -> 2.92665294293883E+51 | GE51: =FIB(RC[-101])+RC[-1]+R[-1]C+R[-1]C[-1] -> 5.09037378996814E+51 | GF51: =FIB(RC[-101])+RC[-1]+R[-1]C+R[-1]C[-1] -> 8.8025276537876E+51 | GG51: =FIB(RC[-101])+RC[-1]+R[-1]C+R[-1]C[-1] -> 1.5135429690452E+52 | GH51: =FIB(RC[-101])+RC[-1]+R[-1]C+R[-1]C[-1] -> 2.58797846322355E+52 | GI51: =FIB(RC[-101])+RC[-1]+R[-1]C+R[-1]C[-1] -> 4.40101276700668E+52 | GJ51: =FIB(RC[-101])+RC[-1]+R[-1]C+R[-1]C[-1] -> 7.44417968305269E+52 | GK51: =FIB(RC[-101])+RC[-1]+R[-1]C+R[-1]C[-1] -> 1.25255903237601E+53 | GL51: =FIB(RC[-101])+RC[-1]+R[-1]C+R[-1]C[-1] -> 2.09671951993615E+53 | GM51: =FIB(RC[-101])+RC[-1]+R[-1]C+R[-1]C[-1] -> 3.49209214387787E+53 | GN51: =FIB(RC[-101])+RC[-1]+R[-1]C+R[-1]C[-1] -> 5.78729412005961E+53 | GO51: =FIB(RC[-101])+RC[-1]+R[-1]C+R[-1]C[-1] -> 9.54443187285853E+53 | GP51: =FIB(RC[-101])+RC[-1]+R[-1]C+R[-1]C[-1] -> 1.56656479864375E+54 | GQ51: =FIB(RC[-101])+RC[-1]+R[-1]C+R[-1]C[-1] -> 2.55922483499741E+54 | GR51: =FIB(RC[-101])+RC[-1]+R[-1]C+R[-1]C[-1] -> 4.1616672586043E+54 | GS51: =FIB(RC[-101])+RC[-1]+R[-1]C+R[-1]C[-1] -> 6.73691651783778E+54
A52: 20 | B52: 20 | C52: 20 | D52: 20 | E52: 20 | F52: 20 | G52: 20 | H52: 20 | I52: 20 | J52: 20 | K52: 20 | L52: 20 | M52: 20 | N52: 20 | O52: 20 | P52: 20 | Q52: 20 | R52: 20 | S52: 20 | T52: 20 | U52: 20 | V52: 20 | W52: 20 | X52: 20 | Y52: 20 | Z52: 20 | AA52: 20 | AB52: 20 | AC52: 20 | AD52: 20 | AE52: 20 | AF52: 20 | AG52: 20 | AH52: 20 | AI52: 20 | AJ52: 20 | AK52: 20 | AL52: 20 | AM52: 20 | AN52: 20 | AO52: 20 | AP52: 20 | AQ52: 20 | AR52: 20 | AS52: 20 | AT52: 20 | AU52: 20 | AV52: 20 | AW52: 20 | AX52: 20 | AY52: 20 | AZ52: 20 | BA52: 20 | BB52: 20 | BC52: 20 | BD52: 20 | BE52: 20 | BF52: 20 | BG52: 20 | BH52: 20 | BI52: 20 | BJ52: 20 | BK52: 20 | BL52: 20 | BM52: 20 | BN52: 20 | BO52: 20 | BP52: 20 | BQ52: 20 | BR52: 20 | BS52: 20 | BT52: 20 | BU52: 20 | BV52: 20 | BW52: 20 | BX52: 20 | BY52: 20 | BZ52: 20 | CA52: 20 | CB52: 20 | CC52: 20 | CD52: 20 | CE52: 20 | CF52: 20 | CG52: 20 | CH52: 20 | CI52: 20 | CJ52: 20 | CK52: 20 | CL52: 20 | CM52: 20 | CN52: 20 | CO52: 20 | CP52: 20 | CQ52: 20 | CR52: 20 | CS52: 20 | CT52: 20 | CU52: 20 | CV52: 20 | CW52: 0 | CX52: =FIB(RC[-101])+RC[-1]+R[-1]C+R[-1]C[-1] -> 558246 | CY52: =FIB(RC[-101])+RC[-1]+R[-1]C+R[-1]C[-1] -> 29028792 | CZ52: =FIB(RC[-101])+RC[-1]+R[-1]C+R[-1]C[-1] -> 997213438 | DA52: =FIB(RC[-101])+RC[-1]+R[-1]C+R[-1]C[-1] -> 25700157184 | DB52: =FIB(RC[-101])+RC[-1]+R[-1]C+R[-1]C[-1] -> 530221120390 | DC52: =FIB(RC[-101])+RC[-1]+R[-1]C+R[-1]C[-1] -> 9123546124056 | DD52: =FIB(RC[-101])+RC[-1]+R[-1]C+R[-1]C[-1] -> 134700939722622 | DE52: =FIB(RC[-101])+RC[-1]+R[-1]C+R[-1]C[-1] -> 1.74225770185709E+15 | DF52: =FIB(RC[-101])+RC[-1]+R[-1]C+R[-1]C[-1] -> 2.00589056455133E+16 | DG52: =FIB(RC[-101])+RC[-1]+R[-1]C+R[-1]C[-1] -> 2.08174760080514E+17 | DH52: =FIB(RC[-101])+RC[-1]+R[-1]C+R[-1]C[-1] -> 1.96750812224987E+18 | DI52: =FIB(RC[-101])+RC[-1]+R[-1]C+R[-1]C[-1] -> 1.70786049127186E+19 | DJ52: =FIB(RC[-101])+RC[-1]+R[-1]C+R[-1]C[-1] -> 1.37131261805924E+20 | DK52: =FIB(RC[-101])+RC[-1]+R[-1]C+R[-1]C[-1] -> 1.02475298784825E+21 | DL52: =FIB(RC[-101])+RC[-1]+R[-1]C+R[-1]C[-1] -> 7.1646263609102E+21 | DM52: =FIB(RC[-101])+RC[-1]+R[-1]C+R[-1]C[-1] -> 4.70829881244671E+22 | DN52: =FIB(RC[-101])+RC[-1]+R[-1]C+R[-1]C[-1] -> 2.92010694034981E+23 | DO52: =FIB(RC[-101])+RC[-1]+R[-1]C+R[-1]C[-1] -> 1.7154173490955E+24 | DP52: =FIB(RC[-101])+RC[-1]+R[-1]C+R[-1]C[-1] -> 9.57600944470874E+24 | DQ52: =FIB(RC[-101])+RC[-1]+R[-1]C+R[-1]C[-1] -> 5.09460951218907E+25 | DR52: =FIB(RC[-101])+RC[-1]+R[-1]C+R[-1]C[-1] -> 2.58998475545187E+26 | DS52: =FIB(RC[-101])+RC[-1]+R[-1]C+R[-1]C[-1] -> 1.26121413539609E+27 | DT52: =FIB(RC[-101])+RC[-1]+R[-1]C+R[-1]C[-1] -> 5.89578358294744E+27 | DU52: =FIB(RC[-101])+RC[-1]+R[-1]C+R[-1]C[-1] -> 2.65114014232373E+28 | DV52: =FIB(RC[-101])+RC[-1]+R[-1]C+R[-1]C[-1] -> 1.14886926103367E+29 | DW52: =FIB(RC[-101])+RC[-1]+R[-1]C+R[-1]C[-1] -> 4.80620708624145E+29 | DX52: =FIB(RC[-101])+RC[-1]+R[-1]C+R[-1]C[-1] -> 1.94411085433239E+30 | DY52: =FIB(RC[-101])+RC[-1]+R[-1]C+R[-1]C[-1] -> 7.61500632603886E+30 | DZ52: =FIB(RC[-101])+RC[-1]+R[-1]C+R[-1]C[-1] -> 2.89234743277003E+31 | EA52: =FIB(RC[-101])+RC[-1]+R[-1]C+R[-1]C[-1] -> 1.06665101306942E+32 | EB52: =FIB(RC[-101])+RC[-1]+R[-1]C+R[-1]C[-1] -> 3.82393860143421E+32 | EC52: =FIB(RC[-101])+RC[-1]+R[-1]C+R[-1]C[-1] -> 1.33416205422774E+33 | ED52: =FIB(RC[-101])+RC[-1]+R[-1]C+R[-1]C[-1] -> 4.53500894272867E+33 | EE52: =FIB(RC[-101])+RC[-1]+R[-1]C+R[-1]C[-1] -> 1.50333314379579E+34 | EF52: =FIB(RC[-101])+RC[-1]+R[-1]C+R[-1]C[-1] -> 4.8646384061784E+34 | EG52: =FIB(RC[-101])+RC[-1]+R[-1]C+R[-1]C[-1] -> 1.53798448852563E+35 | EH52: =FIB(RC[-101])+RC[-1]+R[-1]C+R[-1]C[-1] -> 4.75473244811844E+35 | EI52: =FIB(RC[-101])+RC[-1]+R[-1]C+R[-1]C[-1] -> 1.43853386376749E+36 | EJ52: =FIB(RC[-101])+RC[-1]+R[-1]C+R[-1]C[-1] -> 4.26248644284364E+36 | EK52: =FIB(RC[-101])+RC[-1]+R[-1]C+R[-1]C[-1] -> 1.23784731074957E+37 | EL52: =FIB(RC[-101])+RC[-1]+R[-1]C+R[-1]C[-1] -> 3.52556631167268E+37 | EM52: =FIB(RC[-101])+RC[-1]+R[-1]C+R[-1]C[-1] -> 9.85440642483378E+37 | EN52: =FIB(RC[-101])+RC[-1]+R[-1]C+R[-1]C[-1] -> 2.70483173685612E+38 | EO52: =FIB(RC[-101])+RC[-1]+R[-1]C+R[-1]C[-1] -> 7.29480946643103E+38 | EP52: =FIB(RC[-101])+RC[-1]+R[-1]C+R[-1]C[-1] -> 1.93417326992015E+39 | EQ52: =FIB(RC[-101])+RC[-1]+R[-1]C+R[-1]C[-1] -> 5.04448890001554E+39 | ER52: =FIB(RC[-101])+RC[-1]+R[-1]C+R[-1]C[-1] -> 1.29479644067644E+40 | ES52: =FIB(RC[-101])+RC[-1]+R[-1]C+R[-1]C[-1] -> 3.27235690041138E+40 | ET52: =FIB(RC[-101])+RC[-1]+R[-1]C+R[-1]C[-1] -> 8.14699979377228E+40 | EU52: =FIB(RC[-101])+RC[-1]+R[-1]C+R[-1]C[-1] -> 1.9989729337574E+41 | EV52: =FIB(RC[-101])+RC[-1]+R[-1]C+R[-1]C[-1] -> 4.83586688521322E+41 | EW52: =FIB(RC[-101])+RC[-1]+R[-1]C+R[-1]C[-1] -> 1.15392674768959E+42 | EX52: =FIB(RC[-101])+RC[-1]+R[-1]C+R[-1]C[-1] -> 2.71699929839881E+42 | EY52: =FIB(RC[-101])+RC[-1]+R[-1]C+R[-1]C[-1] -> 6.31498232153011E+42 | EZ52: =FIB(RC[-101])+RC[-1]+R[-1]C+R[-1]C[-1] -> 1.44938389314752E+43 | FA52: =FIB(RC[-101])+RC[-1]+R[-1]C+R[-1]C[-1] -> 3.28605256718947E+43 | FB52: =FIB(RC[-101])+RC[-1]+R[-1]C+R[-1]C[-1] -> 7.36191074450486E+43 | FC52: =FIB(RC[-101])+RC[-1]+R[-1]C+R[-1]C[-1] -> 1.63031345347207E+44 | FD52: =FIB(RC[-101])+RC[-1]+R[-1]C+R[-1]C[-1] -> 3.56985369535172E+44 | FE52: =FIB(RC[-101])+RC[-1]+R[-1]C+R[-1]C[-1] -> 7.73139040626798E+44 | FF52: =FIB(RC[-101])+RC[-1]+R[-1]C+R[-1]C[-1] -> 1.65659743207657E+45 | FG52: =FIB(RC[-101])+RC[-1]+R[-1]C+R[-1]C[-1] -> 3.51275833842131E+45 | FH52: =FIB(RC[-101])+RC[-1]+R[-1]C+R[-1]C[-1] -> 7.37338332771653E+45 | FI52: =FIB(RC[-101])+RC[-1]+R[-1]C+R[-1]C[-1] -> 1.53244102824273E+46 | FJ52: =FIB(RC[-101])+RC[-1]+R[-1]C+R[-1]C[-1] -> 3.15432429548287E+46 | FK52: =FIB(RC[-101])+RC[-1]+R[-1]C+R[-1]C[-1] -> 6.43187983743202E+46 | FL52: =FIB(RC[-101])+RC[-1]+R[-1]C+R[-1]C[-1] -> 1.29950601008562E+47 | FM52: =FIB(RC[-101])+RC[-1]+R[-1]C+R[-1]C[-1] -> 2.60209873455314E+47 | FN52: =FIB(RC[-101])+RC[-1]+R[-1]C+R[-1]C[-1] -> 5.16496490354777E+47 | FO52: =FIB(RC[-101])+RC[-1]+R[-1]C+R[-1]C[-1] -> 1.01648028249941E+48 | FP52: =FIB(RC[-101])+RC[-1]+R[-1]C+R[-1]C[-1] -> 1.98383413270808E+48 | FQ52: =FIB(RC[-101])+RC[-1]+R[-1]C+R[-1]C[-1] -> 3.84034744064431E+48 | FR52: =FIB(RC[-101])+RC[-1]+R[-1]C+R[-1]C[-1] -> 7.37523073892254E+48 | FS52: =FIB(RC[-101])+RC[-1]+R[-1]C+R[-1]C[-1] -> 1.40539747199467E+49 | FT52: =FIB(RC[-101])+RC[-1]+R[-1]C+R[-1]C[-1] -> 2.6577686277797E+49 | FU52: =FIB(RC[-101])+RC[-1]+R[-1]C+R[-1]C[-1] -> 4.98888130343303E+49 | FV52: =FIB(RC[-101])+RC[-1]+R[-1]C+R[-1]C[-1] -> 9.29669077876441E+49 | FW52: =FIB(RC[-101])+RC[-1]+R[-1]C+R[-1]C[-1] -> 1.72013206484241E+50 | FX52: =FIB(RC[-101])+RC[-1]+R[-1]C+R[-1]C[-1] -> 3.16060494624215E+50 | FY52: =FIB(RC[-101])+RC[-1]+R[-1]C+R[-1]C[-1] -> 5.76790928231865E+50 | FZ52: =FIB(RC[-101])+RC[-1]+R[-1]C+R[-1]C[-1] -> 1.045608705899E+51 | GA52: =FIB(RC[-101])+RC[-1]+R[-1]C+R[-1]C[-1] -> 1.88314343773632E+51 | GB52: =FIB(RC[-101])+RC[-1]+R[-1]C+R[-1]C[-1] -> 3.36992395145253E+51 | GC52: =FIB(RC[-101])+RC[-1]+R[-1]C+R[-1]C[-1] -> 5.99289371823482E+51 | GD52: =FIB(RC[-101])+RC[-1]+R[-1]C+R[-1]C[-1] -> 1.05922548811788E+52 | GE52: =FIB(RC[-101])+RC[-1]+R[-1]C+R[-1]C[-1] -> 1.86092816140858E+52 | GF52: =FIB(RC[-101])+RC[-1]+R[-1]C+R[-1]C[-1] -> 3.25021830578415E+52 | GG52: =FIB(RC[-101])+RC[-1]+R[-1]C+R[-1]C[-1] -> 5.64401404020811E+52 | GH52: =FIB(RC[-101])+RC[-1]+R[-1]C+R[-1]C[-1] -> 9.74553547247686E+52 | GI52: =FIB(RC[-101])+RC[-1]+R[-1]C+R[-1]C[-1] -> 1.67345267027071E+53 | GJ52: =FIB(RC[-101])+RC[-1]+R[-1]C+R[-1]C[-1] -> 2.85797191527665E+53 | GK52: =FIB(RC[-101])+RC[-1]+R[-1]C+R[-1]C[-1] -> 4.85494891595793E+53 | GL52: =FIB(RC[-101])+RC[-1]+R[-1]C+R[-1]C[-1] -> 8.20422746827009E+53 | GM52: =FIB(RC[-101])+RC[-1]+R[-1]C+R[-1]C[-1] -> 1.37930391320841E+54 | GN52: =FIB(RC[-101])+RC[-1]+R[-1]C+R[-1]C[-1] -> 2.30724253960216E+54 | GO52: =FIB(RC[-101])+RC[-1]+R[-1]C+R[-1]C[-1] -> 3.84041513889397E+54 | GP52: =FIB(RC[-101])+RC[-1]+R[-1]C+R[-1]C[-1] -> 6.36142312482357E+54 | GQ52: =FIB(RC[-101])+RC[-1]+R[-1]C+R[-1]C[-1] -> 1.04872127584647E+55 | GR52: =FIB(RC[-101])+RC[-1]+R[-1]C+R[-1]C[-1] -> 1.72081048520664E+55 | GS52: =FIB(RC[-101])+RC[-1]+R[-1]C+R[-1]C[-1] -> 2.81066886285085E+55
A53: 20 | B53: 20 | C53: 20 | D53: 20 | E53: 20 | F53: 20 | G53: 20 | H53: 20 | I53: 20 | J53: 20 | K53: 20 | L53: 20 | M53: 20 | N53: 20 | O53: 20 | P53: 20 | Q53: 20 | R53: 20 | S53: 20 | T53: 20 | U53: 20 | V53: 20 | W53: 20 | X53: 20 | Y53: 20 | Z53: 20 | AA53: 20 | AB53: 20 | AC53: 20 | AD53: 20 | AE53: 20 | AF53: 20 | AG53: 20 | AH53: 20 | AI53: 20 | AJ53: 20 | AK53: 20 | AL53: 20 | AM53: 20 | AN53: 20 | AO53: 20 | AP53: 20 | AQ53: 20 | AR53: 20 | AS53: 20 | AT53: 20 | AU53: 20 | AV53: 20 | AW53: 20 | AX53: 20 | AY53: 20 | AZ53: 20 | BA53: 20 | BB53: 20 | BC53: 20 | BD53: 20 | BE53: 20 | BF53: 20 | BG53: 20 | BH53: 20 | BI53: 20 | BJ53: 20 | BK53: 20 | BL53: 20 | BM53: 20 | BN53: 20 | BO53: 20 | BP53: 20 | BQ53: 20 | BR53: 20 | BS53: 20 | BT53: 20 | BU53: 20 | BV53: 20 | BW53: 20 | BX53: 20 | BY53: 20 | BZ53: 20 | CA53: 20 | CB53: 20 | CC53: 20 | CD53: 20 | CE53: 20 | CF53: 20 | CG53: 20 | CH53: 20 | CI53: 20 | CJ53: 20 | CK53: 20 | CL53: 20 | CM53: 20 | CN53: 20 | CO53: 20 | CP53: 20 | CQ53: 20 | CR53: 20 | CS53: 20 | CT53: 20 | CU53: 20 | CV53: 20 | CW53: 0 | CX53: =FIB(RC[-101])+RC[-1]+R[-1]C+R[-1]C[-1] -> 569192 | CY53: =FIB(RC[-101])+RC[-1]+R[-1]C+R[-1]C[-1] -> 30167176 | CZ53: =FIB(RC[-101])+RC[-1]+R[-1]C+R[-1]C[-1] -> 1056420352 | DA53: =FIB(RC[-101])+RC[-1]+R[-1]C+R[-1]C[-1] -> 27753801920 | DB53: =FIB(RC[-101])+RC[-1]+R[-1]C+R[-1]C[-1] -> 583675090440 | DC53: =FIB(RC[-101])+RC[-1]+R[-1]C+R[-1]C[-1] -> 10237442345832 | DD53: =FIB(RC[-101])+RC[-1]+R[-1]C+R[-1]C[-1] -> 154061928203456 | DE53: =FIB(RC[-101])+RC[-1]+R[-1]C+R[-1]C[-1] -> 2.03102056979411E+15 | DF53: =FIB(RC[-101])+RC[-1]+R[-1]C+R[-1]C[-1] -> 2.38321839171754E+16 | DG53: =FIB(RC[-101])+RC[-1]+R[-1]C+R[-1]C[-1] -> 2.52065849643213E+17 | DH53: =FIB(RC[-101])+RC[-1]+R[-1]C+R[-1]C[-1] -> 2.42774873197361E+18 | DI53: =FIB(RC[-101])+RC[-1]+R[-1]C+R[-1]C[-1] -> 2.14738617669421E+19 | DJ53: =FIB(RC[-101])+RC[-1]+R[-1]C+R[-1]C[-1] -> 1.75683728485585E+20 | DK53: =FIB(RC[-101])+RC[-1]+R[-1]C+R[-1]C[-1] -> 1.33756797813976E+21 | DL53: =FIB(RC[-101])+RC[-1]+R[-1]C+R[-1]C[-1] -> 9.52694732689821E+21 | DM53: =FIB(RC[-101])+RC[-1]+R[-1]C+R[-1]C[-1] -> 6.37745618122755E+22 | DN53: =FIB(RC[-101])+RC[-1]+R[-1]C+R[-1]C[-1] -> 4.02868243971724E+23 | DO53: =FIB(RC[-101])+RC[-1]+R[-1]C+R[-1]C[-1] -> 2.4102962871022E+24 | DP53: =FIB(RC[-101])+RC[-1]+R[-1]C+R[-1]C[-1] -> 1.37017230809064E+25 | DQ53: =FIB(RC[-101])+RC[-1]+R[-1]C+R[-1]C[-1] -> 7.42238276475059E+25 | DR53: =FIB(RC[-101])+RC[-1]+R[-1]C+R[-1]C[-1] -> 3.84168398314583E+26 | DS53: =FIB(RC[-101])+RC[-1]+R[-1]C+R[-1]C[-1] -> 1.90438100925586E+27 | DT53: =FIB(RC[-101])+RC[-1]+R[-1]C+R[-1]C[-1] -> 9.06137872759939E+27 | DU53: =FIB(RC[-101])+RC[-1]+R[-1]C+R[-1]C[-1] -> 4.14685637337842E+28 | DV53: =FIB(RC[-101])+RC[-1]+R[-1]C+R[-1]C[-1] -> 1.82866891260389E+29 | DW53: =FIB(RC[-101])+RC[-1]+R[-1]C+R[-1]C[-1] -> 7.78374525987902E+29 | DX53: =FIB(RC[-101])+RC[-1]+R[-1]C+R[-1]C[-1] -> 3.20310608894444E+30 | DY53: =FIB(RC[-101])+RC[-1]+R[-1]C+R[-1]C[-1] -> 1.27622232693157E+31 | DZ53: =FIB(RC[-101])+RC[-1]+R[-1]C+R[-1]C[-1] -> 4.93007039230549E+31 | EA53: =FIB(RC[-101])+RC[-1]+R[-1]C+R[-1]C[-1] -> 1.84889279557697E+32 | EB53: =FIB(RC[-101])+RC[-1]+R[-1]C+R[-1]C[-1] -> 6.7394824100806E+32 | EC53: =FIB(RC[-101])+RC[-1]+R[-1]C+R[-1]C[-1] -> 2.39050415537922E+33 | ED53: =FIB(RC[-101])+RC[-1]+R[-1]C+R[-1]C[-1] -> 8.25967515233562E+33 | EE53: =FIB(RC[-101])+RC[-1]+R[-1]C+R[-1]C[-1] -> 2.78280155330222E+34 | EF53: =FIB(RC[-101])+RC[-1]+R[-1]C+R[-1]C[-1] -> 9.15077310327641E+34 | EG53: =FIB(RC[-101])+RC[-1]+R[-1]C+R[-1]C[-1] -> 2.93952563947111E+35 | EH53: =FIB(RC[-101])+RC[-1]+R[-1]C+R[-1]C[-1] -> 9.23224257611518E+35 | EI53: =FIB(RC[-101])+RC[-1]+R[-1]C+R[-1]C[-1] -> 2.83723136619086E+36 | EJ53: =FIB(RC[-101])+RC[-1]+R[-1]C+R[-1]C[-1] -> 8.53825167280199E+36 | EK53: =FIB(RC[-101])+RC[-1]+R[-1]C+R[-1]C[-1] -> 2.51792112231413E+37 | EL53: =FIB(RC[-101])+RC[-1]+R[-1]C+R[-1]C[-1] -> 7.28133474473638E+37 | EM53: =FIB(RC[-101])+RC[-1]+R[-1]C+R[-1]C[-1] -> 2.06613074812428E+38 | EN53: =FIB(RC[-101])+RC[-1]+R[-1]C+R[-1]C[-1] -> 5.75640312746378E+38 | EO53: =FIB(RC[-101])+RC[-1]+R[-1]C+R[-1]C[-1] -> 1.57560443307509E+39 | EP53: =FIB(RC[-101])+RC[-1]+R[-1]C+R[-1]C[-1] -> 4.23925864963834E+39 | EQ53: =FIB(RC[-101])+RC[-1]+R[-1]C+R[-1]C[-1] -> 1.1217920819574E+40 | ER53: =FIB(RC[-101])+RC[-1]+R[-1]C+R[-1]C[-1] -> 2.9210374126354E+40 | ES53: =FIB(RC[-101])+RC[-1]+R[-1]C+R[-1]C[-1] -> 7.48819075372322E+40 | ET53: =FIB(RC[-101])+RC[-1]+R[-1]C+R[-1]C[-1] -> 1.89075474479069E+41 | EU53: =FIB(RC[-101])+RC[-1]+R[-1]C+R[-1]C[-1] -> 4.70442765792532E+41 | EV53: =FIB(RC[-101])+RC[-1]+R[-1]C+R[-1]C[-1] -> 1.15392674768959E+42 | EW53: =FIB(RC[-101])+RC[-1]+R[-1]C+R[-1]C[-1] -> 2.79144018390051E+42 | EX53: =FIB(RC[-101])+RC[-1]+R[-1]C+R[-1]C[-1] -> 6.66236622998891E+42 | EY53: =FIB(RC[-101])+RC[-1]+R[-1]C+R[-1]C[-1] -> 1.56943478499178E+43 | EZ53: =FIB(RC[-101])+RC[-1]+R[-1]C+R[-1]C[-1] -> 3.65031691029232E+43 | FA53: =FIB(RC[-101])+RC[-1]+R[-1]C+R[-1]C[-1] -> 8.38575337062931E+43 | FB53: =FIB(RC[-101])+RC[-1]+R[-1]C+R[-1]C[-1] -> 1.90337166823236E+44 | FC53: =FIB(RC[-101])+RC[-1]+R[-1]C+R[-1]C[-1] -> 4.26987619615492E+44 | FD53: =FIB(RC[-101])+RC[-1]+R[-1]C+R[-1]C[-1] -> 9.4700433449787E+44 | FE53: =FIB(RC[-101])+RC[-1]+R[-1]C+R[-1]C[-1] -> 2.07712874465984E+45 | FF53: =FIB(RC[-101])+RC[-1]+R[-1]C+R[-1]C[-1] -> 4.5068652173632E+45 | FG53: =FIB(RC[-101])+RC[-1]+R[-1]C+R[-1]C[-1] -> 9.67622098786108E+45 | FH53: =FIB(RC[-101])+RC[-1]+R[-1]C+R[-1]C[-1] -> 2.05623626539989E+46 | FI53: =FIB(RC[-101])+RC[-1]+R[-1]C+R[-1]C[-1] -> 4.32601562641427E+46 | FJ53: =FIB(RC[-101])+RC[-1]+R[-1]C+R[-1]C[-1] -> 9.01278095013987E+46 | FK53: =FIB(RC[-101])+RC[-1]+R[-1]C+R[-1]C[-1] -> 1.85989850830548E+47 | FL53: =FIB(RC[-101])+RC[-1]+R[-1]C+R[-1]C[-1] -> 3.8025925021343E+47 | FM53: =FIB(RC[-101])+RC[-1]+R[-1]C+R[-1]C[-1] -> 7.70419724677306E+47 | FN53: =FIB(RC[-101])+RC[-1]+R[-1]C+R[-1]C[-1] -> 1.5471260884874E+48 | FO53: =FIB(RC[-101])+RC[-1]+R[-1]C+R[-1]C[-1] -> 3.08010286134158E+48 | FP53: =FIB(RC[-101])+RC[-1]+R[-1]C+R[-1]C[-1] -> 6.08041727654907E+48 | FQ53: =FIB(RC[-101])+RC[-1]+R[-1]C+R[-1]C[-1] -> 1.19045988499015E+49 | FR53: =FIB(RC[-101])+RC[-1]+R[-1]C+R[-1]C[-1] -> 2.31201770294683E+49 | FS53: =FIB(RC[-101])+RC[-1]+R[-1]C+R[-1]C[-1] -> 4.45493824883376E+49 | FT53: =FIB(RC[-101])+RC[-1]+R[-1]C+R[-1]C[-1] -> 8.51810434860813E+49 | FU53: =FIB(RC[-101])+RC[-1]+R[-1]C+R[-1]C[-1] -> 1.61647542798209E+50 | FV53: =FIB(RC[-101])+RC[-1]+R[-1]C+R[-1]C[-1] -> 3.04503263620183E+50 | FW53: =FIB(RC[-101])+RC[-1]+R[-1]C+R[-1]C[-1] -> 5.69483377892068E+50 | FX53: =FIB(RC[-101])+RC[-1]+R[-1]C+R[-1]C[-1] -> 1.05755707900052E+51 | FY53: =FIB(RC[-101])+RC[-1]+R[-1]C+R[-1]C[-1] -> 1.9504085018566E+51 | FZ53: =FIB(RC[-101])+RC[-1]+R[-1]C+R[-1]C[-1] -> 3.57280813598747E+51 | GA53: =FIB(RC[-101])+RC[-1]+R[-1]C+R[-1]C[-1] -> 6.5015602796228E+51 | GB53: =FIB(RC[-101])+RC[-1]+R[-1]C+R[-1]C[-1] -> 1.17546276688116E+52 | GC53: =FIB(RC[-101])+RC[-1]+R[-1]C+R[-1]C[-1] -> 2.1117445338499E+52 | GD53: =FIB(RC[-101])+RC[-1]+R[-1]C+R[-1]C[-1] -> 3.77025939379126E+52 | GE53: =FIB(RC[-101])+RC[-1]+R[-1]C+R[-1]C[-1] -> 6.69041304331772E+52 | GF53: =FIB(RC[-101])+RC[-1]+R[-1]C+R[-1]C[-1] -> 1.18015595105104E+53 | GG53: =FIB(RC[-101])+RC[-1]+R[-1]C+R[-1]C[-1] -> 2.06957918565027E+53 | GH53: =FIB(RC[-101])+RC[-1]+R[-1]C+R[-1]C[-1] -> 3.60853413691877E+53 | GI53: =FIB(RC[-101])+RC[-1]+R[-1]C+R[-1]C[-1] -> 6.25654035443717E+53 | GJ53: =FIB(RC[-101])+RC[-1]+R[-1]C+R[-1]C[-1] -> 1.07879649399845E+54 | GK53: =FIB(RC[-101])+RC[-1]+R[-1]C+R[-1]C[-1] -> 1.85008857712191E+54 | GL53: =FIB(RC[-101])+RC[-1]+R[-1]C+R[-1]C[-1] -> 3.15600621554471E+54 | GM53: =FIB(RC[-101])+RC[-1]+R[-1]C+R[-1]C[-1] -> 5.35573287558013E+54 | GN53: =FIB(RC[-101])+RC[-1]+R[-1]C+R[-1]C[-1] -> 9.0422793283907E+54 | GO53: =FIB(RC[-101])+RC[-1]+R[-1]C+R[-1]C[-1] -> 1.51899370068868E+55 | GP53: =FIB(RC[-101])+RC[-1]+R[-1]C+R[-1]C[-1] -> 2.53917752706044E+55 | GQ53: =FIB(RC[-101])+RC[-1]+R[-1]C+R[-1]C[-1] -> 4.22404111538927E+55 | GR53: =FIB(RC[-101])+RC[-1]+R[-1]C+R[-1]C[-1] -> 6.99357287644239E+55 | GS53: =FIB(RC[-101])+RC[-1]+R[-1]C+R[-1]C[-1] -> 1.15250522244999E+56
A54: 20 | B54: 20 | C54: 20 | D54: 20 | E54: 20 | F54: 20 | G54: 20 | H54: 20 | I54: 20 | J54: 20 | K54: 20 | L54: 20 | M54: 20 | N54: 20 | O54: 20 | P54: 20 | Q54: 20 | R54: 20 | S54: 20 | T54: 20 | U54: 20 | V54: 20 | W54: 20 | X54: 20 | Y54: 20 | Z54: 20 | AA54: 20 | AB54: 20 | AC54: 20 | AD54: 20 | AE54: 20 | AF54: 20 | AG54: 20 | AH54: 20 | AI54: 20 | AJ54: 20 | AK54: 20 | AL54: 20 | AM54: 20 | AN54: 20 | AO54: 20 | AP54: 20 | AQ54: 20 | AR54: 20 | AS54: 20 | AT54: 20 | AU54: 20 | AV54: 20 | AW54: 20 | AX54: 20 | AY54: 20 | AZ54: 20 | BA54: 20 | BB54: 20 | BC54: 20 | BD54: 20 | BE54: 20 | BF54: 20 | BG54: 20 | BH54: 20 | BI54: 20 | BJ54: 20 | BK54: 20 | BL54: 20 | BM54: 20 | BN54: 20 | BO54: 20 | BP54: 20 | BQ54: 20 | BR54: 20 | BS54: 20 | BT54: 20 | BU54: 20 | BV54: 20 | BW54: 20 | BX54: 20 | BY54: 20 | BZ54: 20 | CA54: 20 | CB54: 20 | CC54: 20 | CD54: 20 | CE54: 20 | CF54: 20 | CG54: 20 | CH54: 20 | CI54: 20 | CJ54: 20 | CK54: 20 | CL54: 20 | CM54: 20 | CN54: 20 | CO54: 20 | CP54: 20 | CQ54: 20 | CR54: 20 | CS54: 20 | CT54: 20 | CU54: 20 | CV54: 20 | CW54: 0 | CX54: =FIB(RC[-101])+RC[-1]+R[-1]C+R[-1]C[-1] -> 580138 | CY54: =FIB(RC[-101])+RC[-1]+R[-1]C+R[-1]C[-1] -> 31327452 | CZ54: =FIB(RC[-101])+RC[-1]+R[-1]C+R[-1]C[-1] -> 1117925926 | DA54: =FIB(RC[-101])+RC[-1]+R[-1]C+R[-1]C[-1] -> 29928159144 | DB54: =FIB(RC[-101])+RC[-1]+R[-1]C+R[-1]C[-1] -> 641357062450 | DC54: =FIB(RC[-101])+RC[-1]+R[-1]C+R[-1]C[-1] -> 11462474509668 | DD54: =FIB(RC[-101])+RC[-1]+R[-1]C+R[-1]C[-1] -> 175761845069902 | DE54: =FIB(RC[-101])+RC[-1]+R[-1]C+R[-1]C[-1] -> 2.36084434307842E+15 | DF54: =FIB(RC[-101])+RC[-1]+R[-1]C+R[-1]C[-1] -> 2.82240488300589E+16 | DG54: =FIB(RC[-101])+RC[-1]+R[-1]C+R[-1]C[-1] -> 3.04122082390459E+17 | DH54: =FIB(RC[-101])+RC[-1]+R[-1]C+R[-1]C[-1] -> 2.98393666400729E+18 | DI54: =FIB(RC[-101])+RC[-1]+R[-1]C+R[-1]C[-1] -> 2.6885547162923E+19 | DJ54: =FIB(RC[-101])+RC[-1]+R[-1]C+R[-1]C[-1] -> 2.2404313741545E+20 | DK54: =FIB(RC[-101])+RC[-1]+R[-1]C+R[-1]C[-1] -> 1.7372948440408E+21 | DL54: =FIB(RC[-101])+RC[-1]+R[-1]C+R[-1]C[-1] -> 1.26018101490788E+22 | DM54: =FIB(RC[-101])+RC[-1]+R[-1]C+R[-1]C[-1] -> 8.59033192882525E+22 | DN54: =FIB(RC[-101])+RC[-1]+R[-1]C+R[-1]C[-1] -> 5.52546125072252E+23 | DO54: =FIB(RC[-101])+RC[-1]+R[-1]C+R[-1]C[-1] -> 3.36571065614618E+24 | DP54: =FIB(RC[-101])+RC[-1]+R[-1]C+R[-1]C[-1] -> 1.94777300241548E+25 | DQ54: =FIB(RC[-101])+RC[-1]+R[-1]C+R[-1]C[-1] -> 1.07403280752567E+26 | DR54: =FIB(RC[-101])+RC[-1]+R[-1]C+R[-1]C[-1] -> 5.65795506714656E+26 | DS54: =FIB(RC[-101])+RC[-1]+R[-1]C+R[-1]C[-1] -> 2.8543449142851E+27 | DT54: =FIB(RC[-101])+RC[-1]+R[-1]C+R[-1]C[-1] -> 1.38201046511403E+28 | DU54: =FIB(RC[-101])+RC[-1]+R[-1]C+R[-1]C[-1] -> 6.43500471125239E+28 | DV54: =FIB(RC[-101])+RC[-1]+R[-1]C+R[-1]C[-1] -> 2.88685502106697E+29 | DW54: =FIB(RC[-101])+RC[-1]+R[-1]C+R[-1]C[-1] -> 1.24992691935499E+30 | DX54: =FIB(RC[-101])+RC[-1]+R[-1]C+R[-1]C[-1] -> 5.23140753428733E+30 | DY54: =FIB(RC[-101])+RC[-1]+R[-1]C+R[-1]C[-1] -> 2.11967368925474E+31 | DZ54: =FIB(RC[-101])+RC[-1]+R[-1]C+R[-1]C[-1] -> 8.3259664084918E+31 | EA54: =FIB(RC[-101])+RC[-1]+R[-1]C+R[-1]C[-1] -> 3.1744964756567E+32 | EB54: =FIB(RC[-101])+RC[-1]+R[-1]C+R[-1]C[-1] -> 1.17628716813143E+33 | EC54: =FIB(RC[-101])+RC[-1]+R[-1]C+R[-1]C[-1] -> 4.2407395645187E+33 | ED54: =FIB(RC[-101])+RC[-1]+R[-1]C+R[-1]C[-1] -> 1.48909188722335E+34 | EE54: =FIB(RC[-101])+RC[-1]+R[-1]C+R[-1]C[-1] -> 5.09786095575914E+34 | EF54: =FIB(RC[-101])+RC[-1]+R[-1]C+R[-1]C[-1] -> 1.70314356123378E+35 | EG54: =FIB(RC[-101])+RC[-1]+R[-1]C+R[-1]C[-1] -> 5.55774651103253E+35 | EH54: =FIB(RC[-101])+RC[-1]+R[-1]C+R[-1]C[-1] -> 1.77295147266188E+36 | EI54: =FIB(RC[-101])+RC[-1]+R[-1]C+R[-1]C[-1] -> 5.53340709646426E+36 | EJ54: =FIB(RC[-101])+RC[-1]+R[-1]C+R[-1]C[-1] -> 1.69088901354571E+37 | EK54: =FIB(RC[-101])+RC[-1]+R[-1]C+R[-1]C[-1] -> 5.06263530314004E+37 | EL54: =FIB(RC[-101])+RC[-1]+R[-1]C+R[-1]C[-1] -> 1.48618911701905E+38 | EM54: =FIB(RC[-101])+RC[-1]+R[-1]C+R[-1]C[-1] -> 4.28045333961698E+38 | EN54: =FIB(RC[-101])+RC[-1]+R[-1]C+R[-1]C[-1] -> 1.2102987215205E+39 | EO54: =FIB(RC[-101])+RC[-1]+R[-1]C+R[-1]C[-1] -> 3.36154346734198E+39 | EP54: =FIB(RC[-101])+RC[-1]+R[-1]C+R[-1]C[-1] -> 9.17640655005541E+39 | EQ54: =FIB(RC[-101])+RC[-1]+R[-1]C+R[-1]C[-1] -> 2.46335860192678E+40 | ER54: =FIB(RC[-101])+RC[-1]+R[-1]C+R[-1]C[-1] -> 6.50618809651958E+40 | ES54: =FIB(RC[-101])+RC[-1]+R[-1]C+R[-1]C[-1] -> 1.69154162628782E+41 | ET54: =FIB(RC[-101])+RC[-1]+R[-1]C+R[-1]C[-1] -> 4.33111544645083E+41 | EU54: =FIB(RC[-101])+RC[-1]+R[-1]C+R[-1]C[-1] -> 1.09262978491668E+42 | EV54: =FIB(RC[-101])+RC[-1]+R[-1]C+R[-1]C[-1] -> 2.71699929839881E+42 | EW54: =FIB(RC[-101])+RC[-1]+R[-1]C+R[-1]C[-1] -> 6.66236622998891E+42 | EX54: =FIB(RC[-101])+RC[-1]+R[-1]C+R[-1]C[-1] -> 1.61161726438783E+43 | EY54: =FIB(RC[-101])+RC[-1]+R[-1]C+R[-1]C[-1] -> 3.84728867237851E+43 | EZ54: =FIB(RC[-101])+RC[-1]+R[-1]C+R[-1]C[-1] -> 9.06704036766261E+43 | FA54: =FIB(RC[-101])+RC[-1]+R[-1]C+R[-1]C[-1] -> 2.11031106485842E+44 | FB54: =FIB(RC[-101])+RC[-1]+R[-1]C+R[-1]C[-1] -> 4.85225807015372E+44 | FC54: =FIB(RC[-101])+RC[-1]+R[-1]C+R[-1]C[-1] -> 1.1025505934541E+45 | FD54: =FIB(RC[-101])+RC[-1]+R[-1]C+R[-1]C[-1] -> 2.47654254756746E+45 | FE54: =FIB(RC[-101])+RC[-1]+R[-1]C+R[-1]C[-1] -> 5.50067562672517E+45 | FF54: =FIB(RC[-101])+RC[-1]+R[-1]C+R[-1]C[-1] -> 1.20846695887482E+46 | FG54: =FIB(RC[-101])+RC[-1]+R[-1]C+R[-1]C[-1] -> 2.62677557939725E+46 | FH54: =FIB(RC[-101])+RC[-1]+R[-1]C+R[-1]C[-1] -> 5.65063394358325E+46 | FI54: =FIB(RC[-101])+RC[-1]+R[-1]C+R[-1]C[-1] -> 1.20328858353974E+47 | FJ54: =FIB(RC[-101])+RC[-1]+R[-1]C+R[-1]C[-1] -> 2.53716824119516E+47 | FK54: =FIB(RC[-101])+RC[-1]+R[-1]C+R[-1]C[-1] -> 5.29834484451462E+47 | FL54: =FIB(RC[-101])+RC[-1]+R[-1]C+R[-1]C[-1] -> 1.09608358549544E+48 | FM54: =FIB(RC[-101])+RC[-1]+R[-1]C+R[-1]C[-1] -> 2.24676256038618E+48 | FN54: =FIB(RC[-101])+RC[-1]+R[-1]C+R[-1]C[-1] -> 4.56430837355088E+48 | FO54: =FIB(RC[-101])+RC[-1]+R[-1]C+R[-1]C[-1] -> 9.19153732337986E+48 | FP54: =FIB(RC[-101])+RC[-1]+R[-1]C+R[-1]C[-1] -> 1.83520574612705E+49 | FQ54: =FIB(RC[-101])+RC[-1]+R[-1]C+R[-1]C[-1] -> 3.6337073587721E+49 | FR54: =FIB(RC[-101])+RC[-1]+R[-1]C+R[-1]C[-1] -> 7.13618494670908E+49 | FS54: =FIB(RC[-101])+RC[-1]+R[-1]C+R[-1]C[-1] -> 1.39031408984897E+50 | FT54: =FIB(RC[-101])+RC[-1]+R[-1]C+R[-1]C[-1] -> 2.68761834959316E+50 | FU54: =FIB(RC[-101])+RC[-1]+R[-1]C+R[-1]C[-1] -> 5.15590421243606E+50 | FV54: =FIB(RC[-101])+RC[-1]+R[-1]C+R[-1]C[-1] -> 9.81741227661997E+50 | FW54: =FIB(RC[-101])+RC[-1]+R[-1]C+R[-1]C[-1] -> 1.85572786917425E+51 | FX54: =FIB(RC[-101])+RC[-1]+R[-1]C+R[-1]C[-1] -> 3.48276832606684E+51 | FY54: =FIB(RC[-101])+RC[-1]+R[-1]C+R[-1]C[-1] -> 6.49073390692397E+51 | FZ54: =FIB(RC[-101])+RC[-1]+R[-1]C+R[-1]C[-1] -> 1.2013950544768E+52 | GA54: =FIB(RC[-101])+RC[-1]+R[-1]C+R[-1]C[-1] -> 2.20883189603783E+52 | GB54: =FIB(RC[-101])+RC[-1]+R[-1]C+R[-1]C[-1] -> 4.03445069088128E+52 | GC54: =FIB(RC[-101])+RC[-1]+R[-1]C+R[-1]C[-1] -> 7.32165799161234E+52 | GD54: =FIB(RC[-101])+RC[-1]+R[-1]C+R[-1]C[-1] -> 1.32036619192535E+53 | GE54: =FIB(RC[-101])+RC[-1]+R[-1]C+R[-1]C[-1] -> 2.36643343563625E+53 | GF54: =FIB(RC[-101])+RC[-1]+R[-1]C+R[-1]C[-1] -> 4.21563069101906E+53 | GG54: =FIB(RC[-101])+RC[-1]+R[-1]C+R[-1]C[-1] -> 7.46536582772038E+53 | GH54: =FIB(RC[-101])+RC[-1]+R[-1]C+R[-1]C[-1] -> 1.31434791502894E+54 | GI54: =FIB(RC[-101])+RC[-1]+R[-1]C+R[-1]C[-1] -> 2.30085536416454E+54 | GJ54: =FIB(RC[-101])+RC[-1]+R[-1]C+R[-1]C[-1] -> 4.0053058936067E+54 | GK54: =FIB(RC[-101])+RC[-1]+R[-1]C+R[-1]C[-1] -> 6.93419096472707E+54 | GL54: =FIB(RC[-101])+RC[-1]+R[-1]C+R[-1]C[-1] -> 1.19402857573937E+55 | GM54: =FIB(RC[-101])+RC[-1]+R[-1]C+R[-1]C[-1] -> 2.04520248485185E+55 | GN54: =FIB(RC[-101])+RC[-1]+R[-1]C+R[-1]C[-1] -> 3.48500370524894E+55 | GO54: =FIB(RC[-101])+RC[-1]+R[-1]C+R[-1]C[-1] -> 5.90822533877669E+55 | GP54: =FIB(RC[-101])+RC[-1]+R[-1]C+R[-1]C[-1] -> 9.96639656652581E+55 | GQ54: =FIB(RC[-101])+RC[-1]+R[-1]C+R[-1]C[-1] -> 1.67296152089755E+56 | GR54: =FIB(RC[-101])+RC[-1]+R[-1]C+R[-1]C[-1] -> 2.79472292008072E+56 | GS54: =FIB(RC[-101])+RC[-1]+R[-1]C+R[-1]C[-1] -> 4.64658543017494E+56
A55: 20 | B55: 20 | C55: 20 | D55: 20 | E55: 20 | F55: 20 | G55: 20 | H55: 20 | I55: 20 | J55: 20 | K55: 20 | L55: 20 | M55: 20 | N55: 20 | O55: 20 | P55: 20 | Q55: 20 | R55: 20 | S55: 20 | T55: 20 | U55: 20 | V55: 20 | W55: 20 | X55: 20 | Y55: 20 | Z55: 20 | AA55: 20 | AB55: 20 | AC55: 20 | AD55: 20 | AE55: 20 | AF55: 20 | AG55: 20 | AH55: 20 | AI55: 20 | AJ55: 20 | AK55: 20 | AL55: 20 | AM55: 20 | AN55: 20 | AO55: 20 | AP55: 20 | AQ55: 20 | AR55: 20 | AS55: 20 | AT55: 20 | AU55: 20 | AV55: 20 | AW55: 20 | AX55: 20 | AY55: 20 | AZ55: 20 | BA55: 20 | BB55: 20 | BC55: 20 | BD55: 20 | BE55: 20 | BF55: 20 | BG55: 20 | BH55: 20 | BI55: 20 | BJ55: 20 | BK55: 20 | BL55: 20 | BM55: 20 | BN55: 20 | BO55: 20 | BP55: 20 | BQ55: 20 | BR55: 20 | BS55: 20 | BT55: 20 | BU55: 20 | BV55: 20 | BW55: 20 | BX55: 20 | BY55: 20 | BZ55: 20 | CA55: 20 | CB55: 20 | CC55: 20 | CD55: 20 | CE55: 20 | CF55: 20 | CG55: 20 | CH55: 20 | CI55: 20 | CJ55: 20 | CK55: 20 | CL55: 20 | CM55: 20 | CN55: 20 | CO55: 20 | CP55: 20 | CQ55: 20 | CR55: 20 | CS55: 20 | CT55: 20 | CU55: 20 | CV55: 20 | CW55: 0 | CX55: =FIB(RC[-101])+RC[-1]+R[-1]C+R[-1]C[-1] -> 591084 | CY55: =FIB(RC[-101])+RC[-1]+R[-1]C+R[-1]C[-1] -> 32509620 | CZ55: =FIB(RC[-101])+RC[-1]+R[-1]C+R[-1]C[-1] -> 1181773944 | DA55: =FIB(RC[-101])+RC[-1]+R[-1]C+R[-1]C[-1] -> 32227869960 | DB55: =FIB(RC[-101])+RC[-1]+R[-1]C+R[-1]C[-1] -> 703513102500 | DC55: =FIB(RC[-101])+RC[-1]+R[-1]C+R[-1]C[-1] -> 12807344685564 | DD55: =FIB(RC[-101])+RC[-1]+R[-1]C+R[-1]C[-1] -> 200031664276080 | DE55: =FIB(RC[-101])+RC[-1]+R[-1]C+R[-1]C[-1] -> 2.73663785243534E+15 | DF55: =FIB(RC[-101])+RC[-1]+R[-1]C+R[-1]C[-1] -> 3.33215310255836E+16 | DG55: =FIB(RC[-101])+RC[-1]+R[-1]C+R[-1]C[-1] -> 3.65667662246112E+17 | DH55: =FIB(RC[-101])+RC[-1]+R[-1]C+R[-1]C[-1] -> 3.65372640864387E+18 | DI55: =FIB(RC[-101])+RC[-1]+R[-1]C+R[-1]C[-1] -> 3.35232102355742E+19 | DJ55: =FIB(RC[-101])+RC[-1]+R[-1]C+R[-1]C[-1] -> 2.84451894813947E+20 | DK55: =FIB(RC[-101])+RC[-1]+R[-1]C+R[-1]C[-1] -> 2.24578987627019E+21 | DL55: =FIB(RC[-101])+RC[-1]+R[-1]C+R[-1]C[-1] -> 1.65848948693898E+22 | DM55: =FIB(RC[-101])+RC[-1]+R[-1]C+R[-1]C[-1] -> 1.15090024306721E+23 | DN55: =FIB(RC[-101])+RC[-1]+R[-1]C+R[-1]C[-1] -> 7.53539468667225E+23 | DO55: =FIB(RC[-101])+RC[-1]+R[-1]C+R[-1]C[-1] -> 4.67179624988566E+24 | DP55: =FIB(RC[-101])+RC[-1]+R[-1]C+R[-1]C[-1] -> 2.75152369301867E+25 | DQ55: =FIB(RC[-101])+RC[-1]+R[-1]C+R[-1]C[-1] -> 1.54396247706909E+26 | DR55: =FIB(RC[-101])+RC[-1]+R[-1]C+R[-1]C[-1] -> 8.27595035174132E+26 | DS55: =FIB(RC[-101])+RC[-1]+R[-1]C+R[-1]C[-1] -> 4.24773545617389E+27 | DT55: =FIB(RC[-101])+RC[-1]+R[-1]C+R[-1]C[-1] -> 2.09221850215993E+28 | DU55: =FIB(RC[-101])+RC[-1]+R[-1]C+R[-1]C[-1] -> 9.90923367852636E+28 | DV55: =FIB(RC[-101])+RC[-1]+R[-1]C+R[-1]C[-1] -> 4.52127886004484E+29 | DW55: =FIB(RC[-101])+RC[-1]+R[-1]C+R[-1]C[-1] -> 1.99074030746617E+30 | DX55: =FIB(RC[-101])+RC[-1]+R[-1]C+R[-1]C[-1] -> 8.47207476110848E+30 | DY55: =FIB(RC[-101])+RC[-1]+R[-1]C+R[-1]C[-1] -> 3.49002191879433E+31 | DZ55: =FIB(RC[-101])+RC[-1]+R[-1]C+R[-1]C[-1] -> 1.39356620165409E+32 | EA55: =FIB(RC[-101])+RC[-1]+R[-1]C+R[-1]C[-1] -> 5.40065931815997E+32 | EB55: =FIB(RC[-101])+RC[-1]+R[-1]C+R[-1]C[-1] -> 2.03380274751309E+33 | EC55: =FIB(RC[-101])+RC[-1]+R[-1]C+R[-1]C[-1] -> 7.45082948016322E+33 | ED55: =FIB(RC[-101])+RC[-1]+R[-1]C+R[-1]C[-1] -> 2.65824879169155E+34 | EE55: =FIB(RC[-101])+RC[-1]+R[-1]C+R[-1]C[-1] -> 9.24520163467404E+34 | EF55: =FIB(RC[-101])+RC[-1]+R[-1]C+R[-1]C[-1] -> 3.13744982027709E+35 | EG55: =FIB(RC[-101])+RC[-1]+R[-1]C+R[-1]C[-1] -> 1.03983398925434E+36 | EH55: =FIB(RC[-101])+RC[-1]+R[-1]C+R[-1]C[-1] -> 3.36856011301947E+36 | EI55: =FIB(RC[-101])+RC[-1]+R[-1]C+R[-1]C[-1] -> 1.06749186821456E+37 | EJ55: =FIB(RC[-101])+RC[-1]+R[-1]C+R[-1]C[-1] -> 3.3117215914067E+37 | EK55: =FIB(RC[-101])+RC[-1]+R[-1]C+R[-1]C[-1] -> 1.00652459080924E+38 | EL55: =FIB(RC[-101])+RC[-1]+R[-1]C+R[-1]C[-1] -> 2.9989772381423E+38 | EM55: =FIB(RC[-101])+RC[-1]+R[-1]C+R[-1]C[-1] -> 8.76561969477833E+38 | EN55: =FIB(RC[-101])+RC[-1]+R[-1]C+R[-1]C[-1] -> 2.51490602496003E+39 | EO55: =FIB(RC[-101])+RC[-1]+R[-1]C+R[-1]C[-1] -> 7.08674821382252E+39 | EP55: =FIB(RC[-101])+RC[-1]+R[-1]C+R[-1]C[-1] -> 1.96246982312199E+40 | EQ55: =FIB(RC[-101])+RC[-1]+R[-1]C+R[-1]C[-1] -> 5.34346908005431E+40 | ER55: =FIB(RC[-101])+RC[-1]+R[-1]C+R[-1]C[-1] -> 1.43130157785007E+41 | ES55: =FIB(RC[-101])+RC[-1]+R[-1]C+R[-1]C[-1] -> 3.77346201378984E+41 | ET55: =FIB(RC[-101])+RC[-1]+R[-1]C+R[-1]C[-1] -> 9.79611908652849E+41 | EU55: =FIB(RC[-101])+RC[-1]+R[-1]C+R[-1]C[-1] -> 2.50535323821462E+42 | EV55: =FIB(RC[-101])+RC[-1]+R[-1]C+R[-1]C[-1] -> 6.31498232153011E+42 | EW55: =FIB(RC[-101])+RC[-1]+R[-1]C+R[-1]C[-1] -> 1.56943478499178E+43 | EX55: =FIB(RC[-101])+RC[-1]+R[-1]C+R[-1]C[-1] -> 3.84728867237851E+43 | EY55: =FIB(RC[-101])+RC[-1]+R[-1]C+R[-1]C[-1] -> 9.30619460914485E+43 | EZ55: =FIB(RC[-101])+RC[-1]+R[-1]C+R[-1]C[-1] -> 2.2220523649186E+44 | FA55: =FIB(RC[-101])+RC[-1]+R[-1]C+R[-1]C[-1] -> 5.23906746654328E+44 | FB55: =FIB(RC[-101])+RC[-1]+R[-1]C+R[-1]C[-1] -> 1.22016366015554E+45 | FC55: =FIB(RC[-101])+RC[-1]+R[-1]C+R[-1]C[-1] -> 2.80794006062501E+45 | FD55: =FIB(RC[-101])+RC[-1]+R[-1]C+R[-1]C[-1] -> 6.38703320164658E+45 | FE55: =FIB(RC[-101])+RC[-1]+R[-1]C+R[-1]C[-1] -> 1.43642513759392E+46 | FF55: =FIB(RC[-101])+RC[-1]+R[-1]C+R[-1]C[-1] -> 3.19495965914126E+46 | FG55: =FIB(RC[-101])+RC[-1]+R[-1]C+R[-1]C[-1] -> 7.03020219741333E+46 | FH55: =FIB(RC[-101])+RC[-1]+R[-1]C+R[-1]C[-1] -> 1.53076117203938E+47 | FI55: =FIB(RC[-101])+RC[-1]+R[-1]C+R[-1]C[-1] -> 3.29911314993745E+47 | FJ55: =FIB(RC[-101])+RC[-1]+R[-1]C+R[-1]C[-1] -> 7.03956997467235E+47 | FK55: =FIB(RC[-101])+RC[-1]+R[-1]C+R[-1]C[-1] -> 1.48750830603821E+48 | FL55: =FIB(RC[-101])+RC[-1]+R[-1]C+R[-1]C[-1] -> 3.11342637598511E+48 | FM55: =FIB(RC[-101])+RC[-1]+R[-1]C+R[-1]C[-1] -> 6.45627252186673E+48 | FN55: =FIB(RC[-101])+RC[-1]+R[-1]C+R[-1]C[-1] -> 1.32673434558038E+49 | FO55: =FIB(RC[-101])+RC[-1]+R[-1]C+R[-1]C[-1] -> 2.70231891527345E+49 | FP55: =FIB(RC[-101])+RC[-1]+R[-1]C+R[-1]C[-1] -> 5.45667839373849E+49 | FQ55: =FIB(RC[-101])+RC[-1]+R[-1]C+R[-1]C[-1] -> 1.09255914986376E+50 | FR55: =FIB(RC[-101])+RC[-1]+R[-1]C+R[-1]C[-1] -> 2.16954838041188E+50 | FS55: =FIB(RC[-101])+RC[-1]+R[-1]C+R[-1]C[-1] -> 4.27348096493176E+50 | FT55: =FIB(RC[-101])+RC[-1]+R[-1]C+R[-1]C[-1] -> 8.35141340437388E+50 | FU55: =FIB(RC[-101])+RC[-1]+R[-1]C+R[-1]C[-1] -> 1.61949359664031E+51 | FV55: =FIB(RC[-101])+RC[-1]+R[-1]C+R[-1]C[-1] -> 3.11682524554591E+51 | FW55: =FIB(RC[-101])+RC[-1]+R[-1]C+R[-1]C[-1] -> 5.95429434238216E+51 | FX55: =FIB(RC[-101])+RC[-1]+R[-1]C+R[-1]C[-1] -> 1.12927905376232E+52 | FY55: =FIB(RC[-101])+RC[-1]+R[-1]C+R[-1]C[-1] -> 2.12662927706141E+52 | FZ55: =FIB(RC[-101])+RC[-1]+R[-1]C+R[-1]C[-1] -> 3.97709772223061E+52 | GA55: =FIB(RC[-101])+RC[-1]+R[-1]C+R[-1]C[-1] -> 7.38732467274524E+52 | GB55: =FIB(RC[-101])+RC[-1]+R[-1]C+R[-1]C[-1] -> 1.36306072596644E+53 | GC55: =FIB(RC[-101])+RC[-1]+R[-1]C+R[-1]C[-1] -> 2.4986715942158E+53 | GD55: =FIB(RC[-101])+RC[-1]+R[-1]C+R[-1]C[-1] -> 4.55120358530238E+53 | GE55: =FIB(RC[-101])+RC[-1]+R[-1]C+R[-1]C[-1] -> 8.23800321286398E+53 | GF55: =FIB(RC[-101])+RC[-1]+R[-1]C+R[-1]C[-1] -> 1.48200673395193E+54 | GG55: =FIB(RC[-101])+RC[-1]+R[-1]C+R[-1]C[-1] -> 2.65010638582587E+54 | GH55: =FIB(RC[-101])+RC[-1]+R[-1]C+R[-1]C[-1] -> 4.71099088362685E+54 | GI55: =FIB(RC[-101])+RC[-1]+R[-1]C+R[-1]C[-1] -> 8.32619416282033E+54 | GJ55: =FIB(RC[-101])+RC[-1]+R[-1]C+R[-1]C[-1] -> 1.46323554205916E+55 | GK55: =FIB(RC[-101])+RC[-1]+R[-1]C+R[-1]C[-1] -> 2.55718522789253E+55 | GL55: =FIB(RC[-101])+RC[-1]+R[-1]C+R[-1]C[-1] -> 4.44463290010461E+55 | GM55: =FIB(RC[-101])+RC[-1]+R[-1]C+R[-1]C[-1] -> 7.68386396069583E+55 | GN55: =FIB(RC[-101])+RC[-1]+R[-1]C+R[-1]C[-1] -> 1.32140701507966E+56 | GO55: =FIB(RC[-101])+RC[-1]+R[-1]C+R[-1]C[-1] -> 2.26072991948222E+56 | GP55: =FIB(RC[-101])+RC[-1]+R[-1]C+R[-1]C[-1] -> 3.84819211001248E+56 | GQ55: =FIB(RC[-101])+RC[-1]+R[-1]C+R[-1]C[-1] -> 6.51779328756261E+56 | GR55: =FIB(RC[-101])+RC[-1]+R[-1]C+R[-1]C[-1] -> 1.09854777285409E+57 | GS55: =FIB(RC[-101])+RC[-1]+R[-1]C+R[-1]C[-1] -> 1.84267860787965E+57
A56: 20 | B56: 20 | C56: 20 | D56: 20 | E56: 20 | F56: 20 | G56: 20 | H56: 20 | I56: 20 | J56: 20 | K56: 20 | L56: 20 | M56: 20 | N56: 20 | O56: 20 | P56: 20 | Q56: 20 | R56: 20 | S56: 20 | T56: 20 | U56: 20 | V56: 20 | W56: 20 | X56: 20 | Y56: 20 | Z56: 20 | AA56: 20 | AB56: 20 | AC56: 20 | AD56: 20 | AE56: 20 | AF56: 20 | AG56: 20 | AH56: 20 | AI56: 20 | AJ56: 20 | AK56: 20 | AL56: 20 | AM56: 20 | AN56: 20 | AO56: 20 | AP56: 20 | AQ56: 20 | AR56: 20 | AS56: 20 | AT56: 20 | AU56: 20 | AV56: 20 | AW56: 20 | AX56: 20 | AY56: 20 | AZ56: 20 | BA56: 20 | BB56: 20 | BC56: 20 | BD56: 20 | BE56: 20 | BF56: 20 | BG56: 20 | BH56: 20 | BI56: 20 | BJ56: 20 | BK56: 20 | BL56: 20 | BM56: 20 | BN56: 20 | BO56: 20 | BP56: 20 | BQ56: 20 | BR56: 20 | BS56: 20 | BT56: 20 | BU56: 20 | BV56: 20 | BW56: 20 | BX56: 20 | BY56: 20 | BZ56: 20 | CA56: 20 | CB56: 20 | CC56: 20 | CD56: 20 | CE56: 20 | CF56: 20 | CG56: 20 | CH56: 20 | CI56: 20 | CJ56: 20 | CK56: 20 | CL56: 20 | CM56: 20 | CN56: 20 | CO56: 20 | CP56: 20 | CQ56: 20 | CR56: 20 | CS56: 20 | CT56: 20 | CU56: 20 | CV56: 20 | CW56: 0 | CX56: =FIB(RC[-101])+RC[-1]+R[-1]C+R[-1]C[-1] -> 602030 | CY56: =FIB(RC[-101])+RC[-1]+R[-1]C+R[-1]C[-1] -> 33713680 | CZ56: =FIB(RC[-101])+RC[-1]+R[-1]C+R[-1]C[-1] -> 1248008190 | DA56: =FIB(RC[-101])+RC[-1]+R[-1]C+R[-1]C[-1] -> 34657663040 | DB56: =FIB(RC[-101])+RC[-1]+R[-1]C+R[-1]C[-1] -> 770398646446 | DC56: =FIB(RC[-101])+RC[-1]+R[-1]C+R[-1]C[-1] -> 14281256445456 | DD56: =FIB(RC[-101])+RC[-1]+R[-1]C+R[-1]C[-1] -> 227120265418046 | DE56: =FIB(RC[-101])+RC[-1]+R[-1]C+R[-1]C[-1] -> 3.16378978214042E+15 | DF56: =FIB(RC[-101])+RC[-1]+R[-1]C+R[-1]C[-1] -> 3.92219586601703E+16 | DG56: =FIB(RC[-101])+RC[-1]+R[-1]C+R[-1]C[-1] -> 4.38211151931877E+17 | DH56: =FIB(RC[-101])+RC[-1]+R[-1]C+R[-1]C[-1] -> 4.45760522282187E+18 | DI56: =FIB(RC[-101])+RC[-1]+R[-1]C+R[-1]C[-1] -> 4.16345418670399E+19 | DJ56: =FIB(RC[-101])+RC[-1]+R[-1]C+R[-1]C[-1] -> 3.59609646916561E+20 | DK56: =FIB(RC[-101])+RC[-1]+R[-1]C+R[-1]C[-1] -> 2.8898514180007E+21 | DL56: =FIB(RC[-101])+RC[-1]+R[-1]C+R[-1]C[-1] -> 2.17205361636606E+22 | DM56: =FIB(RC[-101])+RC[-1]+R[-1]C+R[-1]C[-1] -> 1.53395455339771E+23 | DN56: =FIB(RC[-101])+RC[-1]+R[-1]C+R[-1]C[-1] -> 1.02202494831372E+24 | DO56: =FIB(RC[-101])+RC[-1]+R[-1]C+R[-1]C[-1] -> 6.4473606668666E+24 | DP56: =FIB(RC[-101])+RC[-1]+R[-1]C+R[-1]C[-1] -> 3.86343938469389E+25 | DQ56: =FIB(RC[-101])+RC[-1]+R[-1]C+R[-1]C[-1] -> 2.20545878484034E+26 | DR56: =FIB(RC[-101])+RC[-1]+R[-1]C+R[-1]C[-1] -> 1.20253716136507E+27 | DS56: =FIB(RC[-101])+RC[-1]+R[-1]C+R[-1]C[-1] -> 6.27786765271309E+27 | DT56: =FIB(RC[-101])+RC[-1]+R[-1]C+R[-1]C[-1] -> 3.14477881304863E+28 | DU56: =FIB(RC[-101])+RC[-1]+R[-1]C+R[-1]C[-1] -> 1.51462309937349E+29 | DV56: =FIB(RC[-101])+RC[-1]+R[-1]C+R[-1]C[-1] -> 7.02682532727097E+29 | DW56: =FIB(RC[-101])+RC[-1]+R[-1]C+R[-1]C[-1] -> 3.14555072619775E+30 | DX56: =FIB(RC[-101])+RC[-1]+R[-1]C+R[-1]C[-1] -> 1.36083657947724E+31 | DY56: =FIB(RC[-101])+RC[-1]+R[-1]C+R[-1]C[-1] -> 5.69806597438241E+31 | DZ56: =FIB(RC[-101])+RC[-1]+R[-1]C+R[-1]C[-1] -> 2.31237499097176E+32 | EA56: =FIB(RC[-101])+RC[-1]+R[-1]C+R[-1]C[-1] -> 9.10660051078581E+32 | EB56: =FIB(RC[-101])+RC[-1]+R[-1]C+R[-1]C[-1] -> 3.48452873040767E+33 | EC56: =FIB(RC[-101])+RC[-1]+R[-1]C+R[-1]C[-1] -> 1.2969160958084E+34 | ED56: =FIB(RC[-101])+RC[-1]+R[-1]C+R[-1]C[-1] -> 4.70024783551627E+34 | EE56: =FIB(RC[-101])+RC[-1]+R[-1]C+R[-1]C[-1] -> 1.66036982618819E+35 | EF56: =FIB(RC[-101])+RC[-1]+R[-1]C+R[-1]C[-1] -> 5.72233980993268E+35 | EG56: =FIB(RC[-101])+RC[-1]+R[-1]C+R[-1]C[-1] -> 1.92581295227532E+36 | EH56: =FIB(RC[-101])+RC[-1]+R[-1]C+R[-1]C[-1] -> 6.33420705454913E+36 | EI56: =FIB(RC[-101])+RC[-1]+R[-1]C+R[-1]C[-1] -> 2.03776858497142E+37 | EJ56: =FIB(RC[-101])+RC[-1]+R[-1]C+R[-1]C[-1] -> 6.41698204459268E+37 | EK56: =FIB(RC[-101])+RC[-1]+R[-1]C+R[-1]C[-1] -> 1.97939495440918E+38 | EL56: =FIB(RC[-101])+RC[-1]+R[-1]C+R[-1]C[-1] -> 5.98489678336073E+38 | EM56: =FIB(RC[-101])+RC[-1]+R[-1]C+R[-1]C[-1] -> 1.77494937162814E+39 | EN56: =FIB(RC[-101])+RC[-1]+R[-1]C+R[-1]C[-1] -> 5.166417366066E+39 | EO56: =FIB(RC[-101])+RC[-1]+R[-1]C+R[-1]C[-1] -> 1.47680716048486E+40 | EP56: =FIB(RC[-101])+RC[-1]+R[-1]C+R[-1]C[-1] -> 4.1479518049891E+40 | EQ56: =FIB(RC[-101])+RC[-1]+R[-1]C+R[-1]C[-1] -> 1.14538907081654E+41 | ER56: =FIB(RC[-101])+RC[-1]+R[-1]C+R[-1]C[-1] -> 3.11103755667204E+41 | ES56: =FIB(RC[-101])+RC[-1]+R[-1]C+R[-1]C[-1] -> 8.31580114831195E+41 | ET56: =FIB(RC[-101])+RC[-1]+R[-1]C+R[-1]C[-1] -> 2.18853822486303E+42 | EU56: =FIB(RC[-101])+RC[-1]+R[-1]C+R[-1]C[-1] -> 5.67350337173049E+42 | EV56: =FIB(RC[-101])+RC[-1]+R[-1]C+R[-1]C[-1] -> 1.44938389314752E+43 | EW56: =FIB(RC[-101])+RC[-1]+R[-1]C+R[-1]C[-1] -> 3.65031691029232E+43 | EX56: =FIB(RC[-101])+RC[-1]+R[-1]C+R[-1]C[-1] -> 9.06704036766261E+43 | EY56: =FIB(RC[-101])+RC[-1]+R[-1]C+R[-1]C[-1] -> 2.2220523649186E+44 | EZ56: =FIB(RC[-101])+RC[-1]+R[-1]C+R[-1]C[-1] -> 5.37472419075168E+44 | FA56: =FIB(RC[-101])+RC[-1]+R[-1]C+R[-1]C[-1] -> 1.28358440222136E+45 | FB56: =FIB(RC[-101])+RC[-1]+R[-1]C+R[-1]C[-1] -> 3.02765480903123E+45 | FC56: =FIB(RC[-101])+RC[-1]+R[-1]C+R[-1]C[-1] -> 7.05575852981178E+45 | FD56: =FIB(RC[-101])+RC[-1]+R[-1]C+R[-1]C[-1] -> 1.62507317920834E+46 | FE56: =FIB(RC[-101])+RC[-1]+R[-1]C+R[-1]C[-1] -> 3.70020163696692E+46 | FF56: =FIB(RC[-101])+RC[-1]+R[-1]C+R[-1]C[-1] -> 8.3315864337021E+46 | FG56: =FIB(RC[-101])+RC[-1]+R[-1]C+R[-1]C[-1] -> 1.85567482902567E+47 | FH56: =FIB(RC[-101])+RC[-1]+R[-1]C+R[-1]C[-1] -> 4.08945622080638E+47 | FI56: =FIB(RC[-101])+RC[-1]+R[-1]C+R[-1]C[-1] -> 8.91933054278322E+47 | FJ56: =FIB(RC[-101])+RC[-1]+R[-1]C+R[-1]C[-1] -> 1.9258013667393E+48 | FK56: =FIB(RC[-101])+RC[-1]+R[-1]C+R[-1]C[-1] -> 4.11726667024475E+48 | FL56: =FIB(RC[-101])+RC[-1]+R[-1]C+R[-1]C[-1] -> 8.71820135226807E+48 | FM56: =FIB(RC[-101])+RC[-1]+R[-1]C+R[-1]C[-1] -> 1.82879002501199E+49 | FN56: =FIB(RC[-101])+RC[-1]+R[-1]C+R[-1]C[-1] -> 3.80115162277904E+49 | FO56: =FIB(RC[-101])+RC[-1]+R[-1]C+R[-1]C[-1] -> 7.83020488363287E+49 | FP56: =FIB(RC[-101])+RC[-1]+R[-1]C+R[-1]C[-1] -> 1.59892021926448E+50 | FQ56: =FIB(RC[-101])+RC[-1]+R[-1]C+R[-1]C[-1] -> 3.2371472085021E+50 | FR56: =FIB(RC[-101])+RC[-1]+R[-1]C+R[-1]C[-1] -> 6.49925473877774E+50 | FS56: =FIB(RC[-101])+RC[-1]+R[-1]C+R[-1]C[-1] -> 1.29422840841214E+51 | FT56: =FIB(RC[-101])+RC[-1]+R[-1]C+R[-1]C[-1] -> 2.5567178453427E+51 | FU56: =FIB(RC[-101])+RC[-1]+R[-1]C+R[-1]C[-1] -> 5.0113527824204E+51 | FV56: =FIB(RC[-101])+RC[-1]+R[-1]C+R[-1]C[-1] -> 9.74767162460662E+51 | FW56: =FIB(RC[-101])+RC[-1]+R[-1]C+R[-1]C[-1] -> 1.88187912125347E+52 | FX56: =FIB(RC[-101])+RC[-1]+R[-1]C+R[-1]C[-1] -> 3.60658760925401E+52 | FY56: =FIB(RC[-101])+RC[-1]+R[-1]C+R[-1]C[-1] -> 6.86249594007774E+52 | FZ56: =FIB(RC[-101])+RC[-1]+R[-1]C+R[-1]C[-1] -> 1.29662229393698E+53 | GA56: =FIB(RC[-101])+RC[-1]+R[-1]C+R[-1]C[-1] -> 2.43306453343456E+53 | GB56: =FIB(RC[-101])+RC[-1]+R[-1]C+R[-1]C[-1] -> 4.53485772667552E+53 | GC56: =FIB(RC[-101])+RC[-1]+R[-1]C+R[-1]C[-1] -> 8.39659004685775E+53 | GD56: =FIB(RC[-101])+RC[-1]+R[-1]C+R[-1]C[-1] -> 1.54464652263759E+54 | GE56: =FIB(RC[-101])+RC[-1]+R[-1]C+R[-1]C[-1] -> 2.82356720245423E+54 | GF56: =FIB(RC[-101])+RC[-1]+R[-1]C+R[-1]C[-1] -> 5.12937425769256E+54 | GG56: =FIB(RC[-101])+RC[-1]+R[-1]C+R[-1]C[-1] -> 9.26148737747036E+54 | GH56: =FIB(RC[-101])+RC[-1]+R[-1]C+R[-1]C[-1] -> 1.66225846469231E+55 | GI56: =FIB(RC[-101])+RC[-1]+R[-1]C+R[-1]C[-1] -> 2.96597696933703E+55 | GJ56: =FIB(RC[-101])+RC[-1]+R[-1]C+R[-1]C[-1] -> 5.26183192767822E+55 | GK56: =FIB(RC[-101])+RC[-1]+R[-1]C+R[-1]C[-1] -> 9.28225269762991E+55 | GL56: =FIB(RC[-101])+RC[-1]+R[-1]C+R[-1]C[-1] -> 1.62840708256271E+56 | GM56: =FIB(RC[-101])+RC[-1]+R[-1]C+R[-1]C[-1] -> 2.84125676864275E+56 | GN56: =FIB(RC[-101])+RC[-1]+R[-1]C+R[-1]C[-1] -> 4.93105017979199E+56 | GO56: =FIB(RC[-101])+RC[-1]+R[-1]C+R[-1]C[-1] -> 8.51318711435388E+56 | GP56: =FIB(RC[-101])+RC[-1]+R[-1]C+R[-1]C[-1] -> 1.46221091438486E+57 | GQ56: =FIB(RC[-101])+RC[-1]+R[-1]C+R[-1]C[-1] -> 2.49880945414237E+57 | GR56: =FIB(RC[-101])+RC[-1]+R[-1]C+R[-1]C[-1] -> 4.24913655575271E+57 | GS56: =FIB(RC[-101])+RC[-1]+R[-1]C+R[-1]C[-1] -> 7.19036293648646E+57
A57: 20 | B57: 20 | C57: 20 | D57: 20 | E57: 20 | F57: 20 | G57: 20 | H57: 20 | I57: 20 | J57: 20 | K57: 20 | L57: 20 | M57: 20 | N57: 20 | O57: 20 | P57: 20 | Q57: 20 | R57: 20 | S57: 20 | T57: 20 | U57: 20 | V57: 20 | W57: 20 | X57: 20 | Y57: 20 | Z57: 20 | AA57: 20 | AB57: 20 | AC57: 20 | AD57: 20 | AE57: 20 | AF57: 20 | AG57: 20 | AH57: 20 | AI57: 20 | AJ57: 20 | AK57: 20 | AL57: 20 | AM57: 20 | AN57: 20 | AO57: 20 | AP57: 20 | AQ57: 20 | AR57: 20 | AS57: 20 | AT57: 20 | AU57: 20 | AV57: 20 | AW57: 20 | AX57: 20 | AY57: 20 | AZ57: 20 | BA57: 20 | BB57: 20 | BC57: 20 | BD57: 20 | BE57: 20 | BF57: 20 | BG57: 20 | BH57: 20 | BI57: 20 | BJ57: 20 | BK57: 20 | BL57: 20 | BM57: 20 | BN57: 20 | BO57: 20 | BP57: 20 | BQ57: 20 | BR57: 20 | BS57: 20 | BT57: 20 | BU57: 20 | BV57: 20 | BW57: 20 | BX57: 20 | BY57: 20 | BZ57: 20 | CA57: 20 | CB57: 20 | CC57: 20 | CD57: 20 | CE57: 20 | CF57: 20 | CG57: 20 | CH57: 20 | CI57: 20 | CJ57: 20 | CK57: 20 | CL57: 20 | CM57: 20 | CN57: 20 | CO57: 20 | CP57: 20 | CQ57: 20 | CR57: 20 | CS57: 20 | CT57: 20 | CU57: 20 | CV57: 20 | CW57: 0 | CX57: =FIB(RC[-101])+RC[-1]+R[-1]C+R[-1]C[-1] -> 612976 | CY57: =FIB(RC[-101])+RC[-1]+R[-1]C+R[-1]C[-1] -> 34939632 | CZ57: =FIB(RC[-101])+RC[-1]+R[-1]C+R[-1]C[-1] -> 1316672448 | DA57: =FIB(RC[-101])+RC[-1]+R[-1]C+R[-1]C[-1] -> 37222354624 | DB57: =FIB(RC[-101])+RC[-1]+R[-1]C+R[-1]C[-1] -> 842278675056 | DC57: =FIB(RC[-101])+RC[-1]+R[-1]C+R[-1]C[-1] -> 15893933777904 | DD57: =FIB(RC[-101])+RC[-1]+R[-1]C+R[-1]C[-1] -> 257295455652352 | DE57: =FIB(RC[-101])+RC[-1]+R[-1]C+R[-1]C[-1] -> 3.64820550322176E+15 | DF57: =FIB(RC[-101])+RC[-1]+R[-1]C+R[-1]C[-1] -> 4.60339539455434E+16 | DG57: =FIB(RC[-101])+RC[-1]+R[-1]C+R[-1]C[-1] -> 5.23467064537601E+17 | DH57: =FIB(RC[-101])+RC[-1]+R[-1]C+R[-1]C[-1] -> 5.41928343929136E+18 | DI57: =FIB(RC[-101])+RC[-1]+R[-1]C+R[-1]C[-1] -> 5.15114305291532E+19 | DJ57: =FIB(RC[-101])+RC[-1]+R[-1]C+R[-1]C[-1] -> 4.52755619312754E+20 | DK57: =FIB(RC[-101])+RC[-1]+R[-1]C+R[-1]C[-1] -> 3.70221668423002E+21 | DL57: =FIB(RC[-101])+RC[-1]+R[-1]C+R[-1]C[-1] -> 2.83126042658914E+22 | DM57: =FIB(RC[-101])+RC[-1]+R[-1]C+R[-1]C[-1] -> 2.03428595769323E+23 | DN57: =FIB(RC[-101])+RC[-1]+R[-1]C+R[-1]C[-1] -> 1.37884899942281E+24 | DO57: =FIB(RC[-101])+RC[-1]+R[-1]C+R[-1]C[-1] -> 8.84823461460313E+24 | DP57: =FIB(RC[-101])+RC[-1]+R[-1]C+R[-1]C[-1] -> 5.39299891284086E+25 | DQ57: =FIB(RC[-101])+RC[-1]+R[-1]C+R[-1]C[-1] -> 3.13110261459382E+26 | DR57: =FIB(RC[-101])+RC[-1]+R[-1]C+R[-1]C[-1] -> 1.73619330130849E+27 | DS57: =FIB(RC[-101])+RC[-1]+R[-1]C+R[-1]C[-1] -> 9.21659811538666E+27 | DT57: =FIB(RC[-101])+RC[-1]+R[-1]C+R[-1]C[-1] -> 4.69422538985861E+28 | DU57: =FIB(RC[-101])+RC[-1]+R[-1]C+R[-1]C[-1] -> 2.29852351966422E+29 | DV57: =FIB(RC[-101])+RC[-1]+R[-1]C+R[-1]C[-1] -> 1.08399719463087E+30 | DW57: =FIB(RC[-101])+RC[-1]+R[-1]C+R[-1]C[-1] -> 4.93223045355572E+30 | DX57: =FIB(RC[-101])+RC[-1]+R[-1]C+R[-1]C[-1] -> 2.16861469745259E+31 | DY57: =FIB(RC[-101])+RC[-1]+R[-1]C+R[-1]C[-1] -> 9.22751725131224E+31 | DZ57: =FIB(RC[-101])+RC[-1]+R[-1]C+R[-1]C[-1] -> 3.80493331354123E+32 | EA57: =FIB(RC[-101])+RC[-1]+R[-1]C+R[-1]C[-1] -> 1.52239088152988E+33 | EB57: =FIB(RC[-101])+RC[-1]+R[-1]C+R[-1]C[-1] -> 5.91757966301613E+33 | EC57: =FIB(RC[-101])+RC[-1]+R[-1]C+R[-1]C[-1] -> 2.23712693515078E+34 | ED57: =FIB(RC[-101])+RC[-1]+R[-1]C+R[-1]C[-1] -> 8.23429086647545E+34 | EE57: =FIB(RC[-101])+RC[-1]+R[-1]C+R[-1]C[-1] -> 2.95382369638736E+35 | EF57: =FIB(RC[-101])+RC[-1]+R[-1]C+R[-1]C[-1] -> 1.03365333325082E+36 | EG57: =FIB(RC[-101])+RC[-1]+R[-1]C+R[-1]C[-1] -> 3.53170026651941E+36 | EH57: =FIB(RC[-101])+RC[-1]+R[-1]C+R[-1]C[-1] -> 1.17917202733439E+37 | EI57: =FIB(RC[-101])+RC[-1]+R[-1]C+R[-1]C[-1] -> 3.85036131776072E+37 | EJ57: =FIB(RC[-101])+RC[-1]+R[-1]C+R[-1]C[-1] -> 1.23051119473248E+38 | EK57: =FIB(RC[-101])+RC[-1]+R[-1]C+R[-1]C[-1] -> 3.85160435360093E+38 | EL57: =FIB(RC[-101])+RC[-1]+R[-1]C+R[-1]C[-1] -> 1.18158960913708E+39 | EM57: =FIB(RC[-101])+RC[-1]+R[-1]C+R[-1]C[-1] -> 3.55502865910129E+39 | EN57: =FIB(RC[-101])+RC[-1]+R[-1]C+R[-1]C[-1] -> 1.04963953967954E+40 | EO57: =FIB(RC[-101])+RC[-1]+R[-1]C+R[-1]C[-1] -> 3.043088436771E+40 | EP57: =FIB(RC[-101])+RC[-1]+R[-1]C+R[-1]C[-1] -> 8.66784740224495E+40 | EQ57: =FIB(RC[-101])+RC[-1]+R[-1]C+R[-1]C[-1] -> 2.42696899153994E+41 | ER57: =FIB(RC[-101])+RC[-1]+R[-1]C+R[-1]C[-1] -> 6.68339561902852E+41 | ES57: =FIB(RC[-101])+RC[-1]+R[-1]C+R[-1]C[-1] -> 1.81102343240125E+42 | ET57: =FIB(RC[-101])+RC[-1]+R[-1]C+R[-1]C[-1] -> 4.83114177209547E+42 | EU57: =FIB(RC[-101])+RC[-1]+R[-1]C+R[-1]C[-1] -> 1.2693183368689E+43 | EV57: =FIB(RC[-101])+RC[-1]+R[-1]C+R[-1]C[-1] -> 3.28605256718947E+43 | EW57: =FIB(RC[-101])+RC[-1]+R[-1]C+R[-1]C[-1] -> 8.38575337062931E+43 | EX57: =FIB(RC[-101])+RC[-1]+R[-1]C+R[-1]C[-1] -> 2.11031106485842E+44 | EY57: =FIB(RC[-101])+RC[-1]+R[-1]C+R[-1]C[-1] -> 5.23906746654328E+44 | EZ57: =FIB(RC[-101])+RC[-1]+R[-1]C+R[-1]C[-1] -> 1.28358440222136E+45 | FA57: =FIB(RC[-101])+RC[-1]+R[-1]C+R[-1]C[-1] -> 3.10464122351788E+45 | FB57: =FIB(RC[-101])+RC[-1]+R[-1]C+R[-1]C[-1] -> 7.41588043477046E+45 | FC57: =FIB(RC[-101])+RC[-1]+R[-1]C+R[-1]C[-1] -> 1.74992937736135E+46 | FD57: =FIB(RC[-101])+RC[-1]+R[-1]C+R[-1]C[-1] -> 4.08057840955086E+46 | FE57: =FIB(RC[-101])+RC[-1]+R[-1]C+R[-1]C[-1] -> 9.40585322572611E+46 | FF57: =FIB(RC[-101])+RC[-1]+R[-1]C+R[-1]C[-1] -> 2.14376412963951E+47 | FG57: =FIB(RC[-101])+RC[-1]+R[-1]C+R[-1]C[-1] -> 4.83259760203539E+47 | FH57: =FIB(RC[-101])+RC[-1]+R[-1]C+R[-1]C[-1] -> 1.07777286518674E+48 | FI57: =FIB(RC[-101])+RC[-1]+R[-1]C+R[-1]C[-1] -> 2.3786515415457E+48 | FJ57: =FIB(RC[-101])+RC[-1]+R[-1]C+R[-1]C[-1] -> 5.19638596256333E+48 | FK57: =FIB(RC[-101])+RC[-1]+R[-1]C+R[-1]C[-1] -> 1.12394539995474E+49 | FL57: =FIB(RC[-101])+RC[-1]+R[-1]C+R[-1]C[-1] -> 2.40749220220602E+49 | FM57: =FIB(RC[-101])+RC[-1]+R[-1]C+R[-1]C[-1] -> 5.10810236244482E+49 | FN57: =FIB(RC[-101])+RC[-1]+R[-1]C+R[-1]C[-1] -> 1.07380440102359E+50 | FO57: =FIB(RC[-101])+RC[-1]+R[-1]C+R[-1]C[-1] -> 2.23694005166478E+50 | FP57: =FIB(RC[-101])+RC[-1]+R[-1]C+R[-1]C[-1] -> 4.61888075929255E+50 | FQ57: =FIB(RC[-101])+RC[-1]+R[-1]C+R[-1]C[-1] -> 9.45494818705912E+50 | FR57: =FIB(RC[-101])+RC[-1]+R[-1]C+R[-1]C[-1] -> 1.9191350134339E+51 | FS57: =FIB(RC[-101])+RC[-1]+R[-1]C+R[-1]C[-1] -> 3.86328889572381E+51 | FT57: =FIB(RC[-101])+RC[-1]+R[-1]C+R[-1]C[-1] -> 7.71423514947865E+51 | FU57: =FIB(RC[-101])+RC[-1]+R[-1]C+R[-1]C[-1] -> 1.52823057772417E+52 | FV57: =FIB(RC[-101])+RC[-1]+R[-1]C+R[-1]C[-1] -> 3.00413301842688E+52 | FW57: =FIB(RC[-101])+RC[-1]+R[-1]C+R[-1]C[-1] -> 5.86077930214101E+52 | FX57: =FIB(RC[-101])+RC[-1]+R[-1]C+R[-1]C[-1] -> 1.13492460326485E+53 | FY57: =FIB(RC[-101])+RC[-1]+R[-1]C+R[-1]C[-1] -> 2.18183295819802E+53 | FZ57: =FIB(RC[-101])+RC[-1]+R[-1]C+R[-1]C[-1] -> 4.16470484614277E+53 | GA57: =FIB(RC[-101])+RC[-1]+R[-1]C+R[-1]C[-1] -> 7.89439167351431E+53 | GB57: =FIB(RC[-101])+RC[-1]+R[-1]C+R[-1]C[-1] -> 1.48623139336244E+54 | GC57: =FIB(RC[-101])+RC[-1]+R[-1]C+R[-1]C[-1] -> 2.77937617071577E+54 | GD57: =FIB(RC[-101])+RC[-1]+R[-1]C+R[-1]C[-1] -> 5.16368169803913E+54 | GE57: =FIB(RC[-101])+RC[-1]+R[-1]C+R[-1]C[-1] -> 9.53189542313096E+54 | GF57: =FIB(RC[-101])+RC[-1]+R[-1]C+R[-1]C[-1] -> 1.74848368832777E+55 | GG57: =FIB(RC[-101])+RC[-1]+R[-1]C+R[-1]C[-1] -> 3.18756985184407E+55 | GH57: =FIB(RC[-101])+RC[-1]+R[-1]C+R[-1]C[-1] -> 5.77597705428341E+55 | GI57: =FIB(RC[-101])+RC[-1]+R[-1]C+R[-1]C[-1] -> 1.04042124883127E+56 | GJ57: =FIB(RC[-101])+RC[-1]+R[-1]C+R[-1]C[-1] -> 1.8632021385328E+56 | GK57: =FIB(RC[-101])+RC[-1]+R[-1]C+R[-1]C[-1] -> 3.31761060106361E+56 | GL57: =FIB(RC[-101])+RC[-1]+R[-1]C+R[-1]C[-1] -> 5.87424295338931E+56 | GM57: =FIB(RC[-101])+RC[-1]+R[-1]C+R[-1]C[-1] -> 1.03439068045948E+57 | GN57: =FIB(RC[-101])+RC[-1]+R[-1]C+R[-1]C[-1] -> 1.81162137530295E+57 | GO57: =FIB(RC[-101])+RC[-1]+R[-1]C+R[-1]C[-1] -> 3.15604510471754E+57 | GP57: =FIB(RC[-101])+RC[-1]+R[-1]C+R[-1]C[-1] -> 5.46957473053778E+57 | GQ57: =FIB(RC[-101])+RC[-1]+R[-1]C+R[-1]C[-1] -> 9.43059509906501E+57 | GR57: =FIB(RC[-101])+RC[-1]+R[-1]C+R[-1]C[-1] -> 1.61785411089601E+58 | GS57: =FIB(RC[-101])+RC[-1]+R[-1]C+R[-1]C[-1] -> 2.76180406011993E+58
A58: 20 | B58: 20 | C58: 20 | D58: 20 | E58: 20 | F58: 20 | G58: 20 | H58: 20 | I58: 20 | J58: 20 | K58: 20 | L58: 20 | M58: 20 | N58: 20 | O58: 20 | P58: 20 | Q58: 20 | R58: 20 | S58: 20 | T58: 20 | U58: 20 | V58: 20 | W58: 20 | X58: 20 | Y58: 20 | Z58: 20 | AA58: 20 | AB58: 20 | AC58: 20 | AD58: 20 | AE58: 20 | AF58: 20 | AG58: 20 | AH58: 20 | AI58: 20 | AJ58: 20 | AK58: 20 | AL58: 20 | AM58: 20 | AN58: 20 | AO58: 20 | AP58: 20 | AQ58: 20 | AR58: 20 | AS58: 20 | AT58: 20 | AU58: 20 | AV58: 20 | AW58: 20 | AX58: 20 | AY58: 20 | AZ58: 20 | BA58: 20 | BB58: 20 | BC58: 20 | BD58: 20 | BE58: 20 | BF58: 20 | BG58: 20 | BH58: 20 | BI58: 20 | BJ58: 20 | BK58: 20 | BL58: 20 | BM58: 20 | BN58: 20 | BO58: 20 | BP58: 20 | BQ58: 20 | BR58: 20 | BS58: 20 | BT58: 20 | BU58: 20 | BV58: 20 | BW58: 20 | BX58: 20 | BY58: 20 | BZ58: 20 | CA58: 20 | CB58: 20 | CC58: 20 | CD58: 20 | CE58: 20 | CF58: 20 | CG58: 20 | CH58: 20 | CI58: 20 | CJ58: 20 | CK58: 20 | CL58: 20 | CM58: 20 | CN58: 20 | CO58: 20 | CP58: 20 | CQ58: 20 | CR58: 20 | CS58: 20 | CT58: 20 | CU58: 20 | CV58: 20 | CW58: 0 | CX58: =FIB(RC[-101])+RC[-1]+R[-1]C+R[-1]C[-1] -> 623922 | CY58: =FIB(RC[-101])+RC[-1]+R[-1]C+R[-1]C[-1] -> 36187476 | CZ58: =FIB(RC[-101])+RC[-1]+R[-1]C+R[-1]C[-1] -> 1387810502 | DA58: =FIB(RC[-101])+RC[-1]+R[-1]C+R[-1]C[-1] -> 39926848520 | DB58: =FIB(RC[-101])+RC[-1]+R[-1]C+R[-1]C[-1] -> 919427889146 | DC58: =FIB(RC[-101])+RC[-1]+R[-1]C+R[-1]C[-1] -> 17655640353052 | DD58: =FIB(RC[-101])+RC[-1]+R[-1]C+R[-1]C[-1] -> 290845029794254 | DE58: =FIB(RC[-101])+RC[-1]+R[-1]C+R[-1]C[-1] -> 4.19634598867931E+15 | DF58: =FIB(RC[-101])+RC[-1]+R[-1]C+R[-1]C[-1] -> 5.38785054374554E+16 | DG58: =FIB(RC[-101])+RC[-1]+R[-1]C+R[-1]C[-1] -> 6.23379523920611E+17 | DH58: =FIB(RC[-101])+RC[-1]+R[-1]C+R[-1]C[-1] -> 6.56613002774959E+18 | DI58: =FIB(RC[-101])+RC[-1]+R[-1]C+R[-1]C[-1] -> 6.34968439961942E+19 | DJ58: =FIB(RC[-101])+RC[-1]+R[-1]C+R[-1]C[-1] -> 5.67763893838102E+20 | DK58: =FIB(RC[-101])+RC[-1]+R[-1]C+R[-1]C[-1] -> 4.72273619738087E+21 | DL58: =FIB(RC[-101])+RC[-1]+R[-1]C+R[-1]C[-1] -> 3.67375571475023E+22 | DM58: =FIB(RC[-101])+RC[-1]+R[-1]C+R[-1]C[-1] -> 2.68478757182717E+23 | DN58: =FIB(RC[-101])+RC[-1]+R[-1]C+R[-1]C[-1] -> 1.85075635237485E+24 | DO58: =FIB(RC[-101])+RC[-1]+R[-1]C+R[-1]C[-1] -> 1.20778399664008E+25 | DP58: =FIB(RC[-101])+RC[-1]+R[-1]C+R[-1]C[-1] -> 7.48560637094126E+25 | DQ58: =FIB(RC[-101])+RC[-1]+R[-1]C+R[-1]C[-1] -> 4.41896314297203E+26 | DR58: =FIB(RC[-101])+RC[-1]+R[-1]C+R[-1]C[-1] -> 2.49119987706508E+27 | DS58: =FIB(RC[-101])+RC[-1]+R[-1]C+R[-1]C[-1] -> 1.34439912937602E+28 | DT58: =FIB(RC[-101])+RC[-1]+R[-1]C+R[-1]C[-1] -> 6.96028433077329E+28 | DU58: =FIB(RC[-101])+RC[-1]+R[-1]C+R[-1]C[-1] -> 3.46397449172741E+29 | DV58: =FIB(RC[-101])+RC[-1]+R[-1]C+R[-1]C[-1] -> 1.66024699577003E+30 | DW58: =FIB(RC[-101])+RC[-1]+R[-1]C+R[-1]C[-1] -> 7.67647464395661E+30 | DX58: =FIB(RC[-101])+RC[-1]+R[-1]C+R[-1]C[-1] -> 3.42948520720382E+31 | DY58: =FIB(RC[-101])+RC[-1]+R[-1]C+R[-1]C[-1] -> 1.48256171559686E+32 | DZ58: =FIB(RC[-101])+RC[-1]+R[-1]C+R[-1]C[-1] -> 6.21024675426931E+32 | EA58: =FIB(RC[-101])+RC[-1]+R[-1]C+R[-1]C[-1] -> 2.52390888831093E+33 | EB58: =FIB(RC[-101])+RC[-1]+R[-1]C+R[-1]C[-1] -> 9.96387943285695E+33 | EC58: =FIB(RC[-101])+RC[-1]+R[-1]C+R[-1]C[-1] -> 3.82527284473809E+34 | ED58: =FIB(RC[-101])+RC[-1]+R[-1]C+R[-1]C[-1] -> 1.42966906463643E+35 | EE58: =FIB(RC[-101])+RC[-1]+R[-1]C+R[-1]C[-1] -> 5.20692184767133E+35 | EF58: =FIB(RC[-101])+RC[-1]+R[-1]C+R[-1]C[-1] -> 1.84972788765669E+36 | EG58: =FIB(RC[-101])+RC[-1]+R[-1]C+R[-1]C[-1] -> 6.41508148742692E+36 | EH58: =FIB(RC[-101])+RC[-1]+R[-1]C+R[-1]C[-1] -> 2.17385020272902E+37 | EI58: =FIB(RC[-101])+RC[-1]+R[-1]C+R[-1]C[-1] -> 7.20338354782412E+37 | EJ58: =FIB(RC[-101])+RC[-1]+R[-1]C+R[-1]C[-1] -> 2.33588568129097E+38 | EK58: =FIB(RC[-101])+RC[-1]+R[-1]C+R[-1]C[-1] -> 7.41800122962438E+38 | EL58: =FIB(RC[-101])+RC[-1]+R[-1]C+R[-1]C[-1] -> 2.30855016745962E+39 | EM58: =FIB(RC[-101])+RC[-1]+R[-1]C+R[-1]C[-1] -> 7.04516843569799E+39 | EN58: =FIB(RC[-101])+RC[-1]+R[-1]C+R[-1]C[-1] -> 2.10965924915947E+40 | EO58: =FIB(RC[-101])+RC[-1]+R[-1]C+R[-1]C[-1] -> 6.20238722561002E+40 | EP58: =FIB(RC[-101])+RC[-1]+R[-1]C+R[-1]C[-1] -> 1.7913323064626E+41 | EQ58: =FIB(RC[-101])+RC[-1]+R[-1]C+R[-1]C[-1] -> 5.08508603822704E+41 | ER58: =FIB(RC[-101])+RC[-1]+R[-1]C+R[-1]C[-1] -> 1.41954506487955E+42 | ES58: =FIB(RC[-101])+RC[-1]+R[-1]C+R[-1]C[-1] -> 3.89890805918365E+42 | ET58: =FIB(RC[-101])+RC[-1]+R[-1]C+R[-1]C[-1] -> 1.05410732636804E+43 | EU58: =FIB(RC[-101])+RC[-1]+R[-1]C+R[-1]C[-1] -> 2.80653984044648E+43 | EV58: =FIB(RC[-101])+RC[-1]+R[-1]C+R[-1]C[-1] -> 7.36191074450486E+43 | EW58: =FIB(RC[-101])+RC[-1]+R[-1]C+R[-1]C[-1] -> 1.90337166823236E+44 | EX58: =FIB(RC[-101])+RC[-1]+R[-1]C+R[-1]C[-1] -> 4.85225807015372E+44 | EY58: =FIB(RC[-101])+RC[-1]+R[-1]C+R[-1]C[-1] -> 1.22016366015554E+45 | EZ58: =FIB(RC[-101])+RC[-1]+R[-1]C+R[-1]C[-1] -> 3.02765480903123E+45 | FA58: =FIB(RC[-101])+RC[-1]+R[-1]C+R[-1]C[-1] -> 7.41588043477046E+45 | FB58: =FIB(RC[-101])+RC[-1]+R[-1]C+R[-1]C[-1] -> 1.79364020930588E+46 | FC58: =FIB(RC[-101])+RC[-1]+R[-1]C+R[-1]C[-1] -> 4.28515763014427E+46 | FD58: =FIB(RC[-101])+RC[-1]+R[-1]C+R[-1]C[-1] -> 1.01156654170565E+47 | FE58: =FIB(RC[-101])+RC[-1]+R[-1]C+R[-1]C[-1] -> 2.36020970523335E+47 | FF58: =FIB(RC[-101])+RC[-1]+R[-1]C+R[-1]C[-1] -> 5.44455915744547E+47 | FG58: =FIB(RC[-101])+RC[-1]+R[-1]C+R[-1]C[-1] -> 1.24209208891204E+48 | FH58: =FIB(RC[-101])+RC[-1]+R[-1]C+R[-1]C[-1] -> 2.80312471430232E+48 | FI58: =FIB(RC[-101])+RC[-1]+R[-1]C+R[-1]C[-1] -> 6.25954912103477E+48 | FJ58: =FIB(RC[-101])+RC[-1]+R[-1]C+R[-1]C[-1] -> 1.38345866251438E+49 | FK58: =FIB(RC[-101])+RC[-1]+R[-1]C+R[-1]C[-1] -> 3.02704265872545E+49 | FL58: =FIB(RC[-101])+RC[-1]+R[-1]C+R[-1]C[-1] -> 6.55848026088621E+49 | FM58: =FIB(RC[-101])+RC[-1]+R[-1]C+R[-1]C[-1] -> 1.4074074825537E+50 | FN58: =FIB(RC[-101])+RC[-1]+R[-1]C+R[-1]C[-1] -> 2.99202211982177E+50 | FO58: =FIB(RC[-101])+RC[-1]+R[-1]C+R[-1]C[-1] -> 6.30276657251013E+50 | FP58: =FIB(RC[-101])+RC[-1]+R[-1]C+R[-1]C[-1] -> 1.31585873834675E+51 | FQ58: =FIB(RC[-101])+RC[-1]+R[-1]C+R[-1]C[-1] -> 2.72324163298191E+51 | FR58: =FIB(RC[-101])+RC[-1]+R[-1]C+R[-1]C[-1] -> 5.58787146512172E+51 | FS58: =FIB(RC[-101])+RC[-1]+R[-1]C+R[-1]C[-1] -> 1.13702953742794E+52 | FT58: =FIB(RC[-101])+RC[-1]+R[-1]C+R[-1]C[-1] -> 2.29478194194819E+52 | FU58: =FIB(RC[-101])+RC[-1]+R[-1]C+R[-1]C[-1] -> 4.59443603462023E+52 | FV58: =FIB(RC[-101])+RC[-1]+R[-1]C+R[-1]C[-1] -> 9.12679963077128E+52 | FW58: =FIB(RC[-101])+RC[-1]+R[-1]C+R[-1]C[-1] -> 1.79917119513392E+53 | FX58: =FIB(RC[-101])+RC[-1]+R[-1]C+R[-1]C[-1] -> 3.52017372861287E+53 | FY58: =FIB(RC[-101])+RC[-1]+R[-1]C+R[-1]C[-1] -> 6.83693129007574E+53 | FZ58: =FIB(RC[-101])+RC[-1]+R[-1]C+R[-1]C[-1] -> 1.31834690944165E+54 | GA58: =FIB(RC[-101])+RC[-1]+R[-1]C+R[-1]C[-1] -> 2.52425656140736E+54 | GB58: =FIB(RC[-101])+RC[-1]+R[-1]C+R[-1]C[-1] -> 4.79992712212123E+54 | GC58: =FIB(RC[-101])+RC[-1]+R[-1]C+R[-1]C[-1] -> 9.06553468619944E+54 | GD58: =FIB(RC[-101])+RC[-1]+R[-1]C+R[-1]C[-1] -> 1.70085925549543E+55 | GE58: =FIB(RC[-101])+RC[-1]+R[-1]C+R[-1]C[-1] -> 3.17041696761244E+55 | GF58: =FIB(RC[-101])+RC[-1]+R[-1]C+R[-1]C[-1] -> 5.87209019825331E+55 | GG58: =FIB(RC[-101])+RC[-1]+R[-1]C+R[-1]C[-1] -> 1.08081437384252E+56 | GH58: =FIB(RC[-101])+RC[-1]+R[-1]C+R[-1]C[-1] -> 1.97716906445526E+56 | GI58: =FIB(RC[-101])+RC[-1]+R[-1]C+R[-1]C[-1] -> 3.59518801871488E+56 | GJ58: =FIB(RC[-101])+RC[-1]+R[-1]C+R[-1]C[-1] -> 6.49881140607895E+56 | GK58: =FIB(RC[-101])+RC[-1]+R[-1]C+R[-1]C[-1] -> 1.16796241456754E+57 | GL58: =FIB(RC[-101])+RC[-1]+R[-1]C+R[-1]C[-1] -> 2.08714777001283E+57 | GM58: =FIB(RC[-101])+RC[-1]+R[-1]C+R[-1]C[-1] -> 3.70896274581123E+57 | GN58: =FIB(RC[-101])+RC[-1]+R[-1]C+R[-1]C[-1] -> 6.55497480157366E+57 | GO58: =FIB(RC[-101])+RC[-1]+R[-1]C+R[-1]C[-1] -> 1.15226412815942E+58 | GP58: =FIB(RC[-101])+RC[-1]+R[-1]C+R[-1]C[-1] -> 2.01482611168495E+58 | GQ58: =FIB(RC[-101])+RC[-1]+R[-1]C+R[-1]C[-1] -> 3.50484309464523E+58 | GR58: =FIB(RC[-101])+RC[-1]+R[-1]C+R[-1]C[-1] -> 6.06575671544774E+58 | GS58: =FIB(RC[-101])+RC[-1]+R[-1]C+R[-1]C[-1] -> 1.04454148864637E+59
A59: 20 | B59: 20 | C59: 20 | D59: 20 | E59: 20 | F59: 20 | G59: 20 | H59: 20 | I59: 20 | J59: 20 | K59: 20 | L59: 20 | M59: 20 | N59: 20 | O59: 20 | P59: 20 | Q59: 20 | R59: 20 | S59: 20 | T59: 20 | U59: 20 | V59: 20 | W59: 20 | X59: 20 | Y59: 20 | Z59: 20 | AA59: 20 | AB59: 20 | AC59: 20 | AD59: 20 | AE59: 20 | AF59: 20 | AG59: 20 | AH59: 20 | AI59: 20 | AJ59: 20 | AK59: 20 | AL59: 20 | AM59: 20 | AN59: 20 | AO59: 20 | AP59: 20 | AQ59: 20 | AR59: 20 | AS59: 20 | AT59: 20 | AU59: 20 | AV59: 20 | AW59: 20 | AX59: 20 | AY59: 20 | AZ59: 20 | BA59: 20 | BB59: 20 | BC59: 20 | BD59: 20 | BE59: 20 | BF59: 20 | BG59: 20 | BH59: 20 | BI59: 20 | BJ59: 20 | BK59: 20 | BL59: 20 | BM59: 20 | BN59: 20 | BO59: 20 | BP59: 20 | BQ59: 20 | BR59: 20 | BS59: 20 | BT59: 20 | BU59: 20 | BV59: 20 | BW59: 20 | BX59: 20 | BY59: 20 | BZ59: 20 | CA59: 20 | CB59: 20 | CC59: 20 | CD59: 20 | CE59: 20 | CF59: 20 | CG59: 20 | CH59: 20 | CI59: 20 | CJ59: 20 | CK59: 20 | CL59: 20 | CM59: 20 | CN59: 20 | CO59: 20 | CP59: 20 | CQ59: 20 | CR59: 20 | CS59: 20 | CT59: 20 | CU59: 20 | CV59: 20 | CW59: 0 | CX59: =FIB(RC[-101])+RC[-1]+R[-1]C+R[-1]C[-1] -> 634868 | CY59: =FIB(RC[-101])+RC[-1]+R[-1]C+R[-1]C[-1] -> 37457212 | CZ59: =FIB(RC[-101])+RC[-1]+R[-1]C+R[-1]C[-1] -> 1461466136 | DA59: =FIB(RC[-101])+RC[-1]+R[-1]C+R[-1]C[-1] -> 42776136104 | DB59: =FIB(RC[-101])+RC[-1]+R[-1]C+R[-1]C[-1] -> 1002130884716 | DC59: =FIB(RC[-101])+RC[-1]+R[-1]C+R[-1]C[-1] -> 19577199137860 | DD59: =FIB(RC[-101])+RC[-1]+R[-1]C+R[-1]C[-1] -> 328077869296112 | DE59: =FIB(RC[-101])+RC[-1]+R[-1]C+R[-1]C[-1] -> 4.81526888778062E+15 | DF59: =FIB(RC[-101])+RC[-1]+R[-1]C+R[-1]C[-1] -> 6.28901203139263E+16 | DG59: =FIB(RC[-101])+RC[-1]+R[-1]C+R[-1]C[-1] -> 7.40148149672004E+17 | DH59: =FIB(RC[-101])+RC[-1]+R[-1]C+R[-1]C[-1] -> 7.92965770134221E+18 | DI59: =FIB(RC[-101])+RC[-1]+R[-1]C+R[-1]C[-1] -> 7.7992631725286E+19 | DJ59: =FIB(RC[-101])+RC[-1]+R[-1]C+R[-1]C[-1] -> 7.09253369559582E+20 | DK59: =FIB(RC[-101])+RC[-1]+R[-1]C+R[-1]C[-1] -> 5.99975346077856E+21 | DL59: =FIB(RC[-101])+RC[-1]+R[-1]C+R[-1]C[-1] -> 4.74600468056617E+22 | DM59: =FIB(RC[-101])+RC[-1]+R[-1]C+R[-1]C[-1] -> 3.52676361135881E+23 | DN59: =FIB(RC[-101])+RC[-1]+R[-1]C+R[-1]C[-1] -> 2.47191147069345E+24 | DO59: =FIB(RC[-101])+RC[-1]+R[-1]C+R[-1]C[-1] -> 1.64005077894691E+25 | DP59: =FIB(RC[-101])+RC[-1]+R[-1]C+R[-1]C[-1] -> 1.03334411465282E+26 | DQ59: =FIB(RC[-101])+RC[-1]+R[-1]C+R[-1]C[-1] -> 6.20086789471898E+26 | DR59: =FIB(RC[-101])+RC[-1]+R[-1]C+R[-1]C[-1] -> 3.55318298083418E+27 | DS59: =FIB(RC[-101])+RC[-1]+R[-1]C+R[-1]C[-1] -> 1.94883741516595E+28 | DT59: =FIB(RC[-101])+RC[-1]+R[-1]C+R[-1]C[-1] -> 1.02535208753153E+29 | DU59: =FIB(RC[-101])+RC[-1]+R[-1]C+R[-1]C[-1] -> 5.18535501233626E+29 | DV59: =FIB(RC[-101])+RC[-1]+R[-1]C+R[-1]C[-1] -> 2.5251799461764E+30 | DW59: =FIB(RC[-101])+RC[-1]+R[-1]C+R[-1]C[-1] -> 1.1861901585903E+31 | DX59: =FIB(RC[-101])+RC[-1]+R[-1]C+R[-1]C[-1] -> 5.38332283018978E+31 | DY59: =FIB(RC[-101])+RC[-1]+R[-1]C+R[-1]C[-1] -> 2.36384251933623E+32 | DZ59: =FIB(RC[-101])+RC[-1]+R[-1]C+R[-1]C[-1] -> 1.00566509892024E+33 | EA59: =FIB(RC[-101])+RC[-1]+R[-1]C+R[-1]C[-1] -> 4.15059866265811E+33 | EB59: =FIB(RC[-101])+RC[-1]+R[-1]C+R[-1]C[-1] -> 1.6638386983826E+34 | EC59: =FIB(RC[-101])+RC[-1]+R[-1]C+R[-1]C[-1] -> 6.48549948640638E+34 | ED59: =FIB(RC[-101])+RC[-1]+R[-1]C+R[-1]C[-1] -> 2.46074629775088E+35 | EE59: =FIB(RC[-101])+RC[-1]+R[-1]C+R[-1]C[-1] -> 9.09733721005864E+35 | EF59: =FIB(RC[-101])+RC[-1]+R[-1]C+R[-1]C[-1] -> 3.28015379342969E+36 | EG59: =FIB(RC[-101])+RC[-1]+R[-1]C+R[-1]C[-1] -> 1.15449631685133E+37 | EH59: =FIB(RC[-101])+RC[-1]+R[-1]C+R[-1]C[-1] -> 3.96985466832304E+37 | EI59: =FIB(RC[-101])+RC[-1]+R[-1]C+R[-1]C[-1] -> 1.33470884188762E+38 | EJ59: =FIB(RC[-101])+RC[-1]+R[-1]C+R[-1]C[-1] -> 4.390932877961E+38 | EK59: =FIB(RC[-101])+RC[-1]+R[-1]C+R[-1]C[-1] -> 1.41448197888763E+39 | EL59: =FIB(RC[-101])+RC[-1]+R[-1]C+R[-1]C[-1] -> 4.46483226930969E+39 | EM59: =FIB(RC[-101])+RC[-1]+R[-1]C+R[-1]C[-1] -> 1.38185508724673E+40 | EN59: =FIB(RC[-101])+RC[-1]+R[-1]C+R[-1]C[-1] -> 4.196031179976E+40 | EO59: =FIB(RC[-101])+RC[-1]+R[-1]C+R[-1]C[-1] -> 1.25080776547455E+41 | EP59: =FIB(RC[-101])+RC[-1]+R[-1]C+R[-1]C[-1] -> 3.66237879449815E+41 | EQ59: =FIB(RC[-101])+RC[-1]+R[-1]C+R[-1]C[-1] -> 1.05387971391878E+42 | ER59: =FIB(RC[-101])+RC[-1]+R[-1]C+R[-1]C[-1] -> 2.98193338262103E+42 | ES59: =FIB(RC[-101])+RC[-1]+R[-1]C+R[-1]C[-1] -> 8.30038650668423E+42 | ET59: =FIB(RC[-101])+RC[-1]+R[-1]C+R[-1]C[-1] -> 2.27403678295483E+43 | EU59: =FIB(RC[-101])+RC[-1]+R[-1]C+R[-1]C[-1] -> 6.13468394976935E+43 | EV59: =FIB(RC[-101])+RC[-1]+R[-1]C+R[-1]C[-1] -> 1.63031345347207E+44 | EW59: =FIB(RC[-101])+RC[-1]+R[-1]C+R[-1]C[-1] -> 4.26987619615492E+44 | EX59: =FIB(RC[-101])+RC[-1]+R[-1]C+R[-1]C[-1] -> 1.1025505934541E+45 | EY59: =FIB(RC[-101])+RC[-1]+R[-1]C+R[-1]C[-1] -> 2.80794006062501E+45 | EZ59: =FIB(RC[-101])+RC[-1]+R[-1]C+R[-1]C[-1] -> 7.05575852981178E+45 | FA59: =FIB(RC[-101])+RC[-1]+R[-1]C+R[-1]C[-1] -> 1.74992937736135E+46 | FB59: =FIB(RC[-101])+RC[-1]+R[-1]C+R[-1]C[-1] -> 4.28515763014427E+46 | FC59: =FIB(RC[-101])+RC[-1]+R[-1]C+R[-1]C[-1] -> 1.03639554695944E+47 | FD59: =FIB(RC[-101])+RC[-1]+R[-1]C+R[-1]C[-1] -> 2.47647785167952E+47 | FE59: =FIB(RC[-101])+RC[-1]+R[-1]C+R[-1]C[-1] -> 5.84825409861851E+47 | FF59: =FIB(RC[-101])+RC[-1]+R[-1]C+R[-1]C[-1] -> 1.36530229612973E+48 | FG59: =FIB(RC[-101])+RC[-1]+R[-1]C+R[-1]C[-1] -> 3.15185030078632E+48 | FH59: =FIB(RC[-101])+RC[-1]+R[-1]C+R[-1]C[-1] -> 7.19706710400068E+48 | FI59: =FIB(RC[-101])+RC[-1]+R[-1]C+R[-1]C[-1] -> 1.62597409393378E+49 | FJ59: =FIB(RC[-101])+RC[-1]+R[-1]C+R[-1]C[-1] -> 3.63538766855163E+49 | FK59: =FIB(RC[-101])+RC[-1]+R[-1]C+R[-1]C[-1] -> 8.04588898979146E+49 | FL59: =FIB(RC[-101])+RC[-1]+R[-1]C+R[-1]C[-1] -> 1.76314119094031E+50 | FM59: =FIB(RC[-101])+RC[-1]+R[-1]C+R[-1]C[-1] -> 3.82639669958264E+50 | FN59: =FIB(RC[-101])+RC[-1]+R[-1]C+R[-1]C[-1] -> 8.22582630195811E+50 | FO59: =FIB(RC[-101])+RC[-1]+R[-1]C+R[-1]C[-1] -> 1.752061499429E+51 | FP59: =FIB(RC[-101])+RC[-1]+R[-1]C+R[-1]C[-1] -> 3.69819689502676E+51 | FQ59: =FIB(RC[-101])+RC[-1]+R[-1]C+R[-1]C[-1] -> 7.73729726635542E+51 | FR59: =FIB(RC[-101])+RC[-1]+R[-1]C+R[-1]C[-1] -> 1.60484103644591E+52 | FS59: =FIB(RC[-101])+RC[-1]+R[-1]C+R[-1]C[-1] -> 3.30065772038602E+52 | FT59: =FIB(RC[-101])+RC[-1]+R[-1]C+R[-1]C[-1] -> 6.73246919976215E+52 | FU59: =FIB(RC[-101])+RC[-1]+R[-1]C+R[-1]C[-1] -> 1.36216871763306E+53 | FV59: =FIB(RC[-101])+RC[-1]+R[-1]C+R[-1]C[-1] -> 2.73429228417221E+53 | FW59: =FIB(RC[-101])+RC[-1]+R[-1]C+R[-1]C[-1] -> 5.44614344238325E+53 | FX59: =FIB(RC[-101])+RC[-1]+R[-1]C+R[-1]C[-1] -> 1.076548836613E+54 | FY59: =FIB(RC[-101])+RC[-1]+R[-1]C+R[-1]C[-1] -> 2.11225933848186E+54 | FZ59: =FIB(RC[-101])+RC[-1]+R[-1]C+R[-1]C[-1] -> 4.11429937693109E+54 | GA59: =FIB(RC[-101])+RC[-1]+R[-1]C+R[-1]C[-1] -> 7.9569028477801E+54 | GB59: =FIB(RC[-101])+RC[-1]+R[-1]C+R[-1]C[-1] -> 1.52810865313087E+55 | GC59: =FIB(RC[-101])+RC[-1]+R[-1]C+R[-1]C[-1] -> 2.91465483396294E+55 | GD59: =FIB(RC[-101])+RC[-1]+R[-1]C+R[-1]C[-1] -> 5.52206755807831E+55 | GE59: =FIB(RC[-101])+RC[-1]+R[-1]C+R[-1]C[-1] -> 1.03933437811862E+56 | GF59: =FIB(RC[-101])+RC[-1]+R[-1]C+R[-1]C[-1] -> 1.94358509470519E+56 | GG59: =FIB(RC[-101])+RC[-1]+R[-1]C+R[-1]C[-1] -> 3.61160848837304E+56 | GH59: =FIB(RC[-101])+RC[-1]+R[-1]C+R[-1]C[-1] -> 6.66959192667082E+56 | GI59: =FIB(RC[-101])+RC[-1]+R[-1]C+R[-1]C[-1] -> 1.2241949009841E+57 | GJ59: =FIB(RC[-101])+RC[-1]+R[-1]C+R[-1]C[-1] -> 2.23359484346348E+57 | GK59: =FIB(RC[-101])+RC[-1]+R[-1]C+R[-1]C[-1] -> 4.05143839863891E+57 | GL59: =FIB(RC[-101])+RC[-1]+R[-1]C+R[-1]C[-1] -> 7.30654858321927E+57 | GM59: =FIB(RC[-101])+RC[-1]+R[-1]C+R[-1]C[-1] -> 1.31026590990433E+58 | GN59: =FIB(RC[-101])+RC[-1]+R[-1]C+R[-1]C[-1] -> 2.33665966464282E+58 | GO59: =FIB(RC[-101])+RC[-1]+R[-1]C+R[-1]C[-1] -> 4.1444212729596E+58 | GP59: =FIB(RC[-101])+RC[-1]+R[-1]C+R[-1]C[-1] -> 7.31151151280397E+58 | GQ59: =FIB(RC[-101])+RC[-1]+R[-1]C+R[-1]C[-1] -> 1.28311807191341E+59 | GR59: =FIB(RC[-101])+RC[-1]+R[-1]C+R[-1]C[-1] -> 2.24017805292271E+59 | GS59: =FIB(RC[-101])+RC[-1]+R[-1]C+R[-1]C[-1] -> 3.89129521311385E+59
A60: 20 | B60: 20 | C60: 20 | D60: 20 | E60: 20 | F60: 20 | G60: 20 | H60: 20 | I60: 20 | J60: 20 | K60: 20 | L60: 20 | M60: 20 | N60: 20 | O60: 20 | P60: 20 | Q60: 20 | R60: 20 | S60: 20 | T60: 20 | U60: 20 | V60: 20 | W60: 20 | X60: 20 | Y60: 20 | Z60: 20 | AA60: 20 | AB60: 20 | AC60: 20 | AD60: 20 | AE60: 20 | AF60: 20 | AG60: 20 | AH60: 20 | AI60: 20 | AJ60: 20 | AK60: 20 | AL60: 20 | AM60: 20 | AN60: 20 | AO60: 20 | AP60: 20 | AQ60: 20 | AR60: 20 | AS60: 20 | AT60: 20 | AU60: 20 | AV60: 20 | AW60: 20 | AX60: 20 | AY60: 20 | AZ60: 20 | BA60: 20 | BB60: 20 | BC60: 20 | BD60: 20 | BE60: 20 | BF60: 20 | BG60: 20 | BH60: 20 | BI60: 20 | BJ60: 20 | BK60: 20 | BL60: 20 | BM60: 20 | BN60: 20 | BO60: 20 | BP60: 20 | BQ60: 20 | BR60: 20 | BS60: 20 | BT60: 20 | BU60: 20 | BV60: 20 | BW60: 20 | BX60: 20 | BY60: 20 | BZ60: 20 | CA60: 20 | CB60: 20 | CC60: 20 | CD60: 20 | CE60: 20 | CF60: 20 | CG60: 20 | CH60: 20 | CI60: 20 | CJ60: 20 | CK60: 20 | CL60: 20 | CM60: 20 | CN60: 20 | CO60: 20 | CP60: 20 | CQ60: 20 | CR60: 20 | CS60: 20 | CT60: 20 | CU60: 20 | CV60: 20 | CW60: 0 | CX60: =FIB(RC[-101])+RC[-1]+R[-1]C+R[-1]C[-1] -> 645814 | CY60: =FIB(RC[-101])+RC[-1]+R[-1]C+R[-1]C[-1] -> 38748840 | CZ60: =FIB(RC[-101])+RC[-1]+R[-1]C+R[-1]C[-1] -> 1537683134 | DA60: =FIB(RC[-101])+RC[-1]+R[-1]C+R[-1]C[-1] -> 45775296320 | DB60: =FIB(RC[-101])+RC[-1]+R[-1]C+R[-1]C[-1] -> 1090682328086 | DC60: =FIB(RC[-101])+RC[-1]+R[-1]C+R[-1]C[-1] -> 21670012361608 | DD60: =FIB(RC[-101])+RC[-1]+R[-1]C+R[-1]C[-1] -> 369325080806526 | DE60: =FIB(RC[-101])+RC[-1]+R[-1]C+R[-1]C[-1] -> 5.51267183789421E+15 | DF60: =FIB(RC[-101])+RC[-1]+R[-1]C+R[-1]C[-1] -> 7.32180610396121E+16 | DG60: =FIB(RC[-101])+RC[-1]+R[-1]C+R[-1]C[-1] -> 8.76256331025553E+17 | DH60: =FIB(RC[-101])+RC[-1]+R[-1]C+R[-1]C[-1] -> 9.54606218203978E+18 | DI60: =FIB(RC[-101])+RC[-1]+R[-1]C+R[-1]C[-1] -> 9.5468351608668E+19 | DJ60: =FIB(RC[-101])+RC[-1]+R[-1]C+R[-1]C[-1] -> 8.82714352893536E+20 | DK60: =FIB(RC[-101])+RC[-1]+R[-1]C+R[-1]C[-1] -> 7.59172118323168E+21 | DL60: =FIB(RC[-101])+RC[-1]+R[-1]C+R[-1]C[-1] -> 6.10515214496719E+22 | DM60: =FIB(RC[-101])+RC[-1]+R[-1]C+R[-1]C[-1] -> 4.61187929391215E+23 | DN60: =FIB(RC[-101])+RC[-1]+R[-1]C+R[-1]C[-1] -> 3.28577576122055E+24 | DO60: =FIB(RC[-101])+RC[-1]+R[-1]C+R[-1]C[-1] -> 2.21581950213831E+25 | DP60: =FIB(RC[-101])+RC[-1]+R[-1]C+R[-1]C[-1] -> 1.41893114276135E+26 | DQ60: =FIB(RC[-101])+RC[-1]+R[-1]C+R[-1]C[-1] -> 8.65314315213315E+26 | DR60: =FIB(RC[-101])+RC[-1]+R[-1]C+R[-1]C[-1] -> 5.03858408551939E+27 | DS60: =FIB(RC[-101])+RC[-1]+R[-1]C+R[-1]C[-1] -> 2.8080141218013E+28 | DT60: =FIB(RC[-101])+RC[-1]+R[-1]C+R[-1]C[-1] -> 1.50103724122825E+29 | DU60: =FIB(RC[-101])+RC[-1]+R[-1]C+R[-1]C[-1] -> 7.71174434109604E+29 | DV60: =FIB(RC[-101])+RC[-1]+R[-1]C+R[-1]C[-1] -> 3.81488988151963E+30 | DW60: =FIB(RC[-101])+RC[-1]+R[-1]C+R[-1]C[-1] -> 1.82019714135991E+31 | DX60: =FIB(RC[-101])+RC[-1]+R[-1]C+R[-1]C[-1] -> 8.38971013014E+31 | DY60: =FIB(RC[-101])+RC[-1]+R[-1]C+R[-1]C[-1] -> 3.7411458153692E+32 | DZ60: =FIB(RC[-101])+RC[-1]+R[-1]C+R[-1]C[-1] -> 1.61616393239078E+33 | EA60: =FIB(RC[-101])+RC[-1]+R[-1]C+R[-1]C[-1] -> 6.77242769396913E+33 | EB60: =FIB(RC[-101])+RC[-1]+R[-1]C+R[-1]C[-1] -> 2.75614133404532E+34 | EC60: =FIB(RC[-101])+RC[-1]+R[-1]C+R[-1]C[-1] -> 1.09054795188343E+35 | ED60: =FIB(RC[-101])+RC[-1]+R[-1]C+R[-1]C[-1] -> 4.19984419827495E+35 | EE60: =FIB(RC[-101])+RC[-1]+R[-1]C+R[-1]C[-1] -> 1.57579277060845E+36 | EF60: =FIB(RC[-101])+RC[-1]+R[-1]C+R[-1]C[-1] -> 5.765680285044E+36 | EG60: =FIB(RC[-101])+RC[-1]+R[-1]C+R[-1]C[-1] -> 2.0590797246987E+37 | EH60: =FIB(RC[-101])+RC[-1]+R[-1]C+R[-1]C[-1] -> 7.18343070987307E+37 | EI60: =FIB(RC[-101])+RC[-1]+R[-1]C+R[-1]C[-1] -> 2.45003737970723E+38 | EJ60: =FIB(RC[-101])+RC[-1]+R[-1]C+R[-1]C[-1] -> 8.17567909955585E+38 | EK60: =FIB(RC[-101])+RC[-1]+R[-1]C+R[-1]C[-1] -> 2.67114317663932E+39 | EL60: =FIB(RC[-101])+RC[-1]+R[-1]C+R[-1]C[-1] -> 8.55045742483664E+39 | EM60: =FIB(RC[-101])+RC[-1]+R[-1]C+R[-1]C[-1] -> 2.68338405666136E+40 | EN60: =FIB(RC[-101])+RC[-1]+R[-1]C+R[-1]C[-1] -> 8.2612703238841E+40 | EO60: =FIB(RC[-101])+RC[-1]+R[-1]C+R[-1]C[-1] -> 2.49653791586056E+41 | EP60: =FIB(RC[-101])+RC[-1]+R[-1]C+R[-1]C[-1] -> 7.40972447583326E+41 | EQ60: =FIB(RC[-101])+RC[-1]+R[-1]C+R[-1]C[-1] -> 2.16109004095192E+42 | ER60: =FIB(RC[-101])+RC[-1]+R[-1]C+R[-1]C[-1] -> 6.19690313749173E+42 | ES60: =FIB(RC[-101])+RC[-1]+R[-1]C+R[-1]C[-1] -> 1.7479223026797E+43 | ET60: =FIB(RC[-101])+RC[-1]+R[-1]C+R[-1]C[-1] -> 4.85199773630295E+43 | EU60: =FIB(RC[-101])+RC[-1]+R[-1]C+R[-1]C[-1] -> 1.32607184690271E+44 | EV60: =FIB(RC[-101])+RC[-1]+R[-1]C+R[-1]C[-1] -> 3.56985369535172E+44 | EW60: =FIB(RC[-101])+RC[-1]+R[-1]C+R[-1]C[-1] -> 9.4700433449787E+44 | EX60: =FIB(RC[-101])+RC[-1]+R[-1]C+R[-1]C[-1] -> 2.47654254756746E+45 | EY60: =FIB(RC[-101])+RC[-1]+R[-1]C+R[-1]C[-1] -> 6.38703320164658E+45 | EZ60: =FIB(RC[-101])+RC[-1]+R[-1]C+R[-1]C[-1] -> 1.62507317920834E+46 | FA60: =FIB(RC[-101])+RC[-1]+R[-1]C+R[-1]C[-1] -> 4.08057840955086E+46 | FB60: =FIB(RC[-101])+RC[-1]+R[-1]C+R[-1]C[-1] -> 1.01156654170565E+47 | FC60: =FIB(RC[-101])+RC[-1]+R[-1]C+R[-1]C[-1] -> 2.47647785167952E+47 | FD60: =FIB(RC[-101])+RC[-1]+R[-1]C+R[-1]C[-1] -> 5.98935125031848E+47 | FE60: =FIB(RC[-101])+RC[-1]+R[-1]C+R[-1]C[-1] -> 1.43140832006165E+48 | FF60: =FIB(RC[-101])+RC[-1]+R[-1]C+R[-1]C[-1] -> 3.38153602605323E+48 | FG60: =FIB(RC[-101])+RC[-1]+R[-1]C+R[-1]C[-1] -> 7.89868862296928E+48 | FH60: =FIB(RC[-101])+RC[-1]+R[-1]C+R[-1]C[-1] -> 1.82476060277563E+49 | FI60: =FIB(RC[-101])+RC[-1]+R[-1]C+R[-1]C[-1] -> 4.17044140710947E+49 | FJ60: =FIB(RC[-101])+RC[-1]+R[-1]C+R[-1]C[-1] -> 9.43180316959488E+49 | FK60: =FIB(RC[-101])+RC[-1]+R[-1]C+R[-1]C[-1] -> 2.1113079827938E+50 | FL60: =FIB(RC[-101])+RC[-1]+R[-1]C+R[-1]C[-1] -> 4.67903807271326E+50 | FM60: =FIB(RC[-101])+RC[-1]+R[-1]C+R[-1]C[-1] -> 1.02685759632362E+51 | FN60: =FIB(RC[-101])+RC[-1]+R[-1]C+R[-1]C[-1] -> 2.2320798964777E+51 | FO60: =FIB(RC[-101])+RC[-1]+R[-1]C+R[-1]C[-1] -> 4.80672402610251E+51 | FP60: =FIB(RC[-101])+RC[-1]+R[-1]C+R[-1]C[-1] -> 1.02569824205583E+52 | FQ60: =FIB(RC[-101])+RC[-1]+R[-1]C+R[-1]C[-1] -> 2.16924765819404E+52 | FR60: =FIB(RC[-101])+RC[-1]+R[-1]C+R[-1]C[-1] -> 4.54781842127549E+52 | FS60: =FIB(RC[-101])+RC[-1]+R[-1]C+R[-1]C[-1] -> 9.45331717810742E+52 | FT60: =FIB(RC[-101])+RC[-1]+R[-1]C+R[-1]C[-1] -> 1.94864440982556E+53 | FU60: =FIB(RC[-101])+RC[-1]+R[-1]C+R[-1]C[-1] -> 3.98406004743483E+53 | FV60: =FIB(RC[-101])+RC[-1]+R[-1]C+R[-1]C[-1] -> 8.0805210492401E+53 | FW60: =FIB(RC[-101])+RC[-1]+R[-1]C+R[-1]C[-1] -> 1.62609567757956E+54 | FX60: =FIB(RC[-101])+RC[-1]+R[-1]C+R[-1]C[-1] -> 3.24725885843088E+54 | FY60: =FIB(RC[-101])+RC[-1]+R[-1]C+R[-1]C[-1] -> 6.43606703352575E+54 | FZ60: =FIB(RC[-101])+RC[-1]+R[-1]C+R[-1]C[-1] -> 1.26626257489387E+55 | GA60: =FIB(RC[-101])+RC[-1]+R[-1]C+R[-1]C[-1] -> 2.47338279736499E+55 | GB60: =FIB(RC[-101])+RC[-1]+R[-1]C+R[-1]C[-1] -> 4.79718173527387E+55 | GC60: =FIB(RC[-101])+RC[-1]+R[-1]C+R[-1]C[-1] -> 9.23994522236768E+55 | GD60: =FIB(RC[-101])+RC[-1]+R[-1]C+R[-1]C[-1] -> 1.76766676144089E+56 | GE60: =FIB(RC[-101])+RC[-1]+R[-1]C+R[-1]C[-1] -> 3.35920789536734E+56 | GF60: =FIB(RC[-101])+RC[-1]+R[-1]C+R[-1]C[-1] -> 6.34212736819116E+56 | GG60: =FIB(RC[-101])+RC[-1]+R[-1]C+R[-1]C[-1] -> 1.18973209512694E+57 | GH60: =FIB(RC[-101])+RC[-1]+R[-1]C+R[-1]C[-1] -> 2.21785213663132E+57 | GI60: =FIB(RC[-101])+RC[-1]+R[-1]C+R[-1]C[-1] -> 4.1090062302825E+57 | GJ60: =FIB(RC[-101])+RC[-1]+R[-1]C+R[-1]C[-1] -> 7.56679597473008E+57 | GK60: =FIB(RC[-101])+RC[-1]+R[-1]C+R[-1]C[-1] -> 1.38518292168325E+58 | GL60: =FIB(RC[-101])+RC[-1]+R[-1]C+R[-1]C[-1] -> 2.52098161986907E+58 | GM60: =FIB(RC[-101])+RC[-1]+R[-1]C+R[-1]C[-1] -> 4.56190238809533E+58 | GN60: =FIB(RC[-101])+RC[-1]+R[-1]C+R[-1]C[-1] -> 8.20882796264248E+58 | GO60: =FIB(RC[-101])+RC[-1]+R[-1]C+R[-1]C[-1] -> 1.46899089002449E+59 | GP60: =FIB(RC[-101])+RC[-1]+R[-1]C+R[-1]C[-1] -> 2.61458416860085E+59 | GQ60: =FIB(RC[-101])+RC[-1]+R[-1]C+R[-1]C[-1] -> 4.62885339179466E+59 | GR60: =FIB(RC[-101])+RC[-1]+R[-1]C+R[-1]C[-1] -> 8.15214951663078E+59 | GS60: =FIB(RC[-101])+RC[-1]+R[-1]C+R[-1]C[-1] -> 1.42836227826673E+60
A61: 20 | B61: 20 | C61: 20 | D61: 20 | E61: 20 | F61: 20 | G61: 20 | H61: 20 | I61: 20 | J61: 20 | K61: 20 | L61: 20 | M61: 20 | N61: 20 | O61: 20 | P61: 20 | Q61: 20 | R61: 20 | S61: 20 | T61: 20 | U61: 20 | V61: 20 | W61: 20 | X61: 20 | Y61: 20 | Z61: 20 | AA61: 20 | AB61: 20 | AC61: 20 | AD61: 20 | AE61: 20 | AF61: 20 | AG61: 20 | AH61: 20 | AI61: 20 | AJ61: 20 | AK61: 20 | AL61: 20 | AM61: 20 | AN61: 20 | AO61: 20 | AP61: 20 | AQ61: 20 | AR61: 20 | AS61: 20 | AT61: 20 | AU61: 20 | AV61: 20 | AW61: 20 | AX61: 20 | AY61: 20 | AZ61: 20 | BA61: 20 | BB61: 20 | BC61: 20 | BD61: 20 | BE61: 20 | BF61: 20 | BG61: 20 | BH61: 20 | BI61: 20 | BJ61: 20 | BK61: 20 | BL61: 20 | BM61: 20 | BN61: 20 | BO61: 20 | BP61: 20 | BQ61: 20 | BR61: 20 | BS61: 20 | BT61: 20 | BU61: 20 | BV61: 20 | BW61: 20 | BX61: 20 | BY61: 20 | BZ61: 20 | CA61: 20 | CB61: 20 | CC61: 20 | CD61: 20 | CE61: 20 | CF61: 20 | CG61: 20 | CH61: 20 | CI61: 20 | CJ61: 20 | CK61: 20 | CL61: 20 | CM61: 20 | CN61: 20 | CO61: 20 | CP61: 20 | CQ61: 20 | CR61: 20 | CS61: 20 | CT61: 20 | CU61: 20 | CV61: 20 | CW61: 0 | CX61: =FIB(RC[-101])+RC[-1]+R[-1]C+R[-1]C[-1] -> 656760 | CY61: =FIB(RC[-101])+RC[-1]+R[-1]C+R[-1]C[-1] -> 40062360 | CZ61: =FIB(RC[-101])+RC[-1]+R[-1]C+R[-1]C[-1] -> 1616505280 | DA61: =FIB(RC[-101])+RC[-1]+R[-1]C+R[-1]C[-1] -> 48929495680 | DB61: =FIB(RC[-101])+RC[-1]+R[-1]C+R[-1]C[-1] -> 1185387131032 | DC61: =FIB(RC[-101])+RC[-1]+R[-1]C+R[-1]C[-1] -> 23946081831672 | DD61: =FIB(RC[-101])+RC[-1]+R[-1]C+R[-1]C[-1] -> 414941175010752 | DE61: =FIB(RC[-101])+RC[-1]+R[-1]C+R[-1]C[-1] -> 6.29693809372243E+15 | DF61: =FIB(RC[-101])+RC[-1]+R[-1]C+R[-1]C[-1] -> 8.50276709712396E+16 | DG61: =FIB(RC[-101])+RC[-1]+R[-1]C+R[-1]C[-1] -> 1.03450206303642E+18 | DH61: =FIB(RC[-101])+RC[-1]+R[-1]C+R[-1]C[-1] -> 1.14568205761018E+19 | DI61: =FIB(RC[-101])+RC[-1]+R[-1]C+R[-1]C[-1] -> 1.1647123436681E+20 | DJ61: =FIB(RC[-101])+RC[-1]+R[-1]C+R[-1]C[-1] -> 1.09465393886901E+21 | DK61: =FIB(RC[-101])+RC[-1]+R[-1]C+R[-1]C[-1] -> 9.56908947499423E+21 | DL61: =FIB(RC[-101])+RC[-1]+R[-1]C+R[-1]C[-1] -> 7.82123321078978E+22 | DM61: =FIB(RC[-101])+RC[-1]+R[-1]C+R[-1]C[-1] -> 6.00451782948784E+23 | DN61: =FIB(RC[-101])+RC[-1]+R[-1]C+R[-1]C[-1] -> 4.34741547356055E+24 | DO61: =FIB(RC[-101])+RC[-1]+R[-1]C+R[-1]C[-1] -> 2.97913862561642E+25 | DP61: =FIB(RC[-101])+RC[-1]+R[-1]C+R[-1]C[-1] -> 1.93842695553682E+26 | DQ61: =FIB(RC[-101])+RC[-1]+R[-1]C+R[-1]C[-1] -> 1.20105012504313E+27 | DR61: =FIB(RC[-101])+RC[-1]+R[-1]C+R[-1]C[-1] -> 7.10494852577584E+27 | DS61: =FIB(RC[-101])+RC[-1]+R[-1]C+R[-1]C[-1] -> 4.02236738293083E+28 | DT61: =FIB(RC[-101])+RC[-1]+R[-1]C+R[-1]C[-1] -> 2.18407539170146E+29 | DU61: =FIB(RC[-101])+RC[-1]+R[-1]C+R[-1]C[-1] -> 1.13968569740258E+30 | DV61: =FIB(RC[-101])+RC[-1]+R[-1]C+R[-1]C[-1] -> 5.72575001303181E+30 | DW61: =FIB(RC[-101])+RC[-1]+R[-1]C+R[-1]C[-1] -> 2.77426113081505E+31 | DX61: =FIB(RC[-101])+RC[-1]+R[-1]C+R[-1]C[-1] -> 1.2984168402315E+32 | DY61: =FIB(RC[-101])+RC[-1]+R[-1]C+R[-1]C[-1] -> 5.8785336686147E+32 | DZ61: =FIB(RC[-101])+RC[-1]+R[-1]C+R[-1]C[-1] -> 2.57813188078917E+33 | EA61: =FIB(RC[-101])+RC[-1]+R[-1]C+R[-1]C[-1] -> 1.09667235071491E+34 | EB61: =FIB(RC[-101])+RC[-1]+R[-1]C+R[-1]C[-1] -> 4.53005645415714E+34 | EC61: =FIB(RC[-101])+RC[-1]+R[-1]C+R[-1]C[-1] -> 1.81916773070368E+35 | ED61: =FIB(RC[-101])+RC[-1]+R[-1]C+R[-1]C[-1] -> 7.10955988086205E+35 | EE61: =FIB(RC[-101])+RC[-1]+R[-1]C+R[-1]C[-1] -> 2.70673317852215E+36 | EF61: =FIB(RC[-101])+RC[-1]+R[-1]C+R[-1]C[-1] -> 1.00482062341746E+37 | EG61: =FIB(RC[-101])+RC[-1]+R[-1]C+R[-1]C[-1] -> 3.64046837662056E+37 | EH61: =FIB(RC[-101])+RC[-1]+R[-1]C+R[-1]C[-1] -> 1.28829788111923E+38 | EI61: =FIB(RC[-101])+RC[-1]+R[-1]C+R[-1]C[-1] -> 4.45667833181377E+38 | EJ61: =FIB(RC[-101])+RC[-1]+R[-1]C+R[-1]C[-1] -> 1.50823948110768E+39 | EK61: =FIB(RC[-101])+RC[-1]+R[-1]C+R[-1]C[-1] -> 4.99695056770259E+39 | EL61: =FIB(RC[-101])+RC[-1]+R[-1]C+R[-1]C[-1] -> 1.62185511691785E+40 | EM61: =FIB(RC[-101])+RC[-1]+R[-1]C+R[-1]C[-1] -> 5.16028491606288E+40 | EN61: =FIB(RC[-101])+RC[-1]+R[-1]C+R[-1]C[-1] -> 1.61049392966083E+41 | EO61: =FIB(RC[-101])+RC[-1]+R[-1]C+R[-1]C[-1] -> 4.9331588779098E+41 | EP61: =FIB(RC[-101])+RC[-1]+R[-1]C+R[-1]C[-1] -> 1.48394212696036E+42 | EQ61: =FIB(RC[-101])+RC[-1]+R[-1]C+R[-1]C[-1] -> 4.38600461549561E+42 | ER61: =FIB(RC[-101])+RC[-1]+R[-1]C+R[-1]C[-1] -> 1.27439977939393E+43 | ES61: =FIB(RC[-101])+RC[-1]+R[-1]C+R[-1]C[-1] -> 3.6420123958228E+43 | ET61: =FIB(RC[-101])+RC[-1]+R[-1]C+R[-1]C[-1] -> 1.02419324348054E+44 | EU61: =FIB(RC[-101])+RC[-1]+R[-1]C+R[-1]C[-1] -> 2.83546486401355E+44 | EV61: =FIB(RC[-101])+RC[-1]+R[-1]C+R[-1]C[-1] -> 7.73139040626798E+44 | EW61: =FIB(RC[-101])+RC[-1]+R[-1]C+R[-1]C[-1] -> 2.07712874465984E+45 | EX61: =FIB(RC[-101])+RC[-1]+R[-1]C+R[-1]C[-1] -> 5.50067562672517E+45 | EY61: =FIB(RC[-101])+RC[-1]+R[-1]C+R[-1]C[-1] -> 1.43642513759392E+46 | EZ61: =FIB(RC[-101])+RC[-1]+R[-1]C+R[-1]C[-1] -> 3.70020163696692E+46 | FA61: =FIB(RC[-101])+RC[-1]+R[-1]C+R[-1]C[-1] -> 9.40585322572611E+46 | FB61: =FIB(RC[-101])+RC[-1]+R[-1]C+R[-1]C[-1] -> 2.36020970523335E+47 | FC61: =FIB(RC[-101])+RC[-1]+R[-1]C+R[-1]C[-1] -> 5.84825409861851E+47 | FD61: =FIB(RC[-101])+RC[-1]+R[-1]C+R[-1]C[-1] -> 1.43140832006165E+48 | FE61: =FIB(RC[-101])+RC[-1]+R[-1]C+R[-1]C[-1] -> 3.46175176515515E+48 | FF61: =FIB(RC[-101])+RC[-1]+R[-1]C+R[-1]C[-1] -> 8.27469611127004E+48 | FG61: =FIB(RC[-101])+RC[-1]+R[-1]C+R[-1]C[-1] -> 1.95549207602926E+49 | FH61: =FIB(RC[-101])+RC[-1]+R[-1]C+R[-1]C[-1] -> 4.57012154110181E+49 | FI61: =FIB(RC[-101])+RC[-1]+R[-1]C+R[-1]C[-1] -> 1.05653235509869E+50 | FJ61: =FIB(RC[-101])+RC[-1]+R[-1]C+R[-1]C[-1] -> 2.41675681276913E+50 | FK61: =FIB(RC[-101])+RC[-1]+R[-1]C+R[-1]C[-1] -> 5.47124511252241E+50 | FL61: =FIB(RC[-101])+RC[-1]+R[-1]C+R[-1]C[-1] -> 1.22615911680295E+51 | FM61: =FIB(RC[-101])+RC[-1]+R[-1]C+R[-1]C[-1] -> 2.72092052039789E+51 | FN61: =FIB(RC[-101])+RC[-1]+R[-1]C+R[-1]C[-1] -> 5.97985801319921E+51 | FO61: =FIB(RC[-101])+RC[-1]+R[-1]C+R[-1]C[-1] -> 1.30186619357794E+52 | FP61: =FIB(RC[-101])+RC[-1]+R[-1]C+R[-1]C[-1] -> 2.80823683824402E+52 | FQ61: =FIB(RC[-101])+RC[-1]+R[-1]C+R[-1]C[-1] -> 6.00318273849389E+52 | FR61: =FIB(RC[-101])+RC[-1]+R[-1]C+R[-1]C[-1] -> 1.27202488179634E+53 | FS61: =FIB(RC[-101])+RC[-1]+R[-1]C+R[-1]C[-1] -> 2.67213844173463E+53 | FT61: =FIB(RC[-101])+RC[-1]+R[-1]C+R[-1]C[-1] -> 5.56611456937094E+53 | FU61: =FIB(RC[-101])+RC[-1]+R[-1]C+R[-1]C[-1] -> 1.14988190266313E+54 | FV61: =FIB(RC[-101])+RC[-1]+R[-1]C+R[-1]C[-1] -> 2.35634001233062E+54 | FW61: =FIB(RC[-101])+RC[-1]+R[-1]C+R[-1]C[-1] -> 4.79048779483419E+54 | FX61: =FIB(RC[-101])+RC[-1]+R[-1]C+R[-1]C[-1] -> 9.66384233084463E+54 | FY61: =FIB(RC[-101])+RC[-1]+R[-1]C+R[-1]C[-1] -> 1.93471682228013E+55 | FZ61: =FIB(RC[-101])+RC[-1]+R[-1]C+R[-1]C[-1] -> 3.84458610052657E+55 | GA61: =FIB(RC[-101])+RC[-1]+R[-1]C+R[-1]C[-1] -> 7.58423147278543E+55 | GB61: =FIB(RC[-101])+RC[-1]+R[-1]C+R[-1]C[-1] -> 1.48547960054243E+56 | GC61: =FIB(RC[-101])+RC[-1]+R[-1]C+R[-1]C[-1] -> 2.88919229630658E+56 | GD61: =FIB(RC[-101])+RC[-1]+R[-1]C+R[-1]C[-1] -> 5.58085357998424E+56 | GE61: =FIB(RC[-101])+RC[-1]+R[-1]C+R[-1]C[-1] -> 1.07077282367925E+57 | GF61: =FIB(RC[-101])+RC[-1]+R[-1]C+R[-1]C[-1] -> 2.0409063500351E+57 | GG61: =FIB(RC[-101])+RC[-1]+R[-1]C+R[-1]C[-1] -> 3.86485118198115E+57 | GH61: =FIB(RC[-101])+RC[-1]+R[-1]C+R[-1]C[-1] -> 7.27243541373942E+57 | GI61: =FIB(RC[-101])+RC[-1]+R[-1]C+R[-1]C[-1] -> 1.35992937806532E+58 | GJ61: =FIB(RC[-101])+RC[-1]+R[-1]C+R[-1]C[-1] -> 2.52750959856658E+58 | GK61: =FIB(RC[-101])+RC[-1]+R[-1]C+R[-1]C[-1] -> 4.66937211772284E+58 | GL61: =FIB(RC[-101])+RC[-1]+R[-1]C+R[-1]C[-1] -> 8.57553665927515E+58 | GM61: =FIB(RC[-101])+RC[-1]+R[-1]C+R[-1]C[-1] -> 1.56584206672395E+59 | GN61: =FIB(RC[-101])+RC[-1]+R[-1]C+R[-1]C[-1] -> 2.84291510179773E+59 | GO61: =FIB(RC[-101])+RC[-1]+R[-1]C+R[-1]C[-1] -> 5.13278878808647E+59 | GP61: =FIB(RC[-101])+RC[-1]+R[-1]C+R[-1]C[-1] -> 9.21636384671181E+59 | GQ61: =FIB(RC[-101])+RC[-1]+R[-1]C+R[-1]C[-1] -> 1.64598014071073E+60 | GR61: =FIB(RC[-101])+RC[-1]+R[-1]C+R[-1]C[-1] -> 2.92408043155328E+60 | GS61: =FIB(RC[-101])+RC[-1]+R[-1]C+R[-1]C[-1] -> 5.16765766148309E+60
A62: 20 | B62: 20 | C62: 20 | D62: 20 | E62: 20 | F62: 20 | G62: 20 | H62: 20 | I62: 20 | J62: 20 | K62: 20 | L62: 20 | M62: 20 | N62: 20 | O62: 20 | P62: 20 | Q62: 20 | R62: 20 | S62: 20 | T62: 20 | U62: 20 | V62: 20 | W62: 20 | X62: 20 | Y62: 20 | Z62: 20 | AA62: 20 | AB62: 20 | AC62: 20 | AD62: 20 | AE62: 20 | AF62: 20 | AG62: 20 | AH62: 20 | AI62: 20 | AJ62: 20 | AK62: 20 | AL62: 20 | AM62: 20 | AN62: 20 | AO62: 20 | AP62: 20 | AQ62: 20 | AR62: 20 | AS62: 20 | AT62: 20 | AU62: 20 | AV62: 20 | AW62: 20 | AX62: 20 | AY62: 20 | AZ62: 20 | BA62: 20 | BB62: 20 | BC62: 20 | BD62: 20 | BE62: 20 | BF62: 20 | BG62: 20 | BH62: 20 | BI62: 20 | BJ62: 20 | BK62: 20 | BL62: 20 | BM62: 20 | BN62: 20 | BO62: 20 | BP62: 20 | BQ62: 20 | BR62: 20 | BS62: 20 | BT62: 20 | BU62: 20 | BV62: 20 | BW62: 20 | BX62: 20 | BY62: 20 | BZ62: 20 | CA62: 20 | CB62: 20 | CC62: 20 | CD62: 20 | CE62: 20 | CF62: 20 | CG62: 20 | CH62: 20 | CI62: 20 | CJ62: 20 | CK62: 20 | CL62: 20 | CM62: 20 | CN62: 20 | CO62: 20 | CP62: 20 | CQ62: 20 | CR62: 20 | CS62: 20 | CT62: 20 | CU62: 20 | CV62: 20 | CW62: 0 | CX62: =FIB(RC[-101])+RC[-1]+R[-1]C+R[-1]C[-1] -> 667706 | CY62: =FIB(RC[-101])+RC[-1]+R[-1]C+R[-1]C[-1] -> 41397772 | CZ62: =FIB(RC[-101])+RC[-1]+R[-1]C+R[-1]C[-1] -> 1697976358 | DA62: =FIB(RC[-101])+RC[-1]+R[-1]C+R[-1]C[-1] -> 52243988264 | DB62: =FIB(RC[-101])+RC[-1]+R[-1]C+R[-1]C[-1] -> 1286560625922 | DC62: =FIB(RC[-101])+RC[-1]+R[-1]C+R[-1]C[-1] -> 26418029599572 | DD62: =FIB(RC[-101])+RC[-1]+R[-1]C+R[-1]C[-1] -> 465305286452942 | DE62: =FIB(RC[-101])+RC[-1]+R[-1]C+R[-1]C[-1] -> 7.17718455519707E+15 | DF62: =FIB(RC[-101])+RC[-1]+R[-1]C+R[-1]C[-1] -> 9.85017936201701E+16 | DG62: =FIB(RC[-101])+RC[-1]+R[-1]C+R[-1]C[-1] -> 1.21803152762784E+18 | DH62: =FIB(RC[-101])+RC[-1]+R[-1]C+R[-1]C[-1] -> 1.3709354166766E+19 | DI62: =FIB(RC[-101])+RC[-1]+R[-1]C+R[-1]C[-1] -> 1.41637409109677E+20 | DJ62: =FIB(RC[-101])+RC[-1]+R[-1]C+R[-1]C[-1] -> 1.3527625823455E+21 | DK62: =FIB(RC[-101])+RC[-1]+R[-1]C+R[-1]C[-1] -> 1.20165059962087E+22 | DL62: =FIB(RC[-101])+RC[-1]+R[-1]C+R[-1]C[-1] -> 9.97979275791008E+22 | DM62: =FIB(RC[-101])+RC[-1]+R[-1]C+R[-1]C[-1] -> 7.78462042635783E+23 | DN62: =FIB(RC[-101])+RC[-1]+R[-1]C+R[-1]C[-1] -> 5.72632929914511E+24 | DO62: =FIB(RC[-101])+RC[-1]+R[-1]C+R[-1]C[-1] -> 3.98651310288698E+25 | DP62: =FIB(RC[-101])+RC[-1]+R[-1]C+R[-1]C[-1] -> 2.63499212838716E+26 | DQ62: =FIB(RC[-101])+RC[-1]+R[-1]C+R[-1]C[-1] -> 1.65839203343553E+27 | DR62: =FIB(RC[-101])+RC[-1]+R[-1]C+R[-1]C[-1] -> 9.9643906842545E+27 | DS62: =FIB(RC[-101])+RC[-1]+R[-1]C+R[-1]C[-1] -> 5.72930130393386E+28 | DT62: =FIB(RC[-101])+RC[-1]+R[-1]C+R[-1]C[-1] -> 3.15924226038793E+29 | DU62: =FIB(RC[-101])+RC[-1]+R[-1]C+R[-1]C[-1] -> 1.67401746261152E+30 | DV62: =FIB(RC[-101])+RC[-1]+R[-1]C+R[-1]C[-1] -> 8.5394531730459E+30 | DW62: =FIB(RC[-101])+RC[-1]+R[-1]C+R[-1]C[-1] -> 4.20078144942282E+31 | DX62: =FIB(RC[-101])+RC[-1]+R[-1]C+R[-1]C[-1] -> 1.99592109825528E+32 | DY62: =FIB(RC[-101])+RC[-1]+R[-1]C+R[-1]C[-1] -> 9.17287160710148E+32 | DZ62: =FIB(RC[-101])+RC[-1]+R[-1]C+R[-1]C[-1] -> 4.08327240836079E+33 | EA62: =FIB(RC[-101])+RC[-1]+R[-1]C+R[-1]C[-1] -> 1.76281277962991E+34 | EB62: =FIB(RC[-101])+RC[-1]+R[-1]C+R[-1]C[-1] -> 7.38954158450196E+34 | EC62: =FIB(RC[-101])+RC[-1]+R[-1]C+R[-1]C[-1] -> 3.01112753456959E+35 | ED62: =FIB(RC[-101])+RC[-1]+R[-1]C+R[-1]C[-1] -> 1.19398551461353E+36 | EE62: =FIB(RC[-101])+RC[-1]+R[-1]C+R[-1]C[-1] -> 4.61167468122188E+36 | EF62: =FIB(RC[-101])+RC[-1]+R[-1]C+R[-1]C[-1] -> 1.73666140939186E+37 | EG62: =FIB(RC[-101])+RC[-1]+R[-1]C+R[-1]C[-1] -> 6.38195040942988E+37 | EH62: =FIB(RC[-101])+RC[-1]+R[-1]C+R[-1]C[-1] -> 2.29053975972428E+38 | EI62: =FIB(RC[-101])+RC[-1]+R[-1]C+R[-1]C[-1] -> 8.03551597265728E+38 | EJ62: =FIB(RC[-101])+RC[-1]+R[-1]C+R[-1]C[-1] -> 2.75745891155479E+39 | EK62: =FIB(RC[-101])+RC[-1]+R[-1]C+R[-1]C[-1] -> 9.26264896036506E+39 | EL62: =FIB(RC[-101])+RC[-1]+R[-1]C+R[-1]C[-1] -> 3.04781506972462E+40 | EM62: =FIB(RC[-101])+RC[-1]+R[-1]C+R[-1]C[-1] -> 9.82995510270536E+40 | EN62: =FIB(RC[-101])+RC[-1]+R[-1]C+R[-1]C[-1] -> 3.10951793153766E+41 | EO62: =FIB(RC[-101])+RC[-1]+R[-1]C+R[-1]C[-1] -> 9.65317073910829E+41 | EP62: =FIB(RC[-101])+RC[-1]+R[-1]C+R[-1]C[-1] -> 2.94257508866217E+42 | EQ62: =FIB(RC[-101])+RC[-1]+R[-1]C+R[-1]C[-1] -> 8.81252183111814E+42 | ER62: =FIB(RC[-101])+RC[-1]+R[-1]C+R[-1]C[-1] -> 2.5942524240553E+43 | ES62: =FIB(RC[-101])+RC[-1]+R[-1]C+R[-1]C[-1] -> 7.51066459927202E+43 | ET62: =FIB(RC[-101])+RC[-1]+R[-1]C+R[-1]C[-1] -> 2.13946094299003E+44 | EU62: =FIB(RC[-101])+RC[-1]+R[-1]C+R[-1]C[-1] -> 5.99911905048412E+44 | EV62: =FIB(RC[-101])+RC[-1]+R[-1]C+R[-1]C[-1] -> 1.65659743207657E+45 | EW62: =FIB(RC[-101])+RC[-1]+R[-1]C+R[-1]C[-1] -> 4.5068652173632E+45 | EX62: =FIB(RC[-101])+RC[-1]+R[-1]C+R[-1]C[-1] -> 1.20846695887482E+46 | EY62: =FIB(RC[-101])+RC[-1]+R[-1]C+R[-1]C[-1] -> 3.19495965914126E+46 | EZ62: =FIB(RC[-101])+RC[-1]+R[-1]C+R[-1]C[-1] -> 8.3315864337021E+46 | FA62: =FIB(RC[-101])+RC[-1]+R[-1]C+R[-1]C[-1] -> 2.14376412963951E+47 | FB62: =FIB(RC[-101])+RC[-1]+R[-1]C+R[-1]C[-1] -> 5.44455915744547E+47 | FC62: =FIB(RC[-101])+RC[-1]+R[-1]C+R[-1]C[-1] -> 1.36530229612973E+48 | FD62: =FIB(RC[-101])+RC[-1]+R[-1]C+R[-1]C[-1] -> 3.38153602605323E+48 | FE62: =FIB(RC[-101])+RC[-1]+R[-1]C+R[-1]C[-1] -> 8.27469611127004E+48 | FF62: =FIB(RC[-101])+RC[-1]+R[-1]C+R[-1]C[-1] -> 2.00111439876952E+49 | FG62: =FIB(RC[-101])+RC[-1]+R[-1]C+R[-1]C[-1] -> 4.78407608592578E+49 | FH62: =FIB(RC[-101])+RC[-1]+R[-1]C+R[-1]C[-1] -> 1.13096897030568E+50 | FI62: =FIB(RC[-101])+RC[-1]+R[-1]C+R[-1]C[-1] -> 2.64451347951456E+50 | FJ62: =FIB(RC[-101])+RC[-1]+R[-1]C+R[-1]C[-1] -> 6.11780264738237E+50 | FK62: =FIB(RC[-101])+RC[-1]+R[-1]C+R[-1]C[-1] -> 1.40058045726739E+51 | FL62: =FIB(RC[-101])+RC[-1]+R[-1]C+R[-1]C[-1] -> 3.17386408532258E+51 | FM62: =FIB(RC[-101])+RC[-1]+R[-1]C+R[-1]C[-1] -> 7.12094372252342E+51 | FN62: =FIB(RC[-101])+RC[-1]+R[-1]C+R[-1]C[-1] -> 1.58217222561205E+52 | FO62: =FIB(RC[-101])+RC[-1]+R[-1]C+R[-1]C[-1] -> 3.48202422050991E+52 | FP62: =FIB(RC[-101])+RC[-1]+R[-1]C+R[-1]C[-1] -> 7.59212725233188E+52 | FQ62: =FIB(RC[-101])+RC[-1]+R[-1]C+R[-1]C[-1] -> 1.64035468290698E+53 | FR62: =FIB(RC[-101])+RC[-1]+R[-1]C+R[-1]C[-1] -> 3.51269783855271E+53 | FS62: =FIB(RC[-101])+RC[-1]+R[-1]C+R[-1]C[-1] -> 7.45686116208369E+53 | FT62: =FIB(RC[-101])+RC[-1]+R[-1]C+R[-1]C[-1] -> 1.56951141731893E+54 | FU62: =FIB(RC[-101])+RC[-1]+R[-1]C+R[-1]C[-1] -> 3.27600477691915E+54 | FV62: =FIB(RC[-101])+RC[-1]+R[-1]C+R[-1]C[-1] -> 6.78222669191291E+54 | FW62: =FIB(RC[-101])+RC[-1]+R[-1]C+R[-1]C[-1] -> 1.39290544990777E+55 | FX62: =FIB(RC[-101])+RC[-1]+R[-1]C+R[-1]C[-1] -> 2.83833846247565E+55 | FY62: =FIB(RC[-101])+RC[-1]+R[-1]C+R[-1]C[-1] -> 5.73943951784024E+55 | FZ62: =FIB(RC[-101])+RC[-1]+R[-1]C+R[-1]C[-1] -> 1.15187424406469E+56 | GA62: =FIB(RC[-101])+RC[-1]+R[-1]C+R[-1]C[-1] -> 2.2947560013959E+56 | GB62: =FIB(RC[-101])+RC[-1]+R[-1]C+R[-1]C[-1] -> 4.53865874921687E+56 | GC62: =FIB(RC[-101])+RC[-1]+R[-1]C+R[-1]C[-1] -> 8.91333064606588E+56 | GD62: =FIB(RC[-101])+RC[-1]+R[-1]C+R[-1]C[-1] -> 1.73833765223567E+57 | GE62: =FIB(RC[-101])+RC[-1]+R[-1]C+R[-1]C[-1] -> 3.36719583391334E+57 | GF62: =FIB(RC[-101])+RC[-1]+R[-1]C+R[-1]C[-1] -> 6.47887500762769E+57 | GG62: =FIB(RC[-101])+RC[-1]+R[-1]C+R[-1]C[-1] -> 1.23846325396439E+58 | GH62: =FIB(RC[-101])+RC[-1]+R[-1]C+R[-1]C[-1] -> 2.35219191353645E+58 | GI62: =FIB(RC[-101])+RC[-1]+R[-1]C+R[-1]C[-1] -> 4.43936483297572E+58 | GJ62: =FIB(RC[-101])+RC[-1]+R[-1]C+R[-1]C[-1] -> 8.32680380960762E+58 | GK62: =FIB(RC[-101])+RC[-1]+R[-1]C+R[-1]C[-1] -> 1.5523685525897E+59 | GL62: =FIB(RC[-101])+RC[-1]+R[-1]C+R[-1]C[-1] -> 2.8768594302895E+59 | GM62: =FIB(RC[-101])+RC[-1]+R[-1]C+R[-1]C[-1] -> 5.30025516294097E+59 | GN62: =FIB(RC[-101])+RC[-1]+R[-1]C+R[-1]C[-1] -> 9.70901233146266E+59 | GO62: =FIB(RC[-101])+RC[-1]+R[-1]C+R[-1]C[-1] -> 1.76847162213469E+60 | GP62: =FIB(RC[-101])+RC[-1]+R[-1]C+R[-1]C[-1] -> 3.20338688561452E+60 | GQ62: =FIB(RC[-101])+RC[-1]+R[-1]C+R[-1]C[-1] -> 5.77100341099643E+60 | GR62: =FIB(RC[-101])+RC[-1]+R[-1]C+R[-1]C[-1] -> 1.03410639832604E+61 | GS62: =FIB(RC[-101])+RC[-1]+R[-1]C+R[-1]C[-1] -> 1.84328020762968E+61
A63: 20 | B63: 20 | C63: 20 | D63: 20 | E63: 20 | F63: 20 | G63: 20 | H63: 20 | I63: 20 | J63: 20 | K63: 20 | L63: 20 | M63: 20 | N63: 20 | O63: 20 | P63: 20 | Q63: 20 | R63: 20 | S63: 20 | T63: 20 | U63: 20 | V63: 20 | W63: 20 | X63: 20 | Y63: 20 | Z63: 20 | AA63: 20 | AB63: 20 | AC63: 20 | AD63: 20 | AE63: 20 | AF63: 20 | AG63: 20 | AH63: 20 | AI63: 20 | AJ63: 20 | AK63: 20 | AL63: 20 | AM63: 20 | AN63: 20 | AO63: 20 | AP63: 20 | AQ63: 20 | AR63: 20 | AS63: 20 | AT63: 20 | AU63: 20 | AV63: 20 | AW63: 20 | AX63: 20 | AY63: 20 | AZ63: 20 | BA63: 20 | BB63: 20 | BC63: 20 | BD63: 20 | BE63: 20 | BF63: 20 | BG63: 20 | BH63: 20 | BI63: 20 | BJ63: 20 | BK63: 20 | BL63: 20 | BM63: 20 | BN63: 20 | BO63: 20 | BP63: 20 | BQ63: 20 | BR63: 20 | BS63: 20 | BT63: 20 | BU63: 20 | BV63: 20 | BW63: 20 | BX63: 20 | BY63: 20 | BZ63: 20 | CA63: 20 | CB63: 20 | CC63: 20 | CD63: 20 | CE63: 20 | CF63: 20 | CG63: 20 | CH63: 20 | CI63: 20 | CJ63: 20 | CK63: 20 | CL63: 20 | CM63: 20 | CN63: 20 | CO63: 20 | CP63: 20 | CQ63: 20 | CR63: 20 | CS63: 20 | CT63: 20 | CU63: 20 | CV63: 20 | CW63: 0 | CX63: =FIB(RC[-101])+RC[-1]+R[-1]C+R[-1]C[-1] -> 678652 | CY63: =FIB(RC[-101])+RC[-1]+R[-1]C+R[-1]C[-1] -> 42755076 | CZ63: =FIB(RC[-101])+RC[-1]+R[-1]C+R[-1]C[-1] -> 1782140152 | DA63: =FIB(RC[-101])+RC[-1]+R[-1]C+R[-1]C[-1] -> 55724115720 | DB63: =FIB(RC[-101])+RC[-1]+R[-1]C+R[-1]C[-1] -> 1394528740852 | DC63: =FIB(RC[-101])+RC[-1]+R[-1]C+R[-1]C[-1] -> 29099118977292 | DD63: =FIB(RC[-101])+RC[-1]+R[-1]C+R[-1]C[-1] -> 520822435040752 | DE63: =FIB(RC[-101])+RC[-1]+R[-1]C+R[-1]C[-1] -> 8.16331227670171E+15 | DF63: =FIB(RC[-101])+RC[-1]+R[-1]C+R[-1]C[-1] -> 1.1384229045208E+17 | DG63: =FIB(RC[-101])+RC[-1]+R[-1]C+R[-1]C[-1] -> 1.4303756117001E+18 | DH63: =FIB(RC[-101])+RC[-1]+R[-1]C+R[-1]C[-1] -> 1.6357761306094E+19 | DI63: =FIB(RC[-101])+RC[-1]+R[-1]C+R[-1]C[-1] -> 1.71704524582537E+20 | DJ63: =FIB(RC[-101])+RC[-1]+R[-1]C+R[-1]C[-1] -> 1.66610451603772E+21 | DK63: =FIB(RC[-101])+RC[-1]+R[-1]C+R[-1]C[-1] -> 1.5035373094592E+22 | DL63: =FIB(RC[-101])+RC[-1]+R[-1]C+R[-1]C[-1] -> 1.26849806669901E+23 | DM63: =FIB(RC[-101])+RC[-1]+R[-1]C+R[-1]C[-1] -> 1.00510977688479E+24 | DN63: =FIB(RC[-101])+RC[-1]+R[-1]C+R[-1]C[-1] -> 7.50990111866568E+24 | DO63: =FIB(RC[-101])+RC[-1]+R[-1]C+R[-1]C[-1] -> 5.31013614466806E+25 | DP63: =FIB(RC[-101])+RC[-1]+R[-1]C+R[-1]C[-1] -> 3.56465705314266E+26 | DQ63: =FIB(RC[-101])+RC[-1]+R[-1]C+R[-1]C[-1] -> 2.27835695158851E+27 | DR63: =FIB(RC[-101])+RC[-1]+R[-1]C+R[-1]C[-1] -> 1.39011396692785E+28 | DS63: =FIB(RC[-101])+RC[-1]+R[-1]C+R[-1]C[-1] -> 8.11585433928716E+28 | DT63: =FIB(RC[-101])+RC[-1]+R[-1]C+R[-1]C[-1] -> 4.54375782471004E+29 | DU63: =FIB(RC[-101])+RC[-1]+R[-1]C+R[-1]C[-1] -> 2.44431747112131E+30 | DV63: =FIB(RC[-101])+RC[-1]+R[-1]C+R[-1]C[-1] -> 1.26577881067787E+31 | DW63: =FIB(RC[-101])+RC[-1]+R[-1]C+R[-1]C[-1] -> 6.32050557740528E+31 | DX63: =FIB(RC[-101])+RC[-1]+R[-1]C+R[-1]C[-1] -> 3.04804980093809E+32 | DY63: =FIB(RC[-101])+RC[-1]+R[-1]C+R[-1]C[-1] -> 1.42168425062949E+33 | DZ63: =FIB(RC[-101])+RC[-1]+R[-1]C+R[-1]C[-1] -> 6.42224381970042E+33 | EA63: =FIB(RC[-101])+RC[-1]+R[-1]C+R[-1]C[-1] -> 2.81336440243603E+34 | EB63: =FIB(RC[-101])+RC[-1]+R[-1]C+R[-1]C[-1] -> 1.19657187665679E+35 | EC63: =FIB(RC[-101])+RC[-1]+R[-1]C+R[-1]C[-1] -> 4.94665356967657E+35 | ED63: =FIB(RC[-101])+RC[-1]+R[-1]C+R[-1]C[-1] -> 1.98976362503815E+36 | EE63: =FIB(RC[-101])+RC[-1]+R[-1]C+R[-1]C[-1] -> 7.79542382087356E+36 | EF63: =FIB(RC[-101])+RC[-1]+R[-1]C+R[-1]C[-1] -> 2.97737125960141E+37 | EG63: =FIB(RC[-101])+RC[-1]+R[-1]C+R[-1]C[-1] -> 1.10959830784231E+38 | EH63: =FIB(RC[-101])+RC[-1]+R[-1]C+R[-1]C[-1] -> 4.03833310850958E+38 | EI63: =FIB(RC[-101])+RC[-1]+R[-1]C+R[-1]C[-1] -> 1.43643888408911E+39 | EJ63: =FIB(RC[-101])+RC[-1]+R[-1]C+R[-1]C[-1] -> 4.99744939290963E+39 | EK63: =FIB(RC[-101])+RC[-1]+R[-1]C+R[-1]C[-1] -> 1.70175572648295E+40 | EL63: =FIB(RC[-101])+RC[-1]+R[-1]C+R[-1]C[-1] -> 5.67583569224408E+40 | EM63: =FIB(RC[-101])+RC[-1]+R[-1]C+R[-1]C[-1] -> 1.85536058646741E+41 | EN63: =FIB(RC[-101])+RC[-1]+R[-1]C+R[-1]C[-1] -> 5.9478740282756E+41 | EO63: =FIB(RC[-101])+RC[-1]+R[-1]C+R[-1]C[-1] -> 1.87105626989216E+42 | EP63: =FIB(RC[-101])+RC[-1]+R[-1]C+R[-1]C[-1] -> 5.77894843246516E+42 | EQ63: =FIB(RC[-101])+RC[-1]+R[-1]C+R[-1]C[-1] -> 1.75340453522455E+43 | ER63: =FIB(RC[-101])+RC[-1]+R[-1]C+R[-1]C[-1] -> 5.22890914239166E+43 | ES63: =FIB(RC[-101])+RC[-1]+R[-1]C+R[-1]C[-1] -> 1.5333826165719E+44 | ET63: =FIB(RC[-101])+RC[-1]+R[-1]C+R[-1]C[-1] -> 4.42391001948913E+44 | EU63: =FIB(RC[-101])+RC[-1]+R[-1]C+R[-1]C[-1] -> 1.25624900129633E+45 | EV63: =FIB(RC[-101])+RC[-1]+R[-1]C+R[-1]C[-1] -> 3.51275833842131E+45 | EW63: =FIB(RC[-101])+RC[-1]+R[-1]C+R[-1]C[-1] -> 9.67622098786108E+45 | EX63: =FIB(RC[-101])+RC[-1]+R[-1]C+R[-1]C[-1] -> 2.62677557939725E+46 | EY63: =FIB(RC[-101])+RC[-1]+R[-1]C+R[-1]C[-1] -> 7.03020219741333E+46 | EZ63: =FIB(RC[-101])+RC[-1]+R[-1]C+R[-1]C[-1] -> 1.85567482902567E+47 | FA63: =FIB(RC[-101])+RC[-1]+R[-1]C+R[-1]C[-1] -> 4.83259760203539E+47 | FB63: =FIB(RC[-101])+RC[-1]+R[-1]C+R[-1]C[-1] -> 1.24209208891204E+48 | FC63: =FIB(RC[-101])+RC[-1]+R[-1]C+R[-1]C[-1] -> 3.15185030078632E+48 | FD63: =FIB(RC[-101])+RC[-1]+R[-1]C+R[-1]C[-1] -> 7.89868862296928E+48 | FE63: =FIB(RC[-101])+RC[-1]+R[-1]C+R[-1]C[-1] -> 1.95549207602926E+49 | FF63: =FIB(RC[-101])+RC[-1]+R[-1]C+R[-1]C[-1] -> 4.78407608592578E+49 | FG63: =FIB(RC[-101])+RC[-1]+R[-1]C+R[-1]C[-1] -> 1.15692665706211E+50 | FH63: =FIB(RC[-101])+RC[-1]+R[-1]C+R[-1]C[-1] -> 2.76630323596037E+50 | FI63: =FIB(RC[-101])+RC[-1]+R[-1]C+R[-1]C[-1] -> 6.54178568578061E+50 | FJ63: =FIB(RC[-101])+RC[-1]+R[-1]C+R[-1]C[-1] -> 1.53041018126775E+51 | FK63: =FIB(RC[-101])+RC[-1]+R[-1]C+R[-1]C[-1] -> 3.54277090327338E+51 | FL63: =FIB(RC[-101])+RC[-1]+R[-1]C+R[-1]C[-1] -> 8.11721544586335E+51 | FM63: =FIB(RC[-101])+RC[-1]+R[-1]C+R[-1]C[-1] -> 1.84120232537094E+52 | FN63: =FIB(RC[-101])+RC[-1]+R[-1]C+R[-1]C[-1] -> 4.13546892323533E+52 | FO63: =FIB(RC[-101])+RC[-1]+R[-1]C+R[-1]C[-1] -> 9.1996653693573E+52 | FP63: =FIB(RC[-101])+RC[-1]+R[-1]C+R[-1]C[-1] -> 2.02738168421991E+53 | FQ63: =FIB(RC[-101])+RC[-1]+R[-1]C+R[-1]C[-1] -> 4.42694909236008E+53 | FR63: =FIB(RC[-101])+RC[-1]+R[-1]C+R[-1]C[-1] -> 9.58000161381976E+53 | FS63: =FIB(RC[-101])+RC[-1]+R[-1]C+R[-1]C[-1] -> 2.05495606144562E+54 | FT63: =FIB(RC[-101])+RC[-1]+R[-1]C+R[-1]C[-1] -> 4.37015359497291E+54 | FU63: =FIB(RC[-101])+RC[-1]+R[-1]C+R[-1]C[-1] -> 9.21566978921099E+54 | FV63: =FIB(RC[-101])+RC[-1]+R[-1]C+R[-1]C[-1] -> 1.92739012580431E+55 | FW63: =FIB(RC[-101])+RC[-1]+R[-1]C+R[-1]C[-1] -> 3.99851824490337E+55 | FX63: =FIB(RC[-101])+RC[-1]+R[-1]C+R[-1]C[-1] -> 8.2297621572868E+55 | FY63: =FIB(RC[-101])+RC[-1]+R[-1]C+R[-1]C[-1] -> 1.68075401376027E+56 | FZ63: =FIB(RC[-101])+RC[-1]+R[-1]C+R[-1]C[-1] -> 3.40657220960899E+56 | GA63: =FIB(RC[-101])+RC[-1]+R[-1]C+R[-1]C[-1] -> 6.85320245506958E+56 | GB63: =FIB(RC[-101])+RC[-1]+R[-1]C+R[-1]C[-1] -> 1.36866172056823E+57 | GC63: =FIB(RC[-101])+RC[-1]+R[-1]C+R[-1]C[-1] -> 2.71386066009651E+57 | GD63: =FIB(RC[-101])+RC[-1]+R[-1]C+R[-1]C[-1] -> 5.34353137693877E+57 | GE63: =FIB(RC[-101])+RC[-1]+R[-1]C+R[-1]C[-1] -> 1.04490648630878E+58 | GF63: =FIB(RC[-101])+RC[-1]+R[-1]C+R[-1]C[-1] -> 2.02951357046288E+58 | GG63: =FIB(RC[-101])+RC[-1]+R[-1]C+R[-1]C[-1] -> 3.91586432519004E+58 | GH63: =FIB(RC[-101])+RC[-1]+R[-1]C+R[-1]C[-1] -> 7.50651949269089E+58 | GI63: =FIB(RC[-101])+RC[-1]+R[-1]C+R[-1]C[-1] -> 1.42980762392031E+59 | GJ63: =FIB(RC[-101])+RC[-1]+R[-1]C+R[-1]C[-1] -> 2.70642448817864E+59 | GK63: =FIB(RC[-101])+RC[-1]+R[-1]C+R[-1]C[-1] -> 5.09147342172911E+59 | GL63: =FIB(RC[-101])+RC[-1]+R[-1]C+R[-1]C[-1] -> 9.52070140460831E+59 | GM63: =FIB(RC[-101])+RC[-1]+R[-1]C+R[-1]C[-1] -> 1.76978159978388E+60 | GN63: =FIB(RC[-101])+RC[-1]+R[-1]C+R[-1]C[-1] -> 3.27070834922424E+60 | GO63: =FIB(RC[-101])+RC[-1]+R[-1]C+R[-1]C[-1] -> 6.0100812045052E+60 | GP63: =FIB(RC[-101])+RC[-1]+R[-1]C+R[-1]C[-1] -> 1.09819397122544E+61 | GQ63: =FIB(RC[-101])+RC[-1]+R[-1]C+R[-1]C[-1] -> 1.99563300088653E+61 | GR63: =FIB(RC[-101])+RC[-1]+R[-1]C+R[-1]C[-1] -> 3.60683974031222E+61 | GS63: =FIB(RC[-101])+RC[-1]+R[-1]C+R[-1]C[-1] -> 6.48422634626795E+61
A64: 20 | B64: 20 | C64: 20 | D64: 20 | E64: 20 | F64: 20 | G64: 20 | H64: 20 | I64: 20 | J64: 20 | K64: 20 | L64: 20 | M64: 20 | N64: 20 | O64: 20 | P64: 20 | Q64: 20 | R64: 20 | S64: 20 | T64: 20 | U64: 20 | V64: 20 | W64: 20 | X64: 20 | Y64: 20 | Z64: 20 | AA64: 20 | AB64: 20 | AC64: 20 | AD64: 20 | AE64: 20 | AF64: 20 | AG64: 20 | AH64: 20 | AI64: 20 | AJ64: 20 | AK64: 20 | AL64: 20 | AM64: 20 | AN64: 20 | AO64: 20 | AP64: 20 | AQ64: 20 | AR64: 20 | AS64: 20 | AT64: 20 | AU64: 20 | AV64: 20 | AW64: 20 | AX64: 20 | AY64: 20 | AZ64: 20 | BA64: 20 | BB64: 20 | BC64: 20 | BD64: 20 | BE64: 20 | BF64: 20 | BG64: 20 | BH64: 20 | BI64: 20 | BJ64: 20 | BK64: 20 | BL64: 20 | BM64: 20 | BN64: 20 | BO64: 20 | BP64: 20 | BQ64: 20 | BR64: 20 | BS64: 20 | BT64: 20 | BU64: 20 | BV64: 20 | BW64: 20 | BX64: 20 | BY64: 20 | BZ64: 20 | CA64: 20 | CB64: 20 | CC64: 20 | CD64: 20 | CE64: 20 | CF64: 20 | CG64: 20 | CH64: 20 | CI64: 20 | CJ64: 20 | CK64: 20 | CL64: 20 | CM64: 20 | CN64: 20 | CO64: 20 | CP64: 20 | CQ64: 20 | CR64: 20 | CS64: 20 | CT64: 20 | CU64: 20 | CV64: 20 | CW64: 0 | CX64: =FIB(RC[-101])+RC[-1]+R[-1]C+R[-1]C[-1] -> 689598 | CY64: =FIB(RC[-101])+RC[-1]+R[-1]C+R[-1]C[-1] -> 44134272 | CZ64: =FIB(RC[-101])+RC[-1]+R[-1]C+R[-1]C[-1] -> 1869040446 | DA64: =FIB(RC[-101])+RC[-1]+R[-1]C+R[-1]C[-1] -> 59375307264 | DB64: =FIB(RC[-101])+RC[-1]+R[-1]C+R[-1]C[-1] -> 1509628174782 | DC64: =FIB(RC[-101])+RC[-1]+R[-1]C+R[-1]C[-1] -> 32003275903872 | DD64: =FIB(RC[-101])+RC[-1]+R[-1]C+R[-1]C[-1] -> 581924829932862 | DE64: =FIB(RC[-101])+RC[-1]+R[-1]C+R[-1]C[-1] -> 9.26605954168627E+15 | DF64: =FIB(RC[-101])+RC[-1]+R[-1]C+R[-1]C[-1] -> 1.31271662270479E+17 | DG64: =FIB(RC[-101])+RC[-1]+R[-1]C+R[-1]C[-1] -> 1.67548956442267E+18 | DH64: =FIB(RC[-101])+RC[-1]+R[-1]C+R[-1]C[-1] -> 1.94636264822167E+19 | DI64: =FIB(RC[-101])+RC[-1]+R[-1]C+R[-1]C[-1] -> 2.07525912370848E+20 | DJ64: =FIB(RC[-101])+RC[-1]+R[-1]C+R[-1]C[-1] -> 2.0453349529911E+21 | DK64: =FIB(RC[-101])+RC[-1]+R[-1]C+R[-1]C[-1] -> 1.87468125636208E+22 | DL64: =FIB(RC[-101])+RC[-1]+R[-1]C+R[-1]C[-1] -> 1.60631992328114E+23 | DM64: =FIB(RC[-101])+RC[-1]+R[-1]C+R[-1]C[-1] -> 1.2925915758828E+24 | DN64: =FIB(RC[-101])+RC[-1]+R[-1]C+R[-1]C[-1] -> 9.80760247143327E+24 | DO64: =FIB(RC[-101])+RC[-1]+R[-1]C+R[-1]C[-1] -> 7.04188650367796E+25 | DP64: =FIB(RC[-101])+RC[-1]+R[-1]C+R[-1]C[-1] -> 4.79985931797727E+26 | DQ64: =FIB(RC[-101])+RC[-1]+R[-1]C+R[-1]C[-1] -> 3.11480858870051E+27 | DR64: =FIB(RC[-101])+RC[-1]+R[-1]C+R[-1]C[-1] -> 1.92943052095676E+28 | DS64: =FIB(RC[-101])+RC[-1]+R[-1]C+R[-1]C[-1] -> 1.14353988271718E+29 | DT64: =FIB(RC[-101])+RC[-1]+R[-1]C+R[-1]C[-1] -> 6.49888314135593E+29 | DU64: =FIB(RC[-101])+RC[-1]+R[-1]C+R[-1]C[-1] -> 3.54858156772791E+30 | DV64: =FIB(RC[-101])+RC[-1]+R[-1]C+R[-1]C[-1] -> 1.8650687145628E+31 | DW64: =FIB(RC[-101])+RC[-1]+R[-1]C+R[-1]C[-1] -> 9.45135310264595E+31 | DX64: =FIB(RC[-101])+RC[-1]+R[-1]C+R[-1]C[-1] -> 4.62523566894322E+32 | DY64: =FIB(RC[-101])+RC[-1]+R[-1]C+R[-1]C[-1] -> 2.18901279761762E+33 | DZ64: =FIB(RC[-101])+RC[-1]+R[-1]C+R[-1]C[-1] -> 1.00329408679475E+34 | EA64: =FIB(RC[-101])+RC[-1]+R[-1]C+R[-1]C[-1] -> 4.45888287120082E+34 | EB64: =FIB(RC[-101])+RC[-1]+R[-1]C+R[-1]C[-1] -> 1.92379660402047E+35 | EC64: =FIB(RC[-101])+RC[-1]+R[-1]C+R[-1]C[-1] -> 8.06702205035383E+35 | ED64: =FIB(RC[-101])+RC[-1]+R[-1]C+R[-1]C[-1] -> 3.29113118704119E+36 | EE64: =FIB(RC[-101])+RC[-1]+R[-1]C+R[-1]C[-1] -> 1.30763186329529E+37 | EF64: =FIB(RC[-101])+RC[-1]+R[-1]C+R[-1]C[-1] -> 5.06454550498405E+37 | EG64: =FIB(RC[-101])+RC[-1]+R[-1]C+R[-1]C[-1] -> 1.91378998430086E+38 | EH64: =FIB(RC[-101])+RC[-1]+R[-1]C+R[-1]C[-1] -> 7.06172140065275E+38 | EI64: =FIB(RC[-101])+RC[-1]+R[-1]C+R[-1]C[-1] -> 2.54644433500535E+39 | EJ64: =FIB(RC[-101])+RC[-1]+R[-1]C+R[-1]C[-1] -> 8.98033261200409E+39 | EK64: =FIB(RC[-101])+RC[-1]+R[-1]C+R[-1]C[-1] -> 3.09953392697432E+40 | EL64: =FIB(RC[-101])+RC[-1]+R[-1]C+R[-1]C[-1] -> 1.04771253457013E+41 | EM64: =FIB(RC[-101])+RC[-1]+R[-1]C+R[-1]C[-1] -> 3.47065669026195E+41 | EN64: =FIB(RC[-101])+RC[-1]+R[-1]C+R[-1]C[-1] -> 1.1273891305005E+42 | EO64: =FIB(RC[-101])+RC[-1]+R[-1]C+R[-1]C[-1] -> 3.59323280322021E+42 | EP64: =FIB(RC[-101])+RC[-1]+R[-1]C+R[-1]C[-1] -> 1.12432375055775E+43 | EQ64: =FIB(RC[-101])+RC[-1]+R[-1]C+R[-1]C[-1] -> 3.45562312902881E+43 | ER64: =FIB(RC[-101])+RC[-1]+R[-1]C+R[-1]C[-1] -> 1.0437936806645E+44 | ES64: =FIB(RC[-101])+RC[-1]+R[-1]C+R[-1]C[-1] -> 3.10006721147557E+44 | ET64: =FIB(RC[-101])+RC[-1]+R[-1]C+R[-1]C[-1] -> 9.05735984753659E+44 | EU64: =FIB(RC[-101])+RC[-1]+R[-1]C+R[-1]C[-1] -> 2.6043759879989E+45 | EV64: =FIB(RC[-101])+RC[-1]+R[-1]C+R[-1]C[-1] -> 7.37338332771653E+45 | EW64: =FIB(RC[-101])+RC[-1]+R[-1]C+R[-1]C[-1] -> 2.05623626539989E+46 | EX64: =FIB(RC[-101])+RC[-1]+R[-1]C+R[-1]C[-1] -> 5.65063394358325E+46 | EY64: =FIB(RC[-101])+RC[-1]+R[-1]C+R[-1]C[-1] -> 1.53076117203938E+47 | EZ64: =FIB(RC[-101])+RC[-1]+R[-1]C+R[-1]C[-1] -> 4.08945622080638E+47 | FA64: =FIB(RC[-101])+RC[-1]+R[-1]C+R[-1]C[-1] -> 1.07777286518674E+48 | FB64: =FIB(RC[-101])+RC[-1]+R[-1]C+R[-1]C[-1] -> 2.80312471430232E+48 | FC64: =FIB(RC[-101])+RC[-1]+R[-1]C+R[-1]C[-1] -> 7.19706710400068E+48 | FD64: =FIB(RC[-101])+RC[-1]+R[-1]C+R[-1]C[-1] -> 1.82476060277563E+49 | FE64: =FIB(RC[-101])+RC[-1]+R[-1]C+R[-1]C[-1] -> 4.57012154110181E+49 | FF64: =FIB(RC[-101])+RC[-1]+R[-1]C+R[-1]C[-1] -> 1.13096897030568E+50 | FG64: =FIB(RC[-101])+RC[-1]+R[-1]C+R[-1]C[-1] -> 2.76630323596037E+50 | FH64: =FIB(RC[-101])+RC[-1]+R[-1]C+R[-1]C[-1] -> 6.68953312898285E+50 | FI64: =FIB(RC[-101])+RC[-1]+R[-1]C+R[-1]C[-1] -> 1.59976220507238E+51 | FJ64: =FIB(RC[-101])+RC[-1]+R[-1]C+R[-1]C[-1] -> 3.7843509549182E+51 | FK64: =FIB(RC[-101])+RC[-1]+R[-1]C+R[-1]C[-1] -> 8.85753203945934E+51 | FL64: =FIB(RC[-101])+RC[-1]+R[-1]C+R[-1]C[-1] -> 2.05175183885961E+52 | FM64: =FIB(RC[-101])+RC[-1]+R[-1]C+R[-1]C[-1] -> 4.70467570881688E+52 | FN64: =FIB(RC[-101])+RC[-1]+R[-1]C+R[-1]C[-1] -> 1.06813469574231E+53 | FO64: =FIB(RC[-101])+RC[-1]+R[-1]C+R[-1]C[-1] -> 2.40164812500158E+53 | FP64: =FIB(RC[-101])+RC[-1]+R[-1]C+R[-1]C[-1] -> 5.34899634615722E+53 | FQ64: =FIB(RC[-101])+RC[-1]+R[-1]C+R[-1]C[-1] -> 1.18033271227372E+54 | FR64: =FIB(RC[-101])+RC[-1]+R[-1]C+R[-1]C[-1] -> 2.5810277828917E+54 | FS64: =FIB(RC[-101])+RC[-1]+R[-1]C+R[-1]C[-1] -> 5.5939840057193E+54 | FT64: =FIB(RC[-101])+RC[-1]+R[-1]C+R[-1]C[-1] -> 1.20190936621378E+55 | FU64: =FIB(RC[-101])+RC[-1]+R[-1]C+R[-1]C[-1] -> 2.56049170463217E+55 | FV64: =FIB(RC[-101])+RC[-1]+R[-1]C+R[-1]C[-1] -> 5.40944880935758E+55 | FW64: =FIB(RC[-101])+RC[-1]+R[-1]C+R[-1]C[-1] -> 1.13353571800652E+56 | FX64: =FIB(RC[-101])+RC[-1]+R[-1]C+R[-1]C[-1] -> 2.35636375822554E+56 | FY64: =FIB(RC[-101])+RC[-1]+R[-1]C+R[-1]C[-1] -> 4.86009398771449E+56 | FZ64: =FIB(RC[-101])+RC[-1]+R[-1]C+R[-1]C[-1] -> 9.94742021108375E+56 | GA64: =FIB(RC[-101])+RC[-1]+R[-1]C+R[-1]C[-1] -> 2.02071948757623E+57 | GB64: =FIB(RC[-101])+RC[-1]+R[-1]C+R[-1]C[-1] -> 4.07470145365142E+57 | GC64: =FIB(RC[-101])+RC[-1]+R[-1]C+R[-1]C[-1] -> 8.15722383431617E+57 | GD64: =FIB(RC[-101])+RC[-1]+R[-1]C+R[-1]C[-1] -> 1.62146158713514E+58 | GE64: =FIB(RC[-101])+RC[-1]+R[-1]C+R[-1]C[-1] -> 3.2007212111378E+58 | GF64: =FIB(RC[-101])+RC[-1]+R[-1]C+R[-1]C[-1] -> 6.27514126790946E+58 | GG64: =FIB(RC[-101])+RC[-1]+R[-1]C+R[-1]C[-1] -> 1.22205191635624E+59 | GH64: =FIB(RC[-101])+RC[-1]+R[-1]C+R[-1]C[-1] -> 2.36429029814433E+59 | GI64: =FIB(RC[-101])+RC[-1]+R[-1]C+R[-1]C[-1] -> 4.54474987133373E+59 | GJ64: =FIB(RC[-101])+RC[-1]+R[-1]C+R[-1]C[-1] -> 8.68098198343267E+59 | GK64: =FIB(RC[-101])+RC[-1]+R[-1]C+R[-1]C[-1] -> 1.64788798933404E+60 | GL64: =FIB(RC[-101])+RC[-1]+R[-1]C+R[-1]C[-1] -> 3.10910547196778E+60 | GM64: =FIB(RC[-101])+RC[-1]+R[-1]C+R[-1]C[-1] -> 5.83095721221249E+60 | GN64: =FIB(RC[-101])+RC[-1]+R[-1]C+R[-1]C[-1] -> 1.08714471612206E+61 | GO64: =FIB(RC[-101])+RC[-1]+R[-1]C+R[-1]C[-1] -> 2.01522367149501E+61 | GP64: =FIB(RC[-101])+RC[-1]+R[-1]C+R[-1]C[-1] -> 3.71442576317096E+61 | GQ64: =FIB(RC[-101])+RC[-1]+R[-1]C+R[-1]C[-1] -> 6.80825273528294E+61 | GR64: =FIB(RC[-101])+RC[-1]+R[-1]C+R[-1]C[-1] -> 1.24107254764817E+62 | GS64: =FIB(RC[-101])+RC[-1]+R[-1]C+R[-1]C[-1] -> 2.25017915630619E+62
A65: 20 | B65: 20 | C65: 20 | D65: 20 | E65: 20 | F65: 20 | G65: 20 | H65: 20 | I65: 20 | J65: 20 | K65: 20 | L65: 20 | M65: 20 | N65: 20 | O65: 20 | P65: 20 | Q65: 20 | R65: 20 | S65: 20 | T65: 20 | U65: 20 | V65: 20 | W65: 20 | X65: 20 | Y65: 20 | Z65: 20 | AA65: 20 | AB65: 20 | AC65: 20 | AD65: 20 | AE65: 20 | AF65: 20 | AG65: 20 | AH65: 20 | AI65: 20 | AJ65: 20 | AK65: 20 | AL65: 20 | AM65: 20 | AN65: 20 | AO65: 20 | AP65: 20 | AQ65: 20 | AR65: 20 | AS65: 20 | AT65: 20 | AU65: 20 | AV65: 20 | AW65: 20 | AX65: 20 | AY65: 20 | AZ65: 20 | BA65: 20 | BB65: 20 | BC65: 20 | BD65: 20 | BE65: 20 | BF65: 20 | BG65: 20 | BH65: 20 | BI65: 20 | BJ65: 20 | BK65: 20 | BL65: 20 | BM65: 20 | BN65: 20 | BO65: 20 | BP65: 20 | BQ65: 20 | BR65: 20 | BS65: 20 | BT65: 20 | BU65: 20 | BV65: 20 | BW65: 20 | BX65: 20 | BY65: 20 | BZ65: 20 | CA65: 20 | CB65: 20 | CC65: 20 | CD65: 20 | CE65: 20 | CF65: 20 | CG65: 20 | CH65: 20 | CI65: 20 | CJ65: 20 | CK65: 20 | CL65: 20 | CM65: 20 | CN65: 20 | CO65: 20 | CP65: 20 | CQ65: 20 | CR65: 20 | CS65: 20 | CT65: 20 | CU65: 20 | CV65: 20 | CW65: 0 | CX65: =FIB(RC[-101])+RC[-1]+R[-1]C+R[-1]C[-1] -> 700544 | CY65: =FIB(RC[-101])+RC[-1]+R[-1]C+R[-1]C[-1] -> 45535360 | CZ65: =FIB(RC[-101])+RC[-1]+R[-1]C+R[-1]C[-1] -> 1958721024 | DA65: =FIB(RC[-101])+RC[-1]+R[-1]C+R[-1]C[-1] -> 63203079680 | DB65: =FIB(RC[-101])+RC[-1]+R[-1]C+R[-1]C[-1] -> 1632206572672 | DC65: =FIB(RC[-101])+RC[-1]+R[-1]C+R[-1]C[-1] -> 35145110662272 | DD65: =FIB(RC[-101])+RC[-1]+R[-1]C+R[-1]C[-1] -> 649073216509952 | DE65: =FIB(RC[-101])+RC[-1]+R[-1]C+R[-1]C[-1] -> 1.049705758814E+16 | DF65: =FIB(RC[-101])+RC[-1]+R[-1]C+R[-1]C[-1] -> 1.51034779400316E+17 | DG65: =FIB(RC[-101])+RC[-1]+R[-1]C+R[-1]C[-1] -> 1.95779600609347E+18 | DH65: =FIB(RC[-101])+RC[-1]+R[-1]C+R[-1]C[-1] -> 2.30969120527329E+19 | DI65: =FIB(RC[-101])+RC[-1]+R[-1]C+R[-1]C[-1] -> 2.50086450905798E+20 | DJ65: =FIB(RC[-101])+RC[-1]+R[-1]C+R[-1]C[-1] -> 2.50294731626775E+21 | DK65: =FIB(RC[-101])+RC[-1]+R[-1]C+R[-1]C[-1] -> 2.32950948328796E+22 | DL65: =FIB(RC[-101])+RC[-1]+R[-1]C+R[-1]C[-1] -> 2.02673899724615E+23 | DM65: =FIB(RC[-101])+RC[-1]+R[-1]C+R[-1]C[-1] -> 1.65589746793553E+24 | DN65: =FIB(RC[-101])+RC[-1]+R[-1]C+R[-1]C[-1] -> 1.27560915152516E+25 | DO65: =FIB(RC[-101])+RC[-1]+R[-1]C+R[-1]C[-1] -> 9.29825590234645E+25 | DP65: =FIB(RC[-101])+RC[-1]+R[-1]C+R[-1]C[-1] -> 6.43387355857971E+26 | DQ65: =FIB(RC[-101])+RC[-1]+R[-1]C+R[-1]C[-1] -> 4.2381818763562E+27 | DR65: =FIB(RC[-101])+RC[-1]+R[-1]C+R[-1]C[-1] -> 2.66472956746243E+28 | DS65: =FIB(RC[-101])+RC[-1]+R[-1]C+R[-1]C[-1] -> 1.6029558915591E+29 | DT65: =FIB(RC[-101])+RC[-1]+R[-1]C+R[-1]C[-1] -> 9.2453789156322E+29 | DU65: =FIB(RC[-101])+RC[-1]+R[-1]C+R[-1]C[-1] -> 5.12300777342672E+30 | DV65: =FIB(RC[-101])+RC[-1]+R[-1]C+R[-1]C[-1] -> 2.73222764867826E+31 | DW65: =FIB(RC[-101])+RC[-1]+R[-1]C+R[-1]C[-1] -> 1.4048649465887E+32 | DX65: =FIB(RC[-101])+RC[-1]+R[-1]C+R[-1]C[-1] -> 6.97523592579651E+32 | DY65: =FIB(RC[-101])+RC[-1]+R[-1]C+R[-1]C[-1] -> 3.34905995709159E+33 | DZ65: =FIB(RC[-101])+RC[-1]+R[-1]C+R[-1]C[-1] -> 1.55710136226567E+34 | EA65: =FIB(RC[-101])+RC[-1]+R[-1]C+R[-1]C[-1] -> 7.01927832026125E+34 | EB65: =FIB(RC[-101])+RC[-1]+R[-1]C+R[-1]C[-1] -> 3.07161272316668E+35 | EC65: =FIB(RC[-101])+RC[-1]+R[-1]C+R[-1]C[-1] -> 1.3062431377541E+36 | ED65: =FIB(RC[-101])+RC[-1]+R[-1]C+R[-1]C[-1] -> 5.40407652983067E+36 | EE65: =FIB(RC[-101])+RC[-1]+R[-1]C+R[-1]C[-1] -> 2.17715263498248E+37 | EF65: =FIB(RC[-101])+RC[-1]+R[-1]C+R[-1]C[-1] -> 8.54933000326182E+37 | EG65: =FIB(RC[-101])+RC[-1]+R[-1]C+R[-1]C[-1] -> 3.27517753512545E+38 | EH65: =FIB(RC[-101])+RC[-1]+R[-1]C+R[-1]C[-1] -> 1.22506889200791E+39 | EI65: =FIB(RC[-101])+RC[-1]+R[-1]C+R[-1]C[-1] -> 4.47768536707853E+39 | EJ65: =FIB(RC[-101])+RC[-1]+R[-1]C+R[-1]C[-1] -> 1.6004462314088E+40 | EK65: =FIB(RC[-101])+RC[-1]+R[-1]C+R[-1]C[-1] -> 5.59801341958353E+40 | EL65: =FIB(RC[-101])+RC[-1]+R[-1]C+R[-1]C[-1] -> 1.91746726922592E+41 | EM65: =FIB(RC[-101])+RC[-1]+R[-1]C+R[-1]C[-1] -> 6.435836494058E+41 | EN65: =FIB(RC[-101])+RC[-1]+R[-1]C+R[-1]C[-1] -> 2.11803844893249E+42 | EO65: =FIB(RC[-101])+RC[-1]+R[-1]C+R[-1]C[-1] -> 6.8386603826532E+42 | EP65: =FIB(RC[-101])+RC[-1]+R[-1]C+R[-1]C[-1] -> 2.16751306914509E+43 | EQ65: =FIB(RC[-101])+RC[-1]+R[-1]C+R[-1]C[-1] -> 6.74745994873166E+43 | ER65: =FIB(RC[-101])+RC[-1]+R[-1]C+R[-1]C[-1] -> 2.06410198844055E+44 | ES65: =FIB(RC[-101])+RC[-1]+R[-1]C+R[-1]C[-1] -> 6.20796288058062E+44 | ET65: =FIB(RC[-101])+RC[-1]+R[-1]C+R[-1]C[-1] -> 1.83653899395928E+45 | EU65: =FIB(RC[-101])+RC[-1]+R[-1]C+R[-1]C[-1] -> 5.34665096671184E+45 | EV65: =FIB(RC[-101])+RC[-1]+R[-1]C+R[-1]C[-1] -> 1.53244102824273E+46 | EW65: =FIB(RC[-101])+RC[-1]+R[-1]C+R[-1]C[-1] -> 4.32601562641427E+46 | EX65: =FIB(RC[-101])+RC[-1]+R[-1]C+R[-1]C[-1] -> 1.20328858353974E+47 | EY65: =FIB(RC[-101])+RC[-1]+R[-1]C+R[-1]C[-1] -> 3.29911314993745E+47 | EZ65: =FIB(RC[-101])+RC[-1]+R[-1]C+R[-1]C[-1] -> 8.91933054278322E+47 | FA65: =FIB(RC[-101])+RC[-1]+R[-1]C+R[-1]C[-1] -> 2.3786515415457E+48 | FB65: =FIB(RC[-101])+RC[-1]+R[-1]C+R[-1]C[-1] -> 6.25954912103477E+48 | FC65: =FIB(RC[-101])+RC[-1]+R[-1]C+R[-1]C[-1] -> 1.62597409393378E+49 | FD65: =FIB(RC[-101])+RC[-1]+R[-1]C+R[-1]C[-1] -> 4.17044140710947E+49 | FE65: =FIB(RC[-101])+RC[-1]+R[-1]C+R[-1]C[-1] -> 1.05653235509869E+50 | FF65: =FIB(RC[-101])+RC[-1]+R[-1]C+R[-1]C[-1] -> 2.64451347951456E+50 | FG65: =FIB(RC[-101])+RC[-1]+R[-1]C+R[-1]C[-1] -> 6.54178568578061E+50 | FH65: =FIB(RC[-101])+RC[-1]+R[-1]C+R[-1]C[-1] -> 1.59976220507238E+51 | FI65: =FIB(RC[-101])+RC[-1]+R[-1]C+R[-1]C[-1] -> 3.86847772304305E+51 | FJ65: =FIB(RC[-101])+RC[-1]+R[-1]C+R[-1]C[-1] -> 9.25259088303364E+51 | FK65: =FIB(RC[-101])+RC[-1]+R[-1]C+R[-1]C[-1] -> 2.18944738774112E+52 | FL65: =FIB(RC[-101])+RC[-1]+R[-1]C+R[-1]C[-1] -> 5.12695243054666E+52 | FM65: =FIB(RC[-101])+RC[-1]+R[-1]C+R[-1]C[-1] -> 1.18833799782231E+53 | FN65: =FIB(RC[-101])+RC[-1]+R[-1]C+R[-1]C[-1] -> 2.72694026444632E+53 | FO65: =FIB(RC[-101])+RC[-1]+R[-1]C+R[-1]C[-1] -> 6.19672308519021E+53 | FP65: =FIB(RC[-101])+RC[-1]+R[-1]C+R[-1]C[-1] -> 1.3947367556349E+54 | FQ65: =FIB(RC[-101])+RC[-1]+R[-1]C+R[-1]C[-1] -> 3.10996910252434E+54 | FR65: =FIB(RC[-101])+RC[-1]+R[-1]C+R[-1]C[-1] -> 6.87132959768977E+54 | FS65: =FIB(RC[-101])+RC[-1]+R[-1]C+R[-1]C[-1] -> 1.50463413863008E+55 | FT65: =FIB(RC[-101])+RC[-1]+R[-1]C+R[-1]C[-1] -> 3.26594190541579E+55 | FU65: =FIB(RC[-101])+RC[-1]+R[-1]C+R[-1]C[-1] -> 7.02834297626174E+55 | FV65: =FIB(RC[-101])+RC[-1]+R[-1]C+R[-1]C[-1] -> 1.49982834902515E+56 | FW65: =FIB(RC[-101])+RC[-1]+R[-1]C+R[-1]C[-1] -> 3.17430894796743E+56 | FX65: =FIB(RC[-101])+RC[-1]+R[-1]C+R[-1]C[-1] -> 6.6642084241995E+56 | FY65: =FIB(RC[-101])+RC[-1]+R[-1]C+R[-1]C[-1] -> 1.38806661701395E+57 | FZ65: =FIB(RC[-101])+RC[-1]+R[-1]C+R[-1]C[-1] -> 2.86881803689378E+57 | GA65: =FIB(RC[-101])+RC[-1]+R[-1]C+R[-1]C[-1] -> 5.88427954557838E+57 | GB65: =FIB(RC[-101])+RC[-1]+R[-1]C+R[-1]C[-1] -> 1.1979700486806E+58 | GC65: =FIB(RC[-101])+RC[-1]+R[-1]C+R[-1]C[-1] -> 2.42116257747736E+58 | GD65: =FIB(RC[-101])+RC[-1]+R[-1]C+R[-1]C[-1] -> 4.85834654804412E+58 | GE65: =FIB(RC[-101])+RC[-1]+R[-1]C+R[-1]C[-1] -> 9.68052934631707E+58 | GF65: =FIB(RC[-101])+RC[-1]+R[-1]C+R[-1]C[-1] -> 1.91563918253643E+59 | GG65: =FIB(RC[-101])+RC[-1]+R[-1]C+R[-1]C[-1] -> 3.76520522568362E+59 | GH65: =FIB(RC[-101])+RC[-1]+R[-1]C+R[-1]C[-1] -> 7.35154744018419E+59 | GI65: =FIB(RC[-101])+RC[-1]+R[-1]C+R[-1]C[-1] -> 1.42605876096622E+60 | GJ65: =FIB(RC[-101])+RC[-1]+R[-1]C+R[-1]C[-1] -> 2.74863194644286E+60 | GK65: =FIB(RC[-101])+RC[-1]+R[-1]C+R[-1]C[-1] -> 5.26461813412017E+60 | GL65: =FIB(RC[-101])+RC[-1]+R[-1]C+R[-1]C[-1] -> 1.0021611595422E+61 | GM65: =FIB(RC[-101])+RC[-1]+R[-1]C+R[-1]C[-1] -> 1.89616742796023E+61 | GN65: =FIB(RC[-101])+RC[-1]+R[-1]C+R[-1]C[-1] -> 3.56640786530354E+61 | GO65: =FIB(RC[-101])+RC[-1]+R[-1]C+R[-1]C[-1] -> 6.66877625292061E+61 | GP65: =FIB(RC[-101])+RC[-1]+R[-1]C+R[-1]C[-1] -> 1.23984256875866E+62 | GQ65: =FIB(RC[-101])+RC[-1]+R[-1]C+R[-1]C[-1] -> 2.29211041860405E+62 | GR65: =FIB(RC[-101])+RC[-1]+R[-1]C+R[-1]C[-1] -> 4.21400823978051E+62 | GS65: =FIB(RC[-101])+RC[-1]+R[-1]C+R[-1]C[-1] -> 7.70525994373487E+62
A66: 20 | B66: 20 | C66: 20 | D66: 20 | E66: 20 | F66: 20 | G66: 20 | H66: 20 | I66: 20 | J66: 20 | K66: 20 | L66: 20 | M66: 20 | N66: 20 | O66: 20 | P66: 20 | Q66: 20 | R66: 20 | S66: 20 | T66: 20 | U66: 20 | V66: 20 | W66: 20 | X66: 20 | Y66: 20 | Z66: 20 | AA66: 20 | AB66: 20 | AC66: 20 | AD66: 20 | AE66: 20 | AF66: 20 | AG66: 20 | AH66: 20 | AI66: 20 | AJ66: 20 | AK66: 20 | AL66: 20 | AM66: 20 | AN66: 20 | AO66: 20 | AP66: 20 | AQ66: 20 | AR66: 20 | AS66: 20 | AT66: 20 | AU66: 20 | AV66: 20 | AW66: 20 | AX66: 20 | AY66: 20 | AZ66: 20 | BA66: 20 | BB66: 20 | BC66: 20 | BD66: 20 | BE66: 20 | BF66: 20 | BG66: 20 | BH66: 20 | BI66: 20 | BJ66: 20 | BK66: 20 | BL66: 20 | BM66: 20 | BN66: 20 | BO66: 20 | BP66: 20 | BQ66: 20 | BR66: 20 | BS66: 20 | BT66: 20 | BU66: 20 | BV66: 20 | BW66: 20 | BX66: 20 | BY66: 20 | BZ66: 20 | CA66: 20 | CB66: 20 | CC66: 20 | CD66: 20 | CE66: 20 | CF66: 20 | CG66: 20 | CH66: 20 | CI66: 20 | CJ66: 20 | CK66: 20 | CL66: 20 | CM66: 20 | CN66: 20 | CO66: 20 | CP66: 20 | CQ66: 20 | CR66: 20 | CS66: 20 | CT66: 20 | CU66: 20 | CV66: 20 | CW66: 0 | CX66: =FIB(RC[-101])+RC[-1]+R[-1]C+R[-1]C[-1] -> 711490 | CY66: =FIB(RC[-101])+RC[-1]+R[-1]C+R[-1]C[-1] -> 46958340 | CZ66: =FIB(RC[-101])+RC[-1]+R[-1]C+R[-1]C[-1] -> 2051225670 | DA66: =FIB(RC[-101])+RC[-1]+R[-1]C+R[-1]C[-1] -> 67213037320 | DB66: =FIB(RC[-101])+RC[-1]+R[-1]C+R[-1]C[-1] -> 1762622700618 | DC66: =FIB(RC[-101])+RC[-1]+R[-1]C+R[-1]C[-1] -> 38539939946508 | DD66: =FIB(RC[-101])+RC[-1]+R[-1]C+R[-1]C[-1] -> 722758267129678 | DE66: =FIB(RC[-101])+RC[-1]+R[-1]C+R[-1]C[-1] -> 1.18688890717906E+16 | DF66: =FIB(RC[-101])+RC[-1]+R[-1]C+R[-1]C[-1] -> 1.73400726060258E+17 | DG66: =FIB(RC[-101])+RC[-1]+R[-1]C+R[-1]C[-1] -> 2.28223151155406E+18 | DH66: =FIB(RC[-101])+RC[-1]+R[-1]C+R[-1]C[-1] -> 2.73369395703804E+19 | DI66: =FIB(RC[-101])+RC[-1]+R[-1]C+R[-1]C[-1] -> 3.00520302528911E+20 | DJ66: =FIB(RC[-101])+RC[-1]+R[-1]C+R[-1]C[-1] -> 3.05355406970246E+21 | DK66: =FIB(RC[-101])+RC[-1]+R[-1]C+R[-1]C[-1] -> 2.88515962188498E+22 | DL66: =FIB(RC[-101])+RC[-1]+R[-1]C+R[-1]C[-1] -> 2.54820590776344E+23 | DM66: =FIB(RC[-101])+RC[-1]+R[-1]C+R[-1]C[-1] -> 2.11339195843649E+24 | DN66: =FIB(RC[-101])+RC[-1]+R[-1]C+R[-1]C[-1] -> 1.65253809416236E+25 | DO66: =FIB(RC[-101])+RC[-1]+R[-1]C+R[-1]C[-1] -> 1.2226403148034E+26 | DP66: =FIB(RC[-101])+RC[-1]+R[-1]C+R[-1]C[-1] -> 8.58633946361775E+26 | DQ66: =FIB(RC[-101])+RC[-1]+R[-1]C+R[-1]C[-1] -> 5.74020317857595E+27 | DR66: =FIB(RC[-101])+RC[-1]+R[-1]C+R[-1]C[-1] -> 3.66256807295564E+28 | DS66: =FIB(RC[-101])+RC[-1]+R[-1]C+R[-1]C[-1] -> 2.2356856556009E+29 | DT66: =FIB(RC[-101])+RC[-1]+R[-1]C+R[-1]C[-1] -> 1.30840204627922E+30 | DU66: =FIB(RC[-101])+RC[-1]+R[-1]C+R[-1]C[-1] -> 7.35594771126916E+30 | DV66: =FIB(RC[-101])+RC[-1]+R[-1]C+R[-1]C[-1] -> 3.98012319714785E+31 | DW66: =FIB(RC[-101])+RC[-1]+R[-1]C+R[-1]C[-1] -> 2.07610003117131E+32 | DX66: =FIB(RC[-101])+RC[-1]+R[-1]C+R[-1]C[-1] -> 1.04562009035565E+33 | DY66: =FIB(RC[-101])+RC[-1]+R[-1]C+R[-1]C[-1] -> 5.09220364002689E+33 | DZ66: =FIB(RC[-101])+RC[-1]+R[-1]C+R[-1]C[-1] -> 2.40122772197752E+34 | EA66: =FIB(RC[-101])+RC[-1]+R[-1]C+R[-1]C[-1] -> 1.09776074045044E+35 | EB66: =FIB(RC[-101])+RC[-1]+R[-1]C+R[-1]C[-1] -> 4.87130129564325E+35 | EC66: =FIB(RC[-101])+RC[-1]+R[-1]C+R[-1]C[-1] -> 2.10053453963509E+36 | ED66: =FIB(RC[-101])+RC[-1]+R[-1]C+R[-1]C[-1] -> 8.81085420721986E+36 | EE66: =FIB(RC[-101])+RC[-1]+R[-1]C+R[-1]C[-1] -> 3.59864570868753E+37 | EF66: =FIB(RC[-101])+RC[-1]+R[-1]C+R[-1]C[-1] -> 1.43251283469318E+38 | EG66: =FIB(RC[-101])+RC[-1]+R[-1]C+R[-1]C[-1] -> 5.56262337014481E+38 | EH66: =FIB(RC[-101])+RC[-1]+R[-1]C+R[-1]C[-1] -> 2.10884898253493E+39 | EI66: =FIB(RC[-101])+RC[-1]+R[-1]C+R[-1]C[-1] -> 7.81160324162137E+39 | EJ66: =FIB(RC[-101])+RC[-1]+R[-1]C+R[-1]C[-1] -> 2.82937509227879E+40 | EK66: =FIB(RC[-101])+RC[-1]+R[-1]C+R[-1]C[-1] -> 1.00278347432711E+41 | EL66: =FIB(RC[-101])+RC[-1]+R[-1]C+R[-1]C[-1] -> 3.48005208551138E+41 | EM66: =FIB(RC[-101])+RC[-1]+R[-1]C+R[-1]C[-1] -> 1.18333558487953E+42 | EN66: =FIB(RC[-101])+RC[-1]+R[-1]C+R[-1]C[-1] -> 3.94495768321782E+42 | EO66: =FIB(RC[-101])+RC[-1]+R[-1]C+R[-1]C[-1] -> 1.29016565148035E+43 | EP66: =FIB(RC[-101])+RC[-1]+R[-1]C+R[-1]C[-1] -> 4.14154475889076E+43 | EQ66: =FIB(RC[-101])+RC[-1]+R[-1]C+R[-1]C[-1] -> 1.30565177767675E+44 | ER66: =FIB(RC[-101])+RC[-1]+R[-1]C+R[-1]C[-1] -> 4.04449976099047E+44 | ES66: =FIB(RC[-101])+RC[-1]+R[-1]C+R[-1]C[-1] -> 1.23165646300116E+45 | ET66: =FIB(RC[-101])+RC[-1]+R[-1]C+R[-1]C[-1] -> 3.6889917450185E+45 | EU66: =FIB(RC[-101])+RC[-1]+R[-1]C+R[-1]C[-1] -> 1.08721817056896E+46 | EV66: =FIB(RC[-101])+RC[-1]+R[-1]C+R[-1]C[-1] -> 3.15432429548287E+46 | EW66: =FIB(RC[-101])+RC[-1]+R[-1]C+R[-1]C[-1] -> 9.01278095013987E+46 | EX66: =FIB(RC[-101])+RC[-1]+R[-1]C+R[-1]C[-1] -> 2.53716824119516E+47 | EY66: =FIB(RC[-101])+RC[-1]+R[-1]C+R[-1]C[-1] -> 7.03956997467235E+47 | EZ66: =FIB(RC[-101])+RC[-1]+R[-1]C+R[-1]C[-1] -> 1.9258013667393E+48 | FA66: =FIB(RC[-101])+RC[-1]+R[-1]C+R[-1]C[-1] -> 5.19638596256333E+48 | FB66: =FIB(RC[-101])+RC[-1]+R[-1]C+R[-1]C[-1] -> 1.38345866251438E+49 | FC66: =FIB(RC[-101])+RC[-1]+R[-1]C+R[-1]C[-1] -> 3.63538766855163E+49 | FD66: =FIB(RC[-101])+RC[-1]+R[-1]C+R[-1]C[-1] -> 9.43180316959488E+49 | FE66: =FIB(RC[-101])+RC[-1]+R[-1]C+R[-1]C[-1] -> 2.41675681276913E+50 | FF66: =FIB(RC[-101])+RC[-1]+R[-1]C+R[-1]C[-1] -> 6.11780264738237E+50 | FG66: =FIB(RC[-101])+RC[-1]+R[-1]C+R[-1]C[-1] -> 1.53041018126775E+51 | FH66: =FIB(RC[-101])+RC[-1]+R[-1]C+R[-1]C[-1] -> 3.7843509549182E+51 | FI66: =FIB(RC[-101])+RC[-1]+R[-1]C+R[-1]C[-1] -> 9.25259088303364E+51 | FJ66: =FIB(RC[-101])+RC[-1]+R[-1]C+R[-1]C[-1] -> 2.23736594891103E+52 | FK66: =FIB(RC[-101])+RC[-1]+R[-1]C+R[-1]C[-1] -> 5.35207242495551E+52 | FL66: =FIB(RC[-101])+RC[-1]+R[-1]C+R[-1]C[-1] -> 1.26684722432433E+53 | FM66: =FIB(RC[-101])+RC[-1]+R[-1]C+R[-1]C[-1] -> 2.96788046520131E+53 | FN66: =FIB(RC[-101])+RC[-1]+R[-1]C+R[-1]C[-1] -> 6.88315872746994E+53 | FO66: =FIB(RC[-101])+RC[-1]+R[-1]C+R[-1]C[-1] -> 1.58068220771065E+54 | FP66: =FIB(RC[-101])+RC[-1]+R[-1]C+R[-1]C[-1] -> 3.59509127186457E+54 | FQ66: =FIB(RC[-101])+RC[-1]+R[-1]C+R[-1]C[-1] -> 8.09979713002381E+54 | FR66: =FIB(RC[-101])+RC[-1]+R[-1]C+R[-1]C[-1] -> 1.80810958302379E+55 | FS66: =FIB(RC[-101])+RC[-1]+R[-1]C+R[-1]C[-1] -> 3.99987668142284E+55 | FT66: =FIB(RC[-101])+RC[-1]+R[-1]C+R[-1]C[-1] -> 8.77045272546871E+55 | FU66: =FIB(RC[-101])+RC[-1]+R[-1]C+R[-1]C[-1] -> 1.90647376071462E+56 | FV66: =FIB(RC[-101])+RC[-1]+R[-1]C+R[-1]C[-1] -> 4.10913640736595E+56 | FW66: =FIB(RC[-101])+RC[-1]+R[-1]C+R[-1]C[-1] -> 8.78327370435853E+56 | FX66: =FIB(RC[-101])+RC[-1]+R[-1]C+R[-1]C[-1] -> 1.86217910765255E+57 | FY66: =FIB(RC[-101])+RC[-1]+R[-1]C+R[-1]C[-1] -> 3.91666656708645E+57 | FZ66: =FIB(RC[-101])+RC[-1]+R[-1]C+R[-1]C[-1] -> 8.17355122099418E+57 | GA66: =FIB(RC[-101])+RC[-1]+R[-1]C+R[-1]C[-1] -> 1.69266488034663E+58 | GB66: =FIB(RC[-101])+RC[-1]+R[-1]C+R[-1]C[-1] -> 3.47906288358508E+58 | GC66: =FIB(RC[-101])+RC[-1]+R[-1]C+R[-1]C[-1] -> 7.09819550974304E+58 | GD66: =FIB(RC[-101])+RC[-1]+R[-1]C+R[-1]C[-1] -> 1.43777046352645E+59 | GE66: =FIB(RC[-101])+RC[-1]+R[-1]C+R[-1]C[-1] -> 2.89165805296257E+59 | GF66: =FIB(RC[-101])+RC[-1]+R[-1]C+R[-1]C[-1] -> 5.77535017013071E+59 | GG66: =FIB(RC[-101])+RC[-1]+R[-1]C+R[-1]C[-1] -> 1.14561945783508E+60 | GH66: =FIB(RC[-101])+RC[-1]+R[-1]C+R[-1]C[-1] -> 2.25729472442186E+60 | GI66: =FIB(RC[-101])+RC[-1]+R[-1]C+R[-1]C[-1] -> 4.4185082294065E+60 | GJ66: =FIB(RC[-101])+RC[-1]+R[-1]C+R[-1]C[-1] -> 8.59319893681559E+60 | GK66: =FIB(RC[-101])+RC[-1]+R[-1]C+R[-1]C[-1] -> 1.66064490173786E+61 | GL66: =FIB(RC[-101])+RC[-1]+R[-1]C+R[-1]C[-1] -> 3.18926787469208E+61 | GM66: =FIB(RC[-101])+RC[-1]+R[-1]C+R[-1]C[-1] -> 6.08759646219451E+61 | GN66: =FIB(RC[-101])+RC[-1]+R[-1]C+R[-1]C[-1] -> 1.15501717554583E+62 | GO66: =FIB(RC[-101])+RC[-1]+R[-1]C+R[-1]C[-1] -> 2.17853558736824E+62 | GP66: =FIB(RC[-101])+RC[-1]+R[-1]C+R[-1]C[-1] -> 4.08525578141896E+62 | GQ66: =FIB(RC[-101])+RC[-1]+R[-1]C+R[-1]C[-1] -> 7.61720876878166E+62 | GR66: =FIB(RC[-101])+RC[-1]+R[-1]C+R[-1]C[-1] -> 1.41233274271662E+63 | GS66: =FIB(RC[-101])+RC[-1]+R[-1]C+R[-1]C[-1] -> 2.60425956106816E+63
A67: 20 | B67: 20 | C67: 20 | D67: 20 | E67: 20 | F67: 20 | G67: 20 | H67: 20 | I67: 20 | J67: 20 | K67: 20 | L67: 20 | M67: 20 | N67: 20 | O67: 20 | P67: 20 | Q67: 20 | R67: 20 | S67: 20 | T67: 20 | U67: 20 | V67: 20 | W67: 20 | X67: 20 | Y67: 20 | Z67: 20 | AA67: 20 | AB67: 20 | AC67: 20 | AD67: 20 | AE67: 20 | AF67: 20 | AG67: 20 | AH67: 20 | AI67: 20 | AJ67: 20 | AK67: 20 | AL67: 20 | AM67: 20 | AN67: 20 | AO67: 20 | AP67: 20 | AQ67: 20 | AR67: 20 | AS67: 20 | AT67: 20 | AU67: 20 | AV67: 20 | AW67: 20 | AX67: 20 | AY67: 20 | AZ67: 20 | BA67: 20 | BB67: 20 | BC67: 20 | BD67: 20 | BE67: 20 | BF67: 20 | BG67: 20 | BH67: 20 | BI67: 20 | BJ67: 20 | BK67: 20 | BL67: 20 | BM67: 20 | BN67: 20 | BO67: 20 | BP67: 20 | BQ67: 20 | BR67: 20 | BS67: 20 | BT67: 20 | BU67: 20 | BV67: 20 | BW67: 20 | BX67: 20 | BY67: 20 | BZ67: 20 | CA67: 20 | CB67: 20 | CC67: 20 | CD67: 20 | CE67: 20 | CF67: 20 | CG67: 20 | CH67: 20 | CI67: 20 | CJ67: 20 | CK67: 20 | CL67: 20 | CM67: 20 | CN67: 20 | CO67: 20 | CP67: 20 | CQ67: 20 | CR67: 20 | CS67: 20 | CT67: 20 | CU67: 20 | CV67: 20 | CW67: 0 | CX67: =FIB(RC[-101])+RC[-1]+R[-1]C+R[-1]C[-1] -> 722436 | CY67: =FIB(RC[-101])+RC[-1]+R[-1]C+R[-1]C[-1] -> 48403212 | CZ67: =FIB(RC[-101])+RC[-1]+R[-1]C+R[-1]C[-1] -> 2146598168 | DA67: =FIB(RC[-101])+RC[-1]+R[-1]C+R[-1]C[-1] -> 71410872104 | DB67: =FIB(RC[-101])+RC[-1]+R[-1]C+R[-1]C[-1] -> 1901246620988 | DC67: =FIB(RC[-101])+RC[-1]+R[-1]C+R[-1]C[-1] -> 42203809279060 | DD67: =FIB(RC[-101])+RC[-1]+R[-1]C+R[-1]C[-1] -> 803502016366192 | DE67: =FIB(RC[-101])+RC[-1]+R[-1]C+R[-1]C[-1] -> 1.33951493552974E+16 | DF67: =FIB(RC[-101])+RC[-1]+R[-1]C+R[-1]C[-1] -> 1.98664764487357E+17 | DG67: =FIB(RC[-101])+RC[-1]+R[-1]C+R[-1]C[-1] -> 2.65429700210168E+18 | DH67: =FIB(RC[-101])+RC[-1]+R[-1]C+R[-1]C[-1] -> 3.22734680840362E+19 | DI67: =FIB(RC[-101])+RC[-1]+R[-1]C+R[-1]C[-1] -> 3.60130710183328E+20 | DJ67: =FIB(RC[-101])+RC[-1]+R[-1]C+R[-1]C[-1] -> 3.71420508241469E+21 | DK67: =FIB(RC[-101])+RC[-1]+R[-1]C+R[-1]C[-1] -> 3.5619355370967E+22 | DL67: =FIB(RC[-101])+RC[-1]+R[-1]C+R[-1]C[-1] -> 3.19291542366161E+23 | DM67: =FIB(RC[-101])+RC[-1]+R[-1]C+R[-1]C[-1] -> 2.68750409157899E+24 | DN67: =FIB(RC[-101])+RC[-1]+R[-1]C+R[-1]C[-1] -> 2.13262769916391E+25 | DO67: =FIB(RC[-101])+RC[-1]+R[-1]C+R[-1]C[-1] -> 1.60115689413602E+26 | DP67: =FIB(RC[-101])+RC[-1]+R[-1]C+R[-1]C[-1] -> 1.14101366725572E+27 | DQ67: =FIB(RC[-101])+RC[-1]+R[-1]C+R[-1]C[-1] -> 7.73985079219344E+27 | DR67: =FIB(RC[-101])+RC[-1]+R[-1]C+R[-1]C[-1] -> 5.01057347003258E+28 | DS67: =FIB(RC[-101])+RC[-1]+R[-1]C+R[-1]C[-1] -> 3.10299980989972E+29 | DT67: =FIB(RC[-101])+RC[-1]+R[-1]C+R[-1]C[-1] -> 1.84227059282928E+30 | DU67: =FIB(RC[-101])+RC[-1]+R[-1]C+R[-1]C[-1] -> 1.05066203503777E+31 | DV67: =FIB(RC[-101])+RC[-1]+R[-1]C+R[-1]C[-1] -> 5.76638000331253E+31 | DW67: =FIB(RC[-101])+RC[-1]+R[-1]C+R[-1]C[-1] -> 3.05075035121735E+32 | DX67: =FIB(RC[-101])+RC[-1]+R[-1]C+R[-1]C[-1] -> 1.55830512859452E+33 | DY67: =FIB(RC[-101])+RC[-1]+R[-1]C+R[-1]C[-1] -> 7.69612885897706E+33 | DZ67: =FIB(RC[-101])+RC[-1]+R[-1]C+R[-1]C[-1] -> 3.68006097187792E+34 | EA67: =FIB(RC[-101])+RC[-1]+R[-1]C+R[-1]C[-1] -> 1.70588960983599E+35 | EB67: =FIB(RC[-101])+RC[-1]+R[-1]C+R[-1]C[-1] -> 7.67495164592968E+35 | EC67: =FIB(RC[-101])+RC[-1]+R[-1]C+R[-1]C[-1] -> 3.35515983379239E+36 | ED67: =FIB(RC[-101])+RC[-1]+R[-1]C+R[-1]C[-1] -> 1.42665485806473E+37 | EE67: =FIB(RC[-101])+RC[-1]+R[-1]C+R[-1]C[-1] -> 5.90638598747425E+37 | EF67: =FIB(RC[-101])+RC[-1]+R[-1]C+R[-1]C[-1] -> 2.38301600430936E+38 | EG67: =FIB(RC[-101])+RC[-1]+R[-1]C+R[-1]C[-1] -> 9.37815220914736E+38 | EH67: =FIB(RC[-101])+RC[-1]+R[-1]C+R[-1]C[-1] -> 3.60292654046415E+39 | EI67: =FIB(RC[-101])+RC[-1]+R[-1]C+R[-1]C[-1] -> 1.35233787646204E+40 | EJ67: =FIB(RC[-101])+RC[-1]+R[-1]C+R[-1]C[-1] -> 4.96287329290297E+40 | EK67: =FIB(RC[-101])+RC[-1]+R[-1]C+R[-1]C[-1] -> 1.78200831284529E+41 | EL67: =FIB(RC[-101])+RC[-1]+R[-1]C+R[-1]C[-1] -> 6.26484387268378E+41 | EM67: =FIB(RC[-101])+RC[-1]+R[-1]C+R[-1]C[-1] -> 2.15782518069905E+42 | EN67: =FIB(RC[-101])+RC[-1]+R[-1]C+R[-1]C[-1] -> 7.2861184487964E+42 | EO67: =FIB(RC[-101])+RC[-1]+R[-1]C+R[-1]C[-1] -> 2.41327326468177E+43 | EP67: =FIB(RC[-101])+RC[-1]+R[-1]C+R[-1]C[-1] -> 7.84498367505289E+43 | EQ67: =FIB(RC[-101])+RC[-1]+R[-1]C+R[-1]C[-1] -> 2.50430462107112E+44 | ER67: =FIB(RC[-101])+RC[-1]+R[-1]C+R[-1]C[-1] -> 7.85445615973833E+44 | ES67: =FIB(RC[-101])+RC[-1]+R[-1]C+R[-1]C[-1] -> 2.42155205507404E+45 | ET67: =FIB(RC[-101])+RC[-1]+R[-1]C+R[-1]C[-1] -> 7.34220026309371E+45 | EU67: =FIB(RC[-101])+RC[-1]+R[-1]C+R[-1]C[-1] -> 2.19033737138018E+46 | EV67: =FIB(RC[-101])+RC[-1]+R[-1]C+R[-1]C[-1] -> 6.43187983743202E+46 | EW67: =FIB(RC[-101])+RC[-1]+R[-1]C+R[-1]C[-1] -> 1.85989850830548E+47 | EX67: =FIB(RC[-101])+RC[-1]+R[-1]C+R[-1]C[-1] -> 5.29834484451462E+47 | EY67: =FIB(RC[-101])+RC[-1]+R[-1]C+R[-1]C[-1] -> 1.48750830603821E+48 | EZ67: =FIB(RC[-101])+RC[-1]+R[-1]C+R[-1]C[-1] -> 4.11726667024475E+48 | FA67: =FIB(RC[-101])+RC[-1]+R[-1]C+R[-1]C[-1] -> 1.12394539995474E+49 | FB67: =FIB(RC[-101])+RC[-1]+R[-1]C+R[-1]C[-1] -> 3.02704265872545E+49 | FC67: =FIB(RC[-101])+RC[-1]+R[-1]C+R[-1]C[-1] -> 8.04588898979146E+49 | FD67: =FIB(RC[-101])+RC[-1]+R[-1]C+R[-1]C[-1] -> 2.1113079827938E+50 | FE67: =FIB(RC[-101])+RC[-1]+R[-1]C+R[-1]C[-1] -> 5.47124511252241E+50 | FF67: =FIB(RC[-101])+RC[-1]+R[-1]C+R[-1]C[-1] -> 1.40058045726739E+51 | FG67: =FIB(RC[-101])+RC[-1]+R[-1]C+R[-1]C[-1] -> 3.54277090327338E+51 | FH67: =FIB(RC[-101])+RC[-1]+R[-1]C+R[-1]C[-1] -> 8.85753203945934E+51 | FI67: =FIB(RC[-101])+RC[-1]+R[-1]C+R[-1]C[-1] -> 2.18944738774112E+52 | FJ67: =FIB(RC[-101])+RC[-1]+R[-1]C+R[-1]C[-1] -> 5.35207242495551E+52 | FK67: =FIB(RC[-101])+RC[-1]+R[-1]C+R[-1]C[-1] -> 1.29415107988221E+53 | FL67: =FIB(RC[-101])+RC[-1]+R[-1]C+R[-1]C[-1] -> 3.09620554670209E+53 | FM67: =FIB(RC[-101])+RC[-1]+R[-1]C+R[-1]C[-1] -> 7.33093323622773E+53 | FN67: =FIB(RC[-101])+RC[-1]+R[-1]C+R[-1]C[-1] -> 1.7181972428899E+54 | FO67: =FIB(RC[-101])+RC[-1]+R[-1]C+R[-1]C[-1] -> 3.98719532334754E+54 | FP67: =FIB(RC[-101])+RC[-1]+R[-1]C+R[-1]C[-1] -> 9.16296880292275E+54 | FQ67: =FIB(RC[-101])+RC[-1]+R[-1]C+R[-1]C[-1] -> 2.08578572048111E+55 | FR67: =FIB(RC[-101])+RC[-1]+R[-1]C+R[-1]C[-1] -> 4.70387501650729E+55 | FS67: =FIB(RC[-101])+RC[-1]+R[-1]C+R[-1]C[-1] -> 1.05118612809539E+56 | FT67: =FIB(RC[-101])+RC[-1]+R[-1]C+R[-1]C[-1] -> 2.32821906878455E+56 | FU67: =FIB(RC[-101])+RC[-1]+R[-1]C+R[-1]C[-1] -> 5.11173810204604E+56 | FV67: =FIB(RC[-101])+RC[-1]+R[-1]C+R[-1]C[-1] -> 1.11273482701266E+57 | FW67: =FIB(RC[-101])+RC[-1]+R[-1]C+R[-1]C[-1] -> 2.40197583818511E+57 | FX67: =FIB(RC[-101])+RC[-1]+R[-1]C+R[-1]C[-1] -> 5.14248231627351E+57 | FY67: =FIB(RC[-101])+RC[-1]+R[-1]C+R[-1]C[-1] -> 1.09213279910125E+58 | FZ67: =FIB(RC[-101])+RC[-1]+R[-1]C+R[-1]C[-1] -> 2.30115457790931E+58 | GA67: =FIB(RC[-101])+RC[-1]+R[-1]C+R[-1]C[-1] -> 4.81117458035536E+58 | GB67: =FIB(RC[-101])+RC[-1]+R[-1]C+R[-1]C[-1] -> 9.98290234428707E+58 | GC67: =FIB(RC[-101])+RC[-1]+R[-1]C+R[-1]C[-1] -> 2.05601607376152E+59 | GD67: =FIB(RC[-101])+RC[-1]+R[-1]C+R[-1]C[-1] -> 4.20360608826228E+59 | GE67: =FIB(RC[-101])+RC[-1]+R[-1]C+R[-1]C[-1] -> 8.5330346047513E+59 | GF67: =FIB(RC[-101])+RC[-1]+R[-1]C+R[-1]C[-1] -> 1.72000428278446E+60 | GG67: =FIB(RC[-101])+RC[-1]+R[-1]C+R[-1]C[-1] -> 3.44315875763261E+60 | GH67: =FIB(RC[-101])+RC[-1]+R[-1]C+R[-1]C[-1] -> 6.84607293988954E+60 | GI67: =FIB(RC[-101])+RC[-1]+R[-1]C+R[-1]C[-1] -> 1.35218758937179E+61 | GJ67: =FIB(RC[-101])+RC[-1]+R[-1]C+R[-1]C[-1] -> 2.653358305994E+61 | GK67: =FIB(RC[-101])+RC[-1]+R[-1]C+R[-1]C[-1] -> 5.17332310141342E+61 | GL67: =FIB(RC[-101])+RC[-1]+R[-1]C+R[-1]C[-1] -> 1.00232358778434E+62 | GM67: =FIB(RC[-101])+RC[-1]+R[-1]C+R[-1]C[-1] -> 1.93001002147299E+62 | GN67: =FIB(RC[-101])+RC[-1]+R[-1]C+R[-1]C[-1] -> 3.69378684323827E+62 | GO67: =FIB(RC[-101])+RC[-1]+R[-1]C+R[-1]C[-1] -> 7.02733960615234E+62 | GP67: =FIB(RC[-101])+RC[-1]+R[-1]C+R[-1]C[-1] -> 1.32911309749395E+63 | GQ67: =FIB(RC[-101])+RC[-1]+R[-1]C+R[-1]C[-1] -> 2.49935955251402E+63 | GR67: =FIB(RC[-101])+RC[-1]+R[-1]C+R[-1]C[-1] -> 4.67341317210881E+63 | GS67: =FIB(RC[-101])+RC[-1]+R[-1]C+R[-1]C[-1] -> 8.69000547589359E+63
A68: 20 | B68: 20 | C68: 20 | D68: 20 | E68: 20 | F68: 20 | G68: 20 | H68: 20 | I68: 20 | J68: 20 | K68: 20 | L68: 20 | M68: 20 | N68: 20 | O68: 20 | P68: 20 | Q68: 20 | R68: 20 | S68: 20 | T68: 20 | U68: 20 | V68: 20 | W68: 20 | X68: 20 | Y68: 20 | Z68: 20 | AA68: 20 | AB68: 20 | AC68: 20 | AD68: 20 | AE68: 20 | AF68: 20 | AG68: 20 | AH68: 20 | AI68: 20 | AJ68: 20 | AK68: 20 | AL68: 20 | AM68: 20 | AN68: 20 | AO68: 20 | AP68: 20 | AQ68: 20 | AR68: 20 | AS68: 20 | AT68: 20 | AU68: 20 | AV68: 20 | AW68: 20 | AX68: 20 | AY68: 20 | AZ68: 20 | BA68: 20 | BB68: 20 | BC68: 20 | BD68: 20 | BE68: 20 | BF68: 20 | BG68: 20 | BH68: 20 | BI68: 20 | BJ68: 20 | BK68: 20 | BL68: 20 | BM68: 20 | BN68: 20 | BO68: 20 | BP68: 20 | BQ68: 20 | BR68: 20 | BS68: 20 | BT68: 20 | BU68: 20 | BV68: 20 | BW68: 20 | BX68: 20 | BY68: 20 | BZ68: 20 | CA68: 20 | CB68: 20 | CC68: 20 | CD68: 20 | CE68: 20 | CF68: 20 | CG68: 20 | CH68: 20 | CI68: 20 | CJ68: 20 | CK68: 20 | CL68: 20 | CM68: 20 | CN68: 20 | CO68: 20 | CP68: 20 | CQ68: 20 | CR68: 20 | CS68: 20 | CT68: 20 | CU68: 20 | CV68: 20 | CW68: 0 | CX68: =FIB(RC[-101])+RC[-1]+R[-1]C+R[-1]C[-1] -> 733382 | CY68: =FIB(RC[-101])+RC[-1]+R[-1]C+R[-1]C[-1] -> 49869976 | CZ68: =FIB(RC[-101])+RC[-1]+R[-1]C+R[-1]C[-1] -> 2244882302 | DA68: =FIB(RC[-101])+RC[-1]+R[-1]C+R[-1]C[-1] -> 75802363520 | DB68: =FIB(RC[-101])+RC[-1]+R[-1]C+R[-1]C[-1] -> 2048459867558 | DC68: =FIB(RC[-101])+RC[-1]+R[-1]C+R[-1]C[-1] -> 46153515778552 | DD68: =FIB(RC[-101])+RC[-1]+R[-1]C+R[-1]C[-1] -> 891859341434750 | DE68: =FIB(RC[-101])+RC[-1]+R[-1]C+R[-1]C[-1] -> 1.50905107131093E+16 | DF68: =FIB(RC[-101])+RC[-1]+R[-1]C+R[-1]C[-1] -> 2.27150424555774E+17 | DG68: =FIB(RC[-101])+RC[-1]+R[-1]C+R[-1]C[-1] -> 3.08011219114482E+18 | DH68: =FIB(RC[-101])+RC[-1]+R[-1]C+R[-1]C[-1] -> 3.80078772772827E+19 | DI68: =FIB(RC[-101])+RC[-1]+R[-1]C+R[-1]C[-1] -> 4.30412055544647E+20 | DJ68: =FIB(RC[-101])+RC[-1]+R[-1]C+R[-1]C[-1] -> 4.50474784814267E+21 | DK68: =FIB(RC[-101])+RC[-1]+R[-1]C+R[-1]C[-1] -> 4.38383083015243E+22 | DL68: =FIB(RC[-101])+RC[-1]+R[-1]C+R[-1]C[-1] -> 3.98749206038652E+23 | DM68: =FIB(RC[-101])+RC[-1]+R[-1]C+R[-1]C[-1] -> 3.40554483998381E+24 | DN68: =FIB(RC[-101])+RC[-1]+R[-1]C+R[-1]C[-1] -> 2.74193259232019E+25 | DO68: =FIB(RC[-101])+RC[-1]+R[-1]C+R[-1]C[-1] -> 2.08861292328443E+26 | DP68: =FIB(RC[-101])+RC[-1]+R[-1]C+R[-1]C[-1] -> 1.50999064899776E+27 | DQ68: =FIB(RC[-101])+RC[-1]+R[-1]C+R[-1]C[-1] -> 1.03908551084469E+28 | DR68: =FIB(RC[-101])+RC[-1]+R[-1]C+R[-1]C[-1] -> 6.82364406009662E+28 | DS68: =FIB(RC[-101])+RC[-1]+R[-1]C+R[-1]C[-1] -> 4.28642156291264E+29 | DT68: =FIB(RC[-101])+RC[-1]+R[-1]C+R[-1]C[-1] -> 2.58121273011052E+30 | DU68: =FIB(RC[-101])+RC[-1]+R[-1]C+R[-1]C[-1] -> 1.49301036733175E+31 | DV68: =FIB(RC[-101])+RC[-1]+R[-1]C+R[-1]C[-1] -> 8.31005240568204E+31 | DW68: =FIB(RC[-101])+RC[-1]+R[-1]C+R[-1]C[-1] -> 4.45839359211681E+32 | DX68: =FIB(RC[-101])+RC[-1]+R[-1]C+R[-1]C[-1] -> 2.30921952292793E+33 | DY68: =FIB(RC[-101])+RC[-1]+R[-1]C+R[-1]C[-1] -> 1.15636535104995E+34 | DZ68: =FIB(RC[-101])+RC[-1]+R[-1]C+R[-1]C[-1] -> 5.60603920882557E+34 | EA68: =FIB(RC[-101])+RC[-1]+R[-1]C+R[-1]C[-1] -> 2.63449962790634E+35 | EB68: =FIB(RC[-101])+RC[-1]+R[-1]C+R[-1]C[-1] -> 1.2015340883672E+36 | EC68: =FIB(RC[-101])+RC[-1]+R[-1]C+R[-1]C[-1] -> 5.32418908675255E+36 | ED68: =FIB(RC[-101])+RC[-1]+R[-1]C+R[-1]C[-1] -> 2.29458975011923E+37 | EE68: =FIB(RC[-101])+RC[-1]+R[-1]C+R[-1]C[-1] -> 9.62763059565821E+37 | EF68: =FIB(RC[-101])+RC[-1]+R[-1]C+R[-1]C[-1] -> 3.93641766262261E+38 | EG68: =FIB(RC[-101])+RC[-1]+R[-1]C+R[-1]C[-1] -> 1.56975858760793E+39 | EH68: =FIB(RC[-101])+RC[-1]+R[-1]C+R[-1]C[-1] -> 6.11050034898682E+39 | EI68: =FIB(RC[-101])+RC[-1]+R[-1]C+R[-1]C[-1] -> 2.32368056540714E+40 | EJ68: =FIB(RC[-101])+RC[-1]+R[-1]C+R[-1]C[-1] -> 8.63889173477216E+40 | EK68: =FIB(RC[-101])+RC[-1]+R[-1]C+R[-1]C[-1] -> 3.1421848156128E+41 | EL68: =FIB(RC[-101])+RC[-1]+R[-1]C+R[-1]C[-1] -> 1.11890370011419E+42 | EM68: =FIB(RC[-101])+RC[-1]+R[-1]C+R[-1]C[-1] -> 3.90321326808161E+42 | EN68: =FIB(RC[-101])+RC[-1]+R[-1]C+R[-1]C[-1] -> 1.33471568975771E+43 | EO68: =FIB(RC[-101])+RC[-1]+R[-1]C+R[-1]C[-1] -> 4.47660079931912E+43 | EP68: =FIB(RC[-101])+RC[-1]+R[-1]C+R[-1]C[-1] -> 1.47348577390538E+44 | EQ68: =FIB(RC[-101])+RC[-1]+R[-1]C+R[-1]C[-1] -> 4.76228876248178E+44 | ER68: =FIB(RC[-101])+RC[-1]+R[-1]C+R[-1]C[-1] -> 1.51210495432912E+45 | ES68: =FIB(RC[-101])+RC[-1]+R[-1]C+R[-1]C[-1] -> 4.719102625377E+45 | ET68: =FIB(RC[-101])+RC[-1]+R[-1]C+R[-1]C[-1] -> 1.44828549435448E+46 | EU68: =FIB(RC[-101])+RC[-1]+R[-1]C+R[-1]C[-1] -> 4.37284289204403E+46 | EV68: =FIB(RC[-101])+RC[-1]+R[-1]C+R[-1]C[-1] -> 1.29950601008562E+47 | EW68: =FIB(RC[-101])+RC[-1]+R[-1]C+R[-1]C[-1] -> 3.8025925021343E+47 | EX68: =FIB(RC[-101])+RC[-1]+R[-1]C+R[-1]C[-1] -> 1.09608358549544E+48 | EY68: =FIB(RC[-101])+RC[-1]+R[-1]C+R[-1]C[-1] -> 3.11342637598511E+48 | EZ68: =FIB(RC[-101])+RC[-1]+R[-1]C+R[-1]C[-1] -> 8.71820135226807E+48 | FA68: =FIB(RC[-101])+RC[-1]+R[-1]C+R[-1]C[-1] -> 2.40749220220602E+49 | FB68: =FIB(RC[-101])+RC[-1]+R[-1]C+R[-1]C[-1] -> 6.55848026088621E+49 | FC68: =FIB(RC[-101])+RC[-1]+R[-1]C+R[-1]C[-1] -> 1.76314119094031E+50 | FD68: =FIB(RC[-101])+RC[-1]+R[-1]C+R[-1]C[-1] -> 4.67903807271326E+50 | FE68: =FIB(RC[-101])+RC[-1]+R[-1]C+R[-1]C[-1] -> 1.22615911680295E+51 | FF68: =FIB(RC[-101])+RC[-1]+R[-1]C+R[-1]C[-1] -> 3.17386408532258E+51 | FG68: =FIB(RC[-101])+RC[-1]+R[-1]C+R[-1]C[-1] -> 8.11721544586335E+51 | FH68: =FIB(RC[-101])+RC[-1]+R[-1]C+R[-1]C[-1] -> 2.05175183885961E+52 | FI68: =FIB(RC[-101])+RC[-1]+R[-1]C+R[-1]C[-1] -> 5.12695243054666E+52 | FJ68: =FIB(RC[-101])+RC[-1]+R[-1]C+R[-1]C[-1] -> 1.26684722432433E+53 | FK68: =FIB(RC[-101])+RC[-1]+R[-1]C+R[-1]C[-1] -> 3.09620554670209E+53 | FL68: =FIB(RC[-101])+RC[-1]+R[-1]C+R[-1]C[-1] -> 7.48656217328638E+53 | FM68: =FIB(RC[-101])+RC[-1]+R[-1]C+R[-1]C[-1] -> 1.79137009562162E+54 | FN68: =FIB(RC[-101])+RC[-1]+R[-1]C+R[-1]C[-1] -> 4.24266066213429E+54 | FO68: =FIB(RC[-101])+RC[-1]+R[-1]C+R[-1]C[-1] -> 9.94805322837172E+54 | FP68: =FIB(RC[-101])+RC[-1]+R[-1]C+R[-1]C[-1] -> 2.3098217354642E+55 | FQ68: =FIB(RC[-101])+RC[-1]+R[-1]C+R[-1]C[-1] -> 5.31190433623759E+55 | FR68: =FIB(RC[-101])+RC[-1]+R[-1]C+R[-1]C[-1] -> 1.2101565073226E+56 | FS68: =FIB(RC[-101])+RC[-1]+R[-1]C+R[-1]C[-1] -> 2.73173013706872E+56 | FT68: =FIB(RC[-101])+RC[-1]+R[-1]C+R[-1]C[-1] -> 6.11113533394866E+56 | FU68: =FIB(RC[-101])+RC[-1]+R[-1]C+R[-1]C[-1] -> 1.35510925047793E+57 | FV68: =FIB(RC[-101])+RC[-1]+R[-1]C+R[-1]C[-1] -> 2.97901788769519E+57 | FW68: =FIB(RC[-101])+RC[-1]+R[-1]C+R[-1]C[-1] -> 6.49372855289296E+57 | FX68: =FIB(RC[-101])+RC[-1]+R[-1]C+R[-1]C[-1] -> 1.40381867073516E+58 | FY68: =FIB(RC[-101])+RC[-1]+R[-1]C+R[-1]C[-1] -> 3.01019970146376E+58 | FZ68: =FIB(RC[-101])+RC[-1]+R[-1]C+R[-1]C[-1] -> 6.40348707847432E+58 | GA68: =FIB(RC[-101])+RC[-1]+R[-1]C+R[-1]C[-1] -> 1.3515816236739E+59 | GB68: =FIB(RC[-101])+RC[-1]+R[-1]C+R[-1]C[-1] -> 2.83098931613814E+59 | GC68: =FIB(RC[-101])+RC[-1]+R[-1]C+R[-1]C[-1] -> 5.88529562432837E+59 | GD68: =FIB(RC[-101])+RC[-1]+R[-1]C+R[-1]C[-1] -> 1.21449177863522E+60 | GE68: =FIB(RC[-101])+RC[-1]+R[-1]C+R[-1]C[-1] -> 2.48815584793657E+60 | GF68: =FIB(RC[-101])+RC[-1]+R[-1]C+R[-1]C[-1] -> 5.06146359119616E+60 | GG68: =FIB(RC[-101])+RC[-1]+R[-1]C+R[-1]C[-1] -> 1.02246266316132E+61 | GH68: =FIB(RC[-101])+RC[-1]+R[-1]C+R[-1]C[-1] -> 2.05138583291354E+61 | GI68: =FIB(RC[-101])+RC[-1]+R[-1]C+R[-1]C[-1] -> 4.08818071627428E+61 | GJ68: =FIB(RC[-101])+RC[-1]+R[-1]C+R[-1]C[-1] -> 8.09372661164007E+61 | GK68: =FIB(RC[-101])+RC[-1]+R[-1]C+R[-1]C[-1] -> 1.59204080190475E+62 | GL68: =FIB(RC[-101])+RC[-1]+R[-1]C+R[-1]C[-1] -> 3.11169669983043E+62 | GM68: =FIB(RC[-101])+RC[-1]+R[-1]C+R[-1]C[-1] -> 6.04403030908776E+62 | GN68: =FIB(RC[-101])+RC[-1]+R[-1]C+R[-1]C[-1] -> 1.1667827173799E+63 | GO68: =FIB(RC[-101])+RC[-1]+R[-1]C+R[-1]C[-1] -> 2.23889536231896E+63 | GP68: =FIB(RC[-101])+RC[-1]+R[-1]C+R[-1]C[-1] -> 4.27074242042815E+63 | GQ68: =FIB(RC[-101])+RC[-1]+R[-1]C+R[-1]C[-1] -> 8.09921507043612E+63 | GR68: =FIB(RC[-101])+RC[-1]+R[-1]C+R[-1]C[-1] -> 1.52719877950589E+64 | GS68: =FIB(RC[-101])+RC[-1]+R[-1]C+R[-1]C[-1] -> 2.86354064430613E+64
A69: 20 | B69: 20 | C69: 20 | D69: 20 | E69: 20 | F69: 20 | G69: 20 | H69: 20 | I69: 20 | J69: 20 | K69: 20 | L69: 20 | M69: 20 | N69: 20 | O69: 20 | P69: 20 | Q69: 20 | R69: 20 | S69: 20 | T69: 20 | U69: 20 | V69: 20 | W69: 20 | X69: 20 | Y69: 20 | Z69: 20 | AA69: 20 | AB69: 20 | AC69: 20 | AD69: 20 | AE69: 20 | AF69: 20 | AG69: 20 | AH69: 20 | AI69: 20 | AJ69: 20 | AK69: 20 | AL69: 20 | AM69: 20 | AN69: 20 | AO69: 20 | AP69: 20 | AQ69: 20 | AR69: 20 | AS69: 20 | AT69: 20 | AU69: 20 | AV69: 20 | AW69: 20 | AX69: 20 | AY69: 20 | AZ69: 20 | BA69: 20 | BB69: 20 | BC69: 20 | BD69: 20 | BE69: 20 | BF69: 20 | BG69: 20 | BH69: 20 | BI69: 20 | BJ69: 20 | BK69: 20 | BL69: 20 | BM69: 20 | BN69: 20 | BO69: 20 | BP69: 20 | BQ69: 20 | BR69: 20 | BS69: 20 | BT69: 20 | BU69: 20 | BV69: 20 | BW69: 20 | BX69: 20 | BY69: 20 | BZ69: 20 | CA69: 20 | CB69: 20 | CC69: 20 | CD69: 20 | CE69: 20 | CF69: 20 | CG69: 20 | CH69: 20 | CI69: 20 | CJ69: 20 | CK69: 20 | CL69: 20 | CM69: 20 | CN69: 20 | CO69: 20 | CP69: 20 | CQ69: 20 | CR69: 20 | CS69: 20 | CT69: 20 | CU69: 20 | CV69: 20 | CW69: 0 | CX69: =FIB(RC[-101])+RC[-1]+R[-1]C+R[-1]C[-1] -> 744328 | CY69: =FIB(RC[-101])+RC[-1]+R[-1]C+R[-1]C[-1] -> 51358632 | CZ69: =FIB(RC[-101])+RC[-1]+R[-1]C+R[-1]C[-1] -> 2346121856 | DA69: =FIB(RC[-101])+RC[-1]+R[-1]C+R[-1]C[-1] -> 80393378624 | DB69: =FIB(RC[-101])+RC[-1]+R[-1]C+R[-1]C[-1] -> 2204655620648 | DC69: =FIB(RC[-101])+RC[-1]+R[-1]C+R[-1]C[-1] -> 50406631277704 | DD69: =FIB(RC[-101])+RC[-1]+R[-1]C+R[-1]C[-1] -> 988419488501952 | DE69: =FIB(RC[-101])+RC[-1]+R[-1]C+R[-1]C[-1] -> 1.6970789543057E+16 | DF69: =FIB(RC[-101])+RC[-1]+R[-1]C+R[-1]C[-1] -> 2.59211724811951E+17 | DG69: =FIB(RC[-101])+RC[-1]+R[-1]C+R[-1]C[-1] -> 3.56647434051256E+18 | DH69: =FIB(RC[-101])+RC[-1]+R[-1]C+R[-1]C[-1] -> 4.46544638089401E+19 | DI69: =FIB(RC[-101])+RC[-1]+R[-1]C+R[-1]C[-1] -> 5.13074396630869E+20 | DJ69: =FIB(RC[-101])+RC[-1]+R[-1]C+R[-1]C[-1] -> 5.44823430031819E+21 | DK69: =FIB(RC[-101])+RC[-1]+R[-1]C+R[-1]C[-1] -> 5.37912904499852E+22 | DL69: =FIB(RC[-101])+RC[-1]+R[-1]C+R[-1]C[-1] -> 4.96378804790162E+23 | DM69: =FIB(RC[-101])+RC[-1]+R[-1]C+R[-1]C[-1] -> 4.30067285081262E+24 | DN69: =FIB(RC[-101])+RC[-1]+R[-1]C+R[-1]C[-1] -> 3.51255436139983E+25 | DO69: =FIB(RC[-101])+RC[-1]+R[-1]C+R[-1]C[-1] -> 2.71406161865644E+26 | DP69: =FIB(RC[-101])+RC[-1]+R[-1]C+R[-1]C[-1] -> 1.99025810319185E+27 | DQ69: =FIB(RC[-101])+RC[-1]+R[-1]C+R[-1]C[-1] -> 1.38911038606365E+28 | DR69: =FIB(RC[-101])+RC[-1]+R[-1]C+R[-1]C[-1] -> 9.25183995700496E+28 | DS69: =FIB(RC[-101])+RC[-1]+R[-1]C+R[-1]C[-1] -> 5.8939699646228E+29 | DT69: =FIB(RC[-101])+RC[-1]+R[-1]C+R[-1]C[-1] -> 3.59925188286406E+30 | DU69: =FIB(RC[-101])+RC[-1]+R[-1]C+R[-1]C[-1] -> 2.11105682862921E+31 | DV69: =FIB(RC[-101])+RC[-1]+R[-1]C+R[-1]C[-1] -> 1.1914119601643E+32 | DW69: =FIB(RC[-101])+RC[-1]+R[-1]C+R[-1]C[-1] -> 6.48081079284931E+32 | DX69: =FIB(RC[-101])+RC[-1]+R[-1]C+R[-1]C[-1] -> 3.40313996142455E+33 | DY69: =FIB(RC[-101])+RC[-1]+R[-1]C+R[-1]C[-1] -> 1.7276012994852E+34 | DZ69: =FIB(RC[-101])+RC[-1]+R[-1]C+R[-1]C[-1] -> 8.49000585936072E+34 | EA69: =FIB(RC[-101])+RC[-1]+R[-1]C+R[-1]C[-1] -> 4.04410413472497E+35 | EB69: =FIB(RC[-101])+RC[-1]+R[-1]C+R[-1]C[-1] -> 1.86939446463033E+36 | EC69: =FIB(RC[-101])+RC[-1]+R[-1]C+R[-1]C[-1] -> 8.39511763975008E+36 | ED69: =FIB(RC[-101])+RC[-1]+R[-1]C+R[-1]C[-1] -> 3.66652042276949E+37 | EE69: =FIB(RC[-101])+RC[-1]+R[-1]C+R[-1]C[-1] -> 1.55887407685469E+38 | EF69: =FIB(RC[-101])+RC[-1]+R[-1]C+R[-1]C[-1] -> 6.45805479904312E+38 | EG69: =FIB(RC[-101])+RC[-1]+R[-1]C+R[-1]C[-1] -> 2.60920583377451E+39 | EH69: =FIB(RC[-101])+RC[-1]+R[-1]C+R[-1]C[-1] -> 1.02894647703693E+40 | EI69: =FIB(RC[-101])+RC[-1]+R[-1]C+R[-1]C[-1] -> 3.96367707734275E+40 | EJ69: =FIB(RC[-101])+RC[-1]+R[-1]C+R[-1]C[-1] -> 1.4926249377522E+41 | EK69: =FIB(RC[-101])+RC[-1]+R[-1]C+R[-1]C[-1] -> 5.49869892684222E+41 | EL69: =FIB(RC[-101])+RC[-1]+R[-1]C+R[-1]C[-1] -> 1.98299207435969E+42 | EM69: =FIB(RC[-101])+RC[-1]+R[-1]C+R[-1]C[-1] -> 7.00510904255548E+42 | EN69: =FIB(RC[-101])+RC[-1]+R[-1]C+R[-1]C[-1] -> 2.42554792082141E+43 | EO69: =FIB(RC[-101])+RC[-1]+R[-1]C+R[-1]C[-1] -> 8.23686440989824E+43 | EP69: =FIB(RC[-101])+RC[-1]+R[-1]C+R[-1]C[-1] -> 2.74483229482711E+44 | EQ69: =FIB(RC[-101])+RC[-1]+R[-1]C+R[-1]C[-1] -> 8.98060683121427E+44 | ER69: =FIB(RC[-101])+RC[-1]+R[-1]C+R[-1]C[-1] -> 2.88639451369873E+45 | ES69: =FIB(RC[-101])+RC[-1]+R[-1]C+R[-1]C[-1] -> 9.11760209340485E+45 | ET69: =FIB(RC[-101])+RC[-1]+R[-1]C+R[-1]C[-1] -> 2.83195596623266E+46 | EU69: =FIB(RC[-101])+RC[-1]+R[-1]C+R[-1]C[-1] -> 8.65308435263117E+46 | EV69: =FIB(RC[-101])+RC[-1]+R[-1]C+R[-1]C[-1] -> 2.60209873455314E+47 | EW69: =FIB(RC[-101])+RC[-1]+R[-1]C+R[-1]C[-1] -> 7.70419724677307E+47 | EX69: =FIB(RC[-101])+RC[-1]+R[-1]C+R[-1]C[-1] -> 2.24676256038618E+48 | EY69: =FIB(RC[-101])+RC[-1]+R[-1]C+R[-1]C[-1] -> 6.45627252186673E+48 | EZ69: =FIB(RC[-101])+RC[-1]+R[-1]C+R[-1]C[-1] -> 1.82879002501199E+49 | FA69: =FIB(RC[-101])+RC[-1]+R[-1]C+R[-1]C[-1] -> 5.10810236244482E+49 | FB69: =FIB(RC[-101])+RC[-1]+R[-1]C+R[-1]C[-1] -> 1.4074074825537E+50 | FC69: =FIB(RC[-101])+RC[-1]+R[-1]C+R[-1]C[-1] -> 3.82639669958264E+50 | FD69: =FIB(RC[-101])+RC[-1]+R[-1]C+R[-1]C[-1] -> 1.02685759632362E+51 | FE69: =FIB(RC[-101])+RC[-1]+R[-1]C+R[-1]C[-1] -> 2.72092052039789E+51 | FF69: =FIB(RC[-101])+RC[-1]+R[-1]C+R[-1]C[-1] -> 7.12094372252342E+51 | FG69: =FIB(RC[-101])+RC[-1]+R[-1]C+R[-1]C[-1] -> 1.84120232537094E+52 | FH69: =FIB(RC[-101])+RC[-1]+R[-1]C+R[-1]C[-1] -> 4.70467570881688E+52 | FI69: =FIB(RC[-101])+RC[-1]+R[-1]C+R[-1]C[-1] -> 1.18833799782231E+53 | FJ69: =FIB(RC[-101])+RC[-1]+R[-1]C+R[-1]C[-1] -> 2.96788046520131E+53 | FK69: =FIB(RC[-101])+RC[-1]+R[-1]C+R[-1]C[-1] -> 7.33093323622773E+53 | FL69: =FIB(RC[-101])+RC[-1]+R[-1]C+R[-1]C[-1] -> 1.79137009562162E+54 | FM69: =FIB(RC[-101])+RC[-1]+R[-1]C+R[-1]C[-1] -> 4.33139640857188E+54 | FN69: =FIB(RC[-101])+RC[-1]+R[-1]C+R[-1]C[-1] -> 1.03654271663278E+55 | FO69: =FIB(RC[-101])+RC[-1]+R[-1]C+R[-1]C[-1] -> 2.45561410568338E+55 | FP69: =FIB(RC[-101])+RC[-1]+R[-1]C+R[-1]C[-1] -> 5.76024116398475E+55 | FQ69: =FIB(RC[-101])+RC[-1]+R[-1]C+R[-1]C[-1] -> 1.33819672356865E+56 | FR69: =FIB(RC[-101])+RC[-1]+R[-1]C+R[-1]C[-1] -> 3.07954366451501E+56 | FS69: =FIB(RC[-101])+RC[-1]+R[-1]C+R[-1]C[-1] -> 7.02143030890633E+56 | FT69: =FIB(RC[-101])+RC[-1]+R[-1]C+R[-1]C[-1] -> 1.58642957799237E+57 | FU69: =FIB(RC[-101])+RC[-1]+R[-1]C+R[-1]C[-1] -> 3.55265236186516E+57 | FV69: =FIB(RC[-101])+RC[-1]+R[-1]C+R[-1]C[-1] -> 7.88677950003828E+57 | FW69: =FIB(RC[-101])+RC[-1]+R[-1]C+R[-1]C[-1] -> 1.73595259406264E+58 | FX69: =FIB(RC[-101])+RC[-1]+R[-1]C+R[-1]C[-1] -> 3.7891441200871E+58 | FY69: =FIB(RC[-101])+RC[-1]+R[-1]C+R[-1]C[-1] -> 8.20316249228601E+58 | FZ69: =FIB(RC[-101])+RC[-1]+R[-1]C+R[-1]C[-1] -> 1.76168492722241E+59 | GA69: =FIB(RC[-101])+RC[-1]+R[-1]C+R[-1]C[-1] -> 3.75361525874374E+59 | GB69: =FIB(RC[-101])+RC[-1]+R[-1]C+R[-1]C[-1] -> 7.93618619855578E+59 | GC69: =FIB(RC[-101])+RC[-1]+R[-1]C+R[-1]C[-1] -> 1.66524711390223E+60 | GD69: =FIB(RC[-101])+RC[-1]+R[-1]C+R[-1]C[-1] -> 3.46826845497028E+60 | GE69: =FIB(RC[-101])+RC[-1]+R[-1]C+R[-1]C[-1] -> 7.17091608154207E+60 | GF69: =FIB(RC[-101])+RC[-1]+R[-1]C+R[-1]C[-1] -> 1.47205355206748E+61 | GG69: =FIB(RC[-101])+RC[-1]+R[-1]C+R[-1]C[-1] -> 3.00066257434842E+61 | GH69: =FIB(RC[-101])+RC[-1]+R[-1]C+R[-1]C[-1] -> 6.07451107042328E+61 | GI69: =FIB(RC[-101])+RC[-1]+R[-1]C+R[-1]C[-1] -> 1.22140776196111E+62 | GJ69: =FIB(RC[-101])+RC[-1]+R[-1]C+R[-1]C[-1] -> 2.43959849475254E+62 | GK69: =FIB(RC[-101])+RC[-1]+R[-1]C+R[-1]C[-1] -> 4.8410119578213E+62 | GL69: =FIB(RC[-101])+RC[-1]+R[-1]C+R[-1]C[-1] -> 9.54474945955647E+62 | GM69: =FIB(RC[-101])+RC[-1]+R[-1]C+R[-1]C[-1] -> 1.87004764684747E+63 | GN69: =FIB(RC[-101])+RC[-1]+R[-1]C+R[-1]C[-1] -> 3.64123339513614E+63 | GO69: =FIB(RC[-101])+RC[-1]+R[-1]C+R[-1]C[-1] -> 7.04691147483501E+63 | GP69: =FIB(RC[-101])+RC[-1]+R[-1]C+R[-1]C[-1] -> 1.35565492575821E+64 | GQ69: =FIB(RC[-101])+RC[-1]+R[-1]C+R[-1]C[-1] -> 2.59265067484464E+64 | GR69: =FIB(RC[-101])+RC[-1]+R[-1]C+R[-1]C[-1] -> 4.92977096139415E+64 | GS69: =FIB(RC[-101])+RC[-1]+R[-1]C+R[-1]C[-1] -> 9.32051038520618E+64
A70: 20 | B70: 20 | C70: 20 | D70: 20 | E70: 20 | F70: 20 | G70: 20 | H70: 20 | I70: 20 | J70: 20 | K70: 20 | L70: 20 | M70: 20 | N70: 20 | O70: 20 | P70: 20 | Q70: 20 | R70: 20 | S70: 20 | T70: 20 | U70: 20 | V70: 20 | W70: 20 | X70: 20 | Y70: 20 | Z70: 20 | AA70: 20 | AB70: 20 | AC70: 20 | AD70: 20 | AE70: 20 | AF70: 20 | AG70: 20 | AH70: 20 | AI70: 20 | AJ70: 20 | AK70: 20 | AL70: 20 | AM70: 20 | AN70: 20 | AO70: 20 | AP70: 20 | AQ70: 20 | AR70: 20 | AS70: 20 | AT70: 20 | AU70: 20 | AV70: 20 | AW70: 20 | AX70: 20 | AY70: 20 | AZ70: 20 | BA70: 20 | BB70: 20 | BC70: 20 | BD70: 20 | BE70: 20 | BF70: 20 | BG70: 20 | BH70: 20 | BI70: 20 | BJ70: 20 | BK70: 20 | BL70: 20 | BM70: 20 | BN70: 20 | BO70: 20 | BP70: 20 | BQ70: 20 | BR70: 20 | BS70: 20 | BT70: 20 | BU70: 20 | BV70: 20 | BW70: 20 | BX70: 20 | BY70: 20 | BZ70: 20 | CA70: 20 | CB70: 20 | CC70: 20 | CD70: 20 | CE70: 20 | CF70: 20 | CG70: 20 | CH70: 20 | CI70: 20 | CJ70: 20 | CK70: 20 | CL70: 20 | CM70: 20 | CN70: 20 | CO70: 20 | CP70: 20 | CQ70: 20 | CR70: 20 | CS70: 20 | CT70: 20 | CU70: 20 | CV70: 20 | CW70: 0 | CX70: =FIB(RC[-101])+RC[-1]+R[-1]C+R[-1]C[-1] -> 755274 | CY70: =FIB(RC[-101])+RC[-1]+R[-1]C+R[-1]C[-1] -> 52869180 | CZ70: =FIB(RC[-101])+RC[-1]+R[-1]C+R[-1]C[-1] -> 2450360614 | DA70: =FIB(RC[-101])+RC[-1]+R[-1]C+R[-1]C[-1] -> 85189872040 | DB70: =FIB(RC[-101])+RC[-1]+R[-1]C+R[-1]C[-1] -> 2370238882258 | DC70: =FIB(RC[-101])+RC[-1]+R[-1]C+R[-1]C[-1] -> 54981525791556 | DD70: =FIB(RC[-101])+RC[-1]+R[-1]C+R[-1]C[-1] -> 1.09380764558216E+15 | DE70: =FIB(RC[-101])+RC[-1]+R[-1]C+R[-1]C[-1] -> 1.9053016677152E+16 | DF70: =FIB(RC[-101])+RC[-1]+R[-1]C+R[-1]C[-1] -> 2.95235531032171E+17 | DG70: =FIB(RC[-101])+RC[-1]+R[-1]C+R[-1]C[-1] -> 4.12092159635669E+18 | DH70: =FIB(RC[-101])+RC[-1]+R[-1]C+R[-1]C[-1] -> 5.23418597458094E+19 | DI70: =FIB(RC[-101])+RC[-1]+R[-1]C+R[-1]C[-1] -> 6.10070720185619E+20 | DJ70: =FIB(RC[-101])+RC[-1]+R[-1]C+R[-1]C[-1] -> 6.57137941713467E+21 | DK70: =FIB(RC[-101])+RC[-1]+R[-1]C+R[-1]C[-1] -> 6.58109041674381E+22 | DL70: =FIB(RC[-101])+RC[-1]+R[-1]C+R[-1]C[-1] -> 6.15980999407585E+23 | DM70: =FIB(RC[-101])+RC[-1]+R[-1]C+R[-1]C[-1] -> 5.41303265501037E+24 | DN70: =FIB(RC[-101])+RC[-1]+R[-1]C+R[-1]C[-1] -> 4.48392491198213E+25 | DO70: =FIB(RC[-101])+RC[-1]+R[-1]C+R[-1]C[-1] -> 3.51370954599463E+26 | DP70: =FIB(RC[-101])+RC[-1]+R[-1]C+R[-1]C[-1] -> 2.61303521965696E+27 | DQ70: =FIB(RC[-101])+RC[-1]+R[-1]C+R[-1]C[-1] -> 1.84943971834853E+28 | DR70: =FIB(RC[-101])+RC[-1]+R[-1]C+R[-1]C[-1] -> 1.24903900614171E+29 | DS70: =FIB(RC[-101])+RC[-1]+R[-1]C+R[-1]C[-1] -> 8.06819296646501E+29 | DT70: =FIB(RC[-101])+RC[-1]+R[-1]C+R[-1]C[-1] -> 4.99546817597285E+30 | DU70: =FIB(RC[-101])+RC[-1]+R[-1]C+R[-1]C[-1] -> 2.9705288345129E+31 | DV70: =FIB(RC[-101])+RC[-1]+R[-1]C+R[-1]C[-1] -> 1.69957052647851E+32 | DW70: =FIB(RC[-101])+RC[-1]+R[-1]C+R[-1]C[-1] -> 9.37179327949212E+32 | DX70: =FIB(RC[-101])+RC[-1]+R[-1]C+R[-1]C[-1] -> 4.98840036865869E+33 | DY70: =FIB(RC[-101])+RC[-1]+R[-1]C+R[-1]C[-1] -> 2.56675533249352E+34 | DZ70: =FIB(RC[-101])+RC[-1]+R[-1]C+R[-1]C[-1] -> 1.27843624913394E+35 | EA70: =FIB(RC[-101])+RC[-1]+R[-1]C+R[-1]C[-1] -> 6.17154096979498E+35 | EB70: =FIB(RC[-101])+RC[-1]+R[-1]C+R[-1]C[-1] -> 2.89095897508233E+36 | EC70: =FIB(RC[-101])+RC[-1]+R[-1]C+R[-1]C[-1] -> 1.31554710794627E+37 | ED70: =FIB(RC[-101])+RC[-1]+R[-1]C+R[-1]C[-1] -> 5.82157929469077E+37 | EE70: =FIB(RC[-101])+RC[-1]+R[-1]C+R[-1]C[-1] -> 2.50768404860072E+38 | EF70: =FIB(RC[-101])+RC[-1]+R[-1]C+R[-1]C[-1] -> 1.05246129244985E+39 | EG70: =FIB(RC[-101])+RC[-1]+R[-1]C+R[-1]C[-1] -> 4.30747260612867E+39 | EH70: =FIB(RC[-101])+RC[-1]+R[-1]C+R[-1]C[-1] -> 1.72061432102724E+40 | EI70: =FIB(RC[-101])+RC[-1]+R[-1]C+R[-1]C[-1] -> 6.71323787540692E+40 | EJ70: =FIB(RC[-101])+RC[-1]+R[-1]C+R[-1]C[-1] -> 2.56031643302717E+41 | EK70: =FIB(RC[-101])+RC[-1]+R[-1]C+R[-1]C[-1] -> 9.55164029762159E+41 | EL70: =FIB(RC[-101])+RC[-1]+R[-1]C+R[-1]C[-1] -> 3.48802599680607E+42 | EM70: =FIB(RC[-101])+RC[-1]+R[-1]C+R[-1]C[-1] -> 1.24761271137212E+43 | EN70: =FIB(RC[-101])+RC[-1]+R[-1]C+R[-1]C[-1] -> 4.37367153644909E+43 | EO70: =FIB(RC[-101])+RC[-1]+R[-1]C+R[-1]C[-1] -> 1.50360838671687E+44 | EP70: =FIB(RC[-101])+RC[-1]+R[-1]C+R[-1]C[-1] -> 5.07212712253381E+44 | EQ70: =FIB(RC[-101])+RC[-1]+R[-1]C+R[-1]C[-1] -> 1.67975662485752E+45 | ER70: =FIB(RC[-101])+RC[-1]+R[-1]C+R[-1]C[-1] -> 5.46421182167768E+45 | ES70: =FIB(RC[-101])+RC[-1]+R[-1]C+R[-1]C[-1] -> 1.74682084287813E+46 | ET70: =FIB(RC[-101])+RC[-1]+R[-1]C+R[-1]C[-1] -> 5.49053701845127E+46 | EU70: =FIB(RC[-101])+RC[-1]+R[-1]C+R[-1]C[-1] -> 1.69755773373151E+47 | EV70: =FIB(RC[-101])+RC[-1]+R[-1]C+R[-1]C[-1] -> 5.16496490354777E+47 | EW70: =FIB(RC[-101])+RC[-1]+R[-1]C+R[-1]C[-1] -> 1.5471260884874E+48 | EX70: =FIB(RC[-101])+RC[-1]+R[-1]C+R[-1]C[-1] -> 4.56430837355088E+48 | EY70: =FIB(RC[-101])+RC[-1]+R[-1]C+R[-1]C[-1] -> 1.32673434558038E+49 | EZ70: =FIB(RC[-101])+RC[-1]+R[-1]C+R[-1]C[-1] -> 3.80115162277904E+49 | FA70: =FIB(RC[-101])+RC[-1]+R[-1]C+R[-1]C[-1] -> 1.07380440102359E+50 | FB70: =FIB(RC[-101])+RC[-1]+R[-1]C+R[-1]C[-1] -> 2.99202211982177E+50 | FC70: =FIB(RC[-101])+RC[-1]+R[-1]C+R[-1]C[-1] -> 8.22582630195811E+50 | FD70: =FIB(RC[-101])+RC[-1]+R[-1]C+R[-1]C[-1] -> 2.2320798964777E+51 | FE70: =FIB(RC[-101])+RC[-1]+R[-1]C+R[-1]C[-1] -> 5.97985801319921E+51 | FF70: =FIB(RC[-101])+RC[-1]+R[-1]C+R[-1]C[-1] -> 1.58217222561205E+52 | FG70: =FIB(RC[-101])+RC[-1]+R[-1]C+R[-1]C[-1] -> 4.13546892323533E+52 | FH70: =FIB(RC[-101])+RC[-1]+R[-1]C+R[-1]C[-1] -> 1.06813469574231E+53 | FI70: =FIB(RC[-101])+RC[-1]+R[-1]C+R[-1]C[-1] -> 2.72694026444632E+53 | FJ70: =FIB(RC[-101])+RC[-1]+R[-1]C+R[-1]C[-1] -> 6.88315872746994E+53 | FK70: =FIB(RC[-101])+RC[-1]+R[-1]C+R[-1]C[-1] -> 1.7181972428899E+54 | FL70: =FIB(RC[-101])+RC[-1]+R[-1]C+R[-1]C[-1] -> 4.24266066213429E+54 | FM70: =FIB(RC[-101])+RC[-1]+R[-1]C+R[-1]C[-1] -> 1.03654271663278E+55 | FN70: =FIB(RC[-101])+RC[-1]+R[-1]C+R[-1]C[-1] -> 2.50622507412274E+55 | FO70: =FIB(RC[-101])+RC[-1]+R[-1]C+R[-1]C[-1] -> 5.9983818964389E+55 | FP70: =FIB(RC[-101])+RC[-1]+R[-1]C+R[-1]C[-1] -> 1.4214237166107E+56 | FQ70: =FIB(RC[-101])+RC[-1]+R[-1]C+R[-1]C[-1] -> 3.33564455657783E+56 | FR70: =FIB(RC[-101])+RC[-1]+R[-1]C+R[-1]C[-1] -> 7.7533849446615E+56 | FS70: =FIB(RC[-101])+RC[-1]+R[-1]C+R[-1]C[-1] -> 1.78543589180828E+57 | FT70: =FIB(RC[-101])+RC[-1]+R[-1]C+R[-1]C[-1] -> 4.07400850069129E+57 | FU70: =FIB(RC[-101])+RC[-1]+R[-1]C+R[-1]C[-1] -> 9.21309044054882E+57 | FV70: =FIB(RC[-101])+RC[-1]+R[-1]C+R[-1]C[-1] -> 2.06525223024523E+58 | FW70: =FIB(RC[-101])+RC[-1]+R[-1]C+R[-1]C[-1] -> 4.5898827743117E+58 | FX70: =FIB(RC[-101])+RC[-1]+R[-1]C+R[-1]C[-1] -> 1.01149794884614E+59 | FY70: =FIB(RC[-101])+RC[-1]+R[-1]C+R[-1]C[-1] -> 2.21072861008345E+59 | FZ70: =FIB(RC[-101])+RC[-1]+R[-1]C+R[-1]C[-1] -> 4.79272978653447E+59 | GA70: =FIB(RC[-101])+RC[-1]+R[-1]C+R[-1]C[-1] -> 1.03080299725006E+60 | GB70: =FIB(RC[-101])+RC[-1]+R[-1]C+R[-1]C[-1] -> 2.19978314298001E+60 | GC70: =FIB(RC[-101])+RC[-1]+R[-1]C+R[-1]C[-1] -> 4.65864887673782E+60 | GD70: =FIB(RC[-101])+RC[-1]+R[-1]C+R[-1]C[-1] -> 9.79216444561034E+60 | GE70: =FIB(RC[-101])+RC[-1]+R[-1]C+R[-1]C[-1] -> 2.04313489821227E+61 | GF70: =FIB(RC[-101])+RC[-1]+R[-1]C+R[-1]C[-1] -> 4.23228005843396E+61 | GG70: =FIB(RC[-101])+RC[-1]+R[-1]C+R[-1]C[-1] -> 8.70499618484986E+61 | GH70: =FIB(RC[-101])+RC[-1]+R[-1]C+R[-1]C[-1] -> 1.77801698296216E+62 | GI70: =FIB(RC[-101])+RC[-1]+R[-1]C+R[-1]C[-1] -> 3.60687585196559E+62 | GJ70: =FIB(RC[-101])+RC[-1]+R[-1]C+R[-1]C[-1] -> 7.26788210867925E+62 | GK70: =FIB(RC[-101])+RC[-1]+R[-1]C+R[-1]C[-1] -> 1.45484925612531E+63 | GL70: =FIB(RC[-101])+RC[-1]+R[-1]C+R[-1]C[-1] -> 2.89342539786309E+63 | GM70: =FIB(RC[-101])+RC[-1]+R[-1]C+R[-1]C[-1] -> 5.7179479906662E+63 | GN70: =FIB(RC[-101])+RC[-1]+R[-1]C+R[-1]C[-1] -> 1.12292290326498E+64 | GO70: =FIB(RC[-101])+RC[-1]+R[-1]C+R[-1]C[-1] -> 2.1917373902621E+64 | GP70: =FIB(RC[-101])+RC[-1]+R[-1]C+R[-1]C[-1] -> 4.25208346350381E+64 | GQ70: =FIB(RC[-101])+RC[-1]+R[-1]C+R[-1]C[-1] -> 8.20038906410666E+64 | GR70: =FIB(RC[-101])+RC[-1]+R[-1]C+R[-1]C[-1] -> 1.57228107003454E+65 | GS70: =FIB(RC[-101])+RC[-1]+R[-1]C+R[-1]C[-1] -> 2.99730920469458E+65
A71: 20 | B71: 20 | C71: 20 | D71: 20 | E71: 20 | F71: 20 | G71: 20 | H71: 20 | I71: 20 | J71: 20 | K71: 20 | L71: 20 | M71: 20 | N71: 20 | O71: 20 | P71: 20 | Q71: 20 | R71: 20 | S71: 20 | T71: 20 | U71: 20 | V71: 20 | W71: 20 | X71: 20 | Y71: 20 | Z71: 20 | AA71: 20 | AB71: 20 | AC71: 20 | AD71: 20 | AE71: 20 | AF71: 20 | AG71: 20 | AH71: 20 | AI71: 20 | AJ71: 20 | AK71: 20 | AL71: 20 | AM71: 20 | AN71: 20 | AO71: 20 | AP71: 20 | AQ71: 20 | AR71: 20 | AS71: 20 | AT71: 20 | AU71: 20 | AV71: 20 | AW71: 20 | AX71: 20 | AY71: 20 | AZ71: 20 | BA71: 20 | BB71: 20 | BC71: 20 | BD71: 20 | BE71: 20 | BF71: 20 | BG71: 20 | BH71: 20 | BI71: 20 | BJ71: 20 | BK71: 20 | BL71: 20 | BM71: 20 | BN71: 20 | BO71: 20 | BP71: 20 | BQ71: 20 | BR71: 20 | BS71: 20 | BT71: 20 | BU71: 20 | BV71: 20 | BW71: 20 | BX71: 20 | BY71: 20 | BZ71: 20 | CA71: 20 | CB71: 20 | CC71: 20 | CD71: 20 | CE71: 20 | CF71: 20 | CG71: 20 | CH71: 20 | CI71: 20 | CJ71: 20 | CK71: 20 | CL71: 20 | CM71: 20 | CN71: 20 | CO71: 20 | CP71: 20 | CQ71: 20 | CR71: 20 | CS71: 20 | CT71: 20 | CU71: 20 | CV71: 20 | CW71: 0 | CX71: =FIB(RC[-101])+RC[-1]+R[-1]C+R[-1]C[-1] -> 766220 | CY71: =FIB(RC[-101])+RC[-1]+R[-1]C+R[-1]C[-1] -> 54401620 | CZ71: =FIB(RC[-101])+RC[-1]+R[-1]C+R[-1]C[-1] -> 2557642360 | DA71: =FIB(RC[-101])+RC[-1]+R[-1]C+R[-1]C[-1] -> 90197885960 | DB71: =FIB(RC[-101])+RC[-1]+R[-1]C+R[-1]C[-1] -> 2545626651204 | DC71: =FIB(RC[-101])+RC[-1]+R[-1]C+R[-1]C[-1] -> 59897391335964 | DD71: =FIB(RC[-101])+RC[-1]+R[-1]C+R[-1]C[-1] -> 1.20868656272062E+15 | DE71: =FIB(RC[-101])+RC[-1]+R[-1]C+R[-1]C[-1] -> 2.13555108854657E+16 | DF71: =FIB(RC[-101])+RC[-1]+R[-1]C+R[-1]C[-1] -> 3.356440585948E+17 | DG71: =FIB(RC[-101])+RC[-1]+R[-1]C+R[-1]C[-1] -> 4.75180118598368E+18 | DH71: =FIB(RC[-101])+RC[-1]+R[-1]C+R[-1]C[-1] -> 6.12145825281498E+19 | DI71: =FIB(RC[-101])+RC[-1]+R[-1]C+R[-1]C[-1] -> 7.23627162459578E+20 | DJ71: =FIB(RC[-101])+RC[-1]+R[-1]C+R[-1]C[-1] -> 7.90507729977987E+21 | DK71: =FIB(RC[-101])+RC[-1]+R[-1]C+R[-1]C[-1] -> 8.02873608843526E+22 | DL71: =FIB(RC[-101])+RC[-1]+R[-1]C+R[-1]C[-1] -> 7.62079264459376E+23 | DM71: =FIB(RC[-101])+RC[-1]+R[-1]C+R[-1]C[-1] -> 6.79109291887733E+24 | DN71: =FIB(RC[-101])+RC[-1]+R[-1]C+R[-1]C[-1] -> 5.7043374693709E+25 | DO71: =FIB(RC[-101])+RC[-1]+R[-1]C+R[-1]C[-1] -> 4.53253578412993E+26 | DP71: =FIB(RC[-101])+RC[-1]+R[-1]C+R[-1]C[-1] -> 3.41765975266941E+27 | DQ71: =FIB(RC[-101])+RC[-1]+R[-1]C+R[-1]C[-1] -> 2.45250921558117E+28 | DR71: =FIB(RC[-101])+RC[-1]+R[-1]C+R[-1]C[-1] -> 1.67923389953469E+29 | DS71: =FIB(RC[-101])+RC[-1]+R[-1]C+R[-1]C[-1] -> 1.09964658721414E+30 | DT71: =FIB(RC[-101])+RC[-1]+R[-1]C+R[-1]C[-1] -> 6.90193405983349E+30 | DU71: =FIB(RC[-101])+RC[-1]+R[-1]C+R[-1]C[-1] -> 4.16026905809353E+31 | DV71: =FIB(RC[-101])+RC[-1]+R[-1]C+R[-1]C[-1] -> 2.41265031573915E+32 | DW71: =FIB(RC[-101])+RC[-1]+R[-1]C+R[-1]C[-1] -> 1.34840141217098E+33 | DX71: =FIB(RC[-101])+RC[-1]+R[-1]C+R[-1]C[-1] -> 7.27398110877888E+33 | DY71: =FIB(RC[-101])+RC[-1]+R[-1]C+R[-1]C[-1] -> 3.79299348023728E+34 | DZ71: =FIB(RC[-101])+RC[-1]+R[-1]C+R[-1]C[-1] -> 1.91441113040703E+35 | EA71: =FIB(RC[-101])+RC[-1]+R[-1]C+R[-1]C[-1] -> 9.36438834933595E+35 | EB71: =FIB(RC[-101])+RC[-1]+R[-1]C+R[-1]C[-1] -> 4.44455190699542E+36 | EC71: =FIB(RC[-101])+RC[-1]+R[-1]C+R[-1]C[-1] -> 2.04909819615405E+37 | ED71: =FIB(RC[-101])+RC[-1]+R[-1]C+R[-1]C[-1] -> 9.1862245987911E+37 | EE71: =FIB(RC[-101])+RC[-1]+R[-1]C+R[-1]C[-1] -> 4.00846443794891E+38 | EF71: =FIB(RC[-101])+RC[-1]+R[-1]C+R[-1]C[-1] -> 1.70407614110482E+39 | EG71: =FIB(RC[-101])+RC[-1]+R[-1]C+R[-1]C[-1] -> 7.06401003968334E+39 | EH71: =FIB(RC[-101])+RC[-1]+R[-1]C+R[-1]C[-1] -> 2.85776258560844E+40 | EI71: =FIB(RC[-101])+RC[-1]+R[-1]C+R[-1]C[-1] -> 1.12916147820426E+41 | EJ71: =FIB(RC[-101])+RC[-1]+R[-1]C+R[-1]C[-1] -> 4.36080169877212E+41 | EK71: =FIB(RC[-101])+RC[-1]+R[-1]C+R[-1]C[-1] -> 1.64727584294209E+42 | EL71: =FIB(RC[-101])+RC[-1]+R[-1]C+R[-1]C[-1] -> 6.09046586951032E+42 | EM71: =FIB(RC[-101])+RC[-1]+R[-1]C+R[-1]C[-1] -> 2.20546189800376E+43 | EN71: =FIB(RC[-101])+RC[-1]+R[-1]C+R[-1]C[-1] -> 7.82674614582497E+43 | EO71: =FIB(RC[-101])+RC[-1]+R[-1]C+R[-1]C[-1] -> 2.72365015494428E+44 | EP71: =FIB(RC[-101])+RC[-1]+R[-1]C+R[-1]C[-1] -> 9.29938566419496E+44 | EQ71: =FIB(RC[-101])+RC[-1]+R[-1]C+R[-1]C[-1] -> 3.1169079035304E+45 | ER71: =FIB(RC[-101])+RC[-1]+R[-1]C+R[-1]C[-1] -> 1.02608763500656E+46 | ES71: =FIB(RC[-101])+RC[-1]+R[-1]C+R[-1]C[-1] -> 3.31932966005245E+46 | ET71: =FIB(RC[-101])+RC[-1]+R[-1]C+R[-1]C[-1] -> 1.05566875213819E+47 | EU71: =FIB(RC[-101])+RC[-1]+R[-1]C+R[-1]C[-1] -> 3.30228018771482E+47 | EV71: =FIB(RC[-101])+RC[-1]+R[-1]C+R[-1]C[-1] -> 1.01648028249941E+48 | EW71: =FIB(RC[-101])+RC[-1]+R[-1]C+R[-1]C[-1] -> 3.08010286134158E+48 | EX71: =FIB(RC[-101])+RC[-1]+R[-1]C+R[-1]C[-1] -> 9.19153732337986E+48 | EY71: =FIB(RC[-101])+RC[-1]+R[-1]C+R[-1]C[-1] -> 2.70231891527345E+49 | EZ71: =FIB(RC[-101])+RC[-1]+R[-1]C+R[-1]C[-1] -> 7.83020488363288E+49 | FA71: =FIB(RC[-101])+RC[-1]+R[-1]C+R[-1]C[-1] -> 2.23694005166478E+50 | FB71: =FIB(RC[-101])+RC[-1]+R[-1]C+R[-1]C[-1] -> 6.30276657251013E+50 | FC71: =FIB(RC[-101])+RC[-1]+R[-1]C+R[-1]C[-1] -> 1.752061499429E+51 | FD71: =FIB(RC[-101])+RC[-1]+R[-1]C+R[-1]C[-1] -> 4.80672402610251E+51 | FE71: =FIB(RC[-101])+RC[-1]+R[-1]C+R[-1]C[-1] -> 1.30186619357794E+52 | FF71: =FIB(RC[-101])+RC[-1]+R[-1]C+R[-1]C[-1] -> 3.48202422050991E+52 | FG71: =FIB(RC[-101])+RC[-1]+R[-1]C+R[-1]C[-1] -> 9.1996653693573E+52 | FH71: =FIB(RC[-101])+RC[-1]+R[-1]C+R[-1]C[-1] -> 2.40164812500158E+53 | FI71: =FIB(RC[-101])+RC[-1]+R[-1]C+R[-1]C[-1] -> 6.19672308519021E+53 | FJ71: =FIB(RC[-101])+RC[-1]+R[-1]C+R[-1]C[-1] -> 1.58068220771065E+54 | FK71: =FIB(RC[-101])+RC[-1]+R[-1]C+R[-1]C[-1] -> 3.98719532334754E+54 | FL71: =FIB(RC[-101])+RC[-1]+R[-1]C+R[-1]C[-1] -> 9.94805322837172E+54 | FM71: =FIB(RC[-101])+RC[-1]+R[-1]C+R[-1]C[-1] -> 2.45561410568338E+55 | FN71: =FIB(RC[-101])+RC[-1]+R[-1]C+R[-1]C[-1] -> 5.9983818964389E+55 | FO71: =FIB(RC[-101])+RC[-1]+R[-1]C+R[-1]C[-1] -> 1.45029888670006E+56 | FP71: =FIB(RC[-101])+RC[-1]+R[-1]C+R[-1]C[-1] -> 3.47156079295465E+56 | FQ71: =FIB(RC[-101])+RC[-1]+R[-1]C+R[-1]C[-1] -> 8.22862906614319E+56 | FR71: =FIB(RC[-101])+RC[-1]+R[-1]C+R[-1]C[-1] -> 1.93176585673825E+57 | FS71: =FIB(RC[-101])+RC[-1]+R[-1]C+R[-1]C[-1] -> 4.49254024301269E+57 | FT71: =FIB(RC[-101])+RC[-1]+R[-1]C+R[-1]C[-1] -> 1.03519846355123E+58 | FU71: =FIB(RC[-101])+RC[-1]+R[-1]C+R[-1]C[-1] -> 2.36390835767524E+58 | FV71: =FIB(RC[-101])+RC[-1]+R[-1]C+R[-1]C[-1] -> 5.35046963197535E+58 | FW71: =FIB(RC[-101])+RC[-1]+R[-1]C+R[-1]C[-1] -> 1.20056046365323E+59 | FX71: =FIB(RC[-101])+RC[-1]+R[-1]C+R[-1]C[-1] -> 2.67104668993054E+59 | FY71: =FIB(RC[-101])+RC[-1]+R[-1]C+R[-1]C[-1] -> 5.89327324886014E+59 | FZ71: =FIB(RC[-101])+RC[-1]+R[-1]C+R[-1]C[-1] -> 1.28967316454781E+60 | GA71: =FIB(RC[-101])+RC[-1]+R[-1]C+R[-1]C[-1] -> 2.79974914045131E+60 | GB71: =FIB(RC[-101])+RC[-1]+R[-1]C+R[-1]C[-1] -> 6.03033528068139E+60 | GC71: =FIB(RC[-101])+RC[-1]+R[-1]C+R[-1]C[-1] -> 1.28887673003992E+61 | GD71: =FIB(RC[-101])+RC[-1]+R[-1]C+R[-1]C[-1] -> 2.73395806227474E+61 | GE71: =FIB(RC[-101])+RC[-1]+R[-1]C+R[-1]C[-1] -> 5.75630940504804E+61 | GF71: =FIB(RC[-101])+RC[-1]+R[-1]C+R[-1]C[-1] -> 1.20317243616943E+62 | GG71: =FIB(RC[-101])+RC[-1]+R[-1]C+R[-1]C[-1] -> 2.49690006049781E+62 | GH71: =FIB(RC[-101])+RC[-1]+R[-1]C+R[-1]C[-1] -> 5.14541666194495E+62 | GI71: =FIB(RC[-101])+RC[-1]+R[-1]C+R[-1]C[-1] -> 1.05303094968727E+63 | GJ71: =FIB(RC[-101])+RC[-1]+R[-1]C+R[-1]C[-1] -> 2.14050674575175E+63 | GK71: =FIB(RC[-101])+RC[-1]+R[-1]C+R[-1]C[-1] -> 4.32214421274499E+63 | GL71: =FIB(RC[-101])+RC[-1]+R[-1]C+R[-1]C[-1] -> 8.67041886673338E+63 | GM71: =FIB(RC[-101])+RC[-1]+R[-1]C+R[-1]C[-1] -> 1.72817922552627E+64 | GN71: =FIB(RC[-101])+RC[-1]+R[-1]C+R[-1]C[-1] -> 3.42289692785787E+64 | GO71: =FIB(RC[-101])+RC[-1]+R[-1]C+R[-1]C[-1] -> 6.73755722138495E+64 | GP71: =FIB(RC[-101])+RC[-1]+R[-1]C+R[-1]C[-1] -> 1.31813780751509E+65 | GQ71: =FIB(RC[-101])+RC[-1]+R[-1]C+R[-1]C[-1] -> 2.56338506027613E+65 | GR71: =FIB(RC[-101])+RC[-1]+R[-1]C+R[-1]C[-1] -> 4.95570503672134E+65 | GS71: =FIB(RC[-101])+RC[-1]+R[-1]C+R[-1]C[-1] -> 9.52529531145046E+65
A72: 20 | B72: 20 | C72: 20 | D72: 20 | E72: 20 | F72: 20 | G72: 20 | H72: 20 | I72: 20 | J72: 20 | K72: 20 | L72: 20 | M72: 20 | N72: 20 | O72: 20 | P72: 20 | Q72: 20 | R72: 20 | S72: 20 | T72: 20 | U72: 20 | V72: 20 | W72: 20 | X72: 20 | Y72: 20 | Z72: 20 | AA72: 20 | AB72: 20 | AC72: 20 | AD72: 20 | AE72: 20 | AF72: 20 | AG72: 20 | AH72: 20 | AI72: 20 | AJ72: 20 | AK72: 20 | AL72: 20 | AM72: 20 | AN72: 20 | AO72: 20 | AP72: 20 | AQ72: 20 | AR72: 20 | AS72: 20 | AT72: 20 | AU72: 20 | AV72: 20 | AW72: 20 | AX72: 20 | AY72: 20 | AZ72: 20 | BA72: 20 | BB72: 20 | BC72: 20 | BD72: 20 | BE72: 20 | BF72: 20 | BG72: 20 | BH72: 20 | BI72: 20 | BJ72: 20 | BK72: 20 | BL72: 20 | BM72: 20 | BN72: 20 | BO72: 20 | BP72: 20 | BQ72: 20 | BR72: 20 | BS72: 20 | BT72: 20 | BU72: 20 | BV72: 20 | BW72: 20 | BX72: 20 | BY72: 20 | BZ72: 20 | CA72: 20 | CB72: 20 | CC72: 20 | CD72: 20 | CE72: 20 | CF72: 20 | CG72: 20 | CH72: 20 | CI72: 20 | CJ72: 20 | CK72: 20 | CL72: 20 | CM72: 20 | CN72: 20 | CO72: 20 | CP72: 20 | CQ72: 20 | CR72: 20 | CS72: 20 | CT72: 20 | CU72: 20 | CV72: 20 | CW72: 0 | CX72: =FIB(RC[-101])+RC[-1]+R[-1]C+R[-1]C[-1] -> 777166 | CY72: =FIB(RC[-101])+RC[-1]+R[-1]C+R[-1]C[-1] -> 55955952 | CZ72: =FIB(RC[-101])+RC[-1]+R[-1]C+R[-1]C[-1] -> 2668010878 | DA72: =FIB(RC[-101])+RC[-1]+R[-1]C+R[-1]C[-1] -> 95423550144 | DB72: =FIB(RC[-101])+RC[-1]+R[-1]C+R[-1]C[-1] -> 2731248098254 | DC72: =FIB(RC[-101])+RC[-1]+R[-1]C+R[-1]C[-1] -> 65174266096368 | DD72: =FIB(RC[-101])+RC[-1]+R[-1]C+R[-1]C[-1] -> 1.3337582201639E+15 | DE72: =FIB(RC[-101])+RC[-1]+R[-1]C+R[-1]C[-1] -> 2.38979556683612E+16 | DF72: =FIB(RC[-101])+RC[-1]+R[-1]C+R[-1]C[-1] -> 3.80897525148638E+17 | DG72: =FIB(RC[-101])+RC[-1]+R[-1]C+R[-1]C[-1] -> 5.46834276972712E+18 | DH72: =FIB(RC[-101])+RC[-1]+R[-1]C+R[-1]C[-1] -> 7.14347264838606E+19 | DI72: =FIB(RC[-101])+RC[-1]+R[-1]C+R[-1]C[-1] -> 8.56276471471588E+20 | DJ72: =FIB(RC[-101])+RC[-1]+R[-1]C+R[-1]C[-1] -> 9.48498093371104E+21 | DK72: =FIB(RC[-101])+RC[-1]+R[-1]C+R[-1]C[-1] -> 9.76774191178435E+22 | DL72: =FIB(RC[-101])+RC[-1]+R[-1]C+R[-1]C[-1] -> 9.40044044461572E+23 | DM72: =FIB(RC[-101])+RC[-1]+R[-1]C+R[-1]C[-1] -> 8.49321622779828E+24 | DN72: =FIB(RC[-101])+RC[-1]+R[-1]C+R[-1]C[-1] -> 7.23276838403846E+25 | DO72: =FIB(RC[-101])+RC[-1]+R[-1]C+R[-1]C[-1] -> 5.82624636947087E+26 | DP72: =FIB(RC[-101])+RC[-1]+R[-1]C+R[-1]C[-1] -> 4.45353796802949E+27 | DQ72: =FIB(RC[-101])+RC[-1]+R[-1]C+R[-1]C[-1] -> 3.23962898765106E+28 | DR72: =FIB(RC[-101])+RC[-1]+R[-1]C+R[-1]C[-1] -> 2.24844771985791E+29 | DS72: =FIB(RC[-101])+RC[-1]+R[-1]C+R[-1]C[-1] -> 1.4924147491534E+30 | DT72: =FIB(RC[-101])+RC[-1]+R[-1]C+R[-1]C[-1] -> 9.49399539620103E+30 | DU72: =FIB(RC[-101])+RC[-1]+R[-1]C+R[-1]C[-1] -> 5.79986200369698E+31 | DV72: =FIB(RC[-101])+RC[-1]+R[-1]C+R[-1]C[-1] -> 3.4086634219182E+32 | DW72: =FIB(RC[-101])+RC[-1]+R[-1]C+R[-1]C[-1] -> 1.93053278593671E+33 | DX72: =FIB(RC[-101])+RC[-1]+R[-1]C+R[-1]C[-1] -> 1.05529153068866E+34 | DY72: =FIB(RC[-101])+RC[-1]+R[-1]C+R[-1]C[-1] -> 5.57568312180382E+34 | DZ72: =FIB(RC[-101])+RC[-1]+R[-1]C+R[-1]C[-1] -> 2.85127879061114E+35 | EA72: =FIB(RC[-101])+RC[-1]+R[-1]C+R[-1]C[-1] -> 1.41300782703541E+36 | EB72: =FIB(RC[-101])+RC[-1]+R[-1]C+R[-1]C[-1] -> 6.79399856896443E+36 | EC72: =FIB(RC[-101])+RC[-1]+R[-1]C+R[-1]C[-1] -> 3.17295324375003E+37 | ED72: =FIB(RC[-101])+RC[-1]+R[-1]C+R[-1]C[-1] -> 1.44082760386952E+38 | EE72: =FIB(RC[-101])+RC[-1]+R[-1]C+R[-1]C[-1] -> 6.36791450169754E+38 | EF72: =FIB(RC[-101])+RC[-1]+R[-1]C+R[-1]C[-1] -> 2.74171403506946E+39 | EG72: =FIB(RC[-101])+RC[-1]+R[-1]C+R[-1]C[-1] -> 1.15098002158576E+40 | EH72: =FIB(RC[-101])+RC[-1]+R[-1]C+R[-1]C[-1] -> 4.71514361116254E+40 | EI72: =FIB(RC[-101])+RC[-1]+R[-1]C+R[-1]C[-1] -> 1.88645209788136E+41 | EJ72: =FIB(RC[-101])+RC[-1]+R[-1]C+R[-1]C[-1] -> 7.37641527485774E+41 | EK72: =FIB(RC[-101])+RC[-1]+R[-1]C+R[-1]C[-1] -> 2.82099754030508E+42 | EL72: =FIB(RC[-101])+RC[-1]+R[-1]C+R[-1]C[-1] -> 1.05587392527575E+43 | EM72: =FIB(RC[-101])+RC[-1]+R[-1]C+R[-1]C[-1] -> 3.87038241023054E+43 | EN72: =FIB(RC[-101])+RC[-1]+R[-1]C+R[-1]C[-1] -> 1.39025904540593E+44 | EO72: =FIB(RC[-101])+RC[-1]+R[-1]C+R[-1]C[-1] -> 4.89658381493271E+44 | EP72: =FIB(RC[-101])+RC[-1]+R[-1]C+R[-1]C[-1] -> 1.6919619634072E+45 | EQ72: =FIB(RC[-101])+RC[-1]+R[-1]C+R[-1]C[-1] -> 5.73880843335709E+45 | ER72: =FIB(RC[-101])+RC[-1]+R[-1]C+R[-1]C[-1] -> 1.91165926869531E+46 | ES72: =FIB(RC[-101])+RC[-1]+R[-1]C+R[-1]C[-1] -> 6.25707656375432E+46 | ET72: =FIB(RC[-101])+RC[-1]+R[-1]C+R[-1]C[-1] -> 2.01330937451886E+47 | EU72: =FIB(RC[-101])+RC[-1]+R[-1]C+R[-1]C[-1] -> 6.37125831437187E+47 | EV72: =FIB(RC[-101])+RC[-1]+R[-1]C+R[-1]C[-1] -> 1.98383413270808E+48 | EW72: =FIB(RC[-101])+RC[-1]+R[-1]C+R[-1]C[-1] -> 6.08041727654907E+48 | EX72: =FIB(RC[-101])+RC[-1]+R[-1]C+R[-1]C[-1] -> 1.83520574612705E+49 | EY72: =FIB(RC[-101])+RC[-1]+R[-1]C+R[-1]C[-1] -> 5.45667839373849E+49 | EZ72: =FIB(RC[-101])+RC[-1]+R[-1]C+R[-1]C[-1] -> 1.59892021926448E+50 | FA72: =FIB(RC[-101])+RC[-1]+R[-1]C+R[-1]C[-1] -> 4.61888075929255E+50 | FB72: =FIB(RC[-101])+RC[-1]+R[-1]C+R[-1]C[-1] -> 1.31585873834675E+51 | FC72: =FIB(RC[-101])+RC[-1]+R[-1]C+R[-1]C[-1] -> 3.69819689502676E+51 | FD72: =FIB(RC[-101])+RC[-1]+R[-1]C+R[-1]C[-1] -> 1.02569824205583E+52 | FE72: =FIB(RC[-101])+RC[-1]+R[-1]C+R[-1]C[-1] -> 2.80823683824402E+52 | FF72: =FIB(RC[-101])+RC[-1]+R[-1]C+R[-1]C[-1] -> 7.59212725233188E+52 | FG72: =FIB(RC[-101])+RC[-1]+R[-1]C+R[-1]C[-1] -> 2.02738168421991E+53 | FH72: =FIB(RC[-101])+RC[-1]+R[-1]C+R[-1]C[-1] -> 5.34899634615722E+53 | FI72: =FIB(RC[-101])+RC[-1]+R[-1]C+R[-1]C[-1] -> 1.3947367556349E+54 | FJ72: =FIB(RC[-101])+RC[-1]+R[-1]C+R[-1]C[-1] -> 3.59509127186457E+54 | FK72: =FIB(RC[-101])+RC[-1]+R[-1]C+R[-1]C[-1] -> 9.16296880292275E+54 | FL72: =FIB(RC[-101])+RC[-1]+R[-1]C+R[-1]C[-1] -> 2.3098217354642E+55 | FM72: =FIB(RC[-101])+RC[-1]+R[-1]C+R[-1]C[-1] -> 5.76024116398475E+55 | FN72: =FIB(RC[-101])+RC[-1]+R[-1]C+R[-1]C[-1] -> 1.4214237166107E+56 | FO72: =FIB(RC[-101])+RC[-1]+R[-1]C+R[-1]C[-1] -> 3.47156079295465E+56 | FP72: =FIB(RC[-101])+RC[-1]+R[-1]C+R[-1]C[-1] -> 8.39342047260935E+56 | FQ72: =FIB(RC[-101])+RC[-1]+R[-1]C+R[-1]C[-1] -> 2.00936103317072E+57 | FR72: =FIB(RC[-101])+RC[-1]+R[-1]C+R[-1]C[-1] -> 4.76398979652329E+57 | FS72: =FIB(RC[-101])+RC[-1]+R[-1]C+R[-1]C[-1] -> 1.11882958962742E+58 | FT72: =FIB(RC[-101])+RC[-1]+R[-1]C+R[-1]C[-1] -> 2.60328207747992E+58 | FU72: =FIB(RC[-101])+RC[-1]+R[-1]C+R[-1]C[-1] -> 6.00238889870638E+58 | FV72: =FIB(RC[-101])+RC[-1]+R[-1]C+R[-1]C[-1] -> 1.3716766888357E+59 | FW72: =FIB(RC[-101])+RC[-1]+R[-1]C+R[-1]C[-1] -> 3.10728411568646E+59 | FX72: =FIB(RC[-101])+RC[-1]+R[-1]C+R[-1]C[-1] -> 6.97889126927022E+59 | FY72: =FIB(RC[-101])+RC[-1]+R[-1]C+R[-1]C[-1] -> 1.55432112080609E+60 | FZ72: =FIB(RC[-101])+RC[-1]+R[-1]C+R[-1]C[-1] -> 3.43332161023991E+60 | GA72: =FIB(RC[-101])+RC[-1]+R[-1]C+R[-1]C[-1] -> 7.52274391523903E+60 | GB72: =FIB(RC[-101])+RC[-1]+R[-1]C+R[-1]C[-1] -> 1.63528283363717E+61 | GC72: =FIB(RC[-101])+RC[-1]+R[-1]C+R[-1]C[-1] -> 3.52719309174524E+61 | GD72: =FIB(RC[-101])+RC[-1]+R[-1]C+R[-1]C[-1] -> 7.5500278840599E+61 | GE72: =FIB(RC[-101])+RC[-1]+R[-1]C+R[-1]C[-1] -> 1.60402953513827E+62 | GF72: =FIB(RC[-101])+RC[-1]+R[-1]C+R[-1]C[-1] -> 3.3828329118125E+62 | GG72: =FIB(RC[-101])+RC[-1]+R[-1]C+R[-1]C[-1] -> 7.08290540847974E+62 | GH72: =FIB(RC[-101])+RC[-1]+R[-1]C+R[-1]C[-1] -> 1.47252221309225E+63 | GI72: =FIB(RC[-101])+RC[-1]+R[-1]C+R[-1]C[-1] -> 3.04009482897401E+63 | GJ72: =FIB(RC[-101])+RC[-1]+R[-1]C+R[-1]C[-1] -> 6.23363252441304E+63 | GK72: =FIB(RC[-101])+RC[-1]+R[-1]C+R[-1]C[-1] -> 1.26962834829098E+64 | GL72: =FIB(RC[-101])+RC[-1]+R[-1]C+R[-1]C[-1] -> 2.56888465623882E+64 | GM72: =FIB(RC[-101])+RC[-1]+R[-1]C+R[-1]C[-1] -> 5.16410576843842E+64 | GN72: =FIB(RC[-101])+RC[-1]+R[-1]C+R[-1]C[-1] -> 1.03151819218226E+65 | GO72: =FIB(RC[-101])+RC[-1]+R[-1]C+R[-1]C[-1] -> 2.04756360710654E+65 | GP72: =FIB(RC[-101])+RC[-1]+R[-1]C+R[-1]C[-1] -> 4.03945713676012E+65 | GQ72: =FIB(RC[-101])+RC[-1]+R[-1]C+R[-1]C[-1] -> 7.92098000455133E+65 | GR72: =FIB(RC[-101])+RC[-1]+R[-1]C+R[-1]C[-1] -> 1.54400701015488E+66 | GS72: =FIB(RC[-101])+RC[-1]+R[-1]C+R[-1]C[-1] -> 2.99210704497206E+66
A73: 20 | B73: 20 | C73: 20 | D73: 20 | E73: 20 | F73: 20 | G73: 20 | H73: 20 | I73: 20 | J73: 20 | K73: 20 | L73: 20 | M73: 20 | N73: 20 | O73: 20 | P73: 20 | Q73: 20 | R73: 20 | S73: 20 | T73: 20 | U73: 20 | V73: 20 | W73: 20 | X73: 20 | Y73: 20 | Z73: 20 | AA73: 20 | AB73: 20 | AC73: 20 | AD73: 20 | AE73: 20 | AF73: 20 | AG73: 20 | AH73: 20 | AI73: 20 | AJ73: 20 | AK73: 20 | AL73: 20 | AM73: 20 | AN73: 20 | AO73: 20 | AP73: 20 | AQ73: 20 | AR73: 20 | AS73: 20 | AT73: 20 | AU73: 20 | AV73: 20 | AW73: 20 | AX73: 20 | AY73: 20 | AZ73: 20 | BA73: 20 | BB73: 20 | BC73: 20 | BD73: 20 | BE73: 20 | BF73: 20 | BG73: 20 | BH73: 20 | BI73: 20 | BJ73: 20 | BK73: 20 | BL73: 20 | BM73: 20 | BN73: 20 | BO73: 20 | BP73: 20 | BQ73: 20 | BR73: 20 | BS73: 20 | BT73: 20 | BU73: 20 | BV73: 20 | BW73: 20 | BX73: 20 | BY73: 20 | BZ73: 20 | CA73: 20 | CB73: 20 | CC73: 20 | CD73: 20 | CE73: 20 | CF73: 20 | CG73: 20 | CH73: 20 | CI73: 20 | CJ73: 20 | CK73: 20 | CL73: 20 | CM73: 20 | CN73: 20 | CO73: 20 | CP73: 20 | CQ73: 20 | CR73: 20 | CS73: 20 | CT73: 20 | CU73: 20 | CV73: 20 | CW73: 0 | CX73: =FIB(RC[-101])+RC[-1]+R[-1]C+R[-1]C[-1] -> 788112 | CY73: =FIB(RC[-101])+RC[-1]+R[-1]C+R[-1]C[-1] -> 57532176 | CZ73: =FIB(RC[-101])+RC[-1]+R[-1]C+R[-1]C[-1] -> 2781509952 | DA73: =FIB(RC[-101])+RC[-1]+R[-1]C+R[-1]C[-1] -> 100873081920 | DB73: =FIB(RC[-101])+RC[-1]+R[-1]C+R[-1]C[-1] -> 2927544741264 | DC73: =FIB(RC[-101])+RC[-1]+R[-1]C+R[-1]C[-1] -> 70833058946832 | DD73: =FIB(RC[-101])+RC[-1]+R[-1]C+R[-1]C[-1] -> 1.46976554521805E+15 | DE73: =FIB(RC[-101])+RC[-1]+R[-1]C+R[-1]C[-1] -> 2.67014794337541E+16 | DF73: =FIB(RC[-101])+RC[-1]+R[-1]C+R[-1]C[-1] -> 4.31496960250764E+17 | DG73: =FIB(RC[-101])+RC[-1]+R[-1]C+R[-1]C[-1] -> 6.28073725512654E+18 | DH73: =FIB(RC[-101])+RC[-1]+R[-1]C+R[-1]C[-1] -> 8.31838065087142E+19 | DI73: =FIB(RC[-101])+RC[-1]+R[-1]C+R[-1]C[-1] -> 1.01089500446416E+21 | DJ73: =FIB(RC[-101])+RC[-1]+R[-1]C+R[-1]C[-1] -> 1.13521524096468E+22 | DK73: =FIB(RC[-101])+RC[-1]+R[-1]C+R[-1]C[-1] -> 1.18514552461201E+23 | DL73: =FIB(RC[-101])+RC[-1]+R[-1]C+R[-1]C[-1] -> 1.15623601604062E+24 | DM73: =FIB(RC[-101])+RC[-1]+R[-1]C+R[-1]C[-1] -> 1.05894962883005E+25 | DN73: =FIB(RC[-101])+RC[-1]+R[-1]C+R[-1]C[-1] -> 9.14103963564833E+25 | DO73: =FIB(RC[-101])+RC[-1]+R[-1]C+R[-1]C[-1] -> 7.46362717143955E+26 | DP73: =FIB(RC[-101])+RC[-1]+R[-1]C+R[-1]C[-1] -> 5.78252532212054E+27 | DQ73: =FIB(RC[-101])+RC[-1]+R[-1]C+R[-1]C[-1] -> 4.26323531666606E+28 | DR73: =FIB(RC[-101])+RC[-1]+R[-1]C+R[-1]C[-1] -> 2.99873415028962E+29 | DS73: =FIB(RC[-101])+RC[-1]+R[-1]C+R[-1]C[-1] -> 2.01713293616815E+30 | DT73: =FIB(RC[-101])+RC[-1]+R[-1]C+R[-1]C[-1] -> 1.30035430815226E+31 | DU73: =FIB(RC[-101])+RC[-1]+R[-1]C+R[-1]C[-1] -> 8.04961585146934E+31 | DV73: =FIB(RC[-101])+RC[-1]+R[-1]C+R[-1]C[-1] -> 4.79361120743484E+32 | DW73: =FIB(RC[-101])+RC[-1]+R[-1]C+R[-1]C[-1] -> 2.75076024887202E+33 | DX73: =FIB(RC[-101])+RC[-1]+R[-1]C+R[-1]C[-1] -> 1.52342083416953E+34 | DY73: =FIB(RC[-101])+RC[-1]+R[-1]C+R[-1]C[-1] -> 8.15439548666201E+34 | DZ73: =FIB(RC[-101])+RC[-1]+R[-1]C+R[-1]C[-1] -> 4.22428665145772E+35 | EA73: =FIB(RC[-101])+RC[-1]+R[-1]C+R[-1]C[-1] -> 2.1205643712423E+36 | EB73: =FIB(RC[-101])+RC[-1]+R[-1]C+R[-1]C[-1] -> 1.03275707672421E+37 | EC73: =FIB(RC[-101])+RC[-1]+R[-1]C+R[-1]C[-1] -> 4.88511017737069E+37 | ED73: =FIB(RC[-101])+RC[-1]+R[-1]C+R[-1]C[-1] -> 2.24663394598159E+38 | EE73: =FIB(RC[-101])+RC[-1]+R[-1]C+R[-1]C[-1] -> 1.00553760515486E+39 | EF73: =FIB(RC[-101])+RC[-1]+R[-1]C+R[-1]C[-1] -> 4.38404309039408E+39 | EG73: =FIB(RC[-101])+RC[-1]+R[-1]C+R[-1]C[-1] -> 1.86355573413212E+40 | EH73: =FIB(RC[-101])+RC[-1]+R[-1]C+R[-1]C[-1] -> 7.72967936688042E+40 | EI73: =FIB(RC[-101])+RC[-1]+R[-1]C+R[-1]C[-1] -> 3.13093439568565E+41 | EJ73: =FIB(RC[-101])+RC[-1]+R[-1]C+R[-1]C[-1] -> 1.23938017684248E+42 | EK73: =FIB(RC[-101])+RC[-1]+R[-1]C+R[-1]C[-1] -> 4.79801924463333E+42 | EL73: =FIB(RC[-101])+RC[-1]+R[-1]C+R[-1]C[-1] -> 1.81777560376959E+43 | EM73: =FIB(RC[-101])+RC[-1]+R[-1]C+R[-1]C[-1] -> 6.74403193927588E+43 | EN73: =FIB(RC[-101])+RC[-1]+R[-1]C+R[-1]C[-1] -> 2.45170048035657E+44 | EO73: =FIB(RC[-101])+RC[-1]+R[-1]C+R[-1]C[-1] -> 8.7385433406952E+44 | EP73: =FIB(RC[-101])+RC[-1]+R[-1]C+R[-1]C[-1] -> 3.05547467896999E+45 | EQ73: =FIB(RC[-101])+RC[-1]+R[-1]C+R[-1]C[-1] -> 1.04862450757343E+46 | ER73: =FIB(RC[-101])+RC[-1]+R[-1]C+R[-1]C[-1] -> 3.53416461960444E+46 | ES73: =FIB(RC[-101])+RC[-1]+R[-1]C+R[-1]C[-1] -> 1.17029004520541E+47 | ET73: =FIB(RC[-101])+RC[-1]+R[-1]C+R[-1]C[-1] -> 3.8093070760997E+47 | EU73: =FIB(RC[-101])+RC[-1]+R[-1]C+R[-1]C[-1] -> 1.21938747649904E+48 | EV73: =FIB(RC[-101])+RC[-1]+R[-1]C+R[-1]C[-1] -> 3.84034744064431E+48 | EW73: =FIB(RC[-101])+RC[-1]+R[-1]C+R[-1]C[-1] -> 1.19045988499015E+49 | EX73: =FIB(RC[-101])+RC[-1]+R[-1]C+R[-1]C[-1] -> 3.63370735877211E+49 | EY73: =FIB(RC[-101])+RC[-1]+R[-1]C+R[-1]C[-1] -> 1.09255914986376E+50 | EZ73: =FIB(RC[-101])+RC[-1]+R[-1]C+R[-1]C[-1] -> 3.2371472085021E+50 | FA73: =FIB(RC[-101])+RC[-1]+R[-1]C+R[-1]C[-1] -> 9.45494818705912E+50 | FB73: =FIB(RC[-101])+RC[-1]+R[-1]C+R[-1]C[-1] -> 2.72324163298191E+51 | FC73: =FIB(RC[-101])+RC[-1]+R[-1]C+R[-1]C[-1] -> 7.73729726635542E+51 | FD73: =FIB(RC[-101])+RC[-1]+R[-1]C+R[-1]C[-1] -> 2.16924765819404E+52 | FE73: =FIB(RC[-101])+RC[-1]+R[-1]C+R[-1]C[-1] -> 6.00318273849389E+52 | FF73: =FIB(RC[-101])+RC[-1]+R[-1]C+R[-1]C[-1] -> 1.64035468290698E+53 | FG73: =FIB(RC[-101])+RC[-1]+R[-1]C+R[-1]C[-1] -> 4.42694909236008E+53 | FH73: =FIB(RC[-101])+RC[-1]+R[-1]C+R[-1]C[-1] -> 1.18033271227372E+54 | FI73: =FIB(RC[-101])+RC[-1]+R[-1]C+R[-1]C[-1] -> 3.10996910252434E+54 | FJ73: =FIB(RC[-101])+RC[-1]+R[-1]C+R[-1]C[-1] -> 8.09979713002381E+54 | FK73: =FIB(RC[-101])+RC[-1]+R[-1]C+R[-1]C[-1] -> 2.08578572048111E+55 | FL73: =FIB(RC[-101])+RC[-1]+R[-1]C+R[-1]C[-1] -> 5.31190433623759E+55 | FM73: =FIB(RC[-101])+RC[-1]+R[-1]C+R[-1]C[-1] -> 1.33819672356865E+56 | FN73: =FIB(RC[-101])+RC[-1]+R[-1]C+R[-1]C[-1] -> 3.33564455657783E+56 | FO73: =FIB(RC[-101])+RC[-1]+R[-1]C+R[-1]C[-1] -> 8.22862906614319E+56 | FP73: =FIB(RC[-101])+RC[-1]+R[-1]C+R[-1]C[-1] -> 2.00936103317072E+57 | FQ73: =FIB(RC[-101])+RC[-1]+R[-1]C+R[-1]C[-1] -> 4.85806411360237E+57 | FR73: =FIB(RC[-101])+RC[-1]+R[-1]C+R[-1]C[-1] -> 1.16314149432964E+58 | FS73: =FIB(RC[-101])+RC[-1]+R[-1]C+R[-1]C[-1] -> 2.75837006360939E+58 | FT73: =FIB(RC[-101])+RC[-1]+R[-1]C+R[-1]C[-1] -> 6.48048173071673E+58 | FU73: =FIB(RC[-101])+RC[-1]+R[-1]C+R[-1]C[-1] -> 1.5086152706903E+59 | FV73: =FIB(RC[-101])+RC[-1]+R[-1]C+R[-1]C[-1] -> 3.48053084939664E+59 | FW73: =FIB(RC[-101])+RC[-1]+R[-1]C+R[-1]C[-1] -> 7.95949165391879E+59 | FX73: =FIB(RC[-101])+RC[-1]+R[-1]C+R[-1]C[-1] -> 1.80456670388755E+60 | FY73: =FIB(RC[-101])+RC[-1]+R[-1]C+R[-1]C[-1] -> 4.05677695162066E+60 | FZ73: =FIB(RC[-101])+RC[-1]+R[-1]C+R[-1]C[-1] -> 9.04441968266666E+60 | GA73: =FIB(RC[-101])+RC[-1]+R[-1]C+R[-1]C[-1] -> 2.00004852081456E+61 | GB73: =FIB(RC[-101])+RC[-1]+R[-1]C+R[-1]C[-1] -> 4.38760574597564E+61 | GC73: =FIB(RC[-101])+RC[-1]+R[-1]C+R[-1]C[-1] -> 9.55008167135805E+61 | GD73: =FIB(RC[-101])+RC[-1]+R[-1]C+R[-1]C[-1] -> 2.06273026471632E+62 | GE73: =FIB(RC[-101])+RC[-1]+R[-1]C+R[-1]C[-1] -> 4.42176258826057E+62 | GF73: =FIB(RC[-101])+RC[-1]+R[-1]C+R[-1]C[-1] -> 9.40862503521134E+62 | GG73: =FIB(RC[-101])+RC[-1]+R[-1]C+R[-1]C[-1] -> 1.98743633555036E+63 | GH73: =FIB(RC[-101])+RC[-1]+R[-1]C+R[-1]C[-1] -> 4.16824908949058E+63 | GI73: =FIB(RC[-101])+RC[-1]+R[-1]C+R[-1]C[-1] -> 8.68086613155685E+63 | GJ73: =FIB(RC[-101])+RC[-1]+R[-1]C+R[-1]C[-1] -> 1.79545934849439E+64 | GK73: =FIB(RC[-101])+RC[-1]+R[-1]C+R[-1]C[-1] -> 3.68845094922667E+64 | GL73: =FIB(RC[-101])+RC[-1]+R[-1]C+R[-1]C[-1] -> 7.52696395375647E+64 | GM73: =FIB(RC[-101])+RC[-1]+R[-1]C+R[-1]C[-1] -> 1.52599543784337E+65 | GN73: =FIB(RC[-101])+RC[-1]+R[-1]C+R[-1]C[-1] -> 3.07392420686947E+65 | GO73: =FIB(RC[-101])+RC[-1]+R[-1]C+R[-1]C[-1] -> 6.15300600615826E+65 | GP73: =FIB(RC[-101])+RC[-1]+R[-1]C+R[-1]C[-1] -> 1.22400267500249E+66 | GQ73: =FIB(RC[-101])+RC[-1]+R[-1]C+R[-1]C[-1] -> 2.42004638913364E+66 | GR73: =FIB(RC[-101])+RC[-1]+R[-1]C+R[-1]C[-1] -> 4.75615139974365E+66 | GS73: =FIB(RC[-101])+RC[-1]+R[-1]C+R[-1]C[-1] -> 9.29226545487059E+66
A74: 20 | B74: 20 | C74: 20 | D74: 20 | E74: 20 | F74: 20 | G74: 20 | H74: 20 | I74: 20 | J74: 20 | K74: 20 | L74: 20 | M74: 20 | N74: 20 | O74: 20 | P74: 20 | Q74: 20 | R74: 20 | S74: 20 | T74: 20 | U74: 20 | V74: 20 | W74: 20 | X74: 20 | Y74: 20 | Z74: 20 | AA74: 20 | AB74: 20 | AC74: 20 | AD74: 20 | AE74: 20 | AF74: 20 | AG74: 20 | AH74: 20 | AI74: 20 | AJ74: 20 | AK74: 20 | AL74: 20 | AM74: 20 | AN74: 20 | AO74: 20 | AP74: 20 | AQ74: 20 | AR74: 20 | AS74: 20 | AT74: 20 | AU74: 20 | AV74: 20 | AW74: 20 | AX74: 20 | AY74: 20 | AZ74: 20 | BA74: 20 | BB74: 20 | BC74: 20 | BD74: 20 | BE74: 20 | BF74: 20 | BG74: 20 | BH74: 20 | BI74: 20 | BJ74: 20 | BK74: 20 | BL74: 20 | BM74: 20 | BN74: 20 | BO74: 20 | BP74: 20 | BQ74: 20 | BR74: 20 | BS74: 20 | BT74: 20 | BU74: 20 | BV74: 20 | BW74: 20 | BX74: 20 | BY74: 20 | BZ74: 20 | CA74: 20 | CB74: 20 | CC74: 20 | CD74: 20 | CE74: 20 | CF74: 20 | CG74: 20 | CH74: 20 | CI74: 20 | CJ74: 20 | CK74: 20 | CL74: 20 | CM74: 20 | CN74: 20 | CO74: 20 | CP74: 20 | CQ74: 20 | CR74: 20 | CS74: 20 | CT74: 20 | CU74: 20 | CV74: 20 | CW74: 0 | CX74: =FIB(RC[-101])+RC[-1]+R[-1]C+R[-1]C[-1] -> 799058 | CY74: =FIB(RC[-101])+RC[-1]+R[-1]C+R[-1]C[-1] -> 59130292 | CZ74: =FIB(RC[-101])+RC[-1]+R[-1]C+R[-1]C[-1] -> 2898183366 | DA74: =FIB(RC[-101])+RC[-1]+R[-1]C+R[-1]C[-1] -> 106552786184 | DB74: =FIB(RC[-101])+RC[-1]+R[-1]C+R[-1]C[-1] -> 3134970620314 | DC74: =FIB(RC[-101])+RC[-1]+R[-1]C+R[-1]C[-1] -> 76895574319356 | DD74: =FIB(RC[-101])+RC[-1]+R[-1]C+R[-1]C[-1] -> 1.61749417849518E+15 | DE74: =FIB(RC[-101])+RC[-1]+R[-1]C+R[-1]C[-1] -> 2.97887391574783E+16 | DF74: =FIB(RC[-101])+RC[-1]+R[-1]C+R[-1]C[-1] -> 4.87987178842008E+17 | DG74: =FIB(RC[-101])+RC[-1]+R[-1]C+R[-1]C[-1] -> 7.20022139421932E+18 | DH74: =FIB(RC[-101])+RC[-1]+R[-1]C+R[-1]C[-1] -> 9.66647651580601E+19 | DI74: =FIB(RC[-101])+RC[-1]+R[-1]C+R[-1]C[-1] -> 1.19074357613094E+21 | DJ74: =FIB(RC[-101])+RC[-1]+R[-1]C+R[-1]C[-1] -> 1.35537909902419E+22 | DK74: =FIB(RC[-101])+RC[-1]+R[-1]C+R[-1]C[-1] -> 1.4342049586109E+23 | DL74: =FIB(RC[-101])+RC[-1]+R[-1]C+R[-1]C[-1] -> 1.41817106436291E+24 | DM74: =FIB(RC[-101])+RC[-1]+R[-1]C+R[-1]C[-1] -> 1.3163903368704E+25 | DN74: =FIB(RC[-101])+RC[-1]+R[-1]C+R[-1]C[-1] -> 1.15163796013488E+26 | DO74: =FIB(RC[-101])+RC[-1]+R[-1]C+R[-1]C[-1] -> 9.52936909513926E+26 | DP74: =FIB(RC[-101])+RC[-1]+R[-1]C+R[-1]C[-1] -> 7.48182494877842E+27 | DQ74: =FIB(RC[-101])+RC[-1]+R[-1]C+R[-1]C[-1] -> 5.58967034375596E+28 | DR74: =FIB(RC[-101])+RC[-1]+R[-1]C+R[-1]C[-1] -> 3.98402471633182E+29 | DS74: =FIB(RC[-101])+RC[-1]+R[-1]C+R[-1]C[-1] -> 2.7154088228303E+30 | DT74: =FIB(RC[-101])+RC[-1]+R[-1]C+R[-1]C[-1] -> 1.7736084840521E+31 | DU74: =FIB(RC[-101])+RC[-1]+R[-1]C+R[-1]C[-1] -> 1.11235786436737E+32 | DV74: =FIB(RC[-101])+RC[-1]+R[-1]C+R[-1]C[-1] -> 6.71093065694914E+32 | DW74: =FIB(RC[-101])+RC[-1]+R[-1]C+R[-1]C[-1] -> 3.90121443531042E+33 | DX74: =FIB(RC[-101])+RC[-1]+R[-1]C+R[-1]C[-1] -> 2.18861830258777E+34 | DY74: =FIB(RC[-101])+RC[-1]+R[-1]C+R[-1]C[-1] -> 1.18664346234193E+35 | DZ74: =FIB(RC[-101])+RC[-1]+R[-1]C+R[-1]C[-1] -> 6.22636966246585E+35 | EA74: =FIB(RC[-101])+RC[-1]+R[-1]C+R[-1]C[-1] -> 3.16563000263465E+36 | EB74: =FIB(RC[-101])+RC[-1]+R[-1]C+R[-1]C[-1] -> 1.56137651411191E+37 | EC74: =FIB(RC[-101])+RC[-1]+R[-1]C+R[-1]C[-1] -> 7.47924376820681E+37 | ED74: =FIB(RC[-101])+RC[-1]+R[-1]C+R[-1]C[-1] -> 3.48306934053934E+38 | EE74: =FIB(RC[-101])+RC[-1]+R[-1]C+R[-1]C[-1] -> 1.57850793380696E+39 | EF74: =FIB(RC[-101])+RC[-1]+R[-1]C+R[-1]C[-1] -> 6.9680886293559E+39 | EG74: =FIB(RC[-101])+RC[-1]+R[-1]C+R[-1]C[-1] -> 2.99876890610711E+40 | EH74: =FIB(RC[-101])+RC[-1]+R[-1]C+R[-1]C[-1] -> 1.25920040071196E+41 | EI74: =FIB(RC[-101])+RC[-1]+R[-1]C+R[-1]C[-1] -> 5.16310273308566E+41 | EJ74: =FIB(RC[-101])+RC[-1]+R[-1]C+R[-1]C[-1] -> 2.06878388971961E+42 | EK74: =FIB(RC[-101])+RC[-1]+R[-1]C+R[-1]C[-1] -> 8.10618331119541E+42 | EL74: =FIB(RC[-101])+RC[-1]+R[-1]C+R[-1]C[-1] -> 3.10819585935246E+43 | EM74: =FIB(RC[-101])+RC[-1]+R[-1]C+R[-1]C[-1] -> 1.16700034023979E+44 | EN74: =FIB(RC[-101])+RC[-1]+R[-1]C+R[-1]C[-1] -> 4.29310401452395E+44 | EO74: =FIB(RC[-101])+RC[-1]+R[-1]C+R[-1]C[-1] -> 1.54833478355757E+45 | EP74: =FIB(RC[-101])+RC[-1]+R[-1]C+R[-1]C[-1] -> 5.47766379659708E+45 | EQ74: =FIB(RC[-101])+RC[-1]+R[-1]C+R[-1]C[-1] -> 1.90193835513013E+46 | ER74: =FIB(RC[-101])+RC[-1]+R[-1]C+R[-1]C[-1] -> 6.484727482308E+46 | ES74: =FIB(RC[-101])+RC[-1]+R[-1]C+R[-1]C[-1] -> 2.17217925539665E+47 | ET74: =FIB(RC[-101])+RC[-1]+R[-1]C+R[-1]C[-1] -> 7.15177637670176E+47 | EU74: =FIB(RC[-101])+RC[-1]+R[-1]C+R[-1]C[-1] -> 2.31549582177919E+48 | EV74: =FIB(RC[-101])+RC[-1]+R[-1]C+R[-1]C[-1] -> 7.37523073892254E+48 | EW74: =FIB(RC[-101])+RC[-1]+R[-1]C+R[-1]C[-1] -> 2.31201770294683E+49 | EX74: =FIB(RC[-101])+RC[-1]+R[-1]C+R[-1]C[-1] -> 7.13618494670908E+49 | EY74: =FIB(RC[-101])+RC[-1]+R[-1]C+R[-1]C[-1] -> 2.16954838041188E+50 | EZ74: =FIB(RC[-101])+RC[-1]+R[-1]C+R[-1]C[-1] -> 6.49925473877774E+50 | FA74: =FIB(RC[-101])+RC[-1]+R[-1]C+R[-1]C[-1] -> 1.9191350134339E+51 | FB74: =FIB(RC[-101])+RC[-1]+R[-1]C+R[-1]C[-1] -> 5.58787146512172E+51 | FC74: =FIB(RC[-101])+RC[-1]+R[-1]C+R[-1]C[-1] -> 1.60484103644591E+52 | FD74: =FIB(RC[-101])+RC[-1]+R[-1]C+R[-1]C[-1] -> 4.54781842127549E+52 | FE74: =FIB(RC[-101])+RC[-1]+R[-1]C+R[-1]C[-1] -> 1.27202488179634E+53 | FF74: =FIB(RC[-101])+RC[-1]+R[-1]C+R[-1]C[-1] -> 3.51269783855271E+53 | FG74: =FIB(RC[-101])+RC[-1]+R[-1]C+R[-1]C[-1] -> 9.58000161381976E+53 | FH74: =FIB(RC[-101])+RC[-1]+R[-1]C+R[-1]C[-1] -> 2.5810277828917E+54 | FI74: =FIB(RC[-101])+RC[-1]+R[-1]C+R[-1]C[-1] -> 6.87132959768977E+54 | FJ74: =FIB(RC[-101])+RC[-1]+R[-1]C+R[-1]C[-1] -> 1.80810958302379E+55 | FK74: =FIB(RC[-101])+RC[-1]+R[-1]C+R[-1]C[-1] -> 4.70387501650729E+55 | FL74: =FIB(RC[-101])+RC[-1]+R[-1]C+R[-1]C[-1] -> 1.2101565073226E+56 | FM74: =FIB(RC[-101])+RC[-1]+R[-1]C+R[-1]C[-1] -> 3.07954366451501E+56 | FN74: =FIB(RC[-101])+RC[-1]+R[-1]C+R[-1]C[-1] -> 7.7533849446615E+56 | FO74: =FIB(RC[-101])+RC[-1]+R[-1]C+R[-1]C[-1] -> 1.93176585673825E+57 | FP74: =FIB(RC[-101])+RC[-1]+R[-1]C+R[-1]C[-1] -> 4.76398979652329E+57 | FQ74: =FIB(RC[-101])+RC[-1]+R[-1]C+R[-1]C[-1] -> 1.16314149432964E+58 | FR74: =FIB(RC[-101])+RC[-1]+R[-1]C+R[-1]C[-1] -> 2.81208940001951E+58 | FS74: =FIB(RC[-101])+RC[-1]+R[-1]C+R[-1]C[-1] -> 6.73360095795854E+58 | FT74: =FIB(RC[-101])+RC[-1]+R[-1]C+R[-1]C[-1] -> 1.59724527522847E+59 | FU74: =FIB(RC[-101])+RC[-1]+R[-1]C+R[-1]C[-1] -> 3.75390871899044E+59 | FV74: =FIB(RC[-101])+RC[-1]+R[-1]C+R[-1]C[-1] -> 8.74305483907738E+59 | FW74: =FIB(RC[-101])+RC[-1]+R[-1]C+R[-1]C[-1] -> 2.01830773423928E+60 | FX74: =FIB(RC[-101])+RC[-1]+R[-1]C+R[-1]C[-1] -> 4.61882360351871E+60 | FY74: =FIB(RC[-101])+RC[-1]+R[-1]C+R[-1]C[-1] -> 1.04801672590269E+61 | FZ74: =FIB(RC[-101])+RC[-1]+R[-1]C+R[-1]C[-1] -> 2.35813638933142E+61 | GA74: =FIB(RC[-101])+RC[-1]+R[-1]C+R[-1]C[-1] -> 5.26262687841265E+61 | GB74: =FIB(RC[-101])+RC[-1]+R[-1]C+R[-1]C[-1] -> 1.16502811452028E+62 | GC74: =FIB(RC[-101])+RC[-1]+R[-1]C+R[-1]C[-1] -> 2.55879685625365E+62 | GD74: =FIB(RC[-101])+RC[-1]+R[-1]C+R[-1]C[-1] -> 5.57653528810578E+62 | GE74: =FIB(RC[-101])+RC[-1]+R[-1]C+R[-1]C[-1] -> 1.20610281410827E+63 | GF74: =FIB(RC[-101])+RC[-1]+R[-1]C+R[-1]C[-1] -> 2.58914157645546E+63 | GG74: =FIB(RC[-101])+RC[-1]+R[-1]C+R[-1]C[-1] -> 5.51744041552695E+63 | GH74: =FIB(RC[-101])+RC[-1]+R[-1]C+R[-1]C[-1] -> 1.16731258405679E+64 | GI74: =FIB(RC[-101])+RC[-1]+R[-1]C+R[-1]C[-1] -> 2.45222410616153E+64 | GJ74: =FIB(RC[-101])+RC[-1]+R[-1]C+R[-1]C[-1] -> 5.11577006781161E+64 | GK74: =FIB(RC[-101])+RC[-1]+R[-1]C+R[-1]C[-1] -> 1.05996803655327E+65 | GL74: =FIB(RC[-101])+RC[-1]+R[-1]C+R[-1]C[-1] -> 2.18150952685158E+65 | GM74: =FIB(RC[-101])+RC[-1]+R[-1]C+R[-1]C[-1] -> 4.4602013600706E+65 | GN74: =FIB(RC[-101])+RC[-1]+R[-1]C+R[-1]C[-1] -> 9.06012100478344E+65 | GO74: =FIB(RC[-101])+RC[-1]+R[-1]C+R[-1]C[-1] -> 1.82870512178112E+66 | GP74: =FIB(RC[-101])+RC[-1]+R[-1]C+R[-1]C[-1] -> 3.66800839739943E+66 | GQ74: =FIB(RC[-101])+RC[-1]+R[-1]C+R[-1]C[-1] -> 7.31205746153556E+66 | GR74: =FIB(RC[-101])+RC[-1]+R[-1]C+R[-1]C[-1] -> 1.44882552504128E+67 | GS74: =FIB(RC[-101])+RC[-1]+R[-1]C+R[-1]C[-1] -> 2.85366721050271E+67
A75: 20 | B75: 20 | C75: 20 | D75: 20 | E75: 20 | F75: 20 | G75: 20 | H75: 20 | I75: 20 | J75: 20 | K75: 20 | L75: 20 | M75: 20 | N75: 20 | O75: 20 | P75: 20 | Q75: 20 | R75: 20 | S75: 20 | T75: 20 | U75: 20 | V75: 20 | W75: 20 | X75: 20 | Y75: 20 | Z75: 20 | AA75: 20 | AB75: 20 | AC75: 20 | AD75: 20 | AE75: 20 | AF75: 20 | AG75: 20 | AH75: 20 | AI75: 20 | AJ75: 20 | AK75: 20 | AL75: 20 | AM75: 20 | AN75: 20 | AO75: 20 | AP75: 20 | AQ75: 20 | AR75: 20 | AS75: 20 | AT75: 20 | AU75: 20 | AV75: 20 | AW75: 20 | AX75: 20 | AY75: 20 | AZ75: 20 | BA75: 20 | BB75: 20 | BC75: 20 | BD75: 20 | BE75: 20 | BF75: 20 | BG75: 20 | BH75: 20 | BI75: 20 | BJ75: 20 | BK75: 20 | BL75: 20 | BM75: 20 | BN75: 20 | BO75: 20 | BP75: 20 | BQ75: 20 | BR75: 20 | BS75: 20 | BT75: 20 | BU75: 20 | BV75: 20 | BW75: 20 | BX75: 20 | BY75: 20 | BZ75: 20 | CA75: 20 | CB75: 20 | CC75: 20 | CD75: 20 | CE75: 20 | CF75: 20 | CG75: 20 | CH75: 20 | CI75: 20 | CJ75: 20 | CK75: 20 | CL75: 20 | CM75: 20 | CN75: 20 | CO75: 20 | CP75: 20 | CQ75: 20 | CR75: 20 | CS75: 20 | CT75: 20 | CU75: 20 | CV75: 20 | CW75: 0 | CX75: =FIB(RC[-101])+RC[-1]+R[-1]C+R[-1]C[-1] -> 810004 | CY75: =FIB(RC[-101])+RC[-1]+R[-1]C+R[-1]C[-1] -> 60750300 | CZ75: =FIB(RC[-101])+RC[-1]+R[-1]C+R[-1]C[-1] -> 3018074904 | DA75: =FIB(RC[-101])+RC[-1]+R[-1]C+R[-1]C[-1] -> 112469055400 | DB75: =FIB(RC[-101])+RC[-1]+R[-1]C+R[-1]C[-1] -> 3353992472844 | DC75: =FIB(RC[-101])+RC[-1]+R[-1]C+R[-1]C[-1] -> 83384537423460 | DD75: =FIB(RC[-101])+RC[-1]+R[-1]C+R[-1]C[-1] -> 1.77777429024894E+15 | DE75: =FIB(RC[-101])+RC[-1]+R[-1]C+R[-1]C[-1] -> 3.31840076262334E+16 | DF75: =FIB(RC[-101])+RC[-1]+R[-1]C+R[-1]C[-1] -> 5.5095992562573E+17 | DG75: =FIB(RC[-101])+RC[-1]+R[-1]C+R[-1]C[-1] -> 8.23916849868707E+18 | DH75: =FIB(RC[-101])+RC[-1]+R[-1]C+R[-1]C[-1] -> 1.12104155050967E+20 | DI75: =FIB(RC[-101])+RC[-1]+R[-1]C+R[-1]C[-1] -> 1.39951249633996E+21 | DJ75: =FIB(RC[-101])+RC[-1]+R[-1]C+R[-1]C[-1] -> 1.61440470627128E+22 | DK75: =FIB(RC[-101])+RC[-1]+R[-1]C+R[-1]C[-1] -> 1.73118333914045E+23 | DL75: =FIB(RC[-101])+RC[-1]+R[-1]C+R[-1]C[-1] -> 1.73470989413804E+24 | DM75: =FIB(RC[-101])+RC[-1]+R[-1]C+R[-1]C[-1] -> 1.63167843272049E+25 | DN75: =FIB(RC[-101])+RC[-1]+R[-1]C+R[-1]C[-1] -> 1.44644483709397E+26 | DO75: =FIB(RC[-101])+RC[-1]+R[-1]C+R[-1]C[-1] -> 1.21274518923681E+27 | DP75: =FIB(RC[-101])+RC[-1]+R[-1]C+R[-1]C[-1] -> 9.64750704752915E+27 | DQ75: =FIB(RC[-101])+RC[-1]+R[-1]C+R[-1]C[-1] -> 7.30260354338672E+28 | DR75: =FIB(RC[-101])+RC[-1]+R[-1]C+R[-1]C[-1] -> 5.27325210504609E+29 | DS75: =FIB(RC[-101])+RC[-1]+R[-1]C+R[-1]C[-1] -> 3.64113650496809E+30 | DT75: =FIB(RC[-101])+RC[-1]+R[-1]C+R[-1]C[-1] -> 2.40926301683194E+31 | DU75: =FIB(RC[-101])+RC[-1]+R[-1]C+R[-1]C[-1] -> 1.53064501445578E+32 | DV75: =FIB(RC[-101])+RC[-1]+R[-1]C+R[-1]C[-1] -> 9.35393353577229E+32 | DW75: =FIB(RC[-101])+RC[-1]+R[-1]C+R[-1]C[-1] -> 5.50770085458256E+33 | DX75: =FIB(RC[-101])+RC[-1]+R[-1]C+R[-1]C[-1] -> 3.12950983157707E+34 | DY75: =FIB(RC[-101])+RC[-1]+R[-1]C+R[-1]C[-1] -> 1.71845627575842E+35 | DZ75: =FIB(RC[-101])+RC[-1]+R[-1]C+R[-1]C[-1] -> 9.1314694005662E+35 | EA75: =FIB(RC[-101])+RC[-1]+R[-1]C+R[-1]C[-1] -> 4.70141390893786E+36 | EB75: =FIB(RC[-101])+RC[-1]+R[-1]C+R[-1]C[-1] -> 2.34808090526916E+37 | EC75: =FIB(RC[-101])+RC[-1]+R[-1]C+R[-1]C[-1] -> 1.13887011875879E+38 | ED75: =FIB(RC[-101])+RC[-1]+R[-1]C+R[-1]C[-1] -> 5.36986383611881E+38 | EE75: =FIB(RC[-101])+RC[-1]+R[-1]C+R[-1]C[-1] -> 2.46380125147277E+39 | EF75: =FIB(RC[-101])+RC[-1]+R[-1]C+R[-1]C[-1] -> 1.10103978146356E+40 | EG75: =FIB(RC[-101])+RC[-1]+R[-1]C+R[-1]C[-1] -> 4.79661755050627E+40 | EH75: =FIB(RC[-101])+RC[-1]+R[-1]C+R[-1]C[-1] -> 2.0387390463733E+41 | EI75: =FIB(RC[-101])+RC[-1]+R[-1]C+R[-1]C[-1] -> 8.46104218017093E+41 | EJ75: =FIB(RC[-101])+RC[-1]+R[-1]C+R[-1]C[-1] -> 3.43119838104527E+42 | EK75: =FIB(RC[-101])+RC[-1]+R[-1]C+R[-1]C[-1] -> 1.36061655819603E+43 | EL75: =FIB(RC[-101])+RC[-1]+R[-1]C+R[-1]C[-1] -> 5.27943074866803E+43 | EM75: =FIB(RC[-101])+RC[-1]+R[-1]C+R[-1]C[-1] -> 2.00576300104184E+44 | EN75: =FIB(RC[-101])+RC[-1]+R[-1]C+R[-1]C[-1] -> 7.46586735580559E+44 | EO75: =FIB(RC[-101])+RC[-1]+R[-1]C+R[-1]C[-1] -> 2.72423192059053E+45 | EP75: =FIB(RC[-101])+RC[-1]+R[-1]C+R[-1]C[-1] -> 9.75023050074518E+45 | EQ75: =FIB(RC[-101])+RC[-1]+R[-1]C+R[-1]C[-1] -> 3.42472778486436E+46 | ER75: =FIB(RC[-101])+RC[-1]+R[-1]C+R[-1]C[-1] -> 1.18113936223025E+47 | ES75: =FIB(RC[-101])+RC[-1]+R[-1]C+R[-1]C[-1] -> 4.0017913658577E+47 | ET75: =FIB(RC[-101])+RC[-1]+R[-1]C+R[-1]C[-1] -> 1.33257469979561E+48 | EU75: =FIB(RC[-101])+RC[-1]+R[-1]C+R[-1]C[-1] -> 4.36324815924498E+48 | EV75: =FIB(RC[-101])+RC[-1]+R[-1]C+R[-1]C[-1] -> 1.40539747199467E+49 | EW75: =FIB(RC[-101])+RC[-1]+R[-1]C+R[-1]C[-1] -> 4.45493824883376E+49 | EX75: =FIB(RC[-101])+RC[-1]+R[-1]C+R[-1]C[-1] -> 1.39031408984897E+50 | EY75: =FIB(RC[-101])+RC[-1]+R[-1]C+R[-1]C[-1] -> 4.27348096493176E+50 | EZ75: =FIB(RC[-101])+RC[-1]+R[-1]C+R[-1]C[-1] -> 1.29422840841214E+51 | FA75: =FIB(RC[-101])+RC[-1]+R[-1]C+R[-1]C[-1] -> 3.86328889572381E+51 | FB75: =FIB(RC[-101])+RC[-1]+R[-1]C+R[-1]C[-1] -> 1.13702953742794E+52 | FC75: =FIB(RC[-101])+RC[-1]+R[-1]C+R[-1]C[-1] -> 3.30065772038602E+52 | FD75: =FIB(RC[-101])+RC[-1]+R[-1]C+R[-1]C[-1] -> 9.45331717810742E+52 | FE75: =FIB(RC[-101])+RC[-1]+R[-1]C+R[-1]C[-1] -> 2.67213844173463E+53 | FF75: =FIB(RC[-101])+RC[-1]+R[-1]C+R[-1]C[-1] -> 7.45686116208369E+53 | FG75: =FIB(RC[-101])+RC[-1]+R[-1]C+R[-1]C[-1] -> 2.05495606144562E+54 | FH75: =FIB(RC[-101])+RC[-1]+R[-1]C+R[-1]C[-1] -> 5.5939840057193E+54 | FI75: =FIB(RC[-101])+RC[-1]+R[-1]C+R[-1]C[-1] -> 1.50463413863008E+55 | FJ75: =FIB(RC[-101])+RC[-1]+R[-1]C+R[-1]C[-1] -> 3.99987668142284E+55 | FK75: =FIB(RC[-101])+RC[-1]+R[-1]C+R[-1]C[-1] -> 1.05118612809539E+56 | FL75: =FIB(RC[-101])+RC[-1]+R[-1]C+R[-1]C[-1] -> 2.73173013706872E+56 | FM75: =FIB(RC[-101])+RC[-1]+R[-1]C+R[-1]C[-1] -> 7.02143030890633E+56 | FN75: =FIB(RC[-101])+RC[-1]+R[-1]C+R[-1]C[-1] -> 1.78543589180828E+57 | FO75: =FIB(RC[-101])+RC[-1]+R[-1]C+R[-1]C[-1] -> 4.49254024301269E+57 | FP75: =FIB(RC[-101])+RC[-1]+R[-1]C+R[-1]C[-1] -> 1.11882958962742E+58 | FQ75: =FIB(RC[-101])+RC[-1]+R[-1]C+R[-1]C[-1] -> 2.75837006360939E+58 | FR75: =FIB(RC[-101])+RC[-1]+R[-1]C+R[-1]C[-1] -> 6.73360095795854E+58 | FS75: =FIB(RC[-101])+RC[-1]+R[-1]C+R[-1]C[-1] -> 1.62792913159366E+59 | FT75: =FIB(RC[-101])+RC[-1]+R[-1]C+R[-1]C[-1] -> 3.89853450261798E+59 | FU75: =FIB(RC[-101])+RC[-1]+R[-1]C+R[-1]C[-1] -> 9.24968849683689E+59 | FV75: =FIB(RC[-101])+RC[-1]+R[-1]C+R[-1]C[-1] -> 2.17466520549047E+60 | FW75: =FIB(RC[-101])+RC[-1]+R[-1]C+R[-1]C[-1] -> 5.06727842363749E+60 | FX75: =FIB(RC[-101])+RC[-1]+R[-1]C+R[-1]C[-1] -> 1.17044097613955E+61 | FY75: =FIB(RC[-101])+RC[-1]+R[-1]C+R[-1]C[-1] -> 2.68034006239411E+61 | FZ75: =FIB(RC[-101])+RC[-1]+R[-1]C+R[-1]C[-1] -> 6.08649317762822E+61 | GA75: =FIB(RC[-101])+RC[-1]+R[-1]C+R[-1]C[-1] -> 1.37072564453723E+62 | GB75: =FIB(RC[-101])+RC[-1]+R[-1]C+R[-1]C[-1] -> 3.06201644689878E+62 | GC75: =FIB(RC[-101])+RC[-1]+R[-1]C+R[-1]C[-1] -> 6.78584141767272E+62 | GD75: =FIB(RC[-101])+RC[-1]+R[-1]C+R[-1]C[-1] -> 1.49211735620321E+63 | GE75: =FIB(RC[-101])+RC[-1]+R[-1]C+R[-1]C[-1] -> 3.25587369912206E+63 | GF75: =FIB(RC[-101])+RC[-1]+R[-1]C+R[-1]C[-1] -> 7.05111808968578E+63 | GG75: =FIB(RC[-101])+RC[-1]+R[-1]C+R[-1]C[-1] -> 1.51577000816682E+64 | GH75: =FIB(RC[-101])+RC[-1]+R[-1]C+R[-1]C[-1] -> 3.2348266337763E+64 | GI75: =FIB(RC[-101])+RC[-1]+R[-1]C+R[-1]C[-1] -> 6.85436332399462E+64 | GJ75: =FIB(RC[-101])+RC[-1]+R[-1]C+R[-1]C[-1] -> 1.44223574979678E+65 | GK75: =FIB(RC[-101])+RC[-1]+R[-1]C+R[-1]C[-1] -> 3.0137807931312E+65 | GL75: =FIB(RC[-101])+RC[-1]+R[-1]C+R[-1]C[-1] -> 6.25525835653605E+65 | GM75: =FIB(RC[-101])+RC[-1]+R[-1]C+R[-1]C[-1] -> 1.28969692434582E+66 | GN75: =FIB(RC[-101])+RC[-1]+R[-1]C+R[-1]C[-1] -> 2.64172916083123E+66 | GO75: =FIB(RC[-101])+RC[-1]+R[-1]C+R[-1]C[-1] -> 5.37644638309068E+66 | GP75: =FIB(RC[-101])+RC[-1]+R[-1]C+R[-1]C[-1] -> 1.08731599022712E+67 | GQ75: =FIB(RC[-101])+RC[-1]+R[-1]C+R[-1]C[-1] -> 2.18532257612062E+67 | GR75: =FIB(RC[-101])+RC[-1]+R[-1]C+R[-1]C[-1] -> 4.36535384731546E+67 | GS75: =FIB(RC[-101])+RC[-1]+R[-1]C+R[-1]C[-1] -> 8.66784658285946E+67
A76: 20 | B76: 20 | C76: 20 | D76: 20 | E76: 20 | F76: 20 | G76: 20 | H76: 20 | I76: 20 | J76: 20 | K76: 20 | L76: 20 | M76: 20 | N76: 20 | O76: 20 | P76: 20 | Q76: 20 | R76: 20 | S76: 20 | T76: 20 | U76: 20 | V76: 20 | W76: 20 | X76: 20 | Y76: 20 | Z76: 20 | AA76: 20 | AB76: 20 | AC76: 20 | AD76: 20 | AE76: 20 | AF76: 20 | AG76: 20 | AH76: 20 | AI76: 20 | AJ76: 20 | AK76: 20 | AL76: 20 | AM76: 20 | AN76: 20 | AO76: 20 | AP76: 20 | AQ76: 20 | AR76: 20 | AS76: 20 | AT76: 20 | AU76: 20 | AV76: 20 | AW76: 20 | AX76: 20 | AY76: 20 | AZ76: 20 | BA76: 20 | BB76: 20 | BC76: 20 | BD76: 20 | BE76: 20 | BF76: 20 | BG76: 20 | BH76: 20 | BI76: 20 | BJ76: 20 | BK76: 20 | BL76: 20 | BM76: 20 | BN76: 20 | BO76: 20 | BP76: 20 | BQ76: 20 | BR76: 20 | BS76: 20 | BT76: 20 | BU76: 20 | BV76: 20 | BW76: 20 | BX76: 20 | BY76: 20 | BZ76: 20 | CA76: 20 | CB76: 20 | CC76: 20 | CD76: 20 | CE76: 20 | CF76: 20 | CG76: 20 | CH76: 20 | CI76: 20 | CJ76: 20 | CK76: 20 | CL76: 20 | CM76: 20 | CN76: 20 | CO76: 20 | CP76: 20 | CQ76: 20 | CR76: 20 | CS76: 20 | CT76: 20 | CU76: 20 | CV76: 20 | CW76: 0 | CX76: =FIB(RC[-101])+RC[-1]+R[-1]C+R[-1]C[-1] -> 820950 | CY76: =FIB(RC[-101])+RC[-1]+R[-1]C+R[-1]C[-1] -> 62392200 | CZ76: =FIB(RC[-101])+RC[-1]+R[-1]C+R[-1]C[-1] -> 3141228350 | DA76: =FIB(RC[-101])+RC[-1]+R[-1]C+R[-1]C[-1] -> 118628369600 | DB76: =FIB(RC[-101])+RC[-1]+R[-1]C+R[-1]C[-1] -> 3585089908790 | DC76: =FIB(RC[-101])+RC[-1]+R[-1]C+R[-1]C[-1] -> 90323619816040 | DD76: =FIB(RC[-101])+RC[-1]+R[-1]C+R[-1]C[-1] -> 1.95148244749939E+15 | DE76: =FIB(RC[-101])+RC[-1]+R[-1]C+R[-1]C[-1] -> 3.69132643639926E+16 | DF76: =FIB(RC[-101])+RC[-1]+R[-1]C+R[-1]C[-1] -> 6.21057197615967E+17 | DG76: =FIB(RC[-101])+RC[-1]+R[-1]C+R[-1]C[-1] -> 9.41118562192878E+18 | DH76: =FIB(RC[-101])+RC[-1]+R[-1]C+R[-1]C[-1] -> 1.29754509171582E+20 | DI76: =FIB(RC[-101])+RC[-1]+R[-1]C+R[-1]C[-1] -> 1.64137116056251E+21 | DJ76: =FIB(RC[-101])+RC[-1]+R[-1]C+R[-1]C[-1] -> 1.91849307196153E+22 | DK76: =FIB(RC[-101])+RC[-1]+R[-1]C+R[-1]C[-1] -> 2.08447311696373E+23 | DL76: =FIB(RC[-101])+RC[-1]+R[-1]C+R[-1]C[-1] -> 2.11627553974846E+24 | DM76: =FIB(RC[-101])+RC[-1]+R[-1]C+R[-1]C[-1] -> 2.01677697610914E+25 | DN76: =FIB(RC[-101])+RC[-1]+R[-1]C+R[-1]C[-1] -> 1.81129037797693E+26 | DO76: =FIB(RC[-101])+RC[-1]+R[-1]C+R[-1]C[-1] -> 1.5385187107439E+27 | DP76: =FIB(RC[-101])+RC[-1]+R[-1]C+R[-1]C[-1] -> 1.23987709475099E+28 | DQ76: =FIB(RC[-101])+RC[-1]+R[-1]C+R[-1]C[-1] -> 9.50723134289062E+28 | DR76: =FIB(RC[-101])+RC[-1]+R[-1]C+R[-1]C[-1] -> 6.95423559367382E+29 | DS76: =FIB(RC[-101])+RC[-1]+R[-1]C+R[-1]C[-1] -> 4.86388527484008E+30 | DT76: =FIB(RC[-101])+RC[-1]+R[-1]C+R[-1]C[-1] -> 3.25976519481276E+31 | DU76: =FIB(RC[-101])+RC[-1]+R[-1]C+R[-1]C[-1] -> 2.09754783562025E+32 | DV76: =FIB(RC[-101])+RC[-1]+R[-1]C+R[-1]C[-1] -> 1.29821263858483E+33 | DW76: =FIB(RC[-101])+RC[-1]+R[-1]C+R[-1]C[-1] -> 7.74130684674462E+33 | DX76: =FIB(RC[-101])+RC[-1]+R[-1]C+R[-1]C[-1] -> 4.45441060170979E+34 | DY76: =FIB(RC[-101])+RC[-1]+R[-1]C+R[-1]C[-1] -> 2.4768483190871E+35 | DZ76: =FIB(RC[-101])+RC[-1]+R[-1]C+R[-1]C[-1] -> 1.33267739954117E+36 | EA76: =FIB(RC[-101])+RC[-1]+R[-1]C+R[-1]C[-1] -> 6.94723824853565E+36 | EB76: =FIB(RC[-101])+RC[-1]+R[-1]C+R[-1]C[-1] -> 3.51294612101651E+37 | EC76: =FIB(RC[-101])+RC[-1]+R[-1]C+R[-1]C[-1] -> 1.72497282138736E+38 | ED76: =FIB(RC[-101])+RC[-1]+R[-1]C+R[-1]C[-1] -> 8.23370677626495E+38 | EE76: =FIB(RC[-101])+RC[-1]+R[-1]C+R[-1]C[-1] -> 3.82415831271115E+39 | EF76: =FIB(RC[-101])+RC[-1]+R[-1]C+R[-1]C[-1] -> 1.72983573788195E+40 | EG76: =FIB(RC[-101])+RC[-1]+R[-1]C+R[-1]C[-1] -> 7.62749306985178E+40 | EH76: =FIB(RC[-101])+RC[-1]+R[-1]C+R[-1]C[-1] -> 3.28115010840911E+41 | EI76: =FIB(RC[-101])+RC[-1]+R[-1]C+R[-1]C[-1] -> 1.37809313349533E+42 | EJ76: =FIB(RC[-101])+RC[-1]+R[-1]C+R[-1]C[-1] -> 5.65539573255769E+42 | EK76: =FIB(RC[-101])+RC[-1]+R[-1]C+R[-1]C[-1] -> 2.26927596955632E+43 | EL76: =FIB(RC[-101])+RC[-1]+R[-1]C+R[-1]C[-1] -> 8.90932327642038E+43 | EM76: =FIB(RC[-101])+RC[-1]+R[-1]C+R[-1]C[-1] -> 3.42463840355068E+44 | EN76: =FIB(RC[-101])+RC[-1]+R[-1]C+R[-1]C[-1] -> 1.28962687603981E+45 | EO76: =FIB(RC[-101])+RC[-1]+R[-1]C+R[-1]C[-1] -> 4.7604455322109E+45 | EP76: =FIB(RC[-101])+RC[-1]+R[-1]C+R[-1]C[-1] -> 1.72349079535466E+46 | EQ76: =FIB(RC[-101])+RC[-1]+R[-1]C+R[-1]C[-1] -> 6.12324163029354E+46 | ER76: =FIB(RC[-101])+RC[-1]+R[-1]C+R[-1]C[-1] -> 2.13593630374604E+47 | ES76: =FIB(RC[-101])+RC[-1]+R[-1]C+R[-1]C[-1] -> 7.31886703183399E+47 | ET76: =FIB(RC[-101])+RC[-1]+R[-1]C+R[-1]C[-1] -> 2.46464053956478E+48 | EU76: =FIB(RC[-101])+RC[-1]+R[-1]C+R[-1]C[-1] -> 8.16046339860537E+48 | EV76: =FIB(RC[-101])+RC[-1]+R[-1]C+R[-1]C[-1] -> 2.65776862777971E+49 | EW76: =FIB(RC[-101])+RC[-1]+R[-1]C+R[-1]C[-1] -> 8.51810434860813E+49 | EX76: =FIB(RC[-101])+RC[-1]+R[-1]C+R[-1]C[-1] -> 2.68761834959316E+50 | EY76: =FIB(RC[-101])+RC[-1]+R[-1]C+R[-1]C[-1] -> 8.35141340437388E+50 | EZ76: =FIB(RC[-101])+RC[-1]+R[-1]C+R[-1]C[-1] -> 2.5567178453427E+51 | FA76: =FIB(RC[-101])+RC[-1]+R[-1]C+R[-1]C[-1] -> 7.71423514947865E+51 | FB76: =FIB(RC[-101])+RC[-1]+R[-1]C+R[-1]C[-1] -> 2.29478194194819E+52 | FC76: =FIB(RC[-101])+RC[-1]+R[-1]C+R[-1]C[-1] -> 6.73246919976215E+52 | FD76: =FIB(RC[-101])+RC[-1]+R[-1]C+R[-1]C[-1] -> 1.94864440982556E+53 | FE76: =FIB(RC[-101])+RC[-1]+R[-1]C+R[-1]C[-1] -> 5.56611456937094E+53 | FF76: =FIB(RC[-101])+RC[-1]+R[-1]C+R[-1]C[-1] -> 1.56951141731893E+54 | FG76: =FIB(RC[-101])+RC[-1]+R[-1]C+R[-1]C[-1] -> 4.37015359497291E+54 | FH76: =FIB(RC[-101])+RC[-1]+R[-1]C+R[-1]C[-1] -> 1.20190936621378E+55 | FI76: =FIB(RC[-101])+RC[-1]+R[-1]C+R[-1]C[-1] -> 3.26594190541579E+55 | FJ76: =FIB(RC[-101])+RC[-1]+R[-1]C+R[-1]C[-1] -> 8.77045272546871E+55 | FK76: =FIB(RC[-101])+RC[-1]+R[-1]C+R[-1]C[-1] -> 2.32821906878455E+56 | FL76: =FIB(RC[-101])+RC[-1]+R[-1]C+R[-1]C[-1] -> 6.11113533394866E+56 | FM76: =FIB(RC[-101])+RC[-1]+R[-1]C+R[-1]C[-1] -> 1.58642957799237E+57 | FN76: =FIB(RC[-101])+RC[-1]+R[-1]C+R[-1]C[-1] -> 4.07400850069129E+57 | FO76: =FIB(RC[-101])+RC[-1]+R[-1]C+R[-1]C[-1] -> 1.03519846355123E+58 | FP76: =FIB(RC[-101])+RC[-1]+R[-1]C+R[-1]C[-1] -> 2.60328207747992E+58 | FQ76: =FIB(RC[-101])+RC[-1]+R[-1]C+R[-1]C[-1] -> 6.48048173071673E+58 | FR76: =FIB(RC[-101])+RC[-1]+R[-1]C+R[-1]C[-1] -> 1.59724527522847E+59 | FS76: =FIB(RC[-101])+RC[-1]+R[-1]C+R[-1]C[-1] -> 3.89853450261798E+59 | FT76: =FIB(RC[-101])+RC[-1]+R[-1]C+R[-1]C[-1] -> 9.42499813682962E+59 | FU76: =FIB(RC[-101])+RC[-1]+R[-1]C+R[-1]C[-1] -> 2.25732211362845E+60 | FV76: =FIB(RC[-101])+RC[-1]+R[-1]C+R[-1]C[-1] -> 5.35695616880261E+60 | FW76: =FIB(RC[-101])+RC[-1]+R[-1]C+R[-1]C[-1] -> 1.25988997979306E+61 | FX76: =FIB(RC[-101])+RC[-1]+R[-1]C+R[-1]C[-1] -> 2.93705879829635E+61 | FY76: =FIB(RC[-101])+RC[-1]+R[-1]C+R[-1]C[-1] -> 6.78783983683001E+61 | FZ76: =FIB(RC[-101])+RC[-1]+R[-1]C+R[-1]C[-1] -> 1.55546730768523E+62 | GA76: =FIB(RC[-101])+RC[-1]+R[-1]C+R[-1]C[-1] -> 3.53484226998529E+62 | GB76: =FIB(RC[-101])+RC[-1]+R[-1]C+R[-1]C[-1] -> 7.9675843614213E+62 | GC76: =FIB(RC[-101])+RC[-1]+R[-1]C+R[-1]C[-1] -> 1.78154422259928E+63 | GD76: =FIB(RC[-101])+RC[-1]+R[-1]C+R[-1]C[-1] -> 3.95224572056977E+63 | GE76: =FIB(RC[-101])+RC[-1]+R[-1]C+R[-1]C[-1] -> 8.70023677589504E+63 | GF76: =FIB(RC[-101])+RC[-1]+R[-1]C+R[-1]C[-1] -> 1.90072285647029E+64 | GG76: =FIB(RC[-101])+RC[-1]+R[-1]C+R[-1]C[-1] -> 4.12160467360569E+64 | GH76: =FIB(RC[-101])+RC[-1]+R[-1]C+R[-1]C[-1] -> 8.87220131554881E+64 | GI76: =FIB(RC[-101])+RC[-1]+R[-1]C+R[-1]C[-1] -> 1.89613912733197E+65 | GJ76: =FIB(RC[-101])+RC[-1]+R[-1]C+R[-1]C[-1] -> 4.02381120952821E+65 | GK76: =FIB(RC[-101])+RC[-1]+R[-1]C+R[-1]C[-1] -> 8.47982775245619E+65 | GL76: =FIB(RC[-101])+RC[-1]+R[-1]C+R[-1]C[-1] -> 1.77488669021234E+66 | GM76: =FIB(RC[-101])+RC[-1]+R[-1]C+R[-1]C[-1] -> 3.69010945021177E+66 | GN76: =FIB(RC[-101])+RC[-1]+R[-1]C+R[-1]C[-1] -> 7.62153553538882E+66 | GO76: =FIB(RC[-101])+RC[-1]+R[-1]C+R[-1]C[-1] -> 1.56397110793107E+67 | GP76: =FIB(RC[-101])+RC[-1]+R[-1]C+R[-1]C[-1] -> 3.18893173646727E+67 | GQ76: =FIB(RC[-101])+RC[-1]+R[-1]C+R[-1]C[-1] -> 6.46157030281501E+67 | GR76: =FIB(RC[-101])+RC[-1]+R[-1]C+R[-1]C[-1] -> 1.30122467262511E+68 | GS76: =FIB(RC[-101])+RC[-1]+R[-1]C+R[-1]C[-1] -> 2.6045447156426E+68
A77: 20 | B77: 20 | C77: 20 | D77: 20 | E77: 20 | F77: 20 | G77: 20 | H77: 20 | I77: 20 | J77: 20 | K77: 20 | L77: 20 | M77: 20 | N77: 20 | O77: 20 | P77: 20 | Q77: 20 | R77: 20 | S77: 20 | T77: 20 | U77: 20 | V77: 20 | W77: 20 | X77: 20 | Y77: 20 | Z77: 20 | AA77: 20 | AB77: 20 | AC77: 20 | AD77: 20 | AE77: 20 | AF77: 20 | AG77: 20 | AH77: 20 | AI77: 20 | AJ77: 20 | AK77: 20 | AL77: 20 | AM77: 20 | AN77: 20 | AO77: 20 | AP77: 20 | AQ77: 20 | AR77: 20 | AS77: 20 | AT77: 20 | AU77: 20 | AV77: 20 | AW77: 20 | AX77: 20 | AY77: 20 | AZ77: 20 | BA77: 20 | BB77: 20 | BC77: 20 | BD77: 20 | BE77: 20 | BF77: 20 | BG77: 20 | BH77: 20 | BI77: 20 | BJ77: 20 | BK77: 20 | BL77: 20 | BM77: 20 | BN77: 20 | BO77: 20 | BP77: 20 | BQ77: 20 | BR77: 20 | BS77: 20 | BT77: 20 | BU77: 20 | BV77: 20 | BW77: 20 | BX77: 20 | BY77: 20 | BZ77: 20 | CA77: 20 | CB77: 20 | CC77: 20 | CD77: 20 | CE77: 20 | CF77: 20 | CG77: 20 | CH77: 20 | CI77: 20 | CJ77: 20 | CK77: 20 | CL77: 20 | CM77: 20 | CN77: 20 | CO77: 20 | CP77: 20 | CQ77: 20 | CR77: 20 | CS77: 20 | CT77: 20 | CU77: 20 | CV77: 20 | CW77: 0 | CX77: =FIB(RC[-101])+RC[-1]+R[-1]C+R[-1]C[-1] -> 831896 | CY77: =FIB(RC[-101])+RC[-1]+R[-1]C+R[-1]C[-1] -> 64055992 | CZ77: =FIB(RC[-101])+RC[-1]+R[-1]C+R[-1]C[-1] -> 3267687488 | DA77: =FIB(RC[-101])+RC[-1]+R[-1]C+R[-1]C[-1] -> 125037296384 | DB77: =FIB(RC[-101])+RC[-1]+R[-1]C+R[-1]C[-1] -> 3828755585720 | DC77: =FIB(RC[-101])+RC[-1]+R[-1]C+R[-1]C[-1] -> 97737465321496 | DD77: =FIB(RC[-101])+RC[-1]+R[-1]C+R[-1]C[-1] -> 2.13954353264787E+15 | DE77: =FIB(RC[-101])+RC[-1]+R[-1]C+R[-1]C[-1] -> 4.10042903441508E+16 | DF77: =FIB(RC[-101])+RC[-1]+R[-1]C+R[-1]C[-1] -> 6.98974752324121E+17 | DG77: =FIB(RC[-101])+RC[-1]+R[-1]C+R[-1]C[-1] -> 1.07312175718689E+19 | DH77: =FIB(RC[-101])+RC[-1]+R[-1]C+R[-1]C[-1] -> 1.4989691236538E+20 | DI77: =FIB(RC[-101])+RC[-1]+R[-1]C+R[-1]C[-1] -> 1.92102258209948E+21 | DJ77: =FIB(RC[-101])+RC[-1]+R[-1]C+R[-1]C[-1] -> 2.27473244622773E+22 | DK77: =FIB(RC[-101])+RC[-1]+R[-1]C+R[-1]C[-1] -> 2.50379566878265E+23 | DL77: =FIB(RC[-101])+RC[-1]+R[-1]C+R[-1]C[-1] -> 2.5751024183231E+24 | DM77: =FIB(RC[-101])+RC[-1]+R[-1]C+R[-1]C[-1] -> 2.4859147719163E+25 | DN77: =FIB(RC[-101])+RC[-1]+R[-1]C+R[-1]C[-1] -> 2.26155955277948E+26 | DO77: =FIB(RC[-101])+RC[-1]+R[-1]C+R[-1]C[-1] -> 1.94580370381954E+27 | DP77: =FIB(RC[-101])+RC[-1]+R[-1]C+R[-1]C[-1] -> 1.58830933620733E+28 | DQ77: =FIB(RC[-101])+RC[-1]+R[-1]C+R[-1]C[-1] -> 1.23354177738489E+29 | DR77: =FIB(RC[-101])+RC[-1]+R[-1]C+R[-1]C[-1] -> 9.13850050534778E+29 | DS77: =FIB(RC[-101])+RC[-1]+R[-1]C+R[-1]C[-1] -> 6.47315888474224E+30 | DT77: =FIB(RC[-101])+RC[-1]+R[-1]C+R[-1]C[-1] -> 4.39346961077099E+31 | DU77: =FIB(RC[-101])+RC[-1]+R[-1]C+R[-1]C[-1] -> 2.86287131617862E+32 | DV77: =FIB(RC[-101])+RC[-1]+R[-1]C+R[-1]C[-1] -> 1.79425455376472E+33 | DW77: =FIB(RC[-101])+RC[-1]+R[-1]C+R[-1]C[-1] -> 1.08337740390942E+34 | DX77: =FIB(RC[-101])+RC[-1]+R[-1]C+R[-1]C[-1] -> 6.31191869029367E+34 | DY77: =FIB(RC[-101])+RC[-1]+R[-1]C+R[-1]C[-1] -> 3.55348124828745E+35 | DZ77: =FIB(RC[-101])+RC[-1]+R[-1]C+R[-1]C[-1] -> 1.93571035627863E+36 | EA77: =FIB(RC[-101])+RC[-1]+R[-1]C+R[-1]C[-1] -> 1.02156260043554E+37 | EB77: =FIB(RC[-101])+RC[-1]+R[-1]C+R[-1]C[-1] -> 5.22923254630562E+37 | EC77: =FIB(RC[-101])+RC[-1]+R[-1]C+R[-1]C[-1] -> 2.59919068811957E+38 | ED77: =FIB(RC[-101])+RC[-1]+R[-1]C+R[-1]C[-1] -> 1.25578702857719E+39 | EE77: =FIB(RC[-101])+RC[-1]+R[-1]C+R[-1]C[-1] -> 5.90331601891483E+39 | EF77: =FIB(RC[-101])+RC[-1]+R[-1]C+R[-1]C[-1] -> 2.70258317104455E+40 | EG77: =FIB(RC[-101])+RC[-1]+R[-1]C+R[-1]C[-1] -> 1.20599119787783E+41 | EH77: =FIB(RC[-101])+RC[-1]+R[-1]C+R[-1]C[-1] -> 5.24989061327211E+41 | EI77: =FIB(RC[-101])+RC[-1]+R[-1]C+R[-1]C[-1] -> 2.23119720566346E+42 | EJ77: =FIB(RC[-101])+RC[-1]+R[-1]C+R[-1]C[-1] -> 9.26468607171648E+42 | EK77: =FIB(RC[-101])+RC[-1]+R[-1]C+R[-1]C[-1] -> 3.76128414998374E+43 | EL77: =FIB(RC[-101])+RC[-1]+R[-1]C+R[-1]C[-1] -> 1.49398833959604E+44 | EM77: =FIB(RC[-101])+RC[-1]+R[-1]C+R[-1]C[-1] -> 5.80955907078877E+44 | EN77: =FIB(RC[-101])+RC[-1]+R[-1]C+R[-1]C[-1] -> 2.21304662347376E+45 | EO77: =FIB(RC[-101])+RC[-1]+R[-1]C+R[-1]C[-1] -> 8.26311903172446E+45 | EP77: =FIB(RC[-101])+RC[-1]+R[-1]C+R[-1]C[-1] -> 3.0258472517482E+46 | EQ77: =FIB(RC[-101])+RC[-1]+R[-1]C+R[-1]C[-1] -> 1.08725796773964E+47 | ER77: =FIB(RC[-101])+RC[-1]+R[-1]C+R[-1]C[-1] -> 3.83551843451503E+47 | ES77: =FIB(RC[-101])+RC[-1]+R[-1]C+R[-1]C[-1] -> 1.32903217700951E+48 | ET77: =FIB(RC[-101])+RC[-1]+R[-1]C+R[-1]C[-1] -> 4.52555941975769E+48 | EU77: =FIB(RC[-101])+RC[-1]+R[-1]C+R[-1]C[-1] -> 1.51506633579278E+49 | EV77: =FIB(RC[-101])+RC[-1]+R[-1]C+R[-1]C[-1] -> 4.98888130343303E+49 | EW77: =FIB(RC[-101])+RC[-1]+R[-1]C+R[-1]C[-1] -> 1.61647542798209E+50 | EX77: =FIB(RC[-101])+RC[-1]+R[-1]C+R[-1]C[-1] -> 5.15590421243606E+50 | EY77: =FIB(RC[-101])+RC[-1]+R[-1]C+R[-1]C[-1] -> 1.61949359664031E+51 | EZ77: =FIB(RC[-101])+RC[-1]+R[-1]C+R[-1]C[-1] -> 5.0113527824204E+51 | FA77: =FIB(RC[-101])+RC[-1]+R[-1]C+R[-1]C[-1] -> 1.52823057772418E+52 | FB77: =FIB(RC[-101])+RC[-1]+R[-1]C+R[-1]C[-1] -> 4.59443603462023E+52 | FC77: =FIB(RC[-101])+RC[-1]+R[-1]C+R[-1]C[-1] -> 1.36216871763306E+53 | FD77: =FIB(RC[-101])+RC[-1]+R[-1]C+R[-1]C[-1] -> 3.98406004743483E+53 | FE77: =FIB(RC[-101])+RC[-1]+R[-1]C+R[-1]C[-1] -> 1.14988190266313E+54 | FF77: =FIB(RC[-101])+RC[-1]+R[-1]C+R[-1]C[-1] -> 3.27600477691915E+54 | FG77: =FIB(RC[-101])+RC[-1]+R[-1]C+R[-1]C[-1] -> 9.21566978921099E+54 | FH77: =FIB(RC[-101])+RC[-1]+R[-1]C+R[-1]C[-1] -> 2.56049170463217E+55 | FI77: =FIB(RC[-101])+RC[-1]+R[-1]C+R[-1]C[-1] -> 7.02834297626174E+55 | FJ77: =FIB(RC[-101])+RC[-1]+R[-1]C+R[-1]C[-1] -> 1.90647376071462E+56 | FK77: =FIB(RC[-101])+RC[-1]+R[-1]C+R[-1]C[-1] -> 5.11173810204604E+56 | FL77: =FIB(RC[-101])+RC[-1]+R[-1]C+R[-1]C[-1] -> 1.35510925047793E+57 | FM77: =FIB(RC[-101])+RC[-1]+R[-1]C+R[-1]C[-1] -> 3.55265236186516E+57 | FN77: =FIB(RC[-101])+RC[-1]+R[-1]C+R[-1]C[-1] -> 9.21309044054882E+57 | FO77: =FIB(RC[-101])+RC[-1]+R[-1]C+R[-1]C[-1] -> 2.36390835767524E+58 | FP77: =FIB(RC[-101])+RC[-1]+R[-1]C+R[-1]C[-1] -> 6.00238889870638E+58 | FQ77: =FIB(RC[-101])+RC[-1]+R[-1]C+R[-1]C[-1] -> 1.5086152706903E+59 | FR77: =FIB(RC[-101])+RC[-1]+R[-1]C+R[-1]C[-1] -> 3.75390871899044E+59 | FS77: =FIB(RC[-101])+RC[-1]+R[-1]C+R[-1]C[-1] -> 9.24968849683689E+59 | FT77: =FIB(RC[-101])+RC[-1]+R[-1]C+R[-1]C[-1] -> 2.25732211362845E+60 | FU77: =FIB(RC[-101])+RC[-1]+R[-1]C+R[-1]C[-1] -> 5.45714404093986E+60 | FV77: =FIB(RC[-101])+RC[-1]+R[-1]C+R[-1]C[-1] -> 1.30714223233709E+61 | FW77: =FIB(RC[-101])+RC[-1]+R[-1]C+R[-1]C[-1] -> 3.10272782901041E+61 | FX77: =FIB(RC[-101])+RC[-1]+R[-1]C+R[-1]C[-1] -> 7.29967660709982E+61 | FY77: =FIB(RC[-101])+RC[-1]+R[-1]C+R[-1]C[-1] -> 1.70245752422262E+62 | FZ77: =FIB(RC[-101])+RC[-1]+R[-1]C+R[-1]C[-1] -> 3.93670881559085E+62 | GA77: =FIB(RC[-101])+RC[-1]+R[-1]C+R[-1]C[-1] -> 9.02701839326138E+62 | GB77: =FIB(RC[-101])+RC[-1]+R[-1]C+R[-1]C[-1] -> 2.0529445024668E+63 | GC77: =FIB(RC[-101])+RC[-1]+R[-1]C+R[-1]C[-1] -> 4.6312471612082E+63 | GD77: =FIB(RC[-101])+RC[-1]+R[-1]C+R[-1]C[-1] -> 1.03650371043772E+64 | GE77: =FIB(RC[-101])+RC[-1]+R[-1]C+R[-1]C[-1] -> 2.3017519600842E+64 | GF77: =FIB(RC[-101])+RC[-1]+R[-1]C+R[-1]C[-1] -> 5.072498494144E+64 | GG77: =FIB(RC[-101])+RC[-1]+R[-1]C+R[-1]C[-1] -> 1.109482602422E+65 | GH77: =FIB(RC[-101])+RC[-1]+R[-1]C+R[-1]C[-1] -> 2.40886320133745E+65 | GI77: =FIB(RC[-101])+RC[-1]+R[-1]C+R[-1]C[-1] -> 5.1922224602243E+65 | GJ77: =FIB(RC[-101])+RC[-1]+R[-1]C+R[-1]C[-1] -> 1.11121727970845E+66 | GK77: =FIB(RC[-101])+RC[-1]+R[-1]C+R[-1]C[-1] -> 2.36158117590689E+66 | GL77: =FIB(RC[-101])+RC[-1]+R[-1]C+R[-1]C[-1] -> 4.98445064136485E+66 | GM77: =FIB(RC[-101])+RC[-1]+R[-1]C+R[-1]C[-1] -> 1.0449446781789E+67 | GN77: =FIB(RC[-101])+RC[-1]+R[-1]C+R[-1]C[-1] -> 2.17610917673896E+67 | GO77: =FIB(RC[-101])+RC[-1]+R[-1]C+R[-1]C[-1] -> 4.50223383820891E+67 | GP77: =FIB(RC[-101])+RC[-1]+R[-1]C+R[-1]C[-1] -> 9.25513668260725E+67 | GQ77: =FIB(RC[-101])+RC[-1]+R[-1]C+R[-1]C[-1] -> 1.89056387218895E+68 | GR77: =FIB(RC[-101])+RC[-1]+R[-1]C+R[-1]C[-1] -> 3.83794557509556E+68 | GS77: =FIB(RC[-101])+RC[-1]+R[-1]C+R[-1]C[-1] -> 7.74371496336328E+68
A78: 20 | B78: 20 | C78: 20 | D78: 20 | E78: 20 | F78: 20 | G78: 20 | H78: 20 | I78: 20 | J78: 20 | K78: 20 | L78: 20 | M78: 20 | N78: 20 | O78: 20 | P78: 20 | Q78: 20 | R78: 20 | S78: 20 | T78: 20 | U78: 20 | V78: 20 | W78: 20 | X78: 20 | Y78: 20 | Z78: 20 | AA78: 20 | AB78: 20 | AC78: 20 | AD78: 20 | AE78: 20 | AF78: 20 | AG78: 20 | AH78: 20 | AI78: 20 | AJ78: 20 | AK78: 20 | AL78: 20 | AM78: 20 | AN78: 20 | AO78: 20 | AP78: 20 | AQ78: 20 | AR78: 20 | AS78: 20 | AT78: 20 | AU78: 20 | AV78: 20 | AW78: 20 | AX78: 20 | AY78: 20 | AZ78: 20 | BA78: 20 | BB78: 20 | BC78: 20 | BD78: 20 | BE78: 20 | BF78: 20 | BG78: 20 | BH78: 20 | BI78: 20 | BJ78: 20 | BK78: 20 | BL78: 20 | BM78: 20 | BN78: 20 | BO78: 20 | BP78: 20 | BQ78: 20 | BR78: 20 | BS78: 20 | BT78: 20 | BU78: 20 | BV78: 20 | BW78: 20 | BX78: 20 | BY78: 20 | BZ78: 20 | CA78: 20 | CB78: 20 | CC78: 20 | CD78: 20 | CE78: 20 | CF78: 20 | CG78: 20 | CH78: 20 | CI78: 20 | CJ78: 20 | CK78: 20 | CL78: 20 | CM78: 20 | CN78: 20 | CO78: 20 | CP78: 20 | CQ78: 20 | CR78: 20 | CS78: 20 | CT78: 20 | CU78: 20 | CV78: 20 | CW78: 0 | CX78: =FIB(RC[-101])+RC[-1]+R[-1]C+R[-1]C[-1] -> 842842 | CY78: =FIB(RC[-101])+RC[-1]+R[-1]C+R[-1]C[-1] -> 65741676 | CZ78: =FIB(RC[-101])+RC[-1]+R[-1]C+R[-1]C[-1] -> 3397496102 | DA78: =FIB(RC[-101])+RC[-1]+R[-1]C+R[-1]C[-1] -> 131702490920 | DB78: =FIB(RC[-101])+RC[-1]+R[-1]C+R[-1]C[-1] -> 4085495383970 | DC78: =FIB(RC[-101])+RC[-1]+R[-1]C+R[-1]C[-1] -> 105651716302132 | DD78: =FIB(RC[-101])+RC[-1]+R[-1]C+R[-1]C[-1] -> 2.34293271428245E+15 | DE78: =FIB(RC[-101])+RC[-1]+R[-1]C+R[-1]C[-1] -> 4.54867665910921E+16 | DF78: =FIB(RC[-101])+RC[-1]+R[-1]C+R[-1]C[-1] -> 7.85465809259375E+17 | DG78: =FIB(RC[-101])+RC[-1]+R[-1]C+R[-1]C[-1] -> 1.22156581334524E+19 | DH78: =FIB(RC[-101])+RC[-1]+R[-1]C+R[-1]C[-1] -> 1.72843788070701E+20 | DI78: =FIB(RC[-101])+RC[-1]+R[-1]C+R[-1]C[-1] -> 2.24376328253556E+21 | DJ78: =FIB(RC[-101])+RC[-1]+R[-1]C+R[-1]C[-1] -> 2.69121103269123E+22 | DK78: =FIB(RC[-101])+RC[-1]+R[-1]C+R[-1]C[-1] -> 3.00039001667455E+23 | DL78: =FIB(RC[-101])+RC[-1]+R[-1]C+R[-1]C[-1] -> 3.12552098686882E+24 | DM78: =FIB(RC[-101])+RC[-1]+R[-1]C+R[-1]C[-1] -> 3.05597711243549E+25 | DN78: =FIB(RC[-101])+RC[-1]+R[-1]C+R[-1]C[-1] -> 2.81574874121465E+26 | DO78: =FIB(RC[-101])+RC[-1]+R[-1]C+R[-1]C[-1] -> 2.45353453321895E+27 | DP78: =FIB(RC[-101])+RC[-1]+R[-1]C+R[-1]C[-1] -> 2.02824315991118E+28 | DQ78: =FIB(RC[-101])+RC[-1]+R[-1]C+R[-1]C[-1] -> 1.59519702699674E+29 | DR78: =FIB(RC[-101])+RC[-1]+R[-1]C+R[-1]C[-1] -> 1.19672393097294E+30 | DS78: =FIB(RC[-101])+RC[-1]+R[-1]C+R[-1]C[-1] -> 8.58373286624996E+30 | DT78: =FIB(RC[-101])+RC[-1]+R[-1]C+R[-1]C[-1] -> 5.89915878587021E+31 | DU78: =FIB(RC[-101])+RC[-1]+R[-1]C+R[-1]C[-1] -> 3.89213415584274E+32 | DV78: =FIB(RC[-101])+RC[-1]+R[-1]C+R[-1]C[-1] -> 2.46975510096685E+33 | DW78: =FIB(RC[-101])+RC[-1]+R[-1]C+R[-1]C[-1] -> 1.50977836938257E+34 | DX78: =FIB(RC[-101])+RC[-1]+R[-1]C+R[-1]C[-1] -> 8.90507446358566E+34 | DY78: =FIB(RC[-101])+RC[-1]+R[-1]C+R[-1]C[-1] -> 5.07518056367538E+35 | DZ78: =FIB(RC[-101])+RC[-1]+R[-1]C+R[-1]C[-1] -> 2.79857653747491E+36 | EA78: =FIB(RC[-101])+RC[-1]+R[-1]C+R[-1]C[-1] -> 1.4949912898109E+37 | EB78: =FIB(RC[-101])+RC[-1]+R[-1]C+R[-1]C[-1] -> 7.74578643655206E+37 | EC78: =FIB(RC[-101])+RC[-1]+R[-1]C+R[-1]C[-1] -> 3.89669258640534E+38 | ED78: =FIB(RC[-101])+RC[-1]+R[-1]C+R[-1]C[-1] -> 1.90537535602968E+39 | EE78: =FIB(RC[-101])+RC[-1]+R[-1]C+R[-1]C[-1] -> 9.0644784035217E+39 | EF78: =FIB(RC[-101])+RC[-1]+R[-1]C+R[-1]C[-1] -> 4.19936261328821E+40 | EG78: =FIB(RC[-101])+RC[-1]+R[-1]C+R[-1]C[-1] -> 1.8961857763111E+41 | EH78: =FIB(RC[-101])+RC[-1]+R[-1]C+R[-1]C[-1] -> 8.35206758746105E+41 | EI78: =FIB(RC[-101])+RC[-1]+R[-1]C+R[-1]C[-1] -> 3.59139302573677E+42 | EJ78: =FIB(RC[-101])+RC[-1]+R[-1]C+R[-1]C[-1] -> 1.50872763031167E+43 | EK78: =FIB(RC[-101])+RC[-1]+R[-1]C+R[-1]C[-1] -> 6.19648038746706E+43 | EL78: =FIB(RC[-101])+RC[-1]+R[-1]C+R[-1]C[-1] -> 2.48976479334113E+44 | EM78: =FIB(RC[-101])+RC[-1]+R[-1]C+R[-1]C[-1] -> 9.79331220372594E+44 | EN78: =FIB(RC[-101])+RC[-1]+R[-1]C+R[-1]C[-1] -> 3.77333375092523E+45 | EO78: =FIB(RC[-101])+RC[-1]+R[-1]C+R[-1]C[-1] -> 1.42494994061234E+46 | EP78: =FIB(RC[-101])+RC[-1]+R[-1]C+R[-1]C[-1] -> 5.27710909553299E+46 | EQ78: =FIB(RC[-101])+RC[-1]+R[-1]C+R[-1]C[-1] -> 1.91755360246776E+47 | ER78: =FIB(RC[-101])+RC[-1]+R[-1]C+R[-1]C[-1] -> 6.84033000472243E+47 | ES78: =FIB(RC[-101])+RC[-1]+R[-1]C+R[-1]C[-1] -> 2.39661702093325E+48 | ET78: =FIB(RC[-101])+RC[-1]+R[-1]C+R[-1]C[-1] -> 8.25120861770044E+48 | EU78: =FIB(RC[-101])+RC[-1]+R[-1]C+R[-1]C[-1] -> 2.7927431395386E+49 | EV78: =FIB(RC[-101])+RC[-1]+R[-1]C+R[-1]C[-1] -> 9.29669077876441E+49 | EW78: =FIB(RC[-101])+RC[-1]+R[-1]C+R[-1]C[-1] -> 3.04503263620183E+50 | EX78: =FIB(RC[-101])+RC[-1]+R[-1]C+R[-1]C[-1] -> 9.81741227661997E+50 | EY78: =FIB(RC[-101])+RC[-1]+R[-1]C+R[-1]C[-1] -> 3.11682524554591E+51 | EZ78: =FIB(RC[-101])+RC[-1]+R[-1]C+R[-1]C[-1] -> 9.74767162460662E+51 | FA78: =FIB(RC[-101])+RC[-1]+R[-1]C+R[-1]C[-1] -> 3.00413301842688E+52 | FB78: =FIB(RC[-101])+RC[-1]+R[-1]C+R[-1]C[-1] -> 9.12679963077128E+52 | FC78: =FIB(RC[-101])+RC[-1]+R[-1]C+R[-1]C[-1] -> 2.73429228417221E+53 | FD78: =FIB(RC[-101])+RC[-1]+R[-1]C+R[-1]C[-1] -> 8.0805210492401E+53 | FE78: =FIB(RC[-101])+RC[-1]+R[-1]C+R[-1]C[-1] -> 2.35634001233062E+54 | FF78: =FIB(RC[-101])+RC[-1]+R[-1]C+R[-1]C[-1] -> 6.78222669191291E+54 | FG78: =FIB(RC[-101])+RC[-1]+R[-1]C+R[-1]C[-1] -> 1.92739012580431E+55 | FH78: =FIB(RC[-101])+RC[-1]+R[-1]C+R[-1]C[-1] -> 5.40944880935758E+55 | FI78: =FIB(RC[-101])+RC[-1]+R[-1]C+R[-1]C[-1] -> 1.49982834902515E+56 | FJ78: =FIB(RC[-101])+RC[-1]+R[-1]C+R[-1]C[-1] -> 4.10913640736595E+56 | FK78: =FIB(RC[-101])+RC[-1]+R[-1]C+R[-1]C[-1] -> 1.11273482701266E+57 | FL78: =FIB(RC[-101])+RC[-1]+R[-1]C+R[-1]C[-1] -> 2.97901788769519E+57 | FM78: =FIB(RC[-101])+RC[-1]+R[-1]C+R[-1]C[-1] -> 7.88677950003828E+57 | FN78: =FIB(RC[-101])+RC[-1]+R[-1]C+R[-1]C[-1] -> 2.06525223024523E+58 | FO78: =FIB(RC[-101])+RC[-1]+R[-1]C+R[-1]C[-1] -> 5.35046963197535E+58 | FP78: =FIB(RC[-101])+RC[-1]+R[-1]C+R[-1]C[-1] -> 1.3716766888357E+59 | FQ78: =FIB(RC[-101])+RC[-1]+R[-1]C+R[-1]C[-1] -> 3.48053084939664E+59 | FR78: =FIB(RC[-101])+RC[-1]+R[-1]C+R[-1]C[-1] -> 8.74305483907738E+59 | FS78: =FIB(RC[-101])+RC[-1]+R[-1]C+R[-1]C[-1] -> 2.17466520549047E+60 | FT78: =FIB(RC[-101])+RC[-1]+R[-1]C+R[-1]C[-1] -> 5.35695616880261E+60 | FU78: =FIB(RC[-101])+RC[-1]+R[-1]C+R[-1]C[-1] -> 1.30714223233709E+61 | FV78: =FIB(RC[-101])+RC[-1]+R[-1]C+R[-1]C[-1] -> 3.15999886876817E+61 | FW78: =FIB(RC[-101])+RC[-1]+R[-1]C+R[-1]C[-1] -> 7.56986893011567E+61 | FX78: =FIB(RC[-101])+RC[-1]+R[-1]C+R[-1]C[-1] -> 1.79722733662259E+62 | FY78: =FIB(RC[-101])+RC[-1]+R[-1]C+R[-1]C[-1] -> 4.22965252155519E+62 | FZ78: =FIB(RC[-101])+RC[-1]+R[-1]C+R[-1]C[-1] -> 9.86881886136866E+62 | GA78: =FIB(RC[-101])+RC[-1]+R[-1]C+R[-1]C[-1] -> 2.28325460702209E+63 | GB78: =FIB(RC[-101])+RC[-1]+R[-1]C+R[-1]C[-1] -> 5.23890094881502E+63 | GC78: =FIB(RC[-101])+RC[-1]+R[-1]C+R[-1]C[-1] -> 1.192309261249E+64 | GD78: =FIB(RC[-101])+RC[-1]+R[-1]C+R[-1]C[-1] -> 2.69193768780755E+64 | GE78: =FIB(RC[-101])+RC[-1]+R[-1]C+R[-1]C[-1] -> 6.03019335832948E+64 | GF78: =FIB(RC[-101])+RC[-1]+R[-1]C+R[-1]C[-1] -> 1.34044438125577E+65 | GG78: =FIB(RC[-101])+RC[-1]+R[-1]C+R[-1]C[-1] -> 2.95717683309216E+65 | GH78: =FIB(RC[-101])+RC[-1]+R[-1]C+R[-1]C[-1] -> 6.47552263685161E+65 | GI78: =FIB(RC[-101])+RC[-1]+R[-1]C+R[-1]C[-1] -> 1.40766082984134E+66 | GJ78: =FIB(RC[-101])+RC[-1]+R[-1]C+R[-1]C[-1] -> 3.03810035557221E+66 | GK78: =FIB(RC[-101])+RC[-1]+R[-1]C+R[-1]C[-1] -> 6.51089881118755E+66 | GL78: =FIB(RC[-101])+RC[-1]+R[-1]C+R[-1]C[-1] -> 1.38569306284593E+67 | GM78: =FIB(RC[-101])+RC[-1]+R[-1]C+R[-1]C[-1] -> 2.92908280516131E+67 | GN78: =FIB(RC[-101])+RC[-1]+R[-1]C+R[-1]C[-1] -> 6.15013666007917E+67 | GO78: =FIB(RC[-101])+RC[-1]+R[-1]C+R[-1]C[-1] -> 1.2828479675027E+68 | GP78: =FIB(RC[-101])+RC[-1]+R[-1]C+R[-1]C[-1] -> 2.65858501958432E+68 | GQ78: =FIB(RC[-101])+RC[-1]+R[-1]C+R[-1]C[-1] -> 5.474662560034E+68 | GR78: =FIB(RC[-101])+RC[-1]+R[-1]C+R[-1]C[-1] -> 1.12031720073185E+69 | GS78: =FIB(RC[-101])+RC[-1]+R[-1]C+R[-1]C[-1] -> 2.27848325457774E+69
A79: 20 | B79: 20 | C79: 20 | D79: 20 | E79: 20 | F79: 20 | G79: 20 | H79: 20 | I79: 20 | J79: 20 | K79: 20 | L79: 20 | M79: 20 | N79: 20 | O79: 20 | P79: 20 | Q79: 20 | R79: 20 | S79: 20 | T79: 20 | U79: 20 | V79: 20 | W79: 20 | X79: 20 | Y79: 20 | Z79: 20 | AA79: 20 | AB79: 20 | AC79: 20 | AD79: 20 | AE79: 20 | AF79: 20 | AG79: 20 | AH79: 20 | AI79: 20 | AJ79: 20 | AK79: 20 | AL79: 20 | AM79: 20 | AN79: 20 | AO79: 20 | AP79: 20 | AQ79: 20 | AR79: 20 | AS79: 20 | AT79: 20 | AU79: 20 | AV79: 20 | AW79: 20 | AX79: 20 | AY79: 20 | AZ79: 20 | BA79: 20 | BB79: 20 | BC79: 20 | BD79: 20 | BE79: 20 | BF79: 20 | BG79: 20 | BH79: 20 | BI79: 20 | BJ79: 20 | BK79: 20 | BL79: 20 | BM79: 20 | BN79: 20 | BO79: 20 | BP79: 20 | BQ79: 20 | BR79: 20 | BS79: 20 | BT79: 20 | BU79: 20 | BV79: 20 | BW79: 20 | BX79: 20 | BY79: 20 | BZ79: 20 | CA79: 20 | CB79: 20 | CC79: 20 | CD79: 20 | CE79: 20 | CF79: 20 | CG79: 20 | CH79: 20 | CI79: 20 | CJ79: 20 | CK79: 20 | CL79: 20 | CM79: 20 | CN79: 20 | CO79: 20 | CP79: 20 | CQ79: 20 | CR79: 20 | CS79: 20 | CT79: 20 | CU79: 20 | CV79: 20 | CW79: 0 | CX79: =FIB(RC[-101])+RC[-1]+R[-1]C+R[-1]C[-1] -> 853788 | CY79: =FIB(RC[-101])+RC[-1]+R[-1]C+R[-1]C[-1] -> 67449252 | CZ79: =FIB(RC[-101])+RC[-1]+R[-1]C+R[-1]C[-1] -> 3530697976 | DA79: =FIB(RC[-101])+RC[-1]+R[-1]C+R[-1]C[-1] -> 138630695944 | DB79: =FIB(RC[-101])+RC[-1]+R[-1]C+R[-1]C[-1] -> 4355828581780 | DC79: =FIB(RC[-101])+RC[-1]+R[-1]C+R[-1]C[-1] -> 114093040278828 | DD79: =FIB(RC[-101])+RC[-1]+R[-1]C+R[-1]C[-1] -> 2.56267747087435E+15 | DE79: =FIB(RC[-101])+RC[-1]+R[-1]C+R[-1]C[-1] -> 5.03923767762599E+16 | DF79: =FIB(RC[-101])+RC[-1]+R[-1]C+R[-1]C[-1] -> 8.81344952626738E+17 | DG79: =FIB(RC[-101])+RC[-1]+R[-1]C+R[-1]C[-1] -> 1.38824688953385E+19 | DH79: =FIB(RC[-101])+RC[-1]+R[-1]C+R[-1]C[-1] -> 1.98941915099492E+20 | DI79: =FIB(RC[-101])+RC[-1]+R[-1]C+R[-1]C[-1] -> 2.61554898570575E+21 | DJ79: =FIB(RC[-101])+RC[-1]+R[-1]C+R[-1]C[-1] -> 3.17714225951536E+22 | DK79: =FIB(RC[-101])+RC[-1]+R[-1]C+R[-1]C[-1] -> 3.58722534589521E+23 | DL79: =FIB(RC[-101])+RC[-1]+R[-1]C+R[-1]C[-1] -> 3.78428252312579E+24 | DM79: =FIB(RC[-101])+RC[-1]+R[-1]C+R[-1]C[-1] -> 3.74695746343495E+25 | DN79: =FIB(RC[-101])+RC[-1]+R[-1]C+R[-1]C[-1] -> 3.4960421988017E+26 | DO79: =FIB(RC[-101])+RC[-1]+R[-1]C+R[-1]C[-1] -> 3.08471362722059E+27 | DP79: =FIB(RC[-101])+RC[-1]+R[-1]C+R[-1]C[-1] -> 2.58206797595513E+28 | DQ79: =FIB(RC[-101])+RC[-1]+R[-1]C+R[-1]C[-1] -> 2.05622814058338E+29 | DR79: =FIB(RC[-101])+RC[-1]+R[-1]C+R[-1]C[-1] -> 1.56186644773095E+30 | DS79: =FIB(RC[-101])+RC[-1]+R[-1]C+R[-1]C[-1] -> 1.13423232449539E+31 | DT79: =FIB(RC[-101])+RC[-1]+R[-1]C+R[-1]C[-1] -> 7.8917643969906E+31 | DU79: =FIB(RC[-101])+RC[-1]+R[-1]C+R[-1]C[-1] -> 5.27122647412882E+32 | DV79: =FIB(RC[-101])+RC[-1]+R[-1]C+R[-1]C[-1] -> 3.38609116396401E+33 | DW79: =FIB(RC[-101])+RC[-1]+R[-1]C+R[-1]C[-1] -> 2.09536299587566E+34 | DX79: =FIB(RC[-101])+RC[-1]+R[-1]C+R[-1]C[-1] -> 1.25102158288439E+35 | DY79: =FIB(RC[-101])+RC[-1]+R[-1]C+R[-1]C[-1] -> 7.21670959291834E+35 | DZ79: =FIB(RC[-101])+RC[-1]+R[-1]C+R[-1]C[-1] -> 4.02776555313428E+36 | EA79: =FIB(RC[-101])+RC[-1]+R[-1]C+R[-1]C[-1] -> 2.17762549887182E+37 | EB79: =FIB(RC[-101])+RC[-1]+R[-1]C+R[-1]C[-1] -> 1.14184032252348E+38 | EC79: =FIB(RC[-101])+RC[-1]+R[-1]C+R[-1]C[-1] -> 5.81311155258402E+38 | ED79: =FIB(RC[-101])+RC[-1]+R[-1]C+R[-1]C[-1] -> 2.87635576992861E+39 | EE79: =FIB(RC[-101])+RC[-1]+R[-1]C+R[-1]C[-1] -> 1.384620952948E+40 | EF79: =FIB(RC[-101])+RC[-1]+R[-1]C+R[-1]C[-1] -> 6.49043140658837E+40 | EG79: =FIB(RC[-101])+RC[-1]+R[-1]C+R[-1]C[-1] -> 2.96516517829876E+41 | EH79: =FIB(RC[-101])+RC[-1]+R[-1]C+R[-1]C[-1] -> 1.32134185420709E+42 | EI79: =FIB(RC[-101])+RC[-1]+R[-1]C+R[-1]C[-1] -> 5.74794163868997E+42 | EJ79: =FIB(RC[-101])+RC[-1]+R[-1]C+R[-1]C[-1] -> 2.44266109675434E+43 | EK79: =FIB(RC[-101])+RC[-1]+R[-1]C+R[-1]C[-1] -> 1.01478691145331E+44 | EL79: =FIB(RC[-101])+RC[-1]+R[-1]C+R[-1]C[-1] -> 4.12419974354114E+44 | EM79: =FIB(RC[-101])+RC[-1]+R[-1]C+R[-1]C[-1] -> 1.64072767406082E+45 | EN79: =FIB(RC[-101])+RC[-1]+R[-1]C+R[-1]C[-1] -> 6.39339264535864E+45 | EO79: =FIB(RC[-101])+RC[-1]+R[-1]C+R[-1]C[-1] -> 2.44162258024073E+46 | EP79: =FIB(RC[-101])+RC[-1]+R[-1]C+R[-1]C[-1] -> 9.14368161638606E+46 | EQ79: =FIB(RC[-101])+RC[-1]+R[-1]C+R[-1]C[-1] -> 3.35963267365966E+47 | ER79: =FIB(RC[-101])+RC[-1]+R[-1]C+R[-1]C[-1] -> 1.21175162808498E+48 | ES79: =FIB(RC[-101])+RC[-1]+R[-1]C+R[-1]C[-1] -> 4.29240164949048E+48 | ET79: =FIB(RC[-101])+RC[-1]+R[-1]C+R[-1]C[-1] -> 1.49402272881242E+49 | EU79: =FIB(RC[-101])+RC[-1]+R[-1]C+R[-1]C[-1] -> 5.11188673012106E+49 | EV79: =FIB(RC[-101])+RC[-1]+R[-1]C+R[-1]C[-1] -> 1.72013206484241E+50 | EW79: =FIB(RC[-101])+RC[-1]+R[-1]C+R[-1]C[-1] -> 5.69483377892068E+50 | EX79: =FIB(RC[-101])+RC[-1]+R[-1]C+R[-1]C[-1] -> 1.85572786917425E+51 | EY79: =FIB(RC[-101])+RC[-1]+R[-1]C+R[-1]C[-1] -> 5.95429434238216E+51 | EZ79: =FIB(RC[-101])+RC[-1]+R[-1]C+R[-1]C[-1] -> 1.88187912125347E+52 | FA79: =FIB(RC[-101])+RC[-1]+R[-1]C+R[-1]C[-1] -> 5.86077930214101E+52 | FB79: =FIB(RC[-101])+RC[-1]+R[-1]C+R[-1]C[-1] -> 1.79917119513392E+53 | FC79: =FIB(RC[-101])+RC[-1]+R[-1]C+R[-1]C[-1] -> 5.44614344238325E+53 | FD79: =FIB(RC[-101])+RC[-1]+R[-1]C+R[-1]C[-1] -> 1.62609567757956E+54 | FE79: =FIB(RC[-101])+RC[-1]+R[-1]C+R[-1]C[-1] -> 4.79048779483419E+54 | FF79: =FIB(RC[-101])+RC[-1]+R[-1]C+R[-1]C[-1] -> 1.39290544990777E+55 | FG79: =FIB(RC[-101])+RC[-1]+R[-1]C+R[-1]C[-1] -> 3.99851824490337E+55 | FH79: =FIB(RC[-101])+RC[-1]+R[-1]C+R[-1]C[-1] -> 1.13353571800652E+56 | FI79: =FIB(RC[-101])+RC[-1]+R[-1]C+R[-1]C[-1] -> 3.17430894796743E+56 | FJ79: =FIB(RC[-101])+RC[-1]+R[-1]C+R[-1]C[-1] -> 8.78327370435853E+56 | FK79: =FIB(RC[-101])+RC[-1]+R[-1]C+R[-1]C[-1] -> 2.40197583818511E+57 | FL79: =FIB(RC[-101])+RC[-1]+R[-1]C+R[-1]C[-1] -> 6.49372855289296E+57 | FM79: =FIB(RC[-101])+RC[-1]+R[-1]C+R[-1]C[-1] -> 1.73595259406264E+58 | FN79: =FIB(RC[-101])+RC[-1]+R[-1]C+R[-1]C[-1] -> 4.5898827743117E+58 | FO79: =FIB(RC[-101])+RC[-1]+R[-1]C+R[-1]C[-1] -> 1.20056046365323E+59 | FP79: =FIB(RC[-101])+RC[-1]+R[-1]C+R[-1]C[-1] -> 3.10728411568646E+59 | FQ79: =FIB(RC[-101])+RC[-1]+R[-1]C+R[-1]C[-1] -> 7.95949165391879E+59 | FR79: =FIB(RC[-101])+RC[-1]+R[-1]C+R[-1]C[-1] -> 2.01830773423928E+60 | FS79: =FIB(RC[-101])+RC[-1]+R[-1]C+R[-1]C[-1] -> 5.06727842363749E+60 | FT79: =FIB(RC[-101])+RC[-1]+R[-1]C+R[-1]C[-1] -> 1.25988997979306E+61 | FU79: =FIB(RC[-101])+RC[-1]+R[-1]C+R[-1]C[-1] -> 3.10272782901041E+61 | FV79: =FIB(RC[-101])+RC[-1]+R[-1]C+R[-1]C[-1] -> 7.56986893011567E+61 | FW79: =FIB(RC[-101])+RC[-1]+R[-1]C+R[-1]C[-1] -> 1.82997367289995E+62 | FX79: =FIB(RC[-101])+RC[-1]+R[-1]C+R[-1]C[-1] -> 4.38418790253411E+62 | FY79: =FIB(RC[-101])+RC[-1]+R[-1]C+R[-1]C[-1] -> 1.04110677607119E+63 | FZ79: =FIB(RC[-101])+RC[-1]+R[-1]C+R[-1]C[-1] -> 2.45095391436357E+63 | GA79: =FIB(RC[-101])+RC[-1]+R[-1]C+R[-1]C[-1] -> 5.72109040752253E+63 | GB79: =FIB(RC[-101])+RC[-1]+R[-1]C+R[-1]C[-1] -> 1.32432459633596E+64 | GC79: =FIB(RC[-101])+RC[-1]+R[-1]C+R[-1]C[-1] -> 3.04052395246647E+64 | GD79: =FIB(RC[-101])+RC[-1]+R[-1]C+R[-1]C[-1] -> 6.92477090152302E+64 | GE79: =FIB(RC[-101])+RC[-1]+R[-1]C+R[-1]C[-1] -> 1.564690194766E+65 | GF79: =FIB(RC[-101])+RC[-1]+R[-1]C+R[-1]C[-1] -> 3.50815391185472E+65 | GG79: =FIB(RC[-101])+RC[-1]+R[-1]C+R[-1]C[-1] -> 7.80577512620265E+65 | GH79: =FIB(RC[-101])+RC[-1]+R[-1]C+R[-1]C[-1] -> 1.72384745961464E+66 | GI79: =FIB(RC[-101])+RC[-1]+R[-1]C+R[-1]C[-1] -> 3.77906055314114E+66 | GJ79: =FIB(RC[-101])+RC[-1]+R[-1]C+R[-1]C[-1] -> 8.22482173855469E+66 | GK79: =FIB(RC[-101])+RC[-1]+R[-1]C+R[-1]C[-1] -> 1.77738209053145E+67 | GL79: =FIB(RC[-101])+RC[-1]+R[-1]C+R[-1]C[-1] -> 3.81416503449613E+67 | GM79: =FIB(RC[-101])+RC[-1]+R[-1]C+R[-1]C[-1] -> 8.12894090250337E+67 | GN79: =FIB(RC[-101])+RC[-1]+R[-1]C+R[-1]C[-1] -> 1.72081603677438E+68 | GO79: =FIB(RC[-101])+RC[-1]+R[-1]C+R[-1]C[-1] -> 3.618677670285E+68 | GP79: =FIB(RC[-101])+RC[-1]+R[-1]C+R[-1]C[-1] -> 7.56011065737203E+68 | GQ79: =FIB(RC[-101])+RC[-1]+R[-1]C+R[-1]C[-1] -> 1.56933582369903E+69 | GR79: =FIB(RC[-101])+RC[-1]+R[-1]C+R[-1]C[-1] -> 3.23711928043428E+69 | GS79: =FIB(RC[-101])+RC[-1]+R[-1]C+R[-1]C[-1] -> 6.63591973574387E+69
A80: 20 | B80: 20 | C80: 20 | D80: 20 | E80: 20 | F80: 20 | G80: 20 | H80: 20 | I80: 20 | J80: 20 | K80: 20 | L80: 20 | M80: 20 | N80: 20 | O80: 20 | P80: 20 | Q80: 20 | R80: 20 | S80: 20 | T80: 20 | U80: 20 | V80: 20 | W80: 20 | X80: 20 | Y80: 20 | Z80: 20 | AA80: 20 | AB80: 20 | AC80: 20 | AD80: 20 | AE80: 20 | AF80: 20 | AG80: 20 | AH80: 20 | AI80: 20 | AJ80: 20 | AK80: 20 | AL80: 20 | AM80: 20 | AN80: 20 | AO80: 20 | AP80: 20 | AQ80: 20 | AR80: 20 | AS80: 20 | AT80: 20 | AU80: 20 | AV80: 20 | AW80: 20 | AX80: 20 | AY80: 20 | AZ80: 20 | BA80: 20 | BB80: 20 | BC80: 20 | BD80: 20 | BE80: 20 | BF80: 20 | BG80: 20 | BH80: 20 | BI80: 20 | BJ80: 20 | BK80: 20 | BL80: 20 | BM80: 20 | BN80: 20 | BO80: 20 | BP80: 20 | BQ80: 20 | BR80: 20 | BS80: 20 | BT80: 20 | BU80: 20 | BV80: 20 | BW80: 20 | BX80: 20 | BY80: 20 | BZ80: 20 | CA80: 20 | CB80: 20 | CC80: 20 | CD80: 20 | CE80: 20 | CF80: 20 | CG80: 20 | CH80: 20 | CI80: 20 | CJ80: 20 | CK80: 20 | CL80: 20 | CM80: 20 | CN80: 20 | CO80: 20 | CP80: 20 | CQ80: 20 | CR80: 20 | CS80: 20 | CT80: 20 | CU80: 20 | CV80: 20 | CW80: 0 | CX80: =FIB(RC[-101])+RC[-1]+R[-1]C+R[-1]C[-1] -> 864734 | CY80: =FIB(RC[-101])+RC[-1]+R[-1]C+R[-1]C[-1] -> 69178720 | CZ80: =FIB(RC[-101])+RC[-1]+R[-1]C+R[-1]C[-1] -> 3667336894 | DA80: =FIB(RC[-101])+RC[-1]+R[-1]C+R[-1]C[-1] -> 145828741760 | DB80: =FIB(RC[-101])+RC[-1]+R[-1]C+R[-1]C[-1] -> 4640288030430 | DC80: =FIB(RC[-101])+RC[-1]+R[-1]C+R[-1]C[-1] -> 123089156901984 | DD80: =FIB(RC[-101])+RC[-1]+R[-1]C+R[-1]C[-1] -> 2.79985966806611E+15 | DE80: =FIB(RC[-101])+RC[-1]+R[-1]C+R[-1]C[-1] -> 5.57549139152113E+16 | DF80: =FIB(RC[-101])+RC[-1]+R[-1]C+R[-1]C[-1] -> 9.8749224331822E+17 | DG80: =FIB(RC[-101])+RC[-1]+R[-1]C+R[-1]C[-1] -> 1.57513060912835E+19 | DH80: =FIB(RC[-101])+RC[-1]+R[-1]C+R[-1]C[-1] -> 2.28575690086114E+20 | DI80: =FIB(RC[-101])+RC[-1]+R[-1]C+R[-1]C[-1] -> 3.04306659089136E+21 | DJ80: =FIB(RC[-101])+RC[-1]+R[-1]C+R[-1]C[-1] -> 3.74300381717507E+22 | DK80: =FIB(RC[-101])+RC[-1]+R[-1]C+R[-1]C[-1] -> 4.27923995356425E+23 | DL80: =FIB(RC[-101])+RC[-1]+R[-1]C+R[-1]C[-1] -> 4.57092905307174E+24 | DM80: =FIB(RC[-101])+RC[-1]+R[-1]C+R[-1]C[-1] -> 4.58247862105471E+25 | DN80: =FIB(RC[-101])+RC[-1]+R[-1]C+R[-1]C[-1] -> 4.32898580725066E+26 | DO80: =FIB(RC[-101])+RC[-1]+R[-1]C+R[-1]C[-1] -> 3.86721642782583E+27 | DP80: =FIB(RC[-101])+RC[-1]+R[-1]C+R[-1]C[-1] -> 3.27726098145978E+28 | DQ80: =FIB(RC[-101])+RC[-1]+R[-1]C+R[-1]C[-1] -> 2.64216103632487E+29 | DR80: =FIB(RC[-101])+RC[-1]+R[-1]C+R[-1]C[-1] -> 2.03170536542178E+30 | DS80: =FIB(RC[-101])+RC[-1]+R[-1]C+R[-1]C[-1] -> 1.49358950581066E+31 | DT80: =FIB(RC[-101])+RC[-1]+R[-1]C+R[-1]C[-1] -> 1.05195862272966E+32 | DU80: =FIB(RC[-101])+RC[-1]+R[-1]C+R[-1]C[-1] -> 7.11236153655755E+32 | DV80: =FIB(RC[-101])+RC[-1]+R[-1]C+R[-1]C[-1] -> 4.62444996503265E+33 | DW80: =FIB(RC[-101])+RC[-1]+R[-1]C+R[-1]C[-1] -> 2.89641710877533E+34 | DX80: =FIB(RC[-101])+RC[-1]+R[-1]C+R[-1]C[-1] -> 1.75019959334949E+35 | DY80: =FIB(RC[-101])+RC[-1]+R[-1]C+R[-1]C[-1] -> 1.02179307691522E+36 | DZ80: =FIB(RC[-101])+RC[-1]+R[-1]C+R[-1]C[-1] -> 5.77122958934134E+36 | EA80: =FIB(RC[-101])+RC[-1]+R[-1]C+R[-1]C[-1] -> 3.15752501311938E+37 | EB80: =FIB(RC[-101])+RC[-1]+R[-1]C+R[-1]C[-1] -> 1.6753553737226E+38 | EC80: =FIB(RC[-101])+RC[-1]+R[-1]C+R[-1]C[-1] -> 8.6303072488301E+38 | ED80: =FIB(RC[-101])+RC[-1]+R[-1]C+R[-1]C[-1] -> 4.32069765007003E+39 | EE80: =FIB(RC[-101])+RC[-1]+R[-1]C+R[-1]C[-1] -> 2.10432629494786E+40 | EF80: =FIB(RC[-101])+RC[-1]+R[-1]C+R[-1]C[-1] -> 9.97937865448424E+40 | EG80: =FIB(RC[-101])+RC[-1]+R[-1]C+R[-1]C[-1] -> 4.61214618440602E+41 | EH80: =FIB(RC[-101])+RC[-1]+R[-1]C+R[-1]C[-1] -> 2.07907299047757E+42 | EI80: =FIB(RC[-101])+RC[-1]+R[-1]C+R[-1]C[-1] -> 9.14835648337463E+42 | EJ80: =FIB(RC[-101])+RC[-1]+R[-1]C+R[-1]C[-1] -> 3.9322909089608E+43 | EK80: =FIB(RC[-101])+RC[-1]+R[-1]C+R[-1]C[-1] -> 1.65228211202482E+44 | EL80: =FIB(RC[-101])+RC[-1]+R[-1]C+R[-1]C[-1] -> 6.79126876701927E+44 | EM80: =FIB(RC[-101])+RC[-1]+R[-1]C+R[-1]C[-1] -> 2.73227452511686E+45 | EN80: =FIB(RC[-101])+RC[-1]+R[-1]C+R[-1]C[-1] -> 1.07663948445363E+46 | EO80: =FIB(RC[-101])+RC[-1]+R[-1]C+R[-1]C[-1] -> 4.15760132923023E+46 | EP80: =FIB(RC[-101])+RC[-1]+R[-1]C+R[-1]C[-1] -> 1.5742905525857E+47 | EQ80: =FIB(RC[-101])+RC[-1]+R[-1]C+R[-1]C[-1] -> 5.84829138788397E+47 | ER80: =FIB(RC[-101])+RC[-1]+R[-1]C+R[-1]C[-1] -> 2.13254403423935E+48 | ES80: =FIB(RC[-101])+RC[-1]+R[-1]C+R[-1]C[-1] -> 7.63669731181481E+48 | ET80: =FIB(RC[-101])+RC[-1]+R[-1]C+R[-1]C[-1] -> 2.68693262494295E+49 | EU80: =FIB(RC[-101])+RC[-1]+R[-1]C+R[-1]C[-1] -> 9.29284208387642E+49 | EV80: =FIB(RC[-101])+RC[-1]+R[-1]C+R[-1]C[-1] -> 3.16060494624215E+50 | EW80: =FIB(RC[-101])+RC[-1]+R[-1]C+R[-1]C[-1] -> 1.05755707900052E+51 | EX80: =FIB(RC[-101])+RC[-1]+R[-1]C+R[-1]C[-1] -> 3.48276832606684E+51 | EY80: =FIB(RC[-101])+RC[-1]+R[-1]C+R[-1]C[-1] -> 1.12927905376232E+52 | EZ80: =FIB(RC[-101])+RC[-1]+R[-1]C+R[-1]C[-1] -> 3.60658760925401E+52 | FA80: =FIB(RC[-101])+RC[-1]+R[-1]C+R[-1]C[-1] -> 1.13492460326485E+53 | FB80: =FIB(RC[-101])+RC[-1]+R[-1]C+R[-1]C[-1] -> 3.52017372861287E+53 | FC80: =FIB(RC[-101])+RC[-1]+R[-1]C+R[-1]C[-1] -> 1.076548836613E+54 | FD80: =FIB(RC[-101])+RC[-1]+R[-1]C+R[-1]C[-1] -> 3.24725885843088E+54 | FE80: =FIB(RC[-101])+RC[-1]+R[-1]C+R[-1]C[-1] -> 9.66384233084463E+54 | FF80: =FIB(RC[-101])+RC[-1]+R[-1]C+R[-1]C[-1] -> 2.83833846247565E+55 | FG80: =FIB(RC[-101])+RC[-1]+R[-1]C+R[-1]C[-1] -> 8.2297621572868E+55 | FH80: =FIB(RC[-101])+RC[-1]+R[-1]C+R[-1]C[-1] -> 2.35636375822554E+56 | FI80: =FIB(RC[-101])+RC[-1]+R[-1]C+R[-1]C[-1] -> 6.6642084241995E+56 | FJ80: =FIB(RC[-101])+RC[-1]+R[-1]C+R[-1]C[-1] -> 1.86217910765255E+57 | FK80: =FIB(RC[-101])+RC[-1]+R[-1]C+R[-1]C[-1] -> 5.14248231627351E+57 | FL80: =FIB(RC[-101])+RC[-1]+R[-1]C+R[-1]C[-1] -> 1.40381867073516E+58 | FM80: =FIB(RC[-101])+RC[-1]+R[-1]C+R[-1]C[-1] -> 3.7891441200871E+58 | FN80: =FIB(RC[-101])+RC[-1]+R[-1]C+R[-1]C[-1] -> 1.01149794884614E+59 | FO80: =FIB(RC[-101])+RC[-1]+R[-1]C+R[-1]C[-1] -> 2.67104668993054E+59 | FP80: =FIB(RC[-101])+RC[-1]+R[-1]C+R[-1]C[-1] -> 6.97889126927022E+59 | FQ80: =FIB(RC[-101])+RC[-1]+R[-1]C+R[-1]C[-1] -> 1.80456670388755E+60 | FR80: =FIB(RC[-101])+RC[-1]+R[-1]C+R[-1]C[-1] -> 4.61882360351871E+60 | FS80: =FIB(RC[-101])+RC[-1]+R[-1]C+R[-1]C[-1] -> 1.17044097613955E+61 | FT80: =FIB(RC[-101])+RC[-1]+R[-1]C+R[-1]C[-1] -> 2.93705879829635E+61 | FU80: =FIB(RC[-101])+RC[-1]+R[-1]C+R[-1]C[-1] -> 7.29967660709982E+61 | FV80: =FIB(RC[-101])+RC[-1]+R[-1]C+R[-1]C[-1] -> 1.79722733662259E+62 | FW80: =FIB(RC[-101])+RC[-1]+R[-1]C+R[-1]C[-1] -> 4.38418790253411E+62 | FX80: =FIB(RC[-101])+RC[-1]+R[-1]C+R[-1]C[-1] -> 1.05983494779682E+63 | FY80: =FIB(RC[-101])+RC[-1]+R[-1]C+R[-1]C[-1] -> 2.53936051412142E+63 | FZ80: =FIB(RC[-101])+RC[-1]+R[-1]C+R[-1]C[-1] -> 6.03142120455618E+63 | GA80: =FIB(RC[-101])+RC[-1]+R[-1]C+R[-1]C[-1] -> 1.42034655264423E+64 | GB80: =FIB(RC[-101])+RC[-1]+R[-1]C+R[-1]C[-1] -> 3.31678018973245E+64 | GC80: =FIB(RC[-101])+RC[-1]+R[-1]C+R[-1]C[-1] -> 7.68162873853488E+64 | GD80: =FIB(RC[-101])+RC[-1]+R[-1]C+R[-1]C[-1] -> 1.76469235925244E+65 | GE80: =FIB(RC[-101])+RC[-1]+R[-1]C+R[-1]C[-1] -> 4.02185964417074E+65 | GF80: =FIB(RC[-101])+RC[-1]+R[-1]C+R[-1]C[-1] -> 9.09470375079147E+65 | GG80: =FIB(RC[-101])+RC[-1]+R[-1]C+R[-1]C[-1] -> 2.04086327888488E+66 | GH80: =FIB(RC[-101])+RC[-1]+R[-1]C+R[-1]C[-1] -> 4.54528825111979E+66 | GI80: =FIB(RC[-101])+RC[-1]+R[-1]C+R[-1]C[-1] -> 1.00481962638756E+67 | GJ80: =FIB(RC[-101])+RC[-1]+R[-1]C+R[-1]C[-1] -> 2.20520785555714E+67 | GK80: =FIB(RC[-101])+RC[-1]+R[-1]C+R[-1]C[-1] -> 4.80507211994405E+67 | GL80: =FIB(RC[-101])+RC[-1]+R[-1]C+R[-1]C[-1] -> 1.03966192449716E+68 | GM80: =FIB(RC[-101])+RC[-1]+R[-1]C+R[-1]C[-1] -> 2.23397251819711E+68 | GN80: =FIB(RC[-101])+RC[-1]+R[-1]C+R[-1]C[-1] -> 4.76768264522183E+68 | GO80: =FIB(RC[-101])+RC[-1]+R[-1]C+R[-1]C[-1] -> 1.01071763522812E+69 | GP80: =FIB(RC[-101])+RC[-1]+R[-1]C+R[-1]C[-1] -> 2.12859646799383E+69 | GQ80: =FIB(RC[-101])+RC[-1]+R[-1]C+R[-1]C[-1] -> 4.45394335743006E+69 | GR80: =FIB(RC[-101])+RC[-1]+R[-1]C+R[-1]C[-1] -> 9.26039846156338E+69 | GS80: =FIB(RC[-101])+RC[-1]+R[-1]C+R[-1]C[-1] -> 1.91334374777415E+70
A81: 20 | B81: 20 | C81: 20 | D81: 20 | E81: 20 | F81: 20 | G81: 20 | H81: 20 | I81: 20 | J81: 20 | K81: 20 | L81: 20 | M81: 20 | N81: 20 | O81: 20 | P81: 20 | Q81: 20 | R81: 20 | S81: 20 | T81: 20 | U81: 20 | V81: 20 | W81: 20 | X81: 20 | Y81: 20 | Z81: 20 | AA81: 20 | AB81: 20 | AC81: 20 | AD81: 20 | AE81: 20 | AF81: 20 | AG81: 20 | AH81: 20 | AI81: 20 | AJ81: 20 | AK81: 20 | AL81: 20 | AM81: 20 | AN81: 20 | AO81: 20 | AP81: 20 | AQ81: 20 | AR81: 20 | AS81: 20 | AT81: 20 | AU81: 20 | AV81: 20 | AW81: 20 | AX81: 20 | AY81: 20 | AZ81: 20 | BA81: 20 | BB81: 20 | BC81: 20 | BD81: 20 | BE81: 20 | BF81: 20 | BG81: 20 | BH81: 20 | BI81: 20 | BJ81: 20 | BK81: 20 | BL81: 20 | BM81: 20 | BN81: 20 | BO81: 20 | BP81: 20 | BQ81: 20 | BR81: 20 | BS81: 20 | BT81: 20 | BU81: 20 | BV81: 20 | BW81: 20 | BX81: 20 | BY81: 20 | BZ81: 20 | CA81: 20 | CB81: 20 | CC81: 20 | CD81: 20 | CE81: 20 | CF81: 20 | CG81: 20 | CH81: 20 | CI81: 20 | CJ81: 20 | CK81: 20 | CL81: 20 | CM81: 20 | CN81: 20 | CO81: 20 | CP81: 20 | CQ81: 20 | CR81: 20 | CS81: 20 | CT81: 20 | CU81: 20 | CV81: 20 | CW81: 0 | CX81: =FIB(RC[-101])+RC[-1]+R[-1]C+R[-1]C[-1] -> 875680 | CY81: =FIB(RC[-101])+RC[-1]+R[-1]C+R[-1]C[-1] -> 70930080 | CZ81: =FIB(RC[-101])+RC[-1]+R[-1]C+R[-1]C[-1] -> 3807456640 | DA81: =FIB(RC[-101])+RC[-1]+R[-1]C+R[-1]C[-1] -> 153303546240 | DB81: =FIB(RC[-101])+RC[-1]+R[-1]C+R[-1]C[-1] -> 4939420329376 | DC81: =FIB(RC[-101])+RC[-1]+R[-1]C+R[-1]C[-1] -> 132668865272736 | DD81: =FIB(RC[-101])+RC[-1]+R[-1]C+R[-1]C[-1] -> 3.05561769025178E+15 | DE81: =FIB(RC[-101])+RC[-1]+R[-1]C+R[-1]C[-1] -> 6.16103912735401E+16 | DF81: =FIB(RC[-101])+RC[-1]+R[-1]C+R[-1]C[-1] -> 1.10485754850698E+18 | DG81: =FIB(RC[-101])+RC[-1]+R[-1]C+R[-1]C[-1] -> 1.78436558831087E+19 | DH81: =FIB(RC[-101])+RC[-1]+R[-1]C+R[-1]C[-1] -> 2.62170652060506E+20 | DI81: =FIB(RC[-101])+RC[-1]+R[-1]C+R[-1]C[-1] -> 3.53381293303798E+21 | DJ81: =FIB(RC[-101])+RC[-1]+R[-1]C+R[-1]C[-1] -> 4.400691769568E+22 | DK81: =FIB(RC[-101])+RC[-1]+R[-1]C+R[-1]C[-1] -> 5.09360951223856E+23 | DL81: =FIB(RC[-101])+RC[-1]+R[-1]C+R[-1]C[-1] -> 5.50821399965202E+24 | DM81: =FIB(RC[-101])+RC[-1]+R[-1]C+R[-1]C[-1] -> 5.59039292632708E+25 | DN81: =FIB(RC[-101])+RC[-1]+R[-1]C+R[-1]C[-1] -> 5.34627296198884E+26 | DO81: =FIB(RC[-101])+RC[-1]+R[-1]C+R[-1]C[-1] -> 4.83474230474978E+27 | DP81: =FIB(RC[-101])+RC[-1]+R[-1]C+R[-1]C[-1] -> 4.14745685471734E+28 | DQ81: =FIB(RC[-101])+RC[-1]+R[-1]C+R[-1]C[-1] -> 3.38463281994258E+29 | DR81: =FIB(RC[-101])+RC[-1]+R[-1]C+R[-1]C[-1] -> 2.63438475104852E+30 | DS81: =FIB(RC[-101])+RC[-1]+R[-1]C+R[-1]C[-1] -> 1.96019851745769E+31 | DT81: =FIB(RC[-101])+RC[-1]+R[-1]C+R[-1]C[-1] -> 1.3973374250565E+32 | DU81: =FIB(RC[-101])+RC[-1]+R[-1]C+R[-1]C[-1] -> 9.56165758434371E+32 | DV81: =FIB(RC[-101])+RC[-1]+R[-1]C+R[-1]C[-1] -> 6.29185187712277E+33 | DW81: =FIB(RC[-101])+RC[-1]+R[-1]C+R[-1]C[-1] -> 3.98804729299087E+34 | DX81: =FIB(RC[-101])+RC[-1]+R[-1]C+R[-1]C[-1] -> 2.43864603352611E+35 | DY81: =FIB(RC[-101])+RC[-1]+R[-1]C+R[-1]C[-1] -> 1.44067763960278E+36 | DZ81: =FIB(RC[-101])+RC[-1]+R[-1]C+R[-1]C[-1] -> 8.23370030585934E+36 | EA81: =FIB(RC[-101])+RC[-1]+R[-1]C+R[-1]C[-1] -> 4.55801800263945E+37 | EB81: =FIB(RC[-101])+RC[-1]+R[-1]C+R[-1]C[-1] -> 2.44690967529848E+38 | EC81: =FIB(RC[-101])+RC[-1]+R[-1]C+R[-1]C[-1] -> 1.27525722978512E+39 | ED81: =FIB(RC[-101])+RC[-1]+R[-1]C+R[-1]C[-1] -> 6.45898560473815E+39 | EE81: =FIB(RC[-101])+RC[-1]+R[-1]C+R[-1]C[-1] -> 3.18229462042868E+40 | EF81: =FIB(RC[-101])+RC[-1]+R[-1]C+R[-1]C[-1] -> 1.52659995698608E+41 | EG81: =FIB(RC[-101])+RC[-1]+R[-1]C+R[-1]C[-1] -> 7.13668400684053E+41 | EH81: =FIB(RC[-101])+RC[-1]+R[-1]C+R[-1]C[-1] -> 3.25395600960223E+42 | EI81: =FIB(RC[-101])+RC[-1]+R[-1]C+R[-1]C[-1] -> 1.44813854834544E+43 | EJ81: =FIB(RC[-101])+RC[-1]+R[-1]C+R[-1]C[-1] -> 6.29526510564371E+43 | EK81: =FIB(RC[-101])+RC[-1]+R[-1]C+R[-1]C[-1] -> 2.67503771348527E+44 | EL81: =FIB(RC[-101])+RC[-1]+R[-1]C+R[-1]C[-1] -> 1.11185885925294E+45 | EM81: =FIB(RC[-101])+RC[-1]+R[-1]C+R[-1]C[-1] -> 4.52326026107172E+45 | EN81: =FIB(RC[-101])+RC[-1]+R[-1]C+R[-1]C[-1] -> 1.80219296307249E+46 | EO81: =FIB(RC[-101])+RC[-1]+R[-1]C+R[-1]C[-1] -> 7.03643377675635E+46 | EP81: =FIB(RC[-101])+RC[-1]+R[-1]C+R[-1]C[-1] -> 2.69369406318436E+47 | EQ81: =FIB(RC[-101])+RC[-1]+R[-1]C+R[-1]C[-1] -> 1.0116276003654E+48 | ER81: =FIB(RC[-101])+RC[-1]+R[-1]C+R[-1]C[-1] -> 3.72900077339315E+48 | ES81: =FIB(RC[-101])+RC[-1]+R[-1]C+R[-1]C[-1] -> 1.34982421194473E+49 | ET81: =FIB(RC[-101])+RC[-1]+R[-1]C+R[-1]C[-1] -> 4.80042656806916E+49 | EU81: =FIB(RC[-101])+RC[-1]+R[-1]C+R[-1]C[-1] -> 1.67802012768885E+50 | EV81: =FIB(RC[-101])+RC[-1]+R[-1]C+R[-1]C[-1] -> 5.76790928231865E+50 | EW81: =FIB(RC[-101])+RC[-1]+R[-1]C+R[-1]C[-1] -> 1.9504085018566E+51 | EX81: =FIB(RC[-101])+RC[-1]+R[-1]C+R[-1]C[-1] -> 6.49073390692397E+51 | EY81: =FIB(RC[-101])+RC[-1]+R[-1]C+R[-1]C[-1] -> 2.12662927706141E+52 | EZ81: =FIB(RC[-101])+RC[-1]+R[-1]C+R[-1]C[-1] -> 6.86249594007774E+52 | FA81: =FIB(RC[-101])+RC[-1]+R[-1]C+R[-1]C[-1] -> 2.18183295819802E+53 | FB81: =FIB(RC[-101])+RC[-1]+R[-1]C+R[-1]C[-1] -> 6.83693129007574E+53 | FC81: =FIB(RC[-101])+RC[-1]+R[-1]C+R[-1]C[-1] -> 2.11225933848186E+54 | FD81: =FIB(RC[-101])+RC[-1]+R[-1]C+R[-1]C[-1] -> 6.43606703352575E+54 | FE81: =FIB(RC[-101])+RC[-1]+R[-1]C+R[-1]C[-1] -> 1.93471682228013E+55 | FF81: =FIB(RC[-101])+RC[-1]+R[-1]C+R[-1]C[-1] -> 5.73943951784024E+55 | FG81: =FIB(RC[-101])+RC[-1]+R[-1]C+R[-1]C[-1] -> 1.68075401376027E+56 | FH81: =FIB(RC[-101])+RC[-1]+R[-1]C+R[-1]C[-1] -> 4.86009398771449E+56 | FI81: =FIB(RC[-101])+RC[-1]+R[-1]C+R[-1]C[-1] -> 1.38806661701395E+57 | FJ81: =FIB(RC[-101])+RC[-1]+R[-1]C+R[-1]C[-1] -> 3.91666656708645E+57 | FK81: =FIB(RC[-101])+RC[-1]+R[-1]C+R[-1]C[-1] -> 1.09213279910125E+58 | FL81: =FIB(RC[-101])+RC[-1]+R[-1]C+R[-1]C[-1] -> 3.01019970146376E+58 | FM81: =FIB(RC[-101])+RC[-1]+R[-1]C+R[-1]C[-1] -> 8.20316249228601E+58 | FN81: =FIB(RC[-101])+RC[-1]+R[-1]C+R[-1]C[-1] -> 2.21072861008345E+59 | FO81: =FIB(RC[-101])+RC[-1]+R[-1]C+R[-1]C[-1] -> 5.89327324886014E+59 | FP81: =FIB(RC[-101])+RC[-1]+R[-1]C+R[-1]C[-1] -> 1.55432112080609E+60 | FQ81: =FIB(RC[-101])+RC[-1]+R[-1]C+R[-1]C[-1] -> 4.05677695162066E+60 | FR81: =FIB(RC[-101])+RC[-1]+R[-1]C+R[-1]C[-1] -> 1.04801672590269E+61 | FS81: =FIB(RC[-101])+RC[-1]+R[-1]C+R[-1]C[-1] -> 2.68034006239411E+61 | FT81: =FIB(RC[-101])+RC[-1]+R[-1]C+R[-1]C[-1] -> 6.78783983683001E+61 | FU81: =FIB(RC[-101])+RC[-1]+R[-1]C+R[-1]C[-1] -> 1.70245752422262E+62 | FV81: =FIB(RC[-101])+RC[-1]+R[-1]C+R[-1]C[-1] -> 4.22965252155519E+62 | FW81: =FIB(RC[-101])+RC[-1]+R[-1]C+R[-1]C[-1] -> 1.04110677607119E+63 | FX81: =FIB(RC[-101])+RC[-1]+R[-1]C+R[-1]C[-1] -> 2.53936051412142E+63 | FY81: =FIB(RC[-101])+RC[-1]+R[-1]C+R[-1]C[-1] -> 6.13855597603965E+63 | FZ81: =FIB(RC[-101])+RC[-1]+R[-1]C+R[-1]C[-1] -> 1.47093376947172E+64 | GA81: =FIB(RC[-101])+RC[-1]+R[-1]C+R[-1]C[-1] -> 3.49442244257157E+64 | GB81: =FIB(RC[-101])+RC[-1]+R[-1]C+R[-1]C[-1] -> 8.23154918494824E+64 | GC81: =FIB(RC[-101])+RC[-1]+R[-1]C+R[-1]C[-1] -> 1.92299581132156E+65 | GD81: =FIB(RC[-101])+RC[-1]+R[-1]C+R[-1]C[-1] -> 4.45585104442748E+65 | GE81: =FIB(RC[-101])+RC[-1]+R[-1]C+R[-1]C[-1] -> 1.02424030478507E+66 | GF81: =FIB(RC[-101])+RC[-1]+R[-1]C+R[-1]C[-1] -> 2.33589664428129E+66 | GG81: =FIB(RC[-101])+RC[-1]+R[-1]C+R[-1]C[-1] -> 5.28623029824532E+66 | GH81: =FIB(RC[-101])+RC[-1]+R[-1]C+R[-1]C[-1] -> 1.187238182825E+67 | GI81: =FIB(RC[-101])+RC[-1]+R[-1]C+R[-1]C[-1] -> 2.64658663432454E+67 | GJ81: =FIB(RC[-101])+RC[-1]+R[-1]C+R[-1]C[-1] -> 5.85661411626923E+67 | GK81: =FIB(RC[-101])+RC[-1]+R[-1]C+R[-1]C[-1] -> 1.28668940917704E+68 | GL81: =FIB(RC[-101])+RC[-1]+R[-1]C+R[-1]C[-1] -> 2.80685854566861E+68 | GM81: =FIB(RC[-101])+RC[-1]+R[-1]C+R[-1]C[-1] -> 6.08049298836289E+68 | GN81: =FIB(RC[-101])+RC[-1]+R[-1]C+R[-1]C[-1] -> 1.30821481517818E+69 | GO81: =FIB(RC[-101])+RC[-1]+R[-1]C+R[-1]C[-1] -> 2.79570071492849E+69 | GP81: =FIB(RC[-101])+RC[-1]+R[-1]C+R[-1]C[-1] -> 5.93501481815044E+69 | GQ81: =FIB(RC[-101])+RC[-1]+R[-1]C+R[-1]C[-1] -> 1.25175546435743E+70 | GR81: =FIB(RC[-101])+RC[-1]+R[-1]C+R[-1]C[-1] -> 2.62318964625678E+70 | GS81: =FIB(RC[-101])+RC[-1]+R[-1]C+R[-1]C[-1] -> 5.46257324018727E+70
A82: 20 | B82: 20 | C82: 20 | D82: 20 | E82: 20 | F82: 20 | G82: 20 | H82: 20 | I82: 20 | J82: 20 | K82: 20 | L82: 20 | M82: 20 | N82: 20 | O82: 20 | P82: 20 | Q82: 20 | R82: 20 | S82: 20 | T82: 20 | U82: 20 | V82: 20 | W82: 20 | X82: 20 | Y82: 20 | Z82: 20 | AA82: 20 | AB82: 20 | AC82: 20 | AD82: 20 | AE82: 20 | AF82: 20 | AG82: 20 | AH82: 20 | AI82: 20 | AJ82: 20 | AK82: 20 | AL82: 20 | AM82: 20 | AN82: 20 | AO82: 20 | AP82: 20 | AQ82: 20 | AR82: 20 | AS82: 20 | AT82: 20 | AU82: 20 | AV82: 20 | AW82: 20 | AX82: 20 | AY82: 20 | AZ82: 20 | BA82: 20 | BB82: 20 | BC82: 20 | BD82: 20 | BE82: 20 | BF82: 20 | BG82: 20 | BH82: 20 | BI82: 20 | BJ82: 20 | BK82: 20 | BL82: 20 | BM82: 20 | BN82: 20 | BO82: 20 | BP82: 20 | BQ82: 20 | BR82: 20 | BS82: 20 | BT82: 20 | BU82: 20 | BV82: 20 | BW82: 20 | BX82: 20 | BY82: 20 | BZ82: 20 | CA82: 20 | CB82: 20 | CC82: 20 | CD82: 20 | CE82: 20 | CF82: 20 | CG82: 20 | CH82: 20 | CI82: 20 | CJ82: 20 | CK82: 20 | CL82: 20 | CM82: 20 | CN82: 20 | CO82: 20 | CP82: 20 | CQ82: 20 | CR82: 20 | CS82: 20 | CT82: 20 | CU82: 20 | CV82: 20 | CW82: 0 | CX82: =FIB(RC[-101])+RC[-1]+R[-1]C+R[-1]C[-1] -> 886626 | CY82: =FIB(RC[-101])+RC[-1]+R[-1]C+R[-1]C[-1] -> 72703332 | CZ82: =FIB(RC[-101])+RC[-1]+R[-1]C+R[-1]C[-1] -> 3951100998 | DA82: =FIB(RC[-101])+RC[-1]+R[-1]C+R[-1]C[-1] -> 161062114824 | DB82: =FIB(RC[-101])+RC[-1]+R[-1]C+R[-1]C[-1] -> 5253786001386 | DC82: =FIB(RC[-101])+RC[-1]+R[-1]C+R[-1]C[-1] -> 142862071614444 | DD82: =FIB(RC[-101])+RC[-1]+R[-1]C+R[-1]C[-1] -> 3.3311486271499E+15 | DE82: =FIB(RC[-101])+RC[-1]+R[-1]C+R[-1]C[-1] -> 6.79971575909527E+16 | DF82: =FIB(RC[-101])+RC[-1]+R[-1]C+R[-1]C[-1] -> 1.23446509737149E+18 | DG82: =FIB(RC[-101])+RC[-1]+R[-1]C+R[-1]C[-1] -> 2.01829785289872E+19 | DH82: =FIB(RC[-101])+RC[-1]+R[-1]C+R[-1]C[-1] -> 3.00197286472602E+20 | DI82: =FIB(RC[-101])+RC[-1]+R[-1]C+R[-1]C[-1] -> 4.09618087157109E+21 | DJ82: =FIB(RC[-101])+RC[-1]+R[-1]C+R[-1]C[-1] -> 5.16369115002891E+22 | DK82: =FIB(RC[-101])+RC[-1]+R[-1]C+R[-1]C[-1] -> 6.05004780419825E+23 | DL82: =FIB(RC[-101])+RC[-1]+R[-1]C+R[-1]C[-1] -> 6.6225797312957E+24 | DM82: =FIB(RC[-101])+RC[-1]+R[-1]C+R[-1]C[-1] -> 6.80347229942185E+25 | DN82: =FIB(RC[-101])+RC[-1]+R[-1]C+R[-1]C[-1] -> 6.58565948456374E+26 | DO82: =FIB(RC[-101])+RC[-1]+R[-1]C+R[-1]C[-1] -> 6.02793554940503E+27 | DP82: =FIB(RC[-101])+RC[-1]+R[-1]C+R[-1]C[-1] -> 5.23372464013282E+28 | DQ82: =FIB(RC[-101])+RC[-1]+R[-1]C+R[-1]C[-1] -> 4.32275096942759E+29 | DR82: =FIB(RC[-101])+RC[-1]+R[-1]C+R[-1]C[-1] -> 3.40512312998554E+30 | DS82: =FIB(RC[-101])+RC[-1]+R[-1]C+R[-1]C[-1] -> 2.56414930556109E+31 | DT82: =FIB(RC[-101])+RC[-1]+R[-1]C+R[-1]C[-1] -> 1.84977220735838E+32 | DU82: =FIB(RC[-101])+RC[-1]+R[-1]C+R[-1]C[-1] -> 1.28087672167586E+33 | DV82: =FIB(RC[-101])+RC[-1]+R[-1]C+R[-1]C[-1] -> 8.528894357233E+33 | DW82: =FIB(RC[-101])+RC[-1]+R[-1]C+R[-1]C[-1] -> 5.47012191642645E+34 | DX82: =FIB(RC[-101])+RC[-1]+R[-1]C+R[-1]C[-1] -> 3.38446295446784E+35 | DY82: =FIB(RC[-101])+RC[-1]+R[-1]C+R[-1]C[-1] -> 2.02298853840218E+36 | DZ82: =FIB(RC[-101])+RC[-1]+R[-1]C+R[-1]C[-1] -> 1.16973664838643E+37 | EA82: =FIB(RC[-101])+RC[-1]+R[-1]C+R[-1]C[-1] -> 6.55112468161181E+37 | EB82: =FIB(RC[-101])+RC[-1]+R[-1]C+R[-1]C[-1] -> 3.55782394372361E+38 | EC82: =FIB(RC[-101])+RC[-1]+R[-1]C+R[-1]C[-1] -> 1.87573059168733E+39 | ED82: =FIB(RC[-101])+RC[-1]+R[-1]C+R[-1]C[-1] -> 9.6099734262106E+39 | EE82: =FIB(RC[-101])+RC[-1]+R[-1]C+R[-1]C[-1] -> 4.78919052352356E+40 | EF82: =FIB(RC[-101])+RC[-1]+R[-1]C+R[-1]C[-1] -> 2.3237484713813E+41 | EG82: =FIB(RC[-101])+RC[-1]+R[-1]C+R[-1]C[-1] -> 1.09870324352079E+42 | EH82: =FIB(RC[-101])+RC[-1]+R[-1]C+R[-1]C[-1] -> 5.06632765380707E+42 | EI82: =FIB(RC[-101])+RC[-1]+R[-1]C+R[-1]C[-1] -> 2.28016691468637E+43 | EJ82: =FIB(RC[-101])+RC[-1]+R[-1]C+R[-1]C[-1] -> 1.00235705686755E+44 | EK82: =FIB(RC[-101])+RC[-1]+R[-1]C+R[-1]C[-1] -> 4.3069212809172E+44 | EL82: =FIB(RC[-101])+RC[-1]+R[-1]C+R[-1]C[-1] -> 1.81005475869318E+45 | EM82: =FIB(RC[-101])+RC[-1]+R[-1]C+R[-1]C[-1] -> 7.44517387901785E+45 | EN82: =FIB(RC[-101])+RC[-1]+R[-1]C+R[-1]C[-1] -> 2.99903637708145E+46 | EO82: =FIB(RC[-101])+RC[-1]+R[-1]C+R[-1]C[-1] -> 1.18376631169103E+47 | EP82: =FIB(RC[-101])+RC[-1]+R[-1]C+R[-1]C[-1] -> 4.58110375255102E+47 | EQ82: =FIB(RC[-101])+RC[-1]+R[-1]C+R[-1]C[-1] -> 1.73910738193894E+48 | ER82: =FIB(RC[-101])+RC[-1]+R[-1]C+R[-1]C[-1] -> 6.47973575569749E+48 | ES82: =FIB(RC[-101])+RC[-1]+R[-1]C+R[-1]C[-1] -> 2.37069786485379E+49 | ET82: =FIB(RC[-101])+RC[-1]+R[-1]C+R[-1]C[-1] -> 8.52094864486769E+49 | EU82: =FIB(RC[-101])+RC[-1]+R[-1]C+R[-1]C[-1] -> 3.01015764898254E+50 | EV82: =FIB(RC[-101])+RC[-1]+R[-1]C+R[-1]C[-1] -> 1.045608705899E+51 | EW82: =FIB(RC[-101])+RC[-1]+R[-1]C+R[-1]C[-1] -> 3.57280813598747E+51 | EX82: =FIB(RC[-101])+RC[-1]+R[-1]C+R[-1]C[-1] -> 1.2013950544768E+52 | EY82: =FIB(RC[-101])+RC[-1]+R[-1]C+R[-1]C[-1] -> 3.97709772223061E+52 | EZ82: =FIB(RC[-101])+RC[-1]+R[-1]C+R[-1]C[-1] -> 1.29662229393698E+53 | FA82: =FIB(RC[-101])+RC[-1]+R[-1]C+R[-1]C[-1] -> 4.16470484614277E+53 | FB82: =FIB(RC[-101])+RC[-1]+R[-1]C+R[-1]C[-1] -> 1.31834690944165E+54 | FC82: =FIB(RC[-101])+RC[-1]+R[-1]C+R[-1]C[-1] -> 4.11429937693109E+54 | FD82: =FIB(RC[-101])+RC[-1]+R[-1]C+R[-1]C[-1] -> 1.26626257489387E+55 | FE82: =FIB(RC[-101])+RC[-1]+R[-1]C+R[-1]C[-1] -> 3.84458610052657E+55 | FF82: =FIB(RC[-101])+RC[-1]+R[-1]C+R[-1]C[-1] -> 1.15187424406469E+56 | FG82: =FIB(RC[-101])+RC[-1]+R[-1]C+R[-1]C[-1] -> 3.40657220960899E+56 | FH82: =FIB(RC[-101])+RC[-1]+R[-1]C+R[-1]C[-1] -> 9.94742021108375E+56 | FI82: =FIB(RC[-101])+RC[-1]+R[-1]C+R[-1]C[-1] -> 2.86881803689378E+57 | FJ82: =FIB(RC[-101])+RC[-1]+R[-1]C+R[-1]C[-1] -> 8.17355122099418E+57 | FK82: =FIB(RC[-101])+RC[-1]+R[-1]C+R[-1]C[-1] -> 2.30115457790931E+58 | FL82: =FIB(RC[-101])+RC[-1]+R[-1]C+R[-1]C[-1] -> 6.40348707847432E+58 | FM82: =FIB(RC[-101])+RC[-1]+R[-1]C+R[-1]C[-1] -> 1.76168492722241E+59 | FN82: =FIB(RC[-101])+RC[-1]+R[-1]C+R[-1]C[-1] -> 4.79272978653447E+59 | FO82: =FIB(RC[-101])+RC[-1]+R[-1]C+R[-1]C[-1] -> 1.28967316454781E+60 | FP82: =FIB(RC[-101])+RC[-1]+R[-1]C+R[-1]C[-1] -> 3.43332161023991E+60 | FQ82: =FIB(RC[-101])+RC[-1]+R[-1]C+R[-1]C[-1] -> 9.04441968266666E+60 | FR82: =FIB(RC[-101])+RC[-1]+R[-1]C+R[-1]C[-1] -> 2.35813638933142E+61 | FS82: =FIB(RC[-101])+RC[-1]+R[-1]C+R[-1]C[-1] -> 6.08649317762822E+61 | FT82: =FIB(RC[-101])+RC[-1]+R[-1]C+R[-1]C[-1] -> 1.55546730768523E+62 | FU82: =FIB(RC[-101])+RC[-1]+R[-1]C+R[-1]C[-1] -> 3.93670881559085E+62 | FV82: =FIB(RC[-101])+RC[-1]+R[-1]C+R[-1]C[-1] -> 9.86881886136866E+62 | FW82: =FIB(RC[-101])+RC[-1]+R[-1]C+R[-1]C[-1] -> 2.45095391436357E+63 | FX82: =FIB(RC[-101])+RC[-1]+R[-1]C+R[-1]C[-1] -> 6.03142120455618E+63 | FY82: =FIB(RC[-101])+RC[-1]+R[-1]C+R[-1]C[-1] -> 1.47093376947172E+64 | FZ82: =FIB(RC[-101])+RC[-1]+R[-1]C+R[-1]C[-1] -> 3.55572313654741E+64 | GA82: =FIB(RC[-101])+RC[-1]+R[-1]C+R[-1]C[-1] -> 8.52107934859071E+64 | GB82: =FIB(RC[-101])+RC[-1]+R[-1]C+R[-1]C[-1] -> 2.02470509761105E+65 | GC82: =FIB(RC[-101])+RC[-1]+R[-1]C+R[-1]C[-1] -> 4.77085582742743E+65 | GD82: =FIB(RC[-101])+RC[-1]+R[-1]C+R[-1]C[-1] -> 1.11497026831765E+66 | GE82: =FIB(RC[-101])+RC[-1]+R[-1]C+R[-1]C[-1] -> 2.58479567754546E+66 | GF82: =FIB(RC[-101])+RC[-1]+R[-1]C+R[-1]C[-1] -> 5.94493262661182E+66 | GG82: =FIB(RC[-101])+RC[-1]+R[-1]C+R[-1]C[-1] -> 1.35670595691384E+67 | GH82: =FIB(RC[-101])+RC[-1]+R[-1]C+R[-1]C[-1] -> 3.07256716956337E+67 | GI82: =FIB(RC[-101])+RC[-1]+R[-1]C+R[-1]C[-1] -> 6.90639198671291E+67 | GJ82: =FIB(RC[-101])+RC[-1]+R[-1]C+R[-1]C[-1] -> 1.54095927373067E+68 | GK82: =FIB(RC[-101])+RC[-1]+R[-1]C+R[-1]C[-1] -> 3.41331009453463E+68 | GL82: =FIB(RC[-101])+RC[-1]+R[-1]C+R[-1]C[-1] -> 7.50685804938029E+68 | GM82: =FIB(RC[-101])+RC[-1]+R[-1]C+R[-1]C[-1] -> 1.63942095834118E+69 | GN82: =FIB(RC[-101])+RC[-1]+R[-1]C+R[-1]C[-1] -> 3.55568507235565E+69 | GO82: =FIB(RC[-101])+RC[-1]+R[-1]C+R[-1]C[-1] -> 7.65960060246232E+69 | GP82: =FIB(RC[-101])+RC[-1]+R[-1]C+R[-1]C[-1] -> 1.63903161355413E+70 | GQ82: =FIB(RC[-101])+RC[-1]+R[-1]C+R[-1]C[-1] -> 3.4842885597266E+70 | GR82: =FIB(RC[-101])+RC[-1]+R[-1]C+R[-1]C[-1] -> 7.35923367034081E+70 | GS82: =FIB(RC[-101])+RC[-1]+R[-1]C+R[-1]C[-1] -> 1.54449965567849E+71
A83: 20 | B83: 20 | C83: 20 | D83: 20 | E83: 20 | F83: 20 | G83: 20 | H83: 20 | I83: 20 | J83: 20 | K83: 20 | L83: 20 | M83: 20 | N83: 20 | O83: 20 | P83: 20 | Q83: 20 | R83: 20 | S83: 20 | T83: 20 | U83: 20 | V83: 20 | W83: 20 | X83: 20 | Y83: 20 | Z83: 20 | AA83: 20 | AB83: 20 | AC83: 20 | AD83: 20 | AE83: 20 | AF83: 20 | AG83: 20 | AH83: 20 | AI83: 20 | AJ83: 20 | AK83: 20 | AL83: 20 | AM83: 20 | AN83: 20 | AO83: 20 | AP83: 20 | AQ83: 20 | AR83: 20 | AS83: 20 | AT83: 20 | AU83: 20 | AV83: 20 | AW83: 20 | AX83: 20 | AY83: 20 | AZ83: 20 | BA83: 20 | BB83: 20 | BC83: 20 | BD83: 20 | BE83: 20 | BF83: 20 | BG83: 20 | BH83: 20 | BI83: 20 | BJ83: 20 | BK83: 20 | BL83: 20 | BM83: 20 | BN83: 20 | BO83: 20 | BP83: 20 | BQ83: 20 | BR83: 20 | BS83: 20 | BT83: 20 | BU83: 20 | BV83: 20 | BW83: 20 | BX83: 20 | BY83: 20 | BZ83: 20 | CA83: 20 | CB83: 20 | CC83: 20 | CD83: 20 | CE83: 20 | CF83: 20 | CG83: 20 | CH83: 20 | CI83: 20 | CJ83: 20 | CK83: 20 | CL83: 20 | CM83: 20 | CN83: 20 | CO83: 20 | CP83: 20 | CQ83: 20 | CR83: 20 | CS83: 20 | CT83: 20 | CU83: 20 | CV83: 20 | CW83: 0 | CX83: =FIB(RC[-101])+RC[-1]+R[-1]C+R[-1]C[-1] -> 897572 | CY83: =FIB(RC[-101])+RC[-1]+R[-1]C+R[-1]C[-1] -> 74498476 | CZ83: =FIB(RC[-101])+RC[-1]+R[-1]C+R[-1]C[-1] -> 4098313752 | DA83: =FIB(RC[-101])+RC[-1]+R[-1]C+R[-1]C[-1] -> 169111540520 | DB83: =FIB(RC[-101])+RC[-1]+R[-1]C+R[-1]C[-1] -> 5583959667676 | DC83: =FIB(RC[-101])+RC[-1]+R[-1]C+R[-1]C[-1] -> 153699817294452 | DD83: =FIB(RC[-101])+RC[-1]+R[-1]C+R[-1]C[-1] -> 3.62771051606974E+15 | DE83: =FIB(RC[-101])+RC[-1]+R[-1]C+R[-1]C[-1] -> 7.49560167341833E+16 | DF83: =FIB(RC[-101])+RC[-1]+R[-1]C+R[-1]C[-1] -> 1.37741827169663E+18 | DG83: =FIB(RC[-101])+RC[-1]+R[-1]C+R[-1]C[-1] -> 2.27948618980553E+19 | DH83: =FIB(RC[-101])+RC[-1]+R[-1]C+R[-1]C[-1] -> 3.43175126899645E+20 | DI83: =FIB(RC[-101])+RC[-1]+R[-1]C+R[-1]C[-1] -> 4.73955328494333E+21 | DJ83: =FIB(RC[-101])+RC[-1]+R[-1]C+R[-1]C[-1] -> 6.04726456568035E+22 | DK83: =FIB(RC[-101])+RC[-1]+R[-1]C+R[-1]C[-1] -> 7.17114337576917E+23 | DL83: =FIB(RC[-101])+RC[-1]+R[-1]C+R[-1]C[-1] -> 7.94469884929244E+24 | DM83: =FIB(RC[-101])+RC[-1]+R[-1]C+R[-1]C[-1] -> 8.26020015748067E+25 | DN83: =FIB(RC[-101])+RC[-1]+R[-1]C+R[-1]C[-1] -> 8.09202673025399E+26 | DO83: =FIB(RC[-101])+RC[-1]+R[-1]C+R[-1]C[-1] -> 7.49570417088681E+27 | DP83: =FIB(RC[-101])+RC[-1]+R[-1]C+R[-1]C[-1] -> 6.586088612162E+28 | DQ83: =FIB(RC[-101])+RC[-1]+R[-1]C+R[-1]C[-1] -> 5.50473229465707E+29 | DR83: =FIB(RC[-101])+RC[-1]+R[-1]C+R[-1]C[-1] -> 4.38787145639401E+30 | DS83: =FIB(RC[-101])+RC[-1]+R[-1]C+R[-1]C[-1] -> 3.34344876419905E+31 | DT83: =FIB(RC[-101])+RC[-1]+R[-1]C+R[-1]C[-1] -> 2.44053201433439E+32 | DU83: =FIB(RC[-101])+RC[-1]+R[-1]C+R[-1]C[-1] -> 1.70990714384514E+33 | DV83: =FIB(RC[-101])+RC[-1]+R[-1]C+R[-1]C[-1] -> 1.1519678222754E+34 | DW83: =FIB(RC[-101])+RC[-1]+R[-1]C+R[-1]C[-1] -> 7.47497917442514E+34 | DX83: =FIB(RC[-101])+RC[-1]+R[-1]C+R[-1]C[-1] -> 4.678973063553E+35 | DY83: =FIB(RC[-101])+RC[-1]+R[-1]C+R[-1]C[-1] -> 2.82933214020426E+36 | DZ83: =FIB(RC[-101])+RC[-1]+R[-1]C+R[-1]C[-1] -> 1.65496871624707E+37 | EA83: =FIB(RC[-101])+RC[-1]+R[-1]C+R[-1]C[-1] -> 9.37583004624531E+37 | EB83: =FIB(RC[-101])+RC[-1]+R[-1]C+R[-1]C[-1] -> 5.15051941650932E+38 | EC83: =FIB(RC[-101])+RC[-1]+R[-1]C+R[-1]C[-1] -> 2.74656492771062E+39 | ED83: =FIB(RC[-101])+RC[-1]+R[-1]C+R[-1]C[-1] -> 1.42322689456085E+40 | EE83: =FIB(RC[-101])+RC[-1]+R[-1]C+R[-1]C[-1] -> 7.17341476070547E+40 | EF83: =FIB(RC[-101])+RC[-1]+R[-1]C+R[-1]C[-1] -> 3.5200089998042E+41 | EG83: =FIB(RC[-101])+RC[-1]+R[-1]C+R[-1]C[-1] -> 1.68307899063934E+42 | EH83: =FIB(RC[-101])+RC[-1]+R[-1]C+R[-1]C[-1] -> 7.8481098879672E+42 | EI83: =FIB(RC[-101])+RC[-1]+R[-1]C+R[-1]C[-1] -> 3.5716106688638E+43 | EJ83: =FIB(RC[-101])+RC[-1]+R[-1]C+R[-1]C[-1] -> 1.58753481522257E+44 | EK83: =FIB(RC[-101])+RC[-1]+R[-1]C+R[-1]C[-1] -> 6.89681315300732E+44 | EL83: =FIB(RC[-101])+RC[-1]+R[-1]C+R[-1]C[-1] -> 2.93042820208564E+45 | EM83: =FIB(RC[-101])+RC[-1]+R[-1]C+R[-1]C[-1] -> 1.21856568397967E+46 | EN83: =FIB(RC[-101])+RC[-1]+R[-1]C+R[-1]C[-1] -> 4.9621194489629E+46 | EO83: =FIB(RC[-101])+RC[-1]+R[-1]C+R[-1]C[-1] -> 1.97988189429546E+47 | EP83: =FIB(RC[-101])+RC[-1]+R[-1]C+R[-1]C[-1] -> 7.74475195853752E+47 | EQ83: =FIB(RC[-101])+RC[-1]+R[-1]C+R[-1]C[-1] -> 2.9716929530478E+48 | ER83: =FIB(RC[-101])+RC[-1]+R[-1]C+R[-1]C[-1] -> 1.11905360906842E+49 | ES83: =FIB(RC[-101])+RC[-1]+R[-1]C+R[-1]C[-1] -> 4.13772504949197E+49 | ET83: =FIB(RC[-101])+RC[-1]+R[-1]C+R[-1]C[-1] -> 1.50293715592134E+50 | EU83: =FIB(RC[-101])+RC[-1]+R[-1]C+R[-1]C[-1] -> 5.36518966939065E+50 | EV83: =FIB(RC[-101])+RC[-1]+R[-1]C+R[-1]C[-1] -> 1.88314343773632E+51 | EW83: =FIB(RC[-101])+RC[-1]+R[-1]C+R[-1]C[-1] -> 6.5015602796228E+51 | EX83: =FIB(RC[-101])+RC[-1]+R[-1]C+R[-1]C[-1] -> 2.20883189603783E+52 | EY83: =FIB(RC[-101])+RC[-1]+R[-1]C+R[-1]C[-1] -> 7.38732467274524E+52 | EZ83: =FIB(RC[-101])+RC[-1]+R[-1]C+R[-1]C[-1] -> 2.43306453343456E+53 | FA83: =FIB(RC[-101])+RC[-1]+R[-1]C+R[-1]C[-1] -> 7.89439167351431E+53 | FB83: =FIB(RC[-101])+RC[-1]+R[-1]C+R[-1]C[-1] -> 2.52425656140736E+54 | FC83: =FIB(RC[-101])+RC[-1]+R[-1]C+R[-1]C[-1] -> 7.95690284778011E+54 | FD83: =FIB(RC[-101])+RC[-1]+R[-1]C+R[-1]C[-1] -> 2.47338279736499E+55 | FE83: =FIB(RC[-101])+RC[-1]+R[-1]C+R[-1]C[-1] -> 7.58423147278543E+55 | FF83: =FIB(RC[-101])+RC[-1]+R[-1]C+R[-1]C[-1] -> 2.2947560013959E+56 | FG83: =FIB(RC[-101])+RC[-1]+R[-1]C+R[-1]C[-1] -> 6.85320245506958E+56 | FH83: =FIB(RC[-101])+RC[-1]+R[-1]C+R[-1]C[-1] -> 2.02071948757623E+57 | FI83: =FIB(RC[-101])+RC[-1]+R[-1]C+R[-1]C[-1] -> 5.88427954557838E+57 | FJ83: =FIB(RC[-101])+RC[-1]+R[-1]C+R[-1]C[-1] -> 1.69266488034663E+58 | FK83: =FIB(RC[-101])+RC[-1]+R[-1]C+R[-1]C[-1] -> 4.81117458035536E+58 | FL83: =FIB(RC[-101])+RC[-1]+R[-1]C+R[-1]C[-1] -> 1.3515816236739E+59 | FM83: =FIB(RC[-101])+RC[-1]+R[-1]C+R[-1]C[-1] -> 3.75361525874374E+59 | FN83: =FIB(RC[-101])+RC[-1]+R[-1]C+R[-1]C[-1] -> 1.03080299725006E+60 | FO83: =FIB(RC[-101])+RC[-1]+R[-1]C+R[-1]C[-1] -> 2.79974914045131E+60 | FP83: =FIB(RC[-101])+RC[-1]+R[-1]C+R[-1]C[-1] -> 7.52274391523903E+60 | FQ83: =FIB(RC[-101])+RC[-1]+R[-1]C+R[-1]C[-1] -> 2.00004852081456E+61 | FR83: =FIB(RC[-101])+RC[-1]+R[-1]C+R[-1]C[-1] -> 5.26262687841265E+61 | FS83: =FIB(RC[-101])+RC[-1]+R[-1]C+R[-1]C[-1] -> 1.37072564453723E+62 | FT83: =FIB(RC[-101])+RC[-1]+R[-1]C+R[-1]C[-1] -> 3.53484226998529E+62 | FU83: =FIB(RC[-101])+RC[-1]+R[-1]C+R[-1]C[-1] -> 9.02701839326138E+62 | FV83: =FIB(RC[-101])+RC[-1]+R[-1]C+R[-1]C[-1] -> 2.28325460702209E+63 | FW83: =FIB(RC[-101])+RC[-1]+R[-1]C+R[-1]C[-1] -> 5.72109040752253E+63 | FX83: =FIB(RC[-101])+RC[-1]+R[-1]C+R[-1]C[-1] -> 1.42034655264423E+64 | FY83: =FIB(RC[-101])+RC[-1]+R[-1]C+R[-1]C[-1] -> 3.49442244257157E+64 | FZ83: =FIB(RC[-101])+RC[-1]+R[-1]C+R[-1]C[-1] -> 8.52107934859071E+64 | GA83: =FIB(RC[-101])+RC[-1]+R[-1]C+R[-1]C[-1] -> 2.05978818337288E+65 | GB83: =FIB(RC[-101])+RC[-1]+R[-1]C+R[-1]C[-1] -> 4.93660121584301E+65 | GC83: =FIB(RC[-101])+RC[-1]+R[-1]C+R[-1]C[-1] -> 1.17321621408815E+66 | GD83: =FIB(RC[-101])+RC[-1]+R[-1]C+R[-1]C[-1] -> 2.76527206514854E+66 | GE83: =FIB(RC[-101])+RC[-1]+R[-1]C+R[-1]C[-1] -> 6.46503801101165E+66 | GF83: =FIB(RC[-101])+RC[-1]+R[-1]C+R[-1]C[-1] -> 1.49947663151689E+67 | GG83: =FIB(RC[-101])+RC[-1]+R[-1]C+R[-1]C[-1] -> 3.45067585109192E+67 | GH83: =FIB(RC[-101])+RC[-1]+R[-1]C+R[-1]C[-1] -> 7.87994897756913E+67 | GI83: =FIB(RC[-101])+RC[-1]+R[-1]C+R[-1]C[-1] -> 1.78589081338454E+68 | GJ83: =FIB(RC[-101])+RC[-1]+R[-1]C+R[-1]C[-1] -> 4.0174892857865E+68 | GK83: =FIB(RC[-101])+RC[-1]+R[-1]C+R[-1]C[-1] -> 8.9717586540518E+68 | GL83: =FIB(RC[-101])+RC[-1]+R[-1]C+R[-1]C[-1] -> 1.98919267979667E+69 | GM83: =FIB(RC[-101])+RC[-1]+R[-1]C+R[-1]C[-1] -> 4.37929944307588E+69 | GN83: =FIB(RC[-101])+RC[-1]+R[-1]C+R[-1]C[-1] -> 9.57440547377271E+69 | GO83: =FIB(RC[-101])+RC[-1]+R[-1]C+R[-1]C[-1] -> 2.07896911485907E+70 | GP83: =FIB(RC[-101])+RC[-1]+R[-1]C+R[-1]C[-1] -> 4.48396078865943E+70 | GQ83: =FIB(RC[-101])+RC[-1]+R[-1]C+R[-1]C[-1] -> 9.60728096194015E+70 | GR83: =FIB(RC[-101])+RC[-1]+R[-1]C+R[-1]C[-1] -> 2.04508031920076E+71 | GS83: =FIB(RC[-101])+RC[-1]+R[-1]C+R[-1]C[-1] -> 4.32550334191332E+71
A84: 20 | B84: 20 | C84: 20 | D84: 20 | E84: 20 | F84: 20 | G84: 20 | H84: 20 | I84: 20 | J84: 20 | K84: 20 | L84: 20 | M84: 20 | N84: 20 | O84: 20 | P84: 20 | Q84: 20 | R84: 20 | S84: 20 | T84: 20 | U84: 20 | V84: 20 | W84: 20 | X84: 20 | Y84: 20 | Z84: 20 | AA84: 20 | AB84: 20 | AC84: 20 | AD84: 20 | AE84: 20 | AF84: 20 | AG84: 20 | AH84: 20 | AI84: 20 | AJ84: 20 | AK84: 20 | AL84: 20 | AM84: 20 | AN84: 20 | AO84: 20 | AP84: 20 | AQ84: 20 | AR84: 20 | AS84: 20 | AT84: 20 | AU84: 20 | AV84: 20 | AW84: 20 | AX84: 20 | AY84: 20 | AZ84: 20 | BA84: 20 | BB84: 20 | BC84: 20 | BD84: 20 | BE84: 20 | BF84: 20 | BG84: 20 | BH84: 20 | BI84: 20 | BJ84: 20 | BK84: 20 | BL84: 20 | BM84: 20 | BN84: 20 | BO84: 20 | BP84: 20 | BQ84: 20 | BR84: 20 | BS84: 20 | BT84: 20 | BU84: 20 | BV84: 20 | BW84: 20 | BX84: 20 | BY84: 20 | BZ84: 20 | CA84: 20 | CB84: 20 | CC84: 20 | CD84: 20 | CE84: 20 | CF84: 20 | CG84: 20 | CH84: 20 | CI84: 20 | CJ84: 20 | CK84: 20 | CL84: 20 | CM84: 20 | CN84: 20 | CO84: 20 | CP84: 20 | CQ84: 20 | CR84: 20 | CS84: 20 | CT84: 20 | CU84: 20 | CV84: 20 | CW84: 0 | CX84: =FIB(RC[-101])+RC[-1]+R[-1]C+R[-1]C[-1] -> 908518 | CY84: =FIB(RC[-101])+RC[-1]+R[-1]C+R[-1]C[-1] -> 76315512 | CZ84: =FIB(RC[-101])+RC[-1]+R[-1]C+R[-1]C[-1] -> 4249138686 | DA84: =FIB(RC[-101])+RC[-1]+R[-1]C+R[-1]C[-1] -> 177459003904 | DB84: =FIB(RC[-101])+RC[-1]+R[-1]C+R[-1]C[-1] -> 5930530223046 | DC84: =FIB(RC[-101])+RC[-1]+R[-1]C+R[-1]C[-1] -> 165214307196120 | DD84: =FIB(RC[-101])+RC[-1]+R[-1]C+R[-1]C[-1] -> 3.94662464057126E+15 | DE84: =FIB(RC[-101])+RC[-1]+R[-1]C+R[-1]C[-1] -> 8.25303518908353E+16 | DF84: =FIB(RC[-101])+RC[-1]+R[-1]C+R[-1]C[-1] -> 1.53490464032166E+18 | DG84: =FIB(RC[-101])+RC[-1]+R[-1]C+R[-1]C[-1] -> 2.57071848100736E+19 | DH84: =FIB(RC[-101])+RC[-1]+R[-1]C+R[-1]C[-1] -> 3.91677173607774E+20 | DI84: =FIB(RC[-101])+RC[-1]+R[-1]C+R[-1]C[-1] -> 5.47440558545075E+21 | DJ84: =FIB(RC[-101])+RC[-1]+R[-1]C+R[-1]C[-1] -> 7.06866045271976E+22 | DK84: =FIB(RC[-101])+RC[-1]+R[-1]C+R[-1]C[-1] -> 8.48273587760919E+23 | DL84: =FIB(RC[-101])+RC[-1]+R[-1]C+R[-1]C[-1] -> 9.51008677463028E+24 | DM84: =FIB(RC[-101])+RC[-1]+R[-1]C+R[-1]C[-1] -> 1.00056787198729E+26 | DN84: =FIB(RC[-101])+RC[-1]+R[-1]C+R[-1]C[-1] -> 9.91861461798935E+26 | DO84: =FIB(RC[-101])+RC[-1]+R[-1]C+R[-1]C[-1] -> 9.29676830571114E+27 | DP84: =FIB(RC[-101])+RC[-1]+R[-1]C+R[-1]C[-1] -> 8.26533585982179E+28 | DQ84: =FIB(RC[-101])+RC[-1]+R[-1]C+R[-1]C[-1] -> 6.98987474185545E+29 | DR84: =FIB(RC[-101])+RC[-1]+R[-1]C+R[-1]C[-1] -> 5.63733216004526E+30 | DS84: =FIB(RC[-101])+RC[-1]+R[-1]C+R[-1]C[-1] -> 4.34596912584298E+31 | DT84: =FIB(RC[-101])+RC[-1]+R[-1]C+R[-1]C[-1] -> 3.20947380333859E+32 | DU84: =FIB(RC[-101])+RC[-1]+R[-1]C+R[-1]C[-1] -> 2.27490772561243E+33 | DV84: =FIB(RC[-101])+RC[-1]+R[-1]C+R[-1]C[-1] -> 1.55044930922116E+34 | DW84: =FIB(RC[-101])+RC[-1]+R[-1]C+R[-1]C[-1] -> 1.01773963059217E+35 | DX84: =FIB(RC[-101])+RC[-1]+R[-1]C+R[-1]C[-1] -> 6.44421061158768E+35 | DY84: =FIB(RC[-101])+RC[-1]+R[-1]C+R[-1]C[-1] -> 3.94165050771833E+36 | DZ84: =FIB(RC[-101])+RC[-1]+R[-1]C+R[-1]C[-1] -> 2.33206698103933E+37 | EA84: =FIB(RC[-101])+RC[-1]+R[-1]C+R[-1]C[-1] -> 1.33628657435317E+38 | EB84: =FIB(RC[-101])+RC[-1]+R[-1]C+R[-1]C[-1] -> 7.42438899548702E+38 | EC84: =FIB(RC[-101])+RC[-1]+R[-1]C+R[-1]C[-1] -> 4.00405576891025E+39 | ED84: =FIB(RC[-101])+RC[-1]+R[-1]C+R[-1]C[-1] -> 2.09828896422294E+40 | EE84: =FIB(RC[-101])+RC[-1]+R[-1]C+R[-1]C[-1] -> 1.06949306194893E+41 | EF84: =FIB(RC[-101])+RC[-1]+R[-1]C+R[-1]C[-1] -> 5.30684353782368E+41 | EG84: =FIB(RC[-101])+RC[-1]+R[-1]C+R[-1]C[-1] -> 2.56576424440213E+42 | EH84: =FIB(RC[-101])+RC[-1]+R[-1]C+R[-1]C[-1] -> 1.20969531230087E+43 | EI84: =FIB(RC[-101])+RC[-1]+R[-1]C+R[-1]C[-1] -> 5.56611696996139E+43 | EJ84: =FIB(RC[-101])+RC[-1]+R[-1]C+R[-1]C[-1] -> 2.50130757910509E+44 | EK84: =FIB(RC[-101])+RC[-1]+R[-1]C+R[-1]C[-1] -> 1.0985655547335E+45 | EL84: =FIB(RC[-101])+RC[-1]+R[-1]C+R[-1]C[-1] -> 4.71867507211987E+45 | EM84: =FIB(RC[-101])+RC[-1]+R[-1]C+R[-1]C[-1] -> 1.98347601140022E+46 | EN84: =FIB(RC[-101])+RC[-1]+R[-1]C+R[-1]C[-1] -> 8.16416114434278E+46 | EO84: =FIB(RC[-101])+RC[-1]+R[-1]C+R[-1]C[-1] -> 3.29250995362603E+47 | EP84: =FIB(RC[-101])+RC[-1]+R[-1]C+R[-1]C[-1] -> 1.3017143806459E+48 | EQ84: =FIB(RC[-101])+RC[-1]+R[-1]C+R[-1]C[-1] -> 5.04788252954745E+48 | ER84: =FIB(RC[-101])+RC[-1]+R[-1]C+R[-1]C[-1] -> 1.92101115732795E+49 | ES84: =FIB(RC[-101])+RC[-1]+R[-1]C+R[-1]C[-1] -> 7.17778981588834E+49 | ET84: =FIB(RC[-101])+RC[-1]+R[-1]C+R[-1]C[-1] -> 2.63448864245937E+50 | EU84: =FIB(RC[-101])+RC[-1]+R[-1]C+R[-1]C[-1] -> 9.50261546777137E+50 | EV84: =FIB(RC[-101])+RC[-1]+R[-1]C+R[-1]C[-1] -> 3.36992395145253E+51 | EW84: =FIB(RC[-101])+RC[-1]+R[-1]C+R[-1]C[-1] -> 1.17546276688116E+52 | EX84: =FIB(RC[-101])+RC[-1]+R[-1]C+R[-1]C[-1] -> 4.03445069088128E+52 | EY84: =FIB(RC[-101])+RC[-1]+R[-1]C+R[-1]C[-1] -> 1.36306072596644E+53 | EZ84: =FIB(RC[-101])+RC[-1]+R[-1]C+R[-1]C[-1] -> 4.53485772667552E+53 | FA84: =FIB(RC[-101])+RC[-1]+R[-1]C+R[-1]C[-1] -> 1.48623139336244E+54 | FB84: =FIB(RC[-101])+RC[-1]+R[-1]C+R[-1]C[-1] -> 4.79992712212123E+54 | FC84: =FIB(RC[-101])+RC[-1]+R[-1]C+R[-1]C[-1] -> 1.52810865313087E+55 | FD84: =FIB(RC[-101])+RC[-1]+R[-1]C+R[-1]C[-1] -> 4.79718173527387E+55 | FE84: =FIB(RC[-101])+RC[-1]+R[-1]C+R[-1]C[-1] -> 1.48547960054243E+56 | FF84: =FIB(RC[-101])+RC[-1]+R[-1]C+R[-1]C[-1] -> 4.53865874921687E+56 | FG84: =FIB(RC[-101])+RC[-1]+R[-1]C+R[-1]C[-1] -> 1.36866172056823E+57 | FH84: =FIB(RC[-101])+RC[-1]+R[-1]C+R[-1]C[-1] -> 4.07470145365142E+57 | FI84: =FIB(RC[-101])+RC[-1]+R[-1]C+R[-1]C[-1] -> 1.1979700486806E+58 | FJ84: =FIB(RC[-101])+RC[-1]+R[-1]C+R[-1]C[-1] -> 3.47906288358508E+58 | FK84: =FIB(RC[-101])+RC[-1]+R[-1]C+R[-1]C[-1] -> 9.98290234428707E+58 | FL84: =FIB(RC[-101])+RC[-1]+R[-1]C+R[-1]C[-1] -> 2.83098931613814E+59 | FM84: =FIB(RC[-101])+RC[-1]+R[-1]C+R[-1]C[-1] -> 7.93618619855578E+59 | FN84: =FIB(RC[-101])+RC[-1]+R[-1]C+R[-1]C[-1] -> 2.19978314298001E+60 | FO84: =FIB(RC[-101])+RC[-1]+R[-1]C+R[-1]C[-1] -> 6.03033528068139E+60 | FP84: =FIB(RC[-101])+RC[-1]+R[-1]C+R[-1]C[-1] -> 1.63528283363717E+61 | FQ84: =FIB(RC[-101])+RC[-1]+R[-1]C+R[-1]C[-1] -> 4.38760574597564E+61 | FR84: =FIB(RC[-101])+RC[-1]+R[-1]C+R[-1]C[-1] -> 1.16502811452028E+62 | FS84: =FIB(RC[-101])+RC[-1]+R[-1]C+R[-1]C[-1] -> 3.06201644689878E+62 | FT84: =FIB(RC[-101])+RC[-1]+R[-1]C+R[-1]C[-1] -> 7.9675843614213E+62 | FU84: =FIB(RC[-101])+RC[-1]+R[-1]C+R[-1]C[-1] -> 2.0529445024668E+63 | FV84: =FIB(RC[-101])+RC[-1]+R[-1]C+R[-1]C[-1] -> 5.23890094881502E+63 | FW84: =FIB(RC[-101])+RC[-1]+R[-1]C+R[-1]C[-1] -> 1.32432459633596E+64 | FX84: =FIB(RC[-101])+RC[-1]+R[-1]C+R[-1]C[-1] -> 3.31678018973245E+64 | FY84: =FIB(RC[-101])+RC[-1]+R[-1]C+R[-1]C[-1] -> 8.23154918494824E+64 | FZ84: =FIB(RC[-101])+RC[-1]+R[-1]C+R[-1]C[-1] -> 2.02470509761105E+65 | GA84: =FIB(RC[-101])+RC[-1]+R[-1]C+R[-1]C[-1] -> 4.93660121584301E+65 | GB84: =FIB(RC[-101])+RC[-1]+R[-1]C+R[-1]C[-1] -> 1.19329906150589E+66 | GC84: =FIB(RC[-101])+RC[-1]+R[-1]C+R[-1]C[-1] -> 2.86017539717834E+66 | GD84: =FIB(RC[-101])+RC[-1]+R[-1]C+R[-1]C[-1] -> 6.79866367641503E+66 | GE84: =FIB(RC[-101])+RC[-1]+R[-1]C+R[-1]C[-1] -> 1.60289737525752E+67 | GF84: =FIB(RC[-101])+RC[-1]+R[-1]C+R[-1]C[-1] -> 3.74887780787558E+67 | GG84: =FIB(RC[-101])+RC[-1]+R[-1]C+R[-1]C[-1] -> 8.69903029048439E+67 | GH84: =FIB(RC[-101])+RC[-1]+R[-1]C+R[-1]C[-1] -> 2.00296551191454E+68 | GI84: =FIB(RC[-101])+RC[-1]+R[-1]C+R[-1]C[-1] -> 4.576851223056E+68 | GJ84: =FIB(RC[-101])+RC[-1]+R[-1]C+R[-1]C[-1] -> 1.0380231322227E+69 | GK84: =FIB(RC[-101])+RC[-1]+R[-1]C+R[-1]C[-1] -> 2.33694792620653E+69 | GL84: =FIB(RC[-101])+RC[-1]+R[-1]C+R[-1]C[-1] -> 5.22331647140839E+69 | GM84: =FIB(RC[-101])+RC[-1]+R[-1]C+R[-1]C[-1] -> 1.15918085942809E+70 | GN84: =FIB(RC[-101])+RC[-1]+R[-1]C+R[-1]C[-1] -> 2.55455135111295E+70 | GO84: =FIB(RC[-101])+RC[-1]+R[-1]C+R[-1]C[-1] -> 5.59096101334929E+70 | GP84: =FIB(RC[-101])+RC[-1]+R[-1]C+R[-1]C[-1] -> 1.21538909168678E+71 | GQ84: =FIB(RC[-101])+RC[-1]+R[-1]C+R[-1]C[-1] -> 2.62451326674674E+71 | GR84: =FIB(RC[-101])+RC[-1]+R[-1]C+R[-1]C[-1] -> 5.63032168214151E+71 | GS84: =FIB(RC[-101])+RC[-1]+R[-1]C+R[-1]C[-1] -> 1.20009053432556E+72
A85: 20 | B85: 20 | C85: 20 | D85: 20 | E85: 20 | F85: 20 | G85: 20 | H85: 20 | I85: 20 | J85: 20 | K85: 20 | L85: 20 | M85: 20 | N85: 20 | O85: 20 | P85: 20 | Q85: 20 | R85: 20 | S85: 20 | T85: 20 | U85: 20 | V85: 20 | W85: 20 | X85: 20 | Y85: 20 | Z85: 20 | AA85: 20 | AB85: 20 | AC85: 20 | AD85: 20 | AE85: 20 | AF85: 20 | AG85: 20 | AH85: 20 | AI85: 20 | AJ85: 20 | AK85: 20 | AL85: 20 | AM85: 20 | AN85: 20 | AO85: 20 | AP85: 20 | AQ85: 20 | AR85: 20 | AS85: 20 | AT85: 20 | AU85: 20 | AV85: 20 | AW85: 20 | AX85: 20 | AY85: 20 | AZ85: 20 | BA85: 20 | BB85: 20 | BC85: 20 | BD85: 20 | BE85: 20 | BF85: 20 | BG85: 20 | BH85: 20 | BI85: 20 | BJ85: 20 | BK85: 20 | BL85: 20 | BM85: 20 | BN85: 20 | BO85: 20 | BP85: 20 | BQ85: 20 | BR85: 20 | BS85: 20 | BT85: 20 | BU85: 20 | BV85: 20 | BW85: 20 | BX85: 20 | BY85: 20 | BZ85: 20 | CA85: 20 | CB85: 20 | CC85: 20 | CD85: 20 | CE85: 20 | CF85: 20 | CG85: 20 | CH85: 20 | CI85: 20 | CJ85: 20 | CK85: 20 | CL85: 20 | CM85: 20 | CN85: 20 | CO85: 20 | CP85: 20 | CQ85: 20 | CR85: 20 | CS85: 20 | CT85: 20 | CU85: 20 | CV85: 20 | CW85: 0 | CX85: =FIB(RC[-101])+RC[-1]+R[-1]C+R[-1]C[-1] -> 919464 | CY85: =FIB(RC[-101])+RC[-1]+R[-1]C+R[-1]C[-1] -> 78154440 | CZ85: =FIB(RC[-101])+RC[-1]+R[-1]C+R[-1]C[-1] -> 4403619584 | DA85: =FIB(RC[-101])+RC[-1]+R[-1]C+R[-1]C[-1] -> 186111773120 | DB85: =FIB(RC[-101])+RC[-1]+R[-1]C+R[-1]C[-1] -> 6294101011016 | DC85: =FIB(RC[-101])+RC[-1]+R[-1]C+R[-1]C[-1] -> 177438938441128 | DD85: =FIB(RC[-101])+RC[-1]+R[-1]C+R[-1]C[-1] -> 4.28927788621946E+15 | DE85: =FIB(RC[-101])+RC[-1]+R[-1]C+R[-1]C[-1] -> 9.07662544176369E+16 | DF85: =FIB(RC[-101])+RC[-1]+R[-1]C+R[-1]C[-1] -> 1.70820124663015E+18 | DG85: =FIB(RC[-101])+RC[-1]+R[-1]C+R[-1]C[-1] -> 2.89502906970254E+19 | DH85: =FIB(RC[-101])+RC[-1]+R[-1]C+R[-1]C[-1] -> 4.46334649114873E+20 | DI85: =FIB(RC[-101])+RC[-1]+R[-1]C+R[-1]C[-1] -> 6.3124174081734E+21 | DJ85: =FIB(RC[-101])+RC[-1]+R[-1]C+R[-1]C[-1] -> 8.24734275208217E+22 | DK85: =FIB(RC[-101])+RC[-1]+R[-1]C+R[-1]C[-1] -> 1.00143361980894E+24 | DL85: =FIB(RC[-101])+RC[-1]+R[-1]C+R[-1]C[-1] -> 1.13597939822001E+25 | DM85: =FIB(RC[-101])+RC[-1]+R[-1]C+R[-1]C[-1] -> 1.2092666795556E+26 | DN85: =FIB(RC[-101])+RC[-1]+R[-1]C+R[-1]C[-1] -> 1.21284491695322E+27 | DO85: =FIB(RC[-101])+RC[-1]+R[-1]C+R[-1]C[-1] -> 1.15014746844633E+28 | DP85: =FIB(RC[-101])+RC[-1]+R[-1]C+R[-1]C[-1] -> 1.03451601588392E+29 | DQ85: =FIB(RC[-101])+RC[-1]+R[-1]C+R[-1]C[-1] -> 8.85092434372156E+29 | DR85: =FIB(RC[-101])+RC[-1]+R[-1]C+R[-1]C[-1] -> 7.22141206860296E+30 | DS85: =FIB(RC[-101])+RC[-1]+R[-1]C+R[-1]C[-1] -> 5.6318435487078E+31 | DT85: =FIB(RC[-101])+RC[-1]+R[-1]C+R[-1]C[-1] -> 4.20725507079367E+32 | DU85: =FIB(RC[-101])+RC[-1]+R[-1]C+R[-1]C[-1] -> 3.01658061302566E+33 | DV85: =FIB(RC[-101])+RC[-1]+R[-1]C+R[-1]C[-1] -> 2.07959814308497E+34 | DW85: =FIB(RC[-101])+RC[-1]+R[-1]C+R[-1]C[-1] -> 1.38074437582278E+35 | DX85: =FIB(RC[-101])+RC[-1]+R[-1]C+R[-1]C[-1] -> 8.84269461800263E+35 | DY85: =FIB(RC[-101])+RC[-1]+R[-1]C+R[-1]C[-1] -> 5.47034103067736E+36 | DZ85: =FIB(RC[-101])+RC[-1]+R[-1]C+R[-1]C[-1] -> 3.2732661348789E+37 | EA85: =FIB(RC[-101])+RC[-1]+R[-1]C+R[-1]C[-1] -> 1.89681988594499E+38 | EB85: =FIB(RC[-101])+RC[-1]+R[-1]C+R[-1]C[-1] -> 1.06574954557852E+39 | EC85: =FIB(RC[-101])+RC[-1]+R[-1]C+R[-1]C[-1] -> 5.81224421403747E+39 | ED85: =FIB(RC[-101])+RC[-1]+R[-1]C+R[-1]C[-1] -> 3.07991896251771E+40 | EE85: =FIB(RC[-101])+RC[-1]+R[-1]C+R[-1]C[-1] -> 1.58731385462299E+41 | EF85: =FIB(RC[-101])+RC[-1]+R[-1]C+R[-1]C[-1] -> 7.9636504543956E+41 | EG85: =FIB(RC[-101])+RC[-1]+R[-1]C+R[-1]C[-1] -> 3.89281364362406E+42 | EH85: =FIB(RC[-101])+RC[-1]+R[-1]C+R[-1]C[-1] -> 1.85555310110349E+43 | EI85: =FIB(RC[-101])+RC[-1]+R[-1]C+R[-1]C[-1] -> 8.63136538336574E+43 | EJ85: =FIB(RC[-101])+RC[-1]+R[-1]C+R[-1]C[-1] -> 3.9210558144378E+44 | EK85: =FIB(RC[-101])+RC[-1]+R[-1]C+R[-1]C[-1] -> 1.74080189408779E+45 | EL85: =FIB(RC[-101])+RC[-1]+R[-1]C+R[-1]C[-1] -> 7.55804252094115E+45 | EM85: =FIB(RC[-101])+RC[-1]+R[-1]C+R[-1]C[-1] -> 3.21114777070632E+46 | EN85: =FIB(RC[-101])+RC[-1]+R[-1]C+R[-1]C[-1] -> 1.33587849264493E+47 | EO85: =FIB(RC[-101])+RC[-1]+R[-1]C+R[-1]C[-1] -> 5.44480456070524E+47 | EP85: =FIB(RC[-101])+RC[-1]+R[-1]C+R[-1]C[-1] -> 2.17544583207903E+48 | EQ85: =FIB(RC[-101])+RC[-1]+R[-1]C+R[-1]C[-1] -> 8.52504274227238E+48 | ER85: =FIB(RC[-101])+RC[-1]+R[-1]C+R[-1]C[-1] -> 3.27830368450993E+49 | ES85: =FIB(RC[-101])+RC[-1]+R[-1]C+R[-1]C[-1] -> 1.23771046577262E+50 | ET85: =FIB(RC[-101])+RC[-1]+R[-1]C+R[-1]C[-1] -> 4.58997808982083E+50 | EU85: =FIB(RC[-101])+RC[-1]+R[-1]C+R[-1]C[-1] -> 1.67270822000516E+51 | EV85: =FIB(RC[-101])+RC[-1]+R[-1]C+R[-1]C[-1] -> 5.99289371823482E+51 | EW85: =FIB(RC[-101])+RC[-1]+R[-1]C+R[-1]C[-1] -> 2.1117445338499E+52 | EX85: =FIB(RC[-101])+RC[-1]+R[-1]C+R[-1]C[-1] -> 7.32165799161234E+52 | EY85: =FIB(RC[-101])+RC[-1]+R[-1]C+R[-1]C[-1] -> 2.4986715942158E+53 | EZ85: =FIB(RC[-101])+RC[-1]+R[-1]C+R[-1]C[-1] -> 8.39659004685775E+53 | FA85: =FIB(RC[-101])+RC[-1]+R[-1]C+R[-1]C[-1] -> 2.77937617071577E+54 | FB85: =FIB(RC[-101])+RC[-1]+R[-1]C+R[-1]C[-1] -> 9.06553468619944E+54 | FC85: =FIB(RC[-101])+RC[-1]+R[-1]C+R[-1]C[-1] -> 2.91465483396294E+55 | FD85: =FIB(RC[-101])+RC[-1]+R[-1]C+R[-1]C[-1] -> 9.23994522236768E+55 | FE85: =FIB(RC[-101])+RC[-1]+R[-1]C+R[-1]C[-1] -> 2.88919229630658E+56 | FF85: =FIB(RC[-101])+RC[-1]+R[-1]C+R[-1]C[-1] -> 8.91333064606588E+56 | FG85: =FIB(RC[-101])+RC[-1]+R[-1]C+R[-1]C[-1] -> 2.71386066009651E+57 | FH85: =FIB(RC[-101])+RC[-1]+R[-1]C+R[-1]C[-1] -> 8.15722383431617E+57 | FI85: =FIB(RC[-101])+RC[-1]+R[-1]C+R[-1]C[-1] -> 2.42116257747736E+58 | FJ85: =FIB(RC[-101])+RC[-1]+R[-1]C+R[-1]C[-1] -> 7.09819550974304E+58 | FK85: =FIB(RC[-101])+RC[-1]+R[-1]C+R[-1]C[-1] -> 2.05601607376152E+59 | FL85: =FIB(RC[-101])+RC[-1]+R[-1]C+R[-1]C[-1] -> 5.88529562432837E+59 | FM85: =FIB(RC[-101])+RC[-1]+R[-1]C+R[-1]C[-1] -> 1.66524711390223E+60 | FN85: =FIB(RC[-101])+RC[-1]+R[-1]C+R[-1]C[-1] -> 4.65864887673782E+60 | FO85: =FIB(RC[-101])+RC[-1]+R[-1]C+R[-1]C[-1] -> 1.28887673003992E+61 | FP85: =FIB(RC[-101])+RC[-1]+R[-1]C+R[-1]C[-1] -> 3.52719309174524E+61 | FQ85: =FIB(RC[-101])+RC[-1]+R[-1]C+R[-1]C[-1] -> 9.55008167135805E+61 | FR85: =FIB(RC[-101])+RC[-1]+R[-1]C+R[-1]C[-1] -> 2.55879685625365E+62 | FS85: =FIB(RC[-101])+RC[-1]+R[-1]C+R[-1]C[-1] -> 6.78584141767272E+62 | FT85: =FIB(RC[-101])+RC[-1]+R[-1]C+R[-1]C[-1] -> 1.78154422259928E+63 | FU85: =FIB(RC[-101])+RC[-1]+R[-1]C+R[-1]C[-1] -> 4.6312471612082E+63 | FV85: =FIB(RC[-101])+RC[-1]+R[-1]C+R[-1]C[-1] -> 1.192309261249E+64 | FW85: =FIB(RC[-101])+RC[-1]+R[-1]C+R[-1]C[-1] -> 3.04052395246647E+64 | FX85: =FIB(RC[-101])+RC[-1]+R[-1]C+R[-1]C[-1] -> 7.68162873853488E+64 | FY85: =FIB(RC[-101])+RC[-1]+R[-1]C+R[-1]C[-1] -> 1.92299581132156E+65 | FZ85: =FIB(RC[-101])+RC[-1]+R[-1]C+R[-1]C[-1] -> 4.77085582742743E+65 | GA85: =FIB(RC[-101])+RC[-1]+R[-1]C+R[-1]C[-1] -> 1.17321621408815E+66 | GB85: =FIB(RC[-101])+RC[-1]+R[-1]C+R[-1]C[-1] -> 2.86017539717834E+66 | GC85: =FIB(RC[-101])+RC[-1]+R[-1]C+R[-1]C[-1] -> 6.91364985586257E+66 | GD85: =FIB(RC[-101])+RC[-1]+R[-1]C+R[-1]C[-1] -> 1.65724889294559E+67 | GE85: =FIB(RC[-101])+RC[-1]+R[-1]C+R[-1]C[-1] -> 3.94001263584462E+67 | GF85: =FIB(RC[-101])+RC[-1]+R[-1]C+R[-1]C[-1] -> 9.29178781897772E+67 | GG85: =FIB(RC[-101])+RC[-1]+R[-1]C+R[-1]C[-1] -> 2.17396959173377E+68 | GH85: =FIB(RC[-101])+RC[-1]+R[-1]C+R[-1]C[-1] -> 5.04683813269675E+68 | GI85: =FIB(RC[-101])+RC[-1]+R[-1]C+R[-1]C[-1] -> 1.16266548676673E+69 | GJ85: =FIB(RC[-101])+RC[-1]+R[-1]C+R[-1]C[-1] -> 2.65837374129503E+69 | GK85: =FIB(RC[-101])+RC[-1]+R[-1]C+R[-1]C[-1] -> 6.03334479972427E+69 | GL85: =FIB(RC[-101])+RC[-1]+R[-1]C+R[-1]C[-1] -> 1.35936091973392E+70 | GM85: =FIB(RC[-101])+RC[-1]+R[-1]C+R[-1]C[-1] -> 3.04087342630285E+70 | GN85: =FIB(RC[-101])+RC[-1]+R[-1]C+R[-1]C[-1] -> 6.7546056368439E+70 | GO85: =FIB(RC[-101])+RC[-1]+R[-1]C+R[-1]C[-1] -> 1.49001180013061E+71 | GP85: =FIB(RC[-101])+RC[-1]+R[-1]C+R[-1]C[-1] -> 3.26449699315232E+71 | GQ85: =FIB(RC[-101])+RC[-1]+R[-1]C+R[-1]C[-1] -> 7.10439935158584E+71 | GR85: =FIB(RC[-101])+RC[-1]+R[-1]C+R[-1]C[-1] -> 1.53592343004741E+72 | GS85: =FIB(RC[-101])+RC[-1]+R[-1]C+R[-1]C[-1] -> 3.29904613258712E+72
A86: 20 | B86: 20 | C86: 20 | D86: 20 | E86: 20 | F86: 20 | G86: 20 | H86: 20 | I86: 20 | J86: 20 | K86: 20 | L86: 20 | M86: 20 | N86: 20 | O86: 20 | P86: 20 | Q86: 20 | R86: 20 | S86: 20 | T86: 20 | U86: 20 | V86: 20 | W86: 20 | X86: 20 | Y86: 20 | Z86: 20 | AA86: 20 | AB86: 20 | AC86: 20 | AD86: 20 | AE86: 20 | AF86: 20 | AG86: 20 | AH86: 20 | AI86: 20 | AJ86: 20 | AK86: 20 | AL86: 20 | AM86: 20 | AN86: 20 | AO86: 20 | AP86: 20 | AQ86: 20 | AR86: 20 | AS86: 20 | AT86: 20 | AU86: 20 | AV86: 20 | AW86: 20 | AX86: 20 | AY86: 20 | AZ86: 20 | BA86: 20 | BB86: 20 | BC86: 20 | BD86: 20 | BE86: 20 | BF86: 20 | BG86: 20 | BH86: 20 | BI86: 20 | BJ86: 20 | BK86: 20 | BL86: 20 | BM86: 20 | BN86: 20 | BO86: 20 | BP86: 20 | BQ86: 20 | BR86: 20 | BS86: 20 | BT86: 20 | BU86: 20 | BV86: 20 | BW86: 20 | BX86: 20 | BY86: 20 | BZ86: 20 | CA86: 20 | CB86: 20 | CC86: 20 | CD86: 20 | CE86: 20 | CF86: 20 | CG86: 20 | CH86: 20 | CI86: 20 | CJ86: 20 | CK86: 20 | CL86: 20 | CM86: 20 | CN86: 20 | CO86: 20 | CP86: 20 | CQ86: 20 | CR86: 20 | CS86: 20 | CT86: 20 | CU86: 20 | CV86: 20 | CW86: 0 | CX86: =FIB(RC[-101])+RC[-1]+R[-1]C+R[-1]C[-1] -> 930410 | CY86: =FIB(RC[-101])+RC[-1]+R[-1]C+R[-1]C[-1] -> 80015260 | CZ86: =FIB(RC[-101])+RC[-1]+R[-1]C+R[-1]C[-1] -> 4561800230 | DA86: =FIB(RC[-101])+RC[-1]+R[-1]C+R[-1]C[-1] -> 195077203880 | DB86: =FIB(RC[-101])+RC[-1]+R[-1]C+R[-1]C[-1] -> 6675289998962 | DC86: =FIB(RC[-101])+RC[-1]+R[-1]C+R[-1]C[-1] -> 190408329462052 | DD86: =FIB(RC[-101])+RC[-1]+R[-1]C+R[-1]C[-1] -> 4.65712515413358E+15 | DE86: =FIB(RC[-101])+RC[-1]+R[-1]C+R[-1]C[-1] -> 9.97126574580009E+16 | DF86: =FIB(RC[-101])+RC[-1]+R[-1]C+R[-1]C[-1] -> 1.89868015850579E+18 | DG86: =FIB(RC[-101])+RC[-1]+R[-1]C+R[-1]C[-1] -> 3.25571721021614E+19 | DH86: =FIB(RC[-101])+RC[-1]+R[-1]C+R[-1]C[-1] -> 5.0784211191406E+20 | DI86: =FIB(RC[-101])+RC[-1]+R[-1]C+R[-1]C[-1] -> 7.26659416920233E+21 | DJ86: =FIB(RC[-101])+RC[-1]+R[-1]C+R[-1]C[-1] -> 9.60524390981975E+22 | DK86: =FIB(RC[-101])+RC[-1]+R[-1]C+R[-1]C[-1] -> 1.17995948642796E+24 | DL86: =FIB(RC[-101])+RC[-1]+R[-1]C+R[-1]C[-1] -> 1.3541187088437E+25 | DM86: =FIB(RC[-101])+RC[-1]+R[-1]C+R[-1]C[-1] -> 1.45827649026197E+26 | DN86: =FIB(RC[-101])+RC[-1]+R[-1]C+R[-1]C[-1] -> 1.47959923393498E+27 | DO86: =FIB(RC[-101])+RC[-1]+R[-1]C+R[-1]C[-1] -> 1.41939188353515E+28 | DP86: =FIB(RC[-101])+RC[-1]+R[-1]C+R[-1]C[-1] -> 1.29146995108207E+29 | DQ86: =FIB(RC[-101])+RC[-1]+R[-1]C+R[-1]C[-1] -> 1.11769103106876E+30 | DR86: =FIB(RC[-101])+RC[-1]+R[-1]C+R[-1]C[-1] -> 9.22419553404387E+30 | DS86: =FIB(RC[-101])+RC[-1]+R[-1]C+R[-1]C[-1] -> 7.27640430897248E+31 | DT86: =FIB(RC[-101])+RC[-1]+R[-1]C+R[-1]C[-1] -> 5.4980798565617E+32 | DU86: =FIB(RC[-101])+RC[-1]+R[-1]C+R[-1]C[-1] -> 3.9871141057612E+33 | DV86: =FIB(RC[-101])+RC[-1]+R[-1]C+R[-1]C[-1] -> 2.77996761496365E+34 | DW86: =FIB(RC[-101])+RC[-1]+R[-1]C+R[-1]C[-1] -> 1.86670095162764E+35 | DX86: =FIB(RC[-101])+RC[-1]+R[-1]C+R[-1]C[-1] -> 1.20901399454531E+36 | DY86: =FIB(RC[-101])+RC[-1]+R[-1]C+R[-1]C[-1] -> 7.56362448702293E+36 | DZ86: =FIB(RC[-101])+RC[-1]+R[-1]C+R[-1]C[-1] -> 4.57666268664893E+37 | EA86: =FIB(RC[-101])+RC[-1]+R[-1]C+R[-1]C[-1] -> 2.68181276809778E+38 | EB86: =FIB(RC[-101])+RC[-1]+R[-1]C+R[-1]C[-1] -> 1.5236128109828E+39 | EC86: =FIB(RC[-101])+RC[-1]+R[-1]C+R[-1]C[-1] -> 8.40160657059879E+39 | ED86: =FIB(RC[-101])+RC[-1]+R[-1]C+R[-1]C[-1] -> 4.50130404098134E+40 | EE86: =FIB(RC[-101])+RC[-1]+R[-1]C+R[-1]C[-1] -> 2.3454361549729E+41 | EF86: =FIB(RC[-101])+RC[-1]+R[-1]C+R[-1]C[-1] -> 1.18964004639915E+42 | EG86: =FIB(RC[-101])+RC[-1]+R[-1]C+R[-1]C[-1] -> 5.87881873546276E+42 | EH86: =FIB(RC[-101])+RC[-1]+R[-1]C+R[-1]C[-1] -> 2.83271633901217E+43 | EI86: =FIB(RC[-101])+RC[-1]+R[-1]C+R[-1]C[-1] -> 1.33196348234814E+44 | EJ86: =FIB(RC[-101])+RC[-1]+R[-1]C+R[-1]C[-1] -> 6.11615583512251E+44 | EK86: =FIB(RC[-101])+RC[-1]+R[-1]C+R[-1]C[-1] -> 2.74452305904382E+45 | EL86: =FIB(RC[-101])+RC[-1]+R[-1]C+R[-1]C[-1] -> 1.20433674740728E+46 | EM86: =FIB(RC[-101])+RC[-1]+R[-1]C+R[-1]C[-1] -> 5.17128877020771E+46 | EN86: =FIB(RC[-101])+RC[-1]+R[-1]C+R[-1]C[-1] -> 2.17412214673633E+47 | EO86: =FIB(RC[-101])+RC[-1]+R[-1]C+R[-1]C[-1] -> 8.95480520008651E+47 | EP86: =FIB(RC[-101])+RC[-1]+R[-1]C+R[-1]C[-1] -> 3.6154068081582E+48 | EQ86: =FIB(RC[-101])+RC[-1]+R[-1]C+R[-1]C[-1] -> 1.43158953825096E+49 | ER86: =FIB(RC[-101])+RC[-1]+R[-1]C+R[-1]C[-1] -> 5.56239749698813E+49 | ES86: =FIB(RC[-101])+RC[-1]+R[-1]C+R[-1]C[-1] -> 2.12178058392243E+50 | ET86: =FIB(RC[-101])+RC[-1]+R[-1]C+R[-1]C[-1] -> 7.94946913951588E+50 | EU86: =FIB(RC[-101])+RC[-1]+R[-1]C+R[-1]C[-1] -> 2.92665294293883E+51 | EV86: =FIB(RC[-101])+RC[-1]+R[-1]C+R[-1]C[-1] -> 1.05922548811788E+52 | EW86: =FIB(RC[-101])+RC[-1]+R[-1]C+R[-1]C[-1] -> 3.77025939379126E+52 | EX86: =FIB(RC[-101])+RC[-1]+R[-1]C+R[-1]C[-1] -> 1.32036619192535E+53 | EY86: =FIB(RC[-101])+RC[-1]+R[-1]C+R[-1]C[-1] -> 4.55120358530238E+53 | EZ86: =FIB(RC[-101])+RC[-1]+R[-1]C+R[-1]C[-1] -> 1.54464652263759E+54 | FA86: =FIB(RC[-101])+RC[-1]+R[-1]C+R[-1]C[-1] -> 5.16368169803913E+54 | FB86: =FIB(RC[-101])+RC[-1]+R[-1]C+R[-1]C[-1] -> 1.70085925549543E+55 | FC86: =FIB(RC[-101])+RC[-1]+R[-1]C+R[-1]C[-1] -> 5.52206755807831E+55 | FD86: =FIB(RC[-101])+RC[-1]+R[-1]C+R[-1]C[-1] -> 1.76766676144089E+56 | FE86: =FIB(RC[-101])+RC[-1]+R[-1]C+R[-1]C[-1] -> 5.58085357998425E+56 | FF86: =FIB(RC[-101])+RC[-1]+R[-1]C+R[-1]C[-1] -> 1.73833765223567E+57 | FG86: =FIB(RC[-101])+RC[-1]+R[-1]C+R[-1]C[-1] -> 5.34353137693877E+57 | FH86: =FIB(RC[-101])+RC[-1]+R[-1]C+R[-1]C[-1] -> 1.62146158713514E+58 | FI86: =FIB(RC[-101])+RC[-1]+R[-1]C+R[-1]C[-1] -> 4.85834654804412E+58 | FJ86: =FIB(RC[-101])+RC[-1]+R[-1]C+R[-1]C[-1] -> 1.43777046352645E+59 | FK86: =FIB(RC[-101])+RC[-1]+R[-1]C+R[-1]C[-1] -> 4.20360608826228E+59 | FL86: =FIB(RC[-101])+RC[-1]+R[-1]C+R[-1]C[-1] -> 1.21449177863522E+60 | FM86: =FIB(RC[-101])+RC[-1]+R[-1]C+R[-1]C[-1] -> 3.46826845497028E+60 | FN86: =FIB(RC[-101])+RC[-1]+R[-1]C+R[-1]C[-1] -> 9.79216444561034E+60 | FO86: =FIB(RC[-101])+RC[-1]+R[-1]C+R[-1]C[-1] -> 2.73395806227474E+61 | FP86: =FIB(RC[-101])+RC[-1]+R[-1]C+R[-1]C[-1] -> 7.5500278840599E+61 | FQ86: =FIB(RC[-101])+RC[-1]+R[-1]C+R[-1]C[-1] -> 2.06273026471632E+62 | FR86: =FIB(RC[-101])+RC[-1]+R[-1]C+R[-1]C[-1] -> 5.57653528810578E+62 | FS86: =FIB(RC[-101])+RC[-1]+R[-1]C+R[-1]C[-1] -> 1.49211735620321E+63 | FT86: =FIB(RC[-101])+RC[-1]+R[-1]C+R[-1]C[-1] -> 3.95224572056977E+63 | FU86: =FIB(RC[-101])+RC[-1]+R[-1]C+R[-1]C[-1] -> 1.03650371043772E+64 | FV86: =FIB(RC[-101])+RC[-1]+R[-1]C+R[-1]C[-1] -> 2.69193768780755E+64 | FW86: =FIB(RC[-101])+RC[-1]+R[-1]C+R[-1]C[-1] -> 6.92477090152302E+64 | FX86: =FIB(RC[-101])+RC[-1]+R[-1]C+R[-1]C[-1] -> 1.76469235925244E+65 | FY86: =FIB(RC[-101])+RC[-1]+R[-1]C+R[-1]C[-1] -> 4.45585104442748E+65 | FZ86: =FIB(RC[-101])+RC[-1]+R[-1]C+R[-1]C[-1] -> 1.11497026831765E+66 | GA86: =FIB(RC[-101])+RC[-1]+R[-1]C+R[-1]C[-1] -> 2.76527206514854E+66 | GB86: =FIB(RC[-101])+RC[-1]+R[-1]C+R[-1]C[-1] -> 6.79866367641503E+66 | GC86: =FIB(RC[-101])+RC[-1]+R[-1]C+R[-1]C[-1] -> 1.65724889294559E+67 | GD86: =FIB(RC[-101])+RC[-1]+R[-1]C+R[-1]C[-1] -> 4.00586277147744E+67 | GE86: =FIB(RC[-101])+RC[-1]+R[-1]C+R[-1]C[-1] -> 9.60312430026766E+67 | GF86: =FIB(RC[-101])+RC[-1]+R[-1]C+R[-1]C[-1] -> 2.283492475509E+68 | GG86: =FIB(RC[-101])+RC[-1]+R[-1]C+R[-1]C[-1] -> 5.38664084914054E+68 | GH86: =FIB(RC[-101])+RC[-1]+R[-1]C+R[-1]C[-1] -> 1.26074485735711E+69 | GI86: =FIB(RC[-101])+RC[-1]+R[-1]C+R[-1]C[-1] -> 2.92809415739351E+69 | GJ86: =FIB(RC[-101])+RC[-1]+R[-1]C+R[-1]C[-1] -> 6.74913338545527E+69 | GK86: =FIB(RC[-101])+RC[-1]+R[-1]C+R[-1]C[-1] -> 1.54408519264746E+70 | GL86: =FIB(RC[-101])+RC[-1]+R[-1]C+R[-1]C[-1] -> 3.5067805923538E+70 | GM86: =FIB(RC[-101])+RC[-1]+R[-1]C+R[-1]C[-1] -> 7.90701493839057E+70 | GN86: =FIB(RC[-101])+RC[-1]+R[-1]C+R[-1]C[-1] -> 1.77024940015373E+71 | GO86: =FIB(RC[-101])+RC[-1]+R[-1]C+R[-1]C[-1] -> 3.93572176396874E+71 | GP86: =FIB(RC[-101])+RC[-1]+R[-1]C+R[-1]C[-1] -> 8.69023055725167E+71 | GQ86: =FIB(RC[-101])+RC[-1]+R[-1]C+R[-1]C[-1] -> 1.90591269019898E+72 | GR86: =FIB(RC[-101])+RC[-1]+R[-1]C+R[-1]C[-1] -> 4.15227605540498E+72 | GS86: =FIB(RC[-101])+RC[-1]+R[-1]C+R[-1]C[-1] -> 8.9872456180395E+72
A87: 20 | B87: 20 | C87: 20 | D87: 20 | E87: 20 | F87: 20 | G87: 20 | H87: 20 | I87: 20 | J87: 20 | K87: 20 | L87: 20 | M87: 20 | N87: 20 | O87: 20 | P87: 20 | Q87: 20 | R87: 20 | S87: 20 | T87: 20 | U87: 20 | V87: 20 | W87: 20 | X87: 20 | Y87: 20 | Z87: 20 | AA87: 20 | AB87: 20 | AC87: 20 | AD87: 20 | AE87: 20 | AF87: 20 | AG87: 20 | AH87: 20 | AI87: 20 | AJ87: 20 | AK87: 20 | AL87: 20 | AM87: 20 | AN87: 20 | AO87: 20 | AP87: 20 | AQ87: 20 | AR87: 20 | AS87: 20 | AT87: 20 | AU87: 20 | AV87: 20 | AW87: 20 | AX87: 20 | AY87: 20 | AZ87: 20 | BA87: 20 | BB87: 20 | BC87: 20 | BD87: 20 | BE87: 20 | BF87: 20 | BG87: 20 | BH87: 20 | BI87: 20 | BJ87: 20 | BK87: 20 | BL87: 20 | BM87: 20 | BN87: 20 | BO87: 20 | BP87: 20 | BQ87: 20 | BR87: 20 | BS87: 20 | BT87: 20 | BU87: 20 | BV87: 20 | BW87: 20 | BX87: 20 | BY87: 20 | BZ87: 20 | CA87: 20 | CB87: 20 | CC87: 20 | CD87: 20 | CE87: 20 | CF87: 20 | CG87: 20 | CH87: 20 | CI87: 20 | CJ87: 20 | CK87: 20 | CL87: 20 | CM87: 20 | CN87: 20 | CO87: 20 | CP87: 20 | CQ87: 20 | CR87: 20 | CS87: 20 | CT87: 20 | CU87: 20 | CV87: 20 | CW87: 0 | CX87: =FIB(RC[-101])+RC[-1]+R[-1]C+R[-1]C[-1] -> 941356 | CY87: =FIB(RC[-101])+RC[-1]+R[-1]C+R[-1]C[-1] -> 81897972 | CZ87: =FIB(RC[-101])+RC[-1]+R[-1]C+R[-1]C[-1] -> 4723724408 | DA87: =FIB(RC[-101])+RC[-1]+R[-1]C+R[-1]C[-1] -> 204362739464 | DB87: =FIB(RC[-101])+RC[-1]+R[-1]C+R[-1]C[-1] -> 7074729953252 | DC87: =FIB(RC[-101])+RC[-1]+R[-1]C+R[-1]C[-1] -> 204158349425212 | DD87: =FIB(RC[-101])+RC[-1]+R[-1]C+R[-1]C[-1] -> 5.05169183303179E+15 | DE87: =FIB(RC[-101])+RC[-1]+R[-1]C+R[-1]C[-1] -> 1.09421474445177E+17 | DF87: =FIB(RC[-101])+RC[-1]+R[-1]C+R[-1]C[-1] -> 2.10781429040898E+18 | DG87: =FIB(RC[-101])+RC[-1]+R[-1]C+R[-1]C[-1] -> 3.65636665510762E+19 | DH87: =FIB(RC[-101])+RC[-1]+R[-1]C+R[-1]C[-1] -> 5.76962950567297E+20 | DI87: =FIB(RC[-101])+RC[-1]+R[-1]C+R[-1]C[-1] -> 8.35139923168369E+21 | DJ87: =FIB(RC[-101])+RC[-1]+R[-1]C+R[-1]C[-1] -> 1.11670432499083E+23 | DK87: =FIB(RC[-101])+RC[-1]+R[-1]C+R[-1]C[-1] -> 1.38768235802524E+24 | DL87: =FIB(RC[-101])+RC[-1]+R[-1]C+R[-1]C[-1] -> 1.61088289328902E+25 | DM87: =FIB(RC[-101])+RC[-1]+R[-1]C+R[-1]C[-1] -> 1.75477665047524E+26 | DN87: =FIB(RC[-101])+RC[-1]+R[-1]C+R[-1]C[-1] -> 1.8009045480087E+27 | DO87: =FIB(RC[-101])+RC[-1]+R[-1]C+R[-1]C[-1] -> 1.74744226172952E+28 | DP87: =FIB(RC[-101])+RC[-1]+R[-1]C+R[-1]C[-1] -> 1.60815336560854E+29 | DQ87: =FIB(RC[-101])+RC[-1]+R[-1]C+R[-1]C[-1] -> 1.40765336273782E+30 | DR87: =FIB(RC[-101])+RC[-1]+R[-1]C+R[-1]C[-1] -> 1.17495399278504E+31 | DS87: =FIB(RC[-101])+RC[-1]+R[-1]C+R[-1]C[-1] -> 9.37377785516191E+31 | DT87: =FIB(RC[-101])+RC[-1]+R[-1]C+R[-1]C[-1] -> 7.16309807297514E+32 | DU87: =FIB(RC[-101])+RC[-1]+R[-1]C+R[-1]C[-1] -> 5.25323189871488E+33 | DV87: =FIB(RC[-101])+RC[-1]+R[-1]C+R[-1]C[-1] -> 3.70400221541126E+34 | DW87: =FIB(RC[-101])+RC[-1]+R[-1]C+R[-1]C[-1] -> 2.51509793466514E+35 | DX87: =FIB(RC[-101])+RC[-1]+R[-1]C+R[-1]C[-1] -> 1.64719388317458E+36 | DY87: =FIB(RC[-101])+RC[-1]+R[-1]C+R[-1]C[-1] -> 1.04198323647428E+37 | DZ87: =FIB(RC[-101])+RC[-1]+R[-1]C+R[-1]C[-1] -> 6.3750083718255E+37 | EA87: =FIB(RC[-101])+RC[-1]+R[-1]C+R[-1]C[-1] -> 3.77697987394522E+38 | EB87: =FIB(RC[-101])+RC[-1]+R[-1]C+R[-1]C[-1] -> 2.1694920751871E+39 | EC87: =FIB(RC[-101])+RC[-1]+R[-1]C+R[-1]C[-1] -> 1.20947114567687E+40 | ED87: =FIB(RC[-101])+RC[-1]+R[-1]C+R[-1]C[-1] -> 6.55093584371809E+40 | EE87: =FIB(RC[-101])+RC[-1]+R[-1]C+R[-1]C[-1] -> 3.45066014344284E+41 | EF87: =FIB(RC[-101])+RC[-1]+R[-1]C+R[-1]C[-1] -> 1.76924967624072E+42 | EG87: =FIB(RC[-101])+RC[-1]+R[-1]C+R[-1]C[-1] -> 8.83770845810264E+42 | EH87: =FIB(RC[-101])+RC[-1]+R[-1]C+R[-1]C[-1] -> 4.30436905836871E+43 | EI87: =FIB(RC[-101])+RC[-1]+R[-1]C+R[-1]C[-1] -> 2.04567202208623E+44 | EJ87: =FIB(RC[-101])+RC[-1]+R[-1]C+R[-1]C[-1] -> 9.49379133955688E+44 | EK87: =FIB(RC[-101])+RC[-1]+R[-1]C+R[-1]C[-1] -> 4.30551777651176E+45 | EL87: =FIB(RC[-101])+RC[-1]+R[-1]C+R[-1]C[-1] -> 1.90934083096283E+46 | EM87: =FIB(RC[-101])+RC[-1]+R[-1]C+R[-1]C[-1] -> 8.28496634857782E+46 | EN87: =FIB(RC[-101])+RC[-1]+R[-1]C+R[-1]C[-1] -> 3.51974765861489E+47 | EO87: =FIB(RC[-101])+RC[-1]+R[-1]C+R[-1]C[-1] -> 1.46486750054377E+48 | EP87: =FIB(RC[-101])+RC[-1]+R[-1]C+R[-1]C[-1] -> 5.97575482871063E+48 | EQ87: =FIB(RC[-101])+RC[-1]+R[-1]C+R[-1]C[-1] -> 2.39070570193784E+49 | ER87: =FIB(RC[-101])+RC[-1]+R[-1]C+R[-1]C[-1] -> 9.38469273717693E+49 | ES87: =FIB(RC[-101])+RC[-1]+R[-1]C+R[-1]C[-1] -> 3.61648960733893E+50 | ET87: =FIB(RC[-101])+RC[-1]+R[-1]C+R[-1]C[-1] -> 1.36877393307772E+51 | EU87: =FIB(RC[-101])+RC[-1]+R[-1]C+R[-1]C[-1] -> 5.09037378996814E+51 | EV87: =FIB(RC[-101])+RC[-1]+R[-1]C+R[-1]C[-1] -> 1.86092816140858E+52 | EW87: =FIB(RC[-101])+RC[-1]+R[-1]C+R[-1]C[-1] -> 6.69041304331772E+52 | EX87: =FIB(RC[-101])+RC[-1]+R[-1]C+R[-1]C[-1] -> 2.36643343563625E+53 | EY87: =FIB(RC[-101])+RC[-1]+R[-1]C+R[-1]C[-1] -> 8.23800321286398E+53 | EZ87: =FIB(RC[-101])+RC[-1]+R[-1]C+R[-1]C[-1] -> 2.82356720245423E+54 | FA87: =FIB(RC[-101])+RC[-1]+R[-1]C+R[-1]C[-1] -> 9.53189542313096E+54 | FB87: =FIB(RC[-101])+RC[-1]+R[-1]C+R[-1]C[-1] -> 3.17041696761244E+55 | FC87: =FIB(RC[-101])+RC[-1]+R[-1]C+R[-1]C[-1] -> 1.03933437811862E+56 | FD87: =FIB(RC[-101])+RC[-1]+R[-1]C+R[-1]C[-1] -> 3.35920789536734E+56 | FE87: =FIB(RC[-101])+RC[-1]+R[-1]C+R[-1]C[-1] -> 1.07077282367925E+57 | FF87: =FIB(RC[-101])+RC[-1]+R[-1]C+R[-1]C[-1] -> 3.36719583391334E+57 | FG87: =FIB(RC[-101])+RC[-1]+R[-1]C+R[-1]C[-1] -> 1.04490648630878E+58 | FH87: =FIB(RC[-101])+RC[-1]+R[-1]C+R[-1]C[-1] -> 3.2007212111378E+58 | FI87: =FIB(RC[-101])+RC[-1]+R[-1]C+R[-1]C[-1] -> 9.68052934631707E+58 | FJ87: =FIB(RC[-101])+RC[-1]+R[-1]C+R[-1]C[-1] -> 2.89165805296257E+59 | FK87: =FIB(RC[-101])+RC[-1]+R[-1]C+R[-1]C[-1] -> 8.5330346047513E+59 | FL87: =FIB(RC[-101])+RC[-1]+R[-1]C+R[-1]C[-1] -> 2.48815584793657E+60 | FM87: =FIB(RC[-101])+RC[-1]+R[-1]C+R[-1]C[-1] -> 7.17091608154207E+60 | FN87: =FIB(RC[-101])+RC[-1]+R[-1]C+R[-1]C[-1] -> 2.04313489821227E+61 | FO87: =FIB(RC[-101])+RC[-1]+R[-1]C+R[-1]C[-1] -> 5.75630940504804E+61 | FP87: =FIB(RC[-101])+RC[-1]+R[-1]C+R[-1]C[-1] -> 1.60402953513827E+62 | FQ87: =FIB(RC[-101])+RC[-1]+R[-1]C+R[-1]C[-1] -> 4.42176258826057E+62 | FR87: =FIB(RC[-101])+RC[-1]+R[-1]C+R[-1]C[-1] -> 1.20610281410827E+63 | FS87: =FIB(RC[-101])+RC[-1]+R[-1]C+R[-1]C[-1] -> 3.25587369912206E+63 | FT87: =FIB(RC[-101])+RC[-1]+R[-1]C+R[-1]C[-1] -> 8.70023677589504E+63 | FU87: =FIB(RC[-101])+RC[-1]+R[-1]C+R[-1]C[-1] -> 2.3017519600842E+64 | FV87: =FIB(RC[-101])+RC[-1]+R[-1]C+R[-1]C[-1] -> 6.03019335832948E+64 | FW87: =FIB(RC[-101])+RC[-1]+R[-1]C+R[-1]C[-1] -> 1.564690194766E+65 | FX87: =FIB(RC[-101])+RC[-1]+R[-1]C+R[-1]C[-1] -> 4.02185964417074E+65 | FY87: =FIB(RC[-101])+RC[-1]+R[-1]C+R[-1]C[-1] -> 1.02424030478507E+66 | FZ87: =FIB(RC[-101])+RC[-1]+R[-1]C+R[-1]C[-1] -> 2.58479567754546E+66 | GA87: =FIB(RC[-101])+RC[-1]+R[-1]C+R[-1]C[-1] -> 6.46503801101165E+66 | GB87: =FIB(RC[-101])+RC[-1]+R[-1]C+R[-1]C[-1] -> 1.60289737525752E+67 | GC87: =FIB(RC[-101])+RC[-1]+R[-1]C+R[-1]C[-1] -> 3.94001263584462E+67 | GD87: =FIB(RC[-101])+RC[-1]+R[-1]C+R[-1]C[-1] -> 9.60312430026766E+67 | GE87: =FIB(RC[-101])+RC[-1]+R[-1]C+R[-1]C[-1] -> 2.32121113720128E+68 | GF87: =FIB(RC[-101])+RC[-1]+R[-1]C+R[-1]C[-1] -> 5.56501604273704E+68 | GG87: =FIB(RC[-101])+RC[-1]+R[-1]C+R[-1]C[-1] -> 1.32351493673866E+69 | GH87: =FIB(RC[-101])+RC[-1]+R[-1]C+R[-1]C[-1] -> 3.12292387900982E+69 | GI87: =FIB(RC[-101])+RC[-1]+R[-1]C+R[-1]C[-1] -> 7.31176289376044E+69 | GJ87: =FIB(RC[-101])+RC[-1]+R[-1]C+R[-1]C[-1] -> 1.69889904366092E+70 | GK87: =FIB(RC[-101])+RC[-1]+R[-1]C+R[-1]C[-1] -> 3.91789757485391E+70 | GL87: =FIB(RC[-101])+RC[-1]+R[-1]C+R[-1]C[-1] -> 8.96876335985517E+70 | GM87: =FIB(RC[-101])+RC[-1]+R[-1]C+R[-1]C[-1] -> 2.03825588905995E+71 | GN87: =FIB(RC[-101])+RC[-1]+R[-1]C+R[-1]C[-1] -> 4.59920678305274E+71 | GO87: =FIB(RC[-101])+RC[-1]+R[-1]C+R[-1]C[-1] -> 1.03051779471752E+72 | GP87: =FIB(RC[-101])+RC[-1]+R[-1]C+R[-1]C[-1] -> 2.29311302683956E+72 | GQ87: =FIB(RC[-101])+RC[-1]+R[-1]C+R[-1]C[-1] -> 5.06804877276371E+72 | GR87: =FIB(RC[-101])+RC[-1]+R[-1]C+R[-1]C[-1] -> 1.11262375183677E+73 | GS87: =FIB(RC[-101])+RC[-1]+R[-1]C+R[-1]C[-1] -> 2.42657591918122E+73
A88: 20 | B88: 20 | C88: 20 | D88: 20 | E88: 20 | F88: 20 | G88: 20 | H88: 20 | I88: 20 | J88: 20 | K88: 20 | L88: 20 | M88: 20 | N88: 20 | O88: 20 | P88: 20 | Q88: 20 | R88: 20 | S88: 20 | T88: 20 | U88: 20 | V88: 20 | W88: 20 | X88: 20 | Y88: 20 | Z88: 20 | AA88: 20 | AB88: 20 | AC88: 20 | AD88: 20 | AE88: 20 | AF88: 20 | AG88: 20 | AH88: 20 | AI88: 20 | AJ88: 20 | AK88: 20 | AL88: 20 | AM88: 20 | AN88: 20 | AO88: 20 | AP88: 20 | AQ88: 20 | AR88: 20 | AS88: 20 | AT88: 20 | AU88: 20 | AV88: 20 | AW88: 20 | AX88: 20 | AY88: 20 | AZ88: 20 | BA88: 20 | BB88: 20 | BC88: 20 | BD88: 20 | BE88: 20 | BF88: 20 | BG88: 20 | BH88: 20 | BI88: 20 | BJ88: 20 | BK88: 20 | BL88: 20 | BM88: 20 | BN88: 20 | BO88: 20 | BP88: 20 | BQ88: 20 | BR88: 20 | BS88: 20 | BT88: 20 | BU88: 20 | BV88: 20 | BW88: 20 | BX88: 20 | BY88: 20 | BZ88: 20 | CA88: 20 | CB88: 20 | CC88: 20 | CD88: 20 | CE88: 20 | CF88: 20 | CG88: 20 | CH88: 20 | CI88: 20 | CJ88: 20 | CK88: 20 | CL88: 20 | CM88: 20 | CN88: 20 | CO88: 20 | CP88: 20 | CQ88: 20 | CR88: 20 | CS88: 20 | CT88: 20 | CU88: 20 | CV88: 20 | CW88: 0 | CX88: =FIB(RC[-101])+RC[-1]+R[-1]C+R[-1]C[-1] -> 952302 | CY88: =FIB(RC[-101])+RC[-1]+R[-1]C+R[-1]C[-1] -> 83802576 | CZ88: =FIB(RC[-101])+RC[-1]+R[-1]C+R[-1]C[-1] -> 4889435902 | DA88: =FIB(RC[-101])+RC[-1]+R[-1]C+R[-1]C[-1] -> 213975910720 | DB88: =FIB(RC[-101])+RC[-1]+R[-1]C+R[-1]C[-1] -> 7493068614382 | DC88: =FIB(RC[-101])+RC[-1]+R[-1]C+R[-1]C[-1] -> 218726148003792 | DD88: =FIB(RC[-101])+RC[-1]+R[-1]C+R[-1]C[-1] -> 5.47457633047174E+15 | DE88: =FIB(RC[-101])+RC[-1]+R[-1]C+R[-1]C[-1] -> 1.19947742608692E+17 | DF88: =FIB(RC[-101])+RC[-1]+R[-1]C+R[-1]C[-1] -> 2.33718350746286E+18 | DG88: =FIB(RC[-101])+RC[-1]+R[-1]C+R[-1]C[-1] -> 4.1008664348948E+19 | DH88: =FIB(RC[-101])+RC[-1]+R[-1]C+R[-1]C[-1] -> 6.54535281467322E+20 | DI88: =FIB(RC[-101])+RC[-1]+R[-1]C+R[-1]C[-1] -> 9.58289746371831E+21 | DJ88: =FIB(RC[-101])+RC[-1]+R[-1]C+R[-1]C[-1] -> 1.29604729194485E+23 | DK88: =FIB(RC[-101])+RC[-1]+R[-1]C+R[-1]C[-1] -> 1.62895751971881E+24 | DL88: =FIB(RC[-101])+RC[-1]+R[-1]C+R[-1]C[-1] -> 1.91254688106343E+25 | DM88: =FIB(RC[-101])+RC[-1]+R[-1]C+R[-1]C[-1] -> 2.10711962791049E+26 | DN88: =FIB(RC[-101])+RC[-1]+R[-1]C+R[-1]C[-1] -> 2.18709417584728E+27 | DO88: =FIB(RC[-101])+RC[-1]+R[-1]C+R[-1]C[-1] -> 2.14624213411512E+28 | DP88: =FIB(RC[-101])+RC[-1]+R[-1]C+R[-1]C[-1] -> 1.997521805193E+29 | DQ88: =FIB(RC[-101])+RC[-1]+R[-1]C+R[-1]C[-1] -> 1.76822087981797E+30 | DR88: =FIB(RC[-101])+RC[-1]+R[-1]C+R[-1]C[-1] -> 1.49254141704062E+31 | DS88: =FIB(RC[-101])+RC[-1]+R[-1]C+R[-1]C[-1] -> 1.20412732649876E+32 | DT88: =FIB(RC[-101])+RC[-1]+R[-1]C+R[-1]C[-1] -> 9.30460318499009E+32 | DU88: =FIB(RC[-101])+RC[-1]+R[-1]C+R[-1]C[-1] -> 6.9000020245114E+33 | DV88: =FIB(RC[-101])+RC[-1]+R[-1]C+R[-1]C[-1] -> 4.91932560773389E+34 | DW88: =FIB(RC[-101])+RC[-1]+R[-1]C+R[-1]C[-1] -> 3.37743071697965E+35 | DX88: =FIB(RC[-101])+RC[-1]+R[-1]C+R[-1]C[-1] -> 2.23644674833906E+36 | DY88: =FIB(RC[-101])+RC[-1]+R[-1]C+R[-1]C[-1] -> 1.43034729962565E+37 | DZ88: =FIB(RC[-101])+RC[-1]+R[-1]C+R[-1]C[-1] -> 8.84733890792543E+37 | EA88: =FIB(RC[-101])+RC[-1]+R[-1]C+R[-1]C[-1] -> 5.29921460192031E+38 | EB88: =FIB(RC[-101])+RC[-1]+R[-1]C+R[-1]C[-1] -> 3.07711152277365E+39 | EC88: =FIB(RC[-101])+RC[-1]+R[-1]C+R[-1]C[-1] -> 1.73413150547294E+40 | ED88: =FIB(RC[-101])+RC[-1]+R[-1]C+R[-1]C[-1] -> 9.4945384948679E+40 | EE88: =FIB(RC[-101])+RC[-1]+R[-1]C+R[-1]C[-1] -> 5.05520757730144E+41 | EF88: =FIB(RC[-101])+RC[-1]+R[-1]C+R[-1]C[-1] -> 2.61983644831515E+42 | EG88: =FIB(RC[-101])+RC[-1]+R[-1]C+R[-1]C[-1] -> 1.32267945826585E+43 | EH88: =FIB(RC[-101])+RC[-1]+R[-1]C+R[-1]C[-1] -> 6.51081936244482E+43 | EI88: =FIB(RC[-101])+RC[-1]+R[-1]C+R[-1]C[-1] -> 3.12719086416758E+44 | EJ88: =FIB(RC[-101])+RC[-1]+R[-1]C+R[-1]C[-1] -> 1.46666542258107E+45 | EK88: =FIB(RC[-101])+RC[-1]+R[-1]C+R[-1]C[-1] -> 6.72156233304851E+45 | EL88: =FIB(RC[-101])+RC[-1]+R[-1]C+R[-1]C[-1] -> 3.01204884191886E+46 | EM88: =FIB(RC[-101])+RC[-1]+R[-1]C+R[-1]C[-1] -> 1.32063560214595E+47 | EN88: =FIB(RC[-101])+RC[-1]+R[-1]C+R[-1]C[-1] -> 5.66887989561862E+47 | EO88: =FIB(RC[-101])+RC[-1]+R[-1]C+R[-1]C[-1] -> 2.38373025596712E+48 | EP88: =FIB(RC[-101])+RC[-1]+R[-1]C+R[-1]C[-1] -> 9.82435258522152E+48 | EQ88: =FIB(RC[-101])+RC[-1]+R[-1]C+R[-1]C[-1] -> 3.97071644333106E+49 | ER88: =FIB(RC[-101])+RC[-1]+R[-1]C+R[-1]C[-1] -> 1.57461148824458E+50 | ES88: =FIB(RC[-101])+RC[-1]+R[-1]C+R[-1]C[-1] -> 6.12957036930121E+50 | ET88: =FIB(RC[-101])+RC[-1]+R[-1]C+R[-1]C[-1] -> 2.34337993074174E+51 | EU88: =FIB(RC[-101])+RC[-1]+R[-1]C+R[-1]C[-1] -> 8.8025276537876E+51 | EV88: =FIB(RC[-101])+RC[-1]+R[-1]C+R[-1]C[-1] -> 3.25021830578415E+52 | EW88: =FIB(RC[-101])+RC[-1]+R[-1]C+R[-1]C[-1] -> 1.18015595105104E+53 | EX88: =FIB(RC[-101])+RC[-1]+R[-1]C+R[-1]C[-1] -> 4.21563069101906E+53 | EY88: =FIB(RC[-101])+RC[-1]+R[-1]C+R[-1]C[-1] -> 1.48200673395193E+54 | EZ88: =FIB(RC[-101])+RC[-1]+R[-1]C+R[-1]C[-1] -> 5.12937425769256E+54 | FA88: =FIB(RC[-101])+RC[-1]+R[-1]C+R[-1]C[-1] -> 1.74848368832777E+55 | FB88: =FIB(RC[-101])+RC[-1]+R[-1]C+R[-1]C[-1] -> 5.87209019825331E+55 | FC88: =FIB(RC[-101])+RC[-1]+R[-1]C+R[-1]C[-1] -> 1.94358509470519E+56 | FD88: =FIB(RC[-101])+RC[-1]+R[-1]C+R[-1]C[-1] -> 6.34212736819116E+56 | FE88: =FIB(RC[-101])+RC[-1]+R[-1]C+R[-1]C[-1] -> 2.0409063500351E+57 | FF88: =FIB(RC[-101])+RC[-1]+R[-1]C+R[-1]C[-1] -> 6.47887500762769E+57 | FG88: =FIB(RC[-101])+RC[-1]+R[-1]C+R[-1]C[-1] -> 2.02951357046288E+58 | FH88: =FIB(RC[-101])+RC[-1]+R[-1]C+R[-1]C[-1] -> 6.27514126790946E+58 | FI88: =FIB(RC[-101])+RC[-1]+R[-1]C+R[-1]C[-1] -> 1.91563918253643E+59 | FJ88: =FIB(RC[-101])+RC[-1]+R[-1]C+R[-1]C[-1] -> 5.77535017013071E+59 | FK88: =FIB(RC[-101])+RC[-1]+R[-1]C+R[-1]C[-1] -> 1.72000428278446E+60 | FL88: =FIB(RC[-101])+RC[-1]+R[-1]C+R[-1]C[-1] -> 5.06146359119616E+60 | FM88: =FIB(RC[-101])+RC[-1]+R[-1]C+R[-1]C[-1] -> 1.47205355206748E+61 | FN88: =FIB(RC[-101])+RC[-1]+R[-1]C+R[-1]C[-1] -> 4.23228005843396E+61 | FO88: =FIB(RC[-101])+RC[-1]+R[-1]C+R[-1]C[-1] -> 1.20317243616943E+62 | FP88: =FIB(RC[-101])+RC[-1]+R[-1]C+R[-1]C[-1] -> 3.3828329118125E+62 | FQ88: =FIB(RC[-101])+RC[-1]+R[-1]C+R[-1]C[-1] -> 9.40862503521134E+62 | FR88: =FIB(RC[-101])+RC[-1]+R[-1]C+R[-1]C[-1] -> 2.58914157645546E+63 | FS88: =FIB(RC[-101])+RC[-1]+R[-1]C+R[-1]C[-1] -> 7.05111808968578E+63 | FT88: =FIB(RC[-101])+RC[-1]+R[-1]C+R[-1]C[-1] -> 1.90072285647029E+64 | FU88: =FIB(RC[-101])+RC[-1]+R[-1]C+R[-1]C[-1] -> 5.072498494144E+64 | FV88: =FIB(RC[-101])+RC[-1]+R[-1]C+R[-1]C[-1] -> 1.34044438125577E+65 | FW88: =FIB(RC[-101])+RC[-1]+R[-1]C+R[-1]C[-1] -> 3.50815391185472E+65 | FX88: =FIB(RC[-101])+RC[-1]+R[-1]C+R[-1]C[-1] -> 9.09470375079147E+65 | FY88: =FIB(RC[-101])+RC[-1]+R[-1]C+R[-1]C[-1] -> 2.33589664428129E+66 | FZ88: =FIB(RC[-101])+RC[-1]+R[-1]C+R[-1]C[-1] -> 5.94493262661182E+66 | GA88: =FIB(RC[-101])+RC[-1]+R[-1]C+R[-1]C[-1] -> 1.49947663151689E+67 | GB88: =FIB(RC[-101])+RC[-1]+R[-1]C+R[-1]C[-1] -> 3.74887780787558E+67 | GC88: =FIB(RC[-101])+RC[-1]+R[-1]C+R[-1]C[-1] -> 9.29178781897772E+67 | GD88: =FIB(RC[-101])+RC[-1]+R[-1]C+R[-1]C[-1] -> 2.283492475509E+68 | GE88: =FIB(RC[-101])+RC[-1]+R[-1]C+R[-1]C[-1] -> 5.56501604273704E+68 | GF88: =FIB(RC[-101])+RC[-1]+R[-1]C+R[-1]C[-1] -> 1.34512432226754E+69 | GG88: =FIB(RC[-101])+RC[-1]+R[-1]C+R[-1]C[-1] -> 3.2251408632799E+69 | GH88: =FIB(RC[-101])+RC[-1]+R[-1]C+R[-1]C[-1] -> 7.67157967902837E+69 | GI88: =FIB(RC[-101])+RC[-1]+R[-1]C+R[-1]C[-1] -> 1.81062664517986E+70 | GJ88: =FIB(RC[-101])+RC[-1]+R[-1]C+R[-1]C[-1] -> 4.24070197821683E+70 | GK88: =FIB(RC[-101])+RC[-1]+R[-1]C+R[-1]C[-1] -> 9.85749859673166E+70 | GL88: =FIB(RC[-101])+RC[-1]+R[-1]C+R[-1]C[-1] -> 2.27441595314407E+71 | GM88: =FIB(RC[-101])+RC[-1]+R[-1]C+R[-1]C[-1] -> 5.20954817818954E+71 | GN88: =FIB(RC[-101])+RC[-1]+R[-1]C+R[-1]C[-1] -> 1.18470108503022E+72 | GO88: =FIB(RC[-101])+RC[-1]+R[-1]C+R[-1]C[-1] -> 2.67513955805302E+72 | GP88: =FIB(RC[-101])+RC[-1]+R[-1]C+R[-1]C[-1] -> 5.9987703796101E+72 | GQ88: =FIB(RC[-101])+RC[-1]+R[-1]C+R[-1]C[-1] -> 1.33599321792134E+73 | GR88: =FIB(RC[-101])+RC[-1]+R[-1]C+R[-1]C[-1] -> 2.95542184703448E+73 | GS88: =FIB(RC[-101])+RC[-1]+R[-1]C+R[-1]C[-1] -> 6.49462151805246E+73
A89: 20 | B89: 20 | C89: 20 | D89: 20 | E89: 20 | F89: 20 | G89: 20 | H89: 20 | I89: 20 | J89: 20 | K89: 20 | L89: 20 | M89: 20 | N89: 20 | O89: 20 | P89: 20 | Q89: 20 | R89: 20 | S89: 20 | T89: 20 | U89: 20 | V89: 20 | W89: 20 | X89: 20 | Y89: 20 | Z89: 20 | AA89: 20 | AB89: 20 | AC89: 20 | AD89: 20 | AE89: 20 | AF89: 20 | AG89: 20 | AH89: 20 | AI89: 20 | AJ89: 20 | AK89: 20 | AL89: 20 | AM89: 20 | AN89: 20 | AO89: 20 | AP89: 20 | AQ89: 20 | AR89: 20 | AS89: 20 | AT89: 20 | AU89: 20 | AV89: 20 | AW89: 20 | AX89: 20 | AY89: 20 | AZ89: 20 | BA89: 20 | BB89: 20 | BC89: 20 | BD89: 20 | BE89: 20 | BF89: 20 | BG89: 20 | BH89: 20 | BI89: 20 | BJ89: 20 | BK89: 20 | BL89: 20 | BM89: 20 | BN89: 20 | BO89: 20 | BP89: 20 | BQ89: 20 | BR89: 20 | BS89: 20 | BT89: 20 | BU89: 20 | BV89: 20 | BW89: 20 | BX89: 20 | BY89: 20 | BZ89: 20 | CA89: 20 | CB89: 20 | CC89: 20 | CD89: 20 | CE89: 20 | CF89: 20 | CG89: 20 | CH89: 20 | CI89: 20 | CJ89: 20 | CK89: 20 | CL89: 20 | CM89: 20 | CN89: 20 | CO89: 20 | CP89: 20 | CQ89: 20 | CR89: 20 | CS89: 20 | CT89: 20 | CU89: 20 | CV89: 20 | CW89: 0 | CX89: =FIB(RC[-101])+RC[-1]+R[-1]C+R[-1]C[-1] -> 963248 | CY89: =FIB(RC[-101])+RC[-1]+R[-1]C+R[-1]C[-1] -> 85729072 | CZ89: =FIB(RC[-101])+RC[-1]+R[-1]C+R[-1]C[-1] -> 5058978496 | DA89: =FIB(RC[-101])+RC[-1]+R[-1]C+R[-1]C[-1] -> 223924336064 | DB89: =FIB(RC[-101])+RC[-1]+R[-1]C+R[-1]C[-1] -> 7930968872112 | DC89: =FIB(RC[-101])+RC[-1]+R[-1]C+R[-1]C[-1] -> 234150185501232 | DD89: =FIB(RC[-101])+RC[-1]+R[-1]C+R[-1]C[-1] -> 5.92745266398771E+15 | DE89: =FIB(RC[-101])+RC[-1]+R[-1]C+R[-1]C[-1] -> 1.31349771603162E+17 | DF89: =FIB(RC[-101])+RC[-1]+R[-1]C+R[-1]C[-1] -> 2.58848102167473E+18 | DG89: =FIB(RC[-101])+RC[-1]+R[-1]C+R[-1]C[-1] -> 4.59343288780856E+19 | DH89: =FIB(RC[-101])+RC[-1]+R[-1]C+R[-1]C[-1] -> 7.41478274694355E+20 | DI89: =FIB(RC[-101])+RC[-1]+R[-1]C+R[-1]C[-1] -> 1.097891101988E+22 | DJ89: =FIB(RC[-101])+RC[-1]+R[-1]C+R[-1]C[-1] -> 1.50166537678084E+23 | DK89: =FIB(RC[-101])+RC[-1]+R[-1]C+R[-1]C[-1] -> 1.90872878659138E+24 | DL89: =FIB(RC[-101])+RC[-1]+R[-1]C+R[-1]C[-1] -> 2.26631551169445E+25 | DM89: =FIB(RC[-101])+RC[-1]+R[-1]C+R[-1]C[-1] -> 2.52500586718627E+26 | DN89: =FIB(RC[-101])+RC[-1]+R[-1]C+R[-1]C[-1] -> 2.65030672535695E+27 | DO89: =FIB(RC[-101])+RC[-1]+R[-1]C+R[-1]C[-1] -> 2.62998222423554E+28 | DP89: =FIB(RC[-101])+RC[-1]+R[-1]C+R[-1]C[-1] -> 2.47514424102807E+29 | DQ89: =FIB(RC[-101])+RC[-1]+R[-1]C+R[-1]C[-1] -> 2.21548748444008E+30 | DR89: =FIB(RC[-101])+RC[-1]+R[-1]C+R[-1]C[-1] -> 1.89091225346643E+31 | DS89: =FIB(RC[-101])+RC[-1]+R[-1]C+R[-1]C[-1] -> 1.54247269354946E+32 | DT89: =FIB(RC[-101])+RC[-1]+R[-1]C+R[-1]C[-1] -> 1.20512032050383E+33 | DU89: =FIB(RC[-101])+RC[-1]+R[-1]C+R[-1]C[-1] -> 9.03558266351425E+33 | DV89: =FIB(RC[-101])+RC[-1]+R[-1]C+R[-1]C[-1] -> 6.51288407653645E+34 | DW89: =FIB(RC[-101])+RC[-1]+R[-1]C+R[-1]C[-1] -> 4.52065168540668E+35 | DX89: =FIB(RC[-101])+RC[-1]+R[-1]C+R[-1]C[-1] -> 3.0262549885777E+36 | DY89: =FIB(RC[-101])+RC[-1]+R[-1]C+R[-1]C[-1] -> 1.95661747331732E+37 | DZ89: =FIB(RC[-101])+RC[-1]+R[-1]C+R[-1]C[-1] -> 1.22343036808684E+38 | EA89: =FIB(RC[-101])+RC[-1]+R[-1]C+R[-1]C[-1] -> 7.4073788607997E+38 | EB89: =FIB(RC[-101])+RC[-1]+R[-1]C+R[-1]C[-1] -> 4.34777086904565E+39 | EC89: =FIB(RC[-101])+RC[-1]+R[-1]C+R[-1]C[-1] -> 2.47661974465487E+40 | ED89: =FIB(RC[-101])+RC[-1]+R[-1]C+R[-1]C[-1] -> 1.37052897449957E+41 | EE89: =FIB(RC[-101])+RC[-1]+R[-1]C+R[-1]C[-1] -> 7.3751904012878E+41 | EF89: =FIB(RC[-101])+RC[-1]+R[-1]C+R[-1]C[-1] -> 3.86287624617407E+42 | EG89: =FIB(RC[-101])+RC[-1]+R[-1]C+R[-1]C[-1] -> 1.97095072771477E+43 | EH89: =FIB(RC[-101])+RC[-1]+R[-1]C+R[-1]C[-1] -> 9.80444954842545E+43 | EI89: =FIB(RC[-101])+RC[-1]+R[-1]C+R[-1]C[-1] -> 4.75871775525461E+44 | EJ89: =FIB(RC[-101])+RC[-1]+R[-1]C+R[-1]C[-1] -> 2.25525628452329E+45 | EK89: =FIB(RC[-101])+RC[-1]+R[-1]C+R[-1]C[-1] -> 1.04434840401529E+46 | EL89: =FIB(RC[-101])+RC[-1]+R[-1]C+R[-1]C[-1] -> 4.728553479239E+46 | EM89: =FIB(RC[-101])+RC[-1]+R[-1]C+R[-1]C[-1] -> 2.09469583426174E+47 | EN89: =FIB(RC[-101])+RC[-1]+R[-1]C+R[-1]C[-1] -> 9.08421133202631E+47 | EO89: =FIB(RC[-101])+RC[-1]+R[-1]C+R[-1]C[-1] -> 3.85903937873162E+48 | EP89: =FIB(RC[-101])+RC[-1]+R[-1]C+R[-1]C[-1] -> 1.60671222199203E+49 | EQ89: =FIB(RC[-101])+RC[-1]+R[-1]C+R[-1]C[-1] -> 6.55986392384524E+49 | ER89: =FIB(RC[-101])+RC[-1]+R[-1]C+R[-1]C[-1] -> 2.62766952496221E+50 | ES89: =FIB(RC[-101])+RC[-1]+R[-1]C+R[-1]C[-1] -> 1.0331851382508E+51 | ET89: =FIB(RC[-101])+RC[-1]+R[-1]C+R[-1]C[-1] -> 3.98952210592266E+51 | EU89: =FIB(RC[-101])+RC[-1]+R[-1]C+R[-1]C[-1] -> 1.5135429690452E+52 | EV89: =FIB(RC[-101])+RC[-1]+R[-1]C+R[-1]C[-1] -> 5.64401404020811E+52 | EW89: =FIB(RC[-101])+RC[-1]+R[-1]C+R[-1]C[-1] -> 2.06957918565027E+53 | EX89: =FIB(RC[-101])+RC[-1]+R[-1]C+R[-1]C[-1] -> 7.46536582772038E+53 | EY89: =FIB(RC[-101])+RC[-1]+R[-1]C+R[-1]C[-1] -> 2.65010638582587E+54 | EZ89: =FIB(RC[-101])+RC[-1]+R[-1]C+R[-1]C[-1] -> 9.26148737747036E+54 | FA89: =FIB(RC[-101])+RC[-1]+R[-1]C+R[-1]C[-1] -> 3.18756985184407E+55 | FB89: =FIB(RC[-101])+RC[-1]+R[-1]C+R[-1]C[-1] -> 1.08081437384252E+56 | FC89: =FIB(RC[-101])+RC[-1]+R[-1]C+R[-1]C[-1] -> 3.61160848837304E+56 | FD89: =FIB(RC[-101])+RC[-1]+R[-1]C+R[-1]C[-1] -> 1.18973209512694E+57 | FE89: =FIB(RC[-101])+RC[-1]+R[-1]C+R[-1]C[-1] -> 3.86485118198115E+57 | FF89: =FIB(RC[-101])+RC[-1]+R[-1]C+R[-1]C[-1] -> 1.23846325396439E+58 | FG89: =FIB(RC[-101])+RC[-1]+R[-1]C+R[-1]C[-1] -> 3.91586432519005E+58 | FH89: =FIB(RC[-101])+RC[-1]+R[-1]C+R[-1]C[-1] -> 1.22205191635624E+59 | FI89: =FIB(RC[-101])+RC[-1]+R[-1]C+R[-1]C[-1] -> 3.76520522568362E+59 | FJ89: =FIB(RC[-101])+RC[-1]+R[-1]C+R[-1]C[-1] -> 1.14561945783508E+60 | FK89: =FIB(RC[-101])+RC[-1]+R[-1]C+R[-1]C[-1] -> 3.44315875763261E+60 | FL89: =FIB(RC[-101])+RC[-1]+R[-1]C+R[-1]C[-1] -> 1.02246266316132E+61 | FM89: =FIB(RC[-101])+RC[-1]+R[-1]C+R[-1]C[-1] -> 3.00066257434842E+61 | FN89: =FIB(RC[-101])+RC[-1]+R[-1]C+R[-1]C[-1] -> 8.70499618484986E+61 | FO89: =FIB(RC[-101])+RC[-1]+R[-1]C+R[-1]C[-1] -> 2.49690006049781E+62 | FP89: =FIB(RC[-101])+RC[-1]+R[-1]C+R[-1]C[-1] -> 7.08290540847974E+62 | FQ89: =FIB(RC[-101])+RC[-1]+R[-1]C+R[-1]C[-1] -> 1.98743633555036E+63 | FR89: =FIB(RC[-101])+RC[-1]+R[-1]C+R[-1]C[-1] -> 5.51744041552695E+63 | FS89: =FIB(RC[-101])+RC[-1]+R[-1]C+R[-1]C[-1] -> 1.51577000816682E+64 | FT89: =FIB(RC[-101])+RC[-1]+R[-1]C+R[-1]C[-1] -> 4.12160467360569E+64 | FU89: =FIB(RC[-101])+RC[-1]+R[-1]C+R[-1]C[-1] -> 1.109482602422E+65 | FV89: =FIB(RC[-101])+RC[-1]+R[-1]C+R[-1]C[-1] -> 2.95717683309216E+65 | FW89: =FIB(RC[-101])+RC[-1]+R[-1]C+R[-1]C[-1] -> 7.80577512620265E+65 | FX89: =FIB(RC[-101])+RC[-1]+R[-1]C+R[-1]C[-1] -> 2.04086327888488E+66 | FY89: =FIB(RC[-101])+RC[-1]+R[-1]C+R[-1]C[-1] -> 5.28623029824532E+66 | FZ89: =FIB(RC[-101])+RC[-1]+R[-1]C+R[-1]C[-1] -> 1.35670595691384E+67 | GA89: =FIB(RC[-101])+RC[-1]+R[-1]C+R[-1]C[-1] -> 3.45067585109192E+67 | GB89: =FIB(RC[-101])+RC[-1]+R[-1]C+R[-1]C[-1] -> 8.69903029048439E+67 | GC89: =FIB(RC[-101])+RC[-1]+R[-1]C+R[-1]C[-1] -> 2.17396959173377E+68 | GD89: =FIB(RC[-101])+RC[-1]+R[-1]C+R[-1]C[-1] -> 5.38664084914054E+68 | GE89: =FIB(RC[-101])+RC[-1]+R[-1]C+R[-1]C[-1] -> 1.32351493673866E+69 | GF89: =FIB(RC[-101])+RC[-1]+R[-1]C+R[-1]C[-1] -> 3.2251408632799E+69 | GG89: =FIB(RC[-101])+RC[-1]+R[-1]C+R[-1]C[-1] -> 7.79540604882733E+69 | GH89: =FIB(RC[-101])+RC[-1]+R[-1]C+R[-1]C[-1] -> 1.86921265911356E+70 | GI89: =FIB(RC[-101])+RC[-1]+R[-1]C+R[-1]C[-1] -> 4.44699727219626E+70 | GJ89: =FIB(RC[-101])+RC[-1]+R[-1]C+R[-1]C[-1] -> 1.0498325895593E+71 | GK89: =FIB(RC[-101])+RC[-1]+R[-1]C+R[-1]C[-1] -> 2.45965264705414E+71 | GL89: =FIB(RC[-101])+RC[-1]+R[-1]C+R[-1]C[-1] -> 5.71981845987138E+71 | GM89: =FIB(RC[-101])+RC[-1]+R[-1]C+R[-1]C[-1] -> 1.3203782591205E+72 | GN89: =FIB(RC[-101])+RC[-1]+R[-1]C+R[-1]C[-1] -> 3.02603416196968E+72 | GO89: =FIB(RC[-101])+RC[-1]+R[-1]C+R[-1]C[-1] -> 6.88587480505292E+72 | GP89: =FIB(RC[-101])+RC[-1]+R[-1]C+R[-1]C[-1] -> 1.5559784742716E+73 | GQ89: =FIB(RC[-101])+RC[-1]+R[-1]C+R[-1]C[-1] -> 3.49184873015395E+73 | GR89: =FIB(RC[-101])+RC[-1]+R[-1]C+R[-1]C[-1] -> 7.78326379510977E+73 | GS89: =FIB(RC[-101])+RC[-1]+R[-1]C+R[-1]C[-1] -> 1.72333071601967E+74
A90: 20 | B90: 20 | C90: 20 | D90: 20 | E90: 20 | F90: 20 | G90: 20 | H90: 20 | I90: 20 | J90: 20 | K90: 20 | L90: 20 | M90: 20 | N90: 20 | O90: 20 | P90: 20 | Q90: 20 | R90: 20 | S90: 20 | T90: 20 | U90: 20 | V90: 20 | W90: 20 | X90: 20 | Y90: 20 | Z90: 20 | AA90: 20 | AB90: 20 | AC90: 20 | AD90: 20 | AE90: 20 | AF90: 20 | AG90: 20 | AH90: 20 | AI90: 20 | AJ90: 20 | AK90: 20 | AL90: 20 | AM90: 20 | AN90: 20 | AO90: 20 | AP90: 20 | AQ90: 20 | AR90: 20 | AS90: 20 | AT90: 20 | AU90: 20 | AV90: 20 | AW90: 20 | AX90: 20 | AY90: 20 | AZ90: 20 | BA90: 20 | BB90: 20 | BC90: 20 | BD90: 20 | BE90: 20 | BF90: 20 | BG90: 20 | BH90: 20 | BI90: 20 | BJ90: 20 | BK90: 20 | BL90: 20 | BM90: 20 | BN90: 20 | BO90: 20 | BP90: 20 | BQ90: 20 | BR90: 20 | BS90: 20 | BT90: 20 | BU90: 20 | BV90: 20 | BW90: 20 | BX90: 20 | BY90: 20 | BZ90: 20 | CA90: 20 | CB90: 20 | CC90: 20 | CD90: 20 | CE90: 20 | CF90: 20 | CG90: 20 | CH90: 20 | CI90: 20 | CJ90: 20 | CK90: 20 | CL90: 20 | CM90: 20 | CN90: 20 | CO90: 20 | CP90: 20 | CQ90: 20 | CR90: 20 | CS90: 20 | CT90: 20 | CU90: 20 | CV90: 20 | CW90: 0 | CX90: =FIB(RC[-101])+RC[-1]+R[-1]C+R[-1]C[-1] -> 974194 | CY90: =FIB(RC[-101])+RC[-1]+R[-1]C+R[-1]C[-1] -> 87677460 | CZ90: =FIB(RC[-101])+RC[-1]+R[-1]C+R[-1]C[-1] -> 5232395974 | DA90: =FIB(RC[-101])+RC[-1]+R[-1]C+R[-1]C[-1] -> 234215721480 | DB90: =FIB(RC[-101])+RC[-1]+R[-1]C+R[-1]C[-1] -> 8389108940602 | DC90: =FIB(RC[-101])+RC[-1]+R[-1]C+R[-1]C[-1] -> 250470263324892 | DD90: =FIB(RC[-101])+RC[-1]+R[-1]C+R[-1]C[-1] -> 6.41207311282478E+15 | DE90: =FIB(RC[-101])+RC[-1]+R[-1]C+R[-1]C[-1] -> 1.43689297379986E+17 | DF90: =FIB(RC[-101])+RC[-1]+R[-1]C+R[-1]C[-1] -> 2.86352009065789E+18 | DG90: =FIB(RC[-101])+RC[-1]+R[-1]C+R[-1]C[-1] -> 5.13863299904183E+19 | DH90: =FIB(RC[-101])+RC[-1]+R[-1]C+R[-1]C[-1] -> 8.38798933562859E+20 | DI90: =FIB(RC[-101])+RC[-1]+R[-1]C+R[-1]C[-1] -> 1.25591882281372E+22 | DJ90: =FIB(RC[-101])+RC[-1]+R[-1]C+R[-1]C[-1] -> 1.73704636926101E+23 | DK90: =FIB(RC[-101])+RC[-1]+R[-1]C+R[-1]C[-1] -> 2.23259996119556E+24 | DL90: =FIB(RC[-101])+RC[-1]+R[-1]C+R[-1]C[-1] -> 2.68044838647314E+25 | DM90: =FIB(RC[-101])+RC[-1]+R[-1]C+R[-1]C[-1] -> 3.01968225700303E+26 | DN90: =FIB(RC[-101])+RC[-1]+R[-1]C+R[-1]C[-1] -> 3.20477553777588E+27 | DO90: =FIB(RC[-101])+RC[-1]+R[-1]C+R[-1]C[-1] -> 3.21549045054882E+28 | DP90: =FIB(RC[-101])+RC[-1]+R[-1]C+R[-1]C[-1] -> 3.0596915085065E+29 | DQ90: =FIB(RC[-101])+RC[-1]+R[-1]C+R[-1]C[-1] -> 2.76897105939353E+30 | DR90: =FIB(RC[-101])+RC[-1]+R[-1]C+R[-1]C[-1] -> 2.38935810784979E+31 | DS90: =FIB(RC[-101])+RC[-1]+R[-1]C+R[-1]C[-1] -> 1.97049972968108E+32 | DT90: =FIB(RC[-101])+RC[-1]+R[-1]C+R[-1]C[-1] -> 1.55641756282689E+33 | DU90: =FIB(RC[-101])+RC[-1]+R[-1]C+R[-1]C[-1] -> 1.1797120546845E+34 | DV90: =FIB(RC[-101])+RC[-1]+R[-1]C+R[-1]C[-1] -> 8.59615439757237E+34 | DW90: =FIB(RC[-101])+RC[-1]+R[-1]C+R[-1]C[-1] -> 6.03155553281757E+35 | DX90: =FIB(RC[-101])+RC[-1]+R[-1]C+R[-1]C[-1] -> 4.08147571040012E+36 | DY90: =FIB(RC[-101])+RC[-1]+R[-1]C+R[-1]C[-1] -> 2.6673905432151E+37 | DZ90: =FIB(RC[-101])+RC[-1]+R[-1]C+R[-1]C[-1] -> 1.68583116974008E+38 | EA90: =FIB(RC[-101])+RC[-1]+R[-1]C+R[-1]C[-1] -> 1.03166403986266E+39 | EB90: =FIB(RC[-101])+RC[-1]+R[-1]C+R[-1]C[-1] -> 6.12017279498828E+39 | EC90: =FIB(RC[-101])+RC[-1]+R[-1]C+R[-1]C[-1] -> 3.52341411105827E+40 | ED90: =FIB(RC[-101])+RC[-1]+R[-1]C+R[-1]C[-1] -> 1.97053236007089E+41 | EE90: =FIB(RC[-101])+RC[-1]+R[-1]C+R[-1]C[-1] -> 1.07162517358583E+42 | EF90: =FIB(RC[-101])+RC[-1]+R[-1]C+R[-1]C[-1] -> 5.67202045988868E+42 | EG90: =FIB(RC[-101])+RC[-1]+R[-1]C+R[-1]C[-1] -> 2.92444039832105E+43 | EH90: =FIB(RC[-101])+RC[-1]+R[-1]C+R[-1]C[-1] -> 1.46998406744613E+44 | EI90: =FIB(RC[-101])+RC[-1]+R[-1]C+R[-1]C[-1] -> 7.20914677754328E+44 | EJ90: =FIB(RC[-101])+RC[-1]+R[-1]C+R[-1]C[-1] -> 3.45204273780308E+45 | EK90: =FIB(RC[-101])+RC[-1]+R[-1]C+R[-1]C[-1] -> 1.61507830624792E+46 | EL90: =FIB(RC[-101])+RC[-1]+R[-1]C+R[-1]C[-1] -> 7.38798018950221E+46 | EM90: =FIB(RC[-101])+RC[-1]+R[-1]C+R[-1]C[-1] -> 3.30634920113586E+47 | EN90: =FIB(RC[-101])+RC[-1]+R[-1]C+R[-1]C[-1] -> 1.44852563674239E+48 | EO90: =FIB(RC[-101])+RC[-1]+R[-1]C+R[-1]C[-1] -> 6.21598614867664E+48 | EP90: =FIB(RC[-101])+RC[-1]+R[-1]C+R[-1]C[-1] -> 2.61421477473285E+49 | EQ90: =FIB(RC[-101])+RC[-1]+R[-1]C+R[-1]C[-1] -> 1.07807909205701E+50 | ER90: =FIB(RC[-101])+RC[-1]+R[-1]C+R[-1]C[-1] -> 4.36173500940375E+50 | ES90: =FIB(RC[-101])+RC[-1]+R[-1]C+R[-1]C[-1] -> 1.7321255916874E+51 | ET90: =FIB(RC[-101])+RC[-1]+R[-1]C+R[-1]C[-1] -> 6.75483283586086E+51 | EU90: =FIB(RC[-101])+RC[-1]+R[-1]C+R[-1]C[-1] -> 2.58797846322355E+52 | EV90: =FIB(RC[-101])+RC[-1]+R[-1]C+R[-1]C[-1] -> 9.74553547247686E+52 | EW90: =FIB(RC[-101])+RC[-1]+R[-1]C+R[-1]C[-1] -> 3.60853413691877E+53 | EX90: =FIB(RC[-101])+RC[-1]+R[-1]C+R[-1]C[-1] -> 1.31434791502894E+54 | EY90: =FIB(RC[-101])+RC[-1]+R[-1]C+R[-1]C[-1] -> 4.71099088362685E+54 | EZ90: =FIB(RC[-101])+RC[-1]+R[-1]C+R[-1]C[-1] -> 1.66225846469231E+55 | FA90: =FIB(RC[-101])+RC[-1]+R[-1]C+R[-1]C[-1] -> 5.77597705428341E+55 | FB90: =FIB(RC[-101])+RC[-1]+R[-1]C+R[-1]C[-1] -> 1.97716906445526E+56 | FC90: =FIB(RC[-101])+RC[-1]+R[-1]C+R[-1]C[-1] -> 6.66959192667082E+56 | FD90: =FIB(RC[-101])+RC[-1]+R[-1]C+R[-1]C[-1] -> 2.21785213663133E+57 | FE90: =FIB(RC[-101])+RC[-1]+R[-1]C+R[-1]C[-1] -> 7.27243541373942E+57 | FF90: =FIB(RC[-101])+RC[-1]+R[-1]C+R[-1]C[-1] -> 2.35219191353645E+58 | FG90: =FIB(RC[-101])+RC[-1]+R[-1]C+R[-1]C[-1] -> 7.50651949269089E+58 | FH90: =FIB(RC[-101])+RC[-1]+R[-1]C+R[-1]C[-1] -> 2.36429029814433E+59 | FI90: =FIB(RC[-101])+RC[-1]+R[-1]C+R[-1]C[-1] -> 7.35154744018419E+59 | FJ90: =FIB(RC[-101])+RC[-1]+R[-1]C+R[-1]C[-1] -> 2.25729472442186E+60 | FK90: =FIB(RC[-101])+RC[-1]+R[-1]C+R[-1]C[-1] -> 6.84607293988954E+60 | FL90: =FIB(RC[-101])+RC[-1]+R[-1]C+R[-1]C[-1] -> 2.05138583291354E+61 | FM90: =FIB(RC[-101])+RC[-1]+R[-1]C+R[-1]C[-1] -> 6.07451107042328E+61 | FN90: =FIB(RC[-101])+RC[-1]+R[-1]C+R[-1]C[-1] -> 1.77801698296216E+62 | FO90: =FIB(RC[-101])+RC[-1]+R[-1]C+R[-1]C[-1] -> 5.14541666194495E+62 | FP90: =FIB(RC[-101])+RC[-1]+R[-1]C+R[-1]C[-1] -> 1.47252221309225E+63 | FQ90: =FIB(RC[-101])+RC[-1]+R[-1]C+R[-1]C[-1] -> 4.16824908949058E+63 | FR90: =FIB(RC[-101])+RC[-1]+R[-1]C+R[-1]C[-1] -> 1.16731258405679E+64 | FS90: =FIB(RC[-101])+RC[-1]+R[-1]C+R[-1]C[-1] -> 3.2348266337763E+64 | FT90: =FIB(RC[-101])+RC[-1]+R[-1]C+R[-1]C[-1] -> 8.87220131554881E+64 | FU90: =FIB(RC[-101])+RC[-1]+R[-1]C+R[-1]C[-1] -> 2.40886320133745E+65 | FV90: =FIB(RC[-101])+RC[-1]+R[-1]C+R[-1]C[-1] -> 6.47552263685161E+65 | FW90: =FIB(RC[-101])+RC[-1]+R[-1]C+R[-1]C[-1] -> 1.72384745961464E+66 | FX90: =FIB(RC[-101])+RC[-1]+R[-1]C+R[-1]C[-1] -> 4.54528825111979E+66 | FY90: =FIB(RC[-101])+RC[-1]+R[-1]C+R[-1]C[-1] -> 1.187238182825E+67 | FZ90: =FIB(RC[-101])+RC[-1]+R[-1]C+R[-1]C[-1] -> 3.07256716956337E+67 | GA90: =FIB(RC[-101])+RC[-1]+R[-1]C+R[-1]C[-1] -> 7.87994897756913E+67 | GB90: =FIB(RC[-101])+RC[-1]+R[-1]C+R[-1]C[-1] -> 2.00296551191454E+68 | GC90: =FIB(RC[-101])+RC[-1]+R[-1]C+R[-1]C[-1] -> 5.04683813269675E+68 | GD90: =FIB(RC[-101])+RC[-1]+R[-1]C+R[-1]C[-1] -> 1.26074485735711E+69 | GE90: =FIB(RC[-101])+RC[-1]+R[-1]C+R[-1]C[-1] -> 3.12292387900982E+69 | GF90: =FIB(RC[-101])+RC[-1]+R[-1]C+R[-1]C[-1] -> 7.67157967902837E+69 | GG90: =FIB(RC[-101])+RC[-1]+R[-1]C+R[-1]C[-1] -> 1.86921265911356E+70 | GH90: =FIB(RC[-101])+RC[-1]+R[-1]C+R[-1]C[-1] -> 4.51796592310985E+70 | GI90: =FIB(RC[-101])+RC[-1]+R[-1]C+R[-1]C[-1] -> 1.08341758544197E+71 | GJ90: =FIB(RC[-101])+RC[-1]+R[-1]C+R[-1]C[-1] -> 2.57794990222089E+71 | GK90: =FIB(RC[-101])+RC[-1]+R[-1]C+R[-1]C[-1] -> 6.08743513883433E+71 | GL90: =FIB(RC[-101])+RC[-1]+R[-1]C+R[-1]C[-1] -> 1.42669062457599E+72 | GM90: =FIB(RC[-101])+RC[-1]+R[-1]C+R[-1]C[-1] -> 3.31905072968362E+72 | GN90: =FIB(RC[-101])+RC[-1]+R[-1]C+R[-1]C[-1] -> 7.6654631507738E+72 | GO90: =FIB(RC[-101])+RC[-1]+R[-1]C+R[-1]C[-1] -> 1.75773721177964E+73 | GP90: =FIB(RC[-101])+RC[-1]+R[-1]C+R[-1]C[-1] -> 4.00230316655654E+73 | GQ90: =FIB(RC[-101])+RC[-1]+R[-1]C+R[-1]C[-1] -> 9.0501303709821E+73 | GR90: =FIB(RC[-101])+RC[-1]+R[-1]C+R[-1]C[-1] -> 2.03252428962458E+74 | GS90: =FIB(RC[-101])+RC[-1]+R[-1]C+R[-1]C[-1] -> 4.53418138515523E+74
A91: 20 | B91: 20 | C91: 20 | D91: 20 | E91: 20 | F91: 20 | G91: 20 | H91: 20 | I91: 20 | J91: 20 | K91: 20 | L91: 20 | M91: 20 | N91: 20 | O91: 20 | P91: 20 | Q91: 20 | R91: 20 | S91: 20 | T91: 20 | U91: 20 | V91: 20 | W91: 20 | X91: 20 | Y91: 20 | Z91: 20 | AA91: 20 | AB91: 20 | AC91: 20 | AD91: 20 | AE91: 20 | AF91: 20 | AG91: 20 | AH91: 20 | AI91: 20 | AJ91: 20 | AK91: 20 | AL91: 20 | AM91: 20 | AN91: 20 | AO91: 20 | AP91: 20 | AQ91: 20 | AR91: 20 | AS91: 20 | AT91: 20 | AU91: 20 | AV91: 20 | AW91: 20 | AX91: 20 | AY91: 20 | AZ91: 20 | BA91: 20 | BB91: 20 | BC91: 20 | BD91: 20 | BE91: 20 | BF91: 20 | BG91: 20 | BH91: 20 | BI91: 20 | BJ91: 20 | BK91: 20 | BL91: 20 | BM91: 20 | BN91: 20 | BO91: 20 | BP91: 20 | BQ91: 20 | BR91: 20 | BS91: 20 | BT91: 20 | BU91: 20 | BV91: 20 | BW91: 20 | BX91: 20 | BY91: 20 | BZ91: 20 | CA91: 20 | CB91: 20 | CC91: 20 | CD91: 20 | CE91: 20 | CF91: 20 | CG91: 20 | CH91: 20 | CI91: 20 | CJ91: 20 | CK91: 20 | CL91: 20 | CM91: 20 | CN91: 20 | CO91: 20 | CP91: 20 | CQ91: 20 | CR91: 20 | CS91: 20 | CT91: 20 | CU91: 20 | CV91: 20 | CW91: 0 | CX91: =FIB(RC[-101])+RC[-1]+R[-1]C+R[-1]C[-1] -> 985140 | CY91: =FIB(RC[-101])+RC[-1]+R[-1]C+R[-1]C[-1] -> 89647740 | CZ91: =FIB(RC[-101])+RC[-1]+R[-1]C+R[-1]C[-1] -> 5409732120 | DA91: =FIB(RC[-101])+RC[-1]+R[-1]C+R[-1]C[-1] -> 244857860520 | DB91: =FIB(RC[-101])+RC[-1]+R[-1]C+R[-1]C[-1] -> 8868182533548 | DC91: =FIB(RC[-101])+RC[-1]+R[-1]C+R[-1]C[-1] -> 267727554809988 | DD91: =FIB(RC[-101])+RC[-1]+R[-1]C+R[-1]C[-1] -> 6.93027093097061E+15 | DE91: =FIB(RC[-101])+RC[-1]+R[-1]C+R[-1]C[-1] -> 1.57031641423792E+17 | DF91: =FIB(RC[-101])+RC[-1]+R[-1]C+R[-1]C[-1] -> 3.16424102946168E+18 | DG91: =FIB(RC[-101])+RC[-1]+R[-1]C+R[-1]C[-1] -> 5.74140911105378E+19 | DH91: =FIB(RC[-101])+RC[-1]+R[-1]C+R[-1]C[-1] -> 9.47599354663815E+20 | DI91: =FIB(RC[-101])+RC[-1]+R[-1]C+R[-1]C[-1] -> 1.43455865163639E+22 | DJ91: =FIB(RC[-101])+RC[-1]+R[-1]C+R[-1]C[-1] -> 2.00609411670602E+23 | DK91: =FIB(RC[-101])+RC[-1]+R[-1]C+R[-1]C[-1] -> 2.60691400979226E+24 | DL91: =FIB(RC[-101])+RC[-1]+R[-1]C+R[-1]C[-1] -> 3.16439978357192E+25 | DM91: =FIB(RC[-101])+RC[-1]+R[-1]C+R[-1]C[-1] -> 3.60416707400754E+26 | DN91: =FIB(RC[-101])+RC[-1]+R[-1]C+R[-1]C[-1] -> 3.86716047087694E+27 | DO91: =FIB(RC[-101])+RC[-1]+R[-1]C+R[-1]C[-1] -> 3.9226840514141E+28 | DP91: =FIB(RC[-101])+RC[-1]+R[-1]C+R[-1]C[-1] -> 3.7735089587028E+29 | DQ91: =FIB(RC[-101])+RC[-1]+R[-1]C+R[-1]C[-1] -> 3.45229110611446E+30 | DR91: =FIB(RC[-101])+RC[-1]+R[-1]C+R[-1]C[-1] -> 3.01148432440059E+31 | DS91: =FIB(RC[-101])+RC[-1]+R[-1]C+R[-1]C[-1] -> 2.51058397290612E+32 | DT91: =FIB(RC[-101])+RC[-1]+R[-1]C+R[-1]C[-1] -> 2.00452593308561E+33 | DU91: =FIB(RC[-101])+RC[-1]+R[-1]C+R[-1]C[-1] -> 1.53580640427575E+34 | DV91: =FIB(RC[-101])+RC[-1]+R[-1]C+R[-1]C[-1] -> 1.13116728565326E+35 | DW91: =FIB(RC[-101])+RC[-1]+R[-1]C+R[-1]C[-1] -> 8.02233825822807E+35 | DX91: =FIB(RC[-101])+RC[-1]+R[-1]C+R[-1]C[-1] -> 5.48686508950469E+36 | DY91: =FIB(RC[-101])+RC[-1]+R[-1]C+R[-1]C[-1] -> 3.62422462320559E+37 | DZ91: =FIB(RC[-101])+RC[-1]+R[-1]C+R[-1]C[-1] -> 2.31499268638215E+38 | EA91: =FIB(RC[-101])+RC[-1]+R[-1]C+R[-1]C[-1] -> 1.43174642547489E+39 | EB91: =FIB(RC[-101])+RC[-1]+R[-1]C+R[-1]C[-1] -> 8.58358326032583E+39 | EC91: =FIB(RC[-101])+RC[-1]+R[-1]C+R[-1]C[-1] -> 4.99378971658968E+40 | ED91: =FIB(RC[-101])+RC[-1]+R[-1]C+R[-1]C[-1] -> 2.82225274283568E+41 | EE91: =FIB(RC[-101])+RC[-1]+R[-1]C+R[-1]C[-1] -> 1.55090368387648E+42 | EF91: =FIB(RC[-101])+RC[-1]+R[-1]C+R[-1]C[-1] -> 8.29454931735099E+42 | EG91: =FIB(RC[-101])+RC[-1]+R[-1]C+R[-1]C[-1] -> 4.32109737604502E+43 | EH91: =FIB(RC[-101])+RC[-1]+R[-1]C+R[-1]C[-1] -> 2.19453784488273E+44 | EI91: =FIB(RC[-101])+RC[-1]+R[-1]C+R[-1]C[-1] -> 1.08736686898721E+45 | EJ91: =FIB(RC[-101])+RC[-1]+R[-1]C+R[-1]C[-1] -> 5.26032428454462E+45 | EK91: =FIB(RC[-101])+RC[-1]+R[-1]C+R[-1]C[-1] -> 2.48631500848269E+46 | EL91: =FIB(RC[-101])+RC[-1]+R[-1]C+R[-1]C[-1] -> 1.14893735042328E+47 | EM91: =FIB(RC[-101])+RC[-1]+R[-1]C+R[-1]C[-1] -> 5.19408457050936E+47 | EN91: =FIB(RC[-101])+RC[-1]+R[-1]C+R[-1]C[-1] -> 2.29856901390691E+48 | EO91: =FIB(RC[-101])+RC[-1]+R[-1]C+R[-1]C[-1] -> 9.96308079932594E+48 | EP91: =FIB(RC[-101])+RC[-1]+R[-1]C+R[-1]C[-1] -> 4.23212146953311E+49 | EQ91: =FIB(RC[-101])+RC[-1]+R[-1]C+R[-1]C[-1] -> 1.76271271648361E+50 | ER91: =FIB(RC[-101])+RC[-1]+R[-1]C+R[-1]C[-1] -> 7.20252681794437E+50 | ES91: =FIB(RC[-101])+RC[-1]+R[-1]C+R[-1]C[-1] -> 2.88855177442221E+51 | ET91: =FIB(RC[-101])+RC[-1]+R[-1]C+R[-1]C[-1] -> 1.13755102019705E+52 | EU91: =FIB(RC[-101])+RC[-1]+R[-1]C+R[-1]C[-1] -> 4.40101276700668E+52 | EV91: =FIB(RC[-101])+RC[-1]+R[-1]C+R[-1]C[-1] -> 1.67345267027071E+53 | EW91: =FIB(RC[-101])+RC[-1]+R[-1]C+R[-1]C[-1] -> 6.25654035443717E+53 | EX91: =FIB(RC[-101])+RC[-1]+R[-1]C+R[-1]C[-1] -> 2.30085536416454E+54 | EY91: =FIB(RC[-101])+RC[-1]+R[-1]C+R[-1]C[-1] -> 8.32619416282033E+54 | EZ91: =FIB(RC[-101])+RC[-1]+R[-1]C+R[-1]C[-1] -> 2.96597696933703E+55 | FA91: =FIB(RC[-101])+RC[-1]+R[-1]C+R[-1]C[-1] -> 1.04042124883127E+56 | FB91: =FIB(RC[-101])+RC[-1]+R[-1]C+R[-1]C[-1] -> 3.59518801871488E+56 | FC91: =FIB(RC[-101])+RC[-1]+R[-1]C+R[-1]C[-1] -> 1.2241949009841E+57 | FD91: =FIB(RC[-101])+RC[-1]+R[-1]C+R[-1]C[-1] -> 4.1090062302825E+57 | FE91: =FIB(RC[-101])+RC[-1]+R[-1]C+R[-1]C[-1] -> 1.35992937806532E+58 | FF91: =FIB(RC[-101])+RC[-1]+R[-1]C+R[-1]C[-1] -> 4.43936483297572E+58 | FG91: =FIB(RC[-101])+RC[-1]+R[-1]C+R[-1]C[-1] -> 1.42980762392031E+59 | FH91: =FIB(RC[-101])+RC[-1]+R[-1]C+R[-1]C[-1] -> 4.54474987133373E+59 | FI91: =FIB(RC[-101])+RC[-1]+R[-1]C+R[-1]C[-1] -> 1.42605876096622E+60 | FJ91: =FIB(RC[-101])+RC[-1]+R[-1]C+R[-1]C[-1] -> 4.4185082294065E+60 | FK91: =FIB(RC[-101])+RC[-1]+R[-1]C+R[-1]C[-1] -> 1.35218758937179E+61 | FL91: =FIB(RC[-101])+RC[-1]+R[-1]C+R[-1]C[-1] -> 4.08818071627428E+61 | FM91: =FIB(RC[-101])+RC[-1]+R[-1]C+R[-1]C[-1] -> 1.22140776196111E+62 | FN91: =FIB(RC[-101])+RC[-1]+R[-1]C+R[-1]C[-1] -> 3.60687585196559E+62 | FO91: =FIB(RC[-101])+RC[-1]+R[-1]C+R[-1]C[-1] -> 1.05303094968727E+63 | FP91: =FIB(RC[-101])+RC[-1]+R[-1]C+R[-1]C[-1] -> 3.04009482897401E+63 | FQ91: =FIB(RC[-101])+RC[-1]+R[-1]C+R[-1]C[-1] -> 8.68086613155685E+63 | FR91: =FIB(RC[-101])+RC[-1]+R[-1]C+R[-1]C[-1] -> 2.45222410616153E+64 | FS91: =FIB(RC[-101])+RC[-1]+R[-1]C+R[-1]C[-1] -> 6.85436332399462E+64 | FT91: =FIB(RC[-101])+RC[-1]+R[-1]C+R[-1]C[-1] -> 1.89613912733197E+65 | FU91: =FIB(RC[-101])+RC[-1]+R[-1]C+R[-1]C[-1] -> 5.1922224602243E+65 | FV91: =FIB(RC[-101])+RC[-1]+R[-1]C+R[-1]C[-1] -> 1.40766082984134E+66 | FW91: =FIB(RC[-101])+RC[-1]+R[-1]C+R[-1]C[-1] -> 3.77906055314114E+66 | FX91: =FIB(RC[-101])+RC[-1]+R[-1]C+R[-1]C[-1] -> 1.00481962638756E+67 | FY91: =FIB(RC[-101])+RC[-1]+R[-1]C+R[-1]C[-1] -> 2.64658663432454E+67 | FZ91: =FIB(RC[-101])+RC[-1]+R[-1]C+R[-1]C[-1] -> 6.90639198671291E+67 | GA91: =FIB(RC[-101])+RC[-1]+R[-1]C+R[-1]C[-1] -> 1.78589081338454E+68 | GB91: =FIB(RC[-101])+RC[-1]+R[-1]C+R[-1]C[-1] -> 4.576851223056E+68 | GC91: =FIB(RC[-101])+RC[-1]+R[-1]C+R[-1]C[-1] -> 1.16266548676673E+69 | GD91: =FIB(RC[-101])+RC[-1]+R[-1]C+R[-1]C[-1] -> 2.92809415739351E+69 | GE91: =FIB(RC[-101])+RC[-1]+R[-1]C+R[-1]C[-1] -> 7.31176289376044E+69 | GF91: =FIB(RC[-101])+RC[-1]+R[-1]C+R[-1]C[-1] -> 1.81062664517986E+70 | GG91: =FIB(RC[-101])+RC[-1]+R[-1]C+R[-1]C[-1] -> 4.44699727219626E+70 | GH91: =FIB(RC[-101])+RC[-1]+R[-1]C+R[-1]C[-1] -> 1.08341758544197E+71 | GI91: =FIB(RC[-101])+RC[-1]+R[-1]C+R[-1]C[-1] -> 2.61863176319492E+71 | GJ91: =FIB(RC[-101])+RC[-1]+R[-1]C+R[-1]C[-1] -> 6.27999925085778E+71 | GK91: =FIB(RC[-101])+RC[-1]+R[-1]C+R[-1]C[-1] -> 1.4945384291913E+72 | GL91: =FIB(RC[-101])+RC[-1]+R[-1]C+R[-1]C[-1] -> 3.52997256765072E+72 | GM91: =FIB(RC[-101])+RC[-1]+R[-1]C+R[-1]C[-1] -> 8.27571392191033E+72 | GN91: =FIB(RC[-101])+RC[-1]+R[-1]C+R[-1]C[-1] -> 1.92602278023678E+73 | GO91: =FIB(RC[-101])+RC[-1]+R[-1]C+R[-1]C[-1] -> 4.4503063070938E+73 | GP91: =FIB(RC[-101])+RC[-1]+R[-1]C+R[-1]C[-1] -> 1.021034668543E+74 | GQ91: =FIB(RC[-101])+RC[-1]+R[-1]C+R[-1]C[-1] -> 2.32627802229686E+74 | GR91: =FIB(RC[-101])+RC[-1]+R[-1]C+R[-1]C[-1] -> 5.26381534901965E+74 | GS91: =FIB(RC[-101])+RC[-1]+R[-1]C+R[-1]C[-1] -> 1.18305210237995E+75
A92: 20 | B92: 20 | C92: 20 | D92: 20 | E92: 20 | F92: 20 | G92: 20 | H92: 20 | I92: 20 | J92: 20 | K92: 20 | L92: 20 | M92: 20 | N92: 20 | O92: 20 | P92: 20 | Q92: 20 | R92: 20 | S92: 20 | T92: 20 | U92: 20 | V92: 20 | W92: 20 | X92: 20 | Y92: 20 | Z92: 20 | AA92: 20 | AB92: 20 | AC92: 20 | AD92: 20 | AE92: 20 | AF92: 20 | AG92: 20 | AH92: 20 | AI92: 20 | AJ92: 20 | AK92: 20 | AL92: 20 | AM92: 20 | AN92: 20 | AO92: 20 | AP92: 20 | AQ92: 20 | AR92: 20 | AS92: 20 | AT92: 20 | AU92: 20 | AV92: 20 | AW92: 20 | AX92: 20 | AY92: 20 | AZ92: 20 | BA92: 20 | BB92: 20 | BC92: 20 | BD92: 20 | BE92: 20 | BF92: 20 | BG92: 20 | BH92: 20 | BI92: 20 | BJ92: 20 | BK92: 20 | BL92: 20 | BM92: 20 | BN92: 20 | BO92: 20 | BP92: 20 | BQ92: 20 | BR92: 20 | BS92: 20 | BT92: 20 | BU92: 20 | BV92: 20 | BW92: 20 | BX92: 20 | BY92: 20 | BZ92: 20 | CA92: 20 | CB92: 20 | CC92: 20 | CD92: 20 | CE92: 20 | CF92: 20 | CG92: 20 | CH92: 20 | CI92: 20 | CJ92: 20 | CK92: 20 | CL92: 20 | CM92: 20 | CN92: 20 | CO92: 20 | CP92: 20 | CQ92: 20 | CR92: 20 | CS92: 20 | CT92: 20 | CU92: 20 | CV92: 20 | CW92: 0 | CX92: =FIB(RC[-101])+RC[-1]+R[-1]C+R[-1]C[-1] -> 996086 | CY92: =FIB(RC[-101])+RC[-1]+R[-1]C+R[-1]C[-1] -> 91639912 | CZ92: =FIB(RC[-101])+RC[-1]+R[-1]C+R[-1]C[-1] -> 5591030718 | DA92: =FIB(RC[-101])+RC[-1]+R[-1]C+R[-1]C[-1] -> 255858634304 | DB92: =FIB(RC[-101])+RC[-1]+R[-1]C+R[-1]C[-1] -> 9368899039318 | DC92: =FIB(RC[-101])+RC[-1]+R[-1]C+R[-1]C[-1] -> 285964636393800 | DD92: =FIB(RC[-101])+RC[-1]+R[-1]C+R[-1]C[-1] -> 7.48396312218534E+15 | DE92: =FIB(RC[-101])+RC[-1]+R[-1]C+R[-1]C[-1] -> 1.71445875476959E+17 | DF92: =FIB(RC[-101])+RC[-1]+R[-1]C+R[-1]C[-1] -> 3.49271854636244E+18 | DG92: =FIB(RC[-101])+RC[-1]+R[-1]C+R[-1]C[-1] -> 6.4071050686362E+19 | DH92: =FIB(RC[-101])+RC[-1]+R[-1]C+R[-1]C[-1] -> 1.06908449646072E+21 | DI92: =FIB(RC[-101])+RC[-1]+R[-1]C+R[-1]C[-1] -> 1.63622703674884E+22 | DJ92: =FIB(RC[-101])+RC[-1]+R[-1]C+R[-1]C[-1] -> 2.31317268554454E+23 | DK92: =FIB(RC[-101])+RC[-1]+R[-1]C+R[-1]C[-1] -> 3.03884069001732E+24 | DL92: =FIB(RC[-101])+RC[-1]+R[-1]C+R[-1]C[-1] -> 3.72897525355288E+25 | DM92: =FIB(RC[-101])+RC[-1]+R[-1]C+R[-1]C[-1] -> 4.29350457772002E+26 | DN92: =FIB(RC[-101])+RC[-1]+R[-1]C+R[-1]C[-1] -> 4.65692763604969E+27 | DO92: =FIB(RC[-101])+RC[-1]+R[-1]C+R[-1]C[-1] -> 4.77509286210677E+28 | DP92: =FIB(RC[-101])+RC[-1]+R[-1]C+R[-1]C[-1] -> 4.64328665005488E+29 | DQ92: =FIB(RC[-101])+RC[-1]+R[-1]C+R[-1]C[-1] -> 4.29397066699023E+30 | DR92: =FIB(RC[-101])+RC[-1]+R[-1]C+R[-1]C[-1] -> 3.78611050171106E+31 | DS92: =FIB(RC[-101])+RC[-1]+R[-1]C+R[-1]C[-1] -> 3.19034345551729E+32 | DT92: =FIB(RC[-101])+RC[-1]+R[-1]C+R[-1]C[-1] -> 2.57461867592795E+33 | DU92: =FIB(RC[-101])+RC[-1]+R[-1]C+R[-1]C[-1] -> 1.9937208651771E+34 | DV92: =FIB(RC[-101])+RC[-1]+R[-1]C+R[-1]C[-1] -> 1.48412001259855E+35 | DW92: =FIB(RC[-101])+RC[-1]+R[-1]C+R[-1]C[-1] -> 1.06376255564799E+36 | DX92: =FIB(RC[-101])+RC[-1]+R[-1]C+R[-1]C[-1] -> 7.35286147097548E+36 | DY92: =FIB(RC[-101])+RC[-1]+R[-1]C+R[-1]C[-1] -> 4.9081972792536E+37 | DZ92: =FIB(RC[-101])+RC[-1]+R[-1]C+R[-1]C[-1] -> 3.16823487662807E+38 | EA92: =FIB(RC[-101])+RC[-1]+R[-1]C+R[-1]C[-1] -> 1.98006918177591E+39 | EB92: =FIB(RC[-101])+RC[-1]+R[-1]C+R[-1]C[-1] -> 1.19953988675766E+40 | EC92: =FIB(RC[-101])+RC[-1]+R[-1]C+R[-1]C[-1] -> 7.05168792937992E+40 | ED92: =FIB(RC[-101])+RC[-1]+R[-1]C+R[-1]C[-1] -> 4.02680050743264E+41 | EE92: =FIB(RC[-101])+RC[-1]+R[-1]C+R[-1]C[-1] -> 2.23580900890331E+42 | EF92: =FIB(RC[-101])+RC[-1]+R[-1]C+R[-1]C[-1] -> 1.20812620101308E+43 | EG92: =FIB(RC[-101])+RC[-1]+R[-1]C+R[-1]C[-1] -> 6.35867850879319E+43 | EH92: =FIB(RC[-101])+RC[-1]+R[-1]C+R[-1]C[-1] -> 3.26251543336655E+44 | EI92: =FIB(RC[-101])+RC[-1]+R[-1]C+R[-1]C[-1] -> 1.63307219681214E+45 | EJ92: =FIB(RC[-101])+RC[-1]+R[-1]C+R[-1]C[-1] -> 7.98076335034397E+45 | EK92: =FIB(RC[-101])+RC[-1]+R[-1]C+R[-1]C[-1] -> 3.81042377197155E+46 | EL92: =FIB(RC[-101])+RC[-1]+R[-1]C+R[-1]C[-1] -> 1.77861122846871E+47 | EM92: =FIB(RC[-101])+RC[-1]+R[-1]C+R[-1]C[-1] -> 8.12163314940135E+47 | EN92: =FIB(RC[-101])+RC[-1]+R[-1]C+R[-1]C[-1] -> 3.63014078589798E+48 | EO92: =FIB(RC[-101])+RC[-1]+R[-1]C+R[-1]C[-1] -> 1.58917905991308E+49 | EP92: =FIB(RC[-101])+RC[-1]+R[-1]C+R[-1]C[-1] -> 6.81760860937879E+49 | EQ92: =FIB(RC[-101])+RC[-1]+R[-1]C+R[-1]C[-1] -> 2.8676857243748E+50 | ER92: =FIB(RC[-101])+RC[-1]+R[-1]C+R[-1]C[-1] -> 1.18329252588028E+51 | ES92: =FIB(RC[-101])+RC[-1]+R[-1]C+R[-1]C[-1] -> 4.79209698209692E+51 | ET92: =FIB(RC[-101])+RC[-1]+R[-1]C+R[-1]C[-1] -> 1.90561589584896E+52 | EU92: =FIB(RC[-101])+RC[-1]+R[-1]C+R[-1]C[-1] -> 7.44417968305269E+52 | EV92: =FIB(RC[-101])+RC[-1]+R[-1]C+R[-1]C[-1] -> 2.85797191527665E+53 | EW92: =FIB(RC[-101])+RC[-1]+R[-1]C+R[-1]C[-1] -> 1.07879649399845E+54 | EX92: =FIB(RC[-101])+RC[-1]+R[-1]C+R[-1]C[-1] -> 4.0053058936067E+54 | EY92: =FIB(RC[-101])+RC[-1]+R[-1]C+R[-1]C[-1] -> 1.46323554205916E+55 | EZ92: =FIB(RC[-101])+RC[-1]+R[-1]C+R[-1]C[-1] -> 5.26183192767822E+55 | FA92: =FIB(RC[-101])+RC[-1]+R[-1]C+R[-1]C[-1] -> 1.8632021385328E+56 | FB92: =FIB(RC[-101])+RC[-1]+R[-1]C+R[-1]C[-1] -> 6.49881140607895E+56 | FC92: =FIB(RC[-101])+RC[-1]+R[-1]C+R[-1]C[-1] -> 2.23359484346348E+57 | FD92: =FIB(RC[-101])+RC[-1]+R[-1]C+R[-1]C[-1] -> 7.56679597473008E+57 | FE92: =FIB(RC[-101])+RC[-1]+R[-1]C+R[-1]C[-1] -> 2.52750959856658E+58 | FF92: =FIB(RC[-101])+RC[-1]+R[-1]C+R[-1]C[-1] -> 8.32680380960763E+58 | FG92: =FIB(RC[-101])+RC[-1]+R[-1]C+R[-1]C[-1] -> 2.70642448817864E+59 | FH92: =FIB(RC[-101])+RC[-1]+R[-1]C+R[-1]C[-1] -> 8.68098198343267E+59 | FI92: =FIB(RC[-101])+RC[-1]+R[-1]C+R[-1]C[-1] -> 2.74863194644286E+60 | FJ92: =FIB(RC[-101])+RC[-1]+R[-1]C+R[-1]C[-1] -> 8.59319893681559E+60 | FK92: =FIB(RC[-101])+RC[-1]+R[-1]C+R[-1]C[-1] -> 2.653358305994E+61 | FL92: =FIB(RC[-101])+RC[-1]+R[-1]C+R[-1]C[-1] -> 8.09372661164007E+61 | FM92: =FIB(RC[-101])+RC[-1]+R[-1]C+R[-1]C[-1] -> 2.43959849475254E+62 | FN92: =FIB(RC[-101])+RC[-1]+R[-1]C+R[-1]C[-1] -> 7.26788210867925E+62 | FO92: =FIB(RC[-101])+RC[-1]+R[-1]C+R[-1]C[-1] -> 2.14050674575175E+63 | FP92: =FIB(RC[-101])+RC[-1]+R[-1]C+R[-1]C[-1] -> 6.23363252441304E+63 | FQ92: =FIB(RC[-101])+RC[-1]+R[-1]C+R[-1]C[-1] -> 1.79545934849439E+64 | FR92: =FIB(RC[-101])+RC[-1]+R[-1]C+R[-1]C[-1] -> 5.11577006781161E+64 | FS92: =FIB(RC[-101])+RC[-1]+R[-1]C+R[-1]C[-1] -> 1.44223574979678E+65 | FT92: =FIB(RC[-101])+RC[-1]+R[-1]C+R[-1]C[-1] -> 4.02381120952821E+65 | FU92: =FIB(RC[-101])+RC[-1]+R[-1]C+R[-1]C[-1] -> 1.11121727970845E+66 | FV92: =FIB(RC[-101])+RC[-1]+R[-1]C+R[-1]C[-1] -> 3.03810035557221E+66 | FW92: =FIB(RC[-101])+RC[-1]+R[-1]C+R[-1]C[-1] -> 8.22482173855469E+66 | FX92: =FIB(RC[-101])+RC[-1]+R[-1]C+R[-1]C[-1] -> 2.20520785555714E+67 | FY92: =FIB(RC[-101])+RC[-1]+R[-1]C+R[-1]C[-1] -> 5.85661411626923E+67 | FZ92: =FIB(RC[-101])+RC[-1]+R[-1]C+R[-1]C[-1] -> 1.54095927373067E+68 | GA92: =FIB(RC[-101])+RC[-1]+R[-1]C+R[-1]C[-1] -> 4.0174892857865E+68 | GB92: =FIB(RC[-101])+RC[-1]+R[-1]C+R[-1]C[-1] -> 1.0380231322227E+69 | GC92: =FIB(RC[-101])+RC[-1]+R[-1]C+R[-1]C[-1] -> 2.65837374129503E+69 | GD92: =FIB(RC[-101])+RC[-1]+R[-1]C+R[-1]C[-1] -> 6.74913338545527E+69 | GE92: =FIB(RC[-101])+RC[-1]+R[-1]C+R[-1]C[-1] -> 1.69889904366092E+70 | GF92: =FIB(RC[-101])+RC[-1]+R[-1]C+R[-1]C[-1] -> 4.24070197821683E+70 | GG92: =FIB(RC[-101])+RC[-1]+R[-1]C+R[-1]C[-1] -> 1.0498325895593E+71 | GH92: =FIB(RC[-101])+RC[-1]+R[-1]C+R[-1]C[-1] -> 2.57794990222089E+71 | GI92: =FIB(RC[-101])+RC[-1]+R[-1]C+R[-1]C[-1] -> 6.27999925085778E+71 | GJ92: =FIB(RC[-101])+RC[-1]+R[-1]C+R[-1]C[-1] -> 1.51786302649105E+72 | GK92: =FIB(RC[-101])+RC[-1]+R[-1]C+R[-1]C[-1] -> 3.64040138076812E+72 | GL92: =FIB(RC[-101])+RC[-1]+R[-1]C+R[-1]C[-1] -> 8.66491237761014E+72 | GM92: =FIB(RC[-101])+RC[-1]+R[-1]C+R[-1]C[-1] -> 2.04705988671712E+73 | GN92: =FIB(RC[-101])+RC[-1]+R[-1]C+R[-1]C[-1] -> 4.80065405914493E+73 | GO92: =FIB(RC[-101])+RC[-1]+R[-1]C+R[-1]C[-1] -> 1.11769831464755E+74 | GP92: =FIB(RC[-101])+RC[-1]+R[-1]C+R[-1]C[-1] -> 2.58376361389993E+74 | GQ92: =FIB(RC[-101])+RC[-1]+R[-1]C+R[-1]C[-1] -> 5.93107630473979E+74 | GR92: =FIB(RC[-101])+RC[-1]+R[-1]C+R[-1]C[-1] -> 1.35211696760563E+75 | GS92: =FIB(RC[-101])+RC[-1]+R[-1]C+R[-1]C[-1] -> 3.06155060488754E+75
A93: 20 | B93: 20 | C93: 20 | D93: 20 | E93: 20 | F93: 20 | G93: 20 | H93: 20 | I93: 20 | J93: 20 | K93: 20 | L93: 20 | M93: 20 | N93: 20 | O93: 20 | P93: 20 | Q93: 20 | R93: 20 | S93: 20 | T93: 20 | U93: 20 | V93: 20 | W93: 20 | X93: 20 | Y93: 20 | Z93: 20 | AA93: 20 | AB93: 20 | AC93: 20 | AD93: 20 | AE93: 20 | AF93: 20 | AG93: 20 | AH93: 20 | AI93: 20 | AJ93: 20 | AK93: 20 | AL93: 20 | AM93: 20 | AN93: 20 | AO93: 20 | AP93: 20 | AQ93: 20 | AR93: 20 | AS93: 20 | AT93: 20 | AU93: 20 | AV93: 20 | AW93: 20 | AX93: 20 | AY93: 20 | AZ93: 20 | BA93: 20 | BB93: 20 | BC93: 20 | BD93: 20 | BE93: 20 | BF93: 20 | BG93: 20 | BH93: 20 | BI93: 20 | BJ93: 20 | BK93: 20 | BL93: 20 | BM93: 20 | BN93: 20 | BO93: 20 | BP93: 20 | BQ93: 20 | BR93: 20 | BS93: 20 | BT93: 20 | BU93: 20 | BV93: 20 | BW93: 20 | BX93: 20 | BY93: 20 | BZ93: 20 | CA93: 20 | CB93: 20 | CC93: 20 | CD93: 20 | CE93: 20 | CF93: 20 | CG93: 20 | CH93: 20 | CI93: 20 | CJ93: 20 | CK93: 20 | CL93: 20 | CM93: 20 | CN93: 20 | CO93: 20 | CP93: 20 | CQ93: 20 | CR93: 20 | CS93: 20 | CT93: 20 | CU93: 20 | CV93: 20 | CW93: 0 | CX93: =FIB(RC[-101])+RC[-1]+R[-1]C+R[-1]C[-1] -> 1007032 | CY93: =FIB(RC[-101])+RC[-1]+R[-1]C+R[-1]C[-1] -> 93653976 | CZ93: =FIB(RC[-101])+RC[-1]+R[-1]C+R[-1]C[-1] -> 5776335552 | DA93: =FIB(RC[-101])+RC[-1]+R[-1]C+R[-1]C[-1] -> 267226011520 | DB93: =FIB(RC[-101])+RC[-1]+R[-1]C+R[-1]C[-1] -> 9891983696088 | DC93: =FIB(RC[-101])+RC[-1]+R[-1]C+R[-1]C[-1] -> 305225519140152 | DD93: =FIB(RC[-101])+RC[-1]+R[-1]C+R[-1]C[-1] -> 8.07515327773024E+15 | DE93: =FIB(RC[-101])+RC[-1]+R[-1]C+R[-1]C[-1] -> 1.87004991876885E+17 | DF93: =FIB(RC[-101])+RC[-1]+R[-1]C+R[-1]C[-1] -> 3.85116941371629E+18 | DG93: =FIB(RC[-101])+RC[-1]+R[-1]C+R[-1]C[-1] -> 7.14149386464407E+19 | DH93: =FIB(RC[-101])+RC[-1]+R[-1]C+R[-1]C[-1] -> 1.20457048579352E+21 | DI93: =FIB(RC[-101])+RC[-1]+R[-1]C+R[-1]C[-1] -> 1.86359253497426E+22 | DJ93: =FIB(RC[-101])+RC[-1]+R[-1]C+R[-1]C[-1] -> 2.66315464271685E+23 | DK93: =FIB(RC[-101])+RC[-1]+R[-1]C+R[-1]C[-1] -> 3.53647342284346E+24 | DL93: =FIB(RC[-101])+RC[-1]+R[-1]C+R[-1]C[-1] -> 4.38650666483896E+25 | DM93: =FIB(RC[-101])+RC[-1]+R[-1]C+R[-1]C[-1] -> 5.1050527695592E+26 | DN93: =FIB(RC[-101])+RC[-1]+R[-1]C+R[-1]C[-1] -> 5.59678337077762E+27 | DO93: =FIB(RC[-101])+RC[-1]+R[-1]C+R[-1]C[-1] -> 5.8004639627895E+28 | DP93: =FIB(RC[-101])+RC[-1]+R[-1]C+R[-1]C[-1] -> 5.70084233254451E+29 | DQ93: =FIB(RC[-101])+RC[-1]+R[-1]C+R[-1]C[-1] -> 5.32838356525017E+30 | DR93: =FIB(RC[-101])+RC[-1]+R[-1]C+R[-1]C[-1] -> 4.7483459249351E+31 | DS93: =FIB(RC[-101])+RC[-1]+R[-1]C+R[-1]C[-1] -> 4.0437890981819E+32 | DT93: =FIB(RC[-101])+RC[-1]+R[-1]C+R[-1]C[-1] -> 3.29803193129787E+33 | DU93: =FIB(RC[-101])+RC[-1]+R[-1]C+R[-1]C[-1] -> 2.58098592589968E+34 | DV93: =FIB(RC[-101])+RC[-1]+R[-1]C+R[-1]C[-1] -> 1.94159069170622E+35 | DW93: =FIB(RC[-101])+RC[-1]+R[-1]C+R[-1]C[-1] -> 1.40633362607846E+36 | DX93: =FIB(RC[-101])+RC[-1]+R[-1]C+R[-1]C[-1] -> 9.82295765270193E+36 | DY93: =FIB(RC[-101])+RC[-1]+R[-1]C+R[-1]C[-1] -> 6.62577919162134E+37 | DZ93: =FIB(RC[-101])+RC[-1]+R[-1]C+R[-1]C[-1] -> 4.32163252371557E+38 | EA93: =FIB(RC[-101])+RC[-1]+R[-1]C+R[-1]C[-1] -> 2.72905592181027E+39 | EB93: =FIB(RC[-101])+RC[-1]+R[-1]C+R[-1]C[-1] -> 1.67045239711628E+40 | EC93: =FIB(RC[-101])+RC[-1]+R[-1]C+R[-1]C[-1] -> 9.92168021325386E+40 | ED93: =FIB(RC[-101])+RC[-1]+R[-1]C+R[-1]C[-1] -> 5.72413732169602E+41 | EE93: =FIB(RC[-101])+RC[-1]+R[-1]C+R[-1]C[-1] -> 3.21090279181618E+42 | EF93: =FIB(RC[-101])+RC[-1]+R[-1]C+R[-1]C[-1] -> 1.75279738108503E+43 | EG93: =FIB(RC[-101])+RC[-1]+R[-1]C+R[-1]C[-1] -> 9.3196020908913E+43 | EH93: =FIB(RC[-101])+RC[-1]+R[-1]C+R[-1]C[-1] -> 4.830343493335E+44 | EI93: =FIB(RC[-101])+RC[-1]+R[-1]C+R[-1]C[-1] -> 2.4423580894823E+45 | EJ93: =FIB(RC[-101])+RC[-1]+R[-1]C+R[-1]C[-1] -> 1.20561936366384E+46 | EK93: =FIB(RC[-101])+RC[-1]+R[-1]C+R[-1]C[-1] -> 5.81411947066979E+46 | EL93: =FIB(RC[-101])+RC[-1]+R[-1]C+R[-1]C[-1] -> 2.74106555273284E+47 | EM93: =FIB(RC[-101])+RC[-1]+R[-1]C+R[-1]C[-1] -> 1.26413099306029E+48 | EN93: =FIB(RC[-101])+RC[-1]+R[-1]C+R[-1]C[-1] -> 5.70643509389841E+48 | EO93: =FIB(RC[-101])+RC[-1]+R[-1]C+R[-1]C[-1] -> 2.52283664789272E+49 | EP93: =FIB(RC[-101])+RC[-1]+R[-1]C+R[-1]C[-1] -> 1.09296243171846E+50 | EQ93: =FIB(RC[-101])+RC[-1]+R[-1]C+R[-1]C[-1] -> 4.64240901703114E+50 | ER93: =FIB(RC[-101])+RC[-1]+R[-1]C+R[-1]C[-1] -> 1.93430200002087E+51 | ES93: =FIB(RC[-101])+RC[-1]+R[-1]C+R[-1]C[-1] -> 7.90969150799807E+51 | ET93: =FIB(RC[-101])+RC[-1]+R[-1]C+R[-1]C[-1] -> 3.17579474485846E+52 | EU93: =FIB(RC[-101])+RC[-1]+R[-1]C+R[-1]C[-1] -> 1.25255903237601E+53 | EV93: =FIB(RC[-101])+RC[-1]+R[-1]C+R[-1]C[-1] -> 4.85494891595793E+53 | EW93: =FIB(RC[-101])+RC[-1]+R[-1]C+R[-1]C[-1] -> 1.85008857712191E+54 | EX93: =FIB(RC[-101])+RC[-1]+R[-1]C+R[-1]C[-1] -> 6.93419096472707E+54 | EY93: =FIB(RC[-101])+RC[-1]+R[-1]C+R[-1]C[-1] -> 2.55718522789253E+55 | EZ93: =FIB(RC[-101])+RC[-1]+R[-1]C+R[-1]C[-1] -> 9.28225269762991E+55 | FA93: =FIB(RC[-101])+RC[-1]+R[-1]C+R[-1]C[-1] -> 3.31761060106361E+56 | FB93: =FIB(RC[-101])+RC[-1]+R[-1]C+R[-1]C[-1] -> 1.16796241456754E+57 | FC93: =FIB(RC[-101])+RC[-1]+R[-1]C+R[-1]C[-1] -> 4.05143839863891E+57 | FD93: =FIB(RC[-101])+RC[-1]+R[-1]C+R[-1]C[-1] -> 1.38518292168325E+58 | FE93: =FIB(RC[-101])+RC[-1]+R[-1]C+R[-1]C[-1] -> 4.66937211772284E+58 | FF93: =FIB(RC[-101])+RC[-1]+R[-1]C+R[-1]C[-1] -> 1.5523685525897E+59 | FG93: =FIB(RC[-101])+RC[-1]+R[-1]C+R[-1]C[-1] -> 5.09147342172911E+59 | FH93: =FIB(RC[-101])+RC[-1]+R[-1]C+R[-1]C[-1] -> 1.64788798933404E+60 | FI93: =FIB(RC[-101])+RC[-1]+R[-1]C+R[-1]C[-1] -> 5.26461813412017E+60 | FJ93: =FIB(RC[-101])+RC[-1]+R[-1]C+R[-1]C[-1] -> 1.66064490173786E+61 | FK93: =FIB(RC[-101])+RC[-1]+R[-1]C+R[-1]C[-1] -> 5.17332310141342E+61 | FL93: =FIB(RC[-101])+RC[-1]+R[-1]C+R[-1]C[-1] -> 1.59204080190475E+62 | FM93: =FIB(RC[-101])+RC[-1]+R[-1]C+R[-1]C[-1] -> 4.8410119578213E+62 | FN93: =FIB(RC[-101])+RC[-1]+R[-1]C+R[-1]C[-1] -> 1.45484925612531E+63 | FO93: =FIB(RC[-101])+RC[-1]+R[-1]C+R[-1]C[-1] -> 4.32214421274499E+63 | FP93: =FIB(RC[-101])+RC[-1]+R[-1]C+R[-1]C[-1] -> 1.26962834829098E+64 | FQ93: =FIB(RC[-101])+RC[-1]+R[-1]C+R[-1]C[-1] -> 3.68845094922667E+64 | FR93: =FIB(RC[-101])+RC[-1]+R[-1]C+R[-1]C[-1] -> 1.05996803655327E+65 | FS93: =FIB(RC[-101])+RC[-1]+R[-1]C+R[-1]C[-1] -> 3.0137807931312E+65 | FT93: =FIB(RC[-101])+RC[-1]+R[-1]C+R[-1]C[-1] -> 8.47982775245619E+65 | FU93: =FIB(RC[-101])+RC[-1]+R[-1]C+R[-1]C[-1] -> 2.36158117590689E+66 | FV93: =FIB(RC[-101])+RC[-1]+R[-1]C+R[-1]C[-1] -> 6.51089881118755E+66 | FW93: =FIB(RC[-101])+RC[-1]+R[-1]C+R[-1]C[-1] -> 1.77738209053145E+67 | FX93: =FIB(RC[-101])+RC[-1]+R[-1]C+R[-1]C[-1] -> 4.80507211994405E+67 | FY93: =FIB(RC[-101])+RC[-1]+R[-1]C+R[-1]C[-1] -> 1.28668940917704E+68 | FZ93: =FIB(RC[-101])+RC[-1]+R[-1]C+R[-1]C[-1] -> 3.41331009453463E+68 | GA93: =FIB(RC[-101])+RC[-1]+R[-1]C+R[-1]C[-1] -> 8.9717586540518E+68 | GB93: =FIB(RC[-101])+RC[-1]+R[-1]C+R[-1]C[-1] -> 2.33694792620653E+69 | GC93: =FIB(RC[-101])+RC[-1]+R[-1]C+R[-1]C[-1] -> 6.03334479972427E+69 | GD93: =FIB(RC[-101])+RC[-1]+R[-1]C+R[-1]C[-1] -> 1.54408519264746E+70 | GE93: =FIB(RC[-101])+RC[-1]+R[-1]C+R[-1]C[-1] -> 3.91789757485391E+70 | GF93: =FIB(RC[-101])+RC[-1]+R[-1]C+R[-1]C[-1] -> 9.85749859673166E+70 | GG93: =FIB(RC[-101])+RC[-1]+R[-1]C+R[-1]C[-1] -> 2.45965264705414E+71 | GH93: =FIB(RC[-101])+RC[-1]+R[-1]C+R[-1]C[-1] -> 6.08743513883433E+71 | GI93: =FIB(RC[-101])+RC[-1]+R[-1]C+R[-1]C[-1] -> 1.4945384291913E+72 | GJ93: =FIB(RC[-101])+RC[-1]+R[-1]C+R[-1]C[-1] -> 3.64040138076812E+72 | GK93: =FIB(RC[-101])+RC[-1]+R[-1]C+R[-1]C[-1] -> 8.7986657880273E+72 | GL93: =FIB(RC[-101])+RC[-1]+R[-1]C+R[-1]C[-1] -> 2.11039795464056E+73 | GM93: =FIB(RC[-101])+RC[-1]+R[-1]C+R[-1]C[-1] -> 5.02394907911869E+73 | GN93: =FIB(RC[-101])+RC[-1]+R[-1]C+R[-1]C[-1] -> 1.18716630249807E+74 | GO93: =FIB(RC[-101])+RC[-1]+R[-1]C+R[-1]C[-1] -> 2.78493002306012E+74 | GP93: =FIB(RC[-101])+RC[-1]+R[-1]C+R[-1]C[-1] -> 6.48639195160759E+74 | GQ93: =FIB(RC[-101])+RC[-1]+R[-1]C+R[-1]C[-1] -> 1.50012318702473E+75 | GR93: =FIB(RC[-101])+RC[-1]+R[-1]C+R[-1]C[-1] -> 3.44534778510434E+75 | GS93: =FIB(RC[-101])+RC[-1]+R[-1]C+R[-1]C[-1] -> 7.85901535759751E+75
A94: 20 | B94: 20 | C94: 20 | D94: 20 | E94: 20 | F94: 20 | G94: 20 | H94: 20 | I94: 20 | J94: 20 | K94: 20 | L94: 20 | M94: 20 | N94: 20 | O94: 20 | P94: 20 | Q94: 20 | R94: 20 | S94: 20 | T94: 20 | U94: 20 | V94: 20 | W94: 20 | X94: 20 | Y94: 20 | Z94: 20 | AA94: 20 | AB94: 20 | AC94: 20 | AD94: 20 | AE94: 20 | AF94: 20 | AG94: 20 | AH94: 20 | AI94: 20 | AJ94: 20 | AK94: 20 | AL94: 20 | AM94: 20 | AN94: 20 | AO94: 20 | AP94: 20 | AQ94: 20 | AR94: 20 | AS94: 20 | AT94: 20 | AU94: 20 | AV94: 20 | AW94: 20 | AX94: 20 | AY94: 20 | AZ94: 20 | BA94: 20 | BB94: 20 | BC94: 20 | BD94: 20 | BE94: 20 | BF94: 20 | BG94: 20 | BH94: 20 | BI94: 20 | BJ94: 20 | BK94: 20 | BL94: 20 | BM94: 20 | BN94: 20 | BO94: 20 | BP94: 20 | BQ94: 20 | BR94: 20 | BS94: 20 | BT94: 20 | BU94: 20 | BV94: 20 | BW94: 20 | BX94: 20 | BY94: 20 | BZ94: 20 | CA94: 20 | CB94: 20 | CC94: 20 | CD94: 20 | CE94: 20 | CF94: 20 | CG94: 20 | CH94: 20 | CI94: 20 | CJ94: 20 | CK94: 20 | CL94: 20 | CM94: 20 | CN94: 20 | CO94: 20 | CP94: 20 | CQ94: 20 | CR94: 20 | CS94: 20 | CT94: 20 | CU94: 20 | CV94: 20 | CW94: 0 | CX94: =FIB(RC[-101])+RC[-1]+R[-1]C+R[-1]C[-1] -> 1017978 | CY94: =FIB(RC[-101])+RC[-1]+R[-1]C+R[-1]C[-1] -> 95689932 | CZ94: =FIB(RC[-101])+RC[-1]+R[-1]C+R[-1]C[-1] -> 5965690406 | DA94: =FIB(RC[-101])+RC[-1]+R[-1]C+R[-1]C[-1] -> 278968048424 | DB94: =FIB(RC[-101])+RC[-1]+R[-1]C+R[-1]C[-1] -> 10438177766978 | DC94: =FIB(RC[-101])+RC[-1]+R[-1]C+R[-1]C[-1] -> 325555680614164 | DD94: =FIB(RC[-101])+RC[-1]+R[-1]C+R[-1]C[-1] -> 8.7059344774955E+15 | DE94: =FIB(RC[-101])+RC[-1]+R[-1]C+R[-1]C[-1] -> 2.03786079632122E+17 | DF94: =FIB(RC[-101])+RC[-1]+R[-1]C+R[-1]C[-1] -> 4.24196048522531E+18 | DG94: =FIB(RC[-101])+RC[-1]+R[-1]C+R[-1]C[-1] -> 7.95080685453823E+19 | DH94: =FIB(RC[-101])+RC[-1]+R[-1]C+R[-1]C[-1] -> 1.35549349298534E+21 | DI94: =FIB(RC[-101])+RC[-1]+R[-1]C+R[-1]C[-1] -> 2.11959893285215E+22 | DJ94: =FIB(RC[-101])+RC[-1]+R[-1]C+R[-1]C[-1] -> 3.06147378949949E+23 | DK94: =FIB(RC[-101])+RC[-1]+R[-1]C+R[-1]C[-1] -> 4.1089362660651E+24 | DL94: =FIB(RC[-101])+RC[-1]+R[-1]C+R[-1]C[-1] -> 5.15104763372981E+25 | DM94: =FIB(RC[-101])+RC[-1]+R[-1]C+R[-1]C[-1] -> 6.05880819941608E+26 | DN94: =FIB(RC[-101])+RC[-1]+R[-1]C+R[-1]C[-1] -> 6.71316946767515E+27 | DO94: =FIB(RC[-101])+RC[-1]+R[-1]C+R[-1]C[-1] -> 7.03145924663478E+28 | DP94: =FIB(RC[-101])+RC[-1]+R[-1]C+R[-1]C[-1] -> 6.98403465348694E+29 | DQ94: =FIB(RC[-101])+RC[-1]+R[-1]C+R[-1]C[-1] -> 6.59687126385332E+30 | DR94: =FIB(RC[-101])+RC[-1]+R[-1]C+R[-1]C[-1] -> 5.94087140784545E+31 | DS94: =FIB(RC[-101])+RC[-1]+R[-1]C+R[-1]C[-1] -> 5.11271083145996E+32 | DT94: =FIB(RC[-101])+RC[-1]+R[-1]C+R[-1]C[-1] -> 4.21368192426205E+33 | DU94: =FIB(RC[-101])+RC[-1]+R[-1]C+R[-1]C[-1] -> 3.33215731145567E+34 | DV94: =FIB(RC[-101])+RC[-1]+R[-1]C+R[-1]C[-1] -> 2.53290501544176E+35 | DW94: =FIB(RC[-101])+RC[-1]+R[-1]C+R[-1]C[-1] -> 1.85378319679326E+36 | DX94: =FIB(RC[-101])+RC[-1]+R[-1]C+R[-1]C[-1] -> 1.30830744755737E+37 | DY94: =FIB(RC[-101])+RC[-1]+R[-1]C+R[-1]C[-1] -> 8.9163824044489E+37 | DZ94: =FIB(RC[-101])+RC[-1]+R[-1]C+R[-1]C[-1] -> 5.87584868332259E+38 | EA94: =FIB(RC[-101])+RC[-1]+R[-1]C+R[-1]C[-1] -> 3.74880404251409E+39 | EB94: =FIB(RC[-101])+RC[-1]+R[-1]C+R[-1]C[-1] -> 2.31823839354872E+40 | EC94: =FIB(RC[-101])+RC[-1]+R[-1]C+R[-1]C[-1] -> 1.39103710039189E+41 | ED94: =FIB(RC[-101])+RC[-1]+R[-1]C+R[-1]C[-1] -> 8.10734244341329E+41 | EE94: =FIB(RC[-101])+RC[-1]+R[-1]C+R[-1]C[-1] -> 4.59405076832711E+42 | EF94: =FIB(RC[-101])+RC[-1]+R[-1]C+R[-1]C[-1] -> 2.53329273709936E+43 | EG94: =FIB(RC[-101])+RC[-1]+R[-1]C+R[-1]C[-1] -> 1.36056922090757E+44 | EH94: =FIB(RC[-101])+RC[-1]+R[-1]C+R[-1]C[-1] -> 7.1228729233317E+44 | EI94: =FIB(RC[-101])+RC[-1]+R[-1]C+R[-1]C[-1] -> 3.63767973114897E+45 | EJ94: =FIB(RC[-101])+RC[-1]+R[-1]C+R[-1]C[-1] -> 1.81362314572697E+46 | EK94: =FIB(RC[-101])+RC[-1]+R[-1]C+R[-1]C[-1] -> 8.8333619800606E+46 | EL94: =FIB(RC[-101])+RC[-1]+R[-1]C+R[-1]C[-1] -> 4.20581369780588E+47 | EM94: =FIB(RC[-101])+RC[-1]+R[-1]C+R[-1]C[-1] -> 1.95881891811416E+48 | EN94: =FIB(RC[-101])+RC[-1]+R[-1]C+R[-1]C[-1] -> 8.92938500507286E+48 | EO94: =FIB(RC[-101])+RC[-1]+R[-1]C+R[-1]C[-1] -> 3.98641865778985E+49 | EP94: =FIB(RC[-101])+RC[-1]+R[-1]C+R[-1]C[-1] -> 1.74388796228672E+50 | EQ94: =FIB(RC[-101])+RC[-1]+R[-1]C+R[-1]C[-1] -> 7.47925941103631E+50 | ER94: =FIB(RC[-101])+RC[-1]+R[-1]C+R[-1]C[-1] -> 3.14646884282762E+51 | ES94: =FIB(RC[-101])+RC[-1]+R[-1]C+R[-1]C[-1] -> 1.29904623508466E+52 | ET94: =FIB(RC[-101])+RC[-1]+R[-1]C+R[-1]C[-1] -> 5.26581013074292E+52 | EU94: =FIB(RC[-101])+RC[-1]+R[-1]C+R[-1]C[-1] -> 2.09671951993615E+53 | EV94: =FIB(RC[-101])+RC[-1]+R[-1]C+R[-1]C[-1] -> 8.20422746827009E+53 | EW94: =FIB(RC[-101])+RC[-1]+R[-1]C+R[-1]C[-1] -> 3.15600621554471E+54 | EX94: =FIB(RC[-101])+RC[-1]+R[-1]C+R[-1]C[-1] -> 1.19402857573937E+55 | EY94: =FIB(RC[-101])+RC[-1]+R[-1]C+R[-1]C[-1] -> 4.44463290010461E+55 | EZ94: =FIB(RC[-101])+RC[-1]+R[-1]C+R[-1]C[-1] -> 1.62840708256271E+56 | FA94: =FIB(RC[-101])+RC[-1]+R[-1]C+R[-1]C[-1] -> 5.87424295338931E+56 | FB94: =FIB(RC[-101])+RC[-1]+R[-1]C+R[-1]C[-1] -> 2.08714777001283E+57 | FC94: =FIB(RC[-101])+RC[-1]+R[-1]C+R[-1]C[-1] -> 7.30654858321927E+57 | FD94: =FIB(RC[-101])+RC[-1]+R[-1]C+R[-1]C[-1] -> 2.52098161986907E+58 | FE94: =FIB(RC[-101])+RC[-1]+R[-1]C+R[-1]C[-1] -> 8.57553665927515E+58 | FF94: =FIB(RC[-101])+RC[-1]+R[-1]C+R[-1]C[-1] -> 2.8768594302895E+59 | FG94: =FIB(RC[-101])+RC[-1]+R[-1]C+R[-1]C[-1] -> 9.52070140460832E+59 | FH94: =FIB(RC[-101])+RC[-1]+R[-1]C+R[-1]C[-1] -> 3.10910547196778E+60 | FI94: =FIB(RC[-101])+RC[-1]+R[-1]C+R[-1]C[-1] -> 1.0021611595422E+61 | FJ94: =FIB(RC[-101])+RC[-1]+R[-1]C+R[-1]C[-1] -> 3.18926787469208E+61 | FK94: =FIB(RC[-101])+RC[-1]+R[-1]C+R[-1]C[-1] -> 1.00232358778434E+62 | FL94: =FIB(RC[-101])+RC[-1]+R[-1]C+R[-1]C[-1] -> 3.11169669983043E+62 | FM94: =FIB(RC[-101])+RC[-1]+R[-1]C+R[-1]C[-1] -> 9.54474945955648E+62 | FN94: =FIB(RC[-101])+RC[-1]+R[-1]C+R[-1]C[-1] -> 2.89342539786309E+63 | FO94: =FIB(RC[-101])+RC[-1]+R[-1]C+R[-1]C[-1] -> 8.67041886673338E+63 | FP94: =FIB(RC[-101])+RC[-1]+R[-1]C+R[-1]C[-1] -> 2.56888465623882E+64 | FQ94: =FIB(RC[-101])+RC[-1]+R[-1]C+R[-1]C[-1] -> 7.52696395375647E+64 | FR94: =FIB(RC[-101])+RC[-1]+R[-1]C+R[-1]C[-1] -> 2.18150952685158E+65 | FS94: =FIB(RC[-101])+RC[-1]+R[-1]C+R[-1]C[-1] -> 6.25525835653605E+65 | FT94: =FIB(RC[-101])+RC[-1]+R[-1]C+R[-1]C[-1] -> 1.77488669021234E+66 | FU94: =FIB(RC[-101])+RC[-1]+R[-1]C+R[-1]C[-1] -> 4.98445064136485E+66 | FV94: =FIB(RC[-101])+RC[-1]+R[-1]C+R[-1]C[-1] -> 1.38569306284593E+67 | FW94: =FIB(RC[-101])+RC[-1]+R[-1]C+R[-1]C[-1] -> 3.81416503449613E+67 | FX94: =FIB(RC[-101])+RC[-1]+R[-1]C+R[-1]C[-1] -> 1.03966192449716E+68 | FY94: =FIB(RC[-101])+RC[-1]+R[-1]C+R[-1]C[-1] -> 2.80685854566861E+68 | FZ94: =FIB(RC[-101])+RC[-1]+R[-1]C+R[-1]C[-1] -> 7.50685804938029E+68 | GA94: =FIB(RC[-101])+RC[-1]+R[-1]C+R[-1]C[-1] -> 1.98919267979667E+69 | GB94: =FIB(RC[-101])+RC[-1]+R[-1]C+R[-1]C[-1] -> 5.22331647140839E+69 | GC94: =FIB(RC[-101])+RC[-1]+R[-1]C+R[-1]C[-1] -> 1.35936091973392E+70 | GD94: =FIB(RC[-101])+RC[-1]+R[-1]C+R[-1]C[-1] -> 3.5067805923538E+70 | GE94: =FIB(RC[-101])+RC[-1]+R[-1]C+R[-1]C[-1] -> 8.96876335985517E+70 | GF94: =FIB(RC[-101])+RC[-1]+R[-1]C+R[-1]C[-1] -> 2.27441595314407E+71 | GG94: =FIB(RC[-101])+RC[-1]+R[-1]C+R[-1]C[-1] -> 5.71981845987138E+71 | GH94: =FIB(RC[-101])+RC[-1]+R[-1]C+R[-1]C[-1] -> 1.42669062457599E+72 | GI94: =FIB(RC[-101])+RC[-1]+R[-1]C+R[-1]C[-1] -> 3.52997256765072E+72 | GJ94: =FIB(RC[-101])+RC[-1]+R[-1]C+R[-1]C[-1] -> 8.66491237761014E+72 | GK94: =FIB(RC[-101])+RC[-1]+R[-1]C+R[-1]C[-1] -> 2.11039795464056E+73 | GL94: =FIB(RC[-101])+RC[-1]+R[-1]C+R[-1]C[-1] -> 5.10066248808384E+73 | GM94: =FIB(RC[-101])+RC[-1]+R[-1]C+R[-1]C[-1] -> 1.22350095218431E+74 | GN94: =FIB(RC[-101])+RC[-1]+R[-1]C+R[-1]C[-1] -> 2.91306216259425E+74 | GO94: =FIB(RC[-101])+RC[-1]+R[-1]C+R[-1]C[-1] -> 6.88515848815244E+74 | GP94: =FIB(RC[-101])+RC[-1]+R[-1]C+R[-1]C[-1] -> 1.61564804628201E+75 | GQ94: =FIB(RC[-101])+RC[-1]+R[-1]C+R[-1]C[-1] -> 3.7644104284675E+75 | GR94: =FIB(RC[-101])+RC[-1]+R[-1]C+R[-1]C[-1] -> 8.70988140059657E+75 | GS94: =FIB(RC[-101])+RC[-1]+R[-1]C+R[-1]C[-1] -> 2.00142445432984E+76
A95: 20 | B95: 20 | C95: 20 | D95: 20 | E95: 20 | F95: 20 | G95: 20 | H95: 20 | I95: 20 | J95: 20 | K95: 20 | L95: 20 | M95: 20 | N95: 20 | O95: 20 | P95: 20 | Q95: 20 | R95: 20 | S95: 20 | T95: 20 | U95: 20 | V95: 20 | W95: 20 | X95: 20 | Y95: 20 | Z95: 20 | AA95: 20 | AB95: 20 | AC95: 20 | AD95: 20 | AE95: 20 | AF95: 20 | AG95: 20 | AH95: 20 | AI95: 20 | AJ95: 20 | AK95: 20 | AL95: 20 | AM95: 20 | AN95: 20 | AO95: 20 | AP95: 20 | AQ95: 20 | AR95: 20 | AS95: 20 | AT95: 20 | AU95: 20 | AV95: 20 | AW95: 20 | AX95: 20 | AY95: 20 | AZ95: 20 | BA95: 20 | BB95: 20 | BC95: 20 | BD95: 20 | BE95: 20 | BF95: 20 | BG95: 20 | BH95: 20 | BI95: 20 | BJ95: 20 | BK95: 20 | BL95: 20 | BM95: 20 | BN95: 20 | BO95: 20 | BP95: 20 | BQ95: 20 | BR95: 20 | BS95: 20 | BT95: 20 | BU95: 20 | BV95: 20 | BW95: 20 | BX95: 20 | BY95: 20 | BZ95: 20 | CA95: 20 | CB95: 20 | CC95: 20 | CD95: 20 | CE95: 20 | CF95: 20 | CG95: 20 | CH95: 20 | CI95: 20 | CJ95: 20 | CK95: 20 | CL95: 20 | CM95: 20 | CN95: 20 | CO95: 20 | CP95: 20 | CQ95: 20 | CR95: 20 | CS95: 20 | CT95: 20 | CU95: 20 | CV95: 20 | CW95: 0 | CX95: =FIB(RC[-101])+RC[-1]+R[-1]C+R[-1]C[-1] -> 1028924 | CY95: =FIB(RC[-101])+RC[-1]+R[-1]C+R[-1]C[-1] -> 97747780 | CZ95: =FIB(RC[-101])+RC[-1]+R[-1]C+R[-1]C[-1] -> 6159139064 | DA95: =FIB(RC[-101])+RC[-1]+R[-1]C+R[-1]C[-1] -> 291092888840 | DB95: =FIB(RC[-101])+RC[-1]+R[-1]C+R[-1]C[-1] -> 11008238715188 | DC95: =FIB(RC[-101])+RC[-1]+R[-1]C+R[-1]C[-1] -> 347002097107276 | DD95: =FIB(RC[-101])+RC[-1]+R[-1]C+R[-1]C[-1] -> 9.37849225522789E+15 | DE95: =FIB(RC[-101])+RC[-1]+R[-1]C+R[-1]C[-1] -> 2.21870506364856E+17 | DF95: =FIB(RC[-101])+RC[-1]+R[-1]C+R[-1]C[-1] -> 4.6676170712223E+18 | DG95: =FIB(RC[-101])+RC[-1]+R[-1]C+R[-1]C[-1] -> 8.84176461018299E+19 | DH95: =FIB(RC[-101])+RC[-1]+R[-1]C+R[-1]C[-1] -> 1.52341920763255E+21 | DI95: =FIB(RC[-101])+RC[-1]+R[-1]C+R[-1]C[-1] -> 2.40749020291394E+22 | DJ95: =FIB(RC[-101])+RC[-1]+R[-1]C+R[-1]C[-1] -> 3.5141827030761E+23 | DK95: =FIB(RC[-101])+RC[-1]+R[-1]C+R[-1]C[-1] -> 4.76650191532266E+24 | DL95: =FIB(RC[-101])+RC[-1]+R[-1]C+R[-1]C[-1] -> 6.03859145186859E+25 | DM95: =FIB(RC[-101])+RC[-1]+R[-1]C+R[-1]C[-1] -> 7.17777210797592E+26 | DN95: =FIB(RC[-101])+RC[-1]+R[-1]C+R[-1]C[-1] -> 8.03682749841435E+27 | DO95: =FIB(RC[-101])+RC[-1]+R[-1]C+R[-1]C[-1] -> 8.50645894324373E+28 | DP95: =FIB(RC[-101])+RC[-1]+R[-1]C+R[-1]C[-1] -> 8.53782647247479E+29 | DQ95: =FIB(RC[-101])+RC[-1]+R[-1]C+R[-1]C[-1] -> 8.14905737644949E+30 | DR95: =FIB(RC[-101])+RC[-1]+R[-1]C+R[-1]C[-1] -> 7.41546427187573E+31 | DS95: =FIB(RC[-101])+RC[-1]+R[-1]C+R[-1]C[-1] -> 6.44834439943208E+32 | DT95: =FIB(RC[-101])+RC[-1]+R[-1]C+R[-1]C[-1] -> 5.36978744735126E+33 | DU95: =FIB(RC[-101])+RC[-1]+R[-1]C+R[-1]C[-1] -> 4.29050424861701E+34 | DV95: =FIB(RC[-101])+RC[-1]+R[-1]C+R[-1]C[-1] -> 3.29517117144903E+35 | DW95: =FIB(RC[-101])+RC[-1]+R[-1]C+R[-1]C[-1] -> 2.43659081548234E+36 | DX95: =FIB(RC[-101])+RC[-1]+R[-1]C+R[-1]C[-1] -> 1.73734484878493E+37 | DY95: =FIB(RC[-101])+RC[-1]+R[-1]C+R[-1]C[-1] -> 1.19620347007912E+38 | DZ95: =FIB(RC[-101])+RC[-1]+R[-1]C+R[-1]C[-1] -> 7.9636903938466E+38 | EA95: =FIB(RC[-101])+RC[-1]+R[-1]C+R[-1]C[-1] -> 5.13275795023101E+39 | EB95: =FIB(RC[-101])+RC[-1]+R[-1]C+R[-1]C[-1] -> 3.20639459282322E+40 | EC95: =FIB(RC[-101])+RC[-1]+R[-1]C+R[-1]C[-1] -> 1.94350039902908E+41 | ED95: =FIB(RC[-101])+RC[-1]+R[-1]C+R[-1]C[-1] -> 1.14418799428343E+42 | EE95: =FIB(RC[-101])+RC[-1]+R[-1]C+R[-1]C[-1] -> 6.54897300695186E+42 | EF95: =FIB(RC[-101])+RC[-1]+R[-1]C+R[-1]C[-1] -> 3.64759511462725E+43 | EG95: =FIB(RC[-101])+RC[-1]+R[-1]C+R[-1]C[-1] -> 1.97865800608023E+44 | EH95: =FIB(RC[-101])+RC[-1]+R[-1]C+R[-1]C[-1] -> 1.04621001503195E+45 | EI95: =FIB(RC[-101])+RC[-1]+R[-1]C+R[-1]C[-1] -> 5.39617703851409E+45 | EJ95: =FIB(RC[-101])+RC[-1]+R[-1]C+R[-1]C[-1] -> 2.71700882269327E+46 | EK95: =FIB(RC[-101])+RC[-1]+R[-1]C+R[-1]C[-1] -> 1.33639939484808E+47 | EL95: =FIB(RC[-101])+RC[-1]+R[-1]C+R[-1]C[-1] -> 6.42554929066002E+47 | EM95: =FIB(RC[-101])+RC[-1]+R[-1]C+R[-1]C[-1] -> 3.02195521696075E+48 | EN95: =FIB(RC[-101])+RC[-1]+R[-1]C+R[-1]C[-1] -> 1.39101591401478E+49 | EO95: =FIB(RC[-101])+RC[-1]+R[-1]C+R[-1]C[-1] -> 6.27037307231191E+49 | EP95: =FIB(RC[-101])+RC[-1]+R[-1]C+R[-1]C[-1] -> 2.76956713529689E+50 | EQ95: =FIB(RC[-101])+RC[-1]+R[-1]C+R[-1]C[-1] -> 1.19927145086199E+51 | ER95: =FIB(RC[-101])+RC[-1]+R[-1]C+R[-1]C[-1] -> 5.09366623479324E+51 | ES95: =FIB(RC[-101])+RC[-1]+R[-1]C+R[-1]C[-1] -> 2.12305974284674E+52 | ET95: =FIB(RC[-101])+RC[-1]+R[-1]C+R[-1]C[-1] -> 8.68791610867432E+52 | EU95: =FIB(RC[-101])+RC[-1]+R[-1]C+R[-1]C[-1] -> 3.49209214387787E+53 | EV95: =FIB(RC[-101])+RC[-1]+R[-1]C+R[-1]C[-1] -> 1.37930391320841E+54 | EW95: =FIB(RC[-101])+RC[-1]+R[-1]C+R[-1]C[-1] -> 5.35573287558013E+54 | EX95: =FIB(RC[-101])+RC[-1]+R[-1]C+R[-1]C[-1] -> 2.04520248485185E+55 | EY95: =FIB(RC[-101])+RC[-1]+R[-1]C+R[-1]C[-1] -> 7.68386396069583E+55 | EZ95: =FIB(RC[-101])+RC[-1]+R[-1]C+R[-1]C[-1] -> 2.84125676864275E+56 | FA95: =FIB(RC[-101])+RC[-1]+R[-1]C+R[-1]C[-1] -> 1.03439068045948E+57 | FB95: =FIB(RC[-101])+RC[-1]+R[-1]C+R[-1]C[-1] -> 3.70896274581123E+57 | FC95: =FIB(RC[-101])+RC[-1]+R[-1]C+R[-1]C[-1] -> 1.31026590990433E+58 | FD95: =FIB(RC[-101])+RC[-1]+R[-1]C+R[-1]C[-1] -> 4.56190238809533E+58 | FE95: =FIB(RC[-101])+RC[-1]+R[-1]C+R[-1]C[-1] -> 1.56584206672395E+59 | FF95: =FIB(RC[-101])+RC[-1]+R[-1]C+R[-1]C[-1] -> 5.30025516294097E+59 | FG95: =FIB(RC[-101])+RC[-1]+R[-1]C+R[-1]C[-1] -> 1.76978159978388E+60 | FH95: =FIB(RC[-101])+RC[-1]+R[-1]C+R[-1]C[-1] -> 5.8309572122125E+60 | FI95: =FIB(RC[-101])+RC[-1]+R[-1]C+R[-1]C[-1] -> 1.89616742796023E+61 | FJ95: =FIB(RC[-101])+RC[-1]+R[-1]C+R[-1]C[-1] -> 6.08759646219451E+61 | FK95: =FIB(RC[-101])+RC[-1]+R[-1]C+R[-1]C[-1] -> 1.930010021473E+62 | FL95: =FIB(RC[-101])+RC[-1]+R[-1]C+R[-1]C[-1] -> 6.04403030908776E+62 | FM95: =FIB(RC[-101])+RC[-1]+R[-1]C+R[-1]C[-1] -> 1.87004764684747E+63 | FN95: =FIB(RC[-101])+RC[-1]+R[-1]C+R[-1]C[-1] -> 5.7179479906662E+63 | FO95: =FIB(RC[-101])+RC[-1]+R[-1]C+R[-1]C[-1] -> 1.72817922552627E+64 | FP95: =FIB(RC[-101])+RC[-1]+R[-1]C+R[-1]C[-1] -> 5.16410576843842E+64 | FQ95: =FIB(RC[-101])+RC[-1]+R[-1]C+R[-1]C[-1] -> 1.52599543784337E+65 | FR95: =FIB(RC[-101])+RC[-1]+R[-1]C+R[-1]C[-1] -> 4.4602013600706E+65 | FS95: =FIB(RC[-101])+RC[-1]+R[-1]C+R[-1]C[-1] -> 1.28969692434582E+66 | FT95: =FIB(RC[-101])+RC[-1]+R[-1]C+R[-1]C[-1] -> 3.69010945021177E+66 | FU95: =FIB(RC[-101])+RC[-1]+R[-1]C+R[-1]C[-1] -> 1.0449446781789E+67 | FV95: =FIB(RC[-101])+RC[-1]+R[-1]C+R[-1]C[-1] -> 2.92908280516131E+67 | FW95: =FIB(RC[-101])+RC[-1]+R[-1]C+R[-1]C[-1] -> 8.12894090250337E+67 | FX95: =FIB(RC[-101])+RC[-1]+R[-1]C+R[-1]C[-1] -> 2.23397251819711E+68 | FY95: =FIB(RC[-101])+RC[-1]+R[-1]C+R[-1]C[-1] -> 6.08049298836289E+68 | FZ95: =FIB(RC[-101])+RC[-1]+R[-1]C+R[-1]C[-1] -> 1.63942095834118E+69 | GA95: =FIB(RC[-101])+RC[-1]+R[-1]C+R[-1]C[-1] -> 4.37929944307588E+69 | GB95: =FIB(RC[-101])+RC[-1]+R[-1]C+R[-1]C[-1] -> 1.15918085942809E+70 | GC95: =FIB(RC[-101])+RC[-1]+R[-1]C+R[-1]C[-1] -> 3.04087342630285E+70 | GD95: =FIB(RC[-101])+RC[-1]+R[-1]C+R[-1]C[-1] -> 7.90701493839057E+70 | GE95: =FIB(RC[-101])+RC[-1]+R[-1]C+R[-1]C[-1] -> 2.03825588905995E+71 | GF95: =FIB(RC[-101])+RC[-1]+R[-1]C+R[-1]C[-1] -> 5.20954817818954E+71 | GG95: =FIB(RC[-101])+RC[-1]+R[-1]C+R[-1]C[-1] -> 1.3203782591205E+72 | GH95: =FIB(RC[-101])+RC[-1]+R[-1]C+R[-1]C[-1] -> 3.31905072968362E+72 | GI95: =FIB(RC[-101])+RC[-1]+R[-1]C+R[-1]C[-1] -> 8.27571392191033E+72 | GJ95: =FIB(RC[-101])+RC[-1]+R[-1]C+R[-1]C[-1] -> 2.04705988671712E+73 | GK95: =FIB(RC[-101])+RC[-1]+R[-1]C+R[-1]C[-1] -> 5.02394907911869E+73 | GL95: =FIB(RC[-101])+RC[-1]+R[-1]C+R[-1]C[-1] -> 1.22350095218431E+74 | GM95: =FIB(RC[-101])+RC[-1]+R[-1]C+R[-1]C[-1] -> 2.957068153177E+74 | GN95: =FIB(RC[-101])+RC[-1]+R[-1]C+R[-1]C[-1] -> 7.09363126795556E+74 | GO95: =FIB(RC[-101])+RC[-1]+R[-1]C+R[-1]C[-1] -> 1.68918519187022E+75 | GP95: =FIB(RC[-101])+RC[-1]+R[-1]C+R[-1]C[-1] -> 3.99334908696748E+75 | GQ95: =FIB(RC[-101])+RC[-1]+R[-1]C+R[-1]C[-1] -> 9.373407561717E+75 | GR95: =FIB(RC[-101])+RC[-1]+R[-1]C+R[-1]C[-1] -> 2.18476993907811E+76 | GS95: =FIB(RC[-101])+RC[-1]+R[-1]C+R[-1]C[-1] -> 5.05718253346761E+76
A96: 20 | B96: 20 | C96: 20 | D96: 20 | E96: 20 | F96: 20 | G96: 20 | H96: 20 | I96: 20 | J96: 20 | K96: 20 | L96: 20 | M96: 20 | N96: 20 | O96: 20 | P96: 20 | Q96: 20 | R96: 20 | S96: 20 | T96: 20 | U96: 20 | V96: 20 | W96: 20 | X96: 20 | Y96: 20 | Z96: 20 | AA96: 20 | AB96: 20 | AC96: 20 | AD96: 20 | AE96: 20 | AF96: 20 | AG96: 20 | AH96: 20 | AI96: 20 | AJ96: 20 | AK96: 20 | AL96: 20 | AM96: 20 | AN96: 20 | AO96: 20 | AP96: 20 | AQ96: 20 | AR96: 20 | AS96: 20 | AT96: 20 | AU96: 20 | AV96: 20 | AW96: 20 | AX96: 20 | AY96: 20 | AZ96: 20 | BA96: 20 | BB96: 20 | BC96: 20 | BD96: 20 | BE96: 20 | BF96: 20 | BG96: 20 | BH96: 20 | BI96: 20 | BJ96: 20 | BK96: 20 | BL96: 20 | BM96: 20 | BN96: 20 | BO96: 20 | BP96: 20 | BQ96: 20 | BR96: 20 | BS96: 20 | BT96: 20 | BU96: 20 | BV96: 20 | BW96: 20 | BX96: 20 | BY96: 20 | BZ96: 20 | CA96: 20 | CB96: 20 | CC96: 20 | CD96: 20 | CE96: 20 | CF96: 20 | CG96: 20 | CH96: 20 | CI96: 20 | CJ96: 20 | CK96: 20 | CL96: 20 | CM96: 20 | CN96: 20 | CO96: 20 | CP96: 20 | CQ96: 20 | CR96: 20 | CS96: 20 | CT96: 20 | CU96: 20 | CV96: 20 | CW96: 0 | CX96: =FIB(RC[-101])+RC[-1]+R[-1]C+R[-1]C[-1] -> 1039870 | CY96: =FIB(RC[-101])+RC[-1]+R[-1]C+R[-1]C[-1] -> 99827520 | CZ96: =FIB(RC[-101])+RC[-1]+R[-1]C+R[-1]C[-1] -> 6356725310 | DA96: =FIB(RC[-101])+RC[-1]+R[-1]C+R[-1]C[-1] -> 303608764160 | DB96: =FIB(RC[-101])+RC[-1]+R[-1]C+R[-1]C[-1] -> 11602940379134 | DC96: =FIB(RC[-101])+RC[-1]+R[-1]C+R[-1]C[-1] -> 369613276212544 | DD96: =FIB(RC[-101])+RC[-1]+R[-1]C+R[-1]C[-1] -> 1.00951076285587E+16 | DE96: =FIB(RC[-101])+RC[-1]+R[-1]C+R[-1]C[-1] -> 2.41344106248654E+17 | DF96: =FIB(RC[-101])+RC[-1]+R[-1]C+R[-1]C[-1] -> 5.13083168383582E+18 | DG96: =FIB(RC[-101])+RC[-1]+R[-1]C+R[-1]C[-1] -> 9.82160948568881E+19 | DH96: =FIB(RC[-101])+RC[-1]+R[-1]C+R[-1]C[-1] -> 1.71005294859127E+21 | DI96: =FIB(RC[-101])+RC[-1]+R[-1]C+R[-1]C[-1] -> 2.73083741853632E+22 | DJ96: =FIB(RC[-101])+RC[-1]+R[-1]C+R[-1]C[-1] -> 4.02801546522113E+23 | DK96: =FIB(RC[-101])+RC[-1]+R[-1]C+R[-1]C[-1] -> 5.52072173215238E+24 | DL96: =FIB(RC[-101])+RC[-1]+R[-1]C+R[-1]C[-1] -> 7.06731381661609E+25 | DM96: =FIB(RC[-101])+RC[-1]+R[-1]C+R[-1]C[-1] -> 8.48836263482439E+26 | DN96: =FIB(RC[-101])+RC[-1]+R[-1]C+R[-1]C[-1] -> 9.60344097269438E+27 | DO96: =FIB(RC[-101])+RC[-1]+R[-1]C+R[-1]C[-1] -> 1.02704857903546E+29 | DP96: =FIB(RC[-101])+RC[-1]+R[-1]C+R[-1]C[-1] -> 1.04155209458346E+30 | DQ96: =FIB(RC[-101])+RC[-1]+R[-1]C+R[-1]C[-1] -> 1.00443921182804E+31 | DR96: =FIB(RC[-101])+RC[-1]+R[-1]C+R[-1]C[-1] -> 9.23480922134872E+31 | DS96: =FIB(RC[-101])+RC[-1]+R[-1]C+R[-1]C[-1] -> 8.11337174875452E+32 | DT96: =FIB(RC[-101])+RC[-1]+R[-1]C+R[-1]C[-1] -> 6.82595906216991E+33 | DU96: =FIB(RC[-101])+RC[-1]+R[-1]C+R[-1]C[-1] -> 5.51007889956912E+34 | DV96: =FIB(RC[-101])+RC[-1]+R[-1]C+R[-1]C[-1] -> 4.27522948626764E+35 | DW96: =FIB(RC[-101])+RC[-1]+R[-1]C+R[-1]C[-1] -> 3.19363088125401E+36 | DX96: =FIB(RC[-101])+RC[-1]+R[-1]C+R[-1]C[-1] -> 2.30036701845856E+37 | DY96: =FIB(RC[-101])+RC[-1]+R[-1]C+R[-1]C[-1] -> 1.59997465680347E+38 | DZ96: =FIB(RC[-101])+RC[-1]+R[-1]C+R[-1]C[-1] -> 1.07598685207292E+39 | EA96: =FIB(RC[-101])+RC[-1]+R[-1]C+R[-1]C[-1] -> 7.00511384168858E+39 | EB96: =FIB(RC[-101])+RC[-1]+R[-1]C+R[-1]C[-1] -> 4.42018177201518E+40 | EC96: =FIB(RC[-101])+RC[-1]+R[-1]C+R[-1]C[-1] -> 2.70615803551292E+41 | ED96: =FIB(RC[-101])+RC[-1]+R[-1]C+R[-1]C[-1] -> 1.60915383773763E+42 | EE96: =FIB(RC[-101])+RC[-1]+R[-1]C+R[-1]C[-1] -> 9.30231483897292E+42 | EF96: =FIB(RC[-101])+RC[-1]+R[-1]C+R[-1]C[-1] -> 5.23272389921973E+43 | EG96: =FIB(RC[-101])+RC[-1]+R[-1]C+R[-1]C[-1] -> 2.86668990746493E+44 | EH96: =FIB(RC[-101])+RC[-1]+R[-1]C+R[-1]C[-1] -> 1.53074480638647E+45 | EI96: =FIB(RC[-101])+RC[-1]+R[-1]C+R[-1]C[-1] -> 7.97313185993251E+45 | EJ96: =FIB(RC[-101])+RC[-1]+R[-1]C+R[-1]C[-1] -> 4.05393971253793E+46 | EK96: =FIB(RC[-101])+RC[-1]+R[-1]C+R[-1]C[-1] -> 2.01349424837121E+47 | EL96: =FIB(RC[-101])+RC[-1]+R[-1]C+R[-1]C[-1] -> 9.77544293387931E+47 | EM96: =FIB(RC[-101])+RC[-1]+R[-1]C+R[-1]C[-1] -> 4.64205443941469E+48 | EN96: =FIB(RC[-101])+RC[-1]+R[-1]C+R[-1]C[-1] -> 2.15741687965232E+49 | EO96: =FIB(RC[-101])+RC[-1]+R[-1]C+R[-1]C[-1] -> 9.81880586597901E+49 | EP96: =FIB(RC[-101])+RC[-1]+R[-1]C+R[-1]C[-1] -> 4.37848502912599E+50 | EQ96: =FIB(RC[-101])+RC[-1]+R[-1]C+R[-1]C[-1] -> 1.91407666730428E+51 | ER96: =FIB(RC[-101])+RC[-1]+R[-1]C+R[-1]C[-1] -> 8.20701435295951E+51 | ES96: =FIB(RC[-101])+RC[-1]+R[-1]C+R[-1]C[-1] -> 3.45312780162202E+52 | ET96: =FIB(RC[-101])+RC[-1]+R[-1]C+R[-1]C[-1] -> 1.42641036531431E+53 | EU96: =FIB(RC[-101])+RC[-1]+R[-1]C+R[-1]C[-1] -> 5.78729412005961E+53 | EV96: =FIB(RC[-101])+RC[-1]+R[-1]C+R[-1]C[-1] -> 2.30724253960216E+54 | EW96: =FIB(RC[-101])+RC[-1]+R[-1]C+R[-1]C[-1] -> 9.0422793283907E+54 | EX96: =FIB(RC[-101])+RC[-1]+R[-1]C+R[-1]C[-1] -> 3.48500370524894E+55 | EY96: =FIB(RC[-101])+RC[-1]+R[-1]C+R[-1]C[-1] -> 1.32140701507966E+56 | EZ96: =FIB(RC[-101])+RC[-1]+R[-1]C+R[-1]C[-1] -> 4.93105017979199E+56 | FA96: =FIB(RC[-101])+RC[-1]+R[-1]C+R[-1]C[-1] -> 1.81162137530295E+57 | FB96: =FIB(RC[-101])+RC[-1]+R[-1]C+R[-1]C[-1] -> 6.55497480157366E+57 | FC96: =FIB(RC[-101])+RC[-1]+R[-1]C+R[-1]C[-1] -> 2.33665966464282E+58 | FD96: =FIB(RC[-101])+RC[-1]+R[-1]C+R[-1]C[-1] -> 8.20882796264248E+58 | FE96: =FIB(RC[-101])+RC[-1]+R[-1]C+R[-1]C[-1] -> 2.84291510179773E+59 | FF96: =FIB(RC[-101])+RC[-1]+R[-1]C+R[-1]C[-1] -> 9.70901233146266E+59 | FG96: =FIB(RC[-101])+RC[-1]+R[-1]C+R[-1]C[-1] -> 3.27070834922424E+60 | FH96: =FIB(RC[-101])+RC[-1]+R[-1]C+R[-1]C[-1] -> 1.08714471612206E+61 | FI96: =FIB(RC[-101])+RC[-1]+R[-1]C+R[-1]C[-1] -> 3.56640786530354E+61 | FJ96: =FIB(RC[-101])+RC[-1]+R[-1]C+R[-1]C[-1] -> 1.15501717554583E+62 | FK96: =FIB(RC[-101])+RC[-1]+R[-1]C+R[-1]C[-1] -> 3.69378684323827E+62 | FL96: =FIB(RC[-101])+RC[-1]+R[-1]C+R[-1]C[-1] -> 1.1667827173799E+63 | FM96: =FIB(RC[-101])+RC[-1]+R[-1]C+R[-1]C[-1] -> 3.64123339513615E+63 | FN96: =FIB(RC[-101])+RC[-1]+R[-1]C+R[-1]C[-1] -> 1.12292290326498E+64 | FO96: =FIB(RC[-101])+RC[-1]+R[-1]C+R[-1]C[-1] -> 3.42289692785787E+64 | FP96: =FIB(RC[-101])+RC[-1]+R[-1]C+R[-1]C[-1] -> 1.03151819218226E+65 | FQ96: =FIB(RC[-101])+RC[-1]+R[-1]C+R[-1]C[-1] -> 3.07392420686947E+65 | FR96: =FIB(RC[-101])+RC[-1]+R[-1]C+R[-1]C[-1] -> 9.06012100478344E+65 | FS96: =FIB(RC[-101])+RC[-1]+R[-1]C+R[-1]C[-1] -> 2.64172916083123E+66 | FT96: =FIB(RC[-101])+RC[-1]+R[-1]C+R[-1]C[-1] -> 7.62153553538882E+66 | FU96: =FIB(RC[-101])+RC[-1]+R[-1]C+R[-1]C[-1] -> 2.17610917673896E+67 | FV96: =FIB(RC[-101])+RC[-1]+R[-1]C+R[-1]C[-1] -> 6.15013666007917E+67 | FW96: =FIB(RC[-101])+RC[-1]+R[-1]C+R[-1]C[-1] -> 1.72081603677438E+68 | FX96: =FIB(RC[-101])+RC[-1]+R[-1]C+R[-1]C[-1] -> 4.76768264522183E+68 | FY96: =FIB(RC[-101])+RC[-1]+R[-1]C+R[-1]C[-1] -> 1.30821481517818E+69 | FZ96: =FIB(RC[-101])+RC[-1]+R[-1]C+R[-1]C[-1] -> 3.55568507235565E+69 | GA96: =FIB(RC[-101])+RC[-1]+R[-1]C+R[-1]C[-1] -> 9.57440547377271E+69 | GB96: =FIB(RC[-101])+RC[-1]+R[-1]C+R[-1]C[-1] -> 2.55455135111295E+70 | GC96: =FIB(RC[-101])+RC[-1]+R[-1]C+R[-1]C[-1] -> 6.7546056368439E+70 | GD96: =FIB(RC[-101])+RC[-1]+R[-1]C+R[-1]C[-1] -> 1.77024940015373E+71 | GE96: =FIB(RC[-101])+RC[-1]+R[-1]C+R[-1]C[-1] -> 4.59920678305274E+71 | GF96: =FIB(RC[-101])+RC[-1]+R[-1]C+R[-1]C[-1] -> 1.18470108503022E+72 | GG96: =FIB(RC[-101])+RC[-1]+R[-1]C+R[-1]C[-1] -> 3.02603416196968E+72 | GH96: =FIB(RC[-101])+RC[-1]+R[-1]C+R[-1]C[-1] -> 7.6654631507738E+72 | GI96: =FIB(RC[-101])+RC[-1]+R[-1]C+R[-1]C[-1] -> 1.92602278023678E+73 | GJ96: =FIB(RC[-101])+RC[-1]+R[-1]C+R[-1]C[-1] -> 4.80065405914493E+73 | GK96: =FIB(RC[-101])+RC[-1]+R[-1]C+R[-1]C[-1] -> 1.18716630249807E+74 | GL96: =FIB(RC[-101])+RC[-1]+R[-1]C+R[-1]C[-1] -> 2.91306216259425E+74 | GM96: =FIB(RC[-101])+RC[-1]+R[-1]C+R[-1]C[-1] -> 7.09363126795556E+74 | GN96: =FIB(RC[-101])+RC[-1]+R[-1]C+R[-1]C[-1] -> 1.71443306890881E+75 | GO96: =FIB(RC[-101])+RC[-1]+R[-1]C+R[-1]C[-1] -> 4.11298138757459E+75 | GP96: =FIB(RC[-101])+RC[-1]+R[-1]C+R[-1]C[-1] -> 9.7955156664123E+75 | GQ96: =FIB(RC[-101])+RC[-1]+R[-1]C+R[-1]C[-1] -> 2.31622723150968E+76 | GR96: =FIB(RC[-101])+RC[-1]+R[-1]C+R[-1]C[-1] -> 5.43833792675949E+76 | GS96: =FIB(RC[-101])+RC[-1]+R[-1]C+R[-1]C[-1] -> 1.26802903993052E+77
A97: 20 | B97: 20 | C97: 20 | D97: 20 | E97: 20 | F97: 20 | G97: 20 | H97: 20 | I97: 20 | J97: 20 | K97: 20 | L97: 20 | M97: 20 | N97: 20 | O97: 20 | P97: 20 | Q97: 20 | R97: 20 | S97: 20 | T97: 20 | U97: 20 | V97: 20 | W97: 20 | X97: 20 | Y97: 20 | Z97: 20 | AA97: 20 | AB97: 20 | AC97: 20 | AD97: 20 | AE97: 20 | AF97: 20 | AG97: 20 | AH97: 20 | AI97: 20 | AJ97: 20 | AK97: 20 | AL97: 20 | AM97: 20 | AN97: 20 | AO97: 20 | AP97: 20 | AQ97: 20 | AR97: 20 | AS97: 20 | AT97: 20 | AU97: 20 | AV97: 20 | AW97: 20 | AX97: 20 | AY97: 20 | AZ97: 20 | BA97: 20 | BB97: 20 | BC97: 20 | BD97: 20 | BE97: 20 | BF97: 20 | BG97: 20 | BH97: 20 | BI97: 20 | BJ97: 20 | BK97: 20 | BL97: 20 | BM97: 20 | BN97: 20 | BO97: 20 | BP97: 20 | BQ97: 20 | BR97: 20 | BS97: 20 | BT97: 20 | BU97: 20 | BV97: 20 | BW97: 20 | BX97: 20 | BY97: 20 | BZ97: 20 | CA97: 20 | CB97: 20 | CC97: 20 | CD97: 20 | CE97: 20 | CF97: 20 | CG97: 20 | CH97: 20 | CI97: 20 | CJ97: 20 | CK97: 20 | CL97: 20 | CM97: 20 | CN97: 20 | CO97: 20 | CP97: 20 | CQ97: 20 | CR97: 20 | CS97: 20 | CT97: 20 | CU97: 20 | CV97: 20 | CW97: 0 | CX97: =FIB(RC[-101])+RC[-1]+R[-1]C+R[-1]C[-1] -> 1050816 | CY97: =FIB(RC[-101])+RC[-1]+R[-1]C+R[-1]C[-1] -> 101929152 | CZ97: =FIB(RC[-101])+RC[-1]+R[-1]C+R[-1]C[-1] -> 6558492928 | DA97: =FIB(RC[-101])+RC[-1]+R[-1]C+R[-1]C[-1] -> 316523993344 | DB97: =FIB(RC[-101])+RC[-1]+R[-1]C+R[-1]C[-1] -> 12223073147584 | DC97: =FIB(RC[-101])+RC[-1]+R[-1]C+R[-1]C[-1] -> 393439289750208 | DD97: =FIB(RC[-101])+RC[-1]+R[-1]C+R[-1]C[-1] -> 1.08581601945324E+16 | DE97: =FIB(RC[-101])+RC[-1]+R[-1]C+R[-1]C[-1] -> 2.62297374071756E+17 | DF97: =FIB(RC[-101])+RC[-1]+R[-1]C+R[-1]C[-1] -> 5.63447316415624E+18 | DG97: =FIB(RC[-101])+RC[-1]+R[-1]C+R[-1]C[-1] -> 1.0898139970488E+20 | DH97: =FIB(RC[-101])+RC[-1]+R[-1]C+R[-1]C[-1] -> 1.91725044315304E+21 | DI97: =FIB(RC[-101])+RC[-1]+R[-1]C+R[-1]C[-1] -> 3.09356775771075E+22 | DJ97: =FIB(RC[-101])+RC[-1]+R[-1]C+R[-1]C[-1] -> 4.61045598284584E+23 | DK97: =FIB(RC[-101])+RC[-1]+R[-1]C+R[-1]C[-1] -> 6.38456887695908E+24 | DL97: =FIB(RC[-101])+RC[-1]+R[-1]C+R[-1]C[-1] -> 8.25784287752724E+25 | DM97: =FIB(RC[-101])+RC[-1]+R[-1]C+R[-1]C[-1] -> 1.00208783042387E+27 | DN97: =FIB(RC[-101])+RC[-1]+R[-1]C+R[-1]C[-1] -> 1.14543650666007E+28 | DO97: =FIB(RC[-101])+RC[-1]+R[-1]C+R[-1]C[-1] -> 1.23762663942841E+29 | DP97: =FIB(RC[-101])+RC[-1]+R[-1]C+R[-1]C[-1] -> 1.26801961642985E+30 | DQ97: =FIB(RC[-101])+RC[-1]+R[-1]C+R[-1]C[-1] -> 1.23539638292937E+31 | DR97: =FIB(RC[-101])+RC[-1]+R[-1]C+R[-1]C[-1] -> 1.14746448161061E+32 | DS97: =FIB(RC[-101])+RC[-1]+R[-1]C+R[-1]C[-1] -> 1.01843171525E+33 | DT97: =FIB(RC[-101])+RC[-1]+R[-1]C+R[-1]C[-1] -> 8.65572795229537E+33 | DU97: =FIB(RC[-101])+RC[-1]+R[-1]C+R[-1]C[-1] -> 7.05824760101565E+34 | DV97: =FIB(RC[-101])+RC[-1]+R[-1]C+R[-1]C[-1] -> 5.53206213632612E+35 | DW97: =FIB(RC[-101])+RC[-1]+R[-1]C+R[-1]C[-1] -> 4.17436004351338E+36 | DX97: =FIB(RC[-101])+RC[-1]+R[-1]C+R[-1]C[-1] -> 3.0371661109353E+37 | DY97: =FIB(RC[-101])+RC[-1]+R[-1]C+R[-1]C[-1] -> 2.13372796974285E+38 | DZ97: =FIB(RC[-101])+RC[-1]+R[-1]C+R[-1]C[-1] -> 1.44935711472755E+39 | EA97: =FIB(RC[-101])+RC[-1]+R[-1]C+R[-1]C[-1] -> 9.53045780848905E+39 | EB97: =FIB(RC[-101])+RC[-1]+R[-1]C+R[-1]C[-1] -> 6.07373893703295E+40 | EC97: =FIB(RC[-101])+RC[-1]+R[-1]C+R[-1]C[-1] -> 3.75555010641773E+41 | ED97: =FIB(RC[-101])+RC[-1]+R[-1]C+R[-1]C[-1] -> 2.25532465193069E+42 | EE97: =FIB(RC[-101])+RC[-1]+R[-1]C+R[-1]C[-1] -> 1.31667933286412E+43 | EF97: =FIB(RC[-101])+RC[-1]+R[-1]C+R[-1]C[-1] -> 7.47963471598115E+43 | EG97: =FIB(RC[-101])+RC[-1]+R[-1]C+R[-1]C[-1] -> 4.13792576898502E+44 | EH97: =FIB(RC[-101])+RC[-1]+R[-1]C+R[-1]C[-1] -> 2.23120637403146E+45 | EI97: =FIB(RC[-101])+RC[-1]+R[-1]C+R[-1]C[-1] -> 1.17350830403504E+46 | EJ97: =FIB(RC[-101])+RC[-1]+R[-1]C+R[-1]C[-1] -> 6.02476120256623E+46 | EK97: =FIB(RC[-101])+RC[-1]+R[-1]C+R[-1]C[-1] -> 3.02136433988162E+47 | EL97: =FIB(RC[-101])+RC[-1]+R[-1]C+R[-1]C[-1] -> 1.48103015221321E+48 | EM97: =FIB(RC[-101])+RC[-1]+R[-1]C+R[-1]C[-1] -> 7.10062888501583E+48 | EN97: =FIB(RC[-101])+RC[-1]+R[-1]C+R[-1]C[-1] -> 3.33168521209537E+49 | EO97: =FIB(RC[-101])+RC[-1]+R[-1]C+R[-1]C[-1] -> 1.53079079577267E+50 | EP97: =FIB(RC[-101])+RC[-1]+R[-1]C+R[-1]C[-1] -> 6.89115641149656E+50 | EQ97: =FIB(RC[-101])+RC[-1]+R[-1]C+R[-1]C[-1] -> 3.04104081136653E+51 | ER97: =FIB(RC[-101])+RC[-1]+R[-1]C+R[-1]C[-1] -> 1.31621318316303E+52 | ES97: =FIB(RC[-101])+RC[-1]+R[-1]C+R[-1]C[-1] -> 5.590042420081E+52 | ET97: =FIB(RC[-101])+RC[-1]+R[-1]C+R[-1]C[-1] -> 2.33072738748461E+53 | EU97: =FIB(RC[-101])+RC[-1]+R[-1]C+R[-1]C[-1] -> 9.54443187285853E+53 | EV97: =FIB(RC[-101])+RC[-1]+R[-1]C+R[-1]C[-1] -> 3.84041513889397E+54 | EW97: =FIB(RC[-101])+RC[-1]+R[-1]C+R[-1]C[-1] -> 1.51899370068868E+55 | EX97: =FIB(RC[-101])+RC[-1]+R[-1]C+R[-1]C[-1] -> 5.90822533877669E+55 | EY97: =FIB(RC[-101])+RC[-1]+R[-1]C+R[-1]C[-1] -> 2.26072991948222E+56 | EZ97: =FIB(RC[-101])+RC[-1]+R[-1]C+R[-1]C[-1] -> 8.51318711435388E+56 | FA97: =FIB(RC[-101])+RC[-1]+R[-1]C+R[-1]C[-1] -> 3.15604510471754E+57 | FB97: =FIB(RC[-101])+RC[-1]+R[-1]C+R[-1]C[-1] -> 1.15226412815942E+58 | FC97: =FIB(RC[-101])+RC[-1]+R[-1]C+R[-1]C[-1] -> 4.1444212729596E+58 | FD97: =FIB(RC[-101])+RC[-1]+R[-1]C+R[-1]C[-1] -> 1.46899089002449E+59 | FE97: =FIB(RC[-101])+RC[-1]+R[-1]C+R[-1]C[-1] -> 5.13278878808647E+59 | FF97: =FIB(RC[-101])+RC[-1]+R[-1]C+R[-1]C[-1] -> 1.76847162213469E+60 | FG97: =FIB(RC[-101])+RC[-1]+R[-1]C+R[-1]C[-1] -> 6.0100812045052E+60 | FH97: =FIB(RC[-101])+RC[-1]+R[-1]C+R[-1]C[-1] -> 2.01522367149501E+61 | FI97: =FIB(RC[-101])+RC[-1]+R[-1]C+R[-1]C[-1] -> 6.66877625292061E+61 | FJ97: =FIB(RC[-101])+RC[-1]+R[-1]C+R[-1]C[-1] -> 2.17853558736824E+62 | FK97: =FIB(RC[-101])+RC[-1]+R[-1]C+R[-1]C[-1] -> 7.02733960615234E+62 | FL97: =FIB(RC[-101])+RC[-1]+R[-1]C+R[-1]C[-1] -> 2.23889536231896E+63 | FM97: =FIB(RC[-101])+RC[-1]+R[-1]C+R[-1]C[-1] -> 7.04691147483501E+63 | FN97: =FIB(RC[-101])+RC[-1]+R[-1]C+R[-1]C[-1] -> 2.1917373902621E+64 | FO97: =FIB(RC[-101])+RC[-1]+R[-1]C+R[-1]C[-1] -> 6.73755722138495E+64 | FP97: =FIB(RC[-101])+RC[-1]+R[-1]C+R[-1]C[-1] -> 2.04756360710654E+65 | FQ97: =FIB(RC[-101])+RC[-1]+R[-1]C+R[-1]C[-1] -> 6.15300600615826E+65 | FR97: =FIB(RC[-101])+RC[-1]+R[-1]C+R[-1]C[-1] -> 1.82870512178112E+66 | FS97: =FIB(RC[-101])+RC[-1]+R[-1]C+R[-1]C[-1] -> 5.37644638309068E+66 | FT97: =FIB(RC[-101])+RC[-1]+R[-1]C+R[-1]C[-1] -> 1.56397110793107E+67 | FU97: =FIB(RC[-101])+RC[-1]+R[-1]C+R[-1]C[-1] -> 4.50223383820891E+67 | FV97: =FIB(RC[-101])+RC[-1]+R[-1]C+R[-1]C[-1] -> 1.2828479675027E+68 | FW97: =FIB(RC[-101])+RC[-1]+R[-1]C+R[-1]C[-1] -> 3.618677670285E+68 | FX97: =FIB(RC[-101])+RC[-1]+R[-1]C+R[-1]C[-1] -> 1.01071763522812E+69 | FY97: =FIB(RC[-101])+RC[-1]+R[-1]C+R[-1]C[-1] -> 2.79570071492849E+69 | FZ97: =FIB(RC[-101])+RC[-1]+R[-1]C+R[-1]C[-1] -> 7.65960060246232E+69 | GA97: =FIB(RC[-101])+RC[-1]+R[-1]C+R[-1]C[-1] -> 2.07896911485907E+70 | GB97: =FIB(RC[-101])+RC[-1]+R[-1]C+R[-1]C[-1] -> 5.59096101334929E+70 | GC97: =FIB(RC[-101])+RC[-1]+R[-1]C+R[-1]C[-1] -> 1.49001180013061E+71 | GD97: =FIB(RC[-101])+RC[-1]+R[-1]C+R[-1]C[-1] -> 3.93572176396874E+71 | GE97: =FIB(RC[-101])+RC[-1]+R[-1]C+R[-1]C[-1] -> 1.03051779471752E+72 | GF97: =FIB(RC[-101])+RC[-1]+R[-1]C+R[-1]C[-1] -> 2.67513955805302E+72 | GG97: =FIB(RC[-101])+RC[-1]+R[-1]C+R[-1]C[-1] -> 6.88587480505292E+72 | GH97: =FIB(RC[-101])+RC[-1]+R[-1]C+R[-1]C[-1] -> 1.75773721177964E+73 | GI97: =FIB(RC[-101])+RC[-1]+R[-1]C+R[-1]C[-1] -> 4.4503063070938E+73 | GJ97: =FIB(RC[-101])+RC[-1]+R[-1]C+R[-1]C[-1] -> 1.11769831464755E+74 | GK97: =FIB(RC[-101])+RC[-1]+R[-1]C+R[-1]C[-1] -> 2.78493002306012E+74 | GL97: =FIB(RC[-101])+RC[-1]+R[-1]C+R[-1]C[-1] -> 6.88515848815244E+74 | GM97: =FIB(RC[-101])+RC[-1]+R[-1]C+R[-1]C[-1] -> 1.68918519187022E+75 | GN97: =FIB(RC[-101])+RC[-1]+R[-1]C+R[-1]C[-1] -> 4.11298138757459E+75 | GO97: =FIB(RC[-101])+RC[-1]+R[-1]C+R[-1]C[-1] -> 9.940395844058E+75 | GP97: =FIB(RC[-101])+RC[-1]+R[-1]C+R[-1]C[-1] -> 2.38488928980449E+76 | GQ97: =FIB(RC[-101])+RC[-1]+R[-1]C+R[-1]C[-1] -> 5.6806680879554E+76 | GR97: =FIB(RC[-101])+RC[-1]+R[-1]C+R[-1]C[-1] -> 1.34352332462246E+77 | GS97: =FIB(RC[-101])+RC[-1]+R[-1]C+R[-1]C[-1] -> 3.15538615722892E+77
A98: 20 | B98: 20 | C98: 20 | D98: 20 | E98: 20 | F98: 20 | G98: 20 | H98: 20 | I98: 20 | J98: 20 | K98: 20 | L98: 20 | M98: 20 | N98: 20 | O98: 20 | P98: 20 | Q98: 20 | R98: 20 | S98: 20 | T98: 20 | U98: 20 | V98: 20 | W98: 20 | X98: 20 | Y98: 20 | Z98: 20 | AA98: 20 | AB98: 20 | AC98: 20 | AD98: 20 | AE98: 20 | AF98: 20 | AG98: 20 | AH98: 20 | AI98: 20 | AJ98: 20 | AK98: 20 | AL98: 20 | AM98: 20 | AN98: 20 | AO98: 20 | AP98: 20 | AQ98: 20 | AR98: 20 | AS98: 20 | AT98: 20 | AU98: 20 | AV98: 20 | AW98: 20 | AX98: 20 | AY98: 20 | AZ98: 20 | BA98: 20 | BB98: 20 | BC98: 20 | BD98: 20 | BE98: 20 | BF98: 20 | BG98: 20 | BH98: 20 | BI98: 20 | BJ98: 20 | BK98: 20 | BL98: 20 | BM98: 20 | BN98: 20 | BO98: 20 | BP98: 20 | BQ98: 20 | BR98: 20 | BS98: 20 | BT98: 20 | BU98: 20 | BV98: 20 | BW98: 20 | BX98: 20 | BY98: 20 | BZ98: 20 | CA98: 20 | CB98: 20 | CC98: 20 | CD98: 20 | CE98: 20 | CF98: 20 | CG98: 20 | CH98: 20 | CI98: 20 | CJ98: 20 | CK98: 20 | CL98: 20 | CM98: 20 | CN98: 20 | CO98: 20 | CP98: 20 | CQ98: 20 | CR98: 20 | CS98: 20 | CT98: 20 | CU98: 20 | CV98: 20 | CW98: 0 | CX98: =FIB(RC[-101])+RC[-1]+R[-1]C+R[-1]C[-1] -> 1061762 | CY98: =FIB(RC[-101])+RC[-1]+R[-1]C+R[-1]C[-1] -> 104052676 | CZ98: =FIB(RC[-101])+RC[-1]+R[-1]C+R[-1]C[-1] -> 6764485702 | DA98: =FIB(RC[-101])+RC[-1]+R[-1]C+R[-1]C[-1] -> 329846982920 | DB98: =FIB(RC[-101])+RC[-1]+R[-1]C+R[-1]C[-1] -> 12869444134794 | DC98: =FIB(RC[-101])+RC[-1]+R[-1]C+R[-1]C[-1] -> 418531807043532 | DD98: =FIB(RC[-101])+RC[-1]+R[-1]C+R[-1]C[-1] -> 1.1670131291337E+16 | DE98: =FIB(RC[-101])+RC[-1]+R[-1]C+R[-1]C[-1] -> 2.84825665557636E+17 | DF98: =FIB(RC[-101])+RC[-1]+R[-1]C+R[-1]C[-1] -> 6.18159620378565E+18 | DG98: =FIB(RC[-101])+RC[-1]+R[-1]C+R[-1]C[-1] -> 1.20797469072822E+20 | DH98: =FIB(RC[-101])+RC[-1]+R[-1]C+R[-1]C[-1] -> 2.14702931193074E+21 | DI98: =FIB(RC[-101])+RC[-1]+R[-1]C+R[-1]C[-1] -> 3.49999573321913E+22 | DJ98: =FIB(RC[-101])+RC[-1]+R[-1]C+R[-1]C[-1] -> 5.26981233193883E+23 | DK98: =FIB(RC[-101])+RC[-1]+R[-1]C+R[-1]C[-1] -> 7.37259570843754E+24 | DL98: =FIB(RC[-101])+RC[-1]+R[-1]C+R[-1]C[-1] -> 9.6335593360669E+25 | DM98: =FIB(RC[-101])+RC[-1]+R[-1]C+R[-1]C[-1] -> 1.18100185255981E+27 | DN98: =FIB(RC[-101])+RC[-1]+R[-1]C+R[-1]C[-1] -> 1.36374547495844E+28 | DO98: =FIB(RC[-101])+RC[-1]+R[-1]C+R[-1]C[-1] -> 1.48854483759026E+29 | DP98: =FIB(RC[-101])+RC[-1]+R[-1]C+R[-1]C[-1] -> 1.54063676413172E+30 | DQ98: =FIB(RC[-101])+RC[-1]+R[-1]C+R[-1]C[-1] -> 1.51626202098553E+31 | DR98: =FIB(RC[-101])+RC[-1]+R[-1]C+R[-1]C[-1] -> 1.4226303220021E+32 | DS98: =FIB(RC[-101])+RC[-1]+R[-1]C+R[-1]C[-1] -> 1.27544119561127E+33 | DT98: =FIB(RC[-101])+RC[-1]+R[-1]C+R[-1]C[-1] -> 1.09496008631566E+34 | DU98: =FIB(RC[-101])+RC[-1]+R[-1]C+R[-1]C[-1] -> 9.01878048256085E+34 | DV98: =FIB(RC[-101])+RC[-1]+R[-1]C+R[-1]C[-1] -> 7.13976494468377E+35 | DW98: =FIB(RC[-101])+RC[-1]+R[-1]C+R[-1]C[-1] -> 5.44154275161437E+36 | DX98: =FIB(RC[-101])+RC[-1]+R[-1]C+R[-1]C[-1] -> 3.99875639044808E+37 | DY98: =FIB(RC[-101])+RC[-1]+R[-1]C+R[-1]C[-1] -> 2.83732021988119E+38 | DZ98: =FIB(RC[-101])+RC[-1]+R[-1]C+R[-1]C[-1] -> 1.94646193368996E+39 | EA98: =FIB(RC[-101])+RC[-1]+R[-1]C+R[-1]C[-1] -> 1.29262768569066E+40 | EB98: =FIB(RC[-101])+RC[-1]+R[-1]C+R[-1]C[-1] -> 8.31941240357251E+40 | EC98: =FIB(RC[-101])+RC[-1]+R[-1]C+R[-1]C[-1] -> 5.19486524047828E+41 | ED98: =FIB(RC[-101])+RC[-1]+R[-1]C+R[-1]C[-1] -> 3.15036618662029E+42 | EE98: =FIB(RC[-101])+RC[-1]+R[-1]C+R[-1]C[-1] -> 1.85724841671922E+43 | EF98: =FIB(RC[-101])+RC[-1]+R[-1]C+R[-1]C[-1] -> 1.06535624655645E+44 | EG98: =FIB(RC[-101])+RC[-1]+R[-1]C+R[-1]C[-1] -> 5.95124548713958E+44 | EH98: =FIB(RC[-101])+RC[-1]+R[-1]C+R[-1]C[-1] -> 3.24012349964392E+45 | EI98: =FIB(RC[-101])+RC[-1]+R[-1]C+R[-1]C[-1] -> 1.72064129140258E+46 | EJ98: =FIB(RC[-101])+RC[-1]+R[-1]C+R[-1]C[-1] -> 8.91891079800385E+46 | EK98: =FIB(RC[-101])+RC[-1]+R[-1]C+R[-1]C[-1] -> 4.51573153993863E+47 | EL98: =FIB(RC[-101])+RC[-1]+R[-1]C+R[-1]C[-1] -> 2.23473974019524E+48 | EM98: =FIB(RC[-101])+RC[-1]+R[-1]C+R[-1]C[-1] -> 1.08163987774243E+49 | EN98: =FIB(RC[-101])+RC[-1]+R[-1]C+R[-1]C[-1] -> 5.12338797833938E+49 | EO98: =FIB(RC[-101])+RC[-1]+R[-1]C+R[-1]C[-1] -> 2.37629811481615E+50 | EP98: =FIB(RC[-101])+RC[-1]+R[-1]C+R[-1]C[-1] -> 1.07982453220854E+51 | EQ98: =FIB(RC[-101])+RC[-1]+R[-1]C+R[-1]C[-1] -> 4.80998098472473E+51 | ER98: =FIB(RC[-101])+RC[-1]+R[-1]C+R[-1]C[-1] -> 2.10131536277216E+52 | ES98: =FIB(RC[-101])+RC[-1]+R[-1]C+R[-1]C[-1] -> 9.00757096601619E+52 | ET98: =FIB(RC[-101])+RC[-1]+R[-1]C+R[-1]C[-1] -> 3.79048872609433E+53 | EU98: =FIB(RC[-101])+RC[-1]+R[-1]C+R[-1]C[-1] -> 1.56656479864375E+54 | EV98: =FIB(RC[-101])+RC[-1]+R[-1]C+R[-1]C[-1] -> 6.36142312482357E+54 | EW98: =FIB(RC[-101])+RC[-1]+R[-1]C+R[-1]C[-1] -> 2.53917752706044E+55 | EX98: =FIB(RC[-101])+RC[-1]+R[-1]C+R[-1]C[-1] -> 9.96639656652581E+55 | EY98: =FIB(RC[-101])+RC[-1]+R[-1]C+R[-1]C[-1] -> 3.84819211001248E+56 | EZ98: =FIB(RC[-101])+RC[-1]+R[-1]C+R[-1]C[-1] -> 1.46221091438486E+57 | FA98: =FIB(RC[-101])+RC[-1]+R[-1]C+R[-1]C[-1] -> 5.46957473053778E+57 | FB98: =FIB(RC[-101])+RC[-1]+R[-1]C+R[-1]C[-1] -> 2.01482611168495E+58 | FC98: =FIB(RC[-101])+RC[-1]+R[-1]C+R[-1]C[-1] -> 7.31151151280397E+58 | FD98: =FIB(RC[-101])+RC[-1]+R[-1]C+R[-1]C[-1] -> 2.61458416860085E+59 | FE98: =FIB(RC[-101])+RC[-1]+R[-1]C+R[-1]C[-1] -> 9.21636384671181E+59 | FF98: =FIB(RC[-101])+RC[-1]+R[-1]C+R[-1]C[-1] -> 3.20338688561452E+60 | FG98: =FIB(RC[-101])+RC[-1]+R[-1]C+R[-1]C[-1] -> 1.09819397122544E+61 | FH98: =FIB(RC[-101])+RC[-1]+R[-1]C+R[-1]C[-1] -> 3.71442576317096E+61 | FI98: =FIB(RC[-101])+RC[-1]+R[-1]C+R[-1]C[-1] -> 1.23984256875866E+62 | FJ98: =FIB(RC[-101])+RC[-1]+R[-1]C+R[-1]C[-1] -> 4.08525578141896E+62 | FK98: =FIB(RC[-101])+RC[-1]+R[-1]C+R[-1]C[-1] -> 1.32911309749395E+63 | FL98: =FIB(RC[-101])+RC[-1]+R[-1]C+R[-1]C[-1] -> 4.27074242042815E+63 | FM98: =FIB(RC[-101])+RC[-1]+R[-1]C+R[-1]C[-1] -> 1.35565492575821E+64 | FN98: =FIB(RC[-101])+RC[-1]+R[-1]C+R[-1]C[-1] -> 4.25208346350381E+64 | FO98: =FIB(RC[-101])+RC[-1]+R[-1]C+R[-1]C[-1] -> 1.31813780751509E+65 | FP98: =FIB(RC[-101])+RC[-1]+R[-1]C+R[-1]C[-1] -> 4.03945713676012E+65 | FQ98: =FIB(RC[-101])+RC[-1]+R[-1]C+R[-1]C[-1] -> 1.22400267500249E+66 | FR98: =FIB(RC[-101])+RC[-1]+R[-1]C+R[-1]C[-1] -> 3.66800839739943E+66 | FS98: =FIB(RC[-101])+RC[-1]+R[-1]C+R[-1]C[-1] -> 1.08731599022712E+67 | FT98: =FIB(RC[-101])+RC[-1]+R[-1]C+R[-1]C[-1] -> 3.18893173646727E+67 | FU98: =FIB(RC[-101])+RC[-1]+R[-1]C+R[-1]C[-1] -> 9.25513668260725E+67 | FV98: =FIB(RC[-101])+RC[-1]+R[-1]C+R[-1]C[-1] -> 2.65858501958432E+68 | FW98: =FIB(RC[-101])+RC[-1]+R[-1]C+R[-1]C[-1] -> 7.56011065737203E+68 | FX98: =FIB(RC[-101])+RC[-1]+R[-1]C+R[-1]C[-1] -> 2.12859646799383E+69 | FY98: =FIB(RC[-101])+RC[-1]+R[-1]C+R[-1]C[-1] -> 5.93501481815044E+69 | FZ98: =FIB(RC[-101])+RC[-1]+R[-1]C+R[-1]C[-1] -> 1.63903161355413E+70 | GA98: =FIB(RC[-101])+RC[-1]+R[-1]C+R[-1]C[-1] -> 4.48396078865943E+70 | GB98: =FIB(RC[-101])+RC[-1]+R[-1]C+R[-1]C[-1] -> 1.21538909168678E+71 | GC98: =FIB(RC[-101])+RC[-1]+R[-1]C+R[-1]C[-1] -> 3.26449699315232E+71 | GD98: =FIB(RC[-101])+RC[-1]+R[-1]C+R[-1]C[-1] -> 8.69023055725167E+71 | GE98: =FIB(RC[-101])+RC[-1]+R[-1]C+R[-1]C[-1] -> 2.29311302683956E+72 | GF98: =FIB(RC[-101])+RC[-1]+R[-1]C+R[-1]C[-1] -> 5.9987703796101E+72 | GG98: =FIB(RC[-101])+RC[-1]+R[-1]C+R[-1]C[-1] -> 1.5559784742716E+73 | GH98: =FIB(RC[-101])+RC[-1]+R[-1]C+R[-1]C[-1] -> 4.00230316655654E+73 | GI98: =FIB(RC[-101])+RC[-1]+R[-1]C+R[-1]C[-1] -> 1.021034668543E+74 | GJ98: =FIB(RC[-101])+RC[-1]+R[-1]C+R[-1]C[-1] -> 2.58376361389993E+74 | GK98: =FIB(RC[-101])+RC[-1]+R[-1]C+R[-1]C[-1] -> 6.48639195160759E+74 | GL98: =FIB(RC[-101])+RC[-1]+R[-1]C+R[-1]C[-1] -> 1.61564804628201E+75 | GM98: =FIB(RC[-101])+RC[-1]+R[-1]C+R[-1]C[-1] -> 3.99334908696748E+75 | GN98: =FIB(RC[-101])+RC[-1]+R[-1]C+R[-1]C[-1] -> 9.7955156664123E+75 | GO98: =FIB(RC[-101])+RC[-1]+R[-1]C+R[-1]C[-1] -> 2.38488928980449E+76 | GP98: =FIB(RC[-101])+RC[-1]+R[-1]C+R[-1]C[-1] -> 5.76381816401478E+76 | GQ98: =FIB(RC[-101])+RC[-1]+R[-1]C+R[-1]C[-1] -> 1.38293755417747E+77 | GR98: =FIB(RC[-101])+RC[-1]+R[-1]C+R[-1]C[-1] -> 3.29452768759546E+77 | GS98: =FIB(RC[-101])+RC[-1]+R[-1]C+R[-1]C[-1] -> 7.79343716944684E+77
A99: 20 | B99: 20 | C99: 20 | D99: 20 | E99: 20 | F99: 20 | G99: 20 | H99: 20 | I99: 20 | J99: 20 | K99: 20 | L99: 20 | M99: 20 | N99: 20 | O99: 20 | P99: 20 | Q99: 20 | R99: 20 | S99: 20 | T99: 20 | U99: 20 | V99: 20 | W99: 20 | X99: 20 | Y99: 20 | Z99: 20 | AA99: 20 | AB99: 20 | AC99: 20 | AD99: 20 | AE99: 20 | AF99: 20 | AG99: 20 | AH99: 20 | AI99: 20 | AJ99: 20 | AK99: 20 | AL99: 20 | AM99: 20 | AN99: 20 | AO99: 20 | AP99: 20 | AQ99: 20 | AR99: 20 | AS99: 20 | AT99: 20 | AU99: 20 | AV99: 20 | AW99: 20 | AX99: 20 | AY99: 20 | AZ99: 20 | BA99: 20 | BB99: 20 | BC99: 20 | BD99: 20 | BE99: 20 | BF99: 20 | BG99: 20 | BH99: 20 | BI99: 20 | BJ99: 20 | BK99: 20 | BL99: 20 | BM99: 20 | BN99: 20 | BO99: 20 | BP99: 20 | BQ99: 20 | BR99: 20 | BS99: 20 | BT99: 20 | BU99: 20 | BV99: 20 | BW99: 20 | BX99: 20 | BY99: 20 | BZ99: 20 | CA99: 20 | CB99: 20 | CC99: 20 | CD99: 20 | CE99: 20 | CF99: 20 | CG99: 20 | CH99: 20 | CI99: 20 | CJ99: 20 | CK99: 20 | CL99: 20 | CM99: 20 | CN99: 20 | CO99: 20 | CP99: 20 | CQ99: 20 | CR99: 20 | CS99: 20 | CT99: 20 | CU99: 20 | CV99: 20 | CW99: 0 | CX99: =FIB(RC[-101])+RC[-1]+R[-1]C+R[-1]C[-1] -> 1072708 | CY99: =FIB(RC[-101])+RC[-1]+R[-1]C+R[-1]C[-1] -> 106198092 | CZ99: =FIB(RC[-101])+RC[-1]+R[-1]C+R[-1]C[-1] -> 6974747416 | DA99: =FIB(RC[-101])+RC[-1]+R[-1]C+R[-1]C[-1] -> 343586226984 | DB99: =FIB(RC[-101])+RC[-1]+R[-1]C+R[-1]C[-1] -> 13542877355644 | DC99: =FIB(RC[-101])+RC[-1]+R[-1]C+R[-1]C[-1] -> 444944128544916 | DD99: =FIB(RC[-101])+RC[-1]+R[-1]C+R[-1]C[-1] -> 1.25336072269364E+16 | DE99: =FIB(RC[-101])+RC[-1]+R[-1]C+R[-1]C[-1] -> 3.09029404075921E+17 | DF99: =FIB(RC[-101])+RC[-1]+R[-1]C+R[-1]C[-1] -> 6.77545127341921E+18 | DG99: =FIB(RC[-101])+RC[-1]+R[-1]C+R[-1]C[-1] -> 1.33754516550027E+20 | DH99: =FIB(RC[-101])+RC[-1]+R[-1]C+R[-1]C[-1] -> 2.40158129755359E+21 | DI99: =FIB(RC[-101])+RC[-1]+R[-1]C+R[-1]C[-1] -> 3.95485679416756E+22 | DJ99: =FIB(RC[-101])+RC[-1]+R[-1]C+R[-1]C[-1] -> 6.0152975846775E+23 | DK99: =FIB(RC[-101])+RC[-1]+R[-1]C+R[-1]C[-1] -> 8.50110670009917E+24 | DL99: =FIB(RC[-101])+RC[-1]+R[-1]C+R[-1]C[-1] -> 1.12209295769206E+26 | DM99: =FIB(RC[-101])+RC[-1]+R[-1]C+R[-1]C[-1] -> 1.38954674168969E+27 | DN99: =FIB(RC[-101])+RC[-1]+R[-1]C+R[-1]C[-1] -> 1.62080033438339E+28 | DO99: =FIB(RC[-101])+RC[-1]+R[-1]C+R[-1]C[-1] -> 1.78699941852444E+29 | DP99: =FIB(RC[-101])+RC[-1]+R[-1]C+R[-1]C[-1] -> 1.86819118974319E+30 | DQ99: =FIB(RC[-101])+RC[-1]+R[-1]C+R[-1]C[-1] -> 1.85714481637302E+31 | DR99: =FIB(RC[-101])+RC[-1]+R[-1]C+R[-1]C[-1] -> 1.75997100573796E+32 | DS99: =FIB(RC[-101])+RC[-1]+R[-1]C+R[-1]C[-1] -> 1.59370132838528E+33 | DT99: =FIB(RC[-101])+RC[-1]+R[-1]C+R[-1]C[-1] -> 1.38187433871532E+34 | DU99: =FIB(RC[-101])+RC[-1]+R[-1]C+R[-1]C[-1] -> 1.14956149075918E+35 | DV99: =FIB(RC[-101])+RC[-1]+R[-1]C+R[-1]C[-1] -> 9.19120448369904E+35 | DW99: =FIB(RC[-101])+RC[-1]+R[-1]C+R[-1]C[-1] -> 7.07463969445265E+36 | DX99: =FIB(RC[-101])+RC[-1]+R[-1]C+R[-1]C[-1] -> 5.25037463505478E+37 | DY99: =FIB(RC[-101])+RC[-1]+R[-1]C+R[-1]C[-1] -> 3.76223332243148E+38 | DZ99: =FIB(RC[-101])+RC[-1]+R[-1]C+R[-1]C[-1] -> 2.60641728792122E+39 | EA99: =FIB(RC[-101])+RC[-1]+R[-1]C+R[-1]C[-1] -> 1.74791560785177E+40 | EB99: =FIB(RC[-101])+RC[-1]+R[-1]C+R[-1]C[-1] -> 1.13599556971149E+41 | EC99: =FIB(RC[-101])+RC[-1]+R[-1]C+R[-1]C[-1] -> 7.16280205054702E+41 | ED99: =FIB(RC[-101])+RC[-1]+R[-1]C+R[-1]C[-1] -> 4.38613291572282E+42 | EE99: =FIB(RC[-101])+RC[-1]+R[-1]C+R[-1]C[-1] -> 2.61089832695353E+43 | EF99: =FIB(RC[-101])+RC[-1]+R[-1]C+R[-1]C[-1] -> 1.51217092092372E+44 | EG99: =FIB(RC[-101])+RC[-1]+R[-1]C+R[-1]C[-1] -> 8.52877265461975E+44 | EH99: =FIB(RC[-101])+RC[-1]+R[-1]C+R[-1]C[-1] -> 4.68812531381985E+45 | EI99: =FIB(RC[-101])+RC[-1]+R[-1]C+R[-1]C[-1] -> 2.51346617274896E+46 | EJ99: =FIB(RC[-101])+RC[-1]+R[-1]C+R[-1]C[-1] -> 1.31530182621554E+47 | EK99: =FIB(RC[-101])+RC[-1]+R[-1]C+R[-1]C[-1] -> 6.72292444595455E+47 | EL99: =FIB(RC[-101])+RC[-1]+R[-1]C+R[-1]C[-1] -> 3.35860533878456E+48 | EM99: =FIB(RC[-101])+RC[-1]+R[-1]C+R[-1]C[-1] -> 1.64097438564041E+49 | EN99: =FIB(RC[-101])+RC[-1]+R[-1]C+R[-1]C[-1] -> 7.84600224172222E+49 | EO99: =FIB(RC[-101])+RC[-1]+R[-1]C+R[-1]C[-1] -> 3.67323713682231E+50 | EP99: =FIB(RC[-101])+RC[-1]+R[-1]C+R[-1]C[-1] -> 1.68477805737238E+51 | EQ99: =FIB(RC[-101])+RC[-1]+R[-1]C+R[-1]C[-1] -> 7.57458357430565E+51 | ER99: =FIB(RC[-101])+RC[-1]+R[-1]C+R[-1]C[-1] -> 3.3397718186752E+52 | ES99: =FIB(RC[-101])+RC[-1]+R[-1]C+R[-1]C[-1] -> 1.44486581474635E+53 | ET99: =FIB(RC[-101])+RC[-1]+R[-1]C+R[-1]C[-1] -> 6.1361116374423E+53 | EU99: =FIB(RC[-101])+RC[-1]+R[-1]C+R[-1]C[-1] -> 2.55922483499741E+54 | EV99: =FIB(RC[-101])+RC[-1]+R[-1]C+R[-1]C[-1] -> 1.04872127584647E+55 | EW99: =FIB(RC[-101])+RC[-1]+R[-1]C+R[-1]C[-1] -> 4.22404111538927E+55 | EX99: =FIB(RC[-101])+RC[-1]+R[-1]C+R[-1]C[-1] -> 1.67296152089755E+56 | EY99: =FIB(RC[-101])+RC[-1]+R[-1]C+R[-1]C[-1] -> 6.51779328756261E+56 | EZ99: =FIB(RC[-101])+RC[-1]+R[-1]C+R[-1]C[-1] -> 2.49880945414237E+57 | FA99: =FIB(RC[-101])+RC[-1]+R[-1]C+R[-1]C[-1] -> 9.43059509906501E+57 | FB99: =FIB(RC[-101])+RC[-1]+R[-1]C+R[-1]C[-1] -> 3.50484309464523E+58 | FC99: =FIB(RC[-101])+RC[-1]+R[-1]C+R[-1]C[-1] -> 1.28311807191341E+59 | FD99: =FIB(RC[-101])+RC[-1]+R[-1]C+R[-1]C[-1] -> 4.62885339179466E+59 | FE99: =FIB(RC[-101])+RC[-1]+R[-1]C+R[-1]C[-1] -> 1.64598014071073E+60 | FF99: =FIB(RC[-101])+RC[-1]+R[-1]C+R[-1]C[-1] -> 5.77100341099643E+60 | FG99: =FIB(RC[-101])+RC[-1]+R[-1]C+R[-1]C[-1] -> 1.99563300088653E+61 | FH99: =FIB(RC[-101])+RC[-1]+R[-1]C+R[-1]C[-1] -> 6.80825273528294E+61 | FI99: =FIB(RC[-101])+RC[-1]+R[-1]C+R[-1]C[-1] -> 2.29211041860405E+62 | FJ99: =FIB(RC[-101])+RC[-1]+R[-1]C+R[-1]C[-1] -> 7.61720876878167E+62 | FK99: =FIB(RC[-101])+RC[-1]+R[-1]C+R[-1]C[-1] -> 2.49935955251402E+63 | FL99: =FIB(RC[-101])+RC[-1]+R[-1]C+R[-1]C[-1] -> 8.09921507043613E+63 | FM99: =FIB(RC[-101])+RC[-1]+R[-1]C+R[-1]C[-1] -> 2.59265067484464E+64 | FN99: =FIB(RC[-101])+RC[-1]+R[-1]C+R[-1]C[-1] -> 8.20038906410667E+64 | FO99: =FIB(RC[-101])+RC[-1]+R[-1]C+R[-1]C[-1] -> 2.56338506027613E+65 | FP99: =FIB(RC[-101])+RC[-1]+R[-1]C+R[-1]C[-1] -> 7.92098000455134E+65 | FQ99: =FIB(RC[-101])+RC[-1]+R[-1]C+R[-1]C[-1] -> 2.42004638913364E+66 | FR99: =FIB(RC[-101])+RC[-1]+R[-1]C+R[-1]C[-1] -> 7.31205746153556E+66 | FS99: =FIB(RC[-101])+RC[-1]+R[-1]C+R[-1]C[-1] -> 2.18532257612062E+67 | FT99: =FIB(RC[-101])+RC[-1]+R[-1]C+R[-1]C[-1] -> 6.46157030281501E+67 | FU99: =FIB(RC[-101])+RC[-1]+R[-1]C+R[-1]C[-1] -> 1.89056387218895E+68 | FV99: =FIB(RC[-101])+RC[-1]+R[-1]C+R[-1]C[-1] -> 5.474662560034E+68 | FW99: =FIB(RC[-101])+RC[-1]+R[-1]C+R[-1]C[-1] -> 1.56933582369903E+69 | FX99: =FIB(RC[-101])+RC[-1]+R[-1]C+R[-1]C[-1] -> 4.45394335743006E+69 | FY99: =FIB(RC[-101])+RC[-1]+R[-1]C+R[-1]C[-1] -> 1.25175546435743E+70 | FZ99: =FIB(RC[-101])+RC[-1]+R[-1]C+R[-1]C[-1] -> 3.4842885597266E+70 | GA99: =FIB(RC[-101])+RC[-1]+R[-1]C+R[-1]C[-1] -> 9.60728096194015E+70 | GB99: =FIB(RC[-101])+RC[-1]+R[-1]C+R[-1]C[-1] -> 2.62451326674674E+71 | GC99: =FIB(RC[-101])+RC[-1]+R[-1]C+R[-1]C[-1] -> 7.10439935158584E+71 | GD99: =FIB(RC[-101])+RC[-1]+R[-1]C+R[-1]C[-1] -> 1.90591269019898E+72 | GE99: =FIB(RC[-101])+RC[-1]+R[-1]C+R[-1]C[-1] -> 5.06804877276371E+72 | GF99: =FIB(RC[-101])+RC[-1]+R[-1]C+R[-1]C[-1] -> 1.33599321792134E+73 | GG99: =FIB(RC[-101])+RC[-1]+R[-1]C+R[-1]C[-1] -> 3.49184873015395E+73 | GH99: =FIB(RC[-101])+RC[-1]+R[-1]C+R[-1]C[-1] -> 9.0501303709821E+73 | GI99: =FIB(RC[-101])+RC[-1]+R[-1]C+R[-1]C[-1] -> 2.32627802229686E+74 | GJ99: =FIB(RC[-101])+RC[-1]+R[-1]C+R[-1]C[-1] -> 5.93107630473979E+74 | GK99: =FIB(RC[-101])+RC[-1]+R[-1]C+R[-1]C[-1] -> 1.50012318702473E+75 | GL99: =FIB(RC[-101])+RC[-1]+R[-1]C+R[-1]C[-1] -> 3.7644104284675E+75 | GM99: =FIB(RC[-101])+RC[-1]+R[-1]C+R[-1]C[-1] -> 9.373407561717E+75 | GN99: =FIB(RC[-101])+RC[-1]+R[-1]C+R[-1]C[-1] -> 2.31622723150968E+76 | GO99: =FIB(RC[-101])+RC[-1]+R[-1]C+R[-1]C[-1] -> 5.6806680879554E+76 | GP99: =FIB(RC[-101])+RC[-1]+R[-1]C+R[-1]C[-1] -> 1.38293755417747E+77 | GQ99: =FIB(RC[-101])+RC[-1]+R[-1]C+R[-1]C[-1] -> 3.34225692475641E+77 | GR99: =FIB(RC[-101])+RC[-1]+R[-1]C+R[-1]C[-1] -> 8.01972216652934E+77 | GS99: =FIB(RC[-101])+RC[-1]+R[-1]C+R[-1]C[-1] -> 1.91076870235716E+78
A100: 20 | B100: 20 | C100: 20 | D100: 20 | E100: 20 | F100: 20 | G100: 20 | H100: 20 | I100: 20 | J100: 20 | K100: 20 | L100: 20 | M100: 20 | N100: 20 | O100: 20 | P100: 20 | Q100: 20 | R100: 20 | S100: 20 | T100: 20 | U100: 20 | V100: 20 | W100: 20 | X100: 20 | Y100: 20 | Z100: 20 | AA100: 20 | AB100: 20 | AC100: 20 | AD100: 20 | AE100: 20 | AF100: 20 | AG100: 20 | AH100: 20 | AI100: 20 | AJ100: 20 | AK100: 20 | AL100: 20 | AM100: 20 | AN100: 20 | AO100: 20 | AP100: 20 | AQ100: 20 | AR100: 20 | AS100: 20 | AT100: 20 | AU100: 20 | AV100: 20 | AW100: 20 | AX100: 20 | AY100: 20 | AZ100: 20 | BA100: 20 | BB100: 20 | BC100: 20 | BD100: 20 | BE100: 20 | BF100: 20 | BG100: 20 | BH100: 20 | BI100: 20 | BJ100: 20 | BK100: 20 | BL100: 20 | BM100: 20 | BN100: 20 | BO100: 20 | BP100: 20 | BQ100: 20 | BR100: 20 | BS100: 20 | BT100: 20 | BU100: 20 | BV100: 20 | BW100: 20 | BX100: 20 | BY100: 20 | BZ100: 20 | CA100: 20 | CB100: 20 | CC100: 20 | CD100: 20 | CE100: 20 | CF100: 20 | CG100: 20 | CH100: 20 | CI100: 20 | CJ100: 20 | CK100: 20 | CL100: 20 | CM100: 20 | CN100: 20 | CO100: 20 | CP100: 20 | CQ100: 20 | CR100: 20 | CS100: 20 | CT100: 20 | CU100: 20 | CV100: 20 | CW100: 0 | CX100: =FIB(RC[-101])+RC[-1]+R[-1]C+R[-1]C[-1] -> 1083654 | CY100: =FIB(RC[-101])+RC[-1]+R[-1]C+R[-1]C[-1] -> 108365400 | CZ100: =FIB(RC[-101])+RC[-1]+R[-1]C+R[-1]C[-1] -> 7189321854 | DA100: =FIB(RC[-101])+RC[-1]+R[-1]C+R[-1]C[-1] -> 357750307200 | DB100: =FIB(RC[-101])+RC[-1]+R[-1]C+R[-1]C[-1] -> 14244213900774 | DC100: =FIB(RC[-101])+RC[-1]+R[-1]C+R[-1]C[-1] -> 472731219812280 | DD100: =FIB(RC[-101])+RC[-1]+R[-1]C+R[-1]C[-1] -> 1.34512825753046E+16 | DE100: =FIB(RC[-101])+RC[-1]+R[-1]C+R[-1]C[-1] -> 3.35014293878172E+17 | DF100: =FIB(RC[-101])+RC[-1]+R[-1]C+R[-1]C[-1] -> 7.41949497137332E+18 | DG100: =FIB(RC[-101])+RC[-1]+R[-1]C+R[-1]C[-1] -> 1.47949462794819E+20 | DH100: =FIB(RC[-101])+RC[-1]+R[-1]C+R[-1]C[-1] -> 2.68328527689844E+21 | DI100: =FIB(RC[-101])+RC[-1]+R[-1]C+R[-1]C[-1] -> 4.46334345161277E+22 | DJ100: =FIB(RC[-101])+RC[-1]+R[-1]C+R[-1]C[-1] -> 6.85711760925553E+23 | DK100: =FIB(RC[-101])+RC[-1]+R[-1]C+R[-1]C[-1] -> 9.78834821949248E+24 | DL100: =FIB(RC[-101])+RC[-1]+R[-1]C+R[-1]C[-1] -> 1.30498750688797E+26 | DM100: =FIB(RC[-101])+RC[-1]+R[-1]C+R[-1]C[-1] -> 1.63225478814769E+27 | DN100: =FIB(RC[-101])+RC[-1]+R[-1]C+R[-1]C[-1] -> 1.92298048736713E+28 | DO100: =FIB(RC[-101])+RC[-1]+R[-1]C+R[-1]C[-1] -> 2.14137750069949E+29 | DP100: =FIB(RC[-101])+RC[-1]+R[-1]C+R[-1]C[-1] -> 2.26102888166558E+30 | DQ100: =FIB(RC[-101])+RC[-1]+R[-1]C+R[-1]C[-1] -> 2.2700668235139E+31 | DR100: =FIB(RC[-101])+RC[-1]+R[-1]C+R[-1]C[-1] -> 2.17269216972665E+32 | DS100: =FIB(RC[-101])+RC[-1]+R[-1]C+R[-1]C[-1] -> 1.98696764593174E+33 | DT100: =FIB(RC[-101])+RC[-1]+R[-1]C+R[-1]C[-1] -> 1.73994123614702E+34 | DU100: =FIB(RC[-101])+RC[-1]+R[-1]C+R[-1]C[-1] -> 1.46174304824542E+35 | DV100: =FIB(RC[-101])+RC[-1]+R[-1]C+R[-1]C[-1] -> 1.18025090227036E+36 | DW100: =FIB(RC[-101])+RC[-1]+R[-1]C+R[-1]C[-1] -> 9.17401104509292E+36 | DX100: =FIB(RC[-101])+RC[-1]+R[-1]C+R[-1]C[-1] -> 6.87523970900934E+37 | DY100: =FIB(RC[-101])+RC[-1]+R[-1]C+R[-1]C[-1] -> 4.97479475683789E+38 | DZ100: =FIB(RC[-101])+RC[-1]+R[-1]C+R[-1]C[-1] -> 3.48012009584816E+39 | EA100: =FIB(RC[-101])+RC[-1]+R[-1]C+R[-1]C[-1] -> 2.35656934622871E+40 | EB100: =FIB(RC[-101])+RC[-1]+R[-1]C+R[-1]C[-1] -> 1.54644406511954E+41 | EC100: =FIB(RC[-101])+RC[-1]+R[-1]C+R[-1]C[-1] -> 9.84524168537806E+41 | ED100: =FIB(RC[-101])+RC[-1]+R[-1]C+R[-1]C[-1] -> 6.08693728931533E+42 | EE100: =FIB(RC[-101])+RC[-1]+R[-1]C+R[-1]C[-1] -> 3.65820534745735E+43 | EF100: =FIB(RC[-101])+RC[-1]+R[-1]C+R[-1]C[-1] -> 2.13908128836481E+44 | EG100: =FIB(RC[-101])+RC[-1]+R[-1]C+R[-1]C[-1] -> 1.21800248639083E+45 | EH100: =FIB(RC[-101])+RC[-1]+R[-1]C+R[-1]C[-1] -> 6.75900506567266E+45 | EI100: =FIB(RC[-101])+RC[-1]+R[-1]C+R[-1]C[-1] -> 3.65817921069821E+46 | EJ100: =FIB(RC[-101])+RC[-1]+R[-1]C+R[-1]C[-1] -> 1.93246636456026E+47 | EK100: =FIB(RC[-101])+RC[-1]+R[-1]C+R[-1]C[-1] -> 9.97069263673035E+47 | EL100: =FIB(RC[-101])+RC[-1]+R[-1]C+R[-1]C[-1] -> 5.02796704705305E+48 | EM100: =FIB(RC[-101])+RC[-1]+R[-1]C+R[-1]C[-1] -> 2.47963162422417E+49 | EN100: =FIB(RC[-101])+RC[-1]+R[-1]C+R[-1]C[-1] -> 1.19666082515868E+50 | EO100: =FIB(RC[-101])+RC[-1]+R[-1]C+R[-1]C[-1] -> 5.65449818615321E+50 | EP100: =FIB(RC[-101])+RC[-1]+R[-1]C+R[-1]C[-1] -> 2.61755158966993E+51 | EQ100: =FIB(RC[-101])+RC[-1]+R[-1]C+R[-1]C[-1] -> 1.1876913221348E+52 | ER100: =FIB(RC[-101])+RC[-1]+R[-1]C+R[-1]C[-1] -> 5.28492149824056E+52 | ES100: =FIB(RC[-101])+RC[-1]+R[-1]C+R[-1]C[-1] -> 2.30733514643793E+53 | ET100: =FIB(RC[-101])+RC[-1]+R[-1]C+R[-1]C[-1] -> 9.88831259862658E+53 | EU100: =FIB(RC[-101])+RC[-1]+R[-1]C+R[-1]C[-1] -> 4.1616672586043E+54 | EV100: =FIB(RC[-101])+RC[-1]+R[-1]C+R[-1]C[-1] -> 1.72081048520664E+55 | EW100: =FIB(RC[-101])+RC[-1]+R[-1]C+R[-1]C[-1] -> 6.99357287644239E+55 | EX100: =FIB(RC[-101])+RC[-1]+R[-1]C+R[-1]C[-1] -> 2.79472292008072E+56 | EY100: =FIB(RC[-101])+RC[-1]+R[-1]C+R[-1]C[-1] -> 1.09854777285409E+57 | EZ100: =FIB(RC[-101])+RC[-1]+R[-1]C+R[-1]C[-1] -> 4.24913655575271E+57 | FA100: =FIB(RC[-101])+RC[-1]+R[-1]C+R[-1]C[-1] -> 1.61785411089601E+58 | FB100: =FIB(RC[-101])+RC[-1]+R[-1]C+R[-1]C[-1] -> 6.06575671544774E+58 | FC100: =FIB(RC[-101])+RC[-1]+R[-1]C+R[-1]C[-1] -> 2.24017805292271E+59 | FD100: =FIB(RC[-101])+RC[-1]+R[-1]C+R[-1]C[-1] -> 8.15214951663078E+59 | FE100: =FIB(RC[-101])+RC[-1]+R[-1]C+R[-1]C[-1] -> 2.92408043155328E+60 | FF100: =FIB(RC[-101])+RC[-1]+R[-1]C+R[-1]C[-1] -> 1.03410639832604E+61 | FG100: =FIB(RC[-101])+RC[-1]+R[-1]C+R[-1]C[-1] -> 3.60683974031222E+61 | FH100: =FIB(RC[-101])+RC[-1]+R[-1]C+R[-1]C[-1] -> 1.24107254764817E+62 | FI100: =FIB(RC[-101])+RC[-1]+R[-1]C+R[-1]C[-1] -> 4.21400823978051E+62 | FJ100: =FIB(RC[-101])+RC[-1]+R[-1]C+R[-1]C[-1] -> 1.41233274271662E+63 | FK100: =FIB(RC[-101])+RC[-1]+R[-1]C+R[-1]C[-1] -> 4.67341317210881E+63 | FL100: =FIB(RC[-101])+RC[-1]+R[-1]C+R[-1]C[-1] -> 1.5271987795059E+64 | FM100: =FIB(RC[-101])+RC[-1]+R[-1]C+R[-1]C[-1] -> 4.92977096139415E+64 | FN100: =FIB(RC[-101])+RC[-1]+R[-1]C+R[-1]C[-1] -> 1.57228107003455E+65 | FO100: =FIB(RC[-101])+RC[-1]+R[-1]C+R[-1]C[-1] -> 4.95570503672135E+65 | FP100: =FIB(RC[-101])+RC[-1]+R[-1]C+R[-1]C[-1] -> 1.54400701015488E+66 | FQ100: =FIB(RC[-101])+RC[-1]+R[-1]C+R[-1]C[-1] -> 4.75615139974365E+66 | FR100: =FIB(RC[-101])+RC[-1]+R[-1]C+R[-1]C[-1] -> 1.44882552504128E+67 | FS100: =FIB(RC[-101])+RC[-1]+R[-1]C+R[-1]C[-1] -> 4.36535384731546E+67 | FT100: =FIB(RC[-101])+RC[-1]+R[-1]C+R[-1]C[-1] -> 1.30122467262511E+68 | FU100: =FIB(RC[-101])+RC[-1]+R[-1]C+R[-1]C[-1] -> 3.83794557509556E+68 | FV100: =FIB(RC[-101])+RC[-1]+R[-1]C+R[-1]C[-1] -> 1.12031720073185E+69 | FW100: =FIB(RC[-101])+RC[-1]+R[-1]C+R[-1]C[-1] -> 3.23711928043428E+69 | FX100: =FIB(RC[-101])+RC[-1]+R[-1]C+R[-1]C[-1] -> 9.26039846156338E+69 | FY100: =FIB(RC[-101])+RC[-1]+R[-1]C+R[-1]C[-1] -> 2.62318964625678E+70 | FZ100: =FIB(RC[-101])+RC[-1]+R[-1]C+R[-1]C[-1] -> 7.35923367034081E+70 | GA100: =FIB(RC[-101])+RC[-1]+R[-1]C+R[-1]C[-1] -> 2.04508031920076E+71 | GB100: =FIB(RC[-101])+RC[-1]+R[-1]C+R[-1]C[-1] -> 5.63032168214151E+71 | GC100: =FIB(RC[-101])+RC[-1]+R[-1]C+R[-1]C[-1] -> 1.53592343004741E+72 | GD100: =FIB(RC[-101])+RC[-1]+R[-1]C+R[-1]C[-1] -> 4.15227605540498E+72 | GE100: =FIB(RC[-101])+RC[-1]+R[-1]C+R[-1]C[-1] -> 1.11262375183677E+73 | GF100: =FIB(RC[-101])+RC[-1]+R[-1]C+R[-1]C[-1] -> 2.95542184703448E+73 | GG100: =FIB(RC[-101])+RC[-1]+R[-1]C+R[-1]C[-1] -> 7.78326379510977E+73 | GH100: =FIB(RC[-101])+RC[-1]+R[-1]C+R[-1]C[-1] -> 2.03252428962458E+74 | GI100: =FIB(RC[-101])+RC[-1]+R[-1]C+R[-1]C[-1] -> 5.26381534901965E+74 | GJ100: =FIB(RC[-101])+RC[-1]+R[-1]C+R[-1]C[-1] -> 1.35211696760563E+75 | GK100: =FIB(RC[-101])+RC[-1]+R[-1]C+R[-1]C[-1] -> 3.44534778510434E+75 | GL100: =FIB(RC[-101])+RC[-1]+R[-1]C+R[-1]C[-1] -> 8.70988140059657E+75 | GM100: =FIB(RC[-101])+RC[-1]+R[-1]C+R[-1]C[-1] -> 2.18476993907811E+76 | GN100: =FIB(RC[-101])+RC[-1]+R[-1]C+R[-1]C[-1] -> 5.43833792675949E+76 | GO100: =FIB(RC[-101])+RC[-1]+R[-1]C+R[-1]C[-1] -> 1.34352332462246E+77 | GP100: =FIB(RC[-101])+RC[-1]+R[-1]C+R[-1]C[-1] -> 3.29452768759546E+77 | GQ100: =FIB(RC[-101])+RC[-1]+R[-1]C+R[-1]C[-1] -> 8.01972216652934E+77 | GR100: =FIB(RC[-101])+RC[-1]+R[-1]C+R[-1]C[-1] -> 1.93817012578151E+78 | GS100: =FIB(RC[-101])+RC[-1]+R[-1]C+R[-1]C[-1] -> 4.65091104479161E+78
A101: 20 | B101: 20 | C101: 20 | D101: 20 | E101: 20 | F101: 20 | G101: 20 | H101: 20 | I101: 20 | J101: 20 | K101: 20 | L101: 20 | M101: 20 | N101: 20 | O101: 20 | P101: 20 | Q101: 20 | R101: 20 | S101: 20 | T101: 20 | U101: 20 | V101: 20 | W101: 20 | X101: 20 | Y101: 20 | Z101: 20 | AA101: 20 | AB101: 20 | AC101: 20 | AD101: 20 | AE101: 20 | AF101: 20 | AG101: 20 | AH101: 20 | AI101: 20 | AJ101: 20 | AK101: 20 | AL101: 20 | AM101: 20 | AN101: 20 | AO101: 20 | AP101: 20 | AQ101: 20 | AR101: 20 | AS101: 20 | AT101: 20 | AU101: 20 | AV101: 20 | AW101: 20 | AX101: 20 | AY101: 20 | AZ101: 20 | BA101: 20 | BB101: 20 | BC101: 20 | BD101: 20 | BE101: 20 | BF101: 20 | BG101: 20 | BH101: 20 | BI101: 20 | BJ101: 20 | BK101: 20 | BL101: 20 | BM101: 20 | BN101: 20 | BO101: 20 | BP101: 20 | BQ101: 20 | BR101: 20 | BS101: 20 | BT101: 20 | BU101: 20 | BV101: 20 | BW101: 20 | BX101: 20 | BY101: 20 | BZ101: 20 | CA101: 20 | CB101: 20 | CC101: 20 | CD101: 20 | CE101: 20 | CF101: 20 | CG101: 20 | CH101: 20 | CI101: 20 | CJ101: 20 | CK101: 20 | CL101: 20 | CM101: 20 | CN101: 20 | CO101: 20 | CP101: 20 | CQ101: 20 | CR101: 20 | CS101: 20 | CT101: 20 | CU101: 20 | CV101: 20 | CW101: 0 | CX101: =FIB(RC[-101])+RC[-1]+R[-1]C+R[-1]C[-1] -> 1094600 | CY101: =FIB(RC[-101])+RC[-1]+R[-1]C+R[-1]C[-1] -> 110554600 | CZ101: =FIB(RC[-101])+RC[-1]+R[-1]C+R[-1]C[-1] -> 7408252800 | DA101: =FIB(RC[-101])+RC[-1]+R[-1]C+R[-1]C[-1] -> 372347892800 | DB101: =FIB(RC[-101])+RC[-1]+R[-1]C+R[-1]C[-1] -> 14974312111720 | DC101: =FIB(RC[-101])+RC[-1]+R[-1]C+R[-1]C[-1] -> 501949745835720 | DD101: =FIB(RC[-101])+RC[-1]+R[-1]C+R[-1]C[-1] -> 1.44259635409635E+16 | DE101: =FIB(RC[-101])+RC[-1]+R[-1]C+R[-1]C[-1] -> 3.62891539994452E+17 | DF101: =FIB(RC[-101])+RC[-1]+R[-1]C+R[-1]C[-1] -> 8.11740080524595E+18 | DG101: =FIB(RC[-101])+RC[-1]+R[-1]C+R[-1]C[-1] -> 1.63486358571439E+20 | DH101: =FIB(RC[-101])+RC[-1]+R[-1]C+R[-1]C[-1] -> 2.9947210982647E+21 | DI101: =FIB(RC[-101])+RC[-1]+R[-1]C+R[-1]C[-1] -> 5.03114408912908E+22 | DJ101: =FIB(RC[-101])+RC[-1]+R[-1]C+R[-1]C[-1] -> 7.80656636332971E+23 | DK101: =FIB(RC[-101])+RC[-1]+R[-1]C+R[-1]C[-1] -> 1.1254716616751E+25 | DL101: =FIB(RC[-101])+RC[-1]+R[-1]C+R[-1]C[-1] -> 1.51541815525041E+26 | DM101: =FIB(RC[-101])+RC[-1]+R[-1]C+R[-1]C[-1] -> 1.91429535436153E+27 | DN101: =FIB(RC[-101])+RC[-1]+R[-1]C+R[-1]C[-1] -> 2.27763550161805E+28 | DO101: =FIB(RC[-101])+RC[-1]+R[-1]C+R[-1]C[-1] -> 2.56143909959801E+29 | DP101: =FIB(RC[-101])+RC[-1]+R[-1]C+R[-1]C[-1] -> 2.73131054169533E+30 | DQ101: =FIB(RC[-101])+RC[-1]+R[-1]C+R[-1]C[-1] -> 2.76930076584999E+31 | DR101: =FIB(RC[-101])+RC[-1]+R[-1]C+R[-1]C[-1] -> 2.67662892866304E+32 | DS101: =FIB(RC[-101])+RC[-1]+R[-1]C+R[-1]C[-1] -> 2.47189975577071E+33 | DT101: =FIB(RC[-101])+RC[-1]+R[-1]C+R[-1]C[-1] -> 2.18582797631727E+34 | DU101: =FIB(RC[-101])+RC[-1]+R[-1]C+R[-1]C[-1] -> 1.85431996949185E+35 | DV101: =FIB(RC[-101])+RC[-1]+R[-1]C+R[-1]C[-1] -> 1.51185720404409E+36 | DW101: =FIB(RC[-101])+RC[-1]+R[-1]C+R[-1]C[-1] -> 1.18661191514074E+37 | DX101: =FIB(RC[-101])+RC[-1]+R[-1]C+R[-1]C[-1] -> 8.97925272865937E+37 | DY101: =FIB(RC[-101])+RC[-1]+R[-1]C+R[-1]C[-1] -> 6.56024400060476E+38 | DZ101: =FIB(RC[-101])+RC[-1]+R[-1]C+R[-1]C[-1] -> 4.63362397159242E+39 | EA101: =FIB(RC[-101])+RC[-1]+R[-1]C+R[-1]C[-1] -> 3.16794375297277E+40 | EB101: =FIB(RC[-101])+RC[-1]+R[-1]C+R[-1]C[-1] -> 2.09889537503969E+41 | EC101: =FIB(RC[-101])+RC[-1]+R[-1]C+R[-1]C[-1] -> 1.34905811255373E+42 | ED101: =FIB(RC[-101])+RC[-1]+R[-1]C+R[-1]C[-1] -> 8.42051957040687E+42 | EE101: =FIB(RC[-101])+RC[-1]+R[-1]C+R[-1]C[-1] -> 5.10895103342957E+43 | EF101: =FIB(RC[-101])+RC[-1]+R[-1]C+R[-1]C[-1] -> 3.0157969264535E+44 | EG101: =FIB(RC[-101])+RC[-1]+R[-1]C+R[-1]C[-1] -> 1.73349030787266E+45 | EH101: =FIB(RC[-101])+RC[-1]+R[-1]C+R[-1]C[-1] -> 9.71049785993615E+45 | EI101: =FIB(RC[-101])+RC[-1]+R[-1]C+R[-1]C[-1] -> 5.30512950325909E+46 | EJ101: =FIB(RC[-101])+RC[-1]+R[-1]C+R[-1]C[-1] -> 2.82879723595599E+47 | EK101: =FIB(RC[-101])+RC[-1]+R[-1]C+R[-1]C[-1] -> 1.47319562372466E+48 | EL101: =FIB(RC[-101])+RC[-1]+R[-1]C+R[-1]C[-1] -> 7.49823193445074E+48 | EM101: =FIB(RC[-101])+RC[-1]+R[-1]C+R[-1]C[-1] -> 3.73225152237455E+49 | EN101: =FIB(RC[-101])+RC[-1]+R[-1]C+R[-1]C[-1] -> 1.81784913981855E+50 | EO101: =FIB(RC[-101])+RC[-1]+R[-1]C+R[-1]C[-1] -> 8.66900815113044E+50 | EP101: =FIB(RC[-101])+RC[-1]+R[-1]C+R[-1]C[-1] -> 4.0499022233983E+51 | EQ101: =FIB(RC[-101])+RC[-1]+R[-1]C+R[-1]C[-1] -> 1.85443670344162E+52 | ER101: =FIB(RC[-101])+RC[-1]+R[-1]C+R[-1]C[-1] -> 8.32704952381697E+52 | ES101: =FIB(RC[-101])+RC[-1]+R[-1]C+R[-1]C[-1] -> 3.66853224864368E+53 | ET101: =FIB(RC[-101])+RC[-1]+R[-1]C+R[-1]C[-1] -> 1.58641799937082E+54 | EU101: =FIB(RC[-101])+RC[-1]+R[-1]C+R[-1]C[-1] -> 6.73691651783778E+54 | EV101: =FIB(RC[-101])+RC[-1]+R[-1]C+R[-1]C[-1] -> 2.81066886285085E+55 | EW101: =FIB(RC[-101])+RC[-1]+R[-1]C+R[-1]C[-1] -> 1.15250522244999E+56 | EX101: =FIB(RC[-101])+RC[-1]+R[-1]C+R[-1]C[-1] -> 4.64658543017494E+56 | EY101: =FIB(RC[-101])+RC[-1]+R[-1]C+R[-1]C[-1] -> 1.84267860787965E+57 | EZ101: =FIB(RC[-101])+RC[-1]+R[-1]C+R[-1]C[-1] -> 7.19036293648646E+57 | FA101: =FIB(RC[-101])+RC[-1]+R[-1]C+R[-1]C[-1] -> 2.76180406011993E+58 | FB101: =FIB(RC[-101])+RC[-1]+R[-1]C+R[-1]C[-1] -> 1.04454148864637E+59 | FC101: =FIB(RC[-101])+RC[-1]+R[-1]C+R[-1]C[-1] -> 3.89129521311385E+59 | FD101: =FIB(RC[-101])+RC[-1]+R[-1]C+R[-1]C[-1] -> 1.42836227826673E+60 | FE101: =FIB(RC[-101])+RC[-1]+R[-1]C+R[-1]C[-1] -> 5.16765766148309E+60 | FF101: =FIB(RC[-101])+RC[-1]+R[-1]C+R[-1]C[-1] -> 1.84328020762968E+61 | FG101: =FIB(RC[-101])+RC[-1]+R[-1]C+R[-1]C[-1] -> 6.48422634626795E+61 | FH101: =FIB(RC[-101])+RC[-1]+R[-1]C+R[-1]C[-1] -> 2.25017915630619E+62 | FI101: =FIB(RC[-101])+RC[-1]+R[-1]C+R[-1]C[-1] -> 7.70525994373487E+62 | FJ101: =FIB(RC[-101])+RC[-1]+R[-1]C+R[-1]C[-1] -> 2.60425956106816E+63 | FK101: =FIB(RC[-101])+RC[-1]+R[-1]C+R[-1]C[-1] -> 8.69000547589359E+63 | FL101: =FIB(RC[-101])+RC[-1]+R[-1]C+R[-1]C[-1] -> 2.86354064430614E+64 | FM101: =FIB(RC[-101])+RC[-1]+R[-1]C+R[-1]C[-1] -> 9.32051038520618E+64 | FN101: =FIB(RC[-101])+RC[-1]+R[-1]C+R[-1]C[-1] -> 2.99730920469458E+65 | FO101: =FIB(RC[-101])+RC[-1]+R[-1]C+R[-1]C[-1] -> 9.52529531145047E+65 | FP101: =FIB(RC[-101])+RC[-1]+R[-1]C+R[-1]C[-1] -> 2.99210704497206E+66 | FQ101: =FIB(RC[-101])+RC[-1]+R[-1]C+R[-1]C[-1] -> 9.29226545487059E+66 | FR101: =FIB(RC[-101])+RC[-1]+R[-1]C+R[-1]C[-1] -> 2.85366721050271E+67 | FS101: =FIB(RC[-101])+RC[-1]+R[-1]C+R[-1]C[-1] -> 8.66784658285946E+67 | FT101: =FIB(RC[-101])+RC[-1]+R[-1]C+R[-1]C[-1] -> 2.6045447156426E+68 | FU101: =FIB(RC[-101])+RC[-1]+R[-1]C+R[-1]C[-1] -> 7.74371496336328E+68 | FV101: =FIB(RC[-101])+RC[-1]+R[-1]C+R[-1]C[-1] -> 2.27848325457774E+69 | FW101: =FIB(RC[-101])+RC[-1]+R[-1]C+R[-1]C[-1] -> 6.63591973574387E+69 | FX101: =FIB(RC[-101])+RC[-1]+R[-1]C+R[-1]C[-1] -> 1.91334374777415E+70 | FY101: =FIB(RC[-101])+RC[-1]+R[-1]C+R[-1]C[-1] -> 5.46257324018727E+70 | FZ101: =FIB(RC[-101])+RC[-1]+R[-1]C+R[-1]C[-1] -> 1.54449965567849E+71 | GA101: =FIB(RC[-101])+RC[-1]+R[-1]C+R[-1]C[-1] -> 4.32550334191332E+71 | GB101: =FIB(RC[-101])+RC[-1]+R[-1]C+R[-1]C[-1] -> 1.20009053432556E+72 | GC101: =FIB(RC[-101])+RC[-1]+R[-1]C+R[-1]C[-1] -> 3.29904613258712E+72 | GD101: =FIB(RC[-101])+RC[-1]+R[-1]C+R[-1]C[-1] -> 8.9872456180395E+72 | GE101: =FIB(RC[-101])+RC[-1]+R[-1]C+R[-1]C[-1] -> 2.42657591918122E+73 | GF101: =FIB(RC[-101])+RC[-1]+R[-1]C+R[-1]C[-1] -> 6.49462151805246E+73 | GG101: =FIB(RC[-101])+RC[-1]+R[-1]C+R[-1]C[-1] -> 1.72333071601967E+74 | GH101: =FIB(RC[-101])+RC[-1]+R[-1]C+R[-1]C[-1] -> 4.53418138515523E+74 | GI101: =FIB(RC[-101])+RC[-1]+R[-1]C+R[-1]C[-1] -> 1.18305210237995E+75 | GJ101: =FIB(RC[-101])+RC[-1]+R[-1]C+R[-1]C[-1] -> 3.06155060488754E+75 | GK101: =FIB(RC[-101])+RC[-1]+R[-1]C+R[-1]C[-1] -> 7.85901535759751E+75 | GL101: =FIB(RC[-101])+RC[-1]+R[-1]C+R[-1]C[-1] -> 2.00142445432984E+76 | GM101: =FIB(RC[-101])+RC[-1]+R[-1]C+R[-1]C[-1] -> 5.05718253346761E+76 | GN101: =FIB(RC[-101])+RC[-1]+R[-1]C+R[-1]C[-1] -> 1.26802903993052E+77 | GO101: =FIB(RC[-101])+RC[-1]+R[-1]C+R[-1]C[-1] -> 3.15538615722892E+77 | GP101: =FIB(RC[-101])+RC[-1]+R[-1]C+R[-1]C[-1] -> 7.79343716944684E+77 | GQ101: =FIB(RC[-101])+RC[-1]+R[-1]C+R[-1]C[-1] -> 1.91076870235716E+78 | GR101: =FIB(RC[-101])+RC[-1]+R[-1]C+R[-1]C[-1] -> 4.65091104479161E+78 | GS101: =FIB(RC[-101])+RC[-1]+R[-1]C+R[-1]C[-1] -> 1.12399922153647E+79

Sheet: @sdf
A1: =DEFINE("FIB", R[+2]C[+1], R[+1]C[+1]) -> FUN FIB AT #0
B2: 10
B3: =IF(R[-1]C<=1, 1, FIB(R[-1]C-1)+FIB(R[-1]C-2)) -> #NAME?